法人名,住所,設立日,法人種別
株式会社Ｖｉｔａ,大阪府東大阪市日下町４丁目３番５号,2026-06-05,株式会社
株式会社ＹＡＳＩ,大阪府吹田市藤白台５丁目７番７４－４１３号,2026-06-05,株式会社
株式会社Ｙｏｕｎｇｒｙ,大阪府大阪市北区中津５丁目２‐９,2026-06-05,株式会社
株式会社ｌｉｖｅ,大阪府貝塚市堤１４７番地１８,2026-06-05,株式会社
株式会社ｐｅｎｓｅｅ,大阪府貝塚市小瀬１丁目４番６－２号,2026-06-05,株式会社
株式会社ｒｉａ,大阪府寝屋川市石津元町１２番１２－５０２号,2026-06-05,株式会社
泉南フェルト株式会社,大阪府泉南市中小路１丁目１１番２５号,2026-06-05,株式会社
神羅株式会社,大阪府吹田市山田西２丁目１３番３－２０１号,2026-06-05,株式会社
税理士法人エヌティアルファ,大阪府大阪市浪速区元町１丁目１０番６号堤ビル３階,2026-06-05,その他の設立登記法人
行政書士法人プラム,大阪府東大阪市足代２丁目３番６号,2026-06-05,その他の設立登記法人
ＡＰＣＦ株式会社,大阪府大阪市北区梅田２丁目２－２ヒルトンプラザウエストオフィスタワー１９階,2026-06-05,株式会社
ＧＡＪ株式会社,大阪府東大阪市新庄１丁目８－２２,2026-06-05,株式会社
ＪＯＹトラスト株式会社,大阪府大阪市都島区都島北通２丁目２２－１９ファラン都島３０５,2026-06-05,株式会社
ＪＰＳＧ株式会社,大阪府大阪市北区梅田１丁目２番２号大阪駅前第２ビル１２－１２,2026-06-05,株式会社
ＭＳＲ　Ｍａｔｅｒｉａｌｓ株式会社,大阪府松原市天美東７丁目１－１４,2026-06-05,株式会社
Ｍｄａｘ合同会社,大阪府堺市中区土師町１丁８番１８号,2026-06-05,合同会社
ＯＴＯＭＯ株式会社,大阪府八尾市高美町５丁目６番９号,2026-06-05,株式会社
Ｐｌａｚｍａ株式会社,大阪府東大阪市長瀬町１丁目１５番２２－１０３号,2026-06-05,株式会社
ＳＡＭＯＥ株式会社,大阪府東大阪市玉串町東３丁目１番５号,2026-06-05,株式会社
Ｔｒｉｂｅ株式会社,大阪府柏原市旭ケ丘２丁目１５番４２号,2026-06-05,株式会社
ＹＭＹ合同会社,大阪府大阪市北区梅田１丁目１－３大阪駅前第３ビル２９階１－１－１号室,2026-06-05,合同会社
ＺＲＳ合同会社,大阪府八尾市上之島町北２丁目３２－５,2026-06-05,合同会社
Ｚｅｎｉｔｈ　Ｉｎｎｏｖａｔｉｏｎ株式会社,大阪府寝屋川市香里北之町２－６－１２０,2026-06-05,株式会社
ココアインターナショナル合同会社,兵庫県川西市見野１丁目１３番１４号,2026-06-05,合同会社
合同会社修多羅,兵庫県姫路市大津区勘兵衛町２丁目２６番地,2026-06-05,合同会社
合同会社Ｒ‐ＣＲＵＳＴ,兵庫県宝塚市鹿塩１丁目１５－２３,2026-06-05,合同会社
株式会社アイユーミート,兵庫県加古川市尾上町養田１５５３番地の６,2026-06-05,株式会社
株式会社ミレディア,兵庫県西宮市高木東町２９番１８－３０６号,2026-06-05,株式会社
株式会社幸楽園不動産商事,兵庫県神戸市灘区赤松町２丁目１番１５号幸楽園ビル２階,2026-06-05,株式会社
株式会社ＧＥＭＧＥＭ,兵庫県尼崎市昭和南通４丁目６３番地の５ゴールドウッズ尼崎６０２,2026-06-05,株式会社
株式会社Ｌｉｌｙファーマ,兵庫県神戸市中央区中山手通３丁目１４－６,2026-06-05,株式会社
ＤＯＲＭＡＹ多美株式会社,兵庫県神戸市中央区下山手通５丁目７番７－４０７号,2026-06-05,株式会社
ＫＴセールスパートナーズ株式会社,兵庫県西宮市松原町９番２０号,2026-06-05,株式会社
Ｍｏｒｅ　Ｂｌｅｓｓｉｎｇｓ株式会社,兵庫県神戸市西区南別府２丁目１５番地の６－４０２号,2026-06-05,株式会社
株式会社シルフィアーク,奈良県奈良市あやめ池南７丁目８４８番地の１５,2026-06-05,株式会社
株式会社モーションクラフト,奈良県天理市指柳町３４６－１,2026-06-05,株式会社
株式会社Ｍ’ｓ　Ｄｅｓｉｇｎ,奈良県大和高田市礒野南町２番９号,2026-06-05,株式会社
株式会社ＴａｋｅＴｒｉａ,奈良県奈良市六条３丁目１番１５号,2026-06-05,株式会社
ＥＳ合同会社,和歌山県海南市大野中７７３―６,2026-06-05,合同会社
合同会社ｍｏｓｉｒ,島根県隠岐郡海士町大字知々井９９２‐４ＡＭＡ　ｈｌｄ．内,2026-06-05,合同会社
ほけんのひらかわ株式会社,岡山県倉敷市中島１５５９番地９,2026-06-05,株式会社
株式会社ことのわ,岡山県赤磐市吉原４３５,2026-06-05,株式会社
株式会社カジ断熱,岡山県岡山市中区雄町５８９番地１３,2026-06-05,株式会社
株式会社三原板金,岡山県倉敷市玉島７４８番地１３,2026-06-05,株式会社
株式会社ＢＵＹＥＲＳ　ＬＡＢ,岡山県岡山市南区築港元町１３番２３号,2026-06-05,株式会社
株式会社Ｏｃｅａｎ　Ｍｅｌｏｄｉａ　Ｓｔｕｄｉｏ,岡山県岡山市中区平井３丁目９６６番地２５,2026-06-05,株式会社
行政書士法人おかやま創研,岡山県岡山市北区西古松２丁目２４番５号,2026-06-05,その他の設立登記法人
貴光株式会社,岡山県岡山市南区箕島３５６８番地４,2026-06-05,株式会社
Ｃａｅｓａｒ株式会社,岡山県倉敷市上富井６２８番地１０５,2026-06-05,株式会社
合同会社ナチュラルスタイル,広島県東広島市福富町下竹仁１７４５番地,2026-06-05,合同会社
合同会社泰心興業,広島県東広島市黒瀬町楢原２１５番地３（２０５号）,2026-06-05,合同会社
合同会社藤本善久商店,広島県福山市大門町津之下９６３番地,2026-06-05,合同会社
株式会社はる,広島県広島市南区東雲本町３丁目８－１６－４０７,2026-06-05,株式会社
株式会社広松ホームリバティー,広島県広島市安佐南区八木町７６番地２,2026-06-05,株式会社
株式会社心和,広島県呉市本通４丁目４番２０号山村ビル１階,2026-06-05,株式会社
株式会社ＨＡＫＡＤＯＲＩ,広島県福山市明神町１丁目４番１５号,2026-06-05,株式会社
株式会社ＲＳ　Ｗｏｒｋｓ,広島県広島市安芸区矢野東７丁目２番２０号１階,2026-06-05,株式会社
浜谷合同会社,山口県大島郡周防大島町大字久賀４３７９番地１,2026-06-05,合同会社
特定非営利活動法人しものせき空き家・暮らしサポート,山口県下関市豊浦町川棚５３１７番１セードゥヴィランテⅠ－２０３,2026-06-05,その他の設立登記法人
西日本ロードアシスト株式会社,山口県下関市一の宮町２丁目１４番１号,2026-06-05,株式会社
イナス合同会社,徳島県吉野川市川島町桑村７０５番地,2026-06-05,合同会社
合同会社ｌｏｗｍｅｒｙ,徳島県板野郡藍住町奥野字西中須２３番地南側,2026-06-05,合同会社
株式会社四国事業承継・Ｍ＆Ａ,徳島県徳島市北島田町１丁目３番地３,2026-06-05,株式会社
Ｌａｎｉａｌ合同会社,徳島県徳島市南庄町５丁目６１番地１０クラール南庄町Ｄ２０２,2026-06-05,合同会社
合同会社バイトラーク,香川県高松市上林町２６１番地１２,2026-06-05,合同会社
合同会社Ｙｏｕ　ａｎｄ　Ｉ,香川県三豊市高瀬町上麻乙１６５番地７,2026-06-05,合同会社
株式会社セトラスフューチャークリエイト,香川県高松市磨屋町８番地１,2026-06-05,株式会社
株式会社バーデックス,香川県高松市勅使町１３０番地４,2026-06-05,株式会社
株式会社ＮＫＣＢ,香川県さぬき市鴨庄４７１６番地６,2026-06-05,株式会社
Ｗａｇｅｎｅ　Ｇｅｎｅｔｉｃｓ株式会社,香川県高松市国分寺町新居３０５４番地３,2026-06-05,株式会社
合同会社輝,愛媛県松山市平井町３１５７番地の２０４,2026-06-05,合同会社
株式会社トマトホールディングス,愛媛県松山市西垣生町７７１番地１１,2026-06-05,株式会社
アミーゴ軽配送合同会社,福岡県大川市大字道海島３４６番地１－８－４０４,2026-06-05,合同会社
オリジナルステップ株式会社,福岡県久留米市御井旗崎３丁目６－１５,2026-06-05,株式会社
合同会社凛華,福岡県八女市室岡７６９－４ルーエ雅１０５号,2026-06-05,合同会社
合同会社安心テクノ,福岡県大野城市大城３丁目３７番８号,2026-06-05,合同会社
合同会社最適解,福岡県福岡市東区香椎６丁目２９－５４,2026-06-05,合同会社
合同会社Ｈａｒｍｏｎｙ,福岡県久留米市津福本町２１８７－５,2026-06-05,合同会社
株式会社さかぐち不動産,福岡県みやま市高田町濃施３８４番地,2026-06-05,株式会社
株式会社アイビー,福岡県福岡市博多区博多駅前１丁目２３番２号ＰａｒｋＦｒｏｎｔ博多駅前一丁目５Ｆ－Ｂ,2026-06-05,株式会社
株式会社アールプランニング,福岡県福岡市中央区赤坂１丁目５番５－６０１号,2026-06-05,株式会社
株式会社モラド,福岡県太宰府市観世音寺１丁目１番２３号,2026-06-05,株式会社
株式会社一蓮建設,福岡県福岡市東区筥松４丁目５－５－１０２,2026-06-05,株式会社
株式会社一電設,福岡県宗像市神湊１２４２番地１３７,2026-06-05,株式会社
株式会社丸江組,福岡県福岡市早良区四箇６丁目２４番４５号,2026-06-05,株式会社
株式会社佑デンタルエデュケーション,福岡県大野城市下大利１丁目２１番２０－２１５号,2026-06-05,株式会社
株式会社安全地帯,福岡県福岡市博多区博多駅前１丁目２３番２号,2026-06-05,株式会社
株式会社ＬＧｅｎｔｅｒｔａｉｎｍｅｎｔ,福岡県福岡市中央区天神２丁目２番１２号Ｔ＆Ｊビルディング７Ｆ,2026-06-05,株式会社
株式会社ＬＯＷＲＩＤＥＲ　ＭＡＭＡ,福岡県大牟田市大字甘木５５４番地１,2026-06-05,株式会社
株式会社ＬｉｖｅＦｒｅｅ,福岡県福岡市中央区天神２丁目２番１２号Ｔ＆Ｊビルディング７階,2026-06-05,株式会社
株式会社Ｍｕｓｔ‐ｗｉｎ,福岡県福岡市博多区東那珂１丁目１５番８－６０５号ＬＩＦＥＦＩＥＬＤ東那珂,2026-06-05,株式会社
ＫｌｕｇＴｅｃｈ株式会社,福岡県福岡市博多区博多駅前１丁目２３‐２ＰａｒｋＦｒｏｎｔ５Ｆ‐Ｂ,2026-06-05,株式会社
合同会社来久軒,佐賀県武雄市武雄町大字武雄４１９０番地２,2026-06-05,合同会社
株式会社山ぼうし,佐賀県鳥栖市轟木町８５５番地１,2026-06-05,株式会社
ＰＤＡ　ＪＡＰＡＮ株式会社,佐賀県佐賀市多布施３丁目１２－２－１,2026-06-05,株式会社
合同会社まるみ,長崎県佐世保市天神２丁目２４－１６,2026-06-05,合同会社
一般社団法人山鹿フットボールアカデミー,熊本県山鹿市津留２２３２番地１,2026-06-05,その他の設立登記法人
一般社団法人Ｌｏｃａｌ　ｄｅｖｅｌｏｐｍｅｎｔ,熊本県上益城郡御船町大字水越１７５６番地,2026-06-05,その他の設立登記法人
合同会社友里愛,熊本県熊本市南区城南町今吉野２８２番地１オークスヒル２０２,2026-06-05,合同会社
山並マンマルホーム株式会社,熊本県八代市塩屋町１番１号,2026-06-05,株式会社
株式会社ＡＫＡＴＳＵＫＩ,熊本県熊本市中央区本山町１０６番地（１４１０号）,2026-06-05,株式会社
株式会社ＦＵＢＡＯ,熊本県熊本市中央区花畑町１番１４号Ａ＆ＭＨＡＮＡＢＡＴＡ,2026-06-05,株式会社
合同会社タユタイ,大分県竹田市久住町久住３９４６番地２１,2026-06-05,合同会社
合同会社樹,大分県別府市鶴見２丁目６番６１号,2026-06-05,合同会社
合同会社Ｇｒｅｅｎｌｉｇｈｔｓ,大分県大分市大字今市字若杉１６１９,2026-06-05,合同会社
合同会社ＴＫＧ,大分県別府市上田の湯町３番７号アライアンスタワーＺ,2026-06-05,合同会社
合同会社Ｔｅｒｒａ　Ｎｏｖａ,大分県宇佐市大字南宇佐３９８番,2026-06-05,合同会社
合同会社ＹＢエナジー,大分県大分市大字入蔵８２３番地,2026-06-05,合同会社
株式会社さいち,大分県大分市都町２丁目３番１号シャルルＫ１０１Ｂ,2026-06-05,株式会社
株式会社なまか,大分県大分市中春日町４番２５号ＧＩＪビル１階テナント１－Ａ,2026-06-05,株式会社
株式会社ファンホールディングス,大分県大分市大字三芳９０１番地,2026-06-05,株式会社
ＧｅｏＰｌａｎｅｔｔ株式会社,大分県宇佐市大字江須賀４０５７番地の２,2026-06-05,株式会社
合同会社Ｌｅａ,宮崎県宮崎市青島３丁目３番２７号,2026-06-05,合同会社
株式会社アリスタ,宮崎県都城市中町５街区１０号,2026-06-05,株式会社
株式会社ｅ‐ＹＡＲＤ,宮崎県串間市大字西方５９１５番地４,2026-06-05,株式会社
株式会社椎木鈑金塗装工業,鹿児島県出水市高尾野町江内３７５６番地６,2026-06-05,株式会社
株式会社種子島の宿スペースタイム,鹿児島県熊毛郡南種子町中之上１７０４番地１２,2026-06-05,株式会社
株式会社結農,鹿児島県肝属郡東串良町川東４３１９番地,2026-06-05,株式会社
Ａ‐ＩＮＴＥＧＲＩＴＹ合同会社,鹿児島県鹿児島市草牟田１丁目１番２０オーヴィジョン草牟田３０３号,2026-06-05,合同会社
Ｋ３コネクト株式会社,鹿児島県志布志市志布志町志布志１丁目１４番地,2026-06-05,株式会社
シンジホーム株式会社,沖縄県宜野湾市我如古１丁目４６番６号,2026-06-05,株式会社
一般社団法人ぱーんとぅ笑楽校,沖縄県宮古島市平良字島尻１３９３番地,2026-06-05,その他の設立登記法人
一般社団法人Ｂｅｓｈａ輝,沖縄県沖縄市山里２丁目１番６号１Ｆ左,2026-06-05,その他の設立登記法人
合同会社アーバンロード,沖縄県沖縄市安慶田５丁目５番２９号メイマンション１０２,2026-06-05,合同会社
合同会社Ｃａｒ　Ｓｈｏｐ　ＳＴＡＲ,沖縄県宮古島市城辺字福里５５９番地４,2026-06-05,合同会社
合同会社Ｐ．Ｏ．Ｎ．Ｔ．Ｅ,沖縄県浦添市宮城４丁目１９番１８－４０１号アゼリアミヤギ,2026-06-05,合同会社
合同会社ＹＭ西町,沖縄県那覇市銘苅３丁目１６番２６号２階,2026-06-05,合同会社
株式会社上門商会,沖縄県宮古島市平良字狩俣１３３２番地２,2026-06-05,株式会社
株式会社亀川商会,沖縄県うるま市字高江洲１１０番地１１,2026-06-05,株式会社
株式会社菊照クリエイティブ,沖縄県浦添市港川１丁目３８番３号,2026-06-05,株式会社
株式会社Ｒｉｓｅ　Ｏｋｉｎａｗａ,沖縄県中頭郡北谷町字吉原６９７番地９コンフォート北谷桃原パークサイド２０２,2026-06-05,株式会社
ＥｃｈｏＳｈｉｆｔ株式会社,沖縄県那覇市久茂地２丁目９番１号サニービル４－Ｄ号室,2026-06-05,株式会社
ＲＡＮＣＨＦＩＥＬＤ株式会社,沖縄県うるま市字江洲４６４番地４セントラルシティ江洲５０７号,2026-06-05,株式会社
