法人名,住所,設立日,法人種別
株式会社綿半リゾート,長野県下伊那郡阿智村智里４０７番地,2026-06-05,株式会社
ＫＡＳＨＭＩＲ合同会社,長野県下高井郡野沢温泉村大字豊郷８２８４番地１,2026-06-05,合同会社
一般社団法人アセットボックス,岐阜県中津川市福岡９４４番地１８,2026-06-05,その他の設立登記法人
合同会社トキノマ,岐阜県大野郡白川村大字萩町１０７番地２,2026-06-05,合同会社
合同会社永進商事,岐阜県山県市東深瀬２７３７番地３,2026-06-05,合同会社
株式会社シノダック不動産,岐阜県恵那市大井町２６９５番地８７５,2026-06-05,株式会社
株式会社トーセイ,岐阜県大垣市島町３１９番地４,2026-06-05,株式会社
株式会社勇商店,岐阜県土岐市下石町１８８０番地の１,2026-06-05,株式会社
株式会社未来クラフト,岐阜県恵那市上矢作町小田子５２２番地１,2026-06-05,株式会社
株式会社東野アセットマネジメント,岐阜県多治見市白山町４丁目１９番地の１,2026-06-05,株式会社
株式会社ＫＯＵＹＡ,岐阜県本巣市仏生寺８６８番地１,2026-06-05,株式会社
株式会社ＫＵＲＩＹＡ,岐阜県岐阜市神田町６丁目２２番地,2026-06-05,株式会社
株式会社ＴＡＦＹ,岐阜県大垣市浅草４丁目９１番地１,2026-06-05,株式会社
小松・森田税理士法人,静岡県浜松市中央区蜆塚２丁目１番１７号,2026-06-05,その他の設立登記法人
株式会社ＣＯＢＡＣＣＯ,静岡県静岡市葵区大原９０１番地の２,2026-06-05,株式会社
株式会社Ｓ４,静岡県熱海市下多賀１１１９番地の１ロイヤルヴァンベール熱海伊豆多賀３０１,2026-06-05,株式会社
株式会社Ｓｗｉｔｃｈ　Ｏｎ　Ｐａｒｔｎｅｒｓ,静岡県浜松市中央区西伊場町８６番６号,2026-06-05,株式会社
株式会社ＹＭＭ,静岡県浜松市中央区雄踏町宇布見４８８９番地の５,2026-06-05,株式会社
特定非営利活動法人遠州お祭り保存会,静岡県磐田市見付２７７９番地７,2026-06-05,その他の設立登記法人
特定非営利活動法人静岡安全な産科麻酔をつなぐ会,静岡県袋井市愛野南２丁目６番地の９,2026-06-05,その他の設立登記法人
イグレックアセット合同会社,愛知県名古屋市名東区社が丘１丁目８０５番地,2026-06-05,合同会社
ケーテック株式会社,愛知県半田市乙川源内林町２丁目１１４番地の５,2026-06-05,株式会社
サンアールプランニング株式会社,愛知県岡崎市北本郷町字河原４８番地,2026-06-05,株式会社
セラホールディング株式会社,愛知県名古屋市東区芳野３丁目６番４号,2026-06-05,株式会社
チームフレッシュロジ中部株式会社,愛知県津島市高台寺町字新開１番地,2026-06-05,株式会社
トライテクノロジー株式会社,愛知県名古屋市守山区花咲台２丁目６０１番地,2026-06-05,株式会社
一般社団法人みのり,愛知県豊橋市多米西町１丁目２２番地２５,2026-06-05,その他の設立登記法人
一般社団法人ＩＳＫＡジャパンコンバットスポーツ連盟,愛知県豊川市諏訪３丁目１４５番地レアール諏訪３階,2026-06-05,その他の設立登記法人
合同会社アーチ・コンパス,愛知県弥富市平島町西勘助４５番地６,2026-06-05,合同会社
合同会社インディペンデントベース,愛知県名古屋市中区千代田３丁目１１番３５号プレサンスロジェ鶴舞駅前Ⅱ１００１号,2026-06-05,合同会社
合同会社カフェミラン,愛知県名古屋市中区大須２丁目２番９号,2026-06-05,合同会社
合同会社シンメディケア,愛知県名古屋市緑区鳴海町字石堀山６６番地の２,2026-06-05,合同会社
合同会社プラスワン,愛知県津島市百島町字三正六歩３７番地３,2026-06-05,合同会社
合同会社庵Ｄｅｓｉｇｎ,愛知県東海市加木屋町１丁目６７番地,2026-06-05,合同会社
合同会社町のＤＸ課,愛知県丹羽郡扶桑町大字柏森字天神３４２番地,2026-06-05,合同会社
合同会社美容室ロゼ・ぱるぱる,愛知県海部郡大治町大字馬島字西深田７番地,2026-06-05,合同会社
合同会社Ａメディック,愛知県名古屋市中区丸の内３丁目６番３３号ザ・パークハウス久屋大通ローレルタワー６０５号,2026-06-05,合同会社
合同会社Ａｒｃ．Ｋ,愛知県一宮市三条字今泉２２番地１,2026-06-05,合同会社
合同会社Ｄｅｍｏｌｉｔｉｏｎ,愛知県愛西市北河田町郷西４０６番地,2026-06-05,合同会社
合同会社Ｆｌｏｒｅｎｃｅ,愛知県名古屋市中村区名駅４丁目２４番５号第２森ビル４０１,2026-06-05,合同会社
合同会社ＨＯＬＹ,愛知県名古屋市中川区豊成町１番５－３１９号,2026-06-05,合同会社
合同会社Ｍ’ｓコーポレーション,愛知県海部郡大治町大字北間島字藤田９５番地の１,2026-06-05,合同会社
合同会社ＭＩＲ,愛知県名古屋市中村区竹橋町２４－６中駒グランヒルズ太閤通駅Ⅰ１００２号室,2026-06-05,合同会社
合同会社ＭＴｗｏｒｋｓ,愛知県名古屋市北区御成通３丁目１６－３,2026-06-05,合同会社
合同会社ＳＫＹ　ＢＡＳＥ,愛知県豊田市小坂町９丁目５番地２,2026-06-05,合同会社
合同会社ＳＳＳ,愛知県岡崎市井田町字荒居４４－３,2026-06-05,合同会社
合同会社Ｓｋｙ　Ｈａｒｍｏｎｙ,愛知県一宮市小赤見字秋吉４７番地２,2026-06-05,合同会社
合同会社ｍｕｒａｃｏ,愛知県名古屋市西区名駅２丁目３４番１７号セントラル名古屋１１０１号,2026-06-05,合同会社
小牧まちづくり研究所合同会社,愛知県小牧市小牧１丁目１３５番地,2026-06-05,合同会社
弁護士法人名古屋国際法律事務所,愛知県名古屋市中区丸の内２丁目６番２１号アクセス丸の内ビル４階,2026-06-05,その他の設立登記法人
日良コンストラクション株式会社,愛知県大府市共栄町５丁目３０９番地,2026-06-05,株式会社
株式会社ありがとう備え一番,愛知県名古屋市瑞穂区柳ケ枝町２丁目６０番地,2026-06-05,株式会社
株式会社うらは,愛知県名古屋市守山区大字上志段味字稲堀田新田１９２３番地の１,2026-06-05,株式会社
株式会社ものづくり事業承継ホールディングス,愛知県名古屋市中区錦１丁目５番１１号,2026-06-05,株式会社
株式会社アプラ,愛知県刈谷市相生町２丁目２０番地,2026-06-05,株式会社
株式会社クローバー,愛知県名古屋市中川区東起町４丁目１５７番地,2026-06-05,株式会社
株式会社ケーズシステム,愛知県春日井市高蔵寺町北４丁目１－１５,2026-06-05,株式会社
株式会社ニーアーキテクツ,愛知県名古屋市千種区春岡通７丁目３５番地９吹上ユニゾン３Ｆ,2026-06-05,株式会社
株式会社ビジネスサポート,愛知県名古屋市西区大野木３丁目７５番地,2026-06-05,株式会社
株式会社ファーマーズネスト,愛知県豊川市牛久保町八幡口３０番地の２,2026-06-05,株式会社
株式会社メディカル・ライフ・プランニング,愛知県犬山市大字今井字畑中４６番地の１,2026-06-05,株式会社
株式会社ヨコスカ電機,愛知県東海市高横須賀町６丁目１９３番地,2026-06-05,株式会社
株式会社北村設備,愛知県名古屋市中川区松ノ木町１丁目４１番地,2026-06-05,株式会社
株式会社名総建設,愛知県名古屋市名東区大針３丁目１００番地,2026-06-05,株式会社
株式会社庭彩,愛知県尾張旭市旭ケ丘町森９６番地２,2026-06-05,株式会社
株式会社木村業務店,愛知県一宮市光明寺字畳手３４番地,2026-06-05,株式会社
株式会社森本工業,愛知県岡崎市細川町字門立５１番地１,2026-06-05,株式会社
株式会社浅野メンディング,愛知県一宮市西五城字杁先南２９番地１,2026-06-05,株式会社
株式会社白浜,愛知県豊橋市城下町字作三部２５０番地２,2026-06-05,株式会社
株式会社白石溶接,愛知県名古屋市南区堤町２丁目２３番地の１,2026-06-05,株式会社
株式会社誠和,愛知県名古屋市中川区横井２丁目５１番地コーポモトイ２０３号,2026-06-05,株式会社
株式会社飯塚建築事務所,愛知県名古屋市天白区表山３丁目１５番地の６,2026-06-05,株式会社
株式会社ＡＭＡＣＤネクスト,愛知県あま市方領北浦２０４番地,2026-06-05,株式会社
株式会社Ｃｏｒｅ　Ｘ,愛知県尾張旭市印場元町５丁目１２番地１３,2026-06-05,株式会社
株式会社Ｅｌｖｉｒｅｓｔ,愛知県名古屋市北区楠１丁目１６０２番地の６,2026-06-05,株式会社
株式会社Ｆ．Ｄ．ＬＡＢ,愛知県名古屋市東区白壁３丁目２４番５８号日興コーポラス２０５号,2026-06-05,株式会社
株式会社ＦＬＯＲＩＡＮ,愛知県田原市赤石５丁目３０番地２,2026-06-05,株式会社
株式会社Ｆｉｅｌｄ　Ｊａｍ,愛知県豊明市沓掛町五反田３１番地７８,2026-06-05,株式会社
株式会社ＧＡＲＡＧＥ　Ｍ＆Ｍ,愛知県名古屋市天白区井口１丁目１４０４番地,2026-06-05,株式会社
株式会社ＨＴＫマネジメント,愛知県豊田市神田町１丁目５番地７,2026-06-05,株式会社
株式会社Ｋａｉｒｉｏｎ,愛知県犬山市大字今井字畑中４６番地の１,2026-06-05,株式会社
株式会社Ｌｏｃｏ　Ｓｔａｔｉｏｎ,愛知県名古屋市守山区下志段味１丁目３８０７番地,2026-06-05,株式会社
株式会社ＭＫＹ,愛知県名古屋市中村区名駅４丁目２４番５号第２森ビル４０１,2026-06-05,株式会社
株式会社ＭＯ‐ＫＵ,愛知県一宮市大赤見字若年東２０番地,2026-06-05,株式会社
株式会社ＭＲＳコーポレーション,愛知県春日井市高蔵寺町北１丁目１７７番地,2026-06-05,株式会社
株式会社Ｍｉｕｍｅｎｔ,愛知県一宮市木曽川町黒田三ノ通り８１番地,2026-06-05,株式会社
株式会社ＮＧＴホールディングス,愛知県西尾市一色町松木島宮東２５番地,2026-06-05,株式会社
株式会社ＲＡＭＵＳＥＳＵ,愛知県名古屋市中川区丹後町２丁目５１番地ラティエ２０３号,2026-06-05,株式会社
株式会社ＳＫ　Ａｘｉｓ　Ｓｕｐｐｏｒｔ,愛知県岡崎市明大寺町字大圦１５番地１ポレスター竜美丘プレミアムレジデンス１４０４号室,2026-06-05,株式会社
株式会社ＴＥＮＮマネジメント,愛知県名古屋市瑞穂区大喜新町３丁目１１番地の３０,2026-06-05,株式会社
株式会社ＴＳＭ,愛知県春日井市西本町２丁目１０番地１,2026-06-05,株式会社
株式会社ＷＡＧＬＵ,愛知県名古屋市中村区名駅４丁目２４番５号第２森ビル４０１,2026-06-05,株式会社
海江グループ株式会社,愛知県名古屋市港区小賀須３丁目１１０２番地の４,2026-06-05,株式会社
結アセットマネジメント合同会社,愛知県一宮市北小渕字大日１２８番地,2026-06-05,合同会社
藤川鉄工株式会社,愛知県名古屋市北区喜惣治２丁目２番地,2026-06-05,株式会社
Ｅ‐ＰＥＲＦＥＣＴ株式会社,愛知県犬山市大字犬山字南古券１１８番地,2026-06-05,株式会社
Ｌ‐Ｓｔｙｌｅホールディングス株式会社,愛知県春日井市大手町３丁目１４番地１３,2026-06-05,株式会社
ＲＹ株式会社,愛知県名古屋市昭和区駒方町２丁目１１７番地の５,2026-06-05,株式会社
Ｒｅ’ｒｅｓｔ株式会社,愛知県知立市西中町中長２７番地１,2026-06-05,株式会社
ＴＳアセット合同会社,愛知県名古屋市名東区平和が丘３丁目８４番地の２,2026-06-05,合同会社
シージー・メンテナンス合同会社,三重県鈴鹿市白子２丁目１１番１号,2026-06-05,合同会社
住まい相談Ｍｉｅｌａ株式会社,三重県桑名市陽だまりの丘７丁目１８０５番地,2026-06-05,株式会社
合同会社アルバトロス,三重県伊勢市辻久留町５４５番地１２１,2026-06-05,合同会社
株式会社メイク,三重県津市観音寺町７６０番地１７,2026-06-05,株式会社
株式会社山本建装,三重県津市安東町１３２２番地,2026-06-05,株式会社
株式会社ＴＨＲＥＥ　ＳＴＡＲＳ　ＭＩＥ,三重県桑名市大字東方７６８番地１,2026-06-05,株式会社
株式会社Ｗｉｚ　Ｓｋｉｌｌ,三重県三重郡菰野町大字菰野１３６０番地１ベルヴィル１階,2026-06-05,株式会社
Ｊ‐ＴＯＰ株式会社,三重県鈴鹿市南長太町字天の宮２３００－２,2026-06-05,株式会社
合同会社慧心,滋賀県大津市比叡平１丁目１１番１０号,2026-06-05,合同会社
合同会社ＮＥＸＥＥＤ,滋賀県栗東市高野４９５番地（Ａ－１０１号）フェリシオ高野,2026-06-05,合同会社
合同会社ＰＯＮ,滋賀県大津市逢坂１丁目２１－５,2026-06-05,合同会社
株式会社ＢＡＭＢＵＳ,滋賀県長浜市本庄町７００番地５,2026-06-05,株式会社
鳥居本町旧鳥居本自治会,滋賀県彦根市鳥居本町６０８,2026-06-05,その他
ＨＴ　Ｈｏｌｄｉｎｇｓ株式会社,滋賀県大津市大江４丁目２２番６号,2026-06-05,株式会社
ここや株式会社,京都府京都市左京区岩倉中河原町２３７番地,2026-06-05,株式会社
一般社団法人ルミエ,京都府与謝郡与謝野町字明石５４２番地３,2026-06-05,その他の設立登記法人
合同会社にじ,京都府京都市西京区樫原久保町３０－２２,2026-06-05,合同会社
合同会社グロウスター,京都府京都市右京区花園寺ノ内町７番地６,2026-06-05,合同会社
合同会社冪,京都府京都市左京区黒谷町３３番地１,2026-06-05,合同会社
株式会社ウチサポ,京都府京都市南区久世殿城町２８５番地エル・セレーノ向日町１０３号室,2026-06-05,株式会社
株式会社江戸えんしす,京都府京都市下京区大黒町２２７番地第２キョートビル４０２,2026-06-05,株式会社
株式会社西村,京都府京都市伏見区竹田西小屋ノ内町１２,2026-06-05,株式会社
株式会社ＢＡＳＥ,京都府京都市中京区西ノ京塚本町１５－１１,2026-06-05,株式会社
株式会社Ｍａｉｓｏｎ　Ｃａｌｌｉｓｔａ,京都府京都市西京区下津林芝ノ宮町１７番地,2026-06-05,株式会社
株式会社Ｍｏｏｎ　Ｌｉｇｈｔ　Ａｒｔｓ,京都府京都市北区小山上内河原町４９番地６,2026-06-05,株式会社
株式会社ｐｉｕ,京都府京田辺市大住責谷４７－５０,2026-06-05,株式会社
楽居株式会社,京都府京都市下京区玉津島町２９４－１０６,2026-06-05,株式会社
特定非営利活動法人京都がん・消化器疾患ネットワーク,京都府京都市左京区吉田近衛町１２番８号,2026-06-05,その他の設立登記法人
Ｎｉｌ　ｃｏｎｎｅｃｔ株式会社,京都府京都市中京区西ノ京勧学院町２７番地１７,2026-06-05,株式会社
ＷＡＤＡＳＵ合同会社,京都府京都市伏見区醍醐多近田町９番地１６,2026-06-05,合同会社
あんどＪＯＹサクセスフルエイジング研究所合同会社,大阪府大阪市中央区東平２丁目１－２８－２０４号,2026-06-05,合同会社
ぼくらの合同会社,大阪府大阪市大正区泉尾１丁目４０番７号,2026-06-05,合同会社
エースライズジャパン株式会社,大阪府東大阪市玉串町西３丁目４番５０号,2026-06-05,株式会社
クラフテリア株式会社,大阪府大阪狭山市茱萸木３丁目２１８番地の３,2026-06-05,株式会社
シーエイチピー株式会社,大阪府東大阪市岩田町５丁目９番５号,2026-06-05,株式会社
ナミテック株式会社,大阪府門真市浜町１１番１６－３号,2026-06-05,株式会社
ハンマダン民泊管理合同会社,大阪府大阪市生野区新今里３丁目３番２１号ハンマダンビル２０１号,2026-06-05,合同会社
ハートフェルトワークス株式会社,大阪府大阪市阿倍野区阿倍野筋１丁目１番４３号あべのハルカス３２階,2026-06-05,株式会社
ヒトワザ合同会社,大阪府大阪市北区梅田１丁目２番２号大阪駅前第２ビル１２‐１２,2026-06-05,合同会社
一般社団法人ＡＮＵＶＡＮＤＡ,大阪府大阪市北区浮田２丁目２番１４号辻芳ビル２階,2026-06-05,その他の設立登記法人
一般社団法人Ａｍｉ,大阪府吹田市山田西４丁目１３番１－１１０６号,2026-06-05,その他の設立登記法人
一般社団法人Ｌｉｎｏ,大阪府堺市堺区大浜南町２丁２番２６号,2026-06-05,その他の設立登記法人
万田機械株式会社,大阪府八尾市老原３丁目２０番地の６,2026-06-05,株式会社
南岸株式会社,大阪府大阪市住之江区西加賀屋４丁目２番１４－３Ｆ,2026-06-05,株式会社
双陽株式会社,大阪府大阪市北区梅田１丁目２番２号大阪駅前第２ビル１２－１２,2026-06-05,株式会社
合同会社ひとりごと,大阪府大阪市福島区吉野２丁目１５番１８号阪神レジャービル３番館５０６号室,2026-06-05,合同会社
合同会社アイビーエステート,大阪府大阪市天王寺区勝山２丁目１番２９号,2026-06-05,合同会社
合同会社アポロリンクス,大阪府東大阪市六万寺町１丁目２１－３４,2026-06-05,合同会社
合同会社アンド,大阪府東大阪市友井２丁目１６番２４号カーサルミエールⅡ２０１,2026-06-05,合同会社
合同会社ケーアイ,大阪府大阪市住吉区帝塚山中２丁目５番１７－４０６号,2026-06-05,合同会社
合同会社コアフィールド,大阪府東大阪市若江本町４丁目１０番３２号,2026-06-05,合同会社
合同会社ゼットコルサ,大阪府大阪市西区新町１丁目１４－２１－３５０５,2026-06-05,合同会社
合同会社バックアップ,大阪府柏原市平野２丁目２番４３号,2026-06-05,合同会社
合同会社英宜,大阪府大阪市北区梅田１丁目２番２号大阪駅前第２ビル１２－１２,2026-06-05,合同会社
合同会社阪和建設,大阪府阪南市石田６８４番地の１－５,2026-06-05,合同会社
合同会社Ｃｅｐａｇｅ,大阪府大阪市東住吉区鷹合３丁目６－１７,2026-06-05,合同会社
合同会社Ｇｅｍｉｎｉ,大阪府堺市西区堀上緑町２丁２－１５,2026-06-05,合同会社
合同会社Ｌｕｍａｒｋ,大阪府東大阪市日下町６丁目７番３１号,2026-06-05,合同会社
合同会社ＭＰエイト,大阪府泉大津市板原町２丁目８番２２－１０２号,2026-06-05,合同会社
合同会社ＳＥＮ,大阪府大阪市住吉区南住吉４丁目１５番１７号,2026-06-05,合同会社
合同会社ＳＰＥＥＤ,大阪府大阪市西淀川区柏里２丁目７－２６ラ・ピース塚本３０１号室,2026-06-05,合同会社
合同会社ｃｏｌｏ‐ｃｏｌｏ,大阪府大阪市港区波除４丁目７番１１－５０７号,2026-06-05,合同会社
喜樹合同会社,大阪府大阪市大正区三軒家東２丁目３番２号,2026-06-05,合同会社
株式会社ひかり電工,大阪府豊中市西泉丘２丁目２４６０番地の１（２０５号）,2026-06-05,株式会社
株式会社ひこざやＪＡＰＡＮ,大阪府大阪市東住吉区田辺３丁目８番１９号,2026-06-05,株式会社
株式会社やすはら,大阪府大阪市中央区南新町１丁目４－１ＴＴＮ南新町ビル５０２,2026-06-05,株式会社
株式会社エヌスラッシュ,大阪府大阪市西成区中開１丁目３番３１号,2026-06-05,株式会社
株式会社エムリング,大阪府高石市西取石７丁目２０番３号,2026-06-05,株式会社
株式会社カードブーム,大阪府大阪市中央区日本橋１丁目３番７号日本橋３８番街ビル４０１号,2026-06-05,株式会社
株式会社サンライト,大阪府大阪市西成区玉出西１丁目３番２１号,2026-06-05,株式会社
株式会社ハイブランド,大阪府大阪市北区長柄東１丁目４番２４－１１０６号,2026-06-05,株式会社
株式会社ユニオンテック,大阪府大阪市港区港晴２丁目７番２号,2026-06-05,株式会社
株式会社三軒,大阪府交野市郡津１丁目４９番２３号,2026-06-05,株式会社
株式会社中山造園,大阪府堺市中区福田１６９番地１８,2026-06-05,株式会社
株式会社京神ＭＥＴＲＯ,大阪府東大阪市長堂３丁目５番３６号,2026-06-05,株式会社
株式会社円心,大阪府阪南市桃の木台７丁目７番地の１０,2026-06-05,株式会社
株式会社前田商店,大阪府大阪市中央区瓦屋町１丁目４番５号,2026-06-05,株式会社
株式会社創藤,大阪府東大阪市池之端町１番２０号ガーデンレジデンス１０１,2026-06-05,株式会社
株式会社南大阪車体運輸,大阪府柏原市大字高井田６１７番地の１４,2026-06-05,株式会社
株式会社大ピンチ企画,大阪府大阪市浪速区立葉１丁目３番２１号,2026-06-05,株式会社
株式会社岡野電気事務所,大阪府羽曳野市野１９２番地の１２,2026-06-05,株式会社
株式会社永公電設,大阪府枚方市招提大谷３丁目２８－２２,2026-06-05,株式会社
株式会社空誠建設,大阪府泉大津市豊中町１丁目５番１１－２０２号,2026-06-05,株式会社
株式会社赤田工務店,大阪府門真市江端町１３番１０－５号,2026-06-05,株式会社
株式会社長生,大阪府大阪市住吉区沢之町１丁目１１番１９号ドルフィンマンション１Ｆ,2026-06-05,株式会社
株式会社黒匠,大阪府大阪市福島区海老江３丁目１３番１４号,2026-06-05,株式会社
株式会社Ａｉｒ　Ｒｅａｌ,大阪府大阪市生野区勝山北１丁目１８番２１号,2026-06-05,株式会社
株式会社ＢＬ関西,大阪府四條畷市砂３丁目１４番１１号,2026-06-05,株式会社
株式会社ＢＬＵＥ,大阪府大阪市中央区天満橋京町２番６号天満橋八千代ビル別館７階Ａ号室,2026-06-05,株式会社
株式会社ＢＯＧ,大阪府堺市美原区阿弥８０番地１４,2026-06-05,株式会社
株式会社ＥＭＰＴＹ,大阪府守口市寺方錦通２丁目２番１１号３０１号室,2026-06-05,株式会社
株式会社ＦＬＯＷ　ＩＮＤＵＳＴＲＹ,大阪府藤井寺市大井１丁目３番８号,2026-06-05,株式会社
株式会社ＦＵＬＬ　ＴＥＣＨ,大阪府八尾市竹渕１丁目２２０番地,2026-06-05,株式会社
株式会社ＦｌｏｗＦｒａｍｅ,大阪府大阪市城東区今福南１丁目８‐１０ＨＧＴコート１階,2026-06-05,株式会社
株式会社Ｆｌｕｅｎｔ　ｈａｒｍｏｎｙ,大阪府八尾市南木の本２丁目２１番地の３３,2026-06-05,株式会社
株式会社Ｆｒｅｅ　ｃｒｅａｔｅ,大阪府八尾市南木の本２丁目２１番地の３３,2026-06-05,株式会社
株式会社ＫＩＮＬＹ,大阪府大阪市西成区潮路１丁目９番１９号久津和ビル北館４０２号,2026-06-05,株式会社
株式会社Ｌｉｇａｒｅ　ＲＥ,大阪府大阪市都島区友渕町１丁目６番４－１８０３号,2026-06-05,株式会社
株式会社Ｌｕｌｕ‐Ｈａｓ,大阪府泉南郡熊取町大久保北２丁目２０番１１号,2026-06-05,株式会社
株式会社ＭＯＳＳ,大阪府東大阪市長田中１丁目１番２８－５０２号,2026-06-05,株式会社
株式会社ＭＴ,大阪府大阪市北区鶴野町４番４号コープ野村Ａ棟３０６号室,2026-06-05,株式会社
株式会社Ｍｏｒｅ　ｆａｓｈｉｏｎ,大阪府大阪市北区天神橋７丁目１番１６－２３１１号,2026-06-05,株式会社
株式会社ＮＥＸＶＡＬ,大阪府大阪市北区梅田１丁目２番２号大阪駅前第２ビル１２－１２,2026-06-05,株式会社
株式会社Ｏ‐ｅｎ　ｇｉｆｔ,大阪府守口市滝井元町１丁目４番３１－５Ｂ号,2026-06-05,株式会社
株式会社Ｑ‐ｌｉｎｅ‐ｅｘｐｒｅｓｓ,大阪府大阪市阿倍野区天王寺町南３丁目１０番１６号,2026-06-05,株式会社
株式会社ＲＡＹＶＥＬ,大阪府大阪市東成区大今里３丁目１１番２号,2026-06-05,株式会社
株式会社ＲＲ,大阪府貝塚市東山２丁目９番５号,2026-06-05,株式会社
株式会社ＳＯＣＺＥ,大阪府大阪市阿倍野区相生通１丁目４番６６号オーク相生５号,2026-06-05,株式会社
株式会社Ｓａｋｏｈａ　Ｌｉｖｉｎｇ,大阪府羽曳野市誉田３丁目５番９号,2026-06-05,株式会社
株式会社Ｓｅｗａ　Ｌｉｎｋｓ,大阪府大阪市天王寺区堂ケ芝２丁目１１番４－６０１号,2026-06-05,株式会社
