法人名,住所,設立日,法人種別
ＲＰＮＢ　Ｓｅｃｕｒｉｔｙ　Ｔｅｃｈｎｏｌｏｇｙ　Ｃｏ．，Ｌｉｍｉｔｅｄ,,2026-06-05,外国会社等
Ｓｕｚｈｏｕ　Ｆｅｎｇｙａｏ　Ｙｕｎｈａｉ　Ｔｒａｄｉｎｇ　Ｃｏ．，Ｌｔｄ．,,2026-06-05,外国会社等
ＴＡＩ　ＦＵ　ＥＮ　ＸＩＡ　ＭＥＮ　ＭＡＯ　ＹＩ　ＹＯＵ　ＸＩＡＮ　ＧＯＮＧ　ＳＩ,,2026-06-05,外国会社等
ＷＵＹＩ　ＨＥＰＵ　ＭＡＯＹＩ　ＹＯＵＸＩＡＮ　ＧＯＮＧＳＩ,,2026-06-05,外国会社等
ｊｉ　ｘｉｎｇ　ｚｈｉ　ｇｏｕ（ｓｈｅｎ　ｚｈｅｎ）ｋｅ　ｊｉ　ｙｏｕ　ｘｉａｎ　ｇｏｎｇ　ｓｉ,,2026-06-05,外国会社等
オケアノース合同会社,北海道札幌市東区北九条東９丁目２番１５号ミキハイツ２０２号,2026-06-05,合同会社
プレディウム株式会社,北海道札幌市北区北十八条西３丁目１番１８号５Ｆ,2026-06-05,株式会社
五十嵐農場株式会社,北海道空知郡南幌町南１２線西７番地,2026-06-05,株式会社
修理屋Ｂｏｔｃｈｉ株式会社,北海道樺戸郡浦臼町字オサツナイ１１番地２１,2026-06-05,株式会社
合同会社きくりんオートサービス,北海道北広島市大曲南ヶ丘３丁目２６番地１０,2026-06-05,合同会社
合同会社テクトリ,北海道札幌市厚別区もみじ台北１丁目２－３,2026-06-05,合同会社
合同会社ネクストマネジメント,北海道札幌市中央区南五条西５丁目８番地１ＴＭ－４８ビル７階Ａ号室,2026-06-05,合同会社
合同会社レザールノア,北海道帯広市西二十一条南４丁目１０番地３,2026-06-05,合同会社
合同会社慕う,北海道札幌市手稲区稲穂三条５丁目１番１号２階,2026-06-05,合同会社
合同会社ＡＫプランニング,北海道札幌市中央区南五条西１５丁目２－３－５０３,2026-06-05,合同会社
合同会社Ｃｉｔｒｏｎ,北海道斜里郡斜里町青葉町１４番地１６,2026-06-05,合同会社
合同会社ＫＩＲＩ　ＦＡＲＭ,北海道野付郡別海町別海６４番地の３５,2026-06-05,合同会社
合同会社ＭＡＳＯＮＳ,北海道上川郡和寒町字南町１３３番地,2026-06-05,合同会社
合同会社ＭＡＴ,北海道札幌市西区二十四軒二条１丁目１番５３－３０５号,2026-06-05,合同会社
合同会社ＭＩＲＡＭＵ,北海道札幌市白石区平和通６丁目南３番４号,2026-06-05,合同会社
合同会社Ｒｅｖｅｒｓａｌ,北海道札幌市北区北三十二条西９丁目１番３－１０２号,2026-06-05,合同会社
合同会社ＹＭＮＳ,北海道札幌市中央区北三条東３丁目１番地２７,2026-06-05,合同会社
合同会社ＹＵＫＩカンパニー,北海道河東郡上士幌町字上士幌東１線２３０番地６７,2026-06-05,合同会社
株式会社アンダーボス,北海道日高郡新ひだか町静内西川３５０番地の２,2026-06-05,株式会社
株式会社ネクサスサービス,北海道札幌市北区北二十二条西４丁目１番１号,2026-06-05,株式会社
株式会社バンドナビゲーション,北海道札幌市南区川沿一条６丁目２番３１号,2026-06-05,株式会社
株式会社ブランシェ,北海道札幌市豊平区平岸三条１７丁目６番１４号,2026-06-05,株式会社
株式会社プラスナイン,北海道札幌市中央区大通西２４丁目２番２０－３０２号,2026-06-05,株式会社
株式会社マルシンささき塗装,北海道札幌市白石区川北２２４８番地６０,2026-06-05,株式会社
株式会社リブアス,北海道札幌市白石区北郷四条３丁目２番１２－１０３号,2026-06-05,株式会社
株式会社ワイフィールド,北海道中川郡幕別町字明野６３２番地の１９,2026-06-05,株式会社
株式会社新港開発,北海道札幌市白石区川北２３２０番地３,2026-06-05,株式会社
株式会社春,北海道旭川市曙一条７丁目２番１号,2026-06-05,株式会社
株式会社藤匠,北海道網走市潮見１０丁目８番１５号,2026-06-05,株式会社
株式会社鈴木牧場,北海道河東郡士幌町字中士幌東１線１２８番地,2026-06-05,株式会社
株式会社雅工業,北海道岩見沢市栄町３丁目３番７号,2026-06-05,株式会社
株式会社養生らいむ,北海道札幌市白石区東札幌五条３丁目２番１２－１０８号,2026-06-05,株式会社
株式会社ＥＫ・トランスポート,北海道札幌市東区北四十三条東１５丁目２番３号ポプリカンサイドＡ１,2026-06-05,株式会社
株式会社ＨＫＥ,北海道札幌市西区平和二条３丁目５番７号,2026-06-05,株式会社
株式会社ＬＩＦＩＸ,北海道小樽市奥沢４丁目１２番２号,2026-06-05,株式会社
株式会社Ｏｌｔｒａｉｓｅ,北海道札幌市中央区南七条西９丁目１０２４番地４５モデナディモーラ１１０２号,2026-06-05,株式会社
株式会社ＲｉＳＥ,北海道苫小牧市日の出町２丁目１３番１６号,2026-06-05,株式会社
株式会社Ｗａｌｌ　Ｃｒａｗｌｉｎｇ　Ｃｒｅｗ,北海道札幌市東区北二十七条東２０丁目３－２７,2026-06-05,株式会社
株式会社ａｎｃｈｏｒ,北海道札幌市中央区南六条西９丁目１０２４番地ささやビル２０１号室,2026-06-05,株式会社
株式会社ｍｏｋｏＴａｓ,北海道札幌市西区発寒六条８丁目７番１号,2026-06-05,株式会社
ＡＲＡＭＡ　ＨＯＬＤＩＮＧＳ株式会社,北海道札幌市中央区大通西１丁目１４番地２桂和大通ビル５０－９Ｆ,2026-06-05,株式会社
Ｉ設備株式会社,北海道札幌市北区新琴似町５４６番地３０,2026-06-05,株式会社
Ｋ２Ｊ合同会社,北海道札幌市西区山の手二条１０丁目３番２３号ヴィルヌーブ山の手３０４号,2026-06-05,合同会社
ＬＩＶＵＰ合同会社,北海道帯広市西二条南４丁目１６－３－５０３号,2026-06-05,合同会社
Ｍｅｌｏｎ　Ｇｒｏｏｖｅ株式会社,北海道滝川市朝日町東２丁目６番１１号,2026-06-05,株式会社
Ｒｉｙｏｒａ　Ｐａｒｔｎｅｒｓ合同会社,北海道札幌市中央区北五条西２０丁目１－２５イトーピア美術館西１００１,2026-06-05,合同会社
ＷＥＡＲＣ株式会社,北海道札幌市北区あいの里三条４丁目５番８号,2026-06-05,株式会社
サインプロデュース合同会社,青森県青森市西滝３丁目８番地１号,2026-06-05,合同会社
株式会社小椋商店,青森県青森市里見２丁目１０番３号,2026-06-05,株式会社
株式会社ＴＵＮＡＧＵ,岩手県北上市さくら通り１丁目８番２４号,2026-06-05,株式会社
Ｈｅｎｗｏｏｄ　Ｐｅｒｆｏｒｍａｎｃｅ合同会社,岩手県釜石市甲子町第９地割１５１番地１６,2026-06-05,合同会社
合同会社穂の香,宮城県栗原市一迫真坂字十日市７１番地３,2026-06-05,合同会社
株式会社まんぷう,宮城県刈田郡蔵王町遠刈田温泉字下ノ原８番地５,2026-06-05,株式会社
株式会社万代ホールディングス,宮城県仙台市太白区中田町字杉ノ下３４番地,2026-06-05,株式会社
株式会社心音,宮城県遠田郡美里町関根字道明５８番地の４,2026-06-05,株式会社
株式会社きららプラス,秋田県秋田市大町２丁目５番１号,2026-06-05,株式会社
株式会社アグリかまくら,秋田県横手市平鹿町醍醐字当面町８５番地２,2026-06-05,株式会社
株式会社琉流杜の雫,秋田県仙北市田沢湖田沢字大深３２８番地１,2026-06-05,株式会社
株式会社ＭＳプロパティマネジメント,秋田県仙北市角館町上菅沢２３４番地５,2026-06-05,株式会社
合同会社天馬,山形県天童市小路２丁目４番３４号,2026-06-05,合同会社
一般社団法人Ｃｏｍｍｕｎｉｔｙ　ＭＩＣＥ,福島県相馬市中村字川沼１４８番地の２,2026-06-05,その他の設立登記法人
合同会社ＡｒｃＳｔｏｒｙ,福島県福島市宮代字天神前３３番地の１１,2026-06-05,合同会社
恒南ネットワーク合同会社,福島県郡山市安積４丁目５９番地,2026-06-05,合同会社
株式会社エンドウ電設,福島県石川郡石川町大字板橋字沢古屋２６９番地の１,2026-06-05,株式会社
株式会社ハウスラボ,福島県郡山市安積町日出山４丁目１８１番地,2026-06-05,株式会社
株式会社心青笑,福島県福島市大町５番１５号,2026-06-05,株式会社
ＧｒｏｏＢｅａｔ株式会社,福島県郡山市大町１丁目３番１７号,2026-06-05,株式会社
まごころカットひたちなか株式会社,茨城県水戸市杉崎町１９８８番地の３,2026-06-05,株式会社
まごころカット太田株式会社,茨城県水戸市杉崎町１９８８番地の３,2026-06-05,株式会社
まごころカット水戸河和田株式会社,茨城県水戸市杉崎町１９８８番地の３,2026-06-05,株式会社
まごころカット笠間株式会社,茨城県水戸市杉崎町１９８８番地の３,2026-06-05,株式会社
レックスＦ・Ｄ・Ｅ株式会社,茨城県水戸市元石川町２６３８番地の１７,2026-06-05,株式会社
合同会社Ｙパートナーズ,茨城県桜川市岩瀬１３８番地４,2026-06-05,合同会社
株式会社エコエネ,茨城県行方市麻生１０８,2026-06-05,株式会社
株式会社ＦＪ商事,茨城県猿島郡境町７３１番地３,2026-06-05,株式会社
ＲＥＳＯＮ合同会社,茨城県鹿嶋市大字平井１２９８番地４５,2026-06-05,合同会社
未千株式会社,栃木県佐野市戸奈良町２５０２番地１,2026-06-05,株式会社
株式会社べるを商店,栃木県足利市南大町３３１４番地１,2026-06-05,株式会社
株式会社フェスターレ,栃木県鹿沼市武子８１４番地,2026-06-05,株式会社
株式会社久誠,栃木県栃木市大塚町３１６１番地,2026-06-05,株式会社
Ｆ　ＩＮＧ合同会社,栃木県真岡市さくら１丁目７番地１１,2026-06-05,合同会社
ＴＲＥ株式会社,栃木県佐野市石塚町１８０５番地,2026-06-05,株式会社
市川会計税理士法人,群馬県高崎市下和田町３丁目５番８号,2026-06-05,その他の設立登記法人
株式会社ブルーガレージ,群馬県前橋市大胡町２８９番地６,2026-06-05,株式会社
株式会社Ｂｅａｕｔｏｍ,群馬県館林市諏訪町１０６６,2026-06-05,株式会社
株式会社Ｙ‐ＣＲＡＮ．Ｃ,群馬県高崎市倉賀野町２８５４番地３,2026-06-05,株式会社
芝入印刷株式会社,群馬県前橋市光が丘町４番地２０,2026-06-05,株式会社
Ｊａｐａｏ　Ｅｎｔｒｅｇａ合同会社,群馬県邑楽郡大泉町大字寄木戸１４１４番地の２ユーパークウツギ１０３号,2026-06-05,合同会社
スマイルＭＥ株式会社,埼玉県さいたま市岩槻区上野１丁目２番地１１,2026-06-05,株式会社
ベース合同会社,埼玉県さいたま市中央区上落合５丁目５－１４－１０３,2026-06-05,合同会社
ルミナスウェア株式会社,埼玉県鶴ヶ島市松ヶ丘２丁目６―２,2026-06-05,株式会社
合同会社弥栄,埼玉県深谷市上柴町西２丁目１番地２２マーヴェラス１０２号,2026-06-05,合同会社
合同会社ＮＥＸＴＤＡＹパートナーズ,埼玉県川越市諏訪町１７番地３０,2026-06-05,合同会社
東和ロジ株式会社,埼玉県さいたま市大宮区桜木町４丁目３８４番地,2026-06-05,株式会社
株式会社エイチスリー,埼玉県さいたま市大宮区櫛引町１丁目２２３番地,2026-06-05,株式会社
株式会社キャリアテラス,埼玉県川口市金山町１２番１号サウスゲートタワー川口２階,2026-06-05,株式会社
株式会社モノテクト,埼玉県桶川市下日出谷西１丁目１６番地の１１,2026-06-05,株式会社
株式会社泡,埼玉県白岡市篠津２１３１番地６,2026-06-05,株式会社
株式会社ＮＥＸＣＯＲ,埼玉県川越市大字下広谷１９８番地１,2026-06-05,株式会社
株式会社ｔｈｒｅｅＭ,埼玉県北葛飾郡松伏町ゆめみ野４丁目１４番地２メゾンアガペー２０１,2026-06-05,株式会社
Ａｄｖａｎｃｅ合同会社,埼玉県加須市騎西２２番地１８,2026-06-05,合同会社
ＯＦＩＣＩＮＡ　ＨＡＹＡＳＨＩ株式会社,埼玉県川越市連雀町１２番地５,2026-06-05,株式会社
ＳＱＵＡＲＥ株式会社,埼玉県朝霞市岡１丁目１１番１９号,2026-06-05,株式会社
ＶＩＳＹＮＣ合同会社,埼玉県富士見市山室２丁目１１番３０－５号,2026-06-05,合同会社
ｇｅｎｓａｉ株式会社,埼玉県三郷市新和３丁目８７番地,2026-06-05,株式会社
カルタン合同会社,千葉県流山市平和台４丁目１番地の１０,2026-06-05,合同会社
一般社団法人千葉県近代五種協会,千葉県市原市鶴舞５９９－７,2026-06-05,その他の設立登記法人
合同会社かるな,千葉県野田市中根３６－１イオンノア店３階ノア総合医療センター内,2026-06-05,合同会社
合同会社アイムバディ,千葉県習志野市秋津１丁目４－８秋津団地・１０６号,2026-06-05,合同会社
松戸グリーン株式会社,千葉県東金市堀上６６６番地３,2026-06-05,株式会社
株式会社さんむハウジング,千葉県山武市松尾町松尾６１番地１,2026-06-05,株式会社
株式会社Ａｌｌｙ　Ｋｎｏｔ,千葉県習志野市花咲１丁目３番１３－１号,2026-06-05,株式会社
株式会社ＧｒｅｅＮｏａ,千葉県木更津市ほたる野１丁目１番地４,2026-06-05,株式会社
株式会社Ｎ‐ＷＯＲＫＳ,千葉県市原市菊間１９８１番地２,2026-06-05,株式会社
株式会社Ｓｕｍｉｌｙ,千葉県千葉市緑区鎌取町８４番地１－１０５号,2026-06-05,株式会社
誠心合同会社,千葉県成田市三里塚１番地１４７４サンライトハイツⅡ２０４,2026-06-05,合同会社
ＬｉｆｅＳｔｙｌｅ株式会社,千葉県市川市宮久保１丁目２－１７サンシティ田所２０２号室,2026-06-05,株式会社
いつきラボ株式会社,東京都品川区大崎３丁目１９番２８号ヒルズ大崎２０６,2026-06-05,株式会社
ささえーる株式会社,東京都大田区中央７丁目６番２３－７０４号,2026-06-05,株式会社
まろやか不動産合同会社,東京都大田区大森西６丁目７番２号,2026-06-05,合同会社
やまとや未来創電株式会社,東京都港区芝４丁目６－８千代田三田ビル６階,2026-06-05,株式会社
アルセディア株式会社,東京都三鷹市上連雀１丁目１３番７号,2026-06-05,株式会社
アルファキャピタル合同会社,東京都板橋区上板橋２丁目２２番１３－６１２号,2026-06-05,合同会社
エンデバー・ユナイテッド・パートナーズ・４６株式会社,東京都千代田区丸の内２丁目５番１号丸の内二丁目ビル６階,2026-06-05,株式会社
エンデバー・ユナイテッド・パートナーズ・４７株式会社,東京都千代田区丸の内２丁目５番１号丸の内二丁目ビル６階,2026-06-05,株式会社
キワミギルド株式会社,東京都渋谷区本町２丁目７－９,2026-06-05,株式会社
グローバルエアーシステム株式会社,東京都新宿区西新宿３丁目３番１３号西新宿水間ビル２Ｆ,2026-06-05,株式会社
スクリベックス合同会社,東京都渋谷区広尾１丁目２番地１号ヒカリビル４階,2026-06-05,合同会社
ネクストエアーソリューション株式会社,東京都渋谷区道玄坂１丁目１０番８号渋谷道玄坂東急ビル２Ｆ－Ｃ,2026-06-05,株式会社
メガプテラ株式会社,東京都渋谷区神南１丁目１１番４号ＦＰＧリンクス神南５階,2026-06-05,株式会社
リアン合同会社,東京都港区新橋２丁目２－５新橋パイオニアビル３－４階,2026-06-05,合同会社
リリー特定目的会社,東京都千代田区丸の内１丁目４番１号東京共同会計事務所内,2026-06-05,その他の設立登記法人
リンクステア合同会社,東京都練馬区大泉町３丁目１３番４号,2026-06-05,合同会社
ルミエノア合同会社,東京都新宿区若宮町１０番地プレール神楽坂３階,2026-06-05,合同会社
一般社団法人いい屋根屋社中,東京都品川区荏原２丁目２番３号,2026-06-05,その他の設立登記法人
一般社団法人チカラ,東京都千代田区六番町６番地４ＬＨ番町スクエア５階,2026-06-05,その他の設立登記法人
一般社団法人中野,東京都港区西新橋１丁目２番９号メンターキャピタル税理士法人内,2026-06-05,その他の設立登記法人
一般社団法人地域承継支援機構,東京都千代田区神田佐久間町１丁目１４番地第２東ビル９０３,2026-06-05,その他の設立登記法人
一般社団法人彩り文字協会,東京都台東区上野６丁目１番６号御徒町グリーンハイツ１００５号室,2026-06-05,その他の設立登記法人
一般社団法人数理社会実装教育研究センター,東京都新宿区高田馬場１丁目１番１５－１１０２号,2026-06-05,その他の設立登記法人
一般社団法人日本モンゴル天然物開発センター,東京都中野区中野３丁目３番５号,2026-06-05,その他の設立登記法人
一般社団法人菊友会,東京都千代田区九段北２丁目２番１号千代田区立九段中等教育学校内,2026-06-05,その他の設立登記法人
一般社団法人Ｊａｐａｎ　Ａｃａｄｅｍｙ　ｏｆ　Ｃｏｍｐｒｅｈｅｎｓｉｖｅ　ＯＧＳ,東京都中央区銀座８丁目１６番１－２０５,2026-06-05,その他の設立登記法人
一般社団法人Ｍａｃ　Ａｄｍｉｎｓ　Ｊａｐａｎ,東京都港区赤坂９丁目７番１号ミッドタウン・タワー１８階,2026-06-05,その他の設立登記法人
一般社団法人Ｓｏｃｉｅｔｙ　ｏｆ　Ｉｄｅａ　Ｐｅｏｐｌｅ,東京都港区南青山６丁目１２番１０号南青山ユニティ２階,2026-06-05,その他の設立登記法人
一般財団法人日本消化器病財団,東京都台東区上野３丁目２番２号,2026-06-05,その他の設立登記法人
井の頭Ｈｏｍｅｓ株式会社,東京都杉並区和泉３丁目１２番４号,2026-06-05,株式会社
伸和総業株式会社,東京都葛飾区新小岩１丁目１０－８,2026-06-05,株式会社
億星株式会社,東京都江戸川区平井５丁目１７番１－１６１３号,2026-06-05,株式会社
光設ソリューションズ株式会社,東京都中央区日本橋室町１丁目１１番１２号日本橋水野ビル７階,2026-06-05,株式会社
合同会社あかときづき,東京都渋谷区大山町１７番２３－９０２号,2026-06-05,合同会社
合同会社かめ,東京都港区北青山１丁目３－３三橋ビル３階,2026-06-05,合同会社
合同会社つきじ人力車,東京都中央区築地６丁目２７番３号ＰＡＲＡＤＩＳＯ２Ｆ,2026-06-05,合同会社
合同会社ウィンズサービス,東京都三鷹市下連雀５丁目３番１－７２３号,2026-06-05,合同会社
合同会社サイバーストック,東京都新宿区下落合４丁目７－６みどり台ハウス２０１,2026-06-05,合同会社
合同会社センス,東京都港区南青山３丁目１番３６号青山丸竹ビル６Ｆ,2026-06-05,合同会社
合同会社トリヴァリー,東京都杉並区永福２丁目５番９号,2026-06-05,合同会社
合同会社ハッピー企画,東京都目黒区中目黒１丁目１番１７－４１５号,2026-06-05,合同会社
合同会社ムーンライトアレィ,東京都小金井市貫井北町３丁目２４番１７号,2026-06-05,合同会社
合同会社ラッヘン,東京都品川区西大井５丁目２２番３４号,2026-06-05,合同会社
合同会社人間６号,東京都港区愛宕１丁目６番８号,2026-06-05,合同会社
合同会社大澤ビル,東京都中央区日本橋茅場町３丁目４番７号,2026-06-05,合同会社
合同会社篠﨑総合事務所,東京都台東区東上野４丁目６－７－２０１,2026-06-05,合同会社
合同会社龍神,東京都中央区銀座８丁目４番２号,2026-06-05,合同会社
合同会社ＧＡＮ．,東京都港区南青山３丁目１番３６号青山丸竹ビル６Ｆ,2026-06-05,合同会社
合同会社Ｈ‐Ｂａｓｅ,東京都千代田区永田町２丁目１７番８－１００１号,2026-06-05,合同会社
合同会社ＪＯＳＹＯ,東京都港区芝浦３丁目１５番５－３０４号,2026-06-05,合同会社
合同会社Ｊａｐａｎ　Ｐｒｏｐｅｒｔｙ,東京都新宿区西新宿６丁目２０－７－２１０４,2026-06-05,合同会社
合同会社Ｊｅｕｘ　ｄ’ｅａｕ,東京都渋谷区渋谷２丁目１９－１５宮益坂ビルディング６０９,2026-06-05,合同会社
合同会社Ｌｉｎｋａ,東京都品川区南品川２丁目２番５号２Ｆ,2026-06-05,合同会社
合同会社Ｌｕｍｉｎｏｕｓ　Ｍｉｎｄ,東京都港区港南２丁目１６番７－２０１０号,2026-06-05,合同会社
合同会社ＭＡＲＱＵＥ,東京都新宿区大久保１丁目１１番２１－２０５号,2026-06-05,合同会社
合同会社Ｍａｓｔｅｒｙ　ｆｏｒ　Ｍｏｔｉｏｎ,東京都目黒区洗足１丁目１１番２１号ＢＬＡＮＣＨＥＵＲ－４０１,2026-06-05,合同会社
合同会社Ｍｉｏｔｏ　Ｂｅａｕｔｙ,東京都港区南麻布３丁目１９－２１グランドガーラ南麻布１５０３,2026-06-05,合同会社
合同会社Ｎ２Ｋ,東京都台東区西浅草１丁目９番６号,2026-06-05,合同会社
合同会社Ｏｍｎｉ　Ｒｕｎｔｉｍｅ　Ｂａｓｅ,東京都港区浜松町１丁目３０－５浜松町スクエア１１Ｆ,2026-06-05,合同会社
合同会社Ｐａｔｍｅ,東京都渋谷区道玄坂１丁目１０番８号渋谷道玄坂東急ビル２Ｆ－Ｃ,2026-06-05,合同会社
合同会社ＲｅａｌＸ,東京都渋谷区道玄坂１丁目１０番８号渋谷道玄坂東急ビル２Ｆ－Ｃ,2026-06-05,合同会社
合同会社ＳＴＡＲＬＩＮＫ,東京都大田区石川町２丁目４番４号,2026-06-05,合同会社
合同会社Ｓｏａｒ,東京都立川市曙町２丁目２１番地７,2026-06-05,合同会社
合同会社ＴＴＹ,東京都中央区築地６丁目２番１２号アトラス３１３号,2026-06-05,合同会社
合同会社ＴＴＹＴＫＭ,東京都中央区築地６丁目２番１２号アトラス３１３号,2026-06-05,合同会社
合同会社Ｖａｍｏｓ,東京都品川区西中延１丁目８－５ティーグル荏原中延４０１,2026-06-05,合同会社
合同会社ＷＧアミューズ,東京都新宿区歌舞伎町１丁目１４番６号第２１東京ビル４Ｆ,2026-06-05,合同会社
合同会社Ｗｉｓｅ　Ｃｒｅａｔｉｏｎ,東京都目黒区下目黒１丁目１番１４号コノトラビル７Ｆ,2026-06-05,合同会社
合同会社ａｆｔｅｒ　ｃｏｌｏｒ,東京都渋谷区神泉町１０番１５号アネックス神泉３０１,2026-06-05,合同会社
合同会社ａｎｄｏｈ　ｃｏｆｆｅｅ,東京都武蔵野市吉祥寺南町１丁目１４番５号,2026-06-05,合同会社
合同会社ｂｌｕｅｌａｍｂ　ｄｅｓｉｇｎ　ｓｔｕｄｉｏ,東京都三鷹市下連雀３丁目３５番１号Ｎ・Ｅ・Ｏ，ＣＩＴＹ，ＭＩＴＡＫＡ６階ＢＩＺｃｏｍｆｏｒｔ三鷹,2026-06-05,合同会社
合同会社ｓａｓａｖｉ,東京都渋谷区道玄坂１丁目１０番８号渋谷道玄坂東急ビル２Ｆ－Ｃ,2026-06-05,合同会社
善商事合同会社,東京都中央区銀座１丁目２２番１１号銀座大竹ビジデンス２Ｆ,2026-06-05,合同会社
宇治山田ホテルマネジメント合同会社,東京都千代田区霞が関３丁目２番１号,2026-06-05,合同会社
宮城白石蓄電所合同会社,東京都港区虎ノ門５丁目３番２０号株式会社アカウンティング・マネジメント・サービス内,2026-06-05,合同会社
小林資産管理株式会社,東京都多摩市諏訪１丁目２番地の３,2026-06-05,株式会社
尚和合同会社,東京都中央区新川２丁目５番７号,2026-06-05,合同会社
日電グループ株式会社,東京都荒川区東日暮里６丁目３７番１２号,2026-06-05,株式会社
旭川ホテルマネジメント合同会社,東京都千代田区霞が関３丁目２番１号,2026-06-05,合同会社
暁ソフトウェア開発株式会社,東京都台東区上野１丁目１７番６号広小路ビル８階－Ｂ,2026-06-05,株式会社
東由利原鮎川風力合同会社,東京都港区南青山３丁目１番７号青山コンパルビル２階ｗｐｄジャパン株式会社内,2026-06-05,合同会社
株式会社すずか,東京都国分寺市北町５丁目１１番地４,2026-06-05,株式会社
株式会社すず鬼,東京都練馬区高野台１丁目６番１号,2026-06-05,株式会社
株式会社つるつるいっぱい,東京都練馬区大泉町１丁目２６番２１号,2026-06-05,株式会社
