法人名,住所,設立日,法人種別
株式会社アイルズアセット,東京都多摩市関戸５丁目１４番地の１１,2026-06-05,株式会社
株式会社アカミネ,東京都八王子市中町３番１２号三田ビル１Ｆ,2026-06-05,株式会社
株式会社アトラスト,東京都新宿区矢来町８２,2026-06-05,株式会社
株式会社アルファ・シリウス,東京都世田谷区上野毛１丁目２１番３号,2026-06-05,株式会社
株式会社アンフィニホールディングス,東京都港区虎ノ門４丁目１番１３号ＰｒｉｍｅＴｅｒｒａｃｅＫＡＭＩＹＡＣＨＯ３階,2026-06-05,株式会社
株式会社エスリーパートナーズ,東京都大田区久が原４丁目２３番４号,2026-06-05,株式会社
株式会社エメ・スピカ,東京都葛飾区東新小岩７丁目２４番６号,2026-06-05,株式会社
株式会社エルエスアンドシー,東京都港区北青山３丁目１０番１８号北青山本田ビルＢ１,2026-06-05,株式会社
株式会社オフィスＥＩＴ,東京都江戸川区東小松川３丁目２番１２号,2026-06-05,株式会社
株式会社カノア,東京都墨田区吾妻橋１丁目７番２号松木倉庫１階,2026-06-05,株式会社
株式会社グランハウス,東京都狛江市西野川３丁目５番１６号,2026-06-05,株式会社
株式会社コスモホールディングス,東京都小金井市梶野町５丁目１番５号２階,2026-06-05,株式会社
株式会社コロ,東京都江東区東陽１丁目２７番３号,2026-06-05,株式会社
株式会社サクセッションリリーフ,東京都江戸川区船堀３丁目５番２７－４０７号,2026-06-05,株式会社
株式会社シノデン,東京都練馬区早宮２丁目１７番３３号ＷｅａｖｅＢａｓｅ練馬平和台１０２,2026-06-05,株式会社
株式会社スーパーハッピー,東京都足立区千住旭町４３番２号ソレイユメゾン２０１,2026-06-05,株式会社
株式会社タマリバー,東京都調布市下石原３丁目６５番地３６,2026-06-05,株式会社
株式会社トップリアル,東京都新宿区大久保１丁目１２番４号ＡＳＳ第二ビル４Ｆ,2026-06-05,株式会社
株式会社ネッキョウ,東京都千代田区神田三崎町２丁目１０－８オリックス水道橋ビル５階,2026-06-05,株式会社
株式会社ハーフプラス,東京都大田区山王４丁目９番２３号,2026-06-05,株式会社
株式会社パンセ,東京都武蔵野市桜堤１丁目９番１２－２０３号,2026-06-05,株式会社
株式会社ファザーズ・ウォーク,東京都小金井市梶野町１丁目２番３６号ＫＯ－ＴＯ,2026-06-05,株式会社
株式会社フィールド・エッジ,東京都武蔵野市御殿山２丁目８番９－３１５号,2026-06-05,株式会社
株式会社マキテル,東京都渋谷区代々木神園町３番３号グロブナープレイス神園町３０７,2026-06-05,株式会社
株式会社メラリ,東京都千代田区神田須田町１丁目７－８ＶＯＲＴⅣ２Ｆ,2026-06-05,株式会社
株式会社リライズ,東京都世田谷区太子堂４丁目１８番１５号マガザン三軒茶屋２，３Ｆ－３,2026-06-05,株式会社
株式会社ルックスオラ,東京都港区三田１丁目２番１８号ＴＴＤビル,2026-06-05,株式会社
株式会社ワイズスタイル,東京都昭島市東町５丁目１０番１３号,2026-06-05,株式会社
株式会社一成商事,東京都足立区千住橋戸町１－５４ザ・サンメゾン千住大橋７０２,2026-06-05,株式会社
株式会社七商,東京都中央区八重洲２丁目１１番３号ＬＩＮＥＶＩＥＷ京橋１Ｆ,2026-06-05,株式会社
株式会社三豊植木,東京都大田区久が原４丁目３５番１号光荘７３６号室,2026-06-05,株式会社
株式会社中山商事,東京都世田谷区桜丘５丁目３４－９ココ桜丘１階,2026-06-05,株式会社
株式会社仁メタルワークス,東京都江戸川区平井６丁目１２番２号,2026-06-05,株式会社
株式会社内堀電気設備,東京都足立区千住大川町６番１－５０８号,2026-06-05,株式会社
株式会社幾留温建築研究所,東京都中央区日本橋２丁目１５番８号４０２,2026-06-05,株式会社
株式会社新風政策研究所,東京都千代田区三番町３番地１パレスサイド三番町２０１号,2026-06-05,株式会社
株式会社高橋通信,東京都稲城市向陽台６丁目１２番地アルボの丘３－６０９号,2026-06-05,株式会社
株式会社２８,東京都大田区西蒲田４丁目２９番９－１号,2026-06-05,株式会社
株式会社ＡＬＬＷＩＮ　ＧＲＯＷＴＨ,東京都港区南青山２丁目２番１５号ＷｉｎＡｏｙａｍａビルＵＣＦ６３５,2026-06-05,株式会社
株式会社ＡＮアドバイザリー,東京都渋谷区渋谷４丁目３番２７号,2026-06-05,株式会社
株式会社ＡＵＲＥＬＩＡ,東京都港区北青山１丁目３番１号アールキューブ青山３階,2026-06-05,株式会社
株式会社ＢＣＪ‐１１０,東京都千代田区丸の内１丁目１番１号パレスビル５階,2026-06-05,株式会社
株式会社ＢｉｚＭｅａｌ,東京都千代田区神田須田町１丁目２番地７淡路町駅前ビル３階,2026-06-05,株式会社
株式会社ＣＡＰＴＡＩＮ,東京都港区赤坂２丁目１７番５０－３００３号,2026-06-05,株式会社
株式会社ＣＬＯＮＥＭＡＴＥ,東京都港区港南２丁目１６番４号品川グランドセントラルタワー８階,2026-06-05,株式会社
株式会社ＣＲＦＴＤ,東京都渋谷区碑文谷二丁目２１番６号,2026-06-05,株式会社
株式会社Ｃｌｉｍｂ　Ｆｉｅｌｄ,東京都新宿区西新宿３丁目３番１３号西新宿水間ビル２Ｆ,2026-06-05,株式会社
株式会社ＤＡＫＥ４,東京都港区六本木５丁目２番１号ほうらいやビル８階,2026-06-05,株式会社
株式会社ＤＵＡＬ　ＡＸＩＳ,東京都中央区勝どき５丁目３番１－１９０７号,2026-06-05,株式会社
株式会社Ｅ‐ＬＩＦＥ　ＣＡＲＥ,東京都渋谷区東２丁目９番２６－１０２号,2026-06-05,株式会社
株式会社ＥＬＦ　ｉｎｃ,東京都渋谷区猿楽町１７番５号ＤＡＩＫＡＮＹＡＭＡＴ－ＳＩＴＥ３号館２階,2026-06-05,株式会社
株式会社ＥＮＴＲＩＱ,東京都新宿区西新宿３丁目７番２６号ハイネスロワイヤル６０５,2026-06-05,株式会社
株式会社Ｆｏｒｔｉａ,東京都港区六本木３丁目１６番１２号六本木ＫＳビル５Ｆ,2026-06-05,株式会社
株式会社Ｇｌｏｂａｌ　Ｔａｌｅｎｔ　Ｌｉｎｋ,東京都港区赤坂２丁目１４－１１,2026-06-05,株式会社
株式会社Ｈａｒｍｏｎｉａ,東京都千代田区永田町２丁目１１番１号山王パークタワー３階,2026-06-05,株式会社
株式会社ＩＳＡ,東京都中央区日本橋兜町１７番２号兜町第６葉山ビル４Ｆ,2026-06-05,株式会社
株式会社ＪＩＢ,東京都中央区日本橋兜町９－５－５０８,2026-06-05,株式会社
株式会社ＫＲ,東京都港区南青山２丁目２番１５号ウィン青山９４２,2026-06-05,株式会社
株式会社ＬＯＶＥ２,東京都練馬区南大泉５丁目２１番４９号,2026-06-05,株式会社
株式会社ＬＹＮＫ　ＢＡＳＥ,東京都千代田区内神田２丁目７番１０号神田松楠ビル４階,2026-06-05,株式会社
株式会社Ｌｕｍｉｆａｍ,東京都新宿区戸山２丁目２７番６０７号,2026-06-05,株式会社
株式会社ＭＥＧＵＲＵ,東京都渋谷区恵比寿西２丁目８番４号ＥＸ恵比寿西ビル５Ｆ,2026-06-05,株式会社
株式会社Ｍｉｎｏｖａ,東京都あきる野市野辺１２５５番地９８,2026-06-05,株式会社
株式会社ＮＨＤ,東京都荒川区荒川８丁目７番７号,2026-06-05,株式会社
株式会社ＮａｃａＮａｋａ,東京都墨田区東駒形４丁目６番３号,2026-06-05,株式会社
株式会社Ｎｏｃｔｏ,東京都港区赤坂２丁目１３－１３オレンジビル４Ｆ,2026-06-05,株式会社
株式会社Ｐｅｒｍ　ＡＩ,東京都中央区銀座１丁目１２番４号Ｎ＆ＥＢＬＤ．６Ｆ,2026-06-05,株式会社
株式会社Ｐｌｕｍｅ,東京都渋谷区恵比寿西２丁目８番４号ＥＸ恵比寿西ビル５階,2026-06-05,株式会社
株式会社ＰｕｚｚｌｅＷｏｒｋｓ,東京都杉並区上井草４丁目１６番２５号,2026-06-05,株式会社
株式会社ＲＥＸ,東京都渋谷区本町２丁目２６番１８号,2026-06-05,株式会社
株式会社ＲＩＤＤＬＥ,東京都杉並区高円寺北２丁目３番８号１階,2026-06-05,株式会社
株式会社ＲｅＳｔａｒＴ,東京都渋谷区円山町１６番４号ＬＯＯＰ１３８渋谷３０３,2026-06-05,株式会社
株式会社Ｒｅｆｏｒｚａ,東京都渋谷区渋谷３丁目１３番５－５０７号,2026-06-05,株式会社
株式会社Ｒｏｔｔａ,東京都中央区銀座６丁目４番１６号花椿ビル３Ｆ,2026-06-05,株式会社
株式会社ＳＩＮＯＮ,東京都調布市小島町２丁目２９番地１,2026-06-05,株式会社
株式会社ＳＴ建設,東京都青梅市新町５丁目２９番地の２６,2026-06-05,株式会社
株式会社ＳＴＯＮＥＳＰＡＲＫ,東京都中央区銀座１丁目１２番４号Ｎ＆ＥＢＬＤ．６Ｆ,2026-06-05,株式会社
株式会社ＳＵＲＦＵＰ,東京都目黒区東が丘１丁目２３番４号,2026-06-05,株式会社
株式会社Ｔ　Ｉｎｓｉｇｈｔｓ,東京都渋谷区恵比寿南１丁目４番２号紀伊國屋ビル４階,2026-06-05,株式会社
株式会社ＴＡＫＡＯ設備,東京都江戸川区松江４丁目１７番１４号,2026-06-05,株式会社
株式会社ＴＡＫＵＬＡＮＤ,東京都港区西麻布３丁目２４番２２号第７菊池ビル２Ｆ,2026-06-05,株式会社
株式会社ＴＹＭＥ,東京都渋谷区神宮前５丁目５１番８号ラ・ポルト青山２Ｆ－７,2026-06-05,株式会社
株式会社ＶＯＤＥ,東京都渋谷区神宮前６丁目２３番４号桑野ビル２階,2026-06-05,株式会社
株式会社Ｖｉｉｖｉｉ,東京都三鷹市下連雀３丁目２７番１号三協ビル２階,2026-06-05,株式会社
株式会社ＷＫＷＫ,東京都渋谷区道玄坂１丁目１０番８号渋谷道玄坂東急ビル２Ｆ―Ｃ,2026-06-05,株式会社
株式会社Ｙ,東京都中央区佃２丁目１番２号,2026-06-05,株式会社
株式会社ＺＥＮ　ＮＥＸＴ,東京都中央区築地２丁目７－１２,2026-06-05,株式会社
株式会社ａｎｄ．Ｎ,東京都中央区銀座１丁目１２番４号Ｎ＆ＥＢＬＤ．６Ｆ,2026-06-05,株式会社
株式会社ｆｏｒｅｖｅｒ,東京都中央区湊２丁目１１番１号,2026-06-05,株式会社
株式会社ｒｅｌｙｏｎ,東京都大田区南蒲田３丁目１６－２２日之出ハイツ,2026-06-05,株式会社
淡路島洲本ホテルマネジメント合同会社,東京都千代田区霞が関３丁目２番１号,2026-06-05,合同会社
特定非営利活動法人ワラビーキッズ,東京都目黒区原町２丁目８番１４号,2026-06-05,その他の設立登記法人
芳鈴館株式会社,東京都千代田区神田神保町２丁目１０－３１ＩＷビル１Ｆ,2026-06-05,株式会社
金吉利株式会社,東京都杉並区上高井戸１丁目１７番２９号クレストヒルズ上高井戸１０２号室,2026-06-05,株式会社
２９５６Ｐａｒｔｎｅｒｓ株式会社,東京都杉並区成田東４丁目２１番１２号,2026-06-05,株式会社
ＡＸＩＳ　Ｉｎｔｅｌｌｉｇｅｎｃｅ合同会社,東京都渋谷区道玄坂１丁目１０番８号渋谷道玄坂東急ビル２Ｆ－Ｃ,2026-06-05,合同会社
Ａｎｔｉｆｒａ合同会社,東京都板橋区徳丸７丁目２７番１１－５０２号,2026-06-05,合同会社
ＣＥＬＵＸＩＡ合同会社,東京都中央区日本橋２丁目１６－４ｒｅｍｉｘ日本橋６階,2026-06-05,合同会社
ＣＯＦ２合同会社,東京都千代田区霞が関３丁目２番５号,2026-06-05,合同会社
ＣＳＦ．Ｔ合同会社,東京都板橋区仲町３９番２０号,2026-06-05,合同会社
Ｄ＆Ｄ合同会社,東京都港区東麻布３丁目４番１６号ＡＣＡビル２階,2026-06-05,合同会社
ＥＧ５合同会社,東京都港区六本木１丁目６番１号,2026-06-05,合同会社
ＥＧ６合同会社,東京都港区六本木１丁目６番１号,2026-06-05,合同会社
ＥＮＮＥ　Ｍａｒｋｅｔｉｎｇ　Ｊａｐａｎ株式会社,東京都千代田区霞が関３丁目７－１霞が関東急ビル,2026-06-05,株式会社
ＥＲ３４株式会社,東京都港区六本木１丁目６番１号,2026-06-05,株式会社
ＥＲ３５株式会社,東京都港区六本木１丁目６番１号,2026-06-05,株式会社
ＥＲ３６株式会社,東京都港区六本木１丁目６番１号,2026-06-05,株式会社
ＥＲ３７株式会社,東京都港区六本木１丁目６番１号,2026-06-05,株式会社
ＥＲ３８株式会社,東京都港区六本木１丁目６番１号,2026-06-05,株式会社
ＦＩＮＡＴ株式会社,東京都港区六本木２丁目１番１９号Ｓ－Ｂｕｉｌｄｉｎｇ３階,2026-06-05,株式会社
Ｇ‐Ｂａｓｅ合同会社,東京都中央区銀座１丁目１２―４Ｎ＆ＥＢＬＤ．７階,2026-06-05,合同会社
ＧＬＢ　Ｈｏｌｄｉｎｇｓ合同会社,東京都杉並区南荻窪１丁目３４番２号,2026-06-05,合同会社
ＨＩＮＯＬＩＧＨＴ合同会社,東京都中央区日本橋２丁目１６－４ｒｅｍｉｘ日本橋６Ｆ,2026-06-05,合同会社
ＨｉＪｏＪｏグローバルユニコーン投資法人,東京都千代田区神田錦町３丁目１７番１,2026-06-05,その他の設立登記法人
ＩＣＨＩＤＡ株式会社,東京都千代田区神田松永町１３番地ＶＯＲＴ秋葉原Ⅱ,2026-06-05,株式会社
ＩＮＦＩＮＩＴＡ株式会社,東京都中央区銀座８丁目１０番１７号銀座サザンビル３Ｆ,2026-06-05,株式会社
ＩＮＴＯ　ＪＡＰＡＮ株式会社,東京都中央区銀座１丁目１９－１４銀座ＯＮＥビル６階,2026-06-05,株式会社
Ｉｎｔｅｇｒａ合同会社,東京都渋谷区道玄坂１丁目１０番８号渋谷道玄坂東急ビル２Ｆ－Ｃ,2026-06-05,合同会社
Ｊ‐ＢＥＳＳ５一般社団法人,東京都千代田区内神田１丁目３番７号４０１あすな会計事務所内,2026-06-05,その他の設立登記法人
Ｊ‐ＢＥＳＳ６一般社団法人,東京都千代田区内神田１丁目３番７号４０１あすな会計事務所内,2026-06-05,その他の設立登記法人
Ｊ‐ＢＥＳＳ７一般社団法人,東京都千代田区内神田１丁目３番７号４０１あすな会計事務所内,2026-06-05,その他の設立登記法人
Ｊ‐ＢＥＳＳ８一般社団法人,東京都千代田区内神田１丁目３番７号４０１あすな会計事務所内,2026-06-05,その他の設立登記法人
ＪＤＭ　ＰＲＩＤＥ株式会社,東京都目黒区自由が丘１丁目２３番１２号,2026-06-05,株式会社
ＪＯＵＲＮＥＸ合同会社,東京都中央区日本橋室町１丁目１１番１２号日本橋水野ビル７階,2026-06-05,合同会社
ＫＫ　ＪＡＰＡＮ株式会社,東京都新宿区新宿５丁目１１－３０新宿第五葉山ビル６階６１５号室,2026-06-05,株式会社
Ｋｅｙｓｔｏｎｅ社会保険労務士法人,東京都中央区日本橋茅場町２丁目８番１号ＢＲＩＣＫＧＡＴＥ茅場町Ｂ１Ｆ,2026-06-05,その他の設立登記法人
ＬＳ‐Ａｖｉａｔｉｏｎ　ＮＫ第２号合同会社,東京都港区六本木１丁目６番１号,2026-06-05,合同会社
ＬＳ‐Ａｖｉａｔｉｏｎ第８９号株式会社,東京都港区六本木１丁目６番１号,2026-06-05,株式会社
ＬＳ‐Ａｖｉａｔｉｏｎ第９０号株式会社,東京都港区六本木１丁目６番１号,2026-06-05,株式会社
ＬＳ‐Ａｖｉａｔｉｏｎ第９１号株式会社,東京都港区六本木１丁目６番１号,2026-06-05,株式会社
ＬＳ‐Ａｖｉａｔｉｏｎ第９２号株式会社,東京都港区六本木１丁目６番１号,2026-06-05,株式会社
ＬＳ‐Ａｖｉａｔｉｏｎ第９３号株式会社,東京都港区六本木１丁目６番１号,2026-06-05,株式会社
ＬＳ‐ＹＯＢＩ第１号合同会社,東京都港区六本木１丁目６番１号,2026-06-05,合同会社
Ｌｅ　Ｍｉｌｉｅｕ合同会社,東京都三鷹市井の頭１丁目１１番１号,2026-06-05,合同会社
Ｌｅｇａｍｅコンサルティング株式会社,東京都品川区大崎３丁目５番２号エステージ大崎ビル６階,2026-06-05,株式会社
Ｍ　ＦＡＭＩＬＹ株式会社,東京都千代田区神田小川町３丁目２８番１３号ラフィネ御茶ノ水７０７号,2026-06-05,株式会社
ＭＫＦチート合同会社,東京都江戸川区西葛西５丁目４番６号,2026-06-05,合同会社
ＭＵデジタル資産形成サービス設立準備株式会社,東京都千代田区丸の内１丁目４番５号,2026-06-05,株式会社
Ｑｕｉｎｔｅｔ合同会社,東京都渋谷区代々木４丁目１２番１０号,2026-06-05,合同会社
ＲＡＭ株式会社,東京都千代田区飯田橋３丁目２番４号ＵＮＯビル３階,2026-06-05,株式会社
ＳＰＡＲＳＥ合同会社,東京都港区北青山１丁目３－３三橋ビル３階,2026-06-05,合同会社
Ｔ．Ａ．Ｇ．３株式会社,東京都小金井市関野町１丁目１番１１号,2026-06-05,株式会社
Ｔ．Ａ．Ｇ．４株式会社,東京都小金井市関野町１丁目１番１１号,2026-06-05,株式会社
Ｔ．Ａ．Ｇ．５株式会社,東京都小金井市関野町１丁目１番１１号,2026-06-05,株式会社
ＴＦＰマネジメント合同会社,東京都千代田区神田佐久間町３丁目９番,2026-06-05,合同会社
ＴＯＫＹＯ　ＴＥＣＨ合同会社,東京都中央区銀座１丁目２２番１１号銀座大竹ビジデンス２Ｆ,2026-06-05,合同会社
Ｔｅｃｌｕｍｉｎ株式会社,東京都千代田区神田佐久間町２丁目１８番地１秋葉原ＳＴＮフロント１０階,2026-06-05,株式会社
ＶＩＶＥＮＡ株式会社,東京都渋谷区道玄坂１丁目１９番１２号－６Ｆ,2026-06-05,株式会社
Ｗ　ＦＩＶＥ株式会社,東京都港区南青山３丁目１番３６号,2026-06-05,株式会社
ＷＨＥＳ株式会社,東京都墨田区堤通２丁目７－１０－１３０２,2026-06-05,株式会社
Ｗｈｉｔｅ　ＭＬ合同会社,東京都千代田区霞が関３丁目２番５号,2026-06-05,合同会社
Ｗｈｉｔｅ　Ｍａｐ合同会社,東京都千代田区霞が関３丁目２番５号,2026-06-05,合同会社
Ｗｉｎｅ　Ｌａｂ合同会社,東京都渋谷区代々木４丁目３５‐８,2026-06-05,合同会社
Ｘ　Ｃｏｒｅ株式会社,東京都江戸川区西小岩５丁目１１番２７号,2026-06-05,株式会社
ＹＳ　Ｐｌａｎｎｉｎｇ合同会社,東京都世田谷区太子堂４丁目３０番７号エヌエックスハウス１階,2026-06-05,合同会社
ｍｏｍｅｎｔ株式会社,東京都渋谷区神宮前５丁目５１番８号ラ・ポルト青山２Ｆ,2026-06-05,株式会社
アークリンク株式会社,神奈川県横浜市西区北幸町二丁目１０番４８号むつみビル３階,2026-06-05,株式会社
オムニブレス合同会社,神奈川県横浜市磯子区洋光台５丁目４番３５－５０１号,2026-06-05,合同会社
シースプリング株式会社,神奈川県横浜市瀬谷区五貫目町１０番地８４,2026-06-05,株式会社
マミーネクスト株式会社,神奈川県横浜市西区北幸１丁目１１番１号水信ビル７階,2026-06-05,株式会社
ラクシア合同会社,神奈川県横浜市戸塚区吉田町１６２３番地１５‐１‐１００６号,2026-06-05,合同会社
合同会社エスケイプラント,神奈川県横浜市中区松影町１丁目３－７－３Ｆ,2026-06-05,合同会社
合同会社Ａｍａｌｉａ,神奈川県横須賀市本町３丁目１９番地,2026-06-05,合同会社
合同会社Ｍｉｎａｌｉｓ,神奈川県横浜市西区北幸１丁目１１番１号水信ビル７階,2026-06-05,合同会社
合同会社ＲＯＣＣＡ　ＳＱＵＡＲＥ,神奈川県横浜市港北区綱島東５丁目８番２９号,2026-06-05,合同会社
合同会社ＴｒｉｎｉｔｙＬｉｎｋ,神奈川県横浜市中区大和町２丁目３７番地４Ｆ,2026-06-05,合同会社
合同会社ＵＡ　ＮＩＰＰＯＮ　ＳＨＯＫＡＩ,神奈川県厚木市下依知２丁目１８５番地１,2026-06-05,合同会社
合同会社ＺＡＭＡ,神奈川県三浦郡葉山町一色６４２－９,2026-06-05,合同会社
大野電設有限会社,神奈川県大和市福田２丁目１７番地の１,2026-06-05,有限会社
岩﨑建設株式会社,神奈川県厚木市戸室１丁目７番２７号１０２,2026-06-05,株式会社
株式会社エリーズ,神奈川県横浜市中区吉田町三丁目４番地１Ｆ,2026-06-05,株式会社
株式会社マンション漏水サポート,神奈川県相模原市南区当麻１２７２番地８,2026-06-05,株式会社
株式会社リノコ,神奈川県横浜市南区大岡２丁目３２－７,2026-06-05,株式会社
株式会社リングソリューション,神奈川県横浜市鶴見区馬場４丁目２０番１８－１号,2026-06-05,株式会社
株式会社大花,神奈川県横浜市港北区菊名４丁目９番６号,2026-06-05,株式会社
株式会社Ｌｉｎｋｕｐ,神奈川県横浜市青葉区奈良町２７６２－７１,2026-06-05,株式会社
株式会社ＮＥＸＩＳ,神奈川県横浜市瀬谷区三ツ境１７２番地１２ポロハウスＢコート１０２,2026-06-05,株式会社
株式会社ＮＥＸＵＳ,神奈川県横浜市旭区中希望が丘２１７番地４,2026-06-05,株式会社
株式会社ＮＫ工業,神奈川県横浜市港北区大曽根台２番３２号,2026-06-05,株式会社
株式会社Ｓｏｌａｎａ空調,神奈川県横浜市旭区今宿西町３７０番地１５,2026-06-05,株式会社
株式会社Ｓｐａｃｅ　Ｓｌａｃｋｅｒ,神奈川県横浜市栄区中野町１０６０番地６,2026-06-05,株式会社
行政書士法人Ｎｏｂｌｅ　Ｓｔｒａｔｅｇｙ＆Ｇｌｏｂａｌ,神奈川県横浜市南区高砂町２丁目１９番５号,2026-06-05,その他の設立登記法人
西河商事合同会社,神奈川県中郡大磯町国府本郷２４７―２シャンボール大磯３０９号,2026-06-05,合同会社
ＦＥＳ株式会社,神奈川県川崎市中原区木月３丁目３３－２０,2026-06-05,株式会社
ＭＩアセットマネジメント株式会社,神奈川県川崎市高津区末長１丁目２３番８－５０１号,2026-06-05,株式会社
ＴＨＥ　ＣＯＨ株式会社,神奈川県逗子市逗子７丁目１－５１ナニワビル３Ｆ,2026-06-05,株式会社
Ｗｅｓｔ６６合同会社,神奈川県横浜市港北区菊名２丁目１８‐２４‐１０２,2026-06-05,合同会社
一般社団法人十日町市サッカー協会,新潟県十日町市丸山町９番地３,2026-06-05,その他の設立登記法人
合同会社ユーキリンク,新潟県新潟市中央区上大川前通５番町５６番地１メゾンリビエール１０２,2026-06-05,合同会社
ＧＥＮ合同会社,新潟県三条市月岡３丁目３番４８号,2026-06-05,合同会社
ＧＯＯＤＢＡＳＥ株式会社,新潟県新潟市中央区紫竹山６丁目３－５,2026-06-05,株式会社
合同会社神尾ｗｏｏｄ,石川県野々市市新庄１丁目５３番地２１,2026-06-05,合同会社
株式会社１０１,石川県金沢市此花町５番６号ライフ金沢第１ビル６０１Ａ,2026-06-05,株式会社
株式会社ＬＩＧＨＴ　ＨＵＢ,石川県金沢市小坂町西１３７番地１,2026-06-05,株式会社
株式会社Ｐｌａｎ８,石川県金沢市此花町５番６号ライフ金沢第１ビル６０１Ａ,2026-06-05,株式会社
株式会社ＺＥＳＴ＆ＣＯＭＰＡＮＹ,石川県金沢市木曳野１丁目目１５９番地,2026-06-05,株式会社
株式会社魔法使い,福井県福井市中央１丁目３－５ＦＵＫＵＭＡＣＨＩＢＬＯＣＫ６Ｆ,2026-06-05,株式会社
合同会社華まるＫｉｔｃｈｅｎ,山梨県甲府市下今井町６９６番地７,2026-06-05,合同会社
合同会社ＨＡＧＵＩＲＯ,山梨県南アルプス市上高砂１０２０番地,2026-06-05,合同会社
株式会社ノガワ,山梨県山梨市西１９１９番地,2026-06-05,株式会社
株式会社井上電気,山梨県中央市木原９１２,2026-06-05,株式会社
ミライサク経営企画合同会社,長野県佐久市佐久平駅東６－１佐久クリスタルビル２０１,2026-06-05,合同会社
一般社団法人ジャパンフードフェスタ協会,長野県長野市信州新町新町１３７７番地,2026-06-05,その他の設立登記法人
株式会社信州しがプロジェクト,長野県松本市会田３２４１番地１,2026-06-05,株式会社
株式会社米本りんご農園,長野県伊那市西箕輪４５４６番地１,2026-06-05,株式会社
