法人名,住所,設立日,法人種別
ひまわり株式会社,東京都江戸川区南小岩５丁目１８番８号南小岩レジデンス１０１,2016-07-01,株式会社
みちのくパートナーズ合同会社,青森県八戸市下長２丁目１番３５号,2016-07-01,合同会社
アオキ工業株式会社,埼玉県行田市大字埼玉４２４５番地２,2016-07-01,株式会社
アストラ物流株式会社,大分県日田市大字友田字丸ノ内１８４１番地１,2016-07-01,株式会社
アンノウン・ジャパン株式会社,東京都渋谷区恵比寿南３丁目ｌ番５号マンション南恵比寿,2016-07-01,株式会社
アールエスト合同会社,東京都足立区竹の塚１丁目４０番１５号庄栄ビル５Ｆビジネスポート竹の塚,2016-07-01,合同会社
エムエム工房合同会社,新潟県新潟市西区小針７丁目１０番７号,2016-07-01,合同会社
オフィスワイツー株式会社,大阪府大阪市阿倍野区相生通１丁目４番４０号,2016-07-01,株式会社
コネクトソリューション合同会社,大阪府大阪市北区浮田１丁目３番９号,2016-07-01,合同会社
シー・アイ・エスジャパンビジネスコンサルティング株式会社,東京都港区芝２丁目３番１８号ＹＭ芝公園ビル３階,2016-07-01,株式会社
ジェイ・エイチ・エル株式会社,愛知県名古屋市名東区藤里町１２０１番地,2016-07-01,株式会社
ジェーケー合同会社,埼玉県入間市扇町屋１丁目１１番１４号入間ＧコートＡ－５,2016-07-01,合同会社
スリースマイル株式会社,岡山県真庭市湯原温泉１００番地,2016-07-01,株式会社
チサンマンション大分駅南管理組合,大分県大分市大道町５丁目４－６０,2016-07-01,その他
テリフィーク株式会社,埼玉県川口市西川口３丁目９番１２,2016-07-01,株式会社
トロンフォーラム,東京都品川区西五反田２丁目１２－３ＹＲＰユビキタス・ネットワーキング研究所内,2016-07-01,その他
ドリアン・ソリューションズ合同会社,愛知県名古屋市東区砂田橋２丁目１番Ｃ－１１０８号,2016-07-01,合同会社
ナラティブホーム＆ケア株式会社,神奈川県鎌倉市長谷２丁目１３番地４７号,2016-07-01,株式会社
ニコア・マーケティング株式会社,東京都渋谷区桜丘町２番３号,2016-07-01,株式会社
ニシキトレード株式会社,埼玉県さいたま市北区奈良町９０番地４,2016-07-01,株式会社
ネクストアドバンス株式会社,山形県酒田市日の出町１丁目４番地の１１,2016-07-01,株式会社
ハウスプランニング株式会社,新潟県柏崎市長峰町８番１９－１０５号,2016-07-01,株式会社
ハウスリンカーズ株式会社,東京都港区西麻布１丁目１１－６ホテル＆レジデンス六本木７０９号,2016-07-01,株式会社
ハヤシオートガラス株式会社,愛知県名古屋市港区知多２丁目２４０５番地,2016-07-01,株式会社
メディカルプラス合同会社,東京都新宿区大久保３丁目８番３－２５１４号,2016-07-01,合同会社
ロックウィル株式会社,東京都港区新橋２丁目１２番１号,2016-07-01,株式会社
ワイアイマネジメント合同会社,神奈川県横浜市港北区新横浜２丁目１４番地６,2016-07-01,合同会社
一般社団法人インターナショナルメディカルアロマスクール,東京都板橋区本町２７番９号,2016-07-01,その他の設立登記法人
一般社団法人グローアップアリーナ,神奈川県横浜市瀬谷区三ツ境１０番地７,2016-07-01,その他の設立登記法人
一般社団法人ヘルスワン,東京都調布市多摩川２丁目２５番地１,2016-07-01,その他の設立登記法人
一般社団法人全日本ノルディック・ウォーク連盟大阪東支部,大阪府富田林市若松町西１丁目１８２１番地６,2016-07-01,その他の設立登記法人
一般社団法人地方創生推進機構,兵庫県淡路市岩屋９２４番地１,2016-07-01,その他の設立登記法人
一般社団法人希望のくじら,福島県伊達市梁川町字大門道３２番地２,2016-07-01,その他の設立登記法人
一般社団法人曽爾村農林業公社,奈良県宇陀郡曽爾村大字今井４９５番地の１,2016-07-01,その他の設立登記法人
一般社団法人末広共有地組合,徳島県徳島市福島２丁目４番６号,2016-07-01,その他の設立登記法人
一般社団法人核兵器廃絶ひろしま将来世代フォーラム,広島県広島市東区牛田本町５丁目１番１３号,2016-07-01,その他の設立登記法人
一般社団法人武蔵野はなケアクリニック内科歯科,東京都武蔵野市八幡町３丁目１番２５号,2016-07-01,その他の設立登記法人
一般社団法人水産業構造改革サポート,東京都千代田区内神田１丁目１番１２号,2016-07-01,その他の設立登記法人
一般社団法人田﨑ホールディングス,佐賀県佐賀市伊勢町８番１２号,2016-07-01,その他の設立登記法人
一般社団法人社会心理研究所,東京都世田谷区三軒茶屋１丁目１０番５号,2016-07-01,その他の設立登記法人
一般社団法人竹澤アセットマネジメント,大阪府大阪市東住吉区北田辺４丁目２番２６号,2016-07-01,その他の設立登記法人
一般社団法人ＦＡＣＰ日本,東京都港区西麻布２丁目２０番１６号株式会社アスペン内,2016-07-01,その他の設立登記法人
一般財団法人エフテック奨学財団,埼玉県久喜市菖蒲町昭和沼１９番地,2016-07-01,その他の設立登記法人
一般財団法人情報法制研究所,東京都文京区弥生２丁目１１番１６号,2016-07-01,その他の設立登記法人
三光建設株式会社,宮城県仙台市泉区上谷刈２丁目１番１５号,2016-07-01,株式会社
三栄住建株式会社,大阪府大阪市西区新町１丁目４番３０号新町ピーオービル２０１号,2016-07-01,株式会社
中央商事株式会社,栃木県宇都宮市若松原１丁目２５番３０号,2016-07-01,株式会社
中盛商事合同会社,東京都渋谷区道玄坂２丁目２８番２号ＭＭビル２Ｆ,2016-07-01,合同会社
井上電工株式会社,広島県広島市安佐南区伴東８丁目７６番８号,2016-07-01,株式会社
伸美テクノス株式会社,兵庫県高砂市米田町米田８番地の１,2016-07-01,株式会社
信栄化成商事株式会社,大阪府高槻市真上町５丁目４５番１３号,2016-07-01,株式会社
健康美株式会社,千葉県船橋市高瀬町４１番地１,2016-07-01,株式会社
力娃合同会社,東京都品川区勝島１丁目３番４９号,2016-07-01,合同会社
医療法人社団聖医会,京都府京都市左京区北白川上池田町１２番地,2016-07-01,その他の設立登記法人
千秋株式会社,大阪府大阪市北区太融寺町２番２１号ニュープラザビル２０１号室,2016-07-01,株式会社
南信工業株式会社,埼玉県所沢市大字牛沼２８番地１Ｂ－１０１,2016-07-01,株式会社
南日本電装株式会社,大分県大分市大字青崎３番地の１,2016-07-01,株式会社
南海総合管理株式会社,福岡県みやま市高田町江浦７６５番地２,2016-07-01,株式会社
古江漁業協同組合,三重県尾鷲市古江町６３７番地の１０,2016-07-01,その他の設立登記法人
合同会社からさわ,石川県金沢市藤江南１丁目１０２番地,2016-07-01,合同会社
合同会社ふぉーてぃ,埼玉県越谷市大字南荻島８６９番地１８,2016-07-01,合同会社
合同会社アップスリー,神奈川県横浜市港北区新羽町６４３－３－１０２,2016-07-01,合同会社
合同会社イシハラフーズ,福岡県筑紫野市上古賀１丁目２０番４３－４０６号,2016-07-01,合同会社
合同会社エナジー,愛知県名古屋市中川区法華西町７１番地ラ・カシータ３０２号,2016-07-01,合同会社
合同会社エベレスト,大阪府大阪市都島区毛馬町２丁目１番１４号５階,2016-07-01,合同会社
合同会社オオサカ・リノベイト,大阪府摂津市鳥飼西３丁目１３番１号,2016-07-01,合同会社
合同会社オートマックス,千葉県八街市榎戸４１６番地１－２１Ｊ,2016-07-01,合同会社
合同会社オーバーレイ,東京都三鷹市上連雀４丁目２６番１９号コーポ鷹１０１,2016-07-01,合同会社
合同会社カーザ・ボーノ,愛知県名古屋市北区楠４丁目１４２番地,2016-07-01,合同会社
合同会社クレアｃａｒｅ,北海道河東郡音更町中鈴蘭南３丁目８番地１０,2016-07-01,合同会社
合同会社ケイアイシステム,神奈川県海老名市杉久保北２丁目３番２３号,2016-07-01,合同会社
合同会社シンクシングス,千葉県市川市菅野１丁目７番２６－２０１号,2016-07-01,合同会社
合同会社スリーエス工業,鹿児島県鹿児島市郡山町２４３７番地,2016-07-01,合同会社
合同会社ドライブ,岐阜県岐阜市西中島５丁目６の２３,2016-07-01,合同会社
合同会社ハートアンドハンド,兵庫県姫路市城北新町２丁目１５番６号,2016-07-01,合同会社
合同会社フレンドリー,愛知県春日井市関田町２丁目１９７番地,2016-07-01,合同会社
合同会社プレジールジョワ,愛知県名古屋市瑞穂区下坂町２丁目１７番地,2016-07-01,合同会社
合同会社ミートＡＯＫＩ,愛知県北名古屋市熊之庄古井５番地２,2016-07-01,合同会社
合同会社リマ,東京都杉並区高井戸東３丁目２８番２号パルデンス高井戸１０４,2016-07-01,合同会社
合同会社リュドール,埼玉県所沢市小手指町１丁目７番地小手指ハイツＣ－５１３,2016-07-01,合同会社
合同会社ヴィヴィッドキッズサポート,北海道札幌市南区澄川一条２丁目７番１－１０２号,2016-07-01,合同会社
合同会社三久,青森県弘前市大字田園２丁目１－２バニアン・ユウ２０１号室,2016-07-01,合同会社
合同会社南条,沖縄県那覇市首里当蔵町１丁目１１番地２４,2016-07-01,合同会社
合同会社幸福の窓,大分県大分市新貝７番１３号,2016-07-01,合同会社
合同会社日光,千葉県船橋市緑台２丁目８番６号,2016-07-01,合同会社
合同会社松山事務商事,愛媛県松山市平和通２丁目１番地６,2016-07-01,合同会社
合同会社水色,京都府京都市中京区壬生朱雀町２９番地７プリオーレ２７二条駅前Ｋ－１,2016-07-01,合同会社
合同会社肥後才谷屋,熊本県熊本市北区龍田２丁目３４番２号,2016-07-01,合同会社
合同会社花ｚｏｋｕ,秋田県大仙市花館上町１５番４５－３号,2016-07-01,合同会社
合同会社茶屋ヶ坂アーバン,愛知県名古屋市千種区上野１丁目１４番１１号,2016-07-01,合同会社
合同会社野村会計事務所,神奈川県川崎市多摩区登戸３２４３番地１クレストフォルム登戸５０３号室,2016-07-01,合同会社
合同会社ＡＳＡＨＩ,奈良県生駒郡平群町上庄３丁目１５番３０号,2016-07-01,合同会社
合同会社Ｂｅａｃｈｓｉｄｅ,東京都世田谷区宮坂３丁目５０番１５号,2016-07-01,合同会社
合同会社Ｃｌｅａｒ　Ｂｒｉｄｇｅ　Ａｓｓｅｔ　Ｍａｎａｇｅｍｅｎｔ,大阪府大阪市北区梅田１丁目１番３号,2016-07-01,合同会社
合同会社Ｄ・Ｈ・Ｄ,埼玉県川越市旭町２丁目１０番地１０ＶＩＰ１０１号室,2016-07-01,合同会社
合同会社ＤＮＥ,青森県五所川原市字川端町５０番１号ＡＫビル１－６,2016-07-01,合同会社
合同会社Ｄｏｇｇｉｅｓ９１１,長崎県佐世保市木場田町１０－１５,2016-07-01,合同会社
合同会社ＥＡＣＬ－ＪＡＰＡＮ,東京都港区東麻布２丁目２８番４号,2016-07-01,合同会社
合同会社ＨＡＧファミリーグループ,佐賀県西松浦郡有田町南原甲２３５番地２,2016-07-01,合同会社
合同会社Ｌａｔｉｔｕｄｅ３５,茨城県取手市新町２丁目２番１８号明日香ビル５０１,2016-07-01,合同会社
合同会社Ｐｒｅｃｉｏｕｓ,千葉県千葉市中央区富士見２丁目２１番９号しんなかビル３階,2016-07-01,合同会社
合同会社ＲＩＴＯＲＩ,東京都渋谷区神南１丁目１１番５－１２０２号,2016-07-01,合同会社
合同会社ｅｎｓｅｍｂｌｅ,東京都江戸川区西瑞江４丁目１４番地５５,2016-07-01,合同会社
合同会社ｆｕｔｕｒｅ　ｈｏｕｓｅ,東京都杉並区高円寺南５丁目１７番３号,2016-07-01,合同会社
合同会社ｔ－ｓｔｙｌｅグループ,宮崎県都城市大王町２１－１,2016-07-01,合同会社
天和偉業株式会社,山形県天童市東長岡１丁目１番４８号,2016-07-01,株式会社
寿建設株式会社,東京都江戸川区西葛西３丁目１６番１７号,2016-07-01,株式会社
小山工業株式会社,東京都墨田区立川２丁目１０番８号,2016-07-01,株式会社
山野辺興業株式会社,福島県いわき市小名浜下神白字千速１０番地の５,2016-07-01,株式会社
平和測量株式会社,兵庫県神戸市中央区磯辺通３丁目１番２ー８０３,2016-07-01,株式会社
慶美貿易株式会社,埼玉県戸田市笹目２丁目２３番地２０,2016-07-01,株式会社
新日綜合警備株式会社,岡山県瀬戸内市長船町牛文７９６－１,2016-07-01,株式会社
日本コラーゲン株式会社,福岡県福岡市博多区麦野４丁目３６番３０号,2016-07-01,株式会社
日本龍福株式会社,愛知県名古屋市東区東桜２丁目１７番２５号レジディア東桜Ⅱ２０７,2016-07-01,株式会社
春利株式会社,神奈川県川崎市麻生区王禅寺東４丁目１番１４号,2016-07-01,株式会社
木下工業株式会社,和歌山県和歌山市杭ノ瀬２５４番地２シャーメゾンセレナ２０６号,2016-07-01,株式会社
杏合同会社,宮城県仙台市太白区中田１丁目１４番４５号オークス南仙台３０１,2016-07-01,合同会社
東鈴株式会社,佐賀県佐賀市呉服元町７番１９号５０５,2016-07-01,株式会社
株式会社あおやまライフクリエイト,兵庫県神戸市中央区磯辺通２丁目２番１０号ワンノットトレーズビル,2016-07-01,株式会社
株式会社ありがとう上山,神奈川県藤沢市朝日町１２番地の１,2016-07-01,株式会社
株式会社いこい,東京都大田区南千束２丁目１７番１号,2016-07-01,株式会社
株式会社そらち,神奈川県横浜市南区堀ノ内町１丁目４番地１山田ビル３０１号,2016-07-01,株式会社
株式会社なす事務所,愛知県豊橋市湊町１３２番地２,2016-07-01,株式会社
株式会社はぐくみ,大阪府大阪市西区新町１丁目２０番６号,2016-07-01,株式会社
株式会社はなん,群馬県高崎市昭和町１５８番地１７,2016-07-01,株式会社
株式会社まんだら,兵庫県尼崎市元浜町５丁目４３番地の２,2016-07-01,株式会社
株式会社アオイドス,茨城県龍ケ崎市長山３丁目４番地２１,2016-07-01,株式会社
株式会社アクロサーブ,大阪府富田林市山中田町１丁目１７番１７－１号,2016-07-01,株式会社
株式会社アッドライン,福岡県福岡市東区唐原５丁目１番４７号,2016-07-01,株式会社
株式会社アンスピレ,東京都港区南青山５丁目３番１０号,2016-07-01,株式会社
株式会社アヴァンセ,愛知県春日井市小野町５丁目８７番地１６,2016-07-01,株式会社
株式会社アーステクノロジー,埼玉県狭山市大字中新田１０８３番地の３,2016-07-01,株式会社
株式会社アール・シー・コンサルティング,東京都港区虎ノ門２丁目７番１６号,2016-07-01,株式会社
株式会社イーグル,北海道札幌市北区新川四条８丁目９番１０号,2016-07-01,株式会社
株式会社ウイン,埼玉県さいたま市北区大成町二丁目４８２番地,2016-07-01,株式会社
株式会社エストレヤ,東京都豊島区巣鴨１丁目１８番９号,2016-07-01,株式会社
株式会社エムアイエス,神奈川県横浜市都筑区北山田２丁目５番７号プロスベアーコーポ１階,2016-07-01,株式会社
株式会社エモション,東京都台東区三筋１丁目５番５号,2016-07-01,株式会社
株式会社カネダ,茨城県常陸太田市稲木町８９５番地の３,2016-07-01,株式会社
株式会社クレアス,愛知県尾張旭市狩宿町４丁目５１番地,2016-07-01,株式会社
株式会社グッドライフ,群馬県渋川市阿久津１３４番地３,2016-07-01,株式会社
株式会社グラスト,東京都江東区亀戸５丁目６番２１号４Ｆ－３５,2016-07-01,株式会社
株式会社グリーンウッド,愛知県名古屋市西区浅間２丁目１４番３０号,2016-07-01,株式会社
株式会社グリーンリバース,埼玉県川口市差間３丁目１８番９号,2016-07-01,株式会社
株式会社サンゼン,愛知県豊田市木瀬町横枕２９５番地６,2016-07-01,株式会社
株式会社サンレールホールディングス,岐阜県不破郡垂井町表佐４６３０番地の３,2016-07-01,株式会社
株式会社シグナルプラス,岡山県岡山市中区原尾島２丁目２番５号,2016-07-01,株式会社
株式会社シンシア,愛知県犬山市大字羽黒字大見下１番地１,2016-07-01,株式会社
株式会社ジェイビーイー,神奈川県南足柄市壗下１０１７番地９,2016-07-01,株式会社
株式会社スタンダードランドスケープデザイン,神奈川県相模原市南区相南２丁目４番３４号,2016-07-01,株式会社
株式会社スマーティージャパン,東京都新宿区住吉町７番３号サンライズビル３０２号,2016-07-01,株式会社
株式会社セカンドドア,東京都大田区南千束２丁目２５番１７－１０５号,2016-07-01,株式会社
株式会社タマリデザイン研究所,奈良県奈良市朱雀５丁目１７番地の５,2016-07-01,株式会社
株式会社タンシキ,神奈川県川崎市多摩区登戸２２８３番地１Ｆ,2016-07-01,株式会社
株式会社ティーエス,愛知県春日井市南下原町４丁目６番地６,2016-07-01,株式会社
株式会社トイスペースカンパニー,神奈川県川崎市麻生区万福寺４丁目１９番１－８３２号,2016-07-01,株式会社
株式会社トラセット,東京都目黒区目黒本町６丁目１９番１４号,2016-07-01,株式会社
株式会社ドゥ保険サービス,東京都世田谷区新町２丁目２８番１９号,2016-07-01,株式会社
株式会社ドリームガーデン昭楽園,愛知県西尾市市子町下川田５４番地２,2016-07-01,株式会社
株式会社ドロップ,岡山県岡山市南区当新田３６９番地１７,2016-07-01,株式会社
株式会社ナカムラ,三重県桑名市大字増田５３３番地１,2016-07-01,株式会社
株式会社ニケ,埼玉県児玉郡神川町大字新里４９５番地３,2016-07-01,株式会社
株式会社ニシムラ総合農林業,愛知県新城市平井字若杉３番地１０,2016-07-01,株式会社
株式会社ネクスタ,千葉県千葉市若葉区西都賀３丁目８番８号,2016-07-01,株式会社
株式会社ハートアース,千葉県市川市八幡３丁目３番２－９０１号（グランドターミナルタワー本八幡）,2016-07-01,株式会社
株式会社パットワークス,埼玉県さいたま市見沼区大字膝子３２５番地１,2016-07-01,株式会社
株式会社ビッドグリード,愛知県岡崎市上和田町字上川田１３番地,2016-07-01,株式会社
株式会社フォーチュンインターナショナル,大阪府大阪市中央区備後町２丁目４番１３号,2016-07-01,株式会社
株式会社フックチイ,東京都青梅市新町８丁目２２番地の１２,2016-07-01,株式会社
株式会社フューチャーリーディング,東京都豊島区南池袋１丁目１６番２０号ぬかりやビル６Ｆ,2016-07-01,株式会社
株式会社ブライト,神奈川県川崎市川崎区日進町２７番地１８－１Ｆ,2016-07-01,株式会社
株式会社ブレインズ,神奈川県横浜市鶴見区上の宮１丁目７番７号,2016-07-01,株式会社
株式会社ベルプリュム,千葉県千葉市緑区おゆみ野中央６丁目５０番地５,2016-07-01,株式会社
株式会社ホワイトパイン,神奈川県横浜市中区不老町１丁目２番地１中央第６関内ビル３０２号室,2016-07-01,株式会社
株式会社ボデーショップ野呂,愛知県瀬戸市上水野町６０７番地,2016-07-01,株式会社
株式会社ミルクジャム,兵庫県神戸市中央区元町通３丁目１７番６号,2016-07-01,株式会社
株式会社ヤドリギ,東京都品川区東品川２丁目２番２８号２階,2016-07-01,株式会社
株式会社ラビングホーム,兵庫県芦屋市伊勢町５番２８－２０３号,2016-07-01,株式会社
株式会社ランフィ・ジャパン,東京都中央区日本橋富沢町１１番１５号,2016-07-01,株式会社
株式会社リアルパートナー,福岡県糟屋郡新宮町花立花１丁目４番６号,2016-07-01,株式会社
株式会社リバーサイド,東京都渋谷区神泉町１５－１７,2016-07-01,株式会社
株式会社ルーポ,東京都墨田区横川３丁目１－４,2016-07-01,株式会社
株式会社レーブ,佐賀県佐賀市駅前中央３丁目１６番２６－１３０２号オーヴィジョン夢咲西,2016-07-01,株式会社
株式会社ワンズテック,愛知県名古屋市中区正木４丁目８番７号,2016-07-01,株式会社
株式会社ヴァンセット,奈良県香芝市穴虫１０３０番地,2016-07-01,株式会社
株式会社一和,福岡県久留米市御井朝妻１丁目６番１１号,2016-07-01,株式会社
株式会社七輪ホールディングス,大阪府茨木市田中町１８番２３号,2016-07-01,株式会社
株式会社三栄防災,大分県宇佐市大字四日市２１２９番地の５,2016-07-01,株式会社
株式会社優寿,鹿児島県鹿屋市新栄町２番１４号,2016-07-01,株式会社
株式会社光喜,千葉県市川市福栄３丁目２番５－４０２号,2016-07-01,株式会社
株式会社創心,埼玉県三郷市高州１丁目８８番地６,2016-07-01,株式会社
株式会社創美匠,神奈川県茅ヶ崎市赤羽根４５６番地１ベルジャヤコートＡ号室,2016-07-01,株式会社
株式会社名古屋合同会計,愛知県名古屋市中区丸の内２丁目２０番２号,2016-07-01,株式会社
株式会社唐津海のまちづくり公社,佐賀県唐津市久里７９１番地４,2016-07-01,株式会社
株式会社圭商ゴルフ倶楽部,福島県東白川郡棚倉町大字瀬ケ野字戸沢１６６番地,2016-07-01,株式会社
株式会社奥崎発電所,青森県青森市大字油川字浪返２４番地９,2016-07-01,株式会社
株式会社富士正,山梨県甲府市里吉２丁目５番７号,2016-07-01,株式会社
株式会社富士河口湖霊園,山梨県南都留郡山中湖村山中４６６番地,2016-07-01,株式会社
株式会社小茄子川ファーム,北海道川上郡標茶町字虹別原野六十線１０６番地１４,2016-07-01,株式会社
株式会社幸原建設,大分県別府市大字野田１１７番地和田組ビル１０１号,2016-07-01,株式会社
株式会社成和工業,鹿児島県鹿児島市坂之上５丁目２１番１号,2016-07-01,株式会社
株式会社日本エナジー,岐阜県岐阜市中鶉４丁目１４番地３,2016-07-01,株式会社
株式会社日本想建設,佐賀県佐賀市中央本町４番２０号三山ビル３０２,2016-07-01,株式会社
株式会社早瀬,愛知県名古屋市中川区長良町３丁目８４番地,2016-07-01,株式会社
株式会社昇実,東京都新宿区愛住町２２,2016-07-01,株式会社
株式会社時遊人,長野県松本市大字今井字市道西６１８５番３,2016-07-01,株式会社
株式会社望月組,群馬県渋川市赤城町栄５４８番地５,2016-07-01,株式会社
株式会社樹幸,埼玉県越谷市南越谷４丁目８番地９,2016-07-01,株式会社
株式会社樹来,千葉県柏市大井９３４番地２,2016-07-01,株式会社
株式会社江幡内装,茨城県水戸市堀町１３５６番地１２,2016-07-01,株式会社
株式会社洛ｒｅＸ,京都府京都市上京区油小路通一条上る元百万遍町５４３番地８,2016-07-01,株式会社
株式会社海遊,大分県杵築市大字猪尾６３番地１,2016-07-01,株式会社
株式会社田中造園,山梨県甲府市千塚３丁目１番１６号,2016-07-01,株式会社
株式会社貝沼通信,新潟県燕市長所９４６番地１７,2016-07-01,株式会社
株式会社貴美,栃木県足利市江川町２丁目２２番地１５ＣＩＴＹ倶楽部江川１０２号室,2016-07-01,株式会社
株式会社造形センター,東京都千代田区飯田橋３丁目７番１４号,2016-07-01,株式会社
株式会社遠空,愛知県豊橋市曙町字宮前６８番地の１,2016-07-01,株式会社
