法人名,住所,設立日,法人種別
ＬＵＮＯＣＯ株式会社,大阪府大阪市浪速区恵美須西３丁目８－８ホワイティＫＩＭＩ２０３号室,2026-05-13,株式会社
Ｌｕａｎｈｕｉ　Ｔｅｃｈｎｏｌｏｇｙ　Ｃｏ．，Ｌｔｄ．（Ｓｈｅｎｚｈｅｎ）,,2026-05-13,外国会社等
Ｌｕｍｅ合同会社,大阪府茨木市北春日丘２丁目１０番４号の１５,2026-05-13,合同会社
Ｌｕｘ　Ｃｏｖｅｒ株式会社,神奈川県藤沢市並木台２丁目５番地の１４,2026-05-13,株式会社
Ｍ’ｓ　ｃｒｅｗ合同会社,三重県桑名市大字額田２０３０番地２２,2026-05-13,合同会社
Ｍ．Ａ．ホールディングス株式会社,愛知県豊田市幸町公文所１０番地の１,2026-05-13,株式会社
ＭＫ株式会社,埼玉県比企郡吉見町大字長谷１６４３番地３３,2026-05-13,株式会社
ＭＯＣＡＳ　ＡＲＣＨＩＴＥＣＴＳ株式会社,京都府京都市下京区仏光寺通烏丸東入上柳町３４４番地１,2026-05-13,株式会社
ＭＲＦマネジメント合同会社,東京都中野区中央４丁目４８番４号,2026-05-13,合同会社
ＭＹＥＲＳ，Ｐ．Ｃ．，ＡＳＨＩＬＥＩＧＨ,,2026-05-13,外国会社等
Ｎ．Ｉ．Ａ株式会社,東京都渋谷区神宮前２丁目１３－９ＢＩＲＴＨ神宮前４０５,2026-05-13,株式会社
ＮＥＸＵＳ株式会社,東京都中央区銀座６丁目１３番１６号銀座ＷａｌｌビルＵＦＣ５階,2026-05-13,株式会社
ＯＥＣ株式会社,千葉県船橋市葛飾町２丁目３８０番地２,2026-05-13,株式会社
ＯＦＦＩＣＥ　ＭＩＦＡＨ合同会社,神奈川県横浜市南区前里町１丁目２５番地,2026-05-13,合同会社
ＯＬＬ株式会社,京都府京都市中京区七軒町４６６番地,2026-05-13,株式会社
ＯＵＴＮｏ．ＤＥ株式会社,宮城県仙台市青葉区栗生１丁目１７番地の２２,2026-05-13,株式会社
Ｏｄｄｂｅａｔｚ合同会社,東京都渋谷区道玄坂１丁目１０番８号渋谷道玄坂東急ビル２Ｆ－Ｃ,2026-05-13,合同会社
Ｏｎ．ｄｅｓｉｇｎ合同会社,東京都世田谷区船橋６丁目１番１０－２０１号,2026-05-13,合同会社
Ｏｒｉｃｈｉ医療機器株式会社,和歌山県和歌山市梅原５７９番地８,2026-05-13,株式会社
ＰＥＡＣＥ　Ｇｒｏｕｐ株式会社,青森県八戸市大字湊町字大沢２８番地１４３,2026-05-13,株式会社
Ｐａｃｉｆｉｃ　Ｎｅｔｗｏｒｋ合同会社,東京都港区麻布十番２丁目２－５－７０１,2026-05-13,合同会社
Ｐａｌａｄｅａｌ　Ｊａｐａｎ　Ｇｒｏｗｔｈ株式会社,東京都港区赤坂２丁目２２番２０－２０１号,2026-05-13,株式会社
Ｐｅａｋｓ　Ｌｉｎｋ合同会社,愛知県名古屋市緑区鳴丘２丁目２２２７,2026-05-13,合同会社
ＲＡＺＡＶＩＬＡＲ　Ｐ．Ａ．，ＰＥＪＭＡＮ,,2026-05-13,外国会社等
ＲＩＳＥＣＯＲＥ株式会社,大阪府大阪市浪速区日本橋４丁目１０番１１号ＧＯＯＮＩＥＳＢｌｄｇ．,2026-05-13,株式会社
ＲＫ商事株式会社,茨城県東茨城郡茨城町大字大戸字清宗２７８０－５,2026-05-13,株式会社
ＲＬＣ合同会社,群馬県前橋市大友町３丁目１５番地３１,2026-05-13,合同会社
ＲＵＨＬＡＮＤ　Ｐ．Ｃ．，ＡＭＹ　Ｌ．,,2026-05-13,外国会社等
ＳＡＫＩＨＡＭＡ株式会社,和歌山県和歌山市松島５４７－１２ラポルト松島１０１,2026-05-13,株式会社
ＳＡＲＴＯ合同会社,京都府京都市下京区朱雀宝蔵町４４番地協栄ビル２階京都朱雀スタジオＡＸ－２０８,2026-05-13,合同会社
ＳＣエンジニア合同会社,千葉県市原市ちはら台西６丁目２４番地３５,2026-05-13,合同会社
ＳＥＭＩ　ＢＧＭ合同会社,神奈川県川崎市幸区戸手４丁目１０番２－１９０２号,2026-05-13,合同会社
ＳＥＲＲＡ，Ｐ．Ｃ．，ＡＬＥＳＳＡＮＤＲＯ　Ｓ．,,2026-05-13,外国会社等
ＳＨＥＤＳ株式会社,大分県大分市古国府１丁目３番７７号,2026-05-13,株式会社
ＳＩＮＯＳ株式会社,東京都渋谷区恵比寿２丁目２８番１１号センチュリープラザ２０１,2026-05-13,株式会社
ＳＫアール札幌株式会社,北海道札幌市西区発寒十条１４丁目１０６８番地６,2026-05-13,株式会社
Ｓａｎｃｔｕｓ　Ｃａｐｉｔａｌ株式会社,神奈川県横浜市磯子区磯子台２７番Ｂ－４０１号,2026-05-13,株式会社
Ｓｈｅｎｚｈｅｎ　Ｐｕｎａｓｉ　Ｅ－Ｃｏｍｍｅｒｃｅ　Ｃｏ．Ｌｔｄ．,,2026-05-13,外国会社等
Ｓｈｅｎｚｈｅｎ　Ｙｕｎｚｈｉｙｕａｎ　Ｔｅｃｈｎｏｌｏｇｙ　Ｃｏ．Ｌｔｄ．,,2026-05-13,外国会社等
Ｔ＆Ｎクリエイティブ合同会社,東京都江東区東雲１丁目６番１５－２０２号,2026-05-13,合同会社
ＴＨＩＥＮ　ＨＡグローバル合同会社,徳島県徳島市東新町１丁目１６－５,2026-05-13,合同会社
ＴＯＭＩ合同会社,東京都中央区銀座１丁目１２番４号Ｎ＆ＥＢＬＤ．６Ｆ,2026-05-13,合同会社
ＴＲ株式会社,兵庫県西宮市鳴尾町４丁目２番１８号,2026-05-13,株式会社
ＴＳＳ株式会社,大阪府八尾市弓削町南２丁目２９番地の１２,2026-05-13,株式会社
ＴＵＲＴＬＩＯＮ　ＲＥＡＬＴＹ　ＰＴＥ．ＬＴＤ．,,2026-05-13,外国会社等
Ｔｈｅ　Ｅｄｉｔ　ＮＹ株式会社,東京都渋谷区桜丘町２６番１号セルリアンタワー１５階,2026-05-13,株式会社
Ｔｈｅ　Ｏｎｃｅ合同会社,北海道札幌市北区新川五条１６丁目４－１８,2026-05-13,合同会社
Ｔｏｔｓｕ　Ｂｉｚ　Ａｚａｂｕｄａｉ合同会社,東京都中央区日本橋１丁目４番１号,2026-05-13,合同会社
ＵＵＭ株式会社,沖縄県中頭郡北谷町字吉原７４６番地１０,2026-05-13,株式会社
Ｕｎｉｍｏ合同会社,神奈川県川崎市中原区小杉町１丁目５２９番地２Ｋ＆Ｗガーデン６０２,2026-05-13,合同会社
Ｕｒａｓｈｉｍａ　ｐｌａｎｔ株式会社,千葉県木更津市港南台１丁目２６番地８,2026-05-13,株式会社
Ｖｏｉｔｈ　Ｈｙｄｒｏ　Ｓ．Ｒ．Ｌ．,,2026-05-13,外国会社等
ＷＡＮＺＩ　ＪＩＵＨＵＩ　ＣＯＭＰＡＮＹ　ＬＩＭＩＴＥＤ,,2026-05-13,外国会社等
ＷＥＭＬＡ株式会社,大阪府大阪市天王寺区松ケ鼻町１１番６号,2026-05-13,株式会社
ＷｏｎＵｐ　ＧＲＯＵＰ株式会社,青森県弘前市大字三岳町１２番地８,2026-05-13,株式会社
ＸＵＡＮ　ＷＥＩ　ＲＥＳＯＵＲＣＥＳ合同会社,栃木県下都賀郡壬生町大字上稲葉１７７０番地２,2026-05-13,合同会社
Ｙ‐ＭＡＸ株式会社,東京都足立区六木１丁目１７番４号,2026-05-13,株式会社
ＹＡＮＡＧＩＥ合同会社,大阪府大阪市北区梅田２丁目２番２号ヒルトンプラザウエストオフィスタワー１９階,2026-05-13,合同会社
ＹＴアセット株式会社,千葉県船橋市海神２丁目１１番１２－５号,2026-05-13,株式会社
ＹＹホールディングス株式会社,愛知県名古屋市瑞穂区鍵田町１丁目８番地,2026-05-13,株式会社
Ｙａｍａｔｏ　Ｗｏｒｋｓ株式会社,岡山県備前市東片上４８７番地１－１０２,2026-05-13,株式会社
Ｙｏｕｒｚｚ株式会社,大阪府大阪市北区梅田１丁目２番２号大阪駅前第２ビル１２－１２,2026-05-13,株式会社
ｌｅｍｉｉ株式会社,東京都世田谷区上北沢１丁目１６番２号,2026-05-13,株式会社
ｎｉｎａｒｕ合同会社,東京都武蔵村山市大南３丁目１０－１１,2026-05-13,合同会社
ｓｈｅｎｚｈｅｎｓｈｉｑｉｕｈｅｄｉａｎｚｉｓｈａｎｇｗｕｙｏｕｘｉａｎｇｏｎｇｓｉ,,2026-05-13,外国会社等
ｓｈｉｎｎｉｃｈｉ　ｉｎｖｅｓｔｍｅｎｔ　ｐｔｅ．ｌｔｄ,,2026-05-13,外国会社等
ｔｅｄａｃｏｒｅ株式会社,沖縄県浦添市牧港４丁目１１番３号,2026-05-13,株式会社
ｔｈｉｎｋａｓｓｅｔ株式会社,東京都港区南麻布５丁目１０番８号,2026-05-13,株式会社
ｔｈｙｓｓｅｎｋｒｕｐｐ　Ｓｕｐｐｌｙ　Ｃｈａｉｎ　Ｓｏｌｕｔｉｏｎｓ　Ｊａｐａｎ株式会社,東京都千代田区丸の内１丁目１１番１号,2026-05-13,株式会社
ｖｉｖｉｄ株式会社,大阪府大阪市北区国分寺２丁目３番２３号,2026-05-13,株式会社
ｗｅＹｏ合同会社,東京都中央区銀座１丁目１２―４Ｎ＆ＥＢＬＤ．７階,2026-05-13,合同会社
ｗｉｎｄ＆ｓｏｉｌ株式会社,福島県南相馬市小高区本町１丁目８７番地小高パイオニアヴィレッジ,2026-05-13,株式会社
