法人名,住所,設立日,法人種別
あーす・じぷしー合同会社,東京都世田谷区深沢６丁目２３番２０号,2019-05-07,合同会社
くろーばーメディカル株式会社,神奈川県相模原市中央区田名４０４８番地３０,2019-05-07,株式会社
ひょうたん農場株式会社,兵庫県丹波市市島町中竹田１６７８番地２,2019-05-07,株式会社
みどり開発株式会社,大阪府大阪市北区末広町三丁目２１番地,2019-05-07,株式会社
りんごの木株式会社,滋賀県大津市三井寺町３－３４,2019-05-07,株式会社
アズクラフト株式会社,大阪府大阪市西成区北津守３丁目２番１８号,2019-05-07,株式会社
イテル建設株式会社,東京都八王子市散田町３丁目１０番１０号,2019-05-07,株式会社
ウィリアム・アンド・カンパニー株式会社,東京都中央区勝どき１丁目３番１号ブリリアイストタワー勝どき２６０５号,2019-05-07,株式会社
オウミ堂合同会社,大阪府八尾市桜ヶ丘１丁目２番地,2019-05-07,合同会社
オドラ株式会社,福岡県福岡市東区下原４丁目１２番２０号,2019-05-07,株式会社
オンネックス株式会社,東京都葛飾区柴又３丁目２８番１５号,2019-05-07,株式会社
グローバルコモンズ研究所合同会社,東京都小金井市本町２丁目７番－１５－４０９号,2019-05-07,合同会社
グローバルリーフ協同組合,千葉県千葉市花見川区幕張本郷６丁目２５番１６号栗原第二ビル２Ｆ,2019-05-07,その他の設立登記法人
サウスワン協同組合,千葉県館山市湊４９３番地,2019-05-07,その他の設立登記法人
サーラ協同組合,愛知県一宮市浅野字長島２７番地１,2019-05-07,その他の設立登記法人
シャミ株式会社,静岡県浜松市南区安松町６番地の６,2019-05-07,株式会社
シー・ワークス合同会社,青森県青森市松原３丁目１３番１２号,2019-05-07,合同会社
ジャスミン合同会社,東京都世田谷区玉川１丁目１５番２号,2019-05-07,合同会社
スイッチエンターテイメント株式会社,東京都大田区東矢口３丁目２６番２号,2019-05-07,株式会社
スカッドパワージャパン株式会社,大阪府大阪市東淀川区西淡路１丁目１番３５号,2019-05-07,株式会社
ストレイツキャピタル株式会社,山口県下関市長府港町８番７号,2019-05-07,株式会社
ソルティノコンサルティング株式会社,東京都杉並区久我山５丁目３５番２３号,2019-05-07,株式会社
タンクメンテナンス株式会社,大阪府八尾市志紀町南１丁目１３２番地,2019-05-07,株式会社
ダブリュー・ｏｆｆｉｃｅ合同会社,東京都江戸川区清新町１丁目１番３－１４０２号,2019-05-07,合同会社
デトックスラボ株式会社,東京都足立区千住緑町２丁目１５番７号,2019-05-07,株式会社
デュオトーンガレージ合同会社,愛知県名古屋市北区芳野２丁目８番１１号,2019-05-07,合同会社
データフリーイノベーション株式会社,東京都世田谷区奥沢５丁目２０番２３号,2019-05-07,株式会社
トライカーサテクノロジー株式会社,香川県高松市中野町２９－５高松プラザビル４階,2019-05-07,株式会社
ナガムネ断熱株式会社,東京都大田区大森東２丁目１３番５号,2019-05-07,株式会社
ネイティブキャラバン株式会社,神奈川県茅ヶ崎市旭が丘６番３２号,2019-05-07,株式会社
ヒューマンデザイア協同組合,福岡県福岡市博多区博多駅前２丁目１２－１５ＢＭＢインターシティ８Ｆ,2019-05-07,その他の設立登記法人
ホームタウンデザインセンター株式会社,北海道余市郡余市町黒川町８丁目３９,2019-05-07,株式会社
ボンドパートナーズ合同会社,広島県広島市安佐南区大町西１丁目３９番２７号,2019-05-07,合同会社
マーベリック開発株式会社,大阪府東大阪市横小路町３丁目２番１４号,2019-05-07,株式会社
ミャンマーアセットマネジメント株式会社,東京都千代田区霞が関３丁目２番１号,2019-05-07,株式会社
ミラクル株式会社,大阪府大阪市生野区巽北１丁目２１－２９生野ハイツ２１１号室,2019-05-07,株式会社
メタルトラスト株式会社,山口県長門市通９９５番地２,2019-05-07,株式会社
ユビ電株式会社,東京都港区六本木１丁目４番５号アークヒルズサウスタワー１６階,2019-05-07,株式会社
ランドリープラネット株式会社,大阪府東大阪市布市町１丁目６番９号,2019-05-07,株式会社
リサイクルトナー株式会社,東京都品川区小山３丁目２６番９号駅サイドビル３階,2019-05-07,株式会社
ヴィント株式会社,東京都台東区三筋２丁目１５番１３号,2019-05-07,株式会社
一般社団法人きものアート,兵庫県神戸市東灘区住吉山手９丁目１８番１５号,2019-05-07,その他の設立登記法人
一般社団法人ひょうごアウトドアプロジェクト,兵庫県明石市二見町西二見８１０番地の１ライオンズマンション明石二見３１５号,2019-05-07,その他の設立登記法人
一般社団法人アイズ,大阪府大東市太子田１丁目９番３号,2019-05-07,その他の設立登記法人
一般社団法人カウンセリング・レビュー・ラボ,福岡県福岡市南区大池１丁目５番１８号,2019-05-07,その他の設立登記法人
一般社団法人セルエキストラクト協会,東京都港区西麻布３丁目２番９号サンライズ六本木３Ｂ,2019-05-07,その他の設立登記法人
一般社団法人テラヘルツ技術研究会,京都府京都市西京区御陵大原１－３６京大桂ベンチャープラザＳ０５,2019-05-07,その他の設立登記法人
一般社団法人メリッサフラワー協会,東京都東大和市向原２丁目１０３９番地の８,2019-05-07,その他の設立登記法人
一般社団法人丸ごとバナナ協会,東京都杉並区久我山２丁目４番２号,2019-05-07,その他の設立登記法人
一般社団法人日本医療美容健康療養協会,静岡県菊川市下平川４８３４番地の１,2019-05-07,その他の設立登記法人
一般社団法人日本地域イノベーション研究機構,岡山県岡山市北区駅前町１丁目８番１号５Ｆ,2019-05-07,その他の設立登記法人
一般社団法人綜合ヒューマンスキル開発協会,東京都新宿区新宿１丁目３３番１０号,2019-05-07,その他の設立登記法人
一般社団法人群馬県コンクリート製品協会,群馬県高崎市下豊岡町５１９番地の２,2019-05-07,その他の設立登記法人
一般社団法人耕壌会種子組合,秋田県秋田市上新城五十丁字大木前４１番地,2019-05-07,その他の設立登記法人
一般社団法人関東就労支援協会,神奈川県横浜市緑区鴨居５丁目５番６号メゾンクレール鴨居１０３号,2019-05-07,その他の設立登記法人
一般社団法人ＡＨ　ＳＴＹＬＩＮＧ協会,東京都渋谷区鶯谷町１５番５号,2019-05-07,その他の設立登記法人
一般社団法人Ｆ６,東京都港区虎ノ門５丁目１番４号,2019-05-07,その他の設立登記法人
一般社団法人ＨＩＫＡＲＩ,和歌山県御坊市熊野３６２番地,2019-05-07,その他の設立登記法人
一般財団法人法護院,京都府京都市西京区嵐山山ノ下町２２番地の１９,2019-05-07,その他の設立登記法人
一般財団法人秋津洲財団,東京都新宿区新宿１丁目２９番地１４号パレ・ドール新宿７０２号,2019-05-07,その他の設立登記法人
伊藤建業株式会社,福島県南相馬市小高区耳谷字桃内１８番地の３,2019-05-07,株式会社
八代市農業再生協議会,熊本県八代市松江城町１－２５,2019-05-07,その他
共信サポート株式会社,愛知県清須市土器野４８０番地１,2019-05-07,株式会社
北伊豆メディカルサービス合同会社,静岡県田方郡函南町桑原１０３０番地１０１号室,2019-05-07,合同会社
北川建築測量合同会社,石川県金沢市並木町３番１３号,2019-05-07,合同会社
北野ガーデン株式会社,兵庫県神戸市中央区布引町１丁目１番５号,2019-05-07,株式会社
匹見上公民館運営委員会,島根県益田市匹見町匹見イ６７４,2019-05-07,その他
医療法人ながまつ内科・小児科クリニック,大分県豊後高田市玉津１１０番地１,2019-05-07,その他の設立登記法人
医療法人わかば会,奈良県橿原市久米町６６０番地,2019-05-07,その他の設立登記法人
医療法人ウェルビジョン,福岡県福岡市中央区天神２丁目１１番１号福岡パルコ本館６階,2019-05-07,その他の設立登記法人
医療法人社団えいあい歯科クリニック,石川県白山市専福寺町１５６番地１,2019-05-07,その他の設立登記法人
医療法人社団にこにこすまいる,埼玉県ふじみ野市滝２丁目５番地３７,2019-05-07,その他の設立登記法人
医療法人社団ブレイン・ヘルス,石川県河北郡津幡町北中条２丁目３３番地,2019-05-07,その他の設立登記法人
医療法人社団健昇会,石川県小松市日の出町１丁目１６５,2019-05-07,その他の設立登記法人
医療法人社団明結会,神奈川県海老名市柏ケ谷１０５２－２かしわ台クリスタルプラザ１０１号,2019-05-07,その他の設立登記法人
合同会社おおい町地域電力,福井県大飯郡おおい町名田庄納田終５８号６番地,2019-05-07,合同会社
合同会社みのりの和,山梨県韮崎市穴山町下新田７３３４番地,2019-05-07,合同会社
合同会社アール・エス,大阪府八尾市渋川町３丁目６番２１号,2019-05-07,合同会社
合同会社オールテイクン,東京都中央区佃２丁目１番１号センチュリーパークタワー２７１４号,2019-05-07,合同会社
合同会社カメレオン,東京都練馬区谷原２丁目６番４６号,2019-05-07,合同会社
合同会社ケーズホーム,神奈川県川崎市幸区中幸町３丁目１６番地４,2019-05-07,合同会社
合同会社ジャンクイット,東京都町田市上小山田町２６０１番地１０,2019-05-07,合同会社
合同会社トライアンフル,大阪府大阪市西区江戸堀２丁目４－１１－４０２,2019-05-07,合同会社
合同会社ドリームワークス,茨城県龍ケ崎市寺後３６０４番地,2019-05-07,合同会社
合同会社ピンポイント,福島県大沼郡会津美里町字外川原甲４２６０番地１９,2019-05-07,合同会社
合同会社ファインテック,宮崎県延岡市萩町１３３番地エイルマンション延岡駅前９０３号,2019-05-07,合同会社
合同会社フランシス,茨城県つくば市二の宮２丁目７番地２０－２階,2019-05-07,合同会社
合同会社プライムエデュケーション,岐阜県可児市桜ケ丘７丁目２０３番地,2019-05-07,合同会社
合同会社ミカ,青森県八戸市大字鮫町字山四郎蒔目１７－２０７,2019-05-07,合同会社
合同会社ライトヒストキャピタル,東京都千代田区二番町５番地２麹町駅プラザ９０１,2019-05-07,合同会社
合同会社ラーダークリパ,宮城県黒川郡大衡村大瓜字長町１５８番地,2019-05-07,合同会社
合同会社レイズ００３,愛知県丹羽郡扶桑町大字高雄字中海道１２５番地,2019-05-07,合同会社
合同会社一心,京都府京都市南区東九条南石田町９４番地２,2019-05-07,合同会社
合同会社令和アソシエーション,鹿児島県鹿児島市下伊敷３丁目６９番６号,2019-05-07,合同会社
合同会社住輝,山梨県甲府市丸の内３丁目１５番１１号,2019-05-07,合同会社
合同会社小崎農場,北海道紋別郡湧別町南兵村三区３８,2019-05-07,合同会社
合同会社川田製作所,香川県東かがわ市帰来１１５番地,2019-05-07,合同会社
合同会社昭和映像音楽制作所,北海道札幌市中央区北四条東１丁目３番地１パシフィックタワー札幌１２０２号,2019-05-07,合同会社
合同会社楽市,山梨県都留市田野倉９６５番地,2019-05-07,合同会社
合同会社樹希真建設,大阪府吹田市千里山西４丁目１１番４号,2019-05-07,合同会社
合同会社泉屋ライトハウス,神奈川県逗子市逗子２丁目８番２号,2019-05-07,合同会社
合同会社田中事務所,高知県高知市旭町２丁目２２番地５７サーパス第２旭町３０７号,2019-05-07,合同会社
合同会社神道商会,茨城県神栖市太田新町２丁目３番地１２,2019-05-07,合同会社
合同会社笑人士,愛媛県新居浜市庄内町４丁目２番３６号,2019-05-07,合同会社
合同会社萩ほの花,山口県萩市大字東田町６１番地２０１号室,2019-05-07,合同会社
合同会社鈴一経営研究所,愛知県津島市牧野町字浪寄７０番地,2019-05-07,合同会社
合同会社電気ワークス,愛知県豊川市御津町下佐脇御所１１３番地８,2019-05-07,合同会社
合同会社ＡＮ　Ｅｎｔｅｒｐｒｉｓｅｓ,千葉県白井市中２１７番地７－Ｂ,2019-05-07,合同会社
合同会社ＡＲＢＬＩＳＳ,群馬県高崎市寺尾町１１２番地２,2019-05-07,合同会社
合同会社ＡＲＣ,北海道旭川市十条通９丁目９７５番地の８２ダイアナ常盤ヒルズ,2019-05-07,合同会社
合同会社ＡＴ,埼玉県さいたま市浦和区木崎３丁目１１番１８号エバーグリーンＣ１０２,2019-05-07,合同会社
合同会社ＡｄｄＰｅａｃｅ,大阪府大阪市浪速区幸町３丁目４番１０－２１０号,2019-05-07,合同会社
合同会社ＢＲＩＤＧＥ,愛知県名古屋市千種区丘上町１丁目１１番地ロイヤル覚王山５０５,2019-05-07,合同会社
合同会社ＥＤＳ,福岡県福岡市博多区麦野１丁目１３番３号,2019-05-07,合同会社
合同会社ＩＮＮ,大分県別府市天満町１０番２９号,2019-05-07,合同会社
合同会社ＫＡＲＩＮ　ＳＨＯＰ,新潟県村上市坂町６２３番地５４６号,2019-05-07,合同会社
合同会社ＫＭＤ,兵庫県伊丹市千僧２丁目５０番地,2019-05-07,合同会社
合同会社ＬＥＣ,福岡県福岡市博多区井相田３丁目２２番２７－１０３号,2019-05-07,合同会社
合同会社ＬＩＰＮＡＳ,愛知県名古屋市中川区松年町３丁目１８番地の１,2019-05-07,合同会社
合同会社Ｌｉｂｒａ近江,滋賀県彦根市犬方町２６８番地,2019-05-07,合同会社
合同会社Ｍ．ｃｏｌｌｅｃｔｉｏｎ,大阪府大阪市浪速区敷津東２丁目１番２４号,2019-05-07,合同会社
合同会社ＭＩＮＴ,広島県安芸郡府中町八幡２丁目７番２０号,2019-05-07,合同会社
合同会社ＭＩＹＡＢＩ,北海道札幌市白石区東札幌二条５丁目８－１０スリーディーグロース,2019-05-07,合同会社
合同会社ＭＫ建工,高知県高知市大津乙９８９番地１４ハイツ真美Ⅱ－２０２,2019-05-07,合同会社
合同会社ＮＥＷＳＴＥＰ,岐阜県岐阜市花沢町５丁目１８番地,2019-05-07,合同会社
合同会社Ｏｆｆｉｃｅ　Ｗ．,東京都目黒区下目黒２丁目２番２号,2019-05-07,合同会社
合同会社Ｏｒｉｏｎ,静岡県浜松市南区大柳町１２１番地の１,2019-05-07,合同会社
合同会社Ｐａｓｓｉｏｎｅ,広島県広島市東区光町２丁目５番３号第１平勝ビルｂ１階,2019-05-07,合同会社
合同会社ＲＩＸ　Ｔｒａｄｉｎｇ,岡山県岡山市南区芳泉２丁目１０番１９号,2019-05-07,合同会社
合同会社Ｓ－Ｌｅｇａｃｙ,千葉県千葉市花見川区南花園２丁目２番８号,2019-05-07,合同会社
合同会社ＳＤ　ＴＲＡＤＩＮＧ,愛知県丹羽郡大口町二ツ屋２丁目１９４番地２,2019-05-07,合同会社
合同会社ＳＩＭＫＳ,愛知県名古屋市守山区更屋敷３番１０号,2019-05-07,合同会社
合同会社ＳＬＥＥＰＩＮＧ　ＦＯＸ,高知県高知市本町５丁目６番１５－１４０１号,2019-05-07,合同会社
合同会社Ｓｏｒａ豆,山口県熊毛郡田布施町大字波野２０８１－１,2019-05-07,合同会社
合同会社ＴＯＤＤＹＳ,千葉県船橋市本町４丁目５番２１号２Ｆ,2019-05-07,合同会社
合同会社Ｔｅｒｒａ　ＪＡＰＡＮ,東京都江東区南砂３丁目１４番１号,2019-05-07,合同会社
合同会社Ｔｈｅ　Ｓｔｏｒｙ　ｏｆ　Ｌｉｆｅ,東京都江戸川区本一色１丁目３４番１６－２０９号,2019-05-07,合同会社
合同会社ＹＣＤＩ,福岡県福岡市中央区大手門３丁目１４番２７号ラフォーレ大濠パークアベニュー６０４,2019-05-07,合同会社
合同会社ＹＵＺＵ,岡山県岡山市南区万倍１９番地１２カシュカシュクークービル１０１‐１,2019-05-07,合同会社
合同会社ｏｒａｎｇｅ　ｇａｍｅｓ,東京都目黒区下目黒２丁目１６番２３号四季苑４０３,2019-05-07,合同会社
合同会社ｒｏａｄ　ｔｒｅｅ　ｓｈｏｐ,大阪府大阪市西区九条３丁目１５番１７号Ａ２５,2019-05-07,合同会社
味氏食品株式会社,東京都渋谷区千駄ヶ谷２丁目３８番１号２Ｆ－Ａ,2019-05-07,株式会社
和金国際株式会社,大阪府大阪市浪速区下寺２丁目９－９－３０１,2019-05-07,株式会社
地域サステナジー株式会社,東京都港区高輪１丁目２５番２号,2019-05-07,株式会社
基萬株式会社,東京都台東区浅草橋１丁目２４番１１号,2019-05-07,株式会社
大原ホールディングス株式会社,愛知県名古屋市北区山田１丁目３番３５号,2019-05-07,株式会社
大川電商ホールディングス株式会社,大阪府大阪市北区天満３丁目２番３号,2019-05-07,株式会社
大阪キャピタル２一般社団法人,東京都港区六本木１丁目６番１号泉ガーデンタワー,2019-05-07,その他の設立登記法人
太陽イズム合同会社,大分県別府市大字鶴見２６０５番地の１,2019-05-07,合同会社
宇留野創建株式会社,岐阜県岐阜市粟野西６丁目４３９番地,2019-05-07,株式会社
山丁株式会社,沖縄県宜野湾市大山６丁目８番１号エヌエイチオフィスビル３Ｆ夢空間Ｃ－０５室,2019-05-07,株式会社
山輝建工株式会社,岐阜県羽島市上中町一色１１４３番地,2019-05-07,株式会社
岐阜市鷺山中洙土地区画整理組合,岐阜県岐阜市薮田南５丁目１４番１２号岐阜県シンクタンク庁舎５階　公益社団法人　岐阜県都市整備協会内,2019-05-07,その他
岐阜起業サポート合同会社,岐阜県岐阜市上土居７３９番地１５,2019-05-07,合同会社
彰林合同会社,東京都品川区大井６丁目１２番１０号,2019-05-07,合同会社
愛高国際株式会社,大阪府大阪市住吉区長居４丁目１２－２１,2019-05-07,株式会社
晴ｃａｆｅ合同会社,北海道帯広市川西町西２線５７番地２８,2019-05-07,合同会社
有限会社翔成,長崎県長崎市桶屋町２５番地ＭＭＮ長崎桶屋町ビル４階,2019-05-07,有限会社
朝日中華物産株式会社,広島県東広島市河内町入野字有田峯１１８３１番５,2019-05-07,株式会社
木村工業株式会社,大阪府岸和田市稲葉町１３５０番地,2019-05-07,株式会社
未来文書株式会社,福岡県福岡市城南区梅林２丁目１４番１７号,2019-05-07,株式会社
未来科技株式会社,埼玉県さいたま市南区大字太田窪２１５４番地１４,2019-05-07,株式会社
東和合同会社,東京都府中市片町１丁目９番５号ブルーコーポ愛３０２号室,2019-05-07,合同会社
株式会社あおば,群馬県前橋市南町３丁目３５番地１,2019-05-07,株式会社
株式会社いちじゃもの,高知県高知市春野町南ケ丘９丁目１番地１８,2019-05-07,株式会社
株式会社いつも青空,愛知県豊田市錦町１丁目４４番地５,2019-05-07,株式会社
株式会社かるら,東京都府中市是政５丁目１９番地の１府中多摩川通り住宅２号棟６２４号室,2019-05-07,株式会社
株式会社こもれび,北海道伊達市松ヶ枝町１５４番地,2019-05-07,株式会社
株式会社さくらんぼファクトリー,山形県山形市伊達城３丁目２１番地１０,2019-05-07,株式会社
株式会社つばめコンサルティング,東京都千代田区内神田１丁目８番９号,2019-05-07,株式会社
株式会社なかじま電気,東京都江戸川区一之江４丁目１６番７号,2019-05-07,株式会社
株式会社ぴおに商会,福岡県福岡市中央区薬院１丁目１２番１０－１２０４号,2019-05-07,株式会社
株式会社ぶどうレコード,東京都練馬区北町７丁目４番１５号,2019-05-07,株式会社
株式会社まるよし,愛知県豊田市上郷町市場５７番地１,2019-05-07,株式会社
株式会社ゆあまーと,広島県広島市中区胡町３番１１号クイーンビル４Ｆ,2019-05-07,株式会社
株式会社らくらく,神奈川県川崎市高津区北見方１丁目１０番地２３号ルネスグラディアン２０３号室,2019-05-07,株式会社
株式会社れいわ,岡山県岡山市北区天神町１番１９号,2019-05-07,株式会社
株式会社アイエスデー,熊本県熊本市南区良町１丁目１０番５－１０２号,2019-05-07,株式会社
株式会社アイテック,東京都東大和市南街１丁目３６番地の３,2019-05-07,株式会社
株式会社アイネットリンク,大阪府大阪市中央区道修町２丁目４番１号北浜クラフト６０１号,2019-05-07,株式会社
株式会社アグリファーム玉名,熊本県玉名市富尾５４１番地,2019-05-07,株式会社
株式会社アトラス,大阪府大阪市東淀川区北江口４丁目３－２７インペリアル北江口Ｃ棟２０１,2019-05-07,株式会社
株式会社アドラー,北海道札幌市豊平区豊平三条６丁目１番８号,2019-05-07,株式会社
株式会社アルファペットライフケア,神奈川県川崎市宮前区鷺沼４丁目９番地２,2019-05-07,株式会社
株式会社アルーアエステート,静岡県浜松市中区蜆塚３丁目１８番２８号,2019-05-07,株式会社
株式会社アレック,茨城県つくば市みどりの１丁目３１番地４ガーデンコートみどりの７０２,2019-05-07,株式会社
株式会社アレッタ,東京都中野区中野４丁目１番１号中野サンプラザ９Ｆ,2019-05-07,株式会社
株式会社アーキテクチャー,北海道函館市富岡町２丁目３６番７号,2019-05-07,株式会社
株式会社イージーワーク,宮城県柴田郡柴田町東船迫２丁目４番１１,2019-05-07,株式会社
株式会社エクシード,東京都中央区銀座７丁目１３番６号サガミビル２階,2019-05-07,株式会社
株式会社エルマーポート,滋賀県野洲市市三宅３１１２番地,2019-05-07,株式会社
株式会社エーライン,神奈川県小田原市南鴨宮３丁目４９番１５号カミイビル２０１,2019-05-07,株式会社
株式会社オフィスリブラ,岐阜県岐阜市宇佐３丁目６番８号,2019-05-07,株式会社
株式会社カナエクサス,東京都板橋区赤塚８丁目７番１８号,2019-05-07,株式会社
株式会社カーロ．ＣＯ．ＬＴＤ,群馬県伊勢崎市大正寺町３４７番地１,2019-05-07,株式会社
株式会社キステム,広島県安芸郡府中町大須４丁目１番４１－４０１号,2019-05-07,株式会社
株式会社キャリアシーク,京都府京都市中京区小川通六角下る元本能寺町３８２番地ＭＢビル３Ｆ,2019-05-07,株式会社
株式会社クモヅ電器,広島県広島市東区戸坂くるめ木１丁目２５番１７号,2019-05-07,株式会社
株式会社クリエイティブリン,長野県長野市大字西尾張部２０４番地２,2019-05-07,株式会社
株式会社クリエＱ,大阪府八尾市小阪合町４丁目３番３０号,2019-05-07,株式会社
株式会社クレノ,東京都豊島区北大塚３丁目２１番１２－８０３号,2019-05-07,株式会社
株式会社クレーン,群馬県前橋市総社町桜が丘１０３８番地２９,2019-05-07,株式会社
株式会社グッドフレンズ,大阪府豊中市長興寺北３丁目５番１１－２０１号,2019-05-07,株式会社
株式会社ケイズ,大阪府大阪市中央区内淡路町２丁目３番１４号,2019-05-07,株式会社
株式会社ケーアイシステムサービス,新潟県北蒲原郡聖籠町大字網代浜１３４３番地１６,2019-05-07,株式会社
株式会社サカイグループ,愛知県半田市亀崎高根町２丁目１５８番地の２,2019-05-07,株式会社
株式会社サンマックエース,徳島県徳島市新蔵町３丁目５３番地の１,2019-05-07,株式会社
株式会社サンロードＳＴＥＰ,茨城県龍ケ崎市５０７６番地５,2019-05-07,株式会社
