法人名,住所,設立日,法人種別
豊業株式会社,大阪府大阪市都島区片町１丁目３番１７号メゾン・ラフィーネ８０７号,2024-06-13,株式会社
賢鼎国際株式会社,埼玉県志木市館２丁目３番６－３０９号Ｂ室,2024-06-13,株式会社
赤津工業株式会社,福島県いわき市錦町大島１８０番地,2024-06-13,株式会社
農事組合法人上鴨沢営農組合,岩手県奥州市江刺広瀬字荒谷３５番地３,2024-06-13,その他の設立登記法人
農事組合法人中里ファーム,青森県三戸郡五戸町大字上市川字石上８１番地２,2024-06-13,その他の設立登記法人
農事組合法人中里農園,青森県三戸郡五戸町大字上市川字石上８１番地２,2024-06-13,その他の設立登記法人
阪神陸運株式会社,兵庫県加古郡播磨町南野添２丁目１６番９号,2024-06-13,株式会社
隆星株式会社,大阪府大阪市西成区天下茶屋北１丁目１番２７号２階,2024-06-13,株式会社
駿思株式会社,千葉県市川市市川３丁目７番７－１０３号,2024-06-13,株式会社
鶴松株式会社,神奈川県横浜市旭区鶴ケ峰１丁目１２番地１あんどうビル１Ｆ,2024-06-13,株式会社
龍騰合同会社,兵庫県西宮市南甲子園２丁目２１番３６号,2024-06-13,合同会社
９ｓ　Ｊａｐａｎ株式会社,大阪府大阪市阿倍野区北畠３丁目９番２３号１０１室,2024-06-13,株式会社
Ａ‐ｔｅｃ株式会社,千葉県千葉市花見川区幕張町３丁目１４６７番地２,2024-06-13,株式会社
ＡＤＥｌｅ合同会社,東京都文京区水道１丁目５番２５号キングハウス飯田橋３０１,2024-06-13,合同会社
ＡＳＡＩ　Ｂｕｌｌ　Ｔｒａｄｅｒｓ株式会社,愛知県名古屋市天白区元植田１丁目２１５番地アニヴァーサリ７０３号,2024-06-13,株式会社
ＡＸファイナンシャルアドバイザリー合同会社,茨城県守谷市けやき台１丁目２３番地１２,2024-06-13,合同会社
ＡＺホライ株式会社,愛知県名古屋市中川区戸田ゆたか２丁目３２０７番地の３,2024-06-13,株式会社
Ａｉｃａｎ株式会社,東京都江戸川区中葛西５丁目４１番１０号－６Ｆ,2024-06-13,株式会社
Ｂ‐ｔｉｍｅ株式会社,愛知県刈谷市小垣江町石ノ戸２６番地１,2024-06-13,株式会社
ＢＬＥＤ株式会社,山梨県南都留郡富士河口湖町河口８３３番地,2024-06-13,株式会社
ＢＹＲコンサルティング合同会社,東京都江東区東砂５丁目９番６号,2024-06-13,合同会社
Ｂｅｖｅ株式会社,愛知県名古屋市中村区松重町４番５５号,2024-06-13,株式会社
ＢｉｚＢａｓｅ合同会社,千葉県市川市北国分４丁目２３－７,2024-06-13,合同会社
Ｂｒｉｎｃ　Ｊａｐａｎ株式会社,東京都港区元赤坂１丁目１番１６号,2024-06-13,株式会社
ＣＩＴＶ光株式会社,東京都豊島区東池袋４丁目２１番１号,2024-06-13,株式会社
ＣＬＯＵＤ　ＨＲＯ株式会社,大阪府大阪市西成区山王１丁目１２－２１,2024-06-13,株式会社
ＣＰすわの株式会社,福岡県久留米市諏訪野町１９４７－１,2024-06-13,株式会社
ＣＲＡＺＹＢＡＳＥ株式会社,兵庫県宝塚市安倉南１丁目４－１,2024-06-13,株式会社
ＤＯＮＧＧＵＡＮ　ＢＯＹＹＥ　ＩＮＤＵＳＴＲＩＡＬ　ＣＯ．，ＬＴＤ．,,2024-06-13,外国会社等
ＤＳ株式会社,東京都荒川区西尾久７丁目１１番１２号２Ｆ－Ｂ室,2024-06-13,株式会社
ＤｉｇＤａＴｅｃｈ合同会社,山口県岩国市砂山町２丁目７番１３号,2024-06-13,合同会社
ＥＰＬ株式会社,東京都渋谷区神泉町２２番３－７０１号,2024-06-13,株式会社
ＦＦＦＪ株式会社,東京都新宿区西新宿６丁目５番１号,2024-06-13,株式会社
ＦＵＪＩ　ＴＲＡＮＳＰＯＲＴ合同会社,千葉県柏市布施２０４９－１,2024-06-13,合同会社
ＦＵＮＴＩＭＥ　ＳＰＯＲＴＳ合同会社,東京都中央区銀座１丁目１２番４号Ｎ＆ＥＢＬＤ．６Ｆ,2024-06-13,合同会社
ＧＭＯコネクトＨＲ株式会社,東京都渋谷区桜丘町２６番１号,2024-06-13,株式会社
ＧＯＫＳＵ　ＫＯＧＹＯ合同会社,愛知県名古屋市北区鳩岡町１丁目７番地の１８,2024-06-13,合同会社
ＧＵＡＮＧＺＨＯＵ　ＪＩＧＵＡＮＧ　ＫＥＪＩ　ＹＯＵＸＩＡＮ　ＧＯＮＧＳＩ,,2024-06-13,外国会社等
ＧＵＡＮＧＺＨＯＵＪＩＮＹＡＯＭＡＯＹＩＹＯＵＸＩＡＮＺＥＲＥＮＧＯＮＧＳＩ,,2024-06-13,外国会社等
ＧＵＡＮＧＺＨＯＵＭＩＭＡＮＭＡＯＹＩＹＯＵＸＩＡＮＺＥＲＥＮＧＯＮＧＳＩ,,2024-06-13,外国会社等
ＧＹ　ＴＲＡＤＩＮＧ合同会社,奈良県磯城郡川西町大字結崎７３番地の１,2024-06-13,合同会社
Ｇｕａｎｇｚｈｏｕ　ｂｌａｃｋ　ｈｕｎｄｒｅｄ　ｄｉａｍｏｎｄ　ｇａｒｍｅｎｔ　Ｃｏ．，ＬＴＤ,,2024-06-13,外国会社等
Ｈ’ｓ　ｆａｃｔｏｒｙ’ｓ株式会社,愛知県岡崎市百々町字池ノ入３０番地２０６,2024-06-13,株式会社
ＨＥＮＡＮ　ＪＩＡ　ＹＩＮ　ＭＥＩ　ＥＬＥＣＴＲＯＮＩＣＳ　ＣＯ．，ＬＴＤ,,2024-06-13,外国会社等
ＨＩＫＭＡ　ＡＵＴＯ　ＴＲＡＤＥＲＳ合同会社,愛知県豊田市汐見町２丁目１４番地１レクサシオミ１０６,2024-06-13,合同会社
ＨＬ商事株式会社,埼玉県川口市芝下２丁目３－２－１０１号室,2024-06-13,株式会社
ＨＹＵＧＡ株式会社,大阪府堺市南区美木多上２７５４番地２２,2024-06-13,株式会社
Ｈｏｍｅｙ合同会社,東京都杉並区高円寺南１丁目２－３－２Ｆ,2024-06-13,合同会社
Ｈｏｐｅ　Ｓａｉｌｓ合同会社,千葉県船橋市海神４丁目７番１５－１号,2024-06-13,合同会社
ＩｏＴクリエイト株式会社,大阪府枚方市香里ケ丘７丁目１１番地９,2024-06-13,株式会社
Ｋ２フォージテック株式会社,長野県岡谷市赤羽２丁目３番９号,2024-06-13,株式会社
ＫＤＬ株式会社,神奈川県横浜市神奈川区羽沢南１丁目１９番１７号,2024-06-13,株式会社
ＫＩＹＡＮＡ株式会社,埼玉県川口市領家２丁目１８番１５号光和マンション３０３号,2024-06-13,株式会社
ＫＳＦ合同会社,宮城県仙台市太白区泉崎１丁目１９番８号２Ｆ,2024-06-13,合同会社
Ｋａｌｕｚａ　Ｊａｐａｎ株式会社,東京都千代田区丸の内２丁目３番１号三菱商事ビルディング,2024-06-13,株式会社
ＬＨパートナーズ株式会社,神奈川県横浜市金沢区六浦南５丁目１１番１－１０４号,2024-06-13,株式会社
Ｌｅ　Ｐａｒａｄｉｓ株式会社,東京都中野区丸山２丁目１５番９号,2024-06-13,株式会社
Ｌｉｎｋ　ｉｎ合同会社,福岡県福岡市中央区天神４丁目６番２８号天神ファーストビル７階,2024-06-13,合同会社
Ｍ．ｐ株式会社,千葉県千葉市花見川区み春野２丁目１０番２４号,2024-06-13,株式会社
ＭＡＹＮＡＭＩ株式会社,東京都台東区台東３丁目５番１０号－１０２－２Ｕ,2024-06-13,株式会社
ＭＣ　ＩＮＶＥＳＴＭＥＮＴ株式会社,東京都渋谷区代々木２丁目２３番１－８７１号,2024-06-13,株式会社
ＭＩＺＵＫＡＷＡ株式会社,愛知県一宮市森本５丁目９番７号,2024-06-13,株式会社
ＭＺ　Ｌａｔｅｒａｌ株式会社,大阪府大阪市中央区南本町１丁目３番９－１００６号,2024-06-13,株式会社
Ｎ＆Ｋ合同会社,兵庫県西宮市二見町１４番１８－６６２号,2024-06-13,合同会社
ＮＥＥＷＥＲＪａｐａｎ株式会社,千葉県成田市奈土字金駒８０６番地Ａ棟１０１号,2024-06-13,株式会社
ＮＩＮＧＢＯＢＩＬＬＩＯＮＡＮＤＭＯＮＺＴＲＡＤＥ　ＣＯ．，ＬＴＤ．,,2024-06-13,外国会社等
ＮＰＯ法人彩里,福岡県久留米市北野町仁王丸３１７－１,2024-06-13,その他の設立登記法人
ＮＰＯ法人本とジブン研休室,神奈川県平塚市城所２１８番地の１０,2024-06-13,その他の設立登記法人
ＮＹジャパン合同会社,東京都西東京市富士町２丁目１２番８号,2024-06-13,合同会社
Ｏｃｅａｎｆｒｏｎｔ合同会社,東京都渋谷区渋谷２丁目１９－１５宮益坂ビルディング６０９,2024-06-13,合同会社
ＯｐｅｎＳｋｙ合同会社,愛知県岡崎市若松町字大廻１番地８,2024-06-13,合同会社
ＰＡＩＸＩＮ　ＤＩＡＮＺＩＳＨＡＮＧＷＵ（ＸＩＡＭＥＮ）ＹＯＵＸＩＡＮＧＯＮＧＳＩ,,2024-06-13,外国会社等
ＰＨＩインフォメーションコンサルティング株式会社,東京都港区赤坂４丁目１８番１９号赤坂フロントタウン３階,2024-06-13,株式会社
ＰＯＴＡＬＩＶＥ合同会社,東京都板橋区前野町６丁目４３番１号,2024-06-13,合同会社
ＰＯＴＷＥＬＬ株式会社,静岡県富士市水戸島本町７番３４号１０２号,2024-06-13,株式会社
ＰＵ　ＴＩＡＮ　ＳＨＩ　ＧＵＡＮ　ＣＥ　ＭＡＯ　ＹＩ　Ｃｏ．，Ｌｔｄ．,,2024-06-13,外国会社等
ＰＵ　ＴＩＡＮ　ＳＨＩ　ＸＩＯＮＧ　ＫＵＮ　ＭＡＯ　ＹＩ　ＹＯＵ　ＸＩＡＮ　ＧＯＮＧ　ＳＩ,,2024-06-13,外国会社等
Ｒ．Ｊ　ＩＮＴＥＲＮＡＴＩＯＮＡＬ合同会社,群馬県みどり市笠懸町阿左美１６６６番地１,2024-06-13,合同会社
Ｒｉｎ合同会社,青森県八戸市根城２丁目２８番７号大橋貸住宅５号,2024-06-13,合同会社
ＳＨＡＩＮＥ　ＪＡＰＡＮ株式会社,千葉県八街市沖１７６１－２,2024-06-13,株式会社
ＳＨＥＮＺＨＥＮ　ＫＵＵＶＡＮ　ＴＲＡＤＩＮＧ　ＣＯ．，ＬＴＤ．,,2024-06-13,外国会社等
ＳＨＥＮＺＨＥＮＳＨＩＨＡＩＭＡＩＫＵＡＪＩＮＧＫＥＪＩＹＯＵＸＩＡＮＧＯＮＧＳＩ,,2024-06-13,外国会社等
ＳＨＥＮＺＨＥＮＳＨＩＬＥＩＺＥＪＩＳＨＵＹＯＵＸＩＡＮＧＯＮＧＳＩ,,2024-06-13,外国会社等
ＳＫＹメンテナンス株式会社,愛知県岡崎市山綱町字中野６番地３５,2024-06-13,株式会社
ＳＭＲ　ＥＸＰＲＥＳＳ　ＪＰ合同会社,埼玉県川口市芝樋ノ爪１丁目６番５５号１０２号,2024-06-13,合同会社
ＳＲＤ合同会社,佐賀県小城市三日月町道辺６７９番地１４,2024-06-13,合同会社
ＳＵＫＵＲＡ合同会社,東京都福生市志茂２２番地７鳳鳴館１０１号室,2024-06-13,合同会社
ＳＵＲＧＩＣＡＬ　ＡＮＤ　ＰＨＡＲＭＡ株式会社,東京都港区元麻布３丁目１番６号,2024-06-13,株式会社
Ｓｈｅｎｚｈｅｎ　Ｓｈｕｎｙｉｗａｎｇ　Ｔｒａｄｉｎｇ　Ｃｏ．，ＬＴＤ,,2024-06-13,外国会社等
Ｔ‐ＦＲＯＮＴコンサル株式会社,静岡県静岡市清水区北矢部町２丁目９番１９号,2024-06-13,株式会社
ＴＨＴ鍛工合同会社,岡山県美作市英田青野１１０９番１,2024-06-13,合同会社
ＴＭＰ株式会社,東京都目黒区下目黒４丁目１６番４号,2024-06-13,株式会社
ＴＯＡファイブ株式会社,大阪府大阪市西区西本町１丁目８番２号三晃ビル５階,2024-06-13,株式会社
ＴＳＵＫＡＳＡホールディングス株式会社,千葉県船橋市本郷町７２５番地３,2024-06-13,株式会社
ＴＷＳ株式会社,静岡県静岡市駿河区八幡２丁目３番６号,2024-06-13,株式会社
ＴｅｃｈＭｏｖｅ株式会社,東京都清瀬市松山２丁目１番２号,2024-06-13,株式会社
ＴｒｙＯｌｉｖｅ　Ｌａｂｅｌｓ合同会社,東京都町田市原町田３丁目４番４号,2024-06-13,合同会社
Ｕ＆Ｌスタッフ株式会社,愛知県高浜市新田町３丁目６番地７,2024-06-13,株式会社
Ｕｓ　Ｖｉｌｌａｇｅ株式会社,鳥取県岩美郡岩美町大字大谷５６２番地１,2024-06-13,株式会社
ＶＣスタートアップ健康保険組合,東京都千代田区大手町１丁目６－１大手町ビル２階　２５０号,2024-06-13,その他
ＶｉｔａＣａｒｂ　Ｉｎｎｏｖａｔｉｏｎｓ株式会社,愛知県名古屋市千種区不老町１番地ＴＯＩＣ館内,2024-06-13,株式会社
ＷＥ　ＧＲＯＵＮＤ株式会社,東京都中央区新川１丁目２６番１６－８０３号,2024-06-13,株式会社
ＷＳＤ株式会社,東京都千代田区外神田５丁目１番１０号千住ビル１階,2024-06-13,株式会社
Ｙ’ｓ株式会社,愛知県名古屋市守山区吉根３丁目７０８番地,2024-06-13,株式会社
ＹＡＤＯＲＩＧＩ合同会社,徳島県板野郡藍住町徳命字元村東２２番地２２,2024-06-13,合同会社
ＹＡＴ４合同会社,東京都港区元赤坂１丁目１番７－８０７号,2024-06-13,合同会社
ＹＩＷＵＳＨＩ　ＦＥＮＧＧＵＯ　ＷＡＮＧＬＵＯ　ＫＥＪＩ　ＹＯＵＸＩＡＮＧＯＮＧＳＩ,,2024-06-13,外国会社等
ｄｔ　Ｅｎｔｅｒｔａｉｎｍｅｎｔ株式会社,広島県広島市中区東平塚町二丁目２３番ｄｒｏｐｔｉｐＢｌｄｇ．,2024-06-13,株式会社
ｍａｍａｎ　ｙａｏ株式会社,大阪府八尾市八尾木東１丁目１３８番地,2024-06-13,株式会社
ｍｕｂｉｋ合同会社,宮崎県都城市上町１７街区２４号都城ビル１１０３,2024-06-13,合同会社
ｍｙ　ＨｉＫｏ株式会社,大阪府大阪市北区天満橋１丁目８番１５－１８０１号,2024-06-13,株式会社
ｎｉｎｊａ　ｊａｐａｎ　ｈｏｕｓｅｍａｋｅｒ合同会社,千葉県千葉市花見川区み春野３丁目１３－２,2024-06-13,合同会社
ｒｅｖｅｒｓｅ合同会社,東京都新宿区西新宿３丁目３番１３号西新宿水間ビル６階,2024-06-13,合同会社
ことらべる株式会社,東京都三鷹市上連雀１丁目１２－１７三鷹ビジネスパークＢ１Ｆ,2024-06-14,株式会社
つくばインディＵＳＡ合同会社,大阪府大阪市北区堂島１丁目１番５号関電不動産梅田新道ビルＢ２Ｆ,2024-06-14,合同会社
アイキッズネクスト株式会社,兵庫県神戸市中央区栄町通４丁目３番５号,2024-06-14,株式会社
アイリンロジスティック株式会社,愛知県名古屋市北区水草町１丁目３４番地,2024-06-14,株式会社
エイバック株式会社,埼玉県春日部市備後東３丁目２０番１号スターブルマンション春日部１０３,2024-06-14,株式会社
エクシード合同会社,長野県諏訪郡下諏訪町５０３５番地２,2024-06-14,合同会社
エス・ケーエンジニアリング株式会社,大阪府大阪市平野区長吉川辺３丁目１９番１９号,2024-06-14,株式会社
エムテック株式会社,和歌山県和歌山市弘西１０６０番地６,2024-06-14,株式会社
オンサイト・フィールドパートナーズ合同会社,大阪府大阪市北区梅田１丁目２番２号大阪駅前第２ビル１２‐１２,2024-06-14,合同会社
キクチ工業株式会社,宮城県柴田郡柴田町大字四日市場字坂本前８１番地２,2024-06-14,株式会社
キノジ合同会社,東京都中央区銀座１丁目１２－４Ｎ＆ＥＢＬＤ．７階,2024-06-14,合同会社
クラブスターズ株式会社,東京都渋谷区神宮前６丁目１９番１５号高野第一ビル１０階Ｂ,2024-06-14,株式会社
ゲートエッジ合同会社,新潟県上越市石橋２丁目１１番２８号エレガントＢ２０２,2024-06-14,合同会社
コネクトライン株式会社,大阪府大阪市住吉区万代５丁目１８番４号,2024-06-14,株式会社
サンワマテリアルソリューションズ株式会社,福岡県北九州市戸畑区牧山５丁目１番２２号,2024-06-14,株式会社
シムディ合同会社,東京都新宿区新宿１丁目３６－２新宿第七葉山ビル３Ｆ,2024-06-14,合同会社
シンクロニシティホールディングス株式会社,大阪府大阪市北区西天満６丁目７－２,2024-06-14,株式会社
シン・リゾート株式会社,熊本県熊本市東区御領６丁目７番１０号,2024-06-14,株式会社
ジェミニホールディングス一般社団法人,東京都千代田区永田町２丁目１７番５号,2024-06-14,その他の設立登記法人
ジオスマイル株式会社,大阪府守口市南寺方南通３丁目４番２７号,2024-06-14,株式会社
スタジオエムズ株式会社,京都府京都市中京区夷川通柳馬場東入ル俵屋町２９２番地アスヴェル京都御所前Ⅱ,2024-06-14,株式会社
スナップミー合同会社,静岡県浜松市中央区神原町１０５５番地の９,2024-06-14,合同会社
スバラマ株式会社,福岡県福岡市中央区天神１丁目９番１７号福岡天神フコク生命ビル１５階,2024-06-14,株式会社
ソフィアホールディングス株式会社,千葉県千葉市若葉区西都賀５丁目８番２号,2024-06-14,株式会社
ソーシャルリノベーション合同会社,岡山県岡山市東区城東台西２丁目７ー６,2024-06-14,合同会社
タカオアセット合同会社,東京都中野区大和町１丁目６番９号レクシオシティ高円寺２０２,2024-06-14,合同会社
ダイリュー株式会社,愛知県名古屋市北区新堀町１９番地の１,2024-06-14,株式会社
トムトム株式会社,東京都世田谷区弦巻５丁目８番１２号,2024-06-14,株式会社
ドットライン税理士法人,千葉県千葉市美浜区中瀬２丁目６番地１,2024-06-14,その他の設立登記法人
ドリームライツ株式会社,千葉県富津市青木１４７４番地１,2024-06-14,株式会社
ドーベルアドバイザリー株式会社,東京都千代田区飯田橋１丁目１２番７号,2024-06-14,株式会社
ナガタケ株式会社,神奈川県相模原市緑区長竹２８４９番地１,2024-06-14,株式会社
ハニカム合同会社,東京都世田谷区大蔵５丁目２４番１１号,2024-06-14,合同会社
パンパシ合同会社,東京都品川区豊町１丁目１４－７クレール戸越２０１,2024-06-14,合同会社
ファストチェック株式会社,東京都港区芝浦４丁目１６番３１－５０４号,2024-06-14,株式会社
マイスターズ株式会社,福岡県福岡市中央区今泉１丁目１３番１１号,2024-06-14,株式会社
メタフーズ株式会社,京都府京都市伏見区横大路天王前５３番地,2024-06-14,株式会社
メディカル・ローカル・パートナーズ合同会社,東京都中央区銀座１丁目１２番４号Ｎ＆ＥＢＬＤ．６Ｆ,2024-06-14,合同会社
メディラックス株式会社,愛知県豊田市九久平町薬師１１番地７,2024-06-14,株式会社
モノリス株式会社,東京都渋谷区渋谷２丁目１９－１５宮益坂ビルディング６０９,2024-06-14,株式会社
モンドレ・タナカ株式会社,大阪府大阪市鶴見区今津中５丁目２番２６号,2024-06-14,株式会社
リライ合同会社,大阪府大阪市浪速区難波中３丁目５番１２－４号,2024-06-14,合同会社
リルステップ合同会社,福岡県福岡市中央区天神２丁目２番１２号Ｔ＆Ｊビルディング７Ｆ,2024-06-14,合同会社
リルバック合同会社,大阪府枚方市岡本町７番１号枚方ビオルネ５階ビィーゴ,2024-06-14,合同会社
リンクブリッジ株式会社,和歌山県和歌山市本町１丁目４３番地,2024-06-14,株式会社
ワイマークス合同会社,大阪府箕面市石丸３丁目２５Ｅ－４０２,2024-06-14,合同会社
一般社団法人かつしか活き生き健康麻雀サロン,東京都葛飾区奥戸２丁目８番１０－５０１号,2024-06-14,その他の設立登記法人
一般社団法人みんなの正しい金融知識,大阪府松原市柴垣１丁目２２番１１号,2024-06-14,その他の設立登記法人
一般社団法人ディパーチャー,大阪府大阪市東成区東小橋３丁目１番２号４階,2024-06-14,その他の設立登記法人
一般社団法人ハギノイエ,山口県萩市大字東浜崎町４番地６,2024-06-14,その他の設立登記法人
一般社団法人下山口丸山会,兵庫県西宮市山口町下山口５丁目５番１８号,2024-06-14,その他の設立登記法人
一般社団法人令星会,東京都文京区本郷３丁目２４番１１号スカーラ文京本郷１階,2024-06-14,その他の設立登記法人
一般社団法人勿忘草日本,東京都新宿区大久保２丁目１番８号,2024-06-14,その他の設立登記法人
一般社団法人少子化対策北海道,北海道札幌市厚別区厚別東三条７丁目１９番８号,2024-06-14,その他の設立登記法人
一般社団法人新湘南ウェルビーイング協議会準備会,神奈川県藤沢市村岡東２丁目２６番地１湘南ヘルスイノベーションパーク内,2024-06-14,その他の設立登記法人
一般社団法人日本住宅安全保安協会,大阪府摂津市東別府４丁目２番１号,2024-06-14,その他の設立登記法人
一般社団法人日本育成アスリートデータバンク協会,愛知県豊田市聖心町３丁目４０番地１,2024-06-14,その他の設立登記法人
一般社団法人椿,北海道北広島市Ｆビレッジ２１番,2024-06-14,その他の設立登記法人
一般社団法人真正日本の会,東京都渋谷区神宮前４丁目１３番２号ＨＡＰ表参道ビル,2024-06-14,その他の設立登記法人
一般社団法人睡眠時無呼吸症候群に打ち克つための患者の会,東京都中央区築地２丁目２番８号Ｍ．Ｂａｌａｎｃｅ＋ＧｉｎｚａＥａｓｔ５Ｆ,2024-06-14,その他の設立登記法人
一般社団法人福祉のひかり,栃木県那須塩原市清住町９４番地２８２テラパークくろいそ１０３号室,2024-06-14,その他の設立登記法人
一般社団法人赤ちゃんラボ５．０,東京都世田谷区駒沢３丁目１番３号シャトレー駒沢１００３,2024-06-14,その他の設立登記法人
一般社団法人関内大通り公園エリア商店会,神奈川県横浜市中区伊勢佐木町６丁目１４３番地８,2024-06-14,その他の設立登記法人
一般社団法人首都圏レジ開発ファイブ,東京都千代田区平河町１丁目６番１５号シルスフィア会計事務所内,2024-06-14,その他の設立登記法人
一般社団法人首都圏レジ開発フォー,東京都千代田区平河町１丁目６番１５号シルスフィア会計事務所内,2024-06-14,その他の設立登記法人
一般社団法人ＣＰＦフィルムファンド,東京都港区元赤坂１丁目１番８号赤坂コミュニティビル４階,2024-06-14,その他の設立登記法人
一般社団法人ＤＯ　ｌａｂ．,静岡県焼津市石津２２５０番地の１８,2024-06-14,その他の設立登記法人
一般社団法人ＥＢＯＳＨＩ　Ｒｕｇｂｙ　Ｃｌｕｂ,神奈川県茅ヶ崎市東海岸北４丁目５番５６－２０５号,2024-06-14,その他の設立登記法人
一般社団法人ＩＳＭ１,東京都港区西新橋１丁目２番９号メンターキャピタル税理士法人内,2024-06-14,その他の設立登記法人
一般社団法人Ｌｕｃａｓ,東京都品川区上大崎２丁目１８番３号レジディア目黒地下１階,2024-06-14,その他の設立登記法人
一般社団法人ＷＥ　ＡＴ,東京都文京区本郷３丁目３６番１０号,2024-06-14,その他の設立登記法人
一般財団法人りせら財団,大阪府大阪市中央区谷町２丁目３番地１号,2024-06-14,その他の設立登記法人
七月株式会社,東京都多摩市落合１丁目８番地の１ウィステリア１００２,2024-06-14,株式会社
三矢建設株式会社,大阪府豊中市上津島３丁目１１番１３－３０５号,2024-06-14,株式会社
上平ジュニア,富山県南砺市池尻３８,2024-06-14,その他
中材精密軸承有限公司,大阪府大阪市生野区巽中４丁目１２番１４号,2024-06-14,外国会社等
井口バドミントンクラブ,富山県南砺市池尻３８,2024-06-14,その他
京瀛匠株式会社,大阪府大阪市平野区瓜破東２丁目１番１２号,2024-06-14,株式会社
優尼可株式会社,京都府京都市東山区月輪町９６－８－２Ｆ,2024-06-14,株式会社
北港ホールディングス株式会社,大阪府大阪市西淀川区大野２丁目４番４号,2024-06-14,株式会社
医療法人Ｓｍｉｌｅ,大分県臼杵市大字臼杵字浜２ノ１０７番７２０,2024-06-14,その他の設立登記法人
合同会社ぐっすりん,香川県高松市香川町浅野２１２６番地３２,2024-06-14,合同会社
合同会社さちトラベルエージェンシー,沖縄県浦添市仲間１丁目１０番６号１階,2024-06-14,合同会社
合同会社ちとせや,福岡県久留米市山川町１６５０番地,2024-06-14,合同会社
合同会社ほのぼの脊振,佐賀県神埼市脊振町服巻５５１１番１,2024-06-14,合同会社
合同会社まめ,岡山県倉敷市茶屋町２１３０番地１１,2024-06-14,合同会社
