法人名,住所,設立日,法人種別
株式会社月ノ華,静岡県掛川市西大渕５５２５番地の１市営住宅１－５,2021-03-22,株式会社
株式会社東風,東京都港区虎ノ門３丁目７番１０号ランディック虎ノ門ビル,2021-03-22,株式会社
株式会社樹,兵庫県神戸市北区星和台１丁目９－４,2021-03-22,株式会社
株式会社櫻井工業,神奈川県横須賀市森崎３丁目１５番１１－１３号,2021-03-22,株式会社
株式会社永島塗装,神奈川県海老名市上今泉６丁目８番３１－２号,2021-03-22,株式会社
株式会社津田フォレスト,北海道札幌市北区南あいの里７丁目２９番９号,2021-03-22,株式会社
株式会社浦河ストロベリーファクトリー,北海道浦河郡浦河町字向別４４１番地の１,2021-03-22,株式会社
株式会社湊,愛知県名古屋市中区丸の内２丁目７番１９号,2021-03-22,株式会社
株式会社濱商人,千葉県流山市おおたかの森東２丁目１番地の１,2021-03-22,株式会社
株式会社益荒男,東京都杉並区荻窪５丁目２３番１２号オキビル１０３,2021-03-22,株式会社
株式会社真和志工業,沖縄県那覇市三原２丁目２１番２８号１階,2021-03-22,株式会社
株式会社神多,岡山県岡山市北区問屋町８番地１０１－１－Ｂ号,2021-03-22,株式会社
株式会社稚内急行,北海道石狩市親船東一条１丁目８番１０１号,2021-03-22,株式会社
株式会社結風,東京都目黒区鷹番２丁目１２番１号,2021-03-22,株式会社
株式会社翔,岐阜県岐阜市北島９丁目８番地４,2021-03-22,株式会社
株式会社英語攻略ドットコム,東京都中央区銀座１丁目２２番１１号銀座大竹ビジデンス２階,2021-03-22,株式会社
株式会社辰希商事,岐阜県羽島郡笠松町米野６６１番地の１,2021-03-22,株式会社
株式会社長栄,奈良県奈良市三条本町１２番５号,2021-03-22,株式会社
株式会社２１２１,北海道函館市富岡二丁目５１番１６号リコナゴム２０２号,2021-03-22,株式会社
株式会社６人,東京都渋谷区恵比寿１丁目２２番１０号ＧｒａｎＤｕｏ恵比寿Ⅲ４階,2021-03-22,株式会社
株式会社Ａ－ｏｎｅ,千葉県市原市下野７５番地３,2021-03-22,株式会社
株式会社ＡＩＤＸ,東京都千代田区大手町１丁目６番１号,2021-03-22,株式会社
株式会社ＡＺＥＮ,千葉県印西市草深２５３４番地１９,2021-03-22,株式会社
株式会社ＡａｎｄＩ,兵庫県姫路市飾東町庄２３０－２,2021-03-22,株式会社
株式会社Ａｎｚｅｎｉｏｎ,東京都千代田区神田小川町２丁目２番地,2021-03-22,株式会社
株式会社Ａｔｔｉ－ｔｕｄｅ,東京都港区海岸１丁目２番３号汐留芝離宮ビルディング２１階,2021-03-22,株式会社
株式会社Ａｙｅｙａｒｗａｄｙ　Ｊａｐａｎ,千葉県市原市辰巳台東５丁目１１番地１辰巳台東寮,2021-03-22,株式会社
株式会社ＢＥＡＲ　ＢＡＳＥ,東京都目黒区上目黒２丁目３１番１６号サンハイム祐天寺１０１号,2021-03-22,株式会社
株式会社ＢＯＴＨ,東京都渋谷区渋谷３丁目１番９号ＹＡＺＡＷＡビル３階,2021-03-22,株式会社
株式会社Ｂｒｅｍｅｎ,東京都世田谷区代沢２丁目４０－３コート・プリムローズ２０５,2021-03-22,株式会社
株式会社Ｃ・Ｓセンターフィールド,神奈川県厚木市妻田南１丁目２番１８号,2021-03-22,株式会社
株式会社ＣＥＲＥＺＯＩ,山口県岩国市平田３丁目８７番１２号,2021-03-22,株式会社
株式会社ＣＨ－５,富山県南砺市長源寺８９番地,2021-03-22,株式会社
株式会社ＣＨＲＯＮＯ　ＳＴＹＬＥ,東京都台東区入谷１丁目１９番１０号１階,2021-03-22,株式会社
株式会社ＣＯＤＥ,大阪府大阪市中央区宗右衛門町２番２９号,2021-03-22,株式会社
株式会社ＣＲＥＡオキナワ,沖縄県豊見城市字豊崎１番地１１７７シーアンドパークス８０７号,2021-03-22,株式会社
株式会社ＣＳＭＳ,愛知県日進市梅森台１丁目１５３番地,2021-03-22,株式会社
株式会社Ｃａｍｐａｎｅｌｌａ,東京都文京区後楽２丁目６番１号,2021-03-22,株式会社
株式会社Ｃｉｔｙ,北海道札幌市中央区北二条西１２丁目２番地２ライフプラザ北二条１５０２号,2021-03-22,株式会社
株式会社Ｃｏ－ＬａＶｏ,東京都渋谷区恵比寿４丁目２０番３号恵比寿ガーデンプレイスタワー１８階,2021-03-22,株式会社
株式会社ＤＫＩ,静岡県浜松市南区安松町６番地の１１,2021-03-22,株式会社
株式会社Ｄｅａｉｗｏ,大阪府大阪市福島区福島７丁目１５番１－１８０６号,2021-03-22,株式会社
株式会社ＥＭＢＬＥＭ,大阪府大阪市中央区東心斎橋２丁目２番６号,2021-03-22,株式会社
株式会社ＥＶｅｒｙｏｎｅ,埼玉県さいたま市北区日進町３丁目３９４－１１,2021-03-22,株式会社
株式会社ＥＸＥＭＡＴＥＳ,東京都世田谷区北沢５丁目３４番７号ル・シエル１０３,2021-03-22,株式会社
株式会社Ｆｌｅｕｖｅ,愛知県名古屋市中区大井町１番２４号ヴィークタワー名古屋東別院２９０２号室,2021-03-22,株式会社
株式会社ＦｒｅｅＳｔｙｌｅ,埼玉県朝霞市朝志ケ丘１丁目５番４０－Ｓ－９０５号,2021-03-22,株式会社
株式会社Ｆｒｏｍ　ＤＲ,東京都台東区池之端１丁目４番３３－９１１号,2021-03-22,株式会社
株式会社ＧＡＴＥＷＡＹ,山梨県甲府市中町３３５番地２,2021-03-22,株式会社
株式会社ＧＯ－ＳＥＮＦＵ,東京都世田谷区駒沢１丁目１８番４号,2021-03-22,株式会社
株式会社Ｇｏｌｄ　Ｓｔａｒ,大阪府大阪市生野区鶴橋２丁目１６番１０号グランデュール鶴橋２０６号,2021-03-22,株式会社
株式会社ＨＡＲＵＡ,静岡県沼津市大岡１５４４番地の４,2021-03-22,株式会社
株式会社ＨＵＢＣＯＭ,東京都渋谷区渋谷３丁目２６番１６号第五叶ビル５Ｆ,2021-03-22,株式会社
株式会社Ｈｅｌｄ　Ｌｉｆｅ,岐阜県中津川市新町１－１２スガイビル１号棟２階,2021-03-22,株式会社
株式会社ＨｕｍｍｉｎｇＤｅｎｔ,千葉県佐倉市中志津２丁目３５－１８－４０１,2021-03-22,株式会社
株式会社ＩＣＭＧ　Ｐａｒｔｎｅｒｓ,東京都千代田区丸の内２丁目１番１号,2021-03-22,株式会社
株式会社Ｊワークス,大阪府堺市美原区多治井４８８,2021-03-22,株式会社
株式会社ＪＡＶＩ　ＳＴＯＲＥ,大阪府大阪市浪速区日本橋４丁目１３番１９号,2021-03-22,株式会社
株式会社ＪＣソリューションズ,大阪府大阪市淀川区西中島３丁目１８番９号新大阪日大ビル６階,2021-03-22,株式会社
株式会社ＪＦＫ,京都府京都市山科区厨子奥若林町３９番地３,2021-03-22,株式会社
株式会社Ｊｏｙ　Ｆｏｒｅｖｅｒ,和歌山県和歌山市栄谷５８番地２８,2021-03-22,株式会社
株式会社Ｊｕｎｃｔｉｏｎ　Ｐａｒｔｎｅｒｓ,東京都千代田区九段南１丁目５番６号りそな九段ビル５ＦＫＳフロア,2021-03-22,株式会社
株式会社Ｋ．Ｔ．Ｙ,兵庫県神戸市北区日の峰４丁目２－４,2021-03-22,株式会社
株式会社Ｋ２Ｓ　Ｐａｒｔｎｅｒｓ,愛知県名古屋市西区那古野１丁目１７番２４号,2021-03-22,株式会社
株式会社ＫＢホールディングス,東京都台東区浅草橋３丁目２６番５号,2021-03-22,株式会社
株式会社ＫＩＲＥＩＤＯ,東京都世田谷区世田谷３丁目１６番１０号,2021-03-22,株式会社
株式会社ＫＵＲＵＮＥ,埼玉県さいたま市大宮区大門町３丁目１９１番地,2021-03-22,株式会社
株式会社ＫｉＮＧ,東京都渋谷区千駄ヶ谷２丁目３番５－２０３号,2021-03-22,株式会社
株式会社Ｌａｒｍｅ,埼玉県草加市八幡町９２９番地２ヌーヴ八幡壱番館２０５号,2021-03-22,株式会社
株式会社Ｌｉｆｅ　Ｍｉｎｉｎｇ　Ｓｙｓｔｅｍ,東京都中央区築地３丁目９番１０号築地ビル９Ｆ,2021-03-22,株式会社
株式会社Ｌｉｌｙｕ,東京都江東区辰巳１丁目７番２８号,2021-03-22,株式会社
株式会社Ｌｕｋｅ,岐阜県瑞浪市南小田町４丁目８番地,2021-03-22,株式会社
株式会社ＭＡＣＯＴＴＹ　ＥＡＲＴＨ,東京都世田谷区代田６丁目８番３１号,2021-03-22,株式会社
株式会社ＭＡＫＡＮＡ,山形県東村山郡中山町大字長崎４６２０番地４,2021-03-22,株式会社
株式会社ＭＣＧシニア経営アドバイザーズ,東京都港区芝大門１丁目１０－１１芝大門センタービル１０Ｆ,2021-03-22,株式会社
株式会社ＭＧ,東京都目黒区鷹番２丁目１９番２２号,2021-03-22,株式会社
株式会社Ｍｏｖｉｎｇ,千葉県浦安市今川２丁目２－１２ＩＮＴ２１－１０８号,2021-03-22,株式会社
株式会社Ｎ．ｃｌａｓｓ,大阪府大阪市北区黒崎町３番１４号リーガル梅田１００１号室,2021-03-22,株式会社
株式会社ＮＥＸＴ　ＩＴＭ,千葉県千葉市中央区中央１丁目１０番５号パークサイド千葉４Ｆ,2021-03-22,株式会社
株式会社ＮＯＥＬＡＮＩ,東京都港区港南４丁目６番５－７０５号,2021-03-22,株式会社
株式会社ＮＯＴ’Ｓ,埼玉県さいたま市桜区大字白鍬５９７番地５,2021-03-22,株式会社
株式会社Ｏｍｕｓｕｂｉ,福井県福井市川合鷲塚町２５号２１番地,2021-03-22,株式会社
株式会社ＯｎｅＲｉｎｇ,大阪府松原市天美東４丁目３１０番地の１（３０１号）,2021-03-22,株式会社
株式会社Ｏｒｉｇｉｎ＆Ｒｅｌａｘ,兵庫県芦屋市松浜町８番１８－３０６号,2021-03-22,株式会社
株式会社ＰＡＹＴＯＮ,愛知県名古屋市西区名駅２丁目３４番１７号セントラル名古屋１１０１号,2021-03-22,株式会社
株式会社ＰＲＩＭＥ,大阪府大阪市中央区宗右衛門町２番２９号,2021-03-22,株式会社
株式会社Ｐｌａｔｉｎｕｍ　Ｔｈｅｒａｐｉｓｔ,茨城県牛久市猪子町９９２番地６９５,2021-03-22,株式会社
株式会社Ｐｏｗｅｒｍｏｕｓｅ,東京都港区赤坂２丁目２１番４号天翔赤坂ＡＮＮＥＸビル３１０号室,2021-03-22,株式会社
株式会社Ｐｏｗｅｒｚ,千葉県匝瑳市飯倉１４９番地アビル飯倉ハイツ２０１,2021-03-22,株式会社
株式会社Ｒ‐ａｃｅ,東京都港区南青山２丁目２番１５号,2021-03-22,株式会社
株式会社ＲＥＩＤＥＮＳＥＴＳＵ,沖縄県那覇市字仲井真２９５番地２プレサンスロジェ仲井真レーヴ５０３,2021-03-22,株式会社
株式会社Ｒｅｖｏｉａ,東京都あきる野市原小宮８０番地１,2021-03-22,株式会社
株式会社Ｓ’Ｃｏｎｎｅｃｔ,東京都渋谷区渋谷１丁目１５番１５号,2021-03-22,株式会社
株式会社Ｓ＆Ｓ,東京都文京区千駄木３丁目４７番１２号,2021-03-22,株式会社
株式会社Ｓ－ｓｔａｇｅ,神奈川県相模原市緑区相原２丁目７番４３号,2021-03-22,株式会社
株式会社ＳＡＳＵＫＥ,埼玉県八潮市大字大曽根７９５番地１１,2021-03-22,株式会社
株式会社ＳＥＩＳ　ＷＯＯＤ,東京都港区六本木５丁目１８番１７－５０２号,2021-03-22,株式会社
株式会社ＳＫＥ,埼玉県さいたま市西区大字指扇領別所３０番地,2021-03-22,株式会社
株式会社ＳＲホールディングス,愛知県犬山市字大門４番地１,2021-03-22,株式会社
株式会社ＳＵ,東京都中央区銀座８丁目１７番５号,2021-03-22,株式会社
株式会社Ｓｌｅｅｐ　Ｐｒｏ．,兵庫県宝塚市仁川北３丁目７番３２号ドエル仁川２０１号,2021-03-22,株式会社
株式会社Ｓｏｒａｙｕ,大阪府大東市南新田１丁目３番１３号摂津倉庫株式会社本社ビル３階,2021-03-22,株式会社
株式会社ＳｏｗｏｎＳｏｆｔ,東京都港区台場１丁目１－１－８０５,2021-03-22,株式会社
株式会社ＴＡＫ,三重県鈴鹿市大池３丁目１１番７号,2021-03-22,株式会社
株式会社ＴＨＡＩ　ＤＵＯＮＧ,埼玉県吉川市木売２丁目３番地１０,2021-03-22,株式会社
株式会社ＴＫＢＣ,三重県松阪市小片野町１２４８番地１,2021-03-22,株式会社
株式会社ＴＮＴ,東京都渋谷区神宮前３丁目４２番２号,2021-03-22,株式会社
株式会社ＴＲＵＳＴ,千葉県市川市行徳駅前１丁目１６番６－４０３号,2021-03-22,株式会社
株式会社ＴＹ,大阪府大阪市旭区新森７丁目５番１５号１階,2021-03-22,株式会社
株式会社ＴＹコーポレーション,静岡県浜松市中区鹿谷町３７番１号,2021-03-22,株式会社
株式会社ＵＴＳ,東京都世田谷区太子堂４丁目５番２号広田ビル１Ｆ,2021-03-22,株式会社
株式会社ＷＢ,岐阜県本巣市海老２８番地,2021-03-22,株式会社
株式会社ＷＩＴＨ　ＥＮＴＥＲＴＡＩＮＭＥＮＴ,東京都港区南青山２丁目２番１５号ウィン青山９４２,2021-03-22,株式会社
株式会社Ｙ，Ｓサービス,大阪府大阪市鶴見区今津北３丁目７番３１号,2021-03-22,株式会社
株式会社ＺＡＩＤ　ＡＵＴＯ,神奈川県伊勢原市下谷５１０番地Ａ,2021-03-22,株式会社
株式会社ａｎ　ｋｎｏｗｎ,大阪府大阪市中央区安土町１丁目５番９号ゼニアベストビル２階Ｄ室,2021-03-22,株式会社
株式会社ｆｌｅｘ,東京都墨田区太平３丁目１４番２－４０１号,2021-03-22,株式会社
株式会社ｇｌａｄ,大阪府大阪市中央区南船場４丁目１０－５南船場ＳＯＨＯビル７０２,2021-03-22,株式会社
株式会社ｈｕｇｏ,東京都港区南青山６丁目４番６号,2021-03-22,株式会社
株式会社ｋｕｔｉｎａくちな工務店,福島県福島市宮代字下川原５０番地の８,2021-03-22,株式会社
株式会社ｍｏｔｏ　ｉｎｃｕｂａｔｅ,東京都中央区銀座６丁目１０番１号ＧＩＮＺＡＳＩＸ１３Ｆ,2021-03-22,株式会社
株式会社ｎｏｕｋａ,神奈川県三浦市三崎町諸磯１５番７号サンライズマンション３０２号,2021-03-22,株式会社
株式会社ｒａ－ｋｉｒａｒｉ,京都府京都市伏見区深草西浦町７丁目４１番地,2021-03-22,株式会社
株式会社ｓｕｍｉｋａｅ,大阪府大阪市平野区平野本町２丁目１０番２５号,2021-03-22,株式会社
株式会社ｔａｓｔｙＰｅａ,北海道札幌市中央区南十二条西１４丁目２番１２－２０２号,2021-03-22,株式会社
梅田不動産株式会社,大阪府大阪市中央区谷町１丁目３番１７号,2021-03-22,株式会社
欣欣合同会社,東京都北区赤羽１丁目１０－２－２Ｆ,2021-03-22,合同会社
江上さくら企画室株式会社,東京都文京区大塚４丁目５１番３号,2021-03-22,株式会社
池田機械系統株式会社,東京都千代田区東神田２丁目６番７号７０１,2021-03-22,株式会社
特定非営利活動法人ちば救命・ＡＥＤ普及研究会,千葉県市川市宮久保３丁目１番２３号,2021-03-22,その他の設立登記法人
特定非営利活動法人上州武尊山スカイビュートレイル,群馬県利根郡川場村大字谷地２４１０番地１,2021-03-22,その他の設立登記法人
特定非営利活動法人唐津Ｓｗｉｔｃｈ,佐賀県唐津市京町１７８３番地ＫＡＲＡＥ２階,2021-03-22,その他の設立登記法人
特定非営利活動法人Ｔｈｉｎｋ,大阪府大阪市住之江区南港北１丁目３１番１７－１２０４号,2021-03-22,その他の設立登記法人
犬塚農園合同会社,岡山県岡山市北区芳賀３８０１番地３,2021-03-22,合同会社
理程国際株式会社,北海道札幌市中央区南十一条西１丁目３番１７号,2021-03-22,株式会社
白馬工業株式会社,愛知県稲沢市北島５丁目８番地,2021-03-22,株式会社
祖龍ゲームズ株式会社,東京都港区南麻布３丁目１９番２３号オーク南麻布ビル２階,2021-03-22,株式会社
神戸佳元株式会社,兵庫県神戸市須磨区妙法寺字兀山１９－１１,2021-03-22,株式会社
秋田くりひろげ株式会社,秋田県秋田市中通２丁目２番３２号山二ビル７Ｆ,2021-03-22,株式会社
純粋実践株式会社,東京都足立区扇１丁目１１－２３,2021-03-22,株式会社
老舗計画株式会社,宮城県柴田郡大河原町字西浦３５－１,2021-03-22,株式会社
華勤技術日本株式会社,東京都港区港南２丁目１６番１号品川イーストタワー４階,2021-03-22,株式会社
補助金ラボ株式会社,愛知県名古屋市緑区大清水東２０５番地,2021-03-22,株式会社
西新宿エステイト合同会社,東京都中央区銀座１丁目２２－１１銀座大竹ビジデンス２階,2021-03-22,合同会社
農事組合法人塩沢ファーム,福島県石川郡石川町大字塩沢字竹ノ内８９番地,2021-03-22,その他の設立登記法人
農園パンダ株式会社,和歌山県橋本市向副１０４７番地,2021-03-22,株式会社
近藤事務所合同会社,東京都世田谷区成城８丁目５番１８号,2021-03-22,合同会社
関西リード合同会社,大阪府大阪市西区北堀江２丁目２番２８－１１０２号,2021-03-22,合同会社
８５Ｂ合同会社,福岡県飯塚市菰田西２丁目２－１３ＡＢＮｏ．２,2021-03-22,合同会社
ＡＣＷ株式会社,東京都世田谷区奥沢２丁目８番１７号,2021-03-22,株式会社
ＡＲＵＮ　ＫＩＲＡＮＡ　ＰＡＳＡＬ,東京都足立区青井４丁目３－１９,2021-03-22,外国会社等
Ａｒｔ　Ｅｎｇｉｎｅｅｒ株式会社,熊本県合志市須屋２７６５番地２,2021-03-22,株式会社
ＣＯＰＥＲＮＩＣＵＳ－ｉｎｆｌｅｘｉｏｎ株式会社,東京都世田谷区上野毛４丁目３６－４,2021-03-22,株式会社
Ｄｅｎｍａｒｋ株式会社,神奈川県横浜市青葉区柿の木台１２番地４０,2021-03-22,株式会社
Ｄｉａｍｏｎｄ行政書士法人,東京都渋谷区桜丘町９番１８－２０５号,2021-03-22,その他の設立登記法人
ＥＲＧ　Ｊａｐａｎ合同会社,東京都新宿区西新宿１丁目２６番２号,2021-03-22,合同会社
Ｅａｒｔｈｙ　Ｂｌｕｅ合同会社,東京都世田谷区若林２丁目２８番６－２０１号,2021-03-22,合同会社
Ｅｎｔｅｘ　Ｈｏｌｄｉｎｇｓ株式会社,東京都世田谷区用賀４丁目１０番３号世田谷ビジネススクエアヒルズⅡ－３４号室,2021-03-22,株式会社
Ｆｉｌｏｔｉｍｏ株式会社,東京都豊島区東池袋１丁目３１番５－１０３号,2021-03-22,株式会社
ＧＡ合同会社,愛知県名古屋市中区栄１丁目７番２８号ローレルタワー名古屋栄１８０２号,2021-03-22,合同会社
ＧＥＭＺ合同会社,東京都港区浜松町２丁目２－１５浜松町ダイヤビル２Ｆ,2021-03-22,合同会社
ＨＱ合同会社,東京都新宿区大久保３丁目１０番１号ニュータウン大久保Ａ棟１５１１,2021-03-22,合同会社
ＨＲＤ株式会社,東京都町田市図師町６１５番地１,2021-03-22,株式会社
Ｈｏｎｇｊｉジャパン株式会社,東京都渋谷区東１丁目１番３６号キタ・ビルデンス,2021-03-22,株式会社
Ｉ・Ｙ・ＬＡＮＫＡ　ＩＮＴＥＲＮＡＴＩＯＮＡＬ株式会社,千葉県松戸市小金４４８番地の２サンハイツ大森１０３号,2021-03-22,株式会社
ＩＮＳｅｅＫ合同会社,東京都千代田区神田須田町１丁目１２番地山萬ビル２０２Ｂ,2021-03-22,合同会社
ＬＡＶＡＢＡ合同会社,兵庫県西宮市今津曙町７番４号,2021-03-22,合同会社
ＬＡＸＭＩ合同会社,東京都杉並区下井草１丁目３２番２号サンハイツビル１０８,2021-03-22,合同会社
ＬＯＯＰ合同会社,静岡県浜松市西区舘山寺町１３８３番地の１Ｃ棟,2021-03-22,合同会社
ＬＹＯトータルマネージメント合同会社,東京都渋谷区富ヶ谷２丁目１１番１２－１０６号,2021-03-22,合同会社
ＭＡＫＩ　ＵＥＤＡ合同会社,沖縄県石垣市字桴海５４５－５－２Ａ,2021-03-22,合同会社
ＭＡＴＳＵＲＩＫＡ株式会社,東京都中央区築地１丁目９番１１号,2021-03-22,株式会社
ＮＰＯ法人トイロ,大阪府吹田市南金田２丁目２４番１０号９０１,2021-03-22,その他の設立登記法人
ＮＳペース株式会社,千葉県千葉市中央区本町２丁目９番１４号,2021-03-22,株式会社
ＮＵＸＩＬ株式会社,愛知県あま市金岩後堂１９番地カサデアンジェラＢ棟１０２号,2021-03-22,株式会社
Ｎｏｚａｗａ　Ｏｎｓｅｎ　Ｄｉｓｔｉｌｌｅｒｙ株式会社,長野県下高井郡野沢温泉村大字豊郷９３９４,2021-03-22,株式会社
ＯＧＮＩ１０５０株式会社,熊本県阿蘇郡小国町大字黒渕１７０４番地３３,2021-03-22,株式会社
Ｏｆｆｉｃｅ　ＪＵＮＯ合同会社,大阪府大阪市淀川区加島３丁目１３番２９－３２号,2021-03-22,合同会社
Ｏｆｆｉｃｅせせらぎ合同会社,神奈川県横浜市鶴見区北寺尾３丁目１６番７号,2021-03-22,合同会社
ＰＪＰトレーディングランカ合同会社,千葉県山武市大木４５３番地,2021-03-22,合同会社
Ｐａｔｅｎｔｕｐ合同会社,東京都渋谷区恵比寿１丁目２３番６号ザマグノリアガーデン恵比寿３０６,2021-03-22,合同会社
Ｐｈｏｄｉｅ合同会社,兵庫県三木市志染町青山５丁目１８－２０,2021-03-22,合同会社
Ｐｉｘａｇｅ合同会社,大阪府八尾市上之島町南４丁目２番地クレアール山本１０５号,2021-03-22,合同会社
Ｒ８Ｇ　Ｊａｐａｎ株式会社,東京都港区虎ノ門４丁目３番１号城山トラストタワー東京赤坂法律事務所内,2021-03-22,株式会社
ＲＡパートナーズ株式会社,栃木県足利市八幡町２丁目３４番地２ローゼンクローネ５０１,2021-03-22,株式会社
ＳＯＵＬ　ＰＥＡＣＥ合同会社,熊本県熊本市東区戸島西２丁目３番６２号,2021-03-22,合同会社
Ｓｉｎｃｅｒｅ　Ｒｅｇｅｎ株式会社,東京都国分寺市本町２丁目２５番地１４号エミネンス国分寺１Ｆ一般社団法人分子免疫学研究所内,2021-03-22,株式会社
Ｔ＆Ｍコーディネート合同会社,埼玉県さいたま市見沼区大和田町１丁目１８８９番地２１,2021-03-22,合同会社
ＴＥＡＭ　ＳＫＹ　ＫＹＯＴＯ合同会社,京都府京都市西京区嵐山上海道町１５番地,2021-03-22,合同会社
ＵＡゼンセンエムエムインターナショナルユニオン,東京都千代田区神田錦町１丁目２１番１号,2021-03-22,その他の設立登記法人
Ｕｎｉｔｙ　Ｗｅｌｌ株式会社,岩手県盛岡市上堂３丁目２１番８号,2021-03-22,株式会社
ｆｕｌｌｂｌｏｏｍ合同会社,東京都世田谷区成城７丁目３３番７号カスターナ成城３０１,2021-03-22,合同会社
ｌｉｒｉｓｅ　ＥＮＴＥＲＴＡＩＮＭＥＮＴ合同会社,千葉県市原市椎津３０３５番地,2021-03-22,合同会社
いろはパートナーズ株式会社,三重県四日市市浮橋２丁目６番地１１,2021-03-23,株式会社
けいじゅ健康保険組合,石川県七尾市桜町９１－１,2021-03-23,その他
なんくる株式会社,沖縄県浦添市伊祖３丁目１４番２０号,2021-03-23,株式会社
ふくふく株式会社,富山県富山市吉作４７４１番地,2021-03-23,株式会社
みうらーや合同会社,栃木県那須郡那須町大字漆塚９８６番地１０,2021-03-23,合同会社
アジアメディカルトレーディング株式会社,大阪府大阪市北区角田町八丁目４７,2021-03-23,株式会社
アジュールコンサルティング株式会社,神奈川県横浜市泉区桂坂１５番地１,2021-03-23,株式会社
アッステック合同会社,神奈川県川崎市宮前区平２丁目５番１３号セルビード山田１０３,2021-03-23,合同会社
アライル株式会社,東京都台東区浅草橋２丁目８番３,2021-03-23,株式会社
アロヒカイコンサルティング合同会社,神奈川県藤沢市片瀬海岸１丁目３番７号－２０２,2021-03-23,合同会社
アンキテラ合同会社,東京都中央区銀座７丁目１３番６号サガミビル２階,2021-03-23,合同会社
アンテー合同会社,神奈川県川崎市多摩区登戸１９１９,2021-03-23,合同会社
アースフロント合同会社,大分県大分市大字寒田６番地の１０,2021-03-23,合同会社
アーブル・オーク株式会社,広島県広島市西区観音町６番１９－９０４号,2021-03-23,株式会社
