法人名,住所,設立日,法人種別
株式会社Ｓｕｍｉｃａ,石川県金沢市香林坊２丁目１２番２０号,2018-02-21,株式会社
株式会社ＳｗｉＴｃｈ．,東京都千代田区九段南１丁目５番６号りそな九段ビル５Ｆ,2018-02-21,株式会社
株式会社ＴＥＴＵＪＩＮ,大阪府大阪市城東区今福南２丁目２番４号,2018-02-21,株式会社
株式会社ＴＭ,東京都港区六本木６丁目８番１０号,2018-02-21,株式会社
株式会社ＴＭ＆Ｓ,福岡県北九州市八幡西区下上津役３丁目６番１号,2018-02-21,株式会社
株式会社ＴＳＳ,京都府京都市南区東九条河辺町２１番地２２,2018-02-21,株式会社
株式会社ＴＳＵＢＡＳＡ　ＴＲＡＮＳ,京都府京都市南区上鳥羽中河原２３番地,2018-02-21,株式会社
株式会社ＴＵＣＣＩ,東京都世田谷区八幡山１丁目５番９号,2018-02-21,株式会社
株式会社ＴｅｔｓｕＣｏｍｐａｎｙ,沖縄県那覇市松山１丁目１３番８号タップスビル５Ｆ,2018-02-21,株式会社
株式会社Ｔｈａｎｋｓ,大阪府大阪市港区市岡元町３丁目９番１８号,2018-02-21,株式会社
株式会社ＵＤＮ　Ｆｏｏｄ　ｓｅｒｖｉｃｅ,東京都大田区南馬込２丁目２７番３号,2018-02-21,株式会社
株式会社ＶｉｐｅａｒＴｅｃｈ,愛知県名古屋市西区牛島町６番１名古屋ルーセントタワー４０階,2018-02-21,株式会社
株式会社Ｗｈｉｔｅ　ｌｉｓｔ,東京都中央区日本橋本町２丁目３番１６－４０４号,2018-02-21,株式会社
株式会社Ｗｏｌｆｎｅｓｓ,東京都中野区東中野１丁目２４番９号,2018-02-21,株式会社
株式会社ＸＡＮＡＤＵ,千葉県千葉市花見川区検見川町２丁目５８８－２－２０５号,2018-02-21,株式会社
株式会社Ｘｂｏｎｄ,東京都練馬区貫井３丁目６番３号,2018-02-21,株式会社
株式会社ＸｙｌｏＴｅｃｎｉｃａ,東京都港区芝３丁目４番１１号芝シティビル２階,2018-02-21,株式会社
株式会社ＺＥＲＯ,岐阜県各務原市鵜沼西町１丁目４０７番地２,2018-02-21,株式会社
株式会社ａ　ｖｅｊｕ,東京都渋谷区恵比寿４丁目３－１,2018-02-21,株式会社
株式会社ｅｍｂｏｄｙ,東京都台東区寿４丁目１３番１０号,2018-02-21,株式会社
株式会社ｍａｋ．ｅ．ｔｏｄｏ,福岡県福岡市南区大楠３丁目４番２０号,2018-02-21,株式会社
株式会社ｍｏｄｅ,福岡県福岡市博多区美野島３丁目１７番３０号,2018-02-21,株式会社
株式会社ｎｏｂｏｔｈｅｒ,東京都港区高輪３丁目１２番８号,2018-02-21,株式会社
株式会社ｓｔｕｄｉｏぱれっと,東京都杉並区阿佐谷南３丁目５０番４号,2018-02-21,株式会社
株式会社ｔｈｉｓ　ｉｓ　ｎｏｔ　ａ　ｓｔｏｒｅ,東京都渋谷区神宮前２丁目１８番７号外苑ビル５階Ｂ号室,2018-02-21,株式会社
樂株式会社,静岡県熱海市春日町９番１号１７０３,2018-02-21,株式会社
海悦商事株式会社,大阪府大阪市浪速区日本橋４丁目９番９号,2018-02-21,株式会社
淡企画合同会社,兵庫県南あわじ市八木養宜上９６３－８南の街五番館Ｂ－２,2018-02-21,合同会社
清水商事合同会社,東京都新宿区百人町１丁目２２番７号５０２号室,2018-02-21,合同会社
特定非営利活動法人そなえるＯＳＡＫＡ,大阪府高槻市上牧町２丁目６番１６号,2018-02-21,その他の設立登記法人
特定非営利活動法人はぐ・くむ＆ＷＡＮ,大阪府箕面市新稲５丁目４番２９号,2018-02-21,その他の設立登記法人
特定非営利活動法人みさと田園空間クリエーターズ,山形県天童市大字寺津１４１０番地三郷堰土地改良会館内,2018-02-21,その他の設立登記法人
特定非営利活動法人らいおんの泉,福井県福井市浅水町第１４号２５番地,2018-02-21,その他の設立登記法人
特定非営利活動法人クリーンリバース,徳島県阿南市長生町おわた２番地１１,2018-02-21,その他の設立登記法人
特定非営利活動法人ジャパン・ハワイ友好協会,神奈川県横浜市港南区港南台９丁目２３番１８－３０４号,2018-02-21,その他の設立登記法人
特定非営利活動法人合気道無限塾東京,東京都目黒区南３丁目１３番５－１０５号ソアラノーム大岡山,2018-02-21,その他の設立登記法人
特定非営利活動法人福井県日独友好親善協会,福井県福井市大手１丁目１番１２号,2018-02-21,その他の設立登記法人
特定非営利活動法人蘆花会,東京都世田谷区駒沢２丁目４３番５号,2018-02-21,その他の設立登記法人
特定非営利活動法人虹の架け橋,宮城県仙台市青葉区木町通２丁目３番３９号,2018-02-21,その他の設立登記法人
特定非営利活動法人ＤＮＮＰ,長崎県長崎市新地町１２番８号５Ｆ,2018-02-21,その他の設立登記法人
特定非営利活動法人ＳＭＩＬＥ　ＣＡＭＰ,大阪府守口市京阪本通２丁目１０番６号４０１号室,2018-02-21,その他の設立登記法人
瑞栄合同会社,北海道稚内市末広４丁目１番２２号,2018-02-21,合同会社
瑞迅貿易株式会社,大阪府大阪市東住吉区湯里５丁目１６番５号３Ｆ－Ｃ室,2018-02-21,株式会社
留寿都ウインド合同会社,東京都千代田区二番町５番地５,2018-02-21,合同会社
社会保険労務士法人ＪＭＴＹ,東京都渋谷区桜丘町１７番１２号渋谷ジョンソンビル４０１号,2018-02-21,その他の設立登記法人
神田自動車株式会社,北海道帯広市西二十一条南５丁目２３番地１０,2018-02-21,株式会社
税理士法人Ｓ．Ｐ．Ａ総合会計,大阪府大阪市淀川区宮原４丁目１番４５号新大阪八千代ビル,2018-02-21,その他の設立登記法人
稲庭ウインド合同会社,東京都千代田区二番町５番地５,2018-02-21,合同会社
羽曳野スリッパ株式会社,東京都中央区日本橋小伝馬町１０番８号７階,2018-02-21,株式会社
興達国際株式会社,宮城県仙台市青葉区角五郎１丁目３番２号,2018-02-21,株式会社
花沢堂合同会社,大阪府柏原市大字青谷７８３番地の１,2018-02-21,合同会社
茨城塙ウインド合同会社,東京都千代田区二番町５番地５,2018-02-21,合同会社
行田工業株式会社,鹿児島県奄美市名瀬佐大熊町１６番１１号,2018-02-21,株式会社
谷川株式会社,宮崎県宮崎市恒久３丁目２０番地４,2018-02-21,株式会社
超達人株式会社,東京都新宿区高田馬場２丁目６番１０号高田馬場アドレス４０５号室,2018-02-21,株式会社
農事組合法人すいとー宇波,島根県安来市広瀬町宇波４７９番地３,2018-02-21,その他の設立登記法人
農事組合法人やぶだい,秋田県大仙市寺館字寺館１２番地,2018-02-21,その他の設立登記法人
農事組合法人ガンバいさご,岩手県花巻市東和町砂子２区４６６番地,2018-02-21,その他の設立登記法人
遠藤建築株式会社,福島県南相馬市鹿島区塩崎字別当廹３番地の１,2018-02-21,株式会社
金子合同会社,東京都中央区日本橋人形町３丁目４番８号,2018-02-21,合同会社
金燕株式会社,東京都江東区有明１丁目１番１７－３３１０号,2018-02-21,株式会社
雲呑房株式会社,神奈川県川崎市川崎区駅前本町２６番地２－２０２８区画,2018-02-21,株式会社
３８５プランニング株式会社,東京都新宿区新宿１丁目１９番１０号サンモールクレスト４Ｆ,2018-02-21,株式会社
ＡＣＥ合同会社,大阪府大阪市浪速区戎本町１丁目９番２１号,2018-02-21,合同会社
ＡＣＶ株式会社,東京都世田谷区尾山台３丁目３番７号,2018-02-21,株式会社
ＡＯＴ株式会社,愛知県安城市横山町大山田中７番地１ロイヤルハイム岡田４０３,2018-02-21,株式会社
Ａｄｅｎ　Ｊａｐａｎ株式会社,東京都渋谷区恵比寿４丁目２０番３号恵比寿ガーデンプレイスタワー１８階,2018-02-21,株式会社
ＣＲＥＳＴ株式会社,大阪府大阪市城東区放出西２丁目６番１５号ミレグランデアネックス６０５号室,2018-02-21,株式会社
ＣｏｎｎｅｃｔＸ　Ｉｎｔｅｒｎａｔｉｏｎａｌ株式会社,東京都港区六本木６丁目８番１０号ＳＴＥＰ六本木ビルＷＥＳＴ１Ｆ,2018-02-21,株式会社
ＤＪ　ＭｉｃｒｏＬａｍｉｎａｔｅｓ株式会社,東京都港区南麻布３丁目１９番２３号オーク南麻布ビル２階,2018-02-21,株式会社
Ｄｅｃｅｎｔｒａｌｉｚｅｄ合同会社,東京都渋谷区本町５丁目３０番１４号ジュエルージュ渋谷２０１,2018-02-21,合同会社
ＥＪ＆ＡＩＴ合同会社,東京都千代田区丸の内１丁目２番１号,2018-02-21,合同会社
ＦＰＭホールディングス株式会社,東京都千代田区外神田６丁目２番８号松本ビル３階,2018-02-21,株式会社
Ｇ・ロジ・スタッフ株式会社,東京都大田区平和島３丁目２番２７号,2018-02-21,株式会社
ＧＯＬＤＥＮＳＰＡＣＥ株式会社,山梨県北杜市小淵沢町上笹尾３３３２番地１６５１,2018-02-21,株式会社
ＧＯＬＦ１９ＪＡＰＡＮ株式会社,愛知県名古屋市中区平和１丁目８番１号長岡ビル１階,2018-02-21,株式会社
Ｈ．Ｉ．Ｓ．Ｍｏｂｉｌｅ株式会社,東京都新宿区西新宿６丁目８番１号,2018-02-21,株式会社
ＨＡＹＫ株式会社,東京都港区六本木３丁目７番１－２７０１号,2018-02-21,株式会社
ＨＩＩＴ　ＭＥ　ＦＩＴ株式会社,東京都千代田区神田司町２丁目１０番地９星の家１０１,2018-02-21,株式会社
ＨＫ管財株式会社,静岡県浜松市中区佐鳴台３丁目４５番２２号,2018-02-21,株式会社
ＨＮＫ合同会社,東京都北区志茂２丁目８番６－５０２号,2018-02-21,合同会社
Ｈａｒｍｏｎｙ中和株式会社,東京都台東区駒形２丁目６－７－２０２,2018-02-21,株式会社
ＩＹＺＫ合同会社,東京都中央区勝どき６丁目３番２－５４０６号,2018-02-21,合同会社
ＪＩＧＰ株式会社,東京都港区芝公園２丁目２番１０号中和ビル４階,2018-02-21,株式会社
Ｋ’ｓカンパニー株式会社,大阪府高槻市松原町１７番１８号,2018-02-21,株式会社
Ｋチーム株式会社,大阪府大阪市阿倍野区美章園２丁目１９番１６－９０８号,2018-02-21,株式会社
ＫＤＤＩデジタルセキュリティ株式会社,東京都千代田区飯田橋３丁目１０番１０号,2018-02-21,株式会社
ＫＦワーク合同会社,東京都葛飾区金町３丁目１９番７号,2018-02-21,合同会社
Ｌ＆Ｋ株式会社,大阪府吹田市津雲台７丁目１番３８－１００４号,2018-02-21,株式会社
ＬＩＣグローバル株式会社,東京都三鷹市下連雀３丁目３５番１号,2018-02-21,株式会社
Ｌｅａｄａｓ　Ｂｒｏｓ．Ｊａｐａｎ株式会社,京都府宇治市小倉町西浦８８番地の４５,2018-02-21,株式会社
Ｌｅａｆ　Ｒｉｎｇ株式会社,東京都港区南青山２丁目２番１５号,2018-02-21,株式会社
Ｌｅａｒｎｉｎｇ　Ｂｕｓｉｎｅｓｓ　Ｃｏｎｓｕｌｔａｎｃｙ，Ａｓｉａ合同会社,東京都杉並区浜田山４丁目２８番１－１０７号,2018-02-21,合同会社
Ｌｉｎｎｅ株式会社,東京都渋谷区恵比寿西２丁目１９番９号フランセスビル１Ｆ，２Ｆ,2018-02-21,株式会社
ＭＥＡＮＢＥＡＮ　Ｊａｐａｎ株式会社,京都府京都市右京区嵯峨中山町３３番地サンライズ嵯峨Ｄ－１,2018-02-21,株式会社
ＭＫＳ　ＩＮＴＥＲＮＡＴＩＯＮＡＬ合同会社,東京都杉並区高円寺北１丁目２１番５号４Ｆ―５,2018-02-21,合同会社
Ｍａｙｅｒ　Ｂｒｏｗｎ　Ｊａｐａｎ合同会社,東京都千代田区大手町１丁目５番１号大手町ファーストスクエア,2018-02-21,合同会社
ＮＡＭフィンテック株式会社,東京都世田谷区玉川１丁目１５番２－３５０２号,2018-02-21,株式会社
ＮＥＷ　ＫＩＤＳ株式会社,東京都渋谷区広尾３丁目１番２２号,2018-02-21,株式会社
Ｎａｋａｍｕｒａ　Ａｓｓｅｔ　Ｍａｎａｇｅｍｅｎｔ合同会社,千葉県千葉市稲毛区園生町６１２番地１エルシエロアズールＢ棟２０１号,2018-02-21,合同会社
Ｎｉｓｈｉｍｕｒａ　Ｇａｒｄｅｎ株式会社,愛媛県伊予市双海町高岸甲１１０８番地１,2018-02-21,株式会社
Ｎｏｂｉｌｉｓ　ＳＲＳ　Ｊａｐａｎ合同会社,東京都福生市大字福生８８７番地１２号上石ハイツ１０３号室,2018-02-21,合同会社
ＯＦＦＩＣＥ　ＷＡＭ株式会社,東京都中央区日本橋茅場町１丁目６番３号Ｋ．Ｔビル４０３,2018-02-21,株式会社
ＯＰＳＷＡＴ　ＪＡＰＡＮ株式会社,東京都千代田区大手町１丁目７番２号,2018-02-21,株式会社
ＲＯＣＫＥＴ　ＳＣＩＥＮＣＥ　ＪＡＰＡＮ株式会社,神奈川県横浜市中区大和町１丁目２１－４,2018-02-21,株式会社
ＲＷ　ＲＥＮＥＷＡＢＬＥＳ８一般社団法人,東京都港区赤坂２丁目１０番５号税理士法人赤坂国際会計事務所内,2018-02-21,その他の設立登記法人
Ｒｏｏｔｓ　ａｓｓｅｔ　ｍａｎａｇｅｍｅｎｔ株式会社,大阪府大阪市福島区福島４丁目２番６２号,2018-02-21,株式会社
ＳＨＩＶＡ　ＳＨＡＫＴＩ株式会社,東京都新宿区大久保２丁目１７番１６－１０６号,2018-02-21,株式会社
ＳＰＩＲＩＴ合同会社,愛媛県松山市南吉田町１４５５番地１フォブール南吉田３０１号,2018-02-21,合同会社
Ｓｕｍｋｅｅｐ合同会社,東京都目黒区東山１丁目２９番８－３０９号ルーブル中目黒,2018-02-21,合同会社
Ｔ‐ｃｏａｔ株式会社,北海道北見市北進町４丁目７番２７号,2018-02-21,株式会社
ＴＰＯ株式会社,埼玉県川越市大字小ケ谷広町８５５番地１,2018-02-21,株式会社
ＴＳ工業株式会社,宮城県黒川郡大和町吉岡字上町１０５番地の７,2018-02-21,株式会社
ＶＩＳＩＯＮ　ＨＡＣＫ合同会社,石川県加賀市大聖寺地方町１３の２５番地１,2018-02-21,合同会社
Ｖｌｏｃｉｔｙ　Ｊａｐａｎ株式会社,東京都中央区日本橋室町４丁目３番９号,2018-02-21,株式会社
Ｗｉｔｚ合同会社,大阪府大阪市東住吉区駒川３丁目２４－２３,2018-02-21,合同会社
ＹＳトラスト株式会社,東京都港区芝３丁目４０番９－８０３号,2018-02-21,株式会社
ａｒｃｕｒｅ合同会社,神奈川県横浜市中区竹之丸５５番地Ａ－５号室,2018-02-21,合同会社
ｉＲｅｓｏｒｔ合同会社,栃木県那須郡那須町大字湯本１５７番地,2018-02-21,合同会社
ｋ＆Ｍ株式会社,東京都新宿区西新宿４丁目２９番１０号,2018-02-21,株式会社
ｓｐｏｒａ合同会社,東京都江東区有明１丁目４番２０－３００６号,2018-02-21,合同会社
ｔｒｙａｎｇｌｅ株式会社,大阪府大阪市天王寺区生玉町１番２６号,2018-02-21,株式会社
さくら５号発電所合同会社,千葉県白井市冨士５７番地１４,2018-02-22,合同会社
ぷっくる株式会社,東京都新宿区高田馬場１丁目２３番１４号,2018-02-22,株式会社
みんなの合同会社,東京都府中市浅間町３丁目９番地,2018-02-22,合同会社
もののあはれ合同会社,東京都荒川区東日暮里３丁目４２番８－１３０５号,2018-02-22,合同会社
アイエス株式会社,東京都足立区綾瀬３丁目１３番１－２０６号,2018-02-22,株式会社
アンシェルデ株式会社,大阪府高槻市中川町１番９号,2018-02-22,株式会社
アーキテクスト合同会社,福岡県福岡市博多区東月隈１丁目２３番３号,2018-02-22,合同会社
インテリア高橋株式会社,北海道恵庭市島松東町３丁目１０番７号,2018-02-22,株式会社
イーソフトジャパン株式会社,東京都新宿区築地町４番地,2018-02-22,株式会社
ウェブトラスト株式会社,東京都港区麻布十番１丁目５番１０号,2018-02-22,株式会社
エイトラボ合同会社,東京都渋谷区恵比寿南１丁目２４番２号,2018-02-22,合同会社
エフ・エフ・ケーホールディングス株式会社,神奈川県横浜市金沢区福浦２丁目７番地３３,2018-02-22,株式会社
オフィスオサ合同会社,大阪府枚方市香里ケ丘７丁目４番地の２香里ケ丘七丁目アーバンライフ５２４号室,2018-02-22,合同会社
オフィスコレクション株式会社,東京都江東区東陽３丁目２７番１７号,2018-02-22,株式会社
オートテックＫ＆Ｋ１３株式会社,大分県大分市新町８番１０号,2018-02-22,株式会社
キャリアウェル合同会社,東京都新宿区北新宿４丁目１０番９号,2018-02-22,合同会社
コイニー株式会社,東京都渋谷区恵比寿１丁目２０番１８号,2018-02-22,株式会社
コジマヤ株式会社,広島県広島市南区宇品御幸４丁目１１番１－５０２号,2018-02-22,株式会社
コンタクト株式会社,東京都港区新橋５丁目１０番８号カルチャーセンタービル５階,2018-02-22,株式会社
サイマー・カフェ株式会社,東京都目黒区自由が丘１丁目２６番４号ステラ自由が丘２階,2018-02-22,株式会社
サンセリテ事業協同組合,佐賀県鹿島市浜町１２１３番地１,2018-02-22,その他の設立登記法人
シバタ・アンド・カンパニー合同会社,東京都港区南青山２丁目２番１５号ウィン青山９４２,2018-02-22,合同会社
シンハライト株式会社,熊本県熊本市中央区本荘４丁目１０番２３号ＧＬＣ本荘１３０４,2018-02-22,株式会社
ジャパン・プレミアム・ブロードキャスト株式会社,東京都渋谷区南平台町１６番１１号,2018-02-22,株式会社
ジーエフエフ・トレーディング合同会社,埼玉県川口市大字安行原１４６０大栄マンションＢ－２０３号室,2018-02-22,合同会社
スマイルマーケ株式会社,広島県広島市安芸区矢野西４丁目１０－１８－３０３,2018-02-22,株式会社
スリーナイン物流合同会社,宮崎県日南市大字東弁分甲８７７番地２,2018-02-22,合同会社
テイクオフ株式会社,福島県南相馬市原町区本陣前１丁目４０－２,2018-02-22,株式会社
テクニカルワーク株式会社,千葉県我孫子市新木３０５５番地の１,2018-02-22,株式会社
デナリスタイル株式会社,東京都港区芝浦４丁目２２番１－４７０９号,2018-02-22,株式会社
トーホーパワージェネレーション株式会社,山形県寒河江市緑町４番地,2018-02-22,株式会社
ドレイクプロジェクト合同会社,千葉県市川市新田４丁目１２番２号,2018-02-22,合同会社
ナビゲーター合同会社,東京都港区赤坂２丁目８番１３号赤坂こうゆうビル９０３号室,2018-02-22,合同会社
バジンガ株式会社,東京都港区六本木４丁目８番７号,2018-02-22,株式会社
ヒューマンコミュニケーション合同会社,福島県福島市笹谷字上成出９番地の２９,2018-02-22,合同会社
ピグニクスジャパン合同会社,東京都港区三田４丁目１９－２５－３１０,2018-02-22,合同会社
ピュアグリーンアグリ協同組合,茨城県鉾田市舟木４７番地２１,2018-02-22,その他の設立登記法人
ファーストヘッジ株式会社,大阪府大阪市城東区関目２丁目２番１１号,2018-02-22,株式会社
ブルースカイ設備株式会社,鳥取県米子市中島１丁目９番１４号,2018-02-22,株式会社
ベンチャーサポート不動産株式会社,東京都中央区銀座３丁目７番３号,2018-02-22,株式会社
ホームインテリジェンス株式会社,神奈川県横浜市中区山元町５丁目２２４番地２ルピナス山手１０４号室,2018-02-22,株式会社
マイチャンス合同会社,千葉県流山市若葉台４５３番地の２７,2018-02-22,合同会社
マイブリッジ株式会社,三重県津市芸濃町椋本６１９番地１サニーコートＢ２０１号室,2018-02-22,株式会社
マツダシステム株式会社,三重県津市一身田中野３８４番地１メゾンドールクラタ２１０,2018-02-22,株式会社
マルトモ株式会社,熊本県熊本市北区植木町亀甲２０９３番地１,2018-02-22,株式会社
ヤーヤー屋株式会社,東京都豊島区南池袋１丁目１６番２０号ぬかりやビル６階,2018-02-22,株式会社
ライオンズフォース滋賀合同会社,滋賀県近江八幡市池田本町９３０番地５９,2018-02-22,合同会社
ロブレ６３２管理組合,栃木県小山市中央町３丁目７－１,2018-02-22,その他
ワープボーリング株式会社,東京都豊島区巣鴨１丁目１４番７号横川ビル２Ｆ,2018-02-22,株式会社
一般社団法人ありがとうショップ,東京都渋谷区代々木３丁目１－１６グリーンハイツ２Ａ,2018-02-22,その他の設立登記法人
一般社団法人うめらく,大阪府大阪市北区中津５丁目８番９－１１０１号,2018-02-22,その他の設立登記法人
一般社団法人おにがきた輪,東京都練馬区練馬２丁目１番１２号,2018-02-22,その他の設立登記法人
一般社団法人ふりいらいふ,香川県高松市木太町５０９１番地７,2018-02-22,その他の設立登記法人
一般社団法人エスティリサーチ,東京都港区浜松町２丁目７番１号,2018-02-22,その他の設立登記法人
一般社団法人カブキレジデンシャル１号,東京都港区元赤坂１丁目１番７号,2018-02-22,その他の設立登記法人
一般社団法人キッズＭ,東京都中央区銀座５丁目６番１２号みゆきビル７Ｆ,2018-02-22,その他の設立登記法人
一般社団法人メディネクト,千葉県浦安市堀江６丁目７番３０号,2018-02-22,その他の設立登記法人
一般社団法人ライフハーモニー,大阪府吹田市山田東１丁目３番３６号,2018-02-22,その他の設立登記法人
一般社団法人レスキュードアニマルネットワーク,神奈川県横浜市神奈川区菅田町２３６番地１０,2018-02-22,その他の設立登記法人
一般社団法人仮想通貨税務研究協会,東京都千代田区鍛冶町１丁目１０番６号,2018-02-22,その他の設立登記法人
一般社団法人共同インフラファンド,東京都千代田区丸の内３丁目１番１号東京共同会計事務所内,2018-02-22,その他の設立登記法人
一般社団法人喜林,岐阜県高山市国府町上広瀬１２９４番地１,2018-02-22,その他の設立登記法人
一般社団法人国際学会事務局,神奈川県川崎市中原区中丸子１３番地７,2018-02-22,その他の設立登記法人
一般社団法人愛健美,宮城県仙台市青葉区八幡７丁目２６番１号,2018-02-22,その他の設立登記法人
一般社団法人日中国際文化芸術交流協会,愛知県名古屋市千種区姫池通３丁目４番地の１アイビーハウス２Ｆ,2018-02-22,その他の設立登記法人
一般社団法人日本パーソナルエイドセンター,神奈川県横浜市中区豆口台１５５番地６横濱山の手テラス２０１号室,2018-02-22,その他の設立登記法人
一般社団法人東京セブンズラグビーアカデミー,東京都中央区日本橋茅場町２丁目１１番８号,2018-02-22,その他の設立登記法人
一般社団法人清凜会,千葉県千葉市花見川区さつきが丘２丁目１１番地１,2018-02-22,その他の設立登記法人
一般社団法人真ん丸,福岡県久留米市善導寺町飯田４３８番地１２,2018-02-22,その他の設立登記法人
一般社団法人神楽坂サポーターズ,東京都新宿区南山伏町２番１９号,2018-02-22,その他の設立登記法人
一般社団法人職業訓練連合会,愛知県知多郡美浜町大字野間字南川８５番地３,2018-02-22,その他の設立登記法人
一般社団法人自然エネルギー推進機構,静岡県伊東市八幡野１１２６番地の１６,2018-02-22,その他の設立登記法人
一般財団法人仮想通貨中央機構,東京都港区六本木７丁目３番８号,2018-02-22,その他の設立登記法人
久松株式会社,大阪府大阪市北区西天満６丁目２番１４号,2018-02-22,株式会社
久留馬総業株式会社,群馬県高崎市高浜町２２５７番地３,2018-02-22,株式会社
亀井建築株式会社,広島県広島市佐伯区五日市中央１丁目２０番１０－１１号,2018-02-22,株式会社
五十嵐食品株式会社,東京都青梅市今寺５丁目１８番６号,2018-02-22,株式会社
