法人名,住所,設立日,法人種別
株式会社ここちぐら,北海道札幌市豊平区平岸二条３丁目４番１－１０７号,2023-02-13,株式会社
株式会社そがめ,愛媛県今治市大西町紺原甲２７９番地５,2023-02-13,株式会社
株式会社なないろスイッチ,宮崎県宮崎市大橋３丁目１１８番地１ビューテラス７０６号,2023-02-13,株式会社
株式会社はそあファーマシー,福岡県福岡市東区高美台１丁目１３番７号,2023-02-13,株式会社
株式会社はぴねすらいふ,北海道札幌市白石区北郷三条７丁目２番１６号,2023-02-13,株式会社
株式会社よゆう,東京都中野区大和町４丁目５０番５号パーシモア＃１,2023-02-13,株式会社
株式会社アットＯＫＩＮＡＷＡ,沖縄県浦添市沢岻１丁目４６－５－２Ｆ,2023-02-13,株式会社
株式会社アップウェーブ,大阪府大阪市城東区関目１丁目１２番３号,2023-02-13,株式会社
株式会社アドル,東京都港区赤坂１丁目１２－３２,2023-02-13,株式会社
株式会社アビリティ,滋賀県大津市松原町１７番２７号,2023-02-13,株式会社
株式会社アリマコーポレーション,群馬県高崎市高砂町９番地,2023-02-13,株式会社
株式会社エコグルメ北海道,北海道伊達市清住町５６－１,2023-02-13,株式会社
株式会社エムズアイ,兵庫県神戸市兵庫区新開地４丁目１番１１号,2023-02-13,株式会社
株式会社エム・アンド・ジェイ,千葉県成田市大清水１０６－２,2023-02-13,株式会社
株式会社エルジューク,東京都世田谷区等々力３丁目２１番２４号,2023-02-13,株式会社
株式会社エンバイロ,神奈川県横浜市中区尾上町４丁目５７番地横浜尾上町ビルディング８Ｆ,2023-02-13,株式会社
株式会社オクデラ,埼玉県上尾市大字瓦葺５４４番地１黒須ビル１０５,2023-02-13,株式会社
株式会社オールライフアシスト,栃木県栃木市箱森町３７番９号,2023-02-13,株式会社
株式会社グランソル,大阪府吹田市千里山西１丁目３２－３,2023-02-13,株式会社
株式会社グランロカ,神奈川県横浜市青葉区新石川４丁目２４番地５４,2023-02-13,株式会社
株式会社グレイスアドバイザリー,京都府京都市中京区元竹田町６３１番地３エステートビル四条烏丸４０１号室,2023-02-13,株式会社
株式会社グローアップ,大阪府大阪市西区江戸堀１丁目２３番１３号,2023-02-13,株式会社
株式会社ケアヒルズインベストメント,愛知県名古屋市中村区名駅５丁目３３－２１,2023-02-13,株式会社
株式会社ゲートキーパー,東京都荒川区西日暮里１丁目１６－１５－９０５,2023-02-13,株式会社
株式会社コバデン,埼玉県加須市大門町１番２号,2023-02-13,株式会社
株式会社サクシード,埼玉県川口市元郷４丁目２５番３号,2023-02-13,株式会社
株式会社サンアンドレインボウズ,長野県長野市川中島町上氷鉋８８０－１,2023-02-13,株式会社
株式会社サンマル,山梨県甲斐市西八幡３５０５番地１,2023-02-13,株式会社
株式会社サークルプラス,高知県高知市はりまや町３丁目１９－１１,2023-02-13,株式会社
株式会社シーリバイヴ,岐阜県高山市桐生町２丁目１１５番地３,2023-02-13,株式会社
株式会社ソウルクリエイション,東京都北区赤羽南１丁目１７番６号赤羽ビューハイツ４０１,2023-02-13,株式会社
株式会社ソラマル,山形県山形市瀬波３丁目６番３号,2023-02-13,株式会社
株式会社ダイワサービス,北海道札幌市豊平区平岸四条２丁目１番２５号,2023-02-13,株式会社
株式会社ダダ,東京都渋谷区神宮前６丁目２３番４号桑野ビル２階,2023-02-13,株式会社
株式会社ティワイエス　東京支店,東京都中央区日本橋大伝馬町１７番５号,2023-02-13,外国会社等
株式会社ハーモニーレジデンス,東京都文京区本駒込３丁目６－２２メゾンティーナ本駒込２０１,2023-02-13,株式会社
株式会社ヒートライン,愛知県東海市名和町３丁目１１３番地,2023-02-13,株式会社
株式会社ビアプラスプラス,東京都北区上十条２丁目７番１３号,2023-02-13,株式会社
株式会社ビヨンドスクエア,東京都港区海岸１丁目７番１号東京ポートシティ竹芝オフィスタワー８階,2023-02-13,株式会社
株式会社ファンワーク,沖縄県豊見城市字高安１１９－１,2023-02-13,株式会社
株式会社プリマ,愛知県名古屋市天白区元八事５丁目１２７番地,2023-02-13,株式会社
株式会社プレーゼ,大阪府大阪市此花区西九条１丁目１８番６号,2023-02-13,株式会社
株式会社ベイシス,東京都墨田区立花４丁目１６番４－４０３号オーバルコート立花,2023-02-13,株式会社
株式会社ベイフィールド,東京都町田市常盤町３１０９番地３０,2023-02-13,株式会社
株式会社マメノキ,千葉県富津市志駒１１８９,2023-02-13,株式会社
株式会社ミライズ,千葉県千葉市中央区富士見２丁目７番９号富士見ビル６０９号,2023-02-13,株式会社
株式会社メディケアプラス,大阪府大阪市西区南堀江１丁目１０番１１号,2023-02-13,株式会社
株式会社ユミエリンク,富山県富山市東田地方町２丁目１番１９号,2023-02-13,株式会社
株式会社ユーテック,愛知県名古屋市港区宝神１丁目８９番地,2023-02-13,株式会社
株式会社ヨシカワ,奈良県香芝市北今市４丁目２０８番地１,2023-02-13,株式会社
株式会社リニアスタッフ,奈良県大和高田市永和町６－２８,2023-02-13,株式会社
株式会社リバティー植物店,広島県三原市糸崎８丁目１５番８号,2023-02-13,株式会社
株式会社リル,千葉県船橋市東船橋３丁目２０番１２号,2023-02-13,株式会社
株式会社一建,愛知県岡崎市保母町字新巻１３番地,2023-02-13,株式会社
株式会社一心ＵＮＩＴＹ,熊本県熊本市中央区水前寺２丁目１７番１－８０１号,2023-02-13,株式会社
株式会社三和モータース,神奈川県川崎市中原区井田２丁目３４番３号第二三和ビル３０１号,2023-02-13,株式会社
株式会社三輝,大阪府堺市北区中百舌鳥町２丁３１４番地１シャリエ中百舌鳥１２０４号,2023-02-13,株式会社
株式会社下村企画,千葉県流山市おおたかの森北１丁目１１－１Ａ１１０６,2023-02-13,株式会社
株式会社前川電気,東京都文京区小石川２丁目１７番３０号,2023-02-13,株式会社
株式会社創,島根県出雲市中野町５２５番地３,2023-02-13,株式会社
株式会社名南コンストラクション,愛知県名古屋市緑区大清水３丁目１０２５番地の１,2023-02-13,株式会社
株式会社士十工業,福島県双葉郡大熊町大字大川原字西平１７２７番地,2023-02-13,株式会社
株式会社大真建鉄,東京都江戸川区南葛西３丁目９番１４－２０８号,2023-02-13,株式会社
株式会社天液酒造,大阪府大阪市北区曾根崎新地１丁目７番２１号エスパス北新地８－２階,2023-02-13,株式会社
株式会社如西,埼玉県越谷市レイクタウン５丁目３４番地１１,2023-02-13,株式会社
株式会社宝,高知県高知市竹島町４３番６号,2023-02-13,株式会社
株式会社小沼興業,千葉県柏市増尾８丁目３３番８号,2023-02-13,株式会社
株式会社島津工業,千葉県市川市中山３丁目１６番２号,2023-02-13,株式会社
株式会社川口組,埼玉県越谷市蒲生本町２番２４号プリマベーラ２０５,2023-02-13,株式会社
株式会社彩雲ノ居,埼玉県川口市幸町３丁目９番２８号ビジネスハイツ川口２０８,2023-02-13,株式会社
株式会社影山ジャパン,栃木県足利市大前町１５３５番地１,2023-02-13,株式会社
株式会社日本電業社,鹿児島県鹿児島市自由ヶ丘２丁目３３番８号,2023-02-13,株式会社
株式会社最果て,東京都文京区湯島３丁目４３番６号,2023-02-13,株式会社
株式会社松﨑建設,神奈川県藤沢市城南３丁目６番６～１１０６号,2023-02-13,株式会社
株式会社梶原農園,新潟県新潟市西区内野潟端２１８６番地２,2023-02-13,株式会社
株式会社比希商店,東京都豊島区池袋本町４丁目３８番１０－５０２号,2023-02-13,株式会社
株式会社浅野,京都府京都市下京区西木屋町通松原上る３丁目市之町２５２番地３エステムコート京都河原町プレジール１１０６号,2023-02-13,株式会社
株式会社清宝,千葉県東金市堀之内５４０番地６,2023-02-13,株式会社
株式会社白馬交通,大阪府羽曳野市古市６丁目１２番２６号,2023-02-13,株式会社
株式会社百笑村,北海道札幌市西区発寒十二条３丁目８番１８号,2023-02-13,株式会社
株式会社福すけ,長野県松本市南松本１丁目２番２７号,2023-02-13,株式会社
株式会社福一住宅,京都府城陽市平川東垣外６４番地３,2023-02-13,株式会社
株式会社稲敷コミュニティ,茨城県稲敷市神宮寺２０１０番地１８,2023-02-13,株式会社
株式会社繁栄,大阪府大阪市鶴見区今津北２丁目７番３２号,2023-02-13,株式会社
株式会社美水,兵庫県伊丹市中野北３丁目２番１２号,2023-02-13,株式会社
株式会社聖枷,埼玉県川口市川口１丁目１番３－２５０２号オーベルタワー川口コラージュ,2023-02-13,株式会社
株式会社聡誠,北海道千歳市弥生１丁目４番６号,2023-02-13,株式会社
株式会社背徳グルメ,東京都新宿区北新宿１丁目８番２４号,2023-02-13,株式会社
株式会社舜コーポレーション,東京都江戸川区鹿骨１丁目３８番１５号,2023-02-13,株式会社
株式会社西根ルーフ工業,岩手県盛岡市大通１丁目７番１５号バーセル大通４０２号,2023-02-13,株式会社
株式会社西蒼サーベイエンジニア,福岡県遠賀郡水巻町吉田西２丁目１６番１５号,2023-02-13,株式会社
株式会社西香,広島県安芸郡府中町宮の町４丁目１７番６号,2023-02-13,株式会社
株式会社超休息商店,東京都渋谷区神宮前６丁目２３番４号桑野ビル２階,2023-02-13,株式会社
株式会社遊ポケ,宮城県遠田郡涌谷町字六軒町裏９６番地３,2023-02-13,株式会社
株式会社道東高圧工業,福島県福島市飯坂町中野字山岸１２番地の２,2023-02-13,株式会社
株式会社門澤工務店,福島県郡山市田村町守山字西河原２９番地の２,2023-02-13,株式会社
株式会社開拓公社ホールディングス,千葉県千葉市美浜区新港７４番地,2023-02-13,株式会社
株式会社韓丸観光バス,大阪府大阪市生野区巽西１丁目１番１８号エルグリーンたつみ９１７,2023-02-13,株式会社
株式会社龍昇産業,兵庫県姫路市上手野３８７番地１,2023-02-13,株式会社
株式会社０８１０,宮城県登米市迫町新田字山崎２４１番地１,2023-02-13,株式会社
株式会社３６９,大阪府大阪市中央区高津２丁目６－４エクセレント高津８０４,2023-02-13,株式会社
株式会社５３０３,東京都台東区台東４丁目３０番６号Ｉ・ＬＩＶＥ・ＦＯＲＥＳＴ７０２号室,2023-02-13,株式会社
株式会社ＡＣＣＥＰＴ,福岡県福岡市中央区大名２丁目９番３５号９Ｆ,2023-02-13,株式会社
株式会社ＡＩｔｈｉｎＱ,東京都港区南青山２丁目２番１５号ウィン青山９４２,2023-02-13,株式会社
株式会社ＡＳＡＴＳＵ,島根県出雲市今市町７１７番地２Ｆ,2023-02-13,株式会社
株式会社ＡＺ　ＯＮＥ,東京都荒川区町屋７丁目１３番５号,2023-02-13,株式会社
株式会社Ａｋｕｒｕｈｉ,東京都渋谷区道玄坂１丁目１０番８号渋谷道玄坂東急ビル２Ｆ－Ｃ,2023-02-13,株式会社
株式会社Ｂ．Ｂ．ＳＨＯＰ,東京都中央区銀座１丁目２２番１１号銀座大竹ビジデンス２階,2023-02-13,株式会社
株式会社ＢＢＭ,兵庫県洲本市千草己４２２番地１２,2023-02-13,株式会社
株式会社ＢＬＥＮＤ,大阪府吹田市江坂町５丁目１７番５号パロスＧＴ江坂１号,2023-02-13,株式会社
株式会社Ｂｅｅｔｅｃｈ　Ｊａｐａｎ,東京都品川区大井１丁目６番３号,2023-02-13,株式会社
株式会社Ｂｏｎｄ,東京都豊島区池袋２丁目２３番４号国土池袋ビル５０Ｂ,2023-02-13,株式会社
株式会社Ｂｕｉｌｄ・ｐｌｕｓ・ｃｏｒｐ,滋賀県長浜市八幡中山町３４６番地,2023-02-13,株式会社
株式会社ＣＯＲＥＣＬＩＰ,北海道旭川市東光八条３丁目３番１０号,2023-02-13,株式会社
株式会社ＣＲＥＡＳ,大阪府大阪市中央区西心斎橋２丁目１２－２２－９１４,2023-02-13,株式会社
株式会社ＣＳＸ,大阪府大阪市北区大深町４番２０号グランフロント大阪タワーＡ,2023-02-13,株式会社
株式会社ＤＫＳ,沖縄県中頭郡西原町字池田４６５番地の３（３Ｆ）,2023-02-13,株式会社
株式会社Ｄｅｅｐ　Ｃｌｏｕｄ,東京都渋谷区神宮前３丁目１３番２０号ＰＡＳＥＯ神宮前１０２,2023-02-13,株式会社
株式会社ＥＡＳＹ　ＴＯ　ＵＮＤＥＲＳＴＡＮＤ,千葉県千葉市美浜区若葉３丁目１－１８幕張ベイパーククロスレジデンスＳ２－１,2023-02-13,株式会社
株式会社ＥＢＩＳＵＷＯＲＫ,東京都渋谷区道玄坂１丁目１０番８号渋谷道玄坂東急ビル２Ｆ－Ｃ,2023-02-13,株式会社
株式会社Ｆ・フィールド,福岡県福岡市東区青葉５丁目１５番９号,2023-02-13,株式会社
株式会社Ｆｉｒｓｔ,兵庫県姫路市河間町３７番地・野里ビルＢ,2023-02-13,株式会社
株式会社Ｇｌｏｂａｌ　Ｍｅｄｉｃａｌ　Ｎｅｔｗｏｒｋ,神奈川県横浜市南区六ツ川２丁目３番地４８,2023-02-13,株式会社
株式会社Ｇｒｏｗｔｈ,東京都千代田区岩本町３丁目８番８号,2023-02-13,株式会社
株式会社Ｈ＆Ｖカンパニー,埼玉県さいたま市緑区原山１丁目３２番８号,2023-02-13,株式会社
株式会社ＨＡインターナショナル,埼玉県幸手市東２丁目２０番３７号,2023-02-13,株式会社
株式会社ＨｉｌｏＷｉｓｈ,千葉県松戸市馬橋３２２５番地,2023-02-13,株式会社
株式会社Ｉｎ　Ｆｉｒｓｔ,愛知県名古屋市守山区本地が丘１７０１番地本地荘１７棟３０６号,2023-02-13,株式会社
株式会社Ｉｎ　Ｓｔｙｌｅ　ｃｏｒｐ．,埼玉県川口市南鳩ヶ谷５丁目９番１８号,2023-02-13,株式会社
株式会社Ｉｚａｎａｍｉ　Ｇａｍｅ　Ｌａｂ,東京都千代田区岩本町３丁目９番１７号スリーセブンビル５階,2023-02-13,株式会社
株式会社Ｊアライアンスビューティー,大阪府大阪市北区梅田１丁目１１番４号大阪駅前第４ビル,2023-02-13,株式会社
株式会社Ｊ．Ｎ．Ｉ　Ａｒｉｓｉｎｇ　ｉｍｐｏｒｔ＆Ｅｘｐｏｒｔ　Ｃｏ．Ｊｐ,愛知県北名古屋市六ツ師松葉１５１番地ホワイトウイング大野１０１号,2023-02-13,株式会社
株式会社ＫＡＩＯＮ,茨城県取手市高須２４５２番地,2023-02-13,株式会社
株式会社ＫＤテック,大阪府和泉市池上町３丁目５番８号,2023-02-13,株式会社
株式会社Ｋｈｔ,大阪府大阪市住吉区山之内２丁目１１番３１号,2023-02-13,株式会社
株式会社Ｋｉｒａｋｕ,東京都品川区上大崎１丁目１５番２５号プラチナレジデンス白金台２０２,2023-02-13,株式会社
株式会社ＬＡＮＤ　ＣＲＥＡＴＥ,長野県佐久市印内１５２番地,2023-02-13,株式会社
株式会社ＬＩＫＡＢＬＥ,東京都中野区大和町１丁目６８－４,2023-02-13,株式会社
株式会社Ｌａｂ８,大阪府大阪市北区大深町４番２０号グランフロント大阪タワーＡ,2023-02-13,株式会社
株式会社Ｌｉｖｙ,東京都港区高輪４丁目１０番１８号京急第一ビル１３Ｆ,2023-02-13,株式会社
株式会社ＭＡＨＡ,神奈川県小田原市小台１９９番地２号,2023-02-13,株式会社
株式会社ＭＡＪＩＭＥＮＩ,愛知県名古屋市瑞穂区井の元町１４７番地の１,2023-02-13,株式会社
株式会社ＭＤＬ,東京都荒川区西日暮里３丁目５番１号神丸ビル５Ｆ,2023-02-13,株式会社
株式会社ＭＥＩ　ＷＯＲＬＤ,東京都板橋区前野町３丁目５番１０号,2023-02-13,株式会社
株式会社ＭＩＹＡ名品,東京都中央区銀座８丁目１２番３号ＳＲビル６階,2023-02-13,株式会社
株式会社ＭＫｃｏｒｐｏｒａｔｉｏｎ,神奈川県横須賀市汐入町４丁目１６番地,2023-02-13,株式会社
株式会社ＭＵＲＡＯＫＡ,鹿児島県鹿児島市西別府町３１１６番地１４５,2023-02-13,株式会社
株式会社Ｍａｋｅ‐ＵＰ,北海道札幌市東区本町二条７丁目２番１－２号,2023-02-13,株式会社
株式会社ＭｉＬＩＮＫＳ,東京都渋谷区恵比寿南３丁目１番２４－４０２号,2023-02-13,株式会社
株式会社ＭｌｉＭ,北海道函館市本町２番１号,2023-02-13,株式会社
株式会社ＮＦＰ,福島県双葉郡大熊町大字下野上字清水２３０番地,2023-02-13,株式会社
株式会社ＮＩＣＯ,愛知県小牧市常普請１丁目１９３番地２,2023-02-13,株式会社
株式会社ＯＲＹＺＡ　ＰＥＡＫ,東京都渋谷区神宮前６丁目２３番４号桑野ビル２階,2023-02-13,株式会社
株式会社ＯＷＬ,北海道江別市野幌美幸町３０番地の１１,2023-02-13,株式会社
株式会社Ｏｔｔｏ,東京都渋谷区鶯谷町７番３号トミーリージェンシー３Ｆ,2023-02-13,株式会社
株式会社Ｐｌａｙａｂｌｅ,大阪府大阪市北区西天満５丁目１４－３エスリード西天満７０３,2023-02-13,株式会社
株式会社Ｐｏｔｏｃｋｉ,東京都港区南青山２丁目２番１５号,2023-02-13,株式会社
株式会社Ｒ＆Ｍ,千葉県銚子市小畑町９３２１番地４,2023-02-13,株式会社
株式会社Ｒｅｓｍｉｌｅ,富山県砺波市高波１１３８番地,2023-02-13,株式会社
株式会社ＳＡＮＵ　Ｎａｓｕ１ｓｔ,栃木県那須郡那須町大字高久乙３３７０番地４４９,2023-02-13,株式会社
株式会社ＳＫクリエイト,愛知県安城市里町大道畑１番地８０,2023-02-13,株式会社
株式会社ＳＱ建創,千葉県船橋市田喜野井５丁目２９番８号,2023-02-13,株式会社
株式会社ＳＹＮＴＩＭＥ,北海道札幌市南区真駒内緑町１丁目１番１６－２１３号,2023-02-13,株式会社
株式会社Ｓｃｏｌｌｅ,東京都荒川区西日暮里１丁目４０番８－４０６号,2023-02-13,株式会社
株式会社Ｓｈｉｎｅｆｕｌｌ,埼玉県川口市芝富士１丁目１番３０号,2023-02-13,株式会社
株式会社Ｓｔｅｐｗｅｌｌ,千葉県松戸市小金１４０番地６,2023-02-13,株式会社
株式会社Ｓｗｏｒｋｅｒｓ,東京都渋谷区恵比寿西１丁目３３番６号１Ｆ,2023-02-13,株式会社
株式会社ＴＡＤホールディングス,東京都中央区日本橋２丁目２番２１号,2023-02-13,株式会社
株式会社ＴＧＫパートナー,神奈川県横浜市中区簑沢１０番地－２Ｆ,2023-02-13,株式会社
株式会社ＴＯＰＡＺ,兵庫県姫路市飾東町庄２８番地７,2023-02-13,株式会社
株式会社ＴＲＵＳＴ,和歌山県和歌山市平岡３１８番地１,2023-02-13,株式会社
株式会社ＵＫ,福岡県遠賀郡水巻町猪熊２丁目１０番１４号,2023-02-13,株式会社
株式会社ＵＭＢ,東京都千代田区六番町６番４号,2023-02-13,株式会社
株式会社Ｕｎｔｅｅ,東京都渋谷区恵比寿西１丁目８番３号クオリア恵比寿ウエスト５０４,2023-02-13,株式会社
株式会社ＷＡＶＹ,大阪府大阪市北区野崎町１番３０－１８１２号,2023-02-13,株式会社
株式会社ＷＯＬＦＲＥＡＫＳ,北海道札幌市南区藤野四条１１丁目１６番１３号,2023-02-13,株式会社
株式会社Ｗｉｔｈ,東京都港区浜松町２丁目２番１５号浜松町ダイヤビル２Ｆ,2023-02-13,株式会社
株式会社ＹＫコネクション,栃木県宇都宮市西川田本町２丁目６番１８号,2023-02-13,株式会社
株式会社ａｌｌｗｏｗ,北海道札幌市西区西町南１８丁目５番２３－２０２号,2023-02-13,株式会社
株式会社ｃｏｎｅｘｉｏｎ,愛知県名古屋市千種区萱場２丁目１３－２,2023-02-13,株式会社
株式会社ｅ宅,北海道札幌市東区伏古八条４丁目６番３号,2023-02-13,株式会社
株式会社ｅｓｐｒｅｓｓｏ,東京都目黒区中目黒１丁目４番２０－４０７号,2023-02-13,株式会社
株式会社ｍ．ｋ．ｍ,東京都三鷹市野崎２丁目１２番－９号－１０２,2023-02-13,株式会社
株式会社ｓｅｃｏｎｄ　ｗｉｌｌｏｗ．,福島県福島市堀河町６番１１号Ｒｅ：ＳＱＵＡＲＥ・Ａ号室,2023-02-13,株式会社
株式会社ｓｅｅｄ,兵庫県尼崎市長洲本通２丁目９番６０号,2023-02-13,株式会社
株式会社ｓｈｉｎｙｓｐａｒｋ,東京都品川区南大井３丁目４番４号ＴＲＡＤＩＳ品川南８０３,2023-02-13,株式会社
株式会社ｗｅｌｌｓｔｏｎｅ,兵庫県西宮市上甲子園１丁目３番１５号,2023-02-13,株式会社
株式会社ｗｏｒｋｓ,大阪府守口市本町１丁目６－１３,2023-02-13,株式会社
湯城株式会社,沖縄県那覇市泊１丁目７番地３,2023-02-13,株式会社
無限責任上三谷負債整理組合,愛媛県伊予市上三谷３０２３番地,2023-02-13,その他の設立登記法人
無限責任上野負債整理組合,愛媛県伊予市上野２２２１番地,2023-02-13,その他の設立登記法人
無限責任下三谷負債整理組合,愛媛県伊予市,2023-02-13,その他の設立登記法人
無限責任八倉東組負債整理組合,愛媛県伊予市八倉,2023-02-13,その他の設立登記法人
無限責任宮下負債整理組合,愛媛県伊予市宮下９６６番地,2023-02-13,その他の設立登記法人
燕三条ＣＩＴＹ　ＦＣ合同会社,新潟県三条市神明町３番７号,2023-02-13,合同会社
爽新株式会社,東京都新宿区若松町３５番１号,2023-02-13,株式会社
特定非営利活動法人ウイングス,京都府宇治市広野町桐生谷５８番地の４,2023-02-13,その他の設立登記法人
特定非営利活動法人彩の国キッズ＆ファミリー車いすスポーツ協会,埼玉県白岡市白岡８４１番地３コンフォルトカーサ１０１,2023-02-13,その他の設立登記法人
特定非営利活動法人鎌倉育ちあいの家,神奈川県鎌倉市御成町６－１５,2023-02-13,その他の設立登記法人
王子郎株式会社,東京都北区滝野川２丁目１２－１３立川荘３号室,2023-02-13,株式会社
瑞安株式会社,大阪府大阪市東成区神路１丁目７－５神路１丁目ビル３０４,2023-02-13,株式会社
男鹿潟上秋田洋上風力合同会社,東京都千代田区大手町１丁目４番２号,2023-02-13,合同会社
石見銀山大田ひと・まちづくり事業協同組合,島根県大田市大森町ハ５１番地１,2023-02-13,その他の設立登記法人
社会保険労務士法人めいほく,愛知県清須市西枇杷島町古城１丁目６番地１６,2023-02-13,その他の設立登記法人
神広商事株式会社,兵庫県神戸市中央区中山手通３丁目５－８中華料理業組合ビル２Ｆ,2023-02-13,株式会社
福岡県バドミントン協会,福岡県福岡市城南区茶山５丁目２１－７,2023-02-13,その他
秦野建設株式会社,福島県伊達郡川俣町字瓦町８４番地の２,2023-02-13,株式会社
致念閣株式会社,千葉県野田市山崎１３２４番地の３鳳鳴大楼マンション４０１号室,2023-02-13,株式会社
艾林株式会社,大阪府大阪市天王寺区悲田院町４－３９朝日プラザ天王寺パサージュ５０４号室,2023-02-13,株式会社
藤原商事株式会社,埼玉県川口市飯塚１丁目９番５０号ナチュレ川口１０１号室,2023-02-13,株式会社
蜀望合同会社,千葉県千葉市花見川区花見川９番１０棟３０６号,2023-02-13,合同会社
衆和テクノロジー株式会社,神奈川県川崎市幸区神明町１丁目８０番地１オーベルグランディオ川崎９１０,2023-02-13,株式会社
西日本ソーシング株式会社,愛知県名古屋市中村区名駅５丁目３１－１０リンクス名駅ビル５Ｆ、６Ｆ,2023-02-13,株式会社
錡逸株式会社,岐阜県岐阜市六条東１丁目３番１６号,2023-02-13,株式会社
青川合同会社,大阪府大阪市東成区玉津２丁目１１番７号スタートライン玉津３０３号室,2023-02-13,合同会社
