法人名,住所,設立日,法人種別
株式会社ウィステリア,東京都渋谷区幡ヶ谷１丁目１７番６－５０１号パークハビオ笹塚,2019-07-23,株式会社
株式会社ウェブズ,佐賀県鹿島市大字納富分８４２番地１９,2019-07-23,株式会社
株式会社ウェルメイド,千葉県柏市今谷上町２９－１,2019-07-23,株式会社
株式会社エイ・イー・ディー,東京都中央区日本橋箱崎町２７番９－４０４号,2019-07-23,株式会社
株式会社エコライティング,神奈川県横浜市西区みなとみらい５丁目３番１－Ｐ－３００２号,2019-07-23,株式会社
株式会社エス・ケー・シー,大阪府高槻市北大樋町６０番１号,2019-07-23,株式会社
株式会社エメラルドホーム,東京都東大和市向原４丁目２７番９号泉長ビル１Ｆ,2019-07-23,株式会社
株式会社エリム,大阪府大阪市中央区南船場４丁目９番６号,2019-07-23,株式会社
株式会社エルフォーサポート,青森県八戸市柏崎４丁目１５番４３号イーマックス柏崎１階事務所,2019-07-23,株式会社
株式会社キシカ,東京都豊島区東池袋１丁目１７番１１号パークハイツ池袋１１０５号,2019-07-23,株式会社
株式会社キッチン・香,北海道旭川市北門町１５丁目２１４４番地の１５６,2019-07-23,株式会社
株式会社クスミテック,岐阜県多治見市滝呂町１４丁目１５５番地の１３４,2019-07-23,株式会社
株式会社グッドラックワークス,東京都立川市砂川町２丁目１５番地の１２,2019-07-23,株式会社
株式会社ケイプラ,宮崎県宮崎市大島町馬場尻１８７９番地１,2019-07-23,株式会社
株式会社ケイリース,埼玉県川口市弥平４丁目１１番８号,2019-07-23,株式会社
株式会社ココロプランニング,奈良県奈良市六条西６丁目８番６５号,2019-07-23,株式会社
株式会社サニーモーメント,沖縄県名護市字旭川１４７番地,2019-07-23,株式会社
株式会社サンブルー・ヘルスケア,東京都千代田区一ツ橋２丁目１番１号如水会ビルディング４階,2019-07-23,株式会社
株式会社シャロン,新潟県新潟市西区小針１丁目３９番３７号,2019-07-23,株式会社
株式会社ジェイビー,東京都港区虎ノ門１丁目１番２８号東洋プロパティ虎ノ門ビル８Ｆ,2019-07-23,株式会社
株式会社ジャパンフーズ＆コスメ,東京都渋谷区西原３丁目１８番４号,2019-07-23,株式会社
株式会社スタートアップ,神奈川県横浜市中区野毛町２丁目５９番地,2019-07-23,株式会社
株式会社スプラウト,千葉県市川市二俣２丁目８番７号,2019-07-23,株式会社
株式会社セントラル,埼玉県入間郡三芳町大字竹間沢６０２番地,2019-07-23,株式会社
株式会社セールスエージェント,三重県三重郡菰野町大字菰野４０５５番地３５,2019-07-23,株式会社
株式会社ダイサンエネルギー５,東京都港区浜松町１丁目２番１２号,2019-07-23,株式会社
株式会社ティージーディー,愛知県名古屋市天白区野並１丁目１２４番地の４,2019-07-23,株式会社
株式会社トミタカネクステック,埼玉県久喜市樋ノ口４９３番地１,2019-07-23,株式会社
株式会社ナドクリエイト,群馬県高崎市小八木町３１２－１５,2019-07-23,株式会社
株式会社ニッタ,群馬県みどり市笠懸町阿左美５３４番地２４,2019-07-23,株式会社
株式会社ネクト,愛知県小牧市多気北町１２３番地,2019-07-23,株式会社
株式会社ネコの手,埼玉県所沢市和ケ原１丁目３９番地の２,2019-07-23,株式会社
株式会社ハル,大阪府大阪市東住吉区照ケ丘矢田３丁目１－１６大師ビル１Ｆ,2019-07-23,株式会社
株式会社ハルオート,埼玉県坂戸市大字片柳２１９１番地６,2019-07-23,株式会社
株式会社ハレル不動産,大阪府吹田市南金田２丁目２６番２６－４０１号,2019-07-23,株式会社
株式会社ハントヴェルカー,大阪府大阪市中央区平野町４丁目７番７号,2019-07-23,株式会社
株式会社パインファーマシー,兵庫県尼崎市御園町２４番地尼崎第一ビル４０２号,2019-07-23,株式会社
株式会社パイン・コンサルティング・カンパニー,東京都新宿区西新宿８丁目１１番１０号星野ビル３階,2019-07-23,株式会社
株式会社ビジョナリーテック,東京都中央区八丁堀４丁目４番５号市川ビル１階,2019-07-23,株式会社
株式会社ビーアイティー,埼玉県上尾市大字平方３１６９－４,2019-07-23,株式会社
株式会社ファルコン,岡山県岡山市南区阿津１６９４－５,2019-07-23,株式会社
株式会社フクオカメディカルサーチ,福岡県福岡市早良区百道１丁目４番３号,2019-07-23,株式会社
株式会社フジヤマサムライジャパン,大阪府豊中市曽根東町２丁目１番３５－３０６号,2019-07-23,株式会社
株式会社フリースト,北海道札幌市東区北十五条東１５丁目４番１５号,2019-07-23,株式会社
株式会社ベルテックス,神奈川県横浜市保土ケ谷区桜ケ丘２丁目５２番１８号－３０３号,2019-07-23,株式会社
株式会社マルヒラ,大阪府大阪市淀川区十三本町２丁目４番３１－８０３号,2019-07-23,株式会社
株式会社ユニバーサルヘルスケア,東京都狛江市猪方１丁目８番９号レオネクストグランドソレイユⅡ２０３,2019-07-23,株式会社
株式会社ライズモアサポート,千葉県柏市光ケ丘団地２番１－２０２号,2019-07-23,株式会社
株式会社ラピンク,東京都中野区新井１丁目６番４号明和ハイム中野４０１,2019-07-23,株式会社
株式会社ラフアウト,東京都渋谷区神南１丁目７番８号,2019-07-23,株式会社
株式会社リラックス,茨城県つくば市松野木１８５番地１,2019-07-23,株式会社
株式会社リンク,愛知県碧南市宮町２丁目１０６番地,2019-07-23,株式会社
株式会社レイズ,愛知県海部郡蟹江町八幡１丁目７番地１,2019-07-23,株式会社
株式会社レガシープラス,大阪府茨木市舟木町５－３－１０１,2019-07-23,株式会社
株式会社ワトー,愛知県岡崎市真福寺町字牛落１４番地７,2019-07-23,株式会社
株式会社中園パワー,茨城県守谷市野木崎３７番地の１１,2019-07-23,株式会社
株式会社中泰Ｊａｐａｎ,東京都中央区日本橋蛎殻町１丁目２０番３号,2019-07-23,株式会社
株式会社中由技建,神奈川県横浜市瀬谷区阿久和南４丁目６番地６,2019-07-23,株式会社
株式会社価格自由,東京都渋谷区千駄ヶ谷４丁目９番７号,2019-07-23,株式会社
株式会社先端技術研究所,東京都千代田区神田三崎町３丁目８番４号江戸川ビル,2019-07-23,株式会社
株式会社前田,福岡県北九州市小倉北区高尾１丁目３５－５,2019-07-23,株式会社
株式会社北村製作所,大阪府東大阪市森河内西１丁目１２番３１号,2019-07-23,株式会社
株式会社司電工,長崎県長崎市鶴の尾町８番３８号,2019-07-23,株式会社
株式会社大光ロードテクノ,東京都練馬区大泉学園町５丁目９番１３－２０２号,2019-07-23,株式会社
株式会社大栄,鹿児島県大島郡瀬戸内町大字古仁屋１１１４番地４０,2019-07-23,株式会社
株式会社大根島工業,島根県松江市八束町入江５７５番地１,2019-07-23,株式会社
株式会社小泉測基ＡＲ,神奈川県横浜市鶴見区諏訪坂１５番１５号,2019-07-23,株式会社
株式会社新晃建設,大阪府大阪市西区新町２丁目１８番１号,2019-07-23,株式会社
株式会社日本自然災害復興支援センター,兵庫県神戸市東灘区魚崎南町４丁目１１番５号,2019-07-23,株式会社
株式会社日水建,愛知県小牧市小木５丁目４２８番地,2019-07-23,株式会社
株式会社松島工務店,東京都小金井市貫井南町２丁目１番２号,2019-07-23,株式会社
株式会社武鳶,埼玉県東松山市本町２丁目１０番３７号ブリッヂ金子１階,2019-07-23,株式会社
株式会社沼建,茨城県取手市青柳６８５番地２,2019-07-23,株式会社
株式会社活性化経営,神奈川県横浜市港南区日限山２丁目１８番５号,2019-07-23,株式会社
株式会社海遊社,佐賀県伊万里市二里町八谷搦１０３５番地１,2019-07-23,株式会社
株式会社異修令堂,福岡県福岡市中央区今泉１丁目１０番１２号ＩＯＮビル４階,2019-07-23,株式会社
株式会社県央興業,神奈川県横浜市戸塚区品濃町９２０番地,2019-07-23,株式会社
株式会社絆,神奈川県川崎市麻生区高石３丁目２７番１４－２号,2019-07-23,株式会社
株式会社藍夢,兵庫県西宮市羽衣町３番１４号,2019-07-23,株式会社
株式会社虹の空,大阪府和泉市池上町３丁目７番２５号,2019-07-23,株式会社
株式会社虹天,東京都葛飾区白鳥３丁目１１番１８号,2019-07-23,株式会社
株式会社資産管理ＮＲＩ,大阪府三島郡島本町桜井５丁目１０番３号,2019-07-23,株式会社
株式会社那須,東京都台東区浅草橋３丁目２９番８号,2019-07-23,株式会社
株式会社鋼林貿易,東京都新宿区大久保２丁目１番８号,2019-07-23,株式会社
株式会社長岡建築,富山県中新川郡立山町浦田１０７８番地,2019-07-23,株式会社
株式会社長栄商事,埼玉県草加市長栄３丁目４７番地４,2019-07-23,株式会社
株式会社門真プロパティ,大阪府門真市垣内町１２番２９号,2019-07-23,株式会社
株式会社香雲土谷,大阪府大阪市中央区難波３丁目３番７号,2019-07-23,株式会社
株式会社高千穂,宮崎県宮崎市高松町１－３,2019-07-23,株式会社
株式会社鳥辰,北海道函館市松風町１０番６号,2019-07-23,株式会社
株式会社Ａ－ＢＡＳＥ,大阪府大阪市西区北堀江１丁目１－２５堀富ビル６階,2019-07-23,株式会社
株式会社ＡＨ,愛知県名古屋市千種区今池５丁目２－６今池センタービル１階,2019-07-23,株式会社
株式会社ＡＮＤ’ＳＵＰＰＯＲＴ,福岡県北九州市小倉南区下城野２丁目４番７号ピュアシティ城野４０２号,2019-07-23,株式会社
株式会社Ａｌｐｈａ,東京都中央区銀座８丁目１８番７－３０６号,2019-07-23,株式会社
株式会社ＢＥＳＴ　ＰＡＲＡＤＩＳＥ,福岡県久留米市東町３３－９,2019-07-23,株式会社
株式会社ＢＮＳ,東京都渋谷区道玄坂２丁目１０番１０号世界堂ビル２階Ｃ室,2019-07-23,株式会社
株式会社Ｂｅｅ．Ｇ．ｌａｂｏ,東京都千代田区外神田５丁目６－２－１Ｆ,2019-07-23,株式会社
株式会社Ｃ７,大阪府門真市末広町３２番５号７０１,2019-07-23,株式会社
株式会社Ｃａｎｖａｓ　Ｔｅｒｒａｃｅ,大阪府大阪市中央区船場中央３丁目３番９－２１４号,2019-07-23,株式会社
株式会社Ｃｏｄｅ３,大阪府箕面市桜井１丁目４番２１号,2019-07-23,株式会社
株式会社Ｄ－Ｃｏｎｎｅｃｔ,北海道札幌市北区南あいの里６丁目１２番８号,2019-07-23,株式会社
株式会社Ｄａｉｓｙ,東京都港区赤坂６丁目１９番５４－５０５号,2019-07-23,株式会社
株式会社Ｅライフサポート,宮城県仙台市青葉区五橋１丁目７番１５号,2019-07-23,株式会社
株式会社ＦＩＭ,東京都江東区有明３丁目７番２６号有明フロンティアビルＢ棟９階,2019-07-23,株式会社
株式会社ＦＯＣ,群馬県桐生市梅田町４丁目４６８番地の１０,2019-07-23,株式会社
株式会社Ｆｅａｓｉｂｌｅ　Ｐａｔｈ,東京都千代田区二番町５番地２麹町駅プラザ９０１,2019-07-23,株式会社
株式会社Ｆｌｏｗｅｒ　Ｇａｒｄｅｎ,福岡県福岡市城南区別府６丁目２１番１０号,2019-07-23,株式会社
株式会社ＧＯＡＬＤ,東京都渋谷区神南１丁目２２番７号岩本ビル５Ｆ,2019-07-23,株式会社
株式会社ＧＰＴ,東京都江東区塩浜２丁目１４番１４号ハイツ松山２０１,2019-07-23,株式会社
株式会社Ｇｌｏｗ,大阪府大阪市中央区東心斎橋１丁目３番２３号１Ｆ,2019-07-23,株式会社
株式会社ＨＩＲＯＭＵ,大阪府大阪市西区北堀江１丁目２番２７号ＡＸＩＳ・ＳＯＵＴＨ四ツ橋ビル８０１号室,2019-07-23,株式会社
株式会社ＨＵＧＥ　ＳＭＩＬＥ,大阪府大阪市西淀川区野里２丁目２番４号若葉野里ビル２階,2019-07-23,株式会社
株式会社Ｉ．Ｃ．Ｏビル,兵庫県神戸市中央区加納町３丁目２番１号,2019-07-23,株式会社
株式会社ＩＤＳ,東京都西東京市住吉町３丁目１０番２５－５０４号,2019-07-23,株式会社
株式会社ＩＨＣ,東京都渋谷区富ヶ谷１丁目４９番２１号,2019-07-23,株式会社
株式会社ＪＨＰサービス,北海道札幌市南区澄川五条１２丁目６番１－１０６号,2019-07-23,株式会社
株式会社ＪＳＫ,埼玉県熊谷市上之１８２１番地４,2019-07-23,株式会社
株式会社Ｋフードファクトリー,愛知県名古屋市中区金山４丁目３番２号,2019-07-23,株式会社
株式会社ＫＥＹＳＴＯＮＥ,北海道札幌市中央区南一条西２４丁目１番１７号カーニバルビル１階,2019-07-23,株式会社
株式会社ＫＲＡＺＹ　ＢＥＥ沖縄,沖縄県豊見城市字豊崎１番地１１７５,2019-07-23,株式会社
株式会社ＫＳカンパニー,新潟県胎内市清水９番地１４３,2019-07-23,株式会社
株式会社ＫＹＡＲＡ,大阪府寝屋川市石津南町３－１２,2019-07-23,株式会社
株式会社ＬＧＡ,東京都品川区北品川１丁目９番７号トップルーム１０１５号,2019-07-23,株式会社
株式会社ＬＩＴＡ,神奈川県横浜市中区吉浜町２番地３６,2019-07-23,株式会社
株式会社ＬＯＴＵＳ　ＤＲＥＡＭ,神奈川県横浜市南区大岡２丁目１－２１－３０８,2019-07-23,株式会社
株式会社Ｍ＆Ｎ,大阪府大阪市生野区勝山北１丁目２－１１,2019-07-23,株式会社
株式会社ＭＣＷ,東京都練馬区平和台１丁目２７番２０号,2019-07-23,株式会社
株式会社Ｍｏｄａｎ,大阪府高槻市富田町１丁目１４番地６号エスアイマンション２０８,2019-07-23,株式会社
株式会社ＮＡＬホールディングス,東京都港区虎ノ門１丁目２３番１号株式会社ジャフコ内,2019-07-23,株式会社
株式会社ＮＥＸＴ,大阪府大阪市東淀川区瑞光２丁目１２番１０号,2019-07-23,株式会社
株式会社Ｎａｔｕａｌ,千葉県千葉市花見川区検見川町５丁目２２９５番地３,2019-07-23,株式会社
株式会社ＯＣＴ,大阪府大阪市北区紅梅町１－１８,2019-07-23,株式会社
株式会社ＯＮＥ　ＳＥＮＣＥ,東京都豊島区上池袋１丁目３７番２２号レジディアタワー上池袋（タワー棟）１９０５号,2019-07-23,株式会社
株式会社Ｏｆｆｉｃｅ　Ｐｉｎｇ　Ｐｌａｎｎｉｎｇ,東京都練馬区向山３丁目２１番２９号,2019-07-23,株式会社
株式会社Ｐｈｏｔｏｇｒａｍ,大阪府大阪市天王寺区筆ケ崎町６番１２ザ上本町タワー６０７号,2019-07-23,株式会社
株式会社Ｐｉｎｅ,高知県高知市朝倉横町１番３２号,2019-07-23,株式会社
株式会社ＲＥＶＯＬＵＴ９,東京都新宿区西新宿７丁目４番７号イマス浜田ビル５階,2019-07-23,株式会社
株式会社ＲＩＳＥ,東京都立川市錦町１丁目４番２０号,2019-07-23,株式会社
株式会社ＲＯＬＡＮＤ　ＦＯＯＤＳ,東京都新宿区大久保１丁目１１番３号,2019-07-23,株式会社
株式会社Ｒｅホームサービス,東京都西東京市谷戸町３丁目１番１７号,2019-07-23,株式会社
株式会社Ｓ．Ｈ．Ｄ,長野県長野市丹波島２丁目１２番地１８,2019-07-23,株式会社
株式会社Ｓ．Ｔ－Ａｒｔ,愛知県愛西市北一色町北田面２８７番地,2019-07-23,株式会社
株式会社ＳＣコーポレーション,千葉県松戸市河原塚４１１番地の１１,2019-07-23,株式会社
株式会社ＳＨＥ,東京都港区東麻布２丁目２３番３号ロイヤル東麻布５０２,2019-07-23,株式会社
株式会社ＳＨＯＷ　ＭＥ,東京都墨田区向島３丁目３９番１９,2019-07-23,株式会社
株式会社ＳＩＭＰＬＥＸ,埼玉県さいたま市北区大成町４丁目３５番地,2019-07-23,株式会社
株式会社ＳＪＫ,福岡県八女市本町２番地３７の４,2019-07-23,株式会社
株式会社ＳＫＹエージェンシー,埼玉県さいたま市西区大字内野本郷１１１９番地１０,2019-07-23,株式会社
株式会社ＳＵＮＲＯＯＴ,大阪府大阪市浪速区日本橋５丁目１３番３号川北ビル４階,2019-07-23,株式会社
株式会社Ｓｌａｎｇ　Ｓａｐｐｏｒｏ,北海道札幌市中央区南五条西４丁目４番地１,2019-07-23,株式会社
株式会社ＴＡＫＡＩ,茨城県かすみがうら市稲吉３丁目５番３５号グリーンアベニューＣⅠ－１０１,2019-07-23,株式会社
株式会社ＴＨロジデザイン,大阪府東大阪市吉田８丁目３番１２号シャルルフジ吉田４０５号,2019-07-23,株式会社
株式会社ＴＮＡ管理,大阪府大阪市阿倍野区昭和町１丁目１１番２２号,2019-07-23,株式会社
株式会社ＴＳＵＹＯＭＩＨＯ,東京都足立区加平１丁目４番１３－３０１号,2019-07-23,株式会社
株式会社ＴＷＥＬＶＥ,長崎県佐世保市白南風町７番３号アーバニティ８０２号,2019-07-23,株式会社
株式会社Ｔｏｐ,東京都品川区大井１丁目３５番７号アーマックス大井町３０９,2019-07-23,株式会社
株式会社Ｔｒａｃｋ　Ｖｉｌｌａｇｅ,長野県諏訪郡原村１５８１９番地３,2019-07-23,株式会社
株式会社ＵｎｉＢｉｓ,東京都品川区西五反田８丁目８番１６号高砂ビル４０３Ａ号室,2019-07-23,株式会社
株式会社Ｗｈｉｔｅ　Ｌｉｎｅ,埼玉県日高市大字高萩１５２番地６,2019-07-23,株式会社
株式会社Ｙ＆Ｒメディカルサービス,東京都港区高輪３丁目１番１４－９０１号,2019-07-23,株式会社
株式会社ＹＡＳＵＤＯ,大阪府泉大津市東助松町２丁目１０番６号,2019-07-23,株式会社
株式会社Ｙａｎｃｌｅ,東京都町田市高ヶ坂６丁目２０番７号,2019-07-23,株式会社
株式会社ＺＥＯＮＩＣ,兵庫県神戸市中央区北野町１丁目１,2019-07-23,株式会社
株式会社ｂｌｕｅｂｉｒｄ,静岡県駿東郡清水町伏見１７６番地の９,2019-07-23,株式会社
株式会社ｃａｄｅｌｉｅ,神奈川県川崎市宮前区小台２丁目２番地１ファーロ宮前平６０５,2019-07-23,株式会社
株式会社ｎａｔｕ－ＲＥ－ｈｏｍｅ,神奈川県川崎市幸区北加瀬２丁目１０番１４号,2019-07-23,株式会社
株式会社ｓｅｖｅｎ　ｓｅａｓ,埼玉県和光市白子２丁目１番３６号イルヴィアーレ天王坂サウス２０７,2019-07-23,株式会社
株式会社ｓｈｏ‐ｔａ‐ｍｉ,大阪府大阪市西区南堀江４丁目２４番２０号,2019-07-23,株式会社
櫻貿易株式会社,東京都豊島区北大塚３丁目２９番６－３０２号,2019-07-23,株式会社
江南貿易株式会社,千葉県長生郡一宮町一宮１７６２番地,2019-07-23,株式会社
沼田ＢＡＳＥ合同会社,広島県広島市安佐南区伴東４丁目１２番５号,2019-07-23,合同会社
海の幸株式会社,島根県浜田市港町２７５番地１７,2019-07-23,株式会社
清見電気工事株式会社,熊本県八代市川田町西１３６７番地,2019-07-23,株式会社
渓濱アテンドサービス株式会社,神奈川県横浜市都筑区川和町１２１１－１１,2019-07-23,株式会社
特定非営利活動法人日本の故郷創りＳＨＯＷＡ機構,群馬県利根郡昭和村大字橡久保５１４番地８,2019-07-23,その他の設立登記法人
特定非営利活動法人港北さくらみちクラブ,神奈川県横浜市港北区菊名２丁目１１番６号,2019-07-23,その他の設立登記法人
社会保険労務士法人みらい,東京都西東京市ひばりが丘北３丁目４番１号,2019-07-23,その他の設立登記法人
神戸レザー協同組合,兵庫県神戸市中央区元町通６丁目７番３号,2019-07-23,その他の設立登記法人
秀建株式会社,埼玉県加須市花崎１丁目３２番地５,2019-07-23,株式会社
紀州コンサルタント合同会社,和歌山県和歌山市東高松４丁目５番２１号,2019-07-23,合同会社
肉聯株式会社,埼玉県児玉郡上里町大字勅使河原字久保原４７１番地１１,2019-07-23,株式会社
花武株式会社,東京都新宿区新宿１丁目１５番７号御苑ハイツ６０５－３号室,2019-07-23,株式会社
華成株式会社,東京都中野区上鷺宮１丁目２－４関口ビルＢ１０９号,2019-07-23,株式会社
華泰情報株式会社,神奈川県川崎市川崎区砂子１丁目５番１４号,2019-07-23,株式会社
西田プロパティ株式会社,兵庫県宝塚市安倉中１丁目８番１７号,2019-07-23,株式会社
遠騰国際合同会社,東京都葛飾区鎌倉４丁目２０番１２号,2019-07-23,合同会社
野﨑プランニング株式会社,東京都板橋区板橋１丁目４８番１２号ＧＳＴビル７Ｆ,2019-07-23,株式会社
金宝合同会社,福島県安達郡大玉村玉井字山口瀬戸４５番地１,2019-07-23,合同会社
鑫俊貿易株式会社,神奈川県川崎市川崎区小田１丁目２１番１４号,2019-07-23,株式会社
鑫洋商事合同会社,埼玉県八潮市大字大曽根３４６番地１９,2019-07-23,合同会社
長安ソフトウェア株式会社,東京都葛飾区東金町１丁目３６番４－５３６号,2019-07-23,株式会社
関東自動車交通株式会社,東京都江戸川区松江５丁目６番８号,2019-07-23,株式会社
雪駒株式会社,東京都新宿区百人町２丁目４番５号,2019-07-23,株式会社
鳴春食業合同会社,東京都北区中十条３丁目３５番１号桑沢ビル３Ｆ,2019-07-23,合同会社
鴻運株式会社,兵庫県神戸市中央区元町通４丁目６番１７－３０４号,2019-07-23,株式会社
麗都株式会社,兵庫県神戸市東灘区向洋町中１丁目１７－２９Ｆ,2019-07-23,株式会社
Ａ・Ｒ・Ｂ　ＩＮＴＥＲＮＡＴＩＯＮＡＬ株式会社,埼玉県蕨市北町１丁目２０番１４号,2019-07-23,株式会社
ＡＣＴＡ株式会社,大阪府高槻市芥川町２丁目１４番３号,2019-07-23,株式会社
ＡＫ交通安全研究所合同会社,東京都大田区久が原４丁目４１番６号,2019-07-23,合同会社
Ａｔｌａｓ　Ｅｎｔｅｒｐｒｉｓｅｓ株式会社,東京都港区南青山１丁目３番１－１６０４号,2019-07-23,株式会社
ＣＴＣ合同会社,東京都中央区勝どき５丁目３番１－３９１７号,2019-07-23,合同会社
Ｃｈｉｎｃｈｉｌｌａ株式会社,大阪府大阪市西成区千本北２丁目２番４号,2019-07-23,株式会社
ＤＩＭＥＮＳＩＯＮ株式会社,東京都千代田区霞が関３丁目２番６号,2019-07-23,株式会社
ＥＹＥＬＩＳＳ合同会社,北海道札幌市豊平区平岸八条１２丁目３番５５－１０３号,2019-07-23,合同会社
ＦＩＧＯＳＪＡＰＡＮ株式会社,東京都練馬区田柄４丁目１６番２５号,2019-07-23,株式会社
ＧＳＣ協同組合,大阪府大阪市淀川区西中島４丁目３番８号新大阪阪神ビル４Ｆ,2019-07-23,その他の設立登記法人
Ｇｌｏｒｙ　Ｐｒｏｐｅｒｔｙ　Ｉｎｖｅｓｔｍｅｎｔ　ａｎｄ　Ｍａｎａｇｅｍｅｎｔ株式会社,大阪府大阪市中央区内平野町１丁目２番６－６０３号,2019-07-23,株式会社
Ｇｏｌｄｅｎ　ｓｔｏｎｅ株式会社,東京都足立区鹿浜８丁目４番５号第１２まさひろ商事ビル,2019-07-23,株式会社
Ｇｏｏｄ　Ｂｒａｎｄｓ合同会社,東京都新宿区四谷三栄町２－１４－１３０,2019-07-23,合同会社
Ｇｏｗｉｎｄ　Ｃｕｌｔｕｒｅ株式会社,東京都中野区中央５丁目４８番５号シャンボール中野７０１,2019-07-23,株式会社
Ｈｅｒｂｓ株式会社,東京都渋谷区代官山町８番７号,2019-07-23,株式会社
ＩＤＥＡ合同会社,大阪府箕面市今宮４丁目８番１１号,2019-07-23,合同会社
ＪＲ九州ビジネスパートナーズ株式会社,福岡県福岡市博多区博多駅前１丁目５番１号,2019-07-23,株式会社
ＫＥＥＰ　ＵＰ株式会社,愛知県名古屋市東区代官町３９番２２号,2019-07-23,株式会社
ＫＥＹＳＩＤＡ　ＪＡＰＡＮ株式会社,東京都中央区晴海３丁目１３番１号ドゥ・トゥールタワーイーストＥ５１１６,2019-07-23,株式会社
