法人名,住所,設立日,法人種別
株式会社カワイ,愛知県名古屋市中川区五女子１丁目１番８号ユニーブル五女子３０３号,2016-07-14,株式会社
株式会社カワイ化粧品,東京都千代田区麹町６丁目４番９号ミュゼ麹町５０１,2016-07-14,株式会社
株式会社カーグラス・ネット,埼玉県さいたま市大宮区桜木町１丁目９番地１８,2016-07-14,株式会社
株式会社ギュウモ大阪,大阪府堺市堺区九間町西１丁２番１号,2016-07-14,株式会社
株式会社クリディオス,東京都大田区大森東１丁目３５番４－１１０２号,2016-07-14,株式会社
株式会社クレインフーズ,神奈川県相模原市緑区東橋本１丁目５番１１号３０２号,2016-07-14,株式会社
株式会社クレストＭ,京都府京都市山科区小野御霊町４４番地の３２,2016-07-14,株式会社
株式会社グッドパワー,北海道札幌市中央区南一条東１丁目３番地,2016-07-14,株式会社
株式会社グリーンフィールド,埼玉県川口市戸塚東４丁目２３番２４号,2016-07-14,株式会社
株式会社グローバルインベストメント,京都府京都市北区紫野上御所田町６６番地,2016-07-14,株式会社
株式会社ケー・エム・シー,石川県白山市倉部町２０２１番地,2016-07-14,株式会社
株式会社コーエイコーポレーション,静岡県浜松市東区和田町８４８番地,2016-07-14,株式会社
株式会社サイトウリフォーム工業,北海道留萌市幸町１丁目２番地,2016-07-14,株式会社
株式会社サカイｉＴ経営,愛知県一宮市浅井町大日比野字如来堂１５３４番地,2016-07-14,株式会社
株式会社サンアセットキャピタライズ,奈良県宇陀市榛原萩原２６８５番地,2016-07-14,株式会社
株式会社サンチュウテクノサービス,愛知県海部郡大治町大字東條字高松２５番地の１,2016-07-14,株式会社
株式会社シューソレイユ,東京都墨田区江東橋１丁目６番１６－４０１号トレンド江東橋,2016-07-14,株式会社
株式会社ショウエイコーティング,三重県津市久居野村町４３０番地２－２号棟３０７号,2016-07-14,株式会社
株式会社ショウデン,岐阜県中津川市茄子川１２７５番地の５,2016-07-14,株式会社
株式会社スターベアーズジャパン,神奈川県座間市相武台３丁目１３番７号,2016-07-14,株式会社
株式会社ステン,神奈川県川崎市宮前区有馬１丁目１－２５－３０８,2016-07-14,株式会社
株式会社セイルズ,東京都小平市天神町４丁目３番１５号,2016-07-14,株式会社
株式会社セキネ,埼玉県北葛飾郡松伏町大字大川戸３６６番地,2016-07-14,株式会社
株式会社セブンスヘブン,東京都目黒区南３丁目１４番４号,2016-07-14,株式会社
株式会社タカマツ,福岡県北九州市小倉南区蜷田若園３丁目７番３７号,2016-07-14,株式会社
株式会社テクニカルサービスワタナベ,群馬県高崎市江木町９７８番地２ソレイヤン２０５,2016-07-14,株式会社
株式会社トリプレット,東京都港区高輪１丁目１４番１５－１０７号,2016-07-14,株式会社
株式会社トレーディア,東京都町田市玉川学園３丁目６番２８号,2016-07-14,株式会社
株式会社ナインドッツ,東京都江戸川区東小岩１丁目２６番２３号,2016-07-14,株式会社
株式会社ナズカンパニー,愛媛県松山市二番町１丁目４番地１０近代ビル５Ｆ,2016-07-14,株式会社
株式会社ニューシープ,東京都世田谷区北烏山９丁目１５番２号アルタスⅠ１－Ｄ,2016-07-14,株式会社
株式会社ネクスト,大分県大分市乙津港町１丁目３番２５号,2016-07-14,株式会社
株式会社ノーススターナビゲーション,神奈川県横浜市西区みなとみらい２丁目２番１号ランドマークタワー２０階,2016-07-14,株式会社
株式会社ハウス光匠,東京都練馬区田柄５丁目２０番１号,2016-07-14,株式会社
株式会社ハマノクリエーション,東京都墨田区亀沢１丁目２７番７号バ－クレイ両国１０２号室,2016-07-14,株式会社
株式会社ハワイアロハ,大阪府大阪市中央区瓦町１丁目６番１－３７０４号,2016-07-14,株式会社
株式会社パスル,東京都立川市曙町３丁目１８番２２号,2016-07-14,株式会社
株式会社パールレジデンス,京都府京都市南区吉祥院九条町４７番地,2016-07-14,株式会社
株式会社ビック・リブ,群馬県前橋市池端町３６番地３,2016-07-14,株式会社
株式会社ビューティー・セレクト,愛媛県四国中央市土居町津根３５０８番地１,2016-07-14,株式会社
株式会社ビルドケイ開発,熊本県熊本市北区龍田陳内２丁目６番３１号,2016-07-14,株式会社
株式会社ファニーボーン,高知県高知市介良乙２６７１番２１,2016-07-14,株式会社
株式会社ファーム結,福島県双葉郡楢葉町大字井出字所布５５番地６,2016-07-14,株式会社
株式会社フェアーパーソン,東京都立川市曙町１丁目１６番３号,2016-07-14,株式会社
株式会社フェイス,東京都渋谷区富ヶ谷２丁目１６番８号,2016-07-14,株式会社
株式会社フォレスタファーマシー,東京都大田区北千束３丁目２９番１３号１階,2016-07-14,株式会社
株式会社フォーチュン,東京都豊島区巣鴨３丁目２６番４号,2016-07-14,株式会社
株式会社フリーアレンジ,京都府亀岡市安町７２番地,2016-07-14,株式会社
株式会社フリーメタル,北海道河東郡音更町北鈴蘭南５丁目４番地３,2016-07-14,株式会社
株式会社ブルームライン,鹿児島県日置市伊集院町郡１７４４番地４,2016-07-14,株式会社
株式会社プロライズ,千葉県市川市北方１丁目１３番１２号,2016-07-14,株式会社
株式会社ベスト・ワン・コンサルティング,静岡県富士市平垣町３番２８－１１０１号,2016-07-14,株式会社
株式会社ボンズビルダー,千葉県柏市酒井根２丁目３番１－３０４号,2016-07-14,株式会社
株式会社マニフィークデシャンピニョン,福島県会津若松市八日町４番６号,2016-07-14,株式会社
株式会社マネジメントサポートＷ,三重県四日市市生桑町１１１番地３大佐建築ビル２階,2016-07-14,株式会社
株式会社マノア,東京都足立区新田３丁目３７番１１号,2016-07-14,株式会社
株式会社マルシェ,東京都中野区中野５丁目１番８号,2016-07-14,株式会社
株式会社マルジョウ,栃木県栃木市旭町１０番２４号,2016-07-14,株式会社
株式会社マルチハビタット,神奈川県横浜市中区本牧三之谷１７番１１号,2016-07-14,株式会社
株式会社ミルキーウェイエンタープライズ,埼玉県川越市脇田本町１０番地１７伊勢原七番館５０５号室,2016-07-14,株式会社
株式会社ムトーワークス,福島県福島市東中央２丁目１番,2016-07-14,株式会社
株式会社メビウスインターナショナル,茨城県水戸市平須町１８２５番地６０,2016-07-14,株式会社
株式会社モノマム,長野県長野市大字安茂里８１８番地サンエステートＷ１０１,2016-07-14,株式会社
株式会社ヤマト緑化園,愛知県知立市西中町跡落５４番地２４,2016-07-14,株式会社
株式会社ユニストプロパティ,大阪府大阪市西区立売堀１丁目４番１２号,2016-07-14,株式会社
株式会社ヨシハラホールディングス,福島県郡山市富久山町久保田字大久保７４番地の３,2016-07-14,株式会社
株式会社ライダーズクロス,兵庫県神戸市中央区港島９丁目２番５号,2016-07-14,株式会社
株式会社ライトオブハート,神奈川県相模原市緑区名倉２４３８番地１,2016-07-14,株式会社
株式会社ライフ,東京都東村山市栄町３丁目１１番９号,2016-07-14,株式会社
株式会社ライフジャーニー,東京都多摩市貝取１８１６番地の６,2016-07-14,株式会社
株式会社ラビットモータース,群馬県伊勢崎市韮塚町８７２番地２,2016-07-14,株式会社
株式会社リリー,大阪府大阪市生野区小路１丁目２１番１４号,2016-07-14,株式会社
株式会社ルシルグループ,神奈川県川崎市麻生区上麻生７丁目３７番６号,2016-07-14,株式会社
株式会社ワイスリー企画,滋賀県大津市唐崎３丁目２１番８号,2016-07-14,株式会社
株式会社上原建装,埼玉県春日部市小渕１３０７番地９,2016-07-14,株式会社
株式会社中嶋建材,岐阜県土岐市曽木町２４１１番地の１,2016-07-14,株式会社
株式会社中村,大阪府東大阪市岸田堂西２丁目２番２５号,2016-07-14,株式会社
株式会社佐伯工業,岐阜県羽島市上中町長間１１２０番地２,2016-07-14,株式会社
株式会社千成,兵庫県尼崎市次屋１丁目３番２０号,2016-07-14,株式会社
株式会社南ハウス,大阪府豊中市若竹町１丁目２０番２号,2016-07-14,株式会社
株式会社原組,愛知県あま市篠田南長無２６番地１ロイヤルマンション美和１０２号,2016-07-14,株式会社
株式会社味・舎廊,広島県三次市粟屋町２２９６番地１,2016-07-14,株式会社
株式会社和,東京都世田谷区等々力２丁目３２－１１－３０６,2016-07-14,株式会社
株式会社和顔施,岡山県津山市一方１０２番地１,2016-07-14,株式会社
株式会社土屋,東京都調布市菊野台１丁目３２番地３４,2016-07-14,株式会社
株式会社大來仁,東京都新宿区高田馬場４丁目３番地７号ケイエスビル２０４,2016-07-14,株式会社
株式会社大山,東京都中央区日本橋浜町１丁目９番１２号,2016-07-14,株式会社
株式会社山元興業,愛媛県四国中央市土居町野田甲６７４番地,2016-07-14,株式会社
株式会社川ばた,京都府京都市中京区壬生西大竹町２７番地８バウハウス２０１号,2016-07-14,株式会社
株式会社平野リゾート,東京都新宿区西新宿３丁目１１番１９号,2016-07-14,株式会社
株式会社志喜,大阪府大阪市西成区天下茶屋東２丁目２番１５号,2016-07-14,株式会社
株式会社新山商事,大阪府大阪市淀川区十八条１丁目１３番３４号,2016-07-14,株式会社
株式会社新生電業,千葉県千葉市若葉区小倉町１７４２番地１４ジュエル花島第１－２０２号,2016-07-14,株式会社
株式会社日商,神奈川県相模原市南区若松３丁目４８番２９号,2016-07-14,株式会社
株式会社日置農園,岐阜県中津川市駒場１５２６番地の８３,2016-07-14,株式会社
株式会社旨味屋クラブ,岐阜県瑞浪市土岐町３３６８番地の３,2016-07-14,株式会社
株式会社月と蛍,静岡県浜松市北区引佐町黒渕１１６番地の１,2016-07-14,株式会社
株式会社有馬開発,長崎県諫早市鷲崎町４０５番地１,2016-07-14,株式会社
株式会社本莊鋼建,神奈川県横浜市瀬谷区下瀬谷１丁目４番地１,2016-07-14,株式会社
株式会社松建工業,岐阜県可児郡御嵩町井尻７４４番地１,2016-07-14,株式会社
株式会社松田拓マーケティングデザイン事務所,東京都世田谷区玉川１丁目１５番３－１９０１号,2016-07-14,株式会社
株式会社梅の格一,和歌山県日高郡みなべ町晩稲３０３番地１,2016-07-14,株式会社
株式会社梅月冨本人形園,愛知県常滑市保示町２丁目１６１番地,2016-07-14,株式会社
株式会社森商会,兵庫県神戸市東灘区本山南町７丁目８番３０－２０２号,2016-07-14,株式会社
株式会社椎口工務店,京都府京都市中京区壬生森町１０番地２０,2016-07-14,株式会社
株式会社水野設備,千葉県柏市十余二３５７番地２７中央２４３街区１４,2016-07-14,株式会社
株式会社法島工房,兵庫県三木市志染町東自由が丘１丁目１番地の６,2016-07-14,株式会社
株式会社涅音成,東京都世田谷区奥沢７丁目１５番８号,2016-07-14,株式会社
株式会社渡辺水道店,岐阜県不破郡関ケ原町３４４１番地の６９,2016-07-14,株式会社
株式会社煌,三重県伊賀市緑ケ丘南町３９２０番地の１,2016-07-14,株式会社
株式会社皆伸社,埼玉県北葛飾郡松伏町大字大川戸３６６番地,2016-07-14,株式会社
株式会社真功工業,神奈川県横浜市南区永田東２丁目４０番１０号,2016-07-14,株式会社
株式会社穂縁,埼玉県熊谷市本石２丁目１４２番地モンシャトー熊谷５０２号室,2016-07-14,株式会社
株式会社細川ホームサービス,茨城県土浦市荒川沖西２丁目１２番２３号,2016-07-14,株式会社
株式会社華鑫,埼玉県川口市金山町８番地３号２階１０号室,2016-07-14,株式会社
株式会社萬楽,福岡県北九州市小倉北区中津口１丁目１０番４５－９０３号,2016-07-14,株式会社
株式会社藤島,東京都中野区鷺宮３丁目２４番３号,2016-07-14,株式会社
株式会社裕子,神奈川県座間市相模が丘４丁目２７番１０号,2016-07-14,株式会社
株式会社西匠,神奈川県秦野市戸川４２９番地１,2016-07-14,株式会社
株式会社解ける問題,京都府京都市左京区吉田中阿達町７番地４,2016-07-14,株式会社
株式会社郷蔵,神奈川県厚木市妻田南１丁目１６番５号,2016-07-14,株式会社
株式会社陽翔,神奈川県横浜市磯子区中原３丁目１０番９－３１０号,2016-07-14,株式会社
株式会社飛鳥工業,静岡県静岡市葵区与一１丁目５番４号,2016-07-14,株式会社
株式会社龍巳電気,埼玉県久喜市鷲宮２３１７番地３,2016-07-14,株式会社
株式会社３‐ＳＨＩＮＥ,愛知県名古屋市中村区名駅５丁目３３番２１号アクアタウン納屋橋第２２０８号,2016-07-14,株式会社
株式会社３Ｃ’ｚ,大阪府守口市佐太西町２丁目６番７号,2016-07-14,株式会社
株式会社４Ｕ,東京都清瀬市旭が丘３丁目３４３番地４６,2016-07-14,株式会社
株式会社７７８,東京都東村山市恩多町３丁目７番１０号,2016-07-14,株式会社
株式会社Ａ警備２４,北海道札幌市西区発寒十条２丁目６番１２号ハイランド２０２号室,2016-07-14,株式会社
株式会社ＡＬＴＵＲＡ,奈良県大和高田市礒野北町１５番２号,2016-07-14,株式会社
株式会社ＡＲＫ,京都府久世郡久御山町島田堤外２５－４,2016-07-14,株式会社
株式会社ＡＳＴＲＡＸ,神奈川県鎌倉市小町２丁目２３番１７号,2016-07-14,株式会社
株式会社Ａｌｍｕｓｔａｆａ　Ｉｎｔｅｒｎａｔｉｏｎａｌ　Ｕｎｉｖｅｒｓｉｔｙ,東京都世田谷区尾山台１丁目１７番２２号,2016-07-14,株式会社
株式会社Ａｒｓ,兵庫県神戸市西区竜が岡４丁目１９番地の１,2016-07-14,株式会社
株式会社Ｂ．Ｉ．Ｃ．Ｓｏｌｕｔｉｏｎ,福岡県京都郡苅田町京町２丁目１番地１,2016-07-14,株式会社
株式会社Ｃ－ホワイト,大阪府大阪市北区鶴野町２番２５－５０２号,2016-07-14,株式会社
株式会社ＣＩＰ,福岡県福岡市早良区西新１丁目１１番１６号,2016-07-14,株式会社
株式会社Ｃｙｂｅｒ　Ｆａｉｔｈ,大阪府大阪市城東区東中浜６丁目１６番１８号,2016-07-14,株式会社
株式会社ＤＢＦ,大阪府堺市南区和田１６０番地,2016-07-14,株式会社
株式会社ＤＣ　ｅｘｐｒｅｓｓ,埼玉県川口市大字峯１４４７番地７,2016-07-14,株式会社
株式会社ＤＩＲＩＧＩＯ,神奈川県横浜市神奈川区二本榎２１番５号,2016-07-14,株式会社
株式会社ＥＦＦＯＲＴ,大阪府吹田市千里丘中１３番１１号,2016-07-14,株式会社
株式会社ＥＭＯＧＲＡ,東京都渋谷区道玄坂２丁目１０番１２号,2016-07-14,株式会社
株式会社ＥＸＴＲＥＭＥＶＩＳＩＯＮ,東京都新宿区西新宿７丁目４番７号イマス浜田ビル５Ｆ,2016-07-14,株式会社
株式会社Ｅｒａｎ,愛知県岡崎市西大友町字蓮花寺２４番地１,2016-07-14,株式会社
株式会社ＦＡＢ,東京都墨田区文花３丁目４番８号,2016-07-14,株式会社
株式会社ＦＡＬＣＯＮＥＲ,愛知県刈谷市青山町１丁目１５１番地１６,2016-07-14,株式会社
株式会社Ｇ４ネットワーク,東京都杉並区浜田山３丁目２１番２号,2016-07-14,株式会社
株式会社ＧＣカンパニー,大阪府大阪市北区堂山町１５番１７号,2016-07-14,株式会社
株式会社ＧＩＧＳ,埼玉県川口市北原台２丁目１２番３０－５０１号,2016-07-14,株式会社
株式会社ＧＯＬＤ　ＲＵＳＨ,東京都中央区佃２丁目１番２－５０７号,2016-07-14,株式会社
株式会社ＧＯＯＤ　ＲＡＹＳ,奈良県香芝市五位堂１丁目３３７番地３,2016-07-14,株式会社
株式会社ＧＳトレード,群馬県伊勢崎市今泉町２丁目９３２番地１９,2016-07-14,株式会社
株式会社ＨＩＲＯＲＩ,愛知県春日井市牛山町２５５３番５号,2016-07-14,株式会社
株式会社ＨｉＳｃｏｒｅ,東京都渋谷区松濤１丁目２６番４号,2016-07-14,株式会社
株式会社Ｉ・Ｎ・Ｇ,岐阜県恵那市大井町１５９３番地４ニュー杉ケ丘２６,2016-07-14,株式会社
株式会社ＩＧＣ,岐阜県恵那市長島町中野３４番地３１,2016-07-14,株式会社
株式会社ＩＮＴ,東京都台東区上野３丁目２３番１１号,2016-07-14,株式会社
株式会社ＩＶＹ　ＣＩＥＳ,福岡県福岡市早良区百道３丁目１２番３号,2016-07-14,株式会社
株式会社ＩｍｐａｃＴ,奈良県北葛城郡上牧町大字上牧４０８８番地,2016-07-14,株式会社
株式会社ＪＨＴ観光,東京都墨田区江東橋２丁目１０番７号,2016-07-14,株式会社
株式会社Ｋ‐Ｈｏｌｄｉｎｇ,茨城県水戸市笠原町１７１１番地１９,2016-07-14,株式会社
株式会社Ｋ　ＡＢＩＬＩＴＹ,栃木県宇都宮市東岡本町７３９－１０４,2016-07-14,株式会社
株式会社ＫＢコーポレーション,京都府京都市下京区三ノ宮町通正面下る上三之宮町２７９番地,2016-07-14,株式会社
株式会社ＫＴＫ,千葉県君津市三直１２６６番地１３,2016-07-14,株式会社
株式会社ＫｏＢａ硝子,北海道登別市鷲別町５丁目１３番地６,2016-07-14,株式会社
株式会社Ｌ＆Ａ　ｓｕｐｐｏｒｔ,東京都世田谷区玉川４丁目３９番２－４０２号,2016-07-14,株式会社
株式会社ＬＡＮＤ・Ａ,神奈川県横須賀市太田和２丁目３番３４号,2016-07-14,株式会社
株式会社ＬＤＫ,栃木県芳賀郡市貝町大字赤羽２６９５番地１,2016-07-14,株式会社
株式会社ＬＥＯ＆ＶＩＲＧＯ,北海道釧路市鳥取北９丁目１番２３号,2016-07-14,株式会社
株式会社ＬＩＮＫＳ,大阪府大阪市中央区今橋１丁目７番１４号,2016-07-14,株式会社
株式会社ＬＩＮＯ,東京都墨田区八広５丁目７番２－１０２号,2016-07-14,株式会社
株式会社Ｍ’ｓサービス,滋賀県草津市追分５丁目９番２７－２０５号,2016-07-14,株式会社
株式会社Ｍプラス,岐阜県岐阜市鏡島南１丁目１０番３７号,2016-07-14,株式会社
株式会社Ｍ企画,千葉県鎌ケ谷市東中沢１丁目６番２４号,2016-07-14,株式会社
株式会社ＭＣＹプロフェッショナルサービス,東京都江東区亀戸１丁目３２番６－６０１号,2016-07-14,株式会社
株式会社ＭＫワールド,香川県高松市田町３番地１１,2016-07-14,株式会社
株式会社ＭＴＫコンサルティング,東京都中央区銀座５丁目９番１３号,2016-07-14,株式会社
株式会社ＮＩＣＯ,神奈川県鎌倉市小袋谷１丁目７番３４号,2016-07-14,株式会社
株式会社ＯＡＫインターナショナル,東京都墨田区押上１丁目１５番１号,2016-07-14,株式会社
株式会社ＯＮＥ＆ＯＮＬＹ,大阪府池田市畑５丁目９－１１メロディーハイム池田五月山ヒルズビュー６０２号,2016-07-14,株式会社
株式会社Ｏｎｅ　Ｒｏｏｆ,東京都世田谷区駒沢５丁目２６番７号,2016-07-14,株式会社
株式会社ＰＡサポート,佐賀県鳥栖市立石町１２番地２１５,2016-07-14,株式会社
株式会社ＰＥＧ,東京都八王子市横山町２５番地９ツカキスクエア,2016-07-14,株式会社
株式会社ＰＩＮＧ　ＰＯＮＧ　ＰＡＮＤＡ,東京都世田谷区祖師谷４丁目２３番１９号,2016-07-14,株式会社
株式会社Ｐｏｒｔｅ,愛媛県松山市空港通１丁目４番２２号,2016-07-14,株式会社
株式会社ＲＥＣ,茨城県稲敷郡阿見町大字若栗３４２１番地２８,2016-07-14,株式会社
株式会社ＲＩＴＡ＆ＣＯ,東京都台東区浅草橋３丁目２０番１８号,2016-07-14,株式会社
株式会社ＲＹＵＫＩ,東京都新宿区北新宿３丁目８番４号,2016-07-14,株式会社
株式会社ＳＡ,千葉県柏市柏１丁目５番１５号一二三堂ビル１Ｆ,2016-07-14,株式会社
株式会社ＳＡＩエンタープライズ,京都府京都市下京区麩屋町通五条上る下鱗形町５５１番地,2016-07-14,株式会社
株式会社ＳＥＤＯＮＡ,東京都板橋区大山西町７０番地１５号ＹＫ大山ビル１階,2016-07-14,株式会社
株式会社ＳＨＩＭＡ　ＮＩＰＰＯＮ,神奈川県大和市柳橋３丁目２４番７号第２鶴屋ハイツ２０１,2016-07-14,株式会社
株式会社ＳＨＩＮ,埼玉県さいたま市浦和区神明２丁目１５番３号５０３,2016-07-14,株式会社
株式会社ＳＨＵＴＵＰ＆ＳＱＵＡＴ,東京都目黒区自由が丘１丁目２６番５号,2016-07-14,株式会社
株式会社ＳＳビジネスサポート,茨城県水戸市宮町２丁目４番２９－１５１０号ライオンズ水戸グランフォート,2016-07-14,株式会社
株式会社ＳＴＵＤＩＯ　ＶｉＶ,東京都三鷹市上連雀６丁目１２番３号レジデンスさとう２０１号室,2016-07-14,株式会社
株式会社ＳＵＧＡＲ　ＢＥＡＲ,東京都江東区東雲１丁目９番１５号,2016-07-14,株式会社
株式会社Ｓｍｉｌｅ‐Ｃｏｍｐａｎｙ,東京都多摩市乞田１０５２番地１０２,2016-07-14,株式会社
株式会社Ｔ’ｓ　ｄｉｎｉｎｇ,神奈川県相模原市中央区相模原２丁目３番５号グレースマンション１階,2016-07-14,株式会社
株式会社Ｔ＆Ｙ,東京都杉並区本天沼１丁目２２番１０号,2016-07-14,株式会社
株式会社ＴＥＰＲＯ,埼玉県草加市中根２丁目２８番９号,2016-07-14,株式会社
株式会社ＴＨＳ,愛知県常滑市字長間６－１,2016-07-14,株式会社
株式会社ＴＩＮＯＬＰＯ,愛知県名古屋市東区泉２丁目１番４号－７０１,2016-07-14,株式会社
株式会社ＴＫサービス,愛知県名古屋市西区大野木３丁目１００番地,2016-07-14,株式会社
株式会社ＴＭＢ,埼玉県さいたま市大宮区三橋２丁目１５０番地,2016-07-14,株式会社
株式会社ＴＯＭＯコーポレーション,東京都世田谷区等々力２丁目２９番９号,2016-07-14,株式会社
株式会社Ｔｅｌｅｓｃｏｐｅ,東京都渋谷区道玄坂２丁目１０番１２号,2016-07-14,株式会社
株式会社Ｔｉ　Ａｄｏｒｏ,静岡県静岡市駿河区西中原２丁目３番１８号セントマルタ３０１,2016-07-14,株式会社
株式会社ＵＮＴＡＭＥＤ,東京都港区麻布十番２丁目５番１２号,2016-07-14,株式会社
株式会社ＶＩＥＷ　ＭＯＲＥ,大阪府大阪市西区南堀江３丁目９番２８－１００１号,2016-07-14,株式会社
株式会社ＷＥＡＲＥ,東京都渋谷区渋谷３丁目１２番１８号,2016-07-14,株式会社
株式会社ＷＩＲＥＤｌａｕｇｈｔｅｒ,愛知県名古屋市中区栄１丁目１８番２０号ロイジェント栄１３０１号,2016-07-14,株式会社
株式会社ＷＴＣ,東京都港区六本木３丁目４番３５号落合三幸ビル７０２,2016-07-14,株式会社
株式会社ＷｏｒｌｄＣａｐｉｔａｌＭａｎａｇｅｍｅｎｔ,神奈川県川崎市川崎区日ノ出１丁目３番１２号,2016-07-14,株式会社
株式会社ＺＡＫＵ,東京都世田谷区上馬２丁目２５番３号,2016-07-14,株式会社
株式会社ＺＩＧ－ＺＡＧ,埼玉県北本市中丸１丁目９４番地１,2016-07-14,株式会社
株式会社ａｍｕ,千葉県習志野市谷津１丁目１２番１０－１２９号,2016-07-14,株式会社
株式会社ｂｉｉｍａ,東京都世田谷区北烏山１丁目６０番２５－１０８号,2016-07-14,株式会社
株式会社ｃａｎｔｅｒａ,大阪府四條畷市雁屋南町１５番１１号,2016-07-14,株式会社
株式会社ｊｉｎ,山口県下関市上新地町１丁目２番９号,2016-07-14,株式会社
