法人名,住所,設立日,法人種別
アクアサービス株式会社,大阪府東大阪市足代北２丁目９番５号１０３,2017-04-11,株式会社
アジアヒューマンライン協同組合,広島県安芸高田市向原町戸島２４８９番地,2017-04-11,その他の設立登記法人
アテンション株式会社,東京都世田谷区上祖師谷５丁目２１番１４－５０５号,2017-04-11,株式会社
アプルコ合同会社,埼玉県川口市幸町２丁目１７番１－１４１０号,2017-04-11,合同会社
アライブエンタープライズ株式会社,大阪府大阪市中央区高津２丁目１番８号高津フェスタビル８０１号,2017-04-11,株式会社
アルファ・スリー株式会社,東京都新宿区早稲田鶴巻町５４４番地,2017-04-11,株式会社
アーク通商合同会社,東京都杉並区阿佐谷南１丁目３０番１６号,2017-04-11,合同会社
イーコンシャス株式会社,熊本県葦北郡津奈木町大字岩城２１２０番地１０,2017-04-11,株式会社
イーセヴエーション株式会社,鳥取県米子市和田町３００２番地４,2017-04-11,株式会社
エア・ウォーター・マニュファクチュアリング株式会社,大阪府堺市西区築港新町２丁６番４０,2017-04-11,株式会社
エコアグリ株式会社,東京都中央区日本橋蛎殻町１丁目３番５号共同ビル５５号室,2017-04-11,株式会社
エストレージャ株式会社,東京都中央区湊１丁目１２番１１号八重洲第７長岡ビル９Ｂ,2017-04-11,株式会社
エムケイプランニング合同会社,東京都千代田区神田鍛冶町３丁目５番,2017-04-11,合同会社
オフィスマーケティング研究所合同会社,東京都港区南青山３丁目１番３号スプライン青山東急ビル６階,2017-04-11,合同会社
オフサル株式会社,東京都豊島区巣鴨４丁目５番６号,2017-04-11,株式会社
オンアイシール株式会社,北海道札幌市西区発寒十一条２丁目５番８号,2017-04-11,株式会社
カクタス商事株式会社,東京都武蔵野市関前５丁目５番１１号,2017-04-11,株式会社
キッズパワー株式会社,埼玉県さいたま市大宮区土手町１丁目２番地,2017-04-11,株式会社
キリンハウス合同会社,愛媛県松山市高木町９０番地３２,2017-04-11,合同会社
クラシック株式会社,東京都江戸川区東小岩６丁目３３番１８号－２Ｆ,2017-04-11,株式会社
クロップサイエンスジャパン株式会社,東京都千代田区丸の内１丁目６番５号,2017-04-11,株式会社
クローバーハウス株式会社,鳥取県西伯郡伯耆町畑池２１３４番地,2017-04-11,株式会社
グルメタス合同会社,愛知県名古屋市千種区東山通１丁目３３番地,2017-04-11,合同会社
グローバル・インフラ・マネジメント株式会社,東京都千代田区永田町２丁目１４番３号,2017-04-11,株式会社
ケイアイシステムサービス株式会社,福岡県福岡市東区土井２丁目１番３２号,2017-04-11,株式会社
ケイエス・テック株式会社,福岡県北九州市若松区白山２丁目１１番１０－７０８号,2017-04-11,株式会社
ケースリー株式会社,宮崎県宮崎市大塚町窪田３３１４番地１さがやビル１０２,2017-04-11,株式会社
ケービックス上信越株式会社,群馬県渋川市石原２０５番地１２,2017-04-11,株式会社
コスモエネルギーホールディングス取引先持株会,東京都港区芝浦１丁目１－１浜松町ビルディング,2017-04-11,その他
サクラ株式会社,北海道札幌市東区北八条東１８丁目３番２５号,2017-04-11,株式会社
シダックスビューティーケアマネジメント株式会社,東京都調布市調布ケ丘３丁目６番地３,2017-04-11,株式会社
シダックス・スポーツアンドカルチャー株式会社,東京都調布市調布ケ丘３丁目６番地３,2017-04-11,株式会社
ジェ・シジョン・トレダー・プライベート・リミテド,東京都八王子市子安町２丁目１３番７号,2017-04-11,外国会社等
ジャーニーエイト合同会社,熊本県熊本市中央区神水本町６番７３号,2017-04-11,合同会社
ジョイントプラス合同会社,埼玉県川口市大字安行領根岸２５５３番地７,2017-04-11,合同会社
スタイルコラボレーション株式会社,鹿児島県鹿児島市春山町１７４９番地５,2017-04-11,株式会社
スノーボールシャレー株式会社,長野県飯山市大字飯山１１４９２番地３３１,2017-04-11,株式会社
セキュリティ設備事業協同組合,東京都文京区千石４丁目２２番１７号,2017-04-11,その他の設立登記法人
セダースレアリーズ株式会社,東京都中央区晴海３丁目１３番１,2017-04-11,株式会社
セノール合同会社,愛知県北名古屋市六ツ師２４１１番地１,2017-04-11,合同会社
タカラグローバル合同会社,茨城県守谷市松ケ丘２丁目１７番地１５,2017-04-11,合同会社
ツバサ・シップ・ホールディング合同会社,東京都中央区八重洲２丁目４番１号,2017-04-11,合同会社
ティーエム技研工業株式会社,三重県桑名市大字和泉字ホノ割５５０番地１,2017-04-11,株式会社
テクノコア株式会社,群馬県高崎市宿横手町２７２番地３,2017-04-11,株式会社
デザイン思考イノベーション株式会社,東京都港区高輪２丁目１４番７号,2017-04-11,株式会社
デロイトトーマツコーポレートソリューション合同会社,東京都千代田区丸の内３丁目３番１号新東京ビル,2017-04-11,合同会社
ナシラ・ガンマ株式会社,北海道札幌市東区北二十七条東１０丁目１番２４号,2017-04-11,株式会社
ヒロ・フォーチュンテリング合同会社,岡山県岡山市北区今保１０１８番地５,2017-04-11,合同会社
ビジネスライン株式会社,東京都港区虎ノ門２丁目７番１０号,2017-04-11,株式会社
ピノ・ロジョ合同会社,大阪府寝屋川市下木田町６番２９号,2017-04-11,合同会社
フューチャー・バリュー株式会社,神奈川県川崎市麻生区万福寺４丁目１９番１－１２１２号,2017-04-11,株式会社
フーマノ・ジャパン株式会社,東京都千代田区神田練塀町３番地富士ソフト秋葉原ビル１０階,2017-04-11,株式会社
ブライトナーズ・コンサルティング株式会社,東京都豊島区東池袋１丁目３４番５号いちご東池袋ビル６階,2017-04-11,株式会社
ブランホールディングス株式会社,大阪府大阪市淀川区西中島３丁目２１番１３号,2017-04-11,株式会社
プラス株式会社,愛知県あま市甚目寺乾出６７番地,2017-04-11,株式会社
ベストイーストコスメ株式会社,東京都中央区日本橋３丁目３番１１号,2017-04-11,株式会社
ベストイーストファーマ株式会社,東京都中央区日本橋３丁目３番１１号,2017-04-11,株式会社
ベストフィット株式会社,大阪府大阪市中央区備後町４丁目２－３,2017-04-11,株式会社
ベスト＆フロンティアホールディングス株式会社,福島県いわき市植田町本町２丁目４番地の２１,2017-04-11,株式会社
ペットエンゼル岡山株式会社,岡山県岡山市北区平山９０９番地,2017-04-11,株式会社
ホテルザフラッグ株式会社,大阪府大阪市中央区東心斎橋１丁目１８番３０号,2017-04-11,株式会社
ホームランソーラーパーク合同会社,東京都港区六本木３丁目１５番５号,2017-04-11,合同会社
ボナペチ合同会社,神奈川県横浜市西区戸部本町１０番１３号,2017-04-11,合同会社
マイコンテ株式会社,埼玉県さいたま市西区大字植田谷本４５６番地１,2017-04-11,株式会社
マエモト住建株式会社,埼玉県さいたま市南区鹿手袋２丁目５番１５号,2017-04-11,株式会社
マークプラン合同会社,青森県五所川原市字蓮沼１９番地２５,2017-04-11,合同会社
ミスおたる運営協議会,北海道小樽市港町４番３号一般社団法人小樽観光協会内,2017-04-11,その他
ミツモト電設株式会社,東京都中野区中央１丁目１３番８号,2017-04-11,株式会社
ミドリ株式会社,沖縄県那覇市小禄１丁目１７番２３－１０５号,2017-04-11,株式会社
ミライ株式会社,東京都荒川区南千住１丁目３２番１２－７０３号,2017-04-11,株式会社
メック都市開発１０号一般社団法人,東京都中央区日本橋２丁目７番１号,2017-04-11,その他の設立登記法人
メリープロモーション株式会社,大阪府大阪市北区東天満１丁目４番８号,2017-04-11,株式会社
ユウキ建設株式会社,愛媛県西条市神拝甲２０９番地２１,2017-04-11,株式会社
ユーケイ工業株式会社,兵庫県尼崎市東園田町８丁目１００番地の８－１０１号,2017-04-11,株式会社
ライズプランニング合同会社,福岡県福岡市博多区祇園町８番１２号,2017-04-11,合同会社
ラクロットジャパン株式会社,東京都中野区新井２丁目４７番６－６０９号,2017-04-11,株式会社
ラッキー・フィールド合同会社,山口県下関市長府日の出町５番１２号,2017-04-11,合同会社
ラッコントホテル株式会社,鳥取県西伯郡伯耆町金屋谷７９３番地１０９,2017-04-11,株式会社
ラビットホーム株式会社,東京都国分寺市東元町１丁目１９番３１号,2017-04-11,株式会社
ラリーストリーム株式会社,群馬県館林市本町２丁目５番４７号ＴＭ２１プラザー５０８,2017-04-11,株式会社
ラントレージャパン株式会社,東京都中央区日本橋２丁目２番３号ＲＩＳＨＥビルＵＣＦ４０２,2017-04-11,株式会社
リッチレンタカー株式会社,東京都新宿区富久町２２番２号,2017-04-11,株式会社
リンク株式会社,大阪府大阪市東淀川区西淡路５丁目２０番１５号,2017-04-11,株式会社
リンコー株式会社,大阪府門真市三ツ島３丁目４番１５号,2017-04-11,株式会社
ワイケーシステム合同会社,愛知県名古屋市港区秋葉３丁目１５０番地の１ハレクノ南陽茶屋２０２号,2017-04-11,合同会社
ワイズケー株式会社,埼玉県さいたま市南区辻１丁目９番１－１１５号,2017-04-11,株式会社
ワンエー株式会社,茨城県土浦市白鳥町９９４番地２１,2017-04-11,株式会社
ワン・プレシャス株式会社,東京都中央区日本橋３丁目２番１４号新槇町ビル別館第一２階,2017-04-11,株式会社
ヴァシュロンブルー株式会社,大阪府大阪市中央区淡路町１丁目４番９号Ｏ．Ｃ．Ｓ淡路町ビル８階,2017-04-11,株式会社
一和株式会社,大分県大分市大字下戸次１６４０番地,2017-04-11,株式会社
一成建設株式会社,兵庫県尼崎市西昆陽１丁目３番３３号,2017-04-11,株式会社
一般社団法人うみとやまのこどもとしょかん,神奈川県逗子市久木８丁目１２番４８号,2017-04-11,その他の設立登記法人
一般社団法人おたがいさん,滋賀県守山市梅田町２番１号セルバ守山１１６号室,2017-04-11,その他の設立登記法人
一般社団法人がもよんにぎわいプロジェクト,大阪府大阪市城東区蒲生４丁目２１番１２号,2017-04-11,その他の設立登記法人
一般社団法人くすのキッズ,福島県いわき市小名浜住吉字搦町３１番地の３,2017-04-11,その他の設立登記法人
一般社団法人すすきのアールズクラブ,北海道札幌市中央区南三条西９丁目９９８番地３アパタワーズ札幌大通公園１７２３号,2017-04-11,その他の設立登記法人
一般社団法人ぱんだこ福祉会,沖縄県浦添市内間３丁目１９番１号,2017-04-11,その他の設立登記法人
一般社団法人やまびこ響,沖縄県うるま市石川伊波９２２番地７,2017-04-11,その他の設立登記法人
一般社団法人アクティベート伊東,静岡県伊東市川奈１１８３番地の１０,2017-04-11,その他の設立登記法人
一般社団法人アルファエネルギー総合研究所,東京都渋谷区東１丁目２６番２０号,2017-04-11,その他の設立登記法人
一般社団法人インターナショナルＺＥＮカルチュラルセンター,神奈川県足柄下郡湯河原町吉浜１３番地,2017-04-11,その他の設立登記法人
一般社団法人エンゼル・ルーム,東京都渋谷区広尾５丁目８番２号,2017-04-11,その他の設立登記法人
一般社団法人グレイスプラネット協会,神奈川県横浜市旭区川島町１６１４番地８,2017-04-11,その他の設立登記法人
一般社団法人ケアほのぼの,神奈川県川崎市宮前区野川２５９４番地５第二新栄荘２０７号室,2017-04-11,その他の設立登記法人
一般社団法人サポートホールディングスＪＲＥ高島,東京都千代田区丸の内３丁目１番１号東京共同会計事務所内,2017-04-11,その他の設立登記法人
一般社団法人ジャパンＭ＆Ｅ野球機構,東京都豊島区池袋２丁目１４番１１号３０３,2017-04-11,その他の設立登記法人
一般社団法人スマイルアテンダントユニティ,新潟県新潟市北区石動１丁目４番地４,2017-04-11,その他の設立登記法人
一般社団法人デモクラシータイムス,東京都新宿区白銀町２番５号,2017-04-11,その他の設立登記法人
一般社団法人ドレスト光子研究起点,東京都文京区弥生２丁目１１番１６号,2017-04-11,その他の設立登記法人
一般社団法人ハートフルアート,埼玉県草加市花栗４丁目２０番１８－７１３号,2017-04-11,その他の設立登記法人
一般社団法人パシオアスレチッククラブ,茨城県水戸市大足町５２２番地の３,2017-04-11,その他の設立登記法人
一般社団法人ブラームスホール協会,滋賀県栗東市手原８丁目１番２号,2017-04-11,その他の設立登記法人
一般社団法人ライズリーナ,大阪府堺市中区福田１０４０番地１ユニハイム北野田１０６号,2017-04-11,その他の設立登記法人
一般社団法人リトルガーデン・ナチュラルアート・アソシエーション,東京都千代田区飯田橋４丁目１０番１－１６０４号,2017-04-11,その他の設立登記法人
一般社団法人リブランディング協会,東京都港区浜松町２丁目２番１５号,2017-04-11,その他の設立登記法人
一般社団法人上落合アライアンス,東京都中央区日本橋本町１丁目９番４号メンターキャピタル税理士法人内,2017-04-11,その他の設立登記法人
一般社団法人京大心理療法学会,京都府京都市左京区吉田本町京都大学大学院教育学研究科内,2017-04-11,その他の設立登記法人
一般社団法人京都障害者スポーツ振興会,京都府京都市左京区高野玉岡町５番地,2017-04-11,その他の設立登記法人
一般社団法人伊豆市産業振興協議会,静岡県伊豆市修善寺８３８番地の１,2017-04-11,その他の設立登記法人
一般社団法人信濃川火焔発電所,新潟県十日町市木落１７６０番地,2017-04-11,その他の設立登記法人
一般社団法人健康支援ネット,群馬県高崎市下之城町９６４番地１,2017-04-11,その他の設立登記法人
一般社団法人優愛福祉会,沖縄県浦添市宮城３丁目５番９号,2017-04-11,その他の設立登記法人
一般社団法人則美装,滋賀県東近江市佐生町８５番地,2017-04-11,その他の設立登記法人
一般社団法人劉衛流龍鳳会,沖縄県那覇市字安里４１３番地ラフィーネヌーベル安里１００１,2017-04-11,その他の設立登記法人
一般社団法人北海道化学事業創造センター,北海道札幌市中央区北一条西８丁目２番地３９,2017-04-11,その他の設立登記法人
一般社団法人協創型情報空間研究所,神奈川県鎌倉市植木４２５番地１オーベル鎌倉植木４１２号,2017-04-11,その他の設立登記法人
一般社団法人埼玉県老人福祉施設協議会,埼玉県さいたま市浦和区針ヶ谷４丁目２番６５号,2017-04-11,その他の設立登記法人
一般社団法人塩尻市森林公社,長野県塩尻市大門一番町１２番２号,2017-04-11,その他の設立登記法人
一般社団法人大浦湾サンゴ増養殖研究センター,沖縄県名護市字安部１５６番地２,2017-04-11,その他の設立登記法人
一般社団法人岐阜県水泳連盟,岐阜県岐阜市道三町１８番地,2017-04-11,その他の設立登記法人
一般社団法人市民セクター政策機構,東京都新宿区新宿６丁目２４番２０号,2017-04-11,その他の設立登記法人
一般社団法人広島市中区医師会,広島県広島市中区大手町４丁目１－１大手町平和ビル２階,2017-04-11,その他の設立登記法人
一般社団法人徐福文化国際交流センター,東京都豊島区西池袋５丁目５番２１－７０１号,2017-04-11,その他の設立登記法人
一般社団法人志摩市観光協会,三重県志摩市阿児町鵜方１６７０番地２,2017-04-11,その他の設立登記法人
一般社団法人教育支援共創機構,大阪府大阪市西区本田３丁目６番２５号,2017-04-11,その他の設立登記法人
一般社団法人新居浜海洋教育スポーツ振興協会,愛媛県新居浜市荷内町８３８,2017-04-11,その他の設立登記法人
一般社団法人日本医薬品添加剤協会,東京都千代田区九段北１丁目９番１６号,2017-04-11,その他の設立登記法人
一般社団法人日本応用老年学会,東京都新宿区神楽坂４丁目１番１号,2017-04-11,その他の設立登記法人
一般社団法人日本生殖心理学会,神奈川県横浜市緑区鴨居６丁目１９番２０号株式会社ヒューマンリプロ・Ｋ内,2017-04-11,その他の設立登記法人
一般社団法人日本英仏医学翻訳研究会,長崎県島原市有明町大三東甲２０５６番地１,2017-04-11,その他の設立登記法人
一般社団法人日本難病看護学会,東京都新宿区新宿１丁目２７番２号山本ビル,2017-04-11,その他の設立登記法人
一般社団法人旭川空家保安管理協会,北海道旭川市神楽四条１１丁目１番４号,2017-04-11,その他の設立登記法人
一般社団法人東京国際合唱機構,東京都八王子市絹ケ丘２丁目２９番１２号,2017-04-11,その他の設立登記法人
一般社団法人楽都,大阪府堺市堺区新町１番２０号,2017-04-11,その他の設立登記法人
一般社団法人横芝光町観光まちづくり協会,千葉県山武郡横芝光町宮川１１９０２番地,2017-04-11,その他の設立登記法人
一般社団法人水野産業共栄会,東京都文京区湯島３丁目１番３号,2017-04-11,その他の設立登記法人
一般社団法人河内長野市歯科医師会,大阪府河内長野市菊水町２番１３号,2017-04-11,その他の設立登記法人
一般社団法人河津町観光協会,静岡県賀茂郡河津町笹原７２番地の１２,2017-04-11,その他の設立登記法人
一般社団法人温活ライフ,富山県富山市富岡町８６番地ノーヴァⅠ１０２号,2017-04-11,その他の設立登記法人
一般社団法人滋賀県種子センター,滋賀県大津市松本１丁目２番２０号,2017-04-11,その他の設立登記法人
一般社団法人甲賀スポーツクラブ,滋賀県甲賀市甲南町希望ケ丘本町９丁目３４９番地１３,2017-04-11,その他の設立登記法人
一般社団法人白川町シルバー人材センター,岐阜県加茂郡白川町河岐１６４３番地１,2017-04-11,その他の設立登記法人
一般社団法人相続サポートパートナー,大阪府堺市堺区老松町１丁３５番地７,2017-04-11,その他の設立登記法人
一般社団法人神奈川県訪問看護ステーション協議会,神奈川県横浜市中区山下町２３番地日土地山下町ビル９階,2017-04-11,その他の設立登記法人
一般社団法人自然災害被災者債務整理ガイドライン運営機関,東京都千代田区大手町２丁目６番１号,2017-04-11,その他の設立登記法人
一般社団法人船橋市観光協会,千葉県船橋市浜町２丁目１番１号,2017-04-11,その他の設立登記法人
一般社団法人裁判医学研究会,東京都千代田区三番町９番地６,2017-04-11,その他の設立登記法人
一般社団法人要約筆記者認定協会,愛知県名古屋市東区泉３丁目１７番１０号泉ビル３Ｆ,2017-04-11,その他の設立登記法人
一般社団法人貝塚市歯科医師会,大阪府貝塚市名越７８３番地２８,2017-04-11,その他の設立登記法人
一般社団法人超人シェフ倶楽部,東京都新宿区西新宿７丁目５番８号,2017-04-11,その他の設立登記法人
一般社団法人青森県土地改良調査設計技術協会,青森県青森市佃２丁目２２番２１号,2017-04-11,その他の設立登記法人
一般社団法人静岡県スイミングクラブ協会,静岡県袋井市高尾１７０番地の１プレィリー貸家Ⅱ,2017-04-11,その他の設立登記法人
一般社団法人香川県言語聴覚士会,香川県高松市田村町１１１４番地,2017-04-11,その他の設立登記法人
一般社団法人ＣＯＬＥＲＥ,岩手県上閉伊郡大槌町大槌第１２地割１１４番地１,2017-04-11,その他の設立登記法人
一般社団法人ＫＭＡＣ,大阪府大阪市淀川区田川２丁目６番８号,2017-04-11,その他の設立登記法人
一般社団法人ＯＬＣ,東京都荒川区西日暮里１丁目６番３号,2017-04-11,その他の設立登記法人
一般社団法人ＴＯＮ,北海道札幌市北区北二十七条西４丁目１－１５,2017-04-11,その他の設立登記法人
一般社団法人Ｔｅｅｔｈ　Ｏｎｅ,大阪府大阪市旭区新森３丁目１８番１４号,2017-04-11,その他の設立登記法人
一般財団法人キユーピーみらいたまご財団,東京都渋谷区渋谷１丁目４－３,2017-04-11,その他の設立登記法人
一般財団法人中部貸切バス適正化センター,愛知県名古屋市中区金山１丁目９番１９号,2017-04-11,その他の設立登記法人
一般財団法人愛知県消防協会,愛知県名古屋市中区三の丸２丁目３番２号,2017-04-11,その他の設立登記法人
一般財団法人長岡花火財団,新潟県長岡市大手通２丁目６番地,2017-04-11,その他の設立登記法人
一般財団法人関東貸切バス適正化センター,埼玉県さいたま市大宮区北袋町１丁目２９９番地３,2017-04-11,その他の設立登記法人
一般財団法人鞍高鞍陵会奨学財団,福岡県直方市大字山部８１０番地７,2017-04-11,その他の設立登記法人
三希産業株式会社,茨城県古河市上和田３４３番地３２,2017-04-11,株式会社
中島工業株式会社,大阪府大阪市此花区春日出中２丁目１番２１号メゾン春日１Ｆ,2017-04-11,株式会社
中川住設株式会社,兵庫県宝塚市旭町２丁目３番２３－５０３号,2017-04-11,株式会社
丸善バッテリーサービス株式会社,福岡県久留米市善導寺町飯田８８１番地４,2017-04-11,株式会社
九蔵不動産株式会社,群馬県高崎市九蔵町４４番地,2017-04-11,株式会社
五常建設株式会社,新潟県妙高市広田町１０番１号,2017-04-11,株式会社
京橋ブリッジ株式会社,大阪府大阪市城東区鴫野西２丁目２番２１号,2017-04-11,株式会社
八代おもいやりネット,兵庫県豊岡市日高町中３３３－１,2017-04-11,その他
八友電工株式会社,埼玉県上尾市大字久保４０４番地５,2017-04-11,株式会社
写真企画ピーホット株式会社,東京都新宿区神楽坂６丁目２３番地,2017-04-11,株式会社
北九州アッシュリサイクルシステムズ株式会社,福岡県北九州市戸畑区牧山５丁目１番１号,2017-04-11,株式会社
北陸熱学株式会社,石川県白山市長竹町４９番地２２,2017-04-11,株式会社
医療法人うめおか神経クリニツク,愛媛県松山市二番町３丁目８番地２１久保豊二番町ビル２階,2017-04-11,その他の設立登記法人
医療法人おおつか循環器・内科クリニック,愛媛県松山市樽味４丁目２番２５号,2017-04-11,その他の設立登記法人
医療法人おかだ歯科医院,福岡県京都郡苅田町神田町１丁目２０番地３,2017-04-11,その他の設立登記法人
医療法人おきクリニック,徳島県徳島市昭和町７丁目２９番１,2017-04-11,その他の設立登記法人
医療法人たかのこみどり眼科クリニック,愛媛県松山市鷹子町２３６番１,2017-04-11,その他の設立登記法人
医療法人なかしま歯科医院,岡山県瀬戸内市邑久町尾張１２４４番地４,2017-04-11,その他の設立登記法人
