法人名,住所,設立日,法人種別
株式会社Ｆｅｅｄｏｍ,東京都中央区日本橋２丁目１６－４ｒｅｍｉｘ日本橋６階,2026-05-13,株式会社
株式会社Ｇ‐Ｓｅｒｖ　Ｆｏｏｄ,新潟県三条市福島新田丙２４０６番地,2026-05-13,株式会社
株式会社Ｇ．Ｏコンサルタント,東京都墨田区太平２丁目５番７号ＫＯＷＡ３ビル７階,2026-05-13,株式会社
株式会社Ｇ．Ｏ．Ａ．Ｔ,新潟県新潟市江南区丸山ノ内善之丞組３５６番地１,2026-05-13,株式会社
株式会社ＧＬＯＶＡＬ,大阪府堺市堺区三国ヶ丘御幸通１０－１,2026-05-13,株式会社
株式会社ＧＲＩＮＮ　ＨＵＮＣＩ,東京都渋谷区神宮前２丁目３１番１１号ＴｅｒｒａｚａＨａｒａｊｕｋｕ２階Ａ区画,2026-05-13,株式会社
株式会社ＧＵＣＡＯＷＬ　ＣＬＥＡＮ,北海道札幌市白石区本郷通４丁目北３番１４－５０５号,2026-05-13,株式会社
株式会社Ｇｒｉｌｌ　Ｂｕｔｃｈｅｒｓ,愛知県知多郡阿久比町宮津２丁目８５番地１ＦＵＬＬＨＯＵＳＥ・ＡＭ・Ｓ,2026-05-13,株式会社
株式会社ＨＡＣＯＢＵＮＥ,兵庫県明石市旭が丘１３番２号,2026-05-13,株式会社
株式会社ＨＮＴエンジニアリング,東京都葛飾区堀切３丁目２３番１８号,2026-05-13,株式会社
株式会社ＨＯＮＯ,東京都世田谷区松原１丁目２３番２－３０１号,2026-05-13,株式会社
株式会社ＨＳＧ,京都府京都市南区上鳥羽鍋ケ淵町５５４番地,2026-05-13,株式会社
株式会社Ｈｅａｌｔｈ　Ｐｉｃｋｓ,神奈川県横浜市中区池袋３７番地４６,2026-05-13,株式会社
株式会社Ｈｏｋｕ　Ｇｌｏｂａｌ,東京都渋谷区円山町５番３号ＭＩＥＵＸ渋谷ビル８階,2026-05-13,株式会社
株式会社Ｉ・Ｎ・Ａ,北海道札幌市中央区南八条西４丁目４２２番地,2026-05-13,株式会社
株式会社ＩＣＨＩＫＡＷＡ,山梨県富士吉田市下吉田２丁目９番２１号,2026-05-13,株式会社
株式会社ＩＫＥ,神奈川県川崎市宮前区宮崎６６５番地１７,2026-05-13,株式会社
株式会社ＩＭＣ北日本,宮城県仙台市青葉区一番町３丁目６－１一番町平和ビル３階,2026-05-13,株式会社
株式会社ＩＮＡＲＩ,東京都大田区南蒲田２丁目１１番７号,2026-05-13,株式会社
株式会社ＪＳＬ,岡山県倉敷市羽島１６０番地,2026-05-13,株式会社
株式会社Ｋ‐ＫＲＥＩＳ,東京都国立市富士見台３丁目３３－４ケラソス国立１階,2026-05-13,株式会社
株式会社Ｋ‐ｓｔｙｌｅ,静岡県浜松市中央区舘山寺町２６４４番地の４,2026-05-13,株式会社
株式会社Ｋプロジェクト,東京都中央区築地６丁目２７番３号,2026-05-13,株式会社
株式会社Ｋ＆Ｋ,愛知県海部郡大治町大字東條字中切２番地の２,2026-05-13,株式会社
株式会社Ｋ．Ｋ不動産,香川県坂出市川津町３８７４番地１,2026-05-13,株式会社
株式会社ＫＡＫＥＤＡＳＨＩ,福岡県北九州市小倉南区蜷田若園３丁目１番７号サンセールカズＢ棟１０１号室,2026-05-13,株式会社
株式会社ＫＡＮＡＵ,兵庫県揖保郡太子町東南３０９番地１,2026-05-13,株式会社
株式会社ＫＨＣ,東京都東久留米市本町２丁目１２番１９号,2026-05-13,株式会社
株式会社ＫＮＯＴＩＣ,大阪府大阪市西区江戸堀１丁目２２番３８号三洋ビル４階Ｓ４０３号室,2026-05-13,株式会社
株式会社ＫＯＺｙ,青森県青森市金沢２丁目２１番２－２号,2026-05-13,株式会社
株式会社ＫＲＳサポート,愛知県碧南市西浜町２丁目６８番地１,2026-05-13,株式会社
株式会社ＫＴＲ甲斐建築,宮崎県日向市大字富高６４２９番地１０,2026-05-13,株式会社
株式会社Ｌ‐Ｅｑｕｕｓ,大阪府堺市東区菩提町５丁１９１番地３,2026-05-13,株式会社
株式会社ＬＩＶＥｗｅｌｌ沖縄,沖縄県島尻郡南風原町字与那覇４９番地１－１０２,2026-05-13,株式会社
株式会社Ｌｅａｐｏｒｔ,東京都世田谷区駒沢５丁目２５番７号,2026-05-13,株式会社
株式会社Ｌｉｅｎ,岡山県岡山市中区江並２８６番地４オフィスＮＩＫＫＯ２０５,2026-05-13,株式会社
株式会社Ｌｉｋｅ　ａ　Ｂｏｓｓ,東京都目黒区目黒本町６丁目２０番７号ミレドゥーエ目黒本町１０２,2026-05-13,株式会社
株式会社ＬｏｎｇＳｌｏｐｅ,東京都葛飾区お花茶屋１丁目２番４号,2026-05-13,株式会社
株式会社Ｌｕｕホールディングス,東京都中央区晴海５丁目５番３号,2026-05-13,株式会社
株式会社Ｌｕｘｉｌｌｕｍｉｎｏ,東京都江戸川区春江町２丁目１９番１４号,2026-05-13,株式会社
株式会社Ｍ‐Ｔｅｃｈ,神奈川県川崎市宮前区土橋４丁目１０番地１７,2026-05-13,株式会社
株式会社Ｍ＆Ａトラスト,福島県いわき市平字白銀町４０番地の１６,2026-05-13,株式会社
株式会社ＭＡＲＱＵＥ,埼玉県志木市柏町５丁目１３番４０号,2026-05-13,株式会社
株式会社ＭＣＫ,兵庫県尼崎市南塚口町３丁目１０番１０号,2026-05-13,株式会社
株式会社ＭＩＡＶＩＥ,大阪府大阪市西区新町２丁目１８番１９号パインビル,2026-05-13,株式会社
株式会社ＭＯ‐Ｂａｓｉｓ,東京都渋谷区道玄坂１丁目１０番８号渋谷道玄坂東急ビル２Ｆ‐Ｃ,2026-05-13,株式会社
株式会社ＭＯＮ,広島県広島市中区東平塚町９番６－９０１号,2026-05-13,株式会社
株式会社ＭＴ,神奈川県川崎市幸区南加瀬１丁目８番６号,2026-05-13,株式会社
株式会社ＭＹＫ,大分県臼杵市大字佐志生６５３２番地の１,2026-05-13,株式会社
株式会社Ｍｉｌｅ,新潟県上越市北城町１丁目１０番２１号,2026-05-13,株式会社
株式会社Ｍｉｏ‐Ｄ‐Ａｒｃ,大阪府大阪市西淀川区歌島３丁目８－３プラザ歌島Ｃ棟３１３号,2026-05-13,株式会社
株式会社Ｎ９ＮＥ,東京都港区南青山１丁目１番１号新青山ビル東館７階,2026-05-13,株式会社
株式会社ＮＥＯ‐ＣＲＥＡＴＥ,北海道札幌市中央区南三条西２０丁目３番１１号,2026-05-13,株式会社
株式会社ＮＨＤ,沖縄県糸満市字真栄里７９４番地,2026-05-13,株式会社
株式会社ＮＫ　Ｌａｂｏｒａｔｏｒｙ,愛知県名古屋市中区上前津１丁目１１番１８号Ｔｒｉｎｉｔｙ１０３号,2026-05-13,株式会社
株式会社ＮＯＭ,東京都杉並区高円寺北３丁目２５‐２６,2026-05-13,株式会社
株式会社ＮＯＭＡＤ,東京都江東区新大橋２丁目１８番５号リビオメゾン新大橋５０３,2026-05-13,株式会社
株式会社Ｎｅｘｉａｌ　Ｃａｐｉｔａｌ　Ｈｏｌｄｉｎｇｓ,東京都江東区青海２丁目７番４号ｔｈｅＳＯＨＯ３１４,2026-05-13,株式会社
株式会社Ｎｕｔｚｌａｂ,兵庫県尼崎市大庄西町４丁目４－４０,2026-05-13,株式会社
株式会社ＯＧＩＯ　ＬＩＮＫ,大阪府大阪市東淀川区東淡路１丁目５番２－１２２３号,2026-05-13,株式会社
株式会社ＯＫＡＭＩ,東京都渋谷区恵比寿３丁目３０番２－２０２号,2026-05-13,株式会社
株式会社ＯＮＥ　ＰＵＴＴ,京都府京都市南区東寺町５１５番地,2026-05-13,株式会社
株式会社ＯＳＳＡ,愛知県豊田市足助町西町４７番地,2026-05-13,株式会社
株式会社Ｏｂｕｓｔ,神奈川県川崎市宮前区菅生４丁目１３番５６号,2026-05-13,株式会社
株式会社Ｐａｃｉｆｉｃ　Ａｌｌｉａｎｃｅ　Ｂｒｉｄｇｅ,東京都港区浜松町２丁目２番１５号浜松町ダイヤビル２Ｆ,2026-05-13,株式会社
株式会社ＰｅｏｐｌｅＯｎｅ,千葉県鎌ケ谷市南鎌ケ谷１丁目２番３７号,2026-05-13,株式会社
株式会社Ｐｅｒｓｉｍｍｏｎ　Ｈｉｌｌ,大阪府和泉市のぞみ野３丁目４番４１号エイトハーフビル２Ｆ－Ｂ,2026-05-13,株式会社
株式会社ＰｏｐＬｉｎｋ,東京都渋谷区道玄坂１丁目１０番８号渋谷道玄坂東急ビル２Ｆ－Ｃ,2026-05-13,株式会社
株式会社Ｐｒｏｔｅｃｈ,大阪府守口市豊秀町１丁目２－１０,2026-05-13,株式会社
株式会社ＲＡＭＢ,福岡県福岡市中央区平尾１丁目４番７－５０１号,2026-05-13,株式会社
株式会社ＲＥ‐ＯＮＥ,東京都港区新橋４丁目２０‐９内山ビル１Ｆ,2026-05-13,株式会社
株式会社ＲＥＶＡＬＩＡ,東京都渋谷区円山町５番３号ＭＩＥＵＸ渋谷ビル８階,2026-05-13,株式会社
株式会社ＲＩＴＯパートナーズ,京都府京都市左京区下鴨南芝町９番地２,2026-05-13,株式会社
株式会社ＲＯＷ,茨城県取手市ゆめみ野１丁目１番地１６,2026-05-13,株式会社
株式会社ＲＳＰ,広島県廿日市市四季が丘８丁目５番地６,2026-05-13,株式会社
株式会社ＲＹＳＩＡ,鳥取県米子市角盤町２丁目６９番地サザンクロスビル２階,2026-05-13,株式会社
株式会社ＲＹＵ,東京都世田谷区松原１丁目２３番２－３０１号,2026-05-13,株式会社
株式会社Ｒｅｋｒｏｓ,東京都西東京市南町３丁目１７番８号,2026-05-13,株式会社
株式会社ＲｅｎｔａＬＩＮＫ,香川県仲多度郡多度津町大字東白方７０１番地１,2026-05-13,株式会社
株式会社Ｒｉｇｈｔ‐Ａｎｇｌｅ,東京都渋谷区神南１丁目１１番４号ＦＰＧリンクス神南５階,2026-05-13,株式会社
株式会社Ｒｉｔａ,神奈川県横浜市鶴見区鶴見中央５丁目９番６号コスモプレイス鶴見中央１階,2026-05-13,株式会社
株式会社ＳＫＹ,北海道北斗市東前１９番地１,2026-05-13,株式会社
株式会社ＳＷＡＬＬＯＷ　ＳＴＵＤＩＯ,大阪府大阪市中央区博労町３丁目１－１０ルセオン博労町１Ｆ,2026-05-13,株式会社
株式会社ＳＹ　Ｐａｒｔｎｅｒｓ,東京都千代田区岩本町３丁目２－１ビリーフ岩本町４０１,2026-05-13,株式会社
株式会社Ｓｅｌｌａｐｈｉｍ,東京都豊島区東池袋１丁目３－７吉田ビル３Ｆ,2026-05-13,株式会社
株式会社Ｓｏｌ,岡山県岡山市北区西古松２丁目１７番１２号,2026-05-13,株式会社
株式会社Ｔ．Ｏ,東京都江戸川区南葛西３丁目１３番２０号,2026-05-13,株式会社
株式会社ＴＡＬＥＮＴＢＡＳＥ　ＪＡＰＡＮ,東京都千代田区神田和泉町１番地６－１６ヤマトビル４０５,2026-05-13,株式会社
株式会社ＴＤＨ,東京都世田谷区大蔵１丁目７番１４－６０３号,2026-05-13,株式会社
株式会社ＴＥＤＭＯＶＥ,東京都国分寺市西元町４丁目５－２０,2026-05-13,株式会社
株式会社ＴＥＲＲＡ,沖縄県国頭郡金武町字屋嘉２８９５番地,2026-05-13,株式会社
株式会社ＴＫユースフル,愛知県丹羽郡大口町替地３丁目２２２番地８,2026-05-13,株式会社
株式会社ＴＫＬｏｇｉｃ,東京都武蔵野市境２丁目２番２０－７０２号,2026-05-13,株式会社
株式会社ＴＮＡＣ,東京都渋谷区恵比寿西２丁目４番８号ウィンド恵比寿ビル８Ｆ,2026-05-13,株式会社
株式会社ＴＮＫ,埼玉県川口市栄町３丁目１１番６号,2026-05-13,株式会社
株式会社ＴＲｙＡＳ,大阪府東大阪市長瀬町１丁目２番１０号,2026-05-13,株式会社
株式会社ＴＳＵＩＴＡＣＨＩ,東京都渋谷区渋谷２丁目１１－５クロスオフィス渋谷メディオ９Ｆ,2026-05-13,株式会社
株式会社Ｔａｕｒｉａ,神奈川県川崎市中原区木月３丁目１５―３１ブレーメンストリートハウス１Ｆ,2026-05-13,株式会社
株式会社Ｔｈｅ　Ｙａｍａｍｕｒａ,東京都港区赤坂８丁目１１番１１号,2026-05-13,株式会社
株式会社Ｔｒａｄｇｅ,兵庫県神崎郡市川町屋形４６３－１,2026-05-13,株式会社
株式会社Ｕ‐Ｃｒｅａｔｅ,福岡県久留米市野中町８５番地１２,2026-05-13,株式会社
株式会社ＵＥＤＡ,群馬県邑楽郡邑楽町大字明野１６番地５,2026-05-13,株式会社
株式会社ＵＮＩＣＯ,神奈川県横浜市青葉区大場町９３０番地１８９,2026-05-13,株式会社
株式会社ＵＲＵＲＩＡ　ＪＡＰＡＮ,京都府京都市下京区万寿寺町１３５番地ベルク烏丸８０２,2026-05-13,株式会社
株式会社ＵＺＩ,神奈川県横浜市港北区樽町２丁目３番２２－６０３号,2026-05-13,株式会社
株式会社Ｕｎｉ,愛知県名古屋市北区大杉１丁目２１番８号ＡＬＢＡＧＡＲＡＧＥ白壁北２階,2026-05-13,株式会社
株式会社ＷＡＱＵＷＡ,愛知県豊川市大橋町３丁目３０番地,2026-05-13,株式会社
株式会社ＷｅｅＡｒｅ,愛知県名古屋市中区錦２丁目２０番１５号広小路クロスタワー１３階,2026-05-13,株式会社
株式会社ＷｉｎｅＧＯ,東京都港区六本木４丁目１２番８号,2026-05-13,株式会社
株式会社Ｗｏｎｄｅｒ　Ｗａｌｌ,大阪府大阪市旭区清水３丁目３番２０号エトワール清水３０２,2026-05-13,株式会社
株式会社Ｗｏｒｋ　ｏｆ　Ｌｏｖｅ,東京都中央区晴海３丁目６番８－１１１６号,2026-05-13,株式会社
株式会社Ｗｏｒｋｆｏｒｃｅ,大阪府豊中市北条町２丁目１０番２４号,2026-05-13,株式会社
株式会社Ｘ,神奈川県横浜市旭区二俣川１丁目４５番地４５大高ビル１階,2026-05-13,株式会社
株式会社ＸＥＮＯＲＡ,神奈川県大和市上草柳１８４番地８４プロシードⅧ１０２,2026-05-13,株式会社
株式会社ＹＯＵ,東京都目黒区駒場２丁目１番７－５０２号駒場パークサイドヒルズ,2026-05-13,株式会社
株式会社ＹＴＫ,神奈川県横浜市鶴見区駒岡４丁目２３番７２－１５５号,2026-05-13,株式会社
株式会社ＺＥＬＫ,東京都世田谷区太子堂４丁目１８番１５号マガザン三軒茶屋２－３Ｆ－３,2026-05-13,株式会社
株式会社ＺＥＲＯ建設,北海道函館市千代台町１４番８号,2026-05-13,株式会社
株式会社ＺＥＳＴＡ,東京都渋谷区恵比寿４丁目２０番３号恵比寿ガーデンプレイスタワー１８階,2026-05-13,株式会社
株式会社Ｚｏｏ,東京都杉並区下高井戸３丁目３２―４,2026-05-13,株式会社
株式会社ａ‐ｇｉａｓ,東京都中央区八重洲２丁目１番１号,2026-05-13,株式会社
株式会社ａｎｓｈａｒｅ,沖縄県那覇市松尾２丁目５番３３号グランステイツ松尾１Ｆ,2026-05-13,株式会社
株式会社ｂｌａｒｅｇｎ,山梨県甲府市丸の内２丁目２―１ＣＲＯＳＳ５００、１Ｆ,2026-05-13,株式会社
株式会社ｋｉｍｏｎｏ絲,東京都世田谷区奥沢２丁目２６番４号,2026-05-13,株式会社
株式会社ｍ．ａ．ｗｏｏｄ,愛知県常滑市栄町７丁目４５番地,2026-05-13,株式会社
株式会社ｍｉｇｈｔｙ,兵庫県神戸市灘区岩屋中町２丁目７番１４－２号,2026-05-13,株式会社
株式会社ｍｏｄａＭ,北海道函館市富岡町２丁目２７番２号,2026-05-13,株式会社
株式会社ｍｕｓｕｂｕ,北海道札幌市北区北四十条西５丁目１番１号ｅｃｏａ麻生駅前１Ｆ,2026-05-13,株式会社
株式会社ｒｅｔｏｒ,大阪府大阪市浪速区下寺１丁目４番６号１Ｆ,2026-05-13,株式会社
株式会社ｓｅｍｕｉ,北海道室蘭市入江町１番地１１５ＴＨＩＮＫＭ,2026-05-13,株式会社
株式会社ｔｏｍａｒｉｇｉ,東京都世田谷区羽根木２丁目３９番１８号とまり木Ａ,2026-05-13,株式会社
株式会社ｕｅｇａｙａ,千葉県八街市八街ほ６０７番地７,2026-05-13,株式会社
梅田テック合同会社,京都府京丹後市網野町網野２７３４番地,2026-05-13,合同会社
植野設備合同会社,神奈川県横浜市旭区今宿東町１６３８番地１ライオンズマンション鶴ヶ峰ガーデン２２３,2026-05-13,合同会社
次元ラボ株式会社,広島県福山市引野町５丁目８番２７号,2026-05-13,株式会社
永和合同会社,愛知県豊田市花園町塩倉１１番地２２,2026-05-13,合同会社
無限医療機器株式会社,東京都千代田区丸の内２丁目２－１岸本ビルヂング７Ｆ２０９室,2026-05-13,株式会社
特定非営利活動法人オランジェリーの杜,東京都港区六本木１丁目３番４０－１２０２号,2026-05-13,その他の設立登記法人
特定非営利活動法人小樽職人の会,北海道小樽市花園５丁目７番２号,2026-05-13,その他の設立登記法人
特定非営利活動法人日本台灣青年會,京都府京都市下京区朱雀分木町２６番地,2026-05-13,その他の設立登記法人
特定非営利活動法人横浜ユネスコ協会,神奈川県横浜市西区北幸２丁目１０番地４８むつみビル３Ｆ,2026-05-13,その他の設立登記法人
田中工業株式会社,福岡県大牟田市馬込町２丁目２８番地,2026-05-13,株式会社
益達株式会社,神奈川県横浜市中区柏葉２４番５－２０５号,2026-05-13,株式会社
社会保険労務士法人熊倉事務所,大阪府枚方市走谷１丁目９番４号,2026-05-13,その他の設立登記法人
社会保険労務士法人神都,三重県伊勢市一之木４丁目６番２２号,2026-05-13,その他の設立登記法人
神輝ガードサービス株式会社,兵庫県神戸市灘区中郷町４丁目２－１,2026-05-13,株式会社
笹島警備株式会社,北海道苫小牧市北栄町１丁目７番２３号,2026-05-13,株式会社
結株式会社,岡山県倉敷市児島柳田町２４０２－２５,2026-05-13,株式会社
良遊企画合同会社,宮城県仙台市青葉区柏木２丁目６番７号,2026-05-13,合同会社
荒川温泉株式会社,長崎県五島市玉之浦町荒川１３０番地,2026-05-13,株式会社
華栄株式会社,東京都世田谷区代沢５丁目３２番７号八千代ビル,2026-05-13,株式会社
蒼山株式会社,東京都港区白金台５丁目１５番５号,2026-05-13,株式会社
誉合同会社,福岡県北九州市小倉南区重住２丁目７－４６,2026-05-13,合同会社
采絃建設株式会社,福島県大沼郡会津美里町字安田乙９７７番地５,2026-05-13,株式会社
開成キャリア株式会社,東京都渋谷区千駄ヶ谷３丁目４番１８号蒼映パーク原宿２０４,2026-05-13,株式会社
陽光株式会社,兵庫県芦屋市山芦屋町２９－７,2026-05-13,株式会社
鹿野塗装株式会社,福島県二本松市下川崎字蟹田４３番地１,2026-05-13,株式会社
１０ｔｅｎ株式会社,広島県広島市安佐南区山本新町４丁目９－４,2026-05-13,株式会社
５Ｓ株式会社,東京都豊島区南池袋１丁目１６－１５ダイヤゲート池袋５Ｆ,2026-05-13,株式会社
Ａ‐Ｂｅｓｔ　Ａｓｓｅｔ株式会社,東京都江東区深川２丁目２４番２号,2026-05-13,株式会社
ＡＣＴ　Ｉｎｖｅｓｔｍｅｎｔ　Ｍａｎａｇｅｍｅｎｔ株式会社,東京都港区虎ノ門１丁目１７番１号虎ノ門ヒルズビジネスタワー１５階,2026-05-13,株式会社
ＡＥＰ　Ｍ＆Ａアドバイザリー株式会社,神奈川県横浜市西区浅間町４丁目３３２番地１４,2026-05-13,株式会社
ＡＧマーケティング合同会社,京都府京都市西京区松尾鈴川町８３番地１８,2026-05-13,合同会社
ＡＫＤｒａｆｔ株式会社,東京都西多摩郡日の出町大字平井８３６番地３,2026-05-13,株式会社
ＡＰＬＵＳ　ＩＧＩＳ特定目的会社,東京都港区虎ノ門３丁目２２番１０－２０１号,2026-05-13,その他の設立登記法人
ＡＲＣＨＩ‐Ｋ合同会社,岡山県岡山市北区首部３３２－１０－１０１,2026-05-13,合同会社
Ａｒｃ　Ｄｅｓｉｇｎ合同会社,東京都杉並区成田西３丁目１２番１７号,2026-05-13,合同会社
ＢＧＸ株式会社,東京都葛飾区新小岩２丁目５番１４号,2026-05-13,株式会社
ＢＬＥＮＤ株式会社,京都府宇治市小倉町西浦９４番地の４０,2026-05-13,株式会社
ＢＴ２ホールディングス株式会社,東京都千代田区丸の内２丁目４番１号,2026-05-13,株式会社
Ｂａｎｋｉｎ　Ｒｅｓｅａｒｃｈ株式会社,大阪府東大阪市玉串町東２丁目３番３２号,2026-05-13,株式会社
Ｂａｎｚａｉ　Ｊａｐａｎ合同会社,静岡県浜松市中央区三島町１５０３番地フジビル２Ｆ南,2026-05-13,合同会社
Ｂｉｇａ　Ｐｒｏｐｅｒｔｉｅｓ合同会社,東京都足立区江北１丁目３１番６号,2026-05-13,合同会社
ＣＡＭＥＲＩＫ　Ｐ．Ａ．，ＮＥＬＬＩＥ　Ｐ．,,2026-05-13,外国会社等
Ｃｏｃｏｒｏ　Ｌｉｎｋ株式会社,岐阜県瑞浪市稲津町萩原１３８０番地の１,2026-05-13,株式会社
ＣｒｏｓｓＰｏｉｎｔ株式会社,東京都町田市図師町１５５８番地５,2026-05-13,株式会社
Ｄ　Ｓｔａｒ　Ｃｏｎｓｕｌｔｉｎｇ合同会社,香川県木田郡三木町大字下高岡３９１３番地１１,2026-05-13,合同会社
Ｄ．Ｎ．ＩＮＴＥＲＮＡＴＩＯＮＡＬ　Ｎｅｐａｌ　Ｏｖｅｒｓｅａｓ　Ｅｍｐｌｏｙｍｅｎｔ　Ａｇｅｎｃｙ合同会社,京都府宇治市宇治宇文字２－４２一千堂ビル２階Ｂ号室,2026-05-13,合同会社
Ｄａｍｍｉｋａ　Ｅｎｔｅｒｐｒｉｓｅｓ,京都府綴喜郡井手町大字井手小字平山２２－２５,2026-05-13,外国会社等
ＦＢ‐Ｃ株式会社,東京都墨田区東向島２丁目１４番１１号,2026-05-13,株式会社
ＦＬＢ株式会社,神奈川県相模原市南区鵜野森１丁目３０番３－９０６号,2026-05-13,株式会社
ＦＯＨ　ＫＯＮ　ＴＥＸＴＩＬＥ　ＬＩＭＩＴＥＤ,,2026-05-13,外国会社等
ＧＬＳ株式会社,兵庫県宝塚市高司５丁目５番２２号,2026-05-13,株式会社
ＧＲＡ合同会社,埼玉県さいたま市岩槻区大字大口７５９,2026-05-13,合同会社
ＧＳキャピタル株式会社,東京都大田区山王１丁目３９番２３号,2026-05-13,株式会社
ＨＢネクスト株式会社,愛知県名古屋市西区大野木１丁目１８４番地,2026-05-13,株式会社
ＨＲＸ株式会社,東京都中央区日本橋小舟町８番１号ヒューリック小舟町ビル７階,2026-05-13,株式会社
Ｈｅｌｌｏ　Ｂｌｕｅ合同会社,東京都渋谷区円山町５番３号ＭＩＥＵＸ渋谷ビル８階,2026-05-13,合同会社
Ｈｏｋｋａｉｄｏ　Ｅｓｔａｔｅ　Ｌｉｍｉｔｅｄ,,2026-05-13,外国会社等
ＩＫＥＹＡホールディングス株式会社,埼玉県川口市飯塚１丁目１８番１７号山柿マンション３階,2026-05-13,株式会社
ＪＲ東日本豊里創生株式会社,東京都港区高輪２丁目２１番１号,2026-05-13,株式会社
Ｋ＆Ｆ株式会社,大阪府東大阪市大蓮東３丁目１１番２１号,2026-05-13,株式会社
Ｋ＆ＮＹ株式会社,東京都港区麻布十番２丁目２０番２号麻布十番ハイツ２０２号,2026-05-13,株式会社
ＫＡＭＩ　ＷＯＲＫＳ合同会社,宮城県加美郡加美町字南町１３８番地３,2026-05-13,合同会社
ＫＡＴＯａｇｒｉ合同会社,大分県杵築市山香町大字倉成６９２番地１,2026-05-13,合同会社
ＫＥＮデンキ株式会社,香川県高松市成合町４９０番地１３,2026-05-13,株式会社
ＫＥＳ　Ｃａｐｉｔａｌ合同会社,東京都港区六本木１丁目４番５号アークヒルズサウスタワー６階,2026-05-13,合同会社
ＫＩＮＧ　ＣＯＯＫＩＥＳ合同会社,三重県鈴鹿市住吉町７２６５－４６,2026-05-13,合同会社
ＫＳＪ２‐３株式会社,岡山県岡山市北区錦町１番１号岡山駅前ビル４階,2026-05-13,株式会社
Ｋａｉｈａｔｓｕ　Ｐｒｉｍｅ１一般社団法人,東京都千代田区丸の内１丁目４番１号東京共同会計事務所内,2026-05-13,その他の設立登記法人
Ｋａｉｒｏ　Ｖａｕｌｔ　Ｔｅｃｈｎｏｌｏｇｉｅｓ合同会社,東京都千代田区大手町１丁目７番２号東京サンケイビル２７階,2026-05-13,合同会社
Ｋａｚｏｋｕ一般社団法人,大阪府大阪市中央区高麗橋４丁目３番７号淀屋橋総合会計内,2026-05-13,その他の設立登記法人
ＫｉＫｉ合同会社,大阪府吹田市千里丘北１番２８－１１０５号,2026-05-13,合同会社
ＬＩＮＫＡ合同会社,東京都台東区上野１丁目１７番６号上野広小路ビル８Ｆ－Ｂ,2026-05-13,合同会社
ＬＭレッカーサービス株式会社,千葉県船橋市金杉２丁目５番３号,2026-05-13,株式会社
ＬＵＭＥＮＯ株式会社,東京都中野区本町１丁目１６－６サンオーレ中野坂上２０３,2026-05-13,株式会社
