法人名,住所,設立日,法人種別
Ｋｅｙ　Ａｓｓｅｔ合同会社,東京都港区南青山２丁目２番１５号,2024-06-07,合同会社
Ｋｕｋｉ　Ｌｏｇｉｓｔｉｃｓ一般社団法人,東京都千代田区丸の内３丁目１番１号東京共同会計事務所内,2024-06-07,その他の設立登記法人
Ｋｕｋｉ　Ｌｏｇｉｓｔｉｃｓ合同会社,東京都千代田区丸の内３丁目１番１号東京共同会計事務所内,2024-06-07,合同会社
ＬＡＦＡ合同会社,愛知県弥富市稲荷２丁目４３番地１,2024-06-07,合同会社
Ｌｏｔｕｓ　Ｂｏｎｄ合同会社,愛知県名古屋市東区橦木町３丁目３０番地,2024-06-07,合同会社
Ｍ３コンサルティング株式会社,大阪府大阪市西淀川区千舟２丁目１５番２－３０８号,2024-06-07,株式会社
ＭＡＹＡ　Ｔｅｃｈｎｏｌｏｇｙ合同会社,東京都中央区銀座１丁目１２－４Ｎ＆Ｅ・ＢＬＤ．７階,2024-06-07,合同会社
ＭＯＶＥ　ＪＡＰＡＮ株式会社,岡山県岡山市東区瀬戸町江尻２２２０番地６,2024-06-07,株式会社
Ｍａｄｉｎａ　Ｔｒａｄｉｎｇ　Ｐｖｔ　Ｌｔｄ,神奈川県愛甲郡清川村煤ヶ谷８－１５－１,2024-06-07,外国会社等
Ｍａｖｅｒｉｃｋｓ株式会社,大阪府大阪市平野区加美正覚寺１丁目５－３ショウエイハウス４Ｂ,2024-06-07,株式会社
ＭｅｅｔＩｎＦｅｂ株式会社,東京都台東区松が谷２丁目１５番８号浅草Ｋ２ビル４１１号室,2024-06-07,株式会社
Ｍｅｎｔｉｉ株式会社,東京都渋谷区恵比寿西２丁目４番８号ウィンド恵比寿ビル８Ｆ,2024-06-07,株式会社
ＮＩＨＯＮ　ＡＵＴＯ株式会社,東京都新宿区高田馬場２丁目１９－７タックイレブン高田馬場９０５,2024-06-07,外国会社等
ＮＫＣ合同会社,大阪府大阪市大正区泉尾７丁目２－２０,2024-06-07,合同会社
ＮＬＥＳマネジメント株式会社,神奈川県横浜市戸塚区品濃町８８１番地１６,2024-06-07,株式会社
ＮＰＴＲＡＤＥ合同会社,富山県射水市浜開新町１２番地７,2024-06-07,合同会社
Ｎｉｌｕｓｈｉ　Ｉｎｔｅｒｎａｔｉｏｎａｌ　Ｐｒｉｖａｔｅ　Ｌｉｍｉｔｅｄ　Ｃｏｍｐａｎｙ,千葉県旭市野中７８０番地４－１０３,2024-06-07,外国会社等
ＯＡＳＩＳ株式会社,兵庫県神戸市中央区布引町２丁目１番１１号グレイスハイツ新神戸３０５号,2024-06-07,株式会社
ＯＨＡ　Ｈｏｎｇ　Ｋｏｎｇ　Ｓｅｒｖｉｃｅｓ　Ｌｉｍｉｔｅｄ,東京都千代田区丸の内３丁目４番１号新国際ビル８階,2024-06-07,外国会社等
ＯＲＣＨＩＤ　ＴＲＡＤＩＮＧ合同会社,神奈川県秦野市南矢名２丁目２５番５号三共学友会館１１４号室,2024-06-07,合同会社
Ｏｃｅａｎ　ＶｉｔａｌＣａｒｅ合同会社,大阪府大阪市都島区都島北通２丁目１７番４号,2024-06-07,合同会社
Ｏｎ‐Ｎａｖｉ株式会社,沖縄県国頭郡恩納村字恩納４１９番地３恩納村コミュニティセンターＵＮＮＡわーく,2024-06-07,株式会社
ＯｎｙｘＳｔｕｄｉｏ合同会社,東京都港区赤坂２丁目１４番５号Ｄａｉｗａ赤坂ビル４階,2024-06-07,合同会社
Ｏｔｈｅｒ　Ｗｏｒｌｄ　Ｃｏｍｐｕｔｉｎｇ，Ｉｎｃ．,,2024-06-07,外国会社等
ＰＪＸ合同会社,神奈川県横浜市西区浅間町１丁目９－２０,2024-06-07,合同会社
ＰＯＳＥＩＤＯＮ　ＴＲＡＮＳ株式会社,大阪府大阪市北区本庄東１丁目１６番１号,2024-06-07,株式会社
ＰＲＯＰ合同会社,東京都世田谷区池尻１丁目６番地５号,2024-06-07,合同会社
ＰＵＲＮＡ合同会社,富山県富山市常盤台３６番１２号,2024-06-07,合同会社
Ｒ＆Ｌ　ＣＡＰＩＴＡＬ株式会社,東京都中央区日本橋箱崎町２０番１号,2024-06-07,株式会社
ＲＥ‐ＴＥＣＨ株式会社,静岡県沼津市志下５９１番地の２,2024-06-07,株式会社
ＳＯＬＩＤＡＲＩＴＹ　ＴＯＫＹＯ株式会社,東京都立川市柏町１丁目２９番地の２５－１０２号,2024-06-07,株式会社
ＳＵＮＲＩＳＥ　ＴＲＡＤＩＮＧ　ＣＯＭＰＡＮＹ合同会社,群馬県太田市西本町５５－１２コーポマインド１０２,2024-06-07,合同会社
Ｓｏｌｖｉｏ株式会社,大阪府大阪市住之江区粉浜１丁目１１番５号,2024-06-07,株式会社
Ｓｐｉｒａｌ　Ｍａｎａｇｅｍｅｎｔ合同会社,東京都目黒区下目黒６丁目５－２１－２２７シティテラス下目黒,2024-06-07,合同会社
Ｓｕｎ‐Ｌｉｇｈｔ‐Ｇｒｏｕｐ株式会社,神奈川県茅ヶ崎市南湖４丁目１８番４１号サーフサイド茅ヶ崎２－１０１,2024-06-07,株式会社
ＴＡＩ　ＰＨＡＴ合同会社,愛知県名古屋市東区葵３丁目３番８－６０７号,2024-06-07,合同会社
ＴＡＴＵＹＡ合同会社,東京都世田谷区世田谷１丁目３５番１６号アプローズセタガヤ１０３,2024-06-07,合同会社
ＴＨＩＥＮ　ＡＮ合同会社,愛知県名古屋市熱田区新尾頭１丁目１番１２号マルトウビル２０６号室,2024-06-07,合同会社
ＴＲＹＺＩＮ合同会社,東京都渋谷区渋谷２丁目１９－１５宮益坂ビルディング６０９,2024-06-07,合同会社
Ｔｅｃｈ‐ＢＶＪ合同会社,埼玉県所沢市小手指町４丁目１８番地の９トリヴァンベール小手指２０３,2024-06-07,合同会社
Ｔｒｅａｓｕｒｅ　Ｌａｂ合同会社,東京都渋谷区円山町５番５号Ｎａｖｉ渋谷Ｖ３階,2024-06-07,合同会社
Ｗｅａｌｔｈｙ　Ｌｉｆｅ　Ｊａｐａｎ株式会社,東京都新宿区西新宿４丁目２５番１６センチュリー西新宿２０１号,2024-06-07,株式会社
ＷｉＺ　ｔｒｕｓｔ株式会社,北海道札幌市中央区北三条西２０丁目２番１６号北３条ＭＭビル３０５号室,2024-06-07,株式会社
ＹＡＮＡＧＩ　Ｃｏｎｓｕｌｔｉｎｇ株式会社,東京都新宿区原町１丁目３８番地１０,2024-06-07,株式会社
ＹＸ株式会社,大阪府大阪市浪速区下寺３丁目１－１４エクレール夕陽丘５号２０３号室,2024-06-07,株式会社
Ｙａｎｉｗａ株式会社,東京都中央区日本橋小舟町１４－７ＳＯＩＬＮｉｈｏｎｂａｓｈｉ,2024-06-07,株式会社
Ｙｏｕｒ　Ｖｏｉｃｅ合同会社,東京都渋谷区神宮前６丁目２３番４号桑野ビル２階,2024-06-07,合同会社
ｃｏｃｏｎｉ　ｈｏｕｓｅ株式会社,北海道札幌市中央区宮の森二条１６丁目９番１６号,2024-06-07,株式会社
ｅｇｇ合同会社,京都府木津川市州見台５丁目３－２,2024-06-07,合同会社
ｆｌｏｗｅｒ　ｉｓ合同会社,東京都中央区銀座１丁目１２番４号Ｎ＆ＥＢＬＤ．６Ｆ,2024-06-07,合同会社
ｍａｋｅ‐ｉ合同会社,大阪府茨木市戸伏町１２番８号,2024-06-07,合同会社
ｍａｎａｂｉ　ｐｌｕｓ合同会社,東京都新宿区西新宿３丁目３番１３号西新宿水間ビル６階,2024-06-07,合同会社
ｎｏｒｔｈ　ｔｒｅｋｓ株式会社,北海道江別市中島１８番地６,2024-06-07,株式会社
ｓｈｅｎｚｈｅｎｓｈｉｈｅｉｓａｉｋｅｊｉｙｏｕｘｉａｎｇｏｎｇｓｉ,,2024-06-07,外国会社等
ｓｌｉｃｅ　ｏｆ　ｊａｐａｎ合同会社,茨城県古河市東山田５８１－８フラップタウンＣ‐１４棟２階Ｅ号室,2024-06-07,合同会社
ｓｕｋｒａ合同会社,長崎県佐世保市下本山町３８６‐１,2024-06-07,合同会社
ｗｅｂ人合同会社,東京都江東区千石２丁目３－４０クボビル１０２,2024-06-07,合同会社
あいぷれい合同会社,徳島県阿南市那賀川町赤池２１８番地３,2024-06-10,合同会社
あすか総合研究株式会社,東京都渋谷区代々木２丁目２３番１号,2024-06-10,株式会社
いすみベリースカイブルー合同会社,千葉県いすみ市小高５０３番地５,2024-06-10,合同会社
おかみ株式会社,東京都港区南麻布５丁目５番１４号,2024-06-10,株式会社
さとう電気株式会社,愛知県稲沢市祖父江町大牧明田８３９番地４８,2024-06-10,株式会社
にこにこ不動産合同会社,千葉県長生郡長柄町皿木１５１番地１,2024-06-10,合同会社
はさま合同会社,東京都新宿区西新宿３丁目３番１３号西新宿水間ビル６階,2024-06-10,合同会社
アイズラック合同会社,東京都新宿区西新宿３丁目３－１３西新宿水間ビル２Ｆ,2024-06-10,合同会社
アキオ・インターナショナル株式会社,千葉県山武郡九十九里町作田５６３３番地２４０,2024-06-10,株式会社
アシスト合同会社,東京都文京区小石川３丁目２６番２,2024-06-10,合同会社
アスミエル合同会社,神奈川県相模原市緑区大島２５８９番地１５,2024-06-10,合同会社
アズール合同会社,香川県高松市屋島西町２２７４番地２０アルファシティ屋島六番館４０３号,2024-06-10,合同会社
アナレマ合同会社,福岡県糸島市志摩野北字犬鳴山２７５７番４４,2024-06-10,合同会社
アプロ山梨株式会社,山梨県富士吉田市下吉田８丁目２番４０号,2024-06-10,株式会社
アルテナーシング株式会社,熊本県熊本市中央区京町２丁目７番３４号,2024-06-10,株式会社
アヴリル合同会社,北海道札幌市白石区北郷一条８丁目１１番１５号,2024-06-10,合同会社
アーバングリーン合同会社,東京都港区新橋３丁目８番４号ル・グラシエルビル１４－３０３,2024-06-10,合同会社
イロドリ株式会社,愛媛県西宇和郡伊方町三崎１１６５,2024-06-10,株式会社
イーライフ株式会社,大分県佐伯市中の島３丁目２番３３号,2024-06-10,株式会社
ウォーターデジタル合同会社,東京都墨田区緑２丁目１５番１１－９０３号ジェイパーク両国デュアルフォルム,2024-06-10,合同会社
エクサスセンド株式会社,神奈川県川崎市多摩区堰１丁目１７番５２号,2024-06-10,株式会社
エステートプライム株式会社,東京都豊島区要町１丁目２２番６号,2024-06-10,株式会社
エスポワール株式会社,神奈川県横浜市港北区篠原町１３８３番地新横浜パークハイムⅡ２０１号,2024-06-10,株式会社
オーエス工業株式会社,石川県金沢市高畠１丁目３１０番地２,2024-06-10,株式会社
カムノル合同会社,東京都世田谷区北沢２丁目１１－１５ミカン下北Ａ街区４階,2024-06-10,合同会社
カンズ建装株式会社,静岡県浜松市中央区佐藤３丁目２３番１７号,2024-06-10,株式会社
ガフー株式会社,沖縄県国頭郡本部町字健堅１０８５番２,2024-06-10,株式会社
グリーン・エナジー・コンサルティング合同会社,東京都新宿区南元町２０－３ガーデンヒルズ四ツ谷迎賓の森２１４,2024-06-10,合同会社
グループホーム勇気株式会社,東京都中野区中央１丁目３５番６号レッチフィールド中野坂上ビル６Ｆ,2024-06-10,株式会社
コグニティブＨＤ株式会社,東京都港区六本木７丁目３番８号,2024-06-10,株式会社
ココハレ株式会社,富山県魚津市釈迦堂１丁目７番１３号,2024-06-10,株式会社
コタロウコンサルティング合同会社,愛知県名古屋市守山区瀬古東３丁目１２４２メルヴェーユ瀬古３０５,2024-06-10,合同会社
サンシックス株式会社,千葉県流山市流山２丁目１２７番地３流山ガーデンハイツ４０１,2024-06-10,株式会社
ジェイテック株式会社,兵庫県たつの市新宮町中野庄２２０番地９,2024-06-10,株式会社
スナハナ株式会社,東京都台東区松が谷２丁目９番１－２０５号,2024-06-10,株式会社
スムスム管理合同会社,福岡県北九州市戸畑区浅生１丁目３番２０－４０２号,2024-06-10,合同会社
スリーシックスコンサルティング株式会社,静岡県沼津市平町２５番１３号,2024-06-10,株式会社
ツー・イー合同会社,静岡県三島市本町２番４号,2024-06-10,合同会社
ナインスコード合同会社,東京都品川区大崎４丁目５番２５号クレセントコート１０４,2024-06-10,合同会社
ナープ株式会社,東京都渋谷区宇田川町２番１号渋谷ホームズ３階,2024-06-10,株式会社
ハピネス合同会社,香川県高松市木太町３９１４番地１７,2024-06-10,合同会社
ハレワタル合同会社,鹿児島県鹿児島市宇宿５丁目５－２ユーマンハイツ３０２,2024-06-10,合同会社
ヒアシンスバイオサイエンス株式会社,東京都港区西新橋３丁目２４番８号山内ビル３階,2024-06-10,株式会社
ファストクリエーション株式会社,埼玉県さいたま市北区宮原町３丁目９０１番地１Ｇ－１１０５,2024-06-10,株式会社
フェアウェル合同会社,東京都中央区日本橋室町１丁目１１番１２号日本橋水野ビル７階,2024-06-10,合同会社
フォルメコジャパン株式会社,千葉県千葉市美浜区打瀬３丁目５番地マリンフォート４－１５０２号,2024-06-10,株式会社
フジミクオリティ合同会社,千葉県千葉市中央区富士見２丁目２３番１０号－２Ｆ,2024-06-10,合同会社
ブリッツ株式会社,東京都中央区日本橋大伝馬町１３番７号,2024-06-10,株式会社
プログレス株式会社,神奈川県大和市中央６丁目２番３３号ステラ３０３,2024-06-10,株式会社
ホームアセット株式会社,大阪府大阪市北区菅原町９番１６号,2024-06-10,株式会社
マジェスティ合同会社,富山県富山市花園町３丁目６番２７号,2024-06-10,合同会社
マトリックスミジ・ジャパン株式会社,大阪府大阪市鶴見区緑１丁目１番２２号,2024-06-10,株式会社
ミッテン合同会社,東京都千代田区神田佐久間町４丁目６番地,2024-06-10,合同会社
ミヨシ貿易株式会社,徳島県板野郡藍住町徳命字新居須８０番地の１,2024-06-10,株式会社
メジャー合同会社,千葉県市川市中山３丁目１４番１１号,2024-06-10,合同会社
メディカルランナー株式会社,埼玉県鶴ヶ島市松ヶ丘４丁目１番１１－５０１号,2024-06-10,株式会社
ラシンズ合同会社,千葉県習志野市谷津１丁目６番１０－２０８号,2024-06-10,合同会社
リスペクトラボ合同会社,東京都千代田区麹町３丁目１２－６,2024-06-10,合同会社
リバティ株式会社,大阪府豊中市曽根東町１丁目１１番１号,2024-06-10,株式会社
レフエステート株式会社,神奈川県逗子市沼間１丁目２０番地の４,2024-06-10,株式会社
ワイヤレスブレイン株式会社,東京都府中市四谷２丁目２９番地の１３,2024-06-10,株式会社
一般社団法人ねこの手,和歌山県有田郡広川町大字和田３番地１,2024-06-10,その他の設立登記法人
一般社団法人ひまわりそろばんアカデミー,東京都中野区中野４丁目３番１－２２０５号,2024-06-10,その他の設立登記法人
一般社団法人アニマルパーソンズ,東京都中央区京橋２丁目５番２２号キムラヤビル７階,2024-06-10,その他の設立登記法人
一般社団法人ウェルネスアクティベーション協会,大阪府大阪市西成区梅南１丁目８番８号,2024-06-10,その他の設立登記法人
一般社団法人フォルゲ・ディア,兵庫県神戸市兵庫区浜中町１丁目２番５－５０７号,2024-06-10,その他の設立登記法人
一般社団法人フリーランス支援協会,兵庫県神戸市須磨区友が丘８丁目２０１番地の１９,2024-06-10,その他の設立登記法人
一般社団法人リアート,埼玉県川越市元町１丁目１４番地５（２階）,2024-06-10,その他の設立登記法人
一般社団法人全国病院歯科医協会,東京都江東区深川２丁目４番１１号一ツ橋印刷株式会社学会事務センター内,2024-06-10,その他の設立登記法人
一般社団法人地域イノベーション推進機構,長崎県雲仙市小浜町北本町８６９番地１１,2024-06-10,その他の設立登記法人
一般社団法人安全技術応用研究会,東京都品川区東大井５丁目４番１９号,2024-06-10,その他の設立登記法人
一般社団法人島原立志会,長崎県島原市新馬場町９７０番地１,2024-06-10,その他の設立登記法人
一般社団法人慶光会,東京都渋谷区渋谷２丁目２２－１１渋谷フランセ奥野ビル７Ｆ,2024-06-10,その他の設立登記法人
一般社団法人新トマム,東京都千代田区霞が関３丁目２番５号,2024-06-10,その他の設立登記法人
一般社団法人日本色相推命学会,福岡県福岡市中央区高砂２丁目１５－３４,2024-06-10,その他の設立登記法人
一般社団法人紫花会,東京都杉並区宮前５丁目２５番１８号,2024-06-10,その他の設立登記法人
一般社団法人翠山大学設立準備会,奈良県奈良市大宮町２丁目３番５２－８０６号,2024-06-10,その他の設立登記法人
一般社団法人ＤＣ１新砂,東京都中央区新富１丁目１５番３号ジパングアウトソーシングサービス株式会社内,2024-06-10,その他の設立登記法人
一般社団法人ＩＭＨＰＪ,東京都大田区南蒲田２丁目１６番２号テクノポート大樹生命ビル９Ｆ,2024-06-10,その他の設立登記法人
一般社団法人ＲＡＩＮＢＯＷ　ＦＥＳＴＡ,大阪府大阪市平野区瓜破４丁目２番２９号,2024-06-10,その他の設立登記法人
一般社団法人ＳＴＥＭ　ＣＥＬＬ　ＡＳＳＯＣＩＡＴＩＯＮ,大阪府泉佐野市西本町９－３,2024-06-10,その他の設立登記法人
一般財団法人レオーネ,静岡県下田市一丁目６番１８号,2024-06-10,その他の設立登記法人
上嘉地産股份有限公司,,2024-06-10,外国会社等
中山商会株式会社,大阪府羽曳野市大黒１４２番地の１,2024-06-10,株式会社
中山道合同会社,岐阜県中津川市茄子川３６３番地の１５０,2024-06-10,合同会社
中潤万家株式会社,東京都千代田区内神田２丁目４番２号一広グローバルビル１００１号,2024-06-10,株式会社
京耀株式会社,東京都練馬区関町北５丁目１３－２５Ａ室,2024-06-10,株式会社
仏山市燦奥貿易有限公司,,2024-06-10,外国会社等
佐藤商事株式会社,東京都立川市一番町２丁目２９番地の２,2024-06-10,株式会社
保育園情報ポータル株式会社,沖縄県中頭郡中城村字泊２９番地２,2024-06-10,株式会社
健康楽サービス株式会社,東京都台東区浅草橋２丁目７番５号,2024-06-10,株式会社
六起電力株式会社,福井県福井市竹生町第１９号１２番地１,2024-06-10,株式会社
内外リアルティホールディングス株式会社,東京都港区六本木５丁目１２番７－３０６号,2024-06-10,株式会社
北の森グリーンエナジー株式会社,北海道上川郡下川町西町９５８番地１,2024-06-10,株式会社
北花沢町自治会,滋賀県東近江市北花沢町９０４番地,2024-06-10,その他
合同会社あきなや,東京都葛飾区東新小岩７丁目３１番１９号リリウム１０３,2024-06-10,合同会社
合同会社いろは,石川県金沢市間明町１丁目２７番地,2024-06-10,合同会社
合同会社えがおのもと,千葉県市川市富浜１丁目２番１０号,2024-06-10,合同会社
合同会社かやすけ,愛知県豊田市足助町宮平２３－２,2024-06-10,合同会社
合同会社どるふぃん比良,宮崎県日向市大字塩見１４５６７番地１２９,2024-06-10,合同会社
合同会社はなぶさ,東京都中野区中央４丁目２３番１号,2024-06-10,合同会社
合同会社ひらた物流,愛媛県四国中央市川之江町２４０５番地１メゾン三愛３０１号,2024-06-10,合同会社
合同会社まるゆう,宮崎県都城市都北町６２４７番地２,2024-06-10,合同会社
合同会社アイランドウェルネス,東京都千代田区丸の内２丁目４－１丸ビル１０階,2024-06-10,合同会社
合同会社アインス,北海道北見市東三輪５丁目５番地１１８,2024-06-10,合同会社
合同会社アクシス,東京都港区北青山１丁目３番１号アールキューブ青山３階,2024-06-10,合同会社
合同会社アスファルト,静岡県静岡市駿河区谷田１１－１３,2024-06-10,合同会社
合同会社アルデンテ,東京都渋谷区神宮前６丁目２９－４原宿Ｋｏｍｉｙａビル６階,2024-06-10,合同会社
合同会社エクスポートワン,石川県金沢市大桑町庚７番地１,2024-06-10,合同会社
合同会社エタデスプリ,沖縄県宮古島市平良字東仲宗根９０１番地１２,2024-06-10,合同会社
合同会社エメラルドコンサルティング,富山県富山市高田５２７番地情報ビル５Ｆ,2024-06-10,合同会社
合同会社カネエ清水水産,北海道石狩市花畔四条１丁目１９４番地１,2024-06-10,合同会社
合同会社カノア,神奈川県横須賀市追浜本町１丁目３７番地,2024-06-10,合同会社
合同会社クレール,大分県豊後大野市三重町赤嶺１２４２番地２８,2024-06-10,合同会社
合同会社ケア美来,愛知県名古屋市守山区森孝１丁目１１０９番地リエス森孝２０４,2024-06-10,合同会社
合同会社ゴールデンクロス,埼玉県熊谷市別府５丁目１８５番地１,2024-06-10,合同会社
合同会社サイドフォート,兵庫県明石市相生町１丁目２－３４,2024-06-10,合同会社
合同会社ツカモト商店,静岡県静岡市葵区古庄５丁目１０－４０,2024-06-10,合同会社
合同会社ファミリー,栃木県佐野市大橋町２０８８－６アリス佐野第一２０３,2024-06-10,合同会社
合同会社ブリッジ,東京都豊島区池袋３丁目３４番７号ビジネスパーク池袋２階,2024-06-10,合同会社
合同会社プラトニア,長野県岡谷市湖畔３丁目２番１８号,2024-06-10,合同会社
合同会社プルーム,岐阜県岐阜市幸ノ町２丁目１０グランシャリオン１０２,2024-06-10,合同会社
合同会社リアル,新潟県長岡市三和１丁目６番１６号,2024-06-10,合同会社
合同会社リエネ岩手久慈ウインドファーム,東京都中央区京橋２丁目１２番６号ＡＯＪ税理士法人内,2024-06-10,合同会社
合同会社リエネ新潟関川ウインドファーム,東京都中央区京橋２丁目１２番６号ＡＯＪ税理士法人内,2024-06-10,合同会社
合同会社三十七鈴,兵庫県高砂市阿弥陀町魚橋１０４２番地の６,2024-06-10,合同会社
合同会社三十三鈴,兵庫県高砂市阿弥陀町魚橋１０４２番地の６,2024-06-10,合同会社
合同会社三十九鈴,兵庫県高砂市阿弥陀町魚橋１０４２番地の６,2024-06-10,合同会社
合同会社三十二鈴,兵庫県高砂市阿弥陀町魚橋１０４２番地の６,2024-06-10,合同会社
合同会社三十五鈴,兵庫県高砂市阿弥陀町魚橋１０４２番地の６,2024-06-10,合同会社
合同会社三十八鈴,兵庫県高砂市阿弥陀町魚橋１０４２番地の６,2024-06-10,合同会社
合同会社三十六鈴,兵庫県高砂市阿弥陀町魚橋１０４２番地の６,2024-06-10,合同会社
合同会社三十四鈴,兵庫県高砂市阿弥陀町魚橋１０４２番地の６,2024-06-10,合同会社
合同会社三矢,沖縄県名護市宇茂佐の森２丁目１３番地５,2024-06-10,合同会社
合同会社下電,宮城県仙台市青葉区本町１丁目５番２８号カーニープレイス仙台駅前通６０３号室,2024-06-10,合同会社
合同会社京女さん,京都府京都市南区久世殿城町５７５番地３向陽グランドハイツ７１９,2024-06-10,合同会社
合同会社光昇開発,北海道小樽市稲穂５丁目３番６号,2024-06-10,合同会社
合同会社前原青果,沖縄県名護市宇茂佐の森１丁目２番地１８,2024-06-10,合同会社
合同会社向日葵,大阪府堺市北区新金岡町５丁６番３０９号ＰＡＲＫＳＩＤＥ新金岡２０２号,2024-06-10,合同会社
合同会社四十一鈴,兵庫県高砂市阿弥陀町魚橋１０４２番地の６,2024-06-10,合同会社
合同会社四十三鈴,兵庫県高砂市阿弥陀町魚橋１０４２番地の６,2024-06-10,合同会社
合同会社四十二鈴,兵庫県高砂市阿弥陀町魚橋１０４２番地の６,2024-06-10,合同会社
合同会社四十五鈴,兵庫県高砂市阿弥陀町魚橋１０４２番地の６,2024-06-10,合同会社
合同会社四十六鈴,兵庫県高砂市阿弥陀町魚橋１０４２番地の６,2024-06-10,合同会社
合同会社四十四鈴,兵庫県高砂市阿弥陀町魚橋１０４２番地の６,2024-06-10,合同会社
合同会社四十鈴,兵庫県高砂市阿弥陀町魚橋１０４２番地の６,2024-06-10,合同会社
