法人名,住所,設立日,法人種別
株式会社ＬＵＸ　ＲＡＤＩＵＳ,東京都江東区木場５丁目１番５号メイプルハイム木場Ｂ１１３,2025-03-21,株式会社
株式会社Ｌｅ　Ｃｈａｍｂｒｅ,東京都中央区銀座６丁目４番８－８０３号,2025-03-21,株式会社
株式会社Ｌｉｃｏ　Ｓｔｙｌｅ,大阪府大阪市中央区安土町１丁目７番２０号新トヤマビル中央館４Ｆ,2025-03-21,株式会社
株式会社Ｌｉｎｋ,東京都八王子市明神町２丁目２０番７号アクトプレイス２階,2025-03-21,株式会社
株式会社Ｌｉｖｅ　Ｓｔｒａｉｇｈｔ,神奈川県綾瀬市上土棚中３丁目１１番３１号,2025-03-21,株式会社
株式会社Ｌｏｉｒｅ,大阪府交野市星田５丁目１０番８ルミエール星田１０１,2025-03-21,株式会社
株式会社ＭＨプランニング,茨城県水戸市元吉田町６３１番地の３２,2025-03-21,株式会社
株式会社ＭＪメンテナンス,埼玉県幸手市大字外国府間３７３－１,2025-03-21,株式会社
株式会社ＭＹ　Ｉｎｔｅｒｎａｔｉｏｎａｌ,東京都板橋区赤塚５丁目２３番９号,2025-03-21,株式会社
株式会社ＭＹＬＥＧＥＮＤ,東京都港区南麻布５丁目１５番２３号ピィクブラン佐々木ビル５階,2025-03-21,株式会社
株式会社Ｍｅｌｌｉｅｒ,大阪府枚方市春日元町１丁目８番２０号,2025-03-21,株式会社
株式会社Ｎ‐Ｖｉｓｉｏｎ,大阪府大阪市北区梅田１丁目１‐３大阪駅前第３ビル２９階１‐１‐１号室,2025-03-21,株式会社
株式会社ＮＣメディカルコンサルティング,兵庫県神戸市中央区御幸通４丁目２番１５号三宮米本ビル８Ｆ－Ｂ室,2025-03-21,株式会社
株式会社ＮＥＹＤＩＳ,大阪府大阪市中央区南本町２丁目３番１２号ＥＤＧＥ本町,2025-03-21,株式会社
株式会社ＮＨＩ　ＧＲＯＵＰ,千葉県八千代市大和田新田３５３番地１００,2025-03-21,株式会社
株式会社ＮＩＰＰＯＮ‐ＳＴＯＲＩＥＳ,大阪府大阪市北区大淀南１丁目３－１３－１,2025-03-21,株式会社
株式会社Ｎａｎａｌａ,大阪府大阪市住之江区粉浜西２丁目１３番２２号,2025-03-21,株式会社
株式会社Ｎａｔｕｒａｌ　Ｆｏｒｅｓｔ,大阪府枚方市東山２丁目３番地４０８号,2025-03-21,株式会社
株式会社Ｎｅｏｆｌｉｘ,東京都文京区大塚４丁目４番８－７０５号,2025-03-21,株式会社
株式会社ＯＦＦＩＣＥ　Ｋ,北海道帯広市西二十条南３丁目５３番１９号,2025-03-21,株式会社
株式会社ＯＧＡＷＡ,兵庫県たつの市揖保町中臣１１１５番地３,2025-03-21,株式会社
株式会社ＯＭＮＩＦＬＯＷ,東京都千代田区平河町１丁目６番１５号ＵＳビル８Ｆ,2025-03-21,株式会社
株式会社ＯＮ,神奈川県横浜市港北区師岡町３６８番地６ＷＯＯＤＢＥＬＬⅡＢ棟１階倉庫,2025-03-21,株式会社
株式会社ＯＴＡ,和歌山県和歌山市杭ノ瀬１０１番地２７,2025-03-21,株式会社
株式会社Ｏｃｃｉｄｅｎｔ,東京都渋谷区東１丁目８－８,2025-03-21,株式会社
株式会社Ｏｌｉｖｅ　Ｏｗｌ,大阪府寝屋川市香里新町２４番１４号,2025-03-21,株式会社
株式会社ＯｐｔＣａｒｅ,大阪府豊中市桜の町３丁目１１番１号リハビリテーション科学総合研究所内,2025-03-21,株式会社
株式会社ＰＯＰ,愛知県一宮市北方町北方字東本郷下１８９番地,2025-03-21,株式会社
株式会社ＰＵＬＳＥ,東京都町田市小川３丁目１１番地６,2025-03-21,株式会社
株式会社ＰｒｏＢｕｄｄｙ,東京都目黒区下目黒１丁目１番１４号コノトラビル７Ｆ,2025-03-21,株式会社
株式会社Ｒ‐Ｎｕ,東京都中央区日本橋蛎殻町１丁目３番６号,2025-03-21,株式会社
株式会社Ｒ‐ＺＥＲＯＨＯＭＥ,福岡県福岡市南区老司１丁目３１番３０－２号,2025-03-21,株式会社
株式会社ＲＡホールディングス,東京都千代田区富士見２丁目１０番２号飯田橋グラン・ブルーム４階,2025-03-21,株式会社
株式会社ＲｅＬＩＦＥ建設,大阪府松原市小川４丁目８番４号Ｂ,2025-03-21,株式会社
株式会社Ｒｅｆｒａ,東京都中央区日本橋茅場町２丁目８－１ＢＲＩＣＫＧＡＴＥ茅場町株式会社Ｒｅｆｒａ,2025-03-21,株式会社
株式会社Ｒｉｚｅ,茨城県土浦市富士崎２丁目５番６－３号,2025-03-21,株式会社
株式会社ＳＥＩＥＩ,福岡県福岡市東区千早１丁目１２番１２号,2025-03-21,株式会社
株式会社ＳＨＥＥＰ　ＰＲＯＪＥＣＴ,大阪府大阪市北区梅田１丁目１－３大阪駅前第３ビル２９階１－１－１号室,2025-03-21,株式会社
株式会社ＳＨＩＮ‐ＹＯＵ,東京都大田区大森北１丁目３８－１－２Ｆ,2025-03-21,株式会社
株式会社ＳＬＯＷＨＯＭＥ,大阪府八尾市若林町３丁目２平尾マンション１０５号室,2025-03-21,株式会社
株式会社Ｓｕｇａｒｔｙ,東京都世田谷区北烏山１丁目１番５号,2025-03-21,株式会社
株式会社Ｓｕｏｉｉ,大阪府大阪市城東区関目５丁目１９番９号関目花博公館６１１Ａ,2025-03-21,株式会社
株式会社Ｓｕｐｅｒｆａｓｔ,愛知県名古屋市中区錦１丁目２番２５号グランドメゾン伏見９０２号,2025-03-21,株式会社
株式会社ＳｕｓｈｉＬｉｎＸ,東京都渋谷区恵比寿４丁目２２番２１号ヒルサイド恵比寿２０１,2025-03-21,株式会社
株式会社Ｓｗｉｆｔ　Ａｄｖａｎｃｅ,沖縄県豊見城市宜保１丁目６番地６（１－Ｃ）,2025-03-21,株式会社
株式会社Ｔ２警備保障,京都府京都市山科区川田御輿塚町２４番地１７,2025-03-21,株式会社
株式会社ＴＡＴＥ,愛知県名古屋市東区筒井３丁目２５番１９号,2025-03-21,株式会社
株式会社ＴＬメディカル,東京都千代田区四番町２番地６四番町二ノ六２０２号,2025-03-21,株式会社
株式会社ＴＭＭＫ,東京都目黒区八雲３丁目２３－１７,2025-03-21,株式会社
株式会社ＴＯｙｏｕ,北海道函館市湯川町２丁目４３－４,2025-03-21,株式会社
株式会社ＴＲＹ　ＷＯＲＫＳ,愛知県豊田市逢妻町３丁目６番地６,2025-03-21,株式会社
株式会社ＴＲＹＲ,北海道札幌市北区新川西四条３丁目１番１６号アトランティス新川２０７号,2025-03-21,株式会社
株式会社ＴＳＵＭＵＧＵ,東京都目黒区碑文谷５丁目２番５号,2025-03-21,株式会社
株式会社Ｕ’ｓ,奈良県生駒市小明町７８１番地１３,2025-03-21,株式会社
株式会社ＵＮＩＴＹ,埼玉県蕨市塚越７丁目６番２号,2025-03-21,株式会社
株式会社ＵＰＲＩＶＥＲ,東京都中央区銀座１丁目２２番１１号銀座大竹ビジデンス２階,2025-03-21,株式会社
株式会社ＷＡＴＥＲ　ＢＯＹ,沖縄県うるま市石川伊波１５５３番地２５０沖縄安全体験ダイビングセンターＮｏ．４,2025-03-21,株式会社
株式会社Ｗｅｌｉｎａ．,大阪府大阪市中央区北浜東４－３３北浜ネクスビルディングＢ１,2025-03-21,株式会社
株式会社ＹＯＵＲ,神奈川県横浜市戸塚区戸塚町１０８－４ワイエスビル１Ｆ,2025-03-21,株式会社
株式会社Ｙｏｕ．Ｌｉｆｅ,茨城県つくば市研究学園５丁目５番地１０,2025-03-21,株式会社
株式会社ｂｋ,埼玉県川越市通町１５番地２（アンビシャス川越９０３号室）,2025-03-21,株式会社
株式会社ｃｏｐａｉｎ,北海道札幌市白石区菊水一条１丁目３番３４号,2025-03-21,株式会社
株式会社ｅ‐Ｍａｉｓｏｎ,京都府京都市中京区西ノ京下合町１１番地島津プラザ３階,2025-03-21,株式会社
株式会社ｅｎｇｉｎｅｐｏｔなにわ,大阪府大阪市淀川区田川北１丁目９－１７－２階,2025-03-21,株式会社
株式会社ｇｒｏｗｔｈ　ｐｌｕｓ,埼玉県所沢市大字上安松１１３１番地の１プレジャー８Ｂ－２０１,2025-03-21,株式会社
株式会社ｋｉｉｔｏｓ,茨城県神栖市知手中央５丁目６－２０アーバニズム６５Ｅ１０５,2025-03-21,株式会社
株式会社ｍａｇｉｎｅａ,東京都港区南青山３丁目１番３６号青山丸竹ビル６Ｆ,2025-03-21,株式会社
株式会社ｎａｍ,東京都世田谷区代田１丁目３２番１７号,2025-03-21,株式会社
株式会社ｎｅｄｏｋｏ,東京都渋谷区恵比寿西２丁目４－８,2025-03-21,株式会社
株式会社ｐｏｐｏｌｏ　ａｎｄ,福岡県福岡市南区清水３丁目１－９,2025-03-21,株式会社
株式会社ｓｃｒｕｍ　ｅｎｇｉｎｅ,大阪府大阪市淀川区田川北１丁目９－１７－２階,2025-03-21,株式会社
株式会社ｔｈｒｅｅ　ｄｏｔｓ．,福岡県福岡市中央区天神４丁目６－２８天神ファーストビル７階,2025-03-21,株式会社
株式会社ｔｏＹｏｕ,神奈川県川崎市中原区宮内３丁目２番１６号,2025-03-21,株式会社
株式会社ｖｉｂｅｓ,愛媛県松山市二番町１丁目９番地２１魚政ビル５Ｆ,2025-03-21,株式会社
株式会社ｗａｖｅ,東京都江戸川区篠崎町６丁目１番２号,2025-03-21,株式会社
株式会社ｙｏｇｕｒｔ＆ｍｉｌｋ,東京都新宿区岩戸町１６－２メイジャー神楽坂９階,2025-03-21,株式会社
梅田建設工業株式会社,福岡県福岡市博多区上呉服町１４番２７号,2025-03-21,株式会社
水星合同会社,岡山県岡山市中区原尾島２丁目１３番３３号,2025-03-21,合同会社
水野商事合同会社,京都府京都市西京区上桂森下町１番地１４７,2025-03-21,合同会社
湯澤経営サポート株式会社,大阪府大阪市北区芝田２丁目８番１１号共栄ビル３階,2025-03-21,株式会社
満天ノ星合同会社,茨城県稲敷郡阿見町大字阿見４２８０番地１,2025-03-21,合同会社
澳華国際株式会社,大阪府大阪市浪速区恵美須東２丁目６番１５－２０２号,2025-03-21,株式会社
煙台東星磁性材料股分有限公司,愛知県名古屋市中村区名駅南２丁目８番１号,2025-03-21,外国会社等
爍楓株式会社,大阪府大阪市生野区巽西３丁目１３番１０号３０１室,2025-03-21,株式会社
特定非営利活動法人あろまぷらす,徳島県板野郡北島町北村字東蛭子７８番地１,2025-03-21,その他の設立登記法人
特定非営利活動法人寺尾学童保育の会,栃木県栃木市都賀町大柿１０１７番地,2025-03-21,その他の設立登記法人
特定非営利活動法人Ｊａｐａｎ　Ａｆｒｉｃａ　Ｓａｋｕｒａ　Ｐｒｏｊｅｃｔ,東京都世田谷区祖師谷４丁目６番３号,2025-03-21,その他の設立登記法人
特定非営利活動法人ＳＨＩＯＲＩＣＨ,福島県郡山市桑野３丁目１４番２７号カレッツァ桑野１０５,2025-03-21,その他の設立登記法人
碩豊株式会社,大阪府大阪市西成区萩之茶屋１丁目１２番７号万葉ビル３１号室,2025-03-21,株式会社
神戸京町株式会社,兵庫県神戸市北区谷上西町２４番５－３０２号,2025-03-21,株式会社
禅千株式会社,東京都八王子市小比企町１３５２番地１,2025-03-21,株式会社
福原社会保険労務士法人,東京都武蔵野市吉祥寺本町２丁目８番４号ｉ－ｏｆｆｉｃｅ吉祥寺,2025-03-21,その他の設立登記法人
竜馬株式会社,東京都中央区新川１丁目７番１号,2025-03-21,株式会社
紅虎合同会社,長野県須坂市大字沼目４６７番地２,2025-03-21,合同会社
美舎建商株式会社,東京都江戸川区南小岩７丁目３６番６号,2025-03-21,株式会社
茨木松下３合同会社,東京都千代田区飯田橋４丁目７番１号結和税理士法人内,2025-03-21,合同会社
賽爾環球科技株式会社,東京都青梅市東青梅１丁目４－６井村高木ビル４０１号室,2025-03-21,株式会社
金橋不動産株式会社,東京都中央区新富１丁目１６番８号日本印刷会館６階,2025-03-21,株式会社
飛天商事株式会社,埼玉県川口市並木３丁目８番２３号,2025-03-21,株式会社
４Ｌｏｔｕｓ　Ｐａｒｔｎｅｒｓ合同会社,東京都港区赤坂１丁目１４番１５号第３５興和ビル別館３Ｆ,2025-03-21,合同会社
Ａ‐ｓｔｙｌｅ合同会社,兵庫県神戸市中央区下山手通２丁目１１番２５－３０５号,2025-03-21,合同会社
Ａやん株式会社,大阪府堺市堺区南半町東１丁１番１０号,2025-03-21,株式会社
Ａスキン株式会社,大阪府堺市堺区南半町東１丁１番１０号,2025-03-21,株式会社
Ａトラベル株式会社,大阪府堺市堺区南半町東１丁１番１０号,2025-03-21,株式会社
Ａモバイル株式会社,大阪府堺市堺区南半町東１丁１番１０号,2025-03-21,株式会社
Ａ株式会社,大阪府堺市堺区南半町東１丁１番１０号,2025-03-21,株式会社
ＡＡ株式会社,東京都板橋区仲宿６３番７号ＯＥＯｆｆｉｃｅＢｌｄｇ．２０２号,2025-03-21,株式会社
ＡＢＩＤ　ＡＵＴＯ　ＴＲＡＤＩＮＧ合同会社,愛知県岩倉市下本町燈明庵１５９番１マンション千代１０２,2025-03-21,合同会社
ＡＤＰＧｒｏｕｐ合同会社,千葉県船橋市西船１丁目２４－１１,2025-03-21,合同会社
ＡＩＢＡ株式会社,東京都港区北青山１丁目３番１号アールキューブ青山３階,2025-03-21,株式会社
ＡＴ合同会社,大阪府大阪市西区本田２丁目１３番７―３０７号,2025-03-21,合同会社
ＡＵＲＵＭ　ＦＡＮＣＹ合同会社,佐賀県唐津市京町１７８３ＫＡＲＡＥ,2025-03-21,合同会社
ＡＹＭセブンコンサルティング合同会社,沖縄県うるま市字天願１３０番地３グランツ天願Ｂ棟３０２,2025-03-21,合同会社
Ａｄｖａｎｃｅｄ　Ｅｎｅｒｇｙ　Ｍｉｎｅｒａｌｓ　Ｊａｐａｎ合同会社,東京都中央区日本橋室町４丁目３番９号,2025-03-21,合同会社
Ａｍｉｒｅａ合同会社,東京都中央区銀座１丁目１２番４号Ｎ＆ＥＢＬＤ．６Ｆ,2025-03-21,合同会社
Ａｎｃｈｏｒ　Ｄｅｓｉｇｎｅｒｓ株式会社,京都府京都市下京区七条通油小路東入大黒町２２７番地第２キョートビル４０２,2025-03-21,株式会社
ＢＬＡ薬事戦略コンサルティング合同会社,神奈川県横浜市都筑区中川中央１丁目３０番１号プレミアヨコハマ３Ｆ,2025-03-21,合同会社
ＢＬＯＳＳＯＭ合同会社,東京都品川区西五反田２丁目２２番６号－１３０１,2025-03-21,合同会社
ＢＰ株式会社,東京都台東区上野３丁目２番２号４０３号室,2025-03-21,株式会社
ＣＲＯＣＯＳ合同会社,大阪府大阪狭山市池尻自由丘２丁目７番７号,2025-03-21,合同会社
ＣＲＯＳＳ　ＷＩＮＥＳ　ＩＮＴＥＲＮＡＴＩＯＮＡＬ株式会社,東京都港区南青山４丁目１８－１１,2025-03-21,株式会社
Ｃａｒｂａｒｎ合同会社,神奈川県横浜市西区浅間町１丁目４番３号ウィザードビル４０２,2025-03-21,合同会社
ＤＥＶＴＲＥ合同会社,東京都港区南青山３丁目１番３６号青山丸竹ビル６Ｆ,2025-03-21,合同会社
ＥＮＩＸＩｎｅｘｕｓ株式会社,茨城県土浦市荒川沖東１丁目３－２１－１,2025-03-21,株式会社
Ｆ．Ｅ．４８２Ｍｉｙａｇａｗａ合同会社,京都府京都市中京区御池通東洞院東入笹屋町４３６永和御池ビル６０６号,2025-03-21,合同会社
ＧＭＧＯＬＦ　ＪＡＰＡＮ合同会社,和歌山県西牟婁郡白浜町３２１２－１０ヴィラ古賀浦３１０号,2025-03-21,合同会社
ＧｉｇａＥａｓｅ　Ｋｕｍｏ国際株式会社,神奈川県横浜市中区弥生町２丁目１５番１号ストークタワー大通り公園Ⅲ２０４－Ａ,2025-03-21,株式会社
Ｇｏｏｄ　Ｈｅａｒｔ　Ｃｏｒｐｏｒａｔｉｏｎ株式会社,東京都八王子市上柚木１６０２番地４,2025-03-21,株式会社
ＨＡＭＺＡ　ＴＲＡＤＩＮＧ株式会社,愛知県弥富市鯏浦町気開１３６番地ユーパティオ３０１,2025-03-21,株式会社
ＨＳＲ株式会社,東京都千代田区飯田橋３丁目１１番２２号,2025-03-21,株式会社
Ｈｕｅ１ｓｔ合同会社,神奈川県茅ヶ崎市赤羽根１３２２番地１,2025-03-21,合同会社
ＪＭＣライフランプラス合同会社,東京都千代田区平河町１丁目７番２２号,2025-03-21,合同会社
ＪＱＥ合同会社,東京都渋谷区円山町１６－８粕谷ビル２０２,2025-03-21,合同会社
Ｊａｐａｎ　Ｏｐｐｏｒｔｕｎｉｔｉｅｓ　Ｉ　Ｊａｐａｎ株式会社,東京都港区西新橋２丁目２０番１号Ｎａｎ－ｏＢｌｄｇ．新虎５階,2025-03-21,株式会社
Ｊａｐａｎ　Ｏｐｐｏｒｔｕｎｉｔｉｅｓ　ＩＩ　Ｊａｐａｎ株式会社,東京都港区西新橋２丁目２０番１号Ｎａｎ－ｏＢｌｄｇ．新虎５階,2025-03-21,株式会社
Ｊｏｕｅｒ株式会社,東京都中央区銀座１丁目２２番１１号銀座大竹ビジデンス２Ｆ,2025-03-21,株式会社
ＫＡＫＩＺＹＵ株式会社,広島県広島市東区温品６丁目１６番９号,2025-03-21,株式会社
ＫＡＮコンサルティング合同会社,神奈川県横浜市青葉区桜台４４番１８号,2025-03-21,合同会社
Ｋａｎｅｉｋｏ　Ｉｎｔｅｒｎａｔｉｏｎａｌ株式会社,大阪府大阪市中央区粉川町７番２－９０３号,2025-03-21,株式会社
ＫｅｙＡｒｋ株式会社,東京都新宿区西新宿３丁目３番１３号西新宿水間ビル２Ｆ,2025-03-21,株式会社
Ｌａｎｋａ　ＲＮＡ合同会社,神奈川県綾瀬市小園１４６７－３２,2025-03-21,合同会社
Ｌｉｆｉｎｉｔｙ．株式会社,東京都中央区銀座７丁目１３番２０号銀座ＴＨビル９階,2025-03-21,株式会社
Ｌｉｎｏ’ａ株式会社,大阪府岸和田市磯上町６丁目９番５号,2025-03-21,株式会社
ＭＡ　ＴＲＡＤＩＮＧ株式会社,京都府京都市右京区山ノ内宮前町２７－９ハイネス山ノ内１０３号室,2025-03-21,株式会社
ＭＨＹ‐ＪＡＰＡＮ株式会社,栃木県足利市今福町２５０番地３,2025-03-21,株式会社
ＭＯＮＯＡＳ株式会社,千葉県鎌ケ谷市中沢新町７番２３号,2025-03-21,株式会社
ＭＳＧ合同会社,東京都千代田区四番町８番地１８プラネスーペリア四番町１００１号,2025-03-21,合同会社
ＮＡＦＡ株式会社,大阪府大阪市北区大淀北１丁目５番２９－２０６号,2025-03-21,株式会社
ＮＩＮＯ合同会社,福岡県福岡市早良区百道浜１丁目５－３－１０３,2025-03-21,合同会社
ＮＩＰＰＯＮＥＸＵＳ株式会社,神奈川県横浜市神奈川区栄町１６番地５プレミスト横浜ポートサイド１２１０号,2025-03-21,株式会社
ＮＯＳＴＡＬＧ合同会社,埼玉県川口市芝中田１丁目２６－２５,2025-03-21,合同会社
ＮＰＯ法人ミモザ,熊本県八代市郡築四番町８０番地２,2025-03-21,その他の設立登記法人
ＮＰＯ法人Ｂｕｉｌｄ　Ｕｐ　Ｉｎｃｌｕｓｉｏｎ　ＦＵＫＵＯＫＡ,福岡県糟屋郡粕屋町長者原東７丁目５－１９,2025-03-21,その他の設立登記法人
ＮＳ合同会社,兵庫県神戸市兵庫区羽坂通３丁目７番３号豊緑兵庫ビル２階２０２号室,2025-03-21,合同会社
Ｎｅｐ‐ｐｉｏｎ合同会社,広島県廿日市市宮園５丁目４－７,2025-03-21,合同会社
Ｎｅｘｔ　ｈｅａｌ合同会社,大阪府堺市堺区向陵中町４丁５番２７号中谷ビル別館２Ｆ,2025-03-21,合同会社
Ｎｕｅ株式会社,東京都渋谷区恵比寿４丁目２０－４恵比寿ガーデンプレイスＢ１ＦＰＯＲＴＡＬＰＯＩＮＴＥＢＩＳＵＨ４,2025-03-21,株式会社
ＯＨＪ株式会社,東京都葛飾区白鳥４丁目９―１３,2025-03-21,株式会社
ＯＭＯＲＯＢＯＴ株式会社,大阪府松原市高見の里６丁目７－１８,2025-03-21,株式会社
ＯＲＩＺＵＲＵ　ＪＡＰＡＮ合同会社,奈良県生駒郡平群町大字椣原５２３番地の２２,2025-03-21,合同会社
Ｏａｓｉｓ　Ｆｕｎｄａｍｅｎｔａｌ　Ｖａｌｕｅ　Ｉ　Ｊａｐａｎ株式会社,東京都港区西新橋２丁目２０番１号Ｎａｎ－ｏＢｌｄｇ．新虎５階,2025-03-21,株式会社
Ｏａｓｉｓ　Ｆｕｎｄａｍｅｎｔａｌ　Ｖａｌｕｅ　ＩＩ　Ｊａｐａｎ株式会社,東京都港区西新橋２丁目２０番１号Ｎａｎ－ｏＢｌｄｇ．新虎５階,2025-03-21,株式会社
ＰＫ　Ｉｎｔｅｒｎａｔｉｏｎａｌ株式会社,神奈川県横浜市鶴見区小野町２７番地３８新菱ハイツ１Ｆ,2025-03-21,株式会社
ＰｒｏＦｉｔ株式会社,東京都渋谷区代々木３丁目２５番３号,2025-03-21,株式会社
Ｐｒｏｇｒｅｓｓ合同会社,埼玉県越谷市西方１丁目３５３１－１越谷シティハウス６－１０３,2025-03-21,合同会社
ＲＳ　ＴＲＡＤＩＮＧ合同会社,愛知県海部郡飛島村大字服岡８丁目８６番地の１,2025-03-21,合同会社
Ｓ技研株式会社,神奈川県海老名市国分南２丁目１１番１７号倉橋コーポ１号室,2025-03-21,株式会社
ＳＡＬ　Ｉｎｎｏｖａｔｉｏｎｓ　Ｊａｐａｎ合同会社,東京都台東区寿３丁目９－３丸大ビル３Ｆ－０３,2025-03-21,合同会社
ＳＥＭ合同会社,神奈川県川崎市川崎区中島３丁目５番２号シュテルハオス１０１,2025-03-21,合同会社
ＳＨＡＢＤＡＶＩＤＳ　ＧＬＯＢＡＬ株式会社,山梨県南都留郡山中湖村平野１２７２番地３１,2025-03-21,株式会社
ＳＮＯＷ　ＫＩＮＧ株式会社,東京都中央区八丁堀２丁目１３番２号ドミノビル６０１,2025-03-21,株式会社
ＳＯＲＡ合同会社,大阪府大阪市天王寺区味原町１１番２１号,2025-03-21,合同会社
ＳＯＵＬ合同会社,愛知県名古屋市緑区太子３丁目１５シーズンコート有松１０７号,2025-03-21,合同会社
ＳＴ　ＧＲＯＵＰ合同会社,福岡県福岡市博多区住吉５丁目２－１３ロケーションズビル１Ｆ,2025-03-21,合同会社
Ｓｈｉｚｕ株式会社,東京都世田谷区等々力８丁目１６番７－４０８号,2025-03-21,株式会社
Ｓｍａｌｌ　Ｊａｐａｎｅｓｅ株式会社,北海道札幌市豊平区豊平八条８丁目１番１３－２０１号,2025-03-21,株式会社
Ｓｕｎｒｉｓｅ株式会社,東京都台東区竜泉１丁目３０－１藤和シティコープ入谷９０２号,2025-03-21,株式会社
Ｔ’ｓ　ｈｏｍｅ株式会社,東京都武蔵野市関前３丁目３０番１１－１１１号,2025-03-21,株式会社
ＴＡＫＡＤＥＮ株式会社,愛知県春日井市味美白山町２丁目９番地１ベルニシキＮ－４１１号,2025-03-21,株式会社
ＴＨＥ　ＺＥＮ　ＳＡＭＵＲＡＩ　ＪＡＰＡＮ合同会社,長崎県対馬市厳原町豆酘２１１３番地１,2025-03-21,合同会社
Ｔｒｅｖｉ　Ｓｙｓｔｅｍｓ　Ｊａｐａｎ合同会社,東京都中央区八丁堀４丁目４番４号梅崎ビル３階,2025-03-21,合同会社
ＵＳＧＦＸ合同会社,東京都渋谷区渋谷２丁目１９‐１５宮益坂ビルディング６０９,2025-03-21,合同会社
Ｕｎｐｌｕｇｇｅｄ株式会社,東京都中央区銀座７丁目１３番６号サガミビル２階,2025-03-21,株式会社
Ｖｉｓｔａ　Ｓｔｕｄｉｏ株式会社,長野県上伊那郡中川村大草３６３２番地１アルプスハイツ中組Ｂ２０１号,2025-03-21,株式会社
ＷＩＴＨＤＯＭ　Ｎａｇａｎｏ株式会社,長野県長野市大字南長野西後町１５９７番地１長野表参道ビル４階,2025-03-21,株式会社
ＷＶ　Ｄｙｎａｍｉｃｓ株式会社,千葉県船橋市西船１丁目２６番５号ベルハイム２０１号,2025-03-21,株式会社
Ｗｅｌｌ‐４Ｂ株式会社,宮城県宮城郡利府町花園２丁目６番地６,2025-03-21,株式会社
ＹＳ合同会社,千葉県千葉市緑区誉田町２丁目２０番地５０９ピオニエール２０４号,2025-03-21,合同会社
ＺＩＰＰＥＲ合同会社,東京都中央区銀座１丁目２２番１１号,2025-03-21,合同会社
ｅｎｕｆｌｏｗ株式会社,東京都港区南青山３丁目１番３６号青山丸竹ビル６Ｆ,2025-03-21,株式会社
ｈａｎｇｚｈｏｕｌｉｎａｎｇｏｕｘｉｎｇｄｉａｎｚｉｓｈａｎｇｗｕｙｏｕｘｉａｎｇｏｎｇｓｉ,,2025-03-21,外国会社等
ｍｏｎａｃｏ合同会社,広島県東広島市八本松町飯田１１７７０－５０,2025-03-21,合同会社
ｓｕｍｍｅｒ　ｔｒｅｅ株式会社,北海道網走市新町３丁目２番１８号,2025-03-21,株式会社
