法人名,住所,設立日,法人種別
株式会社康来工業,山口県宇部市厚南北４丁目５番３－１３号,2016-10-14,株式会社
株式会社心美,埼玉県熊谷市上須戸７３７番地,2016-10-14,株式会社
株式会社新和,大阪府羽曳野市恵我之荘６丁目２３番６号,2016-10-14,株式会社
株式会社新大久保企画,神奈川県横浜市都筑区中川１丁目２５番４１号,2016-10-14,株式会社
株式会社旅宿,大阪府大阪市中央区内久宝寺町３丁目３番６号,2016-10-14,株式会社
株式会社日本貿易,大阪府大阪市平野区長吉長原２丁目１１番４９号,2016-10-14,株式会社
株式会社明清,神奈川県愛甲郡愛川町半原５８６２番地の１０,2016-10-14,株式会社
株式会社木村工業,埼玉県さいたま市西区大字飯田新田１８５番地２０,2016-10-14,株式会社
株式会社未来ハウス,東京都新宿区下落合３丁目１９番１５号,2016-10-14,株式会社
株式会社東京友商事,東京都板橋区成増２丁目１０番３号,2016-10-14,株式会社
株式会社東大和淡水,奈良県大和高田市大字東中１０７－１,2016-10-14,株式会社
株式会社松川温泉開発,大分県別府市大字鶴見４１７番地,2016-10-14,株式会社
株式会社林旅製作所,埼玉県比企郡鳩山町大字小用５９８番地４,2016-10-14,株式会社
株式会社柴田工作所,大分県佐伯市大字鶴望４６９４番地２,2016-10-14,株式会社
株式会社栄翔建設,埼玉県戸田市大字上戸田９９番地,2016-10-14,株式会社
株式会社桜木,愛知県名古屋市南区明治１丁目２４番１１号神戸マンション１Ｆ,2016-10-14,株式会社
株式会社横山商事,埼玉県越谷市東越谷８丁目１９番地９,2016-10-14,株式会社
株式会社横山総合事務所,静岡県菊川市中内田５６１２番地の１,2016-10-14,株式会社
株式会社武杉,北海道旭川市東七条４丁目１番２０号,2016-10-14,株式会社
株式会社汐留カフェ,東京都港区新橋１丁目７番１０号汐留スペリアビル５階,2016-10-14,株式会社
株式会社池田建設,埼玉県所沢市大字下安松９０２番地の２３,2016-10-14,株式会社
株式会社泰陽,福井県福井市大手２丁目４番２４号,2016-10-14,株式会社
株式会社瀬戸塗装,東京都江戸川区一之江６丁目１６番７号,2016-10-14,株式会社
株式会社玉井設備,岐阜県多治見市小名田町７丁目５番地の１,2016-10-14,株式会社
株式会社理想空間,東京都新宿区西新宿３丁目７番１号,2016-10-14,株式会社
株式会社白川工業,埼玉県草加市草加４丁目１番９－１０５号,2016-10-14,株式会社
株式会社石井リアルエステート,福岡県福岡市博多区冷泉町１番３－６１５号,2016-10-14,株式会社
株式会社石本設計,埼玉県越谷市七左町１丁目１７７番地８,2016-10-14,株式会社
株式会社磯野工業,兵庫県神戸市中央区中山手通７丁目３８番５号,2016-10-14,株式会社
株式会社緑演舎,東京都江戸川区北小岩２丁目２１番１２号,2016-10-14,株式会社
株式会社装牀,長崎県西彼杵郡時津町元村郷５６４番地１,2016-10-14,株式会社
株式会社谷口瓦店,石川県小松市小山田町ニ６１番地１,2016-10-14,株式会社
株式会社足利塾,大阪府泉北郡忠岡町忠岡南１丁目４番１６号,2016-10-14,株式会社
株式会社近畿電建,京都府京都市南区吉祥院前田町３番地,2016-10-14,株式会社
株式会社速水制作,東京都国立市東３丁目５番地の１,2016-10-14,株式会社
株式会社都宮工業,大阪府泉南市新家８６２番地,2016-10-14,株式会社
株式会社鈴幸不動産,神奈川県横浜市旭区今宿東町９３６番地９,2016-10-14,株式会社
株式会社難波元町,大阪府大阪市浪速区元町１丁目５番１６号,2016-10-14,株式会社
株式会社魚沼里山農園,新潟県南魚沼市五箇４７５０番地１,2016-10-14,株式会社
株式会社鳴本機工,兵庫県姫路市刀出６４６番地１９,2016-10-14,株式会社
株式会社１０４５,愛知県名古屋市瑞穂区瑞穂通８丁目２４番地２,2016-10-14,株式会社
株式会社１２,東京都港区六本木７丁目１２番３号,2016-10-14,株式会社
株式会社１ＵＰプラス,東京都板橋区大山町３１番１１号グレースラギ３０１,2016-10-14,株式会社
株式会社４ビート・トレード,東京都江東区大島６丁目１４番３－１０３号,2016-10-14,株式会社
株式会社Ａ－ｆｏｒ,大阪府堺市美原区北余部４５番地３２,2016-10-14,株式会社
株式会社ＡＡＳ,埼玉県日高市大字女影１９番地４,2016-10-14,株式会社
株式会社ＡＳＰＥＴＴＯ,愛知県豊田市元城町４丁目１９番地１－３０２,2016-10-14,株式会社
株式会社ＡｇｅＳｈｏｏｔＲ,東京都江戸川区平井６丁目４番１４号,2016-10-14,株式会社
株式会社ＢＩＧ　ＷＥＳＴ,宮崎県宮崎市花ケ島町１３７３番地１,2016-10-14,株式会社
株式会社ＢＩＩＴＯ,東京都台東区蔵前３丁目１９番６号,2016-10-14,株式会社
株式会社ＣＩＥＬトータルヒーリング,愛知県名古屋市中区大須２丁目２７番３４号,2016-10-14,株式会社
株式会社Ｅ　ｃｏｍ　Ｇ,京都府福知山市土師新町２丁目２３番地の１,2016-10-14,株式会社
株式会社ＥＤＩＦＩＲＥ,東京都港区赤坂９丁目６－２３赤坂葵ビル７Ｆ,2016-10-14,株式会社
株式会社ＥＥＣＯ,静岡県浜松市浜北区豊保１７５番地の２２,2016-10-14,株式会社
株式会社ＥＷＥ,東京都千代田区鍛冶町１丁目８番１号,2016-10-14,株式会社
株式会社Ｆｏｒ　ｏｎｅｓｅｌｆ,兵庫県神戸市東灘区向洋町中６丁目９番地,2016-10-14,株式会社
株式会社Ｆｕｎクリエイティブ,岩手県滝沢市鵜飼笹森１２１番地４７,2016-10-14,株式会社
株式会社Ｇ．Ｆ．Ｉ,山梨県甲斐市天狗沢８７番地１３,2016-10-14,株式会社
株式会社ＧＡＲＡＧＥディージー,愛知県豊橋市大岩町字菅池１６番地１,2016-10-14,株式会社
株式会社ＧＢ総合知財経営事務所,愛知県春日井市神屋町２２９８番地５３８,2016-10-14,株式会社
株式会社ＧＫ,東京都杉並区和泉２丁目１０番１８号,2016-10-14,株式会社
株式会社ＨＯＮＥＳＴ　ＢＯＹ,埼玉県所沢市大字山口５２１６番地の２、１０５－１－２０６,2016-10-14,株式会社
株式会社ＨＲＳ,北海道虻田郡洞爺湖町洞爺湖温泉７８番地,2016-10-14,株式会社
株式会社Ｉｎｓｔａｌｌａｔｉｏｎ,東京都北区東十条１丁目４番６号サンポート東十条２０５号室,2016-10-14,株式会社
株式会社ＪＶＣ,広島県広島市南区東雲本町２丁目７番１６号,2016-10-14,株式会社
株式会社Ｋ’ｓ　ｗｏｒｋｓ,北海道札幌市白石区菊水六条２丁目８番１３号,2016-10-14,株式会社
株式会社Ｋプレイス,東京都荒川区東尾久４丁目４８番４号,2016-10-14,株式会社
株式会社Ｋ・ＳＥＣＴ,埼玉県川越市大字砂新田二丁目３番地２,2016-10-14,株式会社
株式会社Ｋ．Ｓエンタープライズ,東京都大田区蒲田４丁目２５番５号プラウドフラット蒲田Ⅱ１００２,2016-10-14,株式会社
株式会社Ｋ１,神奈川県横浜市旭区柏町８７番地の５,2016-10-14,株式会社
株式会社ＫＡＢＵＫＩＲＹＵ,東京都世田谷区大原２丁目２７番１１－４０３号,2016-10-14,株式会社
株式会社ＫＭＳシェルビー,大阪府枚方市春日西町２丁目２４番３号,2016-10-14,株式会社
株式会社ＫＳＴＴ,長野県松本市征矢野１丁目６番３０号,2016-10-14,株式会社
株式会社Ｋｉａ工業,長崎県長崎市矢上町９番３４号２０２,2016-10-14,株式会社
株式会社ＬＤ＆Ｃ,福岡県福岡市城南区七隈６丁目２番１６号,2016-10-14,株式会社
株式会社ＬＩＧＨＴｚ,茨城県つくば市千現２丁目１番地６,2016-10-14,株式会社
株式会社ＬＯＳＥＲ,東京都大田区西六郷１丁目１７番１５号,2016-10-14,株式会社
株式会社Ｌｉｓｈ,埼玉県戸田市上戸田３丁目２６番２１－４０１号常葉ビル,2016-10-14,株式会社
株式会社Ｌｏｔｕｓ,奈良県香芝市逢坂３丁目４３７番地１,2016-10-14,株式会社
株式会社ＭＡＨＡＬＯ,茨城県神栖市田畑６３３番地１０,2016-10-14,株式会社
株式会社ＭＡＳ,東京都武蔵野市御殿山２丁目９番１６－４０４号ルフォン吉祥寺,2016-10-14,株式会社
株式会社ＭＥリゾート但馬,兵庫県養父市丹戸８９６番地２,2016-10-14,株式会社
株式会社ＭＲ．Ｔカーインテリア,東京都足立区中央本町４丁目１４番１２号,2016-10-14,株式会社
株式会社ＭＹＴＨ,奈良県天理市富堂町２３０－４ラフィーネＡ－２０１,2016-10-14,株式会社
株式会社Ｍａｔｈｕｇａｍａ　Ｉｎｔｅｒｎａｔｉｏｎａｌ,茨城県小美玉市羽刈２４８番地２３ティーエムハイツ２０３号室,2016-10-14,株式会社
株式会社Ｎ２ファクトリー,東京都世田谷区北烏山８丁目９番１－３０１号,2016-10-14,株式会社
株式会社ＮＥＷＳＫＹ,東京都中野区中野２丁目１１番６号丸由ビル４０１号,2016-10-14,株式会社
株式会社ＮＥＸＴ　Ｉｎｎｏｖａｔｉｏｎ,埼玉県南埼玉郡宮代町字道佛５６１番地９,2016-10-14,株式会社
株式会社ＮＳＮ水道設備,埼玉県上尾市大字戸崎１２９番地６,2016-10-14,株式会社
株式会社ＯＭＧ,茨城県つくば市研究学園５丁目６番地６,2016-10-14,株式会社
株式会社ＯＰＥＲＡ,東京都品川区北品川５丁目５番１５号大崎ブライトコア４階ＳＨＩＰ,2016-10-14,株式会社
株式会社ＱＶ．,東京都足立区千住旭町３５番１６号,2016-10-14,株式会社
株式会社ＲＤＨ,兵庫県加古郡稲美町国安２４５番地の１,2016-10-14,株式会社
株式会社ＲＥＤＭＡＮ,埼玉県川越市霞ケ関東４丁目１７番地１３,2016-10-14,株式会社
株式会社ＲＵＴ,東京都中央区勝どき６丁目３番２号ＴＨＥＴＯＫＹＯＴＯＷＥＲＳＭＩＤＴＯＷＥＲ２９１４号室,2016-10-14,株式会社
株式会社Ｒｅｓｏ,愛知県名古屋市港区港楽１丁目１番３－２０１号,2016-10-14,株式会社
株式会社ＲｉＯテラス,富山県富山市明輪町１番２４２－１０１７号アパガーデンハイツ富山駅前,2016-10-14,株式会社
株式会社Ｒｏｙａｌ　Ｐｒｉｎｃｅ,岩手県盛岡市肴町１２番１６－９０３号,2016-10-14,株式会社
株式会社Ｓ．Ｍ．Ｃ　Ｐｌａｎｎｉｎｇ　Ｏｆｆｉｃｅ,福岡県糸島市篠原東２丁目９番２２号,2016-10-14,株式会社
株式会社ＳＣＭパートナーズ,東京都港区芝浦１丁目１３番１０号,2016-10-14,株式会社
株式会社ＳＦＮ,石川県白山市千代野南２丁目９番地１０,2016-10-14,株式会社
株式会社ＳＯＲＡ,大分県別府市石垣東９丁目１番３７号,2016-10-14,株式会社
株式会社Ｓｙｕｎｂｉｓｏ,大阪府大阪市中央区淡路町２丁目３－１２ＣＢＭビル２Ｆ,2016-10-14,株式会社
株式会社Ｔ－ドレッジ,大阪府大阪市阿倍野区阿倍野筋１丁目３番１５号阿倍野共同ビル４Ｆ,2016-10-14,株式会社
株式会社Ｔ－１ｓｔ,東京都中央区日本橋蛎殻町２丁目８番１３－５０２号,2016-10-14,株式会社
株式会社Ｔ．Ｉコーポレーション,岡山県倉敷市北畝２丁目１３番２５－１号,2016-10-14,株式会社
株式会社ＴＡＭ,兵庫県尼崎市椎堂１丁目１０番１１号,2016-10-14,株式会社
株式会社ＴＡＳＵＫＩリハビリサービス,福岡県久留米市中央町１９番地７－１５０３号,2016-10-14,株式会社
株式会社ＴＯＫＩ．ＯＳ,埼玉県戸田市笹目５丁目３５番地の５,2016-10-14,株式会社
株式会社ＴＯＷＡ,富山県富山市長江８６０番地１,2016-10-14,株式会社
株式会社ＴＯＹＯ,大阪府大阪市平野区加美北７丁目４番２０号,2016-10-14,株式会社
株式会社ＵＳＫ,大阪府吹田市津雲台５丁目３番１２号,2016-10-14,株式会社
株式会社ＷＨＯＬＥ９,兵庫県加東市南山２丁目２０番地８,2016-10-14,株式会社
株式会社ＷＪＰ,東京都中央区日本橋富沢町２番５号,2016-10-14,株式会社
株式会社Ｗｉｔｈ,東京都新宿区新宿６丁目２９番７号ウィステリアウッズ５０１号,2016-10-14,株式会社
株式会社ＸＷＯＲＫ,東京都港区南青山４丁目１３番１５号,2016-10-14,株式会社
株式会社Ｙ’ｓＰＬＡＮＮＩＮＧ,青森県青森市大字安田字近野５番地３８,2016-10-14,株式会社
株式会社ＺＥＡＬ,茨城県下妻市大木１２５４番地１,2016-10-14,株式会社
株式会社ｃａｓｏ,愛知県尾張旭市霞ケ丘町南５番地,2016-10-14,株式会社
株式会社ｉＱＵＡＬＩＴＹ,北海道室蘭市日の出町２丁目２１番７号,2016-10-14,株式会社
株式会社ｌｅａ,三重県伊勢市大倉町１５５３番地２８２,2016-10-14,株式会社
株式会社ｍｅｄｉｃａｌ　ｔｒｅｅ,東京都港区虎ノ門２丁目７番１６号,2016-10-14,株式会社
株式会社ｏｒｆロジスティクス,岐阜県美濃市大字大矢田字祭リ場西２４９３番地１,2016-10-14,株式会社
株式会社ｐａｒｔｙ　ｏｎ,東京都港区六本木５丁目２番４号,2016-10-14,株式会社
株式会社ｐｏｎｔｏｏｎ,大阪府泉佐野市春日町６番２３号,2016-10-14,株式会社
株式会社ｓｃｅｎｅ,大阪府大阪市西区本田１丁目４番４６－１３０４号,2016-10-14,株式会社
株式会社ｔｏｇｏ,東京都港区六本木５丁目１１番２２号,2016-10-14,株式会社
森の樹林産株式会社,岐阜県中津川市付知町１１３７８番地２,2016-10-14,株式会社
森田工業合同会社,大阪府東大阪市新池島町３丁目４番４号,2016-10-14,合同会社
楠見保険サービス合名会社,広島県福山市西新涯町２丁目９番８－２号,2016-10-14,合名会社
水戸ＷＳ合同会社,茨城県水戸市渡里町２６９４番地の４,2016-10-14,合同会社
池田空調株式会社,埼玉県川口市芝高木１丁目４番１３号,2016-10-14,株式会社
淡路市大谷覗地区有志懇談会,兵庫県淡路市大谷１３５,2016-10-14,その他
熊本県住環境復興協同組合,熊本県上益城郡嘉島町大字上六嘉８８３番地,2016-10-14,その他の設立登記法人
特定非営利活動法人みつばさ学童クラブ,埼玉県狭山市中央４丁目３０番３号,2016-10-14,その他の設立登記法人
特定非営利活動法人クレイシュ,大阪府大阪市北区豊崎３丁目１５－５,2016-10-14,その他の設立登記法人
特定非営利活動法人ココロピオニー,長崎県長崎市橋口町１５番１３号ラ・ルーチュ橋口ビル,2016-10-14,その他の設立登記法人
特定非営利活動法人女性ライフスタイル協会,東京都渋谷区猿楽町７番ｌ号ＫＤＸ代官山レジテンス３１９,2016-10-14,その他の設立登記法人
特定非営利活動法人子どもの育ちを支える会さくらネット小山,栃木県小山市城東２丁目２６番地１０号,2016-10-14,その他の設立登記法人
特定非営利活動法人日本補完医療協会,長崎県長崎市三京町８１５番地２７５,2016-10-14,その他の設立登記法人
特定非営利活動法人次郎長生家を活かすまちづくりの会,静岡県静岡市清水区美濃輪町４番１６号,2016-10-14,その他の設立登記法人
特定非営利活動法人Ａｉ,奈良県大和郡山市小泉町５０５番地１号,2016-10-14,その他の設立登記法人
特定非営利活動法人Ｇｌｉｃｉｎａ足利,栃木県足利市鹿島町４０番１キュウブＯＮＤＡ５．１０３,2016-10-14,その他の設立登記法人
特定非営利活動法人Ｈａｎｄ＆Ｆｏｏｔ,東京都武蔵村山市大南１丁目２２番地の４,2016-10-14,その他の設立登記法人
特定非営利活動法人Ｒａｄｉａｎｔ,愛媛県松山市土居田町３３１番地１３,2016-10-14,その他の設立登記法人
盛和通商株式会社,宮崎県東臼杵郡門川町加草３丁目４１番地１,2016-10-14,株式会社
石虎堂株式会社,埼玉県川口市柳崎５丁目７番１５号,2016-10-14,株式会社
社会保険労務士法人東京国際事務所,東京都千代田区内神田１丁目６番７号,2016-10-14,その他の設立登記法人
社会保険労務士法人ＡＹＵＭＩ,東京都大田区蒲田５丁目２４－２昭和ビル４階,2016-10-14,その他の設立登記法人
税理士法人アイタック,岡山県津山市南新座３３番地,2016-10-14,その他の設立登記法人
税理士法人ヴェンティ,愛知県名古屋市中区丸の内２丁目１８番２２号三博ビル６階６０２号室,2016-10-14,その他の設立登記法人
立志社株式会社,東京都渋谷区恵比寿南１丁目２０番６号第２１荒井ビル４階,2016-10-14,株式会社
総研管理株式会社,東京都昭島市拝島町２丁目６番１６号,2016-10-14,株式会社
葛西住宅管理組合,東京都江戸川区中葛西５丁目２－７－２１４,2016-10-14,その他
西商ライン株式会社,京都府京田辺市田辺中央６丁目３番地１,2016-10-14,株式会社
西泉中国楽器販売合同会社,静岡県牧之原市静波４１１番地７,2016-10-14,合同会社
豊田式典合同会社,埼玉県八潮市中央４丁目１番地１６,2016-10-14,合同会社
農事組合法人中北手ファーム,秋田県秋田市上北手大戸字関上２１８番地１,2016-10-14,その他の設立登記法人
農事組合法人和み,福井県坂井市春江町大針第８号１０番地,2016-10-14,その他の設立登記法人
農事組合法人大木営農組合,福岡県三潴郡大木町大字八町牟田３３０番地,2016-10-14,その他の設立登記法人
農事組合法人小倉,福井県丹生郡越前町小倉第４８号１６番地１,2016-10-14,その他の設立登記法人
農事組合法人小堤営農組合,千葉県山武郡横芝光町小堤７７１番地,2016-10-14,その他の設立登記法人
農事組合法人金廻営農,岐阜県海津市海津町金廻５８番地,2016-10-14,その他の設立登記法人
農業生産法人ひなた株式会社,茨城県鉾田市台濁沢２５２番地１,2016-10-14,株式会社
道豊合同会社,東京都江戸川区西小岩１丁目１２番４号メゾン杉本１０２室,2016-10-14,合同会社
銀門商事株式会社,東京都荒川区東日暮里５丁目５２番１２号ラ・メゾン高野４０３,2016-10-14,株式会社
鋒鳴国際貿易株式会社,千葉県松戸市八ケ崎緑町３２３番地の１フォレスタ緑町１０５,2016-10-14,株式会社
青山工業株式会社,千葉県船橋市丸山２丁目２９番１号,2016-10-14,株式会社
高崎商事株式会社,神奈川県藤沢市本藤沢２丁目１０番２２号,2016-10-14,株式会社
鹿児島水産センター株式会社,鹿児島県南さつま市加世田本町５３番６号,2016-10-14,株式会社
黒澤工業合同会社,埼玉県秩父市大宮５２５９番地４９,2016-10-14,合同会社
龍’ｓＫＯ－ＢＯ株式会社,京都府京都市西京区桂徳大寺北町２２アイシェード桂１０１,2016-10-14,株式会社
５５グルメ合同会社,東京都世田谷区深沢４丁目２３番２１号,2016-10-14,合同会社
ＡＣＥ税理士法人,東京都港区芝５丁目３０番６号,2016-10-14,その他の設立登記法人
Ａｉｍ株式会社,大阪府大阪市北区天満１丁目８番５－１３０２号,2016-10-14,株式会社
ＢＡＤ　ＬＵＣＫ　ＧＯＯＤ合同会社,東京都渋谷区千駄ヶ谷３丁目９番１号,2016-10-14,合同会社
ＢｅａｃｈＢｏｙｓ合同会社,東京都港区芝浦４丁目１６番１４－２９０７号,2016-10-14,合同会社
Ｂｕｒｇｅｒ　Ｋｉｎｇ　Ｊａｐａｎ　Ａｄ　Ｆｕｎｄ株式会社,東京都渋谷区笹塚２丁目１９番２号ＴＳＫ笹塚ビル２階,2016-10-14,株式会社
ＣＯＪＩ＆ＣＯ．合同会社,神奈川県横浜市西区平沼１丁目４０番１７－１１８号,2016-10-14,合同会社
ＣＯＮ．ＣＯＡＴ株式会社,長崎県長崎市竿浦町１２９番地２,2016-10-14,株式会社
ＥＰ地所株式会社,東京都武蔵野市中町１丁目１５番５号８階,2016-10-14,株式会社
ＦＭＧ株式会社,和歌山県有田郡広川町大字広５９０番地１,2016-10-14,株式会社
Ｈ．Ｂ．Ｓ株式会社,東京都足立区千住元町４番９号,2016-10-14,株式会社
ＩＴＥＺＡ　ＮＩＰＰＯＮ株式会社,神奈川県横浜市旭区南希望が丘１２５番地１５－１０３号,2016-10-14,株式会社
Ｊ＆Ｌ株式会社,東京都台東区竜泉２丁目１９番１４号,2016-10-14,株式会社
ＪＰＡ第４５号株式会社,東京都千代田区霞が関３丁目２番１号,2016-10-14,株式会社
ＪＰＡ第４６号株式会社,東京都千代田区霞が関３丁目２番１号,2016-10-14,株式会社
ＪＰＡ第４７号株式会社,東京都千代田区霞が関３丁目２番１号,2016-10-14,株式会社
ＪＰＡ第４８号株式会社,東京都千代田区霞が関３丁目２番１号,2016-10-14,株式会社
Ｋ’Ｓテック株式会社,愛知県西尾市吉良町荻原外川田４５番地,2016-10-14,株式会社
ＫＤＫＲ株式会社,福岡県福岡市西区今宿２丁目１２番３号スリーアイランド今宿８０２,2016-10-14,株式会社
ＫＯＵＳＡＮ　ＳＨＩＰＹＡＲＤ協同組合,広島県尾道市因島中庄町３３１６番地１,2016-10-14,その他の設立登記法人
ＬＦ一般社団法人,東京都新宿区四谷２丁目９番地１５あると綜合事務所内,2016-10-14,その他の設立登記法人
ＭＫ　ＩＮＴＥＲＮＡＴＩＯＮＡＬ株式会社,茨城県筑西市直井７８１番地１,2016-10-14,株式会社
ＮＡＳＩＲ合同会社,群馬県邑楽郡大泉町坂田７丁目１５番２５号,2016-10-14,合同会社
ＮＰＯ法人アーチリンク,福岡県糸島市二丈福井１１３７番地４,2016-10-14,その他の設立登記法人
ＮＰＯ法人ユニスポ熊本,熊本県熊本市南区薄場２丁目６番１号,2016-10-14,その他の設立登記法人
ＮＰＯ法人福島青年管弦楽団,福島県福島市立子山字五十保内２１番地,2016-10-14,その他の設立登記法人
Ｎｉｓｅｋｏ　Ｓｋｉ　Ｃｏｎｃｉｅｒｇｅ合同会社,北海道虻田郡倶知安町北四条東９丁目６番地３,2016-10-14,合同会社
ＯＳＴＲＩＧＥＮ　ＢＡＩＯＭＥ株式会社,東京都港区西新橋２丁目４番３号プロス西新橋ビル,2016-10-14,株式会社
ＰＢ　Ｔｒａｄｉｎｇ合同会社,東京都豊島区西池袋５丁目２６番１０号,2016-10-14,合同会社
ＲｉｎｇＣｅｎｔｒａｌ　Ｊａｐａｎ株式会社,東京都千代田区平河町２丁目６番１号平河町ビル７階,2016-10-14,株式会社
ＳＳＢＸ株式会社,愛知県名古屋市中区丸の内３丁目５番４号８０３室,2016-10-14,株式会社
Ｓｕｎ　Ｓｔａｔｉｏｎ　Ｈｉｋａｒｉ　ＸＩ合同会社,東京都港区虎ノ門１丁目２番２０号第３虎の門電気ビルディング４階,2016-10-14,合同会社
Ｓｕｎ　Ｓｔａｔｉｏｎ　Ｈｉｋａｒｉ　ＸＩＩＩ合同会社,東京都港区虎ノ門１丁目２番２０号第３虎の門電気ビルディング４階,2016-10-14,合同会社
Ｓｕｎ　Ｓｔａｔｉｏｎ　Ｈｉｋａｒｉ　ＸＩＶ合同会社,東京都港区虎ノ門１丁目２番２０号第３虎の門電気ビルディング４階,2016-10-14,合同会社
ＴＥＮＳＥＩ株式会社,東京都港区赤坂３丁目４番３号,2016-10-14,株式会社
ＴＥＲＡＧＯＹＡ株式会社,東京都墨田区江東橋２丁目３番１１号,2016-10-14,株式会社
ＴＯＭＡ弁護士法人,東京都千代田区丸の内１丁目８番３号,2016-10-14,その他の設立登記法人
Ｕ－ｍｉｎｏｖａｔｉｏｎ株式会社,東京都渋谷区初台１丁目３１番１２号コーポ・バン２０４,2016-10-14,株式会社
ＷＥＴＺＬＡＲ株式会社,東京都港区六本木７丁目７番地７号,2016-10-14,株式会社
ＹＷ株式会社,埼玉県川口市芝新町７番９号,2016-10-14,株式会社
ＹＹ　ＬＡＢＯ合同会社,東京都新宿区新宿７丁目２６－７ビクセル新宿１Ｆ,2016-10-14,合同会社
ｅ－ＳＰＯＲＴＳＣＡＦＥ株式会社,東京都新宿区百人町２丁目１０番１号,2016-10-14,株式会社
さいたま市島町西部土地区画整理組合,埼玉県さいたま市見沼区島町４６０番地１,2016-10-17,その他
まいばらナカどおりまちづくり株式会社,滋賀県米原市米原６６１番地,2016-10-17,株式会社
