法人名,住所,設立日,法人種別
あずもりコンサルティンググループ合同会社,神奈川県横浜市神奈川区金港町２－１－２５０９,2021-01-04,合同会社
うゆう合同会社,沖縄県石垣市字大浜１６５番地１２Ｆ,2021-01-04,合同会社
おおさか鑑定株式会社,大阪府吹田市豊津町１番３１号,2021-01-04,株式会社
かしの木の丘団地管理組合法人,大阪府吹田市春日３丁目１８番２３号,2021-01-04,その他の設立登記法人
さいとう合同会社,兵庫県神戸市中央区磯上通２丁目２番２５号,2021-01-04,合同会社
たじま庭工房株式会社,埼玉県行田市大字中里２０番地１,2021-01-04,株式会社
たすけあい労働組合,埼玉県川口市大字安行藤八３３－１３,2021-01-04,その他の設立登記法人
つばさ企画株式会社,兵庫県神戸市西区糀台４丁目１３番地の５,2021-01-04,株式会社
ひろしま森林施業プランナー会,広島県広島市中区鉄砲町４－１広島県森林組合連合会内,2021-01-04,その他
アドバンスト・ポストプロセシング株式会社,兵庫県芦屋市山手町２番６グランドメゾン芦屋山手町５０２号,2021-01-04,株式会社
アペロ・ファーム合同会社,愛知県豊田市下市場町６丁目５７番地,2021-01-04,合同会社
アリノ株式会社,千葉県千葉市緑区あすみが丘東５丁目１９番地１６,2021-01-04,株式会社
アンソレイユ株式会社,東京都渋谷区千駄ヶ谷３丁目１５番３号マフィス北参道,2021-01-04,株式会社
アンバーファミリア株式会社,秋田県秋田市御所野元町２丁目１０番６号,2021-01-04,株式会社
アークアンカー株式会社,東京都文京区白山１丁目１４番１３号ラヴィスタ白山１０１,2021-01-04,株式会社
アールシー株式会社,千葉県市川市大和田３丁目１番１４号,2021-01-04,株式会社
イグナイトマシーン株式会社,岐阜県瑞穂市野白新田９８番地,2021-01-04,株式会社
イグニタリアム・ジャパン株式会社,神奈川県横浜市磯子区岡村７丁目２５番２２号,2021-01-04,株式会社
インフィニティコンシャスネス株式会社,大阪府池田市畑２丁目３番７－Ａ号,2021-01-04,株式会社
エクスジョインツ株式会社,東京都町田市小川５丁目１５番２８号－８号,2021-01-04,株式会社
エスペラール合同会社,大阪府大阪市北区梅田２丁目５番１３号桜橋第一ビル３０４,2021-01-04,合同会社
エムラインロジシステム株式会社,埼玉県川口市大字東本郷１３８２番地の８,2021-01-04,株式会社
オリエンタル株式会社,東京都中央区銀座８丁目８番１７号,2021-01-04,株式会社
オリエント・アロー株式会社,埼玉県春日部市牛島８３１番地２,2021-01-04,株式会社
オートサービス姫地株式会社,愛媛県大洲市菅田町菅田甲２７３８番地１,2021-01-04,株式会社
カイト・グローバル・リース株式会社,広島県広島市西区大宮１丁目１番地１５号,2021-01-04,株式会社
カラナ合同会社,東京都台東区浅草５丁目３４番２号,2021-01-04,合同会社
グッドボタン株式会社,東京都渋谷区神宮前６丁目２３番４号,2021-01-04,株式会社
グルミー株式会社,東京都文京区音羽１丁目１０番４号,2021-01-04,株式会社
ケ・スエルテ株式会社,岐阜県岐阜市羽根町１５番地,2021-01-04,株式会社
コネクトフロンティア合同会社,埼玉県朝霞市膝折町４丁目１９番１９号,2021-01-04,合同会社
コンセクエンスデザイン株式会社,東京都渋谷区渋谷１丁目１－３アーミーホール３Ｆ,2021-01-04,株式会社
サメ貿易合同会社,愛知県豊明市新栄町７丁目２１番地１,2021-01-04,合同会社
サンゴショウ合同会社,東京都港区六本木５丁目９番１７号藤森ビル１階,2021-01-04,合同会社
シティワークス株式会社,大阪府大阪市東淀川区東中島２丁目８番８号,2021-01-04,株式会社
シルフ株式会社,長野県上水内郡飯綱町大字袖之山３１０番地,2021-01-04,株式会社
スリーライン協同組合,栃木県小山市大字高椅４００番地１,2021-01-04,その他の設立登記法人
ゼニスハウス株式会社,東京都港区赤坂９丁目６番２９号,2021-01-04,株式会社
ツバサ株式会社,埼玉県さいたま市大宮区櫛引町１丁目５２７－１,2021-01-04,株式会社
トラベルドクター株式会社,東京都大田区大森中２丁目１５番７号,2021-01-04,株式会社
トリン合同会社,静岡県静岡市駿河区高松３２０５－１,2021-01-04,合同会社
ドッジ・ロール外伝合同会社,東京都新宿区西新宿７丁目２－６Ｋ－１ビル３階,2021-01-04,合同会社
ナーヴリソース合同会社,東京都千代田区霞が関３丁目２番６号東京倶楽部ビルディング１１階,2021-01-04,合同会社
ネクステラコンサルティング株式会社,東京都練馬区桜台２丁目４０番１－１０１号,2021-01-04,株式会社
ネクストジャパン合同会社,千葉県千葉市中央区仁戸名町５０４番地２,2021-01-04,合同会社
ビスタ・マシニング・テクノロジーズ株式会社,東京都港区虎ノ門４丁目１番２８号虎ノ門タワーズオフィス１７階,2021-01-04,株式会社
ビッグロックジャパン株式会社,石川県金沢市野田１丁目９２番地,2021-01-04,株式会社
ビットリア・リザイア株式会社,東京都港区芝４丁目１８番３号ＪＴＭ２６－５１,2021-01-04,株式会社
フォーニア合同会社,大阪府高槻市大塚町３丁目５－７,2021-01-04,合同会社
ブルーコンシャス・アーク株式会社,東京都港区芝浦３丁目１１番７号４階,2021-01-04,株式会社
ペガサス合同会社,東京都荒川区南千住７丁目１７番５－２０３号コルサム千住大橋,2021-01-04,合同会社
マトリクスデザイン株式会社,東京都千代田区神田駿河台３丁目３番地五明館ビル４０１号室,2021-01-04,株式会社
モント・リッチ株式会社,大阪府大阪市淀川区西中島５丁目７番１８号アストロ新大阪ビル５０１号,2021-01-04,株式会社
リード環境防災株式会社,三重県伊賀市服部町１０８７番１,2021-01-04,株式会社
ワイエム株式会社,広島県広島市東区二葉の里１丁目７番１３号,2021-01-04,株式会社
一般社団法人いわて地域創景,岩手県盛岡市下ノ橋町２番１１－２０３号,2021-01-04,その他の設立登記法人
一般社団法人ドローン赤外線調査普及協会,兵庫県佐用郡佐用町豊福２７８番地,2021-01-04,その他の設立登記法人
一般社団法人パピルスＩＩ,東京都千代田区丸の内３丁目１番１号東京共同会計事務所内,2021-01-04,その他の設立登記法人
一般社団法人和歌山県健康長寿推進協議会,和歌山県和歌山市今福１丁目１０－１２,2021-01-04,その他の設立登記法人
一般社団法人和観社中,東京都港区南青山２丁目２番１５号ウィン青山９４２,2021-01-04,その他の設立登記法人
一般社団法人国際メゾンディレクトゥール協会,大阪府大阪市西区南堀江１丁目２６－２７－１３０７,2021-01-04,その他の設立登記法人
一般社団法人日布文化交流事業つなぐ,宮城県仙台市泉区泉中央２丁目１０－３－７０６,2021-01-04,その他の設立登記法人
一般社団法人日本コンテナハウス建築協会,東京都千代田区麹町４丁目７番地５麹町ロイヤルビル３０５,2021-01-04,その他の設立登記法人
一般社団法人日本文化国際交流協会,東京都大田区大森中２丁目８番２号２階,2021-01-04,その他の設立登記法人
一般社団法人日本高齢者高次脳医学研究所,宮城県仙台市青葉区荒巻字青葉６－６－０４,2021-01-04,その他の設立登記法人
一般社団法人終活ケアサポート,東京都中野区東中野３丁目１７番１５号,2021-01-04,その他の設立登記法人
一般社団法人自然災害復興エイド基金,熊本県熊本市北区津浦町４３番１０号,2021-01-04,その他の設立登記法人
一般社団法人ＡＣＣＥＬ,兵庫県神戸市垂水区舞子台２丁目２番１－６０４号,2021-01-04,その他の設立登記法人
一般社団法人Ｄ・Ａ・Ｒ,大阪府門真市柳田町３２番５号,2021-01-04,その他の設立登記法人
一般社団法人Ｌｉｆｅ　ｉｎ　ｔｈｅ　Ｗｏｏｄｓ,愛知県瀬戸市八幡台６丁目２１４番地,2021-01-04,その他の設立登記法人
一般社団法人Ｒｅｂｏｏｔ,東京都江東区青海２丁目７番４号ｔｈｅＳＯＨＯ－７１０,2021-01-04,その他の設立登記法人
一般社団法人ＳＨ０４０,東京都港区虎ノ門３丁目２２番１０－２０１号,2021-01-04,その他の設立登記法人
一般社団法人ＳＨ０４１,東京都港区虎ノ門３丁目２２番１０－２０１号,2021-01-04,その他の設立登記法人
一般社団法人ｙ‐ビジョン,愛知県名古屋市西区数寄屋町７番１３号－５０３,2021-01-04,その他の設立登記法人
一般財団法人アカデミア育英財団,鹿児島県鹿児島市武１丁目４番８号,2021-01-04,その他の設立登記法人
三尾沖縄合同会社,沖縄県浦添市牧港２丁目３４番１９号,2021-01-04,合同会社
中川重機株式会社,神奈川県相模原市南区麻溝台６丁目２番１０号,2021-01-04,株式会社
久川生物研究所株式会社,東京都中央区日本橋蛎殻町１丁目３番５号共同ビル２階２３号,2021-01-04,株式会社
仁義興業株式会社,大阪府大阪市平野区喜連２丁目７番２号４０５,2021-01-04,株式会社
仙石山ソリューションズ株式会社,東京都港区赤坂１丁目１２番３２号アーク森ビル１２階,2021-01-04,株式会社
伊藤土建株式会社,千葉県旭市ニの１４６９番地,2021-01-04,株式会社
伊達舞合同会社,宮城県亘理郡亘理町字新井町７３番地８,2021-01-04,合同会社
医療法人ブライト,兵庫県西宮市甲子園高潮町３番３号Ｃｏｒｏｗａ甲子園地下１階Ｂ１０５区,2021-01-04,その他の設立登記法人
医療法人梟衆会,青森県西津軽郡鰺ヶ沢町大字七ツ石町２７番地１,2021-01-04,その他の設立登記法人
医療法人社団優利会,埼玉県東松山市箭弓町３丁目５番１４号Ｋ１ビル１０１号室,2021-01-04,その他の設立登記法人
医療法人輝力会,神奈川県平塚市田村２丁目１１番１８号１階,2021-01-04,その他の設立登記法人
博美株式会社,東京都中央区日本橋小網町１番５－１００１号,2021-01-04,株式会社
合同会社あしたば,兵庫県神戸市中央区神若通２丁目１－１５神若北田ハイツ２０１号,2021-01-04,合同会社
合同会社いずみ,大分県速見郡日出町大字大神８００４番地１４,2021-01-04,合同会社
合同会社しん,兵庫県神戸市兵庫区下沢通３丁目３番３号,2021-01-04,合同会社
合同会社でら,愛知県一宮市小信中島字仁井西８番地４,2021-01-04,合同会社
合同会社とし,東京都品川区上大崎２丁目１５番１９号,2021-01-04,合同会社
合同会社まのめ社,京都府京都市上京区宮垣町９１まむあん荒神口１０２,2021-01-04,合同会社
合同会社みちびき,宮崎県宮崎市恒久南３丁目１２番地７,2021-01-04,合同会社
合同会社ウィンディーニ,東京都町田市原町田６丁目２４番地１５号,2021-01-04,合同会社
合同会社ウエトミ,東京都練馬区関町南１丁目１２－３－３０４,2021-01-04,合同会社
合同会社カルテット,兵庫県尼崎市若王子三丁目１５番２６－Ｃ１０２号,2021-01-04,合同会社
合同会社グランソレイユ,岡山県倉敷市児島稗田町１５２１番地６,2021-01-04,合同会社
合同会社サカエ,神奈川県横浜市栄区桂町６８８－４ペルソナージュ横浜３０１,2021-01-04,合同会社
合同会社サンエネルギー,熊本県熊本市北区清水万石３丁目３－９－２,2021-01-04,合同会社
合同会社サンライズ,熊本県熊本市中央区渡鹿１丁目１８－１８シティライフ大江東１００３,2021-01-04,合同会社
合同会社サークルエム,兵庫県加古郡稲美町国岡５５２番地の３,2021-01-04,合同会社
合同会社シャットグリーズ,埼玉県日高市大字鹿山６４１番地２７,2021-01-04,合同会社
合同会社デイボーン,東京都福生市大字熊川１６２０番地３５,2021-01-04,合同会社
合同会社ニマ自動車,鹿児島県霧島市国分中央１丁目１４番５０号キャニオン１０５国分５０６号,2021-01-04,合同会社
合同会社ネクストステージ,神奈川県横浜市保土ケ谷区釜台町１番１号,2021-01-04,合同会社
合同会社ハランｏｆｆｉｃｅ,埼玉県所沢市若狭３丁目２３６２番地の６,2021-01-04,合同会社
合同会社バベル,大阪府東大阪市吉松２丁目１２－１４－４０２,2021-01-04,合同会社
合同会社バーボン,東京都港区赤坂２丁目８番１４号ラミアール赤坂３０４号,2021-01-04,合同会社
合同会社パーラーでっていう,愛知県豊川市宿町金山１３２番地,2021-01-04,合同会社
合同会社ビタースイート,沖縄県沖縄市泡瀬１丁目２１番３号,2021-01-04,合同会社
合同会社ビットモア,兵庫県西宮市岡田山６－５,2021-01-04,合同会社
合同会社フォーエヌエー,埼玉県川口市東川口１丁目５番１０－１２０１号アドリーム東川口,2021-01-04,合同会社
合同会社フロンティア,東京都江戸川区北葛西２丁目２３番１５－２０５号,2021-01-04,合同会社
合同会社プカー・リック,神奈川県横浜市中区仲尾台５６番地２３,2021-01-04,合同会社
合同会社プラウディア,茨城県土浦市並木２丁目７番４号マイステージ１０番館２０７号室,2021-01-04,合同会社
合同会社マドリ,神奈川県横浜市磯子区滝頭３丁目５番２５号,2021-01-04,合同会社
合同会社ユーラシアＮＧＪ,兵庫県西宮市菊谷町７番２９号,2021-01-04,合同会社
合同会社ライフテラス,愛知県名古屋市中区栄２丁目１番１２号,2021-01-04,合同会社
合同会社ラピッドグロース,神奈川県川崎市川崎区駅前本町１１番２川崎フロンティアビル４階,2021-01-04,合同会社
合同会社ラミシャネ,熊本県熊本市南区城南町下宮地５００番地,2021-01-04,合同会社
合同会社ランドスケープ８１,東京都板橋区西台３丁目２７番３号,2021-01-04,合同会社
合同会社リセット・プラン,埼玉県さいたま市南区太田窪２丁目９番２３号,2021-01-04,合同会社
合同会社リルビルケア,東京都江戸川区北小岩６丁目４２番４号美喜荘１号,2021-01-04,合同会社
合同会社ロコミイ,滋賀県東近江市小田苅町３９２－２,2021-01-04,合同会社
合同会社三松,兵庫県姫路市香寺町行重１４９番地,2021-01-04,合同会社
合同会社二馬力,兵庫県神戸市中央区北長狭通８丁目８－９、４Ｆ,2021-01-04,合同会社
合同会社人となり研究所,福島県福島市小倉寺字稲荷山１０番地の４０,2021-01-04,合同会社
合同会社創ラボ,東京都新宿区新宿１丁目３６番２号新宿第７葉山ビル３階,2021-01-04,合同会社
合同会社吉楽,千葉県千葉市花見川区天戸町１４６２番地３,2021-01-04,合同会社
合同会社国際挑戦学園協學館,新潟県新潟市西区松海が丘１丁目３番２９号,2021-01-04,合同会社
合同会社安武塗装,神奈川県川崎市高津区蟹ケ谷３－３５ヴィーア日吉１０２号室,2021-01-04,合同会社
合同会社山笠,東京都中央区日本橋１丁目４番１号,2021-01-04,合同会社
合同会社常楽,愛知県常滑市白山町３丁目１０１番地,2021-01-04,合同会社
合同会社教村,大阪府箕面市坊島３丁目６番４号,2021-01-04,合同会社
合同会社月華,京都府与謝郡与謝野町字石川５７６４番地１,2021-01-04,合同会社
合同会社未来商店,大阪府大阪市平野区長吉川辺３丁目１６番４３号,2021-01-04,合同会社
合同会社牛嶋商会,福岡県久留米市花畑２丁目９－６メゾンドールＡ棟２０１,2021-01-04,合同会社
合同会社破天コーポレーション,宮城県仙台市青葉区二日町１７－１９ラサキビル二日町３Ｆ,2021-01-04,合同会社
合同会社税務カフェ,沖縄県那覇市首里大名町１丁目１５３番地１号,2021-01-04,合同会社
合同会社笑足屋,埼玉県富士見市関沢３丁目４０番２４号,2021-01-04,合同会社
合同会社紬,岐阜県岐阜市祈年町１１丁目１９番地１,2021-01-04,合同会社
合同会社縁咲,東京都町田市南成瀬４丁目１３番地２１,2021-01-04,合同会社
合同会社Ａｆｒｏｉｓｍ,兵庫県神戸市須磨区千守町１丁目５－４１,2021-01-04,合同会社
合同会社ＣＳ企画,沖縄県豊見城市字高嶺６１０番地３６南分譲Ｋ－５,2021-01-04,合同会社
合同会社Ｃａｒｎｅｌｉａｎ,大阪府吹田市江坂町１丁目１４番２０号グランドステージ江坂５０１号室,2021-01-04,合同会社
合同会社Ｃｌｅａｎ,京都府京都市下京区鶏鉾町４９３番地,2021-01-04,合同会社
合同会社Ｃｏ,東京都世田谷区池尻２丁目３－１３－２１１,2021-01-04,合同会社
合同会社Ｄｏエネルギー,熊本県熊本市東区健軍４丁目３番１４－１１０１号,2021-01-04,合同会社
合同会社ＥＬＰＩＳ,東京都大田区東蒲田２丁目９番６－２０２号,2021-01-04,合同会社
合同会社Ｆコンサルティング,東京都町田市図師町２２２６番地２２,2021-01-04,合同会社
合同会社Ｆａｍｉｌｙ　Ｈｅａｌｔｈ,東京都葛飾区東水元５丁目４２－１０,2021-01-04,合同会社
合同会社ＦｏｒＭｕｓｅ,千葉県浦安市東野３丁目３６－９,2021-01-04,合同会社
合同会社ＧＲＹＤＥＲ　ＷＯＲＫＳ,福岡県福岡市東区千早５丁目３１番１０－６０４号アーバンパレス千早ネオステージ,2021-01-04,合同会社
合同会社ＨＡＲＵＹＯ,福岡県福岡市中央区桜坂３丁目５番５４－１３０１号,2021-01-04,合同会社
合同会社ＨＩＲＯ’Ｓ,兵庫県神戸市北区藤原台中町３丁目１５番１号,2021-01-04,合同会社
合同会社ＫＡＤ,大阪府大阪市住吉区山之内１丁目１４番１２号,2021-01-04,合同会社
合同会社ＫＲＫ,宮崎県宮崎市大字小松１２１６番地１９,2021-01-04,合同会社
合同会社ＬＡＬＡ,大阪府東大阪市荒川２丁目２４番８号俊徳道駅前ビル３０５号,2021-01-04,合同会社
合同会社ＬＣＧ,東京都渋谷区桜丘町４番１４号ＶＯＲＴ渋谷桜丘９階,2021-01-04,合同会社
合同会社ＬＯＭ,埼玉県八潮市大字二丁目２８３－１,2021-01-04,合同会社
合同会社Ｌｉ－ａｃｔ,岐阜県可児市広見４丁目４０番地ライオンズマンション１０２号,2021-01-04,合同会社
合同会社Ｌｉｅｎ,東京都小金井市前原町３丁目２－２９小金井ハイツ２１３,2021-01-04,合同会社
合同会社ＭＡアドバンス,兵庫県川西市清和台東２丁目４番地の７８,2021-01-04,合同会社
合同会社ＭＧＡ,京都府京都市東山区泉涌寺東林町３２－３６カッシーヤ泉涌寺Ｄ,2021-01-04,合同会社
合同会社Ｍａｒｕｈｉｒｏ　Ｌａｂ．,東京都調布市菊野台２丁目４２番地１４号,2021-01-04,合同会社
合同会社Ｍｏｎｏｉｄ,東京都台東区台東１丁目１５番６－９０３号,2021-01-04,合同会社
合同会社ＮＳＩ,千葉県習志野市鷺沼台３丁目２１番１９号,2021-01-04,合同会社
合同会社ＮｏｄｅＴＥＣＨ．,東京都港区南青山２丁目２番１５号,2021-01-04,合同会社
合同会社ＯＦＦＩＣＥ神山,東京都練馬区石神井台３丁目５番５号,2021-01-04,合同会社
合同会社ＯＫ５号,千葉県松戸市大谷口９４番地の７,2021-01-04,合同会社
合同会社ＯＮＥ　ＷＡＹ,兵庫県神崎郡市川町上牛尾１８９７番地の１,2021-01-04,合同会社
合同会社ＯＲ,大阪府箕面市箕面６丁目１番１号,2021-01-04,合同会社
合同会社ＲＡＴ　ＨＯＰＥ,大阪府東大阪市小阪本町１丁目５番８号,2021-01-04,合同会社
合同会社ＲＡｉＴＯ,岡山県倉敷市西岡２７８番地１,2021-01-04,合同会社
合同会社ＳＥＡＳＯＮ,福岡県福岡市博多区板付７丁目６番２号,2021-01-04,合同会社
合同会社ＳＥＡＴ,神奈川県川崎市中原区下小田中１丁目１９番１８号,2021-01-04,合同会社
合同会社ＳＯＲＡＩＲＯ　Ｍａｉｎｔｅｎａｎｃｅ,兵庫県西宮市国見台４丁目１－２８,2021-01-04,合同会社
合同会社ＴＦＯ,愛知県名古屋市天白区植田山３丁目１８１０番地の１,2021-01-04,合同会社
合同会社ＶＩＳＡＫＨＡ　ＩＮＴＥＲＮＡＴＩＯＮＡＬ,茨城県常総市大塚戸町２８００－１の１ブロックＢ,2021-01-04,合同会社
合同会社Ｙ’ｓデンタルラボ,和歌山県岩出市根来１６０番地の１,2021-01-04,合同会社
合同会社ｅｍｏｎ,熊本県熊本市南区幸田２丁目７番５０－７０２号,2021-01-04,合同会社
合同会社ｋａｎｋａｋｕ,東京都港区浜松町１丁目２番１７－５０４号,2021-01-04,合同会社
合同会社ｕｔｕｗａ,東京都杉並区高円寺南４丁目３０番４号高円寺ＫＹテラス１０１,2021-01-04,合同会社
合同会社ｙｕＪ,千葉県長生郡白子町古所３２５０番地６４７パノラマビュー白子９０８号,2021-01-04,合同会社
合名会社匠人,千葉県香取市上小川６８１番地,2021-01-04,合名会社
坂本洋菓子店合同会社,福岡県太宰府市向佐野２丁目９番１６－２０５号,2021-01-04,合同会社
塩野ファイナンシャルグループ合同会社,兵庫県西宮市松園町８番４１号,2021-01-04,合同会社
大和相互労組,東京都北区豊島５丁目１－３２,2021-01-04,その他の設立登記法人
天龍株式会社,大阪府大阪市中央区西心斎橋１丁目５－１２心斎橋アーバンライフ５０３号室,2021-01-04,株式会社
学校法人ワオ未来学園,岡山県岡山市北区磨屋町７番２号,2021-01-04,その他の設立登記法人
宇久地区自治協議会,長崎県佐世保市宇久町平２６９１番地,2021-01-04,その他
安勤株式会社,沖縄県那覇市前島３丁目２５番２号泊ポートビル５階,2021-01-04,株式会社
密友合同会社,岡山県岡山市北区表町２丁目５番２０号,2021-01-04,合同会社
富士リート株式会社,静岡県富士市下横割５４番地の１０,2021-01-04,株式会社
嵐株式会社,静岡県沼津市本田町１０番１８号,2021-01-04,株式会社
弁護士法人山崎・秋山・山下法律事務所,東京都千代田区飯田橋４丁目７番１１号カクタス飯田橋ビル３０４,2021-01-04,その他の設立登記法人
後藤電設株式会社,沖縄県うるま市字宮里９１８番１０号,2021-01-04,株式会社
志賀組合同会社,埼玉県上尾市小泉８丁目１２番地５,2021-01-04,合同会社
日本通信教育学習院株式会社,大分県大分市中央町２丁目１番２２号,2021-01-04,株式会社
旺達国際株式会社,神奈川県横浜市南区共進町３丁目７０番地３セリバシ横浜３０２,2021-01-04,株式会社
村地綜合管理株式会社,滋賀県蒲生郡竜王町大字綾戸３２８番地の３,2021-01-04,株式会社
東方貿易株式会社,宮城県大崎市岩出山下野目字雨生沢５１,2021-01-04,株式会社
松戸ロジスティクス特定目的会社,東京都新宿区四谷２丁目９番地１５東京ユナイテッド綜合事務所内,2021-01-04,その他の設立登記法人
林興産株式会社,北海道札幌市北区北二十五条西３丁目２番３号,2021-01-04,株式会社
柳木大合同会社,福島県いわき市内郷御厩町１丁目２２０番地の１,2021-01-04,合同会社
栄輝株式会社,大阪府泉南郡田尻町吉見１０７０番地１０２,2021-01-04,株式会社
株式会社あおぞら農園おかやま,岡山県岡山市南区西高崎２７番地９,2021-01-04,株式会社
株式会社いしざき,大阪府大阪市大正区小林西２丁目１１番１８号,2021-01-04,株式会社
株式会社いなづみ,鹿児島県日置市伊集院町郡２丁目１００番地,2021-01-04,株式会社
株式会社いぶし家本舗,福岡県大野城市牛頸４丁目１１番８号,2021-01-04,株式会社
株式会社うにしらこ,宮城県大崎市田尻大貫字北長根６４番地,2021-01-04,株式会社
