法人名,住所,設立日,法人種別
株式会社ユーベッツ,京都府京都市西京区嵐山朝月町２番地１,2021-11-19,株式会社
株式会社リアーツ,大阪府大阪市都島区高倉町３丁目５番１２－６号,2021-11-19,株式会社
株式会社リエントラント,大阪府大阪市中央区久太郎町３丁目１－６伊藤佑ビル大阪本町,2021-11-19,株式会社
株式会社リオレミ,大分県大分市大字中戸次１３３７番地１オレンジＤＡＹＳーＡ２０１,2021-11-19,株式会社
株式会社リープ販売センター,埼玉県桶川市泉１丁目７番６号,2021-11-19,株式会社
株式会社ル・ジェルム,岡山県岡山市中区海吉１９１５番地１２,2021-11-19,株式会社
株式会社ワイケイアカウンティング,東京都品川区東品川３丁目８番８－８１１号,2021-11-19,株式会社
株式会社ワール,宮崎県宮崎市大字赤江１２６９番地２,2021-11-19,株式会社
株式会社ヴェルデホーエンカンパニー,東京都千代田区平河町１丁目６番１５号ＵＳビル８階,2021-11-19,株式会社
株式会社七十八,東京都渋谷区代々木１丁目３０番１５号,2021-11-19,株式会社
株式会社三久薬品商会,大阪府堺市美原区小平尾７２７番地１,2021-11-19,株式会社
株式会社丸泉,東京都世田谷区松原６丁目３９番１２号,2021-11-19,株式会社
株式会社九動,福岡県福岡市南区三宅１丁目１５番１５号２階,2021-11-19,株式会社
株式会社信瑞,東京都渋谷区神宮前５丁目１８番１３号１階,2021-11-19,株式会社
株式会社充興業,沖縄県宜野湾市野嵩２丁目１１番９－１０２号ＳＡＫＵＲＡ・ＳＯ,2021-11-19,株式会社
株式会社匠デザイン塗装,埼玉県川口市領家５丁目１番５号,2021-11-19,株式会社
株式会社博多千じゅ,福岡県福岡市南区大橋１丁目１５番６号アルボーレ大橋Ｂ１,2021-11-19,株式会社
株式会社吉裕,大阪府大阪市淀川区塚本５丁目３番１１号,2021-11-19,株式会社
株式会社境谷工業,群馬県安中市西上磯部１８７０番地２,2021-11-19,株式会社
株式会社多助,東京都港区新橋３丁目２番３号２階,2021-11-19,株式会社
株式会社大福工務店,埼玉県さいたま市南区別所３丁目１９番１６号,2021-11-19,株式会社
株式会社山紀,神奈川県藤沢市片瀬海岸３丁目１番３３号,2021-11-19,株式会社
株式会社平柳興業,福岡県福岡市西区泉１丁目２７番１５号,2021-11-19,株式会社
株式会社成航,埼玉県深谷市折之口字屋敷合４５３番地３,2021-11-19,株式会社
株式会社東迅,千葉県千葉市中央区祐光４丁目１１番５－１０３号,2021-11-19,株式会社
株式会社松建,東京都八王子市元本郷町２丁目１９番１４号セゾン八王子４０１号,2021-11-19,株式会社
株式会社桜国際商事,神奈川県川崎市川崎区昭和１丁目５番１１号ユナイトＳＨＯＷＡザ・シンボル２１０,2021-11-19,株式会社
株式会社永野工業,宮崎県宮崎市源藤町南田４９番地５,2021-11-19,株式会社
株式会社渡邊工業,山梨県甲府市上今井町１６５９番地,2021-11-19,株式会社
株式会社滿菜,福岡県福岡市博多区空港前３丁目１９番３９号,2021-11-19,株式会社
株式会社琉球セキュリティーサービス,沖縄県浦添市港川１丁目４３番１６号ポートかりゆし１０１,2021-11-19,株式会社
株式会社福和,福岡県福岡市東区原田１丁目２０番１２－１０１号,2021-11-19,株式会社
株式会社箱根リゾートオペレーションズ,東京都渋谷区恵比寿４丁目１番１８号恵比寿ネオナート,2021-11-19,株式会社
株式会社糖尿病重症化予防協議会,茨城県筑西市成田６７８番地,2021-11-19,株式会社
株式会社翔彩工務店,埼玉県さいたま市中央区上峰４丁目１４番１８号ラフィナート１０３号,2021-11-19,株式会社
株式会社興亜,愛知県名古屋市千種区大島町２丁目１８番地２１８ＨＯＵＳＥ２階Ａ号室,2021-11-19,株式会社
株式会社西賢,広島県廿日市市山陽園４番５号,2021-11-19,株式会社
株式会社週末住人,鳥取県西伯郡大山町富長１５９番地１２Ｆ（ＴＯＲＩＣＯ内）,2021-11-19,株式会社
株式会社関西システムデベロップメント,大阪府大阪市中央区南船場４丁目１０番５号南船場ＳＯＨＯビル７０２,2021-11-19,株式会社
株式会社髪未来,千葉県千葉市中央区鵜の森町４番２号,2021-11-19,株式会社
株式会社４ａｃｅ,福岡県福岡市中央区大名１丁目９番２５－５０２号,2021-11-19,株式会社
株式会社Ａ－ＴＥＣ,神奈川県横浜市瀬谷区南瀬谷１丁目３７番地７,2021-11-19,株式会社
株式会社Ａ．Ｓ．Ｓ,兵庫県宝塚市今里町１７番８号,2021-11-19,株式会社
株式会社Ａ．ｓｔａｒｓ,東京都渋谷区神宮前３丁目１８番６号ストーリア神宮前１１０,2021-11-19,株式会社
株式会社ＡＬＺＥ,東京都足立区東保木間２丁目１４番９－４０１号,2021-11-19,株式会社
株式会社ＡＮＤＳＡＬＴ,福岡県久留米市南１丁目２２番５号,2021-11-19,株式会社
株式会社ＡＯ,東京都杉並区高円寺北２丁目３９－２６,2021-11-19,株式会社
株式会社ＡＳＢＩＡＮＪ,神奈川県横浜市中区翁町２丁目７番１号レックス横浜関内１Ｆ,2021-11-19,株式会社
株式会社ＡＳＯＭＡＴＯＵＳ,京都府相楽郡笠置町大字笠置小字佃９番地,2021-11-19,株式会社
株式会社ＡＴ,千葉県松戸市小金上総町３番地の８ビレッジ「Ｋ」ＫＡＭＥ１－Ｄ１０５号,2021-11-19,株式会社
株式会社Ａｄｖａｇｅ,福岡県福岡市中央区警固２丁目１２－１９アイリス警固ビル３Ｆ,2021-11-19,株式会社
株式会社Ａｌｄｅｂａｒａｎ,東京都渋谷区東３丁目８番２４号,2021-11-19,株式会社
株式会社Ａｔｈｌｅｔｅ　Ｐａｒｔｎｅｒｓ,新潟県新潟市中央区沼垂東４丁目７番２号１Ｆ,2021-11-19,株式会社
株式会社Ａｔｏｏｓｈｉ　Ｃｏｎｓｕｌｔｉｎｇ,福岡県福岡市中央区天神２丁目３番１０号天神パインクレスト７１９号,2021-11-19,株式会社
株式会社ＢＮＬ,石川県金沢市畝田西３丁目１８７番地,2021-11-19,株式会社
株式会社ＢＹ　ＵＳ　ＣＯＭＰＡＮＹ,大阪府大阪市西区北堀江１丁目１５番１１号クリック北堀江ビル３０３号室,2021-11-19,株式会社
株式会社ＢａＴＯＮ,大阪府茨木市南春日丘７丁目８番１８号,2021-11-19,株式会社
株式会社Ｂｅｒｒｙ　Ｃａｐｉｔａｌ,東京都新宿区西新宿３丁目３番１３号,2021-11-19,株式会社
株式会社ＣＡＳＥ建築研究所,山梨県富士吉田市旭１丁目３番２５－４号ｈｏｕｒｓ　Ａ号室,2021-11-19,株式会社
株式会社ＣＨＥＲＩＲ,静岡県熱海市青葉町９番９号,2021-11-19,株式会社
株式会社Ｃｈｉａａｒｚ,京都府舞鶴市字上福井セバト１５０２番地,2021-11-19,株式会社
株式会社Ｃｏｌｌｅｔ,東京都台東区上野２丁目１番３号,2021-11-19,株式会社
株式会社ＤＩＥＳ,東京都渋谷区渋谷２丁目７番１１号ステラ青山４０１,2021-11-19,株式会社
株式会社ＥＮＩＸＩＡ,大阪府大阪市中央区難波４丁目１－１５近鉄難波ビル１Ｆ,2021-11-19,株式会社
株式会社ＦＵＮＤｉＴ,東京都中央区日本橋小網町７番８号,2021-11-19,株式会社
株式会社Ｆｅｄｉｃａ,愛媛県松山市古川南１丁目１６番２４号,2021-11-19,株式会社
株式会社Ｆｌｉｇｈｔ　Ａｓｓｉｓｔ,千葉県富里市日吉倉７４４番地２,2021-11-19,株式会社
株式会社Ｇ．Ｔ．Ｙ,宮城県名取市手倉田字諏訪３２２番地９,2021-11-19,株式会社
株式会社Ｇｏｏｄ　Ｍｅｅｔｓ,大阪府大阪市中央区久太郎町３丁目１番６号伊藤佑大阪本町ビル,2021-11-19,株式会社
株式会社ＨＹＭ　ＪＡＰＡＮ,東京都江戸川区南小岩６丁目２５番地１０号フェリース南小岩２－２０１,2021-11-19,株式会社
株式会社Ｈａｒｖｅｓｔ,福井県福井市下森田桜町７０９番２,2021-11-19,株式会社
株式会社ＩＣＨＩ　ＩＣＨＩ,東京都渋谷区宇田川町３７番１５号ＡＲＩＳＴＯ渋谷６階,2021-11-19,株式会社
株式会社ＩＴＭファーマ,愛知県蒲郡市旭町９番６号,2021-11-19,株式会社
株式会社Ｊ　ａｎｄ　Ｊ,東京都立川市富士見町２丁目１９番８号,2021-11-19,株式会社
株式会社Ｋ＆Ｍ,福岡県福岡市博多区中洲４丁目１番２６号中洲人形町ビル地下１階Ｂ１Ｆ号室,2021-11-19,株式会社
株式会社ＫＡＲＭ,長野県上田市国分１２９１番地１ブランメゾン２０１号,2021-11-19,株式会社
株式会社ＫＭ　Ｆａｃｔｏｒｙ,神奈川県横須賀市大矢部３丁目４２番７号,2021-11-19,株式会社
株式会社Ｌ’Ｓ,東京都渋谷区道玄坂１丁目６番２号,2021-11-19,株式会社
株式会社ＬＡＳＴ１,東京都新宿区百人町１丁目２１番２４号,2021-11-19,株式会社
株式会社ＬＩＦＥ　ＷＩＴＨ,東京都渋谷区道玄坂１丁目１５番３号プリメーラ道玄坂４０６,2021-11-19,株式会社
株式会社ＬＯＯＰＳ,茨城県牛久市ひたち野西３丁目３７番地１,2021-11-19,株式会社
株式会社Ｌｉｂｅｒｔａ,大阪府大阪市西区本田３丁目３番２４号エオス４Ｂ,2021-11-19,株式会社
株式会社Ｌｉｅｎ,東京都渋谷区恵比寿４丁目２０番３号恵比寿ガーデンプレイスタワー１８階,2021-11-19,株式会社
株式会社Ｌｉｅｎ,福岡県太宰府市通古賀５丁目１１番９号,2021-11-19,株式会社
株式会社ＬｉｖｅＡＲＴｓ,福岡県福岡市博多区博多駅前２丁目１９番１７号トーカン博多第５ビル３１２号室,2021-11-19,株式会社
株式会社Ｌｕｉｇｉａ,東京都目黒区中目黒１丁目１番６３－４０２号シャトー代官山,2021-11-19,株式会社
株式会社Ｍ＆Ｓ,大分県大分市大字猪野１５２８番地の３９,2021-11-19,株式会社
株式会社ＭＩＰ,群馬県高崎市東町３２番地１ＢｒｉｌｌｉａＴｏｗｅｒ高崎１５０２号,2021-11-19,株式会社
株式会社ＭＫＴ,東京都豊島区池袋２丁目６７番１号,2021-11-19,株式会社
株式会社ＭＭＳＫＹ,広島県広島市西区古江西町４番１３号,2021-11-19,株式会社
株式会社ＭＴ・Ｓｍａｓｈ,静岡県伊東市岡１２９４番地の９５,2021-11-19,株式会社
株式会社Ｍａｇｉｃ　ｗａｎｄ,香川県仲多度郡多度津町本通２丁目７番１８号,2021-11-19,株式会社
株式会社Ｍａｔｉｌｄａ,福岡県福岡市中央区長浜２丁目３番１―２０１号,2021-11-19,株式会社
株式会社Ｍｅｔａ　ｐｒｉｍｅ,東京都千代田区平河町２丁目１１番１号,2021-11-19,株式会社
株式会社Ｍｉｉｓｅｌ,東京都渋谷区神宮前６丁目２３番４号桑野ビル２階,2021-11-19,株式会社
株式会社ＮＡＮＡＩＲＯ,山梨県中央市山之神１２１７番地３０Ｔエステート１０１号室,2021-11-19,株式会社
株式会社Ｎｋｏフィールド,東京都千代田区九段北１丁目５番５－１０２号,2021-11-19,株式会社
株式会社Ｎｏｄｅ－Ａ,東京都世田谷区玉川２丁目２８番１０－１０２号,2021-11-19,株式会社
株式会社ＯＡアイランド,佐賀県鳥栖市江島町２３４６番地３５,2021-11-19,株式会社
株式会社ＯＮＥＧＡＭＥ,東京都世田谷区桜丘２丁目２９番２１号,2021-11-19,株式会社
株式会社ＯＲｅｓｔ,大阪府寝屋川市三井南町１２－２５,2021-11-19,株式会社
株式会社ＰＬＵＳ,東京都江戸川区北篠崎２丁目２１番３号,2021-11-19,株式会社
株式会社ＰＲＥＴＥＮＤ,大阪府大阪市西区北堀江１丁目６番１２号,2021-11-19,株式会社
株式会社Ｐｅａｘ,東京都渋谷区渋谷２丁目１９－１５宮益坂ビルディング６０９,2021-11-19,株式会社
株式会社Ｐｏｍｍｅ,岡山県倉敷市川入８０３番地２,2021-11-19,株式会社
株式会社Ｐｒｏｐｅｌ,愛媛県松山市光洋台８番地４９,2021-11-19,株式会社
株式会社Ｒ３５６,千葉県香取市野田２３２－４,2021-11-19,株式会社
株式会社ＲＵＮ,東京都中央区築地１丁目５番１１号ＡＣＮ築地ビル４階,2021-11-19,株式会社
株式会社ＲＵＳＨ,千葉県浦安市日の出１丁目４番Ｃ,2021-11-19,株式会社
株式会社ＳＥＡＣＲＥＴ,東京都港区南麻布４丁目２番４２－６０７号,2021-11-19,株式会社
株式会社ＳＥＬＥＣＴＵＳ,長野県北佐久郡軽井沢町大字追分７８番地４５,2021-11-19,株式会社
株式会社ＳＴＵＤＩＯ　ＯＮＥ,静岡県袋井市上山梨９６７番地の１,2021-11-19,株式会社
株式会社Ｓａｌｏｎ,大阪府高槻市淀の原町２１－２０,2021-11-19,株式会社
株式会社Ｓｔａｒｍｉｎｅ,埼玉県秩父市山田２７４１番地８,2021-11-19,株式会社
株式会社Ｓｕｎｓｅｅｄ,福岡県大川市大字大野島９８番地１,2021-11-19,株式会社
株式会社Ｔ・Ｈ・Ｆ,栃木県真岡市長田４丁目１１番地３サカエハイツＤ号棟,2021-11-19,株式会社
株式会社ＴＥＲＡ　ｃｏｒｐｏｒａｔｉｏｎ,大阪府大阪市住吉区遠里小野５丁目７番２３号,2021-11-19,株式会社
株式会社ＴＥＲＲＡ,東京都品川区小山６丁目６－４ダイヤモンドレジデンス西小山４０２,2021-11-19,株式会社
株式会社ＴＨＲＥＥ　ＧＯＬＤ,福岡県福岡市南区長丘５丁目１４番２２号キャトル・セゾン長丘Ａ２０２号,2021-11-19,株式会社
株式会社ＴＯＰ１,愛媛県松山市千舟町１丁目２番地１０エステート千舟１Ｆ,2021-11-19,株式会社
株式会社ＴＴＫ,大阪府池田市八王寺１丁目２番１４号,2021-11-19,株式会社
株式会社ＴｏＳＳ,神奈川県相模原市中央区相模原５丁目２番１号,2021-11-19,株式会社
株式会社Ｔｒａｎｓｐｏｒｔａｔｉｏｎ９２,北海道苫小牧市拓勇西町６丁目６番２１号,2021-11-19,株式会社
株式会社ＴｒｅａｓｕｒｅＢｏｘ,東京都足立区竹の塚５丁目１番３号,2021-11-19,株式会社
株式会社ＵＭＩＴＳＵＫＩ,愛知県名古屋市中区栄５丁目２６－３９ＧＳ栄ビル３Ｆ,2021-11-19,株式会社
株式会社ＵｎｔａｍａＭ,沖縄県中頭郡西原町字我謝２４８番地の３,2021-11-19,株式会社
株式会社ＷＡＲＡ,埼玉県北葛飾郡杉戸町清地３丁目９番１５号,2021-11-19,株式会社
株式会社Ｗｏｒｌｄ　Ｂｅａｕｔｙ,新潟県新潟市中央区鳥屋野２９２番地１,2021-11-19,株式会社
株式会社ＹＨＬ,愛知県名古屋市中区丸の内３丁目１７番４号第１１ＫＴビル８階,2021-11-19,株式会社
株式会社ＹＯＫＯ,東京都世田谷区上祖師谷１丁目１３番２－３０１号,2021-11-19,株式会社
株式会社ＹＯＮＥＳＨＯ,東京都大田区東海３丁目７－１ＧＴＯビル６００号室,2021-11-19,株式会社
株式会社ＹＹダイニング,東京都中央区月島１丁目２２番１－１９１６号,2021-11-19,株式会社
株式会社ｂ＆ｖｅｉｎ,新潟県南蒲原郡田上町大字田上丁１９１８番地４８,2021-11-19,株式会社
株式会社ｂｏｂｙ,京都府京都市東山区渋谷通東大路東入３丁目上馬町６０４番地１７,2021-11-19,株式会社
株式会社ｃｒｕｓｔ,愛知県豊田市猿投町池田９番地,2021-11-19,株式会社
株式会社ｉｌｌ,東京都渋谷区渋谷２丁目１９－１５宮益坂ビルディング６０９,2021-11-19,株式会社
株式会社ｉｒｏｄｏｒｉ　ｌａｂｏ,富山県富山市中央通り１丁目４番１６号,2021-11-19,株式会社
株式会社ｋｎｏｔ　ｄｅｓｉｇｎ,愛知県名古屋市東区泉１丁目２番１７号レジデンス泉３０１号,2021-11-19,株式会社
株式会社ｍｌｙ,東京都渋谷区神宮前４丁目１５番４号Ｙ．Ｃ表参道ビル１０２,2021-11-19,株式会社
株式会社ｍｏＲＥ　ＪＡＰＡＮ,沖縄県宜野湾市字大謝名９０番３－８０２号,2021-11-19,株式会社
株式会社ｎａｔｏｓ,東京都港区北青山３丁目６番７号青山パラシオタワー１１階,2021-11-19,株式会社
株式会社ｐａｔｒｏｎｉｄｅ,東京都港区南青山２丁目２番１５号,2021-11-19,株式会社
桜丘社会保険労務士法人,東京都渋谷区桜丘町２９番２４－７０９号,2021-11-19,その他の設立登記法人
泰惠企業株式会社,埼玉県戸田市喜沢２丁目３４番地の７（ステイツ戸田喜沢４０３号室）,2021-11-19,株式会社
満樹果物株式会社,大阪府大阪市城東区中浜１丁目１７－１４ルネッサンスシャレード６Ｈ,2021-11-19,株式会社
漢美人本舗合同会社,沖縄県那覇市字仲井真２７９番地２６,2021-11-19,合同会社
特定非営利活動法人カラフル,京都府南丹市日吉町胡麻ミロク７７番地１６,2021-11-19,その他の設立登記法人
特定非営利活動法人セイエン,東京都港区芝４丁目７番１号西山ビル４階,2021-11-19,その他の設立登記法人
特定非営利活動法人坂祝まちづくり推進機構,岐阜県加茂郡坂祝町取組３７０番地,2021-11-19,その他の設立登記法人
特定非営利活動法人市民後見たんば,兵庫県丹波市氷上町市辺６８３番地,2021-11-19,その他の設立登記法人
特定非営利活動法人織り成す軽井沢,長野県北佐久郡軽井沢町中軽井沢１７番地８,2021-11-19,その他の設立登記法人
特定非営利活動法人Ｗｏｒｌｄ　Ｆｏｏｔｂａｌｌ　Ｓｈｉｐ,千葉県市川市市川南４丁目２番３０号,2021-11-19,その他の設立登記法人
石井管理合同会社,東京都板橋区徳丸３丁目４１番２７号,2021-11-19,合同会社
稲城合同会社,東京都港区元赤坂１丁目１番８号株式会社赤坂国際会計内,2021-11-19,合同会社
美合株式会社,埼玉県川口市並木１丁目１３番３２－５０５号エバーグリーン川口,2021-11-19,株式会社
習志野５丁目町会,千葉県船橋市習志野５丁目２－６－９０９,2021-11-19,その他
葉月社会保険労務士法人,千葉県船橋市本町２丁目５番１９号マリーナタカケンビル８階,2021-11-19,その他の設立登記法人
行政書士法人会社設立エクスプレス,東京都渋谷区渋谷３丁目６番４号プライア渋谷５０８号,2021-11-19,その他の設立登記法人
西群馬土地開発合同会社,群馬県安中市安中４３９２番地１,2021-11-19,合同会社
輝洋貿易株式会社,大阪府大阪市西区江戸堀２丁目１番１号江戸堀センタービル９階,2021-11-19,株式会社
農事組合法人ＶＥＧＥ・ＦＩＲＳＴ,千葉県山武郡横芝光町中台１４０５番地１１０,2021-11-19,その他の設立登記法人
辻養蜂場株式会社,福岡県嘉麻市山野２０５５番地６６,2021-11-19,株式会社
鈴木テック株式会社,大分県別府市大字鶴見１９７６番地の３２,2021-11-19,株式会社
錦富株式会社,大阪府大阪市西成区梅南１丁目６－１９梅南マンション２０１号室,2021-11-19,株式会社
阪東電機株式会社,群馬県渋川市渋川８７５番地２,2021-11-19,株式会社
阿見町荒川本郷第二土地区画整理組合,茨城県稲敷郡阿見町大字荒川本郷２００１－１,2021-11-19,その他
雅商事株式会社,茨城県猿島郡境町５０５番地,2021-11-19,株式会社
青木インベストメント一般社団法人,東京都港区虎ノ門４丁目１番２８号,2021-11-19,その他の設立登記法人
高広株式会社,広島県広島市中区光南３丁目３番２－１０２号,2021-11-19,株式会社
０１株式会社,東京都足立区梅田７丁目１０－９－９０３,2021-11-19,株式会社
ＡＩｔｏＡｉｒ株式会社,神奈川県川崎市幸区大宮町１８－２・２Ｆ－１５,2021-11-19,株式会社
ＡＺＳ株式会社,東京都板橋区徳丸７丁目２３番１０号,2021-11-19,株式会社
Ａｃｈｉｌｌｅｓ株式会社,東京都新宿区百人町２丁目１８番１５号,2021-11-19,株式会社
Ａｌｌｉａｎｃｅ　Ｇｌｏｂａｌ　Ｇｒｏｕｐ株式会社,東京都港区赤坂３丁目７番１５号,2021-11-19,株式会社
ＢＨＦ合同会社,宮城県仙台市太白区向山３丁目４番１１号,2021-11-19,合同会社
ＢＩＺサポート企業組合,宮城県大崎市松山金谷字向田８８番地１０,2021-11-19,その他の設立登記法人
Ｂｅｒｒｙ株式会社,沖縄県那覇市首里山川町１丁目６８番地ファイブテラス１階,2021-11-19,株式会社
ＣＬＯＶＥＲ５株式会社,岐阜県羽島郡岐南町三宅５丁目４８，アイレックス三宅１ＦＢ,2021-11-19,株式会社
ＤＡＩＫＯＵ株式会社,茨城県水戸市東野町７９番地の１,2021-11-19,株式会社
Ｄｒｅａｍ　Ｓｔａｒ合同会社,埼玉県ふじみ野市緑ケ丘２丁目２３－１４,2021-11-19,合同会社
Ｅ－ＲＩＳＥ　ＥＸＴＥＲＩＯＲ株式会社,山梨県南アルプス市藤田１６９９番地１,2021-11-19,株式会社
ＥＬ　ＤＯＲＡＤＯ合同会社,埼玉県加須市北小浜２６０番地１レオネクストリントアール１０４,2021-11-19,合同会社
Ｆｏｒｅｓｔｆｌｏｗ合同会社,茨城県つくば市春日２丁目２４番地１エクセラン春日３０１号,2021-11-19,合同会社
Ｆｒｅｅ　ａｓ　ａ　ｂｉｒｄ株式会社,大阪府大阪市城東区中浜１丁目１７－１４ルネッサンスシャレード５Ｆ,2021-11-19,株式会社
Ｇ‐ＳＴＹＬＥ合同会社,福岡県福岡市東区箱崎ふ頭３丁目１番１５－９１２号,2021-11-19,合同会社
ＧＬＯＢＡＬ　ＲＯＳＨＩ合同会社,東京都豊島区北大塚１丁目１番１号,2021-11-19,合同会社
ＧＯＬＤＥＮ　ＰＩＧ　ＰＩＧ合同会社,福岡県福岡市早良区重留７丁目２－１２,2021-11-19,合同会社
Ｈ＆Ｂ合同会社,京都府京都市右京区西京極北衣手町２番地８,2021-11-19,合同会社
ＨＪ株式会社,京都府城陽市寺田新池６６番地の１,2021-11-19,株式会社
ＨＯＡＮＧ　ＨＵＮＧ株式会社,埼玉県本庄市小島１丁目１０番２９号,2021-11-19,株式会社
ＨＲＣパートナーズ合同会社,千葉県松戸市大金平３丁目１４９番地の３,2021-11-19,合同会社
Ｈｏｐｅ株式会社,東京都港区浜松町２丁目２番１５号浜松町ダイヤビル２Ｆ,2021-11-19,株式会社
ＩＳＲ合同会社,東京都板橋区富士見町１４番５号板橋本町オフィス・ビズサークル板橋本町１０４,2021-11-19,合同会社
Ｊ．Ｐ．コンサルティング合同会社,埼玉県川口市東領家１丁目９－５,2021-11-19,合同会社
ＪＥＴＡＩＲ　１６　ＬＩＭＩＴＥＤ,,2021-11-19,外国会社等
ＪＥＴＡＩＲ　１６　ＮＯＲＷＡＹ　ＡＳ,,2021-11-19,外国会社等
ＪＭＦ株式会社,東京都渋谷区神宮前３丁目１６－１７ｍ－ｆｒａｍｅ神宮前２Ｆ－Ｂ,2021-11-19,株式会社
Ｋ＆Ｔコンサルティング株式会社,岡山県岡山市北区西崎２丁目３番７号,2021-11-19,株式会社
ＫＫＭテック株式会社,東京都大田区大森北５丁目１６番１－２０７号,2021-11-19,株式会社
ＫＭＫ株式会社,兵庫県姫路市二階町９９番地１,2021-11-19,株式会社
ＫＯＤＡＫＩＴＡＫＡＳＨＩ．ＣＯＭ株式会社,島根県出雲市斐川町富村１９６０－４,2021-11-19,株式会社
ＫＯＳＥＩ株式会社,東京都港区芝浦２丁目７番１１－６０２号,2021-11-19,株式会社
Ｋｉｚｕｎａ　Ｓｏｌｕｔｉｏｎｓ　ｌｉｍｉｔｅｄ,北海道虻田郡ニセコ町字ニセコ３１５－１１９,2021-11-19,外国会社等
Ｋｏｋｅｎ　Ｃｏｎｓｕｌｔｉｎｇ合同会社,神奈川県相模原市南区相武台１丁目１１番３号,2021-11-19,合同会社
ＬＥＢＥＮ株式会社,埼玉県春日部市粕壁６９０１－８,2021-11-19,株式会社
ＬＥＥＳＵＮ株式会社,埼玉県川口市西川口１丁目３０番２０－４０２号,2021-11-19,株式会社
ＬＩＹＡＮＡＧＥ　ＥＮＴＥＲＰＲＩＳＥＳ,千葉県八街市文違３０１－１１５７、コーポ赤間、サポートオフィス１０２,2021-11-19,外国会社等
ＬＯＯＰ設備工業株式会社,大阪府岸和田市大沢町６４７番地,2021-11-19,株式会社
Ｍ＆Ａリレーション合同会社,東京都江東区辰巳１丁目７番２８号９１４号室,2021-11-19,合同会社
