法人名,住所,設立日,法人種別
ぐんま情報通信サービス業協同組合,群馬県前橋市表町２丁目１０番１９号,2017-06-01,その他の設立登記法人
さくら訪問介護株式会社,東京都足立区東綾瀬１丁目２３番７号,2017-06-01,株式会社
みさきクリエイト合同会社,兵庫県姫路市広畑区西夢前台６丁目２番地,2017-06-01,合同会社
アセットソリューション株式会社,東京都渋谷区広尾４丁目１番２６－３０９号,2017-06-01,株式会社
イグアス株式会社,岐阜県大垣市郭町東１丁目２３番地Ｄ－２,2017-06-01,株式会社
イナペイントサービス株式会社,静岡県浜松市浜北区於呂４０２４番地の１,2017-06-01,株式会社
インパラス株式会社,東京都渋谷区神宮前２丁目４番７号,2017-06-01,株式会社
ウテナ株式会社,東京都港区赤坂２丁目１６番６号,2017-06-01,株式会社
エコーカンパニー株式会社,宮城県仙台市若林区上飯田２丁目１２番１１号,2017-06-01,株式会社
エスケー設備株式会社,東京都練馬区栄町３９番６号小林ビル１０２号室,2017-06-01,株式会社
エーアイ株式会社,埼玉県川口市北原台２丁目２３－１９,2017-06-01,株式会社
オライフ株式会社,東京都葛飾区柴又３丁目２３番１１号,2017-06-01,株式会社
キャッチ合同会社,熊本県熊本市東区戸島７丁目１番２号,2017-06-01,合同会社
グリーンキューブ株式会社,東京都港区赤坂６丁目９番５－５０３号,2017-06-01,株式会社
ケイ・アイ・ソリューション株式会社,大阪府大阪市浪速区恵美須西２丁目５番１７号,2017-06-01,株式会社
サガタ空調設備株式会社,福岡県春日市大土居１丁目１２３番地オフィスパレア春日Ⅲ５号室,2017-06-01,株式会社
スナヤマ合同会社,静岡県磐田市明ケ島原１４番地１７,2017-06-01,合同会社
ソレイユフォルス合同会社,東京都港区芝大門１丁目４番１４号芝栄太楼ビル４階,2017-06-01,合同会社
タケックス株式会社,大阪府吹田市江坂町１丁目２３番５号,2017-06-01,株式会社
ダイアモンド・ガス・インターナショナル・ジャパン株式会社,東京都千代田区丸の内２丁目３番１号,2017-06-01,株式会社
テックワールドサービス株式会社,東京都江戸川区松島３丁目４３番１３号,2017-06-01,株式会社
トップライズ株式会社,大阪府大阪市中央区伏見町３丁目１番１号,2017-06-01,株式会社
ハセガワホールディングス株式会社,埼玉県川越市大字下小坂８３番地１,2017-06-01,株式会社
ヒューシャルインターナショナル合同会社,奈良県生駒市東新町４番２４号,2017-06-01,合同会社
ビーパワーハウス株式会社,兵庫県神戸市中央区北野町２丁目９ー１ギターマンション２０２,2017-06-01,株式会社
フタバスチール株式会社,埼玉県熊谷市妻沼４８１番地４シャルムメゾンＭ１０１,2017-06-01,株式会社
マートルコート川口管理組合,埼玉県川口市飯塚２丁目８－４３,2017-06-01,その他
ミドルベリー大学日本校　オフィス,東京都三鷹市大沢３丁目１０－２国際基督教大学内,2017-06-01,その他
ランドリープライム合同会社,埼玉県さいたま市北区宮原町３丁目９０１番地１Ａ－９１４,2017-06-01,合同会社
リノフト株式会社,神奈川県横浜市港北区日吉３丁目５番９号幸コーポ１０２号室,2017-06-01,株式会社
リフォームアリスミ合同会社,神奈川県横浜市南区弘明寺町２７５番地,2017-06-01,合同会社
一土商事株式会社,東京都豊島区池袋３丁目４３番５号,2017-06-01,株式会社
一忠商事株式会社,奈良県桜井市大字西之宮２４５番地の１－２０２,2017-06-01,株式会社
一般社団法人あかつき心理・教育相談室,岐阜県岐阜市市橋１丁目１４番１５号グランフォーレ市橋２０３,2017-06-01,その他の設立登記法人
一般社団法人すでぃる,沖縄県中頭郡読谷村字都屋４３１番地,2017-06-01,その他の設立登記法人
一般社団法人エリーフ,兵庫県神戸市中央区中山手通２丁目１５番１３－８０２号,2017-06-01,その他の設立登記法人
一般社団法人グローバルチャレンジ,東京都港区赤坂２丁目２番２１号,2017-06-01,その他の設立登記法人
一般社団法人サンソラシステムズ,岐阜県美濃加茂市古井町下古井５１５番地,2017-06-01,その他の設立登記法人
一般社団法人ジャパンパートナーズストレッチ協会,東京都港区赤坂６丁目１８番１１号ストーリア赤坂１０３,2017-06-01,その他の設立登記法人
一般社団法人ジャパン・フードバンク・リンク,東京都中央区銀座６丁目６番１号,2017-06-01,その他の設立登記法人
一般社団法人ナリー振興,大阪府大阪市城東区関目５丁目２１番２６号,2017-06-01,その他の設立登記法人
一般社団法人五色ダイエット協会,愛知県半田市乙川源内林町１丁目１０番地の７,2017-06-01,その他の設立登記法人
一般社団法人在日忠清協会,東京都大田区南雪谷２丁目１１番２４号,2017-06-01,その他の設立登記法人
一般社団法人子ども教育科学創造研究所,東京都港区赤坂２丁目９番５号,2017-06-01,その他の設立登記法人
一般社団法人子育てファシリテーション協会,東京都品川区北品川１丁目９番７号トップルーム品川１０１５号,2017-06-01,その他の設立登記法人
一般社団法人広瀬町仲よし福祉ホーム保護者の会,岡山県岡山市北区広瀬町１０番９号,2017-06-01,その他の設立登記法人
一般社団法人教育環境デザイン研究所,神奈川県横浜市西区西戸部町１丁目９０番地３,2017-06-01,その他の設立登記法人
一般社団法人日本アセットマネジメント協会,東京都港区芝浦３丁目１５番５－３０２号,2017-06-01,その他の設立登記法人
一般社団法人日本ダイエットカウンセラー協会,東京都渋谷区広尾５丁目２３－５長谷部第一ビル１階,2017-06-01,その他の設立登記法人
一般社団法人日本ハーブテント協会,広島県東広島市西条西本町１２－１播磨ビル１Ｆ,2017-06-01,その他の設立登記法人
一般社団法人日本ピッチ＆パット協会,東京都中央区銀座８丁目１４番１２号銀座第一ビル２Ｆ,2017-06-01,その他の設立登記法人
一般社団法人日本フィットネスイノベーション協会,愛知県蒲郡市三谷北通５丁目１８２番地,2017-06-01,その他の設立登記法人
一般社団法人日本プリザーブドアーティスト協会,東京都港区六本木７丁目２０番５号ＫＡＺＵ六本木１Ｆ,2017-06-01,その他の設立登記法人
一般社団法人日本医療海外促進会,東京都新宿区西新宿３丁目７－１,2017-06-01,その他の設立登記法人
一般社団法人東京難病協会,東京都大田区雪谷大塚町２２番地１４号,2017-06-01,その他の設立登記法人
一般社団法人横浜駅西口バス乗降場管理協会,神奈川県座間市入谷５丁目１９５９番地,2017-06-01,その他の設立登記法人
一般社団法人ｓｉｎｃｅｒｅ,大阪府東大阪市今米１丁目６番１１号,2017-06-01,その他の設立登記法人
一般財団法人横浜シーガルトラスト,神奈川県横浜市中区山下町１９４番地,2017-06-01,その他の設立登記法人
三笠土地株式会社,奈良県磯城郡田原本町大字三笠１３番地の１,2017-06-01,株式会社
不動産バンク株式会社,東京都板橋区大谷口北町８６番９－２０１号,2017-06-01,株式会社
光起株式会社,鹿児島県霧島市横川町上ノ２８４３番地１０,2017-06-01,株式会社
別れさせ屋株式会社,東京都調布市仙川町１丁目９番地３９,2017-06-01,株式会社
北摂ビルド株式会社,大阪府大阪市淀川区十三東４丁目２番１５号,2017-06-01,株式会社
北部九州介護支援事業協同組合,大分県中津市大字永添２６３６番地１１４,2017-06-01,その他の設立登記法人
協立ホールディングス株式会社,愛知県名古屋市守山区幸心４丁目４３８番地,2017-06-01,株式会社
南口建設株式会社,大阪府松原市河合２丁目４３８番地の４,2017-06-01,株式会社
合同会社あゆみ,沖縄県那覇市おもろまち２丁目３番１８号,2017-06-01,合同会社
合同会社かねまつ,東京都墨田区亀沢３丁目２１番１０号,2017-06-01,合同会社
合同会社なおよし,沖縄県糸満市字糸満８０番地,2017-06-01,合同会社
合同会社なでなでぷろじぇくと,大分県大分市今津留１丁目６番４号,2017-06-01,合同会社
合同会社ひらめき開発部,東京都世田谷区梅丘１丁目１３番１２号３階,2017-06-01,合同会社
合同会社みさと,東京都中央区湊３丁目４番８号ウェルシャン築地２０２,2017-06-01,合同会社
合同会社インターライブジャパン,東京都千代田区三崎町２丁目２番６号三崎町石川ビル,2017-06-01,合同会社
合同会社エンテック,東京都北区西ケ原２丁目３７番１号,2017-06-01,合同会社
合同会社オフィスＭＡＴＴ,神奈川県横浜市神奈川区反町１丁目１０番地３パークハイツ反町１０４号,2017-06-01,合同会社
合同会社ガセイ,東京都港区赤坂２丁目２３番１号アークヒルズフロントタワーＲｏＰ７０１号室・ＳＵパートナーズ税理士法人内,2017-06-01,合同会社
合同会社キッズカンパニー,北海道札幌市中央区南八条西５丁目２８９－１９０グランヒル南８条壱番館１Ｆ,2017-06-01,合同会社
合同会社ケーユーコーポレーション,茨城県つくば市桜１丁目１５番８５,2017-06-01,合同会社
合同会社サンセル,沖縄県豊見城市字与根５７３番地６,2017-06-01,合同会社
合同会社サンビクト,東京都江戸川区江戸川３丁目３２番地１,2017-06-01,合同会社
合同会社ジョリーファーム,福井県大飯郡高浜町和田第５５号１０１番地,2017-06-01,合同会社
合同会社トダ,東京都文京区目白台２丁目１０－９－３０６,2017-06-01,合同会社
合同会社ドリームアセット,神奈川県川崎市宮前区犬蔵２丁目３９番１－２１５号,2017-06-01,合同会社
合同会社ニシオカテクノ,東京都文京区本郷２丁目１６番１２－４０１号,2017-06-01,合同会社
合同会社ピーワンダ,長野県茅野市湖東７７９０番地,2017-06-01,合同会社
合同会社フォーギブ,東京都西東京市東伏見５丁目６番２７号パールハイツ１０１号,2017-06-01,合同会社
合同会社フラットエステート,東京都千代田区二番町１番２号番町ハイム５１０,2017-06-01,合同会社
合同会社マザー,長崎県長崎市魚の町７番３－９０２,2017-06-01,合同会社
合同会社ムルグノン,神奈川県横浜市緑区三保町２０１４番地,2017-06-01,合同会社
合同会社リバーサプライ,神奈川県横浜市南区睦町１丁目２３番５号,2017-06-01,合同会社
合同会社元氣,秋田県秋田市新屋町字田尻沢１４８番地８,2017-06-01,合同会社
合同会社大洲１号,東京都港区白金２丁目５番１６－８０１号,2017-06-01,合同会社
合同会社天羽,静岡県浜松市南区三島町６７３番地の１イグドラシルⅢＢ棟１０２号室,2017-06-01,合同会社
合同会社岩崎会計,宮崎県都城市山之口町花木２１４４番地６,2017-06-01,合同会社
合同会社昊昌林協,島根県邑智郡邑南町市木５７５番地１,2017-06-01,合同会社
合同会社羽名香,福岡県福岡市南区曰佐２丁目１９番３４－２０２号,2017-06-01,合同会社
合同会社西井組,千葉県千葉市花見川区作新台８丁目１番２５号,2017-06-01,合同会社
合同会社質実,大阪府枚方市出口１丁目２－１２－４０７号,2017-06-01,合同会社
合同会社魚かつ,沖縄県那覇市久米２丁目１３番６号,2017-06-01,合同会社
合同会社ＡＺＣＡ,東京都港区三田５丁目２番１８号,2017-06-01,合同会社
合同会社Ａｖｅｎｔａ,茨城県古河市東山田２６１３,2017-06-01,合同会社
合同会社Ｄ＆Ｙ,東京都台東区竜泉３丁目３番８号,2017-06-01,合同会社
合同会社Ｇａｉｎ,東京都八王子市中野上町４丁目３７番１２号,2017-06-01,合同会社
合同会社ＩＮＧ,東京都杉並区堀ノ内３丁目１番２３号スペーシア高円寺１、４０３,2017-06-01,合同会社
合同会社Ｋスタジオ,山口県熊毛郡田布施町大字波野３３９番地１,2017-06-01,合同会社
合同会社ＫＭＪ,神奈川県横浜市西区高島２丁目１０－１３横浜東口ビル９１０号室,2017-06-01,合同会社
合同会社ＬＩＮＫ　ＵＰ,東京都八王子市鹿島８番地２,2017-06-01,合同会社
合同会社Ｌｉｎｋｃｅｅｄ　Ｃｏｒｐｏｒａｔｅ　Ｓｅｒｖｉｃｅｓ,兵庫県宝塚市山本台２丁目３番８号,2017-06-01,合同会社
合同会社ＭｉＫｉ２４,沖縄県南城市字つきしろ１６７８番地１１８,2017-06-01,合同会社
合同会社ＲＩＣ中心高楼,兵庫県神戸市東灘区向洋町中５丁目１５番地,2017-06-01,合同会社
合同会社ＳＴＡＲ　ＣＯＭＰＵＴＥＲＳ,埼玉県入間郡毛呂山町若山３丁目１１番３号フォレストⅢ１０５号室,2017-06-01,合同会社
合同会社Ｔ・Ｔ,埼玉県川口市北原台１丁目１２番２１号,2017-06-01,合同会社
合同会社ＴＴクリエーション,愛知県岡崎市中町字長狭間８番地７９,2017-06-01,合同会社
合同会社Ｕｐｔｏｎｅ,奈良県生駒市東新町４－２３第一ビル５０５,2017-06-01,合同会社
合同会社ｃｏｕｒａｇｅ,大阪府東大阪市今米１丁目６番１１号,2017-06-01,合同会社
合名会社義和,大阪府摂津市千里丘６丁目３番２４号,2017-06-01,合名会社
団地管理組合法人連取団地,群馬県伊勢崎市連取町４８９番地１９,2017-06-01,その他の設立登記法人
大分ほっぺリーフ株式会社,大分県大分市末広町１丁目５番１６号,2017-06-01,株式会社
大長産業開発株式会社,長崎県長崎市扇町２３番２号,2017-06-01,株式会社
姉妹都市提携４５周年記念バレエ公演実行委員会,静岡県浜松市中区佐鳴台６丁目７－３６,2017-06-01,その他
宝来合同会社,東京都千代田区内神田２丁目８－４,2017-06-01,合同会社
小推車日本株式会社,大阪府大阪市中央区千日前１丁目９番１２号,2017-06-01,株式会社
尾崎鉄鋼株式会社,福岡県田川郡福智町金田６５１番地,2017-06-01,株式会社
山口市地球温暖化対策地域協議会,山口県山口市大内御堀４９６番地,2017-06-01,その他
岡山市立旭東中学校教育後援会,岡山県岡山市東区大多羅町２７６番地,2017-06-01,その他
庄東工業株式会社,富山県砺波市八十歩３６番地,2017-06-01,株式会社
彩虹合同会社,東京都豊島区高田３丁目３－１６、２０７室,2017-06-01,合同会社
扇産業貿易株式会社,千葉県市川市新田５丁目４番１号,2017-06-01,株式会社
新寧株式会社,神奈川県横浜市磯子区磯子台１－１コスモ磯子台４０１,2017-06-01,株式会社
日本リムジン株式会社,東京都港区虎ノ門４丁目３－１城山トラストタワー２７Ｆ,2017-06-01,株式会社
晨日株式会社,東京都江戸川区東小岩４丁目３２番１６号２０３室,2017-06-01,株式会社
東盈株式会社,東京都足立区千住緑町１丁目２１番１０号－１０７室,2017-06-01,株式会社
松本左官工業株式会社,兵庫県加古川市尾上町長田２３９番地の１８,2017-06-01,株式会社
栄和リゾート株式会社,東京都港区浜松町２丁目１番１６号,2017-06-01,株式会社
株式会社いちびり,大阪府豊中市春日町３丁目１０番１６－２０２号,2017-06-01,株式会社
株式会社うまみグリーティングス,兵庫県芦屋市翠ケ丘町１５番１－１０１号,2017-06-01,株式会社
株式会社おとん,東京都北区赤羽西２丁目１４番２－５０１号,2017-06-01,株式会社
株式会社しょうえん,三重県津市大里睦合町１２１１番地,2017-06-01,株式会社
株式会社ぜろばこ,神奈川県横浜市都筑区中川２丁目９番１０,2017-06-01,株式会社
株式会社アイ・クエスト,東京都千代田区鍛冶町１丁目１０－６,2017-06-01,株式会社
株式会社アイ・セラミック・テクノロジー,東京都港区芝浦３丁目１４－５成友芝浦ビル７階,2017-06-01,株式会社
株式会社アイ・リレーション,兵庫県宝塚市仁川うぐいす台５番６号,2017-06-01,株式会社
株式会社アシスター,東京都港区南青山３丁目１０番４１号,2017-06-01,株式会社
株式会社アセントコンサルティング,東京都葛飾区西亀有１丁目２番１号,2017-06-01,株式会社
株式会社アトライズ,福岡県福岡市博多区空港前２丁目５番４０号,2017-06-01,株式会社
株式会社アロハスコーポレーション,北海道札幌市中央区北四条西３丁目１番地北海道建設会館２階,2017-06-01,株式会社
株式会社イソシア,東京都中央区銀座７丁目１５番８号タウンハイツ銀座４０６,2017-06-01,株式会社
株式会社イングラボ,大阪府大阪市西区新町３丁目８番１２号,2017-06-01,株式会社
株式会社インフィニティ,愛知県名古屋市西区牛島町６番１号,2017-06-01,株式会社
株式会社イン・ザ・ゾーン,東京都中央区日本橋小網町８番２号,2017-06-01,株式会社
株式会社イーゼット,茨城県坂東市大口５６４番地４,2017-06-01,株式会社
株式会社ウェブスパーク,東京都町田市旭町１丁目１９番３号,2017-06-01,株式会社
株式会社ウェルスクエア,東京都豊島区東池袋２丁目４９番１０号,2017-06-01,株式会社
株式会社ウエムラテック,埼玉県所沢市上新井４丁目６９番地の１７,2017-06-01,株式会社
株式会社ウーノラボ,東京都渋谷区千駄ヶ谷３丁目３番２３－３０３号,2017-06-01,株式会社
株式会社エネオール,佐賀県唐津市和多田大土井５番１５号,2017-06-01,株式会社
株式会社エムデン,愛知県名古屋市中村区太閤１丁目１０番６号,2017-06-01,株式会社
株式会社エルモード,愛知県稲沢市西町２丁目３６番３５号,2017-06-01,株式会社
株式会社エレサーチ電気保安管理,愛知県津島市唐臼町西島６１番地１,2017-06-01,株式会社
株式会社エンドレス・陽,茨城県鹿嶋市大字宮中７７０番地１,2017-06-01,株式会社
株式会社オオイシ,静岡県掛川市原里９８２番地の５,2017-06-01,株式会社
株式会社オリーブの丘,東京都港区港南２丁目１８番１号,2017-06-01,株式会社
株式会社オーバル商店,大分県大分市府内町２丁目３番２９号,2017-06-01,株式会社
株式会社カラーズ,大阪府大阪市浪速区難波中１丁目３番１７号,2017-06-01,株式会社
株式会社ガレージインク,大阪府大阪市西区新町１丁目３１番６号,2017-06-01,株式会社
株式会社キングディアジャパン,東京都千代田区鍛冶町１丁目１０番４号丸石ビルディング,2017-06-01,株式会社
株式会社ギア,東京都港区芝２丁目１７－２,2017-06-01,株式会社
株式会社グラウンド・トゥルース,福岡県福岡市早良区百道浜４丁目１番２号ネクサス百道Ｓ棟３０２,2017-06-01,株式会社
株式会社グランツリー,東京都港区芝公園２丁目６番１１－１１０４号,2017-06-01,株式会社
株式会社グリーンメープル,埼玉県三郷市早稲田２丁目１７番地１３早稲田ビル,2017-06-01,株式会社
株式会社グリーンレーベン,東京都町田市南大谷１６２８番地２９,2017-06-01,株式会社
株式会社グローバル,埼玉県川越市菅原町１８番地２,2017-06-01,株式会社
株式会社ケイ・シー・エス,神奈川県横浜市港南区最戸１丁目４番５号,2017-06-01,株式会社
株式会社コスモ６８,佐賀県西松浦郡有田町赤坂丙２９４３番地３,2017-06-01,株式会社
株式会社ゴールデンタイムＺ,東京都豊島区上池袋１丁目３９番１０号,2017-06-01,株式会社
株式会社サモーダインターナショナル,岡山県岡山市南区豊成１丁目１６番３号,2017-06-01,株式会社
株式会社サンハート,東京都墨田区東向島１丁目１７番８号,2017-06-01,株式会社
株式会社サン企画,栃木県塩谷郡高根沢町大字石末２０６３番地,2017-06-01,株式会社
株式会社シンプルハウス,福岡県北九州市八幡西区引野３丁目１７－１,2017-06-01,株式会社
株式会社ジェイ・アイ・シー,東京都新宿区下宮比町１番４号,2017-06-01,株式会社
株式会社ジャパンジョイントクラブ,東京都台東区東上野１丁目１３番１０号,2017-06-01,株式会社
株式会社タカエワールド,沖縄県国頭郡本部町字渡久地９１番地１,2017-06-01,株式会社
株式会社タックリアルエステート,東京都渋谷区渋谷２丁目５番１２－４０３号,2017-06-01,株式会社
株式会社ダリジャパン,東京都港区西新橋１丁目１２番６号,2017-06-01,株式会社
株式会社ティーアンドエー,埼玉県所沢市美原町２丁目２９５４番地の７,2017-06-01,株式会社
株式会社ティースリー,東京都渋谷区千駄ヶ谷５丁目１４番１０号新宿明治通りビル,2017-06-01,株式会社
株式会社ティーズエンジニアリング,埼玉県三郷市上口１丁目１６６－８,2017-06-01,株式会社
株式会社トラスト・ホールディングス,愛知県名古屋市中区錦１丁目４番１６号,2017-06-01,株式会社
株式会社ナニワエキスプレス,大阪府大阪市西淀川区佃４丁目１２番１号,2017-06-01,株式会社
株式会社ネクストステージ,福島県いわき市中央台高久３丁目３６番地の７,2017-06-01,株式会社
株式会社ハロハロ,東京都港区浜松町２丁目１番１６号ＳＶＡＸ浜松町Ⅱビル２階,2017-06-01,株式会社
株式会社パットドゥラパン,東京都港区南青山２丁目２２番１４－１２０８号,2017-06-01,株式会社
株式会社パートナーズタシロ,栃木県塩谷郡高根沢町大字石末２０６３番地,2017-06-01,株式会社
株式会社ビアフェスタ,東京都目黒区柿の木坂１丁目２０番１７号－１０４,2017-06-01,株式会社
株式会社ビアマレダイビングサービス,神奈川県横須賀市久里浜５丁目４番３号,2017-06-01,株式会社
株式会社ビジネスサポート・マインズ,沖縄県浦添市牧港１丁目２６番１号,2017-06-01,株式会社
株式会社ビジネスパートナー,東京都台東区西浅草２丁目１３番１１―１１０４号,2017-06-01,株式会社
株式会社ビットアルゴ取引所東京,東京都渋谷区千駄ヶ谷１丁目３番２号,2017-06-01,株式会社
株式会社ビューン,東京都江東区青海２丁目７－４,2017-06-01,株式会社
株式会社ビルホーム,神奈川県相模原市南区麻溝台３１２３番地１,2017-06-01,株式会社
株式会社ファースト,大阪府豊中市曽根南町１丁目８番１５号,2017-06-01,株式会社
株式会社フォーリア,栃木県宇都宮市下栗町６７６番地６,2017-06-01,株式会社
株式会社フジウエル,大阪府堺市西区上野芝向ヶ丘町３丁１１番１７号,2017-06-01,株式会社
株式会社ブーム,東京都港区芝３丁目８番２号,2017-06-01,株式会社
株式会社プラザワンカンパニー,東京都杉並区浜田山３丁目３２番６号,2017-06-01,株式会社
株式会社プロイズム,北海道登別市登別東町２丁目１５番２４,2017-06-01,株式会社
株式会社プロード,北海道千歳市末広４丁目３番３号アルファコート末広１階,2017-06-01,株式会社
株式会社ベクトル,宮城県宮城郡利府町神谷沢字南沢１番地２６９,2017-06-01,株式会社
株式会社マサキ,東京都台東区鳥越１丁目１番５号,2017-06-01,株式会社
株式会社マナネット,東京都昭島市田中町３丁目１０番１３号,2017-06-01,株式会社
株式会社ミタックス,大阪府大阪市天王寺区東高津町１２番１６号プレア上六ビル７Ｆ,2017-06-01,株式会社
株式会社メゾン,東京都渋谷区上原１丁目３８番８号ＳＤ代々木上原ビルＧＦ,2017-06-01,株式会社
