法人名,住所,設立日,法人種別
株式会社楓工業,大分県大分市青崎１丁目１３番２６号,2017-04-14,株式会社
株式会社正和商事,神奈川県横浜市中区寿町３丁目１１番３号,2017-04-14,株式会社
株式会社武石林業,秋田県北秋田郡上小阿仁村仏社字杉ノ下４１番地３,2017-04-14,株式会社
株式会社水野建材,岐阜県多治見市明和町５丁目６２番地の１１,2017-04-14,株式会社
株式会社浅野企画,大阪府大阪市大正区泉尾３丁目１４番２号,2017-04-14,株式会社
株式会社海老澤,東京都世田谷区宇奈根２丁目１１番３２号,2017-04-14,株式会社
株式会社清皓,愛媛県新居浜市菊本町１丁目４番３０号,2017-04-14,株式会社
株式会社渡辺住設,兵庫県高砂市時光寺町３１番８号,2017-04-14,株式会社
株式会社湊陽,鹿児島県鹿屋市川西町４０６８番地２,2017-04-14,株式会社
株式会社瀧澤電設,福島県いわき市小名浜字鳥居北９９番地９,2017-04-14,株式会社
株式会社田中土建,東京都八王子市上柚木１０４１番地１１,2017-04-14,株式会社
株式会社田中総建,青森県五所川原市金木町沢部２４６番地３,2017-04-14,株式会社
株式会社田中電装,神奈川県横浜市港南区上大岡東２丁目４３番２２号,2017-04-14,株式会社
株式会社田原建工,埼玉県三郷市南蓮沼７５６番地３,2017-04-14,株式会社
株式会社男設,福岡県久留米市山川安居野３丁目７番２５号,2017-04-14,株式会社
株式会社白尾塗装興業,鹿児島県薩摩川内市樋脇町市比野２５６１番地１２,2017-04-14,株式会社
株式会社皓元国際商社,東京都台東区浅草橋３丁目６番２号,2017-04-14,株式会社
株式会社真和テック,大阪府茨木市小柳町１４番１０号,2017-04-14,株式会社
株式会社睦企画,福島県須賀川市森宿字辰根沢５２番地１０,2017-04-14,株式会社
株式会社石川工業,大阪府守口市菊水通３丁目３番１３号,2017-04-14,株式会社
株式会社石田工業,広島県広島市安佐南区相田４丁目８番３６－６号,2017-04-14,株式会社
株式会社神崎興業,東京都八王子市新町５番１６号,2017-04-14,株式会社
株式会社神野農園,愛媛県新居浜市郷１丁目１番４５号,2017-04-14,株式会社
株式会社神﨑商会,大阪府豊中市上新田１丁目２４番Ｂ－１１１号,2017-04-14,株式会社
株式会社竜山計装,埼玉県春日部市下蛭田３９番地４エクレール豊春Ⅲ－３１１号,2017-04-14,株式会社
株式会社筑水工業,福岡県久留米市城島町六町原３５１番地２,2017-04-14,株式会社
株式会社米八グループ,東京都武蔵野市境南町１丁目２４番８号,2017-04-14,株式会社
株式会社米沢建築,秋田県北秋田市綴子字糠沢下タ５５番地,2017-04-14,株式会社
株式会社紺碧,京都府相楽郡精華町大字下狛小字浄楽７２番地７,2017-04-14,株式会社
株式会社結,福井県あわら市舟津第４８号１６番地１,2017-04-14,株式会社
株式会社結の樹,愛知県長久手市片平１丁目１００９番地,2017-04-14,株式会社
株式会社緒方工業,山口県宇部市恩田町２丁目１番１０－１０１号,2017-04-14,株式会社
株式会社翔栄エレック,東京都新宿区原町１丁目１８番地松永ビル６階,2017-04-14,株式会社
株式会社臼田設備,東京都板橋区蓮根３丁目２６番２５－２０２号,2017-04-14,株式会社
株式会社興譲館,大分県玖珠郡九重町大字町田３６４２番地,2017-04-14,株式会社
株式会社西会計,神奈川県鎌倉市大船１丁目２３－１６サンワード大船５０４号室,2017-04-14,株式会社
株式会社西浦興業,大阪府和泉市観音寺町２４９番地の１７,2017-04-14,株式会社
株式会社西野ファーム,鹿児島県大島郡喜界町大字志戸桶４６０２番地,2017-04-14,株式会社
株式会社諒平,神奈川県横浜市都筑区中川中央１丁目７番１３号－１０階,2017-04-14,株式会社
株式会社諸井醸造企画,秋田県秋田市新屋松美ガ丘南町５番２５号,2017-04-14,株式会社
株式会社豆牛農園,兵庫県丹波市山南町畑内５１９番地３,2017-04-14,株式会社
株式会社輝建,岐阜県岐阜市芥見長山３丁目４３番地３,2017-04-14,株式会社
株式会社輝竜プロジェクト,東京都小平市小川町２丁目１３２６番地の７ウィステリアアベニュー３０６号,2017-04-14,株式会社
株式会社辰野発電所,岐阜県高山市花岡町１丁目７番地５,2017-04-14,株式会社
株式会社農地所有適格法人ＳＨＯＫＩ,滋賀県甲賀市甲賀町大原中１１１７番地２,2017-04-14,株式会社
株式会社辻建具,岐阜県岐阜市則武東１丁目１１番５号,2017-04-14,株式会社
株式会社酒井組,和歌山県有田市古江見１４９番地１,2017-04-14,株式会社
株式会社野村商店,愛知県春日井市高山町３丁目１０番地６,2017-04-14,株式会社
株式会社野村建設工業,京都府京都市西京区大枝塚原町４－２８－３１５,2017-04-14,株式会社
株式会社金子工業,北海道旭川市東光二十条８丁目１番３１号,2017-04-14,株式会社
株式会社鈴木工業,神奈川県川崎市川崎区中島１丁目１５－５フルール２－１０１,2017-04-14,株式会社
株式会社鈴村塗装,東京都足立区扇３丁目１５番６号,2017-04-14,株式会社
株式会社長谷工開発,東京都港区芝２丁目３１番１９号,2017-04-14,株式会社
株式会社長谷部工業,秋田県大館市字松館５９番地１３,2017-04-14,株式会社
株式会社阿部鉄工,北海道苫小牧市字勇払１５７番地１０,2017-04-14,株式会社
株式会社陸星工業,愛知県安城市古井町金蔵塚５番地１,2017-04-14,株式会社
株式会社須加﨑技建,福岡県中間市長津２丁目１４番６号,2017-04-14,株式会社
株式会社飛騨林産,東京都八王子市西寺方町４５５番地１イーハトーヴ２０１号,2017-04-14,株式会社
株式会社飯野紙業,東京都中央区日本橋浜町３丁目４３番１０号,2017-04-14,株式会社
株式会社高浜建装,大分県大分市西鶴崎１丁目４番１６号,2017-04-14,株式会社
株式会社鮨はこ,北海道函館市若松町９番１５号,2017-04-14,株式会社
株式会社鳥海トライブ,秋田県由利本荘市東町８９番地,2017-04-14,株式会社
株式会社龍鑫,群馬県太田市大原町２１７４番地４６,2017-04-14,株式会社
株式会社６２２,東京都小金井市東町１丁目１５番３号,2017-04-14,株式会社
株式会社ＡＧＧＡＤＡ,東京都世田谷区代田５丁目３５番２１号パシフィックパレス下北沢１０４,2017-04-14,株式会社
株式会社ＡＮＤ　ＢＩＺ,東京都千代田区麹町６丁目２番６号ユニ麹町ビル４Ｆ,2017-04-14,株式会社
株式会社ＡＯ,東京都千代田区外神田５丁目３番８号,2017-04-14,株式会社
株式会社ＡＲＪ,沖縄県沖縄市泡瀬１丁目４０番２６号,2017-04-14,株式会社
株式会社ＡＸＡ,埼玉県さいたま市見沼区東大宮４丁目２３番地２－１０５,2017-04-14,株式会社
株式会社ＡｔｌｉＬ,北海道旭川市豊岡八条３丁目２番１８号豊岡Ｋビル,2017-04-14,株式会社
株式会社ＢＡＩＧ　ＴＲＡＤＩＮＧ,茨城県古河市茶屋新田１４２番地１０,2017-04-14,株式会社
株式会社ＢＥＬＬＳ,東京都目黒区下目黒２丁目９番２－１０１６号,2017-04-14,株式会社
株式会社ＢＨＧ,高知県高知市北川添５番２０－８０１号,2017-04-14,株式会社
株式会社ＢＯＮＤＣＬＵＢ,東京都足立区梅田４丁目３９番２６号,2017-04-14,株式会社
株式会社Ｂａｎａｎａ　Ｍｏｏｎ,愛知県名古屋市西区新道１丁目１２番３２号,2017-04-14,株式会社
株式会社Ｂｅ　ｃｒｏｓｓ,東京都渋谷区神宮前１丁目１番１号,2017-04-14,株式会社
株式会社Ｂｌｏｗ,東京都葛飾区西水元３丁目２６番２１号,2017-04-14,株式会社
株式会社Ｃ’ｅａｓｏｎ,東京都台東区蔵前２丁目９番１１号,2017-04-14,株式会社
株式会社ＣＲＡＦＴ,岐阜県羽島郡岐南町野中３丁目１８番地２０６,2017-04-14,株式会社
株式会社Ｃａｖａｌｌｏ,愛知県名古屋市守山区西川原町２７番地宝新守山ハイツ２０５号,2017-04-14,株式会社
株式会社Ｃｒｅａｔｉｖｅ　Ｃａｐｉｔａｌｉｓｍ　Ｊａｐａｎ,東京都渋谷区桜丘町２９番２４号秀和桜丘レジデンス５０２,2017-04-14,株式会社
株式会社Ｄ－ＣＲＡＦＴ,長野県安曇野市明科光６２１番地,2017-04-14,株式会社
株式会社Ｄ－Ｃｏｍｍｕｎｉｔｙ,東京都渋谷区初台１丁目３８番１０－３０２号,2017-04-14,株式会社
株式会社ＤＡＲＡ　ＤＡ　ＭＯＮＤＥ,静岡県静岡市葵区研屋町２５第二金座ビルボタニカ４０３号,2017-04-14,株式会社
株式会社ＤＡＹＳ＆Ｃｏｍｐａｎｙ,東京都府中市八幡町２丁目４番地の１７,2017-04-14,株式会社
株式会社Ｄｏｕｂｌｅ　Ｒ,東京都目黒区下目黒３丁目６番３－１２０３号パークリュクス目黒,2017-04-14,株式会社
株式会社ＦＡＴＩＭＡ　ＪＡＰＡＮ,東京都渋谷区神宮前１丁目９番８号,2017-04-14,株式会社
株式会社Ｆｉｒｓｔ　Ｃｌａｓｓ,愛知県名古屋市中村区竹橋町１１番１５号アークポイント５０１号,2017-04-14,株式会社
株式会社Ｆｕｋｕｏｋａ,大阪府大阪市生野区勝山北４丁目１番３１号,2017-04-14,株式会社
株式会社Ｇ　Ｃｒｅａｔｏｒｓ,東京都世田谷区駒沢１丁目２番２７号,2017-04-14,株式会社
株式会社Ｇ－ＨＡＷＫ,神奈川県横浜市神奈川区鶴屋町２丁目２３番８号フロンティアビル７階,2017-04-14,株式会社
株式会社ＧＥＬＤ,東京都台東区根岸４丁目１３番２３号,2017-04-14,株式会社
株式会社ＧＩＮＯ,東京都杉並区梅里１丁目１８番１２－１０２号,2017-04-14,株式会社
株式会社ＧＬＡＮｄ,東京都渋谷区渋谷１丁目７番５号青山セブンハイツ８０６,2017-04-14,株式会社
株式会社ＧＲＥＥＮ,東京都世田谷区代田４丁目１０番２４号フロント新代田３０１,2017-04-14,株式会社
株式会社Ｇｅｍｉｎｉ,神奈川県藤沢市鵠沼橘１丁目４番７号,2017-04-14,株式会社
株式会社Ｈ２エキスプレス,兵庫県小野市神明町１９９番地の５,2017-04-14,株式会社
株式会社ＨＡＷＯＲＤ,群馬県前橋市六供町１０３０番地,2017-04-14,株式会社
株式会社ＨＩＴＯＢＩＴＯ,大阪府泉北郡忠岡町忠岡東１丁目２５番８号,2017-04-14,株式会社
株式会社ＨＯＲＩＤＥＮ,愛知県名古屋市中川区下之一色町字松蔭２丁目２４番地５,2017-04-14,株式会社
株式会社ＪＱＣ,東京都港区海岸３丁目２６番１号,2017-04-14,株式会社
株式会社Ｊｕｍｅａｌ,埼玉県さいたま市北区宮原町３丁目３３７番地１山崎ビル１階,2017-04-14,株式会社
株式会社Ｋ’ｓ　Ｌａｂ,東京都千代田区富士見２丁目１３番１２号,2017-04-14,株式会社
株式会社Ｋ－ｓｔｙｌｅ,宮城県仙台市宮城野区安養寺１丁目３６番５号１０２,2017-04-14,株式会社
株式会社ＫＡＮＡＩ,香川県三豊市三野町大見甲６８番地４,2017-04-14,株式会社
株式会社ＫＩＨＯＫＵ　ＹＵＺＵ,愛媛県北宇和郡鬼北町大字近永１０２２番地,2017-04-14,株式会社
株式会社ＫＯＺＯ,兵庫県姫路市飾磨区阿成植木１００３番地２Ｆ,2017-04-14,株式会社
株式会社ＫｉｎＫｅｎ　Ｂｒｏｔｈｅｒｓ,東京都港区南青山４丁目９番６号,2017-04-14,株式会社
株式会社Ｌｉｎｋ,宮城県栗原市志波姫北郷竹の内９８番地１,2017-04-14,株式会社
株式会社Ｍ・ＣＯＲＰＯＲＡＴＩＯＮ,東京都世田谷区太子堂２丁目６番３１号,2017-04-14,株式会社
株式会社Ｍ＆Ｋグループ,栃木県宇都宮市雀の宮７丁目１１番５号,2017-04-14,株式会社
株式会社Ｍ＆Ｍ,群馬県桐生市美原町４番７号,2017-04-14,株式会社
株式会社Ｍ＆Ｙ,千葉県船橋市前貝塚町５６４番地２,2017-04-14,株式会社
株式会社ＭＤＦトラスト,広島県広島市安佐北区深川６丁目７番１４号,2017-04-14,株式会社
株式会社ＭＧ立川,東京都中央区日本橋横山町７番１８号,2017-04-14,株式会社
株式会社ＭＨＣパートナー,三重県伊賀市西明寺２２２５番地の２,2017-04-14,株式会社
株式会社ＭＪＷ,和歌山県紀の川市東野７０－１,2017-04-14,株式会社
株式会社ＭＲＪ,東京都稲城市東長沼３２１番地の５ハイムマンドリン１０６,2017-04-14,株式会社
株式会社ＭＴ７７,愛知県名古屋市中川区長須賀２丁目１８０２番地,2017-04-14,株式会社
株式会社Ｍａｔｓｕｏｋａ,兵庫県加古川市尾上町池田６２４番地の８０,2017-04-14,株式会社
株式会社Ｍｕｔ,愛知県名古屋市名東区貴船２丁目２２０１番地,2017-04-14,株式会社
株式会社ＮＥＷ　ＨＯＰＥ,東京都武蔵野市吉祥寺本町２丁目６番２号,2017-04-14,株式会社
株式会社ＮＳＰホールディングス,東京都中野区東中野３丁目１８番１２号,2017-04-14,株式会社
株式会社Ｎａ－Ｌａｂ,東京都港区西麻布１丁目１４番１号井門西麻布ビル５階,2017-04-14,株式会社
株式会社Ｏ嬢インターナショナル,神奈川県大和市つきみ野５丁目１５番地リーデンスつきみ野シエルコート５０２,2017-04-14,株式会社
株式会社ＯＢＴＵＳＥ,神奈川県川崎市中原区苅宿４２番１８号,2017-04-14,株式会社
株式会社ＯＤソリューションズ,東京都中央区日本橋箱崎町１３－８－８０１,2017-04-14,株式会社
株式会社Ｐａｔｃｈ,東京都豊島区東池袋１丁目２５番８号,2017-04-14,株式会社
株式会社ＰｏｎｄＲｉｖｅｒ,東京都調布市深大寺北町５丁目３８番地６－Ｂ号,2017-04-14,株式会社
株式会社Ｐｒｏｇｒｅｓｓコーポレーション,岡山県倉敷市船穂町船穂１３３６番地９,2017-04-14,株式会社
株式会社Ｒ－ｗｅｅｄ,埼玉県富士見市大字東大久保２３番地２,2017-04-14,株式会社
株式会社ＲＥＧＮＯ,大阪府大阪市生野区巽東２丁目７番１１号,2017-04-14,株式会社
株式会社ＲＩＮＤＯ,東京都豊島区池袋１丁目１番３号豊ビル４階Ａ号室,2017-04-14,株式会社
株式会社ＲＷＹ１２,千葉県船橋市市場４丁目１８番７号,2017-04-14,株式会社
株式会社Ｓ－ｐａｌｅｔｔｅ,東京都荒川区西日暮里２丁目２６－６ツカハラビル４０２,2017-04-14,株式会社
株式会社Ｓ．Ｆ　ＪＡＰＡＮ,東京都新宿区西新宿６丁目１２番１６号,2017-04-14,株式会社
株式会社ＳＡＮＤＳ,兵庫県宝塚市清荒神４丁目２１番３号,2017-04-14,株式会社
株式会社ＳＤＨ,福島県郡山市方八町２丁目５番１６号ＮＯＶＡ東口ビル１Ｆ,2017-04-14,株式会社
株式会社ＳＥＩＫＯ,兵庫県加古川市尾上町養田１４６０番地の１３,2017-04-14,株式会社
株式会社ＳＥＶＥＮ７Ｂ　Ｇｒｏｕｐ,茨城県古河市三杉町１丁目１－３５,2017-04-14,株式会社
株式会社ＳＩＦ,愛知県名古屋市北区若葉通５丁目１７番地ＩＴＯＨ壱番館７０４号,2017-04-14,株式会社
株式会社ＳＫメンテナンス,東京都品川区小山５丁目１６番５号,2017-04-14,株式会社
株式会社ＳＫライズ,大分県大分市牧上町１３番１８号プレステージⅢ１０２,2017-04-14,株式会社
株式会社ＳＫＣ,兵庫県淡路市釜口２２５７番地,2017-04-14,株式会社
株式会社ＳＳＭＫ,兵庫県神戸市灘区中郷町４丁目１番１５号,2017-04-14,株式会社
株式会社ＳＵＮＤＡＹ　ＩＳＳＵＥ,東京都渋谷区神宮前６丁目３３番１１号,2017-04-14,株式会社
株式会社Ｓｃｒａｔｃｈ,東京都目黒区三田１丁目４番４－２７０７号,2017-04-14,株式会社
株式会社Ｓｈｉｎ,宮崎県宮崎市清武町正手３丁目２２番３号,2017-04-14,株式会社
株式会社Ｓｋｙｌｅｒ,東京都西東京市東町５丁目１番５号,2017-04-14,株式会社
株式会社ＳｕｎＰｉｎｅ,愛知県江南市田代町郷中１５３番地,2017-04-14,株式会社
株式会社Ｔ’ｚ　ＦＡＣＴＯＲＹ,栃木県日光市今市７１７番地,2017-04-14,株式会社
株式会社ＴＨＲＥＥ　Ｈ,広島県広島市東区福田５丁目１８０９番地９,2017-04-14,株式会社
株式会社ＴＨＲＩＶＥ,神奈川県横浜市栄区鍛冶ケ谷２丁目４１番２号,2017-04-14,株式会社
株式会社ＴＩＧ,広島県広島市中区堀川町１番７－２０２号,2017-04-14,株式会社
株式会社ＴＫＫ,岐阜県各務原市鵜沼三ツ池町４丁目２１４番地１,2017-04-14,株式会社
株式会社ＴＭ・ＦＡＣＴＯＲＹ,京都府京都市伏見区久我西出町１４番地８４,2017-04-14,株式会社
株式会社ＴＯＶＨＯ,熊本県熊本市中央区下通２丁目１番２０号,2017-04-14,株式会社
株式会社ＴＲＡＩＳＥ,愛知県名古屋市名東区藤里町２２０６番地,2017-04-14,株式会社
株式会社ＴＳＣ,神奈川県厚木市元町１８番２１号レジデンス白鳥１－Ｂ,2017-04-14,株式会社
株式会社ＵＤＮマーケティング,東京都大田区南馬込２丁目２７番３号,2017-04-14,株式会社
株式会社ＵＳＡ,東京都小平市花小金井７丁目６－１ルネ花小金井１２９,2017-04-14,株式会社
株式会社ＶＩＦＡ,東京都足立区扇１丁目１１番２３号,2017-04-14,株式会社
株式会社ＷＩＫＥＮＪＩ,東京都新宿区歌舞伎町２丁目３番２１－８０３号,2017-04-14,株式会社
株式会社Ｙ－ｆｒｏｎｔｉｅｒ,東京都目黒区青葉台３丁目１番１１号ハイパールマンション５０１号室,2017-04-14,株式会社
株式会社ＹＭＯ,東京都渋谷区代々木５丁目１５番１０－５０２号,2017-04-14,株式会社
株式会社ＹＯＵ,岐阜県瑞穂市生津外宮東町１丁目３４番地２、２階,2017-04-14,株式会社
株式会社ＹＵＭＡ,東京都台東区上野６丁目８番１９号小野田ビル２０１号,2017-04-14,株式会社
株式会社ａｎｙｉｔ,静岡県熱海市上多賀１６６番地の１,2017-04-14,株式会社
株式会社ｂｏｕｌａｎｇｅｒｉｅ　ｏｎｎｉ,神奈川県横浜市港南区上大岡西３丁目１０番１号,2017-04-14,株式会社
株式会社ｅｍｉ・ｇａｒｄｅｎ,茨城県牛久市田宮２丁目２７番地６,2017-04-14,株式会社
株式会社ｅｓｈｉｎ,埼玉県さいたま市浦和区上木崎１丁目４番１０,2017-04-14,株式会社
株式会社ｇａｎｂｏ,東京都練馬区高松５丁目２０番４号ＢＬＤ．ＮＩＭＯレジデンス７０１,2017-04-14,株式会社
株式会社ｉ－Ｌｉｆｅ,愛知県小牧市大字久保一色９番地１,2017-04-14,株式会社
株式会社ｉｅｒｏ,神奈川県横浜市都筑区茅ケ崎中央２９番８号ＲａｙｇｒａｎｄｅⅡ２０１,2017-04-14,株式会社
株式会社ｋｎｏｃｋｓ,兵庫県神戸市中央区栄町通２丁目１０番４号,2017-04-14,株式会社
株式会社ｌｅａｆ　ｄｅｓｉｇｎ,東京都千代田区九段南１丁目５番６号りそな九段ビル５階ＫＳフロア,2017-04-14,株式会社
株式会社ｍｉｙａｋｅ,愛媛県新居浜市八幡１丁目６番１３号,2017-04-14,株式会社
株式会社ｏｎｅｘ７,愛媛県松山市美沢１丁目８番５１号,2017-04-14,株式会社
桑原美装株式会社,大阪府岸和田市並松町２６番５号,2017-04-14,株式会社
橋本物流株式会社,大阪府泉佐野市高松北２丁目３番２７－１０７号,2017-04-14,株式会社
櫻興業株式会社,福島県福島市宮下町１１番２２号,2017-04-14,株式会社
正木ストーンテック株式会社,岐阜県大垣市室本町２丁目５７番地１,2017-04-14,株式会社
永峰合同会社,東京都江東区木場５丁目１番５号,2017-04-14,合同会社
清水住設株式会社,京都府宇治市大久保町田原３６－１－９０１,2017-04-14,株式会社
特定非営利活動法人わかもの就労ネットワーク,東京都三鷹市下連雀１丁目１４番３号,2017-04-14,その他の設立登記法人
特定非営利活動法人シニア道場樂,石川県金沢市三馬２丁目２９２,2017-04-14,その他の設立登記法人
特定非営利活動法人スポーツクラブＭ．Ｋ．ＯＲＩ－ＧＯ,石川県加賀市大聖寺八間道６５番地　２Ｆ,2017-04-14,その他の設立登記法人
特定非営利活動法人ワネッツ,福井県小浜市四谷町９番２２号,2017-04-14,その他の設立登記法人
特定非営利活動法人労働教育相談センター,東京都豊島区南大塚２丁目３３番１０号東京労働会館５階,2017-04-14,その他の設立登記法人
特定非営利活動法人堂崎の環境を守る会,長崎県西彼杵郡長与町岡郷３０１６番地２堂崎公民館内,2017-04-14,その他の設立登記法人
特定非営利活動法人富士の緑を育てる会,山梨県富士吉田市大明見３丁目４番２２号,2017-04-14,その他の設立登記法人
特定非営利活動法人草木谷を守る会,秋田県潟上市昭和豊川山田字上屋敷下４６,2017-04-14,その他の設立登記法人
産経熊取販売株式会社,大阪府泉南郡熊取町五門東２丁目２番３４号,2017-04-14,株式会社
田中工建ホールディングス株式会社,福岡県筑後市大字蔵数６４４番地の１０,2017-04-14,株式会社
盛源国際株式会社,大阪府大阪市生野区新今里１丁目１１番１９－１０６号,2017-04-14,株式会社
盛翔商事株式会社,大阪府大阪市北区末広町３番２１号,2017-04-14,株式会社
石川会計税務合同会社,東京都台東区浅草橋５丁目１１番５－３０２号,2017-04-14,合同会社
石橋製作所株式会社,山梨県南アルプス市戸田２５０番地４,2017-04-14,株式会社
社会保険労務士法人ときわ経営労務,静岡県浜松市中区常盤町１３２番地の１３,2017-04-14,その他の設立登記法人
社会保険労務士法人中部労務センター,静岡県島田市中央町３０番１５号,2017-04-14,その他の設立登記法人
社会保険労務士法人田方労務事務所,静岡県伊豆の国市韮山土手和田１４番地の１４,2017-04-14,その他の設立登記法人
社会保険労務士法人ＫＲＪ,東京都江戸川区西小岩１丁目２１番２０号６階,2017-04-14,その他の設立登記法人
社会福祉法人つくし福祉会,福岡県大野城市乙金３丁目１８番１０号,2017-04-14,その他の設立登記法人
社会福祉法人結絆の会,北海道函館市亀田町２２番１４号,2017-04-14,その他の設立登記法人
秀永工業株式会社,茨城県石岡市府中５丁目９番１６号,2017-04-14,株式会社
稲岡建設株式会社,大阪府八尾市南木の本２丁目７７番の３９,2017-04-14,株式会社
篠本商事株式会社,東京都調布市小島町１丁目３０番地１,2017-04-14,株式会社
糸井ホールディングス株式会社,群馬県高崎市上大類町３９９番地２,2017-04-14,株式会社
綾川クレーン株式会社,香川県綾歌郡綾川町萱原６５番地１４,2017-04-14,株式会社
美里商行株式会社,大阪府貝塚市畠中２丁目１３番４２号,2017-04-14,株式会社
群馬ＳＫ不動産合同会社,群馬県前橋市若宮町２丁目２番１９号,2017-04-14,合同会社
聖鉄工株式会社,熊本県宇土市立岡町８１８番地,2017-04-14,株式会社
聚興合同会社,愛知県知多郡美浜町新浦戸１丁目１２番地１７,2017-04-14,合同会社
職人みらい工房株式会社,静岡県浜松市南区三島町６９８番地の１Ｎ１０３号,2017-04-14,株式会社
興栄開発株式会社,福岡県北九州市八幡西区茶屋の原１丁目１番８号,2017-04-14,株式会社
苗木学童保育所　すみれ組,岐阜県中津川市苗木２０８３,2017-04-14,その他
英孝工業株式会社,神奈川県横浜市鶴見区潮田町１丁目４３番地,2017-04-14,株式会社
薭田野家合同会社,京都府亀岡市薭田野町太田高星２１番地１,2017-04-14,合同会社
西陣株式会社,長崎県長崎市田中町１０８１番地１,2017-04-14,株式会社
谷口林業株式会社,兵庫県洲本市鮎屋６２６番地,2017-04-14,株式会社
車両商会株式会社,神奈川県綾瀬市寺尾西１丁目１０番１３－Ｃ２０２号,2017-04-14,株式会社
