法人名,住所,設立日,法人種別
行政書士法人トゥットファーレ,神奈川県横浜市中区元浜町３丁目２１番２号,2026-05-22,その他の設立登記法人
金融コンプライアンス・アドバイザリー合同会社,神奈川県横浜市青葉区大場町３８５番地４５,2026-05-22,合同会社
ＧＡＬＴ株式会社,神奈川県大和市上草柳３丁目１９番２３号クレア大和１０２,2026-05-22,株式会社
ＪＬパワー株式会社,神奈川県足柄下郡湯河原町城堀９０番地１,2026-05-22,株式会社
ＭＩＴＳＵエナジーキャピタル合同会社,神奈川県横浜市西区みなとみらい２丁目２番１号ランドマークプラザ５階,2026-05-22,合同会社
ＰＡＲＫ　ＳＩＤＥ税理士法人,神奈川県横浜市中区常盤町１丁目２番地１－８階Ａ１号室,2026-05-22,その他の設立登記法人
ＹＵＪＴ株式会社,神奈川県横浜市緑区鴨居町８３６番地６第５峰ハイツ２０２,2026-05-22,株式会社
テンナイン株式会社,新潟県十日町市千歳町２丁目１番地１７パークサイドチトセ１－Ｃ,2026-05-22,株式会社
株式会社輝,新潟県長岡市水道町３丁目４番１５号,2026-05-22,株式会社
Ｃｕｂｅ合同会社,新潟県妙高市大字田口１４５８番地４,2026-05-22,合同会社
宏源株式会社,富山県高岡市十二町島５３,2026-05-22,株式会社
株式会社芳維建設,富山県富山市上冨居新町９－１０,2026-05-22,株式会社
エフプラン株式会社,石川県羽咋郡志賀町矢蔵谷ムの１番地７１,2026-05-22,株式会社
株式会社ＫＩＴＥ,石川県金沢市香林坊２丁目１－１－２Ｆ,2026-05-22,株式会社
株式会社Ｏｆｆｉｃｅ　Ｊ,福井県三方上中郡若狭町南第９号１７番地,2026-05-22,株式会社
株式会社Ｓｕｎｆｉｅｌｄ,福井県鯖江市落井町第３１号４番地１３,2026-05-22,株式会社
ＳＩラビアン合同会社,福井県福井市二の宮４丁目１１番２２号,2026-05-22,合同会社
ダイヤモンド悠株式会社,山梨県南都留郡富士河口湖町大石２１５３番地４,2026-05-22,株式会社
合同会社ぼんちすいっち,山梨県中巨摩郡昭和町西条新田５１２番地３,2026-05-22,合同会社
株式会社三珠工業,山梨県中央市大田和１９６７番地１２,2026-05-22,株式会社
株式会社不二園,山梨県甲府市城東４丁目１３番３号,2026-05-22,株式会社
甲州街道株式会社,山梨県北杜市須玉町若神子４０１０番地,2026-05-22,株式会社
株式会社山白,長野県松本市大字里山辺２２４番地５,2026-05-22,株式会社
合同会社Ｓｍａｒｔ　Ｃｏｒｅ,岐阜県岐阜市加納本石町３丁目７コワーキングスペースディライト小個室０１,2026-05-22,合同会社
株式会社トータルリメイク,岐阜県多治見市陶元町２８番地の５,2026-05-22,株式会社
株式会社パステルカラー,岐阜県本巣郡北方町小柳１丁目１９番地の３,2026-05-22,株式会社
株式会社ビーデイズ,岐阜県多治見市豊岡町２丁目５８番地の１,2026-05-22,株式会社
株式会社匠耀工業,岐阜県羽島市堀津町１９２番地,2026-05-22,株式会社
株式会社ＯＮＥＰＬＵＳ,岐阜県岐阜市柳ケ瀬通３丁目１５番地柳ヶ瀬ファイブスタービル５階,2026-05-22,株式会社
株式会社ハートフル菊川,静岡県菊川市半済６番地の１,2026-05-22,株式会社
株式会社ユウナ,静岡県磐田市中泉２１５０番地１,2026-05-22,株式会社
株式会社Ｋａｉｋｏ　Ｂｉｏ研究所,静岡県静岡市駿河区小鹿８８４番地の４４,2026-05-22,株式会社
株式会社ＯＵＲ　ＰＬＡＣＥ,静岡県掛川市中央１丁目４番地の１まるまんビル１階,2026-05-22,株式会社
炭素資源工学研究所合同会社,静岡県浜松市中央区広沢２丁目２２番２２号,2026-05-22,合同会社
行政書士法人Ｙ‐ＢＡＳＥ,静岡県浜松市中央区東若林町１７５３番地の１４,2026-05-22,その他の設立登記法人
静浪エルグロース株式会社,静岡県静岡市葵区中ノ郷１７３番地の５,2026-05-22,株式会社
アイスキャンディー株式会社,愛知県名古屋市中区大須３丁目４０番２５号,2026-05-22,株式会社
クレア合同会社,愛知県名古屋市中区千代田５丁目３番２１号１階,2026-05-22,合同会社
ブルーム株式会社,愛知県豊田市柿本町２丁目７番地２,2026-05-22,株式会社
信栄パートナーズ株式会社,愛知県名古屋市中区栄３丁目１９番２８号ＥＴＳＵＫＡ－ＣＡＮＶＡＳＳＡＫＡＥＢＬＧ．３階,2026-05-22,株式会社
合同会社アシストケア,愛知県岡崎市藤川町字西小坂１５番地２,2026-05-22,合同会社
合同会社イデアルアシスト,愛知県豊川市御津町大草外新田３９番地１,2026-05-22,合同会社
合同会社クラッチ,愛知県長久手市東狭間１２０１番地,2026-05-22,合同会社
合同会社梛木グレィス,愛知県名古屋市中村区名駅３丁目４－１０アルティメイト名駅１ｓｔ２階,2026-05-22,合同会社
合同会社ＡＩ　ＣＬＯＵＤ,愛知県一宮市萩原町朝宮字朝宮前３番地１,2026-05-22,合同会社
合同会社Ｈ２Ａ　ＥＮＴＥＲＰＲＩＳＥ,愛知県弥富市東末広３丁目５２,2026-05-22,合同会社
合同会社ＮＡＴＵＲＡＬ　Ｊ,愛知県名古屋市名東区社台１丁目５０番地,2026-05-22,合同会社
合同会社ｍｙ　ｓｔｏｒｙ,愛知県名古屋市千種区御棚町２丁目３６御棚町Ｈｉｌｌｓ３０２,2026-05-22,合同会社
新三和株式会社,愛知県半田市州の崎町２番地１０１,2026-05-22,株式会社
日新ホールディングス合同会社,愛知県春日井市下条町８５０番地,2026-05-22,合同会社
東信電設合同会社,愛知県名古屋市中区丸の内２丁目９番２４号Ｆａｃｅ日銀前９０１,2026-05-22,合同会社
株式会社かみや水設,愛知県田原市保美町唐沢５０番地２４,2026-05-22,株式会社
株式会社アイセブン,愛知県名古屋市天白区平針３丁目１１７番地クレスト杉浦３０５号,2026-05-22,株式会社
株式会社ドスセカンド,愛知県稲沢市高御堂１丁目９番８号,2026-05-22,株式会社
株式会社マテクリ,愛知県名古屋市昭和区広路町字隼人２５番地の１,2026-05-22,株式会社
株式会社優匠,愛知県尾張旭市晴丘町東２８８番地４,2026-05-22,株式会社
株式会社円之内,愛知県一宮市丹陽町九日市場字上田３１番地１５,2026-05-22,株式会社
株式会社奈々美,愛知県名古屋市東区泉１丁目６番１７号サンメゾン泉一丁目ＥＬＤＯ３０２号,2026-05-22,株式会社
株式会社日税デジタルサービス名古屋,愛知県名古屋市中区栄２丁目６番１号ＲＴ白川ビル２０３号,2026-05-22,株式会社
株式会社ＡＩＯＺ,愛知県安城市三河安城南町１丁目１５番地８,2026-05-22,株式会社
株式会社ＢＡＳＥ,愛知県豊川市新豊町１丁目１４１番地,2026-05-22,株式会社
株式会社Ｂａｂｅｌ,愛知県名古屋市中区富士見町１３番１９号,2026-05-22,株式会社
株式会社ＨＩＫＥＮ,愛知県尾張旭市霞ケ丘町南１４５番地２,2026-05-22,株式会社
株式会社ＬＳＣＷ,愛知県名古屋市西区新道１丁目１０番２号,2026-05-22,株式会社
株式会社ＯＵＲ,愛知県尾張旭市下井町下井２１２８番地１,2026-05-22,株式会社
株式会社Ｑｏａ,愛知県瀬戸市西印所町３２番地,2026-05-22,株式会社
株式会社ＲＢＫ,愛知県名古屋市瑞穂区苗代町２４番１３号,2026-05-22,株式会社
株式会社ＲｅＢｌｏｏｍ,愛知県大府市長草町中屋敷１５番地の４,2026-05-22,株式会社
株式会社Ｔ．ｂｌｏｏｍ,愛知県一宮市木曽川町黒田字宝光寺３５番地３,2026-05-22,株式会社
株式会社ＴｈｅＧｒａｎ,愛知県名古屋市緑区滝ノ水１丁目１２２番地,2026-05-22,株式会社
株式会社ｈｏｏｄ,愛知県名古屋市中区錦３丁目１８番８号ＮａｎｅｉＮｉｓｈｉｋｉＢｕｉｌｄｉｎｇ５階,2026-05-22,株式会社
株式会社ｉｍａｚｕ,愛知県東海市養父町浅間前４６番地,2026-05-22,株式会社
株式会社ｓｕｍｉｋａ,愛知県江南市古知野町小金３６番地１,2026-05-22,株式会社
株式会社ｔｒｉｐｌｅＴ,愛知県尾張旭市南栄町１丁目３７番地,2026-05-22,株式会社
風雅合同会社,愛知県名古屋市東区代官町３２番２０号シティコーポ代官２０２号,2026-05-22,合同会社
Ｍ　Ａｄｖｉｓｏｒｙ＆Ｃａｐｉｔａｌ合同会社,愛知県額田郡幸田町大字芦谷字北屋敷４１番地,2026-05-22,合同会社
Ｏｎｅ　Ａｉｒ株式会社,愛知県名古屋市中村区名駅南３丁目１１番３５－６０６号,2026-05-22,株式会社
ＳＡＬＭＡＮ　ＡＵＴＯ　ＴＲＡＤＩＮＧ合同会社,愛知県名古屋市千種区城木町１丁目５６番１号,2026-05-22,合同会社
ＳＥＲＡＰＨ　ＷＨＩＴＥ　ＣＡＰＩＴＡＬ株式会社,愛知県一宮市今伊勢町馬寄字福塚前１０番地１４,2026-05-22,株式会社
ＵＮＩ‐ｈｏｕｓｅ株式会社,愛知県名古屋市天白区鴻の巣１丁目２６０５番地の１,2026-05-22,株式会社
ととのえデザイン合同会社,滋賀県栗東市綣１丁目１４番１６－２０４号ハイムアートタカノ,2026-05-22,合同会社
合同会社笑門,滋賀県大津市里１丁目１番２４号,2026-05-22,合同会社
合同会社Ｙｏｓｈｉｋａｗａ福祉デザインラボ,滋賀県大津市緑町２７番１６号,2026-05-22,合同会社
株式会社ダイゴ,滋賀県守山市今浜町３９６８番地３,2026-05-22,株式会社
株式会社ネアリス,滋賀県大津市打出浜２－１コラボしが２１Ｂ３２,2026-05-22,株式会社
株式会社フリーデン一風,滋賀県栗東市上砥山６２６番地５,2026-05-22,株式会社
株式会社山田保険事務所,滋賀県東近江市蛇溝町１７９番地,2026-05-22,株式会社
株式会社Ｓｏｒａ　Ａｒｃｓ,滋賀県守山市金森町８６９番地２ＲＯＯＴコワーキング内,2026-05-22,株式会社
ガッツ合同会社,京都府京都市中京区壬生高樋町４６番地１４ハイツ聖１階,2026-05-22,合同会社
一般社団法人セレンディピティラボ,京都府京都市左京区吉田本町１３,2026-05-22,その他の設立登記法人
一般社団法人京都学生ｅスポーツ協会,京都府京都市北区紫野上柏野町５９番地１８,2026-05-22,その他の設立登記法人
一般社団法人次世代フィジカルＡＩ育成機構,京都府京都市左京区吉田本町３６番地１京都大学国際科学イノベーション棟西館１０４ベンチャーインキュベーションセンター内,2026-05-22,その他の設立登記法人
京都雷貞嘉寧株式会社,京都府京都市中京区御幸町通夷川上る松本町５７０番地５,2026-05-22,株式会社
合同会社アイオライトレコード,京都府京都市左京区浄土寺真如町１５２,2026-05-22,合同会社
株式会社とっち開発設計,京都府八幡市八幡清水井６７番６,2026-05-22,株式会社
株式会社オキ,京都府京都市右京区鳴滝川西町１８番地１,2026-05-22,株式会社
株式会社トコハ,京都府京都市右京区梅津中倉町２９番地１,2026-05-22,株式会社
株式会社京都バニー,京都府城陽市平川大将軍１４番地の６,2026-05-22,株式会社
株式会社吉岡,京都府木津川市相楽大里５１番地３,2026-05-22,株式会社
株式会社本田,京都府舞鶴市字森４８３番地４,2026-05-22,株式会社
株式会社桜プリント,京都府京都市中京区御池通東洞院東入笹屋町４３６永和御池ビル６０６号,2026-05-22,株式会社
株式会社西野興業,京都府京都市左京区修学院坪江町３８番地８,2026-05-22,株式会社
株式会社Ａｅｘａ,京都府京都市伏見区竹田真幡木町１８１ＭＴＯＦＦＩＣＥ２０２,2026-05-22,株式会社
株式会社ＵＮＯ　ＬＩＶＩＮＧ,京都府京都市左京区一乗寺里ノ西町７８番地,2026-05-22,株式会社
湛泰合同会社,京都府京都市中京区蛸薬師通柳馬場東入油屋町１２９番地メロディーハイム蛸薬師８０１,2026-05-22,合同会社
特定非営利活動法人ＩＣＯＣＯ,京都府京都市下京区七条通新町東入西境町１６３番地京都駅前増井ビル５階,2026-05-22,その他の設立登記法人
萬盛商事株式会社,京都府福知山市三和町辻９５９番地の１,2026-05-22,株式会社
Ｈｉ‐Ｓｔａｎｄａｒｄ　Ａｇｅｎｃｙ株式会社,京都府福知山市字前田８７－７,2026-05-22,株式会社
ことのは税理士法人,大阪府八尾市山本町１丁目３番２２号カライビル３階,2026-05-22,その他の設立登記法人
マグケアグローバル株式会社,大阪府岸和田市小松里町５９９番地の８,2026-05-22,株式会社
一般社団法人全日本蓄電所,大阪府大阪市中央区西心斎橋１丁目１０番３６号,2026-05-22,その他の設立登記法人
一般社団法人空蘭会,大阪府大阪市北区堂島２丁目２番８－２８０４号,2026-05-22,その他の設立登記法人
三栄ホールディングス株式会社,大阪府大阪市北区梅田１丁目３番１－６００号,2026-05-22,株式会社
加陽印刷工業株式会社,大阪府大阪市阿倍野区旭町２丁目２番４－６０８号,2026-05-22,株式会社
合同会社おかげさま,大阪府大阪市平野区加美東３丁目１５番５号,2026-05-22,合同会社
合同会社ソウコウライフ,大阪府大阪市北区梅田１丁目１‐３大阪駅前第３ビル２９階１‐１‐１号室,2026-05-22,合同会社
合同会社レインパルス,大阪府大阪市北区梅田１丁目２番２号大阪駅前第２ビル１２‐１２,2026-05-22,合同会社
合同会社丹波市島ストレージシステム,大阪府大阪市中央区北久宝寺町２丁目１番１０号,2026-05-22,合同会社
合同会社信楽市ストレージシステム,大阪府大阪市中央区北久宝寺町２丁目１番１０号,2026-05-22,合同会社
合同会社兎生,大阪府大阪市浪速区日本橋西１丁目１－１３ひの幸ビル５２,2026-05-22,合同会社
合同会社全日本蓄電所,大阪府大阪市中央区西心斎橋１丁目１０番３６号,2026-05-22,合同会社
合同会社寿商会,大阪府大阪市鶴見区茨田大宮４丁目２番２８号,2026-05-22,合同会社
合同会社西円寺ストレージシステム,大阪府大阪市中央区北久宝寺町２丁目１番１０号,2026-05-22,合同会社
合同会社西脇ストレージシステム,大阪府大阪市中央区北久宝寺町２丁目１番１０号,2026-05-22,合同会社
合同会社谷農場,大阪府大阪狭山市茱萸木１丁目２６９３番１,2026-05-22,合同会社
合同会社ＮＶＧ,大阪府大阪市此花区春日出北１丁目２６－１８クレイノウィル春日出２０２号室,2026-05-22,合同会社
合同会社Ｎｕｍｉｘ,大阪府大阪市北区梅田１丁目１番３号大阪駅前第３ビル１１階２号室,2026-05-22,合同会社
合同会社ＴＯＵＧＥ,大阪府大阪市西淀川区柏里２丁目２番１８号,2026-05-22,合同会社
株式会社たまごのたまこ,大阪府堺市中区深井清水町３９８０番地,2026-05-22,株式会社
株式会社ひだまりワーク,大阪府豊中市服部南町１丁目７番５号,2026-05-22,株式会社
株式会社ウェルビー,大阪府大阪市旭区今市１丁目８－１６,2026-05-22,株式会社
株式会社エイト,大阪府河内長野市本町２１番１６号,2026-05-22,株式会社
株式会社スピーガホールディングス,大阪府大阪市北区堂島浜１丁目１番１５号,2026-05-22,株式会社
株式会社ネクサスキャピタル,大阪府大阪市西区北堀江１丁目２番１９号アステリオ北堀江ザ・メトロタワー１０Ｆ,2026-05-22,株式会社
株式会社ユーキコーポレーション,大阪府岸和田市小松里町２２７３番地,2026-05-22,株式会社
株式会社ラフテルリンク,大阪府吹田市泉町４丁目３８番２８号３０２号室,2026-05-22,株式会社
株式会社丸中,大阪府門真市三ツ島２丁目２０番５－３１０号,2026-05-22,株式会社
株式会社丸久電工,大阪府松原市上田６丁目２４４番地の１,2026-05-22,株式会社
株式会社共栄Ｎｅｘｕｒ,大阪府大阪市淀川区西中島３丁目１２番１５号,2026-05-22,株式会社
株式会社日向家,大阪府岸和田市中北町１４番２号,2026-05-22,株式会社
株式会社有澤造園土木,大阪府阪南市箱作１９７５番地の１,2026-05-22,株式会社
株式会社滝口加工所,大阪府和泉市国分町１１２８－１,2026-05-22,株式会社
株式会社繋識,大阪府大阪市生野区鶴橋５丁目４－３,2026-05-22,株式会社
株式会社金漢基,大阪府堺市堺区宿屋町東１丁２番２１号,2026-05-22,株式会社
株式会社高橋不動産,大阪府大阪市旭区大宮２丁目１７番２７号,2026-05-22,株式会社
株式会社Ｃａｐｉｔａｌｓ,大阪府堺市堺区緑ヶ丘北町２丁３番１３号,2026-05-22,株式会社
株式会社ＥＦＦＥＣＴＯＲＹ,大阪府大阪市平野区流町１丁目４番５号,2026-05-22,株式会社
株式会社ＥＮ,大阪府大阪市東淀川区菅原２丁目９番２８号アイビース菅原２０１号,2026-05-22,株式会社
株式会社Ｅｖｅｒｅｎ,大阪府豊中市桜の町４丁目６番２７－１０６号,2026-05-22,株式会社
株式会社ＨＣＣ準備会社,大阪府岸和田市上野町東８番１６号,2026-05-22,株式会社
株式会社ＩＣ,大阪府泉大津市北豊中二丁目２番５号,2026-05-22,株式会社
株式会社ＬＩＧ,大阪府泉大津市北豊中二丁目２番５号,2026-05-22,株式会社
株式会社ＭＥＬＩＧＨＴ,大阪府岸和田市野田町１丁目６番２７号小山ビル西館１階,2026-05-22,株式会社
株式会社Ｍａｍｍａ　Ｍｉａ,大阪府豊中市新千里北町２丁目２１番３号,2026-05-22,株式会社
株式会社ＮＥＸＵＳ,大阪府東大阪市菱屋西５丁目６番１０号,2026-05-22,株式会社
株式会社ＰＨＸ都市開発,大阪府大阪市西区新町１丁目１３番１８－１２０１号,2026-05-22,株式会社
株式会社ＲＩＳＭ,大阪府高槻市美しが丘１丁目１０番２８号,2026-05-22,株式会社
株式会社ＴＭＪ,大阪府大阪市阿倍野区阿倍野筋３丁目６番１０－２０２号,2026-05-22,株式会社
株式会社ＴＯ‐ＢＥ,大阪府大阪市中央区南船場３丁目２番２２号おおきに南船場ビル２０５,2026-05-22,株式会社
株式会社ＴＯＫＩＹＡ　Ｈｏｌｄｉｎｇｓ,大阪府泉大津市東雲町４番１４号,2026-05-22,株式会社
株式会社ＷＨＦ,大阪府大阪市住吉区墨江４丁目１４番１４号,2026-05-22,株式会社
株式会社ＹＯＳＨＩＫＥＮ　ＮＥＸ,大阪府貝塚市名越４９５番地,2026-05-22,株式会社
株式会社ＺＥＮ＆Ｃｏ．,大阪府大阪市北区梅田１丁目２番２号大阪駅前第２ビル１２－１２,2026-05-22,株式会社
Ｂｒｉｇｈｔ　Ｆｕｔｕｒｅ　Ｅｄｕｃａｔｉｏｎ株式会社,大阪府大阪市大正区平尾５丁目１０番１７号,2026-05-22,株式会社
Ｆｏｕｒｔｈ　Ｃｏｎｓｕｌｔｉｎｇ株式会社,大阪府豊中市東寺内町１番１０号,2026-05-22,株式会社
ＭＯＵＲＡ投資株式会社,大阪府大阪市浪速区桜川２丁目１番９－７０２号,2026-05-22,株式会社
ＮＴトラスト株式会社,大阪府大阪市阿倍野区松虫通１丁目１０番４号フジパレス松虫通ＥＡＳＴ１０３号,2026-05-22,株式会社
Ｒ　Ａｓｓｅｔ合同会社,大阪府大阪市西区北堀江２丁目３番１号グランドメゾン北堀江レジデンス１５０２号室,2026-05-22,合同会社
ＴＳリサーチ合同会社,大阪府大阪市中央区平野町１丁目４番７－８０２号,2026-05-22,合同会社
あいらんど合同会社,兵庫県伊丹市春日丘６丁目１７番地１,2026-05-22,合同会社
アローホールディングス株式会社,兵庫県神戸市中央区雲井通４丁目２番２号,2026-05-22,株式会社
インフィニート不動産株式会社,兵庫県加東市社１４９１番地の１,2026-05-22,株式会社
ジーエフアセット株式会社,兵庫県加古川市加古川町溝之口１４０番地の１８,2026-05-22,株式会社
レインディア・リクルートメント株式会社,兵庫県西宮市甲陽園目神山町１９番２９号,2026-05-22,株式会社
合同会社アンビヤ,兵庫県小野市小田町３７８,2026-05-22,合同会社
合同会社レアーレ,兵庫県三田市けやき台５丁目１９番地６,2026-05-22,合同会社
合同会社ＮＥＸＵＳ　ＴＲＡＤＩＮＧ,兵庫県明石市魚住町西岡１９６５番地の７,2026-05-22,合同会社
合同会社ＺＥＮＤＡＮ　ＥＮＥＲＧＹ　ＳＴＯＲＡＧＥ１,兵庫県南あわじ市松帆塩浜１２７番地,2026-05-22,合同会社
株式会社スリーナイン,兵庫県小野市新部町１０７２番地の２,2026-05-22,株式会社
株式会社ツカサＳ．Ｐ．Ａ,兵庫県神戸市中央区御幸通８丁目１番６号神戸国際会館２２階,2026-05-22,株式会社
株式会社ヴェロシテックワールド,兵庫県神戸市須磨区妙法寺字ぬめり石１－１－２０５,2026-05-22,株式会社
株式会社美’ｓ　Ｑｕｅｅｎ,兵庫県芦屋市呉川町３番１７号,2026-05-22,株式会社
株式会社ＣＡＬＭ　ＣＲＥＡＴＥ,兵庫県丹波市柏原町田路１１４番地５,2026-05-22,株式会社
株式会社Ｆ．ｏ．Ｆ,兵庫県宝塚市伊孑志３丁目１５,2026-05-22,株式会社
株式会社Ｐｏｌｕｂｏｎａ,兵庫県神戸市垂水区神田町４番３１号,2026-05-22,株式会社
株式会社ＴＲＩＣＯＲＤ　ＬＡＢ,兵庫県姫路市八代本町２丁目１３番１６号城乾プラザ１Ｆ東側,2026-05-22,株式会社
株式会社ｕ　Ａｓｃｅｎｔ　Ｗｏｒｋｓ,兵庫県明石市魚住町中尾１３０番地の１,2026-05-22,株式会社
蒜山白樺ファーム合同会社,兵庫県西宮市能登町１２－１５,2026-05-22,合同会社
Ａｉｄｅｌｉａ株式会社,兵庫県西宮市名塩木之元２２番３３号,2026-05-22,株式会社
ＦｕｎＬｉｆｅ合同会社,兵庫県西宮市荒木町１－４３,2026-05-22,合同会社
ＴＡＮＩＫＵＵ株式会社,兵庫県神戸市灘区鶴甲３丁目９番１５号,2026-05-22,株式会社
合同会社ＹＮＳｙｓｔｅｍｓ,奈良県葛城市北道穗１３２番地１２,2026-05-22,合同会社
株式会社もくホールディングス,奈良県奈良市山陵町１１５５－３,2026-05-22,株式会社
株式会社ＭＯＴ,奈良県橿原市大垣町１９１番地の５,2026-05-22,株式会社
株式会社Ｐｉｌｉｎａ,奈良県御所市大字東松本２３２番地,2026-05-22,株式会社
濰坊静智貿易有限公司,奈良県奈良市学園朝日町１５番１０号,2026-05-22,外国会社等
合同会社はじまりの村,和歌山県東牟婁郡古座川町長追２５５番地４,2026-05-22,合同会社
合同会社藤田商店,和歌山県和歌山市上野６２８番地２号,2026-05-22,合同会社
特定非営利活動法人笑門福来,和歌山県岩出市西国分６２７－３,2026-05-22,その他の設立登記法人
合同会社ＥＬ,鳥取県米子市両三柳１５５番地１,2026-05-22,合同会社
合同会社てごわーく,島根県江津市桜江町長谷２７２８番地１０,2026-05-22,合同会社
株式会社ワンステップ,岡山県岡山市北区十日市中町１１番３号,2026-05-22,株式会社
株式会社大和,岡山県総社市東阿曽１３３３－１,2026-05-22,株式会社
株式会社Ｍ’ｓリアリティ,岡山県岡山市南区若葉町２０番２３号,2026-05-22,株式会社
株式会社ｎｈノバリア,岡山県岡山市南区妹尾９６９番地１,2026-05-22,株式会社
鴻禾株式会社,岡山県岡山市中区湊４５１番地１６９,2026-05-22,株式会社
アパブロホールディングス株式会社,広島県広島市安佐北区深川２丁目４９番２３号,2026-05-22,株式会社
オイナイン株式会社,広島県広島市中区南千田東町１番６号,2026-05-22,株式会社
合同会社ぎおんメモリアルサービス,広島県広島市安佐南区長束４丁目１７番７号,2026-05-22,合同会社
合同会社窪田,広島県広島市中区弥生町４番８－４０６号,2026-05-22,合同会社
合同会社ＴＫ＆Ｇ,広島県廿日市市友田１０３８－４,2026-05-22,合同会社
株式会社うねいファーム,広島県福山市沼隈町大字下山南１９２７番地４,2026-05-22,株式会社
