法人名,住所,設立日,法人種別
株式会社ＧａＫｅｎ,福岡県福岡市博多区大博町３番３０号博多永久ビル５０５号,2021-08-23,株式会社
株式会社Ｇａｉａ　Ｓｏｕｎｄ　Ｇｒｏｏｖｅ,東京都渋谷区恵比寿３丁目３５番１号１０５,2021-08-23,株式会社
株式会社Ｇｌｅｎチャンネル,東京都中央区銀座８丁目６番２０号,2021-08-23,株式会社
株式会社Ｇｒｉｔｕｒｅ,埼玉県越谷市レイクタウン７丁目２４番地１－１０３号,2021-08-23,株式会社
株式会社ＨＥＨＮ,東京都渋谷区神宮前３丁目４０番３号,2021-08-23,株式会社
株式会社ＨＭＰ　Ｋａｎｄａ,東京都千代田区内神田２丁目１５番４号,2021-08-23,株式会社
株式会社ＨＯＯＤ,鹿児島県鹿児島市新屋敷町２３－２０グリーンコーポカモメ１Ｆ,2021-08-23,株式会社
株式会社Ｈａｎｄ　Ｗｏｒｋｅｒｓ,東京都町田市図師町１３３２番地５３,2021-08-23,株式会社
株式会社ＨｉｋａｒｉＱ　Ｈｅａｌｔｈ,東京都港区芝３丁目６番１０号芝ＮＡビル５階,2021-08-23,株式会社
株式会社ＩＮＦＩＮＡ,東京都渋谷区神宮前６丁目２３番４号桑野ビル２階,2021-08-23,株式会社
株式会社ＩＮＶＯＸ,東京都杉並区永福２丁目１４番１８号ＬｅＣｉｅｌＡｚｕｒⅡ２１０２,2021-08-23,株式会社
株式会社ＩＳＫＴ,神奈川県横浜市港北区新吉田町４１４１番地,2021-08-23,株式会社
株式会社ＩＴケアソリューション,大阪府大阪市天王寺区国分町３番２６号,2021-08-23,株式会社
株式会社ＪｏｂｓＬｉｎｋ,東京都三鷹市井の頭２丁目３２番１０－１０１号,2021-08-23,株式会社
株式会社Ｋライズ,神奈川県横浜市青葉区みたけ台３３番地１５４,2021-08-23,株式会社
株式会社Ｋ－ｆａｃｔｏｒｙ,福岡県朝倉郡筑前町下高場１９６２番地１,2021-08-23,株式会社
株式会社ＫＡＩＡ,東京都福生市大字熊川１４９２番地１９（３０３号）,2021-08-23,株式会社
株式会社ＫＷ夢,東京都渋谷区富ヶ谷１丁目１４番１４号４階,2021-08-23,株式会社
株式会社ＫｏｆＣ,愛媛県新居浜市久保田町１丁目３番４１号,2021-08-23,株式会社
株式会社Ｌ．Ｉ．Ｊ,沖縄県那覇市具志２丁目１８－２０,2021-08-23,株式会社
株式会社ＬＡ,東京都港区高輪２丁目１４番１９号レグノプレミア高輪３０２,2021-08-23,株式会社
株式会社ＬＯＧＩ,東京都江戸川区臨海町４丁目３番１号葛西トラックターミナル１２号棟４階,2021-08-23,株式会社
株式会社Ｌｉｆｅ　Ｉｎｔｅｇｒａｌ,東京都豊島区南大塚２丁目１３番１１号アーバンビュー南大塚２０３号,2021-08-23,株式会社
株式会社Ｌｉｌｙ,埼玉県さいたま市大宮区桜木町１丁目２６６番地３,2021-08-23,株式会社
株式会社Ｌｏｇｉｃａｌ,大阪府豊中市曽根東町１丁目２番３号,2021-08-23,株式会社
株式会社ＭＯＭＯトレーディング,大阪府大阪市西区南堀江１丁目２１番１－３０３号,2021-08-23,株式会社
株式会社ＭＴトラスト,埼玉県新座市東北２丁目２９番２５号４０２号室,2021-08-23,株式会社
株式会社Ｍｙコンサルティング,京都府長岡京市金ケ原乙張１６－４,2021-08-23,株式会社
株式会社ＮＩＣサービス,福岡県福岡市早良区原６丁目２４－１－２,2021-08-23,株式会社
株式会社ＮＯＡ,岡山県倉敷市川入６１８番地１オータムヒル３Ａ－１０３,2021-08-23,株式会社
株式会社ＮＯＳＩＤＥ　ＧＲＯＵＰ,熊本県熊本市中央区帯山４丁目４５－１ＣＰＫⅡビル３０１号室,2021-08-23,株式会社
株式会社ＮＴＭマーケティング,新潟県新潟市北区樋ノ入５０３番地７,2021-08-23,株式会社
株式会社ＯＮＥ,東京都墨田区東向島２丁目２４番９号,2021-08-23,株式会社
株式会社Ｏｄａ　Ｄｅｓｉｇｎ　Ｏｆｆｉｃｅ,広島県広島市安芸区瀬野１丁目４２番２５号,2021-08-23,株式会社
株式会社Ｏｆｆｉｃｅｆａｃｔｉｏｎ,東京都江東区平野２丁目１６番２０号,2021-08-23,株式会社
株式会社ＰＩＮＥ　ＰｌａｎｎｉｎｇＰｒｏｐｅｒｔｙ,東京都世田谷区経堂３丁目１６番２号,2021-08-23,株式会社
株式会社ＰＯＴＥＮＴＩＡＬ,東京都港区南青山２丁目２番１５－９４２号,2021-08-23,株式会社
株式会社Ｐｉｏｎｅｅｒｓ,東京都世田谷区池尻４丁目１３番５号,2021-08-23,株式会社
株式会社Ｐｏｃｈｉ　Ｐｏｗｅｒ　Ｈｏｕｓｅ,栃木県那須郡那須町大字高久丙１７７７番地４０８,2021-08-23,株式会社
株式会社Ｐｏｎｏ　Ｍｕｋａｅ,和歌山県伊都郡かつらぎ町大字下天野１０８番地,2021-08-23,株式会社
株式会社Ｐｒｅｖｉｏｕｓ　Ｉｓｌａｎｄ,東京都港区白金６丁目１６番２５－４０８号グランドメゾン白金の杜ザ・タワー,2021-08-23,株式会社
株式会社ＲＡシステム,愛知県丹羽郡扶桑町大字高雄字南羽根１９３番地２,2021-08-23,株式会社
株式会社ＲＡＩＬＷＡＹ,福岡県糟屋郡須惠町大字旅石１１５番地５２２,2021-08-23,株式会社
株式会社ＲＥＡＬＲＩＺＥ,東京都港区南青山２丁目２番１５号ＷｉｎＡｏｙａｍａビルＵＣＦ６階,2021-08-23,株式会社
株式会社ＲＯＳ,大阪府豊中市宮山町２丁目１３番２０号１０１号,2021-08-23,株式会社
株式会社Ｒｅ　Ｂｅａｒｓ,福岡県春日市大谷５丁目２２番地１,2021-08-23,株式会社
株式会社Ｒｅ．,福島県福島市本内字南河原６番地の１,2021-08-23,株式会社
株式会社Ｒｅｘｃｅｅｄ,東京都町田市玉川学園５丁目２８番２号,2021-08-23,株式会社
株式会社ＲｉｍｓＣｏｎｎｅｃｔｉｏｎ,大阪府和泉市はつが野６丁目３８番１１号,2021-08-23,株式会社
株式会社ＳＣ三枝,静岡県藤枝市駅前３丁目１４番１号,2021-08-23,株式会社
株式会社ＳＣＨＯＮ　ＤＡＮＫ,大阪府大阪市西区京町堀２丁目２番８号５０１,2021-08-23,株式会社
株式会社ＳＨＩＢＵＳＨＩアグリファーム,鹿児島県志布志市志布志町志布志６５番地５,2021-08-23,株式会社
株式会社ＳＴＡＲ　ＩＳＬＡＮＤ　ＣＯＭＰＡＮＹ,栃木県大田原市本町１丁目２７０５番地１１,2021-08-23,株式会社
株式会社ＳＵＮＨＡＬＯ,福岡県福岡市中央区天神３丁目７番３号２Ｆタワーズ天神,2021-08-23,株式会社
株式会社ＳＵＮＲＩＳＥ,東京都板橋区高島平７丁目２１番９号グランピュア・Ｓ１階,2021-08-23,株式会社
株式会社Ｓａｃｈｉｎｅｓｓ,東京都港区愛宕２丁目５番１号愛宕グリーンヒルズＭＯＲＩタワー２４階,2021-08-23,株式会社
株式会社Ｓｈｉｚｕｎｉｔｙ,東京都港区愛宕２丁目５番１号愛宕グリーンヒルズＭＯＲＩタワー２４階,2021-08-23,株式会社
株式会社Ｓｏｎｏｐｈｏｎｙ,東京都港区愛宕２丁目５番１号愛宕グリーンヒルズＭＯＲＩタワー２４階,2021-08-23,株式会社
株式会社Ｔ＆Ｔ　Ｃｏ．,東京都板橋区赤塚３丁目２９番２２号,2021-08-23,株式会社
株式会社Ｔ２Ｃ,熊本県菊池郡大津町大字室５３９－１０,2021-08-23,株式会社
株式会社ＴＡ,静岡県静岡市清水区中之郷２丁目１６番７号,2021-08-23,株式会社
株式会社ＴＡＳリアルエステート,神奈川県横浜市磯子区滝頭２丁目３２番６－２号,2021-08-23,株式会社
株式会社ＴＫホールディングス,千葉県袖ケ浦市長浦５８０番地１２２－１,2021-08-23,株式会社
株式会社ＴＫＢ,長崎県平戸市川内町１２１６番地１３,2021-08-23,株式会社
株式会社ＴＫＳ,愛知県半田市緑ケ丘４丁目５番地の１,2021-08-23,株式会社
株式会社ＴＯＫＩＢＩＳＯＵ,神奈川県横浜市青葉区市ケ尾１７２６番地１,2021-08-23,株式会社
株式会社ＴＯＰＯＵＴ,北海道札幌市厚別区厚別西四条３丁目９番１号,2021-08-23,株式会社
株式会社ＴＯＲＡＳＡＴＳＵ,愛知県名古屋市西区菊井１丁目３番１８号,2021-08-23,株式会社
株式会社ＴＵＲＮＩＮＧ　ＰＯＩＮＴ,東京都品川区上大崎３丁目９番９号,2021-08-23,株式会社
株式会社Ｕ,山口県下関市豊北町大字神田上１８５番地の１,2021-08-23,株式会社
株式会社ＶＩＶＩＢＯＮＤ,神奈川県茅ヶ崎市十間坂２丁目４番地１９号ハイツ江南Ｂ１０３,2021-08-23,株式会社
株式会社ＷＡＮｔｏＷＡＮ,山梨県甲斐市中下条１２３８番地,2021-08-23,株式会社
株式会社ＷＩＮｘＶＡＬ,東京都豊島区南池袋１丁目１６番１５号ダイヤゲート池袋５階,2021-08-23,株式会社
株式会社Ｗｅｌｌｍｏｒｅ,静岡県静岡市清水区村松２２００番地の１３,2021-08-23,株式会社
株式会社Ｙ＆Ｋ,愛知県一宮市祐久字北野黒１４７番地,2021-08-23,株式会社
株式会社ＹＡＭＡＳＯＢＵ,千葉県富津市志駒字奥井沢４３４番地,2021-08-23,株式会社
株式会社ＹＯＵＫＯ,山口県周南市大神３丁目１２番４０号,2021-08-23,株式会社
株式会社ＹＳカンパニー,神奈川県平塚市黒部丘６番１９－２０２号,2021-08-23,株式会社
株式会社ＺＡＩＭＯＫＵ－ＹＡ,兵庫県姫路市北今宿２丁目１番１３号メゾンハピネス３０２,2021-08-23,株式会社
株式会社Ｚｅａｌ,神奈川県横浜市中区不老町１丁目１番１１号,2021-08-23,株式会社
株式会社ｂｅｓｔ,東京都豊島区東池袋１丁目２６番４号サンフラワービル５０７,2021-08-23,株式会社
株式会社ｅｃｏＲ,兵庫県神戸市垂水区南多聞台６丁目１０番３号,2021-08-23,株式会社
株式会社ｆｏｕｒ　ｔｅｅｔｈ　ｃｌｏｖｅｒ,福岡県筑後市大字長浜２２３８番地２,2021-08-23,株式会社
株式会社ｈｅｙｍｅ,東京都渋谷区渋谷２丁目１９番１５号宮益坂ビルディング６０９,2021-08-23,株式会社
株式会社ｉｌｅｍｏｎ,東京都江戸川区南小岩３丁目１番７号,2021-08-23,株式会社
株式会社ｔｈａｎＸｉ,東京都品川区東五反田５丁目２３番４－７０２号,2021-08-23,株式会社
株式会社ｙｕｓｈｉｎ,熊本県阿蘇郡小国町大字宮原１６３５－５,2021-08-23,株式会社
横浜泉企画株式会社,神奈川県横浜市西区北幸１丁目１１番１号水信ビル７階,2021-08-23,株式会社
浅田地所株式会社,長野県松本市旭３丁目６番１４号,2021-08-23,株式会社
澤美株式会社,大阪府大阪市城東区蒲生３丁目１５番１２号セザンヌ藤２０３Ａ,2021-08-23,株式会社
特定非営利活動法人真砂山ＦＵＮクラブ,茨城県那珂郡東海村大字村松１４０－８,2021-08-23,その他の設立登記法人
特定非営利活動法人真駒内花火大会,北海道札幌市白石区菊水上町三条２丁目５２番２５５（株）アスクゲート内,2021-08-23,その他の設立登記法人
特定非営利活動法人Ｃｏｎ－Ｔｒａ　Ｃｕｌｔｕｒｅ,群馬県富岡市七日市８８４番地,2021-08-23,その他の設立登記法人
真輝商事株式会社,東京都江戸川区東小松川４丁目５４番８号,2021-08-23,株式会社
神虎株式会社,東京都港区新橋５丁目１２番１１－９０２号,2021-08-23,株式会社
紅杉株式会社,大阪府大阪市北区角田町８番４７号阪急グランドビル２０階,2021-08-23,株式会社
苅北電工株式会社,大分県宇佐市大字森山１６５３番地の５,2021-08-23,株式会社
藤田電気工業株式会社,広島県三次市粟屋町２３２５番地５,2021-08-23,株式会社
西日本インクラインサービス合同会社,福岡県福岡市博多区青木１丁目１９番１－１１０３号,2021-08-23,合同会社
農事組合法人ミサワアグリ,秋田県大仙市土川字杉沢５９番地,2021-08-23,その他の設立登記法人
酵素，食用油販売合同会社,沖縄県糸満市字真栄里２００２番地の６,2021-08-23,合同会社
鑫穎合同会社,埼玉県さいたま市浦和区北浦和４丁目７番７号,2021-08-23,合同会社
雄杉工業株式会社,東京都町田市中町１丁目１１番８－５０３号,2021-08-23,株式会社
神子田合同会社,東京都品川区西大井２丁目１５番９号,2021-08-23,合同会社
４１８ＰＪ株式会社,和歌山県紀の川市久留壁３４番地４,2021-08-23,株式会社
ＡＩビジュアルラボ合同会社,兵庫県宝塚市売布きよしガ丘２番１３号,2021-08-23,合同会社
ＡＬＪ　Ｏｆｆｉｃｅ　Ｉｋｅｊｉｒｉ合同会社,東京都千代田区神田神保町１丁目１１番地さくら綜合事務所内,2021-08-23,合同会社
ＡＭＢＥＲ合同会社,東京都中央区勝どき３丁目２番３－４０８号,2021-08-23,合同会社
ＡＭＩＮ株式会社,千葉県印旛郡酒々井町馬橋６６９番地８,2021-08-23,株式会社
ＡＸＮ株式会社,東京都港区虎ノ門４丁目１番２８号虎ノ門タワーズオフィス,2021-08-23,株式会社
Ａｄｖａｎｃｅｄ　Ｃｌｉｎｉｃａｌ株式会社,東京都千代田区丸の内１丁目１１番１号パシフィックセンチュリープレイス丸の内８階・１３階,2021-08-23,株式会社
Ａｗａｔｌｙ合同会社,三重県度会郡大紀町野原２８０９番地４,2021-08-23,合同会社
ＢＳ神戸コンサルタント株式会社,兵庫県神戸市中央区琴ノ緒町４丁目４番５号,2021-08-23,株式会社
ＢＴＡ合同会社,東京都渋谷区神宮前６丁目２３番４号桑野ビル２階,2021-08-23,合同会社
Ｂｌｕｅ　Ｉｎｎｏｖａｔｉｏｎ＆Ｅｎｖｉｒｏｎｍｅｎｔａｌ　Ｎｅｔｗｏｒｋ株式会社,大阪府大阪市東住吉区公園南矢田２丁目１６番５号,2021-08-23,株式会社
ＣＥＳ　ＵＰ株式会社,大阪府高槻市真上町６丁目１０番１－４１５号,2021-08-23,株式会社
Ｃｌｏｗｄｅｒ合同会社,東京都品川区旗の台１丁目３番９号,2021-08-23,合同会社
Ｅａｒｔｈ　Ｔｅｃｈ　Ｊａｐａｎ株式会社,京都府京都市下京区七条通新町西入ＮＪ小山ビル,2021-08-23,株式会社
ＦＯＲＥＶＥＲ　ＰＬＵＳ株式会社,東京都大田区南馬込１丁目４１番８号,2021-08-23,株式会社
ＧＳトレーディング株式会社,三重県三重郡菰野町大字潤田６５０番地９,2021-08-23,株式会社
ＧＴＰホールディングス株式会社,福岡県北九州市小倉北区香春口２丁目１０番８－２０４号,2021-08-23,株式会社
Ｇａｌａ　Ｄｅｌｕｘｅ　Ｊａｐａｎ株式会社,東京都中野区上高田３丁目３８番２号,2021-08-23,株式会社
Ｇｏｎ　Ｅａｒｔｈ株式会社,神奈川県足柄上郡山北町岸３２９番地８,2021-08-23,株式会社
ＨＡＲＵＨＯｍｅ株式会社,大阪府大阪市生野区田島４丁目１番２７号,2021-08-23,株式会社
ＨＥＩＷＡ　ＳＨＯＫＡＩ株式会社,茨城県猿島郡境町１１５５番地２４レットパーク１０１,2021-08-23,株式会社
Ｈａｌｕ合同会社,栃木県宇都宮市若松原３丁目１６番１８号,2021-08-23,合同会社
Ｊａｐａｎ　ＮｅｗＳｔａｒ株式会社,千葉県佐倉市染井野６丁目１７番地３,2021-08-23,株式会社
Ｊａｐａｎ　ＳＣ１株式会社,神奈川県藤沢市村岡東２丁目２６番地の１,2021-08-23,株式会社
ＫＡＮＡＳＡ株式会社,沖縄県宮古島市平良字東仲宗根添３４８３番地,2021-08-23,株式会社
ＫＧ株式会社,東京都江東区東砂７丁目１７番１９号プラーズ東砂８０１,2021-08-23,株式会社
Ｋｉｎｋｅｄ　Ｔａｉｌ合同会社,東京都豊島区南池袋４丁目８－４ｄｅ－Ｚａｙ２０２号室,2021-08-23,合同会社
Ｌ．Ｓ．Ｓ．株式会社,京都府京都市山科区勧修寺西北出町２３番地,2021-08-23,株式会社
ＬＵＸＥＹ合同会社,広島県広島市南区東雲２丁目１４番１６号,2021-08-23,合同会社
Ｌｉｂｅｘｅｅｄ合同会社,東京都中央区日本橋２丁目２番３号ＲＩＳＨＥビル,2021-08-23,合同会社
Ｍ２株式会社,東京都渋谷区道玄坂１丁目１７番１１号,2021-08-23,株式会社
ＭＡＤＡＲＵ株式会社,神奈川県川崎市中原区宮内２丁目３１番１３－２０２号,2021-08-23,株式会社
ＭＡＲＭＯ株式会社,東京都中央区月島１丁目８番１－３２０１号,2021-08-23,株式会社
ＮＡＫＥＤ合同会社,東京都世田谷区祖師谷５丁目２１番１０号,2021-08-23,合同会社
ＮＣ株式会社,広島県福山市昭和町６番１号ＮＯＱＵＯＩ,2021-08-23,株式会社
ＮＰＯ法人うきはテック,福岡県うきは市浮羽町浮羽７５６番地,2021-08-23,その他の設立登記法人
ＮＰＯ法人ひろねこポケット・縁,広島県広島市南区本浦町４１番１３号,2021-08-23,その他の設立登記法人
ＮＴメタルプラン株式会社,大阪府大阪市東成区大今里１丁目３６番１１号,2021-08-23,株式会社
Ｎｕｖｖｅ株式会社,東京都港区元麻布３丁目１番６号,2021-08-23,株式会社
Ｏ２Ｃａｐｉｔａｌ合同会社,埼玉県越谷市東柳田町２番５号,2021-08-23,合同会社
Ｒｅ．ｍａｉｎ株式会社,茨城県笠間市旭町１８９番地１,2021-08-23,株式会社
ＳＡＮＤ　ＢＯＸ株式会社,埼玉県新座市野火止２丁目４番１４号,2021-08-23,株式会社
Ｓｐａｃｅ　Ｔｒａｄｉｎｇ株式会社,千葉県船橋市夏見１丁目９番２１－１０７号,2021-08-23,株式会社
Ｓｔａｒｒｙｂａｓｅ合同会社,熊本県熊本市南区田迎２丁目５番地８９号,2021-08-23,合同会社
Ｓｕｓｈａｎ　Ｅｎｔｅｒｐｒｉｓｅｓ　Ｌｔｄ．,茨城県神栖市須田字豊住４３９９番２,2021-08-23,外国会社等
Ｔ－不動産サービス株式会社,東京都江東区東陽５丁目２３番６－６１４号,2021-08-23,株式会社
ＴＥＡＭ　ＫＯＺ株式会社,大阪府寝屋川市高柳栄町５番１号,2021-08-23,株式会社
ＴＥＣＯＰＡＲＫ株式会社,東京都江東区木場５丁目１２番５－８０１号,2021-08-23,株式会社
ＴＨＥ　ＰＡＴＨ　ＶＮ合同会社,福岡県福岡市南区大楠１丁目１番２１号リバーサイド大楠２０３号,2021-08-23,合同会社
ＴＲＩＣ株式会社,東京都台東区東上野１丁目６番７号コージーコート上野御徒町Ⅰ１２０３号室,2021-08-23,株式会社
ＵＺＵＳＨＩＯホールディングス株式会社,大阪府大阪市港区八幡屋４丁目２－８,2021-08-23,株式会社
Ｙ・Ｂグループ株式会社,山形県山形市本町２丁目３番１４号,2021-08-23,株式会社
Ｙ＆Ｉ株式会社,大阪府豊中市新千里東町３丁目３番５０－１００２号,2021-08-23,株式会社
ＹＧＳ合同会社,福島県いわき市内郷高坂町１丁目９０番地の９,2021-08-23,合同会社
ＹＩＧｓｏｌｕｔｉｏｎ株式会社,東京都千代田区平河町２丁目７番２号９Ｆ,2021-08-23,株式会社
ＺＥＲＡＴＯＸ合同会社,熊本県八代市東陽町河俣２１０９番地,2021-08-23,合同会社
ｅサポート株式会社,福岡県北九州市小倉北区米町１丁目５番１８号,2021-08-23,株式会社
ｆｕｎ－ｐｒｏｄｕｃｅ株式会社,東京都大田区西馬込１丁目４－７－４０１,2021-08-23,株式会社
ｋａｉｔｏ株式会社,奈良県奈良市学園朝日町３－９シティパレス学園前１０３号室,2021-08-23,株式会社
ｔｉｃｋｅｔｉｆｙ株式会社,福井県坂井市三国町宿２丁目５－２１,2021-08-23,株式会社
ｕｓ合同会社,福井県福井市栄町７の２３番地,2021-08-23,合同会社
うずまきプロダクション株式会社,東京都渋谷区千駄ヶ谷３丁目１７番１１号,2021-08-24,株式会社
かける不動産株式会社,山口県下関市員光町３丁目７番２８号,2021-08-24,株式会社
きび合同会社,東京都世田谷区経堂４丁目１７番７－１５０１号,2021-08-24,合同会社
きょうのグルメ株式会社,東京都港区浜松町２丁目２番１５号浜松町ダイヤビル２Ｆ,2021-08-24,株式会社
でざいん不動産株式会社,埼玉県熊谷市中央２丁目２５１番地,2021-08-24,株式会社
ときわ合同会社,山梨県南都留郡富士河口湖町船津５２１５番地８,2021-08-24,合同会社
ひとつ株式会社,宮崎県宮崎市昭和町２１番地,2021-08-24,株式会社
アイフライテックオートモーティブ・ジャパン株式会社,神奈川県横浜市港北区新横浜２丁目３－１２新横浜スクエアビル１４Ｆ,2021-08-24,株式会社
アイ・ケイ管理合同会社,東京都八王子市小宮町９７３番地,2021-08-24,合同会社
アグリ淡海株式会社,滋賀県彦根市犬方町６１４番地,2021-08-24,株式会社
インクレイズテクノロジー株式会社,東京都中央区銀座１丁目１２－４Ｎ＆ＥＢＬＤ．７階,2021-08-24,株式会社
インターナショナルトレーダー合同会社,東京都北区神谷３丁目３６番６号,2021-08-24,合同会社
エアースマイル株式会社,大阪府大阪市北区曾根崎新地２丁目２番１６号西梅田ＭＩＤビル９階,2021-08-24,株式会社
エムコインズ合同会社,東京都中野区中野５丁目５２番１５号,2021-08-24,合同会社
エムプラス株式会社,大阪府大阪市西区九条１丁目２６番８号,2021-08-24,株式会社
エル・ビー・ウエルド株式会社,愛知県名古屋市西区那古野２丁目１４番１号,2021-08-24,株式会社
オフィスリンク株式会社,大阪府大阪市北区東天満１丁目３番１５号,2021-08-24,株式会社
オーパスファンディング５合同会社,東京都千代田区丸の内３丁目１番１号東京共同会計事務所内,2021-08-24,合同会社
カンセイホーム宮古島合同会社,沖縄県宮古島市平良字西仲宗根５５７番地１,2021-08-24,合同会社
クリーンライフ株式会社,神奈川県横浜市戸塚区平戸町１２１２番地１０３,2021-08-24,株式会社
クレスト株式会社,岡山県岡山市中区湊７８－１５,2021-08-24,株式会社
グッドループ株式会社,東京都港区海岸１丁目７番１号東京ポートシティ竹芝オフィスタワー８Ｆ,2021-08-24,株式会社
グランディール合同会社,東京都港区浜松町２丁目２－１５,2021-08-24,合同会社
グリーンボンド株式会社,京都府京都市上京区今出川通智恵光院西入西北小路町２４８,2021-08-24,株式会社
グレイスジャパン合同会社,東京都葛飾区堀切１丁目５番９号,2021-08-24,合同会社
サンフォレストコーポレーション株式会社,東京都足立区入谷１丁目１４番１５号,2021-08-24,株式会社
ジーライオンファイナンス＆リース株式会社,兵庫県神戸市中央区新港町１１番１号,2021-08-24,株式会社
スギナＨＤ株式会社,福島県南会津郡南会津町田島字西町甲４３５９番地,2021-08-24,株式会社
スミダ装美合同会社,東京都墨田区東向島６丁目３７番４号,2021-08-24,合同会社
ソレコレ株式会社,福岡県福岡市西区上山門２丁目１２番３９－２号,2021-08-24,株式会社
タイヨ株式会社,兵庫県神戸市東灘区深江南町４丁目１３番２７号,2021-08-24,株式会社
ツナガル株式会社,岐阜県瑞穂市美江寺９２９番地１,2021-08-24,株式会社
ディガーコンサルティング合同会社,東京都中央区銀座１丁目２２番１１号銀座大竹ビジデンス２階,2021-08-24,合同会社
ナインファイブ株式会社,大阪府池田市満寿美町５番２６－３０５号,2021-08-24,株式会社
ノーティラス株式会社,東京都渋谷区神宮前２丁目１４番１８号４Ｆ,2021-08-24,株式会社
ビズコード株式会社,東京都中央区銀座１丁目２２番１１号－２Ｆ,2021-08-24,株式会社
ビリアングル株式会社,東京都板橋区南町１２番９号南町ビル５Ｆ,2021-08-24,株式会社
ファイア・アイ・セキュリティ株式会社,東京都千代田区神田錦町３丁目２２番地テラススクエア８階,2021-08-24,株式会社
フィンポート税理士法人,東京都千代田区麹町２丁目８番地ＭＬＣ麹町ビル４階,2021-08-24,その他の設立登記法人
プランビー株式会社,滋賀県大津市大萱１丁目１－９,2021-08-24,株式会社
ポレーヌ・ジャパン株式会社,東京都中央区日本橋室町４丁目３番９号,2021-08-24,株式会社
マッチング株式会社,東京都足立区千住１丁目４番１号東京芸術センター１０階,2021-08-24,株式会社
