法人名,住所,設立日,法人種別
株式会社デザインラボルナソル,神奈川県横浜市緑区東本郷５丁目２２番１３号,2016-12-21,株式会社
株式会社デリス,東京都三鷹市下連雀３丁目３１番２号,2016-12-21,株式会社
株式会社トルネードジャパン,愛知県安城市三河安城南町１丁目９番地５,2016-12-21,株式会社
株式会社トレデキム,東京都新宿区西新宿７丁目７番地の２４ＧＳプラザ新宿,2016-12-21,株式会社
株式会社トータルサービス,大阪府摂津市別府１丁目１８番１号,2016-12-21,株式会社
株式会社ドリームズ沖縄,沖縄県石垣市美崎町２番地５大和ビル１階,2016-12-21,株式会社
株式会社ナチュラル・ウインド,埼玉県さいたま市西区宮前町６３３番地１３,2016-12-21,株式会社
株式会社ネクスト・イノベーション,埼玉県川越市大字砂５２番地１５,2016-12-21,株式会社
株式会社ネクセラ,長野県塩尻市大門八番町３番２８号,2016-12-21,株式会社
株式会社ノースヒル,北海道札幌市南区常盤二条１丁目５番２２号,2016-12-21,株式会社
株式会社ハートリンクケア,大阪府大阪市中央区南本町１丁目４番１０号,2016-12-21,株式会社
株式会社バスクデザイン,東京都小平市花小金井南町３丁目３７番１８－７号,2016-12-21,株式会社
株式会社バズベース,兵庫県神戸市中央区御幸通３丁目１番２１－３０４号,2016-12-21,株式会社
株式会社バックアップ,福岡県福岡市早良区有田６丁目１２番８号,2016-12-21,株式会社
株式会社パピルス,岡山県岡山市南区福富西１丁目１８番３１号,2016-12-21,株式会社
株式会社ヒデコーポレーション,福岡県福岡市早良区原３丁目１７番３５号,2016-12-21,株式会社
株式会社ヒューマンサービス,東京都台東区浅草橋５丁目２０番８号,2016-12-21,株式会社
株式会社フォーチュンコンパス,大阪府大阪市阿倍野区旭町１丁目１番１０号竹澤ビル４階,2016-12-21,株式会社
株式会社フジモトファーム,熊本県菊池郡菊陽町大字久保田７２７番地１,2016-12-21,株式会社
株式会社フューチャーイノベーション,愛知県岡崎市土井町字藤ノ木乙１４番地,2016-12-21,株式会社
株式会社フリーウェール,京都府京都市山科区大宅岩屋殿３番地７２,2016-12-21,株式会社
株式会社ブライトキューブ,埼玉県さいたま市南区太田窪４丁目１８番２号,2016-12-21,株式会社
株式会社ブルーム,神奈川県相模原市中央区淵野辺本町３丁目３８番４号,2016-12-21,株式会社
株式会社ブレイブリー,兵庫県尼崎市小中島３丁目１０番７－６０９号,2016-12-21,株式会社
株式会社ブレス,東京都世田谷区中町１丁目１６番７号,2016-12-21,株式会社
株式会社プレイマン,大阪府堺市堺区神明町西１丁１番７－７０１号,2016-12-21,株式会社
株式会社プレナタルキッチン,東京都中央区銀座７丁目１５番８号,2016-12-21,株式会社
株式会社ヘルスサポート,大阪府大阪市中央区常盤町２丁目３番１６号,2016-12-21,株式会社
株式会社ペーブメント,東京都世田谷区等々力２丁目５番２０号,2016-12-21,株式会社
株式会社マルキース,東京都港区南青山４丁目２４番４号ＴＫハウス１０１号室,2016-12-21,株式会社
株式会社マレーシア留学ネット,鳥取県鳥取市立川町２丁目２０５番地,2016-12-21,株式会社
株式会社メモリーズ,埼玉県吉川市きよみ野４丁目１８番地４,2016-12-21,株式会社
株式会社メリーホッパーズ,熊本県熊本市東区水源２丁目２３番８号,2016-12-21,株式会社
株式会社ヤヌクカンパニー,福岡県筑紫郡那珂川町松木２丁目２８番地１（楠の杜３０１号）,2016-12-21,株式会社
株式会社ヤマサス工業,徳島県板野郡松茂町中喜来字提外９７番地８,2016-12-21,株式会社
株式会社ラウンド・コンサルティング,東京都調布市染地２丁目４番地５３,2016-12-21,株式会社
株式会社ランドマネジメント,埼玉県さいたま市北区日進町１丁目５７３番地１,2016-12-21,株式会社
株式会社ラーク,東京都文京区後楽２丁目１番８号,2016-12-21,株式会社
株式会社ラーメン屋けん,神奈川県川崎市中原区今井南町１９番９号,2016-12-21,株式会社
株式会社リエゾン,奈良県北葛城郡広陵町馬見北３丁目３番３１号,2016-12-21,株式会社
株式会社リコー,茨城県つくば市上ノ室１５０７番地３,2016-12-21,株式会社
株式会社レフト,奈良県北葛城郡王寺町畠田３丁目８番６１号,2016-12-21,株式会社
株式会社ロイヤルクリーン,鹿児島県鹿屋市田崎町４５４８番地,2016-12-21,株式会社
株式会社ワイズエンジニアリング,茨城県土浦市下高津３丁目６番１９号,2016-12-21,株式会社
株式会社ワンダフル,大分県大分市大字下判田２８３２番地,2016-12-21,株式会社
株式会社ヴェステンマッキナ,大阪府豊中市新千里南町２丁目４番１２－７０２号,2016-12-21,株式会社
株式会社一会,愛知県名古屋市天白区島田４丁目２４１１番地,2016-12-21,株式会社
株式会社一位,東京都足立区千住中居町１番２３号,2016-12-21,株式会社
株式会社一盛商事,東京都渋谷区道玄坂１丁目１５番３号,2016-12-21,株式会社
株式会社一貫道,青森県青森市大字大野字片岡１０番地１８コーポはやし１号,2016-12-21,株式会社
株式会社三喜,大阪府大阪市天王寺区生玉前町１番２６号情報センタービル４階,2016-12-21,株式会社
株式会社三日月,大阪府箕面市桜４丁目１３番１７号,2016-12-21,株式会社
株式会社三浦トラスト不動産,東京都渋谷区道玄坂２丁目１５番１号ノア道玄坂４１３号,2016-12-21,株式会社
株式会社上善,神奈川県相模原市中央区淵野辺３丁目１１番８号グリーンハイム１０２,2016-12-21,株式会社
株式会社住宅のお医者さん,鳥取県米子市明治町１９７番地,2016-12-21,株式会社
株式会社健伸組,沖縄県中頭郡西原町字与那城２６７番地の９,2016-12-21,株式会社
株式会社六建,埼玉県川口市大字差間２０番地の１４,2016-12-21,株式会社
株式会社千場,熊本県熊本市南区出仲間５丁目５番６２号,2016-12-21,株式会社
株式会社友和工業,香川県坂出市西庄町１０９２番地２,2016-12-21,株式会社
株式会社叶多,東京都練馬区桜台１丁目４番１１号,2016-12-21,株式会社
株式会社吉成工業,愛知県名古屋市中区大須１丁目７番１４号パークＩＭビル２Ｆ,2016-12-21,株式会社
株式会社同,大阪府大阪市浪速区恵美須西３丁目３番２６号,2016-12-21,株式会社
株式会社四郎園製作所,福岡県北九州市戸畑区牧山海岸２番１５号,2016-12-21,株式会社
株式会社大子メガソーラーパーク,広島県福山市南手城町１丁目１７番１１号,2016-12-21,株式会社
株式会社大宗ホールディングス,東京都渋谷区道玄坂２丁目１０番７号,2016-12-21,株式会社
株式会社小名浜つりエサセンター,福島県いわき市小名浜字栄町２６番地,2016-12-21,株式会社
株式会社山口測量コンサルタンツ,神奈川県相模原市緑区西橋本４丁目１０番１号,2016-12-21,株式会社
株式会社山湖商事,鹿児島県志布志市松山町泰野３６９６番地２,2016-12-21,株式会社
株式会社岩本建築企画,東京都武蔵野市吉祥寺北町１丁目１８番３号コーポむさしの３０Ａ,2016-12-21,株式会社
株式会社日本海サポート,山形県酒田市米島字下新田２７番地の２,2016-12-21,株式会社
株式会社日照興業,東京都渋谷区広尾２丁目１７番２６号広尾パサージュＡ,2016-12-21,株式会社
株式会社明宝興産,東京都渋谷区上原１丁目３５番９号,2016-12-21,株式会社
株式会社昭和金属,熊本県上益城郡山都町上寺８０６番地,2016-12-21,株式会社
株式会社智工務店,東京都大田区大森南３丁目１２番１２号,2016-12-21,株式会社
株式会社朝日,神奈川県横浜市鶴見区朝日町１丁目１５番地,2016-12-21,株式会社
株式会社朝霞建工,埼玉県朝霞市東弁財１丁目１番２４－７０１号,2016-12-21,株式会社
株式会社東京フィルムズ,東京都新宿区歌舞伎町１丁目１番５－３０１号,2016-12-21,株式会社
株式会社東邦水産,沖縄県うるま市与那城平安座８２４２番地１,2016-12-21,株式会社
株式会社柳田アセットコーポレーション,兵庫県高砂市荒井町千鳥２丁目６番２０号,2016-12-21,株式会社
株式会社桜蓮,愛知県田原市西神戸町神明前３９番地１,2016-12-21,株式会社
株式会社森高牧場,北海道厚岸郡厚岸町宮園１丁目３７６番地,2016-12-21,株式会社
株式会社歌藤,奈良県吉野郡吉野町大字吉野山３０５６番地,2016-12-21,株式会社
株式会社渡辺工業,大阪府大阪市浪速区桜川２丁目３番１２－１３０２号,2016-12-21,株式会社
株式会社熊谷商店,岐阜県羽島市江吉良町２０番地１,2016-12-21,株式会社
株式会社産学官連携エンジニアリングセンター,愛知県名古屋市昭和区御器所町字木市２９番,2016-12-21,株式会社
株式会社田中軽天工業,徳島県徳島市国府町芝原字中庄２０番地の１４,2016-12-21,株式会社
株式会社留学のチカラ,東京都千代田区有楽町１丁目１２番１号,2016-12-21,株式会社
株式会社百年の会,東京都千代田区神田淡路町２丁目４番７号,2016-12-21,株式会社
株式会社竹内電工,兵庫県尼崎市上ノ島町１丁目２０番３号,2016-12-21,株式会社
株式会社絆フーズ,埼玉県加須市中央１丁目７－４７田辺ビル１Ｆ,2016-12-21,株式会社
株式会社美働,東京都渋谷区代々木２丁目１１番２号由井ビル３Ｆ,2016-12-21,株式会社
株式会社翔和,千葉県流山市鰭ケ崎８－３－２Ｂ,2016-12-21,株式会社
株式会社芭巣亭,東京都日野市南平７丁目７番８号,2016-12-21,株式会社
株式会社茂原火力発電所,東京都港区南青山２丁目２６番１号,2016-12-21,株式会社
株式会社轍梱包サービス,東京都葛飾区亀有４丁目２２番１号,2016-12-21,株式会社
株式会社金原牧場,北海道名寄市風連町字日進６３１番地４,2016-12-21,株式会社
株式会社金谷興業,石川県白山市横江町６５６番地２６,2016-12-21,株式会社
株式会社長谷川事務所,大阪府大阪市西淀川区野里３丁目４番３－６１２,2016-12-21,株式会社
株式会社陵雅建築,福島県郡山市備前舘１丁目６７番地,2016-12-21,株式会社
株式会社隼Ａｕｔｏ　Ｉｎｔｅｒｎａｔｉｏｎａｌ,福岡県飯塚市太郎丸２８７番地１,2016-12-21,株式会社
株式会社青山製作所,東京都渋谷区代々木３丁目２４番３号,2016-12-21,株式会社
株式会社食ぱん道,長野県長野市篠ノ井横田６３２番地,2016-12-21,株式会社
株式会社鳳,東京都足立区栗原１丁目６番２２号,2016-12-21,株式会社
株式会社ＡＩＳ,東京都品川区大井２丁目３番１号,2016-12-21,株式会社
株式会社ＡＲＣＳ,京都府京都市伏見区横大路天王後１番地３辻村ビル３階,2016-12-21,株式会社
株式会社ＡＴトランスポーター,東京都足立区鹿浜４丁目２１番２０号,2016-12-21,株式会社
株式会社Ａｓｓｉｓｔ,大阪府守口市佐太中町５丁目５番１５号,2016-12-21,株式会社
株式会社Ａｔｅｌｉｅｒ　ＴＡＫＡ,山梨県甲斐市龍地５２４３番地,2016-12-21,株式会社
株式会社ＢＵＢＬＥ,東京都八王子市高倉町２１番地１４レクシオ北八王子５０３号,2016-12-21,株式会社
株式会社Ｂｅｙｏｎｄ,神奈川県横浜市神奈川区六角橋３丁目１３番１９号,2016-12-21,株式会社
株式会社ＢｒｉｇｈｔＧａｍｅｓ,東京都武蔵野市西久保３丁目１３番１２号,2016-12-21,株式会社
株式会社ＣＨＥＲＲＹ,東京都武蔵野市関前３丁目４番１８号,2016-12-21,株式会社
株式会社ＣＩＣＥＬＹ,東京都渋谷区千駄ヶ谷３丁目１５番９号,2016-12-21,株式会社
株式会社ＣＯＣＯＲＯ,山口県周南市築港町３番９号,2016-12-21,株式会社
株式会社ＣＯＤＡ　ＣＨＩＡＶＥ,東京都文京区白山１丁目５番５号,2016-12-21,株式会社
株式会社Ｃａｓｔｅｌｌａ　ｄｏ　Ｐａｕｌｏ,京都府京都市上京区御前通今小路上る馬喰町８９７蔵Ａ,2016-12-21,株式会社
株式会社Ｄ　ｐｌｕｓ,兵庫県西宮市木津山町１１－１１クォーターバレル木津山３０１,2016-12-21,株式会社
株式会社Ｄ．Ｃ．Ｔ　ＨＯＬＤＩＮＧＳ,大阪府大阪市北区角田町８－４７阪急グランドビル２０階,2016-12-21,株式会社
株式会社Ｄｅ　ＡＮＺＡ,愛知県名古屋市天白区表台８５番地,2016-12-21,株式会社
株式会社Ｄｅｂｏｎａｉｒ,東京都世田谷区三軒茶屋１丁目５番１４号パラスティⅠ２０３,2016-12-21,株式会社
株式会社ＦＡＲＳＡ,福岡県北九州市小倉北区香春口２丁目１０番８－３０４号,2016-12-21,株式会社
株式会社ＦＨダイニング,東京都武蔵野市吉祥寺本町１丁目２２番９号,2016-12-21,株式会社
株式会社ＦＲＡＮＫ,東京都調布市調布ケ丘１丁目１４番地２１,2016-12-21,株式会社
株式会社ＦＲＥＥコンサルティング,東京都品川区西五反田１丁目２７番１号,2016-12-21,株式会社
株式会社ＦＲＭ,東京都港区三田１丁目２番１８号ＴＴＤビル,2016-12-21,株式会社
株式会社ＦａＤＩＣ,東京都豊島区東池袋１丁目１３番１号,2016-12-21,株式会社
株式会社Ｆｉｒｓｔ,大阪府大阪市中央区南本町３丁目２番９号－４階,2016-12-21,株式会社
株式会社Ｆｒａｕｅｎ　Ｐｌａｎ,鹿児島県姶良市東餅田５０２番地２,2016-12-21,株式会社
株式会社ＧＭＬパートナーズ,神奈川県横浜市中区山手町１３９番地１１,2016-12-21,株式会社
株式会社Ｇｏ　Ｎｅｘｔ,茨城県つくば市天久保１丁目６番地１ヤマキビル１０２号,2016-12-21,株式会社
株式会社Ｇｏ　ｅｖｅｒｙ,東京都新宿区西新宿１丁目３番３号,2016-12-21,株式会社
株式会社Ｈａｐｐｙ　Ｈｏｐｅ,大阪府枚方市高田２丁目１２番１号,2016-12-21,株式会社
株式会社ＩＤ　ＣＯＮＳＵＬＴＩＮＧ,東京都中央区築地４丁目５番９号築地安田第２ビル４階,2016-12-21,株式会社
株式会社ＩＶＮ,埼玉県川口市大字芝６３３３番地,2016-12-21,株式会社
株式会社ＪＨニューロン,大阪府大阪市北区与力町１番５号,2016-12-21,株式会社
株式会社Ｊｒｏｕｔ,大阪府大阪市中央区島之内１丁目１１－２２フィレンツェ１１１５,2016-12-21,株式会社
株式会社Ｋスタイル,愛知県名古屋市西区名西２丁目１５番１号,2016-12-21,株式会社
株式会社Ｋ＆Ｋ　Ａｓｓｅｔ　Ｍａｎａｇｅｍｅｎｔ,福岡県春日市宝町４丁目１２番地３シンフォニア宝町Ａ棟,2016-12-21,株式会社
株式会社ＫＡＺＵＰプロダクション,東京都新宿区新宿７丁目２６番７号,2016-12-21,株式会社
株式会社ＫＩＧ,岡山県岡山市北区春日町３番１１号,2016-12-21,株式会社
株式会社ＫＪエネルギー,埼玉県入間市大字上藤沢５１７番地９,2016-12-21,株式会社
株式会社ＫＯＰ,埼玉県富士見市東みずほ台２丁目８番地９,2016-12-21,株式会社
株式会社ＫＳＳ,富山県富山市根塚町２丁目３番地１,2016-12-21,株式会社
株式会社ＫＹ田中農園,兵庫県宍粟市山崎町高所４１２番地,2016-12-21,株式会社
株式会社Ｌｉｓｔｏ,東京都港区三田２丁目２０番１７号,2016-12-21,株式会社
株式会社Ｍ’ｓコーポレーション,東京都世田谷区太子堂４丁目２６番９号３階,2016-12-21,株式会社
株式会社Ｍ＆Ｍ,大阪府堺市堺区甲斐町東６丁１番３０号,2016-12-21,株式会社
株式会社Ｍ＆Ｕ,東京都世田谷区玉川台１丁目１５番２１号,2016-12-21,株式会社
株式会社ＭＫＣ,北海道札幌市中央区南九条西１８丁目２番３５－３０２号,2016-12-21,株式会社
株式会社ＭＹ商事,東京都八王子市長房町５８８番地長房アパート西１６－５０２号,2016-12-21,株式会社
株式会社ＭＹｉｎｎｏｖａｔｉｏｎ,徳島県徳島市鷹匠町１丁目５３番地,2016-12-21,株式会社
株式会社Ｍｅｅｔｏ,福岡県福岡市早良区百道１丁目１６番３２号,2016-12-21,株式会社
株式会社Ｍｒ．ＫＩＮＹＵＫＩ,沖縄県那覇市牧志３丁目１８番２３号,2016-12-21,株式会社
株式会社Ｏ．Ｚ,東京都千代田区岩本町２丁目８番１０号神田永谷マンション５０５号室,2016-12-21,株式会社
株式会社ＯＣＴ,千葉県市原市桜台１丁目１６番地１,2016-12-21,株式会社
株式会社Ｐｏｉｎｔ,北海道札幌市中央区北三条西２丁目１番地カミヤマビル６Ｆ,2016-12-21,株式会社
株式会社ＲＥＧＯＬＩＴＨ,神奈川県横浜市都筑区荏田東２丁目１番３１号エクセルプラザふれあいの丘１０１,2016-12-21,株式会社
株式会社ＳＡＫＡＩ,神奈川県川崎市川崎区観音１丁目５番地１６号,2016-12-21,株式会社
株式会社ＳＤ２,東京都渋谷区道玄坂２丁目１０番７号,2016-12-21,株式会社
株式会社ＳＥＫＡＩＥ,東京都新宿区中落合２丁目２７番１７号関口ビル３階,2016-12-21,株式会社
株式会社ＳＩＬＡＷＡＴ　ＴＲＡＤＩＮＧ　ＣＯＭＰＡＮＹ,栃木県小山市駅南町５丁目１４番１４号,2016-12-21,株式会社
株式会社ＳＩＮＡＮ,埼玉県朝霞市膝折町４丁目１２番３６号,2016-12-21,株式会社
株式会社ＳＫＮ,島根県松江市東出雲町揖屋１６番地６,2016-12-21,株式会社
株式会社ＳＬＰｌａｎｎｉｎｇ,東京都千代田区神田佐久間町３丁目１９番地１ローヤルシティ神田佐久間町１１０２号,2016-12-21,株式会社
株式会社ＳＯＬＵＭ,福岡県福岡市南区横手２丁目９番２－２０１号,2016-12-21,株式会社
株式会社ＳＰＥＳ,東京都新宿区四谷１丁目９番地,2016-12-21,株式会社
株式会社ＳＴインターナショナル,大阪府大阪市淀川区宮原１丁目１９番１０号新大阪エクセルビル５０２,2016-12-21,株式会社
株式会社ＳＴＥＰ,鳥取県鳥取市船木１６２番地,2016-12-21,株式会社
株式会社ＳＴＹＬＥ,神奈川県横浜市旭区下川井町２２０１番地６,2016-12-21,株式会社
株式会社ＳＵＺＵＫＩ－ＹＡ,東京都中野区南台３丁目３７番２０号,2016-12-21,株式会社
株式会社ＳｍｉｌｅＰｒｏｖｉｄｅ,新潟県新潟市東区はなみずき１丁目５番９号,2016-12-21,株式会社
株式会社Ｓｔｉｌｌｍａｔｉｃ,東京都渋谷区宇田川町３７番１４号篠原ビル４０１,2016-12-21,株式会社
株式会社Ｔ’ｓ　Ｓｕｐｐｏｒｔ,東京都杉並区宮前１丁目１９番２－８０１号,2016-12-21,株式会社
株式会社ＴＧ１,大阪府大阪市住吉区苅田２丁目９番２７号,2016-12-21,株式会社
株式会社ＴＭアームス,東京都世田谷区成城２丁目２１番６号,2016-12-21,株式会社
株式会社ＴＯＭＯＥ,神奈川県川崎市川崎区日進町２７番地１８朝日サンライズ川崎３２０,2016-12-21,株式会社
株式会社ＴＯＲＥＮＴＡＤＵＥ,埼玉県さいたま市北区日進町１丁目５７１番地７,2016-12-21,株式会社
株式会社ＴＲＵＳＴ　ＷＯＲＫＳ,大阪府茨木市上泉町９番１０号山村マンション１０１号,2016-12-21,株式会社
株式会社ＴＳビルディ,東京都足立区西綾瀬２丁目４番１号,2016-12-21,株式会社
株式会社ＴＴＹコーポレーション,栃木県宇都宮市竹下町１１００番地５７,2016-12-21,株式会社
株式会社ＴＵＮＡＧＩ　ＪＡＰＡＮ,東京都渋谷区神南１丁目１３番４号ＩＤＯビル１階Ｂ,2016-12-21,株式会社
株式会社Ｔａｎｇｅｒｉｎｅｓｋｙ,東京都品川区大井１丁目４３番２号,2016-12-21,株式会社
株式会社ＴｈｅＮｅｘｔＣｒｅａｔｅ,東京都中央区新川２丁目２１－１０リードシー八丁堀２Ｆ－６,2016-12-21,株式会社
株式会社ＴｒｅｅＷａｔｅｒ,東京都世田谷区赤堤１丁目３８番１６号,2016-12-21,株式会社
株式会社ＵＮＩ　ＧＡＴＥ,東京都稲城市若葉台３丁目１番地の１,2016-12-21,株式会社
株式会社ＵＱホールディングス,茨城県守谷市本町４２４８番地１,2016-12-21,株式会社
株式会社ＵＳトラスト,埼玉県さいたま市緑区大字下野田２６８番地,2016-12-21,株式会社
株式会社ＷｏｒｋＤｉｖｅ,東京都台東区台東１丁目１１－２鈴木ビル２Ｆ,2016-12-21,株式会社
株式会社ＹＡＴパートナーズ,大阪府東大阪市小阪本町１丁目１２番４号フランス館Ｂ－１,2016-12-21,株式会社
株式会社ＹＪ　Ｎｅｘｔ,東京都墨田区江東橋１丁目１２番１号,2016-12-21,株式会社
株式会社ＹＭコーポレーション,千葉県千葉市花見川区長作町９２５番地３１,2016-12-21,株式会社
株式会社Ｙｕｕ,福島県郡山市安積町成田字田向１５０番地の２７４,2016-12-21,株式会社
株式会社ＺＥＲＯ　ＯＮＥ,福島県郡山市横塚５丁目２１－３０,2016-12-21,株式会社
株式会社ＺｅｎＬａｂｏ,大阪府大阪市中央区千日前１丁目７番６号,2016-12-21,株式会社
株式会社ａｒｔｉｃｏｌｏ．,大阪府大阪市中央区備後町３丁目１番２号日宝アトラスビル,2016-12-21,株式会社
株式会社ｃａｌｏｎ　ｌａｎ,静岡県静岡市駿河区中吉田１７番２２号,2016-12-21,株式会社
株式会社ｅｉｇｈｔ,鳥取県倉吉市東巌城町３６番地２,2016-12-21,株式会社
株式会社ｉｎｇｓ,岡山県倉敷市福田町古新田９３３番地５０,2016-12-21,株式会社
株式会社ｌｉｎｋ　ｕｐ　ｐｈｏｔｏｇｒａｐｈｙ,新潟県新潟市東区山木戸４丁目１１番２号,2016-12-21,株式会社
株式会社ｐｒｉｍｅ　ｌｅａｐ,東京都文京区後楽２丁目６番１－１１１２号,2016-12-21,株式会社
株式会社ｓｕｐｅｒ．ｉｎｆｏ．ｓａｌｅｓ．ｃｏｍ．,石川県金沢市橋場町６番１７号,2016-12-21,株式会社
株式会社ｗｅｌｔｅｍｍａ,兵庫県宝塚市栄町３丁目８番３号,2016-12-21,株式会社
森山建設株式会社,新潟県新潟市西区西小針台２丁目７番２号,2016-12-21,株式会社
永信外貿交流合同会社,東京都北区赤羽台１丁目４番４１－２０５号,2016-12-21,合同会社
永斗建設株式会社,東京都八王子市散田町４丁目１０番１６号,2016-12-21,株式会社
永發総合合同会社,千葉県富里市日吉台４丁目７番地９（ＫＩビル１０１号）,2016-12-21,合同会社
池尻産業株式会社,神奈川県川崎市麻生区万福寺１丁目１３番１号,2016-12-21,株式会社
沼津医師クラブ,静岡県沼津市八幡町８２番地,2016-12-21,その他
浙江前明植物カプセル科学技術株式会社,東京都中央区銀座５丁目１５番１号,2016-12-21,株式会社
湯船原開発株式会社,福井県福井市宝永４丁目３番１号三井生命福井ビル８階,2016-12-21,株式会社
滝口冷機株式会社,埼玉県川口市大字安行領根岸１０９２番地の８,2016-12-21,株式会社
熊本建商合同会社,熊本県熊本市東区上南部３丁目２７番１１号,2016-12-21,合同会社
特定非営利活動法人あしすと,京都府京都市西京区上桂今井町１３８番地,2016-12-21,その他の設立登記法人
特定非営利活動法人きらきら輝くまるですよ,愛知県名古屋市緑区滝ノ水３丁目１９０３番地,2016-12-21,その他の設立登記法人
特定非営利活動法人くにたち農園の会,東京都国立市谷保５０６９番地,2016-12-21,その他の設立登記法人
特定非営利活動法人ゲンキ,岐阜県大垣市島里２丁目８６番地,2016-12-21,その他の設立登記法人
特定非営利活動法人ユウキ,愛知県名古屋市緑区有松町大字桶狭間字高根３９番第１２番地,2016-12-21,その他の設立登記法人
特定非営利活動法人八千代市市民活動団体連合会,千葉県八千代市大和田新田９３１番地１,2016-12-21,その他の設立登記法人
