法人名,住所,設立日,法人種別
合同会社ＰＡＲＥＷＡ　ＩＮＴＥＲＮＡＴＩＯＮＡＬ,愛知県大府市半月町２丁目１４番地第一門脇ビル１階,2018-02-15,合同会社
合同会社ＰＡＴＨＩＲＡＮＩＡ　ＧＬＯＢＡＬ　ＩＮＴＥＲＮＡＴＩＯＮＡＬ,茨城県筑西市倉持１１２８番地坂入住宅６号室,2018-02-15,合同会社
合同会社Ｐｒｏｆｉｔ,福井県福井市照手町４丁目２２０３番地,2018-02-15,合同会社
合同会社ＲＪＨ,東京都杉並区上荻４丁目２１番１５－６０５号,2018-02-15,合同会社
合同会社Ｒｅ,兵庫県神戸市北区鈴蘭台北町６丁目１０番１５号,2018-02-15,合同会社
合同会社Ｒｅｃｏｎｎｅｃｔ,沖縄県中頭郡読谷村字楚辺２２６３番地２Ｆ,2018-02-15,合同会社
合同会社ＳＩＸ　ＤＥＧＲＥＥＳ　ＺＥＲＯ,東京都港区芝４丁目３番２号,2018-02-15,合同会社
合同会社ＳＯＬＡＲＩＡ,京都府京都市中京区烏丸通二条下る秋野々町５２９番地,2018-02-15,合同会社
合同会社Ｓｉｍｐｌｅｘ,東京都世田谷区南烏山６丁目１１番２－２０８号,2018-02-15,合同会社
合同会社Ｔ－スタイル,千葉県浦安市日の出５丁目３番Ｄ－７０６号,2018-02-15,合同会社
合同会社ＴＣファルマ,香川県坂出市福江町１丁目１番２１号,2018-02-15,合同会社
合同会社ａｒｍｚ,埼玉県さいたま市岩槻区太田２丁目１番２７号,2018-02-15,合同会社
合同会社ｍ＆ｍ’ｓパートナーズ,大阪府和泉市室堂町５番地の１（７－６０６）,2018-02-15,合同会社
合同会社ｍｅｖｉｕｓｓ,東京都世田谷区給田４丁目３２番７号,2018-02-15,合同会社
合資会社オーエス電気商会,熊本県熊本市中央区上通町３番１９号,2018-02-15,合資会社
合資共栄会社,山形県長井市寺泉２８１７番地,2018-02-15,合資会社
坂田ロジスティクスジャパン株式会社,大阪府大阪市西区靱本町３丁目９－９,2018-02-15,株式会社
大和興業合同会社,山形県米沢市西大通２丁目３番６３号,2018-02-15,合同会社
大成株式会社,東京都豊島区池袋４丁目９番１１号（２Ｆ）,2018-02-15,株式会社
大松ホールディングス株式会社,茨城県鹿嶋市大字泉川１４５５番地８,2018-02-15,株式会社
大竹博まごころ保険株式会社,栃木県栃木市吹上町４０２番地,2018-02-15,株式会社
大鵬株式会社,東京都品川区西五反田７丁目２３番１１－３０５号,2018-02-15,株式会社
天合株式会社,東京都新宿区新宿１丁目２４番７－４２２号,2018-02-15,株式会社
天送合同会社,福岡県福岡市南区野多目１丁目８番２－５０５号,2018-02-15,合同会社
宏日金属株式会社,大阪府東大阪市高井田２番１８号,2018-02-15,株式会社
宮川林産合同会社,宮崎県日南市北郷町郷之原乙３９８０番地２９,2018-02-15,合同会社
富山県社会保険労務士政治連盟,富山県富山市千歳町１丁目６－１８河口ビル２階,2018-02-15,その他
寺垣水産合同会社,北海道室蘭市宮の森町３丁目１６番２３号,2018-02-15,合同会社
尾﨑幸工務店株式会社,京都府宇治市神明宮東２３番地の５３,2018-02-15,株式会社
川下山林共有,大分県日田市大字川下高井町２７１,2018-02-15,その他
広島県東部家畜商業協同組合,広島県福山市引野町１丁目１番１号,2018-02-15,その他の設立登記法人
所沢市北秋津上安松土地区画整理組合,埼玉県所沢市大字北秋津４７１－１,2018-02-15,その他
文敏合同会社,東京都板橋区小茂根４丁目１９番１３号,2018-02-15,合同会社
新田株式会社,東京都新宿区北新宿１丁目７番２０号プロスペリタ新宿２０２,2018-02-15,株式会社
日本ピアノ総合管理合同会社,岡山県岡山市北区本町６－３６第一セントラルビル４Ｆ,2018-02-15,合同会社
日本高倫国際株式会社,東京都豊島区池袋３丁目３４番７号,2018-02-15,株式会社
日楽株式会社,大阪府大阪市天王寺区上本町８丁目９番２３号,2018-02-15,株式会社
旭興産株式会社,東京都杉並区阿佐谷北１丁目３番８号,2018-02-15,株式会社
有限会社埼群ツール,埼玉県児玉郡上里町大字神保原町１０１１番地２,2018-02-15,有限会社
有限会社愛媛石材,広島県呉市本通２丁目７番１２号,2018-02-15,有限会社
東京ハッシュ株式会社,東京都港区六本木１丁目４番５号アークヒルズサウスタワー１６Ｆ―１４０,2018-02-15,株式会社
東京冬吉健康管理株式会社,東京都港区浜松町２丁目２番１５号浜松町ダイヤビル２Ｆ,2018-02-15,株式会社
東京通販合同会社,東京都品川区西五反田６丁目３番１９号,2018-02-15,合同会社
東京運動記者クラブ,東京都港区東新橋１丁目７－１汐留メディアタワー１９階　共同通信社運動部内,2018-02-15,その他
東福田自治会,宮城県石巻市東福田字馬場９５－１,2018-02-15,その他
松澤企画合同会社,千葉県千葉市花見川区こてはし台６丁目２５番１８号,2018-02-15,合同会社
株式会社うしづ,神奈川県横須賀市根岸町４丁目３５番６号,2018-02-15,株式会社
株式会社かのは,茨城県つくば市今鹿島４８３３番地,2018-02-15,株式会社
株式会社つづき会計事務所,山形県山形市錦町３番２０号錦町須藤ビル２Ｆ,2018-02-15,株式会社
株式会社なおひ,大阪府枚方市楠葉朝日３丁目１０番３０号,2018-02-15,株式会社
株式会社りの,福岡県福津市光陽台４丁目１番１９号,2018-02-15,株式会社
株式会社アイプロセスライン,大阪府大阪市福島区海老江３丁目２番８号,2018-02-15,株式会社
株式会社アイリード,兵庫県三田市川除４０２番地１,2018-02-15,株式会社
株式会社アクトみなかみ,群馬県利根郡みなかみ町湯原８０９番地５,2018-02-15,株式会社
株式会社アシスト,兵庫県神戸市西区伊川谷町有瀬１４番地の２１プリマベーラ３０３号,2018-02-15,株式会社
株式会社アスファシリティ,東京都練馬区大泉町４丁目４５番２号,2018-02-15,株式会社
株式会社アズプラス,愛知県みよし市三好町湯ノ前１１番地１湯之前館２階Ｇ号,2018-02-15,株式会社
株式会社アドゲート,大阪府大阪市北区兎我野町１１番１９号浪速地所ビル４０３号,2018-02-15,株式会社
株式会社アネス,福岡県大牟田市不知火町３丁目１０８番地６,2018-02-15,株式会社
株式会社アルラボ,佐賀県佐賀市駅前中央１丁目８番３２号アイスクエアビル５０１号室,2018-02-15,株式会社
株式会社アレイズ,東京都品川区南品川３丁目５番６号,2018-02-15,株式会社
株式会社アンカーガーディアン,福岡県福岡市中央区大名２丁目１０番４号シャンボール大名Ｄ棟１５０５号,2018-02-15,株式会社
株式会社アンジュルナ,東京都渋谷区広尾４丁目１番２５－１６０３号,2018-02-15,株式会社
株式会社アークシステム,福岡県北九州市若松区浜町１丁目５番１５号,2018-02-15,株式会社
株式会社イエツグ,神奈川県横浜市神奈川区白幡町１番１０号,2018-02-15,株式会社
株式会社イノベートナビ,東京都中央区月島２丁目１０番１号,2018-02-15,株式会社
株式会社インターナショナル,東京都千代田区大手町２丁目６番１号朝日生命大手町ビル３階,2018-02-15,株式会社
株式会社インダストリアルサポーターズ,神奈川県横浜市中区山下町７３番地２山下ポートハイツ１１０４号室,2018-02-15,株式会社
株式会社インディゴ,愛知県豊橋市前田町２丁目１０番地５,2018-02-15,株式会社
株式会社インフィニティ,大阪府大阪市平野区瓜破西２丁目１５番７号プライムコートⅡ２０５,2018-02-15,株式会社
株式会社エスジェイ,東京都港区赤坂２丁目１８番１８号,2018-02-15,株式会社
株式会社エスティブ,大阪府大阪市生野区桃谷２丁目１３番１５号,2018-02-15,株式会社
株式会社エッジウェイズ,大阪府大阪市中央区南船場１丁目３番１７－７０２号,2018-02-15,株式会社
株式会社エマ,長野県上田市緑が丘１丁目９番２２号,2018-02-15,株式会社
株式会社エム,愛知県名古屋市天白区笹原町１７０３番地,2018-02-15,株式会社
株式会社エンターテイメントジャパン,福岡県北九州市小倉北区堺町２丁目１番１号６Ｆ,2018-02-15,株式会社
株式会社オニキス,福岡県北九州市小倉南区蒲生２丁目１１番３２号,2018-02-15,株式会社
株式会社オノマトペ,愛知県一宮市多加木１丁目１６番１４号,2018-02-15,株式会社
株式会社オフィスしろお,東京都江戸川区一之江４丁目３番１６号,2018-02-15,株式会社
株式会社オー・イー・シーコネクト,神奈川県横浜市磯子区杉田３丁目１４番２１号,2018-02-15,株式会社
株式会社カサブランカ,東京都中野区本町４丁目３８番２５号,2018-02-15,株式会社
株式会社ガーデン・ナビ,大阪府四條畷市大字上田原１７６７番地の３,2018-02-15,株式会社
株式会社キャンスマイルカンパニー,山口県玖珂郡和木町和木３丁目４番１９－３号,2018-02-15,株式会社
株式会社キングスランディング,東京都新宿区神楽坂３丁目２－２０ヴァンテ・アン神楽坂２０３,2018-02-15,株式会社
株式会社クライオンズ,東京都目黒区上目黒３丁目１４番９－２１６号,2018-02-15,株式会社
株式会社クレア企画,北海道釧路市緑ケ岡６丁目２番２４号,2018-02-15,株式会社
株式会社グランオフィス,京都府京都市中京区六角通室町西入玉蔵町１２１,2018-02-15,株式会社
株式会社グリーンファーム,福島県郡山市荒井町字荒井２２番地,2018-02-15,株式会社
株式会社グロップマーケティング,東京都中央区銀座１丁目３番９号,2018-02-15,株式会社
株式会社グローバルアカデミー,岡山県倉敷市加須山３４９番地８,2018-02-15,株式会社
株式会社サイダ,千葉県館山市湊１７５番地１,2018-02-15,株式会社
株式会社サンリツ,新潟県新潟市秋葉区蕨曽根１０４５番地,2018-02-15,株式会社
株式会社ザ・フォーラムカントリークラブ,東京都渋谷区恵比寿西１丁目１２番１４号,2018-02-15,株式会社
株式会社シャッターメンテナンスサービス,東京都東久留米市下里６丁目１番３１号,2018-02-15,株式会社
株式会社シーユー,東京都港区赤坂６丁目１９番４１号パークアクシス六本木檜町公園２１０号室,2018-02-15,株式会社
株式会社シーロード,東京都豊島区西巣鴨１丁目９番３号,2018-02-15,株式会社
株式会社ジェイプラン,奈良県生駒郡三郷町立野南２丁目２３－３０,2018-02-15,株式会社
株式会社ジェード,大阪府大阪市中央区難波千日前７番８号タガワビル７Ｆ,2018-02-15,株式会社
株式会社ジミス,千葉県柏市あけぼの２丁目８－１７メゾンＳＫ７－２Ｂ,2018-02-15,株式会社
株式会社ジャストインベストメント,大阪府大阪市中央区瓦町１丁目７番７号ランズ瓦町ビルディング９,2018-02-15,株式会社
株式会社スクイル,東京都新宿区新宿１丁目２４番７号ルネ御苑プラザ５２２,2018-02-15,株式会社
株式会社スマイルテック,岐阜県可児市光陽台１丁目５４番地,2018-02-15,株式会社
株式会社セダーアセットマネジメント,東京都中央区東日本橋２丁目１１番８号,2018-02-15,株式会社
株式会社セナテクノス,大阪府枚方市東香里新町７番１９号,2018-02-15,株式会社
株式会社ソレイユ,千葉県四街道市千代田５丁目１６番８号,2018-02-15,株式会社
株式会社ソーラーフォレスト,石川県金沢市御所町２丁目１５８番地,2018-02-15,株式会社
株式会社ソーワット,東京都練馬区桜台５丁目１番１９号,2018-02-15,株式会社
株式会社ダイケン興業,三重県松阪市駅部田町２８４番地２,2018-02-15,株式会社
株式会社ダイコー図書販売,広島県東広島市八本松町原１０８７５番地１Ａ３０６,2018-02-15,株式会社
株式会社ダイワテックホールディングス,愛知県名古屋市西区大野木３丁目４３番地,2018-02-15,株式会社
株式会社トップエース,愛知県名古屋市中村区太閤通６丁目５番地,2018-02-15,株式会社
株式会社トニーズ,埼玉県東松山市大字下野本８１１番地１,2018-02-15,株式会社
株式会社トムラ,東京都東久留米市幸町５丁目７番１２号,2018-02-15,株式会社
株式会社トライ・ネクスト,東京都千代田区神田多町２丁目５番地,2018-02-15,株式会社
株式会社トルシープガレージ,愛知県豊明市新田町吉池２３番地１３,2018-02-15,株式会社
株式会社ナチュラルアビリティ,東京都葛飾区高砂５丁目３９番地１号サンワールドビル３Ｆ,2018-02-15,株式会社
株式会社ニケ・プロモーション,東京都豊島区東池袋２丁目２１番６－３０２号,2018-02-15,株式会社
株式会社ニュー・クイックホールディングス,東京都千代田区丸の内１丁目６番１号,2018-02-15,株式会社
株式会社ネクシア,山形県東根市神町南２丁目１番２１－７号,2018-02-15,株式会社
株式会社ネクストＫ,茨城県ひたちなか市西大島３丁目１１番２０号,2018-02-15,株式会社
株式会社ノイテクス,埼玉県朝霞市東弁財２丁目１１番２号,2018-02-15,株式会社
株式会社ハックルベリー,静岡県浜松市中区富塚町４０３番地の１７,2018-02-15,株式会社
株式会社ハヤミ建装,東京都世田谷区桜丘５丁目３３番７－１０３号,2018-02-15,株式会社
株式会社パイロットフィッシュ,大阪府大阪市北区天神橋３丁目２番１９号,2018-02-15,株式会社
株式会社ヒッツコミュニケーションズ,大阪府大阪市中央区谷町３丁目１番１８号ＮＳ２１ビル７Ｆ,2018-02-15,株式会社
株式会社ヒロ企画,佐賀県佐賀市久保泉町大字下和泉８１５番地,2018-02-15,株式会社
株式会社ビスターリ,東京都中野区鷺宮６丁目１８番６号,2018-02-15,株式会社
株式会社ビルエージェンシー,埼玉県さいたま市桜区大字五関１３３番地７,2018-02-15,株式会社
株式会社ビーコイル,大阪府南河内郡河南町大字一須賀５５４番地,2018-02-15,株式会社
株式会社ピース測量設計,広島県広島市中区東白島町３番２５号,2018-02-15,株式会社
株式会社ファンドゥ,東京都調布市国領町８丁目４番地１Ｅ－１０１,2018-02-15,株式会社
株式会社フィーズ,神奈川県横浜市青葉区元石川町３７１３番地１４,2018-02-15,株式会社
株式会社フォーリーブズ,東京都文京区西片１丁目１７番４号,2018-02-15,株式会社
株式会社フライウィール,東京都渋谷区渋谷３丁目６番２号エクラート渋谷ビル４階,2018-02-15,株式会社
株式会社フルハウスサポート,岐阜県揖斐郡池田町本郷１１７８番地の２,2018-02-15,株式会社
株式会社プラストホーム,大阪府大阪市北区西天満３丁目１３－１８西天満クリスタルビル２階,2018-02-15,株式会社
株式会社プルーフ,東京都江東区南砂２丁目２４番１４－５０４号,2018-02-15,株式会社
株式会社プログレス,大阪府大阪市港区弁天４丁目１２番６－６０１号,2018-02-15,株式会社
株式会社ホームラン,東京都世田谷区野沢１丁目３５番７号,2018-02-15,株式会社
株式会社ポイント,大阪府大阪市中央区瓦町３丁目２番１０－５０１号,2018-02-15,株式会社
株式会社ミライトデザイン,東京都渋谷区代々木４丁目２３番１３号,2018-02-15,株式会社
株式会社ミラクル,神奈川県大和市中央林間西６丁目９番５号中央林間レジデンスハウスイースト５１０号,2018-02-15,株式会社
株式会社メルコテクノレックス,静岡県掛川市浜川新田字外ノ切開地１９２９番地１,2018-02-15,株式会社
株式会社モナーク,大阪府吹田市内本町１丁目１０番１１－１０７号,2018-02-15,株式会社
株式会社ヤマコー,大阪府大阪市北区西天満１丁目９番１２号西天満ＵＳＵＩビル８０１号,2018-02-15,株式会社
株式会社ライフメトリクス,大阪府大阪市西区阿波座１丁目１３番１３号,2018-02-15,株式会社
株式会社ラグエルジャパン,東京都中央区銀座５丁目６番１２号,2018-02-15,株式会社
株式会社ラジェンヌプロダクション,大阪府大阪市淀川区西中島５丁目７番１９号,2018-02-15,株式会社
株式会社ラストステップ,大阪府大阪市中央区松屋町３番２３－１４０７号,2018-02-15,株式会社
株式会社ラピーダ,東京都港区元赤坂１丁目５番８号,2018-02-15,株式会社
株式会社リアール,大阪府堺市南区檜尾１２８９番地,2018-02-15,株式会社
株式会社リビエラ,東京都中央区銀座５丁目８番５号,2018-02-15,株式会社
株式会社リード,東京都北区田端１丁目１２番１５－７０３号セジョリ田端,2018-02-15,株式会社
株式会社ル・ストリエ,大阪府岸和田市極楽寺町１丁目７番４４号,2018-02-15,株式会社
株式会社ロクブンノニ,東京都大田区大森西３丁目７番１７号,2018-02-15,株式会社
株式会社ワックアセット,大阪府大阪市住之江区西住之江２丁目１２番１０号,2018-02-15,株式会社
株式会社ワン・キャリー,愛知県安城市二本木新町１丁目１８番地６,2018-02-15,株式会社
株式会社ヴェスパー,東京都渋谷区恵比寿４丁目２３番６号,2018-02-15,株式会社
株式会社一歩,東京都練馬区中村北４丁目１０番９号,2018-02-15,株式会社
株式会社三井建物サービス,愛知県名古屋市中村区名駅４丁目２番７号,2018-02-15,株式会社
株式会社三宅コンサルタント,新潟県胎内市横道２３３番地２,2018-02-15,株式会社
株式会社三輝,東京都新宿区早稲田鶴巻町５３３番地１７ココミ早稲田,2018-02-15,株式会社
株式会社世夢博,京都府京都市伏見区深草一ノ坪町２０番地７,2018-02-15,株式会社
株式会社中本資材,山口県岩国市多田２丁目１０３番地７,2018-02-15,株式会社
株式会社井上美容医療研究所,愛知県一宮市大和町於保字上次１番地２９,2018-02-15,株式会社
株式会社京永設備サービス,京都府長岡京市今里１丁目４番９号,2018-02-15,株式会社
株式会社佐藤電設,東京都板橋区徳丸６丁目４１番６号,2018-02-15,株式会社
株式会社俺,東京都千代田区二番町９番地３,2018-02-15,株式会社
株式会社入船マネジメント,東京都中央区入船２丁目２番１０－７０４号,2018-02-15,株式会社
株式会社和コーポレーション,宮崎県都城市都島町５１９番地４,2018-02-15,株式会社
株式会社城,大阪府羽曳野市島泉９丁目８番９号,2018-02-15,株式会社
株式会社夢限大,広島県福山市延広町７番１０号Ｂ－１,2018-02-15,株式会社
株式会社大厚設備工業,愛知県名古屋市港区小碓４丁目５１１番地,2018-02-15,株式会社
株式会社大星,京都府京都市西京区嵐山中尾下町４８番地,2018-02-15,株式会社
株式会社大東,東京都千代田区神田三崎町３丁目１０番２０－１１０１号,2018-02-15,株式会社
株式会社天田商店,東京都豊島区目白２丁目５番２７号,2018-02-15,株式会社
株式会社奄美大運畜産,鹿児島県大島郡徳之島町亀徳５６番地１,2018-02-15,株式会社
株式会社宇佐美,大阪府大阪市北区豊崎３丁目１５番５号,2018-02-15,株式会社
株式会社富士ＳＵＮＲＩＳＥ牧場,静岡県駿東郡長泉町上長窪１６０番地,2018-02-15,株式会社
株式会社寺崎人財総合研究所,東京都品川区北品川１丁目９番７号トップルーム品川１０１５号,2018-02-15,株式会社
株式会社小島工務店,茨城県常総市小保川１４２７番地２,2018-02-15,株式会社
株式会社小松ゴルフ企画,愛知県長久手市よし池２９番地,2018-02-15,株式会社
株式会社小高商店,東京都葛飾区堀切１丁目３８番１号,2018-02-15,株式会社
株式会社山崎,京都府京都市右京区龍安寺西ノ川町３０番地１,2018-02-15,株式会社
株式会社忍者プロモーション,京都府京都市左京区下鴨東森ケ前町１２番地イーグルコート下鴨テラス３１１号,2018-02-15,株式会社
株式会社恕和,大阪府大阪市天王寺区南河堀町９番３７号Ｊоｗａ天王寺７Ａ号,2018-02-15,株式会社
株式会社敏行智能,大阪府堺市南区深阪南１８３番地サンシティ泉ヶ丘２０７号,2018-02-15,株式会社
株式会社文卿華日貿易商会,大阪府大阪市住之江区南港中４丁目７番２１－７１６号,2018-02-15,株式会社
株式会社新屋安,沖縄県豊見城市字翁長１１３番地,2018-02-15,株式会社
株式会社新静岡モータース,静岡県榛原郡吉田町住吉５２９２番地の１,2018-02-15,株式会社
株式会社朔屋メンテナンス,静岡県伊東市荻４６５番地の１１５,2018-02-15,株式会社
株式会社東光農産,北海道北斗市大工川４８番地,2018-02-15,株式会社
株式会社港町コーポレーション,兵庫県明石市大久保町大久保町８６６番地の５,2018-02-15,株式会社
株式会社湖山,山梨県南都留郡山中湖村山中１６９,2018-02-15,株式会社
株式会社満伝農舎,佐賀県唐津市神田２４２７番地１,2018-02-15,株式会社
株式会社理友,大阪府大阪市鶴見区茨田大宮２丁目４番２８号,2018-02-15,株式会社
株式会社生建,大阪府泉佐野市泉ケ丘２丁目５番８号,2018-02-15,株式会社
株式会社田代商事,東京都板橋区赤塚８丁目５番３号,2018-02-15,株式会社
株式会社石材稲垣好朗,静岡県伊東市竹の内２丁目３番２４号,2018-02-15,株式会社
株式会社福田商事,東京都荒川区西日暮里５丁目２６番９号林ビル,2018-02-15,株式会社
株式会社親方,東京都江東区南砂４丁目１１番９－６０５号,2018-02-15,株式会社
株式会社遠山畜産,静岡県掛川市上屋敷１０番地の２０,2018-02-15,株式会社
株式会社鈴木工業,茨城県小美玉市川戸１４６３番地１３,2018-02-15,株式会社
株式会社間宮不動産,神奈川県横浜市港北区新横浜２丁目１４番地８オフィス新横浜３１０,2018-02-15,株式会社
株式会社阿南サーキュレーション,徳島県阿南市那賀川町西原１７２番地７,2018-02-15,株式会社
株式会社青羽美,東京都大田区大森北３丁目３９番１３号,2018-02-15,株式会社
株式会社香月,広島県福山市昭和町４番１８号,2018-02-15,株式会社
株式会社高橋商会,神奈川県厚木市飯山４５８６番地１３,2018-02-15,株式会社
株式会社高翔運輸,千葉県匝瑳市川辺８０２８番地３,2018-02-15,株式会社
株式会社８８,東京都渋谷区東１丁目２５番２号丸橋ビル３Ｆ,2018-02-15,株式会社
株式会社ＡＫワイズ,東京都品川区広町１丁目３番２２号,2018-02-15,株式会社
株式会社ＡＬＢＥＲＯ,大阪府大阪市浪速区幸町２丁目２番３０号,2018-02-15,株式会社
株式会社ＡＳＬ,大阪府吹田市岸部南３丁目３４番６８号,2018-02-15,株式会社
株式会社ＡＴＣ,大阪府大阪市西成区岸里東１丁目１４番８号,2018-02-15,株式会社
株式会社ＡＺカンパニー,山口県宇部市小松原町１丁目５番２６号,2018-02-15,株式会社
株式会社Ａｃｃｅｌ,千葉県柏市関場町５番３９号,2018-02-15,株式会社
株式会社Ａｎｆａｎｇ,広島県福山市川口町４丁目１６番４１－１号,2018-02-15,株式会社
株式会社Ａｓｔａｒｋｐｒｏｍｏｔｉｏｎ,大阪府大阪市浪速区難波中１丁目３番１９号,2018-02-15,株式会社
株式会社Ａｕｔｕｍｎ,京都府京都市伏見区醍醐御霊ケ下町６番地１２メイプルリーフⅡ２０１,2018-02-15,株式会社
株式会社Ｂ＆Ｓ　ｃｏｍｍｕｎｉｃａｔｉｏｎ,大阪府大阪市東淀川区北江口４丁目８番２号,2018-02-15,株式会社
株式会社ＢＩＲＴＨ,北海道札幌市中央区北一条西２１丁目２番１号カスタリア円山表参道２Ｆ,2018-02-15,株式会社
