法人名,住所,設立日,法人種別
ＵＭＥＺＯＯｔａｂｌｅ株式会社,東京都渋谷区円山町５番５号Ｎａｖｉ渋谷Ｖ３階,2024-03-07,株式会社
Ｖｉｓｊｏｙ株式会社,長崎県長崎市本石灰町３番３号２Ｆ,2024-03-07,株式会社
ＷＩＰ合同会社,千葉県浦安市堀江３丁目２８番３４号グラン・コート浦安１０１,2024-03-07,合同会社
Ｗｏｎｄｅｒｌａｎｄ　ＲＣ株式会社,大阪府大阪市西成区天下茶屋１丁目２８番１６号－２０４号室,2024-03-07,株式会社
ｂｕｔｔｏｎ合同会社,東京都千代田区麹町１丁目６番１６号半蔵門海和ビル９階（Ｃ／ＯＪｏｏ－ｒｅａｌｅｓｔａｔｅ－ｏｆｆｉｃｅ）,2024-03-07,合同会社
ｒｋｓ．株式会社,大阪府大阪市港区市岡１丁目４番２６－５０２号,2024-03-07,株式会社
かねこ株式会社,秋田県にかほ市両前寺字山田下１４番地,2024-03-08,株式会社
かわいいペット株式会社,大阪府大阪市天王寺区悲田院町９－１７阪和ビル４０３号室,2024-03-08,株式会社
きっかけ株式会社,東京都江東区有明３丁目７－１１有明パークビル２０Ｆ,2024-03-08,株式会社
はればれ合同会社,大阪府八尾市高安町北６丁目１６４番地,2024-03-08,合同会社
みたちフーズ合同会社,滋賀県大津市梅林１丁目２－２,2024-03-08,合同会社
よこはまルナコンサルティング株式会社,神奈川県横浜市港北区篠原町１１５８番地６２,2024-03-08,株式会社
わっはる合同会社,東京都板橋区蓮沼町７番１号,2024-03-08,合同会社
アイフレンズ合同会社,東京都目黒区東山３丁目１５－１出光池尻ビル７階,2024-03-08,合同会社
アイヨシケン株式会社,大阪府寝屋川市高柳１丁目４番６号,2024-03-08,株式会社
アズール株式会社,東京都港区北青山３丁目６－７青山パラシオタワー１１階,2024-03-08,株式会社
アンドグロウ株式会社,東京都墨田区太平３丁目１－２ＫＯＷＡ５ビル３階,2024-03-08,株式会社
イツキメンテナンス合同会社,千葉県柏市豊住１丁目４,2024-03-08,合同会社
インシュアデザイン株式会社,東京都中央区新川１丁目３番地２１号,2024-03-08,株式会社
エイナン技術通商株式会社,愛知県名古屋市中村区下中村町２丁目２７番地の２,2024-03-08,株式会社
エスエス工業株式会社,神奈川県三浦郡葉山町上山口１８７８－６,2024-03-08,株式会社
エヌビービースタンモアリース株式会社,東京都中央区日本橋浜町３丁目３番２号,2024-03-08,株式会社
エヌプラン合同会社,兵庫県伊丹市池尻６丁目１２６番地５,2024-03-08,合同会社
オルタンシア合同会社,東京都港区芝浦４丁目５番１３－１２０６号,2024-03-08,合同会社
オークデザインハウス株式会社,静岡県浜松市中央区安間町２５７番地の１,2024-03-08,株式会社
カイロン株式会社,大阪府大阪市浪速区難波中３丁目７番１７－５０８号,2024-03-08,株式会社
カリュプス合同会社,神奈川県横浜市緑区長津田町３０１６番地１南長津田団地４２１,2024-03-08,合同会社
キョウト・ア・ヴェロ合同会社,大阪府大阪市北区堂島１丁目６番２０号堂島アバンザ６階在日フランス商工会議所内,2024-03-08,合同会社
キョクヨーマリン愛南株式会社,愛媛県南宇和郡愛南町久良３９２番２,2024-03-08,株式会社
クロス・ウインズ・ネットワークス株式会社,北海道河西郡芽室町東三条６丁目２－８,2024-03-08,株式会社
グッドフェイス株式会社,鹿児島県鹿児島市城山町３番２４－２０１号,2024-03-08,株式会社
コクドグローバルマネジメント九州株式会社,福岡県糟屋郡志免町別府４丁目１１番１１号藤ファミールハイツⅡ－２０１号,2024-03-08,株式会社
サスティナボール株式会社,大阪府枚方市藤阪中町３３－６,2024-03-08,株式会社
シズカホールディングス株式会社,大阪府大阪市淀川区西中島４丁目１３番２４号花原第３ビル３０１号室,2024-03-08,株式会社
スプラメンター株式会社,東京都港区北青山２丁目７番１３号,2024-03-08,株式会社
ゾーム株式会社,愛知県名古屋市東区代官町３２番８号,2024-03-08,株式会社
テスコムエンジニアリング株式会社,千葉県浦安市富士見５丁目６番３７号,2024-03-08,株式会社
ドラゴンバンク株式会社,東京都江戸川区平井４丁目１２番１号立花屋ビル３階,2024-03-08,株式会社
ネクシア株式会社,奈良県大和郡山市九条町５２４番地１７,2024-03-08,株式会社
バーテックス株式会社,埼玉県熊谷市千代１８５番地１１温庫Ｆ,2024-03-08,株式会社
ピーチブルーム株式会社,千葉県市原市荻作５３０番地４,2024-03-08,株式会社
ベストテックシステム株式会社,愛知県名古屋市西区名駅２丁目３４番１７号,2024-03-08,株式会社
ライキホールディングス株式会社,埼玉県草加市青柳１丁目５番４１号,2024-03-08,株式会社
ライズアップ株式会社,大阪府大阪市福島区玉川２丁目１０番２１号ハイツブラウン５０２号室,2024-03-08,株式会社
リベラグループ株式会社,広島県呉市中央１丁目４番２４号（リベラビル）,2024-03-08,株式会社
リモ鉄サービス株式会社,東京都千代田区神田和泉町１番地６－１６ヤマトビル４０５,2024-03-08,株式会社
レインメーカーズ株式会社,東京都目黒区三田２丁目１番５－２０２号,2024-03-08,株式会社
ローカル・スポーツイノベーション株式会社,愛知県名古屋市中村区名駅４丁目２４番５号第２森ビル４０１,2024-03-08,株式会社
ワーカーズコープ陽明舎労働者協同組合,福岡県嘉麻市下臼井１１３０番地１,2024-03-08,その他の設立登記法人
一般社団法人くろーばー,愛媛県今治市常磐町八丁目４番地２４号,2024-03-08,その他の設立登記法人
一般社団法人ここからベースボールアカデミー,愛知県一宮市牛野通４丁目１５番地,2024-03-08,その他の設立登記法人
一般社団法人まなびたかまり,東京都立川市富士見町６丁目４３番５号ランドシティ立川多摩川テラス２０６号,2024-03-08,その他の設立登記法人
一般社団法人アースフィールド能登,石川県羽咋郡宝達志水町荻市ね３９番地１サンパレス宝達２０８号室,2024-03-08,その他の設立登記法人
一般社団法人アート・シフト・コーチング協会,東京都渋谷区神宮前５丁目５１番６号,2024-03-08,その他の設立登記法人
一般社団法人ダンテ,東京都港区虎ノ門５丁目１番４号,2024-03-08,その他の設立登記法人
一般社団法人ファルケＳＶ,埼玉県北足立郡伊奈町中央３丁目３３０番地１,2024-03-08,その他の設立登記法人
一般社団法人メドグラティアム,京都府京都市伏見区桃山町大蔵１７１番地,2024-03-08,その他の設立登記法人
一般社団法人ラナ・マリー,栃木県那須郡那須町大字寺子乙８８９－４１,2024-03-08,その他の設立登記法人
一般社団法人ラルコンシャ,群馬県北群馬郡榛東村大字長岡１７３１－３,2024-03-08,その他の設立登記法人
一般社団法人丸正,静岡県三島市梅名４２８番地の１,2024-03-08,その他の設立登記法人
一般社団法人共生会,東京都清瀬市旭が丘２丁目５番４－６号,2024-03-08,その他の設立登記法人
一般社団法人国際人材定着支援機構,大阪府豊中市刀根山元町５番４１－４０５号,2024-03-08,その他の設立登記法人
一般社団法人新極真会塚本道場,東京都世田谷区野沢３丁目３０－６,2024-03-08,その他の設立登記法人
一般社団法人琵琶湖スポーツ振興協議会,滋賀県長浜市弥高町２４９番地３ヴィラドハンスブランＡ－３,2024-03-08,その他の設立登記法人
一般社団法人自然共生塾百世,静岡県磐田市豊岡１７０１番地２,2024-03-08,その他の設立登記法人
一般社団法人西日本オペラ協会コンセル・ピエール,福岡県太宰府市石坂２丁目８番２１号,2024-03-08,その他の設立登記法人
一般社団法人関西土地建物管理協会,大阪府大阪市西淀川区姫島２丁目１４番１１号,2024-03-08,その他の設立登記法人
一般社団法人ＡＩ産業基盤,東京都目黒区中央町２丁目４番１８－４１４号,2024-03-08,その他の設立登記法人
一般社団法人ＢＣ‐ｂｏｄｙ,茨城県つくば市二の宮４丁目８番１号,2024-03-08,その他の設立登記法人
一般社団法人ＫＹＯＴＯ　ＥＸＰＥＲＩＭＥＮＴ,京都府京都市中京区烏丸通夷川上る少将井町２２９番２第７長谷ビル６Ｆ,2024-03-08,その他の設立登記法人
一般社団法人ＬＤ１,東京都港区虎ノ門５丁目１番４号,2024-03-08,その他の設立登記法人
一般社団法人ＳＨ０７３,東京都港区虎ノ門３丁目２２番１０－２０１号,2024-03-08,その他の設立登記法人
一般社団法人ＳＳ　Ｉｎｖｅｓｔｍｅｎｔ,東京都港区元赤坂１丁目１番８号株式会社赤坂国際会計内,2024-03-08,その他の設立登記法人
一般社団法人ＳＴＯＲＹ,徳島県徳島市川内町富吉１０番地９,2024-03-08,その他の設立登記法人
一般財団法人しもかわ地域振興機構,北海道上川郡下川町共栄町１番地１,2024-03-08,その他の設立登記法人
一般財団法人神原・ツネイシ文化財団,広島県福山市沼隈町大字常石１０８３番地,2024-03-08,その他の設立登記法人
万仁株式会社,大阪府大阪市中央区備後町１丁目２番１４－１１０２号,2024-03-08,株式会社
三ヶ島工業団地周辺土地区画整理組合,埼玉県所沢市林１丁目２９９－１０株式会社キノシタ　２階,2024-03-08,その他
三里浜オリーブ合同会社,福井県福井市白方町１１字２０番１,2024-03-08,合同会社
三馬合同会社,北海道札幌市豊平区平岸四条１３丁目９番１５－１４０４,2024-03-08,合同会社
仁和株式会社,大阪府大阪市住吉区墨江３丁目１７－１８申野オフィス１０１号室,2024-03-08,株式会社
企業組合川谷もより農産加工所,新潟県上越市吉川区川谷３１５６番地１,2024-03-08,その他の設立登記法人
信儀株式会社,埼玉県所沢市くすのき台３丁目１１番地の１,2024-03-08,株式会社
八達株式会社,大阪府大阪市東成区中道１丁目１２－１０－５１１号,2024-03-08,株式会社
公表システム・サポート株式会社,東京都新宿区高田馬場１丁目３２番１０号,2024-03-08,株式会社
北岡商事株式会社,愛知県名古屋市中村区靖国町２丁目９０ハイツゾンネ２Ｄ,2024-03-08,株式会社
医療法人スマイル＆スマイル,長野県大町市常盤３５８７番地１,2024-03-08,その他の設立登記法人
医療法人博豊会,長崎県諫早市多良見町化屋４８１番地３,2024-03-08,その他の設立登記法人
医療法人拓心会,埼玉県川口市栄町３丁目１０番１８号第２リーヴァビル１階,2024-03-08,その他の設立登記法人
医療法人社団エール,東京都北区西ケ原１丁目２０番１６号クレストヒルズ駒込１階,2024-03-08,その他の設立登記法人
医療法人社団ナオデンタルオフィス竹村歯科,滋賀県草津市南草津２丁目３番地６プリエールソシア１０２号室,2024-03-08,その他の設立登記法人
医療法人社団定夢会,東京都東久留米市学園町２丁目１８番２号沢村屋ビルＡ店舗,2024-03-08,その他の設立登記法人
医療法人社団捲土重来会,東京都渋谷区神南１丁目２０番１７号ＢＣ神南ＰＲＯＰＥＲＴＹ７階,2024-03-08,その他の設立登記法人
医療法人社団桜柊会,東京都港区白金台３丁目８番３号,2024-03-08,その他の設立登記法人
医療法人社団楡真会,東京都足立区千住旭町１番１９号ｙｐｏｉｎｔ２階２０１号室,2024-03-08,その他の設立登記法人
医療法人社団皓歯会,東京都新宿区住吉町１番１５号四谷ＴＴビル５階,2024-03-08,その他の設立登記法人
医療法人社団皓葵会,兵庫県佐用郡佐用町上三河１４１番地４,2024-03-08,その他の設立登記法人
医療法人社団青仙会,東京都江東区潮見２丁目７番１号潮見駅前プラザ二番街１階,2024-03-08,その他の設立登記法人
医療法人社団香栄会,東京都荒川区西尾久８丁目２７番６号石神ビル１階,2024-03-08,その他の設立登記法人
医療法人社団ＳＡＳＡＫＩ　ＣＬＩＮＩＣ,東京都港区芝公園１丁目７番１５号池田ビル３階,2024-03-08,その他の設立登記法人
合同会社うみいろ,沖縄県沖縄市古謝３丁目２８－１７－２,2024-03-08,合同会社
合同会社えるせると,埼玉県越谷市北越谷２丁目２番１－１０５号,2024-03-08,合同会社
合同会社かなで,栃木県宇都宮市南大通り３丁目２番１３号,2024-03-08,合同会社
合同会社こがねもち,千葉県千葉市稲毛区長沼町２３９番地２２,2024-03-08,合同会社
合同会社こばと公司,大分県大分市高崎３丁目６番９号,2024-03-08,合同会社
合同会社なな建装,愛媛県松山市苞木１７５番地５７,2024-03-08,合同会社
合同会社にじのはな訪問看護,千葉県木更津市高柳３５３２番地１サリサ．ｄ２号室,2024-03-08,合同会社
合同会社のぞみ,神奈川県川崎市幸区中幸町１丁目５８－１ソレーユ川崎１０３,2024-03-08,合同会社
合同会社ひのえたつファームトゥキッチン,東京都中央区日本橋室町１丁目１１番１２号日本橋水野ビル７階,2024-03-08,合同会社
合同会社めぐみメディカル,北海道札幌市南区川沿四条３丁目１番１５号,2024-03-08,合同会社
合同会社めるもか,埼玉県越谷市大字大房６９３番地９,2024-03-08,合同会社
合同会社アイズ,東京都北区中十条１丁目２７－１４－２０１,2024-03-08,合同会社
合同会社アキュレートエンジニアリング,北海道札幌市北区屯田七条８丁目４番７号,2024-03-08,合同会社
合同会社アンジュエ８８,青森県三戸郡三戸町大字二日町９２番地５,2024-03-08,合同会社
合同会社イワデン,北海道札幌市北区新川四条１７丁目４番９号,2024-03-08,合同会社
合同会社インフィニット,埼玉県所沢市大字北秋津１４９番地の８,2024-03-08,合同会社
合同会社エメス,千葉県市川市香取２丁目１２番１号,2024-03-08,合同会社
合同会社クロスアド,東京都新宿区西新宿３丁目３番１３号西新宿水間ビル６Ｆ,2024-03-08,合同会社
合同会社シーニュ,和歌山県田辺市新庄町２９０１番１号,2024-03-08,合同会社
合同会社スクラッチ,山形県新庄市大字本合海字丸森１０７２番地３,2024-03-08,合同会社
合同会社ダンテ,東京都港区虎ノ門５丁目１番４号,2024-03-08,合同会社
合同会社チギラオートワークス,沖縄県石垣市字川平１０３３－７１,2024-03-08,合同会社
合同会社ツナギメ,静岡県静岡市葵区城北２丁目９番３６号,2024-03-08,合同会社
合同会社ディレクトソーシング,東京都江戸川区松江５丁目２６番５号,2024-03-08,合同会社
合同会社トップ,京都府京都市伏見区深草下川原町５２番地８－２階,2024-03-08,合同会社
合同会社ハッピーライフ,京都府京都市中京区三条通西洞院西入塩屋町５１番地,2024-03-08,合同会社
合同会社ハレノヒ,鹿児島県鹿児島市東谷山７丁目１６番１号,2024-03-08,合同会社
合同会社パヴォーネ,埼玉県狭山市大字水野４５３番地の１ヒルグランデ４０１,2024-03-08,合同会社
合同会社ヒロミベース,群馬県桐生市菱町３丁目２１０７番地５,2024-03-08,合同会社
合同会社ファーム,神奈川県川崎市高津区蟹ケ谷２３７番地３５,2024-03-08,合同会社
合同会社ベータ,東京都新宿区西新宿３丁目３－１３西新宿水間ビル６階,2024-03-08,合同会社
合同会社マチタク,千葉県千葉市花見川区柏井町１１６９番地,2024-03-08,合同会社
合同会社メタメタ,東京都港区新橋４丁目１９番４－１３０４号,2024-03-08,合同会社
合同会社ヤムログ,大阪府交野市私部西３丁目２１番１号,2024-03-08,合同会社
合同会社ラ・ラ・ランド,東京都世田谷区代沢３丁目１５－１４,2024-03-08,合同会社
合同会社ルーモス,神奈川県横浜市金沢区東朝比奈１丁目５７－２－１１１,2024-03-08,合同会社
合同会社久保板金,愛知県名古屋市南区呼続３丁目１５番３５号,2024-03-08,合同会社
合同会社伊藤,鹿児島県大島郡天城町大字平土野３９番地６,2024-03-08,合同会社
合同会社円,愛知県名古屋市中村区名駅３丁目４－１０アルティメイト名駅１ｓｔ２階,2024-03-08,合同会社
合同会社小田急鶴間駅前ブリッジプロジェクト,東京都千代田区平河町１丁目６番１５号シルスフィア会計事務所内,2024-03-08,合同会社
合同会社山代,東京都千代田区丸の内２丁目２番２号,2024-03-08,合同会社
合同会社常勝,大阪府寝屋川市河北中町３５番１６号,2024-03-08,合同会社
合同会社月島インベストメント,東京都港区新橋５丁目１２番１１号,2024-03-08,合同会社
合同会社本多工業,福島県いわき市四倉町上仁井田字穴狐原２２番地の８,2024-03-08,合同会社
合同会社松竹梅,福岡県北九州市八幡西区熊手１丁目２－２２,2024-03-08,合同会社
合同会社浅野建設,新潟県妙高市大字吉木４４２－１,2024-03-08,合同会社
合同会社清和コンサルタント,東京都江戸川区瑞江１丁目４５番５－２０３号,2024-03-08,合同会社
合同会社畔,北海道虻田郡洞爺湖町洞爺町７番地１８,2024-03-08,合同会社
合同会社菊地商会,埼玉県富士見市鶴馬１丁目４－２０,2024-03-08,合同会社
合同会社西原衛生社,沖縄県中頭郡西原町字兼久３２８番地の５,2024-03-08,合同会社
合同会社西田,広島県広島市南区翠５丁目１４番８号,2024-03-08,合同会社
合同会社貞観,大阪府大阪市浪速区浪速東２丁目１０番１１号１０８号室,2024-03-08,合同会社
合同会社野田市フットボールクラブ,千葉県柏市あけぼの２丁目３番２２－１０４号,2024-03-08,合同会社
合同会社金青,東京都八王子市西片倉１丁目２番１２号,2024-03-08,合同会社
合同会社４ｌｉｆｅ,東京都国立市東４丁目１３－６９,2024-03-08,合同会社
合同会社ＡＢＮ,大阪府堺市西区浜寺南町３丁８－２２,2024-03-08,合同会社
合同会社ＡＩＲ　ＢＯＲＤＥＲ,福岡県那珂川市松木５丁目５番９号,2024-03-08,合同会社
合同会社ＢＡＳＮＥＴ　ＣＨＡＵＴＡＲＩ,静岡県静岡市葵区紺屋町７番地７サンピアレビル地下１階,2024-03-08,合同会社
合同会社ＢＥＥＳ・ＦＡＣＴＯＲＹ,京都府京都市中京区壬生西土居ノ内町２９番地,2024-03-08,合同会社
合同会社Ｂｅａ,山形県飽海郡遊佐町野沢字野沢１９１番地の１,2024-03-08,合同会社
合同会社Ｂｌｏｓｓｏｍ,大阪府枚方市東山２丁目４３番地２－２０６,2024-03-08,合同会社
合同会社Ｂｕｎギャラリー,高知県土佐市宇佐町宇佐３１６１番地２４,2024-03-08,合同会社
合同会社ＣＫＱコーポレーション,静岡県熱海市山手町２番１号１－１０８,2024-03-08,合同会社
合同会社ＣＰ,鹿児島県曽於市財部町南俣４５７番地１,2024-03-08,合同会社
合同会社ＣＳＰ２,東京都渋谷区桜丘町２０番１号,2024-03-08,合同会社
合同会社ＤＯＳ‐ｓｙｓｔｅｍ,愛媛県松山市宇和間甲９２７番地,2024-03-08,合同会社
合同会社ＤＴ,千葉県柏市柏６丁目５番３５－３－１０３号,2024-03-08,合同会社
合同会社ＥａｓｙＲｅｎｔａｌＪＰ,神奈川県川崎市高津区久末５６４番地エクシード久末２０４,2024-03-08,合同会社
合同会社ＦＷＳ,大阪府大阪市東住吉区桑津３丁目２６番２号天王寺ジェイオービル３Ｆ,2024-03-08,合同会社
合同会社Ｆｋｏｋｉ,和歌山県紀の川市尾崎１１８番地１１,2024-03-08,合同会社
合同会社ＧＫ０７３,東京都港区虎ノ門３丁目２２番１０－２０１号,2024-03-08,合同会社
合同会社Ｇｒａｂ　Ｈａｐｐｉｎｅｓｓ,福岡県大牟田市中白川町３丁目８３,2024-03-08,合同会社
合同会社ＨａｒｍｏｎｉＱ,大阪府大阪市平野区長吉出戸３丁目２番５２号,2024-03-08,合同会社
合同会社ＪＷ,東京都港区元麻布１丁目１番１５－１０１号,2024-03-08,合同会社
合同会社Ｊｏｉｎ　ＦｏｒｃＥＳ,熊本県熊本市東区長嶺東１丁目５－２７,2024-03-08,合同会社
合同会社Ｋ‐ＰＣ,東京都江戸川区江戸川３丁目１３番地１０,2024-03-08,合同会社
合同会社Ｋ．Ｐ．Ｉ,愛知県刈谷市稲場町４丁目２１４番地,2024-03-08,合同会社
合同会社ＫＮＮ,東京都西多摩郡日の出町大字平井２５６２番地１グリーンコーポラス３０１号,2024-03-08,合同会社
合同会社ＫＴＭＫ,徳島県吉野川市鴨島町内原３３番地１,2024-03-08,合同会社
合同会社ＫＵエステート,東京都世田谷区玉川台２丁目２０－１４,2024-03-08,合同会社
合同会社ＬＱ　ＳＴＯＲＥ,大阪府大阪市東成区大今里南３丁目６番７号,2024-03-08,合同会社
合同会社Ｌｉｅｎｓ,東京都足立区足立３丁目２４－１２サンガーデン１０１,2024-03-08,合同会社
合同会社Ｌｉｏｎｅｌ,神奈川県横浜市港北区綱島西５丁目２０番３５号シャルマン横浜３０２,2024-03-08,合同会社
合同会社ＬｕｄｙＷｏｒｋｓ,大阪府東大阪市吉松１丁目４－２１,2024-03-08,合同会社
合同会社ＭＡＳＡＹＵＭＥ,埼玉県草加市栄町２丁目１２－１ステーションプラザ５階,2024-03-08,合同会社
合同会社ＭＵＳＵＢＩ,岐阜県揖斐郡池田町下東野５７３番地の１４,2024-03-08,合同会社
合同会社Ｏ１３６,新潟県長岡市高見町１６６８番地１,2024-03-08,合同会社
合同会社ＯＧ,神奈川県川崎市川崎区大島４丁目１４番１０－２０５号リブリ・ハナノミ,2024-03-08,合同会社
合同会社ＯＮＥ,兵庫県明石市大久保町大窪９５８－２－Ｊ２０１,2024-03-08,合同会社
合同会社ＯｒａｎｇｅＺｅｌｙ,福岡県北九州市八幡西区八千代町八千代１－７サンヒルズ八千代７０２,2024-03-08,合同会社
合同会社ＰＩＸＥＬ　ＢＹ　ＰＩＸＥＬ,東京都渋谷区恵比寿西２丁目８－４ＥＸ恵比寿西ビル５階,2024-03-08,合同会社
合同会社ＱＯＬ,北海道札幌市中央区南一条西１６丁目１番地春野ビル３Ｆ３２３,2024-03-08,合同会社
合同会社ＲＥＤＡＹ,福岡県糸島市二丈深江７丁目１７番１４号,2024-03-08,合同会社
合同会社Ｒｅｖｅ,長野県長野市大字三才４１３番地１０,2024-03-08,合同会社
合同会社Ｒｉｌａ,千葉県千葉市緑区高田町１７３２番地,2024-03-08,合同会社
合同会社ＳＡＫＡＴＡ,愛知県瀬戸市八幡台７丁目１０１番地,2024-03-08,合同会社
合同会社ＳＫ‐ＩＩ,東京都港区芝５丁目２０番７－２１１号,2024-03-08,合同会社
合同会社ＳＳＩ００１,東京都港区元赤坂１丁目１番８号株式会社赤坂国際会計内,2024-03-08,合同会社
合同会社ＳＴＲＡＩＴ,青森県弘前市大字稲田１丁目１番地２,2024-03-08,合同会社
合同会社Ｓｔａｙ　Ｆｏｏｌｉｓｈ,愛知県名古屋市中村区名駅３丁目４番１０アルティメイト名駅１ｓｔ２階,2024-03-08,合同会社
合同会社ＳｙＵＮｉ,大阪府大阪市中央区内淡路町２丁目１－１０アストレア内淡路３０１号室,2024-03-08,合同会社
合同会社ＹＣＨ１５,東京都港区南青山２丁目２番１５－８２５号,2024-03-08,合同会社
合同会社ｉＲｉｓ,大阪府寝屋川市豊里町１４番１７号（２０１号）,2024-03-08,合同会社
合同会社ｍｏｃｍｏｃ,大阪府東大阪市小若江１丁目１０番１４号,2024-03-08,合同会社
和港薬品株式会社,大阪府大阪市中央区久太郎町１丁目９番２８号５Ｆ,2024-03-08,株式会社
