法人名,住所,設立日,法人種別
株式会社ＴＺ,三重県津市白山町南家城１３８４番地,2016-10-21,株式会社
株式会社Ｔｈｉｒｄ　Ｓｔｏｎｅ,東京都江戸川区上篠崎２丁目１番８号,2016-10-21,株式会社
株式会社Ｗｅａｌｔｈ　Ｐａｒｔｎｅｒ,東京都港区六本木１丁目３番３９－１１０９号,2016-10-21,株式会社
株式会社Ｚ－ＳＴＹＬＥ,愛知県あま市七宝町安松南辻田２５８３番地,2016-10-21,株式会社
株式会社ＺＫＭ,東京都千代田区神田須田町２丁目６－４ランディック神田ビル２Ｆ,2016-10-21,株式会社
株式会社ｌｉｂｒｅｔｚ,兵庫県宝塚市安倉西４丁目４番４号,2016-10-21,株式会社
株式会社ｓａｌｉｒｅ,京都府京都市下京区河原町通松原上る清水町２７７番地シンフォニー四条河原町６０２,2016-10-21,株式会社
株式会社ｓｕｂｌｉｍｅ不動産販売,滋賀県守山市焔魔堂町２３６番地３Ｆ,2016-10-21,株式会社
株式会社ｓｕｂｌｉｍｅ不動産販売京都,京都府京都市中京区油小路通御池上る押油小路町２５２番地１ロイヤル御池６０２号,2016-10-21,株式会社
永信商事株式会社,神奈川県横浜市保土ケ谷区天王町１丁目２３番地１７－１０３号,2016-10-21,株式会社
淀川労務協会,大阪府大阪市淀川区西中島３丁目８－２ＫＧビル１０,2016-10-21,その他
滴々庵株式会社,岐阜県岐阜市加納大黒町２丁目６番地,2016-10-21,株式会社
特定非営利活動法人あんじょう地域ねこの会,愛知県安城市二本木町長根８５番地２,2016-10-21,その他の設立登記法人
特定非営利活動法人大手寄席,新潟県長岡市城内町３丁目５番地１－９０１号,2016-10-21,その他の設立登記法人
特定非営利活動法人日本科学技術教育開発協会,岐阜県岐阜市山吹町６丁目３９番地（キャッスルハイツ山吹町８０１号室）,2016-10-21,その他の設立登記法人
特定非営利活動法人社会福祉推進会,静岡県浜松市東区有玉南町２１８２番地,2016-10-21,その他の設立登記法人
特定非営利活動法人ＴＰＳチアリーディング部,徳島県徳島市万代町５丁目７１番地中央システム倉庫２Ｆ有限会社オオタニ内,2016-10-21,その他の設立登記法人
茗鷹善株式会社,愛知県名古屋市中川区百船町２０番１１号宝黄金ハイツ７０５号,2016-10-21,株式会社
華龍商事株式会社,新潟県三条市西裏館１丁目１３番２０号,2016-10-21,株式会社
萬和通商株式会社,愛知県名古屋市名東区一社４丁目１４４番地ｃｈｏｕ・ｃｈｏｕ一社３０２号室,2016-10-21,株式会社
豊国ライン株式会社,広島県呉市中央１丁目４番２４号,2016-10-21,株式会社
農事組合法人大森睦月ファーム,福井県福井市大森町第４２号１５番地１,2016-10-21,その他の設立登記法人
農事組合法人山ゆりの里,新潟県上越市吉川区道之下３１６番地,2016-10-21,その他の設立登記法人
農事組合法人房州じゃんぼ,千葉県南房総市和田町黒岩５１番地,2016-10-21,その他の設立登記法人
近澤ホールディングス株式会社,高知県土佐市宇佐町宇佐２８２７番地８,2016-10-21,株式会社
鈴和ガスサービス合同会社,栃木県宇都宮市睦町８番２３号,2016-10-21,合同会社
銘壕匯投資株式会社,大阪府大阪市中央区内淡路町２丁目４番７号ＪＳビル５Ｆ,2016-10-21,株式会社
鎌田電気工事株式会社,岡山県倉敷市帯高２２５番地,2016-10-21,株式会社
関東商会株式会社,神奈川県厚木市中依知４２０番地７－２０１,2016-10-21,株式会社
阪上マネジメント株式会社,兵庫県宝塚市口谷西３丁目６番１号,2016-10-21,株式会社
阿部誠コンサルティング株式会社,神奈川県鎌倉市笛田５丁目４１番１５号,2016-10-21,株式会社
飛漁株式会社,兵庫県神戸市中央区琴ノ緒町３丁目３番２１号２Ｆ,2016-10-21,株式会社
ＡＣアドバイザリー合同会社,東京都文京区本郷２丁目４０番１３号,2016-10-21,合同会社
ＡＫＦＭ合同会社,東京都北区滝野川７丁目２番７－１０１号,2016-10-21,合同会社
ＡＭＰ　Ｉｎｔｅｒｎａｔｉｏｎａｌ　Ｓｅｒｖｉｃｅｓ　Ｌｉｍｉｔｅｄ,東京都千代田区有楽町１丁目１０番１号有楽町ビルディング６１８区,2016-10-21,外国会社等
ＡＹｉｎｔｅｒｉｏｒ株式会社,大阪府大阪市淀川区新高２丁目４番３２号,2016-10-21,株式会社
Ａｌｅｘｉｏｎ　Ｐｈａｒｍａ　Ｉｎｔｅｒｎａｔｉｏｎａｌ　Ｔｒａｄｉｎｇ,,2016-10-21,外国会社等
Ａｍｅｒｉｔ株式会社,東京都文京区小石川３丁目３９番８号,2016-10-21,株式会社
Ｂｅｔｔｙ’ｓ　Ｈｏｕｓｅホールディングスコーポレーション株式会社,愛知県知多市長浦２丁目２９番地,2016-10-21,株式会社
Ｅｓｐｏｉｒ　Ｓｐｏｒｔ株式会社,神奈川県平塚市中里４９番１号グリーングラスＤ号,2016-10-21,株式会社
ＦＯＲ　ＹＯＵ株式会社,宮城県仙台市宮城野区名掛丁２０１－４,2016-10-21,株式会社
ＧＩ開発ファンド合同会社,東京都千代田区麹町３丁目３番地８ＧＩキャピタル・マネジメント株式会社内,2016-10-21,合同会社
ＧＯＲＡＫＨ　ＥＮＴＥＲＰＲＩＳＥ合同会社,神奈川県横浜市西区楠町８番地３アーバンハイツ楠町４０５号,2016-10-21,合同会社
ＧＵＲＫＨＡ合同会社,東京都台東区竜泉１丁目２６番２号,2016-10-21,合同会社
ＨＩＫ株式会社,埼玉県八潮市大字大曽根１３２０番地,2016-10-21,株式会社
ＨＩＲＯ株式会社,青森県つがる市柏広須松元９番地,2016-10-21,株式会社
ＨＯＭＭＡＸ株式会社,愛知県名古屋市守山区瀬古３丁目１３０３番地の３,2016-10-21,株式会社
ＨＵＢブラザーズ合同会社,東京都杉並区上井草１丁目３３番６号メゾン・ド・芝３０３,2016-10-21,合同会社
ＩＳ－ＪＡＰＡＮ　ＷＯＲＬＤ株式会社,群馬県邑楽郡大泉町坂田５丁目１番３０号,2016-10-21,株式会社
Ｉｎｎｏｖａｔｉｏｎ　Ｉｎｖｅｓｔｍｅｎｔ株式会社,愛知県名古屋市千種区日進通２丁目１４番地の１,2016-10-21,株式会社
Ｊ．Ｄ．グループ合同会社,東京都港区西麻布３丁目１３番３－３０１号,2016-10-21,合同会社
ＪＡＰＡＮ　Ｍｉｄａｓ　Ｔｒａｄｉｎｇ株式会社,東京都港区三田１丁目２番１８号ＴＴＤビル,2016-10-21,株式会社
ＪＨ奈良ブリッジファンド合同会社,東京都新宿区四谷２丁目９番地１５あると綜合事務所内,2016-10-21,合同会社
ＫＵＲＯＮＯＳＵ株式会社,東京都世田谷区瀬田３丁目５番１２号,2016-10-21,株式会社
ＫＷ株式会社,東京都稲城市平尾１丁目４１番地の８,2016-10-21,株式会社
Ｋｙｏｔｏｐｉ株式会社,京都府京都市中京区壬生西土居ノ内町２０－１,2016-10-21,株式会社
ＬＥＥＣＨ合同会社,大阪府豊中市庄内栄町４丁目１９番１６号,2016-10-21,合同会社
Ｍ２Ｏ株式会社,東京都港区六本木５丁目１３番１１－４０３号,2016-10-21,株式会社
ＭＧＫ株式会社,大阪府大阪市大正区三軒家東４丁目８番１３号,2016-10-21,株式会社
ＭＴＳ株式会社,鳥取県鳥取市賀露町４００１番地,2016-10-21,株式会社
ＮＤＫにまつわるエトセトラ合同会社,福岡県福岡市南区野間１丁目１３番５号,2016-10-21,合同会社
ＮＰＯ法人ＭＬＴこどもプロジェクト,東京都千代田区三崎町２丁目４番１３－２０１号コンポラビル,2016-10-21,その他の設立登記法人
Ｒａｓｓｉｎｉ　Ｉｎｔｅｒｎａｔｉｏｎａｌ　Ａｓｉａ株式会社,神奈川県横浜市西区北幸１丁目１１番５号相鉄ＫＳビル６階,2016-10-21,株式会社
ＳＢＮ　Ｇｌｏｂａｌ　Ｐｌａｙ株式会社,千葉県佐倉市井野１４１８番地２０,2016-10-21,株式会社
ＳＵＪＩＴＡ株式会社,東京都豊島区目白２丁目１２番１０号,2016-10-21,株式会社
ＴＥＩ株式会社,京都府京都市伏見区深草平田町３番地３ミヤタマンション１Ｆ,2016-10-21,株式会社
ＴＫスロウハンド株式会社,福島県郡山市喜久田町字入ノ内３３番地の８,2016-10-21,株式会社
ＴＯＮＥＤ合同会社,東京都品川区北品川１丁目９番７号トップルーム品川１０１５号,2016-10-21,合同会社
ＴＯＰ　ＭＡＸ　ＴＲＡＤＩＮＧ　ＰＲＩＶＡＴＥ　ＬＩＭＩＴＥＤ,三重県四日市市室山町１７６０パークホームズイトウＡ－１０６,2016-10-21,外国会社等
ＵＧＬＹ　ＣＡＲＡＶＡＮ株式会社,東京都世田谷区北沢２丁目８番４号松田ビル４０３,2016-10-21,株式会社
Ｕｅ　Ｍａｎａｇｅｍｅｎｔ　Ｊａｐａｎ株式会社,東京都江東区有明３丁目７番２６号,2016-10-21,株式会社
ＷＯＲＬＤ　ＣＥＮＴＵＲＹ株式会社,東京都港区新橋２丁目２番地３裕芳ビル６Ｆ,2016-10-21,株式会社
Ｗｉｌｌｉａｍ　Ｃｏｎｎｏｌｌｙ＆Ｓｏｎｓ,,2016-10-21,外国会社等
かくＸＫＬ合同会社,神奈川県横浜市西区老松町５８番地３,2016-10-24,合同会社
ときめきエステート合同会社,東京都新宿区新宿５丁目１１番３０号新宿第五葉山ビル３階,2016-10-24,合同会社
はっぴねす事業協同組合,埼玉県さいたま市大宮区桜木町１丁目９番地１三谷ビル７階,2016-10-24,その他の設立登記法人
まぅるる株式会社,宮城県大崎市古川大幡字月蔵４６番地２,2016-10-24,株式会社
アスタ税理士法人,神奈川県川崎市麻生区上麻生６丁目３番７号,2016-10-24,その他の設立登記法人
アルム株式会社,東京都品川区東大井１丁目３番３０号,2016-10-24,株式会社
ウエマツ＆パートナーズ合同会社,山梨県甲府市古府中町１４５４,2016-10-24,合同会社
エイチ・アイ・コンサルタント株式会社,沖縄県那覇市若狭３丁目５番８号１階Ｂ,2016-10-24,株式会社
エイ・エム・イー株式会社,広島県福山市千代田町２丁目８番２１号,2016-10-24,株式会社
エースシード合同会社,東京都北区田端新町３丁目１９番７－７０４号,2016-10-24,合同会社
オウンワークス株式会社,福岡県福岡市早良区原７丁目２番１４号,2016-10-24,株式会社
オドレート株式会社,東京都墨田区亀沢２丁目１４番２－１０１号,2016-10-24,株式会社
オリエンシャス食品株式会社,滋賀県草津市大路２丁目１番２７－２０２号,2016-10-24,株式会社
カドヤ株式会社,東京都豊島区西池袋４丁目１４番２号コーポモルゲンロート１０１号,2016-10-24,株式会社
サンクチュアリ株式会社,千葉県八街市東吉田２２６番地１１０,2016-10-24,株式会社
サンコネクト合同会社,岡山県岡山市北区芳賀１６－２０２,2016-10-24,合同会社
サンワ設備株式会社,和歌山県和歌山市毛見１２８５番地４,2016-10-24,株式会社
ジェネティックバイオラボ株式会社,北海道札幌市北区北二十一条西１２丁目２,2016-10-24,株式会社
スクライズ株式会社,大阪府松原市大堀５丁目１０番３号,2016-10-24,株式会社
スペシャリストクラウド株式会社,埼玉県川口市青木２丁目６番８－９０３号,2016-10-24,株式会社
ソノヤラボ株式会社,神奈川県茅ヶ崎市円蔵１丁目９番２４号,2016-10-24,株式会社
テルユキ合同会社,東京都北区豊島５丁目６番１０号,2016-10-24,合同会社
トミタ共栄会,東京都大田区大森中１丁目１８番１６号,2016-10-24,その他
ドラムビート・サウンド出版合同会社,東京都杉並区成田西１丁目６番６－２１０号,2016-10-24,合同会社
ネクストデザイン合同会社,東京都中央区日本橋２丁目１番１７号丹生ビル２Ｆ,2016-10-24,合同会社
ハルヴァ株式会社,東京都港区赤坂９丁目１番２７号,2016-10-24,株式会社
ハーベスト特定目的会社,東京都港区六本木１丁目６番１号泉ガーデンタワー,2016-10-24,その他の設立登記法人
バリューアプリケーションズ株式会社,東京都千代田区神田佐久間町１丁目８番４号,2016-10-24,株式会社
パブリックフィナンシャルサービス株式会社,埼玉県川越市大字増形２３８番地５,2016-10-24,株式会社
ファンタス・インタラクティブ株式会社,東京都港区南麻布３丁目１９番１６号,2016-10-24,株式会社
フリースタイル・テクノロジー・ジャパン株式会社,東京都江東区有明３丁目７番２６号,2016-10-24,株式会社
プロフィタブル合同会社,東京都豊島区目白３丁目２７番７号,2016-10-24,合同会社
ベルテックス株式会社,東京都港区六本木６丁目２番３１号六本木ヒルズノースタワー１７階,2016-10-24,株式会社
メメント合同会社,東京都千代田区九段北１丁目３番１号,2016-10-24,合同会社
ライクストレーディング合同会社,埼玉県朝霞市根岸台７丁目２１番６２号,2016-10-24,合同会社
リードグラン株式会社,東京都練馬区豊玉中４丁目１番８号,2016-10-24,株式会社
ルディアス株式会社,東京都江戸川区東葛西１丁目３９番４号,2016-10-24,株式会社
ワールド株式会社,大阪府大阪市福島区福島５丁目８番１号,2016-10-24,株式会社
一般社団法人あさの,北海道札幌市豊平区月寒東一条１６丁目２番６９号,2016-10-24,その他の設立登記法人
一般社団法人こども総研,愛知県名古屋市昭和区鶴舞２丁目７番１０号,2016-10-24,その他の設立登記法人
一般社団法人みらい研究所,埼玉県草加市神明２丁目３番５号リレントクィーン草加５０４号,2016-10-24,その他の設立登記法人
一般社団法人やましろ通信社,京都府木津川市加茂町駅東２丁目５番地３プレステ加茂タワー１３０６号,2016-10-24,その他の設立登記法人
一般社団法人アートメディアフォーラム,東京都港区赤坂２丁目１６番６号ＢＩＺＭＡＲＫＳ赤坂,2016-10-24,その他の設立登記法人
一般社団法人フォトアーキペラゴせとうち,香川県高松市今新町７番地１４の２階,2016-10-24,その他の設立登記法人
一般社団法人フォワードプランニング,京都府木津川市木津清水３５－７,2016-10-24,その他の設立登記法人
一般社団法人ユアーズファンナップ,兵庫県丹波市柏原町柏原１１１６番地１,2016-10-24,その他の設立登記法人
一般社団法人ライフオーダー医科学研究所,福岡県福岡市中央区渡辺通１丁目１１番１１号,2016-10-24,その他の設立登記法人
一般社団法人住みよい町・さむかわにする会,神奈川県高座郡寒川町大曲１丁目８番４３号,2016-10-24,その他の設立登記法人
一般社団法人家づくり安心サポート協会,富山県中新川郡立山町前沢２１８０番地１の２,2016-10-24,その他の設立登記法人
一般社団法人寺岡,大阪府大阪市住吉区長居２丁目７番１３号,2016-10-24,その他の設立登記法人
一般社団法人日本ポリマークレイ協会,東京都新宿区西新宿４丁目２３番２号,2016-10-24,その他の設立登記法人
一般社団法人日本税財務総合研究所,兵庫県神戸市西区竹の台３丁目１７番地の１０５,2016-10-24,その他の設立登記法人
一般社団法人杉野記念文化協会,千葉県市川市北国分３丁目１８番１３号,2016-10-24,その他の設立登記法人
一般社団法人次世代グローバル文化研究所,大阪府池田市伏尾町７６番地の１６,2016-10-24,その他の設立登記法人
一般社団法人消費者建物管理協会,大阪府大阪市東成区深江南２丁目６番２８号,2016-10-24,その他の設立登記法人
一般社団法人犯罪被害者と障害者・高齢者の権利を守る会,愛知県名古屋市天白区原５丁目２３０８番地,2016-10-24,その他の設立登記法人
一般社団法人皐月会,東京都中央区日本橋富沢町４番９号,2016-10-24,その他の設立登記法人
一般社団法人ＨＧＤ,兵庫県神戸市兵庫区水木通４丁目２番６号,2016-10-24,その他の設立登記法人
一般社団法人ＪＣＡＦ,神奈川県相模原市緑区橋本６丁目２７番２号第一間瀬ビル３０２,2016-10-24,その他の設立登記法人
三浦精工株式会社,埼玉県三郷市鷹野３丁目１９２番地,2016-10-24,株式会社
三輝工業株式会社,広島県東広島市西条町御薗宇１０００番地１６,2016-10-24,株式会社
中村空き家管理サービス株式会社,富山県高岡市中川本町８番４号,2016-10-24,株式会社
久茂地株式会社,沖縄県沖縄市中央１丁目５番４号奥間ビル１０２,2016-10-24,株式会社
今栄株式会社,新潟県長岡市栃尾表町９番６号,2016-10-24,株式会社
佐藤商事合同会社,東京都江東区亀戸９丁目１９番７－９２３号,2016-10-24,合同会社
健康ステーション株式会社,大阪府大阪市中央区内本町２丁目４番５号,2016-10-24,株式会社
光明山無量院,埼玉県吉川市栄町１３４２番地４,2016-10-24,その他の設立登記法人
北九州キャリブレーション合同会社,福岡県北九州市小倉北区上到津４丁目１４番１－５０１号,2016-10-24,合同会社
北谷ホテルマネジメント株式会社,東京都港区芝２丁目１４番５号,2016-10-24,株式会社
医療法人田代内科,埼玉県蕨市錦町５丁目３番２８号蕨クリニックタウン１０２号,2016-10-24,その他の設立登記法人
千賀国際株式会社,東京都北区浮間４丁目１７番２２号,2016-10-24,株式会社
千里エナジー合同会社,東京都文京区西片１丁目４番７－４０２号,2016-10-24,合同会社
合同会社おかめ,新潟県佐渡市新穂長畝１２３３番地１,2016-10-24,合同会社
合同会社みつば動物病院,埼玉県羽生市西４丁目３番地８,2016-10-24,合同会社
合同会社アイリスプルミエ,東京都足立区綾瀬６丁目２５番１号,2016-10-24,合同会社
合同会社アップルソーラー１０５６,茨城県筑西市下江連３９３番地１、１号棟２０２,2016-10-24,合同会社
合同会社アメシスト,東京都千代田区九段南１丁目５番６号,2016-10-24,合同会社
合同会社エクストラワン,東京都目黒区自由が丘３丁目４番４号ヒルズ自由が丘２Ｂ,2016-10-24,合同会社
合同会社エッグ,神奈川県相模原市南区東林間１丁目２５番１０－６０１号,2016-10-24,合同会社
合同会社エメラルドソーラー１０５５,茨城県筑西市玉戸１０８７番地２６、１０３,2016-10-24,合同会社
合同会社カーサフィエスタ,東京都港区南麻布５丁目１４－２ＭＡ南麻布３階,2016-10-24,合同会社
合同会社ケーティプランニング,千葉県八千代市勝田台北１丁目８番１９号,2016-10-24,合同会社
合同会社スリーエイチ,東京都杉並区堀ノ内１丁目９番１０号,2016-10-24,合同会社
合同会社ダイヤソーラー１０５４,茨城県筑西市下江連３９３番地１、２号棟,2016-10-24,合同会社
合同会社チャプター・ワン,埼玉県鴻巣市大芦４２８番地１,2016-10-24,合同会社
合同会社トラスト,三重県津市河芸町東千里２６４番地１,2016-10-24,合同会社
合同会社ニライ,沖縄県中頭郡嘉手納町字水釜４０７番地,2016-10-24,合同会社
合同会社パインソーラー１０５６,茨城県筑西市玉戸１０８７番地２６、１０４,2016-10-24,合同会社
合同会社パワープラントジャパン０１,東京都千代田区内神田３丁目２番９号,2016-10-24,合同会社
合同会社ヒュウガ企画,埼玉県戸田市美女木２丁目３０番地の３３,2016-10-24,合同会社
合同会社ピクセル,東京都板橋区熊野町１５番１号,2016-10-24,合同会社
合同会社フォーウェルス,茨城県土浦市荒川沖東２丁目４番１号,2016-10-24,合同会社
合同会社ブルーローズ,東京都豊島区北大塚１丁目１９－１２コルティス大塚ビル６Ｆ,2016-10-24,合同会社
合同会社プロジェクトノード,宮城県仙台市青葉区片平１丁目３番３６－６０５号,2016-10-24,合同会社
合同会社ホワイトコンサルティング,東京都新宿区西新宿８丁目１４番２７－１５０２号,2016-10-24,合同会社
合同会社ライフスマイル,大分県大分市高江南３丁目２９番１１号,2016-10-24,合同会社
合同会社ランドユース,東京都中央区日本橋箱崎町２７番９オフィスヴェラ１階,2016-10-24,合同会社
合同会社リベロ,埼玉県越谷市七左町２丁目１９２番地,2016-10-24,合同会社
合同会社ルビーソーラー１０５６,茨城県筑西市下江連３９３番地１、１号棟１０２,2016-10-24,合同会社
合同会社レモンソーラー１０５６,茨城県筑西市布川１０５１番地２５、２０１,2016-10-24,合同会社
合同会社井上測量,高知県高知市海老ノ丸４番３号,2016-10-24,合同会社
合同会社千葉都市開発ＡＡ,東京都品川区北品川１丁目９番７号トップルーム品川１０１５号,2016-10-24,合同会社
合同会社大野農園ソーラーシェアリング,東京都中央区新川１丁目２８番３３号Ｇｌａｎｆｆｉｃｅ茅場町７Ｆ,2016-10-24,合同会社
合同会社幸映企画,埼玉県草加市苗塚町１６５番地１８,2016-10-24,合同会社
合同会社水越エネルギー１０５６,茨城県筑西市下江連３９３番地１、１号棟１０１,2016-10-24,合同会社
合同会社水越エネルギー１０５７,茨城県筑西市下江連３９３番地２,2016-10-24,合同会社
合同会社水越エネルギー１０５９,茨城県筑西市布川１０５１番地２５、２０２,2016-10-24,合同会社
合同会社水越エネルギー１０６０,茨城県筑西市玉戸１０８７番地２６、１０２,2016-10-24,合同会社
合同会社源満,愛知県半田市榎下町２６番地の２,2016-10-24,合同会社
合同会社獅子,静岡県浜松市中区神田町３２５番地の２,2016-10-24,合同会社
合同会社珈琲焙煎塾,東京都世田谷区南烏山６丁目２９－２ＪＰＣ南烏山１０１,2016-10-24,合同会社
合同会社藍,徳島県鳴門市撫養町斎田字大堤２５６番地,2016-10-24,合同会社
合同会社長坂,東京都大田区下丸子４丁目２６番４－１００２号,2016-10-24,合同会社
合同会社Ｂｉｚ－Ｍａｒｋ,千葉県印西市大森７８７番地３,2016-10-24,合同会社
合同会社Ｄ－ｈｏｍｅ,東京都世田谷区代沢３丁目１８番８号,2016-10-24,合同会社
合同会社Ｈ＆Ｔバランス,大阪府豊中市長興寺南３丁目１５番３３－１０４号,2016-10-24,合同会社
合同会社Ｋ＆Ｋ,神奈川県横浜市南区山王町４丁目２８番１０ヴィータローザ横浜吉野町８０１号,2016-10-24,合同会社
合同会社ＫＧＩ,東京都世田谷区八幡山２丁目１５番６－１０６号,2016-10-24,合同会社
合同会社ＫＮコーポレーション,神奈川県藤沢市片瀬３丁目１番８号,2016-10-24,合同会社
合同会社ＬＩＮＫＳ,千葉県松戸市新松戸４丁目２７０番地,2016-10-24,合同会社
合同会社ＭＳサトー,北海道札幌市清田区平岡三条６丁目１０番２６号,2016-10-24,合同会社
合同会社ＮＩＲＶＡＮＡ,愛媛県今治市宮ヶ崎甲８８３番地４５,2016-10-24,合同会社
合同会社Ｎｅｘｔｅｐｐ,埼玉県新座市新堀１丁目１３番１４号,2016-10-24,合同会社
合同会社ＯｆｆｉｃｅＲａｉｓｅ,大分県大分市大字皆春９１６番地の９,2016-10-24,合同会社
合同会社Ｓｉｄｅ　Ｍｏｕｎｔａｉｎ,東京都杉並区宮前２丁目２－１８メゾン宮前４２２,2016-10-24,合同会社
合同会社Ｓｐａｃｅ,東京都港区赤坂７丁目６番２６号２０１号室,2016-10-24,合同会社
合同会社Ｓｕｎｒｉｓｅｔ,東京都世田谷区深沢３丁目１０番８号,2016-10-24,合同会社
合同会社Ｔ＆Ｙ　ｔｒａｄｉｎｇ　ｃｏｍｐａｎｙ,神奈川県横浜市金沢区柴町４７番地１４カームコート八景島２０３,2016-10-24,合同会社
合同会社ＵＳプロパティファイナンス２号,東京都中央区日本橋兜町３番１１号三田証券株式会社内,2016-10-24,合同会社
合同会社ＷＡＲＡＷＡＳＥＹＡ,東京都町田市金井町２９３７番地８,2016-10-24,合同会社
