法人名,住所,設立日,法人種別
合同会社ウエスト・ストリート・ジャパン・ツー,東京都港区六本木６丁目１０番１号六本木ヒルズ森タワー,2021-11-15,合同会社
合同会社エザケン,神奈川県相模原市南区上鶴間本町７丁目１３番５５号,2021-11-15,合同会社
合同会社エデュケーショナル・キッズパーク,大阪府吹田市広芝町４－３４江坂第一ビル,2021-11-15,合同会社
合同会社エナール,東京都練馬区土支田１丁目３１番１１－３０３号山八マンションＡ,2021-11-15,合同会社
合同会社クリアー,鳥取県米子市彦名町１０６４番地２,2021-11-15,合同会社
合同会社クワムラ,広島県広島市安佐南区山本１丁目２７－１２ベルビュー１階,2021-11-15,合同会社
合同会社サンエンジニアリング,三重県鈴鹿市長太旭町３丁目１番２０号,2021-11-15,合同会社
合同会社シフクノオト,東京都三鷹市牟礼３丁目１０番２２号,2021-11-15,合同会社
合同会社ソコスモ,岩手県盛岡市浅岸２丁目２２－４５,2021-11-15,合同会社
合同会社タリタラボ,鹿児島県伊佐市大口下殿９１３,2021-11-15,合同会社
合同会社チエナミ商会,千葉県市川市南行徳４丁目１８番２号Ｕ’ｓＲｅｓｉｄｅｎｃｅ南行徳２０５号室,2021-11-15,合同会社
合同会社ディッシュ,愛知県名古屋市中区松原１丁目１７番５号,2021-11-15,合同会社
合同会社トーカン建設,宮城県仙台市若林区藤塚字三十刈５９番地,2021-11-15,合同会社
合同会社ビハンド,岡山県岡山市北区奥田南町５番地１８号川西ビル１階,2021-11-15,合同会社
合同会社ピラミッド,千葉県千葉市美浜区打瀬２丁目２３,2021-11-15,合同会社
合同会社ピーチキャピタル,東京都豊島区上池袋１丁目２６番６号上池袋タワーレジデンス２００１号,2021-11-15,合同会社
合同会社フィロソフェンベッグ,大阪府枚方市甲斐田町１５番２０号,2021-11-15,合同会社
合同会社プラント,愛知県江南市宮田町藤ノ森８１番地,2021-11-15,合同会社
合同会社ベル,千葉県松戸市東松戸１丁目９番地の１３,2021-11-15,合同会社
合同会社ヨコケン,神奈川県横浜市港北区新吉田町４４８１番地宮田商会貸工場Ｂ－２,2021-11-15,合同会社
合同会社リトラボラ,沖縄県那覇市松尾１丁目１０－２４－１階,2021-11-15,合同会社
合同会社優商会,福岡県福岡市中央区渡辺通１丁目１番１号サンセルコ２階,2021-11-15,合同会社
合同会社和親,兵庫県神戸市北区鈴蘭台西町３丁目７番２号、和楽ビル,2021-11-15,合同会社
合同会社喜富,徳島県徳島市幟町１丁目５番地,2021-11-15,合同会社
合同会社大島きのこ園,栃木県塩谷郡塩谷町大字船生７９５６番地,2021-11-15,合同会社
合同会社富貴,静岡県静岡市駿河区池田３７３番地,2021-11-15,合同会社
合同会社平和,三重県四日市市西富田２丁目４番２４号,2021-11-15,合同会社
合同会社平島勉Ｗｏｒｋｓ,兵庫県西宮市名塩さくら台２丁目１８番地２,2021-11-15,合同会社
合同会社恒進工業,岡山県岡山市南区箕島１６５番地１１,2021-11-15,合同会社
合同会社愛華,長崎県長崎市江里町１３番１４号,2021-11-15,合同会社
合同会社木許建築事務所,大阪府大阪市浪速区戎本町１丁目８番１２号フェリーチェ難波１０１,2021-11-15,合同会社
合同会社祐,埼玉県比企郡川島町大字中山１４２０番地１,2021-11-15,合同会社
合同会社福田商店,大阪府大阪市淀川区宮原２丁目１２番１４－１１１７号,2021-11-15,合同会社
合同会社虎彪丸,北海道函館市石川町１８８番地１４,2021-11-15,合同会社
合同会社西中商店,高知県高岡郡越知町越知甲２１１０番地１,2021-11-15,合同会社
合同会社食ジャパン,三重県松阪市桜町２７－１０,2021-11-15,合同会社
合同会社ＡＲＩＭＥ,愛知県名古屋市昭和区福原町１丁目３１番地の１,2021-11-15,合同会社
合同会社ＡｕｇＯｎｅ,千葉県千葉市若葉区若松町５３１番地８１,2021-11-15,合同会社
合同会社Ｃ．Ｎ．Ｉエクステリア,茨城県牛久市牛久町２４７番地２,2021-11-15,合同会社
合同会社ＣＯＨ,福岡県福岡市南区五十川２丁目２４－６,2021-11-15,合同会社
合同会社Ｃｏｔｔｏｎｌｅａｆ,愛知県岡崎市戸崎町字藤狭２２番地３７カーサビラ光ヶ丘４０４,2021-11-15,合同会社
合同会社Ｆｏｒｃｅ　Ｏｎｅ,岡山県和気郡和気町矢田１０２‐２,2021-11-15,合同会社
合同会社Ｇｕｉｌｄ,広島県三原市中之町５丁目１９－１０,2021-11-15,合同会社
合同会社ＨＩＮＡＴＡ,青森県青森市本町５丁目６番２号,2021-11-15,合同会社
合同会社ＨＳ　ＴＲＩＧＧＥＲ,東京都新宿区愛住町７番地８ミハス四谷三丁目１０４,2021-11-15,合同会社
合同会社ＨＹＡＫＵ,北海道旭川市二条通２丁目１９８０番２,2021-11-15,合同会社
合同会社Ｈｅｌｉｏｓ,神奈川県横浜市中区元浜町３丁目２３番地プロスタイル横浜馬車道４０４号室,2021-11-15,合同会社
合同会社Ｈｕｍａｎ　ａｎｄ　Ａｒｔｉｆａｃｔｓ,東京都新宿区大久保２丁目４番１２号新宿ラムダックスビル５Ｆ５０１号室,2021-11-15,合同会社
合同会社ＪＡＶＭＳ,神奈川県川崎市川崎区砂子２丁目６番地１１,2021-11-15,合同会社
合同会社ＫＩＲＡＮ,岐阜県岐阜市早田栄町１丁目１０番地,2021-11-15,合同会社
合同会社ＫＭＳ,東京都港区港南３丁目５―１０パークタワー品川ベイワード１８１２,2021-11-15,合同会社
合同会社Ｌ,静岡県浜松市中区中島４丁目８番５号,2021-11-15,合同会社
合同会社ＭＡＬＵＨＩＡ,愛知県名古屋市東区白壁２丁目１１番１３号,2021-11-15,合同会社
合同会社Ｍｉｌｌ,北海道北見市高砂町１５番２９号ＧｒｅｅｎＣｒｏｓｓ高砂Ⅱ１－２号,2021-11-15,合同会社
合同会社ＮＥＸＴ　ＢＩＲＴＨ,三重県桑名市大字小貝須９６３番地２,2021-11-15,合同会社
合同会社ＮＳＧ,大阪府大阪市東住吉区中野３丁目３－２－６０１号,2021-11-15,合同会社
合同会社Ｎｉｋｅ,広島県広島市中区富士見町１５番６－９０１号,2021-11-15,合同会社
合同会社ＰＦＭ,神奈川県横浜市保土ケ谷区川島町１４６２－８,2021-11-15,合同会社
合同会社ＲＩＺＷＡＮ　ＴＲＡＤＩＮＧ,茨城県猿島郡境町大字塚崎２８７４番地１,2021-11-15,合同会社
合同会社ＳＨＩＯ風,栃木県塩谷郡塩谷町大字風見山田４２４番地３,2021-11-15,合同会社
合同会社Ｓｉｍｐｌｅ３,東京都新宿区新宿２丁目４番２号,2021-11-15,合同会社
合同会社Ｔ’ｚカンパニー,北海道札幌市南区藤野五条５丁目１３番６号,2021-11-15,合同会社
合同会社Ｔ＆Ａ　ｐｒｏｄｕｃｔ,東京都渋谷区桜丘町２１番１号,2021-11-15,合同会社
合同会社Ｕｎａ　Ｆｅｌｉｃｉｄａｄ,神奈川県横須賀市追浜本町１丁目２８番地５サンビーチ追浜１１０２,2021-11-15,合同会社
合同会社Ｕｎｉｔｅ,大阪府大阪市西区新町２丁目５番１－７０６号,2021-11-15,合同会社
合同会社ＹＯＮＰＯ,愛知県名古屋市名東区石が根町６８番地の７,2021-11-15,合同会社
合同会社ＹＵＭＥＧＩ,静岡県浜松市中区海老塚２丁目７番９号,2021-11-15,合同会社
合同会社ｃｏｍｍｉｔ,東京都港区南青山２丁目２番１５号,2021-11-15,合同会社
合同会社ｄｂ－ｌａｂ,千葉県柏市末広町４－５,2021-11-15,合同会社
合同会社ｉ．Ｍｅｌｔ,広島県広島市安佐南区伴東７丁目５８番３１－２０３号,2021-11-15,合同会社
合同会社ｓｔａｒｔ　Ｅｔ　ｕｐ,沖縄県浦添市屋富祖２丁目２０番３－２号,2021-11-15,合同会社
呉服橋ＧＰ一般社団法人,東京都千代田区九段南３丁目７番７号成和綜合会計事務所内,2021-11-15,その他の設立登記法人
四日市一般廃棄物処理協同組合,三重県四日市市中野町２０１０番地,2021-11-15,その他の設立登記法人
坂商株式会社,福岡県北九州市八幡東区帆柱４丁目１０番８号,2021-11-15,株式会社
大吉商事株式会社,埼玉県川口市栄町３丁目５－１川口駅東口第三工区再開発ビル,2021-11-15,株式会社
大魚株式会社,東京都葛飾区青戸７丁目２３番１１号,2021-11-15,株式会社
安家株式会社,大阪府大阪市浪速区大国３丁目４－１３－７Ｆ,2021-11-15,株式会社
宮本ホールディングス株式会社,北海道小樽市奥沢１丁目１９番４号,2021-11-15,株式会社
平田設備株式会社,広島県広島市東区戸坂桜上町１０番７号,2021-11-15,株式会社
弁護士法人ＩＳＳＩ,福岡県福岡市中央区赤坂１丁目１５番３３号ダイアビル福岡赤坂４０１号,2021-11-15,その他の設立登記法人
愛佳株式会社,東京都足立区佐野１丁目４番１０号,2021-11-15,株式会社
新栄工機株式会社,静岡県焼津市大栄町２丁目８番９号,2021-11-15,株式会社
新義成実宗　遠懸山　孝導院,静岡県掛川市下土方２６０番地の２,2021-11-15,その他
日本風車株式会社,広島県呉市中通２丁目６番６号,2021-11-15,株式会社
暁株式会社,福岡県那珂川市道善２丁目４０番地渡辺第２ビル５０１,2021-11-15,株式会社
有限会社ファミリー,北海道札幌市南区真駒内上町３丁目２番地１４,2021-11-15,有限会社
松田重機合同会社,沖縄県中頭郡読谷村字喜名２２８３番地１,2021-11-15,合同会社
松竹梅株式会社,奈良県奈良市西木辻町１２１番地の２－４０１,2021-11-15,株式会社
株式会社あおいぷらんにんぐ,静岡県浜松市中区葵西５丁目１２番６－１号,2021-11-15,株式会社
株式会社あそしあ少額短期準備ＮＥＯ,東京都千代田区九段北３丁目２番５号,2021-11-15,株式会社
株式会社かいてきラボ,奈良県奈良市五条町１６２番地２,2021-11-15,株式会社
株式会社かわさきメディケアパートナーズ,神奈川県川崎市川崎区渡田向町１５番７号村田ビル１Ｆ,2021-11-15,株式会社
株式会社くるみ,奈良県葛城市長尾３３９番地４,2021-11-15,株式会社
株式会社くろしぇっと,岩手県奥州市江刺豊田町２丁目１番５号,2021-11-15,株式会社
株式会社しっとる,岡山県岡山市北区本町６番３６号第一セントラルビル４階,2021-11-15,株式会社
株式会社なかよし総合会計,大阪府吹田市千里山東１丁目１６番１６号,2021-11-15,株式会社
株式会社にしき,岐阜県関市西田原９２１番地,2021-11-15,株式会社
株式会社ぶれす・いいと,大阪府大阪市東淀川区東中島１丁目１７番５－７１５号,2021-11-15,株式会社
株式会社みらいふ,愛知県岡崎市羽根町字東荒子５９番地１,2021-11-15,株式会社
株式会社やまがみ,東京都港区西麻布４丁目２－１３八幡ビル３階,2021-11-15,株式会社
株式会社ゆうのうえん,神奈川県藤沢市辻堂６丁目１９番２６号,2021-11-15,株式会社
株式会社アイリス,福井県敦賀市市野々町２丁目８０９番地アニマート市野々２０２,2021-11-15,株式会社
株式会社アイルクリエイト,大阪府大阪市淀川区西中島５丁目２番１２号,2021-11-15,株式会社
株式会社アグリワシオ,愛知県愛西市三和町北条３８番地,2021-11-15,株式会社
株式会社アストラリー,東京都北区浮間３丁目２番１－５０２号プリモハイツ,2021-11-15,株式会社
株式会社アセットプラス,東京都中央区銀座６丁目６番１号,2021-11-15,株式会社
株式会社ウェルサポート,愛知県春日井市柏井町１丁目７０番地新豊土地ビル３Ｆ,2021-11-15,株式会社
株式会社エイチケイ,兵庫県西宮市鳴尾町５丁目８番２号,2021-11-15,株式会社
株式会社エイトテクノ,大分県大分市大在北１丁目１３番２２－２号,2021-11-15,株式会社
株式会社エスケイトレーディング,大阪府大阪市中央区谷町４丁目８番１２－２０４号,2021-11-15,株式会社
株式会社エデュケート,岡山県津山市小田中２１９０番地５,2021-11-15,株式会社
株式会社エヒク,愛媛県今治市石井町４丁目５番４０号,2021-11-15,株式会社
株式会社エフ・プランニング,島根県雲南市三刀屋町三刀屋１１２１番地１,2021-11-15,株式会社
株式会社エムケーコーポレーション,埼玉県川越市東田町４番地３１１,2021-11-15,株式会社
株式会社エム小泉,神奈川県川崎市宮前区鷺沼２丁目９番地１,2021-11-15,株式会社
株式会社オカド,静岡県磐田市豊田３５０番地２,2021-11-15,株式会社
株式会社オギソテイ,愛知県知立市上重原町中根８０番地１,2021-11-15,株式会社
株式会社オチェアーノ,福岡県福岡市中央区鳥飼２丁目１番４０－８０３号,2021-11-15,株式会社
株式会社オフィス円や,長野県松本市大字笹賀１８９９番地,2021-11-15,株式会社
株式会社オリズム,東京都中央区銀座１丁目２２－１１,2021-11-15,株式会社
株式会社オリーブ,東京都新宿区西新宿３丁目７番１号新宿パークタワー３０階,2021-11-15,株式会社
株式会社オール,広島県福山市坪生町１丁目４３番２２号,2021-11-15,株式会社
株式会社キムンカムイ,大阪府大阪市都島区内代町１丁目１番２６号,2021-11-15,株式会社
株式会社ギア,東京都中央区八丁堀３丁目１４番４号,2021-11-15,株式会社
株式会社クオン,東京都新宿区中落合３丁目１１番５号,2021-11-15,株式会社
株式会社クライス,愛知県岡崎市明大寺町字馬場東１６４番地１,2021-11-15,株式会社
株式会社クリアループ,沖縄県宮古島市平良字東仲宗根４２８番地,2021-11-15,株式会社
株式会社クロスアーク,大阪府大阪市中央区糸屋町１丁目２番１１－１３０４号,2021-11-15,株式会社
株式会社クロスリンク,大阪府豊中市上新田１丁目１９番３６ジオ千里中央ザ・レジデンス３１４号,2021-11-15,株式会社
株式会社クールラボ,大阪府大阪市中央区南船場２丁目２番２－１５０１号,2021-11-15,株式会社
株式会社グランドマム,秋田県秋田市新屋朝日町１３番２３号,2021-11-15,株式会社
株式会社グリーンホーム,神奈川県横浜市中区伊勢佐木町７丁目１５２番地サンヴェール伊勢佐木町７０１号室,2021-11-15,株式会社
株式会社グループＫＡＷＡＺＵ本社,茨城県水戸市千波町７７７番地,2021-11-15,株式会社
株式会社グローバルパートナーズ,福岡県福岡市博多区比恵町１番１８号,2021-11-15,株式会社
株式会社ケスウユ,東京都練馬区関町北２丁目１７番４号,2021-11-15,株式会社
株式会社コルン,東京都港区赤坂２丁目８―１１第１１赤坂葵ビル６０３,2021-11-15,株式会社
株式会社コンジュラー,東京都新宿区西新宿５丁目５番１－４８０２号,2021-11-15,株式会社
株式会社サティス＆ハウスデザインラボ,岐阜県可児市塩１２７７番地２－１０３号,2021-11-15,株式会社
株式会社ザ・フューチャー,東京都葛飾区南水元４丁目２４番４号,2021-11-15,株式会社
株式会社ザ・建物,東京都千代田区平河町２丁目５番３号ＮａｇａｔａｃｈｏＧＲｉＤ５Ｆ,2021-11-15,株式会社
株式会社シグマ紙業,東京都港区芝浦３丁目７番１２号,2021-11-15,株式会社
株式会社ジースタイル,広島県福山市神辺町字平野７２４番地７,2021-11-15,株式会社
株式会社ジーワン,東京都新宿区西新宿８丁目８－２４西新宿シティーハウス１Ｆ,2021-11-15,株式会社
株式会社スクイズトライ,大阪府大阪市北区芝田１丁目１０番１０号,2021-11-15,株式会社
株式会社スタジオファナシ,大阪府大阪市北区西天満６丁目７番２号ＳＲ梅新ビル８階Ｂ３室,2021-11-15,株式会社
株式会社スタンドアップ,東京都港区新橋５丁目２５番２号キャセイパシフィックビル１－５階,2021-11-15,株式会社
株式会社ステラワークス,愛知県名古屋市昭和区阿由知通１丁目５番３号,2021-11-15,株式会社
株式会社スロージャーナル,千葉県市川市塩焼４丁目１番２３号,2021-11-15,株式会社
株式会社セワ美健,東京都中央区新川２丁目２２番６号ＳＪＩビル４Ｆ,2021-11-15,株式会社
株式会社ゼブラグリーンズ,兵庫県加古川市東神吉町升田１１５５,2021-11-15,株式会社
株式会社ソラコムサイテック,宮城県仙台市青葉区本町１丁目２番５号,2021-11-15,株式会社
株式会社ダスコン郡山,福島県郡山市鳴神１丁目１７番地,2021-11-15,株式会社
株式会社ツルタ,岐阜県各務原市鵜沼羽場町６丁目１４番地３,2021-11-15,株式会社
株式会社テクノスペース,福岡県福岡市東区多の津４丁目５番１２号ＬＩＺビル２Ｆ,2021-11-15,株式会社
株式会社テン・ホープス,和歌山県新宮市田鶴原町２丁目７番１３号,2021-11-15,株式会社
株式会社トナリアル,大阪府大阪市鶴見区放出東３丁目３６番１０－１００１号,2021-11-15,株式会社
株式会社トリニティ,愛知県豊明市阿野町登５１番地１,2021-11-15,株式会社
株式会社トレア,広島県広島市中区本通７番２９号,2021-11-15,株式会社
株式会社トレノーヴェ,東京都新宿区西新宿８丁目１番２号,2021-11-15,株式会社
株式会社トータルアシスト,埼玉県行田市桜町２丁目２１番２１号,2021-11-15,株式会社
株式会社ナディス,大阪府大阪市福島区福島２丁目１０番１９号メガロコープ５０９,2021-11-15,株式会社
株式会社ナミ,東京都品川区北品川５丁目６番１６－６０５号,2021-11-15,株式会社
株式会社ネクストラボ,東京都港区赤坂２丁目１７番１－１８１０号,2021-11-15,株式会社
株式会社ハイブリッジ,茨城県石岡市大谷津４番１５号,2021-11-15,株式会社
株式会社ハマベース,神奈川県横浜市中区伊勢佐木町４丁目１２１番地３ストーク伊勢佐木五番館３０６号室,2021-11-15,株式会社
株式会社ハーグラボ,福岡県福岡市中央区天神２丁目３番１０―７１９号天神パインクレスト,2021-11-15,株式会社
株式会社バラティエ,愛知県名古屋市中区大須２丁目２６番１１号,2021-11-15,株式会社
株式会社パシフィック・サンフィールド,東京都目黒区八雲１丁目４番６号,2021-11-15,株式会社
株式会社パームツリーインターナショナル,神奈川県横浜市青葉区あざみ野１丁目２３－３８,2021-11-15,株式会社
株式会社ビーストーン,東京都杉並区宮前４丁目２７番１９号,2021-11-15,株式会社
株式会社ピピルノ,大阪府大阪市中央区北浜３丁目２番２５号京阪淀屋橋ビル８階,2021-11-15,株式会社
株式会社ピース,和歌山県海南市下津町方２０８８番地２８,2021-11-15,株式会社
株式会社フジソウ,岡山県岡山市南区豊成３丁目３番２９号,2021-11-15,株式会社
株式会社プロスタイル８,静岡県静岡市葵区井宮町１４８番地の４,2021-11-15,株式会社
株式会社ヘリドー,大阪府大阪市中央区内平野町１丁目２番９号,2021-11-15,株式会社
株式会社ホープカンパニー,東京都渋谷区神宮前６丁目２３－４桑野ビル２階,2021-11-15,株式会社
株式会社ホールデム,大阪府大阪市中央区瓦町３丁目３番１６号,2021-11-15,株式会社
株式会社マーキュリープラザ,岡山県玉野市東田井地１４３２番地４,2021-11-15,株式会社
株式会社ミエルカオムニバス,宮崎県宮崎市大字田吉１０２５番地３,2021-11-15,株式会社
株式会社ミツアナ,東京都足立区足立３丁目１７番６号１Ｆ,2021-11-15,株式会社
株式会社メディカルＡパートナーズ,福岡県直方市大字感田１３８８番地１,2021-11-15,株式会社
株式会社モノクローム,大阪府大阪市大正区三軒家東５丁目１番２７－１００４号,2021-11-15,株式会社
株式会社ユーカラー,広島県広島市西区楠木町１丁目９番１１号,2021-11-15,株式会社
株式会社ライフパートナー,北海道札幌市西区二十四軒三条５丁目２番５－２０３号,2021-11-15,株式会社
株式会社ライ．テック,岐阜県各務原市那加桜町２丁目３５６番地,2021-11-15,株式会社
株式会社ラモハウス,東京都目黒区下目黒２丁目２１番１８－１２０３号,2021-11-15,株式会社
株式会社リカバリープラン,三重県伊賀市大野木１７３７番地の２,2021-11-15,株式会社
株式会社リップル中野,山形県上山市高野字上河原１１７－４,2021-11-15,株式会社
株式会社リハビット,東京都新宿区市谷台町１１番２０号,2021-11-15,株式会社
株式会社リバースＰＲＯ,奈良県奈良市三条大路２丁目２－５６,2021-11-15,株式会社
株式会社ロプレ,静岡県焼津市中港１丁目３番９号,2021-11-15,株式会社
株式会社ヴィジョニスト,東京都江戸川区南小岩２丁目１３番１３号,2021-11-15,株式会社
株式会社一心,福岡県北九州市若松区大井戸町９番１０号,2021-11-15,株式会社
株式会社三河インテリア,千葉県船橋市三咲５丁目２８番９号,2021-11-15,株式会社
株式会社与古美,長野県上伊那郡箕輪町大字中箕輪１６３３９番地１,2021-11-15,株式会社
株式会社中橋ホールディングス,東京都中央区京橋１丁目１番９号,2021-11-15,株式会社
株式会社丸刀安保水産,北海道島牧郡島牧村字元町１５３番地,2021-11-15,株式会社
株式会社丸山畜産,山形県鶴岡市羽黒町富沢字月ノ木２７番地,2021-11-15,株式会社
株式会社介護事業所コスモス,静岡県静岡市葵区瀬名７丁目３２番４１号,2021-11-15,株式会社
株式会社仮谷調査事務所,岡山県岡山市東区松新町２２７番地６,2021-11-15,株式会社
株式会社共信,千葉県市原市五井西４丁目１３番地１パークハイムマルサンＤ１０２,2021-11-15,株式会社
株式会社創億恒産,神奈川県横浜市中区山下町１３７番地１６,2021-11-15,株式会社
株式会社創現,福島県田村市大越町上大越字水神宮１９３－１,2021-11-15,株式会社
株式会社大真,大阪府豊中市上野西１丁目１番２５－１０７号室,2021-11-15,株式会社
株式会社天才,兵庫県三田市下井沢３３３番地,2021-11-15,株式会社
株式会社実石商事,神奈川県横浜市鶴見区仲通３丁目８０番地１１,2021-11-15,株式会社
株式会社山一青果,大阪府大阪市福島区野田５丁目３番１０号,2021-11-15,株式会社
株式会社山中屋,大阪府大阪市都島区毛馬町２丁目１１番１０－３２０号,2021-11-15,株式会社
株式会社山本,神奈川県小田原市板橋２８０番地の３,2021-11-15,株式会社
株式会社岩谷電気設備,大阪府豊中市浜３丁目２１番２９号,2021-11-15,株式会社
株式会社工房山﨑,北海道岩見沢市上幌向北一条３丁目７３４番地６７,2021-11-15,株式会社
株式会社廣宮商会,大阪府松原市一津屋１丁目７番１０号,2021-11-15,株式会社
株式会社改成工業,富山県富山市向新庄１３４８番地８,2021-11-15,株式会社
株式会社新日本防犯,福岡県福岡市中央区荒戸３丁目３－１７－７０１,2021-11-15,株式会社
株式会社日本補助金サポートセンター,東京都千代田区外神田６丁目１５－１４,2021-11-15,株式会社
株式会社明豊創建,岐阜県岐阜市西中島３丁目１１番２０号,2021-11-15,株式会社
株式会社晃華堂,東京都八王子市下恩方町５０９番地,2021-11-15,株式会社
株式会社沖仲,沖縄県名護市大中２丁目４番１９号１階,2021-11-15,株式会社
株式会社河野内装,山口県下関市彦島迫町３丁目１５番９号,2021-11-15,株式会社
株式会社淡路島オニオンズ,兵庫県洲本市五色浜鳥飼浦２５９９－７１７,2021-11-15,株式会社
株式会社渋谷社中,東京都渋谷区東１丁目３２番１２号株式会社プロパティー事務所内,2021-11-15,株式会社
株式会社湖崇,滋賀県大津市一里山５丁目３６番１１号,2021-11-15,株式会社
