法人名,住所,設立日,法人種別
あかね一般社団法人,東京都港区北青山１丁目２番３号,2016-12-01,その他の設立登記法人
きら・きら合同会社,東京都新宿区西新宿３丁目５番３号西新宿ダイヤモンドパレス３０６号,2016-12-01,合同会社
つくし一般社団法人,東京都港区北青山１丁目２番３号,2016-12-01,その他の設立登記法人
ひすい一般社団法人,東京都港区北青山１丁目２番３号,2016-12-01,その他の設立登記法人
みのり一般社団法人,東京都港区北青山１丁目２番３号,2016-12-01,その他の設立登記法人
みらい株式会社,広島県広島市中区銀山町３番１号,2016-12-01,株式会社
アイスブルー株式会社,大阪府大阪市中央区島之内１丁目１０番１６号,2016-12-01,株式会社
アグリ竜王合同会社,滋賀県蒲生郡竜王町大字小口１５４番地,2016-12-01,合同会社
アトラクトデザイン株式会社,東京都世田谷区等々力２丁目３２番９号Ｔ－ａｃｔ２,2016-12-01,株式会社
アリスタ株式会社,東京都中央区日本橋１丁目２番１０号,2016-12-01,株式会社
アルファー合同会社,宮城県仙台市太白区山田北前町４８番１５号,2016-12-01,合同会社
アート力・マネジメント合同会社,大阪府豊中市緑丘４丁目９番３号,2016-12-01,合同会社
アール・ケイ・オネスト株式会社,愛知県名古屋市西区浄心１丁目１番５号,2016-12-01,株式会社
ウェルエステート合同会社,東京都豊島区東池袋３丁目５番７号ユニオンビルディング１０１,2016-12-01,合同会社
エイチアンドエス合同会社,東京都渋谷区富ヶ谷１丁目１７番７号,2016-12-01,合同会社
エヌ・コンコード・コンサルティング株式会社,東京都文京区大塚６丁目８番３号,2016-12-01,株式会社
エースいちご株式会社,福岡県築上郡築上町大字有安９７番地１,2016-12-01,株式会社
オフィスマート合同会社,愛媛県今治市大西町宮脇甲４５７番地１,2016-12-01,合同会社
オプティマイズ・デザイン合同会社,神奈川県横浜市鶴見区鶴見１丁目１２番１１－２０６号,2016-12-01,合同会社
オンザヘッド株式会社,愛知県名古屋市中区栄３丁目３１番１９号Ｆビル栄Ⅲ２Ｆ,2016-12-01,株式会社
キエン株式会社,山形県上山市石曽根４１番地,2016-12-01,株式会社
クロスボーダーネクスト株式会社,東京都千代田区神田駿河台２丁目９番地ＫＤＸ御茶ノ水ビル７Ｆ,2016-12-01,株式会社
ケーライン工業株式会社,埼玉県桶川市大字倉田２６０番地の５,2016-12-01,株式会社
コーケン株式会社,岡山県岡山市南区郡９６１番地２３,2016-12-01,株式会社
ゴー・アヘッド株式会社,神奈川県横浜市南区高砂町３丁目２８番地サンクスライフＢＬＤ７０１,2016-12-01,株式会社
サイヤジェン株式会社,東京都港区新橋１丁目７番１０号,2016-12-01,株式会社
シロン株式会社,兵庫県神戸市中央区栄町通３丁目６番２７－１７０１号,2016-12-01,株式会社
シンプルマインド株式会社,東京都渋谷区神宮前１丁目１番８－４０２号,2016-12-01,株式会社
スターワン株式会社,大阪府堺市北区長曽根町１３０番地４２,2016-12-01,株式会社
セントラルコーポ日の出管理組合法人,北海道苫小牧市日の出町１丁目２番１号,2016-12-01,その他の設立登記法人
センド株式会社,福岡県福岡市博多区寿町２丁目８番１９号,2016-12-01,株式会社
ティーアイプランニング合同会社,徳島県那賀郡那賀町百合字石橋５００番地３,2016-12-01,合同会社
ドリームあすやま株式会社,山口県山口市今井町４番５号,2016-12-01,株式会社
ファイナンシャルトラスト株式会社,東京都新宿区神楽坂６丁目５９番地２,2016-12-01,株式会社
ファンカンパニー株式会社,大阪府大阪市浪速区日本橋３丁目３番９号,2016-12-01,株式会社
ブーランジェリーマルシェ合同会社,宮城県仙台市泉区上谷刈１丁目５番８号,2016-12-01,合同会社
プロテクションテクノロジー合同会社,福岡県福岡市東区筥松１丁目１３番４号グランスヴニール６０３号,2016-12-01,合同会社
ボンジョーノ三街区団地管理組合法人,福岡県北九州市小倉北区東城野町５番１号,2016-12-01,その他の設立登記法人
マークレップジャパン合同会社,福岡県福岡市中央区薬院１丁目２番２号,2016-12-01,合同会社
マーサーコーポレーション合同会社,東京都世田谷区奥沢５丁目３３番２号,2016-12-01,合同会社
ミドルオーガスト合同会社,群馬県桐生市新宿３丁目１２番１１号,2016-12-01,合同会社
ユタカ建設株式会社,埼玉県日高市大字上鹿山７０３番地１,2016-12-01,株式会社
ライカモリソン株式会社,大阪府大阪市城東区関目１丁目１１番Ａ－３１０号,2016-12-01,株式会社
ランタン株式会社,大阪府豊中市蛍池南町一丁目１７番６号,2016-12-01,株式会社
リノア東日本橋管理組合,東京都中央区東日本橋２丁目２１－１リノア東日本橋,2016-12-01,その他
一翔ＩＮＦＩＮＩＴＹ株式会社,宮城県仙台市若林区荒町１２５番地,2016-12-01,株式会社
一般社団法人くらしのプランナー,沖縄県浦添市西原５丁目４５番７号,2016-12-01,その他の設立登記法人
一般社団法人こどもの里,茨城県東茨城郡城里町大字石塚９１０番地２,2016-12-01,その他の設立登記法人
一般社団法人すまいるはうす,大阪府堺市西区草部２００９番地,2016-12-01,その他の設立登記法人
一般社団法人つばめいと,新潟県燕市小関６７０番地,2016-12-01,その他の設立登記法人
一般社団法人わかばやし保育園,京都府京都市伏見区桃山町中島町３０番地,2016-12-01,その他の設立登記法人
一般社団法人ハローケア,秋田県能代市字長崎２２７番地２,2016-12-01,その他の設立登記法人
一般社団法人ファミリー,千葉県いすみ市大原７５３９Ｂ号,2016-12-01,その他の設立登記法人
一般社団法人プレジライフ協会,千葉県船橋市浜町２丁目３番３２号,2016-12-01,その他の設立登記法人
一般社団法人ラテンアメリカネットワーク,神奈川県秦野市下落合７番地の８,2016-12-01,その他の設立登記法人
一般社団法人ワークセールス協会,福岡県福岡市博多区比恵町１番１８－５１８号,2016-12-01,その他の設立登記法人
一般社団法人全国戦略的経営組織基盤創出支援機構,東京都港区西新橋１丁目９番１号,2016-12-01,その他の設立登記法人
一般社団法人全国総合福祉事業組合,大阪府大阪市住吉区沢之町１丁目１番２号,2016-12-01,その他の設立登記法人
一般社団法人愛心ホールディングス,愛媛県大洲市中村２３１番地,2016-12-01,その他の設立登記法人
一般社団法人新月の会,大阪府大阪市北区池田町３番１号ぷらら天満ビル２Ｆ,2016-12-01,その他の設立登記法人
一般社団法人歯科国際先端医療普及協会,東京都港区虎ノ門４丁目３番１号,2016-12-01,その他の設立登記法人
一般社団法人真の健康窓口協会,北海道札幌市中央区南一条西１５丁目１番２３８号,2016-12-01,その他の設立登記法人
一般社団法人空き家ゼロ推進協議会,東京都千代田区神田北乗物町１番地１,2016-12-01,その他の設立登記法人
一般社団法人菜食美人協会,岩手県花巻市山の神５７８番地４,2016-12-01,その他の設立登記法人
一般社団法人認知症ケアアドバイザー協会,愛知県刈谷市恩田町３丁目１５９番地１５,2016-12-01,その他の設立登記法人
一般社団法人ＡＳＧＪ１,東京都中央区銀座１丁目６番１１号土志田ビルディング３Ｆ,2016-12-01,その他の設立登記法人
一般社団法人ＮＥＷ　ＶＩＳＩＯＮ,大阪府大阪市北区天満２丁目２番１５号フロンティア天満４０３号室,2016-12-01,その他の設立登記法人
一般社団法人Ｐａｒｔｅｒｒｅ　ｆｌｅｕｒｓ,広島県福山市曙町３丁目１５番２－２号,2016-12-01,その他の設立登記法人
一般社団法人ＷＡＫＥ,東京都中野区若宮１丁目１８番３号ディアス若宮１０３,2016-12-01,その他の設立登記法人
一般社団法人Ｙｏｕｒ　Ｌｉｆｅｓｔｙｌｅ研究所,東京都江東区豊洲２丁目５番１号アーバンドックパークシティ豊洲Ａ－２５０６号,2016-12-01,その他の設立登記法人
三共フードトレーディング株式会社,東京都新宿区荒木町２２番地２,2016-12-01,株式会社
三協りんかいサービス株式会社,香川県坂出市築港町１丁目６番２７号,2016-12-01,株式会社
不二商事株式会社,東京都足立区西新井本町４丁目２２番２２号,2016-12-01,株式会社
中小企業共済制度拡充協議会,東京都中央区日本橋浜町２丁目１１番地２,2016-12-01,その他
代官山さん昇合同会社,東京都渋谷区代官山町８番１６号,2016-12-01,合同会社
全国システムハウス業企業年金基金,東京都中央区日本橋人形町３丁目３番１０号,2016-12-01,その他
北嶺合同会社,東京都世田谷区駒沢１丁目１７番１７号真成ビル８Ｆ,2016-12-01,合同会社
医療法人光洋台デンタルクリニック,愛媛県松山市小川甲２００番１,2016-12-01,その他の設立登記法人
医療法人朋優会,熊本県熊本市東区月出３丁目１番４５号,2016-12-01,その他の設立登記法人
医療法人柿の樹会,福岡県福岡市博多区麦野６丁目２２番１１号,2016-12-01,その他の設立登記法人
医療法人社団Ａｌｌ　ｆｏｒ　Ｋａｍａｋｕｒａ,神奈川県鎌倉市大船２丁目２６番２２号湘風館２階,2016-12-01,その他の設立登記法人
医療法人若潮会,福岡県北九州市若松区本町３丁目７番９号,2016-12-01,その他の設立登記法人
協同組合匠,栃木県宇都宮市駒生２丁目１０番２０号,2016-12-01,その他の設立登記法人
南澤合同会社,神奈川県横浜市中区蓬莱町２丁目６番地３－６０６号,2016-12-01,合同会社
厦門中岸進出口有限公司　日本支店,埼玉県さいたま市大宮区東町１丁目１３８番地１,2016-12-01,外国会社等
合同会社あかねインベストメント,東京都港区北青山１丁目２番３号,2016-12-01,合同会社
合同会社あみつき,北海道札幌市豊平区西岡四条２丁目７番１８号,2016-12-01,合同会社
合同会社つくしインベストメント,東京都港区北青山１丁目２番３号,2016-12-01,合同会社
合同会社なつ動物病院,山口県下関市秋根東町８番１０号,2016-12-01,合同会社
合同会社ばん蔵舎,埼玉県上尾市向山３丁目５１番地１８,2016-12-01,合同会社
合同会社ひすいインベストメント,東京都港区北青山１丁目２番３号,2016-12-01,合同会社
合同会社みのりインベストメント,東京都港区北青山１丁目２番３号,2016-12-01,合同会社
合同会社アイエスコーポレーション,愛知県名古屋市中区大須１丁目７番１４号パークＩＭビル２階,2016-12-01,合同会社
合同会社アジャイル,神奈川県横浜市保土ケ谷区法泉１丁目４－３－１００１,2016-12-01,合同会社
合同会社イエワークス,埼玉県久喜市桜田３丁目５番１－９－１０７,2016-12-01,合同会社
合同会社ウーノ,東京都港区浜松町２丁目２番１５号,2016-12-01,合同会社
合同会社エスアンドシー,東京都江東区枝川１丁目１１番２２号,2016-12-01,合同会社
合同会社エスプレッソ,神奈川県大和市福田１６２９番地２,2016-12-01,合同会社
合同会社エヌ・ケーワールド,東京都港区虎ノ門３丁目２２番１０－２０１号,2016-12-01,合同会社
合同会社オガワ,徳島県阿波市土成町土成字寒方５１番地１,2016-12-01,合同会社
合同会社オクト,静岡県富士宮市大中里１１６２番地の３,2016-12-01,合同会社
合同会社オフィスキャンプ,奈良県吉野郡東吉野村大字狭戸６０番地の３,2016-12-01,合同会社
合同会社カズレック,千葉県市原市有秋台西１丁目６番５８,2016-12-01,合同会社
合同会社キャビンズカンパニー,東京都中央区佃２丁目１番１－２７０９号,2016-12-01,合同会社
合同会社ケー・アンド・ケー,東京都港区浜松町２丁目２番１５号,2016-12-01,合同会社
合同会社ジェイプロジェクト,千葉県千葉市若葉区加曽利町７２６番地１カーサアルバーダⅠ２０２号,2016-12-01,合同会社
合同会社ティーエスアイ,群馬県前橋市大友町１丁目６番地５ダイアパレス前橋大友１００６号,2016-12-01,合同会社
合同会社トロフ,福岡県大川市大字本木室７０番地,2016-12-01,合同会社
合同会社ファンタイム,東京都港区芝５丁目２７番３号ＭＢＣ,2016-12-01,合同会社
合同会社ブヤンテトレード,茨城県猿島郡境町大字長井戸１６９１番地５,2016-12-01,合同会社
合同会社プロフィットセンター,兵庫県神戸市中央区御幸通８丁目１番６号神戸国際会館２２階,2016-12-01,合同会社
合同会社ベストクリーン,東京都立川市曙町３丁目４９番４号コーポ池田２０２,2016-12-01,合同会社
合同会社メルパレス,東京都府中市幸町１丁目２６番地の５,2016-12-01,合同会社
合同会社モリタ,愛知県名古屋市中村区名駅５丁目４番１４号,2016-12-01,合同会社
合同会社ラクーアマリンクラブ,沖縄県石垣市字大浜５０２番地１,2016-12-01,合同会社
合同会社レイブルーム,東京都渋谷区恵比寿２丁目２８番１０号ＳｈｕＢＬＤＧ２７７０,2016-12-01,合同会社
合同会社レグルス,東京都港区赤坂６丁目１９番５０－４０４号,2016-12-01,合同会社
合同会社レチェ,宮城県岩沼市里の杜２丁目５番７－１０３号,2016-12-01,合同会社
合同会社ワインカラカラ東京,東京都中央区勝どき２丁目１０番９号,2016-12-01,合同会社
合同会社一歩,三重県四日市市松原町９番６号,2016-12-01,合同会社
合同会社夏王朝,埼玉県さいたま市西区大字植田谷本１３７－１,2016-12-01,合同会社
合同会社大田Ｒｅａｌ　Ｅｓｔａｔｅ,奈良県橿原市曽我町３７３番地の２７,2016-12-01,合同会社
合同会社新里板金塗装工場,沖縄県宮古島市平良字島尻３００番地,2016-12-01,合同会社
合同会社栞,大阪府大阪市中央区玉造１丁目６番１３号,2016-12-01,合同会社
合同会社清田会計,福岡県福岡市中央区大手門１丁目８－８－６０５,2016-12-01,合同会社
合同会社理はど,岩手県花巻市石神町１３１番地,2016-12-01,合同会社
合同会社眼福,兵庫県神戸市北区松が枝町２丁目２２番地の７,2016-12-01,合同会社
合同会社赤城模型,東京都足立区神明３丁目２４番２３号,2016-12-01,合同会社
合同会社進学塾Ｕｉｎｅ,東京都墨田区石原２丁目６番９－１０２号,2016-12-01,合同会社
合同会社ＡＱＵＡ　ＢＩＡＮＣＡ,東京都渋谷区恵比寿西１丁目１２番１０号,2016-12-01,合同会社
合同会社ＡＹＡＭＥ．ＥＬＣ,宮城県栗原市若柳字川南町浦７７番地２,2016-12-01,合同会社
合同会社ＢＬＥＳＳ,大分県日田市城町１丁目４番２の１３号,2016-12-01,合同会社
合同会社ＣＡＬＯＮＡ,新潟県新潟市中央区米山３丁目１番３１号パストラルハイム米山弐番館９０２号,2016-12-01,合同会社
合同会社Ｄｒｅｓｓ,滋賀県草津市大路１丁目４番３２号,2016-12-01,合同会社
合同会社ＧＲＥＥＮＴＲＡＣＥ,大阪府茨木市南安威３丁目１１番５０号,2016-12-01,合同会社
合同会社Ｈ＆Ｈ,神奈川県横浜市旭区鶴ケ峰１丁目３３番地１８,2016-12-01,合同会社
合同会社Ｋ・Ｋ・Ｓ,東京都新宿区高田馬場３丁目１２番５号セブンビルＢ１Ｆ,2016-12-01,合同会社
合同会社ＭＩＮＡＭＩ　ＡＺＡＢＵ　ＲＳＩＣ,東京都中央区新川１丁目１７番１８号,2016-12-01,合同会社
合同会社ＭＫＭ,東京都文京区本郷４丁目３２番６号,2016-12-01,合同会社
合同会社Ｎｅｘｔ　Ａ．,静岡県浜松市中区西伊場町６番２２号,2016-12-01,合同会社
合同会社Ｒｏｏｆ,兵庫県明石市小久保１２０番地の５５Ｂ－１２０３号,2016-12-01,合同会社
合同会社ＳＴＫ,東京都千代田区一番町９番地８,2016-12-01,合同会社
合同会社Ｔ　ａｎｄ　Ｔ　ＬＬＣ,大阪府大阪市北区天神橋２丁目５－２５,2016-12-01,合同会社
合同会社Ｔ－ＲＩａｌ　Ｅｓｔａｔｅ１,東京都世田谷区奥沢５丁目１番１１－２０２号,2016-12-01,合同会社
合同会社ＹＫファクトリー,東京都目黒区目黒本町２丁目１５番７－１０４号,2016-12-01,合同会社
合同会社ＹＭＳコーポレーション,神奈川県秦野市本町３丁目１１番１８号,2016-12-01,合同会社
合名会社シモハマ,広島県呉市広大広１丁目５番３６号,2016-12-01,合名会社
啓龍株式会社,東京都中野区上鷺宮１丁目２－４関口ビル１１６号,2016-12-01,株式会社
大五郎株式会社,鹿児島県鹿児島市田上８丁目２１番１１号,2016-12-01,株式会社
大町農業會,長野県大町市大町２５４６番地,2016-12-01,その他の設立登記法人
宜鼎国際股份有限公司,,2016-12-01,外国会社等
宮古市くざかいソーラーパーク合同会社,東京都港区虎ノ門４丁目３番１号城山トラストタワー２６階,2016-12-01,合同会社
小原農園株式会社,岡山県苫田郡鏡野町下原１０１６番地,2016-12-01,株式会社
山佐ＡＭＸ１リース株式会社,東京都千代田区丸の内３丁目１番１号東京共同会計事務所内,2016-12-01,株式会社
山佐ＡＭＸ２リース株式会社,東京都千代田区丸の内３丁目１番１号東京共同会計事務所内,2016-12-01,株式会社
市政会,長野県中野市三好町１丁目３－１９,2016-12-01,その他
戸塚土地建物株式会社,神奈川県横浜市戸塚区戸塚町４１２５番地,2016-12-01,株式会社
新嘉文創事業股份有限公司,,2016-12-01,外国会社等
日本メディカルライン株式会社,宮城県名取市小山２丁目６番３１号,2016-12-01,株式会社
日本建設機械レンタル企業年金基金,東京都中央区日本橋小網町９番９号小網町安田ビル３階,2016-12-01,その他
日輝設備株式会社,東京都中野区上鷺宮１丁目２－４関口ビルＢ１０４号,2016-12-01,株式会社
有限責任下阿多古村信用組合,静岡県浜松市天竜区上野１４７番地,2016-12-01,その他の設立登記法人
朋友合同会社,東京都墨田区石原３丁目３３番１４号,2016-12-01,合同会社
末広建設株式会社,東京都江東区大島５丁目３４番２号,2016-12-01,株式会社
林国際貿易株式会社,大阪府大阪市中央区日本橋１丁目５－１５－８０４号,2016-12-01,株式会社
株式会社おだやか,千葉県松戸市日暮３丁目２番１号コーポサンエイト５０２,2016-12-01,株式会社
株式会社そら,岡山県倉敷市児島唐琴４丁目１４番２３号,2016-12-01,株式会社
株式会社だいしん,大阪府藤井寺市小山７丁目１２４２番地の２１,2016-12-01,株式会社
株式会社まっちん,三重県伊賀市上野車坂町６１５番地の４３,2016-12-01,株式会社
株式会社みやび,熊本県熊本市中央区水前寺６丁目１１番２号,2016-12-01,株式会社
株式会社ものがたりスタジオ,愛知県常滑市飛香台２丁目１番地の３,2016-12-01,株式会社
株式会社ゆりや,京都府京都市伏見区淀池上町１６０番地の１０,2016-12-01,株式会社
株式会社れん,東京都中野区弥生町６丁目２番２－１００８号,2016-12-01,株式会社
株式会社アイ・クリエイト,千葉県木更津市潮浜１丁目１７番地２９,2016-12-01,株式会社
株式会社アカクラホールディングス,東京都港区南青山６丁目７番１４号チガー南青山４階,2016-12-01,株式会社
株式会社アカツキ,埼玉県さいたま市北区日進町２丁目１０５９番地１フードガーデン日進店２階,2016-12-01,株式会社
株式会社アップルバンク,東京都中央区日本橋室町１丁目６番１号,2016-12-01,株式会社
株式会社アパートメントバンク,東京都港区浜松町２丁目１０番１０号,2016-12-01,株式会社
株式会社アポロ,福島県福島市南矢野目字境田１０番地の３,2016-12-01,株式会社
株式会社アリン,埼玉県川口市芝下２丁目２０番２３号ファミール芝下３０１号,2016-12-01,株式会社
株式会社アンナ商事,東京都台東区千束４丁目２７番６号,2016-12-01,株式会社
株式会社アートシェイプ,東京都江東区森下３丁目１５番１２号徳岡ビル１階,2016-12-01,株式会社
株式会社イケス,東京都江東区豊洲３丁目４番１号,2016-12-01,株式会社
株式会社インストケア,東京都文京区本駒込２丁目１０－５ＩＭビル３Ｆ,2016-12-01,株式会社
株式会社ウインエクサ,東京都調布市布田２丁目２５番地２,2016-12-01,株式会社
株式会社エクスト,富山県富山市上大久保８０１番地２,2016-12-01,株式会社
株式会社エコノガイド,東京都渋谷区代々木１丁目５４番１１号,2016-12-01,株式会社
株式会社エスアール,埼玉県さいたま市岩槻区上野４丁目１番地３,2016-12-01,株式会社
株式会社エムアンド,北海道札幌市西区琴似三条７丁目６番７－１３０２号,2016-12-01,株式会社
株式会社エンタースペース,福岡県福岡市城南区長尾２丁目２２番３－５０４号,2016-12-01,株式会社
株式会社エンリード,愛知県岡崎市上里２丁目１５番地１７,2016-12-01,株式会社
株式会社エンロバ,大阪府池田市新町２番１４号いけだピアまるセンター,2016-12-01,株式会社
株式会社エンワ・プラン,福島県郡山市安積町荒井字北田１４番地の１,2016-12-01,株式会社
株式会社エースゴルフサポート,愛知県岡崎市藤川荒古１丁目６番地１２,2016-12-01,株式会社
株式会社エーワイ,大阪府堺市東区大美野８－３,2016-12-01,株式会社
株式会社オギテック,静岡県静岡市葵区瀬名１丁目３２番１７号,2016-12-01,株式会社
株式会社オーシャン・ドライブ,東京都文京区千石４丁目４６番１０号,2016-12-01,株式会社
株式会社オーランド,千葉県浦安市今川４丁目１２番１‐８号,2016-12-01,株式会社
株式会社キクタケ興産,愛媛県松山市高井町１０００番地,2016-12-01,株式会社
株式会社ギフト・パートナーズ,東京都足立区弘道２丁目２３番２号,2016-12-01,株式会社
株式会社クロカワキッチン,兵庫県高砂市米田町古新３４０番地の２,2016-12-01,株式会社
株式会社グラスメンテジャパン,愛知県名古屋市中区新栄３丁目５番１５号,2016-12-01,株式会社
株式会社グリムバレー,北海道天塩郡豊富町字上サロベツ西十六線２７６番地,2016-12-01,株式会社
株式会社グレース,愛知県弥富市鎌倉町外分３７４番地４１,2016-12-01,株式会社
株式会社コーエイ建装,大阪府泉北郡忠岡町高月南３丁目１７－２２,2016-12-01,株式会社
株式会社ゴルフタイムスワールド,東京都港区三田３丁目２－４,2016-12-01,株式会社
株式会社サザンクロス,東京都中央区東日本橋３丁目１０番１４号,2016-12-01,株式会社
株式会社サントス,茨城県常陸大宮市泉５４３番地５１大宮レジャーセンター内,2016-12-01,株式会社
株式会社シェイクヨガ,大阪府大阪市平野区加美南１丁目４番１７号,2016-12-01,株式会社
株式会社ジェイシープランニング,沖縄県那覇市字安里１０１番地丸京工芸ビル４０２Ａ,2016-12-01,株式会社
株式会社ジェッツコーポレーション,兵庫県神戸市北区南五葉３丁目５番１５号,2016-12-01,株式会社
株式会社ジュウロクホウイ,東京都千代田区外神田３丁目１６番１２号アキバＣＯビル７Ｆ,2016-12-01,株式会社
株式会社スターライトイノベーション,東京都港区港南４丁目６番１－３１０４号,2016-12-01,株式会社
