法人名,住所,設立日,法人種別
株式会社ＭＪ　Ａｎｅｌａ,東京都中央区銀座１丁目２２番１１号銀座大竹ビジデンス２階,2021-01-14,株式会社
株式会社ＭＯＴＯＩ　ＦＯＯＤ　ＤＥＳＩＧＮ,京都府京都市中京区富小路二条下ル俵屋町１８６番地,2021-01-14,株式会社
株式会社ＭＶＬ,愛知県名古屋市西区名駅２丁目４番１０号,2021-01-14,株式会社
株式会社Ｍｉｒａｉ　Ｇａｄｇｅｔ　Ｆａｃｔｏｒｙｓ,神奈川県横浜市西区高島２丁目１１番２号スカイメナー横浜４２２,2021-01-14,株式会社
株式会社Ｍｏｎｅｙ　Ｐｒｏｆｅｓｓｉｏｎａｌｓ　ＪＡＰＡＮ,大阪府枚方市出口１丁目３番１０－１２１２号,2021-01-14,株式会社
株式会社Ｍｔ．ＬＥＯ,三重県伊勢市小俣町湯田５４番地３,2021-01-14,株式会社
株式会社Ｍｕｔｏ　Ｍｉｌｋ　Ｆａｒｍ,北海道厚岸郡浜中町姉別南５線２３番地１,2021-01-14,株式会社
株式会社ＮＤＸ,東京都中央区勝どき５丁目３－１,2021-01-14,株式会社
株式会社ＮＥＸＴ　ＯＮＥ,大阪府大阪市浪速区湊町２丁目２番１０－３５０７号,2021-01-14,株式会社
株式会社ＮＥＸＴＬＥＶＥＬ,千葉県野田市桜の里２丁目５番地の４５,2021-01-14,株式会社
株式会社ＮＯＷＨＥＲＥ,福岡県福岡市中央区大名２丁目１０番８号プレミスト天神赤坂タワー４１１,2021-01-14,株式会社
株式会社Ｎｅｃｍｏｓ,東京都豊島区北大塚１丁目１１番１７－２０１号,2021-01-14,株式会社
株式会社Ｎｅｘｔａｇｅ,大阪府大阪市都島区東野田町４丁目２３番２４号,2021-01-14,株式会社
株式会社Ｎｏａｈ′ｓ　Ａｒｋ,沖縄県糸満市字糸満２２２８番地,2021-01-14,株式会社
株式会社ＯＤＥＮ,東京都新宿区歌舞伎町２丁目４２番４号７０２,2021-01-14,株式会社
株式会社ＯＧ,東京都目黒区東山１丁目３番１０号,2021-01-14,株式会社
株式会社ＯＩＣパートナー,広島県広島市安佐南区長束５丁目６番２５－３０１号,2021-01-14,株式会社
株式会社ＯＫ住ＭＩＬＥ,大阪府大阪市平野区平野本町２丁目１３番１０号,2021-01-14,株式会社
株式会社Ｏｎｅ　Ｐｕｒｐｏｓｅ,東京都新宿区四谷４丁目１８番８号,2021-01-14,株式会社
株式会社ＰＡＵＳＥ,埼玉県越谷市西方２丁目１６番７号,2021-01-14,株式会社
株式会社ＰＧＬ,東京都江戸川区西葛西２丁目２０番１２－２０３号,2021-01-14,株式会社
株式会社ＰＩＸＩＥ,東京都品川区戸越１丁目３１番１号わかばパルクメゾン１０２,2021-01-14,株式会社
株式会社Ｐｉｅｃｅ＆Ｐｅａｃｅ,富山県滑川市大町１７８６番地４,2021-01-14,株式会社
株式会社Ｐｉｅｒｒｏｔ,神奈川県藤沢市南藤沢２３番３ＦＫビル２Ｆ,2021-01-14,株式会社
株式会社Ｐｖｏｔ,東京都千代田区九段南１丁目５番６号りそな九段ビル５Ｆ－ＫＳフロア,2021-01-14,株式会社
株式会社ＲＥＮＴ,沖縄県那覇市真嘉比２丁目５番６－６０８号真嘉比マンション,2021-01-14,株式会社
株式会社ＲＩＧＨＴＥＯＵＳ　Ｃｏｒｐｏｒａｔｉｏｎ,千葉県木更津市請西東５丁目２４番地４,2021-01-14,株式会社
株式会社Ｒｅ　ｒｉｓｅ,兵庫県西宮市青木町９番９号,2021-01-14,株式会社
株式会社ＲｅｆｏＢｅｓｔ,宮城県仙台市青葉区上愛子字雷神２番地の２４,2021-01-14,株式会社
株式会社ＲｉｎｏＲｉｋｏ,東京都中野区中央５丁目４６番５号,2021-01-14,株式会社
株式会社Ｒｕｂｙ’ｓ,東京都千代田区神田神保町１丁目２番地５,2021-01-14,株式会社
株式会社ＳＡＺＡＮＫＡ　ＦＡＲＭ,宮崎県宮崎市田野町甲２７４１番地６,2021-01-14,株式会社
株式会社ＳＨＡＣＨＩｍｅ,愛知県名古屋市千種区竹越１丁目１５－１２ファミリアーレ千種竹越１００２号,2021-01-14,株式会社
株式会社ＳＨａｒＭｅ,北海道札幌市清田区北野二条３丁目３番３号ＮＳビル１Ｆ,2021-01-14,株式会社
株式会社ＳＩＮＣＥＮ,栃木県小山市駅東通り１丁目３番１５号アキバビル１Ｆ,2021-01-14,株式会社
株式会社ＳＪ,埼玉県川口市大字里３９３番地の７,2021-01-14,株式会社
株式会社ＳＫファーマー,富山県富山市打出４７４番地,2021-01-14,株式会社
株式会社ＳＫＭ,埼玉県さいたま市浦和区本太１丁目１１番１２号ハイツ小川２０２号室,2021-01-14,株式会社
株式会社ＳＳＳ,東京都新宿区新宿５丁目１８番２０号ルックハイツ新宿８０３号,2021-01-14,株式会社
株式会社ＳＹＳ,東京都千代田区九段南１丁目５番６号,2021-01-14,株式会社
株式会社Ｓｑｕａｒｅ　ｏｎｅ,東京都新宿区高田馬場３丁目１２－５セブンビル４０５,2021-01-14,株式会社
株式会社Ｔ・Ｓ・Ｔ,神奈川県横浜市磯子区丸山１丁目８番２－２１３号,2021-01-14,株式会社
株式会社ＴＡＭＵ,兵庫県尼崎市東難波町３丁目１９番地１７天馬ビル・３階,2021-01-14,株式会社
株式会社ＴＡＰ,栃木県宇都宮市京町１１番１号,2021-01-14,株式会社
株式会社ＴＥＮＳＡＩ,東京都板橋区大山東町２２番１号,2021-01-14,株式会社
株式会社ＴＩＡＭＡ,大阪府堺市堺区南花田口町１丁１番１２号,2021-01-14,株式会社
株式会社ＴＩＮＴ　ＦＡＣＴＯＲＹ,埼玉県越谷市レイクタウン６丁目２０番地１Ｇ－ＢＡＳＥ、Ｃ－１,2021-01-14,株式会社
株式会社ＴＫ,山口県下関市彦島角倉町３丁目１７番１号,2021-01-14,株式会社
株式会社ＴＮＫ,大阪府摂津市正雀２丁目１番１８号,2021-01-14,株式会社
株式会社ＴＲＡＮＣＥ,神奈川県横浜市港北区日吉２丁目１５番３０号,2021-01-14,株式会社
株式会社ＴＳ,石川県加賀市大聖寺麻畠町８番地,2021-01-14,株式会社
株式会社ＴＵＮＡＧＵ,大阪府堺市南区和田７１１番地１４５,2021-01-14,株式会社
株式会社ＴＹＣＯＯＮ,沖縄県宮古島市平良字下里５２番地２ディープブルー３０２,2021-01-14,株式会社
株式会社Ｔｈｅ　Ｆｉｒｓｔ,大阪府東大阪市稲田本町２丁目１３番８号フィオーレ・エム３０１,2021-01-14,株式会社
株式会社Ｔｙｓｏｎｓ,東京都中央区新川１丁目３番２１号ＢＩＺＳＭＡＲＴ茅場町,2021-01-14,株式会社
株式会社Ｕ－Ｈｏｐｅ　Ｃｏｍｐａｎｙ,新潟県北蒲原郡聖籠町大字二本松２０５１番地１,2021-01-14,株式会社
株式会社ＵＮＳＥＲ,東京都港区六本木４丁目３番１１号六本木ユニハウス２２３,2021-01-14,株式会社
株式会社Ｖａｎｑｕｉｓｈ　Ｐａｒｔｎｅｒｓ,埼玉県所沢市青葉台１２６３番地の２,2021-01-14,株式会社
株式会社Ｖｅｇａ設計,神奈川県横浜市保土ケ谷区岡沢町２９３番地１ビューバレー三ツ沢５０２号,2021-01-14,株式会社
株式会社ＷｏｍａｎＡｄｖｉｓｏｒ,東京都文京区千駄木２丁目３０番１号グランドメゾン千駄木中央５０３号室,2021-01-14,株式会社
株式会社Ｗｏｎｄｅｒ　Ｃａｍｅｌ,東京都調布市上石原３丁目３７－３３,2021-01-14,株式会社
株式会社Ｙ’ｓ－Ｓｔｙｌｅ,神奈川県横浜市南区大岡２丁目１５番地５,2021-01-14,株式会社
株式会社ＺОＵ,愛知県名古屋市瑞穂区大喜町２丁目８０番地の２,2021-01-14,株式会社
株式会社ａｒｃａ,東京都渋谷区桜丘町２９－３５ヴィラ桜ヶ丘７Ｆ,2021-01-14,株式会社
株式会社ａｒｅａｌｉｚｅ,福岡県福岡市博多区博多駅東２丁目４－３０,2021-01-14,株式会社
株式会社ｃｏｌｏｒｓ,神奈川県横浜市旭区南本宿町１４４番地２５,2021-01-14,株式会社
株式会社ｄｅｃ,三重県津市戸木町４２９５番地７９,2021-01-14,株式会社
株式会社ｅｍｏｌｏｇｙ,東京都港区北青山２丁目７番１３号３Ｆ,2021-01-14,株式会社
株式会社ｆｅｌｉｃｅ,埼玉県さいたま市大宮区桜木町１丁目１番１８号誠ビル２Ｆ,2021-01-14,株式会社
株式会社ｎｏｍｉｎａｔｉｏｎ,神奈川県川崎市高津区久本１丁目１５番１２－４０７号,2021-01-14,株式会社
株式会社ｐｕｎｃｔｕｍ,東京都新宿区下宮比町２－２８－６０８,2021-01-14,株式会社
株式会社ｓｈｅｅｐｙ,愛知県岡崎市福岡町字菱田６４番地３,2021-01-14,株式会社
株式会社ｔ．ａ．ｍ．建築,大阪府大阪市平野区長吉川辺３丁目２０番５号竹島コンパクトオフィスＧ号,2021-01-14,株式会社
株式会社ｔｒａｄｅ　ＫＫＮ,大阪府堺市堺区新町１番７号ＳＡＫＡＩ東ビル１０２号,2021-01-14,株式会社
株式会社ｙｓｙ,神奈川県横浜市青葉区荏田北３丁目９番地４,2021-01-14,株式会社
橋本晋一合同会社,三重県名張市西原町２５８８番地９,2021-01-14,合同会社
武田設業株式会社,奈良県生駒郡平群町西宮３丁目７番５号,2021-01-14,株式会社
殉愛キリスト教会,石川県金沢市鳴和町タ２１０番地,2021-01-14,その他の設立登記法人
水江不動産株式会社,大分県大分市大字生石９２番地の７,2021-01-14,株式会社
浦崎保険事務所株式会社,沖縄県那覇市真嘉比１丁目２番１１号マンションハル２０１,2021-01-14,株式会社
清家建設株式会社,愛媛県宇和島市吉田町立間尻甲１９７０番地,2021-01-14,株式会社
特定非営利活動法人ウィル,大阪府堺市堺区老松町１丁３９番地５フジパレス堺老松町Ⅲ番館２０２号,2021-01-14,その他の設立登記法人
特定非営利活動法人サクラテンペスタ,千葉県千葉市若葉区若松町３６１番地５８,2021-01-14,その他の設立登記法人
特定非営利活動法人フードバンクふなばし,千葉県船橋市金杉５丁目１番１２号,2021-01-14,その他の設立登記法人
特定非営利活動法人生きやすさ研究室,茨城県水戸市東原３丁目６－４４,2021-01-14,その他の設立登記法人
特定非営利活動法人ＮｅｘｔＩｎｎｏｖａｔｉｏｎ,和歌山県御坊市野口４９５番地,2021-01-14,その他の設立登記法人
特定非営利活動法人Ｓｔａｙ　Ａｌｉｖｅ,愛知県知多郡美浜町大字野間字北向井３２番地２,2021-01-14,その他の設立登記法人
由岐漁業協同組合,徳島県海部郡美波町港町字西２９番地,2021-01-14,その他の設立登記法人
真功株式会社,愛知県春日井市六軒屋町４丁目６４番地５,2021-01-14,株式会社
社会保険労務士法人あいわＯｆｆｉｃｅ,山口県下関市秋根西町２丁目３番７号ＮＣビル２階,2021-01-14,その他の設立登記法人
社会保険労務士法人リライト,神奈川県横浜市中区住吉町２丁目２４番地ＫＹビル４階,2021-01-14,その他の設立登記法人
福順産業株式会社,大阪府茨木市郡山２丁目１４番２５号,2021-01-14,株式会社
税理士の不動産屋株式会社,東京都葛飾区柴又１丁目６番１７－３０３号ヴェルビュ高砂,2021-01-14,株式会社
粟国島発酵農園合同会社,沖縄県島尻郡粟国村字東５８４番地,2021-01-14,合同会社
統英開発合同会社,沖縄県中頭郡西原町字我謝７７７番地１、１０３号,2021-01-14,合同会社
考重設株式会社,千葉県八千代市八千代台東５丁目１２番６号,2021-01-14,株式会社
花海川株式会社,大阪府大阪市生野区巽北１丁目１番１号１Ｆ－Ｃ,2021-01-14,株式会社
藤村工務店株式会社,山口県下関市安岡町４丁目８番６号,2021-01-14,株式会社
藤澤設備設計合同会社,東京都板橋区赤塚４丁目３９番３３－４０８号,2021-01-14,合同会社
西宮管財株式会社,兵庫県西宮市鳴尾町２丁目１番１８号,2021-01-14,株式会社
諏訪商店株式会社,青森県青森市大字三内字稲元７２番地８,2021-01-14,株式会社
諾游株式会社,東京都町田市忠生２丁目１３番地８原上コーポ２０２,2021-01-14,株式会社
輝真工業株式会社,福岡県福岡市東区原田２丁目９番３０－３０２号,2021-01-14,株式会社
農事組合法人ファーム天神,富山県南砺市天神１７８番地,2021-01-14,その他の設立登記法人
農事組合法人ライズ,宮城県石巻市和渕字牡丹窪山３３番地,2021-01-14,その他の設立登記法人
農事組合法人前山農士団,新潟県阿賀野市前山４０５番地,2021-01-14,その他の設立登記法人
農事組合法人鷹栖７区,富山県砺波市鷹栖４１５番地,2021-01-14,その他の設立登記法人
遊佐建築株式会社,福島県安達郡大玉村大山字高屋敷１１０番地１,2021-01-14,株式会社
野村ＰＡＩＮＴＨＯＭＥＳ合同会社,千葉県市原市鶴舞１０２５番地７,2021-01-14,合同会社
鈴良株式会社,神奈川県横浜市磯子区杉田３丁目７番２６,2021-01-14,株式会社
長野県言語聴覚士会,長野県飯田市羽場権現９７８－４大原屋内　なりわいオフィス飯田,2021-01-14,その他
関西中央工業株式会社,大阪府吹田市垂水町１丁目６０番３５－４０６号,2021-01-14,株式会社
難波運送合同会社,広島県広島市南区松原町３番２－８１０号,2021-01-14,合同会社
雪中王株式会社,東京都葛飾区東水元３丁目１番５号,2021-01-14,株式会社
青森ひと創りサポート株式会社,青森県青森市安方２丁目２番２０号,2021-01-14,株式会社
青空ホーム株式会社,千葉県船橋市西習志野２丁目２４番８号,2021-01-14,株式会社
静岡市茶業振興協議会,静岡県静岡市清水区旭町６－８,2021-01-14,その他
韓氏集団株式会社,長崎県雲仙市千々石町庚２７６番地４,2021-01-14,株式会社
高梨医療経営合同会社,東京都板橋区前野町２丁目１６番１－４０１号,2021-01-14,合同会社
４Ｃ２Ｕ株式会社,愛知県名古屋市港区惟信町１丁目２９番地の２,2021-01-14,株式会社
Ａ－ＴＥＣＨ株式会社,福島県いわき市泉町黒須野字早稲田８０番地の８２,2021-01-14,株式会社
ＡＢＳ協同組合,福岡県福岡市東区多々良１丁目２５番２３号,2021-01-14,その他の設立登記法人
ＡＢＹＯＮＤ株式会社,東京都大田区大森東１丁目３番５号,2021-01-14,株式会社
ＡＤＤＤＥＳＩＧＮ株式会社,東京都中央区京橋１丁目１番５号セントラルビル２階ｆａｂｂｉｔ京橋,2021-01-14,株式会社
ＡＩＭ　ＯＮＥ株式会社,大阪府大阪市天王寺区勝山４丁目２番２０号ザ・ホワイトレジデンス２０２号,2021-01-14,株式会社
ＡＬＢＡ税理士法人,静岡県静岡市駿河区下島３４５番地の１,2021-01-14,その他の設立登記法人
ＡＬＩ　ＴＲＡＤＩＮＧ合同会社,栃木県足利市大前町６４３番地１サンシャインシティ１０３,2021-01-14,合同会社
ＡＳＥＡＮ　Ｍａｒｋｅｔｉｎｇ株式会社,東京都江東区亀戸６丁目４１番１０号６階,2021-01-14,株式会社
Ａｃｋｅｒｇａｕｌ株式会社,埼玉県川口市大字小谷場４６５番地１,2021-01-14,株式会社
Ａｌｅ　Ａｒｔ　Ｏｆｆｉｃｅ株式会社,東京都清瀬市野塩５丁目２３６番地１３,2021-01-14,株式会社
ＢＲＩＣＫＳ　Ａｓｓｅｔ　Ｍａｎａｇｅｍｅｎｔ合同会社,北海道札幌市西区八軒七条西１丁目１番２３号,2021-01-14,合同会社
Ｂａｍｂｏｏ合同会社,東京都荒川区西尾久２丁目３７番５号信和ビル２０３号室,2021-01-14,合同会社
Ｂｌｕｅ　Ｓｋｙ株式会社,奈良県大和郡山市城町１４７３番地４４,2021-01-14,株式会社
ＢｌｕｅＯｃｅａｎ合同会社,大阪府豊中市岡町南１丁目２番９号,2021-01-14,合同会社
ＣＬＡＮ合同会社,福岡県福岡市南区大橋４丁目２番３号４階,2021-01-14,合同会社
ＣＯＳＭＯ電気株式会社,愛知県名古屋市東区徳川２丁目１０番２２号１Ｃ,2021-01-14,株式会社
Ｃｏ．Ｐｏｌａｒｉｓ合同会社,東京都葛飾区新小岩３丁目２２番１２号,2021-01-14,合同会社
Ｄ＆Ｄカンパニー合同会社,東京都渋谷区神宮前６丁目２３－４桑野ビル２階,2021-01-14,合同会社
Ｄａｔａ４Ｍｅ合同会社,千葉県柏市若柴１７８番地４柏の葉キャンパス１４８街区１,2021-01-14,合同会社
ＥＧアワ株式会社,徳島県徳島市佐古六番町３番２５号ダイヤマンション１４３,2021-01-14,株式会社
ＥＮＧＩＮＥ　ＬＡＢ株式会社,大阪府大阪市西区新町１丁目８番１１号,2021-01-14,株式会社
Ｅａｒ　Ｓｏｌｕｔｉｏｎ株式会社,東京都江戸川区平井６丁目５番１５－４０２号,2021-01-14,株式会社
ＦＪ株式会社,富山県射水市三日曽根２番１７号,2021-01-14,株式会社
ＦＯＲＢＬＥ株式会社,新潟県妙高市中央町６番２４号,2021-01-14,株式会社
ＦＵＪＩサポート合同会社,愛知県名古屋市昭和区北山町３丁目２１御器所イーストマンション３０１,2021-01-14,合同会社
ＦＺ　ｔｒａｄｉｎｇ合同会社,三重県伊勢市川端町３１２番地２１,2021-01-14,合同会社
Ｆｒｕｌｅｒｓ合同会社,東京都文京区大塚１丁目４番１５－１１０９号,2021-01-14,合同会社
ＧＬＬＣ合同会社,東京都渋谷区富ヶ谷１丁目５１番８号パークハウス代々木公園ラフィナート１００３,2021-01-14,合同会社
ＧＯＷＩＬＤ合同会社,神奈川県横浜市旭区上川井町３００８番地,2021-01-14,合同会社
ＧＲＯＷ合同会社,鳥取県境港市渡町３７０６番,2021-01-14,合同会社
Ｇｅｎｅｓｉｓ－２アソシエイツ株式会社,東京都千代田区丸の内２丁目２番１号岸本ビルヂング６階,2021-01-14,株式会社
ＨａＳ合同会社,宮城県仙台市太白区長町４丁目３番３号,2021-01-14,合同会社
ＩＥ株式会社,東京都板橋区加賀２丁目７番１－８２６号,2021-01-14,株式会社
ＩＫＯ株式会社,大阪府箕面市坊島１丁目１８番１１号,2021-01-14,株式会社
ＩＮＣＡＶ製薬合同会社,埼玉県さいたま市見沼区大字南中野３９５番地１,2021-01-14,合同会社
ＩＮＳＰＩＲＥ　ＣＲＥＡＴＩＯＮ株式会社,東京都港区白金台４丁目９番２３号,2021-01-14,株式会社
ＩＲＯＤＯＲＩ株式会社,岡山県倉敷市児島駅前１番地３７（ＤＩ－２）,2021-01-14,株式会社
Ｉｋｅｄａ　Ｍａｋｏｔｏ株式会社,東京都渋谷区神宮前６丁目２３番４号桑野ビル２階,2021-01-14,株式会社
ＪＯＬＩ株式会社,東京都板橋区小茂根１丁目２５番１６号ＵＩＳビル２０９号,2021-01-14,株式会社
ＪＵＲＩＮ合同会社,奈良県大和高田市大字田井１９７番地１,2021-01-14,合同会社
ＪＺＰ国際貿易株式会社,大阪府松原市東新町２丁目２０１番地の１１,2021-01-14,株式会社
ＫＭＫプランニング合同会社,千葉県木更津市羽鳥野４丁目１番地６４,2021-01-14,合同会社
ＫＴＮ産業株式会社,大阪府東大阪市中新開２丁目９番２号ＣＯＭＰＬＡＺＡ吉田Ｂ１号室,2021-01-14,株式会社
ＫＵＲＯ－ＯＢＩ合同会社,茨城県古河市東山田５８２－２,2021-01-14,合同会社
ＬＯＴＵＳ合同会社,大阪府堺市西区鳳南町５丁５１７番地２９（２０３号）,2021-01-14,合同会社
ＬＳ　ＴＲＡＤＩＮＧ株式会社,宮城県柴田郡柴田町東船迫２丁目６番９号,2021-01-14,株式会社
ＬＴＴＶ合同会社,広島県福山市向陽町２丁目５９番３９４,2021-01-14,合同会社
Ｌｉｆｆｅｙ　Ｉｎｔｅｒｎａｔｉｏｎａｌ株式会社,茨城県つくば市竹園３丁目３４番地２８,2021-01-14,株式会社
ＭＳＳ合同会社,石川県小松市幸町１丁目４９番地２,2021-01-14,合同会社
ＮＡ＆Ｃｏｍｐａｎｙ株式会社,神奈川県川崎市宮前区土橋１丁目１７番地,2021-01-14,株式会社
ＮＰО法人ＬｌＮＫ　ＵＰ　ＪＡＪＡ,大阪府大阪市鶴見区鶴見２丁目２２番５－６０３号,2021-01-14,その他の設立登記法人
ＮＰＯ法人とよのくに子どもツーウエイ,大分県宇佐市大字中原２１２番地の１,2021-01-14,その他の設立登記法人
ＮＰＯ法人ろう高齢者の豊かな生活を支える会陽だまり,福岡県北九州市戸畑区幸町９番２６号,2021-01-14,その他の設立登記法人
ＮａＰ合同会社,大阪府東大阪市山手町１４番２０号,2021-01-14,合同会社
ＯｎｅＦｌａｔ株式会社,愛知県名古屋市守山区大字下志段味字穴ケ洞２２７０番地の１２,2021-01-14,株式会社
ＰＡＲＡＤＥ株式会社,奈良県奈良市元林院町２２番地,2021-01-14,株式会社
ＰＭＰ株式会社,京都府木津川市加茂町里東里３６番地２,2021-01-14,株式会社
Ｐｌａｎ　Ｚ合同会社,東京都杉並区高円寺南２丁目４０番３８号,2021-01-14,合同会社
Ｒ・ｏｎｅ株式会社,京都府城陽市寺田庭井１番地の１５９,2021-01-14,株式会社
ＲＯＣＫＳ　ＳＰＲＩＮＧＳ株式会社,東京都中央区日本橋堀留町２丁目４－１４,2021-01-14,株式会社
Ｒａｎｉｃａ　Ｔｒａｄｉｎｇ株式会社,大阪府箕面市小野原東６丁目２５番２－２０５号,2021-01-14,株式会社
Ｓ．Ｈ　ＪＡＰＡＮ　ＬＡＮＫＡ株式会社,茨城県稲敷市佐倉１３６８番地７,2021-01-14,株式会社
ＳＥＢＩＡ　ＪＡＰＡＮ株式会社,東京都港区赤坂２丁目１１番７号ＡＴＴ新館１１階Ｍａｚａｒｓ・Ｊａｐａｎ株式会社内,2021-01-14,株式会社
ＳＩＮ企画合同会社,神奈川県大和市中央林間西４丁目２番１２号,2021-01-14,合同会社
ＳＭＡＲＴ　ＢＲＡＩＮ株式会社,東京都新宿区袋町９番地６,2021-01-14,株式会社
ＳＹＲＳＲオーソ株式会社,東京都中央区銀座４丁目３番１０号ＭＯＴＯＫＩ、Ｎ４ビル３Ｆ,2021-01-14,株式会社
Ｓａｌｏｎ　ｄｕ　Ｅｍ合同会社,長野県松本市大手４丁目６番８号ｖｉｌｌｅｅｓｔ２０６,2021-01-14,合同会社
Ｓｏｌ　Ｐｏｗｅｒ　Ａｋｉｔａ合同会社,秋田県秋田市土崎港相染町字浜ナシ山５５番地２,2021-01-14,合同会社
Ｔ＆Ｇマネジメント株式会社,東京都大田区東六郷２丁目４番７－１０９号,2021-01-14,株式会社
ＴＭサービス株式会社,富山県射水市稲積４０９番地,2021-01-14,株式会社
ＴＳＡｄｖｉｓｏｒｙ株式会社,大阪府大阪市北区角田町８番４７号阪急グランドビル２０階,2021-01-14,株式会社
ＴｉｅＳｅｔ　Ａｓｉａ株式会社,東京都港区新橋２丁目１６番１号ニュー新橋ビル９Ｆ,2021-01-14,株式会社
Ｖｏｌｎｕｔｔ株式会社,東京都中央区日本橋本町３丁目３－６ワカ末ビル７階,2021-01-14,株式会社
ＷＡＫＵＭＡＲＩ株式会社,大阪府大阪市西区北堀江１丁目５－２,2021-01-14,株式会社
ＷＩＬＬ株式会社,千葉県柏市松ケ崎１０４５番地５,2021-01-14,株式会社
ＷｏｒＸ株式会社,東京都渋谷区松濤１丁目２８番２号,2021-01-14,株式会社
Ｙ＆Ｍ合同会社,沖縄県浦添市前田１丁目４３番１６号２Ｆ,2021-01-14,合同会社
Ｙ２Ｃａｐｉｔａｌ合同会社,香川県高松市花園町１丁目２番１１号,2021-01-14,合同会社
ａｎｄ　ｗｏｒｌｄ株式会社,東京都目黒区東が丘１丁目２４番１号ガーデン東が丘Ｗ棟１０１号室,2021-01-14,株式会社
ｇｒａｎｄｅ合同会社,愛知県名古屋市天白区植田西１丁目４０５番地（サンハイツ杉３０５号）,2021-01-14,合同会社
ｉｍｐｒｏｖｅ株式会社,東京都武蔵野市境４丁目２番２１号若木ビル１階,2021-01-14,株式会社
ｍａｗｔｙ株式会社,福島県郡山市富久山町八山田字向作５９－１,2021-01-14,株式会社
ｎｉｃｏ株式会社,東京都新宿区新宿１丁目３６番２号新宿第七葉山ビル３階,2021-01-14,株式会社
ｓｙｔｏｎ株式会社,北海道札幌市北区太平八条３丁目２番３号,2021-01-14,株式会社
ｔｒｕｓｔｙ株式会社,神奈川県川崎市川崎区小田栄２丁目１番５－１４２４号,2021-01-14,株式会社
ｖｉｏｌａ株式会社,東京都練馬区貫井１丁目１１番４号アートフォレスト中村橋アネックス１０１,2021-01-14,株式会社
あしな漁業株式会社,神奈川県横須賀市芦名１丁目１７番８号,2021-01-15,株式会社
