法人名,住所,設立日,法人種別
メイコウ株式会社,大阪府大阪市中央区日本橋２丁目８番１５－７０６号,2024-06-21,株式会社
ユニバーサルビューティーテック合同会社,東京都港区南青山３丁目１番３６号青山丸竹ビル６Ｆ,2024-06-21,合同会社
ライズ株式会社,宮城県仙台市青葉区中江１丁目１３番１４号,2024-06-21,株式会社
ランディフィールド合同会社,東京都杉並区大宮２丁目２３番５号,2024-06-21,合同会社
リノビジネスサポート株式会社,大阪府大阪市北区中崎西１丁目８番２４号アインズビル梅田５０６号室,2024-06-21,株式会社
レッド合同会社,東京都大田区南六郷１丁目５番２０号ＫＩハイツ１０２,2024-06-21,合同会社
レーザーネット合同会社,東京都新宿区西新宿３丁目３番１３号西新宿水間ビル６階,2024-06-21,合同会社
一念株式会社,東京都北区堀船３丁目２４－４梶原銀座ビル１０５号室,2024-06-21,株式会社
一般社団法人うめはる,福島県田村郡三春町大字鷹巣字北之内１００番地の１,2024-06-21,その他の設立登記法人
一般社団法人かなざわエコライト,石川県金沢市進和町１９番地２,2024-06-21,その他の設立登記法人
一般社団法人みやお,岡山県津山市宮尾６７０番地,2024-06-21,その他の設立登記法人
一般社団法人アジア太平洋企業発展協力会,埼玉県川口市西川口５丁目１３番１８－３号,2024-06-21,その他の設立登記法人
一般社団法人アドベストＥ,大分県大分市田尻北１番１７号,2024-06-21,その他の設立登記法人
一般社団法人アニマルウェルフェア大阪,大阪府豊中市庄内栄町５丁目１１番５号,2024-06-21,その他の設立登記法人
一般社団法人クロスロード鹿児島中央,鹿児島県鹿児島市草牟田１丁目８番２２号,2024-06-21,その他の設立登記法人
一般社団法人ソーシャルサポートセンタープリズム,神奈川県相模原市中央区相模原５丁目４－２６みすきゃんさす相模原３０７,2024-06-21,その他の設立登記法人
一般社団法人トライアングル,東京都千代田区丸の内３丁目１番１号東京共同会計事務所内,2024-06-21,その他の設立登記法人
一般社団法人メンタルケア振興会,東京都渋谷区神宮前２丁目５番８号カーデ青山２０１,2024-06-21,その他の設立登記法人
一般社団法人リファインドソリューションズ,神奈川県横浜市西区北幸１丁目１番８号,2024-06-21,その他の設立登記法人
一般社団法人千葉大学腎臓内科同門会,千葉県千葉市中央区亥鼻１丁目８番１号千葉大学大学院医学研究院腎臓内科学,2024-06-21,その他の設立登記法人
一般社団法人寺子屋ＷＥＢ,東京都新宿区西新宿３丁目３番１３号西新宿水間ビル２Ｆ,2024-06-21,その他の設立登記法人
一般社団法人小山フットボールクラブ,熊本県熊本市東区小山５丁目１２番１号,2024-06-21,その他の設立登記法人
一般社団法人日本アガスティア協会,東京都渋谷区富ヶ谷２丁目２６－１６－１０１,2024-06-21,その他の設立登記法人
一般社団法人日本ボイススタイリスト協会,滋賀県近江八幡市西生来町２４５番地,2024-06-21,その他の設立登記法人
一般社団法人映像実演者協議会,東京都中野区弥生町１丁目３番２号ＣＵＲＶＥ６－７０３,2024-06-21,その他の設立登記法人
一般社団法人望野文化促進会,神奈川県平塚市めぐみが丘２丁目１５番１４号,2024-06-21,その他の設立登記法人
一般社団法人神仏習合部,広島県広島市東区中山中町１７番８号,2024-06-21,その他の設立登記法人
一般社団法人細山ホールディングス,奈良県橿原市内膳町１丁目１番３号,2024-06-21,その他の設立登記法人
一般社団法人聖心会,兵庫県芦屋市公光町９番６号新芦屋ビル１階,2024-06-21,その他の設立登記法人
一般社団法人菁々塾,東京都世田谷区太子堂１丁目１２番２７コンフォートテラス１００５号,2024-06-21,その他の設立登記法人
一般社団法人Ａｃｒｏｂａｔ,鳥取県米子市車尾南１丁目８番３２号,2024-06-21,その他の設立登記法人
一般社団法人Ｄｏｔｓ　ｔｏ　Ｃｏｄｅ,東京都渋谷区道玄坂１丁目１０番８号渋谷道玄坂東急ビル２Ｆ－Ｃ,2024-06-21,その他の設立登記法人
一般社団法人ＳａｌｔＹＳ,東京都港区西麻布１丁目１０番２号,2024-06-21,その他の設立登記法人
三和株式会社,東京都豊島区東池袋５丁目１－３コート池袋７０１号室,2024-06-21,株式会社
九ゑ株式会社,大阪府東大阪市菱江２丁目６－５,2024-06-21,株式会社
佐渡市複業協同組合ＴＯＫＩ　ＣＯＮＮＥＣＴ,新潟県佐渡市両津湊１４５番地,2024-06-21,その他の設立登記法人
偉隆株式会社,大阪府大阪市都島区中野町４丁目３番６号Ｈ２Ｈ大阪桜之宮邸１Ｄ－１,2024-06-21,株式会社
傲辰国際貿易合同会社,東京都新宿区新宿１丁目３６番２号新宿第七葉山ビル３Ｆ,2024-06-21,合同会社
加古川レーク株式会社,兵庫県加古川市神野町石守７０番２,2024-06-21,株式会社
勾雲株式会社,東京都江戸川区松島３丁目１４番７－３１０号若林ビル,2024-06-21,株式会社
原宿パークマンション建替組合,東京都千代田区神田錦町３丁目７番１号,2024-06-21,その他
合同会社あかつき,東京都千代田区霞が関３丁目２番５号,2024-06-21,合同会社
合同会社あかつき運営,東京都千代田区霞が関３丁目２番５号,2024-06-21,合同会社
合同会社うさぎ,東京都大田区西蒲田７丁目６－３－６０１,2024-06-21,合同会社
合同会社かさぶらんか,福岡県福岡市博多区美野島３丁目２０番１６－１２０１号,2024-06-21,合同会社
合同会社たぬたぬ蓄電,東京都江東区永代２丁目３３番９－３０２号,2024-06-21,合同会社
合同会社ちむくくる,愛媛県松山市和気町２丁目９２７－１０,2024-06-21,合同会社
合同会社なかまっくす,沖縄県沖縄市住吉１丁目２２番２３号,2024-06-21,合同会社
合同会社のみしろ,大阪府大阪市都島区東野田町４丁目１８番１２号,2024-06-21,合同会社
合同会社まこと,兵庫県加古川市平岡町二俣１０１１Ａ２－２０６,2024-06-21,合同会社
合同会社インクリース,宮崎県都城市都島町１２５番地８,2024-06-21,合同会社
合同会社インフィニットシーティーエル,神奈川県横浜市南区中里２丁目１‐２５フラットＫ３０３,2024-06-21,合同会社
合同会社ウィンウィナー,東京都新宿区北新宿１丁目１３番９号高美コーポ４０１,2024-06-21,合同会社
合同会社エントランド,熊本県熊本市北区植木町一木１８８‐１４,2024-06-21,合同会社
合同会社オアシス,大阪府大阪市浪速区恵美須東１丁目１９番１号,2024-06-21,合同会社
合同会社オキシン,兵庫県神戸市須磨区竜が台５丁目１２番地の１１,2024-06-21,合同会社
合同会社カイ商店,福岡県福岡市南区大楠２丁目１９－２０ピュアドームエレガンテ平尾７０３,2024-06-21,合同会社
合同会社ガイオン,宮崎県宮崎市東大淀１丁目６番１３号グリーンひむか３０２号,2024-06-21,合同会社
合同会社キタラ,東京都千代田区霞が関３丁目２番５号,2024-06-21,合同会社
合同会社クオンツ,神奈川県横須賀市池田町３丁目２９番４号,2024-06-21,合同会社
合同会社クガニピ,沖縄県八重山郡竹富町字西表９８４番地の１,2024-06-21,合同会社
合同会社クレイソフト,福島県福島市置賜町８番２７号,2024-06-21,合同会社
合同会社コンパッション・リーダーズ,東京都渋谷区道玄坂１丁目１０番８号渋谷道玄坂東急ビル２Ｆ－Ｃ,2024-06-21,合同会社
合同会社サウナ薪,群馬県みどり市大間々町大間々２４１３番地１,2024-06-21,合同会社
合同会社サランセンター福岡,福岡県福岡市中央区赤坂３丁目８番２６号赤坂エクセル３０６号,2024-06-21,合同会社
合同会社シーカー,東京都練馬区向山３丁目２２番８号,2024-06-21,合同会社
合同会社ジダイヲツクルー,熊本県菊池郡菊陽町大字原水３２８１番地,2024-06-21,合同会社
合同会社ステラ,東京都中央区銀座８丁目１０番５号第四秀和ビル３階,2024-06-21,合同会社
合同会社セカンドエフォート,鳥取県東伯郡琴浦町大字赤碕１９２０番地５７,2024-06-21,合同会社
合同会社タスク・ギア,山形県鶴岡市平成町６番２８号,2024-06-21,合同会社
合同会社ティンク,大阪府大阪市住吉区長居東３丁目１番１５－５０３号,2024-06-21,合同会社
合同会社ハヤカワ,東京都府中市朝日町１丁目２３番地の４,2024-06-21,合同会社
合同会社フルスブルネン,東京都大田区下丸子２丁目２２－６,2024-06-21,合同会社
合同会社ブレイヴ,神奈川県相模原市南区御園４丁目１４－１８－７,2024-06-21,合同会社
合同会社マルス,埼玉県富士見市ふじみ野西２丁目１番地１アイムふじみ野タワー西館１８０２,2024-06-21,合同会社
合同会社リベンジ,福岡県福岡市中央区白金１丁目１号３番５０６,2024-06-21,合同会社
合同会社ルネ・サポート,香川県高松市香西本町４４番地１,2024-06-21,合同会社
合同会社ワイズ,福岡県福岡市中央区六本松３丁目５－３５－５０２,2024-06-21,合同会社
合同会社ワイズリンク,沖縄県浦添市宮城２丁目１５番５号パティオハウス３０２号,2024-06-21,合同会社
合同会社中間省略,千葉県船橋市北本町２丁目３８番１－１１０号,2024-06-21,合同会社
合同会社北財務会計,滋賀県湖南市菩提寺北５丁目５番３号,2024-06-21,合同会社
合同会社堂島,大阪府大阪市北区角田町９－３６,2024-06-21,合同会社
合同会社夢幻,福岡県福岡市中央区春吉２丁目１８番４号,2024-06-21,合同会社
合同会社太功,愛知県名古屋市東区泉１丁目２２番３５号チサンマンション桜通久屋８１４号,2024-06-21,合同会社
合同会社山樽屋,山梨県北都留郡丹波山村２０７９番地,2024-06-21,合同会社
合同会社彩雲,神奈川県足柄上郡山北町岸１６２９番地１９,2024-06-21,合同会社
合同会社江とう,東京都港区白金台３丁目３番５号,2024-06-21,合同会社
合同会社江坂ＤＣプロジェクト,東京都港区六本木５丁目１３番１２号,2024-06-21,合同会社
合同会社洋琴人,長野県下伊那郡高森町山吹６００４番地５,2024-06-21,合同会社
合同会社秋桜,大阪府東大阪市瓜生堂１丁目１４番１３－３１０号,2024-06-21,合同会社
合同会社紬,岐阜県大垣市大井３丁目５３番地１,2024-06-21,合同会社
合同会社藤本屋,千葉県佐倉市白銀２丁目３４１番地２７,2024-06-21,合同会社
合同会社近生未来,沖縄県国頭郡恩納村字喜瀬武原３８０番地,2024-06-21,合同会社
合同会社黒山羊,東京都江東区扇橋１丁目１７番１号,2024-06-21,合同会社
合同会社ＡＫＩ,東京都三鷹市北野１丁目２番３０号,2024-06-21,合同会社
合同会社ＡＬＬ　Ｓｉｍｐｌｅｓ,東京都中野区大和町１丁目３３番４号フリーデンハイム１０２,2024-06-21,合同会社
合同会社Ａｂｙｓｓ,東京都渋谷区渋谷２丁目１９－１５宮益坂ビルディング６０９,2024-06-21,合同会社
合同会社ＡｎｙＴｒｕｓｔ,東京都渋谷区恵比寿１丁目６番４号ミレニエ恵比寿３０２,2024-06-21,合同会社
合同会社ＢＬＡＣＫ　ＬＡＢＥＬ,徳島県徳島市八万町上福万９番地３６－Ｂ棟,2024-06-21,合同会社
合同会社Ｂａｕｍ,東京都杉並区久我山２丁目２４番１１号,2024-06-21,合同会社
合同会社Ｂｅ　Ａｌｒｉｇｈｔ,東京都日野市大字上田３８６番地の４ヴィラージュＹ１０１,2024-06-21,合同会社
合同会社Ｃｉｔｒｕｓ　Ｔｒｅｅ,千葉県市原市潤井戸１２９７―１,2024-06-21,合同会社
合同会社Ｃｒａｄｌｅ,愛知県海部郡大治町大字西條字北屋敷１５７番地,2024-06-21,合同会社
合同会社ＤＡＹＳ　ＩＮＴＥＲＮＡＴＩＯＮＡＬ,千葉県千葉市稲毛区長沼原町９４２番地２９４,2024-06-21,合同会社
合同会社ＥＳＲ１,東京都目黒区上目黒１丁目２３番１号中目黒アリーナ４０５号室,2024-06-21,合同会社
合同会社Ｅｎ．Ｔ,栃木県宇都宮市大通り５丁目１－１１,2024-06-21,合同会社
合同会社ＦＩＫＡ,京都府長岡京市奥海印寺太鼓山７番地２サンライズ３０５,2024-06-21,合同会社
合同会社ＦｕｋｕＦｕｋｕ,広島県呉市上長迫町５番３号,2024-06-21,合同会社
合同会社Ｆｕｌｌ　Ｍｏｏｎ,東京都目黒区目黒本町５丁目１２番３号,2024-06-21,合同会社
合同会社ＧＯＡＴ,大阪府大阪市西成区天下茶屋１丁目１１番９号ＷｉｎｄＢｅｌｌ天下茶屋１０１号,2024-06-21,合同会社
合同会社ＩＵ,東京都渋谷区道玄坂１丁目１０番８号渋谷道玄坂東急ビル２Ｆ－Ｃ,2024-06-21,合同会社
合同会社Ｊｏｙｎ,大分県大分市大字鴛野７８０番地の１,2024-06-21,合同会社
合同会社ＫＤ企画,東京都江戸川区南小岩５丁目１８－１４,2024-06-21,合同会社
合同会社ＫＹＯ　ＳＭＩＬＥ,東京都世田谷区奥沢１丁目４９番８号,2024-06-21,合同会社
合同会社Ｋａｎｇｏ　ｎｏ友,大阪府大阪市西淀川区姫里３丁目１３番１０号,2024-06-21,合同会社
合同会社ＬＥＴＥＲＴＥ,千葉県印西市滝野６丁目１３－７,2024-06-21,合同会社
合同会社ＬＩＢ,兵庫県丹波篠山市吹新３１番地１１,2024-06-21,合同会社
合同会社Ｌｕｍｉｅｒｅ,大阪府柏原市大正２丁目８番１号ＳｈａＭａｉｓｏｎＬａｍｅｒ１０２号室,2024-06-21,合同会社
合同会社Ｌｕｓｈ　Ｄｅｓｉｇｎｓ,愛知県名古屋市中区栄３丁目２番３号名古屋日興證券ビル４階,2024-06-21,合同会社
合同会社ＭＡＴＯＭＥ,群馬県太田市台之郷町９３２－２,2024-06-21,合同会社
合同会社ＭＤＬＨ,東京都新宿区西新宿１丁目２６番２号新宿野村ビル３２階,2024-06-21,合同会社
合同会社ＭＩＫ,奈良県奈良市西登美ヶ丘２丁目１５番,2024-06-21,合同会社
合同会社ＭＫ知花,沖縄県中頭郡読谷村字高志保４３０番地３,2024-06-21,合同会社
合同会社ＭＯＡ,東京都渋谷区渋谷２丁目１９－１５宮益坂ビルディング６０９,2024-06-21,合同会社
合同会社ＭＴＲ,千葉県君津市外箕輪１丁目９番２３号,2024-06-21,合同会社
合同会社ＮＡＯＫＩ　ｃｏｒｐｏｒａｔｉｏｎ,東京都大田区下丸子１丁目５番９号ウェルスクエア下丸子１０３,2024-06-21,合同会社
合同会社ＮｅｔＰｒｏ,東京都渋谷区渋谷２丁目１９－１５,2024-06-21,合同会社
合同会社ＯＪＴＨＯＮ,東京都中央区銀座１丁目１２番４号Ｎ＆ＥＢＬＤ．６Ｆ,2024-06-21,合同会社
合同会社ＰＴＰＭ,京都府京都市伏見区深草北蓮池町９１５番地２－４０６号,2024-06-21,合同会社
合同会社Ｒｅｖｉｖｅ,大阪府大阪市中央区南船場４丁目１０番５号南船場ＳＯＨＯビル７０２,2024-06-21,合同会社
合同会社Ｒｕｃｈｉ,島根県出雲市佐田町須佐６１６‐１,2024-06-21,合同会社
合同会社ＳＥＮＳＡＴＩＯＮ,鹿児島県鹿児島市千日町３番７号,2024-06-21,合同会社
合同会社ＳＦＣ,大阪府大阪市天王寺区国分町３番７号シャンピア国分町２０２号,2024-06-21,合同会社
合同会社ＳＭＩＬＥ,東京都渋谷区道玄坂２丁目８－５ＤＭ渋谷ビル５Ｆ,2024-06-21,合同会社
合同会社ＳＰＲＥＡＤ,千葉県柏市花野井６２７番地６７北柏シティーコーポ１０１号,2024-06-21,合同会社
合同会社ＴＡＮ,東京都中野区東中野３丁目１８番１４号第二ハイム２０２,2024-06-21,合同会社
合同会社ＴＭＣ,東京都世田谷区船橋６丁目４番５－５０３号,2024-06-21,合同会社
合同会社ＷＥＬＬ,大阪府大阪市住之江区御崎１丁目８番１０号,2024-06-21,合同会社
合同会社ＹＭＲ,東京都大田区中央３丁目２１－１２,2024-06-21,合同会社
合同会社ａ＆ｋ,神奈川県厚木市長谷１０２９番地７,2024-06-21,合同会社
合同会社ａｉｍｅｒ　ｍｏｒｅ,東京都国立市北１丁目５番地１,2024-06-21,合同会社
合同会社ａｒｇ,東京都新宿区下落合３丁目１２番２３－４０１号,2024-06-21,合同会社
合同会社ｆｕｒａｗａ,千葉県千葉市稲毛区黒砂台２丁目１０－５－１０３,2024-06-21,合同会社
合同会社ｈａｒｕｋａｎａ,神奈川県茅ヶ崎市松が丘２丁目７－２６,2024-06-21,合同会社
合同会社ｊ‐ｓｔ,奈良県天理市川原城町８０１番地辻村ビル４０１,2024-06-21,合同会社
合同会社ｎａｔｕｒａｌ,山形県天童市大字久野本２１３８番地の５,2024-06-21,合同会社
合同会社ｙｕｐｏｐｏ,兵庫県三田市加茂３９４番地１、５０８号,2024-06-21,合同会社
合名会社スリーカオス,東京都江戸川区西葛西５丁目６番２号,2024-06-21,合名会社
合資会社南風原交通,沖縄県島尻郡南風原町字兼城６４４番地の６,2024-06-21,合資会社
吉德株式会社,大阪府大阪市西区九条南２丁目１６番６号,2024-06-21,株式会社
向陽合同会社,東京都千代田区鍛治町二丁目４番５号,2024-06-21,合同会社
喜馬拉雅工務店合同会社,東京都八王子市堀之内３丁目２２番地１２ハイツエスポワール１０６室,2024-06-21,合同会社
嘉年アーバン株式会社,東京都板橋区大山町１４番１０メゾン田中２０１号室,2024-06-21,株式会社
土地家屋調査士法人柏﨑事務所,栃木県宇都宮市小幡２丁目３番２８号,2024-06-21,その他の設立登記法人
夕霧一般社団法人,東京都港区西新橋１丁目１番１号ＥＰコンサルティングサービス内,2024-06-21,その他の設立登記法人
大海株式会社,愛知県名古屋市港区港楽２丁目４番６号－２,2024-06-21,株式会社
宇城株式会社,大阪府大阪市生野区新今里５丁目７－６,2024-06-21,株式会社
宜和株式会社,東京都練馬区豊玉南２丁目２２－２サンテラス佐藤２０１号室,2024-06-21,株式会社
山倉興業株式会社,千葉県四街道市大日２１０６番地３４,2024-06-21,株式会社
岸豊工業株式会社,大阪府堺市堺区竜神橋町２丁３番１号ステュディオ堺フェニックス３２０号,2024-06-21,株式会社
川上商店株式会社,大阪府大阪市浪速区元町３丁目６番８号,2024-06-21,株式会社
志合同会社,千葉県船橋市本町４丁目４３－９－３０２,2024-06-21,合同会社
恒聖貿易株式会社,大阪府大阪市生野区中川西１丁目１７番１０号２Ｃ,2024-06-21,株式会社
新希望株式会社,大阪府大阪市淀川区西三国１丁目１１－２グロースハイツ東三国３０２号室,2024-06-21,株式会社
新志株式会社,大阪府大阪市大正区三軒家西３丁目４番１６号中山ビル４０７Ａ,2024-06-21,株式会社
新白河住まいる不動産株式会社,福島県西白河郡西郷村字豊作東５番地,2024-06-21,株式会社
日商商事株式会社,奈良県奈良市上深川町７５７番地の１,2024-06-21,株式会社
旭昇古美術株式会社,大阪府大阪市阿倍野区阪南町５丁目２５番１８号オーナーズマンション阪南Ⅱ３０１号,2024-06-21,株式会社
昭和ホールディングス株式会社,大阪府大阪市中央区北浜東１番２２号,2024-06-21,株式会社
最上交通株式会社,大阪府吹田市川岸町７番２２号ＧＦ吹田マンション３Ｃ,2024-06-21,株式会社
有限会社中澤輪店,群馬県前橋市千代田町３丁目３番３５号,2024-06-21,有限会社
本来株式会社,東京都文京区根津２丁目３７番８－２０５号,2024-06-21,株式会社
東信商事株式会社,東京都台東区根岸２丁目１８－２３,2024-06-21,株式会社
東祐株式会社,熊本県合志市幾久富１９０９－６８６,2024-06-21,株式会社
株式会社あしがら警備,神奈川県南足柄市関本３６８番地,2024-06-21,株式会社
株式会社かさぜん,福井県福井市西学園１丁目１００６番地,2024-06-21,株式会社
株式会社きぬばり,神奈川県座間市栗原１３５１番地の４,2024-06-21,株式会社
株式会社こるり,福岡県福岡市中央区高砂２丁目１－１,2024-06-21,株式会社
株式会社さくら舎,千葉県松戸市六高台７丁目１３０番地の５,2024-06-21,株式会社
株式会社たがけん内装．,大阪府摂津市鳥飼西４丁目１６番１号,2024-06-21,株式会社
株式会社てらてく,広島県広島市東区戸坂惣田１丁目１８番８号,2024-06-21,株式会社
株式会社はっぱのおうち,宮城県仙台市青葉区川平４丁目１２番２８号,2024-06-21,株式会社
株式会社ひろしまモビリティワールド,東京都世田谷区等々力６丁目１３番１０号,2024-06-21,株式会社
株式会社まると,神奈川県平塚市田村５丁目２２番２１－２０１号,2024-06-21,株式会社
株式会社よんなぁ,沖縄県那覇市字国場９１６番地,2024-06-21,株式会社
株式会社アクア,京都府京都市中京区六角通油小路西入越後町２０３番地,2024-06-21,株式会社
株式会社アトラクレア華,東京都渋谷区千駄ヶ谷４丁目６番８－１９０６号,2024-06-21,株式会社
株式会社アルゴバレ,宮城県仙台市青葉区旭ケ丘１丁目２番３号,2024-06-21,株式会社
株式会社アントレース,新潟県長岡市下柳１丁目９番１８号,2024-06-21,株式会社
株式会社アートセキュリティ,大阪府大阪市西区京町堀２丁目６番２０－１９０５号,2024-06-21,株式会社
株式会社ウィステリアフィールド,愛知県岡崎市大和町字上河原３３番地１,2024-06-21,株式会社
株式会社エクステリア今井,千葉県船橋市芝山５丁目４４番２３号,2024-06-21,株式会社
株式会社エクセル,東京都台東区浅草６丁目１４番７－１１０１号プレサンスブルーム浅草,2024-06-21,株式会社
株式会社エレフォース,東京都渋谷区恵比寿西２丁目４番８号ウィンド恵比寿ビル８Ｆ,2024-06-21,株式会社
株式会社エーブリウス,東京都新宿区新宿１丁目１５－６オリエント新宿５０２,2024-06-21,株式会社
株式会社オプティマル,千葉県白井市桜台３丁目１１番６号,2024-06-21,株式会社
株式会社オレンジカンパニー,兵庫県尼崎市武庫町２丁目３番７号,2024-06-21,株式会社
株式会社オールアクセスクリーニングサービス,大分県別府市末広町６番６号翠翠ハウス１階,2024-06-21,株式会社
株式会社クラッシーサービス,兵庫県伊丹市御願塚７丁目２番２号,2024-06-21,株式会社
株式会社グローアップホールディングス,東京都豊島区南大塚２丁目４５番８号,2024-06-21,株式会社
株式会社グロースアドバンテッジ,東京都港区東新橋１丁目１番２１号今朝ビル５階,2024-06-21,株式会社
株式会社ケイプラスアーキテクト,東京都国分寺市南町３丁目２３番１２号,2024-06-21,株式会社
株式会社ケーエムエー,東京都世田谷区喜多見９丁目１０番１６号,2024-06-21,株式会社
株式会社ケーポータル,東京都目黒区自由が丘２丁目１６－１２ＲＪ３,2024-06-21,株式会社
株式会社ゲインキューブ,神奈川県相模原市緑区橋本５丁目６番３号クレイン２０１,2024-06-21,株式会社
株式会社コタック・エネルギー・パートナーズ,東京都中央区銀座８丁目９番１５号銀座ミノリビル８階,2024-06-21,株式会社
株式会社コンファラボ,兵庫県神戸市中央区磯上通４丁目１番１４号三宮スカイビル６階,2024-06-21,株式会社
株式会社ゴンドウ,兵庫県神戸市西区伊川谷町前開９２３番地アバンダン前開１Ｆ,2024-06-21,株式会社
株式会社ジェイパット,岩手県紫波郡紫波町紫波中央駅前５丁目１６０－１１,2024-06-21,株式会社
株式会社ジャクソンマテリアルズ,福岡県久留米市青峰２丁目１５番１１号,2024-06-21,株式会社
