法人名,住所,設立日,法人種別
株式会社グッドネス,福岡県朝倉市甘木１９１６番地２,2019-07-12,株式会社
株式会社グッドフェローズリンク,福岡県久留米市青峰２丁目８番４１号,2019-07-12,株式会社
株式会社グッドライフマネージメント,東京都千代田区神田和泉町一丁目６番１６号ヤマトビル４階,2019-07-12,株式会社
株式会社グッドワーク,埼玉県新座市大和田３丁目１１番６号,2019-07-12,株式会社
株式会社グレープ,東京都台東区浅草６丁目４３番６号,2019-07-12,株式会社
株式会社コバヤシ建工,山梨県甲斐市西八幡９００番地１サンライフＯＺＡＷＡ、Ａ－１号,2019-07-12,株式会社
株式会社サタケコーポレーション,大阪府阪南市箱の浦３８２番地の８５,2019-07-12,株式会社
株式会社サンテック計装,愛知県知多市にしの台４丁目２４番地の３０,2019-07-12,株式会社
株式会社サードメイク,東京都渋谷区神宮前４丁目２２番１８号,2019-07-12,株式会社
株式会社シマダ,茨城県神栖市矢田部４０９９番地７,2019-07-12,株式会社
株式会社シリベシ,北海道小樽市入船４丁目７番２号,2019-07-12,株式会社
株式会社シン建,福岡県筑紫野市大字山口３２８６番地７,2019-07-12,株式会社
株式会社スカイアイランド,福岡県福岡市南区那の川１丁目６番１４号,2019-07-12,株式会社
株式会社スカイリバー,北海道滝川市滝の川町東４丁目１４番１２号,2019-07-12,株式会社
株式会社スプラウツ,三重県三重郡菰野町大字菰野１３６７番地１,2019-07-12,株式会社
株式会社スプラウト,群馬県高崎市大八木町６７番地２,2019-07-12,株式会社
株式会社スプレットペア,宮城県仙台市青葉区上杉２丁目４番３４号,2019-07-12,株式会社
株式会社セイロントレーディング,福岡県築上郡築上町大字東八田１１３５番地１,2019-07-12,株式会社
株式会社セプター,東京都新宿区富久町１５番１ー４４１４号,2019-07-12,株式会社
株式会社センスエンタテインメント,神奈川県川崎市川崎区駅前本町１１番地２川崎フロンティアビル４階,2019-07-12,株式会社
株式会社センチュリー,埼玉県ふじみ野市霞ケ丘１丁目２番１２－２１０９号,2019-07-12,株式会社
株式会社セントローソ,大阪府大阪市中央区道修町１丁目４番６号,2019-07-12,株式会社
株式会社ゼンユウ,兵庫県小野市王子町８０６番地の５１,2019-07-12,株式会社
株式会社ダイヤモンドエステート,愛知県名古屋市名東区一社１丁目８０番地の１第２オーシャンビル６０２号,2019-07-12,株式会社
株式会社ダストクリーン,熊本県熊本市東区石原２丁目４番３０号,2019-07-12,株式会社
株式会社テンショウ東香里,大阪府枚方市東香里南町５２番３６号,2019-07-12,株式会社
株式会社ディーアールディー,埼玉県所沢市大字中富７５１番地の６,2019-07-12,株式会社
株式会社トウカリ商店,北海道石狩市新港南２丁目７０１番地,2019-07-12,株式会社
株式会社トニック,大阪府大阪市平野区平野東１丁目８番５号,2019-07-12,株式会社
株式会社トライラボ,大阪府八尾市教興寺１丁目２００番地ボスクリオ７０１号,2019-07-12,株式会社
株式会社トラスト,群馬県桐生市境野町１丁目１１２６番地の１,2019-07-12,株式会社
株式会社トラスト,埼玉県川口市大字源左衛門新田２８６番地の３３,2019-07-12,株式会社
株式会社トレイル,愛知県清須市西枇杷島町恵比須３８番地１,2019-07-12,株式会社
株式会社トレス,栃木県宇都宮市菊水町４２番１号,2019-07-12,株式会社
株式会社ナイン,愛知県名古屋市東区代官町１６番１７号,2019-07-12,株式会社
株式会社ナガホーム,福岡県福岡市城南区七隈６丁目２０番２０号,2019-07-12,株式会社
株式会社ニジーク,神奈川県川崎市高津区新作６丁目９番２３－４１０号,2019-07-12,株式会社
株式会社ネクサス,大阪府東大阪市玉串町西３丁目３番３６－１１２号,2019-07-12,株式会社
株式会社バイオＥＯＲ,大阪府東大阪市荒本新町３番１９－２０３号,2019-07-12,株式会社
株式会社バックナイン,福岡県福岡市東区和白東３丁目１７番６号,2019-07-12,株式会社
株式会社バニシングポイント,東京都中野区新井５丁目１５番９号シャイニング小島２０３,2019-07-12,株式会社
株式会社ヒューマンアーク,東京都港区芝３丁目１７番１３号,2019-07-12,株式会社
株式会社ヒロスイプラス,埼玉県所沢市中新井５丁目２９番２０号,2019-07-12,株式会社
株式会社ビッグシティ,神奈川県横浜市神奈川区鶴屋町３丁目３３番地８アサヒビル３Ｆ,2019-07-12,株式会社
株式会社ビッグファーム,三重県四日市市山城町６２５番地１,2019-07-12,株式会社
株式会社ビーパーク,岡山県岡山市北区大内田６７５番地,2019-07-12,株式会社
株式会社ピエゾ,神奈川県横浜市戸塚区吉田町１１９６番地１,2019-07-12,株式会社
株式会社ファイブ,大阪府堺市北区中百舌鳥町２丁２８番地,2019-07-12,株式会社
株式会社ファインラボ,埼玉県さいたま市浦和区常盤３丁目１２番１４－１０３号,2019-07-12,株式会社
株式会社ファーストヒルズ,三重県多気郡明和町大字斎宮４５７３番地,2019-07-12,株式会社
株式会社フィデム,東京都台東区今戸２丁目２９番１１－１Ｆ,2019-07-12,株式会社
株式会社フィールド,京都府京都市中京区壬生森町１８番地,2019-07-12,株式会社
株式会社フューチャー・プログレス,東京都八王子市高尾町２０３２番地１,2019-07-12,株式会社
株式会社フラノ,北海道芦別市北五条西３丁目１番,2019-07-12,株式会社
株式会社フリーク,大阪府枚方市長尾元町７丁目７８番１号,2019-07-12,株式会社
株式会社フロリア,岐阜県岐阜市東鶉７丁目１３１番地１,2019-07-12,株式会社
株式会社ブリティッシュ・レーシング・グリーン,大阪府高槻市淀の原町４６番１４号アンフィニィ上牧３０３号,2019-07-12,株式会社
株式会社ブレーンコンサルタント,大阪府八尾市恩智中町３丁目２２６番地の２０,2019-07-12,株式会社
株式会社プレシャスホーム,神奈川県横浜市瀬谷区相沢１丁目１５番地９,2019-07-12,株式会社
株式会社プレジール,東京都足立区東伊興３丁目４番８号,2019-07-12,株式会社
株式会社プロスタッフ,静岡県富士市厚原１８９６番地の１８２,2019-07-12,株式会社
株式会社ヘキサゴン,愛知県名古屋市名東区平和が丘２丁目８４番地,2019-07-12,株式会社
株式会社ベースライン,宮城県仙台市宮城野区宮千代３丁目１番地の７,2019-07-12,株式会社
株式会社ミニーの首輪,神奈川県横浜市西区高島２丁目１９番２号神谷ビル６階,2019-07-12,株式会社
株式会社モッカクリーンプラス,神奈川県川崎市中原区井田１丁目２番６号,2019-07-12,株式会社
株式会社ヤクミ,三重県松阪市阿形町２００番地１６０号,2019-07-12,株式会社
株式会社ヨシズム,大阪府東大阪市吉田本町３丁目４番４０－１０１号,2019-07-12,株式会社
株式会社ヨンロク,東京都港区南青山１丁目２０番２号,2019-07-12,株式会社
株式会社ライズ＆カンパニー,神奈川県横浜市青葉区すすき野２丁目７番地３０,2019-07-12,株式会社
株式会社ライフプランホーム,埼玉県さいたま市浦和区高砂４丁目４番１号,2019-07-12,株式会社
株式会社ライブラリフィットネス＆スポーツインターナショナル,茨城県稲敷市伊佐部１０２４番地,2019-07-12,株式会社
株式会社ラクサスライフ,京都府京都市下京区西七条東八反田町３３番地,2019-07-12,株式会社
株式会社ラディエーションハウス,福岡県福岡市城南区樋井川５丁目２０番２号,2019-07-12,株式会社
株式会社ラモニーヘルス,栃木県小山市大字大行寺３２７番地,2019-07-12,株式会社
株式会社ランフューチャー,東京都町田市南成瀬１丁目９番地１１,2019-07-12,株式会社
株式会社ラージ住設,兵庫県神戸市長田区駒ケ林南町１番５２号,2019-07-12,株式会社
株式会社リヴアーツ,大阪府大阪市中央区船越町２丁目１番７号,2019-07-12,株式会社
株式会社ロキア,東京都大田区蒲田５丁目２１番１３号ペガサスステーションプラザ蒲田Ｂ２Ｆ,2019-07-12,株式会社
株式会社ワンダフルジャーニー,愛知県名古屋市昭和区滝川町４７番地の５,2019-07-12,株式会社
株式会社万代伸一商店,岡山県岡山市東区瀬戸町観音寺４３３番地,2019-07-12,株式会社
株式会社三伊環境開発,三重県伊賀市久米町５４８番地の１,2019-07-12,株式会社
株式会社三共シーゼル,大阪府大阪市浪速区桜川２丁目３番２８号,2019-07-12,株式会社
株式会社井岡アルミ企画,神奈川県茅ヶ崎市西久保２００６番地１０,2019-07-12,株式会社
株式会社令和貿易,茨城県守谷市けやき台５丁目１３番地１６,2019-07-12,株式会社
株式会社伝聞堂,大阪府堺市中区深阪４丁２３番４３号,2019-07-12,株式会社
株式会社佳豊,愛知県あま市新居屋岩屋２４番地１４,2019-07-12,株式会社
株式会社備前兼光,大阪府大阪市東住吉区田辺４丁目１５番９号,2019-07-12,株式会社
株式会社光アートデザイン,千葉県松戸市上本郷２２４８番地１－１０８,2019-07-12,株式会社
株式会社光ソフトウェア,東京都江東区塩浜２丁目１８番４号,2019-07-12,株式会社
株式会社光佑,愛知県稲沢市大塚北１丁目６２番地,2019-07-12,株式会社
株式会社光和エンタープライズ,埼玉県ふじみ野市上福岡６丁目６番１７号２０５,2019-07-12,株式会社
株式会社兵庫食品科学研究所,兵庫県姫路市東郷町１４５１番地５,2019-07-12,株式会社
株式会社利光収建築設計,東京都杉並区善福寺１丁目１９番２１号,2019-07-12,株式会社
株式会社創,神奈川県相模原市緑区橋本台１丁目３３番２－７１１号,2019-07-12,株式会社
株式会社協栄塗装工社,沖縄県豊見城市字長堂３３３番地,2019-07-12,株式会社
株式会社原宿物産,東京都渋谷区神宮前１丁目２０番７号,2019-07-12,株式会社
株式会社吉川組,兵庫県宝塚市泉町１番２３号,2019-07-12,株式会社
株式会社吉野画廊,岐阜県岐阜市吉野町３丁目１０番地,2019-07-12,株式会社
株式会社和み庭,宮城県仙台市若林区今泉字小在家東９０番地の１,2019-07-12,株式会社
株式会社和杜,和歌山県紀の川市貴志川町神戸３３２番地２,2019-07-12,株式会社
株式会社和渦ＴＯＫＹＯ,東京都品川区北品川３丁目２－１ＭＴＭスタジオ２階,2019-07-12,株式会社
株式会社堺凛,福岡県福岡市東区香椎照葉４丁目２番１号,2019-07-12,株式会社
株式会社夢みらい館,神奈川県横浜市中区本町３丁目２４番地本町中央ビル,2019-07-12,株式会社
株式会社大石,東京都中央区銀座２丁目１０番１号マロニエ通り銀座館２階,2019-07-12,株式会社
株式会社大英重機,愛知県名古屋市緑区鳥澄１丁目３０８番地の３,2019-07-12,株式会社
株式会社大谷地商店,北海道札幌市厚別区厚別南４丁目３４番２１号,2019-07-12,株式会社
株式会社大黒屋,東京都あきる野市舘谷２０６番地,2019-07-12,株式会社
株式会社子ども・表現活動研究所,栃木県宇都宮市東峰町３０９２番地１６,2019-07-12,株式会社
株式会社安藤建設,山形県東田川郡庄内町余目字月屋敷２３６番地の１,2019-07-12,株式会社
株式会社富国,神奈川県横浜市中区扇町１丁目１番地２５,2019-07-12,株式会社
株式会社對馬タイル,東京都八王子市大和田町２丁目４番２－４０２号,2019-07-12,株式会社
株式会社小城,埼玉県川口市西青木１丁目１２－１１,2019-07-12,株式会社
株式会社小野ダクト工業,宮城県仙台市泉区南中山１丁目２７番地の２２６,2019-07-12,株式会社
株式会社岩見沢サポート,北海道美唄市東三条南６丁目９番２３号,2019-07-12,株式会社
株式会社康栄,栃木県日光市中宮祠２４７８番地７,2019-07-12,株式会社
株式会社恒祐商事,埼玉県川口市上青木１丁目２１番２２号,2019-07-12,株式会社
株式会社恵工務店,埼玉県狭山市中央２丁目４９番４,2019-07-12,株式会社
株式会社手稲前田商事,北海道札幌市手稲区前田七条１７丁目４番３号,2019-07-12,株式会社
株式会社新孝工業,宮城県石巻市二子１丁目８番地６,2019-07-12,株式会社
株式会社新日本語教育,福岡県久留米市櫛原町１２７番地９,2019-07-12,株式会社
株式会社日高商店,北海道浦河郡浦河町字西幌別８番１０号,2019-07-12,株式会社
株式会社月虹,福岡県福岡市中央区六本松３丁目１１番４１号エイリンビル１階,2019-07-12,株式会社
株式会社村城,岩手県奥州市水沢真城字垣ノ内３９番地１６,2019-07-12,株式会社
株式会社東上ＷＯＲＫＳ,埼玉県川越市大字木野目１２５３番地１ハレイエＣ２０１,2019-07-12,株式会社
株式会社東京美食Ｌａｂｏ,東京都港区麻布十番２丁目１３番１０号ＳＫ麻布十番ビル８階,2019-07-12,株式会社
株式会社東苫ストア,北海道苫小牧市拓勇東町６丁目４番１６号,2019-07-12,株式会社
株式会社栗原ヘルスケア研究所,神奈川県横浜市神奈川区泉町１４－３ウィング５０１,2019-07-12,株式会社
株式会社栗山造船鉄工,長崎県平戸市鮎川町３番地１２,2019-07-12,株式会社
株式会社梅や,神奈川県川崎市高津区子母口１０６７番地,2019-07-12,株式会社
株式会社樹縁,大阪府豊中市北条町１丁目７番３号,2019-07-12,株式会社
株式会社江別ストア,北海道江別市工栄町２７番地の３,2019-07-12,株式会社
株式会社沓名デザイン事務所,愛知県名古屋市中区栄２丁目９番５号東海ビル７階,2019-07-12,株式会社
株式会社浜創,島根県浜田市長浜町１４９４番地,2019-07-12,株式会社
株式会社深谷工務店,兵庫県三田市三田町８番４３号,2019-07-12,株式会社
株式会社清田真栄,北海道札幌市清田区平岡三条３丁目１番１号,2019-07-12,株式会社
株式会社渋谷エステート,埼玉県さいたま市中央区八王子３丁目３２番２８号,2019-07-12,株式会社
株式会社源栄,大阪府箕面市半町２丁目１１番３５号（１０１号）,2019-07-12,株式会社
株式会社滝野,埼玉県三郷市新和５丁目３４８番地１５,2019-07-12,株式会社
株式会社漆芸舎,京都府京都市北区紫野門前町１４番地,2019-07-12,株式会社
株式会社片山塗装店,和歌山県和歌山市加太２２０１番地１１１,2019-07-12,株式会社
株式会社琉球キャピタルマネジメント,東京都千代田区平河町２丁目１６番５号クレール平河町６０２,2019-07-12,株式会社
株式会社田中機械製作所,千葉県東金市山口８８３番地５,2019-07-12,株式会社
株式会社盛栄,大阪府八尾市高砂町１丁目２１番地,2019-07-12,株式会社
株式会社盛栄商店,大阪府大阪市鶴見区今津中１丁目４番３３号,2019-07-12,株式会社
株式会社碧ＡＯ,福岡県久留米市日吉町７番地１第６泉屋ビル１階,2019-07-12,株式会社
株式会社神香クリエーション,埼玉県川越市砂新田３丁目２２番地１１,2019-07-12,株式会社
株式会社秀花,静岡県富士市中之郷１８７９番地の１,2019-07-12,株式会社
株式会社税法会計研究所,東京都中央区八丁堀２丁目２１番１２号,2019-07-12,株式会社
株式会社聖康,埼玉県川口市上青木西２丁目９番３号,2019-07-12,株式会社
株式会社與那覇工業,神奈川県横浜市鶴見区北寺尾４丁目１１番１４－１０１号,2019-07-12,株式会社
株式会社菊田工業,茨城県守谷市立沢７２７番地の７,2019-07-12,株式会社
株式会社藤田,愛知県知立市山町小林２４番地１,2019-07-12,株式会社
株式会社西日本企画,広島県広島市安佐南区長束西５丁目１１番２号,2019-07-12,株式会社
株式会社西胆振商事,北海道室蘭市中島町３丁目２５番２号,2019-07-12,株式会社
株式会社西部産業,大阪府大阪市平野区長吉川辺２丁目８番６５号,2019-07-12,株式会社
株式会社誠山建設,高知県高知市薊野北町２丁目７番２号,2019-07-12,株式会社
株式会社誠技研,東京都墨田区東向島４丁目４番１０号,2019-07-12,株式会社
株式会社辻堂八的,神奈川県藤沢市辻堂元町３丁目１５番８号,2019-07-12,株式会社
株式会社近畿出版社,大阪府大阪市北区天神橋３丁目２番１５号サクシード南森町２階,2019-07-12,株式会社
株式会社金田,神奈川県藤沢市鵠沼橘１丁目１番１０号フレッサ鵠沼１Ｆ,2019-07-12,株式会社
株式会社陽建,茨城県つくば市学園南３丁目４４番地５,2019-07-12,株式会社
株式会社高橋工業,埼玉県児玉郡美里町大字猪俣１１８番地,2019-07-12,株式会社
株式会社高橋電気,東京都東久留米市幸町３丁目４番５０号,2019-07-12,株式会社
株式会社鬼塚ＦＰ事務所,福岡県福岡市中央区今泉１丁目１７番２２－５０１号,2019-07-12,株式会社
株式会社魂屋,大阪府大阪市港区磯路２丁目１番２０－５０８号,2019-07-12,株式会社
株式会社鳴瀬電設,神奈川県秦野市名古木６８番地の１２,2019-07-12,株式会社
株式会社龍成,福岡県北九州市小倉北区弁天町５番２－９０２号,2019-07-12,株式会社
株式会社３,埼玉県八潮市大字木曽根６５３番１,2019-07-12,株式会社
株式会社３Ｈ　Ｓｙｓｔｅｍｓ,埼玉県川口市東領家２丁目１９番２１号,2019-07-12,株式会社
株式会社３ＷＡＶＥＳ,愛知県名古屋市守山区白沢町１０９番地,2019-07-12,株式会社
株式会社Ａプラン,埼玉県さいたま市大宮区仲町１丁目７７番地２－３階,2019-07-12,株式会社
株式会社Ａ・Ｏ・Ｉ,大阪府東大阪市加納８丁目２番２５号,2019-07-12,株式会社
株式会社ＡＢＣホールディングス,大阪府大阪市福島区吉野５丁目８番１４号,2019-07-12,株式会社
株式会社ＡＤＡ,東京都港区海岸３丁目７－１２,2019-07-12,株式会社
株式会社ＡＱＲＡＩＳＥ,群馬県伊勢崎市境東新井６７１番地,2019-07-12,株式会社
株式会社ＡＲＥＡＴＥ　ＨＯＬＤＩＮＧＳ,神奈川県鎌倉市大船１丁目２２－２８パブロ・コート４Ｆ,2019-07-12,株式会社
株式会社ＡＲＴ　ＲＡＩＳＥ,神奈川県横浜市瀬谷区阿久和南２丁目４番地７２,2019-07-12,株式会社
株式会社ＡＳＲＩＳＥ,大阪府摂津市新在家２丁目３０番５号,2019-07-12,株式会社
株式会社Ａｌｅｓｃｏ,愛知県名古屋市中区丸の内３丁目１５番２１号Ｃｅｒｅｓ丸の内２０１号,2019-07-12,株式会社
株式会社Ａｐｐｌａｕｓｅ,三重県四日市市大字羽津２１４６番地１,2019-07-12,株式会社
株式会社Ａｒｇｏｎ,埼玉県ふじみ野市大井中央１丁目１０番９号,2019-07-12,株式会社
株式会社Ｂ．Ｄ．Ｆ,神奈川県相模原市中央区中央２丁目３番１５号エクセルハイツ１Ｆ,2019-07-12,株式会社
株式会社ＢＪＡＴコンサルティング,栃木県宇都宮市上戸祭町６９６番地６８,2019-07-12,株式会社
株式会社ＢＬＯＯＭ　ＨＯＬＤＩＮＧＳ,茨城県つくば市学園の森１丁目１９番地９－２０３,2019-07-12,株式会社
株式会社ＢＬＵＥ　ＢＩＲＤ,大阪府大阪市中央区南船場４丁目１０番５号南船場ＳＯＨＯビル７０２,2019-07-12,株式会社
株式会社ＢＮＳ,東京都渋谷区恵比寿１丁目２３番１０号,2019-07-12,株式会社
株式会社ＢＯＤ商会,岡山県津山市二宮１４６１番地１,2019-07-12,株式会社
株式会社ＢＳＹ会計,石川県金沢市泉野町４丁目２０番１８号,2019-07-12,株式会社
株式会社Ｂｅｓｔ　Ａｇｅｎｔ,大阪府吹田市西の庄町７番２６－３０２号,2019-07-12,株式会社
株式会社Ｂｉｙｋ,愛知県東海市名和町池末３番地１,2019-07-12,株式会社
株式会社Ｂｒｏｎｘ,東京都東村山市恩多町３丁目２２番地４０,2019-07-12,株式会社
株式会社Ｃ．Ｋ．Ｌａｂ,熊本県熊本市東区桜木３丁目１番２６号,2019-07-12,株式会社
株式会社ＣＡＭＥＸ,東京都青梅市新町１丁目３２番地の１,2019-07-12,株式会社
株式会社ＣＲｏｔｔｏ,宮城県仙台市宮城野区五輪１丁目３番２５－２０７号,2019-07-12,株式会社
株式会社ＣｏＣｒｅａｔｅ,大阪府大阪市北区梅田１丁目１１番４号大阪駅前第４ビル９階９２３・１３８４号,2019-07-12,株式会社
株式会社Ｃｒａｆｔ－Ｗｏｒｋｓ,神奈川県横浜市神奈川区三枚町４０番地７,2019-07-12,株式会社
株式会社Ｃｒｅａｔｉｏｎ,神奈川県横浜市磯子区汐見台３丁目２番地２ジェイパークヒルズ上大岡１０８号,2019-07-12,株式会社
株式会社Ｄファクトリー,大阪府大阪市西区阿波座１丁目６番１３号カーニープレイス本町ビル,2019-07-12,株式会社
株式会社ＤＥＶＥＬＯＰ,大阪府大阪市東住吉区駒川１丁目７番１４号,2019-07-12,株式会社
株式会社ＥＫＵＢＯ,埼玉県さいたま市南区別所５丁目１５番２号,2019-07-12,株式会社
株式会社Ｅｄｇｅ,東京都葛飾区東堀切１丁目３番７号,2019-07-12,株式会社
株式会社Ｅｍｐｏｗｅｒ　Ｆｏｒ,東京都渋谷区東２丁目２５－３,2019-07-12,株式会社
株式会社Ｅｘｃｌｕｓｉｖｅ　Ｊａｐａｎ,宮城県仙台市若林区なないろの里２丁目１１番３－１０１号,2019-07-12,株式会社
株式会社Ｆ,愛知県小牧市岩崎１丁目３１番地,2019-07-12,株式会社
株式会社ＦＡＳＴ,神奈川県横浜市港南区港南台８丁目２１番４号,2019-07-12,株式会社
株式会社ＦＤ　ＣＯＭＰＡＮＹ,沖縄県宮古島市平良字下里２５１１番地２,2019-07-12,株式会社
株式会社ＦＥＦ,大阪府大阪市此花区高見２丁目５番１４号,2019-07-12,株式会社
株式会社ＦＬＡＴ　ＩＮＮ,神奈川県藤沢市湘南台４丁目３番地の２０,2019-07-12,株式会社
株式会社ＦＬＯＷＥＲ,埼玉県春日部市南中曽根６８７番地１３,2019-07-12,株式会社
株式会社Ｆａｔｅ,大阪府大阪市中央区南船場３丁目８番１５号,2019-07-12,株式会社
株式会社Ｆｒｅｓｎｏ,北海道札幌市東区東苗穂十条３丁目１５番６号,2019-07-12,株式会社
株式会社Ｇ・Ａ,神奈川県鎌倉市由比ガ浜１丁目２番２２号,2019-07-12,株式会社
株式会社Ｇ－ＣＲＯＷＮ,京都府京都市左京区上高野池ノ内町２－１,2019-07-12,株式会社
株式会社ＧＧＬコミュニケーションズ,東京都足立区島根３丁目２７番８ダイアパレス西新井３１２号,2019-07-12,株式会社
株式会社ＧＴ,東京都港区西麻布４丁目１６番５号,2019-07-12,株式会社
株式会社Ｇａｒｌａｎｄ,長野県安曇野市穂高北穂高２７５３番地１,2019-07-12,株式会社
株式会社Ｈ・Ｃ・Ｐ,長野県伊那市高遠町長藤６４６４番地１,2019-07-12,株式会社
株式会社ＨＡＦ　ＡＧＥＮＣＹ,東京都港区西新橋２丁目２２－１,2019-07-12,株式会社
株式会社ＨＡＲＲＹＳ,沖縄県宮古島市平良字狩俣７６６番地１,2019-07-12,株式会社
株式会社Ｈａｎａｈａｎａ　ｃｕｉ．,兵庫県神戸市中央区京町６７番地ＫＡＮＪＵビル,2019-07-12,株式会社
株式会社ＩＣＨＩＥ,京都府城陽市平川浜道裏１番地の５Ｄ－ｒｏｏｍ久津川３０３号,2019-07-12,株式会社
株式会社ＩＤＰ北日本,宮城県仙台市青葉区上杉６丁目１番５０号アクシスルミエ１０６号,2019-07-12,株式会社
株式会社ＩＭＤＥＸ,埼玉県熊谷市上之２８６８番地３,2019-07-12,株式会社
株式会社ＪＲＪ,大阪府大阪市都島区高倉町２丁目６番８号ＪＬビル都島４０６号,2019-07-12,株式会社
