法人名,住所,設立日,法人種別
いちごＥＣＯ発電所２１一般社団法人,東京都千代田区内幸町１丁目１番１号,2021-08-02,その他の設立登記法人
いろは不動産株式会社,富山県滑川市横道３３４７番地,2021-08-02,株式会社
みやこ３５８合同会社,神奈川県藤沢市藤沢５７１番地,2021-08-02,合同会社
よつば介護事業協同組合,大阪府大東市氷野１丁目６３７番地の６,2021-08-02,その他の設立登記法人
アンドリード株式会社,千葉県市川市南行徳１丁目３番３号,2021-08-02,株式会社
アーク合同会社,大阪府豊中市清風荘２丁目７番２号,2021-08-02,合同会社
イネケン纉株式会社,福岡県八女郡広川町大字日吉８３２番地３,2021-08-02,株式会社
インパクトサークル株式会社,東京都港区港南２丁目１６番２号太陽生命品川ビル２８階,2021-08-02,株式会社
イーライフ合同会社,神奈川県川崎市幸区戸手４丁目１２番１－２１０４号,2021-08-02,合同会社
エアウェーブ合同会社,東京都台東区浅草橋３丁目３番４号,2021-08-02,合同会社
エクストラレス株式会社,東京都中央区京橋２丁目８番２１号喜久家ビルディング７階７１２号室,2021-08-02,株式会社
エコムシステムズ株式会社,福岡県久留米市諏訪野町１８２６番地５ＥＣＯＭビル３階,2021-08-02,株式会社
エスピーシーエンターテイメント合同会社,千葉県野田市なみき１丁目２５－３,2021-08-02,合同会社
エス・ピー・シー湖南株式会社,滋賀県大津市別保２丁目９番５０号,2021-08-02,株式会社
オレンジ・Ｏ合同会社,東京都港区浜松町２丁目２番１５号浜松町ダイヤビル２Ｆ,2021-08-02,合同会社
オー・ウェイ株式会社,兵庫県川西市緑台４丁目２番地の５９,2021-08-02,株式会社
キョウフジギョウ株式会社,東京都中央区東日本橋２丁目２８番５号５０８,2021-08-02,株式会社
クラフト合同会社,愛知県名古屋市千種区今池２丁目１４番１９号,2021-08-02,合同会社
クリーン明科株式会社,長野県安曇野市明科中川手２８２０番地５,2021-08-02,株式会社
サウナラウンジ株式会社,東京都港区南青山６丁目７番８－１１０１号,2021-08-02,株式会社
サカキバランド合同会社,神奈川県横浜市中区山下町２５番地ハリレラハウス７Ｆ,2021-08-02,合同会社
サニーガーデン株式会社,兵庫県芦屋市精道町６番１５号桑原ビル３階,2021-08-02,株式会社
セイショウ工業株式会社,栃木県矢板市上太田１２番地２０,2021-08-02,株式会社
タクト通商株式会社,兵庫県神戸市須磨区天神町４丁目４番３５号アスミビル２Ｆ,2021-08-02,株式会社
タッチ株式会社,東京都中央区勝どき１丁目８番１号,2021-08-02,株式会社
テックスプラス株式会社,兵庫県西宮市柏堂町１２番１０号,2021-08-02,株式会社
テルモ税理士法人,新潟県糸魚川市南寺町３丁目７番７号,2021-08-02,その他の設立登記法人
テンルアセットマネージメント株式会社,東京都台東区台東３丁目１番４号,2021-08-02,株式会社
ニチエイホーム株式会社,高知県高知市高須２丁目２番２０号,2021-08-02,株式会社
バリコーポレーション合同会社,広島県広島市中区宝町５番１１－１９０１号,2021-08-02,合同会社
パレットライフサイエンスジャパン株式会社,東京都港区海岸１丁目２－３汐留芝離宮ビルディング２１階,2021-08-02,株式会社
ファイブ行政書士法人,大阪府大阪市西区西本町１丁目８番２号三晃ビル３階,2021-08-02,その他の設立登記法人
ブリル合同会社,兵庫県宝塚市山本南１丁目３０番７号３０２,2021-08-02,合同会社
ブルジオン株式会社,大阪府大阪市西区江戸堀２丁目７番１９号,2021-08-02,株式会社
プラスＪａｐａｎ企画合同会社,東京都中央区新川２丁目２番２号八重洲第２パークビル５階,2021-08-02,合同会社
マルガレーテ研究所合同会社,東京都千代田区神田小川町１丁目７番８０３号,2021-08-02,合同会社
メイアイプラス合同会社,千葉県船橋市新高根１丁目２６番８号,2021-08-02,合同会社
メロウレイク株式会社,熊本県熊本市中央区安政町６番２９号,2021-08-02,株式会社
ユニバーサルフラート合同会社,東京都目黒区中目黒３丁目６番２号中目黒Ｆ．Ｓビル５階,2021-08-02,合同会社
ライズネット管理株式会社,東京都新宿区大久保２丁目４番１２号新宿ラムダックスビル８Ｆ,2021-08-02,株式会社
リリーフアドバイザリー合同会社,東京都国分寺市本町４丁目６番９号－４１２,2021-08-02,合同会社
一般社団法人おこしやす京都へ,京都府京都市東山区清閑寺霊山町５－４１,2021-08-02,その他の設立登記法人
一般社団法人ふるさと,埼玉県川越市砂新田５丁目３６番地８,2021-08-02,その他の設立登記法人
一般社団法人エーツージャパン,岐阜県岐阜市柳津町上佐波西５丁目１６,2021-08-02,その他の設立登記法人
一般社団法人オルパ,東京都千代田区丸の内３丁目１番１号東京共同会計事務所内,2021-08-02,その他の設立登記法人
一般社団法人トライアンフ１１０,大阪府大東市扇町１３番９－７０１号,2021-08-02,その他の設立登記法人
一般社団法人ビジョントレーニングサポート協会,兵庫県尼崎市水明町１３番地の１２、水明マンション１階,2021-08-02,その他の設立登記法人
一般社団法人ミラサス,石川県野々市市末松３丁目５７０番地（ケイ・エム・スクエア合同会社内）,2021-08-02,その他の設立登記法人
一般社団法人メンタルケアＯｎｅＷｉｎ,宮崎県宮崎市生目台東３丁目１２番地５,2021-08-02,その他の設立登記法人
一般社団法人匠時間,東京都墨田区墨田４丁目４４番１０号,2021-08-02,その他の設立登記法人
一般社団法人地域福祉活動協会,愛知県名古屋市守山区小幡５丁目８番１３号,2021-08-02,その他の設立登記法人
一般社団法人日本足場会,東京都新宿区新宿１丁目３２番１５号エムズ新宿御苑２Ｆ,2021-08-02,その他の設立登記法人
一般社団法人日本遊具屋外施設業協会,愛知県名古屋市西区上橋町２６１番地,2021-08-02,その他の設立登記法人
一般社団法人旭市母子寡婦福祉会,千葉県旭市椎名内３１４７番地,2021-08-02,その他の設立登記法人
一般社団法人淡路島観光振興協議会,兵庫県淡路市久留麻１８６０番地４０,2021-08-02,その他の設立登記法人
一般社団法人相続おまかせ支援協会,愛知県名古屋市中区栄２丁目５番１３号アイ・エスビル４階,2021-08-02,その他の設立登記法人
一般社団法人組織開発コーチ協会,東京都中央区銀座１丁目２０番１７号,2021-08-02,その他の設立登記法人
一般社団法人Ｄ－ｔａｆ,東京都大田区北馬込２丁目５２番５号,2021-08-02,その他の設立登記法人
一般社団法人Ｇｒｅｅｎ　ｉｎｎｏｖａｔｉｏｎ,東京都港区南青山６丁目７番８－１１０１号ファーロ南青山,2021-08-02,その他の設立登記法人
一般社団法人Ｓｕｎ　Ｈａｐｉ,愛知県豊橋市向山町字伝馬４９番地２,2021-08-02,その他の設立登記法人
一般財団法人杉本育文化財団,福井県福井市新保１丁目１２０１番地,2021-08-02,その他の設立登記法人
一般財団法人ＡＲＩＧＡＴＯ,東京都港区南青山１丁目２４番３号ＷｅＷｏｒｋＮｏｇｉｚａｋａ,2021-08-02,その他の設立登記法人
中里ファミリーインベストメンツ合同会社,神奈川県鎌倉市小町２丁目５番９号,2021-08-02,合同会社
京恩株式会社,神奈川県横浜市鶴見区潮田町２丁目１１４番地９,2021-08-02,株式会社
伊賀環境サービス株式会社,大阪府東大阪市若江西新町３丁目１番５号,2021-08-02,株式会社
住和グループ株式会社,神奈川県川崎市高津区梶ケ谷２丁目７番１７号,2021-08-02,株式会社
内野植木株式会社,東京都立川市上砂町２丁目３１－８,2021-08-02,株式会社
凱高産業株式会社,群馬県太田市熊野町６－１,2021-08-02,株式会社
医療法人楡のもり,岐阜県各務原市蘇原野口町５丁目１３０番地,2021-08-02,その他の設立登記法人
千尋貿易株式会社,東京都豊島区池袋１丁目１２番１５号三陽荘１０２号,2021-08-02,株式会社
千葉産業株式会社,宮城県登米市豊里町新田町１７０番地,2021-08-02,株式会社
協同組合リンクスタッフ,大阪府大阪市東住吉区桑津１丁目１３番２２号,2021-08-02,その他の設立登記法人
司法書士法人リーガルトップ,東京都豊島区南池袋２丁目１１番１号明王ビル３Ｆ,2021-08-02,その他の設立登記法人
合同会社こうのとり,岐阜県中津川市茄子川７３７番地の１,2021-08-02,合同会社
合同会社こども工房,宮崎県都城市乙房町４８３,2021-08-02,合同会社
合同会社ものがたり工作所,兵庫県神戸市須磨区高倉町２丁目１番２３－５０２号,2021-08-02,合同会社
合同会社エクステリア湘,神奈川県三浦郡葉山町一色９５９番地の３,2021-08-02,合同会社
合同会社オフィスおおやま,神奈川県横浜市港北区篠原東１丁目１２番１９号,2021-08-02,合同会社
合同会社オレンジボックス,東京都立川市富士見町６丁目１番２０３号,2021-08-02,合同会社
合同会社カチダス,東京都千代田区二番町１番地２,2021-08-02,合同会社
合同会社カルナフード,福岡県福津市日蒔野１丁目９番地の１０,2021-08-02,合同会社
合同会社コムピット,大阪府八尾市龍華町１丁目４番１－１６０７号,2021-08-02,合同会社
合同会社シンメイ,神奈川県横浜市港北区篠原町１１０５,2021-08-02,合同会社
合同会社スタジオＹＵＫＯ,兵庫県宝塚市逆瀬台４丁目９番１０号,2021-08-02,合同会社
合同会社スノードロップ,神奈川県川崎市多摩区枡形６丁目１８番６３号,2021-08-02,合同会社
合同会社セブンラーク,東京都世田谷区代沢３丁目１７番１７号,2021-08-02,合同会社
合同会社ソキウスケアマネジメント,兵庫県川西市湯山台１丁目２８－２０,2021-08-02,合同会社
合同会社タベタノ,東京都新宿区新宿１丁目３６番２号新宿第七葉山ビル３階,2021-08-02,合同会社
合同会社チャンプル,沖縄県石垣市字新川１１４－３,2021-08-02,合同会社
合同会社デジタル・ビジネス・ラボ,東京都世田谷区深沢５丁目１６番２２号,2021-08-02,合同会社
合同会社トリニティ・ワン,東京都千代田区内幸町２丁目１番６号,2021-08-02,合同会社
合同会社ナイン,東京都港区青山四丁目１５番１９号２０５,2021-08-02,合同会社
合同会社ハネトヤ,群馬県前橋市広瀬町１丁目１４番１３号,2021-08-02,合同会社
合同会社ハート,沖縄県宮古島市平良字東仲宗根８９４番地７,2021-08-02,合同会社
合同会社ブラッサム,沖縄県宜野湾市真栄原１丁目１５番２７号,2021-08-02,合同会社
合同会社ポリャンカ,東京都墨田区太平１丁目１番５－２０２号,2021-08-02,合同会社
合同会社マーカー,埼玉県鶴ヶ島市大字下新田６４０番地１３－１０２,2021-08-02,合同会社
合同会社モナドワークス,東京都港区南青山２丁目２番１５号,2021-08-02,合同会社
合同会社ラーメン虎一番,兵庫県尼崎市大島１丁目２番３号,2021-08-02,合同会社
合同会社リヒト,東京都中野区中野５丁目３２番９号ハウスポート中野１０２,2021-08-02,合同会社
合同会社リードケアーサービス,東京都新宿区大久保１丁目１番４９号タキカワビル２階,2021-08-02,合同会社
合同会社レベシェア１号,東京都練馬区桜台４丁目１９－１７,2021-08-02,合同会社
合同会社二本松太陽光発電所,大阪府大阪市北区堂島浜１丁目２番１号新ダイビル２３階,2021-08-02,合同会社
合同会社侶偉,埼玉県川口市上青木６丁目３８番１０号わかばビルⅡ４０１号,2021-08-02,合同会社
合同会社創生レオ,愛知県名古屋市中村区名駅３丁目３番８号１２０２号,2021-08-02,合同会社
合同会社吉川工業,愛知県名古屋市港区善進町２丁目２８番地の１（エルフェーヌ２０２号）,2021-08-02,合同会社
合同会社安心パックサービス,鹿児島県鹿児島市西伊敷１丁目２６番１号,2021-08-02,合同会社
合同会社常若総合サービス,東京都中央区銀座１丁目２２番１１号銀座大竹ビジデンス２階,2021-08-02,合同会社
合同会社有,兵庫県神戸市灘区六甲町３丁目１－５,2021-08-02,合同会社
合同会社濱田遠隔画像診断室,兵庫県芦屋市大原町１７番２６号,2021-08-02,合同会社
合同会社燈仁舎,東京都港区芝浦４丁目４番２７－１２０８号,2021-08-02,合同会社
合同会社紀成,和歌山県和歌山市田尻１８８番地,2021-08-02,合同会社
合同会社菅創,福岡県春日市昇町３丁目１５５番地,2021-08-02,合同会社
合同会社詩商事,福岡県久留米市櫛原町８８番地,2021-08-02,合同会社
合同会社風林堂薬局,鹿児島県熊毛郡屋久島町栗生１７５１番地５,2021-08-02,合同会社
合同会社Ａ．Ｔ．Ｖ,福岡県嘉穂郡桂川町大字土師２８番地３３４,2021-08-02,合同会社
合同会社ＡＳＯ　ＴＯＰ,熊本県阿蘇郡高森町大字色見１７２４番地,2021-08-02,合同会社
合同会社ＢＬＭ,東京都世田谷区若林４丁目１４番２３号,2021-08-02,合同会社
合同会社Ｂｅｅ’ｓ　Ｇａｒｄｅｎ,兵庫県芦屋市海洋町３－２９,2021-08-02,合同会社
合同会社ＤＩＫＥ,東京都中央区八丁堀２丁目２８番５－４０３号,2021-08-02,合同会社
合同会社Ｄｒａｋｅ,東京都江戸川区松島３丁目４３－１３シャトー松島７０４,2021-08-02,合同会社
合同会社Ｄｒｏｎｅ　Ｓｙｓｔｅｍ,奈良県香芝市五位堂６丁目２１６番地１－１０６号,2021-08-02,合同会社
合同会社ＥＫカンパニー,東京都昭島市松原町３丁目７番２０号,2021-08-02,合同会社
合同会社ＥｉｎｓＬｉｂｅ,東京都港区南青山２丁目２番１５号ＷＩＮ青山５３１,2021-08-02,合同会社
合同会社ＦＯ,東京都千代田区丸の内３丁目１番１号東京共同会計事務所内,2021-08-02,合同会社
合同会社ＦＳデンタルラボ,北海道札幌市南区澄川三条２丁目５番５号,2021-08-02,合同会社
合同会社Ｆｅｅｌ　Ｆｒｅｅ,佐賀県西松浦郡有田町楠木原乙３７９,2021-08-02,合同会社
合同会社ＧＯＬＤＲＡＳＨ,神奈川県横浜市中区初音町３丁目５３－１０本橋ビル４０１,2021-08-02,合同会社
合同会社ＧＸ,東京都江東区白河４丁目９番２５－２５０４号,2021-08-02,合同会社
合同会社Ｇｒｏｗｉｎｇ,神奈川県横浜市青葉区あざみ野２丁目２７番地４シャトレー２０２,2021-08-02,合同会社
合同会社ＪＧＨ,佐賀県佐賀市中央本町１番１０号ニュー寺元ビル５階,2021-08-02,合同会社
合同会社Ｋ’ｚ,熊本県熊本市中央区河原町４－１エバーライフ熊本中央６０１号,2021-08-02,合同会社
合同会社Ｋ＆Ｓ,埼玉県北足立郡伊奈町大字小室１１８８番地２,2021-08-02,合同会社
合同会社ＫＡＺＵ計装,神奈川県横須賀市坂本町３丁目１７番地,2021-08-02,合同会社
合同会社ＫＳＰ,沖縄県那覇市牧志１丁目４番５３－３０９号,2021-08-02,合同会社
合同会社ＫＴＳ,東京都立川市富士見町１丁目２８番４号,2021-08-02,合同会社
合同会社ＭＡＲＫＥ　ＳＭＩＬＥ,兵庫県加古川市加古川町篠原町１３－３加古川まいるビル１階,2021-08-02,合同会社
合同会社ＭＦ　ＳＱＵＡＲＥ,東京都世田谷区深沢４丁目２７－２０－２０５,2021-08-02,合同会社
合同会社ＭＫケアーサービス,東京都新宿区新宿２丁目７番３号ヴェラハイツ新宿御苑４０６号室,2021-08-02,合同会社
合同会社Ｍａｇｎｏｌｉａ　Ｐａｒｔｎｅｒｓ,東京都港区南青山２丁目２番１５号ウィン青山９階,2021-08-02,合同会社
合同会社Ｍｅ－Ｒａｙ,東京都新宿区北新宿４丁目１１番３,2021-08-02,合同会社
合同会社Ｍｉｌｅ,熊本県熊本市南区城南町舞原３０８番地１－２０５号,2021-08-02,合同会社
合同会社ＮＵＴＳ,広島県広島市中区幟町３－６０サムティ幟町６０２,2021-08-02,合同会社
合同会社Ｎｓ’Ｓｔｙｌｅ,群馬県高崎市貝沢町８２４番地,2021-08-02,合同会社
合同会社ＯＮＥ’Ｓ　ｄｅｓｉｇｎ,山梨県甲斐市西八幡１４１２,2021-08-02,合同会社
合同会社Ｐｒｅｖｅｎｔｉｏｎ　Ｐｒｏｊｅｃｔ,和歌山県和歌山市東田中１７４番地１,2021-08-02,合同会社
合同会社Ｒ　ｉｎｎｏｖａｔｉｏｎ,愛知県名古屋市中区栄１丁目６番１５号グランドメゾン御園座タワー３５０２号,2021-08-02,合同会社
合同会社ＲＩＣＨ　ＣＯＵＮＴＲＹ　ＬＩＦＥ,広島県三次市布野町上布野３４６番地,2021-08-02,合同会社
合同会社ＲＩＴＡＣＯＭ,神奈川県横浜市港北区大倉山４丁目２５番１２－１号,2021-08-02,合同会社
合同会社Ｒａｂｂｙ,奈良県生駒市辻町３９９番地４７－２８－１０２,2021-08-02,合同会社
合同会社ＳＥＮ,熊本県熊本市中央区桜町１番２５号未来会議室,2021-08-02,合同会社
合同会社ＳｈｏｗＭＥｉ,大阪府堺市北区大豆塚町１丁２８番地８,2021-08-02,合同会社
合同会社Ｔ－Ｓｔｙｌｅ,佐賀県佐賀市兵庫北１丁目２４番１９－１０２号,2021-08-02,合同会社
合同会社ＴＣＵ,神奈川県横浜市南区別所５丁目１４番１６号,2021-08-02,合同会社
合同会社ＴＯＵＪＩ　ＧＲＡＰＨＩＣＡ,愛知県名古屋市中区大須１丁目７番１４号パークＩＭビル２Ｆ,2021-08-02,合同会社
合同会社ＴＲＳ,香川県さぬき市津田町津田８２８番地２,2021-08-02,合同会社
合同会社ＵＴＡ,北海道札幌市中央区南八条西３丁目７茶やビル３階,2021-08-02,合同会社
合同会社Ｖａｌｈａｌｌａ　Ｐｒｏｍｏｔｉｏｎ,東京都豊島区南池袋１丁目９番地１８号２３２,2021-08-02,合同会社
合同会社ａｎｄＭＡ,大阪府堺市堺区櫛屋町東２丁２番７－１号,2021-08-02,合同会社
合同会社ｃｌａｗｓ,大阪府大阪市住吉区杉本２丁目２６番３１号,2021-08-02,合同会社
合同会社ｈｉｐ,大阪府和泉市和気町１丁目３０－６モアフェミン１階Ｃ号室,2021-08-02,合同会社
合同会社ｍｉＧｏ,東京都港区南青山２丁目２番１５号,2021-08-02,合同会社
合同会社ｐｌａｎｔｅｒ,兵庫県赤穂市大津１８７３番地の３,2021-08-02,合同会社
吉田造園株式会社,東京都大田区大森西１丁目１３番７号,2021-08-02,株式会社
大学入試ドットコム合同会社,奈良県橿原市雲梯町８５９番地の１スカイレジデンス１０１号室,2021-08-02,合同会社
大洋商事株式会社,宮崎県小林市細野３９１番地１,2021-08-02,株式会社
大津百貨店株式会社,東京都墨田区菊川２丁目２３番１号,2021-08-02,株式会社
大矢野運送株式会社,熊本県上天草市大矢野町上４２３０番地１,2021-08-02,株式会社
安信合同会社,東京都江東区亀戸１丁目１９番６－３１５号,2021-08-02,合同会社
安東塗装店株式会社,神奈川県高座郡寒川町大蔵３６３番地,2021-08-02,株式会社
建物装飾株式会社,福岡県福岡市中央区荒戸１丁目１－１３－２０２,2021-08-02,株式会社
弁護士法人番町総合法律事務所,東京都千代田区五番町５番地５号ヒューリック五番町ビル５階,2021-08-02,その他の設立登記法人
恒生商事合同会社,埼玉県越谷市大字大林２５３番地３５メゾンドミール２０１,2021-08-02,合同会社
日水テック株式会社,神奈川県横浜市中区本牧元町２７番１５号,2021-08-02,株式会社
日豊産業株式会社,広島県東広島市豊栄町清武８６８－２,2021-08-02,株式会社
朝倉商事株式会社,東京都足立区東保木間２丁目７番１９号,2021-08-02,株式会社
木下会計コンサルティング株式会社,埼玉県川越市新富町２丁目２２番地八十二銀行ビル４階,2021-08-02,株式会社
東明商事株式会社,長崎県佐世保市高梨町１２番２５号１,2021-08-02,株式会社
株式会社えくぼ,神奈川県川崎市麻生区王禅寺東６丁目１１番３８号,2021-08-02,株式会社
株式会社かなめ工房,神奈川県横浜市青葉区松風台３３番地１５青葉台ハイツ４０２号,2021-08-02,株式会社
株式会社かわた塾,岡山県岡山市北区北長瀬本町２０番５３号,2021-08-02,株式会社
株式会社きらり薬局,三重県三重郡朝日町白梅の丘東１丁目１４番地１６,2021-08-02,株式会社
株式会社こうや,埼玉県北葛飾郡杉戸町倉松２丁目１１番３９号,2021-08-02,株式会社
株式会社しんじゅＬ＆Ｍ,北海道中川郡幕別町忠類朝日６９番地,2021-08-02,株式会社
株式会社ただのやまもと,埼玉県さいたま市見沼区大和田町２丁目５２０番地２山幸ハイツ２０３号,2021-08-02,株式会社
株式会社なお新,神奈川県横浜市戸塚区上倉田町１９４１番地１,2021-08-02,株式会社
株式会社ひまわり交通,茨城県東茨城郡大洗町五反田７２１番地,2021-08-02,株式会社
株式会社ふれあい神余の里,千葉県館山市上野原１０１番地の９,2021-08-02,株式会社
株式会社まちづくり伊豆長岡温泉,静岡県伊豆の国市長岡１０５４番地の３,2021-08-02,株式会社
株式会社らくてんぼう,宮城県石巻市鹿又字新田町浦７９番地,2021-08-02,株式会社
株式会社アイリス,東京都大田区南久が原２丁目７番５号,2021-08-02,株式会社
株式会社アイ・エイド,福島県河沼郡会津坂下町大字大沖字上野１１７８番地５,2021-08-02,株式会社
株式会社アオイ警備保障,佐賀県佐賀市西田代１丁目５－１０　１０３,2021-08-02,株式会社
株式会社アキテック,福井県敦賀市三島町１丁目１６番２２号,2021-08-02,株式会社
株式会社アクト,北海道札幌市中央区北三条西７丁目１番地１,2021-08-02,株式会社
株式会社アサセハウジング,東京都新宿区高田馬場２丁目１４番２７号花富士ビル２階,2021-08-02,株式会社
株式会社アスリードコンサルティング,愛知県名古屋市西区則武新町２丁目２－３０サンハイツ則武２０５,2021-08-02,株式会社
株式会社アップワードマネジメント,兵庫県尼崎市下坂部２丁目１５番１５号,2021-08-02,株式会社
株式会社アトモズ,東京都港区麻布十番２丁目８番１７号斉藤ビル２０１,2021-08-02,株式会社
株式会社アドバンス住販,埼玉県入間市牛沢町３番２号,2021-08-02,株式会社
株式会社アルシェ,熊本県熊本市東区長嶺東１丁目４番８２号ベルガゾン１０５号室,2021-08-02,株式会社
株式会社アルズ,大阪府守口市大庭町１丁目１６番５号,2021-08-02,株式会社
株式会社アルファテクノ,東京都町田市成瀬２丁目７－６,2021-08-02,株式会社
株式会社アンキョ,福岡県福岡市博多区月隈２丁目２－２７,2021-08-02,株式会社
株式会社アンジェリーナジャパン,東京都中央区日本橋蛎殻町１丁目５番６号,2021-08-02,株式会社
株式会社アームプランニング,千葉県柏市名戸ケ谷７６２番地１２,2021-08-02,株式会社
株式会社インディゴ,埼玉県川越市新宿町３丁目１０番地１メイツ川越６１７号室,2021-08-02,株式会社
株式会社イーアンドイート,北海道釧路市緑ケ岡５丁目１６番３８号,2021-08-02,株式会社
株式会社ウッドベル２ｎｄ,神奈川県横浜市旭区白根７丁目２－１,2021-08-02,株式会社
株式会社エスアールエス,兵庫県宝塚市鹿塩２丁目５番１８号,2021-08-02,株式会社
株式会社エスエイチ,千葉県流山市松ケ丘４丁目５１４番地の１２０,2021-08-02,株式会社
