法人名,住所,設立日,法人種別
株式会社Ｙプロパティー,大阪府和泉市みずき台１丁目８番７号,2017-01-16,株式会社
株式会社ｍａｅ,宮城県仙台市青葉区中央１丁目８番２４号ラブリーＫＫビル３Ｆ,2017-01-16,株式会社
株式会社ｍａｓｓｉｖｅ　ｌｎｇｇ,東京都中央区八重洲２丁目４－１０第一幸田ビル２Ｆ,2017-01-16,株式会社
株式会社ｍｏｔｅｘ,神奈川県藤沢市大庭５４５３番地の１ダイアパレス湘南ライフタウンⅢ８０３号,2017-01-16,株式会社
株式会社ｎａｎｏｕ,東京都世田谷区池尻２丁目３２番２号デパール池尻ビル１階,2017-01-16,株式会社
株式会社ｔａｃｔｉｃｓ,広島県広島市西区三篠北町１３番８号,2017-01-16,株式会社
株式会社ｔｅｇｅ,福岡県糸島市志摩師吉１４８５番地２,2017-01-16,株式会社
森義工業株式会社,千葉県松戸市西馬橋４丁目８７番地,2017-01-16,株式会社
楽程株式会社,東京都八王子市本郷町２－１５,2017-01-16,株式会社
武井コーポレーション株式会社,東京都杉並区成田西２丁目１４番３号,2017-01-16,株式会社
永吉溶工株式会社,千葉県市原市松ケ島２丁目１５番地７,2017-01-16,株式会社
清水設備株式会社,愛知県豊川市蔵子３丁目２番地８,2017-01-16,株式会社
特定非営利活動法人みんなのたすけあいセンターいたばし,東京都板橋区板橋３丁目６３番５号,2017-01-16,その他の設立登記法人
特定非営利活動法人ものづくりＯＥＴ,静岡県賀茂郡東伊豆町稲取１９２７番地の１８,2017-01-16,その他の設立登記法人
特定非営利活動法人アヘッドマップ,広島県東広島市西条町御薗宇７１２０番地Ｂ,2017-01-16,その他の設立登記法人
特定非営利活動法人ソーシャルデザインワークス,福島県いわき市内郷内町水之出１７番地,2017-01-16,その他の設立登記法人
特定非営利活動法人フードバンク三重,三重県津市中河原２１２９番地１,2017-01-16,その他の設立登記法人
特定非営利活動法人ペアレントサポート,北海道旭川市宮下通３丁目２１８１番地の２シュロス宮下４０３,2017-01-16,その他の設立登記法人
特定非営利活動法人夢かなう,福岡県春日市春日原北町４丁目２０番地２,2017-01-16,その他の設立登記法人
特定非営利活動法人子どものメンタルサポートグループ・シェアハート,長崎県長崎市赤迫１丁目２番３－１３０３号,2017-01-16,その他の設立登記法人
特定非営利活動法人子ども食堂５５,三重県四日市市大矢知町９３０番地１ツインコート大矢知２０５,2017-01-16,その他の設立登記法人
特定非営利活動法人学童保育クラブＦＯＲＺＡの会,千葉県君津市内蓑輪１７９番地１２,2017-01-16,その他の設立登記法人
特定非営利活動法人狛江子ども食堂,東京都狛江市駒井町１丁目５番１号,2017-01-16,その他の設立登記法人
特定非営利活動法人陽だまり,北海道勇払郡安平町追分白樺１丁目４２２番地,2017-01-16,その他の設立登記法人
特定非営利活動法人Ｈｅａｒｔｉｓ,福島県福島市北沢又字上日行壇１０番地の１６,2017-01-16,その他の設立登記法人
相生合同会社,京都府京都市南区唐橋高田町３０番１２号,2017-01-16,合同会社
知的財産取引所株式会社,東京都品川区東品川４丁目２番１１－２０６号,2017-01-16,株式会社
社会保険労務士法人オーク,千葉県柏市中央町５番２１号,2017-01-16,その他の設立登記法人
社会保険労務士法人天王澤事務所,静岡県島田市稲荷２丁目１２番３１号,2017-01-16,その他の設立登記法人
社会保険労務士法人安藤事務所,神奈川県相模原市中央区相生１丁目１１番７号,2017-01-16,その他の設立登記法人
社会保険労務士法人ＨＭパートナーズ,東京都千代田区飯田橋１丁目８番１０号,2017-01-16,その他の設立登記法人
社会福祉法人悠悠会,宮城県大崎市田尻字町５２番地,2017-01-16,その他の設立登記法人
社会福祉法人自学舎,山梨県南都留郡富士河口湖町小立５６９９－２,2017-01-16,その他の設立登記法人
秋田丸水商事株式会社,秋田県秋田市外旭川字待合２８番地,2017-01-16,株式会社
秋田県協和土地改良区,秋田県大仙市協和境字野田４,2017-01-16,その他
税理士法人ティーアローズ,宮崎県宮崎市昭和町１３番地１,2017-01-16,その他の設立登記法人
税理士法人薄井会計,北海道旭川市曙一条６丁目１番５号,2017-01-16,その他の設立登記法人
税理士法人Ｈ＆Ｐ,大阪府高槻市紺屋町７番８－３０１号,2017-01-16,その他の設立登記法人
竜美工業株式会社,千葉県東金市西野飛地１６０２番地１３,2017-01-16,株式会社
竹林健康コンサルティング株式会社,東京都府中市若松町５丁目６番７８号クレストフォルム東府中サウスステージ２１８,2017-01-16,株式会社
笑部合同会社,福岡県築上郡築上町大字築城１７４１番地１,2017-01-16,合同会社
第一環境労働組合兵庫県支部,兵庫県姫路市三左衛門堀西の町８２番地第一環境姫路営業所内,2017-01-16,その他の設立登記法人
美天興業株式会社,埼玉県吉川市大字吉川５４０番地エクメーネ吉川１０２,2017-01-16,株式会社
羽忱株式会社,東京都江戸川区西小岩１丁目３０番３号,2017-01-16,株式会社
脇谷技研株式会社,岐阜県高山市国府町瓜巣２１７１番地１,2017-01-16,株式会社
英運輸株式会社,埼玉県春日部市一ノ割３丁目４番３５号,2017-01-16,株式会社
菊小商会合同会社,宮城県仙台市青葉区国見２丁目２番１７号,2017-01-16,合同会社
葛尾村プロジェクト１号合同会社,福島県双葉郡葛尾村大字落合字関下１９番地２,2017-01-16,合同会社
葛尾村プロジェクト２号合同会社,福島県双葉郡葛尾村大字落合字関下１９番地２,2017-01-16,合同会社
葛尾村プロジェクト３号合同会社,福島県双葉郡葛尾村大字落合字関下１９番地２,2017-01-16,合同会社
藤田ファイナンシャルテクノロジー合同会社,神奈川県川崎市幸区下平間２１４番地１フロール川崎下平間２－７０６,2017-01-16,合同会社
角館まちづくり地域運営体,秋田県仙北市角館町岩瀬町２９,2017-01-16,その他
賽達株式会社,東京都江東区北砂５丁目１９番７号コープ野村大島１－６０４号,2017-01-16,株式会社
農事組合法人みらい二渡,岩手県奥州市水沢区黒石町字二渡４１番地１,2017-01-16,その他の設立登記法人
農事組合法人箱西,長崎県壱岐市芦辺町箱崎本村触３１７番地１,2017-01-16,その他の設立登記法人
農業生産法人合同会社丸池ファーム,沖縄県宮古島市下地字川満５５８番地２８,2017-01-16,合同会社
長田建設株式会社,東京都荒川区南千住１丁目１番２１号,2017-01-16,株式会社
ＡＪＥＬＩＹＡ　ＭＵＬＴＩ　ＴＲＡＤＥ　ＣＯＮＣＥＲＮ合同会社,東京都新宿区大久保２丁目１１番２１号,2017-01-16,合同会社
ＡＲＵＭ合同会社,広島県広島市中区八丁堀１２番２号日経ビル３階,2017-01-16,合同会社
Ａｌｔａ　Ｉｎｔｅｒｎａｔｉｏｎａｌ　Ｌａｎｋａ　Ｐｒｉｖａｔｅ　Ｌｉｍｉｔｅｄ,神奈川県厚木市山際１番地６オリエントハイツＮｏ．５－１０９,2017-01-16,外国会社等
ＢＢＣ株式会社,東京都板橋区向原１丁目２２番７－２０２号向原ハイツ,2017-01-16,株式会社
ＢＳＭ株式会社,栃木県宇都宮市立伏町９４８番地２１０,2017-01-16,株式会社
Ｂｉｔ＆Ｒｏｌｌ合同会社,東京都杉並区成田東４丁目３０番１２号,2017-01-16,合同会社
ＣＪ国際合同会社,東京都板橋区成増１丁目１３番１２－３０１号ハイネス成増,2017-01-16,合同会社
ＣＳＩ　Ｊａｐａｎ株式会社,愛知県豊田市大林町１０丁目２０番地５,2017-01-16,株式会社
Ｃｉｔｙｎｏｗ　Ａｓｉａ株式会社,東京都中央区入船１丁目７番３号池田ビル２階,2017-01-16,株式会社
Ｄ‐ｗｏｒｋｓ株式会社,滋賀県大津市玉野浦４番６９号,2017-01-16,株式会社
ＥＮＥＲＴＯＰＩＡ　ＪＡＰＡＮ株式会社,大阪府大阪市西区江戸堀２丁目１番１号江戸堀センタービル９階,2017-01-16,株式会社
ＥＶＥＲＥＳＴ合同会社,埼玉県戸田市下前１丁目７番１０－１０７号,2017-01-16,合同会社
ＦＲＥマネジメントサービス株式会社,東京都杉並区松庵３丁目１９番６号,2017-01-16,株式会社
ＧＥ株式会社,広島県福山市三之丸町７番１３号,2017-01-16,株式会社
ＧＬＨ合同会社,大阪府大阪市西成区長橋３丁目５番２６号,2017-01-16,合同会社
ＧＭＳＣａｐｉｔａｌＭａｎａｇｅｍｅｎｔ１号合同会社,東京都中央区銀座８丁目１５番２号ＡＣＮ銀座ビル８Ｆ,2017-01-16,合同会社
ＧＭＳＣａｐｉｔａｌＭａｎａｇｅｍｅｎｔ２号合同会社,東京都中央区銀座８丁目１５番２号ＡＣＮ銀座ビル８Ｆ,2017-01-16,合同会社
ＧＵＭ　ＳＵＮＧ　ＴＥＣＨ株式会社,大阪府藤井寺市春日丘３丁目１番２９－１１４号,2017-01-16,株式会社
Ｇｒａｎｔ合同会社,埼玉県所沢市寿町２３－２,2017-01-16,合同会社
ＨＲＭ株式会社,東京都港区新橋１丁目１７番１号新幸ビル４階,2017-01-16,株式会社
ＨＴプロダクション株式会社,東京都練馬区東大泉６丁目４９番２－５０２号,2017-01-16,株式会社
Ｈｉｒｏ　Ｄｅｓｉｇｎｓ合同会社,神奈川県横浜市青葉区美しが丘４丁目３２番地２４ブライトコート１０１,2017-01-16,合同会社
ＨｏｐｅＪ＆Ｐｌａｙｅｒｓ社会保険労務士法人,大阪府大阪市北区西天満５丁目１番１５号,2017-01-16,その他の設立登記法人
Ｊコーポレーション合同会社,群馬県利根郡片品村大字菅沼３６０番地,2017-01-16,合同会社
ＪＩテック株式会社,岡山県岡山市中区海吉１３１７番地２,2017-01-16,株式会社
Ｋサービス・グロウス株式会社,埼玉県熊谷市筑波３丁目１１１番地七福ビル３階,2017-01-16,株式会社
ＫＯＢＥケミカル株式会社,兵庫県神戸市北区星和台４丁目２番地の２２,2017-01-16,株式会社
Ｌ＆Ｙ株式会社,東京都葛飾区新小岩３丁目８番１０－５０５号ウインベルソロ新小岩第２,2017-01-16,株式会社
ＬＬＴコンサルティング合同会社,東京都大田区山王２丁目３番１５号山王ＭＤビルディング３Ｆ,2017-01-16,合同会社
Ｌｏｔｕｓ　Ｓｑｕｅｅｚｅ株式会社,東京都港区台場１丁目１番２－１８１０号,2017-01-16,株式会社
ＭＡＮＤＡＬＩ合同会社,栃木県栃木市河合町４－５・１階,2017-01-16,合同会社
ＮＡＴＩエンタープライズ株式会社,東京都港区新橋２丁目１６番１ニュー新橋ビル１１３１,2017-01-16,株式会社
ＮＰＯ法人ミラクルコスモス,京都府宇治市五ケ庄三番割３１番地の１２,2017-01-16,その他の設立登記法人
ＮＰＯ法人国際浮世絵文化協会,東京都中央区東日本橋２丁目１８番１３号港屋ビル内,2017-01-16,その他の設立登記法人
ＯＴＡ　ＦＡＣＴＯＲＹ株式会社,群馬県太田市高林南町６５９番地１,2017-01-16,株式会社
ＲＵＳＨ　ＷＯＲＫＳ株式会社,福岡県福岡市中央区清川１丁目９番３号,2017-01-16,株式会社
Ｒｉｋｙｕパートナーズ税理士法人,愛知県名古屋市中区栄２丁目５番１７号白川ビル東館６階,2017-01-16,その他の設立登記法人
ＳＡホールディングス株式会社,大阪府摂津市鳥飼中２丁目８番２９号,2017-01-16,株式会社
ＳＣＭあんしん保険株式会社,北海道札幌市白石区菊水上町二条２丁目５２番地,2017-01-16,株式会社
ＳＴ企画合同会社,山梨県笛吹市石和町今井８５番地,2017-01-16,合同会社
Ｔトラスト株式会社,兵庫県神戸市東灘区深江北町１丁目５番１－６０９号,2017-01-16,株式会社
ＴＥＣＨＮＯ・ＳＷＩＳＳ株式会社,東京都中央区銀座７丁目１２番４号,2017-01-16,株式会社
Ｔｈｉｒｄ　Ｓｐａｃｅ　Ｔｏｋｙｏ株式会社,東京都港区南青山６丁目９番１０－２０２号プラネット南青山,2017-01-16,株式会社
Ｙ＆Ｃ　Ｉｎｖｅｓｔｍｅｎｔ合同会社,東京都港区浜松町２丁目２番１５号浜松町ダイヤビル２Ｆ,2017-01-16,合同会社
Ｙ＆Ｙ　ＣＯＭＰＡＮＹ合同会社,東京都練馬区高松３丁目１２番９号メゾングラチーレ１０７,2017-01-16,合同会社
ＹＡＬＩ　ＳＲＩ　ＩＮＴＥＲＮＡＴＩＯＮＡＬ合同会社,千葉県印旛郡酒々井町東酒々井１丁目１番３５８－３０３号,2017-01-16,合同会社
ＺＥＳＴ株式会社,千葉県四街道市大日２２６４番地４,2017-01-16,株式会社
ｉＳａｍｕｒａｉ株式会社,大阪府泉南郡熊取町小谷南３丁目３２７,2017-01-16,株式会社
ｉｘＭａｒｋ株式会社,東京都港区六本木５丁目１８番１８号,2017-01-16,株式会社
ｔｒｉｐｏｌｉ株式会社,愛知県名古屋市東区代官町３９番２２号太洋ビル２０２号室,2017-01-16,株式会社
あいわＦＡＳ株式会社,東京都港区港南２丁目５番３号,2017-01-17,株式会社
えひめ活き生きファーマーズ株式会社,愛媛県西予市城川町魚成３６４４番地２,2017-01-17,株式会社
きらりせ株式会社,埼玉県比企郡滑川町大字都５１番地３３,2017-01-17,株式会社
ことり株式会社,大阪府枚方市出口１丁目６番２１号,2017-01-17,株式会社
じん株式会社,愛媛県松山市東垣生町３２０番地５,2017-01-17,株式会社
ひかり工業株式会社,愛知県額田郡幸田町大字相見字四十五間２７番地,2017-01-17,株式会社
ひがしくろべ楽童,三重県松阪市垣内田町６番地１東黒部小学校内,2017-01-17,その他
みどり持株会,神奈川県海老名市上郷４丁目３－１,2017-01-17,その他
やめエネルギー株式会社,福岡県八女市吉田１６４５番地４,2017-01-17,株式会社
よりあいサポート株式会社,大阪府岸和田市磯上町２丁目１４番１８号,2017-01-17,株式会社
アイテック工房合同会社,神奈川県横浜市鶴見区矢向６丁目９番地２２,2017-01-17,合同会社
アストライズ株式会社,京都府京都市伏見区東堺町４８８番地,2017-01-17,株式会社
アソシエホールディングス株式会社,石川県野々市市北西部土地区画９５街区３０番,2017-01-17,株式会社
アビタシオン合同会社,神奈川県横浜市西区北幸１丁目１１番１号水信ビル７階,2017-01-17,合同会社
アロナ合同会社,茨城県水戸市泉町３丁目６番３号,2017-01-17,合同会社
アンメアー株式会社,兵庫県三田市中内神３９８番地２,2017-01-17,株式会社
アースアンドベジ株式会社,愛知県豊川市伊奈町新屋８５番地１,2017-01-17,株式会社
アース建築株式会社,長崎県島原市親和町丁２６６１番地２,2017-01-17,株式会社
ウィルコスメ株式会社,福岡県田川郡香春町大字採銅所１３３４番地２,2017-01-17,株式会社
エイトビート株式会社,東京都港区六本木２丁目２番２号イトーピア六本木７０７号,2017-01-17,株式会社
エムティマネジメント合同会社,熊本県熊本市中央区白山２丁目１番１号白山堂ビル３０２,2017-01-17,合同会社
オクト株式会社,東京都中央区日本橋浜町２丁目１３番６号,2017-01-17,株式会社
キックスタート株式会社,東京都新宿区天神町３６番地１,2017-01-17,株式会社
キリン塾合同会社,兵庫県神戸市東灘区御影２丁目２６番１２号,2017-01-17,合同会社
クリアロータス合同会社,埼玉県和光市白子３丁目２５番５５号プルメリアＢ２０３,2017-01-17,合同会社
クロスオーバー株式会社,東京都渋谷区渋谷２丁目１２－１９東建インターナショナルビル本館３Ｆ,2017-01-17,株式会社
コングレート株式会社,東京都杉並区成田東５丁目１９番５号,2017-01-17,株式会社
コンテンツブリッジ株式会社,東京都渋谷区代々木５丁目２８番１０号,2017-01-17,株式会社
サム合同会社,埼玉県蕨市中央２丁目２番１５号蕨セントラルハイツ２０４号室,2017-01-17,合同会社
シティバンク，エヌ・エイ,東京都千代田区丸の内１丁目５番１号,2017-01-17,外国会社等
セイワテック合同会社,千葉県市川市福栄３丁目２３番１号２０７,2017-01-17,合同会社
セデスジャパン株式会社,東京都千代田区平河町２丁目６番１号平河町ビル７階,2017-01-17,株式会社
セリエメンテナンス,栃木県宇都宮市下荒針町３７８７,2017-01-17,その他
ソフトエンジェル合同会社,兵庫県神戸市中央区栄町通７丁目１番１０号エクセレンス西元町５０５号,2017-01-17,合同会社
ソーシャルパワーズ株式会社,福岡県北九州市小倉南区湯川新町３丁目１４番１０号,2017-01-17,株式会社
チケットベンダー相模原合同会社,神奈川県相模原市中央区矢部１丁目１５番２２号,2017-01-17,合同会社
テクネ合同会社,岩手県盛岡市上田１丁目１４番３１号,2017-01-17,合同会社
テンパーズ合同会社,東京都江東区亀戸５丁目６番２１号,2017-01-17,合同会社
テンライズ株式会社,栃木県佐野市高萩町１３３７番地１ポレスター佐野新都市７０４号,2017-01-17,株式会社
トータルプロデュース・レアイナ合同会社,兵庫県西宮市大谷町１１番３３－４０１号,2017-01-17,合同会社
ドリーム株式会社,神奈川県横浜市戸塚区吉田町１３８番地６,2017-01-17,株式会社
パドルクリエイティブキャスト株式会社,東京都港区南青山２丁目１８番２号,2017-01-17,株式会社
ヒノデ産業株式会社,大阪府大阪市浪速区元町３丁目４番１６号ナンバスリーエコー１階,2017-01-17,株式会社
ヒムカフーズ株式会社,宮崎県宮崎市大字小松２３７番地６７,2017-01-17,株式会社
ビアフェス信州実行委員会,長野県松本市中央３丁目４－２１,2017-01-17,その他
ビズネクシア合同会社,東京都渋谷区幡ヶ谷３丁目３９番１２号渋谷ウェストビル１階,2017-01-17,合同会社
ビーグッド株式会社,東京都中央区日本橋人形町１丁目８番２号,2017-01-17,株式会社
ファルミナペットフーズ・ジャパン株式会社,東京都港区芝５丁目２９番２０号,2017-01-17,株式会社
フラワーエステート株式会社,大阪府堺市堺区甲斐町東３丁１番１号,2017-01-17,株式会社
ブラッサム株式会社,兵庫県西宮市甲子園六石町１番１７号２０３,2017-01-17,株式会社
ブランニューデイ株式会社,東京都東久留米市柳窪２丁目６番４号ビューハイム武蔵野２１２,2017-01-17,株式会社
ブルーリーフ株式会社,神奈川県横浜市青葉区荏子田２丁目３３番地２０,2017-01-17,株式会社
ブルー・コンサル株式会社,東京都品川区東五反田１丁目２５番１２－４０１号,2017-01-17,株式会社
ベストウェイインタナショナルメディカル株式会社,東京都中央区勝どき２丁目８番１２号東京ＢＵＣ中銀１２３３号室,2017-01-17,株式会社
マンションクリエイト株式会社,静岡県浜松市中区住吉２丁目７番４０７号,2017-01-17,株式会社
ミツワ株式会社,京都府京都市伏見区上板橋町４８６－２－８,2017-01-17,株式会社
ヤマキ企業年金基金,愛媛県伊予市米湊１６９８番地の６,2017-01-17,その他
ユナイテッドブレインズ株式会社,東京都江東区豊洲３丁目４番１号,2017-01-17,株式会社
ユーナツーリズム合同会社,東京都港区六本木３丁目２番２号六本木グランドタワー９０８号,2017-01-17,合同会社
ラック株式会社,東京都渋谷区桜丘町１５番３号,2017-01-17,株式会社
リケン柏崎持株会,新潟県柏崎市田塚３丁目２番５７号柏崎リケン協力工場協同組合内,2017-01-17,その他
リーディングプロジェクト創造事業企画委員会,鹿児島県鹿児島市鴨池新町１０－１（県庁生活・文化課内）,2017-01-17,その他
リードクリエーション株式会社,京都府京都市左京区上高野下荒蒔町６番地３藤和宝ケ池ホームズ３０１,2017-01-17,株式会社
ワイズ合同会社,愛知県海部郡大治町大字花常字フケ４５番地の３－１０１,2017-01-17,合同会社
ワイ・アイ合同会社,沖縄県那覇市おもろまち１丁目１番２５－２０２２号,2017-01-17,合同会社
ワジラインターナショナル株式会社,栃木県足利市八幡町７８１番地ペアシティ塚原Ａ２０１,2017-01-17,株式会社
ワークアウト株式会社,長野県佐久市岩村田２００７番地２,2017-01-17,株式会社
一嶺株式会社,岡山県岡山市南区泉田１丁目４番５号,2017-01-17,株式会社
一般社団法人くまもと音楽復興支援１００人委員会,熊本県熊本市北区龍田３丁目３２番１８号,2017-01-17,その他の設立登記法人
一般社団法人ちせ,北海道帯広市西十六条南３１丁目７番地２８,2017-01-17,その他の設立登記法人
一般社団法人ゆぴか,栃木県宇都宮市豊郷台３丁目６７番地２,2017-01-17,その他の設立登記法人
一般社団法人アルファＬｉｎｋ,岐阜県岐阜市加納神明町５丁目８番地コーポあおぎり２０３号室,2017-01-17,その他の設立登記法人
一般社団法人グローバル看護教育＆研究プロジェクト,群馬県高崎市北原町５９７番地１,2017-01-17,その他の設立登記法人
一般社団法人セオロジークライスト会,埼玉県鶴ヶ島市大字上広谷１４２番地１２８,2017-01-17,その他の設立登記法人
一般社団法人ドクターキッドジャパン,東京都千代田区神田和泉町１番地６の２,2017-01-17,その他の設立登記法人
一般社団法人ハッピネス・ランド,愛知県額田郡幸田町大字横落字郷中１７番地１,2017-01-17,その他の設立登記法人
一般社団法人ヒラノホールディングス,静岡県浜松市浜北区平口２５１５番地,2017-01-17,その他の設立登記法人
一般社団法人リニューアブルエナジーファイナンス,東京都千代田区三番町５番４０号税理士法人和内,2017-01-17,その他の設立登記法人
一般社団法人一橋総合安全保障研究所,東京都千代田区九段北１丁目１５番１４号,2017-01-17,その他の設立登記法人
一般社団法人中国腎不全研究会,東京都中央区日本橋茅場町２丁目４番５号,2017-01-17,その他の設立登記法人
一般社団法人十可苑,佐賀県佐賀市末広１丁目１０番１号,2017-01-17,その他の設立登記法人
一般社団法人日本女性起業コンサルタント育成協会,東京都足立区足立４丁目２０－１２,2017-01-17,その他の設立登記法人
一般社団法人東京都ドラゴンボート協会,東京都港区芝４丁目６番１７号,2017-01-17,その他の設立登記法人
一般社団法人次世代エンジニア育成協会,東京都千代田区神田多町２丁目２番２２号千代田ビル５階,2017-01-17,その他の設立登記法人
一般社団法人沖永良部島ケイビングガイド連盟,鹿児島県大島郡知名町大字知名５２０番地おきのえらぶフローラル館,2017-01-17,その他の設立登記法人
一般社団法人海洋航空操縦士育成協会,東京都港区三田３丁目５番２１号,2017-01-17,その他の設立登記法人
一般社団法人神奈川県介護支援専門員協会,神奈川県横浜市中区山下町２３番地,2017-01-17,その他の設立登記法人
一般社団法人訪問看護エデュケーションパーラー,東京都目黒区鷹番３丁目８番５号豊島ビル３階,2017-01-17,その他の設立登記法人
一般社団法人道徳とマナー協会,東京都港区南青山２丁目２－１５,2017-01-17,その他の設立登記法人
一般社団法人障がい者就労・就学支援協会仰空会,大阪府茨木市並木町１８番４０号ハイツ並木１０２号室,2017-01-17,その他の設立登記法人
