法人名,住所,設立日,法人種別
株式会社きこと,東京都豊島区北大塚３丁目１３番７号,2026-05-18,株式会社
株式会社つなぎぷらす,東京都港区三田３丁目３番２号田中ビル１階,2026-05-18,株式会社
株式会社なりわい,長崎県大村市中岳町１７９０,2026-05-18,株式会社
株式会社ほのやま,大阪府大阪市北区堂島１丁目２番２５号谷安フォースビル５階,2026-05-18,株式会社
株式会社みかえる,兵庫県尼崎市西立花町１丁目１１番３６号,2026-05-18,株式会社
株式会社みどり,神奈川県横浜市港南区上永谷４丁目２番１４号,2026-05-18,株式会社
株式会社みのり,東京都葛飾区金町５丁目１４番６号,2026-05-18,株式会社
株式会社アイディリック,福島県郡山市桑野４丁目８番９号Ｒａｋビル３０４,2026-05-18,株式会社
株式会社アイルビー,長崎県諫早市天満町１３－１８寺下ビル２０２,2026-05-18,株式会社
株式会社アクセルマーケティング,東京都港区南青山２丁目２番８号ＤＦビル５階,2026-05-18,株式会社
株式会社アザーエスピダ,東京都中野区南台２丁目２３番３号,2026-05-18,株式会社
株式会社アスウィル,東京都世田谷区三宿１丁目９番８号,2026-05-18,株式会社
株式会社アドバンアネックス,長野県上田市上野３０８番地３４,2026-05-18,株式会社
株式会社アマノキャピタル,大阪府大阪市中央区北浜３丁目６番２２号,2026-05-18,株式会社
株式会社アルファ,千葉県市川市相之川１丁目２５－１３,2026-05-18,株式会社
株式会社アンクルボブ,神奈川県横浜市都筑区早渕３丁目３４番３８号,2026-05-18,株式会社
株式会社アンリット,東京都荒川区西尾久１丁目３０番４号セレンディピティ田端１０２,2026-05-18,株式会社
株式会社アヴァンツァーレ,大阪府大阪市浪速区日本橋４丁目１６番６号奥村ビル３階,2026-05-18,株式会社
株式会社アールモード,大阪府豊中市新千里東町２丁目４番Ｄ６－２０２号,2026-05-18,株式会社
株式会社イエマク,石川県金沢市松村６丁目１２２番地,2026-05-18,株式会社
株式会社イノビード,大阪府大阪市中央区大手通１丁目２－１０－１１０２,2026-05-18,株式会社
株式会社エトワール,兵庫県神戸市中央区神仙寺通１丁目４番１２号,2026-05-18,株式会社
株式会社エムエー,埼玉県川口市戸塚境町３番２号,2026-05-18,株式会社
株式会社エムダブリューキャリア,東京都目黒区目黒３丁目４－１６－２０７,2026-05-18,株式会社
株式会社エムテック,大阪府羽曳野市南恵我之荘４丁目８番１０号,2026-05-18,株式会社
株式会社エルズドルチェ,東京都中野区南台２丁目２３番３号,2026-05-18,株式会社
株式会社エルズＬ２,東京都中野区南台２丁目２３番３号,2026-05-18,株式会社
株式会社エルズＬＥＸ,東京都中野区南台２丁目２３番３号,2026-05-18,株式会社
株式会社エルズＬＳＰ,東京都中野区南台２丁目２３番３号,2026-05-18,株式会社
株式会社エーショー,福島県郡山市咲田１丁目１０番１５号,2026-05-18,株式会社
株式会社エージェントゼロ,東京都港区新橋２丁目１６番１号,2026-05-18,株式会社
株式会社オストアンデル,東京都港区北青山１丁目３番１号アールキューブ青山３階,2026-05-18,株式会社
株式会社カレウマ,東京都世田谷区上馬２丁目１番４－１２０１号,2026-05-18,株式会社
株式会社クラピカファーム,北海道新冠郡新冠町字万世１７１番地の２,2026-05-18,株式会社
株式会社クローバー,埼玉県久喜市六万部１０６９番地６,2026-05-18,株式会社
株式会社ケープランニング,岐阜県美濃加茂市山之上町７９２１番地,2026-05-18,株式会社
株式会社コアポイント,千葉県柏市光ケ丘団地２番１－２１４号,2026-05-18,株式会社
株式会社ココローカン,大阪府堺市堺区山本町１丁２０番地１（４２１号）,2026-05-18,株式会社
株式会社コパサン,東京都中央区銀座８丁目７番１７号６Ｆ,2026-05-18,株式会社
株式会社コルネットロッソ,東京都板橋区小茂根２丁目１７番４号,2026-05-18,株式会社
株式会社サニング,北海道北斗市久根別１丁目２０番９号,2026-05-18,株式会社
株式会社サムズアップ不動産,大阪府枚方市養父東町１８番２６号京阪ビル２階,2026-05-18,株式会社
株式会社シャイニーファイト,東京都豊島区南大塚２丁目３５番１０号６０１,2026-05-18,株式会社
株式会社シャイン,千葉県松戸市上本郷９１４番地の１リベイラ北松戸４０１号,2026-05-18,株式会社
株式会社シンシン,東京都渋谷区道玄坂１丁目１６－６二葉ビル８ｂ,2026-05-18,株式会社
株式会社ジュアンジャパン,東京都港区北青山３丁目７番１号カオスビル１Ｆ,2026-05-18,株式会社
株式会社スピリットホーム,神奈川県横浜市港北区新横浜２丁目３番１２号新横浜スクエアビル１４階,2026-05-18,株式会社
株式会社スリーピース,北海道千歳市勇舞８丁目６番１３号,2026-05-18,株式会社
株式会社セイブステージ,栃木県足利市福居町３２７番地ピアステージ足利１０３号,2026-05-18,株式会社
株式会社ダッシュ,岐阜県岐阜市福住町２丁目７番地２－１４０２号,2026-05-18,株式会社
株式会社ダン・デュ・ボヌール,石川県金沢市鞍月３丁目１０１番地,2026-05-18,株式会社
株式会社ツツミホールディングス,広島県広島市中区幟町１３番１５号新広島ビルディング１階,2026-05-18,株式会社
株式会社トキ,東京都新宿区神楽坂６丁目８番地,2026-05-18,株式会社
株式会社トリエント・ホールディングス,東京都中央区日本橋本石町４丁目３番１５号,2026-05-18,株式会社
株式会社トーストプラネット,埼玉県さいたま市大宮区桜木町２丁目３番地大宮マルイ７階,2026-05-18,株式会社
株式会社ナポ,東京都港区赤坂６丁目１２番１４ー４０３号,2026-05-18,株式会社
株式会社ネオヴィアＡ,東京都千代田区内神田１丁目４番１０号,2026-05-18,株式会社
株式会社ネオヴィアＢ,東京都千代田区内神田１丁目４番１０号,2026-05-18,株式会社
株式会社ハイケアグループ,東京都板橋区大山金井町３５番５号,2026-05-18,株式会社
株式会社ハシゴダカ,東京都千代田区飯田橋２丁目１―２,2026-05-18,株式会社
株式会社パラレル,大阪府南河内郡千早赤阪村大字小吹６８番地５６８,2026-05-18,株式会社
株式会社ヒトミル,静岡県浜松市中央区板屋町１０２番１５,2026-05-18,株式会社
株式会社フォート．レス,東京都江戸川区春江町３丁目２２番１６号,2026-05-18,株式会社
株式会社フジミエージェンシー,兵庫県神戸市西区糀台５丁目５番地の１,2026-05-18,株式会社
株式会社フレックスくん,大阪府大阪市北区梅田１丁目２番２号大阪駅前第２ビル１２－１２,2026-05-18,株式会社
株式会社フローレント,東京都世田谷区下馬５丁目１６番２号,2026-05-18,株式会社
株式会社ブリリアント,埼玉県さいたま市南区別所２丁目２１番５号,2026-05-18,株式会社
株式会社ブルームア,岐阜県高山市日の出町２丁目６７番地１,2026-05-18,株式会社
株式会社プロクシア,静岡県静岡市清水区高橋５丁目１－６３,2026-05-18,株式会社
株式会社プロスエア,神奈川県平塚市菫平５番１,2026-05-18,株式会社
株式会社プロフィットエンジン,東京都豊島区東池袋２丁目６２番８号ＢＩＧオフィスプラザ池袋１２０６,2026-05-18,株式会社
株式会社ミアス,東京都渋谷区道玄坂１丁目１０番８号,2026-05-18,株式会社
株式会社ミスちゅーずみ,東京都中野区南台２丁目２３番３号,2026-05-18,株式会社
株式会社ミスウェーブ,東京都中野区南台２丁目２３番３号,2026-05-18,株式会社
株式会社ミスコロン,東京都中野区南台２丁目２３番３号,2026-05-18,株式会社
株式会社ミス青春,東京都中野区南台２丁目２３番３号,2026-05-18,株式会社
株式会社ミスＰＱ,東京都中野区南台２丁目２３番３号,2026-05-18,株式会社
株式会社ミツテック,大阪府泉佐野市松原２丁目４－１５８,2026-05-18,株式会社
株式会社ヤスダビジョン,大阪府大阪市浪速区塩草３丁目２番２６号,2026-05-18,株式会社
株式会社ヤマショウ,長崎県長崎市伊良林３丁目１０－２,2026-05-18,株式会社
株式会社ヤマトホーム南予,愛媛県宇和島市明倫町５丁目６番１９号,2026-05-18,株式会社
株式会社ライラック,神奈川県横浜市港北区新横浜２丁目５－１４ＷＩＳＥＮＥＸＴ新横浜３Ｆ,2026-05-18,株式会社
株式会社ラシクスタジオ,青森県八戸市大字妙字坂中４１番地３,2026-05-18,株式会社
株式会社リトエ,神奈川県川崎市中原区井田三舞町１０番３９号スカイビュー元住吉３０１,2026-05-18,株式会社
株式会社リバティ,静岡県伊豆市年川７０１番地の１,2026-05-18,株式会社
株式会社リバース,埼玉県入間市大字新久４４１番地２,2026-05-18,株式会社
株式会社リファクタ,宮崎県宮崎市橘通西３丁目１０－３２宮崎ナナイロ東館８Ｆ,2026-05-18,株式会社
株式会社レゾン,東京都江戸川区西小岩５丁目１１番１４号,2026-05-18,株式会社
株式会社ヴィオラ,大阪府大阪市西区南堀江１丁目１９番７号,2026-05-18,株式会社
株式会社三電,東京都板橋区前野町３丁目４番１０号,2026-05-18,株式会社
株式会社上口デザイン企画室,東京都世田谷区等々力７丁目３番７号東急ドエルアルス等々力ネクステージ１０２,2026-05-18,株式会社
株式会社二刀流プランニング,京都府京都市伏見区村上町３９４－４０７,2026-05-18,株式会社
株式会社仁都,大阪府大阪市淀川区西宮原１丁目７番７号,2026-05-18,株式会社
株式会社伊藤農場,三重県四日市市水沢町２７６２番地,2026-05-18,株式会社
株式会社佐丸技術士事務所,東京都豊島区目白２丁目１５番６号,2026-05-18,株式会社
株式会社佐藤水工,神奈川県横須賀市西浦賀３丁目２番１９号,2026-05-18,株式会社
株式会社信紡商店,東京都港区西麻布４丁目１３番５号グレイスフル西麻布１０１,2026-05-18,株式会社
株式会社加納管理,千葉県浦安市富士見４丁目３番７号,2026-05-18,株式会社
株式会社加藤ホールディングス,岐阜県安八郡安八町南條１２８０番地１,2026-05-18,株式会社
株式会社卍カンパニー,東京都世田谷区太子堂２丁目４－１６テラスコート三軒茶屋５０３号,2026-05-18,株式会社
株式会社嘉裕商事,千葉県市川市南八幡４丁目７番３－８０１号,2026-05-18,株式会社
株式会社埼玉新築サポートセンター,埼玉県桶川市東２丁目６番２２号,2026-05-18,株式会社
株式会社大弘社,大分県大分市大字津留１９１１番地の２,2026-05-18,株式会社
株式会社大石組,兵庫県姫路市西二階町５６番地ハイツ西二階町１階１０１号室,2026-05-18,株式会社
株式会社宇佐美温泉開発,東京都新宿区新宿３丁目１番２４号,2026-05-18,株式会社
株式会社宮川建設,神奈川県三浦市南下浦町上宮田４４９番地４,2026-05-18,株式会社
株式会社宮工務店,埼玉県川口市大字西新井宿４９９番地の５,2026-05-18,株式会社
株式会社山下アセット,静岡県浜松市中央区東伊場１丁目１番２６号,2026-05-18,株式会社
株式会社幸,福岡県遠賀郡水巻町二西２丁目４番２４号,2026-05-18,株式会社
株式会社怜和,静岡県浜松市中央区安松町３０２１番地の１,2026-05-18,株式会社
株式会社惺粋,東京都台東区北上野２丁目４番３号,2026-05-18,株式会社
株式会社早川建築設計事務所,静岡県静岡市清水区鳥坂１２２５－２、２Ｆ,2026-05-18,株式会社
株式会社木更津魚市場,千葉県君津市東坂田４丁目３番３号,2026-05-18,株式会社
株式会社柚木重量,大阪府大阪市淀川区野中北１丁目１３番２－１３０８号,2026-05-18,株式会社
株式会社柳田組,群馬県前橋市総社町２丁目１５番地２－１号,2026-05-18,株式会社
株式会社桜,大阪府枚方市長尾西町２丁目６２番７号,2026-05-18,株式会社
株式会社求肥屋,大阪府大阪市浪速区元町３丁目１３－９ＵＲＢＡＮＰＡＲＫ難波南１０２,2026-05-18,株式会社
株式会社江戸太神楽鏡味家,東京都世田谷区上馬５丁目１９番４号,2026-05-18,株式会社
株式会社珀,岡山県苫田郡鏡野町吉原２番地の１,2026-05-18,株式会社
株式会社白石商会,東京都江戸川区鹿骨４丁目２９－５,2026-05-18,株式会社
株式会社白鳥金属,岐阜県郡上市白鳥町白鳥１０９０番地１,2026-05-18,株式会社
株式会社皐月電業,岐阜県安八郡輪之内町本戸３２番地の１,2026-05-18,株式会社
株式会社石山建設工業,北海道札幌市南区川沿十三条２丁目３番８号ＫＳビル,2026-05-18,株式会社
株式会社空手道,大阪府大阪市中央区天満橋京町２番１５号,2026-05-18,株式会社
株式会社結久,千葉県木更津市富士見２丁目１番１５号・赤煉瓦ＯＭＯ・Ａ号室,2026-05-18,株式会社
株式会社総合補償企画センター,大阪府大阪市中央区島之内１丁目１０番１５号,2026-05-18,株式会社
株式会社緑匠,大阪府東大阪市岩田町４丁目１６番１８号,2026-05-18,株式会社
株式会社緑向,大阪府池田市東山町４８１番地の１,2026-05-18,株式会社
株式会社翔英コーポレーション,東京都板橋区小豆沢２丁目３６番１５－３０５号,2026-05-18,株式会社
株式会社脇坂サッシ工業,北海道北見市美山町西４丁目１０６番地５９,2026-05-18,株式会社
株式会社荒木電気,福岡県春日市若葉台東３丁目３０番地３０６号,2026-05-18,株式会社
株式会社藤野,埼玉県川口市戸塚東２丁目１番２６号,2026-05-18,株式会社
株式会社虎の巻,東京都渋谷区恵比寿西２丁目８番４号ＥＸ恵比寿西ビル５階,2026-05-18,株式会社
株式会社虹色,東京都中央区銀座１丁目１２番４号Ｎ＆ＥＢＬＤ６Ｆ,2026-05-18,株式会社
株式会社財務パートナーズ,福岡県福岡市博多区博多駅中央街５番３号ホテルクリオコート博多２階,2026-05-18,株式会社
株式会社高ちゃん共和国,岐阜県海津市平田町蛇池９５番地,2026-05-18,株式会社
株式会社鳴る靴,東京都渋谷区神南１丁目１１－４ＦＰＧリンクス神南５階,2026-05-18,株式会社
株式会社１０Ｎ,千葉県船橋市みやぎ台１丁目２番８号,2026-05-18,株式会社
株式会社１５１９１２,東京都港区南青山５丁目１７番１２号リオン南青山３０１,2026-05-18,株式会社
株式会社２ｎｄライフ,千葉県市川市本北方１丁目２９番７号,2026-05-18,株式会社
株式会社６２１,群馬県佐波郡玉村町大字上茂木１２０番地３,2026-05-18,株式会社
株式会社ＡＲＡｃｏｒｐｏｒａｔｉｏｎ,東京都大田区上池台５丁目１４－８－４０３,2026-05-18,株式会社
株式会社ＡＵＲＥＳＴ,千葉県流山市おおたかの森北１丁目４番地の１ソライエグラン流山おおたかの森１２７,2026-05-18,株式会社
株式会社ＡＹＲ,神奈川県横浜市緑区台村町１８６番地,2026-05-18,株式会社
株式会社Ａｇｅｎｏｔａｋｕｍｉ　Ｆｏｏｄｓ,兵庫県神戸市須磨区須磨浦通４丁目６番１５号,2026-05-18,株式会社
株式会社ＡｇｒｉＣｏｎｎｅｃｔ湘南,神奈川県足柄上郡開成町宮台６４６番地,2026-05-18,株式会社
株式会社Ａｉ‐Ｈａｔｃｈ,東京都品川区上大崎１丁目１－１７－６１１,2026-05-18,株式会社
株式会社Ａｌｔｅｒ,兵庫県姫路市飾磨区今在家３丁目２４５番地５,2026-05-18,株式会社
株式会社ＡｌｔｅｒＬｅａｇｕｅ,東京都渋谷区円山町５番５号Ｎａｖｉ渋谷Ｖ３階,2026-05-18,株式会社
株式会社Ａｍａｎｉｔｙ,福岡県福岡市中央区地行２丁目１２番３４－１０７号クレアハイライズ地行,2026-05-18,株式会社
株式会社Ａｎｙ　Ｃ,大阪府大阪市平野区加美東４丁目１２番２８号リビングタウン加美東Ａ棟１０２号,2026-05-18,株式会社
株式会社Ａｕｔｕｍｎ　Ｃｒｅｓｔ,東京都渋谷区道玄坂１丁目１０番８号渋谷道玄坂東急ビル２Ｆ－Ｃ,2026-05-18,株式会社
株式会社Ｂ．ＣＡＶＥ　ＪＡＰＡＮ,東京都品川区大崎３丁目１４番３４号プラスワン４０２,2026-05-18,株式会社
株式会社ＢＥＡＲ　ＣＬＡＷ,北海道帯広市西十七条南４１丁目６－１８,2026-05-18,株式会社
株式会社ＢＥＬＩＡ,埼玉県草加市松原２丁目３番１－６１７号,2026-05-18,株式会社
株式会社ＢＥＬＬＯ,埼玉県所沢市大字南永井９３９－１,2026-05-18,株式会社
株式会社ＢＯＳＳ,埼玉県草加市手代３丁目５０番２１号,2026-05-18,株式会社
株式会社ＢＲＹ,京都府長岡京市長法寺山ノ下２番地,2026-05-18,株式会社
株式会社Ｂｅｉｇｅ,東京都豊島区東池袋１丁目３４番５号いちご東池袋ビル６階,2026-05-18,株式会社
株式会社Ｂｅｙｏｎｄ　Ｉｎｔｅｌｌｉｇｅｎｃｅ,東京都中央区銀座１丁目１２番４号Ｎ＆Ｅ，ＢＬＤ．６Ｆ,2026-05-18,株式会社
株式会社Ｂｌｕｅ　Ｈｏｕｒ　Ｌｉｖｉｎｇ,東京都立川市富士見町５丁目１９番１号,2026-05-18,株式会社
株式会社Ｂｒｉｄｇｅ　Ｗｏｒｋｓ　Ｊａｐａｎ,大阪府大阪市北区大淀南２丁目２番９－４５０９号,2026-05-18,株式会社
株式会社ＣＡＴＡＬ,東京都文京区関口１丁目２３番６－４２７号,2026-05-18,株式会社
株式会社ＣＨＡＮＣＥ,東京都品川区上大崎３丁目１４－３０,2026-05-18,株式会社
株式会社ＣＩＮＮＯ,大阪府大東市新田境町２番５号,2026-05-18,株式会社
株式会社ＣｌｏｖｅｒＳｔｅｐ,大阪府富田林市寿町２丁目３番４号,2026-05-18,株式会社
株式会社Ｃｙａｎ,岐阜県多治見市市之倉町７丁目４１番地,2026-05-18,株式会社
株式会社ＤＧ１,東京都中央区銀座１丁目１２番４号Ｎ＆ＥＢＬＤ．６Ｆ,2026-05-18,株式会社
株式会社ＥＤＵＣＡＴＩＯＮ　ＳＹＳＴＥＭ,千葉県船橋市習志野台４丁目１１番６号マルトミビル３０１号室,2026-05-18,株式会社
株式会社ＥＬＥＶＥＮ　ＡＳＳＥＴＳ,大阪府大阪市中央区本町橋２番２３号,2026-05-18,株式会社
株式会社ＥＮＩＲＥＸ,東京都港区南青山３丁目１０番４１号ジュエル青山ビル２０２号,2026-05-18,株式会社
株式会社Ｅｑｕａｓ,大阪府和泉市伯太町４丁目１５番３３号,2026-05-18,株式会社
株式会社ＦＡＮ　Ｆａｒｅ　Ｐｌｕｓ,福岡県久留米市国分町１１６８番地９,2026-05-18,株式会社
株式会社Ｆｂｒｏ,大阪府大阪市西区江之子島１丁目１‐９エルベロワイヤル１３１１,2026-05-18,株式会社
株式会社Ｆｒｅｉ,大阪府大阪市北区大淀中５丁目１２番４３号,2026-05-18,株式会社
株式会社Ｆｕｋｕｒｏ,大阪府大阪市西区新町１丁目７番３号,2026-05-18,株式会社
株式会社Ｇ‐ＬＩＦＥ,埼玉県大里郡寄居町大字鉢形３１番地１０,2026-05-18,株式会社
株式会社ＧＡＴＥ　ｍａｒｏｎ,大阪府大阪市生野区巽東４丁目１番３６号アバンティオ北巽１０３,2026-05-18,株式会社
株式会社ＧＬＢ,東京都江東区亀戸５丁目３０番１１号Ａ１０１,2026-05-18,株式会社
株式会社ＧＮＩ,大阪府大阪市中央区本町２丁目３番６号９階,2026-05-18,株式会社
株式会社ＧＯＥＮＳＴＡＹ,東京都渋谷区神宮前２丁目３０－８エイテイ神宮２０１,2026-05-18,株式会社
株式会社ＧＲＥＥＮ　ＨＵＧ,東京都港区高輪４丁目７番１２‐３０３号,2026-05-18,株式会社
株式会社ＧＴ,千葉県四街道市大日８２８－３,2026-05-18,株式会社
株式会社Ｇｅｎｅｓｉｓ,広島県呉市焼山中央１丁目６番２号,2026-05-18,株式会社
株式会社Ｈ・Ｙ・Ｓ,香川県綾歌郡綾川町陶１３６２番地２,2026-05-18,株式会社
株式会社ＨＡＫＵＲＯＫＵ,東京都渋谷区神宮前６丁目２３－４桑野ビル２Ｆ,2026-05-18,株式会社
株式会社ＨＩＫＡＬＯＧＩ,東京都国立市東１丁目１５番地の１１－４４８ビル３Ｆ,2026-05-18,株式会社
株式会社ＨＩＮＡＴＡ,東京都渋谷区恵比寿西２丁目８番４号ＥＸ恵比寿西ビル５階,2026-05-18,株式会社
株式会社ＨＯＭＡＲＥ,大阪府池田市石橋２丁目１５番２７号,2026-05-18,株式会社
株式会社ＨＯＴＡＲＵ,新潟県新潟市西蒲区押付４０５番地,2026-05-18,株式会社
株式会社ＨＲ　Ｂａｓｅ　Ｃ,神奈川県小田原市府川９４番地の８,2026-05-18,株式会社
株式会社ＨＴＳ,埼玉県さいたま市西区大字西遊馬４０２－１レオパレスグリーンハイツ２号館１０５,2026-05-18,株式会社
株式会社Ｈａｃｏｍａｃｏ,愛知県名古屋市東区泉１丁目１４番６－８０２号,2026-05-18,株式会社
株式会社Ｈｕｎｇｒｙ　Ｂａｓｅ,三重県四日市市北野町７０―１,2026-05-18,株式会社
株式会社ＩＡ,東京都渋谷区神南１丁目１０番７号第２工業ビル３階,2026-05-18,株式会社
株式会社ＩＲＩ,東京都世田谷区北烏山６丁目４番１３号,2026-05-18,株式会社
株式会社Ｊ．ＣＲＡＣＫ,宮城県仙台市青葉区赤坂３丁目４番地の７,2026-05-18,株式会社
株式会社Ｋ＆Ｋインベストメント,神奈川県横浜市神奈川区栄町１０番地３５ザ・ヨコハマタワーズＷ２１０９号,2026-05-18,株式会社
株式会社ＫＥフェイス,東京都板橋区大山町３７番１号,2026-05-18,株式会社
株式会社ＫＫ商事,東京都江戸川区南小岩４丁目１３番１９号,2026-05-18,株式会社
株式会社ＫＳＫ,千葉県浦安市高洲６丁目２－３－１１３,2026-05-18,株式会社
株式会社ＫＵＲＵＭＡ　ＰＬＵＳ,福岡県田川市大字猪国１９８２番地２,2026-05-18,株式会社
株式会社ＫＺａｒｔ,香川県綾歌郡宇多津町浜一番丁６番地７メゾン・ド・グランＡ２０３,2026-05-18,株式会社
株式会社ＫｅｙＡｃｅ,東京都世田谷区上馬３丁目１４－９－２０５,2026-05-18,株式会社
株式会社ＫｉＫ,埼玉県越谷市大字下間久里５３３番地６,2026-05-18,株式会社
株式会社Ｋｉｒａｒｉ　Ｆｕｋｕｏｋａ,福岡県福岡市中央区笹丘２丁目８番２９号,2026-05-18,株式会社
株式会社Ｋｎｏｔ　Ｒｅｓｏｕｒｃｅ,東京都港区三田５丁目２番２２－１１０１号,2026-05-18,株式会社
株式会社ＬＡＳＩＡ,兵庫県姫路市市之郷１０４２－１ＥＸＣＩＡ東姫路駅前５０６,2026-05-18,株式会社
株式会社ＬＩＦＥＢＡＳＥ,神奈川県横浜市青葉区千草台２番地１４,2026-05-18,株式会社
株式会社ＬＩＧＨＴ　ＷＡＹ,広島県東広島市西条町助実１６８８－２０,2026-05-18,株式会社
株式会社ＬＩＮＥｄｏｔ．,東京都港区南青山３丁目１番３６号青山丸竹ビル６Ｆ,2026-05-18,株式会社
株式会社ＬＩＯＮＳ,埼玉県さいたま市大宮区仲町１丁目８８番地菊水ビル２階,2026-05-18,株式会社
株式会社ＬＯＴＵＳ,福井県敦賀市津内町１丁目５番５号,2026-05-18,株式会社
株式会社ＬＳ　Ｃｏｎｓｕｌｔｉｎｇ,大阪府大阪市中央区淡路町４丁目５番８－１２０３号,2026-05-18,株式会社
株式会社Ｌａ　ｓｔａｔｉｏｎ,埼玉県草加市柿木町６００番地２,2026-05-18,株式会社
株式会社Ｌｉｆｅ　Ｉｎｎｏｖａｔｉｏｎ,宮崎県都城市太郎坊町３２１１番地１０,2026-05-18,株式会社
株式会社ＬｉｎｋＡｃｅ,大阪府羽曳野市南恵我之荘７丁目１２番２号,2026-05-18,株式会社
株式会社Ｌｉｎｏ,兵庫県神戸市兵庫区下祇園町１６番５号,2026-05-18,株式会社
