法人名,住所,設立日,法人種別
株式会社ゼンファクトリー,大分県中津市耶馬溪町大字樋山路５番地１,2016-12-07,株式会社
株式会社タケショー,熊本県熊本市東区下南部３丁目２番７２－３０２号,2016-12-07,株式会社
株式会社タマス,京都府京都市左京区田中西高原町２７番地リバティー１Ｆ,2016-12-07,株式会社
株式会社ターシュ・コーポレーション,愛知県名古屋市名東区猪高台２丁目３０８番地,2016-12-07,株式会社
株式会社チェリー,愛知県小牧市大字久保一色字本田屋敷１６５１番地コーポラスヘルシー１０７号室,2016-12-07,株式会社
株式会社ツムギカンパニー,大阪府茨木市永代町８番１６号,2016-12-07,株式会社
株式会社テミストクレス,東京都八王子市子安町４丁目２６番６とちの木ビル２０１号,2016-12-07,株式会社
株式会社ディーホープ,大阪府茨木市春日２丁目１番１２号,2016-12-07,株式会社
株式会社デコラティブアーツ,大阪府大阪市城東区成育１丁目３番２０号,2016-12-07,株式会社
株式会社トゥーシェ,岡山県岡山市北区今４丁目１５番２１号,2016-12-07,株式会社
株式会社トライアングル,愛知県名古屋市昭和区紅梅町３丁目８－３ブレンダビル３階３Ｃ,2016-12-07,株式会社
株式会社トライドリーム,長崎県長崎市小江原３丁目４番１８号,2016-12-07,株式会社
株式会社トラスティアホーム,埼玉県所沢市東狭山ケ丘１丁目６５番１号大成ハイツ東１０５号室,2016-12-07,株式会社
株式会社トリニティーアセットマネジメント,大阪府大阪市中央区久太郎町３丁目１番１５号,2016-12-07,株式会社
株式会社ドットマネー,東京都渋谷区円山町１９番１号,2016-12-07,株式会社
株式会社ドリームホーム,東京都品川区大井４丁目１番３号,2016-12-07,株式会社
株式会社ナカバ,埼玉県所沢市大字下安松５０番地の２４７カミタマンション二番館１Ｆ号室,2016-12-07,株式会社
株式会社ナチュラル,大阪府茨木市穂積台９番９１８号,2016-12-07,株式会社
株式会社ナリ心理学,東京都目黒区青葉台４丁目４番１６号プチメゾン青葉台３０Ｄ,2016-12-07,株式会社
株式会社ニシヒラ住宅,愛媛県松山市愛光町１番２４号,2016-12-07,株式会社
株式会社ニューイングベーカリー九州,福岡県糟屋郡新宮町緑ケ浜３丁目１番１号,2016-12-07,株式会社
株式会社ニュース,神奈川県横浜市港南区日野南４丁目３０番１１号,2016-12-07,株式会社
株式会社ネオガイア福岡,福岡県春日市須玖南２丁目３７番地,2016-12-07,株式会社
株式会社ネクシード,東京都新宿区西新宿６丁目６番２号新宿国際ビルディング４Ｆ,2016-12-07,株式会社
株式会社ネコアイ,東京都渋谷区代々木３丁目４６番１６号小野木ビル２０８,2016-12-07,株式会社
株式会社ノーティ,東京都千代田区外神田２丁目１９番３号お茶の水木村ビル３階,2016-12-07,株式会社
株式会社ハングオーバー,東京都町田市原町田４丁目６番５号ＮＴ町田７ビル１Ｆ,2016-12-07,株式会社
株式会社バズ,東京都世田谷区野沢１丁目３２番１８号,2016-12-07,株式会社
株式会社バルクセーフティー,神奈川県横浜市神奈川区栄町１番地１,2016-12-07,株式会社
株式会社パイナップル,茨城県つくば市境松４８７番地１,2016-12-07,株式会社
株式会社パストラヴィータ,東京都江戸川区南葛西３丁目１８番７号,2016-12-07,株式会社
株式会社パームス,愛知県名古屋市千種区徳川山町２丁目４番４号,2016-12-07,株式会社
株式会社ヒロキチ,神奈川県川崎市幸区新小倉２番１号,2016-12-07,株式会社
株式会社ビジットソリューションサービス,神奈川県川崎市麻生区千代ケ丘７丁目１３番地２５,2016-12-07,株式会社
株式会社ビジョンアルファ,東京都渋谷区千駄ヶ谷５丁目３番１２号Ｋ＆Ｋビル３０３,2016-12-07,株式会社
株式会社ビリジアン,東京都大田区仲六郷３丁目２１番２－６１１号,2016-12-07,株式会社
株式会社ビーエージーエス,埼玉県狭山市入間川１４９８番地の５,2016-12-07,株式会社
株式会社ピンコロ農園,千葉県四街道市大日４８４番地５４,2016-12-07,株式会社
株式会社ファミリヤ,徳島県小松島市神田瀬町１３番２５号,2016-12-07,株式会社
株式会社フィールド・ワーク,東京都江戸川区東葛西９丁目１番４－６０７号,2016-12-07,株式会社
株式会社フォレストモア,静岡県三島市南本町２０番８号サーパス三島南本町２０１,2016-12-07,株式会社
株式会社フランソアフードスタッフ,福岡県糟屋郡新宮町緑ケ浜３丁目１番１号,2016-12-07,株式会社
株式会社フリーディア管理システム,新潟県上越市大字向橋５１４番地の１,2016-12-07,株式会社
株式会社フレンチ割烹ドミニク・コルビ,東京都新宿区荒木町２番地９,2016-12-07,株式会社
株式会社フレーズ,福井県坂井市三国町池上第９７号１１６番地,2016-12-07,株式会社
株式会社ブルスケッタ,山梨県富士吉田市旭２丁目６番４号,2016-12-07,株式会社
株式会社ブルーモーメント,佐賀県佐賀市本庄町大字本庄２６１番地１,2016-12-07,株式会社
株式会社ブロス・エンタープライズ,静岡県御殿場市新橋２０７６番地の４,2016-12-07,株式会社
株式会社プライムリバレッジ,愛知県名古屋市千種区内山３丁目１番８号,2016-12-07,株式会社
株式会社プレゼンス,愛媛県松山市石手白石甲２７番地７,2016-12-07,株式会社
株式会社プログラン,東京都江戸川区春江町３丁目３２番７号,2016-12-07,株式会社
株式会社ホームラックジャパン,愛知県名古屋市南区内田橋２丁目１９番４号,2016-12-07,株式会社
株式会社ホーワサービス,新潟県新潟市江南区日水３丁目１０９番地,2016-12-07,株式会社
株式会社ポライトシステム,大阪府東大阪市稲田新町２丁目２３番１５号,2016-12-07,株式会社
株式会社マイキ,神奈川県横浜市旭区市沢町１０７１番地１０,2016-12-07,株式会社
株式会社マゲトップ,東京都大田区下丸子２丁目１７－９－８,2016-12-07,株式会社
株式会社マルイチコーポレーション,大阪府大阪市城東区野江３丁目９番１６号,2016-12-07,株式会社
株式会社マーク,宮城県岩沼市桜２丁目９番３６号,2016-12-07,株式会社
株式会社マーサープランニング,香川県高松市百間町９番地１３パールコート２０１号,2016-12-07,株式会社
株式会社ミツヒロ,兵庫県西宮市中島町１６番１８号,2016-12-07,株式会社
株式会社ミナミ,大阪府堺市堺区南三国ヶ丘町３丁４番３号,2016-12-07,株式会社
株式会社ミレイユ,東京都目黒区駒場１丁目３１番６号,2016-12-07,株式会社
株式会社メタップスリンクス,東京都新宿区西新宿６丁目８番１号住友不動産新宿オークタワー３０階,2016-12-07,株式会社
株式会社モビーディック,千葉県千葉市中央区栄町２６番８号,2016-12-07,株式会社
株式会社ライフクリエイト,東京都江戸川区大杉５丁目２番１３号,2016-12-07,株式会社
株式会社ライフサポート,埼玉県深谷市針ヶ谷５９１番地３,2016-12-07,株式会社
株式会社ラウレア,東京都世田谷区北烏山６丁目１１番３－２７０６号,2016-12-07,株式会社
株式会社ランドマーク,兵庫県芦屋市東芦屋町３番７号,2016-12-07,株式会社
株式会社リボーン,広島県福山市多治米町２丁目９番１０－２号,2016-12-07,株式会社
株式会社リンクロック,大分県大分市公園通り３丁目１番１２号,2016-12-07,株式会社
株式会社リードプラン,神奈川県川崎市宮前区神木本町５丁目１５番２１号,2016-12-07,株式会社
株式会社ルクボ,埼玉県三郷市早稲田４丁目７番地１三郷早稲田サニーコート５０４号,2016-12-07,株式会社
株式会社ルーデンスフィールド,大阪府豊中市東豊中町６丁目１３番１－３１９号,2016-12-07,株式会社
株式会社レアー,神奈川県川崎市中原区木月３丁目５５番５号,2016-12-07,株式会社
株式会社レグルスシステム,愛知県名古屋市中区丸の内２丁目２０番２号オアシス丸の内ＮＯＲＴＨ９階,2016-12-07,株式会社
株式会社レックス,東京都足立区西新井本町２丁目２４番１２－８０１号,2016-12-07,株式会社
株式会社ワイズ設備計画,東京都世田谷区奥沢４丁目２８番１１号ＦＴＡビル３Ｆ,2016-12-07,株式会社
株式会社ワンダーマール,山口県下関市彦島本村町３丁目１２番６号,2016-12-07,株式会社
株式会社ワンパーセントピクチャーズ,東京都渋谷区渋谷２丁目２番６号,2016-12-07,株式会社
株式会社ワンポイント,茨城県つくば市梅園２丁目１番地１５,2016-12-07,株式会社
株式会社ヴァイゼ,東京都北区西ケ原４丁目６１番７号マンション柿の木２０５号,2016-12-07,株式会社
株式会社ヴァーチェ,大阪府大阪市淀川区西中島６丁目１番１５号,2016-12-07,株式会社
株式会社ヴェナイン,東京都江東区扇橋３丁目１７番６号,2016-12-07,株式会社
株式会社ヴェルディいちのへ,青森県八戸市大字番町３８番地,2016-12-07,株式会社
株式会社一期,東京都渋谷区千駄ヶ谷３丁目３７番８号,2016-12-07,株式会社
株式会社一組,愛知県一宮市森本２丁目２３番１９号,2016-12-07,株式会社
株式会社一英,大阪府箕面市瀬川３丁目４番１３号,2016-12-07,株式会社
株式会社三輝パートナーズ,岡山県瀬戸内市邑久町山田庄３１３番地９,2016-12-07,株式会社
株式会社三重オートガラス,三重県鈴鹿市甲斐町３０３番地の１,2016-12-07,株式会社
株式会社上総,福島県いわき市平下平窪字寺内２４５番地の５,2016-12-07,株式会社
株式会社中尾建設,大阪府大阪狭山市山本北１２２４番地の１,2016-12-07,株式会社
株式会社丸一土建,宮城県大崎市古川旭５丁目３番３号,2016-12-07,株式会社
株式会社丸富福祉会,鹿児島県奄美市名瀬佐大熊町２２８５番地２,2016-12-07,株式会社
株式会社京樂商事,東京都豊島区東池袋３丁目９番１５号ワイムティハイム７０２号,2016-12-07,株式会社
株式会社以和貴会ケアサービス,鹿児島県鹿屋市串良町下小原３１０６番地,2016-12-07,株式会社
株式会社健塗,埼玉県川口市大字新井宿９７６番地６,2016-12-07,株式会社
株式会社健康の相談室,広島県広島市東区牛田早稲田４丁目１３番１号,2016-12-07,株式会社
株式会社優才ネットワーク,東京都千代田区九段南１丁目５番６号りそな九段ビル５Ｆ,2016-12-07,株式会社
株式会社優美,埼玉県川口市東川口６丁目９番４５号,2016-12-07,株式会社
株式会社加藤会計コンサルティング,東京都大田区西蒲田７丁目４７番１号,2016-12-07,株式会社
株式会社加藤工務店,東京都中野区本町１丁目５番５－１３０９号,2016-12-07,株式会社
株式会社加藤興業,沖縄県糸満市字阿波根１５５６番地１豊ビル１階１０１,2016-12-07,株式会社
株式会社勝建,熊本県菊池市下河原５５３０番地,2016-12-07,株式会社
株式会社南陽設備,愛知県名古屋市港区西茶屋４丁目１４９番地の２,2016-12-07,株式会社
株式会社友興,東京都練馬区西大泉３丁目２２番１２号,2016-12-07,株式会社
株式会社古都,奈良県生駒市小平尾町１４１２番地１,2016-12-07,株式会社
株式会社只管,鹿児島県鹿児島市鴨池新町１４番１４号,2016-12-07,株式会社
株式会社吉,埼玉県本庄市小島南１丁目１０番３１号,2016-12-07,株式会社
株式会社吉野興業,神奈川県藤沢市高倉２２０５番地,2016-12-07,株式会社
株式会社和電気,神奈川県平塚市南豊田３１番地の１,2016-12-07,株式会社
株式会社喜久家,神奈川県茅ヶ崎市萩園２４６０番地１１,2016-12-07,株式会社
株式会社四国ＯＣＭ化成,愛媛県松山市北斎院町２９８番地,2016-12-07,株式会社
株式会社夢幻星,岡山県岡山市北区南中央町７－１７－６０６,2016-12-07,株式会社
株式会社大嶋ポンプ,愛知県瀬戸市北松山町１丁目１４５番地の３,2016-12-07,株式会社
株式会社姫路観光,兵庫県姫路市広畑区吾妻町２丁目２１番地,2016-12-07,株式会社
株式会社宝喜,兵庫県宝塚市川面２丁目３番１２号,2016-12-07,株式会社
株式会社宮崎塗装巧芸,東京都練馬区高松４丁目７番２９号,2016-12-07,株式会社
株式会社小原商店,福島県いわき市植田町本町９番地の５,2016-12-07,株式会社
株式会社山一開発,大分県大分市大字皆春１４５２番地の１,2016-12-07,株式会社
株式会社山共ホールディングス,岐阜県加茂郡東白川村越原９７６番地１０,2016-12-07,株式会社
株式会社山城造園,京都府綴喜郡宇治田原町大字郷之口小字北堂山３３番地,2016-12-07,株式会社
株式会社山林舎,宮城県柴田郡大河原町金ケ瀬字丑越５４番地,2016-12-07,株式会社
株式会社山﨑建装,兵庫県宝塚市金井町４番５３号ピュアサツキ１０３号,2016-12-07,株式会社
株式会社川﨑工業,高知県高知市桜井町２丁目８番１４号すずきコーポ８・３０６,2016-12-07,株式会社
株式会社希颯,神奈川県愛甲郡愛川町春日台１丁目４番地１２,2016-12-07,株式会社
株式会社幸正建設,奈良県香芝市瓦口６９番地,2016-12-07,株式会社
株式会社広栄,大分県別府市大字鶴見４０８０番地の３０,2016-12-07,株式会社
株式会社広瀬,大阪府豊中市神州町１番３４号,2016-12-07,株式会社
株式会社庄交価値創造研究所,山形県鶴岡市錦町２番６０号,2016-12-07,株式会社
株式会社庄交保険サービス,山形県鶴岡市錦町２番６０号,2016-12-07,株式会社
株式会社建築調査研究所,東京都新宿区箪笥町３７番地,2016-12-07,株式会社
株式会社徹底,大阪府摂津市鳥飼本町５丁目１２番１８号,2016-12-07,株式会社
株式会社新菜園,静岡県浜松市西区雄踏町宇布見８１９７番地の２,2016-12-07,株式会社
株式会社日昇エンタープライズ,埼玉県吉川市栄町１３９８番地６,2016-12-07,株式会社
株式会社日本医薬品,神奈川県横浜市西区平沼１丁目３番２２号,2016-12-07,株式会社
株式会社明和機械,兵庫県尼崎市戸ノ内町３丁目１番３７号,2016-12-07,株式会社
株式会社暁良,大阪府吹田市五月が丘北１４－１６（１０３）,2016-12-07,株式会社
株式会社有ヶ谷電気,東京都杉並区井草４丁目３番２０号,2016-12-07,株式会社
株式会社有村カウファーム,宮崎県都城市高崎町縄瀬３１８７番地３,2016-12-07,株式会社
株式会社未樹工房,埼玉県志木市下宗岡２丁目１５番３７号,2016-12-07,株式会社
株式会社本大西,大阪府摂津市一津屋２丁目３番１６号,2016-12-07,株式会社
株式会社村松工務店,静岡県静岡市清水区三保１９６１番地の１４,2016-12-07,株式会社
株式会社村橋電設,富山県富山市城村新町３５番地,2016-12-07,株式会社
株式会社東和,大阪府豊中市北緑丘２丁目５番１０号,2016-12-07,株式会社
株式会社松原商事,神奈川県横浜市金沢区大道２丁目２２番６０号,2016-12-07,株式会社
株式会社根本設備,神奈川県川崎市宮前区野川３５３７番地１１,2016-12-07,株式会社
株式会社根田設計,北海道札幌市白石区菊水五条１丁目６番１５号,2016-12-07,株式会社
株式会社植木,和歌山県日高郡日高町大字志賀９７７番地の８,2016-12-07,株式会社
株式会社樹と葉っぱ,東京都八王子市台町４丁目３９番７号,2016-12-07,株式会社
株式会社正見,福島県須賀川市森宿字北向９１番地５グリーンフォレスト２０１号,2016-12-07,株式会社
株式会社武蔵屋,埼玉県越谷市宮本町３丁目１２１番地１４,2016-12-07,株式会社
株式会社毎日新聞小平販売所,東京都東村山市富士見町５丁目１番地６７,2016-12-07,株式会社
株式会社江戸万里工業,東京都江戸川区江戸川２丁目３１番地江戸川二丁目アパート２１－１４０５,2016-12-07,株式会社
株式会社池田フード,大阪府泉佐野市市場東３丁目２１９番地の３,2016-12-07,株式会社
株式会社淳一水産,兵庫県南あわじ市賀集福井１４番地２０,2016-12-07,株式会社
株式会社清水,兵庫県神戸市東灘区住吉本町１丁目４番１１号,2016-12-07,株式会社
株式会社渡辺装色,山形県米沢市御廟２丁目２番２０－７０５号,2016-12-07,株式会社
株式会社版三,東京都大田区北千束１丁目１８番３号,2016-12-07,株式会社
株式会社猫マル商店,東京都西東京市向台町４丁目１２番３２－３０１号,2016-12-07,株式会社
株式会社白岩総合商会,神奈川県横浜市保土ケ谷区新桜ケ丘２丁目４番４号テラスウィステリアＢ１０２,2016-12-07,株式会社
株式会社百会,東京都新宿区四谷４丁目１０番８号ＹＭビル１Ｆ,2016-12-07,株式会社
株式会社皆成実業,広島県福山市鞆町後地２０１６番地２,2016-12-07,株式会社
株式会社真和会,宮城県大崎市古川大宮１丁目１番７８号,2016-12-07,株式会社
株式会社矢板・リフォームセンター,栃木県那須塩原市あたご町４番３号,2016-12-07,株式会社
株式会社砂原商会,福岡県福岡市城南区長尾３丁目９番３－２０２号,2016-12-07,株式会社
株式会社福幸城ファーム,沖縄県那覇市字小禄３９０,2016-12-07,株式会社
株式会社総合研究舎,東京都新宿区四谷坂町４番３１号,2016-12-07,株式会社
株式会社繁栄,大阪府堺市西区鳳西町２丁１５番地２,2016-12-07,株式会社
株式会社翔輝,佐賀県小城市芦刈町浜枝川９８２番地１１,2016-12-07,株式会社
株式会社荒木総合計画事務所,福岡県久留米市荒木町白口１５９３番地１,2016-12-07,株式会社
株式会社葛西プランニング,東京都江戸川区東葛西５丁目４番８号,2016-12-07,株式会社
株式会社蔵人,岐阜県各務原市那加雄飛ケ丘町１３番地２９,2016-12-07,株式会社
株式会社西播工業,兵庫県姫路市広畑区東新町２丁目５５番地２,2016-12-07,株式会社
株式会社谷田コーポレーション,奈良県奈良市朝日町２丁目１６番地の６,2016-12-07,株式会社
株式会社輝,愛知県名古屋市天白区土原４丁目６３７番地,2016-12-07,株式会社
株式会社辰,東京都江戸川区西葛西２丁目２２番２６－８１９号,2016-12-07,株式会社
株式会社辻村技電,大阪府大阪市鶴見区放出東３丁目１５番１８－３０５号,2016-12-07,株式会社
株式会社都貴住設,奈良県奈良市六条１丁目６番２０号,2016-12-07,株式会社
株式会社酒建工業,茨城県北相馬郡利根町大字羽根野８５０番地４８,2016-12-07,株式会社
株式会社酒酒楽楽,大阪府大阪市阿倍野区天王寺町北２丁目１番７号,2016-12-07,株式会社
株式会社雄建工業,兵庫県神戸市灘区土山町９番４号,2016-12-07,株式会社
株式会社雄躍,鹿児島県鹿児島市桜ヶ丘４丁目１８番地７,2016-12-07,株式会社
株式会社静人舎,東京都世田谷区成城４丁目４番１４号,2016-12-07,株式会社
株式会社飛鳥電気,宮城県宮城郡松島町根廻字桐田４３番地の８,2016-12-07,株式会社
株式会社高松実業,北海道苫小牧市青雲町１丁目９番１７－３０３号,2016-12-07,株式会社
株式会社高橋アート,東京都東久留米市ひばりが丘団地８番１３号ひばりが丘フィールズ１番街５０５号室,2016-12-07,株式会社
株式会社鳶裕,東京都足立区中央本町４丁目１３番１５号,2016-12-07,株式会社
株式会社黒田酒場,宮城県仙台市宮城野区原町１丁目２番７号佐藤ビル１０２,2016-12-07,株式会社
株式会社齋藤商店,福岡県福岡市西区福重５丁目４番１０号,2016-12-07,株式会社
株式会社﨑本自動車,鹿児島県薩摩郡さつま町船木１１１６番地５,2016-12-07,株式会社
株式会社祥栄設備,埼玉県川口市領家２丁目１６番１６号,2016-12-07,株式会社
株式会社３Ｒ関西ウエスト,兵庫県加古川市別府町新野辺２８９９番地,2016-12-07,株式会社
株式会社Ａ＆Ｔ　ＷＥＤＤＩＮＧ,神奈川県平塚市八重咲町２４番３４－３０４号,2016-12-07,株式会社
株式会社Ａ．ＣＯＲＰＯＲＡＴＩＯＮ,東京都渋谷区恵比寿西１丁目３２番１６号,2016-12-07,株式会社
株式会社ＡＣＬ,宮城県名取市大手町４丁目２２番地の７,2016-12-07,株式会社
株式会社ＡＣＳＥＥＺ,東京都葛飾区西亀有３丁目２番１５号,2016-12-07,株式会社
株式会社ＡＧＥＮ,兵庫県神戸市須磨区潮見台町１丁目５番６－３０２号,2016-12-07,株式会社
株式会社ＡＬＤＯＣＫ,東京都渋谷区恵比寿４丁目２０－３恵比寿ガーデンプレイスｌ８階,2016-12-07,株式会社
株式会社ＡＴＯＭＥＲ,東京都大田区中央８丁目３５番１５号,2016-12-07,株式会社
株式会社ＡＴＳ,北海道札幌市西区山の手三条１丁目２番３０－４０３号,2016-12-07,株式会社
株式会社ＡＷ　ＪＡＰＡＮ,東京都中央区新富２丁目２番６号,2016-12-07,株式会社
株式会社ＡＺサポート,兵庫県西宮市大社町一丁目３８－１０３,2016-12-07,株式会社
株式会社ＡＺＳＯＬ,石川県野々市市矢作３丁目４５番地,2016-12-07,株式会社
株式会社Ａｉ　Ｌｏｕｎｇｅ,群馬県高崎市あら町１３４番地１高崎クリエートビル４階,2016-12-07,株式会社
株式会社Ａｉｍグローバル,茨城県古河市下山町１番地９,2016-12-07,株式会社
株式会社Ａｎｏｎ－Ｋ,東京都世田谷区代沢２丁目５番７号,2016-12-07,株式会社
株式会社Ｂ－Ｓｔｙｌｅ,宮城県仙台市太白区八木山松波町１番１５－３０３号,2016-12-07,株式会社
株式会社ＢＯＧＥＮ,東京都渋谷区広尾５丁目１９番１号,2016-12-07,株式会社
株式会社Ｂａｒｎ,東京都大田区本羽田１丁目１番１号,2016-12-07,株式会社
株式会社Ｂｅｌｏｖｅｄ,東京都新宿区歌舞伎町２丁目３０番１３号,2016-12-07,株式会社
株式会社Ｃｏｎｎｅｃｔ,愛知県津島市老松町１９０番地１,2016-12-07,株式会社
株式会社Ｃｏｎｓｔｒｕｃｔ　ｆｉｌｍ　ｗｏｒｋｓ,東京都目黒区東山３丁目１８番９号,2016-12-07,株式会社
株式会社Ｄ＆Ｊホールディングス,京都府京都市南区吉祥院嶋高町８番地,2016-12-07,株式会社
株式会社ＤＫネクサス,東京都品川区戸越６丁目２２番９号,2016-12-07,株式会社
株式会社Ｄｅｃｏ屋,埼玉県川口市東領家２丁目３６番１０号,2016-12-07,株式会社
株式会社Ｄｉａｒｙ　Ｈｏｌｓｔｅｉｎｓ,北海道野付郡別海町中西別５２番地の１６,2016-12-07,株式会社
株式会社Ｄｉｒｅｃ,東京都町田市原町田１丁目１２番２５号サンファースト５０５,2016-12-07,株式会社
株式会社ＥＡＳＴ　ＯＮＥ,東京都豊島区東池袋２丁目１５番６号,2016-12-07,株式会社
株式会社ＥＧプランニング,福島県いわき市小名浜西君ケ塚町１５番地の８,2016-12-07,株式会社
株式会社ＦＤＩマネジメント,神奈川県藤沢市南藤沢１６番１６号ＦＤＩビル,2016-12-07,株式会社
株式会社ＦｉｒｓｔＬｉｎｅ,東京都八王子市小比企町８２４番地８,2016-12-07,株式会社
株式会社Ｇ－ｆｕｎｃｔｉｏｎ,東京都中央区日本橋兜町１６番１号第１１大協ビル５Ｆ,2016-12-07,株式会社
株式会社Ｇ－ｐｒｏｕｄ,北海道札幌市北区北七条西２丁目８番地１,2016-12-07,株式会社
株式会社Ｇ－ｒｉｓｅ,東京都世田谷区尾山台３丁目１０番８号,2016-12-07,株式会社
株式会社Ｇ．Ｎ．Ｗ,東京都台東区上野３丁目１０番１号ファーストビル３階,2016-12-07,株式会社
株式会社ＧＥＮＥＳＩＳ　ＳＨＩＰ,東京都渋谷区円山町１０番１４号スタジオＤＥｎ渋谷３０１,2016-12-07,株式会社
