法人名,住所,設立日,法人種別
一般社団法人ＪＩＮ　ＬＵＣＫサポーターズ,東京都港区赤坂９丁目７番１号ミッドタウン・タワー１８階株式会社ＪＩＮ　ＬＵＣＫアセットマネジメント内,2023-02-20,その他の設立登記法人
一般社団法人ＭＲＴＰ,東京都千代田区丸の内３丁目１番１号東京共同会計事務所内,2023-02-20,その他の設立登記法人
一般社団法人ＳＥＥＤ１,東京都港区元赤坂１丁目１番７号,2023-02-20,その他の設立登記法人
一般社団法人ｙａｇｏｃｏｌｏ,福岡県福津市津屋崎４丁目３６番３号,2023-02-20,その他の設立登記法人
一般財団法人みちひらき,東京都中央区銀座８丁目７番１７号コパビル６階,2023-02-20,その他の設立登記法人
三子合同会社,大阪府堺市東区菩提町３丁５番地１マンションクレール１０２号,2023-02-20,合同会社
三苫電気株式会社,福岡県福岡市西区大字女原３９４番,2023-02-20,株式会社
下森不動産株式会社,大分県別府市光町２１番４号,2023-02-20,株式会社
中山建設株式会社,静岡県焼津市中新田７５５番地の１５,2023-02-20,株式会社
井上金庫グループホールディングス株式会社,福井県福井市西木田３丁目５番１号,2023-02-20,株式会社
依通株式会社,大阪府大阪市大正区三軒家西３丁目４番１６号中山ビル２０１Ｂ,2023-02-20,株式会社
信合貿易株式会社,宮城県石巻市緑町２丁目４番８号,2023-02-20,株式会社
医療法人社団水内歯科医院,広島県広島市南区松原町３番１－２０４号ＥＫＩＣＩＴＹ　ＨＩＲＯＳＨＩＭＡ　ＥＡＳＴ,2023-02-20,その他の設立登記法人
合同会社いあプロジェクト,東京都中野区中野３丁目４５－７トータス中野Ｃ棟２Ｆ,2023-02-20,合同会社
合同会社どんなに,千葉県松戸市松戸１３０７－１松戸ビル１３階１３０２,2023-02-20,合同会社
合同会社はやご,東京都文京区音羽１丁目３番２－７０１号,2023-02-20,合同会社
合同会社まもる,山形県長井市ままの上７‐３５‐１‐１０１,2023-02-20,合同会社
合同会社アクシス,大阪府大阪市鶴見区鶴見５丁目５番３９号エルシェ鶴見２０３,2023-02-20,合同会社
合同会社アッピーフレンズ,北海道空知郡南富良野町字金山７５６番地,2023-02-20,合同会社
合同会社アルメ,東京都渋谷区恵比寿１丁目１５番９号日宝恵比寿ビル４０３,2023-02-20,合同会社
合同会社エウレカスプリングス,東京都港区高輪２丁目１６－４９高輪伊皿子坂ハイツ１０５号室,2023-02-20,合同会社
合同会社オオクラ,東京都杉並区和泉３丁目５２番４号グラシアス２Ｆ,2023-02-20,合同会社
合同会社オーフィンド,東京都中央区佃１丁目１１番３－１０６号,2023-02-20,合同会社
合同会社クロスロード,東京都千代田区神田東松下町３７番地２加瀬ビル１３０－６０６号,2023-02-20,合同会社
合同会社グラン,埼玉県川越市新宿町６丁目２４－１９,2023-02-20,合同会社
合同会社コミューン,京都府京都市下京区七条通油小路東入大黒町２２７番地第２キョートビル４０２,2023-02-20,合同会社
合同会社シルフィード,北海道札幌市厚別区上野幌二条２丁目１９番１５号,2023-02-20,合同会社
合同会社シンプルニーズ,大阪府大阪市西区南堀江４丁目３０番３０－１００１号,2023-02-20,合同会社
合同会社ジャパンワークス,茨城県土浦市小松３丁目２６番３６号,2023-02-20,合同会社
合同会社ビーターズ,東京都千代田区外神田４丁目１４番２号東京タイムズタワー１２０３,2023-02-20,合同会社
合同会社ファイズトレーディング,埼玉県日高市大字高富８４番地１,2023-02-20,合同会社
合同会社マユトラウム,神奈川県茅ヶ崎市赤羽根３１２２番地１,2023-02-20,合同会社
合同会社モノクロ,神奈川県横浜市中区福富町東通４１番地１階,2023-02-20,合同会社
合同会社ラバーテックジャパン,茨城県取手市戸頭２丁目１３番２０号,2023-02-20,合同会社
合同会社リンク,山梨県富士吉田市新西原１丁目７－１２新西原ビル３Ｆ,2023-02-20,合同会社
合同会社ワールドトレード,静岡県浜松市東区薬新町１８番地の４,2023-02-20,合同会社
合同会社ヴァレッジ・スタジオ,東京都港区浜松町２丁目２番１５号浜松町ダイヤビル２Ｆ,2023-02-20,合同会社
合同会社万里,千葉県佐倉市千成３丁目１４番１４号,2023-02-20,合同会社
合同会社丸真,沖縄県宜野湾市長田４丁目１７番２号,2023-02-20,合同会社
合同会社伸興産業,京都府綴喜郡宇治田原町大字南小字上ノ山６番１８,2023-02-20,合同会社
合同会社佐々木建設,千葉県柏市南逆井４丁目２７番４５号,2023-02-20,合同会社
合同会社免疫バランス研究所,千葉県柏市旭町１丁目１４－３－１２０１,2023-02-20,合同会社
合同会社匠,香川県丸亀市今津町５２９番地５,2023-02-20,合同会社
合同会社双極工業,千葉県野田市中戸４７６番地１５,2023-02-20,合同会社
合同会社大イカ商会,東京都世田谷区大蔵３丁目１番６－２０７号,2023-02-20,合同会社
合同会社小泉商会,神奈川県横浜市港北区篠原東２丁目１７－１８,2023-02-20,合同会社
合同会社平林解体,長野県千曲市大字須坂４７９番地１,2023-02-20,合同会社
合同会社柏木工務店,三重県鈴鹿市末広北１丁目６番２号,2023-02-20,合同会社
合同会社桐将電設,宮崎県宮崎市大字浮田１９４番地１０,2023-02-20,合同会社
合同会社甲斐心,山梨県北都留郡丹波山村２６５１番地,2023-02-20,合同会社
合同会社百山,愛媛県松山市千舟町５丁目３１－７－３階・４階,2023-02-20,合同会社
合同会社石川,愛知県岡崎市宮地町字柳畑３７番地,2023-02-20,合同会社
合同会社紬,東京都江戸川区東小岩４丁目３３番１９号,2023-02-20,合同会社
合同会社芝ＩＴＣ,東京都町田市金井５丁目２２－１,2023-02-20,合同会社
合同会社麗光,大阪府大阪市東成区玉津２丁目１１番７号スタートライン玉津２０１号室,2023-02-20,合同会社
合同会社３Ｚ,千葉県富里市日吉台６丁目１３番６号,2023-02-20,合同会社
合同会社７ａｍ,埼玉県川越市大字小仙波１０４９番地１,2023-02-20,合同会社
合同会社ＡＦＴ,東京都千代田区丸の内３丁目１番１号東京共同会計事務所内,2023-02-20,合同会社
合同会社ＡＴＳＵＳＥ,大阪府大阪市東淀川区上新庄３丁目２２－３６,2023-02-20,合同会社
合同会社ＡＵＢＥ,宮崎県宮崎市大坪東３丁目２０－２９エターナルドリーム２０２,2023-02-20,合同会社
合同会社ＢＬＵＥ　ＬＩＦＥ,神奈川県横浜市南区六ツ川３丁目６－３－３０１,2023-02-20,合同会社
合同会社ＢＴＦ,愛知県犬山市大字上野字午ノ背１４９－１,2023-02-20,合同会社
合同会社ＣＬＯＴＨＯＶＥＲ,大阪府大阪市東住吉区駒川１丁目１５－４－６０２号,2023-02-20,合同会社
合同会社ＤＳ．ＪＡＰＡＮ,長崎県対馬市厳原町久田４９番地１,2023-02-20,合同会社
合同会社Ｄｉｅｔｚ,東京都渋谷区円山町５番４号フィールＡ渋谷４０５,2023-02-20,合同会社
合同会社Ｄｉｏｐｔｒａ,愛知県刈谷市東刈谷町１丁目１５番地２シャトレー東刈谷駅１３０３号,2023-02-20,合同会社
合同会社Ｅａｒｎｅｓｔ,熊本県菊池郡菊陽町新山３丁目８番１号,2023-02-20,合同会社
合同会社ＨＡＮＡ,熊本県熊本市東区戸島４丁目１－６０,2023-02-20,合同会社
合同会社ＨＯＮＥＳＴＯ,大阪府大東市氷野２丁目６番１７号,2023-02-20,合同会社
合同会社Ｈａｐｐｉｎｅｓｓ,三重県松阪市中道町３９６番地１１,2023-02-20,合同会社
合同会社ＩＳＰＧ,東京都足立区本木西町１１番１３号,2023-02-20,合同会社
合同会社ＩＺレンタカー,沖縄県宮古島市平良字荷川取１２６９－２,2023-02-20,合同会社
合同会社Ｋ‐プラント工業,岡山県浅口市金光町下竹１２２９番地１,2023-02-20,合同会社
合同会社ＫＳＩＦ,東京都港区西新橋１丁目２番９号メンターキャピタル税理士法人内,2023-02-20,合同会社
合同会社Ｌａｗ　Ｔｒｅｅ,東京都千代田区九段南１丁目５番６号りそな九段ビル５Ｆ・ＫＳフロア,2023-02-20,合同会社
合同会社Ｍ‐ＳＴＯＮＥＳ,岡山県岡山市北区川入１０６４－１４,2023-02-20,合同会社
合同会社ＭＩＸ　ＵＰ,埼玉県川口市大字東本郷１１９４番地３コーポみねぎし台Ｂ－１０５,2023-02-20,合同会社
合同会社ＭＹＧＫ５号,東京都千代田区丸の内３丁目１番１号東京共同会計事務所内,2023-02-20,合同会社
合同会社Ｍｅｓｓｉａｈ,東京都調布市仙川町１丁目３５番地３６,2023-02-20,合同会社
合同会社ＭｉｕＴｒｉｇｇｅｒ,愛知県名古屋市中川区万町２０２番地サンライズ小本２０１号,2023-02-20,合同会社
合同会社ＮＬＳ,広島県広島市安芸区中野２丁目６２番３号,2023-02-20,合同会社
合同会社ＲＩＳＡＫＯ,東京都墨田区文花１丁目１８番１３号,2023-02-20,合同会社
合同会社ＳＥＥＤ１,東京都港区元赤坂１丁目１番７号,2023-02-20,合同会社
合同会社ＳＮＤ,神奈川県平塚市明石町２４―２５―３１３,2023-02-20,合同会社
合同会社ＳＴＹＬＥ,東京都北区赤羽３丁目１０番２－１０２号,2023-02-20,合同会社
合同会社ＴＭＧ研究所,愛知県名古屋市瑞穂区川澄町４丁目８番３号,2023-02-20,合同会社
合同会社ＴＯＫＩＹＡ,愛知県名古屋市名東区つつじが丘１２１番地,2023-02-20,合同会社
合同会社ＴＹ,福岡県福岡市博多区東比恵３丁目１４－４,2023-02-20,合同会社
合同会社ＵＯＭＩ,東京都板橋区大山東町４５－２,2023-02-20,合同会社
合同会社ＹＧｆａｍｉｌｙ,東京都世田谷区上祖師谷２丁目７－２９,2023-02-20,合同会社
合同会社ｃａｎ’ｔ　ｓｔｏｐ,東京都江東区東陽３丁目９番１１号,2023-02-20,合同会社
合同会社ｉ．ｎ．ｉ．ｔ．ｙ．,沖縄県宜野湾市真栄原２丁目３番８－１４０３号ミルコマンション真栄原スカイルーク,2023-02-20,合同会社
合同会社ｉｘｉｒａｄｅ,神奈川県川崎市高津区子母口４０３番地第６たちばなビル３０６,2023-02-20,合同会社
合同会社ｊｕｎｃｔｉｏｎ,東京都足立区千住大川町４４－１３,2023-02-20,合同会社
合同会社ｎｉｎｅ,東京都渋谷区桜丘町２３番１７号シティコート桜丘４０８,2023-02-20,合同会社
合同会社ｐｅｒｃｅｎｔ,大阪府寝屋川市東香里園町２３番２号,2023-02-20,合同会社
合名会社下田タイル店,埼玉県狭山市大字水野１０６８番地の２,2023-02-20,合名会社
名古屋インベストメンツ特定目的会社,東京都港区六本木１丁目６番１号泉ガーデンタワー,2023-02-20,その他の設立登記法人
名古屋インベストメンツ１一般社団法人,東京都港区六本木１丁目６番１号泉ガーデンタワー,2023-02-20,その他の設立登記法人
名古屋インベストメンツ１合同会社,東京都港区六本木１丁目６番１号泉ガーデンタワー,2023-02-20,合同会社
名古屋インベストメンツ２一般社団法人,東京都港区六本木１丁目６番１号泉ガーデンタワー,2023-02-20,その他の設立登記法人
君悦合同会社,千葉県市川市福栄１丁目６番１６－４０２号シティクレスト壱番館,2023-02-20,合同会社
嘉霖株式会社,東京都板橋区上板橋２丁目２４番６号,2023-02-20,株式会社
天理教法奥金澤分教会,石川県能美市小長野町イ９番地１,2023-02-20,その他の設立登記法人
寅家株式会社,岐阜県下呂市森１１５１－１,2023-02-20,株式会社
山田農場株式会社,北海道虻田郡京極町字川西１５９番地,2023-02-20,株式会社
新ＳＯＲＡ合同会社,東京都中野区上高田３丁目４０－５,2023-02-20,合同会社
曼の蓮株式会社,東京都荒川区南千住３丁目２７－２浅草ビル,2023-02-20,株式会社
株式会社あとなみ,千葉県鎌ケ谷市初富２０６番地３２,2023-02-20,株式会社
株式会社いなり,千葉県松戸市野菊野２番地野菊野団地２棟８１２号室,2023-02-20,株式会社
株式会社こさき福祉法務事務所,兵庫県尼崎市御園町２７－３－１００５,2023-02-20,株式会社
株式会社さくらコンクリート,大阪府大阪市住之江区北加賀屋３丁目１番５号,2023-02-20,株式会社
株式会社そらと,岐阜県岐阜市尻毛２丁目５１番地８,2023-02-20,株式会社
株式会社ふくみみ,福岡県福岡市城南区片江５丁目１４番２３－１１０号,2023-02-20,株式会社
株式会社みつたけ不動産,佐賀県唐津市鏡新開９０番地,2023-02-20,株式会社
株式会社みなみもり,兵庫県淡路市志筑３８９番地１－６－Ｄ,2023-02-20,株式会社
株式会社アイズ・アセットマネジメント,東京都千代田区大手町１丁目５ー１大手町ファーストスクエアＥＡＳＴＴＯＷＥＲ４階,2023-02-20,株式会社
株式会社アイパワー,東京都港区港南２丁目１６番２号太陽生命品川ビル２８Ｆ－Ｗ０４,2023-02-20,株式会社
株式会社アッシャイワゾーノ,兵庫県芦屋市岩園町４番９－２号,2023-02-20,株式会社
株式会社アドバンスカンパニー,千葉県柏市高柳１３３５番地１０７,2023-02-20,株式会社
株式会社アベプラミング,東京都練馬区大泉町５丁目１１番２号,2023-02-20,株式会社
株式会社アルブル,福岡県福岡市東区馬出１丁目１５番２５号,2023-02-20,株式会社
株式会社アンカーマンビジネスコンサルティング,東京都千代田区丸の内１丁目８番３号,2023-02-20,株式会社
株式会社イケダカンパニー,東京都杉並区荻窪５丁目１６番１４号カパラビル８階,2023-02-20,株式会社
株式会社イノベーション２１,千葉県柏市豊四季３８２番地１３,2023-02-20,株式会社
株式会社ウェルカム,福岡県福岡市中央区薬院３丁目１２番３－１００１号ファシール薬院,2023-02-20,株式会社
株式会社エクソソーム,東京都千代田区二番町５番地２５,2023-02-20,株式会社
株式会社エヌサービス,大阪府高槻市塚原２丁目６番５号,2023-02-20,株式会社
株式会社エムＬＩＮＥ,新潟県妙高市月岡１丁目１４番１７号,2023-02-20,株式会社
株式会社オーパーツラボ,東京都世田谷区等々力５丁目１６番６号,2023-02-20,株式会社
株式会社オールウェイ,大阪府大阪市東成区東小橋２丁目１０番２６号７０６号室,2023-02-20,株式会社
株式会社カイ・テック,香川県高松市成合町７２０番地１,2023-02-20,株式会社
株式会社カカユ,東京都新宿区四谷坂町１２番１４－６０３号,2023-02-20,株式会社
株式会社カートコーポレイトグループ,東京都世田谷区池尻２丁目３７番２号,2023-02-20,株式会社
株式会社ガーディアン,茨城県牛久市南４丁目３７番地５,2023-02-20,株式会社
株式会社クレアーレネクト,千葉県市川市東大和田１丁目２３番１７－２０２号,2023-02-20,株式会社
株式会社クレストホールディングス,兵庫県西宮市池田町１０番２－３０１号,2023-02-20,株式会社
株式会社グリーンガーデン,鳥取県鳥取市賀露町４０２７番地,2023-02-20,株式会社
株式会社グレイスフル,東京都新宿区西新宿３丁目３番１３号西新宿水間ビル６階,2023-02-20,株式会社
株式会社ココリノ,東京都北区志茂１丁目１５番１０号,2023-02-20,株式会社
株式会社コスメインターナショナル,東京都中央区築地７丁目１２番６号,2023-02-20,株式会社
株式会社コンファム,兵庫県西宮市越水町８－２０,2023-02-20,株式会社
株式会社サイネム,千葉県市川市相之川１丁目１６番１４号,2023-02-20,株式会社
株式会社シティベーション,東京都新宿区新宿２丁目１５－２６第三玉屋ビル６Ｆ,2023-02-20,株式会社
株式会社シードホールディングス,東京都港区西新橋１丁目１８番６号クロスオフィス内幸町,2023-02-20,株式会社
株式会社ステイサム,千葉県松戸市東平賀３７０番地１,2023-02-20,株式会社
株式会社ステムクリエイト,山口県宇部市東琴芝１丁目１０番８号,2023-02-20,株式会社
株式会社スマイルホーム,大阪府大阪市中央区南久宝寺町１丁目４番１５号ＥＩＫＡビル４０２号室,2023-02-20,株式会社
株式会社セカフィー,兵庫県神戸市灘区六甲台町１ー１,2023-02-20,株式会社
株式会社タクミ,埼玉県川口市領家１丁目２２番１６号鳳マンション５０３,2023-02-20,株式会社
株式会社ダイア,愛知県名古屋市中村区名駅３丁目４番１０号アルティメイト名駅１ｓｔ２階,2023-02-20,株式会社
株式会社チカラ,富山県高岡市中曽根２３７３番地セントラルパーク牧野２０１号,2023-02-20,株式会社
株式会社テルミック沖縄,沖縄県那覇市おもろまち１丁目１番２５号リュークスタワー西棟１０１１,2023-02-20,株式会社
株式会社トクシンアセット,香川県仲多度郡多度津町西港町２９番地４,2023-02-20,株式会社
株式会社ドナモ,千葉県八千代市米本２４３６－５３－Ｄ,2023-02-20,株式会社
株式会社ドリームハート,香川県高松市川島東町１７９０番地４,2023-02-20,株式会社
株式会社ネクストアップル,青森県青森市浪岡大字吉内字東留岡２７番地,2023-02-20,株式会社
株式会社ノット,東京都中央区銀座１丁目１２番４号Ｎ＆Ｅ－ＢＬＤ．７,2023-02-20,株式会社
株式会社ハナベル,神奈川県横須賀市小矢部２丁目２２番３号,2023-02-20,株式会社
株式会社バケネコ,東京都武蔵野市中町２丁目２４－１６,2023-02-20,株式会社
株式会社ヒダネ,北海道釧路市興津２丁目２７番２号,2023-02-20,株式会社
株式会社ヒラケン,岡山県玉野市田井１丁目８番１７号,2023-02-20,株式会社
株式会社ビルブロ,福岡県福岡市中央区赤坂１丁目１５番２７号赤坂ハイツ２Ａ,2023-02-20,株式会社
株式会社フレイトぼっくす,愛知県名古屋市中村区則武２丁目１４番１１号,2023-02-20,株式会社
株式会社フレッシュファームＯＫ,福島県相馬市塚ノ町１丁目１番地の７Ｃ－１０４,2023-02-20,株式会社
株式会社プロシンシア,東京都板橋区成増２丁目３５番４号,2023-02-20,株式会社
株式会社ホワイトカラー,埼玉県富士見市西みずほ台２丁目２番地９ＴＭビル５０２,2023-02-20,株式会社
株式会社マッシュ,大分県宇佐市大字下庄１８４番地の２,2023-02-20,株式会社
株式会社マナーズエッセンス,東京都中央区入船３丁目７番７号ウィンド入船ビル３Ｆ,2023-02-20,株式会社
株式会社マルキ電機商会,兵庫県洲本市五色町都志万歳２３番地,2023-02-20,株式会社
株式会社ムービーハイツ,東京都港区新橋３丁目１１番８号オーイズミ新橋第２ビル天翔オフィス新橋赤レンガ通りＡＮＮＥＸ９０４号室,2023-02-20,株式会社
株式会社メインエステート,兵庫県神戸市中央区坂口通５丁目３－１２杉原ビル１０４号,2023-02-20,株式会社
株式会社メビウスプロ,東京都目黒区緑が丘２丁目３番１１号右,2023-02-20,株式会社
株式会社ユーゴーホールディングス,群馬県高崎市上大類町４７７番地,2023-02-20,株式会社
株式会社リノ・リフォーム,福岡県福岡市早良区野芥７丁目９番１０号,2023-02-20,株式会社
株式会社リフォームサービス,愛知県名古屋市西区平中町４１２番地（サンピア堀込２０２号）,2023-02-20,株式会社
株式会社レイ・プランニング,京都府木津川市木津宮ノ堀８９番地１ＳｕｎＧａｒａｇｅ１,2023-02-20,株式会社
株式会社レーヴェ,三重県桑名市筒尾３丁目１０番地２１,2023-02-20,株式会社
株式会社三和会,兵庫県神戸市中央区磯上通４丁目１－３２ロイヤル磯上ビル４０５,2023-02-20,株式会社
株式会社三幸,東京都北区田端３丁目２４番７号,2023-02-20,株式会社
株式会社中垣工業社,大阪府大阪市此花区酉島４丁目１番１５－９０３号,2023-02-20,株式会社
株式会社中村工務店,滋賀県守山市水保町１１５４番地２２,2023-02-20,株式会社
株式会社中村興業,千葉県船橋市二和東４丁目８番１３号,2023-02-20,株式会社
株式会社中田,福井県敦賀市木崎３０号１２番地,2023-02-20,株式会社
株式会社久,東京都港区南麻布５丁目１４番１４号ＨＩＲＯＯ２３、２Ｆ,2023-02-20,株式会社
株式会社二八牌,東京都中央区銀座１丁目１２－４Ｎ＆ＥＢＬＤ．７階,2023-02-20,株式会社
株式会社住まい不動産,福岡県筑紫野市石崎１丁目６番５－１０５号,2023-02-20,株式会社
株式会社佐藤工業,愛知県名古屋市西区城西町１４７番地グランドゥール城西２０１号,2023-02-20,株式会社
株式会社傑,東京都中央区築地７丁目１２－６－２０１,2023-02-20,株式会社
株式会社光世,京都府京都市山科区西野大鳥井町１１１番地６０,2023-02-20,株式会社
株式会社勝榮,東京都豊島区池袋２丁目４９番－１号高橋乾幸ビル３０２,2023-02-20,株式会社
株式会社北優,北海道札幌市東区北丘珠二条２丁目１－１５,2023-02-20,株式会社
株式会社北栄コンクリート,大阪府和泉市三林町５４７番地の１,2023-02-20,株式会社
株式会社印旛商会,千葉県印西市大森７８４番地２,2023-02-20,株式会社
株式会社友百合,大阪府大阪市北区本庄東１丁目２２番２５号,2023-02-20,株式会社
株式会社坂田農産,滋賀県蒲生郡日野町大字西大路１９６３,2023-02-20,株式会社
株式会社増田美装,京都府京都市右京区龍安寺塔ノ下町１６－１１あすなろ館１－Ｃ,2023-02-20,株式会社
株式会社大倉デザイン事務所,東京都港区白金台３丁目４番２１号,2023-02-20,株式会社
株式会社山商,福岡県行橋市大字稲童３２２７番地５,2023-02-20,株式会社
株式会社島,岐阜県加茂郡坂祝町酒倉２２２２番地,2023-02-20,株式会社
株式会社志学,大阪府大阪市天王寺区上本町５丁目７番２号ファンターナ上本町５０２号,2023-02-20,株式会社
株式会社松尾モータープール,兵庫県尼崎市食満５丁目２４番１号,2023-02-20,株式会社
株式会社松永工藝社,神奈川県横浜市中区長者町３丁目８番地１３ＴＫ関内プラザ７０６,2023-02-20,株式会社
株式会社永慶商事,大分県杵築市大字猪尾字六反田７５０番地１,2023-02-20,株式会社
株式会社海晟,福岡県福岡市中央区高砂２丁目８－１２朝野ビル４階,2023-02-20,株式会社
株式会社町環スチール,東京都町田市南町田１丁目３番３１号,2023-02-20,株式会社
株式会社石川設備,大阪府豊中市豊南町東２丁目１１番２号,2023-02-20,株式会社
株式会社祥瑞商事,神奈川県横浜市中区山下町１５０,2023-02-20,株式会社
株式会社福,東京都港区南麻布５丁目１４番１４号ＨＩＲＯＯ２３、２Ｆ,2023-02-20,株式会社
株式会社秀心機設,神奈川県横浜市港北区小机町９９９番地コスモ市川１０１,2023-02-20,株式会社
株式会社紀南エステート,和歌山県田辺市新庄町３７７番地,2023-02-20,株式会社
株式会社羽賀建設,千葉県木更津市潮見６丁目１１番２号,2023-02-20,株式会社
株式会社豊明第一発電所,愛知県豊明市沓掛町石根２１番地,2023-02-20,株式会社
株式会社豊明第二発電所,長野県茅野市北山５５１３番地２７３,2023-02-20,株式会社
株式会社賢林社,京都府京田辺市薪堀切谷８番地３３,2023-02-20,株式会社
株式会社酒井電設,愛知県清須市阿原神門１４１－Ｅ,2023-02-20,株式会社
株式会社黒木溶接工業,大阪府摂津市鳥飼新町２丁目２－２１,2023-02-20,株式会社
