法人名,住所,設立日,法人種別
株式会社ＢＥＬＸ,東京都北区志茂４丁目４８番４－６０１号,2024-03-18,株式会社
株式会社ＢＬＵＥＪＥＡＮ,東京都港区芝３丁目３２番１２－４０１号,2024-03-18,株式会社
株式会社Ｂｅ　ｒｉｇｈｔ,大阪府大阪市淀川区西宮原２丁目７番４８－３０８号,2024-03-18,株式会社
株式会社Ｂｒｅａｋｔｈｒｏｕｇｈ,神奈川県川崎市川崎区大島５丁目２９番８号,2024-03-18,株式会社
株式会社ＢｒｉｄｇｅＬｉｎｋ　Ｊａｐａｎ,東京都立川市栄町４丁目３番地の３,2024-03-18,株式会社
株式会社Ｂｒｉｄｇｅｓ　ｔｏ　Ｉｎｃｌｕｓｉｏｎ,神奈川県川崎市中原区市ノ坪６７１番地２０,2024-03-18,株式会社
株式会社Ｂｒｉｎｅｎｔ,静岡県浜松市中央区元浜町３４番地の１５,2024-03-18,株式会社
株式会社ＣＯＣＯ,東京都渋谷区道玄坂１丁目１０番８号渋谷道玄坂東急ビル２Ｆ－Ｃ,2024-03-18,株式会社
株式会社ＣＯＣＯサポート,北海道札幌市手稲区富丘三条４丁目１２－４,2024-03-18,株式会社
株式会社ＣＯＣＯＲＡＩＳＥ,東京都新宿区高田馬場３丁目１番５号サンパティオ高田馬場３０９号室,2024-03-18,株式会社
株式会社ＣＯＣＯＲＯ　ＦＩＯＣＣＯ,岐阜県美濃加茂市太田本町２丁目２番地１今枝ビル１階,2024-03-18,株式会社
株式会社ＣＯＲＯＬＥ,兵庫県神戸市長田区片山町５丁目１１－３プリオーレ神戸山ノ手４０６,2024-03-18,株式会社
株式会社ＣＲＯＳＳ　ＭＥＭＢＥＲ,神奈川県足柄上郡大井町大井中央４６番地,2024-03-18,株式会社
株式会社Ｃａｒｒｙ　Ｍｏｒｅ,奈良県生駒市山崎町４番２０号大都ビル１Ｆ,2024-03-18,株式会社
株式会社Ｃｒａｄｌｅ,京都府京都市中京区本能寺町１１１イツキビル３０１,2024-03-18,株式会社
株式会社Ｃｒｅａｔｅ　ｅｒａ,高知県香南市夜須町手結山１７１４番地６,2024-03-18,株式会社
株式会社ＣｒｅａｔｅＡｒｋ,東京都品川区西品川１丁目１－１住友不動産大崎ガーデンタワー９階,2024-03-18,株式会社
株式会社Ｄ．Ｙ．Ｃ．,京都府京都市中京区壬生高樋町６０番地８０,2024-03-18,株式会社
株式会社ＤＡＩＴＥＣ,兵庫県明石市鷹匠町６番１１号,2024-03-18,株式会社
株式会社ＤＡＹＳ,兵庫県神戸市西区天が岡１８－７,2024-03-18,株式会社
株式会社Ｄｅｃｏｐｉｎ,岩手県奥州市水沢上姉体１丁目７番地２１,2024-03-18,株式会社
株式会社ＥＥ　ＬＩＦＥ,大阪府大阪市港区波除１丁目２番９－７０１号,2024-03-18,株式会社
株式会社ＥＩＧＨＴ　ＯＮＥ８１,愛媛県松山市北藤原町３番地１アルファステイツ市駅西１３０７号,2024-03-18,株式会社
株式会社ＥＩＴＡ,福岡県福岡市博多区中洲１丁目３番１５号オンリ－ワンビル２Ｆ,2024-03-18,株式会社
株式会社ＥＲＵＳＨＥＥ,東京都立川市柴崎町２丁目６番３号,2024-03-18,株式会社
株式会社Ｆ,北海道札幌市東区北二十六条東８丁目２－１－５０６,2024-03-18,株式会社
株式会社ＦＡＭ,大阪府大阪市東住吉区北田辺３丁目４番１０号,2024-03-18,株式会社
株式会社ＦＡＲＭ　ＴＯ,山口県山口市宮野上４８６番地１,2024-03-18,株式会社
株式会社ＦＡＺＡＬ　ＴＲＡＤＩＮＧ,茨城県坂東市矢作１２１２番地９,2024-03-18,株式会社
株式会社ＦＪＣ,大阪府大阪市淀川区木川東３丁目１番１６号,2024-03-18,株式会社
株式会社ＦＫ,北海道苫小牧市澄川町５丁目２６番２２号,2024-03-18,株式会社
株式会社ＦＳ,新潟県新潟市西区五十嵐２の町８６０８番地７ハイツリバーヒルズＡ２０２,2024-03-18,株式会社
株式会社ＦＵＪＩ,福岡県福岡市博多区中洲１丁目３番１５号オンリーワンビル２Ｆ,2024-03-18,株式会社
株式会社ＦＵＴＵＲＩＺＥＲ,東京都港区南青山３丁目１番３６号青山丸竹ビル６Ｆ,2024-03-18,株式会社
株式会社ＦａｎＴａＳｙ,奈良県橿原市新賀町１７４－１３,2024-03-18,株式会社
株式会社Ｆａｎｔａｓｉｓｔａ,山梨県笛吹市石和町東油川２９１番地１,2024-03-18,株式会社
株式会社ＦｉｖｅＫｉｎｄ,佐賀県小城市三日月町織島２８３０,2024-03-18,株式会社
株式会社Ｆｏｏｄ　ＡＩ　Ｌａｂ,兵庫県神戸市北区藤原台北町５丁目２番１０－１２０２号,2024-03-18,株式会社
株式会社Ｆｏｒｅｓｔ．Ｂ,北海道札幌市東区北二十四条東１４丁目３番２１号元町パークヴィラ１０３,2024-03-18,株式会社
株式会社Ｇ．ｃｏｍ　Ｒ＆Ｍ,東京都千代田区内神田２丁目７番１３号山手ビル３号館３階,2024-03-18,株式会社
株式会社ＧＡＲＯ,岐阜県不破郡垂井町綾戸１６２番地の３,2024-03-18,株式会社
株式会社ＧＬＯＢＡＬ　ＡＰＰＬＩＥＤ,東京都渋谷区松濤１丁目１９番１０号シクセー松涛２０４,2024-03-18,株式会社
株式会社Ｇｒａｎｄ　Ｒｏｏｔｓ　Ｂｒｏｔｈｅｒｓ,大阪府大阪市北区東天満２丁目９番３号,2024-03-18,株式会社
株式会社Ｇｚ　ｅｓｔａｔｅ,神奈川県横浜市西区みなとみらい４丁目４番２号横浜ブルーアベニュー１２Ｆ,2024-03-18,株式会社
株式会社ＨＡＮＡ,高知県香南市野市町上岡２５９２番地１,2024-03-18,株式会社
株式会社ＨＥＴＳ,福岡県糟屋郡篠栗町大字尾仲５４５番地４,2024-03-18,株式会社
株式会社ＨＩ,栃木県足利市朝倉町３丁目４番地１ノース２０３,2024-03-18,株式会社
株式会社ＨＭＤ,大阪府摂津市浜町１１番１５号,2024-03-18,株式会社
株式会社ＨＯＲＡＫＥＮ,大阪府大阪狭山市山本南４１,2024-03-18,株式会社
株式会社ＨＹＵ,大阪府大阪市旭区高殿２丁目１８番１３－１０１１号,2024-03-18,株式会社
株式会社Ｈａｍａｎｏ　Ｄｅｓｉｇｎ,京都府木津川市南加茂台１５丁目５番地１,2024-03-18,株式会社
株式会社Ｈｅｌｆｅｎ,岡山県岡山市北区上中野２丁目２２番１号アルファステイツ岡山上中野３０６号,2024-03-18,株式会社
株式会社Ｈｉ‐ＢＥＡＲＳ,埼玉県川越市寿町１丁目２２６３番地５,2024-03-18,株式会社
株式会社Ｈｉｋｏｕｓｅｎ,東京都台東区清川１丁目２１－５ＷＡＬＬａｐａｒｔｍｅｎｔ５階大区画号室,2024-03-18,株式会社
株式会社ＩＣＨＩＲＯ　ＷＥＬＤＩＮＧ,兵庫県明石市立石２丁目２番１－７０３号,2024-03-18,株式会社
株式会社ＩＫＩｐｕｒｏ,大阪府堺市美原区大饗５３番地１－１０１号,2024-03-18,株式会社
株式会社ＩＴ　Ｂａｓｅ,岡山県岡山市北区津島新野１丁目１番７号,2024-03-18,株式会社
株式会社ＩＴＮＳ,東京都千代田区岩本町１丁目１３番５号ＴＲＵＳＴＶＡＬＵＥ岩本町２階,2024-03-18,株式会社
株式会社Ｉｎｔｅｒｅｖｅ,大阪府茨木市中穂積１丁目２番５１号シャトー春日第３ビル２階,2024-03-18,株式会社
株式会社ＪＲＥ,東京都中央区明石町５番２７号,2024-03-18,株式会社
株式会社ＪＵＮＯ,大阪府泉南郡熊取町青葉台１丁目１番３号,2024-03-18,株式会社
株式会社Ｋ‐ｔｅｃｈｎｏ,兵庫県加古川市神野町西条９９７番地の１,2024-03-18,株式会社
株式会社ＫＥＩＡＩ,静岡県静岡市葵区常磐町１丁目２番地の７冨井ビル３階,2024-03-18,株式会社
株式会社ＫＩ建設,沖縄県沖縄市園田３丁目１１番４８号１Ｆ,2024-03-18,株式会社
株式会社ＫＩＲ,大阪府堺市西区浜寺船尾町西２丁１８４番地,2024-03-18,株式会社
株式会社ＫＪ,東京都杉並区成田西２丁目２３番１０号,2024-03-18,株式会社
株式会社ＫＫＲ,東京都品川区上大崎３丁目５番８―１８０３号,2024-03-18,株式会社
株式会社ＫＯＤＡＭＡ,北海道札幌市東区北四十一条東２丁目１番１５－２０５号,2024-03-18,株式会社
株式会社ＫＯＭＡＫＥＮ,高知県南国市緑ケ丘３丁目１００８番地,2024-03-18,株式会社
株式会社ＫＳＬ,兵庫県神戸市西区井吹台東町５丁目７３番地の１３,2024-03-18,株式会社
株式会社ＫＳＴ１０,東京都千代田区内幸町２丁目１番６号,2024-03-18,株式会社
株式会社ＫＵＲＯＮＥＫＯ　Ｐｒｏ,徳島県小松島市新居見町字高内１２番地,2024-03-18,株式会社
株式会社ＫＵＳＡ　ＬＡＢ,新潟県佐渡市平清水５３５番地１,2024-03-18,株式会社
株式会社Ｋｃｏｍｐａｎｙ,北海道札幌市中央区南十四条西８丁目２番１８－２０１号,2024-03-18,株式会社
株式会社ＬＤＨ,青森県青森市本町１丁目６番１７号,2024-03-18,株式会社
株式会社ＬＩＣＯＬＡＳ,静岡県浜松市中央区山下町２番地の１,2024-03-18,株式会社
株式会社ＬＩＶＦＲＥＥ,埼玉県ふじみ野市北野１丁目５番１５号,2024-03-18,株式会社
株式会社ＬＪ建設,沖縄県沖縄市中央３丁目８番１７号シティビューマンション５０３,2024-03-18,株式会社
株式会社ＬＪ興産,沖縄県沖縄市園田３丁目１１番４８号１Ｆ,2024-03-18,株式会社
株式会社ＬＯＯＫ　ＡＧＥ,石川県野々市市若松町１０番２２号,2024-03-18,株式会社
株式会社ＬＯＶＥＬＥ,兵庫県明石市朝霧南町２丁目８番２２号,2024-03-18,株式会社
株式会社Ｌｅｆｓｕｒｅｌｙ,山梨県富士吉田市下吉田２丁目２７番１５号,2024-03-18,株式会社
株式会社Ｌｅｏ　ｃｏｎｃｅｒｔｏ．,香川県木田郡三木町大字井上４０８６番地,2024-03-18,株式会社
株式会社Ｌｅｓｓ,東京都渋谷区渋谷２丁目１９－１５宮益坂ビルディング６０９,2024-03-18,株式会社
株式会社Ｌｕｓ　ｄｅ　ｅｓｐｅｒａｎｚａ,兵庫県西宮市上ケ原七番町３番３１－１５号,2024-03-18,株式会社
株式会社Ｍ’ｓエンジニア,大阪府柏原市平野２丁目９番３３－１０３号,2024-03-18,株式会社
株式会社Ｍ・Ｓ・Ｔ,岩手県北上市和賀町藤根１８地割１４番地,2024-03-18,株式会社
株式会社ＭＡＴＥ．ＪＰ,福岡県福岡市西区石丸２丁目７番３号,2024-03-18,株式会社
株式会社ＭＣ,神奈川県川崎市麻生区百合丘３丁目２３番地７,2024-03-18,株式会社
株式会社ＭＩＮＡＭＯ,山梨県甲斐市篠原６１番地２,2024-03-18,株式会社
株式会社ＭＩＲＡＳＩＳＯＮＥ,東京都文京区小日向３丁目１番８号ヴィラホワイト２Ｆ,2024-03-18,株式会社
株式会社ＭＫ２号,東京都港区元麻布３丁目７番５号３１４,2024-03-18,株式会社
株式会社ＭＴハウジング,東京都杉並区宮前５丁目７－６,2024-03-18,株式会社
株式会社ＭＹ,東京都新宿区歌舞伎町２丁目１０番５号Ｇ１ビル４階,2024-03-18,株式会社
株式会社Ｍｉｎｏ　Ｌｉｎｏ１８３,神奈川県横須賀市大滝町２丁目１１番地,2024-03-18,株式会社
株式会社Ｎ　Ｖｅｃ,東京都港区六本木３丁目３番２７号,2024-03-18,株式会社
株式会社Ｎ＆Ａホールディングス,埼玉県久喜市栗原２丁目１番地１５,2024-03-18,株式会社
株式会社ＮＥＵＢＡＵ,愛媛県松山市古三津１丁目２９番２６－３号,2024-03-18,株式会社
株式会社ＮＥＸＴＬＩＦＥ,岩手県盛岡市西見前１１地割１０７番地１,2024-03-18,株式会社
株式会社ＮＩＫＯ,東京都豊島区池袋２丁目１２番１４号第８前島ビル１０１,2024-03-18,株式会社
株式会社ＮＫ‐ＦＯＯＤＳ,岡山県岡山市中区四御神２６２番地１３,2024-03-18,株式会社
株式会社ＮＯＧＡ　Ｗｉｎｄｏｗｓ　Ｐａｒｔｎｅｒ,静岡県浜松市中央区有玉南町２２０５番地の１,2024-03-18,株式会社
株式会社ＮＯＬＦＣ,大阪府羽曳野市白鳥３丁目６番１２号,2024-03-18,株式会社
株式会社Ｎｅｘｇｅｎ　Ｃｒｅａｔｉｖｅ　Ｌｉｎｋｓ,茨城県取手市白山２丁目１９番２号,2024-03-18,株式会社
株式会社ＯＮＯ,東京都北区上十条１丁目１６番７号,2024-03-18,株式会社
株式会社ＯＮＹＯ,大阪府大阪市天王寺区松ケ鼻町１０番１６号,2024-03-18,株式会社
株式会社Ｏｎｅ　Ｄｅｃｉｓｉｏｎ　Ａｗａｙ,東京都練馬区土支田２丁目２９－２０ヴィラハーベスト２０３,2024-03-18,株式会社
株式会社Ｐ‐ｂｏｎｄ,東京都港区北青山１丁目３番１号アールキューブ青山３階,2024-03-18,株式会社
株式会社Ｐ＆Ｋ,東京都渋谷区神宮前３丁目４２番２号,2024-03-18,株式会社
株式会社ＰＯＲＴ,東京都中央区新富１丁目４番１号,2024-03-18,株式会社
株式会社ＰＲＩＮＣＥＳＳ,広島県三原市館町１丁目４番４－８０２号,2024-03-18,株式会社
株式会社Ｐｅａｃｈ,東京都新宿区富久町１６番１０－６０６号,2024-03-18,株式会社
株式会社ＰｏＣａｓｋ　Ｅ＆Ｍ　ＪＡＰＡＮ,東京都渋谷区道玄坂１丁目１２番１号,2024-03-18,株式会社
株式会社Ｐｏｉｎｔ　ｅ　Ｐｏｉｎｔ,大阪府大阪市阿倍野区北畠３丁目３番４３号,2024-03-18,株式会社
株式会社Ｐｒａｃｔｉｃｅ,高知県高知市はりまや町１丁目２番１２号１階,2024-03-18,株式会社
株式会社Ｐｕｂｌｉｃ　Ｓｈａｐｅｒ　Ｎｅｔｗｏｒｋｓ,東京都港区白金１丁目２番２－Ｗ１５１５号,2024-03-18,株式会社
株式会社Ｐｕｒｒｎｏｖａｔｅ,福岡県太宰府市水城４丁目１４番１１号,2024-03-18,株式会社
株式会社Ｒスマイル,静岡県田方郡函南町間宮７６８番地の４,2024-03-18,株式会社
株式会社ＲＡＩＢＯＯ,大阪府大阪市城東区成育１丁目６番１号,2024-03-18,株式会社
株式会社ＲＥ,兵庫県西宮市苦楽園二番町１９－４９,2024-03-18,株式会社
株式会社ＲＥＥＫＡ,千葉県流山市美原３丁目８９番地の３,2024-03-18,株式会社
株式会社ＲＥＩＴ,三重県津市芸濃町椋本５０２２番地５,2024-03-18,株式会社
株式会社ＲＥＶＥＲ,東京都中央区銀座１丁目２２番１１号銀座大竹ビジデンス２Ｆ,2024-03-18,株式会社
株式会社ＲＯＵＴＥ‐ＢＡＳＥＤ,千葉県市川市本北方１丁目４８番地４号,2024-03-18,株式会社
株式会社ＲＹＵＧＩ,岡山県岡山市南区泉田１丁目８番１８号,2024-03-18,株式会社
株式会社Ｒａｉｓｅｈｏｏｄ,神奈川県横須賀市追浜本町１丁目４８番地１,2024-03-18,株式会社
株式会社Ｒｅｌｉｅｆ,大阪府八尾市楠根町３丁目３５番地の２,2024-03-18,株式会社
株式会社Ｒｏｓｅｍｅｎｅ,東京都北区神谷１丁目３－３－１４０９,2024-03-18,株式会社
株式会社Ｓ．Ｄ．Ｓ,和歌山県田辺市高雄１丁目１番３３号,2024-03-18,株式会社
株式会社ＳＥＩＥＩ,愛媛県松山市堀江町甲１８３２番地の４,2024-03-18,株式会社
株式会社ＳＥＮＴＥ,山口県山口市鋳銭司２７０２番地５,2024-03-18,株式会社
株式会社ＳＨＩＫＩエステート,佐賀県小城市小城町松尾４０８７番地１,2024-03-18,株式会社
株式会社ＳＩ．Ｅ,兵庫県神戸市中央区磯辺通１丁目１番１８号カサベラ国際プラザビル７０７号室,2024-03-18,株式会社
株式会社ＳＫＴマネジメント,滋賀県高島市安曇川町横江浜１９２番地,2024-03-18,株式会社
株式会社ＳＬＳ,栃木県宇都宮市塙田３丁目１番１６号,2024-03-18,株式会社
株式会社ＳＳコミュニケーション,東京都台東区上野６丁目１番６号,2024-03-18,株式会社
株式会社ＳＴＡＹＧＯＬＤ,岐阜県多治見市笠原町２４５５番地の７１７,2024-03-18,株式会社
株式会社ＳＵＮエイチ不動産,宮城県仙台市青葉区北目町２番３９号東北中心ビル８階,2024-03-18,株式会社
株式会社Ｓａｋｕｒａｉ　Ｊａｐａｎ,栃木県足利市福居町１９７０番地１４,2024-03-18,株式会社
株式会社Ｓａｌａ,東京都渋谷区代々木３丁目４６番１６号小野木ビル４０５号,2024-03-18,株式会社
株式会社Ｓｈａｎｒｉ,千葉県千葉市美浜区浜田１丁目３番地－８５４号,2024-03-18,株式会社
株式会社Ｓｉｍｐｌｅ,神奈川県川崎市高津区諏訪３丁目１８番６－３０５号,2024-03-18,株式会社
株式会社ＳｉｎｃｅｒｅＢｅａｕｔｙ,東京都新宿区北新宿４丁目３番１０－７０６号,2024-03-18,株式会社
株式会社Ｓｔｅｐトータルリフォーム,福岡県飯塚市柳橋５６番地１ディアコートハイツＥ－２０１,2024-03-18,株式会社
株式会社Ｓｙｕ　Ｏｎｅ,北海道札幌市中央区南四条西４丁目２番地４－２階,2024-03-18,株式会社
株式会社Ｔ‐Ｓｔａｒｋ,熊本県熊本市中央区帯山２丁目６－２２サンフェスタ帯山３０１,2024-03-18,株式会社
株式会社ＴＡＩＬ,埼玉県坂戸市鶴舞４丁目６番６号,2024-03-18,株式会社
株式会社ＴＣＫ,東京都千代田区神田小川町１丁目１０番地２,2024-03-18,株式会社
株式会社ＴＥＮ,京都府八幡市男山吉井１０番地２６,2024-03-18,株式会社
株式会社ＴＨＲＥＥ,岡山県岡山市南区中畦２７１番地１４,2024-03-18,株式会社
株式会社ＴＯＤＡ,京都府京都市伏見区淀下津町１１番地ルナソーレ淀１０１号,2024-03-18,株式会社
株式会社ＴＹＬＩＢＥＲ,広島県福山市加茂町大字下加茂５００番地１６,2024-03-18,株式会社
株式会社ＴｅｃｈＧｒｏｗｔｈ,東京都新宿区西新宿３丁目３番１３号西新宿水間ビル６階,2024-03-18,株式会社
株式会社Ｕ　Ｃａｒｅｅｒ,東京都港区虎ノ門１丁目１１番１３号,2024-03-18,株式会社
株式会社ＵＤ,兵庫県姫路市飾磨区城南町２丁目１番地５０１,2024-03-18,株式会社
株式会社ＵＬＵ,沖縄県那覇市泊１丁目２４番７号,2024-03-18,株式会社
株式会社ＵＮＩＶＥＲＳＥ,新潟県新潟市秋葉区新津東町１丁目３－３１－１０,2024-03-18,株式会社
株式会社Ｕｎｉｔｅ　Ｋｎｏｔ,神奈川県川崎市幸区戸手本町１丁目７番地２,2024-03-18,株式会社
株式会社ＶＥＬＯ　ＫＯＢＥ,兵庫県神戸市兵庫区羽坂通３丁目１番１５号,2024-03-18,株式会社
株式会社ＷＡＮ　ＶＯＹＡＧＥ,岡山県岡山市中区円山７８番１,2024-03-18,株式会社
株式会社ＷＡＶＥ,大阪府大阪市此花区西九条３丁目４－３４－３１１,2024-03-18,株式会社
株式会社ＷＨＩＴＥ　ＥＡＲＴＨ,山梨県南都留郡富士河口湖町大石２１２３番地２５,2024-03-18,株式会社
株式会社ＷＬＣ,兵庫県神戸市西区見津が丘１丁目３番地４,2024-03-18,株式会社
株式会社Ｗｅａｖｅ　Ｃｒｅａｔｉｖｅ,東京都港区六本木７丁目１２番２号,2024-03-18,株式会社
株式会社Ｙ‐Ｂｅａｕｔｙ,岐阜県高山市花岡町３丁目８０番地８番,2024-03-18,株式会社
株式会社Ｙ．ｃｏｃｏ,東京都港区芝浦１丁目６番４１号,2024-03-18,株式会社
株式会社ＹＥＥＬＥ　ＮＥＴＷＯＲＫ,東京都新宿区百人町２丁目２０番２２号スカイコート新宿Ⅱ１０８－Ｄ,2024-03-18,株式会社
株式会社ＹＵサービス,滋賀県大津市新免１丁目３番１７号,2024-03-18,株式会社
株式会社ＹＵＨＩ　ＦＡＲＭ,埼玉県北足立郡伊奈町大字小室７６０番地８,2024-03-18,株式会社
株式会社Ｙｕ,東京都新宿区北新宿２丁目２１番２－５１５号,2024-03-18,株式会社
株式会社ＺＫホールディングス,埼玉県さいたま市大宮区桜木町２丁目３３７番地１,2024-03-18,株式会社
株式会社Ｚｅｒｏ　Ｃｒｅａｔｅ,岡山県倉敷市連島３丁目２番５号,2024-03-18,株式会社
株式会社ａｌｉｏｔ,大阪府八尾市東本町１丁目１番５２号,2024-03-18,株式会社
株式会社ａｏ,岐阜県岐阜市日光町３丁目５１番地４,2024-03-18,株式会社
株式会社ｂｒｆ,静岡県磐田市見付２９１８番地１,2024-03-18,株式会社
株式会社ｃｏｃｏｋａｒａ,岡山県岡山市東区中尾１－１３１,2024-03-18,株式会社
株式会社ｃｒｕｔｃｈ,新潟県新潟市西区小針２丁目３４－１３,2024-03-18,株式会社
株式会社ｅ‐ｄａｔａｂａｎｋ,愛媛県松山市千舟町４丁目３番７号青野ビル１階,2024-03-18,株式会社
株式会社ｅｐｏｃｈＬａｂ,福岡県福岡市中央区天神２丁目２番１２号Ｔ＆Ｊビルディング７Ｆ,2024-03-18,株式会社
株式会社ｅｔｈｉｃａｌ　ｂｅａｕｔｙ＆ｆｏｏｄ,神奈川県横浜市中区元町１丁目１８番地５レフィナード元町３Ｆ,2024-03-18,株式会社
株式会社ｅｘｃｙａ,神奈川県横須賀市大滝町１丁目９番地大滝町ビル６Ｆ,2024-03-18,株式会社
株式会社ｉＤｉｓｃｏｖｅｒｙ,和歌山県日高郡みなべ町芝１０－３２,2024-03-18,株式会社
株式会社ｉＴｗｉｎｋｌｅ,大阪府大阪市北区天満４丁目９番１６号３階,2024-03-18,株式会社
株式会社ｉｍａｔｏａ,兵庫県尼崎市武庫之荘７丁目３１番４号,2024-03-18,株式会社
株式会社ｉｎｋｓ,愛媛県今治市五十嵐甲９９番地１２,2024-03-18,株式会社
株式会社ｍａｒｉｋａ,北海道札幌市中央区北六条西１８丁目１１－１,2024-03-18,株式会社
株式会社ｍｏｎａ,東京都新宿区富久町１６番１０－６０６号,2024-03-18,株式会社
株式会社ｏｍＩｋｅＮ,石川県野々市市押野５丁目３３４番地,2024-03-18,株式会社
株式会社ｓｅａ,福岡県飯塚市若菜５２番地１,2024-03-18,株式会社
株式会社ｓｉａ,兵庫県神戸市垂水区天ノ下町１番１－３１２号,2024-03-18,株式会社
株式会社ｓｙｎｃ　ｔｅｃｈ,山梨県中巨摩郡昭和町飯喰１５５４番地２,2024-03-18,株式会社
株式会社ｖｉａｌｕｔｅ,東京都品川区東品川４丁目１２番９－１７１２,2024-03-18,株式会社
株式会社ｗａｋａ,北海道札幌市西区西野一条２丁目８番３０号,2024-03-18,株式会社
株式会社ｗｅｌｌ２Ｌａｂ,東京都目黒区下目黒１丁目４－７グリーンハイツ行人坂２１６号,2024-03-18,株式会社
株式会社ｚｅｐｌｕｓ,広島県三次市十日市中１丁目４番１号,2024-03-18,株式会社
桑嶋工業株式会社,山口県周南市大字大河内２０９番地の４,2024-03-18,株式会社
森山工業株式会社,和歌山県和歌山市田屋１６３番地３８,2024-03-18,株式会社
横浜ステラ株式会社,神奈川県横浜市西区戸部町７丁目２４５番地１フェリース横浜２０１,2024-03-18,株式会社
款東西株式会社,千葉県印西市原３丁目２番地１１９,2024-03-18,株式会社
水﨑ホームデザイン株式会社,佐賀県佐賀市嘉瀬町大字十五７２８番地,2024-03-18,株式会社
泉進地所株式会社,大阪府高石市綾園６丁目１１番１５号,2024-03-18,株式会社
泰平ホールディングス株式会社,東京都中央区八丁堀１丁目７番７号,2024-03-18,株式会社
流山１０ロジスティック特定目的会社,東京都中央区八重洲２丁目２番１号,2024-03-18,その他の設立登記法人
流山１１ロジスティック特定目的会社,東京都中央区八重洲２丁目２番１号,2024-03-18,その他の設立登記法人
流山１２ロジスティック特定目的会社,東京都中央区八重洲２丁目２番１号,2024-03-18,その他の設立登記法人
流山９ロジスティック特定目的会社,東京都中央区八重洲２丁目２番１号,2024-03-18,その他の設立登記法人
満月の世界株式会社,群馬県富岡市富岡８３８番地３ａ．ｐ．ｂｅｌｌｗｏｏｄ３号,2024-03-18,株式会社
照商事株式会社,千葉県市川市南八幡１丁目２１番１７号,2024-03-18,株式会社
照鑫国際合同会社,大阪府大阪市生野区生野東２丁目９番１８－１０５号,2024-03-18,合同会社
特定非営利活動法人就労準備支援協会,兵庫県豊岡市泉町２０番３号,2024-03-18,その他の設立登記法人
特定非営利活動法人泉大津フットボールクラブ,大阪府和泉市弥生町２丁目９番１６号,2024-03-18,その他の設立登記法人
特定非営利活動法人磁気探査ＤＸ推進機構,沖縄県豊見城市字豊崎３番５９号トヨプラ４階,2024-03-18,その他の設立登記法人
