法人名,住所,設立日,法人種別
あだちの家電屋おのちゃん株式会社,東京都足立区東保木間２丁目１８－２,2025-01-06,株式会社
あまみさんの合同会社,東京都中央区銀座１丁目１３番４号Ｎ＆ＥＢＬＤ．６Ｆ,2025-01-06,合同会社
こはこ合同会社,東京都品川区西五反田２丁目９－７ドルミ五反田アンメゾン４０７号,2025-01-06,合同会社
さくらキッチン株式会社,福岡県福岡市中央区警固１丁目１３番１５－２０１号,2025-01-06,株式会社
さくらホールディングス合同会社,京都府京都市下京区松原通烏丸西入ル玉津島町２９４,2025-01-06,合同会社
さんふぃーるど株式会社,埼玉県さいたま市南区辻１丁目８番６号,2025-01-06,株式会社
たかはし合同会社,埼玉県所沢市西所沢１丁目２０番９号,2025-01-06,合同会社
はなさか商事株式会社,東京都港区虎ノ門４丁目３番１号城山トラストタワー２７階,2025-01-06,株式会社
ぼくん家株式会社,埼玉県深谷市櫛引１３７番地１,2025-01-06,株式会社
まり不動産株式会社,大阪府大阪市住吉区万代２丁目５番２１号,2025-01-06,株式会社
ゆるっとライフ株式会社,広島県福山市神辺町大字新湯野５６番地１１ペアーライフ新湯野２０２,2025-01-06,株式会社
アサイードリーム株式会社,大阪府岸和田市土生町４丁目３番１号,2025-01-06,株式会社
アズナブル株式会社,北海道苫小牧市汐見町２丁目１３番２０号,2025-01-06,株式会社
アユターレ合同会社,静岡県静岡市駿河区丸子６００１番地の１,2025-01-06,合同会社
アリス・ベルポート株式会社,山口県熊毛郡平生町大字平生町５６８番地の５４,2025-01-06,株式会社
アルゴラッソ株式会社,愛知県安城市住吉町５丁目１９番地１１,2025-01-06,株式会社
イノウエ株式会社,岡山県岡山市北区津高台４丁目２０５２番地１６,2025-01-06,株式会社
イノベイジメント株式会社,神奈川県横浜市神奈川区金港町５―１４クアドリフォリオ８Ｆ,2025-01-06,株式会社
インフィニティ合同会社,静岡県静岡市駿河区見瀬１６１－１コーポルサント１０６,2025-01-06,合同会社
エイトワンジャパン合同会社,愛知県春日井市中切町１丁目１２番地１０,2025-01-06,合同会社
エステート・エージェント株式会社,京都府京都市左京区高野東開町１番地７東大路高野第２住宅１２棟２０６号,2025-01-06,株式会社
エフケー・スマイル株式会社,茨城県小美玉市小川２８７番地３,2025-01-06,株式会社
エムアールビーワン一般社団法人,東京都新宿区四谷２丁目９番地１５東京ユナイテッド綜合事務所内,2025-01-06,その他の設立登記法人
エムツーライフデザイン合同会社,大阪府藤井寺市北條町２－３７,2025-01-06,合同会社
エーケー株式会社,東京都練馬区中村北２丁目１８番１４号,2025-01-06,株式会社
エースコンサルティング株式会社,神奈川県横浜市金沢区釜利谷東１丁目２７番３号,2025-01-06,株式会社
オルタナレジ１合同会社,東京都千代田区丸の内１丁目４番１号東京共同会計事務所内,2025-01-06,合同会社
カルダンフューチャー株式会社,神奈川県綾瀬市小園１５０９番地２カーサ小園２０１,2025-01-06,株式会社
ガイ・パートナーズ株式会社,東京都杉並区下井草１丁目２９番７号,2025-01-06,株式会社
キャリーワン株式会社,神奈川県横浜市神奈川区西寺尾３丁目５番７号,2025-01-06,株式会社
ギルークコンサルティング合同会社,千葉県印西市鹿黒南３丁目５番地２０,2025-01-06,合同会社
ケーエムズ株式会社,兵庫県姫路市高尾町１２番地舞ビル３Ｆ,2025-01-06,株式会社
ケーブルリンク合同会社,群馬県伊勢崎市田中島町１４３９番地９,2025-01-06,合同会社
ゴーフォワード合同会社,岡山県岡山市南区藤田４１３番地１０,2025-01-06,合同会社
サンクトリ合同会社,兵庫県明石市本町１丁目２番３３号興生ビル４階,2025-01-06,合同会社
サンニー合同会社,東京都中央区勝どき５丁目１２番地４号－２００５室,2025-01-06,合同会社
シックスオフィスマネジメント合同会社,東京都千代田区丸の内１丁目４番１号東京共同会計事務所内,2025-01-06,合同会社
シニアと家族のミカタ株式会社,岡山県岡山市中区原尾島３丁目８番２７号,2025-01-06,株式会社
シリウストレーディング株式会社,千葉県市川市行徳駅前２丁目２３番７－５０３号（サンクレイドル行徳）,2025-01-06,株式会社
ジェディック株式会社,東京都大田区久が原５丁目２２番２０号,2025-01-06,株式会社
ジャパントレーディング株式会社,東京都足立区大谷田２丁目２３番６号第２大信マンション１０３号,2025-01-06,株式会社
タケモト産業株式会社,大阪府大阪市中央区瓦町３丁目６番１３号,2025-01-06,株式会社
ティーホームズ株式会社,兵庫県神戸市西区竜が岡３丁目１５番地の３,2025-01-06,株式会社
ネクストイノベーション株式会社,東京都町田市野津田町１８１７番地２０,2025-01-06,株式会社
ネルネ株式会社,静岡県浜松市中央区高町３００番地の２７プレミスト高町７０３号室,2025-01-06,株式会社
ノーブル合同会社,和歌山県東牟婁郡串本町西向５００番地４,2025-01-06,合同会社
ハピネスユウ合同会社,愛知県名古屋市天白区原２丁目１３０６番地の３,2025-01-06,合同会社
ヒューマンリング株式会社,千葉県成田市飯仲３３６番地３１,2025-01-06,株式会社
ヒルギ合同会社,東京都千代田区丸の内１丁目４番１号東京共同会計事務所内,2025-01-06,合同会社
ビワホームズ合同会社,滋賀県愛知郡愛荘町目加田８９４,2025-01-06,合同会社
ピーアールワイ株式会社,大阪府寝屋川市八坂町１２番１３号旭八坂ビル３Ｆ,2025-01-06,株式会社
プレミアムベリー猪名川合同会社,大阪府池田市古江町１－５６,2025-01-06,合同会社
マスモトハートメディカル合同会社,東京都足立区江北７丁目１７番５－１０３号,2025-01-06,合同会社
マテリアル合同会社,東京都中央区銀座１丁目１２番４号Ｎ＆ＥＢＬＤ．６Ｆ,2025-01-06,合同会社
ミツワコンサルティング株式会社,神奈川県横浜市西区西平沼町１番２２－７１２号,2025-01-06,株式会社
ミヤムラグループ株式会社,京都府京都市右京区西院月双町１０５,2025-01-06,株式会社
ミヤ株式会社,大阪府大東市大野１丁目５－２７－１Ｆ,2025-01-06,株式会社
ミライロジスティクス株式会社,愛知県名古屋市港区小賀須３丁目１７０１番地の２,2025-01-06,株式会社
ミリディア合同会社,東京都世田谷区奥沢６丁目２２番１号,2025-01-06,合同会社
メイカサブランカ株式会社,東京都新宿区北新宿１丁目２９番１２－８０３号,2025-01-06,株式会社
メタルテック治具株式会社,宮城県仙台市若林区卸町１丁目２番１０号,2025-01-06,株式会社
モダンカイゼン合同会社,神奈川県大和市柳橋１丁目１０番地３レクセルマンション大和２０４号山口方,2025-01-06,合同会社
ユニコーン５０５０合同会社,東京都世田谷区給田５丁目８－５－Ｄ８０９,2025-01-06,合同会社
ラ・タコ株式会社,京都府京都市左京区下鴨膳部町８８－２１メゾンかしわべ１０５,2025-01-06,株式会社
一般社団法人ゆいまある舎,京都府向日市寺戸町二ノ坪２０番地の６２,2025-01-06,その他の設立登記法人
一般社団法人オッケー,富山県富山市水橋中町２４０９,2025-01-06,その他の設立登記法人
一般社団法人ツーリズムＫＵＲＥ,広島県呉市中央４丁目１番６号,2025-01-06,その他の設立登記法人
一般社団法人ハッピーフィッシュプロジェクト,長野県岡谷市銀座２丁目２番２２号,2025-01-06,その他の設立登記法人
一般社団法人ミラクルドット,沖縄県宜野湾市字喜友名１０３９Ｇタウンビル２Ｆ,2025-01-06,その他の設立登記法人
一般社団法人佐賀県歯科衛生士会,佐賀県佐賀市西田代２丁目５番２４号,2025-01-06,その他の設立登記法人
一般社団法人全日本特殊浴場協会連合会,東京都台東区千束３丁目３番２号,2025-01-06,その他の設立登記法人
一般社団法人北鹿ヘルスケアネット,秋田県大館市豊町３番１号,2025-01-06,その他の設立登記法人
一般社団法人岡山シニアライフサポート協会,岡山県岡山市中区原尾島３丁目８番２７号,2025-01-06,その他の設立登記法人
一般社団法人日本心不全薬学共創機構,神奈川県小田原市南鴨宮３丁目４９番５号,2025-01-06,その他の設立登記法人
一般社団法人日本生産共同機構,大阪府大阪市東成区中本５丁目２２番１３号,2025-01-06,その他の設立登記法人
一般社団法人日本美容ライフ協会,東京都中央区月島２丁目１３番１０－５０２号,2025-01-06,その他の設立登記法人
一般社団法人東海スノーボード協会,愛知県名古屋市中区錦２丁目６番１５号,2025-01-06,その他の設立登記法人
一般社団法人ＡＳＣ,東京都文京区小石川４丁目１９番６号ヴェラハイツ小石川６０２号室,2025-01-06,その他の設立登記法人
一般社団法人ＣｈｅｆＭｕｓｅ,東京都中央区築地３丁目１３番５号,2025-01-06,その他の設立登記法人
一般社団法人Ｄｒｅａｍｉｎｇ,神奈川県高座郡寒川町一之宮８丁目６番１３号,2025-01-06,その他の設立登記法人
一般社団法人ＨＡＰＰＹ　ＴＡＬＥ,愛知県名古屋市中区正木４丁目６番１０号,2025-01-06,その他の設立登記法人
一般社団法人Ｍａｓｊｉｄ　Ｉｎｄｏｎｅｓｉａ　Ｕｅｄａ,長野県上田市岩下１００番地,2025-01-06,その他の設立登記法人
一般社団法人Ｍａｙ,神奈川県横浜市港北区箕輪町１丁目２４番９号,2025-01-06,その他の設立登記法人
一般社団法人ＮＥＷシルクロード国際文化交流センター,大阪府大阪市北区梅田１丁目１１番４号大阪駅前第４ビル２０階,2025-01-06,その他の設立登記法人
一般社団法人ＰＮＳ,大阪府大阪市淀川区加島３丁目中２番１０－２０１号,2025-01-06,その他の設立登記法人
一般社団法人ＳＤＧｓ環境保全推進協会,山梨県甲斐市西八幡２３０２－５,2025-01-06,その他の設立登記法人
一般社団法人Ｓｆｉｄａ,東京都千代田区紀尾井町３番１２号,2025-01-06,その他の設立登記法人
一般社団法人Ｓｕｎｎｙｓｉｄｅ,兵庫県伊丹市安堂寺町３丁目３番地５,2025-01-06,その他の設立登記法人
一般社団法人Ｓｕｐｅｒ　Ｇｉｖｅｒｓ,東京都港区北青山１丁目３番１号アールキューブ青山３階,2025-01-06,その他の設立登記法人
一般社団法人ｍｉｃｈｉｔａｋｅ,東京都世田谷区桜上水３丁目６番５号,2025-01-06,その他の設立登記法人
一般社団法人ｓｉｇｎ　ｐｏｓｔ,北海道旭川市春光台五条２丁目１８番１号,2025-01-06,その他の設立登記法人
一般財団法人山口記念財団,静岡県沼津市足高２９２番地の６９,2025-01-06,その他の設立登記法人
一般財団法人Ｈｏｐｅフューチャー,群馬県太田市別所町２１４番地１,2025-01-06,その他の設立登記法人
一般財団法人ＳＨＩＺＵＫＡ＆ＬＥＯ　ＫＯＭＵＲＯ記念財団,東京都世田谷区成城７丁目２１番２号,2025-01-06,その他の設立登記法人
三洋商事合同会社,東京都国分寺市東元町４丁目１番２０号,2025-01-06,合同会社
中野ファミリー合同会社,熊本県菊池市雪野１６３５番地,2025-01-06,合同会社
丸八鋼管株式会社,千葉県浦安市港５番地,2025-01-06,株式会社
久長国際株式会社,大阪府大阪市西成区北津守２丁目５番５－１６号,2025-01-06,株式会社
京安鑫株式会社,京都府京都市南区東九条北烏丸町２４番地８,2025-01-06,株式会社
京銀国際株式会社,東京都新宿区四谷４丁目２４番１６号３階,2025-01-06,株式会社
仁済ホールディングス株式会社,東京都品川区大井１丁目４９番１２号,2025-01-06,株式会社
佳美株式会社,東京都新宿区大久保１丁目１０－６アムス新大久保３０１Ｃ号室,2025-01-06,株式会社
保守合同会社,京都府京都市下京区小稲荷町８５－２Ｇｒａｎｄ－Ｋ京都駅前ビル２０１,2025-01-06,合同会社
創和建設株式会社,佐賀県鳥栖市姫方町２７５番地１,2025-01-06,株式会社
労働者協同組合法人たすき星,滋賀県守山市水保町１５４１番地,2025-01-06,その他の設立登記法人
北友株式会社,北海道北広島市輪厚中央４丁目１番地２,2025-01-06,株式会社
北陸０１合同会社,富山県魚津市青島１６１番地８シャノワールⅡ２０２号室,2025-01-06,合同会社
医療法人うりぼうキッズクリニック,宮城県仙台市宮城野区岩切分台３丁目１番５号,2025-01-06,その他の設立登記法人
医療法人修済会,宮城県仙台市若林区沖野５丁目７番６号,2025-01-06,その他の設立登記法人
医療法人幸龍家,神奈川県横浜市都筑区牛久保１丁目２番９号メディコーポ都筑２０２号室,2025-01-06,その他の設立登記法人
医療法人愛医会,愛知県長久手市勝入塚４０２番地,2025-01-06,その他の設立登記法人
医療法人社団桜文会,神奈川県川崎市中原区木月住吉町１２番３号,2025-01-06,その他の設立登記法人
医療法人福岡西つつみ眼科,福岡県福岡市西区上山門１丁目４８６番２,2025-01-06,その他の設立登記法人
医療法人良優会,愛知県みよし市福田町碁盤田２番１,2025-01-06,その他の設立登記法人
医療法人銘祐会,愛知県名古屋市守山区小幡２丁目４番７号,2025-01-06,その他の設立登記法人
医療法人ＥＧＡ,神奈川県藤沢市藤沢５３０番地１０Ｆ．Ｓ．Ｃビル３０２区画,2025-01-06,その他の設立登記法人
協和織布株式会社,愛知県半田市乙川新町１丁目２０番地,2025-01-06,株式会社
協栄地所株式会社,山梨県甲府市丸の内３丁目２０番１号,2025-01-06,株式会社
南海浜運輸株式会社,茨城県神栖市横瀬９４０番地５,2025-01-06,株式会社
合同会社あかみとり,静岡県浜松市中央区入野町６２３４ロイヤルシングル１０号室,2025-01-06,合同会社
合同会社あんそん,京都府宇治市羽拍子町１３番地の１７,2025-01-06,合同会社
合同会社いわてデリカ,岩手県盛岡市中央通１丁目７－３５コアフィールドモリオカ１階－３階,2025-01-06,合同会社
合同会社うるはし,東京都千代田区神田須田町１丁目７番８号ＶＯＲＴ秋葉原Ⅳ２Ｆ,2025-01-06,合同会社
合同会社くますけ,宮崎県宮崎市花ケ島町観音免９４５番地１３,2025-01-06,合同会社
合同会社こまラボ,福島県伊達市保原町字十丁目７番地,2025-01-06,合同会社
合同会社さざなみ,千葉県千葉市中央区富士見２丁目７番９号富士見ビル６０９号,2025-01-06,合同会社
合同会社ひとてま,千葉県流山市市野谷４３５ヴェールデオトー２０３,2025-01-06,合同会社
合同会社びよんど,京都府長岡京市神足１丁目１９－４,2025-01-06,合同会社
合同会社ふじ丸商事,石川県金沢市三馬２丁目９０番地,2025-01-06,合同会社
合同会社みかん,埼玉県加須市柳生２６６６番地１,2025-01-06,合同会社
合同会社アップロード,新潟県新潟市西蒲区道上７４５番地１,2025-01-06,合同会社
合同会社アトリエゆう,沖縄県浦添市西原１丁目３番２号棚原ビル２０２,2025-01-06,合同会社
合同会社アレテ,神奈川県川崎市川崎区港町５番３－１９３２号,2025-01-06,合同会社
合同会社アンブロシア支援,広島県広島市西区田方３丁目９０９番地１ダイアパレスウエストシティ９２１号,2025-01-06,合同会社
合同会社イロドリ,富山県射水市中新湊１５‐１,2025-01-06,合同会社
合同会社エヌ・エス・ジェイ,佐賀県佐賀市兵庫北１丁目２１番３１－４０３号,2025-01-06,合同会社
合同会社オフィス若村,大阪府吹田市江坂町２丁目３番１０リーガル江坂１００１号,2025-01-06,合同会社
合同会社コネクト,群馬県高崎市栄町１８番８号,2025-01-06,合同会社
合同会社サクシード,京都府京都市伏見区醍醐上山口町３１番地１３,2025-01-06,合同会社
合同会社ジャストシナジー,熊本県熊本市南区白藤２丁目３番８０－７０５号,2025-01-06,合同会社
合同会社スターアニス,神奈川県鎌倉市七里ガ浜東４丁目１０―１０,2025-01-06,合同会社
合同会社セカンドティアラ,大阪府和泉市のぞみ野１丁目７番４号,2025-01-06,合同会社
合同会社セルフライト,埼玉県さいたま市北区土呂町１丁目１０番地１３,2025-01-06,合同会社
合同会社セレナ,静岡県三島市千枚原８番地の６,2025-01-06,合同会社
合同会社ダイユー,東京都世田谷区成城６丁目９番７号,2025-01-06,合同会社
合同会社ダビヨン,東京都品川区上大崎３丁目３番９－５２２号,2025-01-06,合同会社
合同会社トミリシェス,兵庫県西宮市日野町１８番２３号,2025-01-06,合同会社
合同会社トーキョースナバーランド,東京都江東区富岡１丁目２－８ストライプハウス４０１,2025-01-06,合同会社
合同会社ニャーテック,東京都千代田区九段南１丁目６番１７号千代田会館２階,2025-01-06,合同会社
合同会社ビーバービレッジ,群馬県桐生市梅田町４丁目３２４番地１,2025-01-06,合同会社
合同会社ファーストトレイル,兵庫県川西市寺畑２丁目５番２－５１０号,2025-01-06,合同会社
合同会社ブラックパレス,東京都品川区小山４丁目３番１３号,2025-01-06,合同会社
合同会社ホワイトベリー,千葉県市原市千種４丁目７番地４,2025-01-06,合同会社
合同会社ミルミー,東京都品川区大井５丁目１２－１－７０６,2025-01-06,合同会社
合同会社メイバックス,大阪府吹田市広芝町１０番８号董友ビル,2025-01-06,合同会社
合同会社メティス,埼玉県東松山市大字下青鳥１３７８番地８,2025-01-06,合同会社
合同会社ヨシ,福岡県福岡市博多区博多駅前１丁目２３番２号ＰａｒｋＦｒｏｎｔ博多駅前１丁目５Ｆ－Ｂ,2025-01-06,合同会社
合同会社ラテコンサル,埼玉県戸田市上戸田２丁目１７番１１号,2025-01-06,合同会社
合同会社ラムー,東京都杉並区宮前５丁目２４番２４号クレッセント２０１,2025-01-06,合同会社
合同会社ラーンダッシュジャパン,石川県金沢市堀川新町５番１号,2025-01-06,合同会社
合同会社リハクエスト,群馬県前橋市上泉町３４６４－１,2025-01-06,合同会社
合同会社リバスク,岡山県倉敷市中畝４丁目１７番２４号Ｂ１０２,2025-01-06,合同会社
合同会社リバティ,東京都世田谷区南烏山６丁目２７－３ウィンド烏山Ｂ１０２,2025-01-06,合同会社
合同会社リフォームのシンミ,埼玉県春日部市西金野井５４６番地４,2025-01-06,合同会社
合同会社リュミエール,岡山県岡山市北区表町３丁目８－１表町コーポ２０２,2025-01-06,合同会社
合同会社ルミナグロウ,北海道札幌市中央区南十一条西１２丁目２番２８－９０２号,2025-01-06,合同会社
合同会社レガシア,京都府舞鶴市字常３６３番地－１棟４０７号,2025-01-06,合同会社
合同会社ロイズ,滋賀県近江八幡市安土町常楽寺９４１番地９,2025-01-06,合同会社
合同会社ヴェルデ,東京都世田谷区大原１丁目４１番４号,2025-01-06,合同会社
合同会社一ノ谷,千葉県松戸市松戸２１０８番地の１アーバニティタカツキ３０６号,2025-01-06,合同会社
合同会社中小企業共創経営研究所,長野県長野市川中島町今井１６２７番地１５,2025-01-06,合同会社
合同会社久保圭紀,千葉県松戸市西馬橋幸町６６－６ＬＥＡＦＭＯＯＮ１Ｂ,2025-01-06,合同会社
合同会社井上工業,千葉県船橋市高野台４丁目１１番２１号,2025-01-06,合同会社
合同会社信光,北海道二海郡八雲町東野２７６番地１,2025-01-06,合同会社
合同会社凱,神奈川県大和市下鶴間２５４１番地１０,2025-01-06,合同会社
合同会社出羽屋,山形県酒田市新堀字聖の宮１０７番地－Ｄ号,2025-01-06,合同会社
合同会社勇気,愛知県碧南市港本町４番地２１,2025-01-06,合同会社
合同会社夢幻,京都府京都市山科区北花山西ノ野町３－８－１,2025-01-06,合同会社
合同会社大和,大阪府羽曳野市はびきの５丁目７番１号,2025-01-06,合同会社
合同会社富ヶ谷,神奈川県横浜市都筑区川和町２２８９番地３,2025-01-06,合同会社
合同会社山村オート,神奈川県藤沢市葛原１４０番地の２６,2025-01-06,合同会社
合同会社山脈,東京都世田谷区太子堂４丁目１８番１５号マガザン三軒茶屋２－３Ｆ－３,2025-01-06,合同会社
合同会社弥栄,富山県中新川郡立山町高原八ツ屋１６１番地,2025-01-06,合同会社
合同会社才有る者の楽園,鹿児島県霧島市国分松木東３－１５－３０２,2025-01-06,合同会社
合同会社晟輝工業,東京都板橋区坂下２丁目１４番５－２０４号,2025-01-06,合同会社
合同会社暖音ホーム,福岡県北九州市八幡西区本城東６丁目４番２８号,2025-01-06,合同会社
合同会社東海林会計総合事務所,岩手県花巻市松園町３６５番地１６,2025-01-06,合同会社
合同会社松よし,広島県広島市南区松原町３番２－４５０８号,2025-01-06,合同会社
合同会社浅能,大阪府大阪市住吉区遠里小野４丁目７番１６号,2025-01-06,合同会社
合同会社秀峰企画,東京都大田区池上７丁目１１－６－３０４,2025-01-06,合同会社
合同会社花月,大阪府大阪市生野区林寺３丁目４番１号３Ｆ,2025-01-06,合同会社
合同会社輝島水産,岡山県倉敷市藤戸町藤戸１４０４－５,2025-01-06,合同会社
合同会社遊彩ＴＡＮＡＫＡ,奈良県磯城郡田原本町大字三笠１３－１,2025-01-06,合同会社
合同会社野田,千葉県船橋市習志野台２丁目７３番２１号,2025-01-06,合同会社
合同会社銀桜サーモン養魚場,千葉県柏市新逆井１丁目４１番３７号,2025-01-06,合同会社
合同会社阿讃工房,徳島県板野郡板野町那東字谷口４－２,2025-01-06,合同会社
合同会社高木地所,神奈川県逗子市久木８丁目１６番３号,2025-01-06,合同会社
合同会社ＡＢＦＡＳｍｉｌｅ,群馬県北群馬郡榛東村大字新井１２１９番地,2025-01-06,合同会社
合同会社ＡＬＴＡ,山口県下関市長府安養寺１丁目１２番１５号,2025-01-06,合同会社
合同会社ＡＱＵＡ　ＣＩＴＹ,秋田県北秋田市脇神字赤川岱１４２番地１Ｆ,2025-01-06,合同会社
合同会社ＡＺＭ,大阪府大阪市住吉区遠里小野７丁目１番２号レオパレスネイバーズＳ２０６号,2025-01-06,合同会社
合同会社Ａｃｒｉｌ　Ｇａｒｄｅｎ,富山県富山市婦中町地角３３６番地,2025-01-06,合同会社
合同会社Ａｌｌ‐Ｌｉｎｅ,秋田県由利本荘市川口字大覚１８２,2025-01-06,合同会社
合同会社Ａｍｉｗｓ,福岡県田川郡川崎町大字川崎１０６１－２ＴＩビル２０２,2025-01-06,合同会社
合同会社ＢＩＴＷＩＮ,神奈川県横浜市港北区菊名６丁目３０－８－２０６,2025-01-06,合同会社
合同会社Ｂｅｖｅｌ,東京都渋谷区道玄坂１丁目１０番８号渋谷道玄坂東急ビル２Ｆ―Ｃ,2025-01-06,合同会社
合同会社Ｂｌｉｓｓ　ｗｉｔｈ,大阪府大阪市北区梅田１丁目２番２号大阪駅前第２ビル１２－１２,2025-01-06,合同会社
合同会社Ｂｌｉｓｓｗａｖｅ,東京都国分寺市泉町１丁目１番２０号,2025-01-06,合同会社
合同会社ＢｌｕｅＡｇｅ,千葉県船橋市本町６丁目１８－１９第３山中ビル４０１号室,2025-01-06,合同会社
