法人名,住所,設立日,法人種別
合同会社ＭＡＴＴＩＮＡ,愛知県名古屋市東区泉３丁目１７番１０号,2016-07-08,合同会社
合同会社Ｍｕｓｉｃａ,香川県観音寺市柞田町丙１２０８番地１,2016-07-08,合同会社
合同会社ＮＯＫＫＮ,福岡県福岡市博多区博多駅東３丁目１番２９号,2016-07-08,合同会社
合同会社ＯＤサポート,茨城県水戸市酒門町４２４８番地６,2016-07-08,合同会社
合同会社ＯＴＯ－ＮＡＲＩ,三重県四日市市鵜の森２丁目３番１４号,2016-07-08,合同会社
合同会社ＰＥＡＣＥ,北海道札幌市北区新琴似十二条１４丁目７番１０号,2016-07-08,合同会社
合同会社Ｐａｔｉｓｓ,神奈川県横浜市南区花之木町１丁目１６番地翁ビル１階,2016-07-08,合同会社
合同会社ＲＯＳＥ　ＢＬＡＮＣ,東京都渋谷区代々木２丁目１９番１２号,2016-07-08,合同会社
合同会社Ｒａｉｆｉｎｇｕ　Ｓｕｐｐｏｒｔ,大分県大分市東浜１丁目１３番２６号（アグランＣｏＣｏ３０３）,2016-07-08,合同会社
合同会社Ｔｏｍｂｏ７４,東京都世田谷区世田谷２丁目２４番１号パレ・ソレイユ世田谷弐丁目６０１号室,2016-07-08,合同会社
合同会社ＷＡＲＭ　ＨＥＡＲＴ,埼玉県久喜市桜田４丁目２０番２,2016-07-08,合同会社
合同会社ｆｒｅｅ　ｄａｙｓ,東京都町田市森野２丁目８番４号ロイヤルマンション１０２号室,2016-07-08,合同会社
合同会社ｏｒｉｅｎｔａｌ民宿,長崎県対馬市美津島町竹敷２３１番地９,2016-07-08,合同会社
合同会社ｙｅａｈ　ｂａｂｙ,東京都目黒区碑文谷４丁目２４－１３－３０３,2016-07-08,合同会社
吉源株式会社,東京都大田区大森西５丁目２４番２号,2016-07-08,株式会社
和泉工業株式会社,東京都府中市浅間町４丁目７番地の９,2016-07-08,株式会社
唯一無二株式会社,神奈川県川崎市中原区中丸子１３番地７リエトコート武蔵小杉イストタワー１６１４,2016-07-08,株式会社
坂本経理事務所合同会社,秋田県大仙市朝日町６番１７号,2016-07-08,合同会社
塩見タイル株式会社,大阪府大阪市港区夕凪１丁目８番８号,2016-07-08,株式会社
大栄工業株式会社,熊本県玉名郡南関町大字相谷１６８５番地１,2016-07-08,株式会社
宮崎県漁業販売株式会社,宮崎県宮崎市港２丁目６番地,2016-07-08,株式会社
寺澤工業株式会社,北海道札幌市厚別区大谷地東５丁目１６番３－６０６号,2016-07-08,株式会社
小島内装株式会社,神奈川県厚木市妻田西３丁目２４番２９－１０７号,2016-07-08,株式会社
小町国際合同会社,東京都板橋区高島平２丁目３３番７号,2016-07-08,合同会社
山下電器株式会社,福島県福島市渡利字中江町１番地の１,2016-07-08,株式会社
山口金属工業株式会社,大阪府守口市南寺方東通６丁目１８番８号,2016-07-08,株式会社
山本建設株式会社,大阪府大阪市都島区内代町３丁目１０番３０号,2016-07-08,株式会社
山澤新エネルギー株式会社,福岡県福岡市博多区博多駅前２丁目１９番１７号７０８号室,2016-07-08,株式会社
峰麗合同会社,東京都荒川区西日暮里６丁目５８番８号,2016-07-08,合同会社
帝斗工業株式会社,長野県長野市大字富竹８０番地５,2016-07-08,株式会社
広大株式会社,埼玉県川口市大字安行慈林１０１４番地の８,2016-07-08,株式会社
弁護士法人岡田春夫綜合法律事務所,大阪府大阪市北区豊崎３丁目２番１号淀川５番館７階,2016-07-08,その他の設立登記法人
新日本観光自動車労働組合,東京都足立区加賀１丁目１１番４号,2016-07-08,その他の設立登記法人
新星企画株式会社,東京都大田区北千束２丁目３１番３号,2016-07-08,株式会社
新環境ホールディングス合同会社,東京都千代田区麹町３丁目１番８号,2016-07-08,合同会社
日勝貿易株式会社,埼玉県さいたま市中央区上落合４丁目１２番６号シャンハイツ北与野２０１号,2016-07-08,株式会社
日本アメリケア株式会社,東京都新宿区下落合２丁目５番１６号,2016-07-08,株式会社
日本保莱塔株式会社,埼玉県草加市谷塚仲町２８９番地１０,2016-07-08,株式会社
日本富士國際株式会社,東京都港区三田１丁目２番１８号ＴＴＤビル,2016-07-08,株式会社
日進ビル株式会社,東京都練馬区豊玉上２丁目２４番９号,2016-07-08,株式会社
早稲田アイドルプロジェクト合同会社,東京都新宿区新宿５丁目１１番３０号新宿第五葉山ビル３階,2016-07-08,合同会社
明るい未来株式会社,大阪府大阪市旭区高殿２丁目１２番２５号１Ｆ,2016-07-08,株式会社
昭成商事株式会社,福岡県飯塚市綱分３４２番地１,2016-07-08,株式会社
有限会社藤原自動車整備工場,岡山県玉野市長尾１０５番地の１,2016-07-08,有限会社
有限会社辰己木工,鳥取県鳥取市上原８４２番地,2016-07-08,有限会社
東昭株式会社,東京都江東区青海２丁目２番Ａ－３０５号,2016-07-08,株式会社
東正国際株式会社,東京都中央区東日本橋２丁目２４番１２号,2016-07-08,株式会社
東洋ネクスト株式会社,宮城県仙台市青葉区一番町２丁目４番１号,2016-07-08,株式会社
東洋商事株式会社,東京都品川区西五反田１丁目３番８号,2016-07-08,株式会社
松本食品販売株式会社,千葉県長生郡長柄町鴇谷１００５番地,2016-07-08,株式会社
栄恒株式会社,東京都台東区千束４丁目３１番２号久栄ビル４Ｆ,2016-07-08,株式会社
株式会社いけだ会計,大阪府大阪市中央区南船場２丁目２番２－２０２号,2016-07-08,株式会社
株式会社いちろくはち,大阪府豊中市曽根西町２丁目４番３８号,2016-07-08,株式会社
株式会社いわかがみ,東京都中央区日本橋堀留町１丁目８番１５号,2016-07-08,株式会社
株式会社おいしい健康,東京都渋谷区恵比寿４丁目２０番３号,2016-07-08,株式会社
株式会社かずいち,東京都府中市四谷２丁目４５番地の１,2016-07-08,株式会社
株式会社きわみ,大阪府大阪市住之江区南港北２丁目１番１０号,2016-07-08,株式会社
株式会社こころ,茨城県笠間市下市毛１８８番地１,2016-07-08,株式会社
株式会社さかたガラス,広島県東広島市福富町上戸野３６３６番地４,2016-07-08,株式会社
株式会社しおたにＳＣ,東京都立川市錦町２丁目６番２２号,2016-07-08,株式会社
株式会社しろいろ,東京都台東区駒形２丁目１番２７号ＲＡＩＤ浅草リバーフロント５Ｆ,2016-07-08,株式会社
株式会社そらいず,長崎県長崎市滑石６丁目９番２号,2016-07-08,株式会社
株式会社たかむら農園,青森県三戸郡五戸町大字倉石石沢字高岩１９番地,2016-07-08,株式会社
株式会社たくみホーム,熊本県熊本市東区画図町大字重富３３３番地,2016-07-08,株式会社
株式会社たたみ工房ゆさ,宮城県岩沼市吹上１丁目８番５４号,2016-07-08,株式会社
株式会社なかなか,大阪府大阪市北区浪花町１番２２号,2016-07-08,株式会社
株式会社はさま,三重県度会郡南伊勢町迫間浦８２５番地,2016-07-08,株式会社
株式会社ふく成,熊本県熊本市西区田崎町３８０番地９,2016-07-08,株式会社
株式会社まるやま,東京都葛飾区亀有５丁目５４番２０号,2016-07-08,株式会社
株式会社みさと保険,宮崎県東臼杵郡美郷町西郷田代３番地,2016-07-08,株式会社
株式会社みちのくコーポ,青森県五所川原市字元町１２６番地,2016-07-08,株式会社
株式会社みどりの杜,三重県鈴鹿市算所１丁目１番１号,2016-07-08,株式会社
株式会社やまびこ,大阪府大阪市淀川区十八条３丁目９番１１号,2016-07-08,株式会社
株式会社らしゅえっと,東京都世田谷区南烏山３丁目１２番１－Ｔ８１６号,2016-07-08,株式会社
株式会社アイシング,奈良県奈良市二名５丁目１６１０番地の１,2016-07-08,株式会社
株式会社アイズ・ガーデン,神奈川県藤沢市今田７２１番地クロノス湘南台１０５,2016-07-08,株式会社
株式会社アイテック,広島県広島市安佐北区狩留家町２４番地６,2016-07-08,株式会社
株式会社アイディールファーマ,大阪府東大阪市横枕西１番７号,2016-07-08,株式会社
株式会社アイトリニティ,岡山県岡山市北区下中野７０７番地１０１,2016-07-08,株式会社
株式会社アイレシピ,神奈川県横浜市西区北幸１丁目１１番１号水信ビル７階,2016-07-08,株式会社
株式会社アオイトリ,東京都港区六本木３丁目８－１２六本木ＳＴビル２Ｆ,2016-07-08,株式会社
株式会社アクティブ,東京都八王子市散田町５丁目２８番１７号,2016-07-08,株式会社
株式会社アグリソイル・ソリューション,埼玉県深谷市菅沼８７番地１,2016-07-08,株式会社
株式会社アニーズ,福島県会津若松市高野町大字木流字橋本３１８番地の７,2016-07-08,株式会社
株式会社アノードラボ,埼玉県草加市青柳２丁目２番５号,2016-07-08,株式会社
株式会社アルシス,愛知県額田郡幸田町大字坂崎字雀ケ入１番地５５,2016-07-08,株式会社
株式会社アークスプルーフ,宮崎県東臼杵郡門川町大字加草２１７５番地５,2016-07-08,株式会社
株式会社イコー福岡,福岡県福岡市東区多の津４丁目８番３１号,2016-07-08,株式会社
株式会社イタダキテン,愛知県春日井市梅ケ坪町６５番地４ジョイフル梶田Ⅱ３０２,2016-07-08,株式会社
株式会社インテグレート,宮城県仙台市宮城野区東仙台５丁目２０番３７号,2016-07-08,株式会社
株式会社イースト,東京都足立区保木間１丁目２３番１１号,2016-07-08,株式会社
株式会社イーストジャパンクオリティ,宮城県名取市愛島台２丁目６番地の６,2016-07-08,株式会社
株式会社ウエストコーストプラス,愛知県名古屋市中川区宮脇町１丁目１３９番地,2016-07-08,株式会社
株式会社エオネット,北海道札幌市厚別区大谷地西４丁目１６番７号,2016-07-08,株式会社
株式会社エコロジーＨＤ,福岡県北九州市八幡西区木屋瀬１丁目２７番８号,2016-07-08,株式会社
株式会社エスイーエルブルー,東京都大田区西嶺町２２番１７号,2016-07-08,株式会社
株式会社エステートマツダ,三重県津市芸濃町萩野５３５番地,2016-07-08,株式会社
株式会社エストヴィラージュ,奈良県生駒市辻町９９２番地６７,2016-07-08,株式会社
株式会社エディケーションエス,神奈川県藤沢市長後１３７０番地９,2016-07-08,株式会社
株式会社エヌアイシーグローバルコンサルティング,東京都新宿区百人町１丁目１４番１号,2016-07-08,株式会社
株式会社エフ・クルーシー,茨城県稲敷郡阿見町大字吉原３４７５,2016-07-08,株式会社
株式会社エム・ジェイ・プランニング,東京都西多摩郡瑞穂町大字箱根ケ崎２２７３番地６３,2016-07-08,株式会社
株式会社エーベスト,神奈川県横浜市神奈川区神大寺３丁目１４番１６号,2016-07-08,株式会社
株式会社オザス,宮崎県宮崎市松橋２丁目１２番１７号,2016-07-08,株式会社
株式会社オフィスユースフル,大阪府八尾市志紀町１丁目１４２ハイグレード志紀２０２号,2016-07-08,株式会社
株式会社オーラット,福岡県福岡市中央区小笹２丁目７番２７号,2016-07-08,株式会社
株式会社オー・ケー・アイ,東京都足立区西伊興４丁目１０番２１号,2016-07-08,株式会社
株式会社カインド,大阪府大阪市阿倍野区昭和町４丁目２番２号ディアコート西田辺１Ｆ,2016-07-08,株式会社
株式会社カネイチ,青森県北津軽郡中泊町大字小泊字大山長根１１５番地３,2016-07-08,株式会社
株式会社カフェ・コトゴト,山梨県中巨摩郡昭和町西条５１６３番地,2016-07-08,株式会社
株式会社カルタム,東京都中央区築地１丁目１２番５－４０２号,2016-07-08,株式会社
株式会社カーサービスＳＡＴＡＫＥ,愛知県名古屋市名東区藤里町１２０１番地（藤の木団地１棟４０１号）,2016-07-08,株式会社
株式会社ガイサーテック,福島県郡山市若葉町２１番７号エトワール若葉町１０４,2016-07-08,株式会社
株式会社ガラパゴス,埼玉県川口市大字東本郷１０２０番地の４,2016-07-08,株式会社
株式会社キャリアライブ,宮崎県宮崎市下北方町椎ノ坪７７５番地４,2016-07-08,株式会社
株式会社キーマンズドットコム,東京都渋谷区渋谷３丁目６番２号,2016-07-08,株式会社
株式会社クラシエ,埼玉県桶川市大字上日出谷１０７７番地の９,2016-07-08,株式会社
株式会社クリーブ,神奈川県横浜市鶴見区潮田町２丁目１１４番地９ニューハイム東海４０２,2016-07-08,株式会社
株式会社クリーンアシスト,鹿児島県鹿児島市広木２丁目１８番６号,2016-07-08,株式会社
株式会社クレオフィルマ,神奈川県相模原市南区東林間５丁目１番６号ラベンダーコート２０１号,2016-07-08,株式会社
株式会社クレオミク,東京都新宿区新宿１丁目１９番１０号,2016-07-08,株式会社
株式会社クロスカルチャー,東京都中央区日本橋浜町２丁目１６番６号,2016-07-08,株式会社
株式会社クワハラ,東京都練馬区南大泉５丁目３４番１号,2016-07-08,株式会社
株式会社グッドクオリティ,東京都中野区中野５丁目２６番４０号,2016-07-08,株式会社
株式会社グッドコミュニケーションズ,広島県広島市中区堺町２丁目４番１５号堺町Ｙビル２階,2016-07-08,株式会社
株式会社グッドフレンズコネクション,栃木県栃木市大宮町１７１４番地９,2016-07-08,株式会社
株式会社グッドワンサービス,埼玉県上尾市谷津２丁目１番５０－２８号,2016-07-08,株式会社
株式会社グラシア,東京都千代田区神田小川町３丁目１４番地,2016-07-08,株式会社
株式会社グラストデザイン,福岡県福岡市中央区大名１丁目１番２３号,2016-07-08,株式会社
株式会社グランツ,東京都あきる野市雨間１００４番地８,2016-07-08,株式会社
株式会社グランド・デザイン,愛知県長久手市前熊一ノ井１番地５２,2016-07-08,株式会社
株式会社グランパレ,東京都板橋区相生町８番４号,2016-07-08,株式会社
株式会社グリーンファームササキ,茨城県鉾田市常磐１６３９番地１,2016-07-08,株式会社
株式会社グリーンライフ,埼玉県川越市大字砂７０９番地２－１０８,2016-07-08,株式会社
株式会社グローバルエンターテイメント,東京都葛飾区立石４丁目２７番１０号,2016-07-08,株式会社
株式会社グローバルワーク,宮城県登米市迫町佐沼字駒木袋８２番地,2016-07-08,株式会社
株式会社ケイズアクト,静岡県田方郡函南町塚本２３６番地の１,2016-07-08,株式会社
株式会社ケイノーツ,東京都中央区銀座８丁目１６番１－６０２号,2016-07-08,株式会社
株式会社ケージャスティス,東京都千代田区岩本町３丁目２番２－１２０３号,2016-07-08,株式会社
株式会社ゲンブー,宮城県仙台市青葉区国分町２丁目９番１０号,2016-07-08,株式会社
株式会社コンストラクトアソシエーション,福岡県福岡市博多区博多駅東２丁目９番５－池松ビル２Ｆ,2016-07-08,株式会社
株式会社サイエンスモンスター,大阪府豊中市北桜塚３丁目３番１３号,2016-07-08,株式会社
株式会社サプライチェーンアドバンス・コンサルティング,東京都中央区八丁堀４丁目１番３号ダヴィンチ宝町９Ｆ,2016-07-08,株式会社
株式会社サポートｉｎｇ,広島県広島市安佐南区伴東７丁目２９番５号,2016-07-08,株式会社
株式会社サムライゴクチ,福岡県大野城市筒井１丁目６番４１－３０３号,2016-07-08,株式会社
株式会社サンライズ,東京都立川市富士見町２丁目３３番４号,2016-07-08,株式会社
株式会社サンライトムラカワ,広島県広島市安佐北区安佐町久地１７０番地１,2016-07-08,株式会社
株式会社シリウス,香川県高松市国分寺町福家甲１５７９番地６,2016-07-08,株式会社
株式会社シーラップ,大阪府大阪市北区南森町１丁目４番１９号,2016-07-08,株式会社
株式会社ジュイール,埼玉県上尾市大字平塚１５７５番地７,2016-07-08,株式会社
株式会社スマイル・クリエーション,東京都文京区本郷３丁目４４番７号,2016-07-08,株式会社
株式会社スリーダイイング,千葉県市川市東菅野３丁目１３番１号,2016-07-08,株式会社
株式会社セブンズライフ,東京都新宿区西新宿７丁目１番７－３１２,2016-07-08,株式会社
株式会社タカ工業,福島県いわき市平上片寄字柳沢１１番地,2016-07-08,株式会社
株式会社タキタ産業,岡山県岡山市中区浜１丁目１９番４１号,2016-07-08,株式会社
株式会社タクイツ,鹿児島県鹿児島市宇宿１丁目５２番８号,2016-07-08,株式会社
株式会社タクト,北海道札幌市西区八軒七条東５丁目１番２２号,2016-07-08,株式会社
株式会社タグボートデザイン,東京都港区南青山５丁目６番２４号２階,2016-07-08,株式会社
株式会社タスカル,東京都渋谷区千駄ヶ谷３丁目１６番１７号エクセドラ北参道３０２,2016-07-08,株式会社
株式会社タッチングアップ,東京都中野区本町４丁目４４番１３号,2016-07-08,株式会社
株式会社ダイワ工務店,鹿児島県鹿児島市武岡３丁目２番地２,2016-07-08,株式会社
株式会社ツバサ,長崎県長崎市宝町１２番２号,2016-07-08,株式会社
株式会社ティースリー,東京都世田谷区弦巻４丁目２４番１１号,2016-07-08,株式会社
株式会社ティーズトレード,大阪府大阪市西区土佐堀２丁目３番１３－２９０１号,2016-07-08,株式会社
株式会社ティー・エム・ケイ,東京都町田市金森東２丁目１番２号,2016-07-08,株式会社
株式会社デンタル・スピリッツ,岐阜県多治見市旭ケ丘９丁目３番地の５８,2016-07-08,株式会社
株式会社トゥー・コーポレーション,大阪府和泉市いぶき野２丁目２６番４号,2016-07-08,株式会社
株式会社トクバイ,東京都渋谷区恵比寿４丁目２０番３号,2016-07-08,株式会社
株式会社トダセイサクショ,東京都渋谷区千駄ヶ谷１丁目１３番１１号ｃｏ－ｌａｂ千駄ヶ谷,2016-07-08,株式会社
株式会社トップエージェント,東京都東久留米市中央町５丁目７番１７号,2016-07-08,株式会社
株式会社トラスト,広島県広島市安佐南区伴東２丁目８番９－７号,2016-07-08,株式会社
株式会社トリプルアース,熊本県熊本市中央区世安町１３３番地,2016-07-08,株式会社
株式会社トンペティ,東京都品川区南品川５丁目１６番５０－２０４号,2016-07-08,株式会社
株式会社ドリームイノベーション,宮城県仙台市青葉区本町１丁目１２番２号,2016-07-08,株式会社
株式会社ナガクラホールディングス,静岡県沼津市桃里６０６番地,2016-07-08,株式会社
株式会社ナンコー,長野県松本市大字島立３５３８番地１,2016-07-08,株式会社
株式会社ニトヤ金属,大阪府大阪市福島区鷺洲３丁目１番６－１０７号,2016-07-08,株式会社
株式会社ニーゼロ,茨城県ひたちなか市大字馬渡西谷津３８４６番地,2016-07-08,株式会社
株式会社ネクストウイル,山口県周南市周陽２丁目１０番６号,2016-07-08,株式会社
株式会社ネバダル工業,愛知県豊橋市小池町５２番地１,2016-07-08,株式会社
株式会社ノパル,埼玉県戸田市笹目５丁目３０番地の２４,2016-07-08,株式会社
株式会社ノンテック,東京都葛飾区立石８丁目３０番１４号,2016-07-08,株式会社
株式会社ハイトゥーーン,東京都練馬区旭町３丁目１４番１７－４０４号,2016-07-08,株式会社
株式会社ハシケン,福井県福井市花堂東１丁目４番５号,2016-07-08,株式会社
株式会社ハシモトコーポレーション,広島県広島市佐伯区坪井２丁目５２１番地４,2016-07-08,株式会社
株式会社バイユウ,福岡県飯塚市横田３７５番地１３９,2016-07-08,株式会社
株式会社バリック,東京都江戸川区篠崎町７丁目８番２１号,2016-07-08,株式会社
株式会社パインテール,福岡県福岡市早良区原１丁目４１番１－５０２号,2016-07-08,株式会社
株式会社ヒロセ・コーポレーション,埼玉県川口市芝塚原１丁目１５番地５号,2016-07-08,株式会社
株式会社ビーウィッチ,埼玉県さいたま市緑区芝原３丁目４番地６プルミエールＤ３０１,2016-07-08,株式会社
株式会社ピープル,大阪府大阪市中央区大手通１丁目４番７－４０２号,2016-07-08,株式会社
株式会社ファミリーホーム,沖縄県中頭郡北中城村字和仁屋６８番地,2016-07-08,株式会社
株式会社ファースト設計,埼玉県朝霞市宮戸１丁目２番地２７,2016-07-08,株式会社
株式会社フェアライフコーポレーション,奈良県大和高田市大字根成柿４１９番地１,2016-07-08,株式会社
株式会社フェイスプラス,愛知県名古屋市中村区名駅５丁目３３番２１号９１２号室,2016-07-08,株式会社
株式会社フォーティエイト,大阪府大阪市西区江之子島２丁目１番３７－４５１０号,2016-07-08,株式会社
株式会社フォーティーン,兵庫県丹波市市島町南１０６２番地,2016-07-08,株式会社
株式会社フジワラ,大阪府和泉市肥子町１丁目３番１５号,2016-07-08,株式会社
株式会社フラワーショップ優花,福岡県福岡市博多区板付６丁目１３番１５号,2016-07-08,株式会社
株式会社フリースタイルマーケティング,大阪府大阪市平野区西脇４丁目１番３２号,2016-07-08,株式会社
株式会社フルカワエンジニアリング,東京都品川区大井６丁目１９番１２号,2016-07-08,株式会社
株式会社フロムイースト,東京都調布市小島町１丁目３６番地１６グレーシア調布１５０６,2016-07-08,株式会社
株式会社フロンティアサポート,群馬県伊勢崎市境百々１４９番地１,2016-07-08,株式会社
株式会社ブリッヂ,福岡県北九州市小倉北区片野１丁目１番５６号２Ｆ,2016-07-08,株式会社
株式会社プライベート・アート,大阪府大阪市阿倍野区阪南町６丁目１０番２８号Ｍ’ｓＣＯＵＲＴ３０５号,2016-07-08,株式会社
株式会社プライムホテルマネジメント,福岡県福岡市博多区博多駅東２丁目５番２１号博多プラザビル,2016-07-08,株式会社
株式会社プラスエイト,東京都新宿区新宿３丁目２番７号,2016-07-08,株式会社
株式会社ヘルシーカンパニーＳＡＪＩＣＯ,東京都江戸川区東篠崎１丁目６番１０－２０３号,2016-07-08,株式会社
株式会社ベストメント,東京都港区麻布十番１丁目５番７号第一長門ビル４０１,2016-07-08,株式会社
株式会社ボルモ,東京都渋谷区恵比寿４丁目３番８号ＫＤＸ恵比寿ビル,2016-07-08,株式会社
株式会社ボンド,大阪府寝屋川市三井南町１４－１,2016-07-08,株式会社
株式会社ポジティブ・ラーニング,埼玉県さいたま市南区南浦和３丁目４５番４号,2016-07-08,株式会社
株式会社ポップアート,長崎県長崎市西海町１１７０番地１,2016-07-08,株式会社
株式会社マイバッグ,東京都江東区南砂２丁目３番１－２２４号,2016-07-08,株式会社
株式会社マキシヴロジェ,東京都調布市多摩川３丁目６５番地２ジオステージ３０３,2016-07-08,株式会社
株式会社マムアース,秋田県秋田市山王２丁目１１番４０号－２,2016-07-08,株式会社
株式会社マルチボックス,東京都昭島市宮沢町５１７番地４,2016-07-08,株式会社
株式会社マルテック,北海道札幌市中央区北六条西１４丁目４番地２１,2016-07-08,株式会社
株式会社マル松塗装商会,熊本県合志市豊岡２５０２番地９１,2016-07-08,株式会社
