法人名,住所,設立日,法人種別
あんしんネット株式会社,北海道札幌市豊平区平岸六条１６丁目２番５５－１０６号,2021-01-08,株式会社
いずみファーム株式会社,茨城県つくば市泉２３５３番地,2021-01-08,株式会社
はなれ株式会社,東京都豊島区東池袋１丁目３４番５号いちご東池袋ビル６階,2021-01-08,株式会社
まるは株式会社,千葉県香取市山倉２２００番地１,2021-01-08,株式会社
みらいキャピタルパートナーズ合同会社,三重県四日市市沖の島町３番１３号４階,2021-01-08,合同会社
みれいコンサルティング合同会社,埼玉県越谷市赤山町４丁目９番１号Ｄ－３０８,2021-01-08,合同会社
らでん合同会社,神奈川県横浜市西区岡野２丁目１３番５号,2021-01-08,合同会社
アイオン税理士法人,北海道滝川市大町２丁目４番１９号,2021-01-08,その他の設立登記法人
アイタイティア合同会社,東京都江東区清澄２丁目４番１号,2021-01-08,合同会社
アストライド６６株式会社,東京都江戸川区南小岩６丁目１９番７号,2021-01-08,株式会社
アプローチ株式会社,東京都渋谷区道玄坂１丁目２１番１号渋谷ソラスタ３Ｆ,2021-01-08,株式会社
アリアのしゃりん株式会社,福岡県福岡市早良区野芥７丁目３番５号,2021-01-08,株式会社
アルファデザイン株式会社,千葉県柏市逆井４丁目２８番２２号,2021-01-08,株式会社
イチバン株式会社,東京都中野区弥生町２丁目６番１６－２０１号,2021-01-08,株式会社
イデア総研社会保険労務士法人,大分県大分市王子北町５番８号フレスポ春日浦Ｆ棟２０２,2021-01-08,その他の設立登記法人
エストリーヴ株式会社,神奈川県藤沢市遠藤３６６２番地の７,2021-01-08,株式会社
オブジェクトループ株式会社,東京都国立市東１丁目１５－１１,2021-01-08,株式会社
オペレーターサービス株式会社,兵庫県加古川市尾上町養田３５２番地の３４,2021-01-08,株式会社
キャリアラボカンパニー合同会社,東京都豊島区池袋２丁目１０番１号,2021-01-08,合同会社
クレセント株式会社,東京都新宿区神楽坂５丁目２０番地５,2021-01-08,株式会社
グラフコア・ジャパン株式会社,東京都千代田区内幸町１丁目１番１号帝国ホテルタワー１５階リージャス日比谷センター,2021-01-08,株式会社
グリグラ合同会社,東京都江東区有明２丁目１番２－１００４号,2021-01-08,合同会社
グリンティーナ株式会社,東京都新宿区四谷１丁目３番地津嶋ビル３階,2021-01-08,株式会社
グリーンリーフ株式会社,千葉県習志野市香澄２丁目５番１５号,2021-01-08,株式会社
コスモテクノロジー株式会社,東京都中央区日本橋兜町１７番１号日本橋ロイヤルプラザ４２０号,2021-01-08,株式会社
コントレス株式会社,東京都千代田区神田小川町３丁目２８番５号Ａｘｌｅ御茶ノ水Ｃ０７,2021-01-08,株式会社
サウンド・ナリファ合同会社,茨城県桜川市真壁町長岡８１０番地２,2021-01-08,合同会社
サクラシステムソリューション株式会社,東京都中央区日本橋本町３丁目１番９号,2021-01-08,株式会社
サニー農園株式会社,大阪府南河内郡河南町大字寺田３０番地の５,2021-01-08,株式会社
サンタクス株式会社,東京都文京区千駄木３丁目４番１１号,2021-01-08,株式会社
シシマル合同会社,北海道札幌市中央区南十九条西１４丁目２－３６,2021-01-08,合同会社
シマウマ合同会社,東京都渋谷区千駄ヶ谷３丁目３番１４号メゾンブランシュ４０３,2021-01-08,合同会社
ショーン・パートナーズ合同会社,東京都国分寺市東恋ヶ窪３丁目１０－３国分寺北シティハウス５０２,2021-01-08,合同会社
ジェネロジテ株式会社,神奈川県川崎市多摩区西生田３丁目１５番１２－２１２号室,2021-01-08,株式会社
ジョワイズ合同会社,新潟県新発田市城北町２丁目８番１６号,2021-01-08,合同会社
スカイブルー株式会社,千葉県船橋市本町４丁目１４番１２号,2021-01-08,株式会社
スタートアップサポート株式会社,長崎県佐世保市天神２丁目２３５番地２,2021-01-08,株式会社
ストリングス合同会社,東京都狛江市中和泉１丁目２番６号プラザエクセル２０１号,2021-01-08,合同会社
スラソロ株式会社,東京都江東区木場６丁目１２番５号,2021-01-08,株式会社
スーパーウェルネス株式会社,東京都港区芝大門１丁目３番９号菅野ビル５階,2021-01-08,株式会社
セカイエ千葉１株式会社,東京都中央区八丁堀４丁目１０－１１ネオ神谷ビル,2021-01-08,株式会社
セカイエ千葉２株式会社,東京都中央区八丁堀４丁目１０－１１ネオ神谷ビル,2021-01-08,株式会社
セカイエ千葉３株式会社,東京都中央区八丁堀４丁目１０－１１ネオ神谷ビル,2021-01-08,株式会社
セカイエ千葉４株式会社,東京都中央区八丁堀４丁目１０－１１ネオ神谷ビル,2021-01-08,株式会社
セカイエ千葉５株式会社,東京都中央区八丁堀４丁目１０－１１ネオ神谷ビル,2021-01-08,株式会社
セカイエ茨城３株式会社,東京都中央区八丁堀４丁目１０－１１ネオ神谷ビル,2021-01-08,株式会社
セカイエ茨城４株式会社,東京都中央区八丁堀４丁目１０－１１ネオ神谷ビル,2021-01-08,株式会社
セカイエ静岡１株式会社,東京都中央区八丁堀４丁目１０－１１ネオ神谷ビル,2021-01-08,株式会社
ティアーモ株式会社,福岡県福岡市博多区博多駅南２丁目３番３５－６０２号,2021-01-08,株式会社
ディベアスサポート合同会社,東京都葛飾区金町３丁目２９番３号,2021-01-08,合同会社
ハマズワークス株式会社,東京都府中市宮西町３丁目６番地の１,2021-01-08,株式会社
パイナップル株式会社,東京都渋谷区恵比寿西１丁目３３番６号ｃｏｂａ恵比寿２０２号室,2021-01-08,株式会社
パクスホーム株式会社,埼玉県さいたま市大宮区桜木町４丁目１２３番地３,2021-01-08,株式会社
ビラテクノロジー株式会社,東京都品川区上大崎２丁目１５－１９ＭＧ目黒駅前,2021-01-08,株式会社
ファミリー８０株式会社,千葉県袖ケ浦市蔵波台７丁目９番地２Ａ－８,2021-01-08,株式会社
フィールド株式会社,愛知県額田郡幸田町大字横落字郷前１０番地４０,2021-01-08,株式会社
フクシンプライム株式会社,熊本県上天草市松島町合津６００３番地１,2021-01-08,株式会社
プラウドアップパートナーズ株式会社,東京都千代田区神田佐久間町２丁目１番奥田ビル４階,2021-01-08,株式会社
プロット株式会社,福岡県福岡市博多区住吉５丁目１４番１５－２０２号サンエール住吉,2021-01-08,株式会社
プロ・スキル合同会社,鳥取県西伯郡大山町上市２９８番地１,2021-01-08,合同会社
ベルフラワーホーム株式会社,神奈川県横浜市青葉区市ケ尾町５２３番地８,2021-01-08,株式会社
ホワイトスネイク合同会社,東京都中央区日本橋３丁目２番１４号,2021-01-08,合同会社
マックス・フィールド株式会社,大阪府門真市末広町４０番７号,2021-01-08,株式会社
マフォロバ株式会社,東京都新宿区西新宿６丁目５番１号新宿アイランドタワー３３階,2021-01-08,株式会社
マーキュリー製薬合同会社,東京都豊島区目白５丁目７番８－３０１号,2021-01-08,合同会社
メディカルサポート税理士法人,福岡県福岡市中央区天神３丁目４番９号ＧＧソーラービル７階Ａ号室,2021-01-08,その他の設立登記法人
メディナケア株式会社,東京都立川市緑町７番地の２サンクタス立川Ｔ１、１４１１号,2021-01-08,株式会社
モモアライヤ株式会社,奈良県生駒郡安堵町大字笠目２２３番地の４,2021-01-08,株式会社
ユアホーム株式会社,千葉県松戸市六実１丁目２３番地の１６,2021-01-08,株式会社
ユイット合同会社,神奈川県横浜市都筑区中川中央１丁目２３番１０号ＭＫノースビル３階,2021-01-08,合同会社
ユウアソリューション株式会社,神奈川県川崎市川崎区浜町２丁目１３番３７－３１２号ダイアパレス川崎グリーンポート,2021-01-08,株式会社
ユーアイ・ビル・メンテナンス株式会社,沖縄県浦添市前田２丁目３番１３号,2021-01-08,株式会社
ユーシーアイ株式会社,千葉県市原市五井８８０９番地,2021-01-08,株式会社
ユー株式会社,千葉県木更津市江川４８３番地２,2021-01-08,株式会社
ライフデザインネット株式会社,東京都八王子市東町一丁目１０番グランデハイツ８０２号,2021-01-08,株式会社
ライフワークデザインＯＫＵＲＩＭＯＮＯ合同会社,愛知県北名古屋市西之保神ノ戸４１番地１,2021-01-08,合同会社
リュウワテック株式会社,愛知県名古屋市中川区打出１丁目６８番地,2021-01-08,株式会社
リーズ・リー株式会社,神奈川県茅ヶ崎市元町４－３３進和第２ビル３０２,2021-01-08,株式会社
ロッシー株式会社,東京都足立区保木間４丁目１３番９号,2021-01-08,株式会社
ワークコジャパン合同会社,東京都港区海岸１丁目４番２２号ＳＮビル,2021-01-08,合同会社
一永株式会社,熊本県荒尾市府本３３９番地,2021-01-08,株式会社
一般社団法人たいよう記念会,青森県青森市花園２丁目１番１１号,2021-01-08,その他の設立登記法人
一般社団法人アマヤドリ,神奈川県三浦郡葉山町長柄５７５番地の１５,2021-01-08,その他の設立登記法人
一般社団法人ジュニアプログラミング推進機構,東京都千代田区神田神保町２丁目３０番地,2021-01-08,その他の設立登記法人
一般社団法人テクニカルディレクターズアソシエーション,東京都港区六本木７丁目２番８号,2021-01-08,その他の設立登記法人
一般社団法人トークン・ブリッジ,東京都千代田区霞が関３丁目２番５号,2021-01-08,その他の設立登記法人
一般社団法人トーセイ・トークン,東京都千代田区霞が関３丁目２番５号,2021-01-08,その他の設立登記法人
一般社団法人バリアフリーサークルこゆ,宮崎県児湯郡高鍋町大字北高鍋９５６－３,2021-01-08,その他の設立登記法人
一般社団法人人材サービス協議会,沖縄県浦添市西原２丁目４番１号Ｐ’ｓＳＱＵＡＲＥ４階,2021-01-08,その他の設立登記法人
一般社団法人北摂助け合いの輪,大阪府池田市石橋２丁目１４番１１号,2021-01-08,その他の設立登記法人
一般社団法人北谷町喜友名小郷友会,沖縄県中頭郡北谷町字桑江４８１番地１１,2021-01-08,その他の設立登記法人
一般社団法人吹田フットボールネットワーク,大阪府吹田市青葉丘北一丁目４番,2021-01-08,その他の設立登記法人
一般社団法人小樽ろうあ協会,北海道小樽市稲穂４丁目１番２号小樽市身体障害者福祉センター内,2021-01-08,その他の設立登記法人
一般社団法人日本シャンチー協会,東京都杉並区清水３丁目３１番６号,2021-01-08,その他の設立登記法人
一般社団法人日本リモートワーク協会,大阪府大阪市天王寺区上汐３丁目１番６号,2021-01-08,その他の設立登記法人
一般社団法人日本ＨＩＦＵ協会,東京都中野区弥生町２丁目１４番１０号,2021-01-08,その他の設立登記法人
一般社団法人札仙ホールディングス,東京都千代田区内幸町２丁目１番６号,2021-01-08,その他の設立登記法人
一般社団法人横須賀カウンシル・アジア太平洋研究所,東京都目黒区東山１丁目１３－１タウンハイツ目黒東山２０５,2021-01-08,その他の設立登記法人
一般社団法人財務戦略診断協会,北海道北広島市南町４丁目８番地３,2021-01-08,その他の設立登記法人
一般社団法人関東軟式野球連盟連合会,埼玉県坂戸市浅羽野３丁目１０番地１０,2021-01-08,その他の設立登記法人
一般社団法人首里空手古武道保存会,沖縄県那覇市首里鳥堀町２丁目２４番地１,2021-01-08,その他の設立登記法人
一般社団法人ＣＩＲＣＵＬＡＴＩＯＮ　ＡＲＴ,東京都杉並区高円寺南２丁目１４番２号カセッタ高円寺１２,2021-01-08,その他の設立登記法人
一般社団法人ＥＺＯＵＳＡＧＩ,北海道上川郡下川町共栄町９９番地,2021-01-08,その他の設立登記法人
一般社団法人ＩＸＳＩＡ,東京都練馬区豊玉中１丁目２番１４号,2021-01-08,その他の設立登記法人
一般社団法人ＴＥＡＭ　Ｄｉ　Ｊｏｂ,福岡県福岡市中央区高砂１丁目１１番１号,2021-01-08,その他の設立登記法人
一般社団法人ｆｏｒｔｕｎａ,神奈川県横浜市南区山王町１丁目８番地２ルミナス横浜阪東橋６０４号,2021-01-08,その他の設立登記法人
一般財団法人先進プロジェクト支援協会,東京都目黒区平町１丁目２０番１６－２０１号,2021-01-08,その他の設立登記法人
中央マネジメントコンサルティング株式会社,東京都中央区銀座１丁目２２番１１号銀座大竹ビジデンス２階,2021-01-08,株式会社
中村工業株式会社,京都府宇治市槇島町目川１６７番地の１,2021-01-08,株式会社
丸瀬産業株式会社,大阪府豊中市豊南町西２丁目８－５,2021-01-08,株式会社
久田精肉店株式会社,福岡県福岡市城南区東油山２丁目３番２１号,2021-01-08,株式会社
京陽株式会社,大阪府寝屋川市香里南之町３６番３４－４０７号,2021-01-08,株式会社
人知れず良いこと株式会社,東京都中央区銀座１丁目２２番１１号銀座大竹ビジデンス２階,2021-01-08,株式会社
企業価値研究所株式会社,東京都千代田区神田錦町１丁目１１番地２－４１０室,2021-01-08,株式会社
佰分愛株式会社,神奈川県横浜市中区山下町１６２番地,2021-01-08,株式会社
倉敷青果株式会社,岡山県倉敷市西中新田５２５番地２１,2021-01-08,株式会社
元気フィンテックソリューションズ株式会社,神奈川県横浜市港北区新横浜２丁目１１番５号,2021-01-08,株式会社
八街トラックス株式会社,香川県高松市香川町大野２１５９番地３,2021-01-08,株式会社
凡澤実業株式会社,茨城県龍ケ崎市出し山町２００－３プリミエール３号館２０３号室,2021-01-08,株式会社
出水防災設備株式会社,熊本県熊本市北区楡木２丁目３番４２号,2021-01-08,株式会社
分散システム技研合同会社,神奈川県三浦郡葉山町長柄２７９番地の４,2021-01-08,合同会社
勇進工業株式会社,沖縄県島尻郡八重瀬町字宜次４３番地,2021-01-08,株式会社
勝田報徳社,静岡県牧之原市勝田１４８３番地,2021-01-08,その他の設立登記法人
匠運株式会社,佐賀県佐賀市川副町大字小々森１２２番地３９,2021-01-08,株式会社
医療法人ごとう会,山梨県甲斐市西八幡１９４２番地１,2021-01-08,その他の設立登記法人
医療法人みどり会,山梨県甲斐市西八幡１９４６番地１,2021-01-08,その他の設立登記法人
医療法人Ｌｅ　ｃｉｅｌ　ｂｌｅｕ,福岡県遠賀郡岡垣町野間２丁目１６番５号,2021-01-08,その他の設立登記法人
医療法人ＳＫＹ,愛知県名古屋市緑区左京山４４９番地,2021-01-08,その他の設立登記法人
千嘉合同会社,神奈川県川崎市高津区二子２丁目８番１－２１１号,2021-01-08,合同会社
司法書士法人あおと事務所,東京都葛飾区青戸３丁目３４番１号林ビル２０１,2021-01-08,その他の設立登記法人
司法書士法人いとう事務所,北海道札幌市中央区南一条西７丁目２０番地１札幌スカイビル４階,2021-01-08,その他の設立登記法人
司法書士法人やまぎわ,大阪府大阪市北区豊崎３丁目４番１４号ショーレイビル６０１,2021-01-08,その他の設立登記法人
司法書士法人坂本事務所,東京都足立区梅田６丁目４番１５号,2021-01-08,その他の設立登記法人
合同会社あいうえお,神奈川県横浜市西区浅間町２丁目９７番地１号,2021-01-08,合同会社
合同会社いちか,長崎県長崎市大手２丁目１３－３８,2021-01-08,合同会社
合同会社おこめらんど,東京都豊島区南池袋２丁目８番１号角田ビル３Ｆ,2021-01-08,合同会社
合同会社かおりぶ,東京都練馬区北町２丁目１９番１３号,2021-01-08,合同会社
合同会社かさねや仙台中央店,宮城県仙台市青葉区北目町７番２５－１０３号,2021-01-08,合同会社
合同会社かさねや長町店,宮城県仙台市太白区西多賀１丁目１９番８号キャピタル西多賀１０３号,2021-01-08,合同会社
合同会社こころやさい,三重県伊賀市治田１５９８－４ふたば園２階,2021-01-08,合同会社
合同会社さかえる,山口県大島郡周防大島町大字和田１２７０番地,2021-01-08,合同会社
合同会社なんくるないさ,千葉県浦安市日の出１丁目３番２１－２０３号海風の街,2021-01-08,合同会社
合同会社れんげ,宮城県仙台市泉区八乙女中央１丁目２番１５－６０２号,2021-01-08,合同会社
合同会社アイオライト,栃木県宇都宮市氷室町１７３７番地,2021-01-08,合同会社
合同会社アドバンス,東京都品川区西五反田８丁目２番５号ファインズ五反田４Ｆ,2021-01-08,合同会社
合同会社アドバンス,神奈川県横須賀市森崎４丁目１４番９－２０１号サンウォークヒルズ森崎,2021-01-08,合同会社
合同会社アドミワン,東京都中央区佃１丁目１１番７－９０８号,2021-01-08,合同会社
合同会社アルバトロス,熊本県熊本市東区石原３丁目３２番地,2021-01-08,合同会社
合同会社イエローハート,東京都国立市谷保６９９番地の９,2021-01-08,合同会社
合同会社インフィニティ,神奈川県川崎市幸区小倉２丁目３１番１３号,2021-01-08,合同会社
合同会社エクステリアＡＤＡＣＨＩ,兵庫県丹波市青垣町小倉６２８番地１,2021-01-08,合同会社
合同会社エステート結翔,佐賀県佐賀市松原４丁目５－１０,2021-01-08,合同会社
合同会社エムエーホーム,千葉県銚子市川口町２丁目６３８５番地５０３,2021-01-08,合同会社
合同会社オフィスナガタ,福岡県福岡市東区名島２丁目３５番１７号,2021-01-08,合同会社
合同会社カチタス,千葉県船橋市飯山満町３丁目１５８２－２セントラルコーポ船橋１号棟２１１号室,2021-01-08,合同会社
合同会社カピリナ,東京都板橋区舟渡３丁目１０－１レアシス板橋５０５,2021-01-08,合同会社
合同会社カリテ信濃屋,岐阜県本巣市曽井中島１３００番地１０,2021-01-08,合同会社
合同会社カーサ,沖縄県那覇市おもろまち４丁目１４番１８号,2021-01-08,合同会社
合同会社カーム,神奈川県茅ヶ崎市浜之郷１１４７番地７,2021-01-08,合同会社
合同会社キコ設備,兵庫県宝塚市花屋敷荘園３丁目５番１８号,2021-01-08,合同会社
合同会社ケイワプラン,神奈川県海老名市河原口３丁目２番３３号,2021-01-08,合同会社
合同会社ゴールデンハウス,東京都大田区田園調布１丁目１３番２１号田園調布テラスハウスＢ棟,2021-01-08,合同会社
合同会社サイクルＤＥＭＯＴＯ　ＧＣＲ,香川県高松市多賀町２丁目１番４号,2021-01-08,合同会社
合同会社サクセス,東京都品川区西五反田８丁目２番５号ファインズ五反田４Ｆ,2021-01-08,合同会社
合同会社サロンジャングル,宮城県多賀城市高橋４丁目２３番２４号,2021-01-08,合同会社
合同会社ザウエル,東京都渋谷区幡ヶ谷３丁目３９番１２号渋谷ウェストビル１階,2021-01-08,合同会社
合同会社スケールしない,神奈川県鎌倉市浄明寺５丁目７番１８号,2021-01-08,合同会社
合同会社スタジオガンマ,東京都豊島区東池袋１丁目３４番５号いちご東池袋ビル６階,2021-01-08,合同会社
合同会社スタジオゲート,東京都渋谷区神宮前６丁目２３番４号桑野ビル２階,2021-01-08,合同会社
合同会社スタジオ５６,千葉県船橋市夏見４丁目２５番３号,2021-01-08,合同会社
合同会社スプラウト,青森県八戸市江陽１丁目６番２４号,2021-01-08,合同会社
合同会社センドック,福岡県福岡市中央区黒門６番１０－１１０２号,2021-01-08,合同会社
合同会社ゼロモフ,東京都世田谷区玉川４丁目４番１９－３０７号,2021-01-08,合同会社
合同会社ティーツーアンドケイツーテクニカルサービス,千葉県市原市青葉台３丁目１２番地９,2021-01-08,合同会社
合同会社テン,千葉県八千代市村上１８９１番地３２,2021-01-08,合同会社
合同会社デザポケ,東京都千代田区平河町１丁目６番１５号ＵＳビル８Ｆ,2021-01-08,合同会社
合同会社トライハード,千葉県市原市西五所１２番地６ロイヤルハイツ１０１,2021-01-08,合同会社
合同会社トレスポ,東京都八王子市長沼町１０４番地３１３,2021-01-08,合同会社
合同会社ドンファン,東京都板橋区仲宿３４番１０号ハーモニーテラス仲宿１０２,2021-01-08,合同会社
合同会社バングル,大阪府大阪市北区堂島２丁目１番２７号桜橋千代田ビル５Ｃ,2021-01-08,合同会社
合同会社ヒルヴァレーファーム,北海道浦河郡浦河町字絵笛１５６番地,2021-01-08,合同会社
合同会社ピエログループ,和歌山県和歌山市六十谷６９８番地６９,2021-01-08,合同会社
合同会社フローター,福井県鯖江市鳥羽３丁目２番５－１号,2021-01-08,合同会社
合同会社ブリスフル,福岡県福岡市早良区西新１丁目５番６－４０７号,2021-01-08,合同会社
合同会社ヤマミ宮下農園,長野県下伊那郡松川町大島３２３１番地,2021-01-08,合同会社
合同会社ユニゾングループ,北海道札幌市中央区旭ケ丘５丁目２番２号,2021-01-08,合同会社
合同会社ライズホーム,愛知県豊川市桜木通２丁目３０番地の１,2021-01-08,合同会社
合同会社ラトリ,沖縄県沖縄市宮里３丁目６番２号１階,2021-01-08,合同会社
合同会社リデグ,岐阜県海津市南濃町安江１１４２番地１６,2021-01-08,合同会社
合同会社リノワーク,千葉県四街道市めいわ４丁目１２番１６号,2021-01-08,合同会社
合同会社リバティースクエア,埼玉県さいたま市西区大字佐知川９１１番地グランハイムもえぎＡ－２０７,2021-01-08,合同会社
合同会社ルビアソーラー,福岡県北九州市八幡西区東鳴水１丁目５番４号,2021-01-08,合同会社
合同会社丸喜屋,東京都目黒区上目黒３丁目７番５号アオイハウスＳビル２０１,2021-01-08,合同会社
合同会社今針山潤教育研究所,福岡県糟屋郡志免町王子４丁目１２番１０号,2021-01-08,合同会社
合同会社住処,福岡県福岡市中央区鳥飼１丁目３番１９－３０１号マンション鳥飼,2021-01-08,合同会社
合同会社住設応援団,福岡県北九州市小倉北区高尾１丁目１５番１９号,2021-01-08,合同会社
合同会社吉角工務,兵庫県神戸市灘区日尾町３丁目１－３朝日プラザ六甲Ⅱ１００１号,2021-01-08,合同会社
合同会社喜々,北海道札幌市西区発寒五条２丁目３番８号発寒グランドハイツ２０７,2021-01-08,合同会社
合同会社城陽製作所,京都府城陽市寺田大谷８８番地の６,2021-01-08,合同会社
合同会社大野家畜医院,鹿児島県志布志市有明町原田２２８３番地１１,2021-01-08,合同会社
合同会社天業,東京都港区元麻布３丁目１１番１０号センチュリー元麻布１Ｆ,2021-01-08,合同会社
合同会社天野農産,秋田県男鹿市脇本脇本字脇本１０番地,2021-01-08,合同会社
合同会社川口,神奈川県横浜市金沢区六浦南３丁目２６番４号,2021-01-08,合同会社
合同会社川島進デザイン室,東京都渋谷区上原１丁目１１番１２号コムス上原３０２,2021-01-08,合同会社
合同会社川村玲産業医事務所,東京都杉並区成田東３丁目２１番６号,2021-01-08,合同会社
