法人名,住所,設立日,法人種別
株式会社Ｌｏｖｅ　Ｗｏｒｋ,東京都世田谷区祖師谷１丁目３５番６号,2017-06-07,株式会社
株式会社Ｌｕｍｏ,三重県伊勢市村松町４４９番地,2017-06-07,株式会社
株式会社Ｍ．ＣＨＥＥＭＡ．ＴＲＡＤＩＮＧ,愛知県春日井市岩成台７丁目１１番地１２,2017-06-07,株式会社
株式会社ＭＡＲＵＴＡ,兵庫県姫路市花田町加納原田５８８番地２０,2017-06-07,株式会社
株式会社ＭＬＪ,愛知県春日井市松新町１丁目２０番地河合ビル３Ｆ,2017-06-07,株式会社
株式会社ＭＰＳ,兵庫県姫路市増位新町１丁目８番地２Ａ－１１０,2017-06-07,株式会社
株式会社ＭＲ企画,東京都江戸川区松島３丁目４０番１６－７０１号,2017-06-07,株式会社
株式会社ＭＳＲＴ,北海道札幌市東区北二十六条東２１丁目６番４号,2017-06-07,株式会社
株式会社ＭＴＭキャピタル,新潟県新発田市中曽根町２丁目１０番１９号,2017-06-07,株式会社
株式会社Ｍａｎｏａコーディネート,大阪府大阪市福島区大開３丁目１番２－６３３号,2017-06-07,株式会社
株式会社Ｍａｐｌｅ＆Ｃｏ．,大阪府大阪市住吉区帝塚山東３丁目３番２０号,2017-06-07,株式会社
株式会社Ｍａｒｖｅｌｏｕｓ　Ｐｏｗｅｒ,東京都杉並区宮前３丁目３０番１１号,2017-06-07,株式会社
株式会社Ｍｅｒｃｉ,宮城県仙台市宮城野区高砂１丁目１番地の４ベルレジデンス高砂２０４,2017-06-07,株式会社
株式会社ＭｙＦａｃｔｏｒｙ,熊本県熊本市中央区下通１丁目１１番２０号,2017-06-07,株式会社
株式会社ＮＡＳＨ,沖縄県八重山郡竹富町字上原２８９－２２,2017-06-07,株式会社
株式会社ＮＥＸＴ　ＳＴＡＧＥ,北海道札幌市中央区北二条東３丁目２番,2017-06-07,株式会社
株式会社ＮＫパッケージ,山形県山形市大字十文字１８８０番地３,2017-06-07,株式会社
株式会社ＮＳＰ,東京都港区浜松町１丁目２１番４号港ビル４階,2017-06-07,株式会社
株式会社ＮＳＹ＆Ｃｏ．,石川県野々市市三日市１丁目２５５番地,2017-06-07,株式会社
株式会社Ｎｅｅｄｓ,東京都中央区日本橋箱崎町１５番６号２Ｆ,2017-06-07,株式会社
株式会社ＮｅｘｔＡｉｒ,兵庫県西宮市浜松原町１番１９号,2017-06-07,株式会社
株式会社ＯＫＩＴＡ　Ｓｐｏｒｔｓ＆Ｆｉｔｎｅｓｓ,静岡県富士市厚原１８５９番地の８,2017-06-07,株式会社
株式会社Ｏｆｆｉｃｅ　Ｓｈｉｎｏ,東京都渋谷区恵比寿４丁目２２番７号,2017-06-07,株式会社
株式会社ＰＭＡＴ,東京都港区愛宕２丁目３番１－１６０２号,2017-06-07,株式会社
株式会社ＰＲＥＳＩＤＥ　ＷＥＳＴ,大阪府大阪市浪速区難波中３丁目６番１２号ナンバグランドビル９Ｆ,2017-06-07,株式会社
株式会社ＰＲＯＧＲＥＳＳ,東京都新宿区百人町２丁目２１番４号渡辺ビル２Ａ室,2017-06-07,株式会社
株式会社Ｐｉｇｍｅｎｔ,東京都中央区日本橋３丁目５番９号,2017-06-07,株式会社
株式会社ＰｒｏＤｏｃｔｏｒ,東京都渋谷区渋谷３丁目６番３号,2017-06-07,株式会社
株式会社Ｑｏｌ－Ｌａｂ,茨城県ひたちなか市大字高野２０８番地６０,2017-06-07,株式会社
株式会社Ｒプラス,東京都世田谷区鎌田３丁目１７番４号,2017-06-07,株式会社
株式会社ＲＡＮ,静岡県浜松市南区新橋町１６７４番３,2017-06-07,株式会社
株式会社ＲＥＬＩＶＥ,福岡県福岡市博多区博多駅前４丁目１５番１０号４Ｆ,2017-06-07,株式会社
株式会社Ｒｅｌｉｓｈ,東京都町田市三輪町３５０番地６,2017-06-07,株式会社
株式会社ＳＡＩ,徳島県徳島市春日１丁目４－１,2017-06-07,株式会社
株式会社ＳＨＯＷＢＥＥＺ,東京都港区麻布台２丁目３番２２号,2017-06-07,株式会社
株式会社ＳＯＫＥＮ,熊本県宇城市松橋町松橋１５１１番地５,2017-06-07,株式会社
株式会社ＳＯＬＥＩＬ,愛知県名古屋市東区白壁２丁目２５番１３号,2017-06-07,株式会社
株式会社ＳＲＳ,岡山県岡山市中区高島新屋敷３４６番地,2017-06-07,株式会社
株式会社ＳＳコーポレーション,鹿児島県鹿児島市中山町１３０１番地,2017-06-07,株式会社
株式会社ＳＴファクトリー,愛知県碧南市鶴見町３丁目１１５番地３,2017-06-07,株式会社
株式会社ＳＴホールディングス,愛知県名古屋市中区丸の内３丁目１６番２９号,2017-06-07,株式会社
株式会社ＳＴＡＧＥ　ＣＯＭＰＡＮＹ,千葉県松戸市中根１１５番地の６プロムナード北松戸４－８０３,2017-06-07,株式会社
株式会社Ｓａｆｅ,滋賀県近江八幡市鷹飼町１４８１番地,2017-06-07,株式会社
株式会社Ｓａｉｌ,福島県郡山市堂前町２８番９号第二筒井ビル１階,2017-06-07,株式会社
株式会社Ｓｉｍｐｌｅ＆Ｒｅｌｉｓｈ,大阪府東大阪市高井田元町２丁目９番２１－１０４号,2017-06-07,株式会社
株式会社Ｓｕｃｃｅｓｓ　Ｓｔｏｒｙ　Ｉｎｎｏｖａｔｉｏｎ,鹿児島県鹿児島市金生町６番１３号金生フォーテンビル,2017-06-07,株式会社
株式会社Ｓｕｍｍｅｒ＆Ｓｕｍｍｅｒ,東京都新宿区西五軒町８番１７号岡村ビルＢ１階８号室,2017-06-07,株式会社
株式会社ＳｕｎＬｉｍｉｃ,沖縄県島尻郡与那原町字上与那原２８８番地の２,2017-06-07,株式会社
株式会社Ｓｙｓｔｅｍ．Ａｍｐｅｒｓａｎｄ,北海道札幌市白石区東札幌二条６丁目４番１５号藤井ビル４階,2017-06-07,株式会社
株式会社Ｔ．Ｍ．Ｋｉｄｓ,東京都目黒区東山１丁目２番２号,2017-06-07,株式会社
株式会社ＴＥＡＭ　ＳＡＫＡＭＯＴＯ,三重県名張市桔梗が丘４番町五街区４４番地,2017-06-07,株式会社
株式会社ＴＥＮＮＯＴＴＯ,東京都文京区白山１丁目５番１８－８０１号,2017-06-07,株式会社
株式会社ＴＯＭＯ－ＲＵ,神奈川県川崎市幸区鹿島田１丁目１番５－１００４号,2017-06-07,株式会社
株式会社ＴＲＥＥ,大阪府大阪市西区南堀江１丁目２６番１５号,2017-06-07,株式会社
株式会社Ｔａｂｌｅ　ｏｆ　Ｓｍｉｌｅ,鹿児島県鹿児島市易居町１番２号,2017-06-07,株式会社
株式会社Ｔｈｅ　Ｇｕｅｓｔ　Ｈｏｕｓｅ　Ｊａｐａｎ,神奈川県横浜市青葉区市ケ尾町１６３４番地１２,2017-06-07,株式会社
株式会社Ｔｍｏｂｉｌｅ,愛知県小牧市大字東田中５１番地１２,2017-06-07,株式会社
株式会社ＵＥＤＡ,奈良県橿原市上品寺町１６３番地,2017-06-07,株式会社
株式会社ＵＮＩＯＮＥ,東京都世田谷区玉川台２丁目２番５号スカイコート世田谷用賀第３－２０４号,2017-06-07,株式会社
株式会社Ｕｎ・ｂｅａｕｔｅ,東京都渋谷区神宮前３丁目１１番１１号,2017-06-07,株式会社
株式会社ＶＥＧＡ,東京都中央区銀座６丁目４番１０号５階,2017-06-07,株式会社
株式会社ＶＩＧＯ,京都府京都市右京区梅津南広町９３番地菜の花の里天神川１Ｆげん氣鍼灸整骨院内,2017-06-07,株式会社
株式会社Ｖａｌｏｒｅ,鹿児島県鹿児島市荒田１丁目４番１４号,2017-06-07,株式会社
株式会社Ｖａｌｕｅ　Ｌａｂｏ,東京都中央区八重洲２丁目４番１０号,2017-06-07,株式会社
株式会社ＹＫＭＫ,東京都世田谷区上野毛３丁目２２番１６号,2017-06-07,株式会社
株式会社ＹＮビルみたか,東京都杉並区浜田山１丁目３０番１２号,2017-06-07,株式会社
株式会社Ｙｏｓｈｉ’ｓ,兵庫県西宮市高木東町３１番３－３０９号,2017-06-07,株式会社
株式会社Ｚプラン,島根県出雲市西林木町２００番地１,2017-06-07,株式会社
株式会社ａｃｐホールディングス,東京都世田谷区奥沢４丁目５番１号,2017-06-07,株式会社
株式会社ａｍ　ｐｒｏｏｆ,愛知県名古屋市中区栄１丁目１６番２５号,2017-06-07,株式会社
株式会社ｅ－ｄｅｌｉｇｈｔ,福岡県春日市須玖南１丁目１８２番地,2017-06-07,株式会社
株式会社ｋａｒａｔ,東京都世田谷区奥沢４丁目２６番８号,2017-06-07,株式会社
株式会社ｎｉｎｅ,東京都八王子市犬目町６７６番地,2017-06-07,株式会社
株式会社ｓａｉｎ,大阪府大阪市東住吉区西今川３丁目２２番１４号,2017-06-07,株式会社
株式会社ｓｃｈｕｕｒ,東京都渋谷区桜丘町９番１７号ＴＯＣ第３ビル５０５号室,2017-06-07,株式会社
株式会社ｖａｌｉａｎｔ,東京都千代田区外神田４丁目６番７号カンダエイトビル１Ｆ,2017-06-07,株式会社
株式会社ｖｉｃ,東京都渋谷区円山町２８番４号大場ビルＡ館４階ｂ,2017-06-07,株式会社
株式会社ｙｕーｍｏ,三重県松阪市田村町１１２８番地３,2017-06-07,株式会社
株式会社𠀋,兵庫県神戸市垂水区桃山台５丁目２０番地の２０パレドールＪＯＥ１０６,2017-06-07,株式会社
桂田通信株式会社,滋賀県高島市マキノ町沢２７１番地７,2017-06-07,株式会社
桃李株式会社,大阪府大阪市住吉区東粉浜３丁目２４番１１号,2017-06-07,株式会社
榎本工業株式会社業,愛知県名古屋市中川区下之一色町字松蔭７丁目３６番地の２,2017-06-07,株式会社
横浜シーガル株式会社,神奈川県横浜市保土ケ谷区岩井町１７８番地の５,2017-06-07,株式会社
橋本清掃株式会社,群馬県太田市富若町７７０番地２,2017-06-07,株式会社
正利株式会社,茨城県つくば市緑が丘２６番地１,2017-06-07,株式会社
水戸ＨＳＳ合同会社,茨城県水戸市渡里町２６９４番地の４,2017-06-07,合同会社
沖縄ハナテイスト株式会社,沖縄県国頭郡恩納村字恩納２５７２番地２,2017-06-07,株式会社
淡路島ファーム株式会社,兵庫県南あわじ市市小井１２３番地,2017-06-07,株式会社
清田保温合同会社,鹿児島県鹿児島市千年１丁目４８－１０,2017-06-07,合同会社
特定非営利活動法人おおなる工房,愛媛県大洲市森山甲９３０番地３,2017-06-07,その他の設立登記法人
特定非営利活動法人はま婚,静岡県浜松市中区田町３２６番地の１,2017-06-07,その他の設立登記法人
特定非営利活動法人プラス壱ゲーム,宮城県仙台市太白区長町字越路１９番地の１３９３コープ野村八木山公園壱番館４０２,2017-06-07,その他の設立登記法人
特定非営利活動法人凜の里芦川,山梨県笛吹市芦川町中芦川５８９番地,2017-06-07,その他の設立登記法人
特定非営利活動法人北杜アントレプレナー養成塾,山梨県北杜市小淵沢町１００６０番地小淵沢アカデミー,2017-06-07,その他の設立登記法人
特定非営利活動法人大分県地酒・焼酎文化創造会議,大分県大分市府内町１丁目５番３－２０５号,2017-06-07,その他の設立登記法人
特定非営利活動法人学童保育杉の子クラブ,神奈川県海老名市柏ケ谷字天谷原５３２番地,2017-06-07,その他の設立登記法人
特定非営利活動法人横沢入里山管理市民協議会,東京都あきる野市三内８６番地３,2017-06-07,その他の設立登記法人
特定非営利活動法人空地・休眠地保全管理センター,千葉県東金市日吉台７丁目２番地２,2017-06-07,その他の設立登記法人
特定非営利活動法人草創,北海道旭川市十条通２０丁目１番地の５,2017-06-07,その他の設立登記法人
特定非営利活動法人陸前高田市体育協会,岩手県陸前高田市米崎町字川内１１６番地１,2017-06-07,その他の設立登記法人
独立起業支援塾合同会社,東京都千代田区九段南１丁目５番６号りそな九段ビル５Ｆ,2017-06-07,合同会社
田辺市龍神宮代オートキャンプ場,和歌山県田辺市龍神村宮代６２０,2017-06-07,その他
社会保険労務士法人いとう労務,東京都世田谷区若林１丁目１５番１０号世田谷電設会館２階,2017-06-07,その他の設立登記法人
社会福祉法人つぼみ会,鹿児島県鹿児島市和田１丁目４１番３号,2017-06-07,その他の設立登記法人
社会福祉法人勝潤会,兵庫県明石市大久保町大窪字下檜山１５３３番１,2017-06-07,その他の設立登記法人
社会福祉法人桜水会,茨城県土浦市滝田１丁目６－３,2017-06-07,その他の設立登記法人
祥希海運株式会社,岡山県岡山市北区学南町３丁目１４番４５号,2017-06-07,株式会社
福島電力販売株式会社,宮城県仙台市青葉区国分町１丁目７番１８号,2017-06-07,株式会社
秋吉合同会社,愛知県知多市朝倉町５４番地（第５近藤ハイツ２Ｂ）,2017-06-07,合同会社
税理士法人ところ会計,東京都港区新橋３丁目２６番３号,2017-06-07,その他の設立登記法人
税理士法人マネイジブレーン,大阪府大阪市中央区大手前１丁目４番１２号大阪天満橋ビル２階,2017-06-07,その他の設立登記法人
税理士法人奥村会計事務所,大阪府大阪市中央区久太郎町３丁目５番２６号,2017-06-07,その他の設立登記法人
税理士法人ＫＪグループ,大阪府大阪市城東区野江４丁目１１番６号,2017-06-07,その他の設立登記法人
築地イクタス株式会社,東京都世田谷区喜多見２丁目６番３号,2017-06-07,株式会社
総合企画うさぎ合同会社,静岡県富士市長通４番地の１サン・フレア・ベル長通１０３号,2017-06-07,合同会社
縁誠合同会社,東京都千代田区岩本町３丁目３番２号ＴｈｅＰａｒｋＲｅｘ岩本町ビル５Ｆ,2017-06-07,合同会社
美麗合同会社,栃木県宇都宮市若松原１丁目２７番２０号,2017-06-07,合同会社
英技建株式会社,兵庫県尼崎市大庄中通３丁目３１番地モスワークス１号,2017-06-07,株式会社
荒井工業株式会社,山形県寒河江市大字柴橋７１２番地の１ステイツＳＨＩＢＡＨＡＳＨＩ１０２,2017-06-07,株式会社
荒木電通株式会社,佐賀県佐賀市西与賀町大字厘外７３９番地６,2017-06-07,株式会社
藤田電機工業株式会社,三重県四日市市末広町１７番６号,2017-06-07,株式会社
藤田電設株式会社,兵庫県加古川市志方町上冨木７９４番地の７,2017-06-07,株式会社
講武自治会,島根県松江市鹿島町北講武３番地１,2017-06-07,その他
農事組合法人こざえん,宮崎県日南市大字下方１２２番地１,2017-06-07,その他の設立登記法人
農事組合法人ひなた,福岡県八女市上陽町上横山４２７２番地２,2017-06-07,その他の設立登記法人
農事組合法人ふぁーむ清田,滋賀県蒲生郡日野町大字清田９８６番地,2017-06-07,その他の設立登記法人
農事組合法人猪岡農産,宮城県遠田郡涌谷町猪岡短台字迫二３０番地２,2017-06-07,その他の設立登記法人
農事組合法人米魂,長野県小諸市大字八満１５８２番地１,2017-06-07,その他の設立登記法人
農林集荷センター企業組合,大分県玖珠郡玖珠町大字山田２４８６番地の２,2017-06-07,その他の設立登記法人
金洋株式会社,愛知県名古屋市中村区宿跡町２丁目３８番地５,2017-06-07,株式会社
鈴木不動産株式会社,山形県鶴岡市東原町２５番４６号,2017-06-07,株式会社
防災テクノプラン株式会社,宮城県仙台市泉区市名坂字原田１００番地１,2017-06-07,株式会社
青山共創株式会社,東京都中央区八重洲１丁目９番９号,2017-06-07,株式会社
青山造園株式会社,愛知県長久手市香桶５１５番地,2017-06-07,株式会社
高橋建設株式会社,山形県山形市松山３丁目１１番３７－３号,2017-06-07,株式会社
５４ｂａｓｅ株式会社,福岡県福岡市西区生の松原１丁目１６番１号,2017-06-07,株式会社
６００株式会社,東京都渋谷区代々木１丁目５９番１号６階０２６号室,2017-06-07,株式会社
ＡＡＡ’ｓ株式会社,埼玉県さいたま市桜区田島１丁目９番２０号オルニエールⅡ２０６号,2017-06-07,株式会社
ＡＣＲＥ株式会社,東京都世田谷区松原３丁目２３番１９－Ｂ１０６号,2017-06-07,株式会社
ＡＥＢＡ．ＳＴＵＤＩＯ株式会社,東京都世田谷区等々力６丁目２６番１０号,2017-06-07,株式会社
ＡＥＣ株式会社,愛知県大府市吉川町１丁目１６６番地,2017-06-07,株式会社
ＡＩＰ株式会社,東京都文京区根津２丁目４－３ネズフラッツ１０２,2017-06-07,株式会社
ＡＬＡＩＭＢＲＡＴＵＲ合同会社,埼玉県戸田市大字新曽９４２－１３,2017-06-07,合同会社
ＡＭＡＮ　ＴＲＡＤＥ株式会社,群馬県太田市西矢島町６０７－４セントラルマンション１０２,2017-06-07,株式会社
ＡＭＥ株式会社,福井県坂井市丸岡町新九頭竜１丁目７７番地２,2017-06-07,株式会社
ＡＭＥＺＩ株式会社,東京都文京区本郷１丁目３３番３－５０２号,2017-06-07,株式会社
ＡＴアサイン株式会社,東京都中央区日本橋箱崎町３２番７号,2017-06-07,株式会社
Ａｓｔｅｍ　Ｃｌｏｕｄ株式会社,大阪府吹田市昭和町７番１４号草場ビル３０２,2017-06-07,株式会社
ＣＡＣＨＥ’＆ＲＩＴＡ株式会社,鹿児島県鹿児島市西田１丁目１５番１５号銀屋ビル１Ｆ,2017-06-07,株式会社
ＣＡＰ．若狭株式会社,福井県大飯郡高浜町中津海第２４号１８番地８,2017-06-07,株式会社
Ｄ－アセットマネジメント株式会社,大阪府大阪市東淀川区東中島２丁目８番８号,2017-06-07,株式会社
Ｄｒａｇｏｎ　Ｔｒａｄｉｎｇ株式会社,千葉県船橋市海神町２丁目３番地２１エム・ブランド船橋８０４号,2017-06-07,株式会社
ＥＮＥＣＯＭ株式会社,茨城県水戸市酒門町２００５番地,2017-06-07,株式会社
Ｅｆｙｅｅｓ株式会社,東京都渋谷区広尾１丁目７番２５号－２０３,2017-06-07,株式会社
Ｇ＆Ｆｅａｔｈｅｒ合同会社,神奈川県逗子市久木８丁目１６番５号,2017-06-07,合同会社
ＧＡＫＵＭＯ株式会社,愛知県名古屋市中区新栄３丁目５番５号アークビル６階,2017-06-07,株式会社
ＧＬ株式会社,東京都大田区西六郷２丁目４番３号,2017-06-07,株式会社
ＧＳＳＧ　Ｓｏｌａｒ　Ｊａｐａｎ　Ｈｏｌｄｉｎｇｓ１一般社団法人,東京都港区虎ノ門３丁目２２番１０―２０１号,2017-06-07,その他の設立登記法人
ＧＳＳＧ　Ｓｏｌａｒ　Ｊａｐａｎ　Ｈｏｌｄｉｎｇｓ２一般社団法人,東京都港区虎ノ門３丁目２２番１０―２０１号,2017-06-07,その他の設立登記法人
ＧＳＳＧ　Ｓｏｌａｒ　Ｊａｐａｎ　Ｈｏｌｄｉｎｇｓ３一般社団法人,東京都港区虎ノ門３丁目２２番１０―２０１号,2017-06-07,その他の設立登記法人
Ｈホールディングス株式会社,福岡県田川郡添田町大字添田３４１９番地,2017-06-07,株式会社
ＨＡＲＵ－ＴＥＣＨ株式会社,福岡県北九州市八幡西区光貞台３丁目２５番５号,2017-06-07,株式会社
ＨＲ株式会社,大阪府大阪市中央区島之内２丁目１７番６号３０４,2017-06-07,株式会社
ＩＰ　Ｓｏｐｈｉｅ合同会社,大阪府大阪市中央区北浜３丁目２番２５号京阪淀屋橋ビル８Ｆ,2017-06-07,合同会社
ＪＫ株式会社,東京都目黒区上目黒３丁目２６番２０号上目黒タウンハウス１０１,2017-06-07,株式会社
ＪＫＴＣ株式会社,大阪府大阪市中央区大手前１丁目４番２－６０１号,2017-06-07,株式会社
ＪａｐａｎＳｅａｒｃｈ株式会社,東京都世田谷区経堂１丁目５番６号パルファム経堂２０１,2017-06-07,株式会社
Ｊｒ．Ｚｅｒｏ株式会社,鹿児島県鹿児島市西千石町１２番９号（１Ｆ）,2017-06-07,株式会社
Ｋ＆Ａエンターテインメント合同会社,宮崎県都城市牟田町２２街区７号,2017-06-07,合同会社
Ｋ＆Ｂ　ＣＯＲＰＯＲＡＴＩＯＮ株式会社,栃木県栃木市旭町７－１５,2017-06-07,株式会社
Ｋ．Ｊａｐａｎ合同会社,東京都目黒区上目黒３丁目２７番１７号サクラノキテラス中目黒０１,2017-06-07,合同会社
ＬＥＴＯ　Ｊａｐａｎ株式会社,東京都千代田区霞が関３丁目２番６号東京倶楽部ビルディング１１階,2017-06-07,株式会社
ＬＩＧＨＴＩＵＭ株式会社,東京都渋谷区幡ヶ谷３丁目８番２号,2017-06-07,株式会社
Ｍトラスト合同会社,東京都板橋区本町１８番１０－１００２号,2017-06-07,合同会社
Ｍ．Ａ．Ｔ．ＪＡＰＡＮ株式会社,東京都江戸川区北小岩５丁目３番１０号,2017-06-07,株式会社
Ｍ２コンサルティング株式会社,千葉県柏市花野井５９６番地の１８,2017-06-07,株式会社
ＭＩＳＥＬ株式会社,大阪府大阪市北区大淀中１丁目１番３０号,2017-06-07,株式会社
ＭＩＷＡマリン株式会社,鹿児島県鹿児島市坂之上３丁目１７番２５号,2017-06-07,株式会社
ＭｔｏＭカンパニー株式会社,東京都江戸川区南葛西５丁目７番１２－５０５号,2017-06-07,株式会社
Ｎファミリア合同会社,東京都墨田区八広３丁目３９番１３号,2017-06-07,合同会社
ＮＫスタッド株式会社,広島県福山市草戸町１５９４番地,2017-06-07,株式会社
ＮＰＯ法人犬猫縁の会,島根県出雲市大社町修理免７２５番地２,2017-06-07,その他の設立登記法人
ＯＬＥＤ販売株式会社,神奈川県横浜市港北区菊名５丁目８番７号,2017-06-07,株式会社
ＯＭＯＣＨＡＳＡＭＡ合同会社,埼玉県川越市大字砂８６７番地１,2017-06-07,合同会社
ＯＴＡＢＥ商事株式会社,東京都足立区梅島１丁目３１番１１号,2017-06-07,株式会社
Ｏｎｅ＆Ｏｎｅ株式会社,大阪府大阪市北区堂島１丁目３番１号,2017-06-07,株式会社
Ｒａｉｓｅ　Ｖａｌｕｅ株式会社,大阪府大阪市中央区淡路町４丁目７番５号,2017-06-07,株式会社
Ｓ・ＳＥＬＥＣＴ合同会社,沖縄県沖縄市南桃原４丁目１０番３１号,2017-06-07,合同会社
ＳＤＨＲジャパン株式会社,大阪府大阪市淀川区西中島６丁目２－１－８０５号室,2017-06-07,株式会社
ＳＤＳＳ株式会社,宮城県仙台市青葉区宮町１丁目４番１１－３号,2017-06-07,株式会社
ＳＥＣ　Ｊａｐａｎ株式会社,東京都港区麻布台３丁目４番２３号ＪＭＣ株式会社内,2017-06-07,株式会社
ＳＨＯＡＩＢ　ＥＮＴＥＲＰＲＩＳＥＳ　ＪＡＰＡＮ株式会社,愛知県愛西市新右エ門新田町郷東４２番地２,2017-06-07,株式会社
ＳｕｎｄａｙＳｋｙ　Ｊａｐａｎ株式会社,東京都中央区日本橋３丁目４番１５号八重洲通ビル４Ｆ・５Ｆ,2017-06-07,株式会社
Ｔ＆Ｔ国際株式会社,群馬県前橋市堀之下町３５３番地１０,2017-06-07,株式会社
Ｔ－イノベーション合同会社,千葉県市川市曽谷３丁目１３番７号,2017-06-07,合同会社
ＴＡＩＹＯＵ　ＬＬＣ合同会社,高知県吾川郡いの町駅南町６２番地４森沢ワンハイツⅢ３０１,2017-06-07,合同会社
ＴＫ２エンジニアリング株式会社,広島県尾道市御調町中原５４番地１,2017-06-07,株式会社
ＴＮＹ株式会社,富山県射水市今開発６７４番地,2017-06-07,株式会社
ＴＵＡＮ　ＡＮＨ合同会社,千葉県松戸市高塚新田１１５番地の３レオパレス舞２１０号,2017-06-07,合同会社
Ｔｍａｌｌジャパン株式会社,東京都中央区日本橋浜町２丁目１２番４号,2017-06-07,株式会社
ＵＮＩＴＹ株式会社,東京都世田谷区太子堂１丁目１２番３４－４０４号,2017-06-07,株式会社
ＶＩＲ　ＳＯＦＴＥＣＨ株式会社,東京都世田谷区豪徳寺１丁目２５番３号,2017-06-07,株式会社
Ｖｏｌｃａ株式会社,東京都港区芝１丁目６番１４号阿部ビル２階,2017-06-07,株式会社
ＷＡＬＡＲ株式会社,兵庫県神戸市東灘区岡本１丁目４番２２号オーガニックビル１Ｆ,2017-06-07,株式会社
Ｗｏｒｋｓ株式会社,大阪府門真市本町４３番１２号１０２,2017-06-07,株式会社
ＹＳメディカル株式会社,愛知県名古屋市千種区川崎町２丁目２６番地の３,2017-06-07,株式会社
ＹＴパートナーズ合同会社,東京都港区海岸３丁目１５番５－１００３号,2017-06-07,合同会社
