法人名,住所,設立日,法人種別
株式会社ＭＵＳＩＣ　ＢＥＡＮＳ,兵庫県西宮市苦楽園五番町２番５６進和苦楽園アーバンライフ１２０１号,2023-02-06,株式会社
株式会社Ｍａｎ‐ｔｅｃｈ,愛知県名古屋市南区要町５丁目１６４番地倉庫付事務所Ｄ号室,2023-02-06,株式会社
株式会社ＭｅｃｔａＬａｂｏ,山梨県甲斐市西八幡２１１３番地１,2023-02-06,株式会社
株式会社Ｍｅｒｃ,東京都渋谷区恵比寿南３丁目１番１号いちご恵比寿グリーングラス６Ｆ,2023-02-06,株式会社
株式会社Ｍｏｄｕｌａｔｉｏｎ,東京都中央区銀座１丁目１２番４号Ｎ＆Ｅ－ＢＬＤ．６Ｆ,2023-02-06,株式会社
株式会社ＮＣ１,北海道札幌市北区北十四条西１丁目２番１４－４０１号,2023-02-06,株式会社
株式会社ＮＥＯ,兵庫県伊丹市緑ケ丘６丁目４３番地１,2023-02-06,株式会社
株式会社ＮＥＸＴ　ＩＮＮＯＶＡＴＩＯＮ,神奈川県横須賀市坂本町３丁目１７番地７７,2023-02-06,株式会社
株式会社ＮＥＸＵＳ,大阪府堺市西区浜寺石津町西３丁４番２３－３０２号,2023-02-06,株式会社
株式会社ＮＫＢ,大阪府堺市中区辻之３９８番地１－９０７号,2023-02-06,株式会社
株式会社ＮＯＢＬＥ,千葉県木更津市ほたる野４丁目３５番地３,2023-02-06,株式会社
株式会社ＮＯＲ,東京都台東区蔵前３丁目６番７号,2023-02-06,株式会社
株式会社ＮｅｘｕｓＡｒｃ,埼玉県川口市東領家３丁目２４番３号,2023-02-06,株式会社
株式会社ＯＡＲＫ,北海道札幌市北区屯田八条２丁目４－２４,2023-02-06,株式会社
株式会社ＯＨＦ　ＤＥＳＩＧＮ,埼玉県狭山市広瀬東１丁目４－１３,2023-02-06,株式会社
株式会社ＯＭＣ,大阪府堺市中区新家町７５４番地１２,2023-02-06,株式会社
株式会社Ｏｒｅａ,大阪府和泉市内田町３丁目１０番１４号,2023-02-06,株式会社
株式会社Ｏｕｒ　Ｔｕｒｎ,東京都品川区平塚３丁目１０番５号フラッツ東亜２０１,2023-02-06,株式会社
株式会社ＰＧスターホールディングス,山口県下関市岬之町１２番２６号富士パークビル,2023-02-06,株式会社
株式会社ＰａｉｎｔＢｏｘ２,兵庫県伊丹市南野２丁目２番１７号,2023-02-06,株式会社
株式会社Ｐｌｕｓ　Ｏｎｅ,茨城県龍ケ崎市松葉３丁目４番地９,2023-02-06,株式会社
株式会社Ｑｕａｔｒｅ　ｄｉｅｕｘ,奈良県奈良市大宮町１丁目１３３－５トータスｂｌｄ１Ｆ,2023-02-06,株式会社
株式会社Ｒ‐ｏｎｅ,埼玉県草加市稲荷５丁目２番１１号,2023-02-06,株式会社
株式会社ＲＡＹＡＮ　ＪＡＰＡＮ　ＴＲＡＤＩＮＧ,群馬県伊勢崎市平和町１８番１６号ヴィラコーポ・ヤナイ１０６,2023-02-06,株式会社
株式会社ＲＩＣＫＩＥＳ,愛知県名古屋市緑区大将ケ根１丁目１６１６番地の７,2023-02-06,株式会社
株式会社ＲＯＬＥ,大阪府堺市中区平井５７２番地１８,2023-02-06,株式会社
株式会社Ｒｅｂｉｒｔｈ,東京都武蔵村山市本町１丁目６番地の１,2023-02-06,株式会社
株式会社Ｒｅｃｏｖｅｒｙ,広島県広島市安佐南区西原８丁目３番４４－１－１０２号,2023-02-06,株式会社
株式会社ＲｉＢ,大阪府大阪市北区中崎西１丁目６番３６号サクラビル３０７号,2023-02-06,株式会社
株式会社Ｒｉｓｋｄｅｆｅｎｓｅ,神奈川県海老名市上今泉２丁目５番３９－１０２号,2023-02-06,株式会社
株式会社Ｒｏｏｆｓｈｏｔ,千葉県千葉市美浜区中瀬１丁目３番地幕張テクノガーデンＣＢ棟３階ＭＢＰ,2023-02-06,株式会社
株式会社Ｒｏｏｔｓ,大阪府大阪市北区梅田１丁目２番２号大阪駅前第２ビル４階,2023-02-06,株式会社
株式会社Ｓ・Ｊ・Ｋ,広島県福山市千田町２丁目４７番２１－４号,2023-02-06,株式会社
株式会社ＳＡＮＳＨＩＮ,広島県呉市安浦町内海南４丁目１番１０号,2023-02-06,株式会社
株式会社ＳＣ,東京都新宿区西新宿６丁目９番１－５０５号,2023-02-06,株式会社
株式会社ＳＥＣＯＮＤ,大阪府大阪市阿倍野区阿倍野筋３丁目１０番１－７０６号,2023-02-06,株式会社
株式会社ＳＫＩＬＬ,山梨県山梨市上神内川１１８９番地メゾン・ド・タカノ２０１,2023-02-06,株式会社
株式会社ＳＭＩＬＥ,東京都目黒区碑文谷１丁目２３番１２－５０７号,2023-02-06,株式会社
株式会社ＳＰＯＩＴＥ,埼玉県戸田市下前１丁目１１番２０－１３５９号,2023-02-06,株式会社
株式会社ＳＲコーポレーション,東京都渋谷区代官山町１３－８－５０４,2023-02-06,株式会社
株式会社ＳＲＢ,埼玉県所沢市和ケ原３丁目９４－９,2023-02-06,株式会社
株式会社ＳＲＩ,静岡県静岡市駿河区石田３丁目１４番２７号,2023-02-06,株式会社
株式会社ＳＴＵＤＩＯ　ＲＡＫＵ,東京都中央区日本橋人形町１丁目１３番９－６０２号,2023-02-06,株式会社
株式会社ＳＵＮ　ＴＲＡＤＥ,愛知県春日井市神領町１丁目２５番地７,2023-02-06,株式会社
株式会社Ｓａｋａｂａ　Ｗｏｒｌｄ,東京都新宿区新小川町１番１４号リープレックスビズ２階,2023-02-06,株式会社
株式会社Ｓｈａｒｅ,栃木県宇都宮市中央３丁目１番４号栃木県産業会館３階宇都宮ベンチャーズ内,2023-02-06,株式会社
株式会社Ｓｈｉｔｅｎ,東京都豊島区南池袋１丁目１６番２０号ぬかりやビル６階６１４,2023-02-06,株式会社
株式会社Ｓｐｏｒｔｉａ,東京都世田谷区砧７丁目１８番２６号,2023-02-06,株式会社
株式会社Ｓｕｎｓｅｔ　Ｒｉｓｅ,大阪府豊中市西緑丘１丁目５番１２－３０６号,2023-02-06,株式会社
株式会社ＴＡＩＹＯＷ物流,愛知県名古屋市北区大曽根３丁目５番１９号ヒルズ大曽根７０２号,2023-02-06,株式会社
株式会社ＴＡＫＡＮＯ,茨城県下妻市鎌庭２６９２番地２プレジデンツ壱番館１０２,2023-02-06,株式会社
株式会社ＴＥＣ不動産鑑定,千葉県習志野市谷津５丁目１８－２５,2023-02-06,株式会社
株式会社ＴＨＲＥＥ　ＳＥＥＤｓ,神奈川県横浜市磯子区汐見台３丁目２番地３ヴェレーナシティ上大岡４１９号,2023-02-06,株式会社
株式会社ＴＯＭＩ’Ｓ２１,沖縄県中頭郡北谷町字吉原６７７番地６,2023-02-06,株式会社
株式会社ＴＲＹ,埼玉県加須市琴寄８７１番地１,2023-02-06,株式会社
株式会社ＴＳワークス,福井県鯖江市石田上町１４号２番地５,2023-02-06,株式会社
株式会社ＴＳ工法技術協議会,静岡県沼津市本田町４番２６号,2023-02-06,株式会社
株式会社ＴＳＲＣ,東京都足立区東保木間２丁目２６番６号,2023-02-06,株式会社
株式会社Ｔｈｅ　Ｏｋｉｎａｗａ　Ｖａｎｉｌｌａ　Ｃｏｍｐａｎｙ,沖縄県南城市玉城字船越２１８番地１,2023-02-06,株式会社
株式会社Ｔｏｎａｉ,埼玉県入間市扇町屋５丁目２番７号５,2023-02-06,株式会社
株式会社Ｔｒｅｆｏｉｌ,東京都練馬区関町北３丁目４０番３号,2023-02-06,株式会社
株式会社ＵＫ,東京都渋谷区代々木１丁目３番４号パレステュディオ代々木Ⅱ（神宮の杜）２０４,2023-02-06,株式会社
株式会社ＵＬＴ,北海道札幌市白石区本通３丁目北３番７－１０１号,2023-02-06,株式会社
株式会社ＵＭＬ,香川県高松市伏石町２０４６番地１サーパス伏石中央公園２０１号,2023-02-06,株式会社
株式会社ＵＮＩＱＵＥ,神奈川県横浜市神奈川区三ツ沢西町４番２１－１０１号,2023-02-06,株式会社
株式会社ＵＴＡ,大阪府泉佐野市日根野１０４０－３,2023-02-06,株式会社
株式会社Ｕｎｌｅａｓｈｅｄ,大阪府大阪市北区池田町６－４－３Ａ,2023-02-06,株式会社
株式会社ＶＡＭＯＳ,東京都千代田区岩本町２丁目１１番１号,2023-02-06,株式会社
株式会社ＶＩＴＯ,京都府京都市南区唐橋花園町１４番地１,2023-02-06,株式会社
株式会社Ｖａｎｎｅｌｌｉ　Ｃｏｆｆｅｅ　Ｊａｐａｎ,兵庫県三木市別所町東這田５７０番地の１,2023-02-06,株式会社
株式会社Ｖｅｎｔｉ,大阪府大阪市中央区南本町４丁目３番１６－３００９号,2023-02-06,株式会社
株式会社Ｖｅｒｔｅｘ　Ｄｉｇｉｔａｌ　Ｍａｒｋｅｔｉｎｇ,東京都千代田区神田猿楽町２丁目８番１１号ＶＯＲＴ水道橋Ⅲ,2023-02-06,株式会社
株式会社ＷＥＬＬ‐ＥＳＳＥＮＣＥ,東京都渋谷区神宮前６丁目３番８号,2023-02-06,株式会社
株式会社ＷｏｏｄＢｅｌｌ．,群馬県太田市山之神町２９９番地９,2023-02-06,株式会社
株式会社Ｙ’ｓクリエイト,愛知県名古屋市名東区高針台３丁目１０２８番地,2023-02-06,株式会社
株式会社ＹＯＨＡＣＫ,東京都中央区八重洲１丁目４番１６号東京建物八重洲ビル３階,2023-02-06,株式会社
株式会社ＹＵＩ,広島県広島市西区南観音２丁目９番１８－５０３号,2023-02-06,株式会社
株式会社Ｙｏｋｏｈａｍａ　Ｂａｌｌｅｔ　Ｗｏｒｋｓ,神奈川県横浜市西区浅間町１丁目４番３号ウィザードビル４０２,2023-02-06,株式会社
株式会社Ｚ‐ＥＬＥＸ　ＰＯＷＥＲ,千葉県千葉市若葉区貝塚１丁目４番４号,2023-02-06,株式会社
株式会社ｂｕｄｄｙＯ,埼玉県春日部市大場１１０８番地１上原第五ビル２Ｆ,2023-02-06,株式会社
株式会社ｃｏｎｎｅｃｔ＆Ｆ,大阪府堺市北区野遠町４９３番地２レオネクストソシア野遠１０５号,2023-02-06,株式会社
株式会社ｃｙｍｂａ,東京都中央区晴海５丁目１番９号,2023-02-06,株式会社
株式会社ｄｕｏｔｏｎｅ,東京都中央区銀座１丁目１２番４号Ｎ＆ＥＢＬＤ．６Ｆ,2023-02-06,株式会社
株式会社ｅ‐Ｌｏｏｐ,東京都千代田区神田三崎町３丁目５番９号,2023-02-06,株式会社
株式会社ｅ．Ｋｏｓ‐Ｆｉｋａ,広島県広島市佐伯区湯来町大字葛原８８４番地,2023-02-06,株式会社
株式会社ｅｎ‐ｃｒｅａｔｅ,大阪府堺市南区和田東９８８－１,2023-02-06,株式会社
株式会社ｅｎｐｌｕｓ設計室,神奈川県横浜市神奈川区泉町１５番地５,2023-02-06,株式会社
株式会社ｆｉｋａ,兵庫県神戸市北区鈴蘭台南町５丁目４番３２号マノアール鈴蘭３０３号室,2023-02-06,株式会社
株式会社ｇｒｅＫｅｎ　ｄｅｎｔａｌ　ｌａｂ,愛知県名古屋市昭和区鶴舞３丁目１番１５号セントラルハイツカシノ２階,2023-02-06,株式会社
株式会社ｉｎｉｚｉｏ,東京都世田谷区船橋１丁目３５番１６号,2023-02-06,株式会社
株式会社ｉｎｎｏｖａｔｉｏｎ　ｍａｒｋｅｔ,三重県四日市市諏訪町６番１１号ピュアコート店舗１０４,2023-02-06,株式会社
株式会社ｉｘＦｉｖｅ,大阪府堺市西区草部１４８０番地,2023-02-06,株式会社
株式会社ｋｎｏｗ‐ｗｈｙ,大阪府大阪市淀川区西中島３丁目１８番２１号ＮＬＣ新大阪１８号館４階,2023-02-06,株式会社
株式会社ｋｕｕｐｏｒｔ,埼玉県さいたま市大宮区宮町１丁目８６番地１,2023-02-06,株式会社
株式会社ｍｏＮ,兵庫県加古川市加古川町溝之口７２８番地ミキシティビル１Ｆ,2023-02-06,株式会社
株式会社ｍｏｔｏ,兵庫県尼崎市東園田町５丁目８７番地,2023-02-06,株式会社
株式会社ｏｎｅ　ｓｔｙｌｅ　ｂｅａｕｔｙ,神奈川県藤沢市藤沢９７１－１リベール藤沢第２ビル２階,2023-02-06,株式会社
株式会社ｏｎｅ　ｔｅａｍ,埼玉県さいたま市北区植竹町１丁目５４１－３０１,2023-02-06,株式会社
株式会社ｐｅｐｅ,広島県三次市十日市東５丁目２番３９号,2023-02-06,株式会社
株式会社ｔｏ　ｐｌａｎ,福岡県福岡市東区名島５丁目６９番１２号アンピール千早駅南４１０号室,2023-02-06,株式会社
株式会社ｕｎｉｃｏ　ｄｅｓｉｇｎ,埼玉県北本市石戸４丁目４７５番地４,2023-02-06,株式会社
株式会社ｗｉｔｈ,大阪府門真市本町２７番１８号,2023-02-06,株式会社
森川不動産株式会社,福岡県北九州市小倉北区下到津２丁目３番２７号,2023-02-06,株式会社
比田井建設工業株式会社,神奈川県大和市下和田８６１番地１,2023-02-06,株式会社
永光株式会社,大阪府東大阪市高井田元町１丁目１１番２５号,2023-02-06,株式会社
瀬栄陶器株式会社,愛知県名古屋市東区芳野１丁目１４番１９号,2023-02-06,株式会社
特定非営利活動法人ひまわり,神奈川県横須賀市安浦町２丁目３３番地１２リーデンス・コート６０４,2023-02-06,その他の設立登記法人
特定非営利活動法人山梨・人ねっこアートワーク,山梨県笛吹市御坂町二之宮２５－２,2023-02-06,その他の設立登記法人
特定非営利活動法人野生動物被害対策研究会,鹿児島県日置市東市来町神之川１９０番地,2023-02-06,その他の設立登記法人
相志コンサルティング株式会社,埼玉県八潮市大字木曽根８２１番地１サンシャトーＳ３０１,2023-02-06,株式会社
知行投資株式会社,東京都豊島区北大塚２丁目２番１３－７０１号,2023-02-06,株式会社
神戸セントラル株式会社,兵庫県西宮市段上町６丁目９番４－１号,2023-02-06,株式会社
税理士法人カンパネラ,東京都台東区鳥越２丁目１０番２号,2023-02-06,その他の設立登記法人
竹鶴ホールディングス株式会社,広島県竹原市本町３丁目１０番２９号,2023-02-06,株式会社
第十二日本ソーラー電力合同会社,千葉県千葉市中央区富士見１丁目１４番１３号千葉大栄ビル８階,2023-02-06,合同会社
管理組合法人八重洲第七長岡ビル,東京都千代田区神田多町２丁目２番２２号千代田ビル７Ｆ,2023-02-06,その他の設立登記法人
米とわたしと合同会社,兵庫県神戸市東灘区岡本２丁目１１番１０－１０１号,2023-02-06,合同会社
自然電力いなべ株式会社,三重県いなべ市北勢町阿下喜３１番地,2023-02-06,株式会社
若松株式会社,茨城県龍ケ崎市出し山町１１２番地２階,2023-02-06,株式会社
菊地塗工株式会社,茨城県つくば市上ノ室１９６７番地４,2023-02-06,株式会社
西野設備株式会社,大阪府岸和田市上野町西１７番９号,2023-02-06,株式会社
農事組合法人加茂営農組合,富山県射水市加茂中部１１７０番地,2023-02-06,その他の設立登記法人
都住創大手前管理組合法人,大阪府大阪市中央区大手前１丁目４番２号,2023-02-06,その他の設立登記法人
里山設備設計株式会社,兵庫県川西市笹部２丁目３７番２５－１号,2023-02-06,株式会社
鈴木塗装工業株式会社,長野県長野市篠ノ井塩崎４５９０番地１,2023-02-06,株式会社
鑫域株式会社,千葉県船橋市海神５丁目２８番１８－１号,2023-02-06,株式会社
青久商店株式会社,愛知県名古屋市中区金山２丁目６番１４号ＨＡＴビル１Ｆ,2023-02-06,株式会社
青山インベストメント・リサーチ株式会社,東京都港区南青山４丁目１８番２１号,2023-02-06,株式会社
順祥興業株式会社,東京都練馬区上石神井３丁目２８番１０号,2023-02-06,株式会社
顧問クラブ合同会社,東京都中央区銀座１丁目１２番４号Ｎ＆ＥＢＬＤ．６Ｆ,2023-02-06,合同会社
飯田商会合同会社,滋賀県甲賀市甲南町希望ケ丘４丁目２７番地５,2023-02-06,合同会社
鴻澤興業株式会社,神奈川県平塚市南金目７２３番地１号,2023-02-06,株式会社
鼎鑫株式会社,愛知県名古屋市北区成願寺１丁目６番６ザ・シーン城北アストロタワー７０７号－Ｃ室,2023-02-06,株式会社
龍江合同会社,埼玉県川口市西川口６丁目７－３２,2023-02-06,合同会社
１ｓｔ建設株式会社,東京都台東区花川戸２丁目１７番７－７０２号,2023-02-06,株式会社
Ａ．Ｓｔｅｐ’ｓ株式会社,北海道札幌市豊平区月寒東三条３丁目４番５号,2023-02-06,株式会社
ＡＬＭＡ株式会社,埼玉県さいたま市大宮区桜木町１丁目３７８番地ＢＩＺｃｏｍｆｏｒｔ大宮西口ビル,2023-02-06,株式会社
ＡＲＩ合同会社,埼玉県さいたま市大宮区北袋町１丁目３２８番地２メリービル２Ｆ,2023-02-06,合同会社
ＡＳＰテック株式会社,埼玉県蕨市北町１丁目２６番４号ルネ蕨ガーデンシティ１００７号,2023-02-06,株式会社
ＡＴ　Ｆｏｒｅｆｒｏｎｔ株式会社,東京都文京区西片２丁目１３番７号,2023-02-06,株式会社
ＡＵＴＯ　ＷＯＲＬＤ株式会社,神奈川県藤沢市西俣野１９０８番地１,2023-02-06,株式会社
Ａｎａｔｏｍａｇｅ　Ｊａｐａｎ株式会社,東京都千代田区霞が関３丁目２番５号,2023-02-06,株式会社
Ａｎｄｒａｗ合同会社,神奈川県平塚市広川４１番地１０,2023-02-06,合同会社
Ａｎｅｌａ　Ｈｏｌｄｉｎｇｓ株式会社,東京都渋谷区神宮前４丁目３１番１１号,2023-02-06,株式会社
Ａｓａｈｉ　Ｇｒｏｕｐ株式会社,静岡県浜松市南区遠州浜２丁目２２番９号,2023-02-06,株式会社
Ａｘｌａ合同会社,東京都渋谷区道玄坂１丁目１０番８号渋谷道玄坂東急ビル２Ｆ－Ｃ,2023-02-06,合同会社
ＢＢｒａｎｃｈ合同会社,福岡県北九州市門司区大里原町９番２１号,2023-02-06,合同会社
ＢＥＬＬ　ＢＡＳＥ株式会社,埼玉県さいたま市緑区東浦和３丁目４－１８,2023-02-06,株式会社
ＢＥＴＴＥＲ　ＨＯＭＥ株式会社,神奈川県川崎市川崎区京町２丁目２４番６－１５０５号,2023-02-06,株式会社
ＢａｙＳｈａｒｉｎｇ株式会社,神奈川県横浜市保土ケ谷区岩崎町２３番３８号,2023-02-06,株式会社
Ｂｉｚ合同会社,神奈川県足柄下郡箱根町強羅１３２０－８６ＧＶ強羅Ｄ－２０１＃Ｒ０１,2023-02-06,合同会社
Ｂｒｉｇｈｔ合同会社,埼玉県さいたま市緑区大字三室１６５５番地２０,2023-02-06,合同会社
ＣＥＮＴＥＣＨ株式会社,愛知県名古屋市東区泉１丁目１番３０号（ＢＰＲレジデンス久屋大通公園１１０６号）,2023-02-06,株式会社
ＣＬＯＶＥＲＣ合同会社,三重県桑名市大字星川９５８番地５,2023-02-06,合同会社
ＣＳ合同会社,東京都台東区下谷２丁目１５番４－３０２号エクセル入谷２号館,2023-02-06,合同会社
Ｃａｎａａ合同会社,宮城県仙台市青葉区花京院１丁目１番５２－１２０１号,2023-02-06,合同会社
Ｃｅｙｌｏｎ　Ｍｉｎｔ合同会社,茨城県龍ケ崎市愛戸町２９番地,2023-02-06,合同会社
Ｃｉｒｏ合同会社,大阪府大阪市北区中崎３丁目４番１３号プリマクラッセ１０１Ｂ,2023-02-06,合同会社
ＣｏＥｖｏｌｕｔｉｏｎ合同会社,大阪府大阪市中央区北久宝寺町３丁目６番１号本町南ガーデンシティ７階,2023-02-06,合同会社
Ｃｙｎ‐Ｋバイオ株式会社,京都府京都市左京区吉田橘町３２番地,2023-02-06,株式会社
Ｄ＆Ｙ　Ｖｅｎｔｕｒｅｓ株式会社,大阪府大阪市浪速区敷津西２丁目１３番２号ＮＯ．２ＢＬＯＯＭＢＬＤ３Ｆ,2023-02-06,株式会社
Ｄｈ‐ＨＡＬ合同会社,神奈川県横浜市金沢区泥亀２丁目１番１０号,2023-02-06,合同会社
ＥＮＩＡＣ合同会社,神奈川県横浜市都筑区中川中央１丁目２４－６センター北ＹＳビル４０１,2023-02-06,合同会社
Ｅｔｅｒｎａｌ　Ｌｉｇｈｔ株式会社,熊本県熊本市中央区水前寺１丁目１８番３号ダイコー水前寺Ⅲ４０２,2023-02-06,株式会社
Ｆ．Ｂ．Ｄ．Ａ．名古屋株式会社,愛知県名古屋市守山区中新１０番１０号,2023-02-06,株式会社
Ｆ．Ｂ．Ｄ．Ａ．広島株式会社,大阪府東大阪市御厨南３丁目１番４６－９０８号,2023-02-06,株式会社
ＦＨ株式会社,東京都荒川区町屋３丁目２４番２号面川ビル２１１号室,2023-02-06,株式会社
ＦＲＩＥＮＤＦＲＩＥＮＤ株式会社,千葉県山武郡九十九里町片貝３７６２番地１３,2023-02-06,株式会社
ＦＵＴＵＲＥ　ＤＥＳＩＧＮ株式会社,大阪府高槻市東城山町１０番１５号,2023-02-06,株式会社
Ｆｕｔｕｒｅ　ｔｅｃｈｎｏｌｏｇｉｅｓ株式会社,東京都中央区銀座２丁目１０番１８号,2023-02-06,株式会社
ＧＡＬＡＮＴ　ＲＯＳＥ　ＩＮＴＥＲＮＡＴＩＯＮＡＬ合同会社,鳥取県米子市両三柳５０３７,2023-02-06,合同会社
ＧＥＡＲ冷熱株式会社,長野県佐久市鍛冶屋３７５番地５,2023-02-06,株式会社
ＧＬＯＢＡＬ　ＳＨＡＲＥＳ合同会社,東京都調布市下石原１丁目１０番地１１,2023-02-06,合同会社
ＧＲＡＮＴ株式会社,東京都江戸川区中葛西４丁目１２番２－２０５号メゾンアルファ中葛西,2023-02-06,株式会社
ＧｅｅＰｌｕｓ合同会社,大阪府堺市北区中百舌鳥町６丁９６２番地１０１,2023-02-06,合同会社
Ｇｌｕｖ合同会社,東京都小平市学園西町１丁目１１番１６号,2023-02-06,合同会社
Ｇｒｏｕｎｄ　Ｍ株式会社,神奈川県横浜市緑区台村町３５２番地１ピコ中山１０２号,2023-02-06,株式会社
ＨＩＴＯＭＩＳＴＹＬＥ株式会社,広島県広島市中区大手町４丁目５番１１－１２０２号,2023-02-06,株式会社
ＨＲエージェント株式会社,埼玉県川口市川口２丁目１２番１０－２０１号エルヴィータ,2023-02-06,株式会社
ＨＴ　ＭＯＢＩＬＥ株式会社,京都府京都市伏見区深草相深町１６番地３,2023-02-06,株式会社
ＩＪＡ協同組合,長野県佐久市志賀５６６４番地２,2023-02-06,その他の設立登記法人
Ｉｎｄｕｓ合同会社,東京都港区南青山７丁目２番１０－６０１号,2023-02-06,合同会社
ＪＡＴ合同会社,大分県由布市湯布院町川北２０２７番地１,2023-02-06,合同会社
ＪＯＥ株式会社,熊本県山鹿市山鹿１５５番地８セリーヌ壱番館１０５,2023-02-06,株式会社
Ｊｅｅｍｓ合同会社,埼玉県草加市青柳４丁目１番１３号,2023-02-06,合同会社
Ｊｏｙ　ｗｉｔｈ　Ｐａｗｓ合同会社,東京都世田谷区駒沢３丁目２４番６号,2023-02-06,合同会社
Ｋエンタープライズ株式会社,神奈川県横浜市保土ケ谷区今井町１１２０番地１,2023-02-06,株式会社
ＫＥＮＴＯＳＨＩ株式会社,東京都世田谷区駒沢２丁目３４番２号,2023-02-06,株式会社
ＫＩＫＫＡＷＡ興業株式会社,静岡県沼津市大手町４丁目４番１２号伊豆屋第三ビル２階,2023-02-06,株式会社
ＬＥカンパニー株式会社,福島県いわき市東田町菖蒲沢１３番地,2023-02-06,株式会社
ＬＥ工業株式会社,神奈川県横浜市南区日枝町２丁目４７番地６クレアール吉野町３０１号室,2023-02-06,株式会社
ＬＥＧＡＲＥＡ　ＢＡＳＥ合同会社,埼玉県越谷市レイクタウン９丁目１－２８ロイジェントパークスレイクタウンＡ３０５,2023-02-06,合同会社
ＬＥＯ株式会社,三重県津市豊が丘２丁目３２番１１号,2023-02-06,株式会社
ＬＥＶＥＬＵＰ　ｆｏｏｄｓ　ｔｅｃｈｎｏｌｏｇｙ　Ｊａｐａｎ株式会社,東京都渋谷区恵比寿１丁目２１番１８－５０１号,2023-02-06,株式会社
ＬＩＬＡＣ合同会社,大阪府大阪市住吉区長居東３丁目１５番３５号３Ｆ,2023-02-06,合同会社
ＬＵＤＥ株式会社,東京都江東区東砂５丁目５番６－３０７号,2023-02-06,株式会社
Ｌｅｖｅｌｅｒ株式会社,東京都渋谷区道玄坂１丁目１０番８号渋谷道玄坂東急ビル２Ｆ－Ｃ,2023-02-06,株式会社
Ｌｉｍｅ．ａｒｔ合同会社,神奈川県横須賀市秋谷４１６５番地１２,2023-02-06,合同会社
ＬｉｎｋＵ合同会社,大阪府大阪市中央区玉造２丁目５番１３―５０６号,2023-02-06,合同会社
ＭＧＳ合同会社,千葉県松戸市栗山７０番地の６,2023-02-06,合同会社
ＭＫホールディングス株式会社,大阪府八尾市安中町３丁目１番２６号,2023-02-06,株式会社
ＭＫ合同会社,東京都荒川区東日暮里４丁目２３番１１－２０３号青山ビル,2023-02-06,合同会社
