法人名,住所,設立日,法人種別
一般社団法人エネルギー変換医科学－自然科学ＬＡＤＯＲＡＴＯＲＹ,神奈川県横浜市青葉区つつじが丘２８番地４９,2021-01-22,その他の設立登記法人
一般社団法人キャリアアップサポート協会,愛知県名古屋市中村区名駅５丁目３３番２１号アクアタウン納屋橋１３０３号,2021-01-22,その他の設立登記法人
一般社団法人コーンアーク,山口県山口市小郡下郷１０７３番地６,2021-01-22,その他の設立登記法人
一般社団法人モリマチリノベーション,静岡県周智郡森町森３４９番地の１,2021-01-22,その他の設立登記法人
一般社団法人三沢ソーラー,東京都中央区八重洲２丁目７番２号,2021-01-22,その他の設立登記法人
一般社団法人三重ＲＡＳアトランティックサーモンプロジェクトＨＤ,東京都千代田区丸の内３丁目１番１号東京共同会計事務所内,2021-01-22,その他の設立登記法人
一般社団法人中小企業支援機構,東京都羽村市神明台２丁目２番地５リーベスト羽村２０６,2021-01-22,その他の設立登記法人
一般社団法人入居サポートセンター・みやぎ,宮城県仙台市青葉区一番町２丁目５番２２号ＧＣあおば通りプラザ８階,2021-01-22,その他の設立登記法人
一般社団法人四葉奨学育英会,鳥取県米子市八幡６６２番地２,2021-01-22,その他の設立登記法人
一般社団法人学童クラブツリーツリー,沖縄県うるま市字田場１－２,2021-01-22,その他の設立登記法人
一般社団法人小松ソーラー,東京都中央区八重洲２丁目７番２号,2021-01-22,その他の設立登記法人
一般社団法人日本学習玩具協会,大阪府大阪市西区立売堀４丁目７番１５号,2021-01-22,その他の設立登記法人
一般社団法人水戸ソーラー,東京都中央区八重洲２丁目７番２号,2021-01-22,その他の設立登記法人
一般社団法人総合防犯士会,東京都港区浜松町１丁目１２番４号第２長谷川ビル４階,2021-01-22,その他の設立登記法人
一般社団法人自分広告,埼玉県川口市上青木西１丁目４番３－２０５号,2021-01-22,その他の設立登記法人
一般社団法人雫石ソーラー,東京都中央区八重洲２丁目７番２号,2021-01-22,その他の設立登記法人
一般社団法人Ｄ２Ｋ三沢ソーラー,東京都中央区八重洲２丁目７番２号,2021-01-22,その他の設立登記法人
一般社団法人Ｄ２Ｋ小松ソーラー,東京都中央区八重洲２丁目７番２号,2021-01-22,その他の設立登記法人
一般社団法人Ｄ２Ｋ水戸ソーラー,東京都中央区八重洲２丁目７番２号,2021-01-22,その他の設立登記法人
一般社団法人Ｄ２Ｋ雫石ソーラー,東京都中央区八重洲２丁目７番２号,2021-01-22,その他の設立登記法人
一般社団法人ＭＥＴ－ＳＬ,東京都港区芝浦３丁目１７番１１号天翔田町ビル１０Ｆ,2021-01-22,その他の設立登記法人
一般社団法人Ｍｅｄｉｃａｌ＆Ｓｅｃｕｒｉｔｙ協会,東京都品川区東五反田１丁目１４番９号,2021-01-22,その他の設立登記法人
一般社団法人ＳＡ　ＰＲＯＰＥＲＴＹ　ＯＪＩＭＡ２,東京都港区虎ノ門５丁目１番４号,2021-01-22,その他の設立登記法人
一般財団法人岡本教育財団,東京都渋谷区道玄坂１丁目１２番１号,2021-01-22,その他の設立登記法人
七志会合同会社,京都府京都市伏見区深草直違橋１１丁目１１７番地,2021-01-22,合同会社
京・街かど株式会社,京都府京都市右京区西院西矢掛町１８番地,2021-01-22,株式会社
京都建販株式会社,京都府京都市下京区西洞院通木津屋橋上る東塩小路町６０７番地,2021-01-22,株式会社
共立湯河原マンション管理組合法人,神奈川県足柄下郡湯河原町吉浜１０５０番地の２,2021-01-22,その他の設立登記法人
利龍株式会社,大阪府大阪市西成区千本南１丁目１７番２１号１０５－Ｇ室,2021-01-22,株式会社
医療法人さいとう消化器内科クリニック,大阪府大阪市天王寺区堂ケ芝２丁目１３番２号エミネンス堂ヶ芝１Ｆ,2021-01-22,その他の設立登記法人
医療法人さのこどもクリニック,大阪府大阪市福島区海老江１丁目２番１７号阪神野田駅前ノースサイドビル３階,2021-01-22,その他の設立登記法人
医療法人千世会,大阪府堺市堺区向陵中町２丁３番１３号,2021-01-22,その他の設立登記法人
医療法人大桜会,大阪府大阪市浪速区桜川２丁目２番３１号ザクロコーポレーション桜川ビル３階,2021-01-22,その他の設立登記法人
医療法人法橋心療内科,大阪府高槻市城北町２丁目１４番２８号関西城北ビル３０３号,2021-01-22,その他の設立登記法人
医療法人社団仁勇会,山梨県中巨摩郡昭和町西条１４８１－２,2021-01-22,その他の設立登記法人
千尋建築株式会社,茨城県龍ケ崎市野原町１５３番地,2021-01-22,株式会社
厚木田園都市株式会社,神奈川県厚木市寿町２丁目４番１号,2021-01-22,株式会社
双鼎商事株式会社,大阪府大阪市西成区千本南１丁目１７番２１号２０２－Ａ室,2021-01-22,株式会社
台湾貿易株式会社,山梨県笛吹市一宮町南野呂２１１番地,2021-01-22,株式会社
司法書士法人スペース,愛知県名古屋市名東区猪子石原３丁目５０２番地,2021-01-22,その他の設立登記法人
司法書士法人加藤事務所,岩手県一関市千厩町千厩字北方２２番地２,2021-01-22,その他の設立登記法人
合同会社あおぞら,福岡県北九州市小倉南区高野１丁目３番１０号紫水苑５０２号,2021-01-22,合同会社
合同会社おぼらだれん,神奈川県厚木市関口２２８－２,2021-01-22,合同会社
合同会社きぼう,奈良県奈良市朱雀６丁目１番地の８,2021-01-22,合同会社
合同会社くりはらファーマーズラボ,宮城県栗原市一迫柳目字平沢８０番地,2021-01-22,合同会社
合同会社みずほ１２,鹿児島県鹿児島市上之園町１８番地１３プラウディア上之園９０３号,2021-01-22,合同会社
合同会社みずほ２１,鹿児島県鹿児島市上之園町１８番地１３プラウディア上之園９０３号,2021-01-22,合同会社
合同会社よこやま,大阪府交野市私部８丁目６番１３号,2021-01-22,合同会社
合同会社アクシア,愛知県名古屋市中区栄１丁目２２番７号サカエビル２２－４Ｃ,2021-01-22,合同会社
合同会社アニテル,大阪府大阪市平野区長吉長原３丁目１６番２２－４０１号,2021-01-22,合同会社
合同会社アーカイブ,埼玉県蓮田市馬込４丁目９２番地,2021-01-22,合同会社
合同会社ウォッカ,東京都中野区中野３丁目１９番５号パラレル１０２号室,2021-01-22,合同会社
合同会社エクセレント,大阪府大阪市西区九条南２丁目２６番１３－１１０２号,2021-01-22,合同会社
合同会社オフィス松下,千葉県浦安市今川３丁目１０番１４号,2021-01-22,合同会社
合同会社カミーノ沖縄,沖縄県豊見城市字根差部６９７番地１,2021-01-22,合同会社
合同会社クロスコ,埼玉県川口市栄町３丁目１２－１１,2021-01-22,合同会社
合同会社グッドフェイス,埼玉県さいたま市浦和区本太４丁目－８番１１－５０５号,2021-01-22,合同会社
合同会社グリーンガーデン,北海道石狩市緑苑台東一条１丁目１９番地,2021-01-22,合同会社
合同会社コネクト１３,鹿児島県鹿児島市上之園町１８番地１３プラウディア上之園９０３号,2021-01-22,合同会社
合同会社コネクト１６,鹿児島県鹿児島市上之園町１８番地１３プラウディア上之園９０３号,2021-01-22,合同会社
合同会社サッポロビールファンクラブ御徒町,東京都台東区台東４丁目２９番１０号８Ｆ,2021-01-22,合同会社
合同会社シグナル,兵庫県神戸市灘区青谷町４丁目１－７,2021-01-22,合同会社
合同会社シールワークス,埼玉県戸田市下戸田２丁目３番１０号,2021-01-22,合同会社
合同会社スポットナカジマ,東京都八王子市宮下町２９７番地１,2021-01-22,合同会社
合同会社ツラくない節約,東京都杉並区和田３丁目４２番４号,2021-01-22,合同会社
合同会社ナノナイロ,茨城県水戸市天王町６番１３号,2021-01-22,合同会社
合同会社ヒロ外工,秋田県秋田市仁井田目長田１丁目６番７号,2021-01-22,合同会社
合同会社フラッグ,東京都港区虎ノ門３丁目２２番１０－２０１号,2021-01-22,合同会社
合同会社ブライトサークル,東京都豊島区東池袋２丁目６０番２－５０７号,2021-01-22,合同会社
合同会社プレフェス,東京都文京区湯島２丁目３２番１０号,2021-01-22,合同会社
合同会社マルミッツゲームス,滋賀県大津市比叡平２丁目４４番７号,2021-01-22,合同会社
合同会社ミヨンラボ,東京都中央区銀座４丁目９番８号,2021-01-22,合同会社
合同会社メンタルヘルプ,東京都文京区白山４丁目３３番２３号ル・カルフール９０１,2021-01-22,合同会社
合同会社リバーサイド・スギザキ,神奈川県川崎市高津区久地１丁目３８番４号,2021-01-22,合同会社
合同会社リンク,福岡県宗像市須恵４丁目２７番２３号,2021-01-22,合同会社
合同会社レインボー１０１,東京都八王子市大楽寺町２８７番地１２,2021-01-22,合同会社
合同会社ロータステーブル,東京都墨田区向島３丁目４６番１４号ＴＯＰ押上ＮＯ１４０６号室,2021-01-22,合同会社
合同会社三重ＲＡＳアトランティックサーモンプロジェクト,東京都千代田区丸の内３丁目１番１号東京共同会計事務所内,2021-01-22,合同会社
合同会社京都平安クロニクル,京都府京都市上京区主税町１０４５－１,2021-01-22,合同会社
合同会社便利屋・リサイクルやまだ,北海道札幌市東区北四十条東１９丁目４番１５号,2021-01-22,合同会社
合同会社南部モータース,沖縄県糸満市字兼城３３９番地１,2021-01-22,合同会社
合同会社吉美,東京都東大和市新堀３丁目１０番地の１パピリオン東大和２０１号,2021-01-22,合同会社
合同会社和,東京都豊島区池袋２丁目１３番４号天翔池袋西口ビル,2021-01-22,合同会社
合同会社夢結彩,埼玉県熊谷市永井太田５３番地１,2021-01-22,合同会社
合同会社大宏,神奈川県横浜市金沢区六浦５丁目４３番１－４１０号,2021-01-22,合同会社
合同会社大潟未来計画,秋田県南秋田郡大潟村字西３丁目２番地４,2021-01-22,合同会社
合同会社岡,北海道岩見沢市緑が丘４丁目２２１番地８７,2021-01-22,合同会社
合同会社志木テック,埼玉県志木市本町５丁目１番６号,2021-01-22,合同会社
合同会社東日本猟友会,福島県会津若松市門田町飯寺字村東８６０番地３４,2021-01-22,合同会社
合同会社松本事務所,大阪府大阪市中央区谷町２丁目３番１号第２ターネンビル５階,2021-01-22,合同会社
合同会社沖縄唐揚げ堂,沖縄県那覇市泊１丁目６－４－２Ｆ,2021-01-22,合同会社
合同会社清雅,大阪府大阪市住之江区西加賀屋３丁目１８番１５号,2021-01-22,合同会社
合同会社袋井バイオマス発電所,静岡県袋井市西同笠９２１番５０,2021-01-22,合同会社
合同会社飛天坂パートナーズ,千葉県市原市北国分寺台４丁目１０番地２,2021-01-22,合同会社
合同会社麦ノ音,滋賀県大津市北比良９７０番地の１２３,2021-01-22,合同会社
合同会社３８９ＣＲＥＷ,東京都杉並区上荻２丁目３４番８号,2021-01-22,合同会社
合同会社Ａ＆Ｌ,東京都杉並区西荻南３丁目１６番４号,2021-01-22,合同会社
合同会社ＡＫＩＮＩＴＡ,福岡県福岡市早良区原４丁目２３番６－４０９号,2021-01-22,合同会社
合同会社ＡＮＮＥ,大阪府高槻市津之江町１丁目８９番２４号,2021-01-22,合同会社
合同会社ＡＺＭＦＲ,東京都港区虎ノ門５丁目１番４号,2021-01-22,合同会社
合同会社ＡＺＭＦＲ３,東京都港区虎ノ門５丁目１番４号,2021-01-22,合同会社
合同会社Ａｃｅ－Ｋ,東京都板橋区新河岸３丁目１４番９－３０５号,2021-01-22,合同会社
合同会社Ｃ＆Ｈトレーディング,神奈川県横浜市南区山谷８２番地４ロータリーパレス横濱山の手７０６号,2021-01-22,合同会社
合同会社ＣＯＭＥ　ＯＮ　ＴＥＣ,鹿児島県熊毛郡屋久島町尾之間６６１番地,2021-01-22,合同会社
合同会社ＤＣスパーク,東京都豊島区南大塚２丁目３８番１号,2021-01-22,合同会社
合同会社ＤＮ,東京都新宿区北新宿１丁目２９番１４号２０１,2021-01-22,合同会社
合同会社Ｄｏエステート,熊本県熊本市中央区黒髪２丁目１８番３０号２階,2021-01-22,合同会社
合同会社ＦＬＹ　ＨＩＧＨ,北海道札幌市北区新琴似七条２丁目２番５８号,2021-01-22,合同会社
合同会社ＦＵＫＵＲＯ９１０,東京都千代田区九段南１丁目５番６号りそな九段ビル５階ＫＳフロア,2021-01-22,合同会社
合同会社ＦｉｒｓｔＰｅｎｇｕｉｎ,長野県佐久市中込１２４８番地３号Ｂ－２０１,2021-01-22,合同会社
合同会社ＧＩＦＴ,三重県南牟婁郡紀宝町大里５６０番地,2021-01-22,合同会社
合同会社ＧＲＯＵＮＤ　ＥＩＧＨＴ,東京都中央区銀座１丁目２２番１１号銀座大竹ビジデンス２階,2021-01-22,合同会社
合同会社ＬＩＦＴ２,東京都千代田区内幸町１丁目１番１号,2021-01-22,合同会社
合同会社ＭＡＲＵＷＡ,北海道北広島市大曲６１９番地,2021-01-22,合同会社
合同会社ＭＩＤ,東京都千代田区神田佐久間町１丁目１６大橋ビル５０３,2021-01-22,合同会社
合同会社ＰＲＩＢＥＴＡ,山形県山形市末広町１１番１号ＹＡＭＡＧＥＮ末広１０３,2021-01-22,合同会社
合同会社Ｐｒｏｇｒｅｓｓ,長崎県長崎市戸町１丁目５番１－３０８号,2021-01-22,合同会社
合同会社ＲＵＮ,大阪府大阪市淀川区塚本４丁目１６番５９号,2021-01-22,合同会社
合同会社ＲＹＵＤＥＮ,東京都東久留米市幸町３丁目３番６号サンドリーム１０６,2021-01-22,合同会社
合同会社Ｒａｈｍｅｔ　Ｊａｐａｎ,東京都港区西麻布１丁目５番１６号ＬｉｆｅＲｏｃｋＣｕｂｅ３階,2021-01-22,合同会社
合同会社Ｓ．ＣＯＮＮＥＣＴ,福岡県北九州市小倉南区志徳１丁目１番１３－５０７号,2021-01-22,合同会社
合同会社ＳＡ　ＰＲＯＰＥＲＴＹ　ＯＪＩＭＡ２,東京都港区虎ノ門５丁目１番４号,2021-01-22,合同会社
合同会社ＳＯ．ＫＩ．ＨＡ．,大阪府松原市天美我堂６丁目５番４８号,2021-01-22,合同会社
合同会社ＳＰＧ,北海道札幌市豊平区月寒西一条３丁目１番２－９０１号,2021-01-22,合同会社
合同会社Ｓｍｉｌｅ－Ｓｌｉｍｅ,大阪府大阪市浪速区元町１丁目１２番８－３０５号,2021-01-22,合同会社
合同会社Ｓｏｌｅｉｌ　Ｓｏｌｅ,東京都台東区谷中１丁目４番１７号ハイツラック２０１号,2021-01-22,合同会社
合同会社ＴＡ－ＴＡ,広島県広島市中区広瀬北町８－８山陽ビル１０１,2021-01-22,合同会社
合同会社ＵＭＥ,長崎県長崎市下西山町３番８号,2021-01-22,合同会社
合同会社ＹＫコーポレーション,東京都品川区東五反田１丁目１９番８号,2021-01-22,合同会社
合同会社ｂｅ　ｓｍｉｌｅ,東京都足立区江北３丁目１８番２５号,2021-01-22,合同会社
合同会社ｄｅｖｅｌｏ,埼玉県川口市栄町３丁目１２－１１,2021-01-22,合同会社
合同会社ｆａｖｏｒｉｔｅ　ｆａｂｒｉｃ,東京都千代田区麹町５丁目３番２３号ＷｅＷｏｒｋ日テレ四谷ビル２Ｆ,2021-01-22,合同会社
合同会社ｉ‐なごみ,岐阜県岐阜市長良東１丁目９６番地２,2021-01-22,合同会社
合同会社ｍｉｚｅ,高知県土佐清水市三崎浦１丁目１０２５番地４,2021-01-22,合同会社
合同会社ｎｉｉｂｕｙａａ,沖縄県中頭郡読谷村字長浜１５１９番地１、１Ｆ,2021-01-22,合同会社
合同会社ｒｅｘ,大阪府大阪市浪速区稲荷２丁目７番１５－２０４号シティライフコム,2021-01-22,合同会社
合資会社関根,福島県須賀川市森宿字ヒジリ田４３番地５,2021-01-22,合資会社
土地家屋調査士法人匡事務所,沖縄県那覇市楚辺１丁目５番１７号,2021-01-22,その他の設立登記法人
大原野村農業會,京都府京都市西京区大原野大字石作小字東灰殿３番４番合地,2021-01-22,その他の設立登記法人
大成ビルド株式会社,静岡県静岡市葵区南安倍１丁目３番１０号,2021-01-22,株式会社
安宿部テクノ合同会社,大阪府柏原市玉手町２４番６３号,2021-01-22,合同会社
宮前平パステルコート管理組合法人,神奈川県川崎市宮前区宮前平３丁目１１番地４,2021-01-22,その他の設立登記法人
山間株式会社,大阪府大阪市西成区千本南１丁目１７番２１号２０２－Ｅ室,2021-01-22,株式会社
希望ケ丘自治会,滋賀県甲賀市甲南町希望ケ丘３丁目９,2021-01-22,その他
弁護士法人すぎの葉法律事務所,北海道札幌市中央区大通西１６丁目１番地３０第１０芙蓉ビル２階,2021-01-22,その他の設立登記法人
御幸町９番・伝馬町４番地区　市街地再開発組合,静岡県静岡市葵区御幸町９番１ＦＤＡビル７Ｆ,2021-01-22,その他
成田伝統芸能まつり実行委員会,千葉県成田市花崎町７６０,2021-01-22,その他
成田商事株式会社,千葉県千葉市美浜区高洲１丁目２２番２２号,2021-01-22,株式会社
成蹊株式会社,大阪府大阪市西成区千本南１丁目１７番２１号２０２－Ｂ室,2021-01-22,株式会社
星海不動産株式会社,東京都板橋区東坂下２丁目４－３あずさわグランドハウス１階,2021-01-22,株式会社
有限会社万番館,茨城県下妻市鎌庭５２７番地３,2021-01-22,有限会社
有限会社三和企画,山形県東根市神町西３丁目６番２０号,2021-01-22,有限会社
有限会社宮田石油商会,茨城県高萩市大字秋山１８５２番地,2021-01-22,有限会社
木のいえわが家株式会社,山梨県北杜市長坂町長坂上条２５７０番地１,2021-01-22,株式会社
杉上土地改良区,熊本県熊本市南区城南町永４４４－１,2021-01-22,その他
東名コーポレーション株式会社,愛知県名古屋市瑞穂区豊岡通２丁目５６番地,2021-01-22,株式会社
松村わかば園株式会社,大阪府八尾市垣内３丁目１４４番地,2021-01-22,株式会社
栗山産業株式会社,東京都足立区加賀２丁目２１－１０,2021-01-22,株式会社
株式会社あおばグループ,神奈川県鎌倉市大船１丁目２４番１１号,2021-01-22,株式会社
株式会社いいなホールディングス,大阪府大阪市淀川区十三本町３丁目７番３６号十三建物２階,2021-01-22,株式会社
株式会社いきらぼ,東京都江戸川区中葛西５丁目２８番８,2021-01-22,株式会社
株式会社きたい,北海道勇払郡厚真町新町３７番地の１,2021-01-22,株式会社
株式会社きちんと,茨城県古河市関戸１１８７－５,2021-01-22,株式会社
株式会社こばやし,千葉県千葉市中央区富士見２丁目１７番６号,2021-01-22,株式会社
株式会社そりとる,千葉県船橋市二和西３丁目１３番３２号,2021-01-22,株式会社
株式会社てれぷれす,鹿児島県鹿児島市西陵１丁目２７番３１号,2021-01-22,株式会社
株式会社とどめ,東京都立川市柏町３丁目２６番地の２ユタカビル１０２号,2021-01-22,株式会社
株式会社にくや,福岡県福岡市南区長丘２丁目４番１８－１２０４号,2021-01-22,株式会社
株式会社はる企画,広島県広島市中区橋本町１番１３－１２０１号,2021-01-22,株式会社
株式会社ひらつか総合企画,茨城県牛久市刈谷町３丁目６８番地２,2021-01-22,株式会社
株式会社ふらしき,鹿児島県奄美市笠利町大字中金久１０番地２,2021-01-22,株式会社
株式会社みくりや車体,静岡県御殿場市板妻７３４番地の１２,2021-01-22,株式会社
株式会社もろつか中村林業,宮崎県東臼杵郡諸塚村大字家代３０３７番地,2021-01-22,株式会社
株式会社アイル会計ファーム,福井県福井市高木中央２丁目３２１０番地,2021-01-22,株式会社
株式会社アビテアジュール,大阪府東大阪市足代２丁目１番４号,2021-01-22,株式会社
株式会社アプフェル,大阪府大阪市天王寺区上本町６丁目４番１７号カネマサ上本町ビル１０１号,2021-01-22,株式会社
株式会社アルタイル,東京都豊島区千川２丁目４番１０号,2021-01-22,株式会社
株式会社アヴィレーヴ,東京都中央区銀座１丁目２２番１１号銀座大竹ビジデンス２Ｆ,2021-01-22,株式会社
株式会社アールジェイ,東京都渋谷区神宮前６丁目２３番４号桑野ビル２階,2021-01-22,株式会社
株式会社アールプラン,千葉県柏市十余二２３０番地６,2021-01-22,株式会社
株式会社イイダハウス,埼玉県さいたま市北区奈良町４９番３号ファインライフ大宮Ⅰ－２０３号,2021-01-22,株式会社
株式会社ウィルエイト,神奈川県大和市下鶴間２４７０番地１－１００４,2021-01-22,株式会社
株式会社ウェルスラボ,東京都新宿区大久保１丁目１１番３号大東ビル４階,2021-01-22,株式会社
株式会社ウエストサイド,福岡県糸島市荻浦２丁目１０番１２号,2021-01-22,株式会社
株式会社エアセカンド,愛知県名古屋市東区砂田橋３丁目２番１０４－９０３,2021-01-22,株式会社
株式会社エイシンフーズ,東京都中央区銀座６丁目１３番１６号,2021-01-22,株式会社
株式会社エイジレスマインド,神奈川県茅ヶ崎市浜見平１３番４－８０５号,2021-01-22,株式会社
株式会社エイチディ,東京都墨田区両国２丁目１０番６号,2021-01-22,株式会社
株式会社エバーユアーズ,埼玉県川口市元郷４丁目２番１号,2021-01-22,株式会社
株式会社エフケイ,兵庫県神戸市長田区東尻池町３丁目１番３２号,2021-01-22,株式会社
株式会社エムアールシージャパン,宮城県石巻市須江字大平４１番地１,2021-01-22,株式会社
株式会社エルアール,長崎県長崎市小浦町９８０番地６,2021-01-22,株式会社
株式会社エーシステムズ,大阪府八尾市竹渕西１丁目６０番地の７,2021-01-22,株式会社
株式会社オハナ,福岡県北九州市八幡西区黒崎３丁目２番２号菅原第二ビルディング４階,2021-01-22,株式会社
株式会社オフィス松本カンパニー,大阪府大阪市阿倍野区西田辺町１丁目２１番１３号,2021-01-22,株式会社
株式会社オリオンヒルズ,神奈川県厚木市厚木町３番１号,2021-01-22,株式会社
株式会社オーケー,東京都港区白金１丁目１５番３６号,2021-01-22,株式会社
株式会社ガッツリ,東京都板橋区蓮沼町４０番１号,2021-01-22,株式会社
株式会社キーテック,神奈川県横須賀市湘南鷹取１丁目３番８号,2021-01-22,株式会社
株式会社クラフトマンシップ,東京都文京区本郷１丁目３３番１２－１００１号,2021-01-22,株式会社
株式会社クララス,愛媛県松山市立花２丁目５番３５号,2021-01-22,株式会社
株式会社クリスコ,東京都武蔵野市中町３丁目５番２２号,2021-01-22,株式会社
株式会社クレアレヴ,神奈川県大和市中央１丁目７番３２号Ｋ法務局前事務所２－２０２,2021-01-22,株式会社
株式会社クローゼット,東京都港区南青山４丁目９番３号,2021-01-22,株式会社
株式会社グランアセット,東京都中央区日本橋小網町８番２号ＢＩＺＭＡＲＫＳ日本橋茅場町５Ｆ,2021-01-22,株式会社
株式会社グリーンプラス,愛知県名古屋市瑞穂区惣作町１丁目９番地の２,2021-01-22,株式会社
株式会社グローバルペイント,東京都練馬区石神井町１丁目１５番２２号,2021-01-22,株式会社
株式会社ケティアンドライフ,東京都中央区銀座１丁目２２番１１号,2021-01-22,株式会社
