法人名,住所,設立日,法人種別
株式会社ＩｌＳｅｒｅｎｏ,東京都渋谷区渋谷２丁目７番１４号ＶＯＲＴＡＯＹＡＭＡ３０２,2025-01-09,株式会社
株式会社ＪＨＳＴ,埼玉県蕨市塚越５丁目２２番１２号クレイドルⅡ－２０１号,2025-01-09,株式会社
株式会社ＪＩＮ,大阪府大阪市北区梅田１丁目１番３号大阪駅前第３ビル２９階１－１－１号室,2025-01-09,株式会社
株式会社ＪＩＸ,東京都目黒区大岡山１丁目１７番４号,2025-01-09,株式会社
株式会社ＪＪＳ,京都府京都市下京区東洞院通五条下る３丁目和泉町５２９番地,2025-01-09,株式会社
株式会社ＪＯＷＡ,山梨県南都留郡富士河口湖町小立５６６０番地１,2025-01-09,株式会社
株式会社Ｋ’ｓライフ,東京都小平市花小金井南町１丁目５番５号,2025-01-09,株式会社
株式会社Ｋ・Ｊ　Ｗｏｏｄ　Ｗｏｒｋｓ,滋賀県甲賀市水口町今郷７７６番地２,2025-01-09,株式会社
株式会社ＫＡＮＡＤＥ,神奈川県横浜市港南区下永谷５丁目６番２５号,2025-01-09,株式会社
株式会社ＫＡＺＵ板金,栃木県大田原市蜂巣１２７番地２,2025-01-09,株式会社
株式会社ＫＥＮＳＨＩＮ,東京都町田市上小山田町１０５６番地３,2025-01-09,株式会社
株式会社ＫＦサービス,東京都新宿区西新宿３丁目７番２５号山内ビル２階,2025-01-09,株式会社
株式会社ＫＯＨＬＥＮ　ＪＡＰＡＮ,東京都中央区銀座１丁目１２番４号Ｎ＆ＥＢＬＤ．７階,2025-01-09,株式会社
株式会社ＫＯＫＯ,静岡県静岡市葵区栄町２番地５,2025-01-09,株式会社
株式会社ＫＯＭＡＣ,石川県小松市符津町ム１６１番地１,2025-01-09,株式会社
株式会社ＫＰｌｕｓ,滋賀県守山市古高町８１番１,2025-01-09,株式会社
株式会社ＫＴＫ,埼玉県八潮市大字浮塚９６６番地７,2025-01-09,株式会社
株式会社Ｌ’ａｍｉ,東京都渋谷区神宮前３丁目３６番１９号シェルブール１階,2025-01-09,株式会社
株式会社Ｌ’ａｍｏｕｒ,東京都千代田区外神田４丁目４番３号小木曽ビル４Ｆ,2025-01-09,株式会社
株式会社Ｌ．Ｆｕｎｃｔｉｏｎ再生工場,東京都中央区銀座１丁目１２－４Ｎ＆ＥＢＬＤ．７階,2025-01-09,株式会社
株式会社ＬＩＧＨＴ　ＦＩＴ,大阪府大阪市福島区海老江２丁目９番１０号ＬＩＧＨＴＦＩＴ,2025-01-09,株式会社
株式会社ＬＩＳＭ　ＷＯＲＫＳ,栃木県宇都宮市中岡本町２５６９番地３８,2025-01-09,株式会社
株式会社ＬＵＮＮＡＫＯ,千葉県白井市根１７２９－１,2025-01-09,株式会社
株式会社ＬＵＸＳＴ,千葉県市川市新井３丁目６番１５－３０２号,2025-01-09,株式会社
株式会社Ｌａ　ｖｉｅきらり,北海道札幌市西区琴似二条２丁目６番３号,2025-01-09,株式会社
株式会社Ｌａｚｏ,東京都中央区銀座４丁目１０番１４号ＡＣＮ銀座４ビルディング１０－１１Ｆ,2025-01-09,株式会社
株式会社Ｌｅａｌｅａ,埼玉県戸田市大字新曽１７７番地の２（リブリ・モンテーニュ１０７号室）,2025-01-09,株式会社
株式会社ＬｉＯＮ,福岡県京都郡苅田町神田町１丁目１６－１２－８０３,2025-01-09,株式会社
株式会社Ｌｉｅｎ,千葉県船橋市前貝塚町２７５番地３,2025-01-09,株式会社
株式会社Ｌｉｆｅｐｈｏｎｉｃ,千葉県千葉市中央区中央２丁目２番１６－２２１２号,2025-01-09,株式会社
株式会社Ｌｉｖｅ　Ｌｉｆｅ　Ｃａｒｅ,千葉県市原市牛久４７番地１,2025-01-09,株式会社
株式会社ＬｕＴｉｎｏ,東京都中央区勝どき６丁目３番１－１８０３号,2025-01-09,株式会社
株式会社Ｌｕｎａ　Ｐｉｅｎａ,東京都中央区銀座１丁目１２－４Ｎ＆ＥＢＬＤ．６Ｆ,2025-01-09,株式会社
株式会社Ｌｕｔｏｎ,埼玉県戸田市笹目４丁目３０－１シーレックスパルケ２０２号室,2025-01-09,株式会社
株式会社Ｍ’ｚ,大阪府大阪市淀川区十三東１丁目２０番３号グランビュー大阪７０１号室,2025-01-09,株式会社
株式会社Ｍアンビエンス,埼玉県上尾市栄町１番１７号,2025-01-09,株式会社
株式会社ＭＡＤＯ,東京都港区北青山１丁目３番１号アールキューブ青山３階,2025-01-09,株式会社
株式会社ＭＩＡＶＩＥ,京都府京都市中京区裏寺町５９８番地,2025-01-09,株式会社
株式会社ＭＪＧＲＯＵＰ,滋賀県草津市東矢倉２丁目１番１号５号室,2025-01-09,株式会社
株式会社ＭＫリライジョン,沖縄県沖縄市泡瀬２丁目４５番２６号,2025-01-09,株式会社
株式会社ＭＫＴ,大阪府大阪市中央区内久宝寺町２丁目２番２２－２１０３号,2025-01-09,株式会社
株式会社ＭＮＴ,鹿児島県熊毛郡南種子町中之上字石ノ峯１７１１－１,2025-01-09,株式会社
株式会社ＭＯＡＢ,兵庫県赤穂市御崎１５１番地２,2025-01-09,株式会社
株式会社ＭＯＵＮＴＡＩＮ　ＢＡＳＥ,静岡県静岡市清水区袖師町７５６番地の１,2025-01-09,株式会社
株式会社Ｍａｋｅ　Ａｃｔ,千葉県松戸市五香南３丁目１９番地の３,2025-01-09,株式会社
株式会社Ｍａｋｅ　Ｕｐ,北海道札幌市中央区大通西１丁目１４番地２,2025-01-09,株式会社
株式会社Ｍａｎａ　Ｌｅａ,千葉県松戸市中和倉１６４－１０４－１０２,2025-01-09,株式会社
株式会社Ｍａｒｑｕｅ‐Ｐａｇｅ,熊本県熊本市中央区水前寺３丁目５番２０号コープ野村水前寺１０５号,2025-01-09,株式会社
株式会社Ｍｅｇｕｍｉ　Ｃｏｍｐａｎｙ　Ｇｒｏｕｐ,東京都千代田区麹町４丁目４番地４ＡＣＮ麹町ビル１２階,2025-01-09,株式会社
株式会社Ｍｅｔｈｏｄ‐Ｌａｂ,東京都中央区銀座１丁目１２－４Ｎ＆ＥＢＬＤ．７階,2025-01-09,株式会社
株式会社Ｍｉｎｔ,群馬県館林市栄町１９番１号レオネクストノーム２０４号室,2025-01-09,株式会社
株式会社Ｍｉｒａ　Ｑｕｅｓｔ,神奈川県川崎市川崎区渡田山王町２４番１５号,2025-01-09,株式会社
株式会社Ｍｉｙａｂｅｅ,東京都千代田区神田須田町１丁目７番地８ＶＯＲＴ秋葉原Ⅳ２Ｆ,2025-01-09,株式会社
株式会社Ｍｏｎｄｅ　Ｃｏｌｏｒｅ,大阪府堺市堺区中瓦町２丁３－２９Ｋウエノビル４Ｆ,2025-01-09,株式会社
株式会社ＭｙｃｏＧｅｎｏｍｅ,東京都千代田区富士見１丁目３番１１号富士見デュープレックスＢ’ｓ４Ｆ,2025-01-09,株式会社
株式会社Ｎ’ｓ,鹿児島県鹿児島市小野１丁目８－３２,2025-01-09,株式会社
株式会社ＮＡＧＡＭＵＲＡ,宮城県黒川郡大衡村奥田字上ノ沢２８番地５８,2025-01-09,株式会社
株式会社ＮＥＢＵＬＡ　Ｔｅｃｈｎｏｌｏｇｉｅｓ　ＩＮＣ．,東京都港区北青山３丁目６－７青山パラシオタワー１１階,2025-01-09,株式会社
株式会社ＮＩＢＥＮ．,群馬県伊勢崎市西久保町３丁目６３５番地１,2025-01-09,株式会社
株式会社ＮＩＣＯ,北海道石狩郡当別町弥生５２番地,2025-01-09,株式会社
株式会社ＮＭＬＣ,愛知県春日井市鳥居松町４丁目５６２９番地４,2025-01-09,株式会社
株式会社ＮＹＫ,東京都大田区鵜の木３丁目１４番１３号,2025-01-09,株式会社
株式会社Ｎａｇａｔｏｍｏ,愛知県名古屋市北区若葉通４丁目２番地の１,2025-01-09,株式会社
株式会社Ｎａｔｕｒｉａ　Ｂｏｄｙ,三重県津市河芸町浜田５０２番地７,2025-01-09,株式会社
株式会社Ｎｅｘｕｓ　ｏｎｅ,京都府京都市下京区中堂寺坊城町２番地ＢＥＡＵＴＹＢＬＤＧＴＡＮＢＡＧＵＣＨＩ５Ｆ,2025-01-09,株式会社
株式会社Ｎｕｔｒｉｔｉｏｎ　Ｌａｂｏｒａｔｏｒｙ,東京都町田市森野１丁目３６番２号セレステ町田,2025-01-09,株式会社
株式会社ＯＵＲ,兵庫県神戸市北区八多町下小名田６４８番地の３,2025-01-09,株式会社
株式会社ＯｎｅＯＡＫ,東京都文京区後楽２丁目３番２１号住友不動産飯田橋ビル２Ｆ,2025-01-09,株式会社
株式会社Ｏｒｂｉｓ,北海道帯広市西十六条南１丁目１０番３号,2025-01-09,株式会社
株式会社ＰＬＥＡＳＵＲＥ　ＴＲＥＡＳＵＲＥ,岡山県岡山市北区今３丁目１８―２６クレール今Ｅ７０２,2025-01-09,株式会社
株式会社ＰＯＮＰＯＮ,東京都新宿区白銀町２番１－１０６号,2025-01-09,株式会社
株式会社ＰＲＯＳＯＮＥ,愛知県名古屋市中川区下之一色町字古川１５１番地,2025-01-09,株式会社
株式会社Ｐｅｎｇｕｉｎ　Ｇｒｏｕｐ,東京都新宿区箪笥町３９番地ルネ神楽坂１６０４号室,2025-01-09,株式会社
株式会社Ｐｈｉｌｏｓｏｍｎｉａ,長野県北佐久郡軽井沢町大字長倉２１４７番地７６９,2025-01-09,株式会社
株式会社Ｐｌｕｓ　ｔａｔｅ　Ｇｒｏｕｐ,大阪府大阪市北区堂山町１０番７号ステージジュエルビル１０２号,2025-01-09,株式会社
株式会社Ｒ‐Ｅラボ,大阪府大阪市中央区森ノ宮中央２丁目４－７永田ビル本館１０２号,2025-01-09,株式会社
株式会社ＲＡＫＵＡＮ,神奈川県鎌倉市坂ノ下１６－１１,2025-01-09,株式会社
株式会社ＲＡＶ　ＲＥＳＯＲＴ,東京都港区六本木３丁目１番３０号,2025-01-09,株式会社
株式会社ＲＥ３環境,福島県双葉郡楢葉町大字山田岡字カチグリ１７番地,2025-01-09,株式会社
株式会社ＲＥＩＫＩ,群馬県みどり市大間々町桐原５１１番地１,2025-01-09,株式会社
株式会社ＲＥＬＩＦＥ,福岡県福岡市東区香椎照葉５丁目１－１１－９０８,2025-01-09,株式会社
株式会社ＲＥＸコーポレーション,東京都中央区八丁堀４丁目１０番１号甲東ビル６０２,2025-01-09,株式会社
株式会社ＲＭＹ,山梨県北杜市明野町上手７５５７番地２,2025-01-09,株式会社
株式会社ＲＭｒｍ,千葉県千葉市中央区川崎町１－３４,2025-01-09,株式会社
株式会社ＲａｉｎｙＢｌｕｅＢｅｌｌ,神奈川県横浜市港北区日吉５丁目２５番２２－２０７号,2025-01-09,株式会社
株式会社Ｒａｌｌｙ,東京都港区元赤坂１丁目２－７赤坂Ｋタワー４Ｆ,2025-01-09,株式会社
株式会社ＲｅａＣｈａｒｕ,大阪府大阪市中央区南本町２丁目５番１３－１００５号,2025-01-09,株式会社
株式会社Ｒｅａｌ　Ｒｅａｃｈ,大阪府大阪市北区角田町８番１号大阪梅田ツインタワーズ・ノース１９Ｆ,2025-01-09,株式会社
株式会社Ｒｅｂｏｒｎ　Ａｇｅｎｃｙ,福岡県福岡市東区香椎照葉３丁目４番１０号,2025-01-09,株式会社
株式会社Ｒｏｍａｘ,神奈川県相模原市中央区共和２丁目１番１６号,2025-01-09,株式会社
株式会社Ｒｏｙａｌ　Ｈｏｕｓｉｎｇ,沖縄県中頭郡北谷町字伊平４２１番地７大松ビル３Ｆ,2025-01-09,株式会社
株式会社Ｒｕｄｙ,群馬県高崎市檜物町１１６番地,2025-01-09,株式会社
株式会社Ｓ．ｙｏｓｈｉｄａ,愛知県長久手市塚田１００１番地,2025-01-09,株式会社
株式会社ＳＡＲＵＴＡ９,東京都渋谷区神泉町２２番９号２Ｆ,2025-01-09,株式会社
株式会社ＳＣ　Ｃａｐｉｔａｌ　Ｐａｒｔｎｅｒｓ,東京都千代田区麹町４丁目４番地４ＡＣＮ麹町ビル１２階,2025-01-09,株式会社
株式会社ＳＤ,福岡県宮若市長井鶴４６８番地３,2025-01-09,株式会社
株式会社ＳＤＳ,神奈川県藤沢市辻堂新町１丁目１－２クロスポイント湘南５Ｆ,2025-01-09,株式会社
株式会社ＳＨＩＢＡＩＮＵ,埼玉県所沢市西新井町２０番１０号,2025-01-09,株式会社
株式会社ＳＨＩＮＯＫＩ,大阪府大阪市西淀川区大和田２丁目３番１７－１００４号,2025-01-09,株式会社
株式会社ＳＨＩＮＳＥＩ,埼玉県草加市瀬崎１丁目４－６,2025-01-09,株式会社
株式会社ＳＫ２４６８,岡山県岡山市中区江崎１４６番地１２,2025-01-09,株式会社
株式会社ＳＯＬＩＺＥ分割準備会社１,東京都千代田区三番町６番３号,2025-01-09,株式会社
株式会社ＳＯＬＩＺＥ分割準備会社２,東京都千代田区三番町６番３号,2025-01-09,株式会社
株式会社ＳＯＬＩＺＥ分割準備会社３,東京都千代田区三番町６番３号,2025-01-09,株式会社
株式会社ＳＯＵＴＨ,東京都八王子市南町３２番１号,2025-01-09,株式会社
株式会社ＳＯＵＴＨ　ＧＡＴＥ　ＨＯＬＤＩＮＧＳ,宮崎県宮崎市南花ケ島町６０番地２,2025-01-09,株式会社
株式会社ＳＰＡＣＥ,京都府亀岡市大井町並河坂井５０番地４,2025-01-09,株式会社
株式会社ＳＴＡＣＫ,大阪府寝屋川市太秦中町１番３号高本マンション,2025-01-09,株式会社
株式会社ＳＴＥＩＧＨＴ,東京都世田谷区三宿１丁目２３－３ピアチェーレ三宿２０２,2025-01-09,株式会社
株式会社ＳＴＵＤＩＯ　ＧＯＳＨＯＷ,香川県高松市田町９番地３,2025-01-09,株式会社
株式会社ＳＴＵＤＹ　ＰＲＯ,東京都青梅市新町１丁目２９番地の７,2025-01-09,株式会社
株式会社ＳＵＲＰＡＳＳ,愛知県名古屋市中区栄１丁目７番１６号,2025-01-09,株式会社
株式会社Ｓａｋｕｔｏｎｅｓ,東京都杉並区天沼３丁目１番５号Ｋビル２階,2025-01-09,株式会社
株式会社Ｓａｌｅｓ　Ｒｅｐ,沖縄県名護市宮里１丁目２８－８南西ビル２階,2025-01-09,株式会社
株式会社Ｓｉｇｎホールディングス,東京都港区南青山６丁目１番２１号ピロティ南青山２０１号室,2025-01-09,株式会社
株式会社Ｓｏｕ１,三重県鈴鹿市西条１丁目１３番３号,2025-01-09,株式会社
株式会社ＳｕｎＬｅａ,福岡県中間市中央５丁目１０番１９号,2025-01-09,株式会社
株式会社Ｓｗａｌｌｏ,東京都中央区銀座１丁目１２番４号Ｎ＆ＥＢＬＤ．６Ｆ,2025-01-09,株式会社
株式会社Ｓｗｅｅｔｓ　Ｌｉｆｅ　Ｄｅｓｉｇｎ,兵庫県西宮市相生町７番１２号,2025-01-09,株式会社
株式会社Ｓｙｎｅｒｇｙ　Ｃｏｎｎｅｃｔ,東京都港区芝浦２丁目６番１号,2025-01-09,株式会社
株式会社Ｔ‐Ｒｅｘ,福岡県北九州市小倉南区中吉田６丁目１８番５号,2025-01-09,株式会社
株式会社Ｔ・Ｈ,沖縄県那覇市首里当蔵町１丁目３４番地,2025-01-09,株式会社
株式会社Ｔ．Ｋ．ｃｏｍｐａｎｙ,埼玉県さいたま市見沼区大和田町１丁目１０００番地１,2025-01-09,株式会社
株式会社ＴＡＭＡＫＩ,千葉県いすみ市大原台３０９番地１,2025-01-09,株式会社
株式会社ＴＨＥ　ＢＡＬＭ　ＴＯＫＹＯ,東京都中央区銀座２丁目１１番１９号足柄ビル２Ｆ,2025-01-09,株式会社
株式会社ＴＫＳ　Ｍａｒｉｔｉｍｅ,東京都目黒区碑文谷２丁目２１番６－９０２号キャッスル共進,2025-01-09,株式会社
株式会社ＴＭＮ,東京都新宿区新宿１丁目３番８号ＹＫＢ新宿御苑２階,2025-01-09,株式会社
株式会社ＴＮＢ,東京都世田谷区野沢１丁目３５番７号,2025-01-09,株式会社
株式会社ＴＯＮＰＯＲＩ,宮城県仙台市太白区八木山香澄町２５－４２,2025-01-09,株式会社
株式会社ＴＲＩＭｅｒ,東京都小金井市本町２丁目６番７号ペガサスマンション第二武蔵小金井７０３,2025-01-09,株式会社
株式会社ＴＲＵＸＩＡ,岐阜県各務原市川島松原町４４０番地１０,2025-01-09,株式会社
株式会社ＴＳ,福岡県福岡市中央区大手門２丁目６番１６－９０１号ＭＪＲ大手門タワーレジデンス,2025-01-09,株式会社
株式会社ＴＴＥＰＵ,東京都大田区池上３丁目３６番１０号２階,2025-01-09,株式会社
株式会社Ｔｈｉｎｋ＆Ｃａｍｐ,神奈川県鎌倉市笛田３丁目４０番２８号,2025-01-09,株式会社
株式会社Ｔｏｐ　Ｅｆｆｉｃｉｅｎｃｙ　Ｔｅａｍ,東京都港区麻布十番１丁目５番１０号,2025-01-09,株式会社
株式会社Ｔｓｕｍｕｇｉ,東京都千代田区東神田３丁目４－１２,2025-01-09,株式会社
株式会社ＵＪＵ　ＪＡＰＡＮ,東京都八王子市明神町３丁目２０番５号エイトビル３階,2025-01-09,株式会社
株式会社ＵＭＥＳＴ　ＢＲＡＮＤＩＮＧ,東京都調布市飛田給１丁目２８番地３ヒトトキアン飛田給１Ｆ,2025-01-09,株式会社
株式会社ＵＮＩＱ,宮城県仙台市泉区市名坂字町３２番地２０１,2025-01-09,株式会社
株式会社ＵＰＬＡＳＴ,神奈川県横浜市南区井土ケ谷下町１６番地５－１０２,2025-01-09,株式会社
株式会社Ｕｎｉｐｌｕｓ,東京都千代田区神田錦町２丁目９番地１５,2025-01-09,株式会社
株式会社Ｖａｉｂｕ,東京都北区田端新町３丁目３４番１１号,2025-01-09,株式会社
株式会社Ｖｉｃｔｏｒｉａ,大阪府大阪市天王寺区南河堀町６番４０号リヴァディチ天王寺４０２号,2025-01-09,株式会社
株式会社ＷＡＫＯホールディングス,神奈川県川崎市麻生区王禅寺西２丁目４番１号,2025-01-09,株式会社
株式会社ＷＡＮＺＵ,神奈川県小田原市浜町３丁目１１番２－１０１号メゾン浜町,2025-01-09,株式会社
株式会社ＷＥＢＬＩＳＴ,東京都杉並区方南１丁目６－１２ＭＡＸＩＶ代田橋４０４,2025-01-09,株式会社
株式会社Ｗｅｅ’ｓ,東京都府中市四谷４丁目１６－９,2025-01-09,株式会社
株式会社ＷｅｌｌＡｇｅｎｔ,東京都千代田区神田須田町１丁目７番８号ＶＯＲＴ秋葉原Ⅳ２Ｆ,2025-01-09,株式会社
株式会社ＷｉＺｅｂｒａ,東京都渋谷区鉢山町７番２２号アトリエール代官山１０２,2025-01-09,株式会社
株式会社Ｗｉｌｌｄｏｍパートナーズ,静岡県静岡市清水区由比北田１４２番地の４,2025-01-09,株式会社
株式会社Ｗｍｂｆ,愛知県名古屋市名東区高針荒田１６０７番地,2025-01-09,株式会社
株式会社ＸｉＮ,神奈川県藤沢市片瀬海岸２丁目２０番１２号オハナテラス２Ｆ,2025-01-09,株式会社
株式会社Ｙ’ｓ,岡山県総社市新本８３４０番地１,2025-01-09,株式会社
株式会社ＹＡＭＡＭＵＲＡ,北海道中川郡池田町字常盤１０７番地,2025-01-09,株式会社
株式会社Ｙｓｔ　Ｎｉｎｅ,愛知県名古屋市中区新栄１丁目１３－１６－２・８０１,2025-01-09,株式会社
株式会社ｃｈａｎｃｈ,東京都渋谷区神宮前６丁目６番地４号山森ビル２Ｆ,2025-01-09,株式会社
株式会社ｃｒｅａｇｉｎａｔｉｏｎ,東京都港区南青山２丁目２番１５号ＷｉｎＡｏｙａｍａビルＵＣＦ６３５,2025-01-09,株式会社
株式会社ｅｎｉｌ,埼玉県春日部市中央１丁目８番２１号ニュー吉田ビル２０２,2025-01-09,株式会社
株式会社ｆａｂｉｎｏ,福岡県宗像市田野１４３０－１４,2025-01-09,株式会社
株式会社ｆｉｘ　ｌａｓｈ,大阪府大阪市福島区海老江８丁目１３番３号エムズコート１０１号室,2025-01-09,株式会社
株式会社ｆｒｅｅｄｏｍ．ｃｏｍ,福岡県宗像市田熊４丁目４番３２号,2025-01-09,株式会社
株式会社ｆｕｓＥ,愛知県名古屋市中村区名駅４丁目２４番５号第２森ビル４０１,2025-01-09,株式会社
株式会社ｈａｋｕｍｅｉ,北海道札幌市北区北四十条西５丁目５－３０,2025-01-09,株式会社
株式会社ｈｏｒｏｓｃｏｐｅｓ,東京都渋谷区宇田川町１４番１３号宇田川町ビルディング３Ｆ,2025-01-09,株式会社
株式会社ｉＣＯＮ,東京都中央区銀座１丁目１２番４号Ｎ＆ＥＢＬＤ．６Ｆ,2025-01-09,株式会社
株式会社ｉＣｌｉｎｏ,東京都大田区西蒲田３丁目２番２号,2025-01-09,株式会社
株式会社ｍａ　ＢＯＮＤ,東京都立川市砂川町７丁目２５番地の３４,2025-01-09,株式会社
株式会社ｏｉｍ,大阪府大阪市中央区安土町２丁目４番１１シティタワー大阪本町２３１２,2025-01-09,株式会社
株式会社ｏｍｏｍｏｍ,愛知県常滑市本町２丁目１番地,2025-01-09,株式会社
株式会社ｐｒｏｇｒｅｓｓ,石川県能美市緑が丘４丁目８３番地,2025-01-09,株式会社
株式会社ｒａｇｔｉｍｅ,東京都中央区日本橋蛎殻町２丁目７－１２,2025-01-09,株式会社
株式会社ｒｅ・Ｍａｇｏ,神奈川県横浜市中区福富町東通３８石井ビル２階,2025-01-09,株式会社
株式会社ｓａｎｆｏｒｔ,埼玉県幸手市大字上高野２１０７番地５,2025-01-09,株式会社
株式会社ｓｉｎｃｅｒｉｔｙ,東京都大田区東馬込１丁目２３－１３－１０１,2025-01-09,株式会社
株式会社ｓｐｏｒｔｓ　ｌａｂ　ａｎｋ,福島県郡山市富田町字上ノ台６１番地の１４,2025-01-09,株式会社
株式会社ｓｔｕｄｉｏ　ｖａｎｄｒｅｒ,東京都渋谷区上原１丁目３３番１６号ラメール代々木上原４０７号室,2025-01-09,株式会社
株式会社ｔａｓ,東京都渋谷区神宮前６丁目１４番６号ＩＮＯ５・３Ｆ,2025-01-09,株式会社
株式会社ｕ‐ｎａｖｉ,福岡県北九州市小倉南区石田町９－３,2025-01-09,株式会社
株式会社ｕｚｕｋｉ,徳島県阿南市中大野町北傍示４５２番地１,2025-01-09,株式会社
株式会社ｗｉｔｈ　ｎｅｘｔ,徳島県小松島市小松島町字外開２３番地６,2025-01-09,株式会社
森トラスト合同会社,群馬県邑楽郡大泉町坂田６丁目１番５号,2025-01-09,合同会社
楽本株式会社,大阪府大阪市北区太融寺町２－２１ニュープラザビル５０１号室,2025-01-09,株式会社
楽栄インターナショナル株式会社,東京都港区芝１丁目２番１号１２１４号室,2025-01-09,株式会社
永泰株式会社,大阪府大阪市天王寺区上汐４丁目５－３－７Ｂ,2025-01-09,株式会社
河原工業株式会社,兵庫県姫路市四郷町山脇４５０番地２０,2025-01-09,株式会社
泰康国際株式会社,東京都板橋区坂下２丁目３３番１９号リヴィエール蓮根３０３号室,2025-01-09,株式会社
浅野工業株式会社,茨城県守谷市みずき野７丁目９番地３,2025-01-09,株式会社
深セン市サ卡塔科技有限公司,,2025-01-09,外国会社等
深セン虎嗅微電子有限公司,,2025-01-09,外国会社等
特定非営利活動法人サードコミュニティ,東京都立川市錦町１丁目４番４号サニービル２ＦＣＳ－１８９,2025-01-09,その他の設立登記法人
特定非営利活動法人シュエット,三重県名張市美旗町中３番２７６番地,2025-01-09,その他の設立登記法人
特定非営利活動法人守身,埼玉県飯能市美杉台３丁目１５番地１２,2025-01-09,その他の設立登記法人
特定非営利活動法人筑豊地区ＰＯＳ連絡協議会,福岡県田川市大字弓削田３４１番地１,2025-01-09,その他の設立登記法人
特定非営利活動法人ＳＥＦＡＬＵＡ・ＶＩＬＬＡＧＥ,大阪府泉大津市昭和町５－４－１,2025-01-09,その他の設立登記法人
猫的企画合同会社,滋賀県甲賀市水口町酒人８４３－３,2025-01-09,合同会社
癒方鍼灸株式会社,兵庫県神戸市灘区王子町１丁目３番６号,2025-01-09,株式会社
盈泰株式会社,東京都文京区千石４丁目２６番２号ＳＡＮＳＡＮ千石ビル４Ｂ０７,2025-01-09,株式会社
福島工業株式会社,東京都羽村市栄町２丁目２０番地２９,2025-01-09,株式会社
秀宝設備株式会社,兵庫県三木市別所町石野５４１番地,2025-01-09,株式会社
税理士法人修成,京都府京都市中京区三条通新町西入釜座町２２番地ストークビル三条烏丸４０１号,2025-01-09,その他の設立登記法人
積水ソーラーフィルム株式会社,大阪府大阪市北区西天満２丁目４番４号,2025-01-09,株式会社
穜禧株式会社,東京都台東区上野６丁目７－１６川久保ビル８０６号室,2025-01-09,株式会社
経緯株式会社,大阪府大阪市住吉区遠里小野６丁目１７－１８プロスピリティー３０３号室,2025-01-09,株式会社
縁パートナー株式会社,愛知県愛西市本部田町本東１４０番地,2025-01-09,株式会社
美の壽國際合同会社,大阪府大阪市阿倍野区相生通２丁目７番４５－２０２号,2025-01-09,合同会社
