法人名,住所,設立日,法人種別
株式会社ＪＡＩ,愛知県名古屋市東区葵３丁目７番１６号千種ウエスト９Ｆ,2016-09-13,株式会社
株式会社Ｋ‐ＡＲＣ,茨城県北相馬郡利根町もえぎ野台４丁目４番地５,2016-09-13,株式会社
株式会社Ｋ’ｓ　ＯＦＦＩＣＥ,東京都東村山市萩山町４丁目５番地７４,2016-09-13,株式会社
株式会社ＫＥＫＭ,東京都三鷹市新川５丁目１３番３号,2016-09-13,株式会社
株式会社ＫＪサポート,京都府京都市山科区椥辻草海道町２３番地４６,2016-09-13,株式会社
株式会社Ｌ－ＢＲＩＤＧＥ,愛知県半田市稲荷町１丁目９４番地,2016-09-13,株式会社
株式会社Ｌａｌｉｎｄａ,東京都中央区新川２丁目１１番地１号八丁堀東豊エステート８０９号,2016-09-13,株式会社
株式会社Ｍ’ｓ　Ｐｌａｎｎｉｎｇ,神奈川県平塚市馬入２０５３番地,2016-09-13,株式会社
株式会社Ｍ－ＮＥＴ　ＴＲＡＶＥＬ,大阪府堺市中区深井東町３７７番地４,2016-09-13,株式会社
株式会社ＭＥＴプランニング,千葉県船橋市楠が山町８０番地２２,2016-09-13,株式会社
株式会社ＭＩＹＡＢＩ,大阪府枚方市長尾元町１丁目２１番８－５０３号,2016-09-13,株式会社
株式会社Ｍａｓｕｄａアセットマネジメント,兵庫県姫路市北条宮の町４１１番地,2016-09-13,株式会社
株式会社ＮＩＮＥ,京都府舞鶴市字下福井８８２－２０,2016-09-13,株式会社
株式会社ＮｅｗＢｒａｎｃｈ,福島県郡山市桑野１丁目１４番１号,2016-09-13,株式会社
株式会社Ｎｏａｌｌ,埼玉県深谷市深谷町１１番３４号,2016-09-13,株式会社
株式会社Ｏ－ＫＩＮＹ,大阪府大阪市西成区萩之茶屋３丁目４番１５号,2016-09-13,株式会社
株式会社ＰＴ,東京都八王子市明神町３丁目２番２号,2016-09-13,株式会社
株式会社Ｐａｓｓ,東京都渋谷区神宮前２丁目１６番９号,2016-09-13,株式会社
株式会社Ｒ・Ｐカンパニー,東京都文京区湯島４丁目６番１２号,2016-09-13,株式会社
株式会社ＲＡＭ,兵庫県三木市大村１１２７番地とんとんどみきＣ０３号室,2016-09-13,株式会社
株式会社ＲＯＮＡ　ＪＡＰＡＮ,埼玉県さいたま市南区松本４丁目７番３号,2016-09-13,株式会社
株式会社ＳＨＩＮ＆ＣＯ．,東京都世田谷区赤堤２丁目１５番６号,2016-09-13,株式会社
株式会社ＳＫＲＥＥ,東京都新宿区下落合２丁目１番８号,2016-09-13,株式会社
株式会社Ｓｈｉｎｅ　ｆａｉｒｙ,山梨県甲斐市中下条１８９番地１,2016-09-13,株式会社
株式会社Ｔ＆Ｔ,千葉県印旛郡酒々井町中川１９９番地３,2016-09-13,株式会社
株式会社ＴＡＫＵＭＩ,千葉県松戸市南花島４丁目６１番地の３,2016-09-13,株式会社
株式会社ＴＡＮＧＥＲＩＮＥ,群馬県高崎市並榎町６３番地３,2016-09-13,株式会社
株式会社ＴＥＲＡＳＵ　Ｃｏｍｐａｓｓ,長崎県長崎市五島町１－１９－１２０３,2016-09-13,株式会社
株式会社ＴＲＵＥ　ＧＲＩＴ,福岡県福岡市南区大橋１丁目１番１３号,2016-09-13,株式会社
株式会社Ｔｅｍａｒｉ,東京都新宿区大久保１丁目１番１０号,2016-09-13,株式会社
株式会社ＵＳＰ,福岡県福岡市博多区榎田２丁目９番３８－４０１号,2016-09-13,株式会社
株式会社ＶＥＲＭＯＲＥ,岡山県岡山市中区平井１丁目３番５号,2016-09-13,株式会社
株式会社Ｗ・Ｋ・Ｓ,青森県五所川原市大字漆川字浅井３番地１２,2016-09-13,株式会社
株式会社Ｙ＆Ａ,千葉県市川市東菅野１丁目１３番７号,2016-09-13,株式会社
株式会社ＹＤＳ,愛知県岩倉市栄町１丁目４６番地,2016-09-13,株式会社
株式会社ｃｏ－ｎ,愛知県名古屋市昭和区萩原町４丁目３３番地,2016-09-13,株式会社
株式会社ｇｏｉｓｅｉ,静岡県駿東郡清水町徳倉２３１５番地の１１,2016-09-13,株式会社
株式会社ｉｋｉｋａｔａ,三重県四日市市大井手１丁目５番３６号マイ・キャッスルＢ－１０１,2016-09-13,株式会社
株式会社ｌｏａｄｏｆｆ,東京都世田谷区祖師谷１丁目１９番３号,2016-09-13,株式会社
桜井市環境事業協同組合,奈良県桜井市大字三輪９９２番地の１５,2016-09-13,その他の設立登記法人
江岡水産株式会社,香川県小豆郡土庄町長浜甲１１５３番地２,2016-09-13,株式会社
泉メディカル合同会社,東京都八王子市中野山王２丁目２９番１６号,2016-09-13,合同会社
濱地通商株式会社,三重県三重郡川越町大字豊田５９０番地,2016-09-13,株式会社
特定非営利活動法人くらしの総合研究所,千葉県浦安市高洲５丁目１番Ｃ－２０７号レジアスフォート新浦安,2016-09-13,その他の設立登記法人
特定非営利活動法人らいふくらうど,岐阜県岐阜市石原１丁目９３番地１,2016-09-13,その他の設立登記法人
特定非営利活動法人グランドグリーン,奈良県宇陀市室生上笠間１０７２番地の１,2016-09-13,その他の設立登記法人
特定非営利活動法人京都日野匠スポーツクラブ,京都府京都市伏見区日野畑出町１４番地４,2016-09-13,その他の設立登記法人
特定非営利活動法人住まいや暮らしの何でも相談センター,東京都港区南麻布１丁目１５番５－３０２号,2016-09-13,その他の設立登記法人
特定非営利活動法人免疫力を改善する友の会,東京都足立区西伊興３丁目１４番３号サニーハイツ２０１,2016-09-13,その他の設立登記法人
特定非営利活動法人全日本福祉理美容協会,広島県広島市佐伯区五日市町大字上河内８０６番地１２,2016-09-13,その他の設立登記法人
特定非営利活動法人岐阜県木育推進協議会,岐阜県加茂郡東白川村越原９７６番地１０,2016-09-13,その他の設立登記法人
特定非営利活動法人関西ジュニアスポーツ協議会,大阪府大阪市福島区玉川４丁目４番１２号,2016-09-13,その他の設立登記法人
特定非営利活動法人飲酒運転根絶推進会,静岡県沼津市西間門４３１番地３階,2016-09-13,その他の設立登記法人
特定非営利活動法人ＦＲＥＣＴｉＶＥ,静岡県浜松市中区助信町１－５メゾンアイサン助信３０２,2016-09-13,その他の設立登記法人
特定非営利活動法人ＵＩプロジェクト,東京都渋谷区道玄坂１丁目１７番５号オリンピック渋谷ビル４階,2016-09-13,その他の設立登記法人
環宇株式会社,東京都新宿区歌舞伎町２丁目２５番８号,2016-09-13,株式会社
社会福祉法人きぼう会,沖縄県国頭郡恩納村字仲泊８５８番４,2016-09-13,その他の設立登記法人
社会福祉法人めぐみの家,千葉県印西市小林１６０８番地３８,2016-09-13,その他の設立登記法人
税理士法人下川＆パートナーズ,大阪府大阪市中央区東高麗橋３番１６号,2016-09-13,その他の設立登記法人
紅栄合同会社,東京都江戸川区西小岩１丁目１２番４号,2016-09-13,合同会社
紫光株式会社,愛知県刈谷市住吉町１丁目２３番地５アヴェン１０１号,2016-09-13,株式会社
経済産業企業年金基金,滋賀県大津市中央３丁目１番８号,2016-09-13,その他
華健合同会社,千葉県船橋市本町１丁目１１－６,2016-09-13,合同会社
農事組合法人上八院下,福岡県三潴郡大木町大字上八院５２５番地２,2016-09-13,その他の設立登記法人
農事組合法人平松ファーム,滋賀県湖南市平松４８６番地,2016-09-13,その他の設立登記法人
道上学区まちづくり推進委員会,広島県福山市神辺町字道上９９４番地５,2016-09-13,その他
道灌企画合同会社,熊本県上益城郡御船町大字高木４６９２,2016-09-13,合同会社
鑫源合同会社,千葉県千葉市美浜区高浜３丁目５－２３,2016-09-13,合同会社
長谷川ホテル＆リゾート株式会社,東京都豊島区東池袋３丁目１番１号サンシャイン６０－５７階,2016-09-13,株式会社
鹿児島県建設業企業年金基金,鹿児島県鹿児島市鴨池新町６番１０号,2016-09-13,その他
Ａ＆Ｈ弁護士法人,東京都港区東麻布３丁目７番３号東麻布久永ビル２階,2016-09-13,その他の設立登記法人
Ａｎｃｈｏｒ株式会社,千葉県八千代市村上南３丁目３番地１,2016-09-13,株式会社
Ｃ．Ｈ．Ｒｏｂｉｎｓｏｎ　Ｗｏｒｌｄｗｉｄｅ　Ｊａｐａｎ株式会社,東京都千代田区霞が関３丁目２番６号東京倶楽部ビルディング１１階,2016-09-13,株式会社
Ｃｏｎｔｉｎｅｎｔａｌ　Ｓａｆｅｒａｙ　Ｇｉｆｕ３合資会社,東京都港区虎ノ門５丁目１番５号,2016-09-13,合資会社
ＤＥＵＸ　ＩＮＴＥＲＮＡＴＩＯＮＡＬ株式会社,滋賀県大津市松原町７番１７号,2016-09-13,株式会社
ＤＩＡＭＯＮＤ　ＨＯＬＤＩＮＧＳ　ＪＡＰＡＮ合同会社,千葉県八街市榎戸４１６番地１－２１Ｌ,2016-09-13,合同会社
Ｆｒｉｅｎｄｌｙ合同会社,東京都豊島区南大塚２丁目１１番１０号,2016-09-13,合同会社
Ｇａｍｅ　Ｓｅｒｖｅｒ　Ｓｅｒｖｉｃｅｓ株式会社,愛知県北名古屋市鹿田院田前１２２番地オレンジビル１Ｆ,2016-09-13,株式会社
ＨＩＭ合同会社,神奈川県川崎市幸区鹿島田１丁目１番５－４３０７号,2016-09-13,合同会社
ＩＷＡＢＵＣＨＩＦＡＲＭ株式会社,千葉県香取郡多古町出沼７９番地１,2016-09-13,株式会社
Ｋａｒｕｉｚａｗａ　Ｋｅｓｐｅｒ　Ｇｒｏｕｐ合同会社,長野県北佐久郡軽井沢町大字長倉１００９番地６,2016-09-13,合同会社
ＮＥＸＴ　ＣＨＡＮＮＥＬ株式会社,大阪府吹田市朝日町１３番１－３０１号,2016-09-13,株式会社
ＮＰＯ法人竹田キリシタン未来計画,大分県竹田市大字会々２２５０番地１,2016-09-13,その他の設立登記法人
ＯＡＴアグリフロンティア株式会社,東京都千代田区神田小川町１丁目３番１号,2016-09-13,株式会社
Ｏｒｅｎｏ合同会社,長崎県長崎市昭和２丁目１５番１－９０１号,2016-09-13,合同会社
Ｐ．Ｂ．Ｆ株式会社,石川県金沢市里見町１番地,2016-09-13,株式会社
ＰＬＡＹ　ＮＩＳＥＫＯ株式会社,北海道札幌市中央区南十三条西２３丁目４番１号,2016-09-13,株式会社
ＰＬＵＳ－Ｔパートナーズ株式会社,大阪府大阪市中央区島之内１丁目２２番２３号,2016-09-13,株式会社
Ｐａｎｄａ　Ｇｒａｐｈｉｃｓ株式会社,東京都渋谷区本町３丁目１２番１号,2016-09-13,株式会社
ＲＡＺＥＥＮ　ＴＲＡＤＩＮＧ合同会社,千葉県山武市松尾町下野５１８番地２,2016-09-13,合同会社
Ｒｅｃｅｓｉｎ株式会社,静岡県浜松市中区板屋町１１１番地の２,2016-09-13,株式会社
ＳＡＮＩＬ電機　株式会社,東京都港区新橋３丁目３番１４号田村町７階,2016-09-13,外国会社等
ＳＵＮＳＨＩＮＥ　ＴＲＡＤＩＮＧ合同会社,千葉県山武市中津田５８４番地１,2016-09-13,合同会社
Ｓｍｏｏｒｏａｄ株式会社,東京都東久留米市本町１丁目３番２４号プレミール東久留米７０９号,2016-09-13,株式会社
Ｓｐａｃｅ－Ｔｉｍｅ　Ｉｎｓｉｇｈｔ,,2016-09-13,外国会社等
ＴＡＩＹＯＵ　ＴＲＡＤＩＮＧ合同会社,埼玉県春日部市備後東２丁目２番１８号大熊アパートＦ２０１,2016-09-13,合同会社
ＴＢＦ株式会社,神奈川県横浜市中区花咲町１丁目４８番地,2016-09-13,株式会社
ＴＣ３株式会社,東京都豊島区東池袋４丁目５番１号エアライズタワー４００６号,2016-09-13,株式会社
ＴＧＡ　Ｇｉｎｚａ１１５合同会社,東京都港区虎ノ門３丁目２２番１０－２０１号,2016-09-13,合同会社
ＴＫアソシエーツ合同会社,東京都港区麻布台２丁目１番２号,2016-09-13,合同会社
ＵＤＡ企画合同会社,東京都中央区新富１丁目５－５－４０６,2016-09-13,合同会社
ＵＮＯ　Ａｃｔ．Ｌａｂ．合同会社,千葉県千葉市中央区問屋町１３番１号,2016-09-13,合同会社
ＵｎｉｔｅｄＭａｒｔ　Ａｓｉａ合同会社,東京都足立区江北２丁目１８番地１０号,2016-09-13,合同会社
ＹＯＳＨＩ建築工房株式会社,京都府亀岡市篠町馬堀池ノ下２５番地１８,2016-09-13,株式会社
Ｙａｙ．Ｒｅｎｏｖａｔｉｏｎ株式会社,神奈川県藤沢市葛原１０９２番地の１,2016-09-13,株式会社
えりもグリーンエナジー合同会社,北海道幌泉郡えりも町字東洋１５９番地の６,2016-09-14,合同会社
ひかり倉庫株式会社,大阪府羽曳野市郡戸５６番地,2016-09-14,株式会社
まつたけ株式会社,新潟県新潟市北区松浜東町１丁目３番６１号,2016-09-14,株式会社
アスム株式会社,栃木県宇都宮市竹林町１７２番地１０,2016-09-14,株式会社
アズール合同会社,東京都世田谷区池尻２丁目２番１３号１０５,2016-09-14,合同会社
アドブレーン合同会社,東京都新宿区西新宿７丁目４番５号,2016-09-14,合同会社
アニーズ株式会社,大阪府摂津市三島３丁目２番４５号Ｍ－ブランドール３０２号室,2016-09-14,株式会社
インロックハウジング合同会社,長崎県諫早市仲沖町２７番６号,2016-09-14,合同会社
グランテーレ合同会社,宮城県仙台市青葉区五橋１丁目４番２０号１００３号室,2016-09-14,合同会社
シナプテック合同会社,沖縄県浦添市港川２丁目９番８号,2016-09-14,合同会社
ジョナサン国際技能者支援協同組合,新潟県新潟市中央区南笹口１丁目１番３８号,2016-09-14,その他の設立登記法人
スプリングハズカム合同会社,神奈川県横浜市西区北幸１丁目１１番１号水信ビル７階,2016-09-14,合同会社
ソルヤード合名会社,和歌山県和歌山市紀三井寺１番地９４,2016-09-14,合名会社
タシイフ貿易合同会社,東京都足立区梅田７丁目２５番１３号コープ野村８０７,2016-09-14,合同会社
チャイナインポート合同会社,福岡県三潴郡大木町大字八町牟田４７０番地１,2016-09-14,合同会社
テトル株式会社,岡山県岡山市北区内山下１丁目１３番１２号ビ・ウェル内山下４０１号,2016-09-14,株式会社
トーシン株式会社,東京都調布市飛田給３丁目２５番地３３,2016-09-14,株式会社
ネクスト・イノベーション株式会社,東京都千代田区神田練塀町６７番地,2016-09-14,株式会社
ハザマメディカルコンサルティング株式会社,大阪府大阪市北区天神橋１丁目９番５号,2016-09-14,株式会社
ハッピーファミリー株式会社,福島県郡山市安積町荒井字細子２７番地,2016-09-14,株式会社
ハートボンド株式会社,北海道旭川市春光三条８丁目１１番２８号,2016-09-14,株式会社
ビジョンアップ合同会社,千葉県千葉市美浜区高洲２丁目３番７棟３０３号,2016-09-14,合同会社
ピーラック株式会社,東京都足立区宮城２丁目８番１０号,2016-09-14,株式会社
フォーチュンテクノロジー株式会社,東京都港区六本木５丁目１２番１１号,2016-09-14,株式会社
フランセスＭインベストメンツ株式会社,東京都千代田区九段北１丁目１３番９－１９１１号,2016-09-14,株式会社
フリーキーカンパニー合同会社,神奈川県鎌倉市鎌倉山２丁目１８番７２号,2016-09-14,合同会社
ブドウ商事株式会社,大阪府大阪市中央区内淡路町２丁目４番７号ＪＳビル５Ｆ,2016-09-14,株式会社
ボッシュサービスソリューションズ株式会社,東京都渋谷区渋谷３丁目６番７号,2016-09-14,株式会社
マキシマイザー株式会社,東京都豊島区東池袋２丁目６０番２号池袋パークハイツ２階,2016-09-14,株式会社
マツエソフト株式会社,東京都杉並区和泉１丁目４１番１２－３０２号東洋マンション,2016-09-14,株式会社
ロル株式会社,埼玉県さいたま市桜区大字下大久保１２４２番地１,2016-09-14,株式会社
ワンウェイ株式会社,岐阜県中津川市苗木４３９番地,2016-09-14,株式会社
一般社団法人なかの屋,大阪府大阪市城東区成育３丁目１３番２１号,2016-09-14,その他の設立登記法人
一般社団法人ツバサメディカル,静岡県浜松市中区神田町１６６番地の１,2016-09-14,その他の設立登記法人
一般社団法人ナインブリッジズ,新潟県新潟市江南区早通６丁目３番１０号,2016-09-14,その他の設立登記法人
一般社団法人全国ガスエンジン発電機協会,東京都品川区南大井３丁目２６番５号,2016-09-14,その他の設立登記法人
一般社団法人固定資産評価協議会,大阪府大阪市中央区北久宝寺町４丁目４番２号,2016-09-14,その他の設立登記法人
一般社団法人子ども未来がっこう,愛知県岡崎市合歓木町字下郷間３６６番地,2016-09-14,その他の設立登記法人
一般社団法人小平ＦＭネットワーク,東京都小平市鈴木町１丁目１８３番地の１０,2016-09-14,その他の設立登記法人
一般社団法人日本フォニックス・メソッド普及協会,東京都世田谷区玉川３丁目２１番３号,2016-09-14,その他の設立登記法人
一般社団法人日本国際結婚協会,埼玉県北本市深井２丁目１０２番地１,2016-09-14,その他の設立登記法人
一般社団法人日本Ｎｅｗ　Ｃｏｄｅ　ＮＬＰ普及協会,東京都新宿区新宿２丁目１２番１３号新宿アントレサロンビル,2016-09-14,その他の設立登記法人
一般社団法人東京都社会福祉障害者支援協会,東京都渋谷区千駄ヶ谷２丁目９－２－２０３,2016-09-14,その他の設立登記法人
一般社団法人沖縄歌舞劇団美,沖縄県沖縄市上地２丁目１４番１９号－２Ｆ,2016-09-14,その他の設立登記法人
一般社団法人相続支援協会,滋賀県栗東市手原５丁目６番１９号五番街ビル２Ｆ,2016-09-14,その他の設立登記法人
一般社団法人総合プラチナサロンひまわりオレンジ,神奈川県相模原市中央区田名４０６９番地１コスモタウン田名３０３号室,2016-09-14,その他の設立登記法人
一般社団法人若手起業家支援機構,東京都世田谷区三軒茶屋１丁目３３番２２号三茶ブラウン２０２,2016-09-14,その他の設立登記法人
一般社団法人葬祭業社会貢献普及活動協会,東京都大田区下丸子２丁目１６番３号,2016-09-14,その他の設立登記法人
一般社団法人近畿唐揚協会,大阪府大阪市中央区船場中央２丁目１－４－４１１,2016-09-14,その他の設立登記法人
一般社団法人銀座８丁目開発プロジェクト２,東京都新宿区四谷２丁目９番地１５あると綜合事務所内,2016-09-14,その他の設立登記法人
一般社団法人開発１５号,東京都千代田区一番町９番地８ノザワビルディング６階税理士法人シリウス内,2016-09-14,その他の設立登記法人
一般社団法人開発１６号,東京都千代田区一番町９番地８ノザワビルディング６階税理士法人シリウス内,2016-09-14,その他の設立登記法人
一般社団法人開発１７号,東京都千代田区一番町９番地８ノザワビルディング６階税理士法人シリウス内,2016-09-14,その他の設立登記法人
一般社団法人開発１８号,東京都千代田区一番町９番地８ノザワビルディング６階税理士法人シリウス内,2016-09-14,その他の設立登記法人
一般社団法人開発１９号,東京都千代田区一番町９番地８ノザワビルディング６階税理士法人シリウス内,2016-09-14,その他の設立登記法人
一般社団法人開発２０号,東京都千代田区一番町９番地８ノザワビルディング６階税理士法人シリウス内,2016-09-14,その他の設立登記法人
一般社団法人開発２１号,東京都千代田区一番町９番地８ノザワビルディング６階税理士法人シリウス内,2016-09-14,その他の設立登記法人
一般社団法人開発２２号,東京都千代田区一番町９番地８ノザワビルディング６階税理士法人シリウス内,2016-09-14,その他の設立登記法人
一般社団法人開発２３号,東京都千代田区一番町９番地８ノザワビルディング６階税理士法人シリウス内,2016-09-14,その他の設立登記法人
一般社団法人開発２４号,東京都千代田区一番町９番地８ノザワビルディング６階税理士法人シリウス内,2016-09-14,その他の設立登記法人
一般社団法人ＧＬＯＲＩＡ,北海道旭川市大町二条５丁目２１番地の３２０,2016-09-14,その他の設立登記法人
一般財団法人五橋文庫,山口県岩国市横山２丁目４番３２号,2016-09-14,その他の設立登記法人
三和精密機械株式会社,岡山県笠岡市大河４７１番地,2016-09-14,株式会社
三陽グローバル株式会社,茨城県つくば市下広岡７４６番地３,2016-09-14,株式会社
中日優品合同会社,神奈川県横浜市中区長者町１丁目３番９号,2016-09-14,合同会社
佳創株式会社,大阪府大阪市西区南堀江４丁目２２番５号２０１号室,2016-09-14,株式会社
医療法人かんなべモール歯科,広島県福山市神辺町川北１４４２－１,2016-09-14,その他の設立登記法人
医療法人優心会,広島県庄原市川北町１５８番地２,2016-09-14,その他の設立登記法人
医療法人北見北斗病院,北海道北見市北五条西１丁目６番地,2016-09-14,その他の設立登記法人
医療法人社団ティースマイル,広島県広島市中区紙屋町１丁目１番１号,2016-09-14,その他の設立登記法人
医療法人社団トキオ,北海道沙流郡日高町富川北４丁目２番１０号,2016-09-14,その他の設立登記法人
医療法人社団優歯人会,東京都江東区枝川３丁目３番３号ディライトコート１階,2016-09-14,その他の設立登記法人
医療法人社団富田内科クリニック,北海道札幌市中央区北二条西１丁目１番地マルイト札幌ビル２階,2016-09-14,その他の設立登記法人
医療法人社団長谷川歯科医院,東京都武蔵野市緑町１丁目４番５号２階,2016-09-14,その他の設立登記法人
医療法人社団順成会,東京都千代田区神田佐久間町２丁目１８番地５アークビル６階,2016-09-14,その他の設立登記法人
医療法人穂華会,茨城県つくばみらい市紫峰ヶ丘１丁目７番地４,2016-09-14,その他の設立登記法人
医療法人ＴａｋｕＹｕ会,広島県呉市海岸２丁目１６番１２号,2016-09-14,その他の設立登記法人
十八建設株式会社,愛知県名古屋市南区柵下町４丁目３５番地の３（Ｋ．プライムハウスＫ－２号）,2016-09-14,株式会社
合同会社いろは,茨城県つくばみらい市陽光台１丁目１８番地５,2016-09-14,合同会社
合同会社おおした,福井県坂井市三国町山王２丁目１０番２３号,2016-09-14,合同会社
合同会社きぼう,千葉県香取郡多古町北中１１７０番地３（ホワイトハウスⅤ２０１）,2016-09-14,合同会社
合同会社くじら計画団,愛知県津島市江東町３丁目１４６番地,2016-09-14,合同会社
合同会社つむぎ,大阪府大阪市淀川区加島２丁目６－２５,2016-09-14,合同会社
合同会社はなとつき,香川県仲多度郡まんのう町吉野８４１番地６,2016-09-14,合同会社
合同会社やどり木,秋田県能代市向能代字上野２１０番地７号,2016-09-14,合同会社
合同会社よつば,徳島県美馬市脇町字拝原１５８７番地,2016-09-14,合同会社
合同会社アイジーエスクリエーション,北海道札幌市手稲区前田八条１７丁目６番２０号,2016-09-14,合同会社
合同会社アクセルウェイ,神奈川県川崎市高津区末長１丁目４７番１－４１１号梶ヶ谷プラザビル,2016-09-14,合同会社
合同会社アサンテサーナ,東京都八王子市宮下町２５６番地１０３,2016-09-14,合同会社
合同会社アシスト,東京都中央区日本橋２丁目２番３号ＲＩＳＨＥビルＵＣＦ４０２,2016-09-14,合同会社
合同会社エスエイチプラン,沖縄県中頭郡嘉手納町字水釜４１４番地２嘉手納町民住宅４０６号,2016-09-14,合同会社
合同会社エネファーム・エルソル,大分県速見郡日出町大字豊岡５３番地７,2016-09-14,合同会社
