法人名,住所,設立日,法人種別
株式会社エバーリソース,東京都足立区千住１丁目４番１号,2016-09-07,株式会社
株式会社エムツー,岐阜県本巣市仏生寺１０７番地４,2016-09-07,株式会社
株式会社エンターコンパス,北海道旭川市神居九条１丁目１番４６号,2016-09-07,株式会社
株式会社エンテック,東京都千代田区神田神保町２丁目１３番地神保町ＭＦビル７０２,2016-09-07,株式会社
株式会社エースロジ,神奈川県平塚市徳延４４８番地の１０,2016-09-07,株式会社
株式会社エース建装,青森県八戸市城下２丁目１３番８号,2016-09-07,株式会社
株式会社オアシス,静岡県浜松市北区三幸町４６０番地の３,2016-09-07,株式会社
株式会社オアシス,東京都新宿区百人町２丁目２６番６号パールマンションＩ・Ｓ２０５,2016-09-07,株式会社
株式会社オカモト,埼玉県羽生市大字上村君４１９番地,2016-09-07,株式会社
株式会社オビナタ,東京都荒川区西日暮里６丁目４３番２号,2016-09-07,株式会社
株式会社オフィス・プラン,大阪府大阪市西区川口２丁目３番２６－１１０９号,2016-09-07,株式会社
株式会社オフィスＡ２,東京都新宿区若葉１丁目１４番地１号,2016-09-07,株式会社
株式会社カカオティエゴカン,大阪府大阪市中央区高麗橋２丁目６番９号,2016-09-07,株式会社
株式会社カサスブランカス,東京都大田区北馬込１丁目６番１５号,2016-09-07,株式会社
株式会社カシュウ工務店,大阪府大阪市浪速区大国１丁目３番８号,2016-09-07,株式会社
株式会社カーケア・アガタ,大阪府大阪市住之江区西住之江１丁目３番２－１１０８号,2016-09-07,株式会社
株式会社キトラ電気,東京都八王子市北野町５０６番地１９,2016-09-07,株式会社
株式会社キヤマ電気,富山県富山市下大久保２２４２番地１,2016-09-07,株式会社
株式会社キレイニスタ,東京都豊島区南大塚２丁目２５番１５号,2016-09-07,株式会社
株式会社クマショク産業,熊本県熊本市東区小山３丁目２番５０号,2016-09-07,株式会社
株式会社クマヒロファーム,熊本県山鹿市鹿本町中川８５９番地,2016-09-07,株式会社
株式会社クリスパ,長野県上伊那郡南箕輪村３１８番地１,2016-09-07,株式会社
株式会社クロダ,茨城県笠間市福田２５１２番地,2016-09-07,株式会社
株式会社グランドレベル,東京都千代田区神田司町２丁目５番,2016-09-07,株式会社
株式会社グランド・ロック,東京都千代田区麹町１丁目７番地,2016-09-07,株式会社
株式会社グリーンハウスコーヒー,岐阜県下呂市萩原町花池１２３番地,2016-09-07,株式会社
株式会社グロースリング,富山県富山市長附２５２番地１,2016-09-07,株式会社
株式会社グローツ,愛知県名古屋市北区水草町２丁目６０番地の２水草団地２棟５１１,2016-09-07,株式会社
株式会社グローバルビュー沖縄,沖縄県那覇市久米２丁目９番８号,2016-09-07,株式会社
株式会社グローバルライン,福岡県福岡市東区松田３丁目１２番５－１１０６号,2016-09-07,株式会社
株式会社ケイデザイン,兵庫県姫路市飾磨区妻鹿１４２０番地１,2016-09-07,株式会社
株式会社コスモスアグリサポート,高知県高岡郡佐川町甲１７５１番地１,2016-09-07,株式会社
株式会社コニシ,大阪府東大阪市小阪２丁目８番９号,2016-09-07,株式会社
株式会社コロインテリア,広島県福山市引野町１丁目６番９号,2016-09-07,株式会社
株式会社コン・エンタープライズ,三重県松阪市川井町２８０番地９,2016-09-07,株式会社
株式会社コーナン,東京都練馬区桜台２丁目２９番７号,2016-09-07,株式会社
株式会社ゴールドイノベーション,神奈川県横浜市中区若葉町３丁目４３番地１－６１２号室,2016-09-07,株式会社
株式会社サイドチェンジコンサルティング,神奈川県横浜市戸塚区品濃町５４７番地１,2016-09-07,株式会社
株式会社サカジ工務店,神奈川県横浜市緑区長津田６丁目１７番２２－１０５号,2016-09-07,株式会社
株式会社サンプランニング,宮崎県宮崎市和知川原３丁目２１番地セゾン８８－２０５号,2016-09-07,株式会社
株式会社シティ・クリエイト,茨城県ひたちなか市笹野町１丁目９番２５号東和アーバンスポットビル４Ｆ,2016-09-07,株式会社
株式会社シャイファトレーディング,愛知県岡崎市日名南町１４番地６,2016-09-07,株式会社
株式会社シンケン・ホームズ,埼玉県所沢市東所沢和田２丁目１８番地の１２,2016-09-07,株式会社
株式会社シージェイエム,埼玉県川口市大字榛松２２２番地,2016-09-07,株式会社
株式会社シータグ,大阪府大阪市港区八幡屋１丁目１０番７号,2016-09-07,株式会社
株式会社シー・エス,新潟県新潟市中央区西堀前通５番町７６４番地４プロントネットビル４Ｆ,2016-09-07,株式会社
株式会社ジージェイ・インターナショナル・ジャパン,東京都練馬区三原台１丁目１９番７号,2016-09-07,株式会社
株式会社スコップ,神奈川県横浜市都筑区川和町１６４０番地３,2016-09-07,株式会社
株式会社ステージアッププロジェクト,群馬県高崎市貝沢町２１３３番地２,2016-09-07,株式会社
株式会社スペースプランテック,神奈川県横浜市港北区仲手原１丁目２３番５号,2016-09-07,株式会社
株式会社スポーツケア,千葉県千葉市花見川区さつきが丘２丁目１２－６,2016-09-07,株式会社
株式会社セイリョウ,埼玉県吉川市保１丁目１２番地１,2016-09-07,株式会社
株式会社セミナーエリート,東京都港区元麻布３丁目４番２９－３０３号,2016-09-07,株式会社
株式会社センターヴィレッヂ,神奈川県横浜市緑区長津田７丁目１３番２号菊池ビル１０１,2016-09-07,株式会社
株式会社セントラルアセットマネジメント,東京都中央区晴海２丁目５番２４号,2016-09-07,株式会社
株式会社ソアーズ,東京都江東区木場３丁目１２番２号,2016-09-07,株式会社
株式会社ソイル,広島県広島市安佐南区西原９丁目４番２－３号,2016-09-07,株式会社
株式会社ゾーイデザイン,神奈川県横浜市青葉区松風台２９番地１６,2016-09-07,株式会社
株式会社タイヤ館真庭,岡山県真庭市富尾５１番地３,2016-09-07,株式会社
株式会社タトゥーロ,東京都渋谷区恵比寿西２丁目２０番８号パーフェクトルーム５１５号室,2016-09-07,株式会社
株式会社タノデン,宮崎県都城市高崎町大牟田７２９番地４,2016-09-07,株式会社
株式会社タムラ建築設計,埼玉県上尾市愛宕３丁目１５番２号,2016-09-07,株式会社
株式会社ツイビルド,長野県松本市小屋南１丁目１０番２号,2016-09-07,株式会社
株式会社ティーバイティー東北,宮城県仙台市宮城野区扇町３丁目１１番１号,2016-09-07,株式会社
株式会社ティーバイティー関西,大阪府大阪市平野区長吉川辺３丁目８番４７号,2016-09-07,株式会社
株式会社ティーファイブ,東京都豊島区南大塚３丁目５０番１号ウィンド大塚ビル３Ｆ,2016-09-07,株式会社
株式会社テクノ・クマガイ,福島県郡山市富久山町福原字宝田４番地の３,2016-09-07,株式会社
株式会社テクノ・サービス,福島県須賀川市仁井田字舘内１９７番地,2016-09-07,株式会社
株式会社テラスデザイン,北海道札幌市東区北十八条東１６丁目１番３号,2016-09-07,株式会社
株式会社デベロップメント石井,神奈川県横浜市港北区新吉田町４０８１番地,2016-09-07,株式会社
株式会社トミゴン,東京都渋谷区渋谷２丁目２番６号,2016-09-07,株式会社
株式会社トラストレイト,滋賀県草津市野村２丁目１１番１９号,2016-09-07,株式会社
株式会社トータルセブン,埼玉県新座市栗原４丁目１番２号,2016-09-07,株式会社
株式会社トーワアセマネ,岩手県滝沢市野沢６２番地６５３,2016-09-07,株式会社
株式会社ドリームＭＫ,埼玉県上尾市大字瓦葺１７４２番地１１ベルピア東大宮第８－１－１０１,2016-09-07,株式会社
株式会社ナカムラテック,京都府京都市右京区太秦安井辰巳町７番地の２９,2016-09-07,株式会社
株式会社ネクストリテイリング,千葉県船橋市湊町２丁目１２番２４号湊町日本橋ビル６階,2016-09-07,株式会社
株式会社ネクストワン,埼玉県加須市牛重１２３８番地,2016-09-07,株式会社
株式会社ノア,大阪府寝屋川市中神田町１８番２８号,2016-09-07,株式会社
株式会社ノービス・コンサルタント,東京都板橋区清水町２番９号,2016-09-07,株式会社
株式会社ノーブルホールディングス,茨城県水戸市笠原町１１９６番地の１５,2016-09-07,株式会社
株式会社ハウスポーション,東京都調布市西つつじケ丘３丁目３０番地４ＭＫビル１０１,2016-09-07,株式会社
株式会社ハーン,北海道札幌市豊平区美園三条７丁目１番１７－３０２号,2016-09-07,株式会社
株式会社バイオ・ソリューションズ・ゲート,東京都墨田区堤通２丁目１番１号,2016-09-07,株式会社
株式会社バスコ,和歌山県和歌山市有家３７７番地の７,2016-09-07,株式会社
株式会社バンブーアセット,静岡県沼津市岡宮１０１２番地の１,2016-09-07,株式会社
株式会社ヒーリンクスジャパン,東京都港区赤坂２丁目１２番９号,2016-09-07,株式会社
株式会社ビューティアンドビューティ,東京都港区赤坂２丁目１７番６３－５０３号,2016-09-07,株式会社
株式会社ピボットワークス,東京都渋谷区恵比寿２丁目２８番７号,2016-09-07,株式会社
株式会社ピュールズ,富山県滑川市上梅沢３９７番地,2016-09-07,株式会社
株式会社ファーストグラス,東京都文京区水道１丁目５－２４マルアイビル２階,2016-09-07,株式会社
株式会社フェニックスコンサルタント,北海道札幌市西区発寒九条１０丁目６番３号,2016-09-07,株式会社
株式会社フォルダ,静岡県浜松市浜北区中条１８４４番地,2016-09-07,株式会社
株式会社フォーユー,大阪府大阪市福島区福島８丁目８－３ランドマーク福島３０４,2016-09-07,株式会社
株式会社フジモリ,神奈川県相模原市南区旭町２番４号,2016-09-07,株式会社
株式会社フジ三フード,鹿児島県枕崎市恵比須町４５番地,2016-09-07,株式会社
株式会社フリーダム,東京都八王子市大和田町６丁目２４番４号クラリス・Ｙ１０３号,2016-09-07,株式会社
株式会社フリーディア九州,宮崎県串間市大字西方３９３３番地１,2016-09-07,株式会社
株式会社フレスコ,東京都新宿区若葉２丁目９番８号四谷Ｆ＆Ｔビル２０２,2016-09-07,株式会社
株式会社フロウ,神奈川県横浜市港北区大曽根３丁目２１番２１－６号,2016-09-07,株式会社
株式会社フロンティアワン,千葉県船橋市前原東４丁目１番３棟４０７号,2016-09-07,株式会社
株式会社プレジャー,大阪府八尾市春日町１丁目４番４号,2016-09-07,株式会社
株式会社プログレスホーム,香川県高松市一宮町７１０番地１,2016-09-07,株式会社
株式会社ベース,静岡県浜松市中区伝馬町３１２番２１号カメヤビル南館２階,2016-09-07,株式会社
株式会社ボー・ソレイユ,東京都板橋区小茂根１丁目１２番１２号,2016-09-07,株式会社
株式会社ポートナ,東京都渋谷区恵比寿西１丁目３４番４号,2016-09-07,株式会社
株式会社マイクロスカイラボ,東京都葛飾区東金町６丁目６番５号,2016-09-07,株式会社
株式会社マイナット,愛知県春日井市下条町２丁目２番地３,2016-09-07,株式会社
株式会社マルイ紙工,岐阜県安八郡神戸町大字田２４５番地の１,2016-09-07,株式会社
株式会社マルタカ商会,東京都杉並区成田西１丁目２番１２号,2016-09-07,株式会社
株式会社マルハサービス,福岡県福岡市東区八田２丁目１７番１８号,2016-09-07,株式会社
株式会社ミヤオ,神奈川県横浜市瀬谷区橋戸２丁目３０番地４,2016-09-07,株式会社
株式会社ミーティア,愛知県豊橋市有楽町４５番地の５,2016-09-07,株式会社
株式会社ムラマツ,福島県福島市松川町字前原１８番地の９,2016-09-07,株式会社
株式会社メディカルホームズ,福岡県福岡市博多区博多駅東２丁目８番１１号,2016-09-07,株式会社
株式会社メルシ,富山県富山市呉羽町３９１８番地１７１,2016-09-07,株式会社
株式会社モロッカンタイルズ,埼玉県さいたま市緑区大字下山口新田１１２番地,2016-09-07,株式会社
株式会社ユタカホールディングス,京都府京都市右京区西院太田町７２番地,2016-09-07,株式会社
株式会社ヨコジユウ,鳥取県東伯郡湯梨浜町大字久留１５１番地５,2016-09-07,株式会社
株式会社ライトニングスピード,東京都港区赤坂２丁目１７番６３－５０３号,2016-09-07,株式会社
株式会社ライフサポート,長野県松本市大字里山辺１０６８番地８,2016-09-07,株式会社
株式会社ラジカルラボ九州,佐賀県唐津市浜玉町浜崎９４１番地１,2016-09-07,株式会社
株式会社ラミューズコンサルティング,東京都渋谷区恵比寿４丁目２５番９号,2016-09-07,株式会社
株式会社ランディ,愛知県名古屋市東区泉１丁目９番２０号アメニティ泉２Ａ,2016-09-07,株式会社
株式会社リスタイルエイト,静岡県浜松市中区和合北１丁目２番８７号,2016-09-07,株式会社
株式会社リノア・アコーステック,東京都新宿区大久保３丁目８番３号ラ・トゥール新宿ガーデン２９２１号,2016-09-07,株式会社
株式会社リビングワークス,埼玉県飯能市大字上赤工１番地６,2016-09-07,株式会社
株式会社リライフデザインプラス,埼玉県川口市栄町３丁目１番１３号,2016-09-07,株式会社
株式会社リンガムジカ,神奈川県横浜市港北区新横浜２丁目１３番地１２,2016-09-07,株式会社
株式会社ルイーズ沖縄,沖縄県沖縄市高原７丁目３０番９号グリーンハイム１０１,2016-09-07,株式会社
株式会社ルピナ,茨城県かすみがうら市稲吉南１丁目１６番３号,2016-09-07,株式会社
株式会社ロンテックホールディングス,宮城県仙台市青葉区落合３丁目３番１９号,2016-09-07,株式会社
株式会社ワイディーオンライン,東京都渋谷区渋谷３丁目２５番２１号渋谷ＮＴビル３Ｆ,2016-09-07,外国会社等
株式会社ワグオン,東京都渋谷区恵比寿２丁目３６番１３号,2016-09-07,株式会社
株式会社三原農園,香川県善通寺市善通寺町３５９５番地,2016-09-07,株式会社
株式会社三晃電業社,大阪府東大阪市日下町５丁目１２５０－２辰巳モータープール４３,2016-09-07,株式会社
株式会社三本木,福島県いわき市中央台鹿島３丁目１６番地の１１,2016-09-07,株式会社
株式会社三田不動産管理,東京都港区三田４丁目１番３７号,2016-09-07,株式会社
株式会社三留建築,福島県耶麻郡西会津町睦合字縄沢甲２３番地,2016-09-07,株式会社
株式会社上原工業,埼玉県川口市戸塚東３丁目２４番７号メゾンドールＫⅠ１０３号,2016-09-07,株式会社
株式会社丸宮,東京都八王子市下柚木４３３番地７,2016-09-07,株式会社
株式会社久藤デザイン事務所,東京都渋谷区上原３丁目１番５号,2016-09-07,株式会社
株式会社人財育成アカデミー,大阪府大阪市福島区大開３丁目８番３２－６０２号,2016-09-07,株式会社
株式会社伊万里グリーンパワー,佐賀県佐賀市高木瀬町大字長瀬１２２５番地４,2016-09-07,株式会社
株式会社伊藤塗装,新潟県柏崎市西山町坂田４１４２番地６,2016-09-07,株式会社
株式会社信明テクノン,広島県東広島市西条土与丸２丁目６番５９号,2016-09-07,株式会社
株式会社健真,愛知県名古屋市中村区権現通４丁目１７番地の１ＡＲＵ－ＫＡビル３Ｆ,2016-09-07,株式会社
株式会社八王子エフエム,東京都八王子市みなみ野４丁目３３番１号グランビューみなみ野１０８,2016-09-07,株式会社
株式会社加藤,神奈川県愛甲郡愛川町田代１９４８番地,2016-09-07,株式会社
株式会社加藤建築,愛知県瀬戸市川西町２丁目１６６番地,2016-09-07,株式会社
株式会社北創商事,北海道旭川市末広二条４丁目８番１号,2016-09-07,株式会社
株式会社北川商事,福井県福井市上北野２丁目１１番３０号,2016-09-07,株式会社
株式会社北生食品,茨城県筑西市岡芹７９８番地,2016-09-07,株式会社
株式会社匠,東京都三鷹市牟礼７丁目４番５２号,2016-09-07,株式会社
株式会社十兵衛農産,宮崎県えびの市大字向江２１２番地１,2016-09-07,株式会社
株式会社千和,北海道札幌市中央区南八条西１６丁目３番８号１階右,2016-09-07,株式会社
株式会社吉岡青果,埼玉県ふじみ野市中福岡２８番１,2016-09-07,株式会社
株式会社吉川組,三重県津市一志町高野１６０番地６３６,2016-09-07,株式会社
株式会社名南ビジネスマッチング,愛知県名古屋市中村区名駅１丁目１番１号ＪＰタワー名古屋,2016-09-07,株式会社
株式会社名南メディケアコンサルティング,愛知県名古屋市中村区名駅１丁目１番１号ＪＰタワー名古屋,2016-09-07,株式会社
株式会社咲人,東京都調布市入間町３丁目４番地８７,2016-09-07,株式会社
株式会社坪井宏嗣構造設計事務所,東京都渋谷区東１丁目２０番６号,2016-09-07,株式会社
株式会社城戸機械サービス,宮崎県小林市野尻町三ケ野山３２１３番地６９,2016-09-07,株式会社
株式会社報恩感謝,茨城県石岡市府中１丁目３番１９号,2016-09-07,株式会社
株式会社増田農園,神奈川県横浜市戸塚区舞岡町２７４５番地,2016-09-07,株式会社
株式会社壮健,岐阜県本巣郡北方町小柳１丁目８７番地アニバーサリーＫ２、１０６号,2016-09-07,株式会社
株式会社多賀組,大阪府大阪市淀川区西三国２丁目４番９号,2016-09-07,株式会社
株式会社大城,福岡県久留米市北野町金島１８７８番地１,2016-09-07,株式会社
株式会社大山村,東京都目黒区東山２丁目５番１２－２１１号アパートメンツ東山,2016-09-07,株式会社
株式会社大旗,福岡県福岡市西区大字田尻６３６番地,2016-09-07,株式会社
株式会社大須賀電気工事,福島県須賀川市東作４０番地,2016-09-07,株式会社
株式会社奥藤祥弘映像事務所,東京都杉並区和泉２丁目２７番２７号,2016-09-07,株式会社
株式会社嬉野オリーブ園,東京都中野区本町３丁目２３番２２号,2016-09-07,株式会社
株式会社宏栄商事,兵庫県尼崎市塚口本町２丁目２６番２１号,2016-09-07,株式会社
株式会社宮健ライン,愛知県安城市赤松町新屋敷１３４番地２,2016-09-07,株式会社
株式会社小島放電加工研究所,大阪府豊中市原田南１丁目１９番１２号,2016-09-07,株式会社
株式会社小川物産,千葉県匝瑳市野手１７１４６番地６４９,2016-09-07,株式会社
株式会社小泉電気,神奈川県秦野市寺山４３４番地,2016-09-07,株式会社
株式会社尚志乃郷,長崎県壱岐市郷ノ浦町志原西触５５０の１番地,2016-09-07,株式会社
株式会社山建住宅,岩手県宮古市田老４丁目１３番８号,2016-09-07,株式会社
株式会社山村商店,滋賀県長浜市西上坂町１０２番地２,2016-09-07,株式会社
株式会社山樹建装,山口県柳井市柳井１５０７番地７,2016-09-07,株式会社
株式会社山陽地質コンサルタント,広島県福山市大門町１丁目３０番１６号,2016-09-07,株式会社
株式会社岡部建設工業,茨城県日立市砂沢町３９番地の２,2016-09-07,株式会社
株式会社峰孝,埼玉県川口市大字峯１８３番地,2016-09-07,株式会社
株式会社幸建,愛知県知多郡阿久比町大字草木字東郷１７番地,2016-09-07,株式会社
株式会社廣瀬商事,茨城県石岡市若宮１丁目５番３号,2016-09-07,株式会社
株式会社建翔,山形県山形市城西町５丁目２９番３号,2016-09-07,株式会社
株式会社彩煌,神奈川県横浜市港南区日野４丁目５５番８号,2016-09-07,株式会社
株式会社彩真設計,福島県東白川郡棚倉町大字関口字八幡沢１５４番地３７,2016-09-07,株式会社
株式会社愛知共同企画,愛知県名古屋市中川区四女子町１丁目２２番地,2016-09-07,株式会社
株式会社成る口,東京都江東区富岡１丁目６番２号,2016-09-07,株式会社
株式会社我武者羅,東京都渋谷区幡ヶ谷２丁目１番５号,2016-09-07,株式会社
株式会社新宿松本ビル,東京都渋谷区代々木２丁目１４番１号,2016-09-07,株式会社
株式会社昇降設備,愛知県名古屋市中川区新家１丁目１０１４番地,2016-09-07,株式会社
株式会社明商,東京都大田区山王１丁目３１番１５号,2016-09-07,株式会社
株式会社木下管財,広島県広島市中区上幟町５番７号３階,2016-09-07,株式会社
株式会社木心工務店,愛知県稲沢市下津北山１丁目７番８,2016-09-07,株式会社
株式会社未来サービス,山口県下関市田倉御殿町１丁目４番地５,2016-09-07,株式会社
株式会社未来企画,東京都中野区中央３丁目１３番１１号ＭＧビル６０３,2016-09-07,株式会社
株式会社村上電器,熊本県熊本市北区下硯川町６１４番地１,2016-09-07,株式会社
株式会社来電舎,埼玉県川口市本前川１丁目３３番１０号,2016-09-07,株式会社
株式会社東北農機,福島県本宮市仁井田字富士内１番地の１,2016-09-07,株式会社
株式会社東北高速道岩手,岩手県胆沢郡金ケ崎町西根油地２８番地１,2016-09-07,株式会社
株式会社東日本会議室,宮城県仙台市青葉区本町１丁目１２番１２ＧＭビルディング９Ｆ,2016-09-07,株式会社
株式会社東日本地所,埼玉県さいたま市緑区道祖土１丁目２７番１０号,2016-09-07,株式会社
株式会社東豊テクニカ,愛知県西春日井郡豊山町大字豊場字伊勢山２７９番地２,2016-09-07,株式会社
株式会社板城商事,広島県東広島市西条町森近１００４番地５,2016-09-07,株式会社
株式会社柏心会,愛知県知多郡阿久比町大字阿久比字東向山６番地２９,2016-09-07,株式会社
株式会社森新聞店,徳島県吉野川市鴨島町喜来３９９番地１,2016-09-07,株式会社
株式会社森田,大阪府堺市西区太平寺６９３番地１,2016-09-07,株式会社
株式会社樋口電気,岡山県倉敷市福田町浦田２１４９番地２,2016-09-07,株式会社
株式会社樹コーポレーション,群馬県邑楽郡千代田町大字舞木２６０６番地の２,2016-09-07,株式会社
株式会社樹工管,茨城県常陸大宮市野田７５３番地の３,2016-09-07,株式会社
株式会社河田,宮城県仙台市青葉区一番町１丁目１１－１４－２Ｆ,2016-09-07,株式会社
株式会社浩天,埼玉県蕨市塚越３丁目２３番９号,2016-09-07,株式会社
株式会社清水総合保険サービス,広島県山県郡北広島町大元６７番地３,2016-09-07,株式会社
株式会社渡邊屋,山梨県甲府市住吉５丁目２５番１４号ＩＫビル２０５,2016-09-07,株式会社
株式会社潤青果,長崎県雲仙市南串山町丙１９３７番地,2016-09-07,株式会社
株式会社灘ＦＩＶＥ,山口県長門市仙崎１１３５番地２８,2016-09-07,株式会社
株式会社白井設備,長野県松本市大字新村２２９５番地１,2016-09-07,株式会社
株式会社真規,静岡県磐田市池田２０３番地２,2016-09-07,株式会社
株式会社碑文谷レンタル,東京都目黒区碑文谷３丁目５番７号,2016-09-07,株式会社
株式会社神選,東京都大田区本羽田１丁目１１番９号１階,2016-09-07,株式会社
株式会社第六アップキープ,東京都杉並区成田東４丁目３８番１７号,2016-09-07,株式会社
株式会社篠原製菓,東京都足立区関原３丁目１番１２号,2016-09-07,株式会社
