法人名,住所,設立日,法人種別
株式会社ラクロー,東京都渋谷区幡ヶ谷３丁目３９番１２号,2019-07-05,株式会社
株式会社ラポール,三重県鈴鹿市住吉４丁目３番７号,2019-07-05,株式会社
株式会社リップススタイル,東京都渋谷区神宮前５丁目９番２号,2019-07-05,株式会社
株式会社リハビリネクスト,鳥取県米子市両三柳２１３６番地,2019-07-05,株式会社
株式会社リバーフェイス,兵庫県神戸市垂水区舞多聞東２丁目２番１号,2019-07-05,株式会社
株式会社リファイン,大阪府大阪市中央区船越町２丁目２番１３号,2019-07-05,株式会社
株式会社リベルタ,神奈川県川崎市幸区南幸町１丁目２番地,2019-07-05,株式会社
株式会社ロケット商会,宮城県仙台市泉区高森６丁目４２番地の７,2019-07-05,株式会社
株式会社ロンソ,東京都豊島区西池袋３丁目２９番３号,2019-07-05,株式会社
株式会社ワトソン,福岡県福岡市南区大楠２丁目１７番３号,2019-07-05,株式会社
株式会社ヴィクトリー,東京都八王子市南陽台３丁目１３番１９号,2019-07-05,株式会社
株式会社一心ホールディングス,神奈川県横浜市鶴見区上末吉５丁目２９番２９号,2019-07-05,株式会社
株式会社一閃,兵庫県神戸市中央区北長狭通２丁目３１番５６号,2019-07-05,株式会社
株式会社三光ハウス工業,徳島県吉野川市山川町麦原２８７番地,2019-07-05,株式会社
株式会社上田建設,岩手県下閉伊郡岩泉町門字日影名目利７番地２,2019-07-05,株式会社
株式会社中原洋蘭,宮崎県宮崎市阿波岐原町宮神３１３２番地１,2019-07-05,株式会社
株式会社丸建組,三重県度会郡大紀町野原１２１６番地,2019-07-05,株式会社
株式会社令和工産,岐阜県岐阜市高田４丁目９番３号,2019-07-05,株式会社
株式会社伊勢﨑電気設備,熊本県宇城市小川町江頭４６４番地７４,2019-07-05,株式会社
株式会社伸光,秋田県横手市横手町字上真山１８６番,2019-07-05,株式会社
株式会社佐伯電設,茨城県つくばみらい市板橋２８４４番地１９１,2019-07-05,株式会社
株式会社佐金酒店,秋田県北秋田市東横町１２番１号,2019-07-05,株式会社
株式会社健和工業,神奈川県相模原市南区松が枝町２４番１６号岩田ビル３０２,2019-07-05,株式会社
株式会社億山,神奈川県平塚市見附町３２番６号,2019-07-05,株式会社
株式会社共新,埼玉県越谷市中島２丁目３４番地２,2019-07-05,株式会社
株式会社内建,東京都江戸川区大杉３丁目３番８号,2019-07-05,株式会社
株式会社内田商店,鹿児島県鹿児島市西別府町２９４１番地２２,2019-07-05,株式会社
株式会社原プロパティマネジメント,東京都大田区多摩川２丁目３番８号,2019-07-05,株式会社
株式会社双鶴,神奈川県横浜市神奈川区白幡向町３番２１号Ｍステージ横浜１０３号室,2019-07-05,株式会社
株式会社善,宮城県仙台市若林区中倉３丁目９番１５－６０８号,2019-07-05,株式会社
株式会社圭洋企画,長崎県諫早市飯盛町里１８７９番地１,2019-07-05,株式会社
株式会社垣光,奈良県奈良市公納堂町１１番地,2019-07-05,株式会社
株式会社大以希建設,静岡県沼津市大平２８７４番地の４９６,2019-07-05,株式会社
株式会社大沢造園,神奈川県綾瀬市早川８０６番地２３,2019-07-05,株式会社
株式会社大福,東京都東久留米市下里４丁目１番２５－５０９,2019-07-05,株式会社
株式会社大誠,長崎県長崎市平山町１０９１番地１４,2019-07-05,株式会社
株式会社宗生産業,宮城県石巻市渡波字栄田１４６番地１３,2019-07-05,株式会社
株式会社宮本精肉店,徳島県徳島市中昭和町３丁目５７番地,2019-07-05,株式会社
株式会社富士アグリ＆リジェ,大阪府東大阪市布市町１丁目１０番２６号,2019-07-05,株式会社
株式会社寺島工業,北海道苫小牧市新明町４丁目１９番１６号Ⅱ２０１,2019-07-05,株式会社
株式会社山口興業,香川県三豊市豊中町本山甲１１９７番地１,2019-07-05,株式会社
株式会社岡本学デザイン,東京都渋谷区富ヶ谷１丁目９番１８号,2019-07-05,株式会社
株式会社岩本興業,兵庫県美方郡新温泉町二日市３０３番地６,2019-07-05,株式会社
株式会社希工業,埼玉県川口市朝日５丁目８番２号ウェーブ朝日２０３号,2019-07-05,株式会社
株式会社干し芋農園川上,茨城県那珂郡東海村大字豊岡１５８９番地１,2019-07-05,株式会社
株式会社平田配管工業,神奈川県海老名市門沢橋２丁目１０番１９号,2019-07-05,株式会社
株式会社年徳建設,長崎県平戸市田代町４２９番地第２,2019-07-05,株式会社
株式会社広島オートテックサービス,広島県広島市安佐南区八木７丁目２番２２号,2019-07-05,株式会社
株式会社彩心,愛知県名古屋市守山区大字下志段味字穴ケ洞２２７１番地の２６９,2019-07-05,株式会社
株式会社後田建築,長崎県諫早市飯盛町開２６番地２,2019-07-05,株式会社
株式会社成咲工務店,岩手県花巻市石鳥谷町好地第５地割６１番地３,2019-07-05,株式会社
株式会社成旺,広島県広島市佐伯区五日市中央７丁目４番２７号,2019-07-05,株式会社
株式会社成貢,埼玉県さいたま市浦和区前地１丁目３番２３号エリセオ３０９号室,2019-07-05,株式会社
株式会社斎藤松月堂,岩手県一関市上大槻街２番３７号,2019-07-05,株式会社
株式会社新京都保険サービス,京都府京都市南区上鳥羽藁田２０番地３,2019-07-05,株式会社
株式会社新道央バレイ,北海道札幌市南区定山渓温泉西４丁目３５７番地２,2019-07-05,株式会社
株式会社既読,東京都渋谷区渋谷３丁目２６番１６号,2019-07-05,株式会社
株式会社日の出コート,愛知県北名古屋市九之坪鴨田１２５番地,2019-07-05,株式会社
株式会社日創建設,京都府京都市伏見区横大路天王前３９番地アビタシオンアグリア２０３,2019-07-05,株式会社
株式会社日輝交通,大阪府泉佐野市南中安松５８２－１,2019-07-05,株式会社
株式会社早野将志建築設計事務所,岐阜県大垣市今宿６丁目５２番地１６ソフトピアジャパンドリームコア５０８,2019-07-05,株式会社
株式会社昱一,大阪府堺市堺区大浜南町２丁１番２５－２４７号,2019-07-05,株式会社
株式会社時間グループ,静岡県静岡市清水区日立町１１番９－２号,2019-07-05,株式会社
株式会社晴月舎,神奈川県鎌倉市関谷１１２５番地３,2019-07-05,株式会社
株式会社望月ガラス,静岡県藤枝市上当間３５６番地の２,2019-07-05,株式会社
株式会社木山電気,兵庫県神戸市垂水区千鳥が丘３丁目２３番４１号,2019-07-05,株式会社
株式会社木村,愛知県名古屋市港区七番町５丁目３番地の１,2019-07-05,株式会社
株式会社林工業,岐阜県下呂市萩原町大ヶ洞１１１０番地３,2019-07-05,株式会社
株式会社栄光電設,愛知県常滑市大和町１丁目５８番地,2019-07-05,株式会社
株式会社森田工務店,山口県宇部市西宇部北４丁目１５番４１号,2019-07-05,株式会社
株式会社森谷畜産,宮城県角田市岡字小沢田２３番地,2019-07-05,株式会社
株式会社極真,沖縄県宮古島市平良字下里１７４番地３,2019-07-05,株式会社
株式会社機電,秋田県秋田市八橋イサノ１丁目４番１７号,2019-07-05,株式会社
株式会社櫻井,新潟県南魚沼市門前３０６番地,2019-07-05,株式会社
株式会社武蔵商会,北海道江別市美原１４７番地の１０,2019-07-05,株式会社
株式会社歩総建,三重県鈴鹿市国分町１３１５番地の２,2019-07-05,株式会社
株式会社洋幸,愛知県豊橋市西高師町字津森１２番地３,2019-07-05,株式会社
株式会社海のしょうげつ,愛知県知多郡南知多町大字内海字前山８０番地,2019-07-05,株式会社
株式会社海苔辰,愛知県名古屋市昭和区長戸町６丁目２３番地の５,2019-07-05,株式会社
株式会社渡辺設備,静岡県富士市大淵３０９７番地の１５,2019-07-05,株式会社
株式会社温水建装,熊本県菊池市泗水町永８３７番地６,2019-07-05,株式会社
株式会社湘南アクアタイムズ,神奈川県藤沢市藤沢１０１５番地１７藤沢Ｆビル３階,2019-07-05,株式会社
株式会社源,愛知県岡崎市中伊西町字中井田８番地,2019-07-05,株式会社
株式会社白井建築,静岡県静岡市清水区堂林２丁目８番５号,2019-07-05,株式会社
株式会社盛岡工務店,東京都足立区竹の塚２丁目２番５号ロッソ竹ノ塚１０２,2019-07-05,株式会社
株式会社石井商店,愛知県名古屋市中区大須３丁目４０番３８号,2019-07-05,株式会社
株式会社石川創建,静岡県富士宮市北山５１１０番地の２,2019-07-05,株式会社
株式会社石田建設,兵庫県三木市吉川町渡瀬４１７番地,2019-07-05,株式会社
株式会社砂場,神奈川県藤沢市長後７８９番地,2019-07-05,株式会社
株式会社神戸福祉サービスセンター,兵庫県宝塚市寿楽荘１番３８－１０１号,2019-07-05,株式会社
株式会社神田久米会計,東京都千代田区内神田３丁目２１番６号,2019-07-05,株式会社
株式会社福一,大阪府大阪市東淀川区菅原３丁目１１番２２－１０６号,2019-07-05,株式会社
株式会社秀栄社,長崎県佐世保市天神２丁目２６６１番地３,2019-07-05,株式会社
株式会社種清ホールディングス,愛知県名古屋市西区新道１丁目１２番７号,2019-07-05,株式会社
株式会社竜栄,東京都福生市大字福生９４７番地８,2019-07-05,株式会社
株式会社笑顔創造研究所,愛知県一宮市大和町苅安賀字杉山１０番地１,2019-07-05,株式会社
株式会社紫蘭,愛媛県松山市桑原２丁目２番２９号,2019-07-05,株式会社
株式会社絆,大阪府東大阪市西鴻池町３丁目２番４号,2019-07-05,株式会社
株式会社総合ロードメンテナンス,東京都府中市是政２丁目３０番地の５４,2019-07-05,株式会社
株式会社能ｏｓｅ,千葉県市原市五井５３３４番地３,2019-07-05,株式会社
株式会社船﨑新聞店,徳島県三好郡東みよし町昼間９８８番地１,2019-07-05,株式会社
株式会社若松社寺,三重県桑名市大字桑名６２５番地８,2019-07-05,株式会社
株式会社荒屋商店,青森県上北郡七戸町字舘野１７番地９,2019-07-05,株式会社
株式会社菜のはな,宮崎県延岡市土々呂町１丁目２番地１１,2019-07-05,株式会社
株式会社華八,神奈川県横浜市西区みなとみらい２丁目２番１号ランドマークタワー１２階,2019-07-05,株式会社
株式会社藤原産業医事務所,京都府京都市下京区四条烏丸下ル水銀屋町６３５－２梓ビル７Ｆ,2019-07-05,株式会社
株式会社蟻川建築設計事務所,東京都台東区東上野１丁目２０番２号,2019-07-05,株式会社
株式会社裕防水工業,神奈川県小田原市板橋２８４番地５,2019-07-05,株式会社
株式会社誠和,新潟県長岡市北山３丁目１７番地２,2019-07-05,株式会社
株式会社谷上瓦商店,大阪府貝塚市木積１２２９番地,2019-07-05,株式会社
株式会社豊龍丸,兵庫県豊岡市津居山３５５番地,2019-07-05,株式会社
株式会社遠山設備,埼玉県さいたま市緑区東浦和３丁目３番地１０,2019-07-05,株式会社
株式会社都倉商会,兵庫県神戸市須磨区戎町４丁目１番１２号,2019-07-05,株式会社
株式会社野坂建設,福岡県春日市桜ヶ丘３丁目１６番地,2019-07-05,株式会社
株式会社野村,神奈川県横浜市青葉区新石川３丁目１８番地２８,2019-07-05,株式会社
株式会社鈴健設備,岐阜県各務原市蘇原申子町２丁目５７番地１,2019-07-05,株式会社
株式会社鈴壱,神奈川県横浜市南区永田南２丁目２番１号ヴィラヤマナカⅡ－１０５号室,2019-07-05,株式会社
株式会社鈴木工業,静岡県沼津市大岡３０２１番地,2019-07-05,株式会社
株式会社鈴木板金,愛知県名古屋市西区城西５丁目１８番１６号,2019-07-05,株式会社
株式会社長谷川ダクト,埼玉県川越市大字笠幡８５番地２４,2019-07-05,株式会社
株式会社阪林,京都府城陽市寺田宮ノ谷１１番地の３３,2019-07-05,株式会社
株式会社隆建,石川県金沢市泉野町２丁目１１番１４号,2019-07-05,株式会社
株式会社青栄技建,大阪府大阪市平野区長吉長原３丁目１０番２１号,2019-07-05,株式会社
株式会社高千穂ハーブス,宮崎県西臼杵郡高千穂町大字三田井５９０番地１,2019-07-05,株式会社
株式会社高宮,大阪府寝屋川市高宮あさひ丘３９番３号,2019-07-05,株式会社
株式会社高橋庄作酒造店,福島県会津若松市門田町大字一ノ堰字村東７５５番地,2019-07-05,株式会社
株式会社高橋興業,新潟県魚沼市小平尾１６７２番地８,2019-07-05,株式会社
株式会社高野自動車工業東海,岐阜県岐阜市長良宮路町２丁目１２番地１ＰＯＬＣＡ３０９,2019-07-05,株式会社
株式会社鶏満,長崎県島原市新町１丁目３２３番地,2019-07-05,株式会社
株式会社鶴建,長崎県南島原市南有馬町己８８３番地１,2019-07-05,株式会社
株式会社０３４ｐｒｏｄｕｃｔｉｏｎｓ,東京都目黒区中目黒１丁目１番１７マンション恵比須苑９０６号,2019-07-05,株式会社
株式会社１９８３,大阪府大阪市中央区内本町１丁目１番６号内本町Ｂ＆Ｍビル６階ＢｕｓｉｎｅｓｓＣｅｎｔｅｒ内,2019-07-05,株式会社
株式会社１９９６,福岡県福岡市中央区大名１丁目３番６号,2019-07-05,株式会社
株式会社３Ｄ　ＬＡＢＯ,兵庫県神戸市東灘区本山南町３丁目５番１０－８２０号,2019-07-05,株式会社
株式会社ＡＧＴＫ,東京都目黒区自由が丘１丁目２５番４号アライビル２Ｆ,2019-07-05,株式会社
株式会社ＡＫコクア,大阪府八尾市植松町４丁目５番１８号,2019-07-05,株式会社
株式会社ＡＫトラスト,愛知県春日井市上条町７丁目７２番地１,2019-07-05,株式会社
株式会社ＡＫＭ,愛知県東海市富木島町山中７９番地の１１,2019-07-05,株式会社
株式会社ＡＰＰＬＩＣＡ,東京都中央区銀座６丁目６－１風月堂ビル５Ｆ,2019-07-05,株式会社
株式会社ＡＲエンタープライズ,沖縄県那覇市西３丁目９番５－４０４号県営三重城市街地住宅,2019-07-05,株式会社
株式会社ＡＺＡＩ,兵庫県西宮市甲子園口１丁目１４番２０号,2019-07-05,株式会社
株式会社Ａｄｄ　ｃｏｌｏｒｓ,大阪府大阪市北区西天満４丁目１１番６－１１０１号,2019-07-05,株式会社
株式会社Ａｓｉａｎ　ｗｉｓｄｏｍ,岩手県奥州市水沢姉体町字水ノ口前７９番地,2019-07-05,株式会社
株式会社Ａｕｒｏｒａ,北海道札幌市中央区南五条西５丁目１番２号メイプル通りＢＬＤ７Ｆ,2019-07-05,株式会社
株式会社ＢＤＣ,大阪府和泉市伯太町３丁目１０番１３号,2019-07-05,株式会社
株式会社ＢＥＥＰ,神奈川県鎌倉市坂ノ下２９番１０－３０９号,2019-07-05,株式会社
株式会社ＢＬＩＳＳＥＹ,神奈川県横浜市保土ケ谷区西谷町８９０番地,2019-07-05,株式会社
株式会社ＢＲＡＶＥ,宮城県仙台市泉区南光台５丁目２７番９号,2019-07-05,株式会社
株式会社ＢＵＤＤＩＥＳ,大阪府東大阪市花園東町３丁目２番６号,2019-07-05,株式会社
株式会社ＢＵＬＬ,大阪府大阪市中央区上本町西５丁目１番３５－１６０３号,2019-07-05,株式会社
株式会社Ｂｅ－ｎｏｓ,神奈川県川崎市高津区溝口１丁目１８番１２号アーベイン溝の口ビル４０３号,2019-07-05,株式会社
株式会社Ｂｅｔｔｅｒ　Ｄａｙｓ,三重県津市八町１丁目６番２６号ダイアパレス津新町８０３号,2019-07-05,株式会社
株式会社Ｂｉｏｓｐｅｃｉｍｅｎ　Ｌａｂｏｒａｔｏｒｉｅｓ,東京都大田区中馬込１丁目５番１０－１０５号,2019-07-05,株式会社
株式会社Ｂｏｏｄｌｅ,宮城県仙台市青葉区一番町２丁目２番１１号,2019-07-05,株式会社
株式会社Ｃ＆Ｃコーポレーション,東京都中央区入船１丁目７番６号,2019-07-05,株式会社
株式会社ＣＨＡＩＷＯＲＮ,千葉県茂原市千代田町１丁目１番地１０－２Ｆ,2019-07-05,株式会社
株式会社ＣＮＶ社,東京都中央区日本橋小網町１９番８号,2019-07-05,株式会社
株式会社Ｃｈｉｂａ,北海道登別市幌別町１丁目８番地４,2019-07-05,株式会社
株式会社Ｃｒｅａｔｅ　Ｄｉｎｉｎｇ,広島県三次市畠敷町１５９８番地６,2019-07-05,株式会社
株式会社ＤＫ,宮城県岩沼市たけくま２丁目５番６号,2019-07-05,株式会社
株式会社ＤＮワークス,東京都武蔵野市関前２丁目２８番１０－１０１号,2019-07-05,株式会社
株式会社ＤＲ,東京都東久留米市滝山６丁目２番１０～５１３,2019-07-05,株式会社
株式会社ＤＳ＆Ｉ,東京都文京区湯島４丁目５番１５号,2019-07-05,株式会社
株式会社ＤＵＧ　ｓｔａｎｄａｒｄ,長崎県長崎市横尾５丁目７番３号,2019-07-05,株式会社
株式会社Ｄａｒｗｉｎ,東京都台東区花川戸１丁目７番１１号,2019-07-05,株式会社
株式会社Ｅ３６,東京都文京区弥生２丁目１０番５－１０１号,2019-07-05,株式会社
株式会社ＥＢＵＴ,埼玉県所沢市大字上安松５５７番地の６,2019-07-05,株式会社
株式会社ＥＮＪＩＮ　ｐｌｕｓ,大阪府堺市西区浜寺石津町東４丁４番３－１号,2019-07-05,株式会社
株式会社ＦＥＣ　ａｒｃｈｉｔｅｃｔ,東京都昭島市玉川町２丁目９番７号,2019-07-05,株式会社
株式会社ＦＥＬＩＣＥ,愛知県丹羽郡大口町余野６丁目４６５番地,2019-07-05,株式会社
株式会社ＦＩＯＲＥ,石川県金沢市駅西本町３丁目１６番３３号,2019-07-05,株式会社
株式会社ＦＫＣ,東京都三鷹市中原３丁目１番３９号,2019-07-05,株式会社
株式会社Ｆｉｘ　Ｅｓｔａｔｅ,大阪府大阪市住吉区長居東３丁目１３番３１－２０２号,2019-07-05,株式会社
株式会社Ｆｒｅｙ,徳島県海部郡海陽町鞆浦字北町２９番地２,2019-07-05,株式会社
株式会社Ｇ＆Ｙ,大阪府池田市旭丘２丁目９番２号,2019-07-05,株式会社
株式会社ＧＯ　ＯＮ,福岡県福岡市中央区天神１丁目９番１７号１５階,2019-07-05,株式会社
株式会社ＧＯＤＡ,香川県仲多度郡まんのう町炭所西１２５７番地２,2019-07-05,株式会社
株式会社ＧＯＬＤＦＩＳＨ,大阪府大阪市阿倍野区阿倍野筋１丁目１番４３号あべのハルカス３１階,2019-07-05,株式会社
株式会社ＧＲＯＷ,兵庫県姫路市広畑区西夢前台５丁目２７５番地,2019-07-05,株式会社
株式会社Ｇｂｕｒｇ,大阪府大阪市西区北堀江１丁目２２番１９－７０９号,2019-07-05,株式会社
株式会社ＧｅｅＸＰｌｕｓ,東京都千代田区富士見２丁目１３番３号,2019-07-05,株式会社
株式会社Ｇｏ　Ｐｕｂｌｉｃ,大阪府大阪市北区曾根崎新地１丁目１３番２２号,2019-07-05,株式会社
株式会社Ｇｒｅｖｅ．ｔ,長野県小諸市丙３８８－９－２０２,2019-07-05,株式会社
株式会社Ｇｒｏｗ,静岡県沼津市今沢５０８番地の２,2019-07-05,株式会社
株式会社Ｈ＆Ｍコンサルティング,兵庫県西宮市門戸岡田町７番３４－４０３号,2019-07-05,株式会社
株式会社Ｈ．Ｙ．ファンド,徳島県板野郡北島町中村字樫切２７番地１,2019-07-05,株式会社
株式会社ＨＧＳ総合事務所,東京都調布市小島町１丁目３５番地３レジダンス・オノ８０１,2019-07-05,株式会社
株式会社ＨＫＴ,香川県高松市国分寺町福家甲３１５８番地１３,2019-07-05,株式会社
株式会社ＨＭライフパートナー,北海道札幌市中央区南一条西１８丁目１番地１００３,2019-07-05,株式会社
株式会社ＨＵＭＭ,大阪府大阪市中央区徳井町１丁目２番９号ＺＥＲＯＯＮＥ谷町５０１,2019-07-05,株式会社
株式会社Ｈａｌ,徳島県徳島市川内町北原２０３番地６,2019-07-05,株式会社
株式会社ＩＣＳ,兵庫県芦屋市新浜町２番３－６０３号,2019-07-05,株式会社
株式会社ＩＮＦＩＮＩＴＹ,千葉県千葉市若葉区西都賀２丁目１０番７号,2019-07-05,株式会社
株式会社ＩＴＯコンサルティング,北海道札幌市中央区南四条西６丁目８番地晴ばれビル５Ｆ,2019-07-05,株式会社
株式会社ＩＷＡＳＡ,神奈川県相模原市中央区田名４７６７番地４,2019-07-05,株式会社
株式会社ＪＡＭ　ｃｏｒｐｏｒａｔｉｏｎ,京都府京都市東山区冨永町通縄手東入１３８番ユニバース会館２０８号,2019-07-05,株式会社
株式会社ＪＡＰＡＮ　ＷＯＲＬＤ　ＢＲＩＤＧＥ,東京都中央区日本橋蛎殻町１丁目３４番８－８０３号,2019-07-05,株式会社
株式会社Ｋ,大阪府大阪市西成区山王３丁目３番１９号,2019-07-05,株式会社
株式会社Ｋ＆Ｓ,愛知県名古屋市中村区靖国町１丁目４８番地の１,2019-07-05,株式会社
株式会社ＫＡＺ　ＢＡＮＹＡ,大阪府大阪市中央区瓦町１丁目７番７号,2019-07-05,株式会社
株式会社ＫＴ企画,千葉県船橋市前原西３丁目２３番７号,2019-07-05,株式会社
株式会社ＫＴ建設,宮城県大崎市田尻字北大杉２４番地８,2019-07-05,株式会社
株式会社Ｋａｋｅｌａ　Ｓｔｕｄｉｏｓ,東京都目黒区下目黒６丁目１５番１６号ＫｕｋａｉＴｅｒｒａｃｅ目黒通り４０３,2019-07-05,株式会社
株式会社Ｋｓエンジニアリング,兵庫県姫路市南条３丁目１１８番地５,2019-07-05,株式会社
株式会社ＬＩＧＨＴ　ＷＩＴＨ　ＪＡＰＡＮ,秋田県横手市松原町２番地２６Ｎ棟,2019-07-05,株式会社
株式会社Ｍ‐ＰＲＯＵＤ,埼玉県入間市大字小谷田７８７番地５,2019-07-05,株式会社
株式会社Ｍ‐ｓｔｙｌｅ,福岡県太宰府市大字内山９５６‐２,2019-07-05,株式会社
株式会社Ｍマスト,宮城県仙台市宮城野区榴岡１丁目５番１８号,2019-07-05,株式会社
株式会社Ｍ＆Ａプランニング,神奈川県横須賀市久里浜４丁目１０番１２号ヤマシチビル５階,2019-07-05,株式会社
株式会社Ｍ．Ａ．Ｐ．Ｓ,兵庫県神戸市須磨区寺田町３丁目１番３－２０４号,2019-07-05,株式会社
株式会社Ｍ８,兵庫県神戸市中央区八幡通４丁目１番１４号,2019-07-05,株式会社
株式会社ＭＡＩ,東京都中央区日本橋浜町２丁目５４番５,2019-07-05,株式会社
株式会社ＭＡＲＵＭＩ,千葉県南房総市千倉町白子１３３番地,2019-07-05,株式会社
株式会社ＭＡＴＯＣＡ,福岡県福岡市博多区博多駅前２丁目１９番１７号トーカン博多第５ビル３１２号,2019-07-05,株式会社
株式会社ＭＡｐｐＢａｓｅ,大阪府大阪市淀川区西宮原１丁目８番地６号２０３,2019-07-05,株式会社
株式会社ＭＥＧＯＯＤ,東京都世田谷区赤堤２丁目３２番１３号,2019-07-05,株式会社
株式会社ＭＩＳＡＯ,福岡県福岡市中央区舞鶴１丁目６番２２号,2019-07-05,株式会社
株式会社ＭＫＣ,愛知県名古屋市中川区助光２丁目１８１０番地の２,2019-07-05,株式会社
株式会社ＭＯＮｖａｌｒｙ,福岡県福岡市博多区御供所町１２番２３号,2019-07-05,株式会社
株式会社ＭＯＴＯ,兵庫県尼崎市東難波町３丁目５番１－１０７号,2019-07-05,株式会社
株式会社Ｍｅｄｉｃａｌ　Ｂｒｉｄｇｅ,東京都中央区日本橋浜町３丁目１９番４号,2019-07-05,株式会社
株式会社ＮＲＫ　ＨＯＬＤＩＮＧＳ,栃木県栃木市大平町真弓１５７０番地,2019-07-05,株式会社
株式会社Ｎｅｘｔ　ｉｎｎｏｖａｔｉｏｎ,大阪府大阪市中央区南船場４丁目１０－５,2019-07-05,株式会社
株式会社ＯＮＥ　ＤＥＳＩＧＮＳ,神奈川県相模原市中央区千代田３丁目３番１０号,2019-07-05,株式会社
株式会社ＯＮＥＷＡＹ,神奈川県藤沢市湘南台１丁目３８番地の２２,2019-07-05,株式会社
株式会社Ｏｌｉｋａ,東京都大田区新蒲田２丁目１８番７号,2019-07-05,株式会社
