法人名,住所,設立日,法人種別
株式会社レブラス,東京都千代田区飯田橋４丁目４番８号,2021-03-05,株式会社
株式会社レングセン,大阪府大阪市西区靱本町２丁目５番１４号,2021-03-05,株式会社
株式会社ロコ,福岡県北九州市小倉南区下曽根新町１８番１０号ジュネス壱番館２０２,2021-03-05,株式会社
株式会社ロゼッタＭＴ,東京都千代田区神田神保町３丁目７番１号,2021-03-05,株式会社
株式会社ロードアシストジャパン,千葉県佐倉市坂戸１０７９番地,2021-03-05,株式会社
株式会社ワイズ,東京都墨田区江東橋２丁目６番１３号ダイハビル１階,2021-03-05,株式会社
株式会社ワタル,東京都立川市柴崎町２丁目１７番地７号ヴェルト２１・１０８号室,2021-03-05,株式会社
株式会社ワンオールコーポレーション,愛知県刈谷市一ツ木町清水田１番地２,2021-03-05,株式会社
株式会社ワンストップマネジメント,東京都中央区日本橋１丁目２番１０号,2021-03-05,株式会社
株式会社ヴィアス,東京都港区六本木４丁目５番１１号ＳＩＸ４階,2021-03-05,株式会社
株式会社一八菜,新潟県上越市大学前１３１番地,2021-03-05,株式会社
株式会社一水社,東京都千代田区九段南３丁目７番８号,2021-03-05,株式会社
株式会社一番,埼玉県さいたま市見沼区大和田町１丁目１９２３番地,2021-03-05,株式会社
株式会社一閃,東京都港区芝浦１丁目６番４１号グローバルフロントタワー２６２４号,2021-03-05,株式会社
株式会社下野ファーム,北海道旭川市東鷹栖九線十九号３２８５番地の６２,2021-03-05,株式会社
株式会社世界のホルモン工場,東京都板橋区板橋１丁目２４番１号,2021-03-05,株式会社
株式会社中華・高橋ホールディングス,東京都江東区三好４丁目７番１８号,2021-03-05,株式会社
株式会社九州中央警備保障,福岡県北九州市小倉南区上葛原２丁目２２番２５号,2021-03-05,株式会社
株式会社九州ＦＰ事務所,福岡県福岡市東区箱崎３丁目２５番１６－１１０号サンリヤン箱崎九大前ステーションレジデンス,2021-03-05,株式会社
株式会社九醒,福岡県糸島市前原西４丁目４番２号,2021-03-05,株式会社
株式会社井上板金店,神奈川県横浜市港北区高田東４丁目２４番８号,2021-03-05,株式会社
株式会社京都アート＆クラフト,京都府京都市東山区五条橋東６丁目５４０番地１０,2021-03-05,株式会社
株式会社京都ＡＣＭ電気,京都府京都市右京区嵯峨朝日町３５番地９２,2021-03-05,株式会社
株式会社今工業,青森県青森市小柳１丁目１１番４号,2021-03-05,株式会社
株式会社仙台防災,宮城県仙台市太白区中田２丁目６番７０－２０３号,2021-03-05,株式会社
株式会社伊木工務店,兵庫県川西市緑が丘１丁目２４番１５号,2021-03-05,株式会社
株式会社住建,埼玉県越谷市蒲生西町２丁目８番地２マリーエⅡ１０５,2021-03-05,株式会社
株式会社佐くら,愛知県知多郡南知多町大字豊浜字中町１０番地の６,2021-03-05,株式会社
株式会社作田商事,愛媛県今治市別名３１７番地１５,2021-03-05,株式会社
株式会社保坂アルミ,栃木県真岡市小林６９９番地５,2021-03-05,株式会社
株式会社元気充電,埼玉県さいたま市見沼区東大宮７丁目７０番地３,2021-03-05,株式会社
株式会社冨田植木,愛知県愛西市鵜多須町松塚１１２番地２,2021-03-05,株式会社
株式会社出会いの旅,熊本県熊本市中央区下通１丁目３番８号６Ｆ,2021-03-05,株式会社
株式会社匠和テクノ,大阪府大阪市天王寺区石ケ辻町１９番５号,2021-03-05,株式会社
株式会社嘉華,香川県高松市松島町３丁目１４番７号,2021-03-05,株式会社
株式会社国際医療情報サービス,東京都杉並区高円寺南５丁目１５番１３号,2021-03-05,株式会社
株式会社地域創生ホールディングス,東京都豊島区西池袋１丁目４番１０号,2021-03-05,株式会社
株式会社坂翔,兵庫県宝塚市口谷東２丁目６番３号,2021-03-05,株式会社
株式会社城見商事,鳥取県米子市夜見町３０５７番地,2021-03-05,株式会社
株式会社堀地財団,神奈川県横浜市神奈川区羽沢町９１６番地２３,2021-03-05,株式会社
株式会社大洋,東京都世田谷区船橋１丁目９番２号,2021-03-05,株式会社
株式会社大砲興業,愛媛県大洲市菅田町菅田甲８４８番地８,2021-03-05,株式会社
株式会社太陽総業,宮崎県都城市都島町９３７番地１,2021-03-05,株式会社
株式会社宇宙の学び舎ｓｅｅｄ,東京都千代田区富士見１丁目３－１１,2021-03-05,株式会社
株式会社安達建築興業,宮城県仙台市青葉区芋沢字本郷１１６番地の３,2021-03-05,株式会社
株式会社宮雅,東京都江戸川区東葛西５丁目１３－１３,2021-03-05,株式会社
株式会社就活のお父さん,東京都江東区北砂３丁目６番１１－４０４号,2021-03-05,株式会社
株式会社山与,栃木県宇都宮市北一の沢町２４番５６号,2021-03-05,株式会社
株式会社山武,東京都港区芝２丁目８番１号芝二丁目ハイツ６０１,2021-03-05,株式会社
株式会社岡成商事,神奈川県横浜市都筑区仲町台１丁目２－３２－２０２号,2021-03-05,株式会社
株式会社平明商店,大阪府八尾市東老原１丁目２番地の６１,2021-03-05,株式会社
株式会社平野建設,鳥取県境港市松ケ枝町４５番地,2021-03-05,株式会社
株式会社幸晋重量,大阪府大阪市鶴見区茨田大宮２丁目２番６２号,2021-03-05,株式会社
株式会社心蒼建設,大分県中津市耶馬溪町大字大島１６６４番地１,2021-03-05,株式会社
株式会社悠栄,岡山県岡山市南区妹尾８９７番地５,2021-03-05,株式会社
株式会社悠正,埼玉県戸田市大字新曽１００６番地の２,2021-03-05,株式会社
株式会社成田総研,和歌山県田辺市上屋敷３丁目１２番１８号,2021-03-05,株式会社
株式会社新冠川上牧場,東京都足立区西新井７丁目４番１７号,2021-03-05,株式会社
株式会社新星住宅設備,北海道札幌市東区東苗穂六条２丁目８番７号,2021-03-05,株式会社
株式会社日本技術者団,東京都中央区東日本橋１丁目１－２０三幸日本橋プラザビル５Ｆ－２,2021-03-05,株式会社
株式会社昇栄興業,東京都足立区六町４丁目４番１４号,2021-03-05,株式会社
株式会社暁エクスプレス,東京都中央区銀座４丁目１２番２号クリエイト東銀座２Ｆ,2021-03-05,株式会社
株式会社未來,高知県高知市一宮南町１丁目１２番２号,2021-03-05,株式会社
株式会社本多都市建築設計事務所,石川県小松市長崎町４丁目１２３番地１,2021-03-05,株式会社
株式会社村上工業,栃木県宇都宮市石井町２９６０番地１,2021-03-05,株式会社
株式会社東旭商事,大阪府大阪市中央区島之内２丁目１１番６号島之内中央マンション７０１,2021-03-05,株式会社
株式会社栄登工業,兵庫県姫路市広畑区早瀬町１丁目７５番地３,2021-03-05,株式会社
株式会社桜温泉,青森県弘前市大字賀田２丁目１０番地１,2021-03-05,株式会社
株式会社梓,愛知県名古屋市北区五反田町３４番地,2021-03-05,株式会社
株式会社森井商事,群馬県北群馬郡榛東村大字広馬場１９９４番地１１,2021-03-05,株式会社
株式会社森岡ファーム,岩手県奥州市水沢佐倉河字前田中２７番地,2021-03-05,株式会社
株式会社森田屋,千葉県富津市青木１２２８番地１,2021-03-05,株式会社
株式会社水野不動産,愛知県知立市堀切３丁目２５番地,2021-03-05,株式会社
株式会社永遠,兵庫県尼崎市立花町２丁目２２番１０－１０１号,2021-03-05,株式会社
株式会社河原企画,東京都墨田区緑４丁目６番１－７０３号,2021-03-05,株式会社
株式会社渡辺商店,埼玉県川口市朝日６丁目１１番１６号,2021-03-05,株式会社
株式会社益前商事,東京都荒川区西日暮里２丁目２９番６－６０３号,2021-03-05,株式会社
株式会社益希,東京都荒川区西日暮里２丁目２９番６－６０３号,2021-03-05,株式会社
株式会社眞成工業,千葉県四街道市大日１６６８番地２１,2021-03-05,株式会社
株式会社石田板金屋,新潟県上越市東本町３丁目４番５６号,2021-03-05,株式会社
株式会社米最高－前田,北海道上川郡鷹栖町１５線７号４番地,2021-03-05,株式会社
株式会社緑化建設オーガ,佐賀県三養基郡みやき町大字東尾３２６９番地５,2021-03-05,株式会社
株式会社美令,東京都練馬区大泉町２丁目５６番２号,2021-03-05,株式会社
株式会社美阿丸,高知県室戸市元甲２０７１番地１６,2021-03-05,株式会社
株式会社翔建業,長野県茅野市玉川１０１５６番地１,2021-03-05,株式会社
株式会社萬成建設,大阪府大阪市西区京町堀１丁目６番１２号五月ビル,2021-03-05,株式会社
株式会社誠道,愛知県豊田市大林町１０丁目１番地３０,2021-03-05,株式会社
株式会社谷口工業,長崎県西彼杵郡時津町左底郷４６１番地１,2021-03-05,株式会社
株式会社谷宗,滋賀県栗東市林５７０番地３,2021-03-05,株式会社
株式会社関内不動産Ｌａｂｏ,神奈川県横浜市中区不老町１丁目２－７－７０９,2021-03-05,株式会社
株式会社関東林業,群馬県館林市上赤生田町４０１８番地６,2021-03-05,株式会社
株式会社青柳たまご,福岡県古賀市青柳２１０６番地２,2021-03-05,株式会社
株式会社須藤建材,栃木県小山市大字福良５７３番地１,2021-03-05,株式会社
株式会社高松食肉,長崎県島原市新湊２丁目丁２５７５番地２,2021-03-05,株式会社
株式会社Ａ－ＳＴＹＬＥ,香川県丸亀市飯山町東坂元１２８６番地１１２,2021-03-05,株式会社
株式会社Ａ．Ｅ．,東京都中央区新富１丁目６番５号５０６号室,2021-03-05,株式会社
株式会社ＡＤＥＬＥ　ＰＥＴＳ,埼玉県さいたま市岩槻区本丸３丁目２３番１７号,2021-03-05,株式会社
株式会社ＡＥＧＩＳ,和歌山県和歌山市土入２８４番地１７,2021-03-05,株式会社
株式会社ＡＬＧＸ,愛知県名古屋市昭和区丸屋町４丁目１８番地の１１,2021-03-05,株式会社
株式会社ＡＭＡＮＡＨ,神奈川県横浜市都筑区折本町２７４,2021-03-05,株式会社
株式会社ＡＳＯＢＡＳＥ,東京都品川区西五反田１丁目２番５号,2021-03-05,株式会社
株式会社ＡＴＧカンパニー,東京都練馬区春日町６丁目９番８号,2021-03-05,株式会社
株式会社ＡＷＩＮ,愛知県名古屋市東区泉１丁目２１番２９号,2021-03-05,株式会社
株式会社ＡＺホーム,沖縄県中頭郡北谷町字桑江１２２番地ローズマンション１０２号,2021-03-05,株式会社
株式会社Ａｃｔ　Ｆｒｅｅ,東京都中央区日本橋兜町１７番１号日本橋ロイヤルプラザ７０６,2021-03-05,株式会社
株式会社Ａｌｐｓ　ｃｏｆｆｅｅ　ｌＡｂ．,長野県松本市大手４丁目７番２２号,2021-03-05,株式会社
株式会社ＡｒｅａＥｘｐａｎｓｉｏｎ,北海道札幌市中央区南六条西９丁目１０２３番１８号,2021-03-05,株式会社
株式会社ＡｔｏｍｓＷｏｒｌｄ,兵庫県尼崎市稲葉荘１丁目１３－５,2021-03-05,株式会社
株式会社ＡｕＤａ,神奈川県横浜市瀬谷区南台２丁目１６－１９,2021-03-05,株式会社
株式会社ＢＯＯＲＹ研究所,愛知県豊橋市若松町字若松５７９番地,2021-03-05,株式会社
株式会社ＢＰＭ,大阪府大阪市北区西天満３丁目１０番３号ＡＲＫ西天満ビル４階,2021-03-05,株式会社
株式会社ＢＵＤＤＹ,千葉県千葉市中央区富士見２丁目１５番１号ワラビビル６Ｆ、Ｃ号室,2021-03-05,株式会社
株式会社Ｂａｎｇ,東京都世田谷区三軒茶屋２丁目１１番２２号,2021-03-05,株式会社
株式会社Ｂｅ．ＣＯＮＮＥＣＴ,千葉県千葉市中央区港町１番１０ハピネス本千葉,2021-03-05,株式会社
株式会社Ｂｅａｕｔｙ　Ｔｒａｖｅｌｅｒ,宮崎県宮崎市大字浮田５９５番地１,2021-03-05,株式会社
株式会社Ｂｅｙｏｎｄ　Ｐｒｅｖｅｎｔ,東京都板橋区大山東町６０番４－７０４号,2021-03-05,株式会社
株式会社Ｂｌａｘ　Ｐａｒｔｎｅｒｓ,東京都港区六本木７丁目１４番２３－４０３号,2021-03-05,株式会社
株式会社Ｂｏｔ　Ａｇｅｎｔ,東京都調布市入間町３丁目７番地１２２,2021-03-05,株式会社
株式会社Ｂｒｏｓ,東京都府中市府中町１丁目２４番地の７,2021-03-05,株式会社
株式会社Ｂｓｉｄｅ　Ｅｎｔｅｒｔａｉｎｍｅｎｔ,東京都世田谷区三宿２丁目１６番１０－６２０号,2021-03-05,株式会社
株式会社ＣＯＣＴＡＮ,埼玉県川越市仙波町１丁目１０番地２０,2021-03-05,株式会社
株式会社ＣＯＮＮＥＣＴＩＯＮ,神奈川県横浜市中区桜木町２丁目２番地港陽ビル４Ｆ,2021-03-05,株式会社
株式会社ＣＲＯＳＳＭＩＳＳＩＯＮ,神奈川県愛甲郡愛川町半原５８２０番地の９,2021-03-05,株式会社
株式会社Ｃａｒｅｃｔ,奈良県生駒市小明町４３０番地１,2021-03-05,株式会社
株式会社Ｃｒｅｓｃｅｎｄｏ,大阪府大阪市中央区南船場１丁目１８番１１号ＳＲビル長堀Ｂ１Ｆ,2021-03-05,株式会社
株式会社ＤＯＬＡ,大阪府大阪市北区天神西町３番３－１１０４号,2021-03-05,株式会社
株式会社ＤＯＭ　ＰＲＯＰＥＲＴＹ,東京都千代田区霞が関３丁目２番５号,2021-03-05,株式会社
株式会社Ｅ・ＧＡＬＬＯＰ,東京都品川区南大井４丁目８番１３号,2021-03-05,株式会社
株式会社ＥＶＥＮ,茨城県つくば市若栗９０２番地１,2021-03-05,株式会社
株式会社ＥｄｕＣｒｅｗ,埼玉県上尾市仲町１丁目７番２７号アークエムビル７Ｆ,2021-03-05,株式会社
株式会社Ｅｘｔｒｅｍｅ,群馬県伊勢崎市堀口町１４５番地６,2021-03-05,株式会社
株式会社Ｆ・スタイル工業,山梨県中巨摩郡昭和町清水新居１５０３番地ＮＫビル２０３,2021-03-05,株式会社
株式会社ＦＷ,東京都世田谷区三軒茶屋２丁目１１番２２号,2021-03-05,株式会社
株式会社Ｆａｉｒ　Ｗａｙ,和歌山県和歌山市中之島２２１６番地－８０４号,2021-03-05,株式会社
株式会社Ｆｉｔ,東京都中央区京橋３丁目３－１３平和ビル３号館３Ｆ,2021-03-05,株式会社
株式会社Ｆｏｃｕｓ　Ｍｅｄｉａ,東京都新宿区西新宿１丁目２６－２新宿野村ビル３２階,2021-03-05,株式会社
株式会社Ｇ．Ｇ,石川県金沢市片町２丁目２３番３号,2021-03-05,株式会社
株式会社ＧＬＥＴＨＡＩＵ,福岡県宗像市自由ヶ丘１０丁目６番地１２,2021-03-05,株式会社
株式会社ＧＬＯＢＡＬ　ＰＬＵＳ　６５,群馬県北群馬郡榛東村大字新井２６２０番地２,2021-03-05,株式会社
株式会社ＧＵＲＧＡＯＮ,京都府京都市東山区四条通大和大路東入祇園町南側５７０番地４４,2021-03-05,株式会社
株式会社Ｇａｒｎｅｔ　Ｓｔａｒ,大阪府富田林市喜志町４丁目４９３番地１－２Ｆ,2021-03-05,株式会社
株式会社Ｇｒａｎｔ　Ｓｔａｒｓ,神奈川県横浜市鶴見区朝日町２丁目７４番地６０,2021-03-05,株式会社
株式会社Ｇｒａｓｏｌ,東京都千代田区麹町４丁目５番地２０ＫＳビル８Ｆ,2021-03-05,株式会社
株式会社ＨＡＨ,東京都世田谷区上馬５丁目３６番１号,2021-03-05,株式会社
株式会社ＨＡＬ,埼玉県新座市野火止８丁目２４番８号,2021-03-05,株式会社
株式会社ＨＥＲＯ,東京都品川区東五反田１丁目２３－２五反田ビル３０１－１,2021-03-05,株式会社
株式会社ＨＯＰＥ,埼玉県さいたま市浦和区瀬ヶ崎４丁目１番１２号,2021-03-05,株式会社
株式会社Ｈｏ－ｅｉ,大阪府大阪市城東区東中浜６丁目８番１９号,2021-03-05,株式会社
株式会社ＩＣ,福岡県田川市大字伊田３４１４番地４,2021-03-05,株式会社
株式会社ＩＫＵＳＴＡＭ,神奈川県鎌倉市小町１丁目３番４号,2021-03-05,株式会社
株式会社ＩＮＬＥＴ,神奈川県平塚市片岡４３番地の９,2021-03-05,株式会社
株式会社Ｋ’ａｒｔ,宮崎県児湯郡都農町大字川北１６５０５番地,2021-03-05,株式会社
株式会社Ｋアドバンス,大阪府和泉市一条院町４４番地の１,2021-03-05,株式会社
株式会社Ｋ・Ｒ・Ｅ,北海道札幌市東区北三十四条東２丁目１番２号,2021-03-05,株式会社
株式会社ＫＪ商事,千葉県流山市平和台２丁目１３番地の１３流山パークハイツ３１０,2021-03-05,株式会社
株式会社Ｋｃｏｍｐａｎｙ,神奈川県小田原市小竹７９４番地の１９,2021-03-05,株式会社
株式会社Ｌ．Ｇ　ｃｏｍｐａｎｙ,神奈川県横須賀市小矢部３丁目２７番２号,2021-03-05,株式会社
株式会社ＬＡＰｉＳ　ＬＡｚｕＬｉ．,東京都中央区築地４丁目３番４号リッツ銀座ビル３Ｆ,2021-03-05,株式会社
株式会社ＬＩＢＥＲＯ,大阪府大阪市東淀川区西淡路５丁目１７番６号,2021-03-05,株式会社
株式会社ＬＩＦＥ　ＢＵＩＬＤＩＮＧ,東京都目黒区八雲１丁目７番２１号,2021-03-05,株式会社
株式会社ＬＩＮＫＴＨ,大阪府大阪市淀川区西三国３丁目９番６号,2021-03-05,株式会社
株式会社ＬＩＶＥ,東京都千代田区大手町１丁目６番１号大手町ビル,2021-03-05,株式会社
株式会社Ｌｉｎｋ,東京都板橋区仲宿４３番１号,2021-03-05,株式会社
株式会社Ｌｏｔｕｓ,東京都千代田区一番町９番地,2021-03-05,株式会社
株式会社Ｌｕｃｅ　Ｓａｌｕｔｅ,大阪府大阪市北区東天満２丁目９番４号,2021-03-05,株式会社
株式会社Ｍ’ｓ　Ｎｉｎｅ,北海道札幌市中央区南二十九条西１０丁目２番１０号,2021-03-05,株式会社
株式会社Ｍ＆Ｗ,大阪府大阪市西成区萩之茶屋１丁目９番７号,2021-03-05,株式会社
株式会社Ｍ．Ｉ．Ａ,東京都渋谷区上原２丁目３３番１０号,2021-03-05,株式会社
株式会社ＭＡＳＡＫＩ,大阪府大阪市福島区大開４丁目３番５７号,2021-03-05,株式会社
株式会社ＭＡＳＨＩコンサルティング,東京都中野区中野５丁目１６番２号２Ｆ,2021-03-05,株式会社
株式会社ＭＢｗｏｒｋｓ,京都府京都市伏見区久我森の宮町１５－１０,2021-03-05,株式会社
株式会社ＭＩＴＳＵＭＯＲＩ,神奈川県相模原市中央区田名６３４３番地１４,2021-03-05,株式会社
株式会社ＭＩＹＵＭＯ,兵庫県川西市南花屋敷１丁目５番２７号,2021-03-05,株式会社
株式会社ＭＮＣ,群馬県高崎市東貝沢町３丁目３４番地１深町ビル３Ｆ東,2021-03-05,株式会社
株式会社Ｍａｇａｒｉ,神奈川県横須賀市池田町５丁目８番１号,2021-03-05,株式会社
株式会社Ｍａｒｉａｇｅ,神奈川県相模原市中央区千代田３丁目１５番１０号,2021-03-05,株式会社
株式会社Ｍａｚｕｒｋａ　Ｇｒａｐｈｉｃ,東京都港区南青山２丁目２番１５号ウィン青山９４２,2021-03-05,株式会社
株式会社Ｍｉｄ　Ｂｅｌｌ,佐賀県佐賀市嘉瀬町大字中原２４９９番地２９,2021-03-05,株式会社
株式会社Ｍｏｒｅ　Ｖｉｎｔａｇｅ,東京都渋谷区代官山町１３番８号キャッスルマンション代官山５１３,2021-03-05,株式会社
株式会社Ｎ　ｓｔｏＲｉｅｓ,神奈川県相模原市南区南台５丁目１１番１９号ペアナードオダサガ２０７,2021-03-05,株式会社
株式会社Ｎ．ｗｏｏｄｓ,千葉県千葉市稲毛区作草部町５５９番地４－２２２号,2021-03-05,株式会社
株式会社ＮＡＪＥＹ,沖縄県浦添市仲間１丁目５番７号山内ビル２０３,2021-03-05,株式会社
株式会社ＮＥＥＤＳ,徳島県名西郡石井町浦庄字上浦２３２番地１,2021-03-05,株式会社
株式会社ＮＥＸＴ　ＢＬＵＥ,群馬県前橋市関根町２丁目２１番１５メゾネットネギシＳ（Ｅ）,2021-03-05,株式会社
株式会社ＮＦＴＫ,北海道札幌市中央区北三条西１７丁目２番地３５,2021-03-05,株式会社
株式会社ＮＫ　ＴＲＡＤＩＮＧ,大阪府岸和田市土生町２丁目１番３２号パークハイツ１０２号,2021-03-05,株式会社
株式会社Ｎｅｏ　Ｗｉｎｇ,大阪府大阪市中央区伏見町３丁目１番１－３０３号,2021-03-05,株式会社
株式会社Ｎｅｘｕｓ　Ｐｒｏｄｕｃｅ,東京都中央区銀座１丁目２２番１１号銀座大竹ビジデンス２階,2021-03-05,株式会社
株式会社ＯＫＢ,埼玉県川越市諏訪町１５番地２６,2021-03-05,株式会社
株式会社ＯＮＥＬＩＦＥ,大阪府大阪市東住吉区住道矢田４丁目３番８号,2021-03-05,株式会社
株式会社ＯＲＥＮＣＨＩ,東京都西東京市向台町４丁目１１番３号,2021-03-05,株式会社
株式会社ＯＵＲ　ＦＡＶＯＲＩＴＥ　ＣＡＰＩＴＡＬ,岐阜県各務原市那加栄町１５番地１,2021-03-05,株式会社
株式会社Ｏｈａｎａ,東京都世田谷区祖師谷３丁目６番１０号,2021-03-05,株式会社
株式会社ＯｎｅＴｅｃｈ,神奈川県相模原市南区新磯野４丁目３番３－３０２号,2021-03-05,株式会社
株式会社Ｐ．Ｓホールディングス,北海道札幌市中央区北六条西１９丁目２３番地５,2021-03-05,株式会社
株式会社Ｐｌｕｓ　ＯＮＥ’ｓ,高知県高知市南川添８番１７号,2021-03-05,株式会社
株式会社Ｐｙｘｉｓ　Ｔｅｃｈｎｏｌｏｇｉｅｓ,東京都中央区東日本橋２丁目２８番４号日本橋ＣＥＴビル２階,2021-03-05,株式会社
株式会社Ｒ＆Ｓ,大阪府吹田市上山手町２６番２５号,2021-03-05,株式会社
株式会社ＲＡＩ,神奈川県横浜市中区新山下３丁目１５番８－５１２号,2021-03-05,株式会社
株式会社ＲＥＡＬＬＹ,山形県天童市乱川３丁目１１番１号,2021-03-05,株式会社
株式会社ＲＥＸ,埼玉県さいたま市中央区八王子２丁目１７番２０号,2021-03-05,株式会社
株式会社ＲＩＭＳＥ,東京都千代田区外神田４丁目９－２,2021-03-05,株式会社
株式会社ＲＩＳＥファースト,愛媛県松山市中須賀１丁目１３番地１,2021-03-05,株式会社
株式会社ＲＯＯＴＳ,東京都中央区日本橋中洲３番４－１１０４号,2021-03-05,株式会社
株式会社ＲＲＣ,岐阜県岐阜市石原２丁目１９１番地,2021-03-05,株式会社
株式会社ＲＳＪ　ＧＬＯＢＡＬ　ＨＯＬＤＩＮＧＳ,大阪府大阪市北区中之島３丁目６番３２号ダイビル本館１７階１７０６号室,2021-03-05,株式会社
株式会社ＲＵＮ,福井県鯖江市鳥羽町２８号４６番地,2021-03-05,株式会社
株式会社Ｒｅ‐Ｌｉｇｈｔ,東京都江東区有明３丁目５－７ＴＯＣ有明イーストタワー７階,2021-03-05,株式会社
株式会社Ｒｅｇａｌｉａ,岐阜県大垣市笠木町５８９番地１,2021-03-05,株式会社
株式会社Ｒｅｌａｔｉｏｎ,奈良県香芝市尼寺３丁目９４２番地１,2021-03-05,株式会社
株式会社Ｒｅｎｊｉｓｈｅ,東京都新宿区西新宿１丁目４番６号井田ビル５階,2021-03-05,株式会社
株式会社Ｒｅｔｕｒｎａｂｌｅ,東京都千代田区神田須田町１丁目８番３号メトロフロント神田５０５,2021-03-05,株式会社
株式会社Ｒｅｖａｎｅｓｓ,長野県長野市大字高田４２７番地５ヤナビル２Ｆ,2021-03-05,株式会社
株式会社ＲｉｚｅＷｏｒｋｅｒ’ｓ,愛知県一宮市緑５丁目８番地１コーポレインボー２０６,2021-03-05,株式会社
株式会社Ｒｏｏｔｓどうぶつ病院,奈良県生駒市俵口町１１４２番地３,2021-03-05,株式会社
株式会社Ｓツーリズム,沖縄県宮古島市平良字西里１９４７番地１２,2021-03-05,株式会社
株式会社Ｓ＆Ｈ,愛知県一宮市花池４丁目９番２１号,2021-03-05,株式会社
株式会社ＳＡＨＩＢ　ＩＮＴＥＲＮＡＴＩＯＮＡＬ,東京都墨田区石原１丁目７番１４号（稲垣マンション２０３）,2021-03-05,株式会社
株式会社ＳＦアール,東京都板橋区小茂根３丁目９番８－６１０号,2021-03-05,株式会社
