法人名,住所,設立日,法人種別
ザイク株式会社,東京都墨田区京島１丁目１番２－２０２号,2019-05-24,株式会社
ジョイントサービス株式会社,東京都足立区谷在家１丁目９番１５号,2019-05-24,株式会社
セイコー産業株式会社,岐阜県大垣市外渕２丁目５９番地の２,2019-05-24,株式会社
タケイチトラスト合同会社,福岡県福岡市南区柏原５丁目１６番１１号,2019-05-24,合同会社
トミーラブ合同会社,東京都世田谷区野沢３丁目１１番１８号,2019-05-24,合同会社
ナンバー８株式会社,東京都中央区築地２丁目１５番１５号セントラル東銀座９０５,2019-05-24,株式会社
バリューズ株式会社,東京都世田谷区東玉川２丁目３９番１２号,2019-05-24,株式会社
パークレーンパートナーズ株式会社,東京都港区南青山２丁目２番１５号,2019-05-24,株式会社
ビューティテックラボ合同会社,東京都墨田区本所１丁目６－１１－６０３,2019-05-24,合同会社
ビーンズＤＭＣ合同会社,京都府福知山市土師新町１丁目１５７番地コーポ吉祥３階３０５号室,2019-05-24,合同会社
ピアチェーレ株式会社,東京都大田区大森南１丁目４番９－３０１号,2019-05-24,株式会社
ブエノスアイレス合同会社,東京都新宿区西新宿７丁目１９番２２号,2019-05-24,合同会社
ブロックコネクティッド株式会社,東京都千代田区有楽町１丁目７番１号,2019-05-24,株式会社
プラスＴＯＭＯＲＥ合同会社,茨城県神栖市大野原２丁目１５番６号,2019-05-24,合同会社
ベイトラスト合同会社,千葉県浦安市猫実１丁目４番１４号,2019-05-24,合同会社
ベージュン株式会社,東京都練馬区豊玉北５丁目２９番４号井門練馬ビル６階税理士法人経営サポートプラスアルファ内,2019-05-24,株式会社
マイソールカフェジャパン株式会社,東京都渋谷区渋谷３丁目１番９号,2019-05-24,株式会社
マスターズホールディングス株式会社,三重県四日市市鵜の森１丁目１２番８号,2019-05-24,株式会社
マドラー株式会社,北海道勇払郡厚真町字上厚真１８,2019-05-24,株式会社
ムック合同会社,大阪府大阪市西区靱本町１丁目７番地２２－６０２,2019-05-24,合同会社
ヨシロク株式会社,東京都板橋区中丸町３３－１５,2019-05-24,株式会社
ライフサポート株式会社,福岡県福岡市南区若久６丁目１番２６号,2019-05-24,株式会社
リフレクション株式会社,三重県多気郡明和町大字斎宮３８８３番地２メゾン斎宮Ｂ棟１０１号室,2019-05-24,株式会社
リンク・コネクトコンサルティング合同会社,宮城県仙台市泉区将監殿３丁目１８番地の５,2019-05-24,合同会社
レーニア合同会社,大阪府豊中市永楽荘２丁目１８番１９号,2019-05-24,合同会社
ワイズトラスト株式会社,沖縄県うるま市石川東山本町１丁目１２番１０号,2019-05-24,株式会社
ワイズパートナー株式会社,大阪府東大阪市新町１０番８号,2019-05-24,株式会社
ワールドジムＦＣ事業株式会社,東京都千代田区内幸町１丁目１番１号,2019-05-24,株式会社
一般社団法人つくしんぼ,東京都福生市加美平３丁目２３番地２０,2019-05-24,その他の設立登記法人
一般社団法人つなぐ,東京都板橋区小茂根２丁目９番１３号,2019-05-24,その他の設立登記法人
一般社団法人アジア健康増進協会,山口県山口市朝田２１８４番地１,2019-05-24,その他の設立登記法人
一般社団法人イドビラキ,福岡県福岡市中央区天神５丁目４番１５号,2019-05-24,その他の設立登記法人
一般社団法人名城トラスト,沖縄県浦添市西洲２丁目６番地１,2019-05-24,その他の設立登記法人
一般社団法人和歌山県水泳連盟,和歌山県和歌山市つつじが丘６丁目６番地２号,2019-05-24,その他の設立登記法人
一般社団法人日本ユニファイド通信事業者協会,東京都港区虎ノ門１丁目２１番１９号東急虎ノ門ビル,2019-05-24,その他の設立登記法人
一般社団法人日本再生医療センター,東京都港区北青山３丁目６番７号,2019-05-24,その他の設立登記法人
一般社団法人松阪民主会館,三重県松阪市宮町２８２番地７,2019-05-24,その他の設立登記法人
一般社団法人栃木の食文化を発展させる会,東京都中央区銀座２丁目７番１８号メルサｇｉｎｚａ－２、４Ｆ,2019-05-24,その他の設立登記法人
一般社団法人沖縄ヨガ協会,沖縄県那覇市楚辺２丁目３９－６幸地ビル１階,2019-05-24,その他の設立登記法人
一般社団法人角折神社氏子の会,茨城県水戸市自由が丘３番３３号,2019-05-24,その他の設立登記法人
一般社団法人高齢者ケア推進協会,東京都調布市佐須町３丁目１１番地３,2019-05-24,その他の設立登記法人
一般社団法人鳥取県西部活性化協会,鳥取県米子市米原４丁目５番５３号,2019-05-24,その他の設立登記法人
一般社団法人龍門寺,沖縄県那覇市首里儀保町１丁目３５番地,2019-05-24,その他の設立登記法人
一般社団法人Ａ．Ｐ．８,東京都港区元赤坂１丁目１番８号赤坂コミュニティビル４階,2019-05-24,その他の設立登記法人
一般社団法人ＤＡヘルスケア２,東京都港区虎ノ門４丁目３番１号城山トラストタワー３３階,2019-05-24,その他の設立登記法人
一般社団法人ＦＬａＧ,宮城県仙台市青葉区本町１丁目１３－３２オーロラビル６０６号室,2019-05-24,その他の設立登記法人
一般社団法人ＧＩＲＯ,群馬県前橋市古市町４１９番地５,2019-05-24,その他の設立登記法人
一般社団法人ＭＴＰＳ協会,愛知県一宮市大和町戸塚字連田５８番地２６,2019-05-24,その他の設立登記法人
一般社団法人ＯＮＢＡＪＯＢ,福島県白河市大信町屋字町屋１０１,2019-05-24,その他の設立登記法人
三恵合同会社,千葉県八街市榎戸６７０番地５,2019-05-24,合同会社
三愛ブレイン株式会社,東京都港区西新橋３丁目８番３号,2019-05-24,株式会社
三石通商株式会社,広島県広島市中区袋町２番２６－２Ｆ,2019-05-24,株式会社
上野林業種苗協同組合,三重県伊賀市山出８７０番地,2019-05-24,その他の設立登記法人
中友株式会社,東京都板橋区中丸町３３－１５,2019-05-24,株式会社
中和共創株式会社,東京都荒川区東尾久４丁目３５－３－１０４号室,2019-05-24,株式会社
九州ツネイシエンジニアリング株式会社,長崎県佐世保市原分町１８２５番地１,2019-05-24,株式会社
九華株式会社,東京都北区西ケ原１丁目３７番１３号,2019-05-24,株式会社
令和東株式会社,千葉県千葉市花見川区検見川町２丁目５５５番地,2019-05-24,株式会社
令和種苗株式会社,大阪府東大阪市日下町１丁目１５９７番地１６,2019-05-24,株式会社
保證責任小峰村尾野㞍負債整理組合,熊本県上益城郡山都町,2019-05-24,その他の設立登記法人
信和株式会社,兵庫県伊丹市船原１丁目４－１４エーデルハイム船原３０５,2019-05-24,株式会社
医療法人あおき歯科クリニック,福岡県福岡市東区香椎浜３丁目２番７号,2019-05-24,その他の設立登記法人
医療法人伊藤皮膚科,大分県杵築市大字南杵築３番地１,2019-05-24,その他の設立登記法人
千禾株式会社,東京都渋谷区富ヶ谷１丁目１４番１４号３階,2019-05-24,株式会社
友栄株式会社,愛媛県今治市鐘場町２丁目３番２６号,2019-05-24,株式会社
合同会社おーる,東京都練馬区東大泉１丁目２６番２－４０２号,2019-05-24,合同会社
合同会社なごみ農園,長野県下伊那郡高森町下市田１３０１番地１,2019-05-24,合同会社
合同会社ひかり農場,千葉県白井市大山口２丁目４番８棟３０３号,2019-05-24,合同会社
合同会社みのり,大阪府羽曳野市恵我之荘１丁目１５番２０号,2019-05-24,合同会社
合同会社みらいえ,岡山県倉敷市日吉町４４２番地１－４０２,2019-05-24,合同会社
合同会社アイティス,埼玉県越谷市宮本町１丁目１４８番地１号８０７号室,2019-05-24,合同会社
合同会社アイリス,東京都中央区日本橋１丁目４番１号日本橋一丁目ビルディング,2019-05-24,合同会社
合同会社アクティブインベストメント,東京都練馬区豊玉南３丁目１０番１２－５０３号,2019-05-24,合同会社
合同会社アジア介護福祉協会,兵庫県神戸市中央区下山手通２丁目１３番３号,2019-05-24,合同会社
合同会社ウィンドストリーム,神奈川県横浜市中区尾上町４丁目５７番地横浜尾上町ビルディング８Ｆ,2019-05-24,合同会社
合同会社ウェルフェアサービスたまロッヂ,神奈川県川崎市多摩区中野島４丁目１９番３４－１０１号,2019-05-24,合同会社
合同会社エールワイズ,東京都大田区南蒲田２丁目１５番７－２０３号,2019-05-24,合同会社
合同会社オーケーワークス,北海道帯広市西八条南９丁目１２－５,2019-05-24,合同会社
合同会社カーネーション,茨城県鹿嶋市大字平井８３７番地４,2019-05-24,合同会社
合同会社ハシュアール,兵庫県姫路市砥堀８３４番地,2019-05-24,合同会社
合同会社ファーストサロン,東京都荒川区荒川３丁目２７番３号新和コーポ２０２,2019-05-24,合同会社
合同会社フォークソノミー,埼玉県川越市砂新田２丁目７番地６アムール新河岸１０２号室,2019-05-24,合同会社
合同会社フリーダム,千葉県八千代市大和田５６０番地１,2019-05-24,合同会社
合同会社ヘレン,兵庫県神戸市兵庫区福原町一丁目７番１,2019-05-24,合同会社
合同会社ベネフィットマネジメント,東京都港区赤坂１丁目１２番３２号アーク森ビル２３階,2019-05-24,合同会社
合同会社ユウシン,京都府京都市下京区東洞院通四条下る元悪王子町４２番地サンクタス四条烏丸スティーロレジデンス５１１号,2019-05-24,合同会社
合同会社ユウセイ設備,沖縄県うるま市与那城西原１０３１番地１－１号室,2019-05-24,合同会社
合同会社ライドオン,大阪府大阪市此花区伝法３丁目１３番３号,2019-05-24,合同会社
合同会社ワンステップ,大阪府大阪市福島区海老江３丁目１番６号,2019-05-24,合同会社
合同会社三壹商會,東京都板橋区双葉町１２－１２リバーサイド１２－４Ｆ,2019-05-24,合同会社
合同会社事業人,東京都港区六本木７丁目７－７,2019-05-24,合同会社
合同会社伸和開発,福岡県古賀市小竹９５１番地１,2019-05-24,合同会社
合同会社佐藤建材,三重県四日市市浮橋１丁目２４番地２,2019-05-24,合同会社
合同会社叶興業,千葉県鎌ケ谷市東初富２丁目５番２７号,2019-05-24,合同会社
合同会社大照,千葉県千葉市中央区仁戸名町４８５番地１２,2019-05-24,合同会社
合同会社彦美,大阪府堺市堺区三宝町５丁２９０－６０,2019-05-24,合同会社
合同会社新白河ソーラー２,東京都中央区月島４丁目１２番１２号,2019-05-24,合同会社
合同会社本願寺,東京都中央区日本橋２丁目９番６号,2019-05-24,合同会社
合同会社東京システム設計事務所,東京都中央区日本橋兜町９番５号,2019-05-24,合同会社
合同会社東野商店,京都府宮津市字東野１７２番地,2019-05-24,合同会社
合同会社林陶苑,北海道札幌市中央区南三条東１丁目アルファ創成川公園１００７,2019-05-24,合同会社
合同会社歩,北海道帯広市西一条南３０丁目５番地１,2019-05-24,合同会社
合同会社玄気,北海道小樽市若竹町３４番２号,2019-05-24,合同会社
合同会社翡翠,埼玉県さいたま市大宮区桜木町２丁目３番地大宮マルイ７階,2019-05-24,合同会社
合同会社耀東,千葉県千葉市若葉区小間子町１番地２０,2019-05-24,合同会社
合同会社蓮優工業,大阪府大阪市福島区鷺洲１丁目７番３９－５１０号,2019-05-24,合同会社
合同会社谷津７プロジェクト,東京都中央区日本橋２丁目７番１号,2019-05-24,合同会社
合同会社貴型枠,沖縄県島尻郡南風原町字宮平３４８番地２宮平ハイツ３０２号,2019-05-24,合同会社
合同会社ＡＦＦ　ＯＮＬＩＮＥ,愛知県安城市三河安城本町２丁目２番地２カーサグリージョ８０１,2019-05-24,合同会社
合同会社ＡＭ３ＣＯＭＰＡＮＹ,沖縄県沖縄市中央３丁目１番３号３階,2019-05-24,合同会社
合同会社ＣＯＮＥＣＴ－ｉ,千葉県船橋市習志野台８丁目３０番８号,2019-05-24,合同会社
合同会社ＣＯＮＴＡＣＴ,広島県東広島市豊栄町乃美１０８３番地５,2019-05-24,合同会社
合同会社ＤＡヘルスケア５,東京都港区虎ノ門４丁目３番１号城山トラストタワー３３階,2019-05-24,合同会社
合同会社ＥＮＥＲＧＹ．ｃｏｍ,大阪府守口市金下町２丁目３番７号,2019-05-24,合同会社
合同会社Ｆｌｅｅａｐ,北海道上川郡東神楽町ひじり野南二条４丁目１番１７号,2019-05-24,合同会社
合同会社Ｆｏｒ　Ｓｏｕｔｈ,大阪府大阪市淀川区西中島３丁目１５番１１号,2019-05-24,合同会社
合同会社ＨＩＤＥコーポレーション,東京都品川区旗の台２丁目５番１０号,2019-05-24,合同会社
合同会社ＨＩＴＯ－ＴＯ－ＨＩＴＯ,大阪府柏原市大字高井田１５９１番地の３,2019-05-24,合同会社
合同会社Ｋ＆Ｔ．Ｉ,沖縄県沖縄市与儀１丁目３５番１０号,2019-05-24,合同会社
合同会社ＫＩＳＯ,神奈川県横浜市緑区長津田５丁目６番地３２,2019-05-24,合同会社
合同会社ＫＯＫＯ　ＣＯＬＯＲ,群馬県みどり市大間々町１８５４番地７,2019-05-24,合同会社
合同会社Ｌｅｇｏｌａｓ,静岡県浜松市南区倉松町１９３番地の１,2019-05-24,合同会社
合同会社Ｍ－ＮＥＸＴ,茨城県水戸市中央１丁目３番９号,2019-05-24,合同会社
合同会社Ｎ－ＳＯＬ,宮城県登米市迫町佐沼字天神前７０番地,2019-05-24,合同会社
合同会社ＮＡＴＵＲＡＬ,千葉県千葉市中央区白旗３丁目１１番１９号,2019-05-24,合同会社
合同会社ＮＥＸＵＳ,千葉県成田市玉造７丁目１５番地６５,2019-05-24,合同会社
合同会社ＲＥＩＷＡ,兵庫県三田市川除３５３－１,2019-05-24,合同会社
合同会社ＳＥＣサービス,愛知県知多郡美浜町大字奥田字石亀１８４番地３,2019-05-24,合同会社
合同会社ＳＥＥＤ,大阪府大阪市中央区平野町３丁目１－７－２０５号,2019-05-24,合同会社
合同会社ＳＴＣ,東京都清瀬市野塩１丁目３４９番地１４,2019-05-24,合同会社
合同会社ＴＡＲＩＴＥ,東京都大田区田園調布２丁目２１－１８,2019-05-24,合同会社
合同会社ＴＫＤサポート,沖縄県沖縄市泡瀬５丁目２５番２０号翔アパート２０２,2019-05-24,合同会社
合同会社ＴＫＲ,鹿児島県姶良市松原町２丁目２１番地２,2019-05-24,合同会社
合同会社ＴＳＪ,東京都文京区湯島３丁目３２番１０号,2019-05-24,合同会社
合同会社ＴＹジャパン,福岡県北九州市小倉北区鍛冶町１丁目５番１１号,2019-05-24,合同会社
合同会社ＷＩＳＴＡＲＩＡ　ＦＩＥＬＤ,静岡県磐田市池田４１７番地５,2019-05-24,合同会社
合同会社Ｙ・Ｋ・Ｇ,埼玉県川口市東本郷１丁目８番１７号,2019-05-24,合同会社
合同会社ＺＥＲＯ,長野県松本市深志１丁目４番１０号,2019-05-24,合同会社
合同会社ｂｅｌｉｅｆ,千葉県成田市不動ケ岡１９６１番地１（アバンツァートヒロタ２０４）,2019-05-24,合同会社
合名会社Ａｌｌ　Ｇａｊｕｍａｒｕ,熊本県菊池郡大津町大字新２４０番地,2019-05-24,合名会社
国際・政策銀健康保険組合,東京都千代田区大手町１丁目９番６号,2019-05-24,その他
増増通商株式会社,大阪府大阪市中央区島之内２丁目４番１３－１２１６号,2019-05-24,株式会社
平和リバブル株式会社,佐賀県鳥栖市西新町１４２８番地５１,2019-05-24,株式会社
徳泰株式会社,大阪府大阪市淀川区西中島４丁目４－２５,2019-05-24,株式会社
日全テック株式会社,東京都江東区東陽２丁目２番１４－１２１号,2019-05-24,株式会社
日本河川環境開発株式会社,北海道札幌市手稲区手稲本町六条３丁目１番１０号,2019-05-24,株式会社
未来屋本舗株式会社,大阪府大阪市東住吉区杭全３丁目２－１,2019-05-24,株式会社
松尾織物株式会社,京都府京丹後市網野町掛津４３番地,2019-05-24,株式会社
株式会社あんしん典礼駿河,静岡県沼津市白銀町１６５番地の１,2019-05-24,株式会社
株式会社いち犬猫病院,大阪府大阪市都島区友渕町１丁目７番２－９０６号,2019-05-24,株式会社
株式会社すまいる,大阪府東大阪市高井田西６丁目５番３号,2019-05-24,株式会社
株式会社はしもとや,静岡県沼津市西浦木負２１５番地の１８,2019-05-24,株式会社
株式会社びーびー団,神奈川県伊勢原市伊勢原２丁目５番５号,2019-05-24,株式会社
株式会社まる孫,千葉県松戸市和名ケ谷７３７番地,2019-05-24,株式会社
株式会社ゆとりば,神奈川県川崎市高津区上作延４４１番地１９ベルディールⅡＡ棟,2019-05-24,株式会社
株式会社アイゼンスタジオ,神奈川県高座郡寒川町倉見２２８０番地３,2019-05-24,株式会社
株式会社アップルギフターズ,青森県平川市広船福田２１５番地,2019-05-24,株式会社
株式会社アドバンス,東京都世田谷区中町４丁目２０番８号,2019-05-24,株式会社
株式会社アリー不動産,大阪府堺市堺区三宝町１丁３番地１,2019-05-24,株式会社
株式会社アルファスポーツ,東京都墨田区墨田２丁目１－５,2019-05-24,株式会社
株式会社アルボ,千葉県八千代市萱田町５４２番地９９,2019-05-24,株式会社
株式会社アークス,青森県八戸市大字大久保字下大久保９番地６,2019-05-24,株式会社
株式会社インフィニティ,広島県福山市神辺町字十九軒屋７－１ひまわりハイツ１０３,2019-05-24,株式会社
株式会社ウェイバック,大阪府大阪市住吉区遠里小野１丁目７番３４号,2019-05-24,株式会社
株式会社エアラボ,北海道中川郡幕別町札内北町２０番地の１８,2019-05-24,株式会社
株式会社エコル,沖縄県中頭郡北中城村字島袋５３０番地１,2019-05-24,株式会社
株式会社エスケートレード,愛知県名古屋市中区大須３丁目３３番４号,2019-05-24,株式会社
株式会社エスジー・ツール,愛知県豊橋市前田南町１丁目１番地１タワーレジデンスＨＡＤＡ１０２号,2019-05-24,株式会社
株式会社エナブレイス,東京都清瀬市中清戸３丁目２５１番地２６,2019-05-24,株式会社
株式会社エフエムピー,静岡県静岡市葵区飯間２０６１番地の１,2019-05-24,株式会社
株式会社エフリード,愛知県名古屋市中区東桜２丁目２２番１８号,2019-05-24,株式会社
株式会社エポックサービス,岐阜県恵那市大井町２００７番地１４,2019-05-24,株式会社
株式会社エムズテクニカルファクトリー,神奈川県横浜市神奈川区菅田町７３９番地４１,2019-05-24,株式会社
株式会社エム・アーバン管財,東京都西東京市西原町５丁目２番１２号,2019-05-24,株式会社
株式会社エリーハート,福岡県福岡市中央区大濠１丁目３番１号,2019-05-24,株式会社
株式会社エーサップ,埼玉県比企郡吉見町大字黒岩１３番地１２,2019-05-24,株式会社
株式会社オッチー,東京都小平市御幸町３１５番地の１－２０５号,2019-05-24,株式会社
株式会社オペレーションシェアードサービス,東京都目黒区青葉台２丁目１９番１０号,2019-05-24,株式会社
株式会社オーダーリンク,宮城県仙台市宮城野区宮城野２丁目７番２６－１０５号,2019-05-24,株式会社
株式会社カギヤ,大阪府大阪市北区池田町３番１号,2019-05-24,株式会社
株式会社カラフルズ,東京都目黒区緑が丘２丁目２３番１７号,2019-05-24,株式会社
株式会社クラック,大阪府吹田市南金田２丁目１９番３８－６０３号,2019-05-24,株式会社
株式会社グッドエー,東京都港区新橋２丁目４番５号,2019-05-24,株式会社
株式会社グランストーリー,東京都港区南青山３丁目１番３号スプライン青山東急ビル４階,2019-05-24,株式会社
株式会社ケッズトリニティ,東京都渋谷区恵比寿１丁目２２－８恵比寿ファーストプレイス９０２,2019-05-24,株式会社
株式会社サイノス,広島県府中市高木町４７２県営高木３－２０４,2019-05-24,株式会社
株式会社サザン開発,沖縄県中頭郡西原町字幸地９６３番地６,2019-05-24,株式会社
株式会社シェアハウス共生,長崎県諫早市幸町２２番１２号,2019-05-24,株式会社
株式会社ジーウェーブ,愛知県一宮市住吉１丁目７番３号,2019-05-24,株式会社
株式会社ストリーム,東京都中野区鷺宮３丁目９番１０号,2019-05-24,株式会社
株式会社スリーピース,東京都新宿区西新宿７丁目１番７号新宿ダイカンプラザ,2019-05-24,株式会社
株式会社スワイプ,熊本県菊池郡菊陽町大字津久礼３０６９番地１４号,2019-05-24,株式会社
株式会社センティ,愛知県名古屋市瑞穂区西ノ割町１丁目３７番地の４コーポ大永１階,2019-05-24,株式会社
株式会社ゼスト,大阪府門真市上島町３０－１８－１０３,2019-05-24,株式会社
株式会社ゼロ,山形県酒田市亀ケ崎３丁目１番２５号パルフェ２Ａ号,2019-05-24,株式会社
株式会社ソニア,広島県福山市南蔵王町６丁目１５－２２番,2019-05-24,株式会社
株式会社タカヤマ,東京都中野区東中野１丁目５６番５号,2019-05-24,株式会社
株式会社タシデレ,愛知県豊田市本地町６丁目２１２番地１,2019-05-24,株式会社
株式会社テクノワークス,千葉県柏市藤ケ谷新田１２３番地２,2019-05-24,株式会社
株式会社トラストワン,大阪府高槻市南大樋町１６番１号,2019-05-24,株式会社
株式会社ドライブヨーク,宮城県仙台市若林区六丁の目中町１０番８号,2019-05-24,株式会社
株式会社バムロッタ,大阪府大阪市城東区鴫野西４丁目６番１９号,2019-05-24,株式会社
株式会社フィルムソリューションズ,東京都世田谷区成城１丁目４番１号東宝スタジオプロダクションセンター３０６,2019-05-24,株式会社
株式会社フューチャーファイン,福岡県那珂川市松原２番１０号,2019-05-24,株式会社
株式会社フリーチャート,東京都中央区銀座７丁目１３番６号,2019-05-24,株式会社
株式会社フローヤード,愛知県名古屋市名東区貴船１丁目７０番地の１,2019-05-24,株式会社
株式会社ブランドサーチ,東京都港区西新橋２丁目８番４号,2019-05-24,株式会社
株式会社ブルドック,埼玉県川口市芝新町１２番１０号３０１号室,2019-05-24,株式会社
株式会社ブルム,岩手県陸前高田市竹駒町字大畑２番地２,2019-05-24,株式会社
株式会社プラス,宮城県仙台市若林区蒲町東２番地の５,2019-05-24,株式会社
株式会社プランティオ,大阪府東大阪市楠根３丁目３番３８号,2019-05-24,株式会社
株式会社プレバック,神奈川県横浜市神奈川区斎藤分町二丁目６番地,2019-05-24,株式会社
株式会社ベトナムフード,埼玉県八潮市大字八條１６１０番地５,2019-05-24,株式会社
株式会社ボタニックラボ,神奈川県厚木市戸田２５００番１,2019-05-24,株式会社
株式会社ボンズコミュニケーション,神奈川県座間市相模が丘５丁目４番３７号ＣＡＳＡＳＱＵＡＲＥ２０７号,2019-05-24,株式会社
株式会社マイナビナースケア,東京都新宿区新宿４丁目１番６号,2019-05-24,株式会社
株式会社メイラー,神奈川県横浜市旭区本村町５５番地３６,2019-05-24,株式会社
株式会社ライフサポート逢衣,滋賀県米原市春照１１３８番地,2019-05-24,株式会社
