法人名,住所,設立日,法人種別
株式会社入船食堂,静岡県浜松市南区田尻町１１２番地,2017-06-21,株式会社
株式会社八ヶ岳南麓スープ研究所,山梨県北杜市大泉町西井出７１０２番地１１,2017-06-21,株式会社
株式会社兵頭工業,埼玉県越谷市宮本町３丁目７５番地１２,2017-06-21,株式会社
株式会社勝見,千葉県千葉市緑区あすみが丘東３丁目３２番地８セレンディプティーⅡ－１０２号,2017-06-21,株式会社
株式会社匠,東京都品川区上大崎２丁目１７番４号,2017-06-21,株式会社
株式会社増子車輌,福島県郡山市西田町三町目字栢作２１０番地,2017-06-21,株式会社
株式会社夢くいばく,奈良県生駒市東新町６番２３号,2017-06-21,株式会社
株式会社大媛,大分県大分市高城新町１２番１－１００２号（パークサイドたかじょう１）,2017-06-21,株式会社
株式会社大州プラント,大分県大分市大字乙津７２番地の２（コーポ山村１０１）,2017-06-21,株式会社
株式会社大輝電工,栃木県大田原市加治屋９６番地９７,2017-06-21,株式会社
株式会社宮門,東京都世田谷区玉川１丁目１５番１－１００５号,2017-06-21,株式会社
株式会社家尚吉,大阪府大阪市浪速区元町１丁目１１－８難波三協ビル７０３－１室,2017-06-21,株式会社
株式会社宿満久,長野県大町市平１０４５５番地１,2017-06-21,株式会社
株式会社小林電化センター,大阪府箕面市粟生間谷東６丁目２５番１６号,2017-06-21,株式会社
株式会社川上倉庫,茨城県ひたちなか市大字中根３３３１番地１３,2017-06-21,株式会社
株式会社幸栄,福岡県久留米市花畑２丁目９番地１,2017-06-21,株式会社
株式会社広洋社,神奈川県横浜市神奈川区子安通３丁目３４１番地の１,2017-06-21,株式会社
株式会社德冨想建,神奈川県横浜市中区曙町１丁目３番地藤和伊勢佐木ハイタウン７２６号,2017-06-21,株式会社
株式会社悠,東京都江東区東砂３丁目２０－１３,2017-06-21,株式会社
株式会社慶兆,新潟県妙高市大字関川２３１０番地６,2017-06-21,株式会社
株式会社成興,東京都町田市旭町２丁目４－４旭ハイツ１０５号室,2017-06-21,株式会社
株式会社日東美野里ｈｏｍｅ,茨城県小美玉市羽鳥３０４８番地３,2017-06-21,株式会社
株式会社日野組,愛知県一宮市富塚字土居之内１４番地２,2017-06-21,株式会社
株式会社昌栄商会,神奈川県横浜市金沢区谷津町１６２番地,2017-06-21,株式会社
株式会社星空,東京都三鷹市新川３丁目１９番９号,2017-06-21,株式会社
株式会社杉本デイリーファーム,北海道中川郡幕別町忠類公親２０番地１,2017-06-21,株式会社
株式会社東根相互不動産,山形県東根市中央３丁目１０番６号,2017-06-21,株式会社
株式会社梅野電設,大阪府和泉市富秋町２丁目１１番３４－１０５号,2017-06-21,株式会社
株式会社清水電設工業,東京都板橋区南町５６番１－２０２号,2017-06-21,株式会社
株式会社産業ＮＡＶＩ,神奈川県横浜市中区元浜町４丁目３２番地,2017-06-21,株式会社
株式会社白蓮,東京都町田市金森３丁目２１番１３号,2017-06-21,株式会社
株式会社眞建工,埼玉県川口市大字東本郷１３６５番地２,2017-06-21,株式会社
株式会社石炭の歴史村観光,北海道夕張市高松７番地の１,2017-06-21,株式会社
株式会社美味工房とさ,高知県高知市土居町９番８号,2017-06-21,株式会社
株式会社肆總,福岡県福岡市中央区六本松３丁目１６番４１号,2017-06-21,株式会社
株式会社花々緒,東京都中央区銀座６丁目６番１号,2017-06-21,株式会社
株式会社英機工,東京都板橋区赤塚４丁目２４番７号シャルム松木２０２号室,2017-06-21,株式会社
株式会社葛西工業,東京都東大和市向原６丁目９３６番地の５小泉アパート２０１号,2017-06-21,株式会社
株式会社藏屋はしもと,京都府京都市中京区猪熊通御池下る三坊猪熊町北組３７３番地１,2017-06-21,株式会社
株式会社藤栄,埼玉県さいたま市岩槻区西町４丁目１番３号,2017-06-21,株式会社
株式会社藤正,宮城県仙台市青葉区小田原４丁目１番３２号,2017-06-21,株式会社
株式会社野口電設工業,京都府京都市右京区太秦一ノ井町１８番地６ハイツベルベ２０３号,2017-06-21,株式会社
株式会社青山デザイン事務所,東京都港区南青山２丁目２番１５号,2017-06-21,株式会社
株式会社高崎イベントサービス,群馬県高崎市鶴見町１番地１丸三高崎ビル２階Ａ,2017-06-21,株式会社
株式会社鼎鑫,大阪府大阪市浪速区日本橋４丁目２番２０号コア日本橋１階,2017-06-21,株式会社
株式会社２４０ＲＩＳＩＮＧ,高知県高知市十津３丁目１０番２号,2017-06-21,株式会社
株式会社ＡＭＯ,兵庫県芦屋市山手町３０番２１号,2017-06-21,株式会社
株式会社ＡＷＬ,東京都立川市錦町２丁目１番３２号山崎ビルＢ１Ｆ,2017-06-21,株式会社
株式会社ＡＸＣＥＬ,大阪府大阪市福島区吉野１丁目１５番１３号,2017-06-21,株式会社
株式会社ＡＺＣＡＬ,埼玉県さいたま市緑区大字大門２４７３番地１,2017-06-21,株式会社
株式会社Ａｓｈｕｎ,北海道札幌市北区新琴似十条８丁目５番８号,2017-06-21,株式会社
株式会社Ｂｉｏゴルフアカデミａｎｄ工房,長野県安曇野市穂高柏原２２６１番地７,2017-06-21,株式会社
株式会社ＣＯＲＳＡ,兵庫県姫路市東今宿３丁目１３番５号,2017-06-21,株式会社
株式会社Ｃｅｌｌ　ａｎｄ　Ｇｅｎｅｔｉｃ　Ｉｎｖｅｓｔｍｅｎｔ,東京都港区麻布十番１丁目９番７号,2017-06-21,株式会社
株式会社Ｄａｈｌｉｅｓｔ,東京都文京区本郷３丁目４番３号,2017-06-21,株式会社
株式会社ＦＲＯＭ　ＺＥＲＯ,東京都台東区松が谷４丁目１８番２号松が谷ドミール１０１,2017-06-21,株式会社
株式会社ＦＵＫＡＳＡＷＡ　ＭＵＳＩＣ　ＣＯＭＰＡＮＹ,東京都港区南青山４丁目１７番３３号,2017-06-21,株式会社
株式会社ＧＡＲＯＷＡＹ,大阪府東大阪市新庄１丁目１４番２７号,2017-06-21,株式会社
株式会社Ｈ＆Ｌ,京都府京都市中京区錦大宮町１１５番地３ＮＡＳビル５Ｆ,2017-06-21,株式会社
株式会社Ｉ　Ｒｕｓｈ,群馬県太田市亀岡町４４０番地,2017-06-21,株式会社
株式会社Ｉ．Ｒ．Ａ．,東京都新宿区大久保２丁目９－１２－３ＦＢ,2017-06-21,株式会社
株式会社ＩＫＩＤＡＮＥ,東京都新宿区市谷砂土原町３丁目５番地,2017-06-21,株式会社
株式会社ＩＷＳ,東京都足立区小台２丁目１０番１８号,2017-06-21,株式会社
株式会社Ｉｎｔｅｌｌｉｇｅｎｔ　Ｍｅｄｉｃａｌ　Ｌａｂｏｒａｔｏｒｙ,大阪府寝屋川市国松町４０番１３号,2017-06-21,株式会社
株式会社ＪＰドラッグ,大阪府大阪市中央区島之内２丁目８番８号天智ビル１Ｆ,2017-06-21,株式会社
株式会社Ｊｏｌｌｉｖｅｒ,北海道札幌市東区北二十条東２０丁目３番３号,2017-06-21,株式会社
株式会社ＫＡＴＳＵＭＯＫ,福岡県福岡市中央区大名１丁目９番１８号大名Ｆビル２階,2017-06-21,株式会社
株式会社ＫＪＨ　ｉｎｔｅｒｎａｔｉｏｎａｌ,東京都足立区椿２丁目５番５号,2017-06-21,株式会社
株式会社Ｌａｎｉ　Ｐａｒｔｎｅｒｓ,大阪府大阪市東住吉区南田辺５丁目４番７号,2017-06-21,株式会社
株式会社Ｌｉｆｅ　Ｄｅｓｉｇｎ　ＦＰ　Ｏｎｅ事務所,山梨県甲府市北口１丁目２番１４号甲府北口プラザビル３０５号室,2017-06-21,株式会社
株式会社Ｍ．ｓｙｓｔｅｍ,大阪府大阪市北区中崎１丁目６番１４号７０２,2017-06-21,株式会社
株式会社ＭＡ,千葉県千葉市中央区問屋町８番１－４２１号,2017-06-21,株式会社
株式会社ＭＥＤＩＡＲＱ,東京都豊島区西池袋３丁目２１番地１３－３２０６号,2017-06-21,株式会社
株式会社ＭＳホールディングス,東京都港区麻布十番１丁目７番１１号麻布井上ビル,2017-06-21,株式会社
株式会社ＭＹプランニング,東京都調布市深大寺東町７丁目２４番地２９,2017-06-21,株式会社
株式会社Ｍａｒｙｌｅｂｏｎｅ,東京都大田区北嶺町２３番８号,2017-06-21,株式会社
株式会社Ｍｅｒｃｈａｎｔ　Ａｄｖｅｎｔｕｒｅｒｓ　ｏｆ　Ｊａｐａｎ,東京都渋谷区神宮前５丁目４１番１４号,2017-06-21,株式会社
株式会社Ｎ．Ａパートナー,東京都中央区日本橋本町３丁目３番６ワカ末ビル７階,2017-06-21,株式会社
株式会社ＯＰＥＮ　ＴＯＷＮ,宮城県仙台市青葉区本町１丁目１３番１６号ｙｅｌｌｏｗｂｌｄｇ５Ｆ,2017-06-21,株式会社
株式会社ＯＴＡ　Ｐｌａｎ　ａｎｄ　Ｒｅａｌｉｚａｔｉｏｎ,東京都台東区下谷２丁目１番１－１４０３号アルカーデンタワー入谷,2017-06-21,株式会社
株式会社ＰＯＣＵＢＡ,東京都品川区上大崎１丁目２２番１号ＳＱＵＡＲＥ目黒９０２,2017-06-21,株式会社
株式会社Ｓ－Ｂｒｏｓ．,京都府京都市左京区田中下柳町２０番地,2017-06-21,株式会社
株式会社ＳＫＹ　ＴＲＡＤＩＮＧ　Ｉｎｔｅｒｎａｔｉｏｎａｌ　Ｃｏｍｐａｎｙ,埼玉県蓮田市西城２丁目１９番地パストラルコートⅡ番館２０２号,2017-06-21,株式会社
株式会社ＳＫＹ・Ｍ,茨城県つくば市学園の森３丁目２４番地１,2017-06-21,株式会社
株式会社ＳＫＹＥＥ　ＪＡＰＡＮ,東京都千代田区神田須田町１丁目２番地７淡路町駅前ビル３階,2017-06-21,株式会社
株式会社ＳＬＣ,宮崎県延岡市富美山町４３８４番地,2017-06-21,株式会社
株式会社ＳＯＴホルダー,大分県別府市上田の湯町１２番２９号,2017-06-21,株式会社
株式会社ＳＴＯＣＫ５６,東京都豊島区東池袋２丁目２２番１号,2017-06-21,株式会社
株式会社ＳＴＯＣＫ５７,東京都豊島区東池袋２丁目２２番１号,2017-06-21,株式会社
株式会社ＳＴＯＣＫ５８,東京都豊島区東池袋２丁目２２番１号,2017-06-21,株式会社
株式会社ＳＴＯＣＫ５９,東京都豊島区東池袋２丁目２２番１号,2017-06-21,株式会社
株式会社ＳＴＯＣＫ６０,東京都豊島区東池袋２丁目２２番１号,2017-06-21,株式会社
株式会社Ｔ’ｓコーポレーション,三重県四日市市下之宮町２８１番地２,2017-06-21,株式会社
株式会社Ｔ＆Ｋ,埼玉県北足立郡伊奈町大字大針４１４番エミネンス１Ｆ－Ｃ,2017-06-21,株式会社
株式会社ＴＡＹ,静岡県静岡市葵区大岩町４番８９号,2017-06-21,株式会社
株式会社ＵＢＣ,愛知県西尾市法光寺町宮前４８番地２,2017-06-21,株式会社
株式会社ＶＰＰ　Ｊａｐａｎ,東京都品川区東五反田５丁目１１番１号,2017-06-21,株式会社
株式会社Ｗ．Ｄ．Ｍ,東京都新宿区左門町１３番地磯部ビル５階,2017-06-21,株式会社
株式会社Ｗａｔｒａｙ,東京都杉並区永福４丁目２０番２０号,2017-06-21,株式会社
株式会社Ｙ’ｓ　Ｒｅｓｏｎａｎｃｅ,東京都千代田区丸の内１丁目１１番１号パシフィックセンチュリープレイス丸の内８階,2017-06-21,株式会社
株式会社ＺＩＺＥＮ　Ｃｙｃｌｅ,愛知県名古屋市中川区かの里１丁目５０２番地,2017-06-21,株式会社
株式会社ａｔｄ,東京都中野区東中野１丁目１４－２８,2017-06-21,株式会社
株式会社ｅｓＴａ,神奈川県横浜市中区長者町４丁目１１番地１ルリエ横浜長者町１４０７号室,2017-06-21,株式会社
株式会社ｎａｔｔｙ,東京都新宿区西新宿１丁目１９番８号新東京ビル７Ｆ,2017-06-21,株式会社
株式会社ｓｗａｎｋｙ,東京都新宿区西新宿１丁目１９番８号新東京ビル７Ｆ,2017-06-21,株式会社
横浜インテリジェンス株式会社,神奈川県横浜市瀬谷区二ツ橋町５４０番地１２スターホームズ三ツ境Ⅹ１０２,2017-06-21,株式会社
永恒株式会社,埼玉県川口市川口１丁目９－２４（１Ｆ）,2017-06-21,株式会社
沖之須牧場株式会社,静岡県掛川市沖之須２１５２番地の１,2017-06-21,株式会社
浅井企画合同会社,大阪府大阪市平野区瓜破３丁目２番２７号浅井マンション４０１号,2017-06-21,合同会社
浅見技研株式会社,東京都港区赤坂９丁目５番１２号パークサイドシックス５０２,2017-06-21,株式会社
清水ＩＴ会計合同会社,千葉県浦安市東野３丁目３１番３号,2017-06-21,合同会社
潤古堂株式会社,京都府京都市中京区河原町通竹屋町上る大文字町２４２番地４,2017-06-21,株式会社
特定非営利活動法人あさ家,福島県南相馬市小高区水谷字宮前８５番地,2017-06-21,その他の設立登記法人
特定非営利活動法人まちだ自然エネルギー協議会,東京都町田市真光寺３丁目５番地１エミナンエノモト１０１,2017-06-21,その他の設立登記法人
特定非営利活動法人ゆらい,鹿児島県大島郡喜界町大字赤連２５２４番地,2017-06-21,その他の設立登記法人
特定非営利活動法人不登校・発達支援ネットワークＳｅｅｄｓ　ＡＰＰ,神奈川県横浜市金沢区瀬戸１３番１０号,2017-06-21,その他の設立登記法人
特定非営利活動法人仏向たかの子キッズクラブ,神奈川県横浜市保土ケ谷区仏向町２４０番地,2017-06-21,その他の設立登記法人
特定非営利活動法人八戸ノルディック・ウォーク倶楽部,青森県八戸市大字根城字大久保５３番地,2017-06-21,その他の設立登記法人
特定非営利活動法人東京稲城里山義塾,東京都稲城市百村１１２３番地の２シェモアＣ－１,2017-06-21,その他の設立登記法人
特定非営利活動法人池袋サードプレイス,東京都豊島区西池袋１丁目１０番１５号養老乃瀧ビル９階,2017-06-21,その他の設立登記法人
特定非営利活動法人Ｅｘｃｅｅｄ　Ｓｐｏｒｔｓ,大阪府大阪市住之江区南港中５丁目３番４３－４１０号,2017-06-21,その他の設立登記法人
特定非営利活動法人Ｈｕｇ,長野県下伊那郡松川町元大島３８０３番地１０,2017-06-21,その他の設立登記法人
特定非営利活動法人Ｔｏｉ　Ｔｏｉ,沖縄県沖縄市諸見里１丁目１１番２０号,2017-06-21,その他の設立登記法人
畠中建設株式会社,京都府船井郡京丹波町下大久保久保地９番地１,2017-06-21,株式会社
石井商事株式会社,神奈川県川崎市多摩区中野島３丁目１７番１４号,2017-06-21,株式会社
社会福祉法人新泉学園,千葉県松戸市新松戸北１丁目１１番地の１５,2017-06-21,その他の設立登記法人
竹尋学区まちづくり推進委員会,広島県福山市神辺町大字下竹田８－１,2017-06-21,その他
芯テック株式会社,福岡県福岡市博多区古門戸町１番１３－８０２号,2017-06-21,株式会社
菊島建設合同会社,栃木県芳賀郡益子町大字本沼１７番地３,2017-06-21,合同会社
行政書士法人ひるかわ事務所,神奈川県横浜市戸塚区原宿３丁目１４番１４－Ａ号,2017-06-21,その他の設立登記法人
農事組合法人グリーンスター,大分県竹田市直入町大字長湯７１４４番地,2017-06-21,その他の設立登記法人
農事組合法人五島畑作物組合,長崎県五島市籠淵町２４５０番地１,2017-06-21,その他の設立登記法人
農事組合法人大谷,岩手県奥州市江刺区稲瀬字谷地１００番地,2017-06-21,その他の設立登記法人
那賀町に心を捧ぐ株式会社,徳島県那賀郡那賀町百合字石橋５００番地３,2017-06-21,株式会社
都筑園丁株式会社,神奈川県横浜市都筑区茅ケ崎南３丁目７番９号,2017-06-21,株式会社
長澤＆アソシエーツ株式会社,東京都港区芝５丁目２９番地２０号,2017-06-21,株式会社
関西商事株式会社,大阪府大阪市中央区内淡路町２丁目４番７号ＪＳ北浜ビル,2017-06-21,株式会社
防災プラネット株式会社,北海道札幌市豊平区平岸三条１７丁目７番１０号,2017-06-21,株式会社
ＡＯＰメーカー合同会社,大阪府池田市呉服町９番１５－４０５号,2017-06-21,合同会社
ＡＳＫＢ株式会社,神奈川県横浜市港北区篠原町２５７２番地の１バームハイツ新横浜壱番館１００,2017-06-21,株式会社
Ｅ＆Ｂ株式会社,沖縄県島尻郡久米島町字比嘉２８６６番地の９,2017-06-21,株式会社
ＦＡＮＴＡＳＹ　ＮＡＩＬＳ　ＥＵＲＯＰＥ　ＳＬ．,大阪府大阪市北区堂島２丁目２番２６号,2017-06-21,外国会社等
Ｇｌｏｂａｌ　Ｃｏｎｖｅｒｇｅｎｃｅ　Ｊａｐａｎ株式会社,東京都新宿区西新宿１丁目２０番３号西新宿高木ビル７Ｆ・８Ｆ,2017-06-21,株式会社
ＨＡＮＡＮＯ　ＬＬＣ合同会社,岡山県倉敷市玉島八島７０１番地,2017-06-21,合同会社
Ｈｉｌｔｏｎ　Ｇｒａｎｄ　Ｖａｃａｔｉｏｎｓ　Ｊａｐａｎ　Ｍａｎａｇｅｍｅｎｔ合同会社,東京都新宿区西新宿８丁目１７番１号,2017-06-21,合同会社
Ｊ＆Ｙ株式会社,神奈川県横浜市青葉区みすずが丘９番地３６,2017-06-21,株式会社
ＪＢＧ　ＰＳ１５合同会社,東京都千代田区内幸町２丁目２番２号富国生命ビル１２階渥美坂井法律事務所内,2017-06-21,合同会社
ＪＲＥ　ＧＯＬＤ合同会社,東京都港区西麻布１丁目２番１７－４０１号,2017-06-21,合同会社
Ｋ‐ＣＭａＳ株式会社,東京都江戸川区中葛西５丁目１６番１４号,2017-06-21,株式会社
Ｋ２ｉｎｃｅｎｔｉｖｅ株式会社,静岡県裾野市御宿１２９１番地の１,2017-06-21,株式会社
ＫＨＡＴＲＩ合同会社,東京都足立区千住曙町３－１６－２０３,2017-06-21,合同会社
Ｌ－ＴＩＭＥ株式会社,北海道函館市東山２丁目４５番１号メゾン・スクエア１０２号室,2017-06-21,株式会社
Ｌｏｎｇ　Ｐｒｏｖｉｄｅｎｃｅ株式会社,大阪府豊中市待兼山町１３番２３号,2017-06-21,株式会社
ＭＨＩインフォテック株式会社,東京都港区港南２丁目１６番５号,2017-06-21,株式会社
ＭＩＴ　ＢＯＵＴＩＱＵＥ合同会社,千葉県習志野市花咲１丁目２１番１３号チクラハイツ１０２号,2017-06-21,合同会社
Ｍｉｌｌａｕ合同会社,茨城県石岡市行里川３番２号,2017-06-21,合同会社
ＮＰＣ　ＭＯＬＴＥＫ－ＪＡＰＡＮ株式会社,茨城県稲敷市時崎４５番地１－Ｃ,2017-06-21,株式会社
ＮＰＯ法人アニマルレスキュードリームロード,島根県出雲市小山町１１３番地１,2017-06-21,その他の設立登記法人
ＮＰＯ法人在宅ホスピスを支援する会希望の家美虹,神奈川県平塚市長持２７０番地の４,2017-06-21,その他の設立登記法人
Ｐｅｒｆｏｒｍ株式会社,茨城県土浦市大手町１７番１６号,2017-06-21,株式会社
Ｒ株式会社,東京都文京区本郷５丁目５番１７号大光ビル６０６,2017-06-21,株式会社
ＳＧリビング合同会社,東京都新宿区神楽坂３丁目６番地,2017-06-21,合同会社
ＳＨＩＴＡＲＡ合同会社,大阪府大阪市北区堂山町１番５号三共梅田ビル６階,2017-06-21,合同会社
ＳＨＯＶＡ　ＩＮＴＥＲＮＡＴＩＯＮＡＬ合同会社,東京都足立区保木間２丁目２番１号,2017-06-21,合同会社
ＳＫドリーマーズ株式会社,滋賀県大津市野郷原２丁目１３番２１号,2017-06-21,株式会社
ＳＫＤ７特定目的会社,東京都千代田区丸の内３丁目１番１号東京共同会計事務所内,2017-06-21,その他の設立登記法人
ＳｏＡ　Ｊａｐａｎ株式会社,東京都世田谷区千歳台１丁目２番２号,2017-06-21,株式会社
Ｓｕｎａｒｃ合同会社,東京都中央区日本橋箱崎町２０番１４号日本橋巴ビル４階,2017-06-21,合同会社
Ｓｕｎｃｒｅｓｔ合同会社,東京都中央区日本橋箱崎町２０番１４号日本橋巴ビル４階,2017-06-21,合同会社
Ｔ・Ｍ・Ｏ合同会社,東京都足立区足立２丁目１８－９第２山口ビル２Ｆ１７号,2017-06-21,合同会社
Ｔｉｐ株式会社,東京都港区芝１丁目６番１０号,2017-06-21,株式会社
Ｔｕｌｓａ株式会社,埼玉県草加市旭町４丁目４番７号－Ｂ２０２号,2017-06-21,株式会社
ａｂｂａ合同会社,北海道室蘭市絵鞆町３丁目１６番１４号,2017-06-21,合同会社
ｂａｏｂａｂ合同会社,埼玉県さいたま市浦和区仲町１丁目６番６号,2017-06-21,合同会社
ｋｕｔｔａ合同会社,北海道旭川市末広五条９丁目５番１６号,2017-06-21,合同会社
ｔｕｎｎｅｌｄｅｓｉｇｎ株式会社,東京都品川区大井４丁目２０番７号,2017-06-21,株式会社
ｙａｎｙａｎ０２０７合同会社,神奈川県横浜市鶴見区豊岡町２１番５－３０２号,2017-06-21,合同会社
あすか合同会社,神奈川県横浜市青葉区あかね台１丁目３３番地１２,2017-06-22,合同会社
いつき福祉サービス株式会社,山口県防府市警固町２丁目７－６１第８なかがわマンション１０５号室,2017-06-22,株式会社
ひとみＳｔｙｌｅ株式会社,兵庫県明石市北朝霧丘２丁目８番４０号,2017-06-22,株式会社
イメージ・コネクト合同会社,東京都大田区南馬込２丁目１５番６号,2017-06-22,合同会社
インテリジェント・ビジネス・マネジメント株式会社,東京都港区白金３丁目７番１８号,2017-06-22,株式会社
エクスラボ株式会社,福井県坂井市春江町江留中第３９号１番地１９,2017-06-22,株式会社
エブリネイションチャーチ伊豆,静岡県伊豆市柏久保６１６－１,2017-06-22,その他
オーシャンコロナ合同会社,東京都新宿区箪笥町３０番地,2017-06-22,合同会社
カゼッタ株式会社,東京都品川区豊町１丁目３番６号,2017-06-22,株式会社
カナンテック株式会社,石川県白山市鹿島町へ７番地１,2017-06-22,株式会社
クリエートツール株式会社,岩手県一関市厳美町字天王８０番地,2017-06-22,株式会社
グルーバル技研協同組合,東京都新宿区大久保１丁目１番９－２０１号,2017-06-22,その他の設立登記法人
ケイアイネットリアルティ２ｎｄ株式会社,栃木県宇都宮市西川田町５０番地１,2017-06-22,株式会社
ゴールドフィッシュ株式会社,岐阜県岐阜市柳ケ瀬通３丁目８番３ＴＹビル１Ｆ,2017-06-22,株式会社
サニファインクリエート株式会社,東京都世田谷区砧６丁目１２番５号ＧＡＲＤＥＮ　ＧＲＯＶＥ２０２,2017-06-22,株式会社
シオン株式会社,北海道札幌市白石区北郷一条１２丁目７番５号,2017-06-22,株式会社
シンキーズアイ株式会社,東京都千代田区外神田２丁目１６番２号,2017-06-22,株式会社
シーシャ・プロ・ジャパン株式会社,東京都港区六本木４丁目３番６号,2017-06-22,株式会社
ジークエスト合同会社,東京都中央区月島３丁目２７番３号はざまビル３０２,2017-06-22,合同会社
セキエイ工業株式会社,栃木県宇都宮市駒生町１２４９番地７,2017-06-22,株式会社
ディーエコ株式会社,大阪府大阪市鶴見区放出東１丁目３３番３２号,2017-06-22,株式会社
ディー・クルー・テクノロジーズ株式会社,神奈川県横浜市港北区新横浜３丁目１７番２号,2017-06-22,株式会社
トラベルフュージョンジャパン株式会社,東京都渋谷区桜丘町２９番３５号,2017-06-22,株式会社
トレイルヘッド株式会社,兵庫県神戸市西区学園東町５丁目１番地５０３－２０３号,2017-06-22,株式会社
ドグタウン工房株式会社,群馬県利根郡昭和村大字貝野瀬４８３９番地３,2017-06-22,株式会社
ニュー千早団地管理組合法人,福岡県福岡市東区千早３丁目６番３４号ニュー千早団地集会所,2017-06-22,その他の設立登記法人
ノルディック・セミコンダクター株式会社,神奈川県横浜市西区みなとみらい２丁目２番１号横浜ランドマークタワー２０階,2017-06-22,株式会社
ビラ鎌倉管理組合法人,神奈川県鎌倉市材木座６丁目８番７号ビラ鎌倉１０１,2017-06-22,その他の設立登記法人
