法人名,住所,設立日,法人種別
株式会社池田屋,愛知県一宮市丹陽町九日市場字東三本松１８２８番地５,2025-03-07,株式会社
株式会社泉州ホールディングス,大阪府岸和田市包近町３６０番地１,2025-03-07,株式会社
株式会社泰興Ｇｌｏｂａｌ,東京都中央区京橋２丁目８番１０号木下ビル６階,2025-03-07,株式会社
株式会社洗足ゴルフスタジオ,東京都品川区東五反田２丁目１９番２号第１２東都ビル７階,2025-03-07,株式会社
株式会社海友世,東京都葛飾区新小岩２丁目１番９－９１５号シティテラス新小岩,2025-03-07,株式会社
株式会社湘南さくらエステート,神奈川県藤沢市辻堂２丁目３番１号マリス湘南４０２,2025-03-07,株式会社
株式会社熊本産地開発,熊本県熊本市北区麻生田１丁目１番１２号,2025-03-07,株式会社
株式会社瑞嘉,東京都港区港南３丁目７番１６－３１０４号,2025-03-07,株式会社
株式会社璃羅設備,東京都西東京市泉町５丁目７番３号,2025-03-07,株式会社
株式会社生鮮カズ,茨城県古河市駒羽根１３９７番地２,2025-03-07,株式会社
株式会社真心,東京都新宿区北新宿３丁目１番２号,2025-03-07,株式会社
株式会社真田商店,京都府綴喜郡宇治田原町銘城台１７番地の１５,2025-03-07,株式会社
株式会社知多キャッスル,愛知県名古屋市東区葵３丁目２５番５号,2025-03-07,株式会社
株式会社石川オートサービス,茨城県ひたちなか市勝田本町１７番２５号,2025-03-07,株式会社
株式会社絆,京都府京都市右京区西院三蔵町４６番地６,2025-03-07,株式会社
株式会社結トータルアソシエーション,神奈川県横浜市南区高根町３丁目１７番地２８マークス横濱阪東橋１階,2025-03-07,株式会社
株式会社結音,群馬県高崎市飯塚町７０番地１２,2025-03-07,株式会社
株式会社美加登家,島根県鹿足郡津和野町日原２２１番地２,2025-03-07,株式会社
株式会社至心,神奈川県横浜市西区北幸２丁目１０番４８号むつみビル３階,2025-03-07,株式会社
株式会社花山,大阪府大阪市平野区平野西４丁目９番３２号,2025-03-07,株式会社
株式会社芳照,神奈川県海老名市上今泉６丁目４７番４３号,2025-03-07,株式会社
株式会社荒木地所コンサルティング,愛知県名古屋市千種区今池南２９番２４号川島第一ビル３階３Ｆ号室,2025-03-07,株式会社
株式会社菊本屋農園,長野県南佐久郡南牧村大字広瀬１９４１番地３,2025-03-07,株式会社
株式会社菓楽,大阪府枚方市養父丘２丁目７番２４号,2025-03-07,株式会社
株式会社蒼天,山梨県笛吹市春日居町桑戸５４７番地１,2025-03-07,株式会社
株式会社藤本建設,大阪府堺市北区長曽根町３０５１番地１１,2025-03-07,株式会社
株式会社西の出家,広島県広島市安芸区矢野西４丁目２４番４２号,2025-03-07,株式会社
株式会社買取グース,大阪府吹田市豊津町１０－１１池上ビル１０１,2025-03-07,株式会社
株式会社道,大阪府東大阪市日下町６丁目２番１６号,2025-03-07,株式会社
株式会社野村工業,京都府京都市山科区西野大鳥井町３５番地３８,2025-03-07,株式会社
株式会社野田,熊本県熊本市東区小山１丁目６番５４号,2025-03-07,株式会社
株式会社雅装飾,兵庫県神戸市西区和井取１０番８号,2025-03-07,株式会社
株式会社１５,東京都豊島区池袋２丁目１０番３号第一絆ビル３階,2025-03-07,株式会社
株式会社１９９３,東京都中央区日本橋２丁目１番１７号丹生ビル２階,2025-03-07,株式会社
株式会社２‐８,東京都府中市府中町１丁目２９番地の２コーポテラス２０２,2025-03-07,株式会社
株式会社３ｗａｙｓ,東京都渋谷区恵比寿西２丁目４番８号ウィンド恵比寿ビル８Ｆ,2025-03-07,株式会社
株式会社４Ｂ,大阪府堺市北区長曽根町１３０番地４２,2025-03-07,株式会社
株式会社４ＭＡ,東京都中央区日本橋本町１丁目１番５号日本橋ＴＮビル２Ｆ,2025-03-07,株式会社
株式会社５ＲＫ,愛知県名古屋市南区鶴田１丁目１０番６号,2025-03-07,株式会社
株式会社８８ＡＵＤＩＯ,東京都新宿区西新宿３丁目３番１３号西新宿水間ビル６階,2025-03-07,株式会社
株式会社Ａ．Ｔ．Ｍ．ＴＥＣＨＮＯ,茨城県下妻市高道祖２６１２番地コーポタイセイＡ棟１０１号室,2025-03-07,株式会社
株式会社ＡＢＯＵ,東京都中央区勝どき４丁目６番２号パークタワー勝どきミッド４０８,2025-03-07,株式会社
株式会社ＡＢＳ,神奈川県川崎市川崎区東門前２丁目５番３－３０５号,2025-03-07,株式会社
株式会社ＡＣ‐３,東京都千代田区麹町３丁目５番地２,2025-03-07,株式会社
株式会社ＡＣ‐４,東京都千代田区麹町３丁目５番地２,2025-03-07,株式会社
株式会社ＡＣＥ総合コンサル,愛知県春日井市松河戸町２丁目１８番地７グランドゥールＨ４０３号,2025-03-07,株式会社
株式会社ＡＬＢ,東京都渋谷区上原３丁目１０番２号,2025-03-07,株式会社
株式会社ＡＬＧ,東京都中野区弥生町１丁目３３番５－１０７号,2025-03-07,株式会社
株式会社ＡＭＯＳ,福岡県北九州市小倉南区若園２丁目２５番３号,2025-03-07,株式会社
株式会社ＡＭＴ,兵庫県神戸市中央区熊内橋通７丁目１番１３－２４０２号,2025-03-07,株式会社
株式会社ＡＲＴＩＥＲＥ,神奈川県横浜市戸塚区戸塚町１５４３番地２０１号室,2025-03-07,株式会社
株式会社ＡＳＥＡＭ,愛知県名古屋市千種区姫池通２丁目２６番地１０,2025-03-07,株式会社
株式会社ＡＳＳＥＴ,東京都中央区銀座１丁目１２－４Ｎ＆ＥＢＬＤ．７階,2025-03-07,株式会社
株式会社Ａｉｎｏａ　Ｐａｒｔｎｅｒ,兵庫県宝塚市口谷西３丁目２９番地の３１,2025-03-07,株式会社
株式会社Ａｍｂｅｒ,神奈川県藤沢市鵠沼神明５丁目２―１７,2025-03-07,株式会社
株式会社Ａｎｇｅ,千葉県我孫子市湖北台１丁目１６番６号,2025-03-07,株式会社
株式会社ＡｒｍａＧｅｔｄｏｎｅ,東京都目黒区平町２丁目１３番５号,2025-03-07,株式会社
株式会社Ａｔｔｒａｉｔ,愛知県名古屋市中区錦３丁目１２番１２号ハードワンビル４階Ａ号室,2025-03-07,株式会社
株式会社Ｂ＆Ｈ,東京都港区南青山３丁目１３番９号,2025-03-07,株式会社
株式会社ＢＡＳＥＦＩＴＮＥＳＳ,福岡県福岡市中央区春吉１丁目９番１６－１０２号リフェスタ渡辺通,2025-03-07,株式会社
株式会社ＢＣＭ３６,東京都中央区京橋２丁目２番１号,2025-03-07,株式会社
株式会社ＢＬＵＥ　ＯＦＦＩＣＥ,東京都中央区銀座１丁目２２番１１号銀座大竹ビジデンス２Ｆ,2025-03-07,株式会社
株式会社ＢＮＧ,新潟県上越市浦川原区長走８７９番地５,2025-03-07,株式会社
株式会社Ｂａｂｂｌｉｎｇ　Ｂａｂｙ,愛知県名古屋市天白区土原４丁目１０２番地,2025-03-07,株式会社
株式会社Ｂｅｌｌｅ　Ｖｉｓｉｏｎ,東京都港区元赤坂１丁目２番７号赤坂Ｋタワー４階,2025-03-07,株式会社
株式会社Ｂｅｔｗｅｅｎ,愛知県日進市三本木町大根６４番地１,2025-03-07,株式会社
株式会社Ｂｌｕｅ　Ｌｉｆｅ,宮城県宮城郡利府町神谷沢字塚元６２番地,2025-03-07,株式会社
株式会社Ｂｒａｎｃｈ,福岡県筑紫野市湯町２丁目１番１号,2025-03-07,株式会社
株式会社Ｂｒｉｃｋｓ＆ＵＫ　Ｃｏｎｓｕｌｔｉｎｇ,東京都港区港南１丁目７番１８号,2025-03-07,株式会社
株式会社ＣＡＳＰＥＮ,北海道虻田郡倶知安町字山田３４番地３２,2025-03-07,株式会社
株式会社ＣＡＴＴＬＥ,東京都足立区花畑７丁目７番４号,2025-03-07,株式会社
株式会社ＣＯＺＹ　ＴＥＲＡＳＵ,大阪府大阪市生野区小路東１丁目５－１７,2025-03-07,株式会社
株式会社ＣＲＥＤＯ,東京都荒川区南千住３丁目２０番６号,2025-03-07,株式会社
株式会社ＣＳＬＡＳＨＳ,東京都世田谷区喜多見９丁目２７番８号,2025-03-07,株式会社
株式会社ＣＵＯＲＥＳ,愛知県名古屋市天白区池見１丁目４７番地の２（プリンセス八事２０３号）,2025-03-07,株式会社
株式会社ＣｈａｔｅａｕＭａｋｏ,千葉県八街市文違３０１番地１１９１,2025-03-07,株式会社
株式会社Ｄ　ＮＥＸＴ,神奈川県南足柄市沼田１８番地５,2025-03-07,株式会社
株式会社ＤＡＳＨＩ,石川県野々市市新庄２丁目２６１番地２,2025-03-07,株式会社
株式会社ＤＡＳＨＩーＹＵ,神奈川県相模原市南区上鶴間本町１丁目４８番５－２０４号,2025-03-07,株式会社
株式会社Ｄｉｇｎｉｔｙ,大阪府枚方市走谷２丁目３１番１号,2025-03-07,株式会社
株式会社Ｅ．Ｒ,東京都港区高輪４丁目１５番１９－４０２号,2025-03-07,株式会社
株式会社ＥＩＫＥＮ,神奈川県相模原市緑区大島６９２番地２,2025-03-07,株式会社
株式会社Ｆロード,神奈川県横浜市泉区岡津町１５３８番地,2025-03-07,株式会社
株式会社Ｆ＆Ｅ　Ｌａｂ,大阪府寝屋川市黒原旭町２８番１３号,2025-03-07,株式会社
株式会社ＦＡＭＣＯ,東京都世田谷区等々力７丁目２０番７号,2025-03-07,株式会社
株式会社ＦＵＫＡＩ,大阪府堺市中区深井清水町３２３４番地,2025-03-07,株式会社
株式会社Ｆａｍ,鹿児島県鹿児島市広木１丁目９番２号,2025-03-07,株式会社
株式会社ＦｉｒｓｔＰｅａｋ,愛知県名古屋市緑区相川２丁目５番地,2025-03-07,株式会社
株式会社Ｆｉｔ,大阪府大阪市東住吉区公園南矢田３丁目２４番２号,2025-03-07,株式会社
株式会社ＦｉｖｅＳｔａｒ　Ｃｒｅａｔｅ,大阪府大阪市浪速区浪速西２丁目３番２－７０５号,2025-03-07,株式会社
株式会社Ｆｌｙ　Ｈｅｉｇｈｔ,東京都港区新橋４丁目１４番１号新橋ＡＵＮＢＬＤＧ４階,2025-03-07,株式会社
株式会社Ｆｏｒｅｓｔ　Ｂｅｌｌ,東京都荒川区東日暮里３丁目９番４－５０６号,2025-03-07,株式会社
株式会社Ｇ２,大阪府大阪市浪速区木津川２丁目１番２５号,2025-03-07,株式会社
株式会社ＧＢＰラボラトリーズ,東京都中央区京橋３丁目１番１号東京スクエアガーデン６階シティラボ東京内,2025-03-07,株式会社
株式会社ＧＯＡＴ．Ｅ,千葉県市原市五井２２２３番地１アゾラーレ五井１０５,2025-03-07,株式会社
株式会社ＧＲＦ,愛知県名古屋市緑区大高町字江明９番地の７,2025-03-07,株式会社
株式会社ＧＴ,北海道深川市一已町字一已８３７１番地,2025-03-07,株式会社
株式会社ＧＵＸ,東京都港区芝５丁目三十六番四号札の辻スクエア９階,2025-03-07,株式会社
株式会社Ｇａｂｒｉｅｌ,東京都狛江市岩戸北１丁目１６番１０号,2025-03-07,株式会社
株式会社Ｇａｒｙ＆Ｋｅｎｎｙ,東京都目黒区碑文谷１丁目１３番６号,2025-03-07,株式会社
株式会社ＧｏｋｕＧｏｋｕ,東京都渋谷区恵比寿３丁目９－２９シェビア恵比寿２階ＲｅｌｉｃＳＱＵＡＲＥＺＥＲＯ,2025-03-07,株式会社
株式会社Ｈ・Ｓ,岩手県一関市赤荻字荻野２５５番地１１,2025-03-07,株式会社
株式会社Ｈ２Ｏ,東京都港区高輪４丁目１４番１－８０２号,2025-03-07,株式会社
株式会社ＨＡＮＡＤＯ,東京都豊島区千早１丁目１９番１２－１３０１号,2025-03-07,株式会社
株式会社ＨＯＭＩ,神奈川県横浜市南区弘明寺町２６７番地,2025-03-07,株式会社
株式会社Ｈａｒｖｅｓｔ,神奈川県伊勢原市岡崎５０６６番地,2025-03-07,株式会社
株式会社ＨｉｔｏＯｎｅ,愛知県名古屋市南区北内町３丁目１９番地－１０６号,2025-03-07,株式会社
株式会社Ｈｙｐａｇｅ,東京都渋谷区道玄坂１丁目１０番８号渋谷道玄坂東急ビル２Ｆ－Ｃ,2025-03-07,株式会社
株式会社ＩＧＡ五十嵐資産管理オフィス,東京都八王子市明神町１丁目９番４－３０１号第２カミュ八王子,2025-03-07,株式会社
株式会社ＩＫＤ,神奈川県横浜市中区本牧大里町１５番２号,2025-03-07,株式会社
株式会社ＩＴＳＵＷＡ　ｉｎｄｕｓｔｒｙ　ＪＡＰＡＮ,福岡県福岡市東区箱崎ふ頭３丁目３―１９,2025-03-07,株式会社
株式会社Ｊ＆Ｖ,愛知県豊田市昭和町１丁目６番地１０,2025-03-07,株式会社
株式会社ＪＡＮ　ＤＩＮＩＮＧ,東京都港区芝５丁目１９番６号ＢＩＡＳＴＡ・ＴＡＭＡＣＨＩ・ＭＩＴＡ３階,2025-03-07,株式会社
株式会社ＪＣ,東京都立川市砂川町８丁目５６番１号ラメール立川６０５,2025-03-07,株式会社
株式会社ＪＦハウジング,大阪府岸和田市東大路町２６８番地の７,2025-03-07,株式会社
株式会社ＪＦＲ＆ＫＯＭＥＨＹＯ　ＰＡＲＴＮＥＲＳ,東京都千代田区神田須田町１丁目２４番地４,2025-03-07,株式会社
株式会社ＪＯＡＭＯＡ,東京都新宿区大久保２丁目２番１７号新宿第３アルプスマンション５０１,2025-03-07,株式会社
株式会社ＪＯＳＨＯ,東京都板橋区三園１丁目４４番２８号,2025-03-07,株式会社
株式会社Ｊｏｙｎｔ３ｃｈ,東京都千代田区神田佐久間町２丁目１８番地１秋葉原ＳＴＮフロント１０階,2025-03-07,株式会社
株式会社Ｋ,大阪府大阪市都島区片町２丁目７番２６号１階,2025-03-07,株式会社
株式会社Ｋ,東京都世田谷区上馬５丁目３５番２５号ＪＬＢグランエクリュ三軒茶屋６０２,2025-03-07,株式会社
株式会社Ｋ‐ＴＯＰ,奈良県奈良市三条本町９番２１号,2025-03-07,株式会社
株式会社Ｋ＆Ｍ,東京都葛飾区西水元５丁目１０番２２号,2025-03-07,株式会社
株式会社Ｋ．Ｄ．Ｌａｂｏ．,滋賀県大津市錦織１丁目１９番４６号,2025-03-07,株式会社
株式会社ＫＡＩＳＥＮ,秋田県潟上市天王字追分西４３番地１,2025-03-07,株式会社
株式会社ＫＥＩ,埼玉県越谷市弥生町１７番２号グローリオ越谷ステーションタワー７０９号室,2025-03-07,株式会社
株式会社ＫＧ‐ＴＥＣ,北海道札幌市西区西町南２丁目３番１５－２０５号,2025-03-07,株式会社
株式会社ＫＩＭＩＤＯＲＩ,群馬県太田市由良町３５６番地１,2025-03-07,株式会社
株式会社ＫＭＧ,兵庫県川西市湯山台１丁目１番地の８,2025-03-07,株式会社
株式会社ＫＯＳＥＩ,茨城県坂東市借宿２８２番地２,2025-03-07,株式会社
株式会社ＫＯＴＯ,京都府京都市伏見区竹田北三ツ杭町４０番地３０１,2025-03-07,株式会社
株式会社ＫＯＹＯｓｏｌｕｔｉｏｎ,兵庫県朝来市山東町大月５１４番地１,2025-03-07,株式会社
株式会社ＫＲＡ,東京都渋谷区神宮前３丁目３４番６号,2025-03-07,株式会社
株式会社ＫＳプランニング,東京都立川市栄町５丁目３４番地の１４,2025-03-07,株式会社
株式会社ＫＳＫ,東京都品川区八潮５丁目５番３号,2025-03-07,株式会社
株式会社ＫＵＲＡ,東京都新宿区中落合２丁目１６番７号コアロード目白西坂１０６,2025-03-07,株式会社
株式会社ＫＵＳＵＢＵＲＩ,東京都目黒区五本木１丁目７番７号フェリクス五本木１０６,2025-03-07,株式会社
株式会社Ｋａｕ’ｎ’ｓｅｌ,東京都国分寺市泉町１丁目５番１６号,2025-03-07,株式会社
株式会社Ｋｅｅｐ　Ｆｏｒｗａｒｄ,長崎県長崎市網場町４９２番地１－３０２号,2025-03-07,株式会社
株式会社ＫｉＫｕ　Ｌａｂ,京都府宮津市字上世屋４８５番地,2025-03-07,株式会社
株式会社ＬＥＡＴＨＥＲ　ＷＯＲＫＳ,愛知県名古屋市中区大須２丁目１８番３６号,2025-03-07,株式会社
株式会社Ｌｉａｎ,熊本県熊本市中央区帯山２丁目１番２３号パークヒル帯山Ｂ３０１,2025-03-07,株式会社
株式会社Ｌｉｇｈｔｈｏｕｓｅ,東京都港区赤坂５丁目２番３３－５０３号,2025-03-07,株式会社
株式会社Ｌｉｔｅ,愛知県名古屋市中川区四女子町１丁目２２番地,2025-03-07,株式会社
株式会社Ｌｕｃｅ,東京都渋谷区神南１丁目１１－４ＦＰＧリンクス神南５階,2025-03-07,株式会社
株式会社ＬｕｌｕＳｔｅｌｌａ,東京都渋谷区西原２丁目１５番２号ツインハウス０００１,2025-03-07,株式会社
株式会社Ｍ．Ｋ,熊本県熊本市中央区島崎１丁目３番５号,2025-03-07,株式会社
株式会社ＭＡＲＵＴＳＵＧＩ,東京都江東区白河２丁目１４番２－３０７号,2025-03-07,株式会社
株式会社ＭＡＹＵＴＡＫＡ,千葉県千葉市美浜区中瀬１丁目３番地幕張テクノガーデンＣＢ棟３階,2025-03-07,株式会社
株式会社ＭＣ,東京都渋谷区鶯谷町１３番１号ラ・トゥール代官山Ｊ－２０２,2025-03-07,株式会社
株式会社ＭＥＤＩＡ　ＢＵＺＺ,東京都豊島区目白４丁目２番１２号オープンレジデンシア目白１０１,2025-03-07,株式会社
株式会社ＭＥＬ,茨城県つくば市学園の森３丁目１２番地１０－Ａ１０１,2025-03-07,株式会社
株式会社ＭＨＫエンタープライズ,福岡県福岡市西区大字女原４５１番地１,2025-03-07,株式会社
株式会社ＭＪアセットマネジメント,愛知県高浜市屋敷町４丁目８番地８,2025-03-07,株式会社
株式会社ＭＫ３号,東京都港区三田５丁目１７番１２号３０２,2025-03-07,株式会社
株式会社ＭＵＭ,愛知県名古屋市中村区名駅４丁目２４番１６号広小路ガーデンアベニュー３階・４階,2025-03-07,株式会社
株式会社Ｍｉｅｌｉ,山梨県南都留郡富士河口湖町富士ヶ嶺１番地７４０,2025-03-07,株式会社
株式会社ＭｉｌｌＣ,東京都世田谷区等々力２丁目１８番１５号,2025-03-07,株式会社
株式会社Ｎ　ａｉｒｓｙｓｔｅｍ,大阪府和泉市山荘町３丁目８番２６号,2025-03-07,株式会社
株式会社ＮＡＧＩ,東京都江東区豊洲６丁目２番２９－１００９号,2025-03-07,株式会社
株式会社ＮＡＫＡＹＡＭＡ,茨城県稲敷郡美浦村大字信太２８２９番地１,2025-03-07,株式会社
株式会社ＮＡＲＡ　ＮＥＸＴ　ＦＡＣＴＯＲＹ,奈良県奈良市小西町２５番地の１ファインフラッツ奈良ザ・レジデンス２１８号,2025-03-07,株式会社
株式会社ＮＥＸＴ　ＩＮＮＯＶＡＴＩＯＮ,岐阜県可児市下恵土５６３６番地１ＡＫビル２０１,2025-03-07,株式会社
株式会社ＮＧＴＧ１１,東京都渋谷区渋谷１丁目３－１８ビラ・モデルナＡ４０２,2025-03-07,株式会社
株式会社ＮＧＴＧ１２,東京都渋谷区渋谷１丁目３－１８ビラ・モデルナＡ４０２,2025-03-07,株式会社
株式会社ＮＧＴＧ１３,東京都渋谷区渋谷１丁目３－１８ビラ・モデルナＡ４０２,2025-03-07,株式会社
株式会社ＮＧＴＧ１４,東京都渋谷区渋谷１丁目３－１８ビラ・モデルナＡ４０２,2025-03-07,株式会社
株式会社ＮＫメンテ,大阪府堺市堺区賑町３丁４番３号,2025-03-07,株式会社
株式会社Ｎｅｏ　Ｗｏｒｋｓ,奈良県磯城郡田原本町大字阪手６４３番地２,2025-03-07,株式会社
株式会社Ｎｅｘｕｓ　ＦｒｏｎｔｉｅｒＴｅｃｈ,東京都千代田区大手町１丁目６番１号大手町ビル４Ｆ,2025-03-07,株式会社
株式会社ＮｉＤＵＳ,東京都港区西新橋３丁目２５番８号東京慈恵会医科大学先端医療情報技術研究部内,2025-03-07,株式会社
株式会社Ｎｉｃｏ　ａｎｄ　Ｅｓｔａｔｅ,東京都中央区銀座１丁目１２番４号Ｎ＆ＥＢＬＤ．６Ｆ,2025-03-07,株式会社
株式会社Ｎｉｈｏｎ　Ｂｒｉｃｋｓ,京都府京都市上京区七本松通一条下る三軒町７１番地１３コーポラス北野９０８,2025-03-07,株式会社
株式会社Ｏ．Ｌ．Ｔ,福島県郡山市香久池１丁目８－１３,2025-03-07,株式会社
株式会社ＯＦＧ,熊本県熊本市中央区安政町１番２０号テイコビル地下１階,2025-03-07,株式会社
株式会社ＯＨデジタルパートナーズ,東京都中央区銀座６丁目１０番１号,2025-03-07,株式会社
株式会社ＯＫＡＺＡＫＩ,香川県綾歌郡宇多津町浜三番丁３５－２ルベール宇多津Ｉ－２０３,2025-03-07,株式会社
株式会社ＯＮ,大阪府大阪市中央区南船場３丁目４番２２号東道ビル９階,2025-03-07,株式会社
株式会社ＯＮＥ　ＬＩＦＥ,大阪府大阪市北区堂島２丁目４番４号,2025-03-07,株式会社
株式会社ＯＮＥＴＥＮ,東京都江戸川区本一色３丁目３５番１４号,2025-03-07,株式会社
株式会社ＯＴＡＫ,東京都渋谷区東１丁目１１番３号ウッドハウス５０１号室,2025-03-07,株式会社
株式会社ＯＵＴＩＮ　ＦＵＴＵＲＥＳ　ＪＡＰＡＮ,大阪府大阪市住之江区南港北２丁目１番１０号,2025-03-07,株式会社
株式会社ＯｎｅＬｉｆｅ,長野県北佐久郡軽井沢町大字長倉２４８４番地１５,2025-03-07,株式会社
株式会社ＰＡＩＮＴ　Ｏｌｌｉｅ,長野県松本市横田４丁目２２番４号,2025-03-07,株式会社
株式会社ＰＡＬＵＰ,千葉県成田市宗吾４丁目１９番７,2025-03-07,株式会社
株式会社ＰＩＶＯＴＩＱ,東京都渋谷区渋谷２丁目１９－１５宮益坂ビルディング６０９,2025-03-07,株式会社
株式会社ＰＯＬ総合防災,神奈川県海老名市下今泉４丁目４番１１－３号,2025-03-07,株式会社
株式会社Ｐｅｏｐｌｅ　Ｓｅｅｄ,東京都渋谷区渋谷１丁目１番５号,2025-03-07,株式会社
株式会社ＰｉｖｏｔＬａｂ,東京都新宿区大久保２丁目９－１５ＮＩＤＯ西早稲田４０４,2025-03-07,株式会社
株式会社Ｐｒｏｔｅｃｔ,東京都港区赤坂３丁目１４番３号渡林赤坂ビル５階,2025-03-07,株式会社
株式会社ＲＡ,東京都江戸川区中葛西４丁目１５番６号プラザエノモトⅢ３０６号室,2025-03-07,株式会社
株式会社ＲＡＩＫ,熊本県熊本市中央区中央街３番１－３０２号,2025-03-07,株式会社
株式会社ＲＢＹ,東京都港区白金６丁目２３番３号ＷＡＴＯＲＥＩ白金８０２,2025-03-07,株式会社
株式会社ＲＥＢＣＲＯ,大阪府大阪市中央区南久宝寺町１丁目９－１０日宝船場ビル７階,2025-03-07,株式会社
株式会社ＲＥＮＯＬＡＢＯ,東京都台東区寿１丁目２１番１１号パレ・ドール浅草９０２号,2025-03-07,株式会社
株式会社ＲＥＶＩＶＡＬ,東京都墨田区京島２丁目１１番３号京島第２ビル１階,2025-03-07,株式会社
株式会社ＲＥＷＩＬＤ,東京都国分寺市南町３丁目４番１１号ハイネス国分寺ルミエール８０３,2025-03-07,株式会社
株式会社ＲＭＣ,神奈川県横浜市港北区新吉田東６丁目３３番３７号,2025-03-07,株式会社
株式会社ＲＳ,千葉県市原市八幡９９６番地１３クイーンズレゾン八幡宿３０２号室,2025-03-07,株式会社
株式会社Ｒｅｎａｒｄ,東京都北区滝野川６丁目３２番１４号えんぷらす滝野川３０５号,2025-03-07,株式会社
株式会社Ｒｕｂｉｃｏｎ９,東京都世田谷区玉川４丁目２６番６号,2025-03-07,株式会社
株式会社Ｓ２Ｒ,東京都千代田区三番町９番地１麹町三番町マンション５１６,2025-03-07,株式会社
株式会社ＳＡＮＴＡ,奈良県奈良市今在家５０－１,2025-03-07,株式会社
株式会社ＳＡＴＯＳＨＩ　ＯＴＳＵＫＩ,東京都渋谷区宇田川町７番１７,2025-03-07,株式会社
株式会社ＳＥＴＯＵＣＨＩ　ＨＵＢ,広島県三原市港町１丁目１０番３１号Ｊパレット三原港町３Ｆ,2025-03-07,株式会社
株式会社ＳＫＯプランニング,大阪府八尾市沼１丁目６８番地の６５朝日プラザシティ八尾南２番館３０９号,2025-03-07,株式会社
株式会社ＳＯＫＥＮ,大阪府泉南郡熊取町大宮３丁目７０４番地の１６,2025-03-07,株式会社
株式会社ＳＲＭ,京都府向日市寺戸町八ノ坪１２９番地プレサンスロジェ洛西口ザ・レジデンス１００１,2025-03-07,株式会社
株式会社ＳＴＵＤＩＯ　ＭＩＳＰＡ,愛知県豊田市水源町５丁目２５番地９,2025-03-07,株式会社
