法人名,住所,設立日,法人種別
ドラゴンクラーウド合同会社,東京都中央区銀座１丁目１２－４Ｎ＆ＥＢＬＤ７Ｆ,2025-03-14,合同会社
ニチメ株式会社,東京都千代田区神田佐久間町３丁目３８－２０１,2025-03-14,株式会社
ニューレジェンドジャパン株式会社,和歌山県和歌山市梅原５７９番地８,2025-03-14,株式会社
ネオサンライズ株式会社,東京都港区虎ノ門２丁目６番１号虎ノ門ヒルズステーションタワー１９階,2025-03-14,株式会社
ネオパス株式会社,埼玉県さいたま市南区大字大谷口５４５０番地７,2025-03-14,株式会社
ハグム株式会社,大阪府大阪市中央区安土町２丁目３番１３号大阪国際ビルディング３１階,2025-03-14,株式会社
パワーリフト株式会社,北海道札幌市南区藤野二条５丁目８番６号スイートＣ,2025-03-14,株式会社
ピッコラルーチェ株式会社,岐阜県大垣市外渕２丁目１５７番地２セジュール近藤１０７,2025-03-14,株式会社
フィクシー株式会社,埼玉県川口市大字差間３４６番地１,2025-03-14,株式会社
フェザーストーンワールドツアー合同会社,東京都港区浜松町２丁目７番１７号イーグル浜松町ビル５６４,2025-03-14,合同会社
フード・アンド・テック合同会社,東京都中央区日本橋室町１丁目１１番１２号日本橋水野ビル７階,2025-03-14,合同会社
プラネット合同会社,東京都大田区新蒲田２丁目２１番１７号コーポＮＳ１０３,2025-03-14,合同会社
ヘリテージシンフォニア株式会社,東京都江戸川区松島３丁目４５番９号,2025-03-14,株式会社
マジェスティック合同会社,北海道札幌市中央区南二条西５丁目３１－１ＲＭＢｌｄ．７０１,2025-03-14,合同会社
モスラズ合同会社,神奈川県足柄下郡箱根町宮城野１３４５番地の５９,2025-03-14,合同会社
モニングライト株式会社,東京都新宿区高田馬場１丁目２６番１２号高田馬場ビル５０３号,2025-03-14,株式会社
ライフサポートコネクト株式会社,広島県三次市南畑敷町５５７番地２,2025-03-14,株式会社
ライフヴァーチュ株式会社,神奈川県川崎市多摩区登戸２番地３,2025-03-14,株式会社
ラストマイル株式会社,東京都中央区銀座１丁目１２－４Ｎ＆ＥＢＬＤ．７階,2025-03-14,株式会社
リコネスト株式会社,東京都品川区南品川５丁目１６－７Ｕ－ｍａｋｅ南品川１Ｆ,2025-03-14,株式会社
リブレード合同会社,新潟県小千谷市大字小粟田７０９番地１,2025-03-14,合同会社
リングスオン株式会社,東京都杉並区荻窪３丁目７番５２号シティテラス荻窪ブリーズコート１０４,2025-03-14,株式会社
リードアセット株式会社,東京都板橋区南常盤台１丁目２３番６－５１２号,2025-03-14,株式会社
ルーラルネクスト株式会社,熊本県山鹿市山鹿１３６４番地３,2025-03-14,株式会社
ロイハーベスト株式会社,東京都港区南青山２丁目２番１５号ＷｉｎＡｏｙａｍａビルＵＦＣ６階,2025-03-14,株式会社
ワークアンドピープル株式会社,東京都中央区銀座１丁目１５－４ヒューリック銀座一丁目昭和通りビル７階,2025-03-14,株式会社
ヴィアッジ株式会社,東京都新宿区西新宿６丁目５番１号新宿アイランドタワー２階,2025-03-14,株式会社
一合株式会社,東京都江戸川区本一色１丁目２４－２１,2025-03-14,株式会社
一般社団法人あかり,大阪府大阪市此花区高見３丁目１８番１８号,2025-03-14,その他の設立登記法人
一般社団法人そらの木,新潟県新発田市本町２丁目１番２号,2025-03-14,その他の設立登記法人
一般社団法人オペラワーク機構,神奈川県横浜市緑区長津田４丁目１７番４９号,2025-03-14,その他の設立登記法人
一般社団法人ジュニアゴルフサポート協会,東京都千代田区二番町９番地３ＴＨＥＢＡＳＥ麹町,2025-03-14,その他の設立登記法人
一般社団法人ソリスメディカル,北海道札幌市東区北六条東３丁目１番地１ダ・ヴィンチモール２階,2025-03-14,その他の設立登記法人
一般社団法人バンソー,群馬県前橋市上大屋町３９２番地３,2025-03-14,その他の設立登記法人
一般社団法人フリースクールサルドゥ,青森県青森市安方２丁目１６番１３号Ｙスポットビル４階Ｂ,2025-03-14,その他の設立登記法人
一般社団法人ベンガル・ワン,東京都千代田区内幸町２丁目１番６号,2025-03-14,その他の設立登記法人
一般社団法人ミドルシニア・セルフ・エンパワメント協会,東京都千代田区内神田１丁目９番１３号,2025-03-14,その他の設立登記法人
一般社団法人健康共生連,東京都千代田区神田和泉町１番地６－１６ヤマトビル４０５,2025-03-14,その他の設立登記法人
一般社団法人分子情報解析技術機構,東京都港区南青山３丁目１番３６号青山丸竹ビル６Ｆ,2025-03-14,その他の設立登記法人
一般社団法人埼玉県野球協議会,埼玉県所沢市大字上山口２１３５,2025-03-14,その他の設立登記法人
一般社団法人学びあいｋｉｄｓ舎設立基金,愛知県一宮市木曽川町黒田二ノ通り５３番地,2025-03-14,その他の設立登記法人
一般社団法人日本梁山泊,東京都文京区湯島２丁目１番１１号サンビル２０１号室,2025-03-14,その他の設立登記法人
一般社団法人日本民間救急支援機構,大阪府大阪市淀川区西中島６丁目３番２４号Ｋ４０９,2025-03-14,その他の設立登記法人
一般社団法人日本糸リフト協会,東京都渋谷区恵比寿西２丁目２１番４号,2025-03-14,その他の設立登記法人
一般社団法人流星,東京都千代田区内神田１丁目３番７号４０１あすな会計事務所内,2025-03-14,その他の設立登記法人
一般社団法人羊飼いのともしび,福島県相馬市尾浜字札ノ沢５８番地の３１,2025-03-14,その他の設立登記法人
一般社団法人脳血管内治療技術と機器研究会,大阪府大阪市中央区法円坂２丁目１番１４号,2025-03-14,その他の設立登記法人
一般社団法人関西臨床動作学研究会,京都府京都市西京区松室吾田神町１１７ＡＲＲＩＢＡ４０６,2025-03-14,その他の設立登記法人
一般社団法人香里園,大阪府八尾市志紀町１丁目１１８番地,2025-03-14,その他の設立登記法人
一般社団法人２７メディカルプラス,東京都中央区銀座７丁目１６番１５号清月堂本店ビル７０２,2025-03-14,その他の設立登記法人
一般社団法人Ｂａｌｌｅｒｓ　Ｌａｂ,新潟県新潟市東区浜谷町１丁目１番７４号,2025-03-14,その他の設立登記法人
一般社団法人ＥＡＲＴＨＬＩＮＧ,東京都渋谷区道玄坂２丁目１８番１１－６０３号,2025-03-14,その他の設立登記法人
一般社団法人Ｉｎｔｅｒｎａｔｉｏｎａｌ　ＨＡＤＯ　Ｆｅｄｅｒａｔｉｏｎ,東京都港区台場１丁目７番１号,2025-03-14,その他の設立登記法人
一般社団法人Ｋｏｒｕ　Ｎａｔｕｒｅ　Ｄｅｓｉｇｎ,神奈川県足柄上郡山北町岸１８７９番地４,2025-03-14,その他の設立登記法人
一般社団法人ＬＶＣ２４号,東京都千代田区紀尾井町３－８第２紀尾井町ビル９０１アクシス綜合会計事務所内,2025-03-14,その他の設立登記法人
一般社団法人ＬＶＣ２５号,東京都千代田区紀尾井町３－８第２紀尾井町ビル９０１アクシス綜合会計事務所内,2025-03-14,その他の設立登記法人
一般社団法人ＬＶＣ２６号,東京都千代田区紀尾井町３－８第２紀尾井町ビル９０１アクシス綜合会計事務所内,2025-03-14,その他の設立登記法人
一般社団法人ＬＶＣ２７号,東京都千代田区紀尾井町３－８第２紀尾井町ビル９０１アクシス綜合会計事務所内,2025-03-14,その他の設立登記法人
一般社団法人ＬＶＣ２８号,東京都千代田区紀尾井町３－８第２紀尾井町ビル９０１アクシス綜合会計事務所内,2025-03-14,その他の設立登記法人
一般社団法人Ｍｉｎｅｒａｌｓ,東京都青梅市二俣尾３丁目８４４番地,2025-03-14,その他の設立登記法人
一般社団法人ＲＥＳＣＵＥ‐１,大阪府大阪市北区梅田１丁目１－３大阪駅前第３ビル２９階１－１－１号室,2025-03-14,その他の設立登記法人
一般社団法人ＳＵＰＯＰＯ　ＣＵＬＴＵＲＥ　ＨＡＰＰＩＮＥＳＳ,富山県砺波市大門４８０番地,2025-03-14,その他の設立登記法人
一般財団法人ウイルス感染予防研究所,奈良県橿原市東坊城町５０５番地,2025-03-14,その他の設立登記法人
一芮株式会社,東京都大田区東海３丁目７番３号東海ビル３０７室,2025-03-14,株式会社
万融通商株式会社,大阪府大阪市東淀川区下新庄４丁目２０番７号３０５号室,2025-03-14,株式会社
三光合同会社,静岡県磐田市東小島２１４番地,2025-03-14,合同会社
三共アドマーケティング株式会社,東京都新宿区新宿１丁目３６番２号,2025-03-14,株式会社
三栄株式会社,神奈川県海老名市本郷２３４８番地の２,2025-03-14,株式会社
下館通信合同会社,茨城県筑西市玉戸１３３６番地１４６,2025-03-14,合同会社
両馬株式会社,埼玉県所沢市西所沢１丁目１６番１７号,2025-03-14,株式会社
中原板金株式会社,宮崎県北諸県郡三股町大字樺山４７１８番地８,2025-03-14,株式会社
中山研究所株式会社,東京都港区南青山３丁目１番３６号青山丸竹ビル６Ｆ,2025-03-14,株式会社
久勝合同会社,東京都港区虎ノ門４丁目１－２０－９０１,2025-03-14,合同会社
亀井商事株式会社,京都府京都市右京区花園巽南町１７番地,2025-03-14,株式会社
五輪ホールディングス株式会社,東京都葛飾区東新小岩６丁目２１番１－５０９号トミンハイム東新小岩六丁目,2025-03-14,株式会社
企業組合ｍａｎｎａ,山口県周南市本町２丁目１４番地,2025-03-14,その他の設立登記法人
信企画株式会社,東京都荒川区東日暮里４丁目８番６－６０２号,2025-03-14,株式会社
加藤ファシリティデザイン合同会社,埼玉県所沢市西所沢２丁目９番１２号,2025-03-14,合同会社
医療法人ありた眼科,山口県下関市長府中土居北町４番７号,2025-03-14,その他の設立登記法人
医療法人一心会,長崎県佐世保市陣の内町３７６番地１,2025-03-14,その他の設立登記法人
医療法人七彦会,愛知県名古屋市港区七反野１丁目９０１番地,2025-03-14,その他の設立登記法人
医療法人大口眼科クリニック,北海道札幌市中央区北二条西２８丁目１番２６号エストラーダ円山２Ｆ,2025-03-14,その他の設立登記法人
医療法人太平会,神奈川県藤沢市辻堂太平台１丁目３番２号１階,2025-03-14,その他の設立登記法人
医療法人岩段会,長野県伊那市日影３８０番１,2025-03-14,その他の設立登記法人
医療法人社団おはぎ,東京都文京区千駄木２丁目８番５号１階,2025-03-14,その他の設立登記法人
医療法人社団悠希会,岡山県岡山市北区大元１丁目１１－１,2025-03-14,その他の設立登記法人
医療法人社団瑞珠会,東京都国立市東１丁目８番地の６国立メディカルセンター２０２号室,2025-03-14,その他の設立登記法人
医療法人社団輝晟会,神奈川県横浜市神奈川区大口通３０番地の３,2025-03-14,その他の設立登記法人
医療法人社団麓翠会,東京都新宿区高田馬場１丁目５番１０号,2025-03-14,その他の設立登記法人
医療法人社団ＦＵ‐ＷＡ,東京都品川区上大崎２丁目１３番２６号メイプルトップビル３階,2025-03-14,その他の設立登記法人
医療法人肩とひざの匠,愛知県名古屋市中川区中野新町５丁目３９,2025-03-14,その他の設立登記法人
医療法人進愛会,三重県津市鳥居町２７８番地６,2025-03-14,その他の設立登記法人
南港東住宅管理組合法人,大阪府大阪市住之江区南港東１丁目７番２２号南港東住宅管理組合事務所,2025-03-14,その他の設立登記法人
司法書士法人平野事務所,東京都新宿区西新宿４丁目３２番１２号西新宿フォレストビル４階,2025-03-14,その他の設立登記法人
合同会社ちょこほぐ,東京都渋谷区代々木２丁目３８番３号,2025-03-14,合同会社
合同会社とっかーた,兵庫県明石市明南町１丁目１－１１,2025-03-14,合同会社
合同会社のりしお,東京都中央区日本橋室町１丁目１１番１２号日本橋水野ビル７階,2025-03-14,合同会社
合同会社ぷれあ,福岡県北九州市八幡西区則松１丁目３番１１号プラゾオリジンＡ１０２号室,2025-03-14,合同会社
合同会社ぺんごん,茨城県ひたちなか市栄町１丁目９－３４シャルマンハイツ２０１,2025-03-14,合同会社
合同会社まごのて,東京都千代田区神田和泉町一丁目６番１６号ヤマトビル４０５,2025-03-14,合同会社
合同会社まるかり,岐阜県下呂市久野川１２６３番地,2025-03-14,合同会社
合同会社わか,東京都大田区蒲田５丁目２８番４号ＥＣＳ第２７ビル３階,2025-03-14,合同会社
合同会社アンビシャス,東京都新宿区四谷坂町１２番１５－１２０１号,2025-03-14,合同会社
合同会社イノベーションラボ,東京都日野市日野本町４丁目６番５号,2025-03-14,合同会社
合同会社エイムハイ,山口県山口市道場門前１丁目３番８号グレイステラス道場門前１階,2025-03-14,合同会社
合同会社エコグラム,佐賀県三養基郡みやき町大字白壁４１５２－１,2025-03-14,合同会社
合同会社クリエイト,神奈川県綾瀬市上土棚北３丁目１８番３３号ハイツサンライズ２０１,2025-03-14,合同会社
合同会社コスモス,北海道滝川市空知町２丁目５番２１号,2025-03-14,合同会社
合同会社サザンビーチ・キャピタル,東京都品川区上大崎３丁目１２番１４号,2025-03-14,合同会社
合同会社サヴィ総研,大阪府藤井寺市岡１丁目７番１０－８０７号,2025-03-14,合同会社
合同会社シュクレ,新潟県新潟市西区五十嵐２の町８０５０産学連携共同研究棟１号棟ＮＯＴＴＨＥＵＮＩＶＥＲＳＩＴＹ,2025-03-14,合同会社
合同会社ジョニー・デップ,茨城県日立市小木津町１丁目１４－１１,2025-03-14,合同会社
合同会社スマートカンパニー,兵庫県西宮市東鳴尾町２丁目１４－７アプロビル１Ｆ,2025-03-14,合同会社
合同会社ゼンシン貿易,大阪府大阪市淀川区宮原２丁目１４番１９号酒井文化２０３室,2025-03-14,合同会社
合同会社タカノ,千葉県市川市南行徳１丁目１６番２５号,2025-03-14,合同会社
合同会社ツナグ,東京都中央区日本橋室町１丁目１１番１２号日本橋水野ビル７階,2025-03-14,合同会社
合同会社ティーエヌシー,東京都中央区銀座１丁目２２番１１号銀座大竹ビジデンス２Ｆ,2025-03-14,合同会社
合同会社ティーマイナス,奈良県香芝市関屋２９番地,2025-03-14,合同会社
合同会社テクノデベロップメント,東京都国分寺市光町１丁目１８番地４,2025-03-14,合同会社
合同会社ハッピーベジフル,東京都葛飾区白鳥１丁目２－１３,2025-03-14,合同会社
合同会社ハナトケイ,岩手県盛岡市山岸１丁目４－２４ハウス山岸３１２号室,2025-03-14,合同会社
合同会社ヒビラボ,宮崎県宮崎市大字新名爪２１３２番地１,2025-03-14,合同会社
合同会社フォレストチャージ,東京都千代田区二番町５番地２５,2025-03-14,合同会社
合同会社フォワードスピリット,北海道札幌市中央区南二十四条西１１丁目２番３３－２０３号,2025-03-14,合同会社
合同会社フォーキッズマネジメント,北海道旭川市八条通１１丁目２１９１番地の３８５,2025-03-14,合同会社
合同会社フジ,東京都練馬区立野町１０番１号早川ビル１階,2025-03-14,合同会社
合同会社フリージア,神奈川県横浜市神奈川区金港町５番地１４クアドリフォリオ８階,2025-03-14,合同会社
合同会社ベティのアトリエ,神奈川県横浜市金沢区釜利谷東７丁目１２番２６－２号,2025-03-14,合同会社
合同会社マイライツ,宮城県栗原市瀬峰清水山１５番地１５,2025-03-14,合同会社
合同会社マシュマロ,大阪府守口市八雲東町２丁目７４番１７号,2025-03-14,合同会社
合同会社マスターマインド,東京都あきる野市野辺３６７番地２,2025-03-14,合同会社
合同会社マーラ・アンジュ,大阪府吹田市江の木町２番３２,2025-03-14,合同会社
合同会社ミライ樹スタイル,東京都港区南青山３丁目１番３６号青山丸竹ビル６Ｆ,2025-03-14,合同会社
合同会社メノジム,東京都港区南青山１丁目１７番１６号１０２,2025-03-14,合同会社
合同会社メルシー,京都府与謝郡与謝野町字幾地５３３－７,2025-03-14,合同会社
合同会社モテモテ,東京都品川区豊町６丁目２番４号,2025-03-14,合同会社
合同会社リンクス,石川県鳳珠郡能登町字姫７字１７番地,2025-03-14,合同会社
合同会社レインリリー,大阪府豊中市東寺内町２番２４‐９０２号,2025-03-14,合同会社
合同会社ワンダフルジャーニー,東京都中央区築地７丁目１６番６,2025-03-14,合同会社
合同会社一心,千葉県柏市高柳６３０番地,2025-03-14,合同会社
合同会社優彩グループＹＳＧ,三重県桑名市大字赤須賀２１３２番地,2025-03-14,合同会社
合同会社唯ｋｉｔｃｈｅｎ,沖縄県島尻郡北大東村字港１６番地の５,2025-03-14,合同会社
合同会社喜成,東京都墨田区江東橋２丁目６番１４号,2025-03-14,合同会社
合同会社大黒屋,大阪府岸和田市西之内町３１番１２号,2025-03-14,合同会社
合同会社小林組,大阪府茨木市小柳町１１番１９号,2025-03-14,合同会社
合同会社尾上コンサルティング,香川県高松市今里町４０１番地１Ｉ・Ｓ・ＳＱＵＡＲＥ２階１号室,2025-03-14,合同会社
合同会社星団,静岡県島田市中河９９８番地の１,2025-03-14,合同会社
合同会社春はあけぼの,東京都日野市栄町１丁目２番地の１七和ビル１０１,2025-03-14,合同会社
合同会社晴耕,東京都世田谷区喜多見７丁目６―３,2025-03-14,合同会社
合同会社望見ヶ丘,山口県山陽小野田市大字丸河内１３４１番地１４,2025-03-14,合同会社
合同会社来喜,神奈川県川崎市川崎区砂子２丁目８番地１シャンボール川崎砂子７１１,2025-03-14,合同会社
合同会社楽市楽座,宮崎県宮崎市太田４丁目２－１５Ｆステージ南宮崎５０３,2025-03-14,合同会社
合同会社波,福井県福井市福町３６－１０７－１,2025-03-14,合同会社
合同会社睦,富山県射水市大門２６９番地,2025-03-14,合同会社
合同会社神奈川モータース,神奈川県横浜市泉区中田町３４６２－５７,2025-03-14,合同会社
合同会社福堂産,東京都品川区東品川４丁目５－８－８１０,2025-03-14,合同会社
合同会社結担人,岩手県盛岡市渋民字岩鼻６９番地１６６,2025-03-14,合同会社
合同会社藤野,東京都渋谷区道玄坂１丁目１０番８号渋谷道玄坂東急ビル２Ｆ－Ｃ,2025-03-14,合同会社
合同会社陽月,東京都渋谷区道玄坂１丁目１０番８号渋谷道玄坂東急ビル２Ｆ－Ｃ,2025-03-14,合同会社
合同会社青葉医科歯科コンサルティング,宮城県仙台市青葉区滝道３７番１号,2025-03-14,合同会社
合同会社飛翔,広島県福山市千田町１丁目５番１３号,2025-03-14,合同会社
合同会社１３５ｏ,兵庫県明石市魚住町西岡４７４番地の１１,2025-03-14,合同会社
合同会社２４ＤＡＹｓ,東京都大田区久が原４丁目３６番９号,2025-03-14,合同会社
合同会社８ｅｄ　Ｓｔｕｄｉｏ,大阪府岸和田市下松町９９９番地,2025-03-14,合同会社
合同会社Ａ,広島県福山市三吉町１丁目８番２７－６号,2025-03-14,合同会社
合同会社ＡＤＳ,青森県上北郡おいらせ町上久保６２－１１２,2025-03-14,合同会社
合同会社ＡＳＫ,大阪府和泉市いぶき野４丁目５番９－１２０９号,2025-03-14,合同会社
合同会社ＡＸＥＬ,兵庫県神戸市中央区磯辺通１丁目１番１８号カサベラ国際プラザビル７０７号室,2025-03-14,合同会社
合同会社Ａｍａｒｙｌｌｉｓ,大阪府大阪市浪速区難波中１丁目１６－１１レック難波ビル８０１,2025-03-14,合同会社
合同会社ＢＲＡＨ,東京都三鷹市上連雀２丁目７番２１号,2025-03-14,合同会社
合同会社ＢＲＩＧＨＩＤ,神奈川県大和市深見１５５番地,2025-03-14,合同会社
合同会社ＣＯＹＡ,北海道勇払郡占冠村字占冠６３５‐１,2025-03-14,合同会社
合同会社Ｃｙａｅｇｉｓ,東京都港区北青山１丁目３－３三橋ビル３階,2025-03-14,合同会社
合同会社Ｄｒ．Ｓｈｕ　Ｏｆｆｉｃｅ,静岡県静岡市清水区殿沢１丁目１番７－２号,2025-03-14,合同会社
合同会社ＥＩＺＯ,東京都大田区西馬込１丁目３３番１３号,2025-03-14,合同会社
合同会社Ｆａｒｍｏｔ,東京都中央区銀座１丁目２２番１１号銀座大竹ビジデンス２Ｆ,2025-03-14,合同会社
合同会社Ｆｒｅｅｓｉａ,東京都千代田区神田須田町１丁目７－８ＶＯＲＴ秋葉原Ⅳ２階,2025-03-14,合同会社
合同会社ＨＡＲＵ,山口県萩市大字平安古町２８７番地の３,2025-03-14,合同会社
合同会社ＨＢ,埼玉県さいたま市中央区上落合２丁目６番１－１６０６号,2025-03-14,合同会社
合同会社ＨＱ　Ｃｏｓｍｅｔｉｃ,大阪府大阪市西成区天神ノ森１丁目８－１１ＮＴＨＯＵＳＥ２０１号,2025-03-14,合同会社
合同会社ＨｅａｒｔｙＷｏｒｌｄ,東京都港区港南２丁目１５番１号品川インターシティＡ棟２８階,2025-03-14,合同会社
合同会社Ｈｙｐｅｒｉｏｎ,神奈川県厚木市中町２丁目７番１８号２Ｆ,2025-03-14,合同会社
合同会社ＩＣ　ＲｅＨＯＭＥ,東京都八王子市西寺方町３３０－１スパーブＡ１０４,2025-03-14,合同会社
合同会社ＪＩＮＤＯＵ　ＣＲＥＡＴＩＯＮ,石川県鳳珠郡能登町字瑞穂１８字院内８３番地,2025-03-14,合同会社
合同会社Ｋ＆Ａ,岐阜県飛騨市神岡町殿１０８１番地２,2025-03-14,合同会社
合同会社Ｋ２Ｍ,埼玉県川口市元郷１丁目１番２１－４０１号,2025-03-14,合同会社
合同会社ＫＩＢＯ,新潟県新潟市秋葉区矢代田１９７２,2025-03-14,合同会社
合同会社ＬＯＴＵＳ,神奈川県横浜市都筑区茅ケ崎東３丁目１６番８号,2025-03-14,合同会社
合同会社Ｌｅ　Ｌｉｅｎ,福島県福島市野田町３丁目３‐４１アネックス野田２０３,2025-03-14,合同会社
合同会社Ｍ’ｓ,群馬県高崎市緑町２丁目１３番地１１,2025-03-14,合同会社
合同会社Ｍ’ｓ　Ｐａｉｎｔ,茨城県鹿嶋市旭ケ丘１丁目２２番地１２ジュネス玉村１０１,2025-03-14,合同会社
合同会社ＭＯＭＯＨＡＮＡ,山口県下関市みもすそ川町３番１８号,2025-03-14,合同会社
合同会社ＭＯＶＥ,愛知県豊川市美和通１丁目１５番地の３,2025-03-14,合同会社
合同会社ＭＵＨＡＭＭＡＤ　ＩＮＴＥＲＮＡＴＩＯＮＡＬ,神奈川県相模原市南区磯部１６６番地１,2025-03-14,合同会社
合同会社Ｍｙ　Ｓｔｏｎｅ,神奈川県川崎市幸区中幸町３丁目２６番地２４クレッセント川崎タワー３００８,2025-03-14,合同会社
合同会社ＮＥＣＲ,静岡県静岡市葵区紺屋町４番地の１０旅館会館ビル２階,2025-03-14,合同会社
合同会社ＮＯＷ,東京都渋谷区幡ヶ谷２丁目６番６号幡ヶ谷北村ビル４階,2025-03-14,合同会社
合同会社Ｎａｌｕ,北海道札幌市中央区南十二条西１４丁目１番２０号,2025-03-14,合同会社
合同会社Ｎｅｘｔ　Ｌｉｆｅ,大阪府大阪市中央区南船場４丁目１０番１８ナサプライムハウス本館７０７号,2025-03-14,合同会社
合同会社ＰＲＰ,神奈川県大和市下鶴間３０１８番地５１,2025-03-14,合同会社
