法人名,住所,設立日,法人種別
あの合同会社,奈良県奈良市大宮町３丁目２－３９－２０７,2023-02-01,合同会社
あわじ楽農倶楽部合同会社,兵庫県洲本市木戸５０９番地２,2023-02-01,合同会社
ししもも合同会社,東京都中央区銀座１丁目１２番４号,2023-02-01,合同会社
にこにこ合同会社,東京都港区東新橋２丁目４－８ピアネッタ汐留１２０２,2023-02-01,合同会社
アイエスピー合同会社,東京都中央区八重洲１丁目８―１７新槇町ビル６階,2023-02-01,合同会社
アシスト株式会社,大阪府枚方市星丘２丁目１３番１１号,2023-02-01,株式会社
アテリーズグローバルマネジメント合同会社,千葉県茂原市本納２２８４番地１,2023-02-01,合同会社
アビスジャパン株式会社,東京都文京区湯島２丁目７番３号,2023-02-01,株式会社
アンドシガー合同会社,東京都新宿区西新宿３丁目３番１３号西新宿水間ビル２階,2023-02-01,合同会社
ウィキュー・オプトロニクス・ジャパン株式会社,広島県庄原市西城町中野字本郷３１３番１,2023-02-01,株式会社
エキスポートファクトリー合同会社,福岡県福岡市東区千早１丁目９番１－６０１号,2023-02-01,合同会社
エナジー１号合同会社,福岡県久留米市中央町３８番地２３ユーズビル３２号,2023-02-01,合同会社
エムイーアイ合同会社,埼玉県朝霞市西弁財１丁目９－１１,2023-02-01,合同会社
エムサンステップ株式会社,東京都豊島区東池袋１丁目３４－５,2023-02-01,株式会社
エムビーシーシー合同会社,三重県伊勢市本町３－４,2023-02-01,合同会社
オリーブエンターテイメント合同会社,東京都北区豊島７丁目２８番８号,2023-02-01,合同会社
オーシャンビューアパートメント株式会社,東京都小笠原村父島字吹上谷,2023-02-01,株式会社
カフベンテックジャパン株式会社,東京都文京区本郷３丁目４２番５号,2023-02-01,株式会社
キンツギグローバルジャパン株式会社,東京都渋谷区松濤１丁目２８番２号,2023-02-01,株式会社
グローバルエクスプレス合同会社,千葉県千葉市美浜区若葉３丁目１－１－２８０６,2023-02-01,合同会社
コム・エスペリエンシア株式会社,東京都中央区京橋１丁目６番１号三井住友海上テプコビル７Ｆ,2023-02-01,株式会社
サイバー犯罪に関する白浜シンポジウム実行委員会,和歌山県田辺市新庄町３３５３－９（Ｂｉｇ－Ｕ内）,2023-02-01,その他
サブロク不動産ＧＸ株式会社,茨城県守谷市本町６５２番地の６グラン・フォーシーズンズ２０２,2023-02-01,株式会社
サンアグリ合同会社,秋田県大仙市神宮寺字館ノ南１９番地,2023-02-01,合同会社
ザ・フューチャー協同組合,愛知県名古屋市西区比良４丁目３０３番地,2023-02-01,その他の設立登記法人
ジョージ・アンド・サンズ株式会社,大阪府大阪市中央区谷町２丁目７番４号谷町スリースリーズビル４Ｃ,2023-02-01,株式会社
スキマテック株式会社,熊本県上益城郡山都町南田４９番地３,2023-02-01,株式会社
スターシップ合同会社,千葉県流山市東初石２丁目９１番地の６レクセルプラッツァ初石１１１,2023-02-01,合同会社
スチールサービスセンター中部株式会社,石川県羽咋郡志賀町甘田ロの９６番地,2023-02-01,株式会社
スベオ合同会社,大阪府富田林市若松町５丁目１５番８号エイト富田林１０４,2023-02-01,合同会社
ゼロジム３６９株式会社,福岡県福岡市博多区博多駅中央街１－１アミュプラザ博多地下１階「Ｑ」,2023-02-01,株式会社
ソラリスバイオ株式会社,京都府相楽郡精華町光台１丁目７番地けいはんなプラザ・ラボ棟,2023-02-01,株式会社
トライセラ合同会社,千葉県浦安市高洲４丁目３番１－１０３５号,2023-02-01,合同会社
ナセナル株式会社,東京都渋谷区神宮前６丁目２３－４桑野ビル２階,2023-02-01,株式会社
ハレノヒ合同会社,栃木県宇都宮市中岡本町２９１９番地３１５,2023-02-01,合同会社
ハロ麒麟株式会社,東京都中野区南台５丁目５番７号ＧＳハイム中野南台１０４,2023-02-01,株式会社
ビーオンウェブ合同会社,神奈川県平塚市西八幡１丁目１１番３７号－３０３号シャーメゾン,2023-02-01,合同会社
マックスアンドアソシエイツ合同会社,千葉県柏市増尾８丁目３番２号,2023-02-01,合同会社
ユニクレイジー合同会社,東京都港区南青山３丁目１番３６号青山丸竹ビル,2023-02-01,合同会社
ライトテクニカル株式会社,福岡県福岡市南区清水３丁目１１番７号,2023-02-01,株式会社
レッドアイ合同会社,神奈川県大和市つきみ野１丁目６－９－６４５,2023-02-01,合同会社
ワイトナイル株式会社,京都府京都市東山区慈法院庵町５９８番１８,2023-02-01,株式会社
一般社団法人かごしま未来創生ラボ,鹿児島県鹿児島市上之園町４番地２０トーカンマンション共研公園６０１号,2023-02-01,その他の設立登記法人
一般社団法人ののねこ,岡山県岡山市東区広谷４３４番地３０,2023-02-01,その他の設立登記法人
一般社団法人ひと・福祉・社会をつなぐ総合研究所,大阪府豊中市上野東３丁目１４番２８号,2023-02-01,その他の設立登記法人
一般社団法人ウェルスファンドツー,東京都千代田区丸の内３丁目１番１号東京共同会計事務所内,2023-02-01,その他の設立登記法人
一般社団法人キロビット,東京都中央区八丁堀４丁目２番１０号ＡＯＪ税理士法人内,2023-02-01,その他の設立登記法人
一般社団法人ギガスクールサポーター,神奈川県横浜市神奈川区片倉５丁目１４－６,2023-02-01,その他の設立登記法人
一般社団法人スポーツウェルビーイング推進協議会,東京都千代田区神田錦町３丁目２０番地,2023-02-01,その他の設立登記法人
一般社団法人ソーラーガーデン,東京都千代田区平河町１丁目３番１３号平河町フロントビル７階株式会社シリウス・アドバイザリー内,2023-02-01,その他の設立登記法人
一般社団法人ソーラーパーク,東京都千代田区平河町１丁目３番１３号平河町フロントビル７階株式会社シリウス・アドバイザリー内,2023-02-01,その他の設立登記法人
一般社団法人チアタンブリング協会,栃木県足利市伊勢町１丁目７番地９,2023-02-01,その他の設立登記法人
一般社団法人ピース,大阪府大阪市東淀川区豊新３丁目７番１号セントラルコート豊新４０１号,2023-02-01,その他の設立登記法人
一般社団法人山櫻,愛知県海部郡大治町大字東條字中切６７－１,2023-02-01,その他の設立登記法人
一般社団法人広島イノベーションベース,広島県広島市佐伯区倉重１丁目１２５６番地,2023-02-01,その他の設立登記法人
一般社団法人座キューピーマジック,東京都東村山市野口町３丁目３０番地２１,2023-02-01,その他の設立登記法人
一般社団法人日本ビジネス教育協会,北海道札幌市中央区北五条西１３丁目１番地１１６,2023-02-01,その他の設立登記法人
一般社団法人日本メディカルトレーニングセラピー協会,広島県広島市安佐南区沼田町大字阿戸３３４３番地６,2023-02-01,その他の設立登記法人
一般社団法人未来環境プロジェクト普及協議会,神奈川県横浜市中区海岸通５丁目２５番地２号－２１,2023-02-01,その他の設立登記法人
一般社団法人権現堂にぎわい委員会,埼玉県幸手市東５丁目１９番７号,2023-02-01,その他の設立登記法人
一般社団法人生産性向上推進機構,東京都昭島市昭和町５丁目１番１２号,2023-02-01,その他の設立登記法人
一般社団法人秩父・正昭集古館,埼玉県秩父市上町３丁目１２番４５号,2023-02-01,その他の設立登記法人
一般社団法人西新宿ファーストプロパティーズ,東京都中央区日本橋１丁目４番１号,2023-02-01,その他の設立登記法人
一般社団法人Ｃ２Ｃ　Ｆｏｏｔｂａｌｌ　Ａｃａｄｅｍｙ,山梨県甲府市和戸町７３５番地,2023-02-01,その他の設立登記法人
一般社団法人ＤＡ‐Ｎ‐ＲＯ,岐阜県大垣市旭町３丁目１０番地旭ビル１Ｃ,2023-02-01,その他の設立登記法人
一般社団法人ＲＵＲＵＤＡＳＨ,東京都昭島市緑町２丁目１９番５号２０１号,2023-02-01,その他の設立登記法人
万事お助け株式会社,山梨県甲州市塩山赤尾５３９番地１,2023-02-01,株式会社
三立合同会社,山梨県上野原市コモアしおつ３丁目１８番１号,2023-02-01,合同会社
乃木坂キャピタルマネジメント合同会社,東京都港区赤坂９丁目５番１ー６０３号,2023-02-01,合同会社
久池井林業緑化株式会社,佐賀県佐賀市大和町大字久池井３９６番地１,2023-02-01,株式会社
伸屋工業協同組合,兵庫県たつの市揖保町門前３６９番地の１,2023-02-01,その他の設立登記法人
信惠株式会社,大阪府大阪市港区築港４丁目５－１０サンハイツ港１０２号室,2023-02-01,株式会社
八王子ミライテラスパートナーズ株式会社,東京都八王子市子安町３丁目２６番１号,2023-02-01,株式会社
兵庫プロパン瓦斯企業組合,兵庫県姫路市元塩町６８番地,2023-02-01,その他の設立登記法人
創優Ｔｅｃｈｎｏｌｏｇｙ株式会社,大阪府大阪市西成区玉出中２丁目１４番９－２０３号,2023-02-01,株式会社
医療法人勇愛会,大阪府堺市西区上野芝向ヶ丘町６丁１番３４号パルファン上野芝１階,2023-02-01,その他の設立登記法人
医療法人秋山歯科クリニック,大阪府枚方市北中振３丁目２０番３６号秋山ビル１階,2023-02-01,その他の設立登記法人
医療法人英友会,福岡県久留米市宮ノ陣町若松字柿添１６４２番地１,2023-02-01,その他の設立登記法人
医療法人ＪＯＹクリニック,大阪府泉南郡田尻町嘉祥寺６６５番地１,2023-02-01,その他の設立登記法人
双葉ホールディングス株式会社,北海道札幌市北区南あいの里７丁目２０番２５号,2023-02-01,株式会社
合同会社あいサポ,福島県郡山市町東１丁目８８ノーブルハイツ１Ａ棟１０３号室,2023-02-01,合同会社
合同会社あらい牧場,茨城県東茨城郡茨城町大字若宮８８５番地,2023-02-01,合同会社
合同会社くら,沖縄県豊見城市字嘉数２０２番地１１,2023-02-01,合同会社
合同会社ほっとステーション,高知県高知市横浜東町２番４７号,2023-02-01,合同会社
合同会社みらい,福岡県太宰府市坂本３丁目７番２５号（２０１号）,2023-02-01,合同会社
合同会社アルテ,沖縄県沖縄市海邦１丁目１７番１９号,2023-02-01,合同会社
合同会社キロバイト,東京都中央区八丁堀４丁目２番１０号ＡＯＪ税理士法人内,2023-02-01,合同会社
合同会社クロエース,大阪府大阪市西区新町１丁目３４番２号クロスレジデンス大阪新町６０１,2023-02-01,合同会社
合同会社グッドマンスリー,広島県広島市東区牛田早稲田４丁目２番３２－２０７,2023-02-01,合同会社
合同会社ジャパンシステム,静岡県浜松市中区砂山町３５７－５砂山ビル３Ｆ,2023-02-01,合同会社
合同会社スマートワイズ,大阪府大阪市西区新町１丁目１４番３９号４０５,2023-02-01,合同会社
合同会社スラストアップ,千葉県市川市八幡１丁目２番１９－４０３号,2023-02-01,合同会社
合同会社セカンドワークス,兵庫県神戸市兵庫区水木通５丁目３番１９号カサパロマ１階,2023-02-01,合同会社
合同会社ソーラーガーデン,東京都千代田区平河町１丁目３番１３号平河町フロントビル７階株式会社シリウス・アドバイザリー内,2023-02-01,合同会社
合同会社ソーラーパーク,東京都千代田区平河町１丁目３番１３号平河町フロントビル７階株式会社シリウス・アドバイザリー内,2023-02-01,合同会社
合同会社フクユウ,愛知県豊橋市有楽町２１番地,2023-02-01,合同会社
合同会社マガリ,愛知県春日井市上条町６丁目３５番地２０,2023-02-01,合同会社
合同会社ミンク,兵庫県三田市対中町２５番２０号,2023-02-01,合同会社
合同会社メディマティクス,愛知県名古屋市中区栄２丁目２番１号,2023-02-01,合同会社
合同会社メリーきてや,千葉県松戸市新松戸１丁目２１６番地の１,2023-02-01,合同会社
合同会社ライジングサン,東京都品川区東品川３丁目８－８ラグナタワー１７０６,2023-02-01,合同会社
合同会社ライフサービス,富山県富山市東町２丁目４番５－４０２号福一ビル,2023-02-01,合同会社
合同会社ラビッシュ,東京都渋谷区道玄坂１丁目１０番８号渋谷道玄坂東急ビル２Ｆ－Ｃ,2023-02-01,合同会社
合同会社リカバー,沖縄県南城市玉城字船越７７３番地１,2023-02-01,合同会社
合同会社レース・ノアエ,東京都新宿区若松町９番１４－１００１号,2023-02-01,合同会社
合同会社光曜,千葉県松戸市河原塚４２８,2023-02-01,合同会社
合同会社前田設備,千葉県船橋市海神３丁目２９番２３号,2023-02-01,合同会社
合同会社創友社,東京都大田区萩中２丁目１６番１７号,2023-02-01,合同会社
合同会社千富,福岡県筑後市大字西牟田３９９０－３,2023-02-01,合同会社
合同会社友来屋,東京都新宿区箪笥町１８番地３コスモシティ市ヶ谷３０６,2023-02-01,合同会社
合同会社山岸会計事務所,東京都中央区佃３丁目４－１１－１１０２,2023-02-01,合同会社
合同会社想わ,愛知県名古屋市守山区小幡千代田１７―１４ファミーユ千代田４Ｂ,2023-02-01,合同会社
合同会社江田鉄筋,宮城県黒川郡大和町吉田字沢渡東１６番地の３,2023-02-01,合同会社
合同会社河津企画,愛知県豊田市美里４丁目３番地７７,2023-02-01,合同会社
合同会社琉球ネット,沖縄県那覇市松山２丁目５番１０号－９０２号室,2023-02-01,合同会社
合同会社田中企画,兵庫県尼崎市戸ノ内町１丁目６番１３号,2023-02-01,合同会社
合同会社発酵人間,京都府南丹市美山町大野文字畾地５番地２,2023-02-01,合同会社
合同会社結び,鹿児島県鹿児島市西田１丁目１５番地６銀屋ビル２０１号,2023-02-01,合同会社
合同会社茨城の地酒販売,茨城県水戸市見和１丁目３１７－５花工房ビル,2023-02-01,合同会社
合同会社萩岡自動車,兵庫県神戸市中央区北本町通３丁目２番２－１０１号,2023-02-01,合同会社
合同会社蔵商,神奈川県横浜市中区宮川町１丁目１－１シーガルパレス５０３,2023-02-01,合同会社
合同会社西新宿ファーストプロパティーズ,東京都中央区日本橋１丁目４番１号,2023-02-01,合同会社
合同会社訪問介護春花,福岡県田川郡川崎町大字川崎７１２番地の１５,2023-02-01,合同会社
合同会社誠サポート,埼玉県越谷市新越谷１丁目３８９番地５,2023-02-01,合同会社
合同会社野谷,東京都府中市府中町２丁目１―１プレミスト府中１２０１,2023-02-01,合同会社
合同会社ＡＫＩＴＯＭＯ,愛知県豊田市平戸橋町永和１４番地６,2023-02-01,合同会社
合同会社ＡＳＨ　ＨＥＡＤ　ＢＲＥＷＥＲＹ,鹿児島県霧島市隼人町小浜３７番１,2023-02-01,合同会社
合同会社Ｅｇｏｄａｗａｔｈｔｈａ　Ｅｎｔｅｒｐｒｉｓｅｓ,茨城県筑西市野４４８番地２,2023-02-01,合同会社
合同会社Ｅｌｌｅ,新潟県五泉市村松甲１６３７番地の１,2023-02-01,合同会社
合同会社ＦＲＡＮＫ　ＶＥＮＴＵＲＥＳ,千葉県野田市中戸６８－３,2023-02-01,合同会社
合同会社Ｆａｍ,愛知県岡崎市針崎町字朱印地６番地１１,2023-02-01,合同会社
合同会社Ｇａｍｅ　Ｃｈａｎｇｅｒ,埼玉県和光市白子３丁目２０番３４号,2023-02-01,合同会社
合同会社ＨＡＲＢＯＲ,沖縄県沖縄市中央２丁目１６－１,2023-02-01,合同会社
合同会社ＨＲ企画,京都府福知山市篠尾新町４丁目２６番地,2023-02-01,合同会社
合同会社ＨＵＧＳＰＯ,大阪府東大阪市若草町３番１０号,2023-02-01,合同会社
合同会社ＨＹＤ,兵庫県尼崎市南塚口町２丁目１番３－１６２４号,2023-02-01,合同会社
合同会社ＨａｒｐＳｅａｌ,神奈川県横浜市西区西戸部町２丁目１２８,2023-02-01,合同会社
合同会社Ｈａｒｓｈａ　Ｍｏｔｏｒｓ,茨城県坂東市神田山２２７２番地,2023-02-01,合同会社
合同会社Ｈｏｎｕａ　Ｗｅｂ　Ｓｔｕｄｉｏ,大阪府大阪市中央区南船場３丁目１１－２７日宝シルバービル４０２,2023-02-01,合同会社
合同会社ＫＡＷＡ,東京都中野区中野５丁目５９番１３号１Ｆ,2023-02-01,合同会社
合同会社ＫＲＩＳＨＡＮ　ＥＮＴＥＲＰＲＩＳＥＳ,福岡県福岡市南区折立町１番２８号ハーベスト大橋南Ⅱ２階２０１号室,2023-02-01,合同会社
合同会社ＬＩＮＫＸ,福岡県福岡市中央区天神３丁目５番２２号ＯＡＫＶＩＬＬＡ天神プラストロワ７Ｆ,2023-02-01,合同会社
合同会社ＭＡＫＩ,沖縄県島尻郡八重瀬町字東風平１１６０番地６,2023-02-01,合同会社
合同会社ＭＳＩ,熊本県熊本市中央区中央街６番１９号,2023-02-01,合同会社
合同会社Ｍｉｒａｒｃｈ,埼玉県所沢市東狭山ケ丘２丁目２９１７番地の３３,2023-02-01,合同会社
合同会社ＮＡＬＳ,沖縄県浦添市字前田１３２６－２,2023-02-01,合同会社
合同会社ＮＥＸ,千葉県浦安市入船３丁目２０番２０６号,2023-02-01,合同会社
合同会社ＮＳＢＣ,東京都新宿区弁天町２１番地７－６０１,2023-02-01,合同会社
合同会社Ｒ,京都府京都市左京区東丸太町７,2023-02-01,合同会社
合同会社Ｒｅｂｕｉｌｄｅｒ,大阪府高槻市西町５０番７号,2023-02-01,合同会社
合同会社Ｒｅｃｏｒｅ,北海道札幌市北区屯田七条９丁目１３番１５号,2023-02-01,合同会社
合同会社Ｒｙｕｋｋａ＆Ｃｏ．,埼玉県本庄市小島１丁目６番３号,2023-02-01,合同会社
合同会社Ｓ‐ｐｌａｎｎｉｎｇ,大阪府茨木市横江１丁目１７－３４,2023-02-01,合同会社
合同会社ＳＡＭＡＲＡ　ＩＮＴＥＲＮＡＴＩＯＮＡＬ,埼玉県蕨市塚越５丁目４８番１３号ハイム竹山１０２,2023-02-01,合同会社
合同会社ＳＭＭ２,東京都中央区銀座１丁目１２番４号Ｎ＆ＥＢＬＤ．７階,2023-02-01,合同会社
合同会社Ｓｎｏｗｂａｌｌ,東京都品川区東品川１丁目１１番６－４０１号,2023-02-01,合同会社
合同会社Ｓｐｙｄｅｒ,広島県福山市今町２番１８号,2023-02-01,合同会社
合同会社ＴＭネットホールディングス,東京都杉並区高円寺南３丁目３６番８号サウスヒルズ・Ａ２０５,2023-02-01,合同会社
合同会社ＵＮ,京都府京都市下京区大黒町２２７番地第２キョートビル４０２,2023-02-01,合同会社
合同会社ＵＲＡ,東京都品川区荏原１丁目４－２リベール１０１,2023-02-01,合同会社
合同会社ＷＥＳＴＬＩＮＥ,沖縄県南城市玉城字船越１３３９番地の２,2023-02-01,合同会社
合同会社ａ,長崎県長崎市旭町９番１２号杉元ビル２階,2023-02-01,合同会社
合同会社ａｇ,岡山県岡山市北区下石井２丁目１０－３０杜の街グレース岡山ザ・タワー８１６号,2023-02-01,合同会社
合同会社ｄｉｇｎｏ,東京都杉並区高井戸東４丁目９番１－６０４号,2023-02-01,合同会社
合同会社ｓｈａｒｏｎ,愛知県名古屋市中川区十一番町２丁目２０－７,2023-02-01,合同会社
四街道貿易株式会社,千葉県四街道市鹿放ケ丘２８３番２,2023-02-01,株式会社
地震保険調査事務所株式会社,東京都台東区東上野２丁目１３番１１号増田ビル４Ｆ,2023-02-01,株式会社
大唐国開株式会社,京都府京都市左京区上高野東田町２８番６,2023-02-01,株式会社
大宇株式会社,大阪府大阪市北区神山町１番５号扇町公園ビル６０２,2023-02-01,株式会社
妄想アーキテクツ株式会社,東京都港区浜松町２丁目２－１５浜松町ダイヤビル２Ｆ,2023-02-01,株式会社
宇田川総研合同会社,東京都文京区目白台２丁目７－１２－１００１,2023-02-01,合同会社
小渕興業株式会社,群馬県渋川市北橘町小室８７番地４,2023-02-01,株式会社
小田原ビジネスアドバイザリー株式会社,神奈川県小田原市荻窪８８２番地,2023-02-01,株式会社
幸造設備合同会社,東京都中央区銀座６丁目１３番１６号銀座ＷａｌｌビルＵＣＦ５階,2023-02-01,合同会社
弁理士法人ナビジョン国際特許事務所,大阪府大阪市中央区城見２丁目１－６１ツイン２１ＭＩＤタワー２５階,2023-02-01,その他の設立登記法人
愛凌株式会社,大阪府大阪市都島区都島南通１丁目１９番１０－３０２号,2023-02-01,株式会社
新仁商事株式会社,東京都台東区東上野４丁目２０－５－１０１,2023-02-01,株式会社
日本ＪＤＶコントロールバルブ株式会社,東京都千代田区丸の内１丁目１１番１号パシフィックセンチュリープレイス１３階,2023-02-01,株式会社
日麗株式会社,大阪府大阪市東成区神路１丁目７－５神路一丁目ビル３０１,2023-02-01,株式会社
昊昇株式会社,東京都品川区東大井５丁目１９－６鈴の家ビル７０３,2023-02-01,株式会社
晴天株式会社,東京都文京区小石川１丁目５番１号ＰＣ４０２,2023-02-01,株式会社
有限会社ミツワプロセス,千葉県八街市吉倉３５７番地２１,2023-02-01,有限会社
有限会社米澤不動産,広島県広島市安佐北区口田南１丁目８番３８号,2023-02-01,有限会社
東京レジ３４一般社団法人,東京都千代田区丸の内３丁目１番１号東京共同会計事務所内,2023-02-01,その他の設立登記法人
東京レジ３５一般社団法人,東京都千代田区丸の内３丁目１番１号東京共同会計事務所内,2023-02-01,その他の設立登記法人
松凪建工株式会社,東京都北区浮間２丁目１０－７,2023-02-01,株式会社
株式会社あおぬまエコエナジー,東京都葛飾区小菅２丁目２０番１１号,2023-02-01,株式会社
株式会社さざれ,東京都中央区日本橋小伝馬町１８－１内田ビル６階,2023-02-01,株式会社
株式会社ばーすでい,大阪府摂津市鳥飼銘木町１番３号,2023-02-01,株式会社
株式会社ひかり,鹿児島県鹿屋市笠之原町１８番２６号,2023-02-01,株式会社
株式会社へうげ,神奈川県秦野市北矢名３９０番地の１１,2023-02-01,株式会社
株式会社アイテック,埼玉県さいたま市中央区大戸３丁目１３番１５号Ｋ＆Ｓ１０１,2023-02-01,株式会社
株式会社アイノス,神奈川県横須賀市安浦町３丁目１６番地しんわ本社ビル５階,2023-02-01,株式会社
株式会社アットロジコム関東,千葉県成田市大袋３０６番地６,2023-02-01,株式会社
株式会社イチナナ,東京都渋谷区代々木１丁目５３番１号ＭＹＴＯＷＥＲＲＥＳＩＤＥＮＣＥ１８１２,2023-02-01,株式会社
株式会社ウェリエンス,東京都渋谷区恵比寿１丁目２９番１５号シティプラザ恵比寿８０４,2023-02-01,株式会社
株式会社ウミン,東京都渋谷区渋谷２丁目１９番１５－６０９号,2023-02-01,株式会社
株式会社エスエーブライト,広島県広島市南区東雲本町１丁目１番３０号,2023-02-01,株式会社
株式会社エバエージェン,東京都新宿区西新宿７丁目１番７号新宿ダイカンプラザＡ館６１９,2023-02-01,株式会社
株式会社オネスト,大阪府茨木市五十鈴町１４番２８号の２,2023-02-01,株式会社
株式会社オフィス・ファン,東京都渋谷区本町３丁目７番６号パレ・ソレイユ西新宿８０１,2023-02-01,株式会社
株式会社カケル,三重県鈴鹿市三日市町９６０番地１,2023-02-01,株式会社
株式会社カメラマン,東京都品川区西五反田５丁目１番１０－３１１号,2023-02-01,株式会社
