法人名,住所,設立日,法人種別
富士の環合同会社,山梨県韮崎市穴山町８０１０番地２,2026-05-13,合同会社
将和グループ株式会社,大阪府大阪市中央区南船場３丁目２番２２号おおきに船場ビル２０５,2026-05-13,株式会社
尾平町自治会,三重県四日市市尾平町２９９５－１,2026-05-13,その他
弁護士法人アエル,愛知県岡崎市城南町３丁目９番地２キミオカビル２階東,2026-05-13,その他の設立登記法人
新鎌ヶ谷リードタウン団地管理組合法人,東京都港区虎ノ門２丁目１０－４,2026-05-13,その他の設立登記法人
時空旅Ｔｉｍｅｗａｒｐ合同会社,大分県杵築市大字守江１２２０,2026-05-13,合同会社
有限会社県南不動産,埼玉県川口市大字芝３８９１番地の４,2026-05-13,有限会社
栄和建匠株式会社,新潟県新潟市北区新鼻甲１６１番地,2026-05-13,株式会社
栞栞創造研究所合同会社,東京都練馬区大泉町５丁目３２番１５号,2026-05-13,合同会社
株式会社かくまる堂,兵庫県神戸市東灘区森南町１丁目１０番２号３０１号室,2026-05-13,株式会社
株式会社さぬき,山口県下関市古屋町１丁目１８番３０号,2026-05-13,株式会社
株式会社つーさんとゆっぴ,東京都渋谷区道玄坂１丁目１０番８号渋谷道玄坂東急ビル２Ｆ－Ｃ,2026-05-13,株式会社
株式会社てらくま,福島県いわき市平沼ノ内字新街１４番地,2026-05-13,株式会社
株式会社ぷらすふぃーるど,愛知県豊川市篠田町四ツ家５４番地,2026-05-13,株式会社
株式会社まごろくリユース,東京都江東区牡丹３丁目６番１号,2026-05-13,株式会社
株式会社まちのもり,奈良県宇陀市室生大野１９３５番地の１,2026-05-13,株式会社
株式会社まるえい,香川県丸亀市中津町８２８番地１,2026-05-13,株式会社
株式会社みそらＩＴソリューション,大阪府箕面市船場西２丁目１番１号エリモビル３０５,2026-05-13,株式会社
株式会社みらい,沖縄県那覇市首里寒川町２丁目７９番地,2026-05-13,株式会社
株式会社むらまつ,大阪府八尾市太田新町８丁目１０５番地,2026-05-13,株式会社
株式会社やまがた管工,岐阜県山県市東深瀬４８５番地３,2026-05-13,株式会社
株式会社アクアリゾート,大阪府大阪市中央区南船場３丁目２番２２号おおきに南船場ビル２０５,2026-05-13,株式会社
株式会社アクシスコード,福岡県福岡市東区香椎照葉６丁目２番５２－３９０４号,2026-05-13,株式会社
株式会社アトムエステート,大阪府大阪市西成区太子１丁目５－８－２０１,2026-05-13,株式会社
株式会社アニマノード,大阪府大阪市北区梅田２丁目２－２ヒルトンプラザウエスト１９階,2026-05-13,株式会社
株式会社アモヌア,東京都品川区北品川３丁目６番１３号,2026-05-13,株式会社
株式会社アークトゥルス,神奈川県横浜市西区戸部本町１３－１１ＭＲＭビル３Ｆ,2026-05-13,株式会社
株式会社アークネクスト,東京都板橋区上板橋１丁目２－４クリア上板Ｃ棟,2026-05-13,株式会社
株式会社イトワ不動産,山梨県富士吉田市上吉田１丁目１番２号Ｂ,2026-05-13,株式会社
株式会社イロドリ,長野県松本市村井町南３丁目９番２２号フレグランスシルキー２０２,2026-05-13,株式会社
株式会社ウルミタス,福井県小浜市小松原第３号５６番地,2026-05-13,株式会社
株式会社エムｗｉｔｈ,岡山県岡山市北区撫川１３９７番地１,2026-05-13,株式会社
株式会社エリカ発酵食研,佐賀県佐賀市兵庫北７丁目１６－７,2026-05-13,株式会社
株式会社エンパワー,埼玉県さいたま市緑区大字中尾５７７－１,2026-05-13,株式会社
株式会社エンリッチ不動産,静岡県静岡市葵区東草深町２０番２５号,2026-05-13,株式会社
株式会社オクノテ,東京都大田区上池台３丁目１４番１５－５０２号,2026-05-13,株式会社
株式会社オハナ,大阪府堺市西区鳳西町２丁８６番１２号,2026-05-13,株式会社
株式会社カハン,東京都渋谷区本町１丁目５番１４号,2026-05-13,株式会社
株式会社カミペン,茨城県つくば市東２丁目２番地６,2026-05-13,株式会社
株式会社カラペンソ,神奈川県相模原市中央区相模原１丁目８番１１号ルミエールＳ弐番館１０５,2026-05-13,株式会社
株式会社キョウダイホールディングス,東京都品川区東五反田１丁目１３番１２号,2026-05-13,株式会社
株式会社クライムオン企画,埼玉県さいたま市西区大字宝来３３１番地３,2026-05-13,株式会社
株式会社クラップハンズ,東京都大田区西蒲田５丁目２番１４号ＭｉａＣａｓａⅡ４０５,2026-05-13,株式会社
株式会社グッドヒル,大阪府守口市大日町２丁目１０番２０号,2026-05-13,株式会社
株式会社グラウンドスタンス,愛知県岡崎市岩津町字西坂５５番地６２,2026-05-13,株式会社
株式会社グロース,兵庫県神戸市兵庫区荒田町１丁目２番９号,2026-05-13,株式会社
株式会社ケリー,東京都江戸川区清新町２丁目４番２－３０１号,2026-05-13,株式会社
株式会社コウハク不動産,広島県広島市安佐北区亀山南２丁目１１番１８号,2026-05-13,株式会社
株式会社コトノハ舎,神奈川県川崎市高津区溝口３丁目３番８号セシーズイシイ１０－２０２号室,2026-05-13,株式会社
株式会社サクラハーモニー・プロダクション,神奈川県横浜市西区浅間町１丁目４番３号ウィザードビル４０２,2026-05-13,株式会社
株式会社ササキアート,宮城県仙台市泉区加茂５丁目１０番地の７,2026-05-13,株式会社
株式会社サンワ,大阪府大阪市中央区久太郎町２丁目５番１８号宝ビル３階３１号室,2026-05-13,株式会社
株式会社シナプス,大阪府大阪市北区大深町５－５４,2026-05-13,株式会社
株式会社シンセン,東京都西東京市向台町５丁目５番４３号,2026-05-13,株式会社
株式会社ジャパン・リリーフ送迎サポート,東京都港区芝浦４丁目９番２５号,2026-05-13,株式会社
株式会社スカーレットアーク,東京都世田谷区三宿２丁目１６―１０ＫＨ三宿テラス７１０,2026-05-13,株式会社
株式会社スタメイツ,山梨県富士吉田市下吉田５丁目１２番２０号,2026-05-13,株式会社
株式会社スタート・トゥ・フィニッシュ,新潟県新潟市中央区紫竹山７丁目１番５号,2026-05-13,株式会社
株式会社ステラ企画,愛知県名古屋市千種区仲田２丁目１５番８号ＮＴビル２階,2026-05-13,株式会社
株式会社ズッカ,大阪府大阪市平野区瓜破１丁目７番４３号,2026-05-13,株式会社
株式会社ゼニス,大阪府大阪市中央区久太郎町４丁目２番１５号－５Ｆ,2026-05-13,株式会社
株式会社ソウルプット,千葉県松戸市本町１７－１１芹澤ビル６Ｆ,2026-05-13,株式会社
株式会社ソレイネ,福岡県福岡市早良区原３丁目１５番３－３２３号,2026-05-13,株式会社
株式会社タマソラ,東京都港区芝浦３丁目１２番２号やまとビル３Ｆ,2026-05-13,株式会社
株式会社チャムタス,神奈川県藤沢市辻堂東海岸４丁目１番１３号,2026-05-13,株式会社
株式会社ツープラス,大阪府大阪市生野区小路東２丁目９番１４号,2026-05-13,株式会社
株式会社ティクセル,東京都千代田区神田須田町１丁目７番８号ＶＯＲＴ秋葉原Ⅳ２Ｆ,2026-05-13,株式会社
株式会社テクノ・ビオトープ,山梨県甲府市宮原町４０５番地３,2026-05-13,株式会社
株式会社テンアピス,東京都港区麻布十番２丁目２１番６－２１０２号,2026-05-13,株式会社
株式会社トリボンド,東京都中央区銀座１丁目１２－４Ｎ＆ＥＢＬＤ．７階,2026-05-13,株式会社
株式会社ナナタグ,神奈川県横浜市西区北幸１丁目１１番１号水信ビル７階,2026-05-13,株式会社
株式会社ナレッジブリッジ,神奈川県横浜市旭区善部町３７－３３,2026-05-13,株式会社
株式会社ニシヤマ,宮城県仙台市青葉区二日町１７番２１号３階,2026-05-13,株式会社
株式会社ニッショウホールディングス,東京都杉並区堀ノ内３丁目２５番３号,2026-05-13,株式会社
株式会社ニッショーガレッパ,愛知県名古屋市北区城見通３丁目５番地,2026-05-13,株式会社
株式会社ニド,大阪府大阪市東住吉区駒川３丁目９番２号,2026-05-13,株式会社
株式会社ニューコ・ワン,熊本県熊本市中央区安政町１番２号,2026-05-13,株式会社
株式会社ニューマン,東京都港区麻布十番２丁目２１番６－２１０２号,2026-05-13,株式会社
株式会社ネクサス,和歌山県有田郡広川町大字下津木８７０番地,2026-05-13,株式会社
株式会社ネクサスグロース,東京都渋谷区円山町２番１６号ハーベスト・ハウス円山７０３,2026-05-13,株式会社
株式会社ネクスファイ,埼玉県桶川市泉２丁目１２番６７号,2026-05-13,株式会社
株式会社ハイライト,東京都足立区栗原１丁目２４番２号,2026-05-13,株式会社
株式会社ハウスポスト,東京都世田谷区松原１丁目１１番８－２０６号,2026-05-13,株式会社
株式会社ハヤシライズ,東京都港区麻布十番１丁目８番１１号３Ｆ,2026-05-13,株式会社
株式会社バリューシフトパートナーズ,東京都港区芝４丁目５番１１号,2026-05-13,株式会社
株式会社パークアベニュー,神奈川県横浜市青葉区もえぎ野２０番地１０,2026-05-13,株式会社
株式会社ヒビキ管理,愛知県豊明市三崎町高鴨１０番地２５,2026-05-13,株式会社
株式会社ファームワタナベ,新潟県三条市江口５２９番地,2026-05-13,株式会社
株式会社フクヤ,京都府舞鶴市字福来８４番地１,2026-05-13,株式会社
株式会社フューチャーリゾート,滋賀県長浜市名越町１０１６番地４,2026-05-13,株式会社
株式会社フリーダム,沖縄県宜野湾市宇地泊２丁目５番７号,2026-05-13,株式会社
株式会社プライムプロダクション,東京都港区六本木３丁目１６番１２号六本木ＫＳビル５Ｆ,2026-05-13,株式会社
株式会社ベラルーチェ,広島県竹原市吉名町３４０１番地,2026-05-13,株式会社
株式会社ベルツリーアセット,滋賀県栗東市野尻５９４番地１１０５号,2026-05-13,株式会社
株式会社マツウラ測量,群馬県太田市東長岡町１６７４番地４,2026-05-13,株式会社
株式会社マルシンエステート,埼玉県戸田市戸田公園５番１２号,2026-05-13,株式会社
株式会社マルテラ魚祐,北海道札幌市西区発寒十一条３丁目２番１１号,2026-05-13,株式会社
株式会社マロンアイス,東京都港区三田２丁目４番３－６０２号,2026-05-13,株式会社
株式会社ミ・カーサ,神奈川県横浜市都筑区牛久保東１丁目３番２号,2026-05-13,株式会社
株式会社メイト,広島県広島市安佐南区八木７丁目５番４８号,2026-05-13,株式会社
株式会社メイランド,東京都港区虎ノ門４丁目３番１号城山トラストタワー２１Ｆ,2026-05-13,株式会社
株式会社メディコア,大阪府大阪市淀川区新北野３丁目７－１４グランビルド新北野Ⅱ５０２号,2026-05-13,株式会社
株式会社ヤマセ,奈良県山辺郡山添村大字大塩１５８５番地,2026-05-13,株式会社
株式会社ユキカゼ,東京都渋谷区円山町５番３号ＭＩＥＵＸ渋谷ビル８階,2026-05-13,株式会社
株式会社ヨロコビ,東京都豊島区南大塚３丁目３９番１５号１Ｆ,2026-05-13,株式会社
株式会社ライジング,福島県南相馬市原町区押釜字原２０２番地,2026-05-13,株式会社
株式会社ライフイノベーション研究所,北海道札幌市中央区南二条西７丁目８番地１,2026-05-13,株式会社
株式会社リウボウ・バイオ・マテリアル,沖縄県那覇市松尾１丁目９番４９号,2026-05-13,株式会社
株式会社リバティ,東京都武蔵村山市榎２丁目７９番地の１０,2026-05-13,株式会社
株式会社リヒコ,東京都品川区大井２丁目１８番２号,2026-05-13,株式会社
株式会社リベリオン,東京都渋谷区恵比寿西２丁目８番４号ＥＸ恵比寿西ビル５階,2026-05-13,株式会社
株式会社リヴォーグ,福島県二本松市小沢字馬場１０１番地１,2026-05-13,株式会社
株式会社ルクセリア,埼玉県さいたま市大宮区吉敷町１丁目１３５番地Ａｒａｉビル８階,2026-05-13,株式会社
株式会社レバレッジ,神奈川県横浜市西区北幸２丁目１０番４８号むつみビル３階,2026-05-13,株式会社
株式会社ロムログループ,埼玉県新座市池田４丁目１番４号,2026-05-13,株式会社
株式会社ワイズ,兵庫県神戸市灘区新在家南町５丁目３番８号,2026-05-13,株式会社
株式会社ヴォルトリックス,埼玉県さいたま市大宮区吉敷町１丁目１３５番地Ａｒａｉビル８階,2026-05-13,株式会社
株式会社三央,東京都杉並区高円寺南５丁目１番２２号,2026-05-13,株式会社
株式会社三與木建材,埼玉県春日部市大場１４４４番地,2026-05-13,株式会社
株式会社不動庵,東京都世田谷区経堂２丁目１４番２号,2026-05-13,株式会社
株式会社中嶋匠建,東京都大田区西六郷２丁目５番２号,2026-05-13,株式会社
株式会社中西空調,大阪府東大阪市楠根１丁目７番１５号,2026-05-13,株式会社
株式会社丸金,栃木県足利市伊勢町３丁目９番地１０,2026-05-13,株式会社
株式会社仁美,大阪府交野市私市１丁目１番２４号,2026-05-13,株式会社
株式会社信希電工,兵庫県姫路市砥堀１１５１番地１Ｎｏ．１号,2026-05-13,株式会社
株式会社信林興,福島県郡山市富久山町久保田字乙高７２番地５,2026-05-13,株式会社
株式会社優貴妃,東京都日野市百草８６０番地の５,2026-05-13,株式会社
株式会社和式研究所,大阪府箕面市小野原西２丁目１０番３１号,2026-05-13,株式会社
株式会社和翔,神奈川県高座郡寒川町倉見２３９８番地８,2026-05-13,株式会社
株式会社國建材,愛知県豊橋市大岩町字久保田４番地の７０,2026-05-13,株式会社
株式会社地域共育ラボ,大分県大分市大字佐賀関１８９番地,2026-05-13,株式会社
株式会社坂本加工,兵庫県神戸市西区玉津町新方２６１－４,2026-05-13,株式会社
株式会社大福コンサルティング,兵庫県西宮市松ケ丘町１２番２６号,2026-05-13,株式会社
株式会社寿・建装,沖縄県豊見城市字翁長２９６番地１１,2026-05-13,株式会社
株式会社小林車輌,北海道函館市船見町５番１６号,2026-05-13,株式会社
株式会社山電,千葉県千葉市若葉区若松町５４３番地１６０,2026-05-13,株式会社
株式会社岡田旅館・和楽亭,岐阜県高山市奥飛騨温泉郷平湯５０５番地,2026-05-13,株式会社
株式会社岩崎ＳＰＷ,北海道亀田郡七飯町鳴川１丁目１８番２号,2026-05-13,株式会社
株式会社幕張書房,千葉県千葉市美浜区中瀬１丁目３番地幕張テクノガーデンＣＢ棟３階,2026-05-13,株式会社
株式会社幸建,京都府京都市右京区西院六反田町１３番地４－１０５号,2026-05-13,株式会社
株式会社弥勢丸,愛知県知多郡南知多町大字豊浜字東之浦１６７番地の５,2026-05-13,株式会社
株式会社弥栄工業,大阪府八尾市長池町１丁目３６番地の１８,2026-05-13,株式会社
株式会社成田建設,北海道北斗市市渡２３８番地の１１,2026-05-13,株式会社
株式会社成義,神奈川県藤沢市辻堂新町１丁目４番３０～３０３号,2026-05-13,株式会社
株式会社新潟モーター商会,新潟県新潟市北区内島見１９１０番地１,2026-05-13,株式会社
株式会社月読,愛知県犬山市大字五郎丸字上前田６－１アルカサール１０２,2026-05-13,株式会社
株式会社朝倉板金,北海道檜山郡厚沢部町緑町１６２番地８,2026-05-13,株式会社
株式会社朝日商事,大阪府大阪市平野区背戸口１丁目１７番１０号,2026-05-13,株式会社
株式会社木村工業,東京都葛飾区鎌倉２丁目１４番６号,2026-05-13,株式会社
株式会社本樫設備,神奈川県横浜市保土ケ谷区新桜ケ丘１丁目６番１７号,2026-05-13,株式会社
株式会社杉原電設,神奈川県藤沢市遠藤７３９番地の２アトレイユ湘南Ｂ２０５,2026-05-13,株式会社
株式会社村政テクノサービス,福岡県福岡市中央区今泉１丁目２１番８－１０３号,2026-05-13,株式会社
株式会社杜橘,東京都東久留米市滝山５丁目２８番６号,2026-05-13,株式会社
株式会社松浦企販,千葉県袖ケ浦市袖ケ浦駅前１丁目２６番地１３,2026-05-13,株式会社
株式会社栗山Ｈ．Ｄ,鳥取県鳥取市古海７１４番地,2026-05-13,株式会社
株式会社桑原工業,埼玉県本庄市小島南３丁目７番１２号,2026-05-13,株式会社
株式会社森風舎,佐賀県伊万里市大川内町丙１３９８番地,2026-05-13,株式会社
株式会社水槽族,北海道札幌市中央区南五条西５丁目１－２メイプル通りビル５階,2026-05-13,株式会社
株式会社水色,新潟県新潟市西区小新南１丁目９番１９号,2026-05-13,株式会社
株式会社波田野設備,埼玉県越谷市大字南荻島３５５６番地１,2026-05-13,株式会社
株式会社洛陽エステート,京都府京都市南区唐橋高田町３６番地２－３０５号,2026-05-13,株式会社
株式会社流木,沖縄県国頭郡恩納村字真栄田１５５４番地,2026-05-13,株式会社
株式会社渋川大気堂,群馬県渋川市金井６８５番地４,2026-05-13,株式会社
株式会社濵興業,神奈川県横浜市保土ケ谷区峰沢町１９０番地４３,2026-05-13,株式会社
株式会社焚納,北海道函館市富岡町２丁目５番１９号,2026-05-13,株式会社
株式会社王堂,滋賀県大津市大石東４丁目１０番６号,2026-05-13,株式会社
株式会社田中八右衛門,東京都板橋区成増３丁目３９番７号,2026-05-13,株式会社
株式会社白金ワークス,千葉県市原市白金町２丁目２８番地１,2026-05-13,株式会社
株式会社碓氷,群馬県太田市福沢町１４７番地８,2026-05-13,株式会社
株式会社福士組,神奈川県川崎市川崎区小田栄２丁目２－２,2026-05-13,株式会社
株式会社福虎,東京都江戸川区南葛西３丁目９番１４－２０１号ロイヤルハイムＫＥＮ,2026-05-13,株式会社
株式会社秋山電工,青森県八戸市大字白銀町字右岩淵通２番地４,2026-05-13,株式会社
株式会社穂,大阪府大阪市東淀川区小松１丁目９番３５号ランドマークⅡ４０６号,2026-05-13,株式会社
株式会社美ら,福井県福井市順化１丁目１８番３号,2026-05-13,株式会社
株式会社茶橋,東京都目黒区下目黒４丁目２３番８号,2026-05-13,株式会社
株式会社萬工房,岡山県岡山市中区高屋４５８‐５,2026-05-13,株式会社
株式会社蔵野,東京都武蔵野市八幡町４丁目８番６号,2026-05-13,株式会社
株式会社赤松,香川県綾歌郡綾川町陶４５７０番地１,2026-05-13,株式会社
株式会社都市綜合開発,埼玉県所沢市北野南３丁目６番地の２４,2026-05-13,株式会社
株式会社錦丸秀養鯉場,新潟県小千谷市大字南荷頃２５９２番地３,2026-05-13,株式会社
株式会社順輝真,愛知県名古屋市守山区新守山１５１７番地,2026-05-13,株式会社
株式会社高野商店,新潟県新潟市秋葉区蕨曽根９８１番地,2026-05-13,株式会社
株式会社３３３,東京都渋谷区円山町５番３号ＭＩＥＵＸ渋谷ビル８階,2026-05-13,株式会社
株式会社４ＴＳ,大分県大分市北鶴崎２丁目７番６８号,2026-05-13,株式会社
株式会社ＡＫ　Ｗａｔｃｈ,東京都東村山市萩山町１丁目８番地２２,2026-05-13,株式会社
株式会社ＡＫＹ,京都府京都市中京区竹屋町通西洞院東入毘沙門町３７８番地４,2026-05-13,株式会社
株式会社ＡＵＲＡ,大阪府堺市堺区住吉橋町１－９－１１,2026-05-13,株式会社
株式会社ＡＶＡＮＴＥ,大阪府大阪市北区曾根崎新地１丁目１番４３号第２大川ビル２階,2026-05-13,株式会社
株式会社ＡＺＡＮＡ　ｃａｐｉｔａｌ　ａｓｓｏｃｉａｔｅｓ,東京都千代田区麹町５丁目３番地第７秋山ビルディング８Ｆ,2026-05-13,株式会社
株式会社ＡＺＵＲＩＯＮ,神奈川県横浜市神奈川区羽沢町６２９番地２,2026-05-13,株式会社
株式会社Ａｒｄｅｎｙｓ,東京都江戸川区松江５丁目６番８号,2026-05-13,株式会社
株式会社Ａｖｅｒ,東京都大田区池上１丁目３５－１１ラメゾンドセレニテ１０３,2026-05-13,株式会社
株式会社ＢＯＮＳＡＩ　ＥＬＹＳＥＥ,東京都港区南青山７丁目４番２号アトリウム青山３０１号,2026-05-13,株式会社
株式会社Ｂｅａｕｅｌ,大阪府大阪市天王寺区寺田町２丁目５番６号,2026-05-13,株式会社
株式会社Ｂｏｃｃａ,大阪府大阪市城東区今福南４丁目１２番３号,2026-05-13,株式会社
株式会社Ｂｒｅａｔｈ,兵庫県西宮市川添町１３番２－３０３号,2026-05-13,株式会社
株式会社Ｂｒｉｄｅｘ,埼玉県さいたま市南区大字大谷口１０６３番地,2026-05-13,株式会社
株式会社Ｃ．ｍｏｏｎ,愛知県名古屋市千種区神田町１０番８号,2026-05-13,株式会社
株式会社ＣＡＮＤＹ　ＣＩＲＣＵＳ,和歌山県日高郡印南町大字西ノ地３３番地の１,2026-05-13,株式会社
株式会社ＣＥＬＥＢＲＡＴＥ,岡山県岡山市南区新保１００‐３０ウォークイン１０２,2026-05-13,株式会社
株式会社ＣＬＣ北九州,福岡県北九州市八幡東区荒生田１丁目４番５号小野ビル２Ｆ,2026-05-13,株式会社
株式会社ＣＯＣＯＲＯ,神奈川県横浜市栄区公田町１５２２番地２,2026-05-13,株式会社
株式会社ＣＯＬＬＥＣＯ,兵庫県神戸市中央区磯辺通４丁目１番２８－４２１号,2026-05-13,株式会社
株式会社ＣＯＮＤＯＲ,東京都品川区南品川４丁目１３－８ＳＴレジデンス南品川６０２,2026-05-13,株式会社
株式会社ＣＲＥＤＯ,宮城県名取市高舘吉田字内舘１番地,2026-05-13,株式会社
株式会社ＣＳＩ,静岡県駿東郡清水町徳倉２７０６番地,2026-05-13,株式会社
株式会社Ｃｉｒｃｕｌａｔｉｏｎ,東京都港区芝２丁目５番１９号ＩＴＯビル４階,2026-05-13,株式会社
株式会社Ｃｒａｚｙ　Ｊａｓｍｉｎｅ　Ｔｏｋｙｏ,東京都渋谷区本町３丁目４７番１０号,2026-05-13,株式会社
株式会社ＤＩＧ,鹿児島県鹿児島市与次郎２丁目８番３－１５０６号,2026-05-13,株式会社
株式会社ＤＫＰＮ,大阪府大阪市福島区海老江３丁目２３番４３号,2026-05-13,株式会社
株式会社ＤＯＯＲ,東京都港区南青山６丁目１２番１０号ユニティ２階２０１,2026-05-13,株式会社
株式会社ＤｅｅｐＲｏｏｔｓ,東京都渋谷区広尾１丁目２番地１号ヒカリビル４階,2026-05-13,株式会社
株式会社Ｄｉａｍｏｎｄ　Ｌａｂ　Ｊａｐａｎ,東京都中央区銀座１丁目２２番地１１号銀座大竹ビジデンスビル２Ｆ,2026-05-13,株式会社
株式会社Ｄｉｓｃｏ,大阪府大阪市西区靱本町１丁目７番２６号,2026-05-13,株式会社
株式会社ＥＣＶＯ,大阪府大阪市福島区福島７丁目１番１０号２階ＧＲＡＮＤＳＬＡＭ内,2026-05-13,株式会社
株式会社ＥＩＧＨＴ,神奈川県横浜市戸塚区汲沢町１０７１番地,2026-05-13,株式会社
株式会社ＥＰＬＵＳ,兵庫県尼崎市東難波町３丁目２１番７号リヨンドハイツ１Ｆ,2026-05-13,株式会社
株式会社ＥＶＩＳＴＡＴＥ,兵庫県西宮市高松町４番８－９０４号,2026-05-13,株式会社
株式会社ＥｎＣｈａｒｍ,東京都港区赤坂８丁目４番１０－９０３号,2026-05-13,株式会社
株式会社Ｅｐｏｎｙｍ,東京都新宿区西新宿３丁目３番１３号西新宿水間ビル２階,2026-05-13,株式会社
株式会社ＥｒａＲｉｓｅ,東京都渋谷区道玄坂１丁目１０番８号渋谷道玄坂東急ビル２Ｆ－Ｃ,2026-05-13,株式会社
株式会社Ｆａｃｔｏｒｉｅｓ,東京都渋谷区富ヶ谷１丁目４４番１６号コーポ金子２０３号室,2026-05-13,株式会社
