法人名,住所,設立日,法人種別
一般社団法人日本みらい企業機構,東京都品川区西五反田１丁目１７番１号,2021-08-13,その他の設立登記法人
一般社団法人日本カンナビジオール普及機構,東京都港区南麻布５丁目１５番２号スカーラ広尾ステーションプラザ２０５号,2021-08-13,その他の設立登記法人
一般社団法人日本コンソーシアムチェーン連盟,東京都港区港南２丁目１６番２号,2021-08-13,その他の設立登記法人
一般社団法人日本福祉タッチケア協会,東京都新宿区百人町２丁目８－２金子ビル２階,2021-08-13,その他の設立登記法人
一般社団法人漫画芸術,東京都中央区日本橋人形町１丁目１番１１号,2021-08-13,その他の設立登記法人
一般社団法人針ヶ別所未来開発,奈良県奈良市針ヶ別所町６７０番地の１,2021-08-13,その他の設立登記法人
一般社団法人Ｍａｎｅｎ,東京都港区虎ノ門５丁目１番４号,2021-08-13,その他の設立登記法人
一般財団法人日本ひとのわ財団,東京都中央区湊２丁目１１番１号シティタワー銀座東９１９号,2021-08-13,その他の設立登記法人
三祥ソーラー合同会社,兵庫県神戸市中央区中山手通３丁目４番８号,2021-08-13,合同会社
三豊技研株式会社,石川県金沢市平和町２丁目２８番７６号,2021-08-13,株式会社
丸十合同会社,東京都渋谷区渋谷２丁目１０番１５号,2021-08-13,合同会社
乙丸温泉館,大分県由布市湯布院町川上３５７１,2021-08-13,その他
井の国建設株式会社,静岡県浜松市北区引佐町伊平１４０４番地,2021-08-13,株式会社
入間郡市歯科医師会訪問診療相談センター,埼玉県狭山市狭山台３丁目１０－４,2021-08-13,その他
内山空調株式会社,福岡県飯塚市大分５２７番地１５,2021-08-13,株式会社
勝栄工業株式会社,北海道滝川市西町５丁目８番３４号,2021-08-13,株式会社
医療法人社団メイプルＤＣ,岡山県岡山市北区御津宇垣１６８７番２,2021-08-13,その他の設立登記法人
千葉日光貿易サービス株式会社,千葉県匝瑳市平木３２３０番地,2021-08-13,株式会社
合同会社いずみパートナーズ,愛知県名古屋市東区泉１丁目１０番２３号,2021-08-13,合同会社
合同会社かもめ,東京都世田谷区用賀２丁目２１番１号,2021-08-13,合同会社
合同会社ことばｍｉｒａｉ,奈良県生駒市萩の台１丁目１番５－２０５号,2021-08-13,合同会社
合同会社こどもメイト,北海道北広島市大曲並木３丁目１８番１４号,2021-08-13,合同会社
合同会社さつき,鳥取県東伯郡北栄町大島字新橋東川端１１３－２,2021-08-13,合同会社
合同会社つくってみた,岐阜県加茂郡白川町黒川９９６番地１,2021-08-13,合同会社
合同会社つみき,神奈川県小田原市前川３２５番地,2021-08-13,合同会社
合同会社となりアート,東京都品川区西五反田８丁目２番１２号７Ａ,2021-08-13,合同会社
合同会社ねがいぼし,岡山県倉敷市中島１４８５番地１,2021-08-13,合同会社
合同会社ねこ・と,岡山県岡山市南区万倍３１番地５,2021-08-13,合同会社
合同会社ぱんどし,福岡県遠賀郡水巻町伊左座５丁目６－１７,2021-08-13,合同会社
合同会社ひまわり,福岡県北九州市門司区吉志２丁目１８番４３号,2021-08-13,合同会社
合同会社アッチェル,北海道札幌市東区北四十五条東１０丁目５番１０号,2021-08-13,合同会社
合同会社アポロン,神奈川県平塚市長持４２１番地の２,2021-08-13,合同会社
合同会社アムール,東京都中野区上高田１丁目２７－１６－２０５,2021-08-13,合同会社
合同会社エコハート,静岡県浜松市中区萩丘３丁目２番２３号Ｍコープ２－２号室,2021-08-13,合同会社
合同会社エヌエヌ企画,兵庫県神戸市北区星和台１丁目４番地の５,2021-08-13,合同会社
合同会社エピナ,北海道札幌市清田区平岡二条２丁目１番５３号,2021-08-13,合同会社
合同会社エムズサービス,徳島県吉野川市鴨島町麻植塚３０９番地３,2021-08-13,合同会社
合同会社エムドットケー,北海道札幌市西区山の手五条３丁目２番２４号,2021-08-13,合同会社
合同会社エーレフト,東京都世田谷区三宿２丁目１６－１０－３１４,2021-08-13,合同会社
合同会社カチ・アセット・プラン,北海道札幌市中央区宮の森二条１３丁目１２番３０号,2021-08-13,合同会社
合同会社クローネ,東京都港区浜松町２丁目２番１５号浜松町ダイヤビル２Ｆ,2021-08-13,合同会社
合同会社ケープロモーション,東京都目黒区駒場１丁目１６番９号片桐ビル３０２,2021-08-13,合同会社
合同会社コレクト,大阪府大阪市天王寺区石ケ辻町１４番６号,2021-08-13,合同会社
合同会社サンファミリー,東京都大田区北糀谷２丁目１１番８号サンファミリー大塚３０２,2021-08-13,合同会社
合同会社ディオニソス,東京都中央区日本橋小網町１１番８号,2021-08-13,合同会社
合同会社トリプルＴ,大阪府大阪市東成区神路２丁目８番３３号クレアシティ深江橋４０４,2021-08-13,合同会社
合同会社ネイピアホールディングス,東京都千代田区丸の内３丁目１番１号東京共同会計事務所内,2021-08-13,合同会社
合同会社ハブレス,北海道札幌市中央区円山西町５丁目７番２号,2021-08-13,合同会社
合同会社バンブービック,神奈川県横浜市都筑区池辺町３５０８番地１,2021-08-13,合同会社
合同会社フォーアイ,東京都目黒区下目黒１丁目５番１９号,2021-08-13,合同会社
合同会社プラヤビスタ,東京都世田谷区喜多見９丁目２番７－５０３号,2021-08-13,合同会社
合同会社ヘラゾウ,滋賀県草津市東矢倉２丁目１番１号６号室,2021-08-13,合同会社
合同会社ホークス,千葉県浦安市北栄２丁目１８番５１－２０３号ハイツＨＩＲＯ,2021-08-13,合同会社
合同会社ポム,大阪府大阪市中央区西心斎橋２丁目４番１４号３Ｆ,2021-08-13,合同会社
合同会社マーサ・アメニティ,神奈川県横浜市旭区川島町１９７７－２５,2021-08-13,合同会社
合同会社モウコリッタ,大阪府大阪市北区梅田１丁目１－３大阪駅前第３ビル２３０７,2021-08-13,合同会社
合同会社ワイズ,茨城県筑西市舟生１０１８番地５１,2021-08-13,合同会社
合同会社丸二工業,千葉県長生郡白子町関６９７８番地９,2021-08-13,合同会社
合同会社探査リサーチ,徳島県鳴門市撫養町立岩字四枚６５番地,2021-08-13,合同会社
合同会社新堂工務店,埼玉県川口市前川３丁目１８番９号,2021-08-13,合同会社
合同会社浩美ＩＴＮ,千葉県船橋市高根台７丁目９－２３,2021-08-13,合同会社
合同会社煌華,静岡県袋井市久能１９５７番地の１,2021-08-13,合同会社
合同会社鞆鋲釘,広島県福山市鞆町鞆３６２番地,2021-08-13,合同会社
合同会社魚音,東京都渋谷区初台１丁目１１番１２号,2021-08-13,合同会社
合同会社鹿児島ライフサイエンス,鹿児島県鹿児島市唐湊４丁目１８番３８号,2021-08-13,合同会社
合同会社ＡｌｌＦａｍｉｌｉａ,北海道札幌市白石区平和通２丁目南６番２３号エスパシオ白石１１０号室,2021-08-13,合同会社
合同会社Ｂｅｓｔ　Ｌｉｆｅ　Ｐａｒｔｎｅｒ,北海道札幌市北区新琴似八条１３丁目３番１４号,2021-08-13,合同会社
合同会社Ｂｉｅｂｅｒ,東京都大田区上池台３丁目１６－２０,2021-08-13,合同会社
合同会社Ｃ’ｓ　Ｈｏｕｓｅ,東京都町田市中町１丁目４番２号,2021-08-13,合同会社
合同会社ＣＲＥＡスポーツクラブ,東京都品川区二葉１丁目１０番１３号アクサス大井町１０２,2021-08-13,合同会社
合同会社ＥＳＱＵＡＲＥＤ,東京都渋谷区神宮前６丁目２３番４号桑野ビル２階,2021-08-13,合同会社
合同会社ＦＩＳＨＥＲＭＡＮ,東京都練馬区上石神井２丁目１６番１５号,2021-08-13,合同会社
合同会社ＧＡ,福岡県福岡市早良区荒江３丁目１０番７－４０２号ギャラン荒江,2021-08-13,合同会社
合同会社ＨＫビルマネジメント,東京都世田谷区北烏山７丁目５番４号,2021-08-13,合同会社
合同会社ＨｉｇｈＲｏａｄカンパニー,東京都豊島区要町２丁目１番１８号アイコート池袋２０５号室,2021-08-13,合同会社
合同会社Ｈｉｌｌ　Ｃａｐｅ,神奈川県座間市東原３丁目５番１０号,2021-08-13,合同会社
合同会社ＩＲＥ,千葉県旭市ハの２０４番地３,2021-08-13,合同会社
合同会社Ｉｋｏｉ,長野県北佐久郡軽井沢町大字長倉８１７－１イングルヌック２０２号室,2021-08-13,合同会社
合同会社Ｋ＆Ｓ,愛知県弥富市鯏浦町中六１９９番地,2021-08-13,合同会社
合同会社ＫＣＲ１,東京都中央区日本橋１丁目４番１号,2021-08-13,合同会社
合同会社ＫｉＳａ,東京都国立市東２丁目３番地の４,2021-08-13,合同会社
合同会社Ｌ’ｓ,北海道札幌市中央区北十条西１５丁目１番地５７ブランズ札幌桑園駅前ウエスト１２０３号,2021-08-13,合同会社
合同会社Ｌ＆Ｍ,東京都品川区東五反田２丁目２１番１１号,2021-08-13,合同会社
合同会社ＬＩＮＫ,北海道札幌市中央区南六条西９丁目１０２６番地１３ガイアールＳ６－１０２号,2021-08-13,合同会社
合同会社Ｌｉｆｈｉｌ,北海道札幌市東区北三十六条東１２丁目２番７号,2021-08-13,合同会社
合同会社Ｌｉｌｙｌａｍｐ,東京都大田区東雪谷３丁目７番１２号,2021-08-13,合同会社
合同会社ＭＣＭ　ＪＡＰＡＮ,北海道札幌市東区東苗穂十四条３丁目２３番１２号,2021-08-13,合同会社
合同会社Ｎ－ｌａｂ,宮城県石巻市美園３丁目１４番地１１,2021-08-13,合同会社
合同会社Ｎ．Ｔ．Ｐ,福岡県福岡市博多区博多駅南３丁目１５番２７号マルセン博多ビル５０２号,2021-08-13,合同会社
合同会社ＮＯＯＫＳ,奈良県北葛城郡河合町中山台２丁目１６番地９,2021-08-13,合同会社
合同会社ＰＲＯＳＰＥＲＯＵＳ,東京都渋谷区神宮前１丁目１４番１４号,2021-08-13,合同会社
合同会社ＲＥＳＴＡＲＴ,兵庫県伊丹市鴻池１丁目８－１８－１０１,2021-08-13,合同会社
合同会社ＲＨＹ,静岡県静岡市葵区本通８丁目１番地の４,2021-08-13,合同会社
合同会社Ｒｉｉ　Ｃｏｍｐａｎｙ,東京都目黒区中央町２丁目７番１４号,2021-08-13,合同会社
合同会社ＳＡＪＵＲ２,東京都港区虎ノ門５丁目１番４号,2021-08-13,合同会社
合同会社ＳＫ,埼玉県さいたま市大宮区仲町１丁目２６番地まるさんビル１階,2021-08-13,合同会社
合同会社ＳＲＫ,東京都渋谷区富ヶ谷２丁目２１番１－１０３号,2021-08-13,合同会社
合同会社ＳＴＡＲＳ,東京都豊島区池袋２丁目１１－２アルコイルスＫビル４Ｆ,2021-08-13,合同会社
合同会社ＳＵＮＮＹ,東京都足立区千住緑町１丁目１８番１４号,2021-08-13,合同会社
合同会社Ｓａｎｄａｉ,福島県須賀川市塚田１３３番地,2021-08-13,合同会社
合同会社ＳｐｏＷｅｌｌ,東京都練馬区西大泉４丁目５番２０号,2021-08-13,合同会社
合同会社ＴＡＰＰ,東京都立川市富士見町２丁目１２－８恒和ビル立川２０２,2021-08-13,合同会社
合同会社ＴＫ　ＣＲＡＦＴ,東京都江戸川区江戸川４丁目６番１号,2021-08-13,合同会社
合同会社ＴＫＲ,福岡県北九州市八幡西区黒崎１丁目９番８号キングビル２階,2021-08-13,合同会社
合同会社ＶＩＮＥ,東京都渋谷区恵比寿西１丁目３３番６号,2021-08-13,合同会社
合同会社ｂａｃｙ,東京都渋谷区広尾１丁目１５番３号マスダビル６０１,2021-08-13,合同会社
合同会社ｅ－ｃｅｍ,東京都世田谷区池尻３丁目２８－７リムテラス池尻三宿１０１,2021-08-13,合同会社
合同会社ｍｏｊｉｒｉ,愛知県名古屋市中区栄５丁目２６番３９号ＧＳ栄ビル３Ｆ,2021-08-13,合同会社
合同会社ｎｅｗｍｏｒｅ,東京都板橋区新河岸３丁目１５－７サンライフ新高島平４０２,2021-08-13,合同会社
合同会社ｓｔｅｌｌａ,福岡県福岡市中央区大宮２丁目５番１５－２０１号,2021-08-13,合同会社
合同会社ｙｏｈａｋｕ,奈良県奈良市杉ヶ町３６－１大谷ビル１Ｆ,2021-08-13,合同会社
国分寺コーポ管理組合法人,東京都国分寺市東恋ヶ窪３丁目１０番地２－３０３,2021-08-13,その他の設立登記法人
多田国際社会保険労務士法人,東京都品川区大崎１丁目６番１号,2021-08-13,その他の設立登記法人
大阪ＡＳＴ研究会,大阪府大阪市住吉区万代東３丁目１－５６大阪急性期・総合医療センター感染症内科内,2021-08-13,その他
宇翔株式会社,千葉県船橋市印内２丁目１２－８トモヨシフラット１階Ａ－２号室,2021-08-13,株式会社
尚品東京合同会社,東京都江戸川区東小岩５丁目２３番１７号,2021-08-13,合同会社
山輝工業株式会社,石川県能美市小長野町イ５番地,2021-08-13,株式会社
岩橋商事株式会社,東京都豊島区北大塚３丁目３４番８号,2021-08-13,株式会社
才華建設株式会社,宮城県亘理郡亘理町逢隈中泉字一里原４１番地４,2021-08-13,株式会社
拉拉肥株式会社,東京都世田谷区世田谷１丁目４１番２号,2021-08-13,株式会社
新百合ヶ丘エリアマネジメントコンソーシアム,神奈川県川崎市麻生区万福寺１丁目１－１－６Ｆ,2021-08-13,その他
新良株式会社,福岡県福岡市博多区麦野４丁目１５番３２－１０１号,2021-08-13,株式会社
日光Ｐｌｕｓ２０一般社団法人,東京都千代田区丸の内３丁目１番１号東京共同会計事務所内,2021-08-13,その他の設立登記法人
日本雲途株式会社,東京都豊島区南池袋１丁目１６番１５号ダイヤゲート池袋５階５２８室,2021-08-13,株式会社
東亜エンジニアリング合同会社,兵庫県神戸市東灘区御影中町３丁目２－２－５０５,2021-08-13,合同会社
東和合同会社,千葉県柏市中央１丁目３番３０号,2021-08-13,合同会社
東昇株式会社,埼玉県草加市氷川町２１１７－６,2021-08-13,株式会社
株式会社たけ屋,福岡県久留米市津福本町１３０９番地１,2021-08-13,株式会社
株式会社つかさ,東京都目黒区下目黒２丁目１番２２－２０５号ハイホーム目黒,2021-08-13,株式会社
株式会社つづお,鳥取県鳥取市吉成１００３番地,2021-08-13,株式会社
株式会社はじまり,東京都港区北青山３丁目６－７青山パラシオタワー１１Ｆ,2021-08-13,株式会社
株式会社まごころ園,宮城県石巻市住吉一丁目９－３,2021-08-13,株式会社
株式会社みんなの四つ葉,北海道札幌市中央区南七条西６丁目５番地,2021-08-13,株式会社
株式会社めるかとファーム,千葉県富里市十倉５８７番地３０,2021-08-13,株式会社
株式会社わんぷり,大阪府大阪市西区南堀江３丁目６番５号,2021-08-13,株式会社
株式会社アザブＳＴ,東京都港区麻布十番２丁目１９番１０号ＰＩＡ麻布十番Ⅱ,2021-08-13,株式会社
株式会社アセットハウス,福岡県北九州市八幡西区岡田町１１番２９－１３０１号,2021-08-13,株式会社
株式会社アニマ,埼玉県八潮市大瀬１丁目１０番地２,2021-08-13,株式会社
株式会社アラウンド・ケイ,東京都港区六本木６丁目８番１５号第二五月ビル３階２号室,2021-08-13,株式会社
株式会社アルストロメリア,東京都中央区銀座１丁目２７番１２号,2021-08-13,株式会社
株式会社アーリーワン,広島県広島市中区本川町３丁目１番５号,2021-08-13,株式会社
株式会社ウエストテイル,北海道室蘭市寿町２丁目１１番１７号,2021-08-13,株式会社
株式会社エヌ興産,大阪府大阪市東成区東中本１丁目１番１０号２０２号室,2021-08-13,株式会社
株式会社エーカンパニー,東京都千代田区外神田６丁目７番７号マツダビル２階,2021-08-13,株式会社
株式会社オフショア,岡山県玉野市築港３丁目１０‐３２‐６０２,2021-08-13,株式会社
株式会社クラシノ,福岡県糟屋郡新宮町下府３丁目１７番１０号,2021-08-13,株式会社
株式会社ココロウェルネス,千葉県市川市大野町２丁目１８３－２,2021-08-13,株式会社
株式会社サクラメントリー,埼玉県さいたま市大宮区大成町３丁目５０６番地森田屋ビル１号室,2021-08-13,株式会社
株式会社サクラ鈑金自動車,愛知県春日井市細木町１丁目１６番地４,2021-08-13,株式会社
株式会社ザ・トレード,神奈川県川崎市麻生区金程１丁目１３番２号,2021-08-13,株式会社
株式会社シーホネスト,北海道江別市ゆめみ野南町４７番地の９,2021-08-13,株式会社
株式会社ジェイエス,静岡県静岡市清水区恵比寿町３７番地,2021-08-13,株式会社
株式会社ジェイコミュニティ,北海道札幌市北区北二十四条西４丁目１番２号,2021-08-13,株式会社
株式会社スペランサー元浜,福岡県福岡市西区大字元岡１０５９番地３,2021-08-13,株式会社
株式会社タカハシゴム工業,岐阜県羽島郡笠松町江川２２１番地の１,2021-08-13,株式会社
株式会社ダニエル・ペコ,大阪府豊中市新千里西町２丁目３番１－３０６号,2021-08-13,株式会社
株式会社テットホーム,北海道苫小牧市松風町３番１０号,2021-08-13,株式会社
株式会社テンダーライフ,群馬県富岡市七日市１０９４番地６,2021-08-13,株式会社
株式会社ディレクト,岐阜県岐阜市清本町１０丁目８番地（ライオンズマンション岐阜清本町５０６号室）,2021-08-13,株式会社
株式会社トレンドトレード,北海道旭川市東旭川北一条４丁目１２番１８号メゾンイースト１０１,2021-08-13,株式会社
株式会社トーエーｐｒｏｊｅｃｔプラス,北海道旭川市東光九条１０丁目４番８号,2021-08-13,株式会社
株式会社トークイズム,大阪府大阪市中央区本町橋６番１９号本町第２今岡ビル６０５号,2021-08-13,株式会社
株式会社ドルフィン・バリュー・アップ３号,東京都港区芝公園１丁目１番１号住友不動産御成門タワー７階,2021-08-13,株式会社
株式会社ナカヤマ,北海道札幌市東区東苗穂十四条３丁目２３番２号,2021-08-13,株式会社
株式会社ニコドット,大阪府大阪市北区梅田１丁目２番２－４００号,2021-08-13,株式会社
株式会社ヌルボン,福岡県福岡市博多区美野島２丁目５番２号,2021-08-13,株式会社
株式会社ハピネス３１,福岡県福岡市博多区板付１丁目４番３１－７０１号,2021-08-13,株式会社
株式会社パークス,愛知県名古屋市千種区千種２丁目２３番６号ロイヤルパークス千種５１３,2021-08-13,株式会社
株式会社パーセントプラス,福岡県小郡市小郡２４１３番地の１,2021-08-13,株式会社
株式会社ヒルサイドＮｏＮ,東京都目黒区自由が丘１丁目２４番１６号,2021-08-13,株式会社
株式会社ピアホーム,岡山県岡山市東区西大寺松崎２４８番地１２４,2021-08-13,株式会社
株式会社ピースフロー,東京都目黒区碑文谷２丁目２０番２４－１０４号,2021-08-13,株式会社
株式会社フォーストリーツ,千葉県四街道市和良比２７６番地６１,2021-08-13,株式会社
株式会社フォーセブンティーン,東京都千代田区平河町１丁目３番１４号,2021-08-13,株式会社
株式会社フリーデザイン,福岡県那珂川市中原２丁目１２０博多南駅前ビル３Ｆ,2021-08-13,株式会社
株式会社ブリッジリンクス,神奈川県横浜市神奈川区台町１１番地２９横浜エム・アイビル４０１,2021-08-13,株式会社
株式会社プレイス,東京都渋谷区桜丘町２３番１７号シティコート桜丘４０８,2021-08-13,株式会社
株式会社ホームアンドライフ,千葉県君津市三田３７８番地,2021-08-13,株式会社
株式会社ポロンクセマ,東京都港区南青山２丁目２２番４号秀和南青山レジデンス２０５,2021-08-13,株式会社
株式会社マスダ,大阪府大阪市淀川区新北野２丁目１０番７号,2021-08-13,株式会社
株式会社マゼラン,東京都港区三田４丁目１７番２５号,2021-08-13,株式会社
株式会社ミツケル,東京都大田区多摩川２丁目１３番４号ＬＵＡＮＡ２０１,2021-08-13,株式会社
株式会社ミラスト,埼玉県さいたま市大宮区東町１丁目１２０番地２,2021-08-13,株式会社
株式会社ミント,兵庫県神戸市東灘区甲南町１丁目２番６－４０２,2021-08-13,株式会社
株式会社モモ・バンカーフォワード,福岡県福岡市南区清水３丁目２５番２１－１００２号,2021-08-13,株式会社
株式会社ユーミ,東京都大田区羽田２丁目３１番２号,2021-08-13,株式会社
株式会社ライクホーム,東京都渋谷区本町５丁目４２番１２号サンバレー渋谷１０３号室,2021-08-13,株式会社
株式会社ライズレッカー,北海道札幌市北区篠路町上篠路２７１番地,2021-08-13,株式会社
株式会社リトルファミリー,大阪府貝塚市麻生中１１１番地１７,2021-08-13,株式会社
株式会社リバーリンクス,埼玉県戸田市本町１丁目５番２－５０２号,2021-08-13,株式会社
株式会社ワイエスアール,東京都豊島区西池袋１丁目２９番１４号,2021-08-13,株式会社
株式会社ワイドユニファイ,愛知県名古屋市天白区表山２丁目５０６番地,2021-08-13,株式会社
株式会社三裕,埼玉県北足立郡伊奈町大字小室２６４２番地１,2021-08-13,株式会社
株式会社上村建築工業,高知県香美市土佐山田町宮ノ口６９７番地２,2021-08-13,株式会社
株式会社中天,東京都渋谷区富ヶ谷１丁目１４番１４号４階,2021-08-13,株式会社
株式会社中村格付研究所,神奈川県川崎市多摩区三田１丁目２６番地１２アルシオン生田サンクロールヒルズ７０１,2021-08-13,株式会社
株式会社伊藤商会,大阪府大阪市中央区瓦町１丁目６番１－３０３号,2021-08-13,株式会社
株式会社優屋,大阪府大阪市北区本庄東２丁目４番２－７３５号,2021-08-13,株式会社
株式会社北進,北海道札幌市北区北二十三条西３丁目２番２０－３０１号,2021-08-13,株式会社
株式会社千葉,千葉県市川市八幡３丁目２３番１４号,2021-08-13,株式会社
株式会社博雅国際,神奈川県川崎市川崎区大師駅前２丁目１番１－１３０１号シティテラス川崎鈴木町グランドシーズンズ,2021-08-13,株式会社
株式会社原開発工業,福岡県福津市内殿８１１－１,2021-08-13,株式会社
株式会社吉澤ペイント,埼玉県新座市野寺２丁目１２番１５号,2021-08-13,株式会社
株式会社在宅福祉支援協会,神奈川県横須賀市津久井３丁目１９番２１号ドエルマーサ１０３号室,2021-08-13,株式会社
株式会社夢道場,大阪府大阪市東成区大今里南６丁目３番１０号ローズマンション１階,2021-08-13,株式会社
株式会社大内工業,茨城県ひたちなか市大字東石川１２８６番地サーパス東石川１０８号,2021-08-13,株式会社
株式会社大夢,静岡県静岡市葵区唐瀬２丁目１８番９号リバース唐瀬１０２,2021-08-13,株式会社
株式会社宮誠,千葉県松戸市常盤平柳町２７番地の２９,2021-08-13,株式会社
株式会社山電,鹿児島県鹿児島市川上町２６８２番地５６,2021-08-13,株式会社
株式会社岡部ホールディングス,福岡県福岡市南区野間４丁目４番３２号,2021-08-13,株式会社
株式会社希心,大阪府大阪市都島区片町１丁目２番９号６０１,2021-08-13,株式会社
株式会社平成リフォーム横浜,神奈川県横浜市戸塚区下倉田町２４４番地の３－２Ｆ,2021-08-13,株式会社
株式会社弘和,大阪府大阪市此花区酉島１丁目１４番１４号,2021-08-13,株式会社
株式会社心美葬,愛媛県宇和島市夏目町３丁目１１番２０号,2021-08-13,株式会社
