法人名,住所,設立日,法人種別
株式会社ＪＡくらしサポート町田,東京都町田市忠生３丁目７番地２,2016-07-22,株式会社
株式会社ＪＳＷ,神奈川県横浜市旭区白根２丁目６番２１号,2016-07-22,株式会社
株式会社ＪＵＧＡＲ,東京都渋谷区恵比寿西１丁目１３番５－３０２号,2016-07-22,株式会社
株式会社Ｋ・Ｄ・Ｆ,広島県福山市松永町５丁目３２番１８号,2016-07-22,株式会社
株式会社ＫＷｏｒｋｓ,埼玉県越谷市大間野町２丁目１７４番地１ハッピーライフ里１号棟２０９,2016-07-22,株式会社
株式会社ＬＡＮＤＩＣ,福岡県福岡市博多区中洲５丁目３番８号アクア博多６Ｆ,2016-07-22,株式会社
株式会社ＬＯＢ　ＣＩＴＹ,京都府京都市左京区岩倉長谷町２４４番地,2016-07-22,株式会社
株式会社Ｌｅｓｓ　ｉｓ　ｍｏｒｅ,大阪府岸和田市宮前町６番１号,2016-07-22,株式会社
株式会社ＭＡＲＧＥ,京都府京都市中京区富小路通三条上る福長町１０１番地ＳＡＣＲＡＡＮＮＥＸ５階,2016-07-22,株式会社
株式会社ＭＧＬ,埼玉県川口市並木４丁目１６番１７号,2016-07-22,株式会社
株式会社ＭＩＮＡＭＩ,静岡県静岡市駿河区小鹿７５３番地の５,2016-07-22,株式会社
株式会社ＭＩＹＡ電業,東京都町田市小川１２４４番地１９,2016-07-22,株式会社
株式会社ＭＲ,愛知県名古屋市緑区大将ケ根１丁目１６０７番地,2016-07-22,株式会社
株式会社Ｍｏｎ,北海道札幌市清田区平岡公園東６丁目２番８号,2016-07-22,株式会社
株式会社ＮＡＳＴ,千葉県千葉市緑区おゆみ野１丁目６番地,2016-07-22,株式会社
株式会社ＮＢＡ,愛知県名古屋市南区寺崎町７番１１号,2016-07-22,株式会社
株式会社ＮＥＵＴＲＡＬ,東京都渋谷区道玄坂２丁目１５番１号,2016-07-22,株式会社
株式会社ＮＥＸＴ,大分県大分市大字荏隈９１０番地の１（市営Ｈ８－２０５）,2016-07-22,株式会社
株式会社ＮＥＸＴ　ＥＤＵＣＡＴＩＯＮ,愛知県名古屋市東区筒井３丁目２６番２５号,2016-07-22,株式会社
株式会社ＮＥＸＴ　ＩＮＮＯＶＡＴＩＯＮ,静岡県裾野市富沢２１番地の１０,2016-07-22,株式会社
株式会社ＮＫマネジメント,東京都日野市三沢１丁目１１番地５,2016-07-22,株式会社
株式会社ＮＴＦ太陽光発電所,山形県米沢市大字芳泉町２５７９番２号,2016-07-22,株式会社
株式会社Ｎｅｗ　Ｌｅｇｅｎｄ,福岡県福岡市東区八田１丁目１番１－１００７号,2016-07-22,株式会社
株式会社ＯＤｙ,広島県福山市多治米町２丁目１１番８号,2016-07-22,株式会社
株式会社ＰＡＣＫＥＲＳ,大阪府池田市住吉２丁目１２番１６号,2016-07-22,株式会社
株式会社ＰＦＤｅＮＡ,東京都渋谷区渋谷２丁目２１番１号,2016-07-22,株式会社
株式会社ＰｌｕｓＷＡＮ,高知県四万十市入田２５９２番地１,2016-07-22,株式会社
株式会社ＰｏＰｏ,福岡県福岡市博多区中洲４丁目１－３１マエダビル２Ｆ,2016-07-22,株式会社
株式会社Ｐｒｅｓｉｄｅｎｔ　Ｂａｎｋ,福岡県福岡市博多区博多駅南１丁目１２番３－１００２号,2016-07-22,株式会社
株式会社ＲＥＡＬＱ,東京都渋谷区神宮前３丁目１５番２２－２０３号,2016-07-22,株式会社
株式会社ＲＥＣＯＥ’ｓ,神奈川県三浦郡葉山町堀内５６２番地堀内５６２タウンハウスＣ,2016-07-22,株式会社
株式会社ＲＰＬＵＳ　Ｌａｂ,沖縄県那覇市港町２丁目７－７－３Ｆ,2016-07-22,株式会社
株式会社Ｒｏｓｅ　Ｇｒａｃｅ,東京都町田市玉川学園７丁目９番１号,2016-07-22,株式会社
株式会社Ｓ－ＴＹＫＫソーラー・パワー,東京都港区南麻布１丁目２７番２２号,2016-07-22,株式会社
株式会社ＳＨＯＫＵＣＨＯ,広島県広島市中区三川町３番２２号,2016-07-22,株式会社
株式会社ＳＩＡＬ　ＴＲＡＤＩＮＧ,宮城県仙台市青葉区中山吉成２丁目１４番３１号,2016-07-22,株式会社
株式会社ＳＩＮＥ,東京都品川区小山台２丁目１番１号,2016-07-22,株式会社
株式会社Ｓａｋｕｒａ　Ｍｏｔｏｒｓ,福岡県筑紫野市大字牛島２８２－１,2016-07-22,株式会社
株式会社Ｓｅａ＆Ｓｋｙ,京都府京都市中京区聚楽廻南町４１番地２,2016-07-22,株式会社
株式会社Ｓｔｕｄｉｏ　ｐｉｓｔｉｓ,東京都東大和市桜が丘１丁目１４２５番地の３、４３１号,2016-07-22,株式会社
株式会社Ｔ＆Ｆ,熊本県熊本市東区若葉１丁目３７番１１号２Ｆ,2016-07-22,株式会社
株式会社ＴＡ＆Ｃオフィス,大阪府大阪市西区北堀江１丁目２３番２５－１９０４号,2016-07-22,株式会社
株式会社ＴＡＩＬ＆ＭＯＯＮ,神奈川県横浜市栄区尾月１１番２号,2016-07-22,株式会社
株式会社ＴＩＧＲＩＳ,埼玉県川口市坂下町２丁目１４番１６号,2016-07-22,株式会社
株式会社ＴＯＭＩＩ,東京都豊島区千川１丁目３２番１５号,2016-07-22,株式会社
株式会社ＴＳＵＭＵＧＵ,京都府京都市下京区若宮通正面下る鍵屋町６３３番地１,2016-07-22,株式会社
株式会社Ｔｅｒｅｓａ,東京都江東区豊洲１丁目２番３９号,2016-07-22,株式会社
株式会社Ｕ－ｔｒｅａｔ,大阪府大阪市中央区西心斎橋２丁目１７番８号,2016-07-22,株式会社
株式会社ＵＭＥＫＡＷＡ,東京都台東区浅草橋２丁目２９番１４号,2016-07-22,株式会社
株式会社Ｗｏｒｌｄ　Ｊ　Ｃｏｎｑｕｅｓｔ,東京都北区赤羽１丁目１１番４号アポー赤羽ビル５階ＩＭＢ赤羽５１２,2016-07-22,株式会社
株式会社ＹＯＵＴＨ,宮城県仙台市若林区石名坂５７番地,2016-07-22,株式会社
株式会社Ｚｏ企画,福岡県福岡市西区姪の浜４丁目１番２３号,2016-07-22,株式会社
株式会社ｃｈａｒｔａ　ｍｅｄｉｃｕｓ,新潟県新潟市中央区万代４丁目８番２０－６０２号,2016-07-22,株式会社
株式会社ｇｒｅｅｄｅｎ,大阪府大阪市北区本庄西１丁目６番１４号第一明和ビル,2016-07-22,株式会社
株式会社ｉｐａ,東京都港区北青山２丁目７番２０号猪瀬ビル２Ｆ,2016-07-22,株式会社
株式会社ｉｔｏｍ,東京都新宿区新宿５丁目４番２４号,2016-07-22,株式会社
株式会社ｍｏｎａｃａ,東京都北区赤羽北１丁目１５番５号,2016-07-22,株式会社
株式会社ｓｏｕｖｅｎｉｒ,島根県安来市安来町１１９３番地,2016-07-22,株式会社
森﨑エステート株式会社,神奈川県横須賀市津久井２丁目４番２２号,2016-07-22,株式会社
横浜ベイオートアンドマシナリー合同会社,神奈川県横浜市瀬谷区二ツ橋町１８３番地５ライオンズヴィアーレ三ツ境２０４号室,2016-07-22,合同会社
橙株式会社,東京都新宿区払方町７番地Ｂ－２２２,2016-07-22,株式会社
気仙町けんか七夕保存会,岩手県陸前高田市矢作町字東角地１０－３,2016-07-22,その他
深海合同会社,神奈川県相模原市中央区共和３丁目９番１１号,2016-07-22,合同会社
灰塚農事組合法人,熊本県菊池郡大津町大字灰塚１６０番地３,2016-07-22,その他の設立登記法人
特定非営利活動法人アスレチッククラブもりや,茨城県取手市米ノ井６６番地１１,2016-07-22,その他の設立登記法人
特定非営利活動法人サイエンスリンク,東京都世田谷区岡本３丁目４１番１１号世田谷岡本サンハイツ３０６号,2016-07-22,その他の設立登記法人
特定非営利活動法人サークルズ,東京都豊島区南池袋１丁目８番２４－１１０２号,2016-07-22,その他の設立登記法人
特定非営利活動法人チーム橋守半兵衛,東京都新宿区西早稲田３丁目２４番７号,2016-07-22,その他の設立登記法人
特定非営利活動法人ヨガラジオ体操普及協会,神奈川県横浜市港南区上大岡西２丁目１番１９号須藤ビル４Ｆ,2016-07-22,その他の設立登記法人
特定非営利活動法人教員サポートＳｍｉｌｅういんず,新潟県新潟市西区小新３丁目１５番７号,2016-07-22,その他の設立登記法人
特定非営利活動法人浄土ヶ浜ネイチャーガイド,岩手県宮古市藤原上町５番１５号,2016-07-22,その他の設立登記法人
特定非営利活動法人鈴鹿市馬術協会,三重県鈴鹿市北玉垣町８２３番地の１,2016-07-22,その他の設立登記法人
特定非営利活動法人鶴岡市芸術文化協会,山形県鶴岡市上山添字文栄１００番地鶴岡市櫛引庁舎内,2016-07-22,その他の設立登記法人
珍味楼合同会社,埼玉県川口市西川口５丁目４番１９号,2016-07-22,合同会社
畑中電気合同会社,兵庫県神戸市長田区川西通５丁目１０７番地の８,2016-07-22,合同会社
社会保険労務士法人協心,東京都新宿区新宿１丁目２６番６号,2016-07-22,その他の設立登記法人
社会福祉法人寿憩会,岩手県一関市地主町２番２６号,2016-07-22,その他の設立登記法人
社会福祉法人華桜会,新潟県新潟市中央区近江２丁目１１番１７号,2016-07-22,その他の設立登記法人
福祥合同会社,長野県中野市大字新保７９７番地,2016-07-22,合同会社
秋行合同会社,神奈川県川崎市川崎区大島２丁目７番１３－２０１号スカイヴィレッジ,2016-07-22,合同会社
第一食品株式会社,埼玉県八潮市大字西袋１番地５,2016-07-22,株式会社
蔵王特殊グリーン株式会社,宮城県刈田郡蔵王町大字平沢字立目場８５番地１,2016-07-22,株式会社
賀茂管財株式会社,東京都台東区松が谷４丁目７番５号,2016-07-22,株式会社
輝盛株式会社,東京都江東区北砂３丁目３１－７,2016-07-22,株式会社
農事組合法人満穴ファーム,佐賀県佐賀市本庄町大字末次８５９番地,2016-07-22,その他の設立登記法人
隆鑫株式会社,東京都文京区湯島２丁目３１－１７,2016-07-22,株式会社
雲通株式会社,大阪府大阪市天王寺区堀越町１０番１１号,2016-07-22,株式会社
高橋塗装株式会社,東京都江戸川区平井４丁目２番３号,2016-07-22,株式会社
高翔工業株式会社,埼玉県川口市大字木曽呂５２０番地の２２,2016-07-22,株式会社
ＡｃｃｕｍＢｉｔ株式会社,東京都渋谷区桜丘町２３番１７号シティコート桜丘４０８,2016-07-22,株式会社
Ａｕｒｏｒａ株式会社,神奈川県横浜市中区羽衣町３丁目６３番地羽衣ビル７Ａ室,2016-07-22,株式会社
ＢＭ　Ｊａｐａｎ株式会社,東京都港区元赤坂１丁目２番７号赤坂Ｋタワー１９階,2016-07-22,株式会社
Ｂａｒｄｏｎ株式会社,茨城県守谷市久保ケ丘２丁目３番地２,2016-07-22,株式会社
Ｂｅａｕｔｙ　Ｂｏｏｋ　Ｊａｐａｎ合同会社,東京都目黒区東が丘１丁目７番８号,2016-07-22,合同会社
Ｂｒｉｓｔｏｌ　Ｌａｎｄ　Ｖｅｎｔｕｒｅｓ合同会社,東京都中野区弥生町４丁目３５番１号,2016-07-22,合同会社
ＣＨＵＮＬＥＥ合同会社,東京都新宿区北新宿１丁目３０番３０号,2016-07-22,合同会社
Ｃｏｒｎｅｒｓｔｏｎｅ株式会社,東京都大田区田園調布本町２１番５号,2016-07-22,株式会社
ＧｒａｃｅＬｉｆｅ合同会社,三重県四日市市ときわ４丁目９番２号クオーレトラストⅡ１０５号,2016-07-22,合同会社
Ｈ．Ｇ株式会社,静岡県島田市井口６６６番地,2016-07-22,株式会社
ＩＮＳＡＡＦ　ＴＲＡＤＩＮＧ合同会社,神奈川県愛甲郡愛川町中津太田窪３４８４番地３,2016-07-22,合同会社
Ｉｎｓｔｏｌｌ株式会社,東京都港区芝公園１丁目２番９号,2016-07-22,株式会社
ＪＥＴＳＵＲＦ　ＪＡＰＡＮ株式会社,神奈川県横浜市中区長者町２丁目５番地１１,2016-07-22,株式会社
ＪＰＣ第２０号株式会社,東京都中央区八重洲１丁目７番２０号,2016-07-22,株式会社
ＪＳＣ株式会社,神奈川県高座郡寒川町岡田４丁目１７番２６号,2016-07-22,株式会社
ＫＫＬ合同会社,東京都港区虎ノ門４丁目１番２１号,2016-07-22,合同会社
Ｋａｚｚ＆Ｃｏ．合同会社,北海道札幌市中央区南九条西２１丁目４番２３－１００２号,2016-07-22,合同会社
Ｌｉｂｅ株式会社,大阪府松原市一津屋５丁目２６番１０号,2016-07-22,株式会社
ＭＪ物流リート投資法人,東京都千代田区丸の内２丁目５番１号,2016-07-22,その他の設立登記法人
ＭＴＥＣ株式会社,滋賀県守山市今浜町２５７３番地６,2016-07-22,株式会社
ＭＹＡＧＤＩ　ＩＮＴＥＲＮＡＴＩＯＮＡＬ株式会社,愛知県名古屋市東区筒井１丁目１２番３０号コーポラ建中１階,2016-07-22,株式会社
ＮＡＭ　ＳＥＩＫＯ株式会社,埼玉県川越市霞ケ関北４丁目２２番地１４,2016-07-22,株式会社
ＮＡＮＢＯＫＵ総合企画株式会社,大阪府大阪市中央区日本橋１丁目１番２号,2016-07-22,株式会社
ＮＰＯ法人Ｇｏｏｄ　Ｌｉｆｅ　Ｓｔｙｌｅ,群馬県藤岡市鮎川１８３番地７,2016-07-22,その他の設立登記法人
ＯＦＦＩＣＥきりゅう合同会社,福岡県飯塚市鯰田１７７８番地,2016-07-22,合同会社
ＯＴＡ合同会社,岡山県岡山市南区大福５１４番地６,2016-07-22,合同会社
ＰＵＮＴＯ株式会社,東京都八王子市下恩方町８８９番地６,2016-07-22,株式会社
Ｓｈｉｍｉｚｕ　Ｔｒａｄｉｎｇ合同会社,東京都墨田区立花５丁目４３番６号,2016-07-22,合同会社
Ｓｕｎ　Ｃｅｎｔｕｒｙ　Ｄｅｖｅｌｏｐｍｅｎｔ合同会社,東京都杉並区宮前５丁目３番１３号,2016-07-22,合同会社
Ｓｕｎ　Ｃｅｎｔｕｒｙ　Ｈｏｌｄｉｎｇ合同会社,東京都杉並区宮前５丁目３番１３号,2016-07-22,合同会社
Ｓｕｎｇｅｎ　Ｅｎｅｒｇｙ　Ｉｎｔｅｒｎａｔｉｏｎａｌ株式会社,東京都杉並区宮前５丁目３番１３号,2016-07-22,株式会社
Ｔ‐ＫＩＤＳ株式会社,東京都渋谷区南平台町１６番１７号,2016-07-22,株式会社
ＴＡＡ＆秀好舎株式会社,東京都豊島区上池袋２丁目３８番１１号,2016-07-22,株式会社
ＴＡＫトレーディング株式会社,埼玉県所沢市東町１３番２９号,2016-07-22,株式会社
ＴＥＣ２２株式会社,広島県広島市東区中山中町１１番８―２０５号,2016-07-22,株式会社
ＴＨＯＩ　ＴＲＡＮＧ　ＶＩＥＴ合同会社,東京都福生市武蔵野台１丁目５番地１武蔵野台マンション１０３号,2016-07-22,合同会社
ＴＳＫ株式会社,埼玉県さいたま市浦和区本太１丁目１２番３２号,2016-07-22,株式会社
Ｔａｎｉｋｅｎ合同会社,大阪府堺市中区堀上町８１－１番地９号,2016-07-22,合同会社
Ｔａｓｏｎｃｏ合同会社,京都府長岡京市神足大張２０番地１（Ｂ－１０１１）メイツブラン長岡京,2016-07-22,合同会社
Ｔｒａｄｅ　Ｎｉｈｏｎ合同会社,東京都中野区本町４丁目４４番１３－２Ｆ－１６,2016-07-22,合同会社
Ｔｒｅｎｄｓｐｌａｎｔ　Ｊａｐａｎ合同会社,東京都世田谷区上祖師谷１丁目２８番１２号フォレストーネＴ,2016-07-22,合同会社
Ｔｒｉｇｈｔ株式会社,東京都中央区新川１丁目２２番１２－６０１号,2016-07-22,株式会社
ＶＩＣ株式会社,神奈川県横浜市西区岡野１丁目９番１３号,2016-07-22,株式会社
ｍｙ・オフィス株式会社,静岡県静岡市駿河区敷地２丁目１番４１号,2016-07-22,株式会社
おかげさまデザイン株式会社,東京都千代田区岩本町３丁目３番３号,2016-07-25,株式会社
けんご株式会社,東京都港区三田５丁目７番８－１０２０号,2016-07-25,株式会社
こだま興業株式会社,山形県東置賜郡高畠町大字高畠３５８番地１サン・ヴァンカンＡ２０１,2016-07-25,株式会社
まつばや百貨店株式会社,長崎県大村市松並２丁目８９４番地,2016-07-25,株式会社
やわらか製作所株式会社,福岡県久留米市田主丸町船越１１７０番地５,2016-07-25,株式会社
ゆこゆこホールディングス株式会社,東京都千代田区紀尾井町４番１号,2016-07-25,株式会社
アイル合同会社,秋田県秋田市保戸野桜町１５番３９号,2016-07-25,合同会社
アウル株式会社,愛知県名古屋市中川区野田３丁目１６５番地,2016-07-25,株式会社
アオイコンサルタンツ株式会社,兵庫県神戸市中央区国香通７丁目１番６号,2016-07-25,株式会社
アシストタイヤサービス株式会社,埼玉県東松山市大字古凍９３０番地１,2016-07-25,株式会社
アトール五月女ＵＳＡ　ＩＮＣ,東京都渋谷区千駄ヶ谷２丁目３７－８五月女ビル＃５０５,2016-07-25,外国会社等
アリエ合同会社,沖縄県那覇市牧志１丁目３番地１７号,2016-07-25,合同会社
アンドライツ株式会社,愛知県瀬戸市北脇町２１番地の６,2016-07-25,株式会社
アースネクサス株式会社,大分県大分市大字横尾３８３６番地の２,2016-07-25,株式会社
ウイリアム・クレイン合同会社,東京都港区南青山２丁目２番１５－９４２号,2016-07-25,合同会社
ウエミ株式会社,大阪府豊中市熊野町１丁目４番６３号,2016-07-25,株式会社
エトワール株式会社,大阪府大阪市淀川区西中島７丁目８番３９号,2016-07-25,株式会社
エニシング合同会社,愛知県名古屋市緑区鳴海町字神ノ倉３番地の５２,2016-07-25,合同会社
エヌソリューション合同会社,埼玉県蕨市北町５丁目１２番２１号,2016-07-25,合同会社
エン会計株式会社,静岡県熱海市福道町３番地１５ウェルネスビル１０２号,2016-07-25,株式会社
オプテックス新事業準備株式会社,滋賀県大津市雄琴５丁目８番１２号,2016-07-25,株式会社
クレバーファイン合同会社,神奈川県藤沢市藤が岡１丁目８番１７号,2016-07-25,合同会社
ケンサ愛豊株式会社,愛知県豊橋市三本木町字東上１０２番地２３,2016-07-25,株式会社
ケー・ティー・アンド・エス特許業務法人,愛知県安城市三河安城本町２丁目１番地１０,2016-07-25,その他の設立登記法人
サイコドライバー合同会社,愛知県名古屋市中区大須３丁目２５番２２号,2016-07-25,合同会社
シルヴァンキャピタル合同会社,東京都品川区上大崎１丁目１１番７号,2016-07-25,合同会社
ジオミックモータースポーツ株式会社,愛知県岡崎市天白町字河原５０番地１,2016-07-25,株式会社
ジョブリンク株式会社,東京都渋谷区千駄ヶ谷４丁目５番１０号,2016-07-25,株式会社
ジーエスイー株式会社,東京都墨田区緑４丁目３６番６－１１０６号,2016-07-25,株式会社
ジー・スリーエコエナジー合同会社,東京都港区南麻布２丁目１０番２号,2016-07-25,合同会社
スターリット株式会社,東京都港区浜松町２丁目２番１５号,2016-07-25,株式会社
スピード株式会社,広島県福山市南蔵王町４丁目１１番２３号,2016-07-25,株式会社
スマートファーム株式会社,東京都千代田区麹町４丁目５番２０号ＫＳビル,2016-07-25,株式会社
スリーパーエージェント株式会社,東京都中央区佃２丁目２番１１号,2016-07-25,株式会社
ディーヴァ株式会社,神奈川県茅ヶ崎市松浪２丁目８番１９－２０２号,2016-07-25,株式会社
ドリーム管工株式会社,愛知県名古屋市北区桐畑町１４９番地,2016-07-25,株式会社
ニッタ工房株式会社,東京都目黒区目黒本町３丁目５番１号山水ハイツ４０１,2016-07-25,株式会社
ネクストブランク株式会社,東京都世田谷区粕谷３丁目２４－１８,2016-07-25,株式会社
ハーデ株式会社,愛知県名古屋市東区泉３丁目４番６号,2016-07-25,株式会社
フリーグーフォ合同会社,神奈川県茅ヶ崎市東海岸北４丁目１４番１１号,2016-07-25,合同会社
フルタニコーポレーション株式会社,石川県金沢市堀川町４番１号,2016-07-25,株式会社
ポシブル株式会社,岐阜県大垣市久徳町２９７番地７,2016-07-25,株式会社
マイキャン・テクノロジーズ株式会社,東京都中央区日本橋箱崎町１番２号,2016-07-25,株式会社
マイルストーンサポート株式会社,福岡県福岡市中央区高砂１丁目２番４号,2016-07-25,株式会社
マキシマス・パルティカ合同会社,東京都港区麻布十番１丁目２番７－７０１号,2016-07-25,合同会社
ヨシホシ株式会社,東京都豊島区高田３丁目３番１６－３１２号,2016-07-25,株式会社
リニューアブルエナジーフロンティア株式会社,大阪府大阪市中央区高麗橋１丁目７番７－４３０１号,2016-07-25,株式会社
リンクエステート合同会社,大分県別府市大字野田８３４番地の３,2016-07-25,合同会社
レジックス合同会社,東京都新宿区三栄町２７－４－８０１,2016-07-25,合同会社
レバレッジ＆パレートワークスラボ株式会社,東京都中央区銀座７丁目１３番６号サガミビル２階,2016-07-25,株式会社
ヴェルデナイト株式会社,神奈川県伊勢原市高森２丁目３０番５号,2016-07-25,株式会社
一般社団法人あおい,東京都北区西ケ原３丁目５３番１４号,2016-07-25,その他の設立登記法人
一般社団法人にじみなと基金,島根県出雲市小津町２３番地１,2016-07-25,その他の設立登記法人
一般社団法人みのりコンサルティング,広島県広島市佐伯区美の里２丁目４番３６－１号,2016-07-25,その他の設立登記法人
一般社団法人アクトランスプロ,愛知県名古屋市西区牛島町６番１号名古屋ルーセントタワー４０階,2016-07-25,その他の設立登記法人
一般社団法人インフィールド,福岡県北九州市小倉南区西貫２丁目３番２号,2016-07-25,その他の設立登記法人
一般社団法人エヌ・エー,沖縄県中頭郡北中城村字喜舎場１３６６番地８,2016-07-25,その他の設立登記法人
一般社団法人サイズダウンビューティーアカデミー,東京都中央区銀座８丁目１４番９号,2016-07-25,その他の設立登記法人
一般社団法人セーフティグローバル推進機構,大阪府大阪市淀川区西宮原２丁目７番５３号Ｍａｒｕｔａビル８階,2016-07-25,その他の設立登記法人
一般社団法人ピュアコミュニケーション,東京都港区北青山３丁目６番７号青山パラシオタワー１１階,2016-07-25,その他の設立登記法人
一般社団法人プラトンアカデミー,大阪府大阪市中央区道修町３丁目３番１０号,2016-07-25,その他の設立登記法人
一般社団法人健康生活創造事業協同組合,東京都中央区日本橋浜町２丁目１６番５号東味ビル２階,2016-07-25,その他の設立登記法人
一般社団法人内臓目覚め協会,愛知県一宮市泉２丁目６番９号,2016-07-25,その他の設立登記法人
一般社団法人大誠学園,北海道札幌市東区本町一条２丁目２番１５号,2016-07-25,その他の設立登記法人
一般社団法人日本おもてなしサービスＪＯＳ協会,東京都新宿区西新宿６丁目１５番１号１７０６,2016-07-25,その他の設立登記法人
一般社団法人日本コインランドリー協会,東京都港区赤坂１丁目２番１７号,2016-07-25,その他の設立登記法人
一般社団法人日本デジタルデトックス協会,東京都中央区八丁堀３丁目６番１号京橋長岡ビル８階,2016-07-25,その他の設立登記法人
一般社団法人日本導体協会,鳥取県米子市皆生温泉４丁目６番３号,2016-07-25,その他の設立登記法人
一般社団法人日本春ウコン協会,沖縄県南城市大里字古堅８５６番地１,2016-07-25,その他の設立登記法人
一般社団法人日本水素水商品販売協会,愛知県名古屋市中区丸の内３丁目５番３３号,2016-07-25,その他の設立登記法人
一般社団法人美姿勢ライフデザインカレッジ,東京都港区南青山２丁目２番１５号ウイン青山９４２,2016-07-25,その他の設立登記法人
一般社団法人認知症改善サポート日本協会,東京都中央区日本橋３丁目４番１５号,2016-07-25,その他の設立登記法人
一般社団法人野菜スイーツ推進協会,愛知県名古屋市中区丸の内２丁目１２番１３号丸の内プラザビル８Ｆ,2016-07-25,その他の設立登記法人
