法人名,住所,設立日,法人種別
株式会社しがぎん事業承継ファンド４号,京都府京都市下京区松原通烏丸西入ル玉津島町３０３番地,2026-05-07,株式会社
株式会社しみずのトタン屋,石川県野々市市矢作４丁目３２番地１９,2026-05-07,株式会社
株式会社ついたち,東京都世田谷区下馬６丁目１８―２―６０４,2026-05-07,株式会社
株式会社なづき,福岡県福岡市博多区博多駅東１丁目１０番２９－１１０１号,2026-05-07,株式会社
株式会社はじまりの芽,愛知県みよし市三好町上７５番地１,2026-05-07,株式会社
株式会社ひろき,岐阜県岐阜市加納新本町４丁目１１,2026-05-07,株式会社
株式会社ほけんミライ,宮城県石巻市大瓜字下大塚前２１番地,2026-05-07,株式会社
株式会社みやなみ,岡山県岡山市北区富町２丁目１３番１１号,2026-05-07,株式会社
株式会社むつニューバッテリー,青森県むつ市金曲１丁目１０番１８号,2026-05-07,株式会社
株式会社めぐり,福岡県福岡市博多区博多駅前１丁目２３番２号－５Ｆ－Ｂ,2026-05-07,株式会社
株式会社よしむら空調設備,大阪府寝屋川市香里新町７番６－９０２号,2026-05-07,株式会社
株式会社りんくす,福岡県北九州市八幡東区桃園１丁目５番１号,2026-05-07,株式会社
株式会社アクセル・モード・ネクスト,新潟県上越市大和５丁目１番５号,2026-05-07,株式会社
株式会社アクト,石川県河北郡内灘町字千鳥台２丁目４０６番地,2026-05-07,株式会社
株式会社アセンリオ,愛媛県宇和島市三間町元宗３２２番地１,2026-05-07,株式会社
株式会社アチーヴィア,奈良県奈良市南永井町乙９８番地の１６,2026-05-07,株式会社
株式会社アーク測量,東京都杉並区荻窪５丁目２８番１２号サカエビル６階,2026-05-07,株式会社
株式会社イト,東京都荒川区南千住２丁目３２－６グローベル南千住駅前２０１,2026-05-07,株式会社
株式会社インスパイア,大阪府泉大津市板原町４丁目２２番１４号ＳＫビル,2026-05-07,株式会社
株式会社オオヤ建工,栃木県宇都宮市田下町１７３番地１,2026-05-07,株式会社
株式会社オフィスヒロタ,徳島県徳島市中吉野町４丁目３番地１,2026-05-07,株式会社
株式会社オフィス浜の宮,和歌山県和歌山市毛見１１０５番地１,2026-05-07,株式会社
株式会社カネデン,山口県山口市小郡東津１丁目１９番３号,2026-05-07,株式会社
株式会社キッズステーション,青森県青森市大字幸畑字谷脇１２４番地７コーポハマナス２０１号室,2026-05-07,株式会社
株式会社クラバスト,岡山県岡山市北区西辛川３０２番地１,2026-05-07,株式会社
株式会社クロスヴィワークス,京都府京都市下京区葛籠屋町５１９,2026-05-07,株式会社
株式会社グリットガレージ,広島県呉市郷原町７１５８番地１,2026-05-07,株式会社
株式会社コウシン,茨城県神栖市神栖３丁目２番２９－１号,2026-05-07,株式会社
株式会社コスモホールディングス,新潟県新潟市西区大学南２丁目８番２４号,2026-05-07,株式会社
株式会社サカモトエンジニアリング,栃木県宇都宮市幕田町３１１番地４,2026-05-07,株式会社
株式会社サニーベル,福岡県久留米市東櫛原町１２６２番地１,2026-05-07,株式会社
株式会社ジェイズ,宮城県仙台市青葉区貝ケ森６丁目１２番２０号,2026-05-07,株式会社
株式会社スズテック,香川県木田郡三木町大字井戸２５７２番地２０,2026-05-07,株式会社
株式会社タカヤマロクノウ,奈良県生駒市俵口町８１４－１－３０２,2026-05-07,株式会社
株式会社チロルワークス,奈良県高市郡明日香村大字平田２９１番地の９９,2026-05-07,株式会社
株式会社ティンカーベル,栃木県佐野市高萩町１３３６番地１４,2026-05-07,株式会社
株式会社トイトミライ,石川県野々市市本町２丁目１番２１号,2026-05-07,株式会社
株式会社ニコ・ナギ,大阪府大阪市中央区高麗橋４丁目６番１４号,2026-05-07,株式会社
株式会社ニブン,愛媛県松山市三番町４丁目４番地６,2026-05-07,株式会社
株式会社ネオネス,広島県広島市安佐南区八木８丁目１１番３号グリーンシティ八木７０２,2026-05-07,株式会社
株式会社ヒューマンワーク,東京都千代田区東神田１丁目１５番９号,2026-05-07,株式会社
株式会社ヒロシゲ,大阪府大阪市此花区島屋４丁目２番３号１階,2026-05-07,株式会社
株式会社ヒロセテクノロジー,大阪府大阪市西区新町１丁目３番１９号ＭＧビルディング,2026-05-07,株式会社
株式会社フィナンシャルテクノソリューション,東京都江東区豊洲３丁目３番３号,2026-05-07,株式会社
株式会社フリーラン,奈良県大和郡山市小泉町７４９－３－１Ｆ,2026-05-07,株式会社
株式会社フルポテンシャル,東京都中央区銀座１丁目１２番４号Ｎ＆ＥＢＬＤ．６Ｆ,2026-05-07,株式会社
株式会社プライムノヴァ,熊本県熊本市中央区南坪井町１０番２４－７１２号,2026-05-07,株式会社
株式会社プロコア,長崎県長崎市稲佐町２番２号,2026-05-07,株式会社
株式会社マネーボックス,東京都江東区塩浜２丁目５番１－４１８号,2026-05-07,株式会社
株式会社ユアファクトリー,京都府京都市山科区厨子奥若林町１－５２,2026-05-07,株式会社
株式会社ユウシン,長崎県長崎市平間町１３０９番地１４,2026-05-07,株式会社
株式会社ユナイト・プランニング・オフィス,東京都中央区日本橋兜町５番１号兜町第１平和ビル３Ｆ,2026-05-07,株式会社
株式会社ヨドラム工業,愛知県稲沢市赤池坂畑町３７番地１,2026-05-07,株式会社
株式会社ライトハウス,奈良県大和郡山市小泉町７４９－３－１Ｆ,2026-05-07,株式会社
株式会社ライフケアサポート,岐阜県岐阜市北一色３丁目９番２１号,2026-05-07,株式会社
株式会社リノワークス,愛知県北名古屋市鍛冶ケ一色一丁目１番地,2026-05-07,株式会社
株式会社リブッチ,愛知県名古屋市東区芳野３丁目６番４号ダイアパレス東白壁Ｂ棟１１０５号,2026-05-07,株式会社
株式会社ルミオラバイオ,東京都中央区日本橋室町３丁目２番１号日本橋室町三井タワー７階,2026-05-07,株式会社
株式会社七顛八起,静岡県藤枝市志太４丁目１２番１０号,2026-05-07,株式会社
株式会社下山自動車,鹿児島県枕崎市下松町７３０番地,2026-05-07,株式会社
株式会社作州ＶＥＴ,岡山県津山市大田１２４番地１,2026-05-07,株式会社
株式会社全国制覇,千葉県柏市明原３丁目４番１０号,2026-05-07,株式会社
株式会社八女ＢＡＳＥ,福岡県八女市立花町白木１０３８番地,2026-05-07,株式会社
株式会社創進建設,山口県山口市黒川１９８７番地１２,2026-05-07,株式会社
株式会社北斗,静岡県駿東郡清水町徳倉１８９５番地の８,2026-05-07,株式会社
株式会社吉加江自動車,岐阜県大垣市静里町７８５番地,2026-05-07,株式会社
株式会社和＆旅,福岡県福岡市東区千早２丁目２５－２７－２Ｆ,2026-05-07,株式会社
株式会社国際ライヘ,静岡県浜松市中央区三幸町９８番地の３美幸の郷北の館Ｎろーａ,2026-05-07,株式会社
株式会社土地制度研究所,京都府京田辺市田辺蕪木２２番地４９,2026-05-07,株式会社
株式会社宝屋,富山県魚津市北鬼江３６４番地,2026-05-07,株式会社
株式会社寧兎,東京都足立区西保木間３丁目９番５号トーキョーベータ竹ノ塚３６－２０４,2026-05-07,株式会社
株式会社山本兵太郎商店,愛媛県松山市湊町４丁目２番地２５,2026-05-07,株式会社
株式会社岩崎工業,静岡県焼津市塩津２７９番地の７,2026-05-07,株式会社
株式会社岸本電工,広島県安芸高田市美土里町北５７１７番地４,2026-05-07,株式会社
株式会社庄司興産,宮城県宮城郡利府町神谷沢字館ノ内２６番地１,2026-05-07,株式会社
株式会社志儀機電設備日本,群馬県高崎市新町２１４７番地７,2026-05-07,株式会社
株式会社志縁左官,大分県別府市大字内竈３５０９番地の８,2026-05-07,株式会社
株式会社慶翔,福岡県北九州市門司区柳原町１１－１７,2026-05-07,株式会社
株式会社手打ちうどん三豊,大阪府東大阪市新町２３番２３号,2026-05-07,株式会社
株式会社未来幼児教育研究所,福島県南相馬市原町区国見町１丁目３８番地の１,2026-05-07,株式会社
株式会社東日本建設,埼玉県上尾市仲町１丁目８番３１号シンワエクセルビル４０１,2026-05-07,株式会社
株式会社松本建具店,石川県金沢市金石北３丁目３番２４号,2026-05-07,株式会社
株式会社松本建築,大阪府堺市西区鳳中町４丁１１３番地１０プランドール２０１号,2026-05-07,株式会社
株式会社板橋農園,栃木県日光市高原１４５番地,2026-05-07,株式会社
株式会社桜坂,福岡県福岡市中央区桜坂３丁目２番１１号,2026-05-07,株式会社
株式会社楚辺,沖縄県那覇市楚辺２丁目３７番４０号,2026-05-07,株式会社
株式会社武巳工芸,山形県山形市大字漆山２４４８番地３,2026-05-07,株式会社
株式会社殿,東京都台東区松が谷３丁目７番１号第５サニーハイツ１０１号室,2026-05-07,株式会社
株式会社浅間板金工業,山梨県富士吉田市浅間１丁目９番１４号,2026-05-07,株式会社
株式会社浜電,大阪府池田市栄町９番７－４０２号,2026-05-07,株式会社
株式会社海集,東京都港区西麻布４丁目１１番２－８０５号,2026-05-07,株式会社
株式会社濱田,和歌山県田辺市上芳養３９１番地の２７５,2026-05-07,株式会社
株式会社百年の食卓,東京都港区高輪３丁目４番１３号,2026-05-07,株式会社
株式会社空創,岡山県倉敷市玉島勇崎８８６‐１,2026-05-07,株式会社
株式会社粟津屋,石川県金沢市増泉２丁目１２番１２号,2026-05-07,株式会社
株式会社船本組,石川県輪島市マリンタウン４番地１７,2026-05-07,株式会社
株式会社良全,茨城県つくば市東平塚８９３番地１,2026-05-07,株式会社
株式会社貴和美不動産,東京都台東区松が谷３丁目１番１４号,2026-05-07,株式会社
株式会社資源循環センター,静岡県浜松市中央区城北３丁目５番１号,2026-05-07,株式会社
株式会社輝幸,大阪府豊中市庄内幸町３丁目２８－２４,2026-05-07,株式会社
株式会社重松建築,長崎県諫早市高来町峰２３９,2026-05-07,株式会社
株式会社青木自動車,奈良県宇陀市室生上笠間４２６番地,2026-05-07,株式会社
株式会社魚半,石川県金沢市香林坊２丁目１２番１５号,2026-05-07,株式会社
株式会社魚太商店,愛知県名古屋市中川区下之一色町字東ノ切３５,2026-05-07,株式会社
株式会社１４ー５４,青森県十和田市稲生町１４－５４,2026-05-07,株式会社
株式会社３６９,愛知県名古屋市東区芳野１丁目７番１７号マストスタイル東白壁７０１号,2026-05-07,株式会社
株式会社Ａ‐ＦＯＲＧＥ,岡山県倉敷市笹沖６３８‐１オークビル２０３,2026-05-07,株式会社
株式会社ＡＩＴＥ,大阪府大阪市北区梅田１丁目１番３号大阪駅前第３ビル１１階２号室,2026-05-07,株式会社
株式会社ＡＭＵ,東京都渋谷区神宮前１丁目１１－１１グリーンファンタジア５０３,2026-05-07,株式会社
株式会社ＡＳＨＩＮＯ　ＢＡＳＥ,山形県山形市高堂２丁目４番１号,2026-05-07,株式会社
株式会社ＡＳＩＪ,東京都台東区竜泉３丁目１番６号小島荘２０１,2026-05-07,株式会社
株式会社ＡＵＲＩＳ,福岡県福岡市中央区御所ヶ谷４番２４号,2026-05-07,株式会社
株式会社ＡＸＥＬＡ,東京都練馬区大泉学園町８丁目２番３２号,2026-05-07,株式会社
株式会社Ａｄｖａｎｃｅｄ　Ａｇｅｎｔ,東京都港区六本木３丁目１６番１２号六本木ＫＳビル５Ｆ,2026-05-07,株式会社
株式会社Ａｉｚａｗａ商会,青森県三沢市大字三沢字園沢２１９番地３０５号,2026-05-07,株式会社
株式会社Ａｎｕｅｎｕｅ,沖縄県沖縄市泡瀬１丁目１６番５号コーポひまわり２－Ａ,2026-05-07,株式会社
株式会社ＡｒｋＵｒｓ,東京都港区北青山１丁目３－１アールキューブ青山３Ｆ,2026-05-07,株式会社
株式会社ＡｒｔｅｒｉＸ,東京都大田区西糀谷１丁目９番１６－３０３号,2026-05-07,株式会社
株式会社Ａｒｕｍ,北海道札幌市西区発寒十五条４丁目７番２２号,2026-05-07,株式会社
株式会社Ａｓｔｉｒｉａ,東京都千代田区外神田５丁目５－１５和光ビル,2026-05-07,株式会社
株式会社Ａｔｕｙ,北海道札幌市東区伏古三条２丁目４番４１号,2026-05-07,株式会社
株式会社Ａｙｕｓ　Ｌｉｖｉｎｇ,東京都港区芝浦４丁目１２－３３芝浦新本ビル３階,2026-05-07,株式会社
株式会社ＣＦアセット,東京都板橋区徳丸１丁目９―７ヒルズ徳丸３Ｂ,2026-05-07,株式会社
株式会社ＣＯＣＯ,東京都港区南青山２丁目１４番１４号フロムファースト南青山３０２号室,2026-05-07,株式会社
株式会社ＣＯＣＯ　ＤＲＥＡＭ　ＳＴＡＧＥ,奈良県大和高田市大字築山１４６番地７,2026-05-07,株式会社
株式会社Ｃａｒｅｅｒ　Ｆｕｌｌ　Ｌｉｆｅ,大阪府大阪市淀川区塚本４丁目１６番６号,2026-05-07,株式会社
株式会社Ｃａｒｒａｒｉａ,福岡県福岡市中央区赤坂１丁目１４番２２号センチュリー赤坂門ビル１Ｆ－Ｄ,2026-05-07,株式会社
株式会社Ｃｏｍｂｉｎｅｄ　Ｄｅｓｉｇｎ,東京都港区北青山１丁目３番１号アールキューブ青山３階,2026-05-07,株式会社
株式会社Ｄｏｇｇｙ＆Ｂｕｄｄｙ,東京都港区北青山１丁目３番１号アールキューブ青山３階,2026-05-07,株式会社
株式会社Ｅｎ,宮城県仙台市青葉区国分町１丁目１番１７号寿々力ビル３Ｆ,2026-05-07,株式会社
株式会社ＦＵＭＩ,北海道札幌市豊平区美園七条６丁目２番１４号,2026-05-07,株式会社
株式会社Ｆｉｌ,大阪府大阪市淀川区木川東４丁目１１番１－９０２,2026-05-07,株式会社
株式会社Ｆｉｒｓｔ,山形県山形市西田２丁目２４番５０号,2026-05-07,株式会社
株式会社Ｆｏｕｎｄｏｔ,茨城県鹿嶋市大字宮中２３３２番地１２４,2026-05-07,株式会社
株式会社ＧＥＥＴＡＱＡ,東京都大田区仲池上２丁目５番５号レクセルマンション西馬込５０７号室,2026-05-07,株式会社
株式会社Ｇｏｏｄ　Ｌｉｎｋｓ,福岡県福岡市中央区天神２丁目２番１２号Ｔ＆Ｊビルディング７Ｆ,2026-05-07,株式会社
株式会社Ｈ＆Ｋ　Ｇｒｏｕｐ,愛知県岩倉市大地町野合３８番地,2026-05-07,株式会社
株式会社ＨＡＪＩＭＥ,山口県山口市若宮町１番６１号,2026-05-07,株式会社
株式会社ＨＡＬＯ,群馬県高崎市箕郷町矢原２２２３番地,2026-05-07,株式会社
株式会社ＨＥＲＯ’Ｓ　ＬＡＢＥＬ,東京都港区赤坂３丁目２１番１４号ＴＳ共和六番館Ｂ１,2026-05-07,株式会社
株式会社ＨＯＰＰＥＲ,東京都清瀬市下宿２丁目５７７－３２,2026-05-07,株式会社
株式会社ＨＹ　ＳＴＵＤＩＯ,東京都港区南青山５丁目１７番１２号リオン南青山３０１,2026-05-07,株式会社
株式会社Ｈｕｍｏｎｉｉ,東京都港区虎ノ門１丁目１５番１０号名和メイワビル４階,2026-05-07,株式会社
株式会社Ｉｗａｌｌ,大阪府箕面市彩都粟生南２丁目１７番１１号,2026-05-07,株式会社
株式会社Ｊ２Ｍａｘ　Ｉｎｓｔｉｔｕｔｅ,東京都大田区下丸子４丁目２１番１５号,2026-05-07,株式会社
株式会社ＪＵＮＧＳＥＯ,大阪府大阪市阿倍野区阿倍野筋３丁目３番６号,2026-05-07,株式会社
株式会社Ｊｏｉｎｔ　Ｊｏｕｒｎｅｙ　Ｃｒｅａｔｉｖｅ　Ｊａｐａｎ,東京都港区赤坂７丁目１０番１７号,2026-05-07,株式会社
株式会社ＫＡＮＫＵ．ＴＲＤ,京都府京都市右京区梅津堤下町２番地１,2026-05-07,株式会社
株式会社ＫＩＮＯＶＡ,大分県大分市三佐６丁目３番２５号,2026-05-07,株式会社
株式会社Ｋｏａ,大阪府堺市中区宮園町９番２－８０１号,2026-05-07,株式会社
株式会社Ｋｏｒａｍｏ,東京都八王子市打越町６４５番地１８八王子北野ガーデニア３０９号,2026-05-07,株式会社
株式会社ＬＵＭＥ　ＧＲＯＵＰ,福岡県福岡市中央区天神３丁目６番１７号オフィスニューガイアＣＬＡＩＲ２階,2026-05-07,株式会社
株式会社Ｌａｒｒｙ　Ｅｄｕｃａｔｉｏｎ,兵庫県神戸市須磨区常盤町２丁目３番８－２号,2026-05-07,株式会社
株式会社Ｌｅｐｕｓ　Ｌｕｎａｒｉｓ,愛知県名古屋市中区金山５丁目５－２０日興ビル２階,2026-05-07,株式会社
株式会社Ｌｕｏｒａ,東京都足立区東六月町７番４３号,2026-05-07,株式会社
株式会社ＭＩＬＥＸ,福岡県福岡市中央区天神２丁目２番１２号Ｔ＆Ｊビルディング７Ｆ,2026-05-07,株式会社
株式会社ＭＯＴＯ,長崎県長崎市家野町８番８号,2026-05-07,株式会社
株式会社ＭＹスマイルコーポレーション,大阪府松原市上田８丁目５番２０号,2026-05-07,株式会社
株式会社Ｍｏｒｅ　ｔｈａｎ　Ｓｉｘ,和歌山県和歌山市中６４９番地の３フォレストヒルズふじと台５０４号,2026-05-07,株式会社
株式会社Ｎ８ＧＲＯＵＰ,大阪府高槻市真上町２丁目５番６号,2026-05-07,株式会社
株式会社ＮＥＸＴ　ＭＥ　ＬＡＢ,愛媛県松山市朝美１丁目１１番１８号,2026-05-07,株式会社
株式会社ＮＥＸＵＳ,大阪府大阪市北区梅田１丁目２番２号大阪駅前第２ビル１２－１２,2026-05-07,株式会社
株式会社ＯＮＫＥＩ,三重県松阪市久保町１８５５番地１５５５,2026-05-07,株式会社
株式会社ＯＳＥ,静岡県静岡市葵区北安東３丁目２３―１５,2026-05-07,株式会社
株式会社ＯＴＨＥＲ,東京都あきる野市伊奈２５６番地３,2026-05-07,株式会社
株式会社ＯＴＯ,愛媛県松山市山越４丁目１番７号,2026-05-07,株式会社
株式会社Ｏｆｆｉｃｅ　Ｇｏｔｏｈ,兵庫県神戸市中央区港島中町１丁目６番５号ＩＭＤＡビル,2026-05-07,株式会社
株式会社Ｏｐｕｓ,北海道札幌市中央区南六条西４丁目２番地４野口ビル６階,2026-05-07,株式会社
株式会社ＰＥＡＣＥ　ＷＩＮＧ,東京都練馬区石神井台５丁目２２番４１－４０２号,2026-05-07,株式会社
株式会社ＲＥＹＥＳ　Ｊ　ＨＯＬＤＩＮＧＳ,大阪府河内長野市南ケ丘３６番１４号,2026-05-07,株式会社
株式会社ＲＯＫＫＡ,宮城県仙台市青葉区中央２丁目１１―１９仙南ビル４階―Ａ,2026-05-07,株式会社
株式会社ＲＵＤＤＥＲ＆Ｃｏ．,東京都八王子市新町９番１１号１階,2026-05-07,株式会社
株式会社ＲＹＭＡＳＴ,東京都八王子市絹ケ丘１丁目１９番１１号,2026-05-07,株式会社
株式会社Ｒａｖｉｓｓａｎｔ　Ｐｒｏｄｕｃｔｓ,石川県金沢市間明町２丁目２２１番地２,2026-05-07,株式会社
株式会社Ｒｅｖ,熊本県上益城郡嘉島町大字北甘木２０２７番地２,2026-05-07,株式会社
株式会社Ｒｉｃｅ,茨城県土浦市藤沢３０８０番地１,2026-05-07,株式会社
株式会社Ｒｉｓｅ　Ｂｒｉｄｇｅ,兵庫県神戸市中央区港島９丁目１１番１号,2026-05-07,株式会社
株式会社ＲｏｏｖｉｋＷｏｒｋｓ,兵庫県西宮市鳴尾町１丁目３－９－１０３,2026-05-07,株式会社
株式会社ＳＡＩＫＥＮ,静岡県浜松市中央区東三方町４７５‐２,2026-05-07,株式会社
株式会社ＳＥＳＡＭＥ,静岡県静岡市葵区若松町２５番地の１,2026-05-07,株式会社
株式会社ＳＥＶＡ,兵庫県神崎郡福崎町西田原１６０３番地,2026-05-07,株式会社
株式会社ＳＫ　ＷＯＲＫＳ,愛媛県松山市高岡町７９９番地３３,2026-05-07,株式会社
株式会社ＳＫＹビジネスソリューションズ,神奈川県横浜市港北区綱島西１丁目１９番２０号,2026-05-07,株式会社
株式会社ＳＫＹＲａ,兵庫県神戸市中央区磯辺通１丁目１番１８号　カサベラ国際プラザビル７０７号室,2026-05-07,株式会社
株式会社ＳＴＡ　ｓｉｄｅ,東京都港区東麻布３丁目７番１２号ルアナ麻布十番２階,2026-05-07,株式会社
株式会社ＳＴＡＮＤ‐ＵＰ　ＣＲＥＷ,神奈川県横浜市泉区上飯田町４６０２番地２,2026-05-07,株式会社
株式会社ＳＵＮ,東京都福生市大字熊川９９０番地７ＡＲＫＨＯＵＳＥＦ２０８,2026-05-07,株式会社
株式会社ＳＵＳＨＩ　ＢＵＳ,東京都台東区雷門２丁目１８－１６－５Ｆ,2026-05-07,株式会社
株式会社ＳＹＵ,福岡県北九州市八幡東区春の町１丁目４番１３号,2026-05-07,株式会社
株式会社Ｓｅｃｕｌｅａｆ,千葉県富津市富津８７３,2026-05-07,株式会社
株式会社Ｓｅｎｊｉｎ　Ｉｎｖｅｓｔｍｅｎｔ,東京都千代田区九段南２丁目３番１号青葉第一ビル５階,2026-05-07,株式会社
株式会社Ｓｉｎｃｅｃｏｒｅ,東京都町田市鶴間３丁目３番地７ドレッセタワー南町田グランベリーパーク３０５,2026-05-07,株式会社
株式会社Ｓｌｏｐｅ　ｐｒｏｔｅｃｔｉｏｎ　ｍａｃｈｉｎｅｒｙ,岐阜県中津川市駒場１６６６番地の９５６,2026-05-07,株式会社
株式会社Ｓｔｅｉｎ,福岡県福岡市中央区天神２丁目３番１０号天神パインクレスト７１９号,2026-05-07,株式会社
株式会社Ｓｔｑ　Ｇｒｏｕｐ,奈良県北葛城郡上牧町片岡台２丁目１３－１－２０１号室,2026-05-07,株式会社
株式会社Ｓｗｉｎｇ‐ｂｙ,愛知県一宮市猿海道１丁目２番１０号,2026-05-07,株式会社
株式会社ＴＯＨＯ,北海道札幌市手稲区稲穂三条３丁目１番２６号,2026-05-07,株式会社
株式会社ＴＯＭＯ,大阪府大阪市天王寺区空清町１番２５号ノア・エ・ブラン２０２号,2026-05-07,株式会社
株式会社ＴＯＲＡＸＩＳ,埼玉県深谷市田中２２８０番地１,2026-05-07,株式会社
株式会社ＴＳＵＭＵＧＵ１２０,京都府京都市西京区山田開キ町１２番地９,2026-05-07,株式会社
株式会社ＴＴ,東京都足立区鹿浜４丁目１７番１１号,2026-05-07,株式会社
株式会社Ｔｉｅｒ‐Ａ,神奈川県横浜市神奈川区金港町５番地１４クアドリフォリオ８階,2026-05-07,株式会社
株式会社Ｔｉｌｔ３,茨城県つくば市吾妻２丁目５番地１つくば市産業振興センター,2026-05-07,株式会社
株式会社Ｔｓｕｍｕｇｉ産業,北海道川上郡標茶町常盤１丁目３７番地,2026-05-07,株式会社
株式会社Ｔｕｒｔｌｅ,福岡県糟屋郡志免町志免中央４丁目４番２０号,2026-05-07,株式会社
株式会社ＵＬＵＣＵＳ,茨城県守谷市小山３１７－１４セザール取手西２０２,2026-05-07,株式会社
株式会社ＶＥＲＴＥＸ,愛媛県伊予郡松前町大字永田５１４番地１,2026-05-07,株式会社
株式会社ＶｉｓｉｏｎａｒｙＸ　Ｌａｂ,宮城県仙台市青葉区中山６丁目２０－１カーサベルデ中山Ａ棟２１０,2026-05-07,株式会社
株式会社ＷＩＮ　ＬＩＮＫ,香川県丸亀市綾歌町岡田東１３５７番地１,2026-05-07,株式会社
株式会社ＷＳＨＵＧ,千葉県八千代市大和田新田９５０番地１ルーチェ緑が丘Ａ棟３０６号,2026-05-07,株式会社
株式会社ＹＡＩＳＡ,石川県河北郡津幡町字横浜ろ７０番地５,2026-05-07,株式会社
株式会社Ｙｏｕ　Ｉ,兵庫県加西市福居町５３５番地,2026-05-07,株式会社
株式会社ＺＯＡ,東京都大田区大森東１丁目１６番２３号,2026-05-07,株式会社
株式会社ｃｈｅｅｒｆｕｌ　ｄｏｇ,石川県白山市馬場２丁目３１番地３,2026-05-07,株式会社
株式会社ｋｕＬｉａ,東京都練馬区土支田２丁目１６番１２号久３０３号,2026-05-07,株式会社
