法人名,住所,設立日,法人種別
あやケアサポート株式会社,東京都足立区西加平１丁目１番６号,2021-03-01,株式会社
とよなかＳｔｙｌｅ合同会社,大阪府豊中市新千里南町３丁目３番４－６０７号,2021-03-01,合同会社
なっちゃんのきいろいかさ合同会社,石川県白山市鹿島平１１番地９,2021-03-01,合同会社
のねこのて株式会社,東京都豊島区南池袋１丁目１６－１５ダイヤゲート池袋５Ｆ,2021-03-01,株式会社
よつば商工株式会社,福島県会津若松市天神町２５番３４号,2021-03-01,株式会社
アシスト大阪行政書士法人,大阪府豊中市庄内西町３丁目１５番２号,2021-03-01,その他の設立登記法人
アドア株式会社,東京都目黒区目黒本町５丁目５番１号,2021-03-01,株式会社
アンドユー株式会社,東京都港区南麻布１丁目５番９号オンリーワン麻布ビル１Ｂ,2021-03-01,株式会社
イトツバキ株式会社,愛知県名古屋市千種区川崎町２丁目１３番地の３,2021-03-01,株式会社
ウィステリアヒルズ株式会社,愛知県名古屋市緑区旭出２丁目１８１０番地,2021-03-01,株式会社
ウコンド合同会社,東京都港区南青山２丁目２番１５号ウィン青山１２１４号,2021-03-01,合同会社
エムケイ株式会社,東京都中央区日本橋蛎殻町１丁目３番５号共同ビル２階２３号,2021-03-01,株式会社
エリアサポート株式会社,栃木県足利市新宿町１０５４番地１,2021-03-01,株式会社
オルムス株式会社,東京都渋谷区神宮前３丁目１４番１５号石崎ビル２０２号,2021-03-01,株式会社
カノセイ・リニューアブル・エナジー株式会社,宮城県栗原市一迫柳目字曽根３０９番地１,2021-03-01,株式会社
カモメワークス合同会社,福岡県福岡市中央区大名２丁目２番２号,2021-03-01,合同会社
コロンビア・スレッドニードル・インベストメンツ株式会社,東京都千代田区丸の内１丁目８番２号鉄鋼ビルディング４階オフィスＳ－０３,2021-03-01,株式会社
コーギア株式会社,東京都港区港南１丁目７番１号,2021-03-01,株式会社
サイコクサイ株式会社,大阪府大阪市生野区巽北１丁目１番１号３階Ｃ室,2021-03-01,株式会社
サッソウ株式会社,神奈川県厚木市愛名９４０番地１５厚木毛利台第２ダイヤモンドマンション１０４,2021-03-01,株式会社
サロンひまわり合同会社,熊本県熊本市東区保田窪本町５番３４－１０１号,2021-03-01,合同会社
ジェイコアレジ２合同会社１,東京都千代田区丸の内３丁目１番１号東京共同会計事務所内,2021-03-01,合同会社
ジェイコアレジ２合同会社２,東京都千代田区丸の内３丁目１番１号東京共同会計事務所内,2021-03-01,合同会社
ジェイコアレジ２合同会社３,東京都千代田区丸の内３丁目１番１号東京共同会計事務所内,2021-03-01,合同会社
ジェイコアレジ２合同会社４,東京都千代田区丸の内３丁目１番１号東京共同会計事務所内,2021-03-01,合同会社
ジェイコアレジ２合同会社５,東京都千代田区丸の内３丁目１番１号東京共同会計事務所内,2021-03-01,合同会社
ジョイン株式会社,神奈川県藤沢市花の木２番１号コードナイン１０２,2021-03-01,株式会社
ジーネット協同組合,群馬県前橋市下大島町９９５番地,2021-03-01,その他の設立登記法人
セントラルホールディングス株式会社,埼玉県深谷市上柴町東４丁目１３番地５,2021-03-01,株式会社
ダイダンサービス中部株式会社,愛知県名古屋市中区大須４丁目１０番３２号上前津ＫＤビル８階,2021-03-01,株式会社
ダウンザライン合同会社,東京都台東区東上野５丁目４番３号１４０６号室,2021-03-01,合同会社
ティースライン株式会社,千葉県鎌ケ谷市東中沢２丁目２４番２７号,2021-03-01,株式会社
ティーチヴィクトリー株式会社,東京都台東区北上野１丁目７番３号諏訪ビル５階,2021-03-01,株式会社
ハイブリッジ２４株式会社,静岡県富士市森下４５番地の１２,2021-03-01,株式会社
バリアスチープ株式会社,北海道上川郡当麻町伊香牛３区,2021-03-01,株式会社
パパパ株式会社,東京都渋谷区本町３丁目１３番１２号渋谷本町ビル６Ｆ,2021-03-01,株式会社
ビジュアル＆サムシング株式会社,東京都渋谷区代々木１丁目５３番４号田尻ビル７０１,2021-03-01,株式会社
ビヨンドストラテジー合同会社,東京都港区赤坂２丁目２３－１,2021-03-01,合同会社
ピオーネ合同会社,東京都渋谷区本町３丁目１１番３号ホーヨー東京レジデンス西新宿５丁目３０１,2021-03-01,合同会社
ピュアライフ株式会社,大阪府東大阪市衣摺２丁目６番４０号,2021-03-01,株式会社
フィールズコンサルタント株式会社,群馬県前橋市上細井町２４３番地２,2021-03-01,株式会社
フロントフィールドエンジニアリング株式会社,福岡県福岡市西区横浜１丁目４７番１５号,2021-03-01,株式会社
ブロンプトンアンドカンパニー株式会社,東京都品川区東品川３丁目１１番１７－３０９号,2021-03-01,株式会社
ポニメ電子工業合同会社,千葉県流山市東初石３丁目２４５番６５号,2021-03-01,合同会社
マスターズホスピタリティ株式会社,大阪府大阪市中央区伏見町４丁目２番１４号,2021-03-01,株式会社
マーケティングなら株式会社,奈良県天理市豊井町１０３番地３ふくや荘２０１,2021-03-01,株式会社
モレキュラー・アシスト合同会社,埼玉県川口市並木４丁目１６番１７,2021-03-01,合同会社
ライオンテイル合同会社,京都府京都市上京区鞍馬口通南裏室町東入上御霊中町４５６番地１２,2021-03-01,合同会社
リベル株式会社,東京都港区西新橋１丁目１８番１１号,2021-03-01,株式会社
ルネステクノ株式会社,兵庫県川西市平野２丁目１３－６－１０１,2021-03-01,株式会社
ロマラン株式会社,東京都渋谷区恵比寿南３丁目１番２６－３０９号,2021-03-01,株式会社
ワイピオ株式会社,千葉県柏市高南台３丁目１番地３１,2021-03-01,株式会社
一般社団法人ふじのくに社会健康医療連合,静岡県静岡市葵区北安東４丁目２７番１号,2021-03-01,その他の設立登記法人
一般社団法人ソーシャルアクションラボ,大阪府大阪市北区西天満６丁目７番４号,2021-03-01,その他の設立登記法人
一般社団法人ドローン＆アート協会,東京都港区南青山２丁目２番１５号,2021-03-01,その他の設立登記法人
一般社団法人ハーティ事務局障がい者支援と基金,東京都文京区本郷４丁目１６番７号,2021-03-01,その他の設立登記法人
一般社団法人ワンアカデミー,大分県大分市政所１丁目４番３９号,2021-03-01,その他の設立登記法人
一般社団法人ワンウェルフェア,東京都千代田区外神田６丁目１５番１４号,2021-03-01,その他の設立登記法人
一般社団法人ヴォンバクラブ,愛知県名古屋市南区内田橋２丁目１番６６号,2021-03-01,その他の設立登記法人
一般社団法人人財育成研究所,東京都北区王子２丁目３１番６号福島ビル５階,2021-03-01,その他の設立登記法人
一般社団法人佐々木道誉公顕彰会,滋賀県犬上郡甲良町大字正楽寺２５番地,2021-03-01,その他の設立登記法人
一般社団法人全日本空手道連盟糸東会,埼玉県朝霞市浜崎３丁目８番１１号,2021-03-01,その他の設立登記法人
一般社団法人日本インラインフィギュアスケート協会,神奈川県横浜市港北区綱島西６丁目１７番７号,2021-03-01,その他の設立登記法人
一般社団法人日本伝統文化七樹会,東京都世田谷区太子堂２丁目１３番４号７階,2021-03-01,その他の設立登記法人
一般社団法人日本伝統芸能連盟,愛知県日進市浅田平子２丁目１５６番地,2021-03-01,その他の設立登記法人
一般社団法人生涯発達支援研究所,東京都渋谷区円山町５番５号Ｎａｖｉ渋谷Ⅴ３階,2021-03-01,その他の設立登記法人
一般社団法人胃を切った人友の会アルファ・クラブ,東京都豊島区東池袋３丁目１番３号ワールドインポートマートビル８階株式会社協和企画内,2021-03-01,その他の設立登記法人
一般社団法人買いたくなるいいもの研究所,東京都杉並区西荻南２丁目６番５号,2021-03-01,その他の設立登記法人
一般社団法人魅学アカデミー協会,大分県大分市金池町２丁目１３番１０号ベルディン金池４０１,2021-03-01,その他の設立登記法人
一般財団法人すだち健康財団,千葉県野田市木間ケ瀬４１７３番地１８,2021-03-01,その他の設立登記法人
一般財団法人竹内敏信記念財団,東京都新宿区下落合３丁目２０番４号,2021-03-01,その他の設立登記法人
一般財団法人自然医学財団,静岡県賀茂郡南伊豆町一色４６４番地,2021-03-01,その他の設立登記法人
七海株式会社,東京都中央区日本橋馬喰町１丁目１３番８－５０５号,2021-03-01,株式会社
上田左官工業株式会社,山口県山口市朝田６７２番４号,2021-03-01,株式会社
両国サイト株式会社,東京都杉並区久我山４丁目２０番２号,2021-03-01,株式会社
九牧大和株式会社,福岡県福岡市早良区高取１丁目２１－１０　２０９室,2021-03-01,株式会社
優信リース株式会社,東京都墨田区東向島６丁目３７番４号２０６室,2021-03-01,株式会社
前田清実オフィス株式会社,東京都墨田区横川１丁目１番１０号鈴木興産ビル倉庫６３号Ｂ,2021-03-01,株式会社
医療法人明石内科クリニック,広島県廿日市市山陽園８番１９号ステイツ野村１階,2021-03-01,その他の設立登記法人
医療法人Ｐａｌｅｔｔｅ,長崎県大村市小路口町２４４番地７,2021-03-01,その他の設立登記法人
協弘商事株式会社,埼玉県三郷市戸ケ崎２丁目４２２－３シティハイムサンライズＢ棟２０２号室,2021-03-01,株式会社
友青株式会社,大阪府吹田市江坂町５丁目１１－１０サンシャイン緑地公園１０７号,2021-03-01,株式会社
合同会社おのころ,静岡県浜松市中区小豆餅３丁目３番８号,2021-03-01,合同会社
合同会社かちぷろ,東京都葛飾区立石７丁目６－３,2021-03-01,合同会社
合同会社しん,秋田県横手市十文字町佐賀会字下沖田３４８番地アミ　グレイスⅡ２０３号室,2021-03-01,合同会社
合同会社つくば中央サービス,茨城県つくば市天久保２丁目１６番地１,2021-03-01,合同会社
合同会社つるさん,東京都世田谷区玉川１丁目７番１３号,2021-03-01,合同会社
合同会社てんびん座,神奈川県相模原市南区相南４丁目２４番４３－５０５号,2021-03-01,合同会社
合同会社まほら企画,千葉県船橋市藤原３丁目２９－８,2021-03-01,合同会社
合同会社アチーヴ,沖縄県中頭郡北谷町字宮城１－３９４、２Ｆ,2021-03-01,合同会社
合同会社アドワースアテインワン,宮城県仙台市宮城野区宮城野２丁目１３－３２,2021-03-01,合同会社
合同会社ウイングレット,東京都大田区大森中３丁目４番１号,2021-03-01,合同会社
合同会社エクシール・インベストメント,愛知県名古屋市中村区名駅３丁目２３番２号,2021-03-01,合同会社
合同会社エムエポック,東京都世田谷区桜新町２丁目４番１５－３０７号,2021-03-01,合同会社
合同会社クラフトラスト,山形県最上郡舟形町舟形２６４０番地４,2021-03-01,合同会社
合同会社クリスタ,大阪府大阪市福島区福島７丁目２０番１８－２７０８号,2021-03-01,合同会社
合同会社クリプトキャット,東京都港区南青山２丁目２番１５号ウィン青山９４２,2021-03-01,合同会社
合同会社サンカトレーディング,千葉県富里市中沢１２１８番地,2021-03-01,合同会社
合同会社スタートアップ,福岡県北九州市戸畑区東鞘ケ谷町６番１－３０５号,2021-03-01,合同会社
合同会社スリースターズ,沖縄県島尻郡南風原町字津嘉山２８０番地１、３Ｆ,2021-03-01,合同会社
合同会社センターヴィレッジ,大阪府大阪市東淀川区豊新５丁目９番５号,2021-03-01,合同会社
合同会社タイムファンデーション,愛知県名古屋市中区栄５丁目２６番３９号ＧＳ栄ビル３Ｆ,2021-03-01,合同会社
合同会社タスカル,青森県つがる市木造萩野６番地３６,2021-03-01,合同会社
合同会社ダ・ヴィンチ,福岡県柳川市大和町塩塚９５２番地,2021-03-01,合同会社
合同会社チャリコ,東京都目黒区五本木１丁目１８番１号ディアナコート祐天寺４１１,2021-03-01,合同会社
合同会社デジョイ,石川県白山市荒屋町に９３番地１,2021-03-01,合同会社
合同会社トータルライフ,石川県白山市徳丸町３７９番地,2021-03-01,合同会社
合同会社ネオモバイル,大阪府大阪市中央区糸屋町１丁目１－２セイワパレス大手通３０２,2021-03-01,合同会社
合同会社ネクストメイト,京都府亀岡市東別院町鎌倉見立２４番１９５号,2021-03-01,合同会社
合同会社ハル,大阪府大阪市北区梅田２丁目５番１３号桜橋第一ビル３０４号,2021-03-01,合同会社
合同会社プラス,大阪府大阪市北区芝田２丁目８番１１号共栄ビル３Ｆ,2021-03-01,合同会社
合同会社プラスワン,鹿児島県南さつま市加世田唐仁原６３１６番地１３－２Ｆ,2021-03-01,合同会社
合同会社プロパティエンカレッジメント,福岡県福岡市中央区薬院３丁目１２番４１－６０３号ナビールコート薬院,2021-03-01,合同会社
合同会社ユウシンホーム,埼玉県八潮市緑町２丁目１８番地１,2021-03-01,合同会社
合同会社リベロ,東京都世田谷区奥沢１丁目４７－９,2021-03-01,合同会社
合同会社ルビア,京都府京都市西京区大原野西竹の里町１丁目１９番地７,2021-03-01,合同会社
合同会社レアルリコス,東京都港区南麻布２丁目２－２８ベレマンション南麻布グラン３０２,2021-03-01,合同会社
合同会社中田ダンススクール,北海道北見市北一条西５丁目３番地１　１条ビル３階,2021-03-01,合同会社
合同会社倶多楽,東京都渋谷区代々木５丁目３６番５－４０４号室オープンレジデンシア代々木公園,2021-03-01,合同会社
合同会社優美＆Ｃｏ．,千葉県安房郡鋸南町横根２３０番地２,2021-03-01,合同会社
合同会社凛洞,東京都港区高輪２丁目１５番３１－１０７号,2021-03-01,合同会社
合同会社前田企画,福島県郡山市並木２丁目６番地の１ＰＬＵＮＤＯＬＥ並木４０２号,2021-03-01,合同会社
合同会社小口運送,千葉県千葉市中央区長洲１丁目２２番２号プラーズ長洲５０４,2021-03-01,合同会社
合同会社新橋パートナーズ,東京都港区新橋１丁目１２番９号６Ｆ,2021-03-01,合同会社
合同会社東京訪問ケアサービス,東京都江東区豊洲１丁目２番８号,2021-03-01,合同会社
合同会社桑華通商,千葉県船橋市二宮２丁目４８番１－２０４号,2021-03-01,合同会社
合同会社牛野ファーム,鹿児島県姶良市西餅田９６６番地２３,2021-03-01,合同会社
合同会社福祉わんど,大阪府東大阪市角田３丁目３番１８号,2021-03-01,合同会社
合同会社秋葉原,東京都世田谷区代沢１丁目１番５号,2021-03-01,合同会社
合同会社耕,東京都町田市原町田５丁目１５－５ヤマト電材３Ｆ,2021-03-01,合同会社
合同会社西洋,神奈川県川崎市多摩区布田１４番１７号,2021-03-01,合同会社
合同会社１１,東京都港区南青山３丁目１５番９号ＭＩＮＯＷＡ表参道３Ｆ,2021-03-01,合同会社
合同会社１２０度不動産,東京都墨田区錦糸１丁目１１番１３号西島ビル１０１,2021-03-01,合同会社
合同会社２０２０ホストタウンＰＣＲ感染対策支援協議会,東京都千代田区一番町１０番２号,2021-03-01,合同会社
合同会社ＡＮＤＬＯＬ,茨城県稲敷郡阿見町本郷１丁目４６－２,2021-03-01,合同会社
合同会社ＡＮＹＣＡＳＴ,東京都杉並区成田西１丁目２８番１１号,2021-03-01,合同会社
合同会社Ａｒｃａｎａ,大阪府堺市中区深阪６丁１５番１１号,2021-03-01,合同会社
合同会社Ａｚライフプランニング,神奈川県相模原市南区下溝４４５番地２,2021-03-01,合同会社
合同会社ＢＡＣＨ,東京都港区南青山３丁目８番４０号青山センタービル２Ｆ,2021-03-01,合同会社
合同会社Ｂｌｕｅ　Ｓｋｙ,山口県周南市梅園町１丁目７番地,2021-03-01,合同会社
合同会社Ｃｕｅ　Ｕ,兵庫県神戸市垂水区名谷町３４２５－３カサ．デ．エレガンシア１Ｆ,2021-03-01,合同会社
合同会社Ｄｅｎ,福岡県福岡市早良区有田６丁目２４番３０,2021-03-01,合同会社
合同会社ＥＪ,山梨県甲府市山宮町３２２５－７,2021-03-01,合同会社
合同会社ＥＭＡ,岡山県岡山市北区鹿田町１丁目８－１８－１５０１,2021-03-01,合同会社
合同会社ＥＲＫ,大阪府大阪市浪速区湊町１丁目２－１７－８１１,2021-03-01,合同会社
合同会社Ｆ．Ｓ．Ｄ,東京都世田谷区下馬５丁目２１番１７号,2021-03-01,合同会社
合同会社ＧＧＬ,静岡県沼津市大岡１７６３番地の３,2021-03-01,合同会社
合同会社ＧＳＯ,大阪府吹田市穂波町６番１－３０５号,2021-03-01,合同会社
合同会社Ｇｉｉｄｅ,京都府京都市中京区柳馬場通三条上る油屋町８９番地グラン・ブルー三条柳馬場１１０３号,2021-03-01,合同会社
合同会社ＩＫＴＫ,神奈川県相模原市中央区緑が丘２丁目３７番４号,2021-03-01,合同会社
合同会社ＩＴＯｒｉｇｉｎａｌＧｒｉｔ,東京都江東区東砂７丁目１７番２－１１０５,2021-03-01,合同会社
合同会社ＫＭ,山梨県甲府市長松寺町５番２４号ミキハウス２０５号,2021-03-01,合同会社
合同会社Ｋｎｏｄｅ　Ｓｙｎｃ,東京都品川区上大崎２丁目２－１６－３０２,2021-03-01,合同会社
合同会社Ｌｉｔｈｏｓ,埼玉県戸田市本町４丁目４番６号ＴＢＣ－１７３,2021-03-01,合同会社
合同会社Ｍ９,東京都中央区勝どき６丁目３番１号ザ東京タワーズシータワー５５２０号室,2021-03-01,合同会社
合同会社ＭＫＭ,大阪府寝屋川市清水町２２番１６号,2021-03-01,合同会社
合同会社Ｎ－ＳＴＡＢＬＥ,東京都品川区西五反田３丁目７番６号レジディアタワー目黒不動前２２１０,2021-03-01,合同会社
合同会社ＮＮＮ,神奈川県相模原市南区相模大野２丁目４番３号レジーナ相模大野１０２号,2021-03-01,合同会社
合同会社ＮＯＭ,大阪府大阪市北区国分寺２丁目３番２号,2021-03-01,合同会社
合同会社Ｎｉｐｐｏｎ　Ｅｎｔｅｒｐｒｉｓｅ,群馬県邑楽郡明和町下江黒２８０番地１,2021-03-01,合同会社
合同会社Ｏｎｅ　Ｐｌａｃｅ,東京都世田谷区南烏山３丁目１－１２－３０１,2021-03-01,合同会社
合同会社Ｗ．ｋｏｊｏｈ,東京都品川区西五反田１丁目２６番２号サンハイツビル２Ｆ,2021-03-01,合同会社
合同会社ＷＡＡＡ,神奈川県横浜市青葉区あざみ野南１丁目２１－２０,2021-03-01,合同会社
合同会社ＹＭＴ,京都府京都市中京区御池通東洞院東入笹屋町４３６永和御池ビル６０６号,2021-03-01,合同会社
合同会社ｃｏａｓｔｌｉｎｅ,大阪府大阪市西区京町堀１丁目１１番７号京旺ビル４階Ｂ号室,2021-03-01,合同会社
合同会社ｓａｉｇａｋｕ,大阪府八尾市上尾町３丁目７５番地の１５,2021-03-01,合同会社
和忠株式会社,千葉県浦安市海楽１丁目２番５号,2021-03-01,株式会社
啓財株式会社,東京都荒川区町屋３丁目２－１Ｂ１０３９号室,2021-03-01,株式会社
壁左匠しらいし株式会社,茨城県古河市本町４丁目１４番２９号,2021-03-01,株式会社
安若株式会社,大阪府大阪市東成区神路３丁目１３番２７号,2021-03-01,株式会社
岩倉企画印刷有限会社,愛知県岩倉市八剱町下り松４２番地,2021-03-01,有限会社
平米設計志楽合同会社,東京都世田谷区喜多見４丁目２７－１３,2021-03-01,合同会社
幼老プロジェクト合同会社,愛知県瀬戸市深川町１３－１８,2021-03-01,合同会社
新悠合同会社,大阪府羽曳野市伊賀５丁目２番１４号,2021-03-01,合同会社
日光Ｐｌｕｓ１６合同会社１,東京都千代田区丸の内３丁目１番１号東京共同会計事務所内,2021-03-01,合同会社
日光Ｐｌｕｓ１６合同会社１０,東京都千代田区丸の内３丁目１番１号東京共同会計事務所内,2021-03-01,合同会社
日光Ｐｌｕｓ１６合同会社１１,東京都千代田区丸の内３丁目１番１号東京共同会計事務所内,2021-03-01,合同会社
日光Ｐｌｕｓ１６合同会社１２,東京都千代田区丸の内３丁目１番１号東京共同会計事務所内,2021-03-01,合同会社
日光Ｐｌｕｓ１６合同会社１３,東京都千代田区丸の内３丁目１番１号東京共同会計事務所内,2021-03-01,合同会社
日光Ｐｌｕｓ１６合同会社１４,東京都千代田区丸の内３丁目１番１号東京共同会計事務所内,2021-03-01,合同会社
日光Ｐｌｕｓ１６合同会社１５,東京都千代田区丸の内３丁目１番１号東京共同会計事務所内,2021-03-01,合同会社
日光Ｐｌｕｓ１６合同会社１６,東京都千代田区丸の内３丁目１番１号東京共同会計事務所内,2021-03-01,合同会社
日光Ｐｌｕｓ１６合同会社２,東京都千代田区丸の内３丁目１番１号東京共同会計事務所内,2021-03-01,合同会社
日光Ｐｌｕｓ１６合同会社３,東京都千代田区丸の内３丁目１番１号東京共同会計事務所内,2021-03-01,合同会社
日光Ｐｌｕｓ１６合同会社４,東京都千代田区丸の内３丁目１番１号東京共同会計事務所内,2021-03-01,合同会社
日光Ｐｌｕｓ１６合同会社５,東京都千代田区丸の内３丁目１番１号東京共同会計事務所内,2021-03-01,合同会社
日光Ｐｌｕｓ１６合同会社６,東京都千代田区丸の内３丁目１番１号東京共同会計事務所内,2021-03-01,合同会社
日光Ｐｌｕｓ１６合同会社７,東京都千代田区丸の内３丁目１番１号東京共同会計事務所内,2021-03-01,合同会社
日光Ｐｌｕｓ１６合同会社８,東京都千代田区丸の内３丁目１番１号東京共同会計事務所内,2021-03-01,合同会社
日光Ｐｌｕｓ１６合同会社９,東京都千代田区丸の内３丁目１番１号東京共同会計事務所内,2021-03-01,合同会社
日興商店合同会社,大阪府東大阪市友井２丁目１１番８号,2021-03-01,合同会社
未来テクノロジー株式会社,東京都品川区勝島１丁目３－７オーベルグランディオ品川勝島１９０６,2021-03-01,株式会社
村田会計合同会社,大阪府大阪市中央区北浜１丁目９番１０号北浜宗田ビル,2021-03-01,合同会社
東京エアコン工事合同会社,東京都杉並区井草３丁目２９－１２,2021-03-01,合同会社
東京ＦＴ合同会社,埼玉県所沢市金山町１４番９－９０２号パレステージ西所沢,2021-03-01,合同会社
東林総業株式会社,島根県松江市雑賀町２５９－１,2021-03-01,株式会社
東発水力エンジニアリング株式会社,福島県耶麻郡西会津町野沢字浦道添甲４６番地,2021-03-01,株式会社
株式会社いもこ,神奈川県厚木市中町４丁目１３番２号,2021-03-01,株式会社
株式会社えがおのきろく,愛知県豊川市伊奈町古当１０３－１５－１０１,2021-03-01,株式会社
株式会社ときのなみ,東京都豊島区東池袋３丁目１５番１４号クレール東池袋１００１号,2021-03-01,株式会社
株式会社みや藤,大阪府大阪市北区万歳町１番１１号,2021-03-01,株式会社
株式会社みんなともだち,神奈川県平塚市南原３丁目３番２２号,2021-03-01,株式会社
株式会社ゆうあいファーマシー,東京都練馬区小竹町２丁目７１番５号,2021-03-01,株式会社
