法人名,住所,設立日,法人種別
あい不動産株式会社,青森県弘前市大字富田１丁目６番地５,2017-01-04,株式会社
あけぼの土地開発株式会社,神奈川県横浜市青葉区美しが丘４丁目１９番地３,2017-01-04,株式会社
あんしん税理士法人,福岡県福岡市南区大楠３丁目１８番１５号,2017-01-04,その他の設立登記法人
くまもと農業成長産業協同組合,熊本県合志市野々島２４９５番地１,2017-01-04,その他の設立登記法人
こはら株式会社,岡山県倉敷市連島中央２丁目３番２２号,2017-01-04,株式会社
ふれあい合同会社,沖縄県うるま市字高江洲９３８番地８,2017-01-04,合同会社
ゆめコーポレーション株式会社,東京都荒川区町屋７丁目３番８－１００１号,2017-01-04,株式会社
アクロシア株式会社,大阪府大阪市此花区春日出中２丁目１８番１０号,2017-01-04,株式会社
アサイクル株式会社,石川県小松市南浅井町ロ５４番地１,2017-01-04,株式会社
アサヒ商事株式会社,大阪府四條畷市岡山２丁目２１番２２号,2017-01-04,株式会社
ウイング事業協同組合,福岡県八女市黒木町木屋６３３７番地の１,2017-01-04,その他の設立登記法人
エイジレスホールディングス株式会社,神奈川県横浜市中区元町３丁目１１５番百段館６階,2017-01-04,株式会社
オリフ株式会社,広島県広島市西区小河内町２丁目７番５－３０３号,2017-01-04,株式会社
カイスト株式会社,東京都新宿区市谷砂土原町１丁目２番地山下ビル２０２号室,2017-01-04,株式会社
グランクチュール株式会社,東京都港区港南２丁目１６番７号品川Ｖタワー９０５号,2017-01-04,株式会社
グランドホーム株式会社,東京都新宿区西新宿４丁目３２番１１号新宿セントビラ永谷３０２号,2017-01-04,株式会社
コアブロック株式会社,東京都杉並区下井草２丁目４４番４号,2017-01-04,株式会社
サークルワークス株式会社,滋賀県大津市秋葉台４番２０－４０２号,2017-01-04,株式会社
サービスメーカー株式会社,茨城県日立市相賀町１７番９号,2017-01-04,株式会社
シキデンキ株式会社,神奈川県横浜市港南区日野５丁目３０番１号,2017-01-04,株式会社
ジェイ・ワイ・シー株式会社,兵庫県芦屋市松浜町１番１３号,2017-01-04,株式会社
ジェストグラフィカ合同会社,茨城県水戸市笠原町５１０番地の１１,2017-01-04,合同会社
スキダマリンクホールディングス株式会社,東京都目黒区青葉台２丁目９番９号,2017-01-04,株式会社
スマイリング株式会社,沖縄県沖縄市美里４丁目１７番７号,2017-01-04,株式会社
センス株式会社,岐阜県羽島市新生町１丁目４１番地,2017-01-04,株式会社
タカハシライフサポート株式会社,北海道網走市南六条西２丁目２番地,2017-01-04,株式会社
チューブトップ株式会社,大阪府大阪市中央区久太郎町１丁目３番７号,2017-01-04,株式会社
デジタルバンク株式会社,東京都西多摩郡瑞穂町箱根ケ崎東松原８番地７,2017-01-04,株式会社
トーホー物産株式会社,長野県上田市大字上田１５３６番地２,2017-01-04,株式会社
ドリームライン株式会社,埼玉県上尾市大字大谷本郷７６８番地４,2017-01-04,株式会社
ニナ・ステージ株式会社,東京都渋谷区広尾１丁目１１番２号,2017-01-04,株式会社
ハイランドメガソーラー発電合同会社,大阪府大阪市浪速区元町２丁目３番８号,2017-01-04,合同会社
ハウスリング株式会社,東京都渋谷区円山町２８番６号１０階,2017-01-04,株式会社
ファイブファースト合同会社,栃木県栃木市樋ノ口町３９６番地１６,2017-01-04,合同会社
フラット馬込管理組合法人,東京都中央区京橋１丁目１番５号,2017-01-04,その他の設立登記法人
プラスウェイジャパン株式会社,東京都葛飾区東四つ木４丁目３７番１２号,2017-01-04,株式会社
プレジャー・フィールド株式会社,東京都北区赤羽台３丁目１番１９号綿貫ビル２階,2017-01-04,株式会社
マインドテクノ株式会社,埼玉県川越市大字福田１６０番地１,2017-01-04,株式会社
メゾン・ド・アヴァンセ管理組合法人,東京都中央区京橋１丁目１番５号,2017-01-04,その他の設立登記法人
メゾン・ド・コンテス管理組合法人,東京都中央区京橋１丁目１番５号,2017-01-04,その他の設立登記法人
メゾン・ド・ソアレ管理組合法人,東京都中央区京橋１丁目１番５号,2017-01-04,その他の設立登記法人
メゾン・ド・ソネット管理組合法人,東京都中央区京橋１丁目１番５号,2017-01-04,その他の設立登記法人
メゾン・ド・テルム管理組合法人,東京都中央区京橋１丁目１番５号,2017-01-04,その他の設立登記法人
メゾン・ド・バーグ管理組合法人,東京都中央区京橋１丁目１番５号,2017-01-04,その他の設立登記法人
メゾン・ド・パリエ管理組合法人,東京都中央区京橋１丁目１番５号,2017-01-04,その他の設立登記法人
メゾン・ド・フェリー管理組合法人,東京都中央区京橋１丁目１番５号,2017-01-04,その他の設立登記法人
メゾン・ド・プリムヴェール管理組合法人,東京都中央区京橋１丁目１番５号,2017-01-04,その他の設立登記法人
メゾン・ド・ペガーズ管理組合法人,東京都中央区京橋１丁目１番５号,2017-01-04,その他の設立登記法人
メゾン・ド・ラマージュ管理組合法人,東京都中央区京橋１丁目１番５号,2017-01-04,その他の設立登記法人
メゾン・ド・ヴィレ千駄木管理組合法人,東京都中央区京橋１丁目１番５号,2017-01-04,その他の設立登記法人
メゾン・ド・覚王山管理組合法人,東京都中央区京橋１丁目１番５号,2017-01-04,その他の設立登記法人
ラ・パルフェ・ド・コロン管理組合法人,東京都中央区京橋１丁目１番５号,2017-01-04,その他の設立登記法人
ラ・パルフェ・ド・ジュワンドル管理組合法人,東京都中央区京橋１丁目１番５号,2017-01-04,その他の設立登記法人
ラ・パルフェ・ド・東仙台管理組合法人,東京都中央区京橋１丁目１番５号,2017-01-04,その他の設立登記法人
リサイクルファーム合同会社,北海道上川郡東川町西４号北２９番地,2017-01-04,合同会社
リリアンクリエイション株式会社,広島県東広島市福富町久芳３７２１番地３,2017-01-04,株式会社
ワイケーパッケージング株式会社,福岡県北九州市八幡西区則松５丁目５番２１号,2017-01-04,株式会社
ワンネーション合同会社,東京都港区三田５丁目１３番８号,2017-01-04,合同会社
一般社団法人とみやスポーツクラブ,宮城県富谷市一ノ関臑合山６－８,2017-01-04,その他の設立登記法人
一般社団法人まりも,大阪府大阪市東成区東中本２丁目１７番１７号,2017-01-04,その他の設立登記法人
一般社団法人みっくすビート,埼玉県さいたま市北区土呂町１丁目３番地１０ユーエスハイム１０２号,2017-01-04,その他の設立登記法人
一般社団法人アーバンデザインセンター大宮,埼玉県さいたま市大宮区宮町１丁目６０番地大宮ラクーン８階,2017-01-04,その他の設立登記法人
一般社団法人ライブ・コミュニティ協会,福島県福島市野田町６丁目５番１０号,2017-01-04,その他の設立登記法人
一般社団法人和僑総会,東京都中央区日本橋本町３丁目２番１２号,2017-01-04,その他の設立登記法人
一般社団法人地域インターネット新聞社,神奈川県横浜市西区北幸１丁目１１番１号水信ビル７階,2017-01-04,その他の設立登記法人
一般社団法人大分県相続サポートセンター,大分県大分市牧１丁目２番１５号,2017-01-04,その他の設立登記法人
一般社団法人大学ゴルフ授業研究会,東京都新宿区三栄町２５番地７,2017-01-04,その他の設立登記法人
一般社団法人大阪ファイン,大阪府東大阪市長瀬町１丁目１０番８号,2017-01-04,その他の設立登記法人
一般社団法人安眠総研,東京都渋谷区南平台町２番１２号,2017-01-04,その他の設立登記法人
一般社団法人岡山アスレーテスクラブ,岡山県倉敷市連島中央２丁目３番２２号,2017-01-04,その他の設立登記法人
一般社団法人庄原市総領自治振興区,広島県庄原市総領町下領家２７８番地,2017-01-04,その他の設立登記法人
一般社団法人日本スポーツ科学マネジメント,東京都大田区山王２丁目６番６号,2017-01-04,その他の設立登記法人
一般社団法人日本経営心理コンサルタント協会,福岡県福岡市中央区大名２丁目４番５号１階,2017-01-04,その他の設立登記法人
一般社団法人日本著作権・製造業者商取引協会,東京都新宿区新宿２丁目１４番６号,2017-01-04,その他の設立登記法人
一般社団法人瀬戸内市観光協会,岡山県瀬戸内市牛窓町牛窓３０３１番地２,2017-01-04,その他の設立登記法人
一般社団法人環境福祉保育支援機構,岐阜県岐阜市栄新町２丁目４９番地,2017-01-04,その他の設立登記法人
一般社団法人長崎県漁船リース協会,長崎県長崎市五島町２番２７号,2017-01-04,その他の設立登記法人
一般社団法人ＳＯＲＡ小さな命を救う会,愛知県名古屋市熱田区熱田西町１番１７号ヴィー・クオレタワー白鳥庭園８０１号,2017-01-04,その他の設立登記法人
一般財団法人武蔵奨学会,埼玉県さいたま市大宮区桜木町１丁目７番地５,2017-01-04,その他の設立登記法人
三葉商事株式会社,千葉県市川市新田４丁目１６番１号竹葉荘１棟２０４号室,2017-01-04,株式会社
京安商事株式会社,京都府京都市中京区押小路通間之町東入る左京町１３７番地,2017-01-04,株式会社
住宅産業企業年金基金,東京都新宿区山吹町１１番地１測量年金会館５階,2017-01-04,その他
医療法人健功会,愛知県豊川市馬場町上石畑６６番地,2017-01-04,その他の設立登記法人
医療法人心美会,福岡県福岡市南区横手南町２０番地３,2017-01-04,その他の設立登記法人
医療法人林ハートクリニック,京都府京都市中京区御池通柳馬場西入御所八幡町２３１番地シカタカトルズビルディング３階,2017-01-04,その他の設立登記法人
半田土地開発株式会社,宮城県仙台市青葉区本町１丁目１１番１１号,2017-01-04,株式会社
合同会社くるみ,鳥取県米子市花園町１２番地,2017-01-04,合同会社
合同会社みやびコンサルティング,福岡県宗像市河東１１３１番地２７,2017-01-04,合同会社
合同会社みらい介護,宮城県亘理郡亘理町吉田字原２４７番地１９,2017-01-04,合同会社
合同会社アッシュ,東京都港区南青山２丁目２番１５号ＷｉｎＡｏｙａｍａビル－ＵＣＦ９階,2017-01-04,合同会社
合同会社アネシス,千葉県市川市須和田１丁目２１番２号,2017-01-04,合同会社
合同会社アルカイック,東京都調布市染地３丁目１番地１９,2017-01-04,合同会社
合同会社アンランジュ,鹿児島県霧島市国分広瀬２丁目３５番１０号,2017-01-04,合同会社
合同会社エヌビーエフ,千葉県千葉市若葉区桜木北２丁目１０－９,2017-01-04,合同会社
合同会社クアドラプルウイング,東京都渋谷区恵比寿１丁目１５番９号シルク恵比寿４０３,2017-01-04,合同会社
合同会社クラッハベーン,神奈川県横浜市中区福富町仲通２番地２－１Ｆ,2017-01-04,合同会社
合同会社クロスウェーブ,千葉県船橋市宮本６丁目２２番１５－１０５号,2017-01-04,合同会社
合同会社ケアリンク三鷹,東京都三鷹市上連雀９丁目１９番７号,2017-01-04,合同会社
合同会社ケーエー,長野県安曇野市穂高４３９番地５,2017-01-04,合同会社
合同会社コンパスマネジメント,石川県金沢市泉野町４丁目９番５号（スプリングテラス泉野・１０１号）,2017-01-04,合同会社
合同会社コーディアル,大阪府東大阪市太平寺２丁目１０番４３号２Ｆ,2017-01-04,合同会社
合同会社シャルム,埼玉県川越市今成２丁目２２番地１,2017-01-04,合同会社
合同会社ジャパンレジデンシャルファンド,東京都千代田区丸の内３丁目１番１号東京共同会計事務所内,2017-01-04,合同会社
合同会社スタジオキューズ,大阪府大阪市淀川区塚本５丁目２番１０－１Ｆ,2017-01-04,合同会社
合同会社ナノ・プラン,大阪府堺市堺区北三国ヶ丘町７丁４番２１号,2017-01-04,合同会社
合同会社バイクファクトリー,兵庫県姫路市西新在家３丁目１番１６号,2017-01-04,合同会社
合同会社メディアコンポジットロケーションズ,神奈川県鎌倉市岩瀬１丁目３２－２ベルピア鎌倉６－２０４号,2017-01-04,合同会社
合同会社ヨシオ２,東京都千代田区丸の内３丁目１番１号東京共同会計事務所内,2017-01-04,合同会社
合同会社ワイアンドケー,静岡県沼津市駿河台１３番地の９,2017-01-04,合同会社
合同会社一生健美,福井県あわら市舟津第４７号２３番地,2017-01-04,合同会社
合同会社伸和,東京都北区赤羽台２丁目３番１－６１４号,2017-01-04,合同会社
合同会社光芒,埼玉県鶴ヶ島市富士見５丁目２２番３号,2017-01-04,合同会社
合同会社共進工業,神奈川県川崎市多摩区菅北浦３丁目８番１－３０７号,2017-01-04,合同会社
合同会社太陽,岐阜県岐阜市切通６丁目１６番２０号,2017-01-04,合同会社
合同会社未来企画,千葉県野田市七光台４０５番地の７４弘和荘２０１,2017-01-04,合同会社
合同会社未来工房,兵庫県宝塚市清荒神２丁目１８番２７号,2017-01-04,合同会社
合同会社洸伸建工,青森県八戸市大字大久保字袖ノ沢２１番地１７,2017-01-04,合同会社
合同会社産秀,高知県高知市桜井町１丁目９番１１号,2017-01-04,合同会社
合同会社百日百善,兵庫県伊丹市千僧５丁目９１番地１－１１－４０３号,2017-01-04,合同会社
合同会社葉彩工務店,東京都多摩市貝取１４３５番地の２グルース４０２,2017-01-04,合同会社
合同会社越戸興業,神奈川県相模原市緑区下九沢２３８８番地７,2017-01-04,合同会社
合同会社龍,東京都台東区浅草５丁目５４番４号ライズ早川,2017-01-04,合同会社
合同会社Ｂｏｓｔｏｎ,東京都渋谷区東３丁目２５－７レスポアールビル１階,2017-01-04,合同会社
合同会社ＤＥＳＩＲＥ,広島県三次市十日市東１丁目５番６号,2017-01-04,合同会社
合同会社ＨＯＰＥアカデミー,香川県高松市勅使町１３０７番地,2017-01-04,合同会社
合同会社Ｉｎｆｏ－ｄｅｓｉｇｎ,愛媛県八幡浜市保内町須川１９１４番地１,2017-01-04,合同会社
合同会社ＫＥＮＹＵ,鹿児島県鹿児島市長田町２３番２５－５０３号,2017-01-04,合同会社
合同会社Ｍ・Ｇ・Ａ,福島県郡山市麓山２丁目９番２０号２０９,2017-01-04,合同会社
合同会社ＭＫＴ,大阪府大阪市浪速区難波中１丁目１番１号２階,2017-01-04,合同会社
合同会社Ｍｓ　ｃｏｍｐａｎｙ,群馬県高崎市和田町９番１号,2017-01-04,合同会社
合同会社Ｎ’ｓ　Ｃｏｍｐａｎｙ,北海道札幌市西区宮の沢二条２丁目１番１２号,2017-01-04,合同会社
合同会社Ｎ－Ｐｏｔｃｏｍｐａｎｙ,埼玉県桶川市南１丁目６番２号,2017-01-04,合同会社
合同会社ＮＹＫ,東京都千代田区内神田３丁目１３番３号,2017-01-04,合同会社
合同会社ＰＬＡＺＡ,北海道札幌市中央区宮ケ丘１丁目１番５－５０１号,2017-01-04,合同会社
合同会社Ｓ‐ＥＮＥＲＧＹ,福岡県福岡市博多区博多駅前３丁目９－５チサンマンション第一博多２０５号,2017-01-04,合同会社
合同会社ＳＫＤサービス研究所,群馬県桐生市堤町１丁目６番６号,2017-01-04,合同会社
合同会社Ｖａｌｅ,東京都目黒区東が丘２丁目１３番３７号,2017-01-04,合同会社
合同会社ｆｉｌ,北海道札幌市西区二十四軒四条３丁目４番１８号,2017-01-04,合同会社
合名会社インモビリアーレ,福岡県北九州市小倉南区朽網東４丁目１６番１２号,2017-01-04,合名会社
合名会社ＫＮアセットマネジメント,大阪府大阪市阿倍野区昭和町３丁目１１番２９－１３０５号,2017-01-04,合名会社
合名会社Ｓ．ベル,福岡県行橋市大字大野井６８５番地６,2017-01-04,合名会社
合名会社ｇｒｏｖｅ,福岡県北九州市小倉北区中井１丁目１７番１号,2017-01-04,合名会社
和田工業株式会社,埼玉県所沢市大字城６４２番地１,2017-01-04,株式会社
土岐貿易合同会社,岐阜県土岐市下石町６１３番地の１,2017-01-04,合同会社
大分メガソーラー一般社団法人,東京都千代田区丸の内３丁目１番１号東京共同会計事務所内,2017-01-04,その他の設立登記法人
大和正島株式会社,大阪府大阪市浪速区戎本町１丁目９番２１号７０５号室,2017-01-04,株式会社
大和産業株式会社,京都府福知山市字牧小字狭間１３５２－１,2017-01-04,株式会社
宇宙商事株式会社,東京都板橋区大谷口上町４番１号,2017-01-04,株式会社
安田サービス株式会社,愛知県半田市乙川若宮町７２番地の８,2017-01-04,株式会社
宝珠株式会社,沖縄県那覇市松尾１丁目１５番２９号ミルコマンション松尾十二邸５０１,2017-01-04,株式会社
富士グローバルソフトウェア株式会社,大阪府大阪市中央区谷町２丁目１番２０－２０８号,2017-01-04,株式会社
山健工業株式会社,福岡県筑紫郡那珂川町今光６丁目８２番地,2017-01-04,株式会社
岩倉株式会社,東京都大田区雪谷大塚町８番４号サンユー駅前ビル５Ｆ,2017-01-04,株式会社
峯岸不動産株式会社,神奈川県川崎市川崎区浅田３丁目１２番１５号,2017-01-04,株式会社
嵐合同会社,東京都台東区竜泉１丁目２６番２号,2017-01-04,合同会社
工藤冷熱工業株式会社,福岡県春日市須玖北３丁目３６番地,2017-01-04,株式会社
日南麦酒株式会社,宮崎県日南市吾田東１丁目１番３７号,2017-01-04,株式会社
旭昇株式会社,千葉県東金市家之子８９８番地１２,2017-01-04,株式会社
明文株式会社,東京都中野区上鷺宮１丁目２－４関口ビル１１９号,2017-01-04,株式会社
明新工業株式会社,広島県福山市柳津町４丁目９番５８号,2017-01-04,株式会社
春日パークハイツ管理組合法人,福岡県春日市宝町１丁目１番地１,2017-01-04,その他の設立登記法人
晋和商事合同会社,岡山県岡山市北区奉還町４丁目１２－１４,2017-01-04,合同会社
暮らしの電器株式会社,岡山県倉敷市玉島乙島４４２０,2017-01-04,株式会社
有限会社あすか,東京都江戸川区南小岩６丁目１２番１５号,2017-01-04,有限会社
有限会社タカコウ建設,岩手県奥州市江刺区愛宕字観音堂沖２３７番地の１,2017-01-04,有限会社
有限会社小林建設工業,茨城県常陸大宮市辰ノ口１２５６番地の２,2017-01-04,有限会社
有限会社正栄商事,静岡県駿東郡長泉町下土狩１１９４番地の１０,2017-01-04,有限会社
有限会社竹本モータース,福岡県築上郡築上町大字東築城１０２番地,2017-01-04,有限会社
有限会社萩オートサービス,愛知県みよし市明知町西ノ口１５０番地,2017-01-04,有限会社
本橋重機株式会社,栃木県真岡市石島８１１番地３,2017-01-04,株式会社
東大阪まちづくり機構合同会社,大阪府東大阪市荒本新町３番４号ＳＥＩＫＯビル,2017-01-04,合同会社
東扇島インベストメント合同会社,東京都千代田区丸の内２丁目１番１号,2017-01-04,合同会社
東洋産業株式会社,東京都江戸川区小松川２丁目３番１－１１０２号,2017-01-04,株式会社
株式会社ありす保育室,埼玉県狭山市中央４丁目２５番１号山中第二ビル２階,2017-01-04,株式会社
株式会社いずみ保険堂,大阪府堺市堺区市之町西２丁１番９－５０５号,2017-01-04,株式会社
株式会社おかやまジュニア体操スクール,岡山県岡山市南区泉田３２８番地５,2017-01-04,株式会社
株式会社かさラボ,福岡県京都郡苅田町京町１丁目１１番地２５ヤマダビル１Ｆ,2017-01-04,株式会社
株式会社こうゆう,埼玉県川口市芝１丁目２０番４号,2017-01-04,株式会社
株式会社こことある,栃木県足利市田島町６１１番地,2017-01-04,株式会社
株式会社さくら工務店,広島県大竹市油見１丁目１番２０号,2017-01-04,株式会社
株式会社ふるさと木材,岩手県下閉伊郡田野畑村菅窪２０５番地８,2017-01-04,株式会社
株式会社まるたけ,宮城県仙台市宮城野区岩切字今市東２９３番地,2017-01-04,株式会社
株式会社わのせんす,東京都千代田区神田須田町２丁目２３番地１天翔秋葉原万世橋ビル,2017-01-04,株式会社
株式会社アイズ,東京都江戸川区平井４丁目９番２号,2017-01-04,株式会社
株式会社アイベルグユー,長崎県長崎市滑石３丁目５２番４号,2017-01-04,株式会社
株式会社アウルＮＳＫ,沖縄県那覇市真嘉比３丁目２０番３１号,2017-01-04,株式会社
株式会社アグリッシブ下金山,北海道空知郡南富良野町字下金山番外地,2017-01-04,株式会社
株式会社アシスト企画,神奈川県横浜市旭区二俣川２丁目７２番地１７,2017-01-04,株式会社
株式会社アテンティブ,福島県郡山市島２丁目３１番１１号,2017-01-04,株式会社
株式会社アルカスインターナショナル,兵庫県神戸市中央区港島中町６丁目８番１,2017-01-04,株式会社
株式会社アワリゾート,東京都千代田区神田須田町２丁目２５番地ＧＹＢ秋葉原４Ｆ,2017-01-04,株式会社
株式会社アース保険事務所,福島県いわき市平下荒川字諏訪下７０番地の１アスティオスＫ１０１,2017-01-04,株式会社
株式会社イノベーションリンク,兵庫県神戸市中央区港島中町６丁目８番１,2017-01-04,株式会社
株式会社インターキューブ,兵庫県神戸市中央区港島中町６丁目８番１,2017-01-04,株式会社
株式会社インテリア佐藤,福島県田村市船引町芦沢字下上戸１７５番地,2017-01-04,株式会社
株式会社エアフォルク,北海道札幌市東区東苗穂八条３丁目１５番１号,2017-01-04,株式会社
株式会社エクスプローラーズトーキョー,兵庫県神戸市中央区港島中町６丁目８番１,2017-01-04,株式会社
株式会社エスケーエス,愛知県名古屋市港区春田野１丁目２４０７番地,2017-01-04,株式会社
株式会社エスケープロダクツ,東京都中央区日本橋兜町９番５号,2017-01-04,株式会社
株式会社エスポ,東京都豊島区東池袋１丁目１５番３号,2017-01-04,株式会社
株式会社エスラッシュ,東京都江戸川区小松川４丁目６２番地,2017-01-04,株式会社
株式会社エスワイ,広島県呉市苗代町１２６番地の３０,2017-01-04,株式会社
株式会社エムエストライズ,愛知県名古屋市西区長先町２８番地,2017-01-04,株式会社
株式会社エムズ,埼玉県さいたま市大宮区桜木町４丁目２４４番地２,2017-01-04,株式会社
株式会社エムズビー,大阪府大阪市福島区鷺洲２丁目１１番１１号,2017-01-04,株式会社
株式会社エルフ,大阪府茨木市新中条町５番５号,2017-01-04,株式会社
株式会社エースケミカル,大阪府吹田市江坂町１丁目１２番７－１５０４号,2017-01-04,株式会社
株式会社オフィスエム,東京都板橋区宮本町２１番４号,2017-01-04,株式会社
株式会社カイリゾート,埼玉県東松山市大字上唐子１３１７番地１,2017-01-04,株式会社
株式会社カナロア・ジャパン,神奈川県平塚市明石町６番１３号,2017-01-04,株式会社
株式会社カワイ建築,大阪府東大阪市小阪３丁目４番,2017-01-04,株式会社
株式会社キュアラ,京都府京都市南区唐橋南琵琶町１９番地２,2017-01-04,株式会社
