法人名,住所,設立日,法人種別
株式会社ＢＬＵＥ　ＬＩＮＥ,神奈川県藤沢市長後３７３番地２ディアコート湘南１０２,2016-09-23,株式会社
株式会社Ｂｅｙｏｎｄ,愛知県名古屋市千種区内山３丁目２８番２号,2016-09-23,株式会社
株式会社Ｃ＆Ａ　Ｃｏｒｐｏｒａｔｉｏｎ,東京都世田谷区深沢８丁目９番９号,2016-09-23,株式会社
株式会社ＣＹＢＯＲＧ,大阪府大阪市浪速区日本橋４丁目９番２１号,2016-09-23,株式会社
株式会社Ｃｌｏｖｅｒ,東京都品川区西五反田１丁目１８番１号五反田ｅｘビル７階,2016-09-23,株式会社
株式会社Ｄｏｗｎ　Ｕｎｄｅｒ,大阪府吹田市青山台２丁目１３番４号,2016-09-23,株式会社
株式会社ＥＧＧ,東京都中央区銀座３丁目１４番１号,2016-09-23,株式会社
株式会社ＦＬＯＷ２,東京都渋谷区神宮前６丁目１９番１５号高野第１ビル５Ｆ,2016-09-23,株式会社
株式会社ＦＴマネジメント,大阪府大阪市淀川区塚本２丁目２番２３号,2016-09-23,株式会社
株式会社ＦＵＮｍａｃｙ,東京都渋谷区渋谷４丁目３番２７号,2016-09-23,株式会社
株式会社ＦｒｅｅＬｉｆｅ,東京都新宿区西新宿７丁目７番２６号ワコーレ新宿第１ビル１０１０号室,2016-09-23,株式会社
株式会社ＧＥＭ,東京都渋谷区広尾３丁目１０番１号,2016-09-23,株式会社
株式会社ＧＲＩＴ,大阪府大阪市西成区松２丁目３番１０号,2016-09-23,株式会社
株式会社Ｇｉｏｃｏｓｏ,神奈川県川崎市宮前区菅生５丁目１５番９号,2016-09-23,株式会社
株式会社Ｇｒａｖｉｔｙ,高知県高知市一宮徳谷４番２４号ルミナスＡ棟２０１,2016-09-23,株式会社
株式会社Ｈ・Ｎ・Ｍ,岩手県一関市田村町５番５７号,2016-09-23,株式会社
株式会社ＨＨシルバー,栃木県佐野市赤坂町９５８番地２０,2016-09-23,株式会社
株式会社ＨＩＲＯ,東京都板橋区板橋３丁目５７番３号,2016-09-23,株式会社
株式会社ＨＫ企画,広島県広島市中区堀川町１番３６号２階,2016-09-23,株式会社
株式会社Ｈｏｍｅｙ,山口県長門市東深川３３２番地７９,2016-09-23,株式会社
株式会社Ｊｏｂ　Ｃｈａｎｇｅ,岐阜県岐阜市菅生３丁目１１番１１号,2016-09-23,株式会社
株式会社Ｋプランニング,大阪府吹田市朝日町１９番５号,2016-09-23,株式会社
株式会社ＫＧＧホールディングス,広島県広島市佐伯区五日市町大字石内５９９８番地１,2016-09-23,株式会社
株式会社ＫＨ,東京都江戸川区宇喜田町２０３番地グリーンハイツ２０５号室,2016-09-23,株式会社
株式会社ＫＯＴＯＲＩＥ,東京都板橋区小茂根３丁目１４番１５号,2016-09-23,株式会社
株式会社ＫＳＧフードマネージメント,東京都港区新橋３丁目８番８号,2016-09-23,株式会社
株式会社ＫＷＳ,鹿児島県霧島市国分清水１丁目１４番３１号,2016-09-23,株式会社
株式会社Ｋｏｋｕａ,静岡県富士市加島町５番１７号,2016-09-23,株式会社
株式会社ＬＥＧＩＴ,大阪府大阪市北区曾根崎新地２丁目５－２９,2016-09-23,株式会社
株式会社ＬＥＯＮ,大阪府八尾市永畑町３丁目１番１２－１２０３号,2016-09-23,株式会社
株式会社ＬＯＣＯ　ＬＩＦＥ,東京都千代田区五番町１２番地６,2016-09-23,株式会社
株式会社ＬａＭｕｓｅ,東京都北区赤羽北１丁目８番１７－９０３号,2016-09-23,株式会社
株式会社Ｌｉｎｋ＆Ｉｎｎｏｖａｔｉｏｎ,東京都世田谷区駒沢３丁目４番７号,2016-09-23,株式会社
株式会社ＭＤＣ,東京都渋谷区恵比寿南２丁目１９番１０号,2016-09-23,株式会社
株式会社ＭＨコーポレーション,長野県塩尻市大字洗馬３２１番地１塚原住宅３号,2016-09-23,株式会社
株式会社ＭＯＵＮＴＡＩＮ　ＢＯＯＫ,東京都渋谷区代々木４丁目２４番５－２０３号,2016-09-23,株式会社
株式会社Ｎ．ＧＲＥＥＮ,東京都渋谷区恵比寿１丁目２０番２号クオリア恵比寿イースト３０１号,2016-09-23,株式会社
株式会社Ｎ．Ｋファーム,福岡県みやま市高田町黒崎開９９１番地２,2016-09-23,株式会社
株式会社ＮＡＭＡ　ＣＩＴＹ　ＪＡＰＡＮ,福岡県福岡市東区青葉２丁目１０番１７号,2016-09-23,株式会社
株式会社ＮＯＡＨマーケティング,大阪府大阪市中央区内本町２丁目４番１６号,2016-09-23,株式会社
株式会社Ｎｅｂｕｌａ　ｗｏｒｋｓｈｏｐ,東京都世田谷区上馬１丁目２５番１０号武蔵野荘１０２,2016-09-23,株式会社
株式会社ＯＦＦＩＣＥ東京ベイ,千葉県千葉市稲毛区小中台町７４６番地１,2016-09-23,株式会社
株式会社ＰＢエステート,奈良県生駒市俵口町１３０１番地,2016-09-23,株式会社
株式会社ＰＲＥＭＡエステート,神奈川県川崎市多摩区菅城下９番７号,2016-09-23,株式会社
株式会社Ｐｅａｃｅ,大阪府東大阪市永和３丁目８番５号,2016-09-23,株式会社
株式会社ＰｒｏＲｅＡ,岐阜県大垣市今宿６丁目５２番１６号,2016-09-23,株式会社
株式会社Ｒケアサービス,大阪府大阪狭山市西山台２丁目１３番１０号,2016-09-23,株式会社
株式会社ＲＥＸＥＥＤ,大阪府大阪市西区北堀江２丁目４番１１号,2016-09-23,株式会社
株式会社ＲＯＯＣＡＳ　ＯＮＥ,東京都品川区上大崎２丁目２４番１２号,2016-09-23,株式会社
株式会社ＲｅＲプロパティマネジメント,京都府南丹市園部町宍人流田３４番１,2016-09-23,株式会社
株式会社Ｒｅａｌ　Ｃｒａｆｔ,三重県四日市市鵜の森１丁目１４番１８号,2016-09-23,株式会社
株式会社ＳＡＵ１１,大阪府大阪市天王寺区大道４丁目１０番２３号サニープレスⅠ３０２号,2016-09-23,株式会社
株式会社ＳＲＣ,東京都新宿区西早稲田３丁目３０番２９号,2016-09-23,株式会社
株式会社ＳＴＡＮＤＡＲＤＳ　ＭＩＬＥ,岐阜県可児市広見２０５７番地１,2016-09-23,株式会社
株式会社ＳＴＳ,東京都品川区大井５丁目２２番８号,2016-09-23,株式会社
株式会社ＳｏｉＬ,福岡県柳川市京町４９番地,2016-09-23,株式会社
株式会社Ｓｔｙｌｅ・創,東京都練馬区豊玉北４丁目２５番１６号１０１,2016-09-23,株式会社
株式会社Ｔ－１,東京都文京区本郷１丁目１９番６号,2016-09-23,株式会社
株式会社Ｔｉｍｅ＆Ａｉｒ　Ｐａｒｔｎｅｒｓ,宮崎県宮崎市淀川３丁目８番１７号,2016-09-23,株式会社
株式会社Ｔｕｔｏｒｉｃａ,東京都新宿区西新宿３丁目８番３号新都心丸善ビル３Ｆ,2016-09-23,株式会社
株式会社ＶＥＲＤＥＣ,北海道旭川市新富一条１丁目４番１１号,2016-09-23,株式会社
株式会社ＶＩＴＥＸ,東京都港区南青山３丁目５番２号,2016-09-23,株式会社
株式会社Ｗトラスト,兵庫県姫路市安富町安志１２１０番地２,2016-09-23,株式会社
株式会社ＷＡＭ,東京都文京区本郷１丁目３５番２８－７１０号,2016-09-23,株式会社
株式会社ＷｅｂＰｏｒｔ,東京都大田区西糀谷１丁目１３番１７号,2016-09-23,株式会社
株式会社ＹＴＣ,神奈川県横浜市西区浅間町４丁目３４５番地の１,2016-09-23,株式会社
株式会社ａｋｔｉｓ,東京都江戸川区中葛西７丁目９番１６号,2016-09-23,株式会社
株式会社ｃｏｗｈａｐｐｉ,神奈川県横浜市保土ケ谷区仏向西２２番１－４０７号,2016-09-23,株式会社
株式会社ｅｑｕａ,東京都港区芝浦２丁目１３番７号,2016-09-23,株式会社
株式会社ｉＸｉＯ,東京都板橋区前野町２丁目１６番１号,2016-09-23,株式会社
株式会社ｍａｃｈｉｎａｍｉ,島根県出雲市塩冶原町２丁目４番１１号,2016-09-23,株式会社
株式会社ｍｅｄｉｃａｌ－ａｇｅｎｔ,群馬県前橋市堀越町２４７３番地１６,2016-09-23,株式会社
株式会社ｏ．ｆ．ｓ．,石川県七尾市中島町長浦子部２５番地,2016-09-23,株式会社
株式会社ｙｏｓｈｉｍａｓ．,新潟県五泉市四ツ屋新２０２番地,2016-09-23,株式会社
樋口工業株式会社,広島県広島市安佐南区安東１丁目１７番８号,2016-09-23,株式会社
横浜テック株式会社,神奈川県横浜市鶴見区梶山１丁目９番１号Ｃ棟,2016-09-23,株式会社
法人コンサルティング株式会社,東京都目黒区自由が丘２丁目１１番１０号パルシィード３階,2016-09-23,株式会社
海星マテリアルズジャパン株式会社,東京都荒川区西日暮里２丁目５２－５キングビル５０１,2016-09-23,株式会社
特定非営利活動法人おおき・ほっとかん,福岡県三潴郡大木町大字上八院１５９６番地１,2016-09-23,その他の設立登記法人
特定非営利活動法人おやこ整体協会,新潟県新潟市東区牡丹山５丁目４番６号５,2016-09-23,その他の設立登記法人
特定非営利活動法人全日本竹水鉄砲合戦協会,愛知県岡崎市康生通南３丁目２番・２２１ビル３Ｆ,2016-09-23,その他の設立登記法人
特定非営利活動法人埼玉東コアラ,埼玉県白岡市高岩１７９５番地２３,2016-09-23,その他の設立登記法人
特定非営利活動法人茅ヶ崎市障害者施設連絡会,神奈川県茅ヶ崎市芹沢７８６番地,2016-09-23,その他の設立登記法人
田中興業株式会社,岐阜県岐阜市岩地１丁目６番１５号,2016-09-23,株式会社
相模ハウジング株式会社,神奈川県相模原市南区相模台２丁目３番９号,2016-09-23,株式会社
社会福祉法人陽の木会,千葉県佐倉市寺崎北２丁目１３番１,2016-09-23,その他の設立登記法人
社会福祉法人風の詩,富山県中新川郡上市町湯崎野２０６番地１,2016-09-23,その他の設立登記法人
秀恩寺,北海道苫小牧市柏木町６丁目２番２０号,2016-09-23,その他の設立登記法人
翼工建株式会社,鹿児島県鹿児島市五ヶ別府町３７０５番地５,2016-09-23,株式会社
萩原電気合同会社,千葉県柏市日立台２丁目４番１８号,2016-09-23,合同会社
蒼麻株式会社,奈良県奈良市学園大和町１丁目１３０番地,2016-09-23,株式会社
農事組合法人あかい農場,福島県会津若松市湊町大字赤井字赤井３８番地,2016-09-23,その他の設立登記法人
農事組合法人卯鼠庵,岐阜県中津川市千旦林１４２５番地,2016-09-23,その他の設立登記法人
農業生産法人合同会社伊島農水商,沖縄県宮古島市伊良部字国仲１６８番地１,2016-09-23,合同会社
野口酒販合同会社,東京都多摩市聖ヶ丘３丁目６３番地の１,2016-09-23,合同会社
金沢市中学校文化連盟,石川県金沢市広坂１丁目１－１金沢市学校指導課,2016-09-23,その他
銀松国際株式会社,東京都港区南青山４丁目１６－１１,2016-09-23,株式会社
鯖江土地改良区合同事務所,福井県鯖江市西山町１３－１,2016-09-23,その他
ＡＫＩ　ＴＥＮＮＩＳ株式会社,東京都新宿区西新宿３丁目７番１号新宿パークタワーＮ３０階,2016-09-23,株式会社
ＡＲＨ合同会社,徳島県板野郡北島町高房字勝瑞境４５番地１１,2016-09-23,合同会社
ＢＰＳチップ工業株式会社,新潟県新潟市北区太郎代字山辺８５６番地６５,2016-09-23,株式会社
ＣＨＰＭ日本合同会社,東京都品川区東品川２丁目２番２４号,2016-09-23,合同会社
Ｄ．Ｒ．Ｉ．Ｉｎｔｅｒｎａｔｉｏｎａｌ合同会社,千葉県市川市新浜１丁目７番９号（ＣＨＩＤＯＲＩＰＡＲＫ２０４号）,2016-09-23,合同会社
Ｄｒｅａｍ　Ｂｒｉｄｇｅ株式会社,神奈川県横浜市港北区富士塚２丁目８番２号,2016-09-23,株式会社
ＧＡＴＳ株式会社,香川県高松市木太町３６２１番地８－１０３号室,2016-09-23,株式会社
ＧＢＳ株式会社,大阪府大阪市中央区宗右衛門町１番２８号,2016-09-23,株式会社
ＧＰＦ九州株式会社,佐賀県唐津市肥前町切木甲７８３番地３３,2016-09-23,株式会社
ＧＲＡＮ　ＰＡＲＴＮＥＲＳ合同会社,東京都中央区日本橋本町３丁目３－６ワカ末ビル７階,2016-09-23,合同会社
Ｇｏｌｄｅｎ　Ｍａｓｔｅｒ株式会社,東京都豊島区池袋４丁目１４番７号,2016-09-23,株式会社
Ｈａｎｉｃｓ　Ｊａｐａｎ株式会社,大阪府守口市大枝西町１５番５号,2016-09-23,株式会社
Ｈｙｂｒｉｄ株式会社,東京都新宿区西新宿７丁目５番２０号新宿旭ビルＡ館４０１,2016-09-23,株式会社
ＩＭＡハウジング合同会社,神奈川県川崎市幸区戸手３丁目４番３号,2016-09-23,合同会社
Ｊ＆Ｊカンパニー株式会社,東京都渋谷区笹塚１丁目４７番１－２１１０号メルクマール京王笹塚レジデンス,2016-09-23,株式会社
Ｊ－Ｂｕｚｚマーケティング株式会社,福岡県福岡市東区馬出６丁目１４番１２－４０５号,2016-09-23,株式会社
ＪＰＡ　Ｃｏｎｓｕｌｔｉｎｇ合同会社,東京都中央区日本橋室町４丁目３番９号,2016-09-23,合同会社
ＫＡＷＡＩＩ　ＪＡＰＡＮ株式会社,東京都渋谷区神宮前２丁目１３番５号,2016-09-23,株式会社
ＫＣガーディアン株式会社,神奈川県川崎市川崎区浅田３丁目１８番２号,2016-09-23,株式会社
ＫＨコンサルティング株式会社,埼玉県さいたま市南区文蔵４丁目２８番１１号ラプタⅡ２０１号,2016-09-23,株式会社
ＫＲＣ　ｉｎｔｅｒｎａｔｉｏｎａｌ株式会社,千葉県千葉市花見川区幕張本郷３丁目９番２８号,2016-09-23,株式会社
ＫＳ企画合同会社,東京都品川区北品川４丁目８番１４－３０７号,2016-09-23,合同会社
ＫＹＯＥＩＤＯカンパニー株式会社,京都府京都市右京区嵯峨野宮ノ元町１７番地５,2016-09-23,株式会社
Ｋｌａｍｐ株式会社,東京都品川区西五反田８丁目２番１２号,2016-09-23,株式会社
ＬＥＯ　Ｐｈａｒｍａ　Ａ／Ｓ,,2016-09-23,外国会社等
ＬｏｎｇＳｔａｒ株式会社,大阪府大阪市中央区瓦屋町１丁目１４番１５号サードパープル１０１号室,2016-09-23,株式会社
Ｍ　ＬＩＦＥ株式会社,東京都台東区東上野２丁目１８番７号３Ｆ,2016-09-23,株式会社
ＭＥＩＰソーラー合同会社,東京都千代田区丸の内３丁目１番１号東京共同会計事務所内,2016-09-23,合同会社
ＭＩＳ株式会社,青森県上北郡おいらせ町上久保６３番地７２,2016-09-23,株式会社
ＭＴＩ電通株式会社,大阪府堺市堺区浅香山町３丁１４番１０号,2016-09-23,株式会社
ＭＴＭ合同会社,京都府舞鶴市字引土６０８番地,2016-09-23,合同会社
Ｎ＆Ａ　Ｏｆｆｉｃｅ株式会社,大阪府大阪市北区梅田１丁目１１番４－１０００号,2016-09-23,株式会社
ＮＥＶＥＲＹ株式会社,東京都江戸川区西小岩２丁目２０番９－９０１号,2016-09-23,株式会社
ＮＰＯ法人ごはん５Ｈ　Ａｃｔｉｏｎ　Ｎｅｔｗｏｒｋ,北海道札幌市中央区南二条東２丁目８－１大都ビル９階,2016-09-23,その他の設立登記法人
ＮＲ　ＴＲＡＤＩＮＧ合同会社,千葉県山武市大木４７３番地１－２,2016-09-23,合同会社
ＯＣソーラー・ツー合同会社,東京都千代田区丸の内３丁目１番１号東京共同会計事務所内,2016-09-23,合同会社
Ｒ．Ｋ．Ｆ合同会社,愛知県岡崎市矢作町字赤池２２番地１１,2016-09-23,合同会社
ＲＥ３　ＴＲＡＤＩＮＧ株式会社,神奈川県藤沢市円行８２３番地の１－１０５号,2016-09-23,株式会社
ＲＧＫＭ合同会社,東京都渋谷区東１丁目３１番１９号マンション渋谷並木橋１０２号室,2016-09-23,合同会社
ＲＩＳＥ合同会社,東京都中野区上鷺宮３丁目７－１８－２０１号,2016-09-23,合同会社
ＲＷ原木３・１一般社団法人,東京都港区赤坂２丁目１０番５号税理士法人赤坂国際会計事務所内,2016-09-23,その他の設立登記法人
ＳＡＩ合同会社,東京都荒川区南千住５丁目３９番１５－１０２号,2016-09-23,合同会社
ＳＡＲＷＡＲ　ＴＲＡＤＩＮＧ株式会社,愛知県名古屋市港区藤高１丁目２２３番地,2016-09-23,株式会社
ＳＥＥＤ株式会社,大阪府泉佐野市高松南３丁目１－４１－１０２号,2016-09-23,株式会社
ＴＦＭリアルアセット合同会社,宮崎県延岡市野地町２丁目３６６８番地１,2016-09-23,合同会社
ＷＥＬＬ　ＨＯＭＥ株式会社,神奈川県横浜市西区高島２丁目１１番２号スカイメナー横浜４２２,2016-09-23,株式会社
ＷＩＮＧＳ　ＥＤＵＣＡＴＩＯＮ合同会社,東京都立川市柏町３丁目１５番地の１フラット・ヴィラージュＢ棟２０２号,2016-09-23,合同会社
ｒｏｏｍ４合同会社,東京都港区麻布台３丁目３番２６号,2016-09-23,合同会社
あま部品工業株式会社,愛知県あま市中萱津道場７２番地,2016-09-26,株式会社
うおよしフーズ株式会社,東京都中央区築地６丁目２番５号,2016-09-26,株式会社
つむぐ株式会社,福岡県北九州市八幡西区上の原３丁目２１番１７号,2016-09-26,株式会社
はりま税理士法人,兵庫県姫路市三左衛門堀西の町２０７番地,2016-09-26,その他の設立登記法人
ひの街パーキング株式会社,三重県松阪市日野町５８９番地,2016-09-26,株式会社
ひろのプログレス合同会社,東京都港区新橋２丁目１１番８号,2016-09-26,合同会社
ひ菜た農園協同組合,大分県日田市大山町西大山４８２番地１,2016-09-26,その他の設立登記法人
アイランドトラスト合同会社,沖縄県那覇市赤嶺１丁目９番地２,2016-09-26,合同会社
アスタノット株式会社,東京都千代田区神田須田町２丁目２５ＧＹＭ秋葉原４Ｆ５Ｆ,2016-09-26,株式会社
アズエンジニアリング株式会社,福井県越前市東千福町５番１６号,2016-09-26,株式会社
アーキテクトプラスブランディング株式会社,東京都港区南青山５丁目１０番１９号,2016-09-26,株式会社
アートデザイン合同会社,東京都千代田区内幸町１丁目１番１号帝国ホテルタワー１６階,2016-09-26,合同会社
アールズリペア株式会社,千葉県千葉市花見川区作新台８丁目１番２５号１Ｆ,2016-09-26,株式会社
エースライフ株式会社,埼玉県さいたま市大宮区桜木町１丁目１０番地１６シーノ大宮ノースウィング１３階,2016-09-26,株式会社
エーモード合同会社,福岡県福岡市博多区博多駅前２丁目１９番１７号,2016-09-26,合同会社
オーエムキャリー株式会社,大阪府大阪市大正区鶴町１丁目８番１７－３０３号,2016-09-26,株式会社
カサハラアグリセンター株式会社,長野県上田市常田１丁目１０番３号,2016-09-26,株式会社
グランドパートナー株式会社,熊本県熊本市北区八景水谷４丁目５番３３号,2016-09-26,株式会社
グリーン・プランナー株式会社,宮城県仙台市若林区卸町１丁目６番地１０卸町グリーンビル２０５号,2016-09-26,株式会社
グルー・クラウドサポート株式会社,東京都中央区日本橋兜町２０番５号,2016-09-26,株式会社
グレース・ライディングクラブ合同会社,岡山県岡山市南区箕島１６３１番地１,2016-09-26,合同会社
ケアステーション清須合同会社,愛知県清須市上条２丁目１６番地１６,2016-09-26,合同会社
サンセードル合同会社,埼玉県さいたま市浦和区針ヶ谷１丁目２２番５－３号,2016-09-26,合同会社
シェアリッチ株式会社,茨城県古河市恩名２３７３番地,2016-09-26,株式会社
シビルガード株式会社,愛知県春日井市浅山町４丁目６番３５号,2016-09-26,株式会社
シーナイン合同会社,東京都港区南青山２丁目１５番５号ＦＡＲＯ１階,2016-09-26,合同会社
ソラロボ株式会社,千葉県千葉市中央区中央２丁目５番１号千葉中央ツインビル２号館７階,2016-09-26,株式会社
タートル株式会社,愛知県知多市岡田緑が丘７番地の８,2016-09-26,株式会社
チャレンジプロジェクト株式会社,岐阜県大垣市木戸町２丁目１０９番地,2016-09-26,株式会社
ディープグロー税理士法人,東京都新宿区荒木町１９番地,2016-09-26,その他の設立登記法人
トキワインポーツジャパン合同会社,山口県下関市長府珠の浦町１７番２号,2016-09-26,合同会社
トラストグリーンパワー株式会社,東京都港区新橋６丁目４番３号ル・グラシエルビル７、３０６号,2016-09-26,株式会社
ドリームサポート株式会社,秋田県にかほ市平沢字石橋３４番地７,2016-09-26,株式会社
ナリス近畿南販売株式会社,和歌山県和歌山市園部１２９４番地７,2016-09-26,株式会社
ピエモンテ合同会社,東京都渋谷区渋谷１丁目１４番１５号,2016-09-26,合同会社
ピカデリー合同会社,東京都港区浜松町２丁目２番１５号,2016-09-26,合同会社
フジタホールディングス株式会社,静岡県伊東市富戸１３１７番５７９４,2016-09-26,株式会社
フライングゲット株式会社,東京都台東区竜泉２丁目２０番９号,2016-09-26,株式会社
ブレーンパショネイト株式会社,山口県周南市鐘楼町３番１号,2016-09-26,株式会社
プロパティマネジメント株式会社,東京都港区六本木１丁目９番１０号,2016-09-26,株式会社
マインドセット株式会社,東京都港区北青山３丁目６番７号青山パラシオタワー１１階,2016-09-26,株式会社
マサコム合同会社,埼玉県さいたま市北区奈良町１３１番地８９,2016-09-26,合同会社
マリソル株式会社,埼玉県さいたま市浦和区常盤４丁目２番１５－１００７号,2016-09-26,株式会社
ユウトグローバルキッチン株式会社,東京都中央区銀座２丁目１４番５号,2016-09-26,株式会社
リンク株式会社,北海道札幌市中央区南六条東２丁目６番地５－６０６号,2016-09-26,株式会社
一般社団法人エノモト,広島県広島市東区矢賀２丁目１番２１号,2016-09-26,その他の設立登記法人
一般社団法人ケア人間関係研究所,岐阜県岐阜市雄総桜町４丁目２３番地,2016-09-26,その他の設立登記法人
一般社団法人シンクネイチャー・アーツ・アンド・デザイン,東京都中野区中央５丁目４番２２号ＪＨＶ中野ビル２Ｆ,2016-09-26,その他の設立登記法人
一般社団法人ジャパンブルー上板,徳島県板野郡上板町泉谷字原東３２番地４,2016-09-26,その他の設立登記法人
一般社団法人ユニバーサルアカデミー協会,新潟県東蒲原郡阿賀町広谷乙２０８８番地,2016-09-26,その他の設立登記法人
一般社団法人ヴィンテージファッション検定,東京都江戸川区東葛西６丁目２番１１号エステートヨシダ２０１,2016-09-26,その他の設立登記法人
一般社団法人事業再生支援機構,東京都千代田区丸の内１丁目８番２号鉄鋼ビルディング４階,2016-09-26,その他の設立登記法人
一般社団法人住宅修繕保険申請支援機構,東京都千代田区二番町５番地２麹町駅プラザ９０１,2016-09-26,その他の設立登記法人
一般社団法人全国同和社,滋賀県近江八幡市末広町２００番地１３８,2016-09-26,その他の設立登記法人
一般社団法人八潮市薬剤師会,埼玉県八潮市中央４丁目１番地１３,2016-09-26,その他の設立登記法人
一般社団法人地域デザインファクトリー,東京都千代田区九段北１丁目１０番１号,2016-09-26,その他の設立登記法人
一般社団法人奥島根弥栄,島根県浜田市弥栄町長安本郷５４２番地１,2016-09-26,その他の設立登記法人
一般社団法人新地モータープール,大阪府大阪市北区堂島１丁目３番１１号,2016-09-26,その他の設立登記法人
一般社団法人日本右脳記憶教育協会,大阪府吹田市芳野町６番３号東急ドエルアルス江坂６０２号,2016-09-26,その他の設立登記法人
一般社団法人日本駄菓子協会,大阪府大阪市北区太融寺町７－１１,2016-09-26,その他の設立登記法人
一般社団法人沖縄県コンドミニアムリゾート協会,沖縄県那覇市前島３丁目２５番１号,2016-09-26,その他の設立登記法人
