法人名,住所,設立日,法人種別
株式会社イービレッジ,広島県広島市安佐南区西原２丁目２６番３９号,2025-01-24,株式会社
株式会社ウェア＆ウェイ,東京都墨田区菊川３丁目１５－２東海ビル１０１,2025-01-24,株式会社
株式会社エイト,東京都港区南青山２丁目２番１５号,2025-01-24,株式会社
株式会社エスエーメイク,宮城県仙台市宮城野区栄４丁目１４番１４号,2025-01-24,株式会社
株式会社エヌエスエーシー,京都府京都市下京区小稲荷町８５－２Ｇｒａｎｄ－Ｋ京都駅前ビル２０１,2025-01-24,株式会社
株式会社エモダカフ,鹿児島県姶良市西餅田３０５８番地４８,2025-01-24,株式会社
株式会社エーステクノロジー,愛知県名古屋市西区長先町１４７番地,2025-01-24,株式会社
株式会社オフィスアバンシア,鹿児島県霧島市溝辺町麓２０９４－４,2025-01-24,株式会社
株式会社オンテーブル,京都府舞鶴市字倉谷１０４８番地２,2025-01-24,株式会社
株式会社カント,北海道旭川市中常盤町１丁目２４３４番地の２,2025-01-24,株式会社
株式会社キャッチスター,大阪府大阪市中央区上町１丁目１６番２７－１９０３号,2025-01-24,株式会社
株式会社キュラスワン,東京都足立区綾瀬３丁目９番７号ベルシード綾瀬駅前５０１,2025-01-24,株式会社
株式会社クオンタムインテレクト,東京都港区南青山３丁目１番３６号青山丸竹ビル６Ｆ,2025-01-24,株式会社
株式会社グランキャピタル,東京都中央区新川２丁目２２番６号,2025-01-24,株式会社
株式会社グリーンプラム,東京都府中市宮西町５丁目２番地１１マーベラス府中西宮町１階,2025-01-24,株式会社
株式会社ケーズメンテ,広島県安芸郡坂町平成ヶ浜２丁目２番７２－９０６号,2025-01-24,株式会社
株式会社ココノハ,千葉県市川市市川１丁目２６番９－６０１号,2025-01-24,株式会社
株式会社コトホ,兵庫県尼崎市久々知３丁目３番２７号,2025-01-24,株式会社
株式会社コンフィシングス,埼玉県上尾市大字地頭方４４３番地１０,2025-01-24,株式会社
株式会社コードネスト,東京都渋谷区渋谷２丁目１９－１５宮益坂ビルディング６０９,2025-01-24,株式会社
株式会社ゴタール,大分県大分市中央町１丁目４番２号ＴＩＣ大分ビル７Ｆ－Ａ,2025-01-24,株式会社
株式会社サカグチ,大阪府堺市美原区菅生１０２７番地２,2025-01-24,株式会社
株式会社サムシス,愛知県名古屋市北区上飯田東町２丁目６８番地の２,2025-01-24,株式会社
株式会社ザイマックスウィコム,東京都港区赤坂１丁目１番１号,2025-01-24,株式会社
株式会社シエノス,大阪府大阪市中央区博労町４丁目４番１１号,2025-01-24,株式会社
株式会社ジェイジェイ,千葉県成田市東町１２０番地３８,2025-01-24,株式会社
株式会社ジェイ・エイ・シー・コーポレーション,京都府京都市中京区西洞院通錦小路上る古西町４３６番地,2025-01-24,株式会社
株式会社ストーンハート,徳島県美馬市脇町大字脇町６番地２,2025-01-24,株式会社
株式会社スプラウトマネジメント,東京都中央区晴海２丁目３番３０－４７０３号,2025-01-24,株式会社
株式会社スリーアローズ,兵庫県神戸市須磨区行幸町１丁目１番１２－１１０５号,2025-01-24,株式会社
株式会社ソロル,大阪府吹田市五月が丘南３１番１０－１０５号,2025-01-24,株式会社
株式会社タカケン,福島県いわき市平字長橋町５２番地シャーメゾン長橋２０１号室,2025-01-24,株式会社
株式会社ダイアマネジメント,東京都港区新橋２丁目４番５号,2025-01-24,株式会社
株式会社ダックス,岡山県久米郡美咲町休石４８０番地６,2025-01-24,株式会社
株式会社ダブリューディティティ,東京都渋谷区神宮前６丁目２３番４号桑野ビル２階,2025-01-24,株式会社
株式会社ティーチング企画,神奈川県横浜市緑区鴨居３丁目２９番３４号井上ハイツ２０３,2025-01-24,株式会社
株式会社トコロ商事,東京都練馬区北町７丁目２０番２６号,2025-01-24,株式会社
株式会社ファームサポート・イトウ,福島県河沼郡柳津町大字黒沢字五舛蒔４７１番地１,2025-01-24,株式会社
株式会社フレックスホールディングス,群馬県高崎市島野町１１４０番地,2025-01-24,株式会社
株式会社フードワン,東京都板橋区西台４丁目３番５－９０３号モアクレスト西台,2025-01-24,株式会社
株式会社プライムリンク,千葉県松戸市五香１丁目３３番地の２９,2025-01-24,株式会社
株式会社ホンテツ,石川県金沢市福増町南１４番地,2025-01-24,株式会社
株式会社ミキ,東京都渋谷区恵比寿南１丁目１１－１０プラウド恵比寿南６０２,2025-01-24,株式会社
株式会社ミナミシップコンサルタント,高知県高知市中の島２番１０７号,2025-01-24,株式会社
株式会社ミヤザワアンドカンパニー,長野県北佐久郡軽井沢町大字追分１５００番地１８,2025-01-24,株式会社
株式会社リアン,福岡県朝倉市美奈宜の杜１丁目４番１１号,2025-01-24,株式会社
株式会社リヒト,東京都中野区東中野４丁目９番２５号トーシンスペースビル４Ｆ,2025-01-24,株式会社
株式会社リメイン,東京都あきる野市雨間１０９５番地１７,2025-01-24,株式会社
株式会社リモデルワーカー,福島県いわき市泉町滝尻字前坪１４番地の１,2025-01-24,株式会社
株式会社リーフレイン,東京都港区浜松町２丁目２－１５浜松町ダイヤビル２階,2025-01-24,株式会社
株式会社ルミエール,鹿児島県鹿児島市武１丁目２１番３９号,2025-01-24,株式会社
株式会社ルーキーズ,東京都渋谷区恵比寿西２丁目２－９ＳＵＧＡＹＡビル７階,2025-01-24,株式会社
株式会社レモンシナモン,宮城県仙台市青葉区錦ケ丘５丁目８６番地の６,2025-01-24,株式会社
株式会社ワイズ工務店,東京都中央区日本橋茅場町２丁目８番１号,2025-01-24,株式会社
株式会社ワイ・ツウ・ケイ商事,大阪府東大阪市四条町１１番３号,2025-01-24,株式会社
株式会社三和,埼玉県川口市西川口６丁目４―６第二荻島ビル２階２１８,2025-01-24,株式会社
株式会社五十六,東京都千代田区九段南４丁目６番１号,2025-01-24,株式会社
株式会社仮説デザイン,東京都世田谷区太子堂４丁目１８番１５号マガザン三軒茶屋２－３Ｆ－３,2025-01-24,株式会社
株式会社仲村建装,沖縄県中頭郡嘉手納町字水釜４３９番地１,2025-01-24,株式会社
株式会社光国農園,千葉県茂原市六ツ野１９２０番地,2025-01-24,株式会社
株式会社共林,福島県いわき市小名浜下神白字薬師下１５９番地の２６,2025-01-24,株式会社
株式会社北端建材,和歌山県和歌山市布施屋４３番地２,2025-01-24,株式会社
株式会社博多といろ,福岡県福岡市博多区上川端町４番２２５号,2025-01-24,株式会社
株式会社吉祥寺人材サポートセンター,東京都武蔵野市吉祥寺本町１丁目３１－１１ＫＳビル７階,2025-01-24,株式会社
株式会社四つ葉防犯システム,群馬県佐波郡玉村町大字上新田５９５番地２,2025-01-24,株式会社
株式会社岩手未来総合研究所,岩手県盛岡市大通２丁目１番２３号,2025-01-24,株式会社
株式会社幸栄住宅,神奈川県鎌倉市手広２丁目８番２６号,2025-01-24,株式会社
株式会社新渡月,京都府京都市右京区嵯峨天龍寺造路町２０番地の４０,2025-01-24,株式会社
株式会社日進,埼玉県新座市北野３丁目１３番６号,2025-01-24,株式会社
株式会社日進コア,東京都墨田区江東橋５丁目８番１２－６０４号,2025-01-24,株式会社
株式会社暁,和歌山県和歌山市善明寺４０１番地５,2025-01-24,株式会社
株式会社未来リージョナル,千葉県流山市東初石３丁目１１１－１－Ｆ６０３,2025-01-24,株式会社
株式会社柊燈園,神奈川県横浜市戸塚区原宿３丁目１２番２３号,2025-01-24,株式会社
株式会社樹設備,埼玉県狭山市大字青柳１２４番地の１４２,2025-01-24,株式会社
株式会社沖東交易,沖縄県沖縄市知花４丁目１３番３号山城ビル３Ｆ,2025-01-24,株式会社
株式会社流桜,広島県広島市中区新天地５－１２ピーターパンハウス３Ｆ,2025-01-24,株式会社
株式会社燈堂,東京都中野区中野２丁目１９－２リードシー中野ビル３Ｆ,2025-01-24,株式会社
株式会社田中試錐工業,長崎県佐世保市世知原町長田代３９３番地,2025-01-24,株式会社
株式会社真誠,大阪府大阪市西成区鶴見橋１丁目１５番２７号,2025-01-24,株式会社
株式会社知念土木,沖縄県宮古郡多良間村字塩川２２０番地,2025-01-24,株式会社
株式会社碧空,東京都港区赤坂６丁目５番２１－１０３号,2025-01-24,株式会社
株式会社神戸ウィッグ,兵庫県神戸市中央区東町１２３番地１貿易ビル５Ｆ,2025-01-24,株式会社
株式会社福寿,長崎県雲仙市小浜町南本町７番地２２,2025-01-24,株式会社
株式会社福岡久園,京都府相楽郡和束町大字原山小字西ノ谷３７番地,2025-01-24,株式会社
株式会社竹次郎,福岡県糸島市本９１３番地,2025-01-24,株式会社
株式会社経営リズム,神奈川県横浜市西区北幸１丁目１１番１号水信ビル７階,2025-01-24,株式会社
株式会社豊明スクールランチ,愛知県豊明市西川町笹原１５番地１,2025-01-24,株式会社
株式会社都,京都府京都市右京区西院西貝川町６５番地７,2025-01-24,株式会社
株式会社酒井土建,静岡県浜松市中央区三方原町５０番地の３,2025-01-24,株式会社
株式会社金星ウェルネス,東京都千代田区東神田３丁目２番３号,2025-01-24,株式会社
株式会社鑫迪買取,埼玉県富士見市西みずほ台２丁目１－３,2025-01-24,株式会社
株式会社雨の森,福岡県宗像市東郷５丁目１６番３２号,2025-01-24,株式会社
株式会社３Ｍａｇｉｃ,北海道士別市温根別町南二線西一号,2025-01-24,株式会社
株式会社Ａ　ＰＬＵＳ　ＷＯＲＫＳ,静岡県浜松市中央区河輪町６２番地の１,2025-01-24,株式会社
株式会社Ａチーム,千葉県柏市旭町１丁目３－３ＳＫヴィラ２、６０６号室,2025-01-24,株式会社
株式会社ＡＤＣホールディングス,東京都練馬区平和台１丁目４番２号,2025-01-24,株式会社
株式会社ＡＩＲ,東京都渋谷区道玄坂１丁目１０番８号渋谷道玄坂東急ビル２Ｆ－Ｃ,2025-01-24,株式会社
株式会社ＡＮＮＥＸ,東京都中央区日本橋大伝馬町３－１０,2025-01-24,株式会社
株式会社ＡＲＴ　ＯＦ　ＬＩＦＥ,埼玉県日高市大字原宿４５６番地５,2025-01-24,株式会社
株式会社ＡＳＰＩＲＥ,福島県白河市東大沼５９ピュアハウスＢ２０１,2025-01-24,株式会社
株式会社ＡＷＡＫＥＮ,福岡県福岡市中央区天神２丁目２番１２号Ｔ＆Ｊビルディング７Ｆ,2025-01-24,株式会社
株式会社ＡＸＩＡ,北海道帯広市西六条北２丁目８番地１,2025-01-24,株式会社
株式会社ＡＹＡＮＮＡ,大阪府大阪市中央区瓦町２丁目１番１４瓦町ダイワビル６０１号,2025-01-24,株式会社
株式会社Ａｃｈｉｅｖｅ,北海道苫小牧市北光町２丁目１６番１号,2025-01-24,株式会社
株式会社Ａｉｓ　Ｒｏｃｋｅｔ,東京都新宿区西落合４丁目２２番１号,2025-01-24,株式会社
株式会社Ａｓａｈｉｎａ　Ｉｓａｍｕ　Ｐｒｏｄｕｃｅ,東京都東村山市恩多町２丁目３９番地１９,2025-01-24,株式会社
株式会社Ｂ＆Ｃ,広島県広島市南区西霞町２番１２号,2025-01-24,株式会社
株式会社ＢＡＬＳ,東京都台東区上野２丁目１０番４号４階－Ａ,2025-01-24,株式会社
株式会社ＢＡＳＥ　ＶＡＮＧＵＡＲＤ,東京都葛飾区青戸４丁目３番１号,2025-01-24,株式会社
株式会社ＢＣＪ‐９３,東京都千代田区丸の内１丁目１番１号パレスビル５階,2025-01-24,株式会社
株式会社ＢＣＪ‐９４,東京都千代田区丸の内１丁目１番１号パレスビル５階,2025-01-24,株式会社
株式会社ＢＮソリューションズ,東京都千代田区神田須田町１丁目７番８号ＶＯＲＴ秋葉原Ⅳ２Ｆ,2025-01-24,株式会社
株式会社Ｂａａｌ,北海道旭川市八条西３丁目２‐１０ピアコートシャンテ１０３号室,2025-01-24,株式会社
株式会社Ｂａｌｌｏｏｍ,東京都港区南青山３丁目１０番１１号Ｌｉｖｅｒａ表参道１０２,2025-01-24,株式会社
株式会社Ｂｅｌｌ　Ｌｉｎｅ,三重県鈴鹿市南玉垣町６５１７番地の１２,2025-01-24,株式会社
株式会社Ｂｌｏｏｍｙ,東京都世田谷区太子堂４丁目１８番１５号マガザン三軒茶屋２、３Ｆ－３,2025-01-24,株式会社
株式会社Ｂｏｔｔｏｍ　Ｄｅｓｉｇｎ　Ｗｏｒｋｓ,大阪府枚方市茄子作北町１２番８号,2025-01-24,株式会社
株式会社Ｃ．Ｃ．Ｃ,埼玉県所沢市大字久米１３２０番地の２０,2025-01-24,株式会社
株式会社ＣＡＭＢＡＮＡ,京都府京都市山科区竹鼻竹ノ街道町３５番地１４,2025-01-24,株式会社
株式会社ＣＥＮＯＴＥ,広島県広島市東区牛田新町４丁目７番２１－１２０２号,2025-01-24,株式会社
株式会社ＣＨＡＰＡＴＹ,東京都渋谷区道玄坂１丁目１０番８号渋谷道玄坂東急ビル２Ｆ－Ｃ,2025-01-24,株式会社
株式会社ＣＲＥＡ　ＷＯＲＫＳ＆ＣＯ．,広島県広島市西区井口台３丁目８番１号,2025-01-24,株式会社
株式会社Ｃｈａｒｉｓ　Ｔｈｒｉｖｅ,東京都中野区東中野１丁目１７番７－３０８号,2025-01-24,株式会社
株式会社Ｄ‐ＰＲＯＪＥＣＴ,大阪府大阪市淀川区三国本町１丁目１０番１３号,2025-01-24,株式会社
株式会社ＤｅａｒＦｉｎａｌｌｙ,東京都江戸川区南葛西７丁目１番３号メゾンクレールＡ棟１０５,2025-01-24,株式会社
株式会社ＥＢＩＳＵ,広島県広島市中区大手町１丁目１番２６号大手町一番ビル３０５,2025-01-24,株式会社
株式会社ＥＮＴＬＡ,東京都港区新橋４丁目１４番１,2025-01-24,株式会社
株式会社ＥＸＣＩＴＥ,大阪府大阪市西成区潮路１丁目８番３４号－５０５号,2025-01-24,株式会社
株式会社Ｅｍｐｏｗｅｒ　Ｌｉｎｋ　Ｊａｐａｎ,東京都港区浜松町２丁目２番１５号浜松町ダイヤビル２Ｆ,2025-01-24,株式会社
株式会社ＥｘＴｅｒａ,千葉県船橋市湊町２丁目１２番２４号日本橋ビル６Ｆ,2025-01-24,株式会社
株式会社ＦＡＩＴＨ,埼玉県川口市西川口６丁目１３番１２号,2025-01-24,株式会社
株式会社ＦＩＸ,宮城県大崎市鹿島台平渡字西銭神２１番地２,2025-01-24,株式会社
株式会社ＦＬＳ,東京都新宿区西新宿３丁目７番１号新宿パークタワーＮ棟３０階,2025-01-24,株式会社
株式会社ＦＯＵＮＤＲＹ　ＭＥＷＳ,東京都渋谷区神宮前６丁目２３―４桑野ビル２階,2025-01-24,株式会社
株式会社Ｆａｍｉｌｙ　Ｃｒｅｗ,愛知県名古屋市天白区塩釜口１丁目６５７番地の２,2025-01-24,株式会社
株式会社Ｆａｓｔｅ,宮城県気仙沼市唐桑町宿浦２９番地３,2025-01-24,株式会社
株式会社Ｆｌｏｕｒｉｓｈ,広島県広島市安佐北区落合南２丁目２３番１０号,2025-01-24,株式会社
株式会社ＧＬＥＡＭ,東京都葛飾区堀切２丁目４４番１９号,2025-01-24,株式会社
株式会社Ｇｌｏｗ,福岡県筑紫野市原田４丁目６番地１０－１０２号,2025-01-24,株式会社
株式会社Ｇｒｏｏｖｙ,岐阜県不破郡垂井町平尾７２５番地,2025-01-24,株式会社
株式会社ＨＡＫＵＳＵＩポリマー,東京都八王子市川口町９６１－６,2025-01-24,株式会社
株式会社ＨＣ,福井県あわら市温泉１丁目５０５番地,2025-01-24,株式会社
株式会社ＨＯＰＥ,北海道札幌市白石区本郷通１０丁目南２番１７－２０２号,2025-01-24,株式会社
株式会社ＨＳコーポレーション,岡山県岡山市北区下石井２丁目１０番３０号５１６号室,2025-01-24,株式会社
株式会社ＨａｎｄｓＯｎ　ＡＩ,東京都江東区東陽２丁目３－６－９１４,2025-01-24,株式会社
株式会社Ｈｏｎｅｓｔ,北海道恵庭市黄金北３丁目１７番地１３,2025-01-24,株式会社
株式会社ＩＤコンサルティング,東京都港区港南２丁目１５－１品川インターシティＡ棟２８階,2025-01-24,株式会社
株式会社ＩＧ４,東京都港区赤坂９丁目７番２号ミッドタウン・イースト４階,2025-01-24,株式会社
株式会社ＩＳＳＨＩＮ,福岡県北九州市小倉北区寿山町５番２７号（ウィンディアヒロ１０２）,2025-01-24,株式会社
株式会社Ｋ‐Ｎ,東京都渋谷区渋谷２丁目１９－１５宮益坂ビルディング６０９,2025-01-24,株式会社
株式会社Ｋトライフ,群馬県前橋市樋越町３３２番地６,2025-01-24,株式会社
株式会社Ｋｕｆｕｒｕ,東京都板橋区南常盤台１丁目１１－６レフア南常盤台１０１号室,2025-01-24,株式会社
株式会社ＬＡＣＩＱＵＥ,群馬県伊勢崎市下蓮町２３４番地７,2025-01-24,株式会社
株式会社ＬＥＡＤ　ＢＲＩＤＧＥ,東京都新宿区西落合２丁目１０番１２号,2025-01-24,株式会社
株式会社ＬＯＯＰ,東京都港区北青山１丁目３番１号アールキューブ青山３階,2025-01-24,株式会社
株式会社Ｌａ　Ｖａｌｉｓｅ,愛知県名古屋市昭和区広瀬町３丁目１エトワール阿由知１０３,2025-01-24,株式会社
株式会社ＬａＢｒｉｌｌｅｒ,鹿児島県鹿児島市平之町７番３３－３０１号,2025-01-24,株式会社
株式会社Ｌｅａｐ,岐阜県岐阜市高砂町５丁目１２番地２（サンクレイドル岐阜６０３号室）,2025-01-24,株式会社
株式会社Ｌｅｖａｎｔｅ,愛知県名古屋市中区橘１丁目１６番４５号,2025-01-24,株式会社
株式会社ＬｉｎｋＬｅ,東京都渋谷区渋谷２丁目１９－１５宮益坂ビルディング６０９,2025-01-24,株式会社
株式会社Ｌｉｎｋｓ,大阪府八尾市教興寺５丁目１８５番地２１８号室,2025-01-24,株式会社
株式会社Ｌｕｍｉｅｒｅ,大阪府大阪市北区天満橋３丁目３番５号,2025-01-24,株式会社
株式会社Ｌｕｎｅｏ　Ｅｎｅｒｇｙ,千葉県松戸市新松戸７丁目２５１番地の１ピノポルタ１０２号,2025-01-24,株式会社
株式会社Ｍ＆Ｍ,大阪府大阪市淀川区西中島２丁目３番１５－９０７号,2025-01-24,株式会社
株式会社ＭＡ,大阪府八尾市山賀町５丁目５０－２,2025-01-24,株式会社
株式会社ＭＩＭＡ　ＴＲＡＤＥ,徳島県美馬市脇町別所３４４５番地１,2025-01-24,株式会社
株式会社ＭＩＳＥＬＵ,福岡県福岡市東区香椎駅前１丁目９番１５－１００２号,2025-01-24,株式会社
株式会社Ｍａｉｓｏｎ　Ｐｌａｎ,熊本県熊本市北区楠８丁目６番１５－７号,2025-01-24,株式会社
株式会社Ｍｕｓｕｂｉｉｔｏ,東京都世田谷区下馬１丁目２９番４号シティーハイムモチダ１０４,2025-01-24,株式会社
株式会社Ｎ．Ｈ　ｐｌａｎｔｓ,福岡県北九州市小倉南区長尾４丁目１７番２８号,2025-01-24,株式会社
株式会社ＮＡＧＩ,福島県福島市鎌田字一里塚５番地の２２,2025-01-24,株式会社
株式会社ＮＡＯ’Ｓクリーン＆エステート,京都府京都市上京区主税町８２７－２主税ビル１Ｆ,2025-01-24,株式会社
株式会社ＮＥＢＥＬＭＥＥＲ,大阪府大阪市東住吉区矢田２丁目２１番１７号,2025-01-24,株式会社
株式会社ＮＥＺＩ,大阪府大阪市北区中之島３丁目１－８リバーサイドビル２Ｆ,2025-01-24,株式会社
株式会社Ｎｅｘｔ,埼玉県さいたま市大宮区桜木町２丁目３番地大宮マルイ７階,2025-01-24,株式会社
株式会社Ｎｉｐｐｏｎ　Ｍｉｒａｉ,大阪府吹田市豊津町９番１５号日本興業ビル７０１,2025-01-24,株式会社
株式会社Ｏ２ジャパントラベル,東京都新宿区西新宿３丁目３番１３号西新宿水間ビル６階,2025-01-24,株式会社
株式会社ＯＤＡＧＡＷＡ,東京都千代田区岩本町３丁目１番９号ＮｏｖｅｌＷｏｒｋＩｗａｍｏｔｏｃｈｏ３階,2025-01-24,株式会社
株式会社ＯＶＣＨＩＮＩ,東京都港区赤坂２丁目５番８号ヒューリックＪＰ赤坂ビル３階,2025-01-24,株式会社
株式会社Ｐｕｎｔ,東京都港区南青山２丁目２番１５号ウィン青山９４２,2025-01-24,株式会社
株式会社Ｐｕｒｐｏｓｅ,京都府京都市左京区岩倉南河原町２０番地,2025-01-24,株式会社
株式会社Ｑｗｏｎ’ｚ,東京都渋谷区東１丁目１番３８号,2025-01-24,株式会社
株式会社ＲＯＣＫ　ＴＯＷＥＲ,東京都新宿区新宿１丁目２４番７－４２２号,2025-01-24,株式会社
株式会社ＲｅｇｉｏｎａｌＡｇｅｎｔ,福島県田村市船引町石森字舘１０８番地,2025-01-24,株式会社
株式会社ＳＡＧＧＩＯ,埼玉県熊谷市宮町２丁目１８１番地,2025-01-24,株式会社
株式会社ＳＫ設備工業,東京都八王子市下柚木１８０９番地５,2025-01-24,株式会社
株式会社ＳＭＰ,大阪府大阪市西成区千本南１丁目３番２２号,2025-01-24,株式会社
株式会社ＳＭＳ,徳島県徳島市応神町東貞方字貞光１０番地,2025-01-24,株式会社
株式会社ＳＰＡＩＬ,東京都新宿区西新宿３丁目３番１３号西新宿水間ビル２Ｆ,2025-01-24,株式会社
株式会社ＳＴ企画,徳島県徳島市住吉５丁目２番３６－１号,2025-01-24,株式会社
株式会社ＳＴＯＲＹ,埼玉県久喜市伊坂南３丁目２１番地１４,2025-01-24,株式会社
株式会社ＳＵＧＯＩ．ＨＱ,東京都港区南麻布４丁目１４番６号,2025-01-24,株式会社
株式会社ＳＵＰＥＲ　ＮＯＶＡ,愛知県名古屋市中川区戸田ゆたか１丁目１３１７番地,2025-01-24,株式会社
株式会社Ｓｅｅｄｓ,大阪府豊中市北条町１丁目２番４５－６１９号,2025-01-24,株式会社
株式会社Ｓｋｙ　Ｅｎｔｒａｎｃｅ,大阪府大阪市東淀川区東淡路４丁目１７－１５Ｒｅ：Ｚｏｎｅ淡路０１－２０６号,2025-01-24,株式会社
株式会社ＳｔｕｄｉｏＣｈｉ,奈良県奈良市学園中５丁目７０６番地の１１フローレスタ学園前３０１号,2025-01-24,株式会社
株式会社Ｓｗａｌｌｏｗ,石川県金沢市八日市５丁目３００番地２,2025-01-24,株式会社
株式会社Ｔ．Ｐｏｒｔ,沖縄県中頭郡北谷町字吉原９５８番地３,2025-01-24,株式会社
株式会社ＴＩＳ,神奈川県厚木市鳶尾１丁目１番１４号,2025-01-24,株式会社
株式会社ＴＪエンタープライズ,千葉県船橋市西船７丁目１－１３,2025-01-24,株式会社
株式会社ＴＭＪ松橋設備工業,秋田県秋田市将軍野東４丁目７番１７号,2025-01-24,株式会社
株式会社ＴＯＡＳＴ,東京都世田谷区野沢３丁目４番１８－８０８号,2025-01-24,株式会社
株式会社ＴＲＯＰＩＫＡ,沖縄県那覇市牧志２丁目１７－２７－４０１,2025-01-24,株式会社
株式会社ＴＲＵＳＴ,茨城県常総市中妻町７１４番地１,2025-01-24,株式会社
株式会社ＵＭＩＡＩＬＥ,東京都墨田区八広４丁目３６番２１号,2025-01-24,株式会社
株式会社ＷＷＨ　ＧＲＯＵＰ,岡山県岡山市北区駅前町２丁目６番２１号,2025-01-24,株式会社
株式会社Ｗｏｒｌｄ　Ｏｎｅ,東京都新宿区大久保２丁目１８番１８号,2025-01-24,株式会社
株式会社ＹＡＤＯ一級建築士事務所,栃木県鹿沼市西鹿沼町９８番地３,2025-01-24,株式会社
株式会社ＹＯＳＨＩＭＯＴＯ,徳島県徳島市西新浜町１丁目２番８－３３号レーベンハイツ,2025-01-24,株式会社
株式会社ＹＵＲＰＴＩＯＮ,東京都世田谷区北沢２丁目９番１７号,2025-01-24,株式会社
株式会社ａｌｍｓ,沖縄県宮古島市平良字久貝８３６－３－２０３,2025-01-24,株式会社
株式会社ｇｒｅｅｎ．ｔ,宮城県仙台市宮城野区中野１丁目４－９－１０８,2025-01-24,株式会社
