法人名,住所,設立日,法人種別
合同会社ミークジーエ,大阪府枚方市高塚町２５番２－１２０７号,2017-04-21,合同会社
合同会社モアハピネス,福岡県福岡市東区三苫５丁目１番２５号,2017-04-21,合同会社
合同会社上原工務店,埼玉県三郷市早稲田１丁目２３番地１１－２０３,2017-04-21,合同会社
合同会社丹波高天原,京都府船井郡京丹波町豊田山内３６番地,2017-04-21,合同会社
合同会社依田,山梨県笛吹市石和町市部５０１番地,2017-04-21,合同会社
合同会社前田工業,新潟県新潟市東区松和町７番１０号,2017-04-21,合同会社
合同会社安野機工,栃木県栃木市岩舟町和泉１９２番地１,2017-04-21,合同会社
合同会社弌,北海道札幌市北区篠路十条２丁目１２番１５号,2017-04-21,合同会社
合同会社旭川開発,東京都港区海岸１丁目９番１８号,2017-04-21,合同会社
合同会社松組,宮崎県都城市金田町１２０６番地４,2017-04-21,合同会社
合同会社根尾,東京都港区南青山２丁目２番１５号ｗｉｎ青山ビルＵＦＣ９１７,2017-04-21,合同会社
合同会社牧田,静岡県静岡市清水区横砂南町１０番１３号,2017-04-21,合同会社
合同会社特命係,大阪府大阪市東淀川区豊里２丁目１－３－１４０９,2017-04-21,合同会社
合同会社石井電業,茨城県鉾田市造谷１５２９番地１２０,2017-04-21,合同会社
合同会社福留,鹿児島県曽於市財部町北俣１８２５番地,2017-04-21,合同会社
合同会社飯田電気工事,神奈川県川崎市川崎区東門前２丁目１番１２号,2017-04-21,合同会社
合同会社齋藤商店,神奈川県横浜市中区野毛町１丁目１番地,2017-04-21,合同会社
合同会社３ＰＥＡＣＥ,千葉県柏市大津ケ丘３丁目１番地５棟４０４号,2017-04-21,合同会社
合同会社ＡＬＭＥＲＩＡ,東京都世田谷区赤堤３丁目２番１１号－４０５,2017-04-21,合同会社
合同会社Ａｂｓｏｌｕｔｅ,愛知県豊橋市広小路３丁目５４番地１（３０２）,2017-04-21,合同会社
合同会社ＢＯＡＲ,東京都板橋区成増１丁目１６番２５号ぶりらんて１０３,2017-04-21,合同会社
合同会社Ｃｏｍｐａｎｙ　ＯＧＵ,東京都文京区千石２丁目１１番９－１３１号,2017-04-21,合同会社
合同会社Ｆｕｔｕｒｅ,埼玉県川越市大字藤間１０２４番地２,2017-04-21,合同会社
合同会社Ｇネクスト,千葉県船橋市坪井東２丁目６番２１号,2017-04-21,合同会社
合同会社ＨＩＯＳＨＩＮＡ,東京都渋谷区渋谷２丁目１７番３号,2017-04-21,合同会社
合同会社ＪＡＩ　ＳＡＨＩＢ　ＫＩ　ＥＮＴＥＲＰＲＩＳＥ,茨城県結城市大字結城１３８７５番地,2017-04-21,合同会社
合同会社ＫＦプレミアム,大阪府大阪市中央区伏見町３丁目１番１号淀屋橋アップルタワーレジデンス４０１,2017-04-21,合同会社
合同会社ＫＭ,東京都大田区蒲田４丁目３９番１号,2017-04-21,合同会社
合同会社ＫＯＫＯＲＯ,東京都港区赤坂２丁目１８番１９号,2017-04-21,合同会社
合同会社ＬＯＣＡ,千葉県千葉市緑区土気町１３０６番地３８,2017-04-21,合同会社
合同会社ＮＡＭ設計工房,茨城県結城郡八千代町大字野爪３３７番地１,2017-04-21,合同会社
合同会社ＮＩＣＣＯＲＩ,神奈川県平塚市立野町４番２８号ブルーウィング１０２号,2017-04-21,合同会社
合同会社Ｐ’ｓ　ｈａｎｄ,北海道札幌市西区八軒一条東２丁目２番７８号,2017-04-21,合同会社
合同会社Ｒａｂｂｉｔ　Ｊａｐａｎ,東京都八王子市三崎町４番１１号,2017-04-21,合同会社
合同会社ＳＫＹ,東京都新宿区百人町１丁目６番２７号,2017-04-21,合同会社
合同会社Ｔ’ｓ　ｃｏｍｐａｎｙ,沖縄県那覇市西１丁目９番１８号,2017-04-21,合同会社
合同会社Ｔ＆Ｔ,兵庫県神戸市灘区楠丘町４丁目３番１６－１０２号,2017-04-21,合同会社
合同会社ＴＡＦ　ｈａｉｒ,京都府京都市左京区高野西開町２６番地１Ｆ,2017-04-21,合同会社
合同会社ＴＩＰ,東京都練馬区早宮４丁目４０番８号,2017-04-21,合同会社
合同会社ＴＯＫＺＵＭ,東京都西東京市南町５丁目９番１５－１３号,2017-04-21,合同会社
合同会社Ｔｒｕｍｐ,大阪府大阪市浪速区恵美須西２丁目１４番９号,2017-04-21,合同会社
合同会社ＹＳＰＣ,大阪府堺市堺区向陵中町２丁３番１９号,2017-04-21,合同会社
合同会社ＺＥＮプロモーション,北海道札幌市中央区北三条西１４丁目２番２号,2017-04-21,合同会社
合同会社ｍｏａｎａｒｅａ,東京都調布市国領町７丁目７１番地３９,2017-04-21,合同会社
合同会社ｎｉｃｏ,大阪府大阪市平野区背戸口１丁目２２番２０号,2017-04-21,合同会社
合同会社ｓｙｎｃｈｒｏｎｉｃｉｔｙ,東京都杉並区高円寺南２丁目３５番１２号ＭＤＭｋｏｅｎｊｉ１０１,2017-04-21,合同会社
合名会社ウブカタ,山口県宇部市大字西岐波５８０番地７,2017-04-21,合名会社
合資会社富山商店,福島県本宮市本宮字中條５２番地,2017-04-21,合資会社
堀越シャッター工業株式会社,栃木県足利市五十部町５８番地７,2017-04-21,株式会社
塚田株式会社,長野県埴科郡坂城町大字坂城６４６１番地１,2017-04-21,株式会社
大島産業株式会社,東京都大田区中央６丁目１番５号,2017-04-21,株式会社
大曾工業株式会社,千葉県松戸市北松戸１丁目９番地の５ペガサス北松戸９０２号,2017-04-21,株式会社
大津トレーディング株式会社,福岡県三潴郡大木町大字前牟田５２４番地,2017-04-21,株式会社
大阪ランド株式会社,大阪府大阪市阿倍野区阿倍野筋３丁目３番１８号,2017-04-21,株式会社
太田組合同会社,大阪府茨木市耳原１丁目７番８号,2017-04-21,合同会社
宝塚設備保全株式会社,兵庫県宝塚市伊孑志４丁目１番６４号,2017-04-21,株式会社
宝贏株式会社,大阪府大阪市北区大淀北１丁目６番２１－９０４号,2017-04-21,株式会社
小石川建物管理合同会社,東京都文京区白山２丁目１番２号５０１,2017-04-21,合同会社
山口電設株式会社,神奈川県川崎市川崎区小田５丁目１２番３０号東ハイツ１０２,2017-04-21,株式会社
山株式会社,静岡県伊豆市下白岩３７１番地の７,2017-04-21,株式会社
常盤コーポ管理組合法人,高知県高知市二葉町４番３号,2017-04-21,その他の設立登記法人
恒大信用合同会社,東京都中野区野方６丁目２９－８－２Ｆ,2017-04-21,合同会社
惠貫株式会社,東京都板橋区坂下２丁目１２番１３号プレミール坂下１０３,2017-04-21,株式会社
新太平洋物流株式会社,北海道北広島市大曲工業団地４丁目２番地８,2017-04-21,株式会社
新明リアル・エステート株式会社,東京都新宿区大久保１丁目９番１７号,2017-04-21,株式会社
日中通商合同会社,東京都板橋区徳丸３丁目１７番５号,2017-04-21,合同会社
日本足場レンタル株式会社,東京都新宿区西新宿７丁目４番７号,2017-04-21,株式会社
日越総合企画株式会社,兵庫県尼崎市塚口町１丁目２２番地の９,2017-04-21,株式会社
有限会社タメフサ,岡山県瀬戸内市牛窓町鹿忍７２２６番地,2017-04-21,有限会社
有限会社堀口酒店,東京都八王子市東中野５２６番地,2017-04-21,有限会社
未来クリエイターズ株式会社,東京都千代田区飯田橋２丁目１７番９－１５０２号,2017-04-21,株式会社
東日本高速協同組合,福島県伊達郡国見町大字藤田字日向１番地１２,2017-04-21,その他の設立登記法人
松井グローカル合同会社,福島県福島市泉字清水内３番地,2017-04-21,合同会社
栃木県農業共済組合,栃木県宇都宮市下平出町前表３１９番地１,2017-04-21,その他の設立登記法人
株式会社かなのわ,大阪府守口市八雲中町１丁目２３番７号,2017-04-21,株式会社
株式会社かのん,福岡県大野城市筒井５丁目１０番１４号,2017-04-21,株式会社
株式会社さくらんぼ,福岡県遠賀郡水巻町猪熊３丁目１－３８,2017-04-21,株式会社
株式会社そよかぜパートナーズ,神奈川県横浜市港北区新横浜２丁目１５番地１０,2017-04-21,株式会社
株式会社たくみ,兵庫県尼崎市杭瀬本町２丁目１番３号,2017-04-21,株式会社
株式会社たべもの計画,東京都新宿区西新宿７丁目２０番１号住友不動産西新宿ビル２３階,2017-04-21,株式会社
株式会社ちゅーりっぷＪｏＢ,神奈川県横浜市金沢区泥亀１丁目８番２号,2017-04-21,株式会社
株式会社なんのこれしき,東京都八丈島八丈町大賀郷３６３番地１,2017-04-21,株式会社
株式会社のむら屋,大阪府箕面市桜ケ丘３丁目１番２０号,2017-04-21,株式会社
株式会社まちづくり村田,宮城県柴田郡村田町大字村田字町４３番地,2017-04-21,株式会社
株式会社みらい共創技術研究所,神奈川県横浜市港北区樽町１丁目２１番１５－４０１号,2017-04-21,株式会社
株式会社やどかり,沖縄県那覇市赤嶺１丁目３番１２号１Ｆ,2017-04-21,株式会社
株式会社やまやレストランシステム,兵庫県神戸市須磨区弥栄台５丁目１９番地の２,2017-04-21,株式会社
株式会社よまとりーふ,鹿児島県鹿児島市伊敷台５丁目１８番１８号,2017-04-21,株式会社
株式会社アイザック,栃木県栃木市大平町西水代１４８７番地１,2017-04-21,株式会社
株式会社アカデミアクォーレ,北海道苫小牧市表町１丁目３番４号,2017-04-21,株式会社
株式会社アキズ・ノーバ・プロ,京都府亀岡市千代川町高野林西ノ畑３番地４０,2017-04-21,株式会社
株式会社アップデート,広島県広島市中区三川町２番１０号,2017-04-21,株式会社
株式会社アルファ,東京都武蔵野市境１丁目７番９号マンションオークラ境２０２号室,2017-04-21,株式会社
株式会社アレックス,広島県広島市南区出島２丁目１３番４１号,2017-04-21,株式会社
株式会社アンクラフト・リサーチ・インスチチュート,大阪府大阪市西区南堀江２丁目３番１２号,2017-04-21,株式会社
株式会社アンドシェア,大阪府大阪市淀川区十八条２丁目２番３号,2017-04-21,株式会社
株式会社アンリミット,大阪府堺市中区学園町４番１４号,2017-04-21,株式会社
株式会社イリス,東京都豊島区東池袋１丁目３２番１号第２アムスビル５ＦＴ００５号室,2017-04-21,株式会社
株式会社エイワイテクニックス,埼玉県草加市青柳４丁目１６番２１号ハイツ宮Ｇ－２０２号室,2017-04-21,株式会社
株式会社エスビーシードットコム,鳥取県米子市三本松１丁目３番２４号,2017-04-21,株式会社
株式会社エデュマン,神奈川県横浜市緑区長津田５丁目４番３２号,2017-04-21,株式会社
株式会社エバーグリーン・ツリー,東京都豊島区池袋２丁目５４番１号パールビル１階,2017-04-21,株式会社
株式会社エフ・エフ・エル,東京都豊島区東池袋２丁目６０番２号池袋パークハイツ２階,2017-04-21,株式会社
株式会社エフ．オー．ビー,福岡県福岡市中央区薬院２丁目４番２７－６０１号,2017-04-21,株式会社
株式会社エムオーアンドイー,東京都渋谷区円山町２０番１号,2017-04-21,株式会社
株式会社エムオーサポート,東京都狛江市東野川２丁目２０番５－２０１号,2017-04-21,株式会社
株式会社エランダール,東京都品川区北品川２丁目２６番５号,2017-04-21,株式会社
株式会社オアシス,東京都杉並区成田東４丁目２８番１５号,2017-04-21,株式会社
株式会社オズ・アークス,広島県広島市安佐北区落合南４丁目２０番２０号,2017-04-21,株式会社
株式会社オフィス・アーキテクト,東京都新宿区高田馬場１丁目３１番８号,2017-04-21,株式会社
株式会社オリーブ企画,石川県金沢市太陽が丘２丁目１１０番地,2017-04-21,株式会社
株式会社オーイズミフーズ北陸,福井県越前市横市町第３９号８番地３,2017-04-21,株式会社
株式会社カウベル,埼玉県川口市大字安行原１０５８番地,2017-04-21,株式会社
株式会社カルビハウス,大阪府大阪市生野区桃谷４丁目４番８号,2017-04-21,株式会社
株式会社カンシャス,島根県安来市広瀬町東比田１０４１番地,2017-04-21,株式会社
株式会社カーズワン,北海道札幌市清田区北野一条２丁目１１番８０号,2017-04-21,株式会社
株式会社キャッチ,愛知県名古屋市中村区名駅３丁目２０番２０号名駅錦ビル６Ｆ,2017-04-21,株式会社
株式会社クリエイトセブン,兵庫県加古川市上荘町都染４５３番地,2017-04-21,株式会社
株式会社ケイスター,熊本県熊本市中央区新大江３丁目７番３号エルシア１階,2017-04-21,株式会社
株式会社ケイティライズ,東京都港区新橋６丁目１６番８号レックスビル４０６,2017-04-21,株式会社
株式会社コンライズ,茨城県水戸市白梅２丁目２番地２５,2017-04-21,株式会社
株式会社サウンドフレンド,北海道斜里郡斜里町字以久科北５２番地,2017-04-21,株式会社
株式会社サントル,神奈川県横浜市鶴見区北寺尾６丁目１番１５号,2017-04-21,株式会社
株式会社サンライズ,東京都大田区大森西１丁目２番８号,2017-04-21,株式会社
株式会社サンライン,鳥取県米子市尾高１９８３番地９,2017-04-21,株式会社
株式会社シティブライト,大阪府大阪市都島区都島本通５丁目１３番７号,2017-04-21,株式会社
株式会社シティモバイル,東京都中央区日本橋堀留町１丁目３番１６号,2017-04-21,株式会社
株式会社シビカラ屋,大阪府枚方市出口３丁目５番１３号,2017-04-21,株式会社
株式会社シンフォニック・バリューズ,東京都渋谷区渋谷３丁目１番８号,2017-04-21,株式会社
株式会社シーエイト,熊本県熊本市北区植木町岩野８６５－２３,2017-04-21,株式会社
株式会社ジオン,東京都新宿区西新宿７丁目２番６号,2017-04-21,株式会社
株式会社ジューワー,千葉県市川市広尾１丁目１３番３号,2017-04-21,株式会社
株式会社ジョイテック,愛知県岡崎市東牧内町字二反畑１３番地１,2017-04-21,株式会社
株式会社ジョイントリンク,大阪府大阪市中央区南船場４丁目１１－１６心斎橋コラムナービル４０２号,2017-04-21,株式会社
株式会社スターエクスプレス・ジャパン,福岡県福岡市博多区御供所町１３－１２－２０２,2017-04-21,株式会社
株式会社ステラライト,大阪府大阪市天王寺区寺田町２丁目６番２号,2017-04-21,株式会社
株式会社ストレンジブルーイング,新潟県南魚沼市黒土新田７９番地５,2017-04-21,株式会社
株式会社スーパーフラット,京都府京丹後市久美浜町関２６８番地の２,2017-04-21,株式会社
株式会社ゼロフィールド,東京都目黒区緑が丘２丁目１９番１１号,2017-04-21,株式会社
株式会社ソノカワ塗装,愛知県あま市甚目寺沖田４９番地３,2017-04-21,株式会社
株式会社ソルテンサアライアンス,福岡県福岡市中央区天神４丁目１番２８号天神リベラ５０３号室,2017-04-21,株式会社
株式会社ゾルディック,群馬県伊勢崎市東本町１０９番地２８,2017-04-21,株式会社
株式会社タガミ企画,北海道札幌市豊平区平岸三条１２丁目１番３３号,2017-04-21,株式会社
株式会社タック,愛知県知多郡武豊町字上原１３６番地７,2017-04-21,株式会社
株式会社タナカ,広島県東広島市西条岡町８番２３号,2017-04-21,株式会社
株式会社チーム丸昌,東京都中央区銀座５丁目９番１３号菊正ビルＢ１,2017-04-21,株式会社
株式会社ディー・ラン,大阪府高石市取石５丁目７番１８号,2017-04-21,株式会社
株式会社デザインステーション,福岡県田川市伊田町５番１０号,2017-04-21,株式会社
株式会社デジタルプラネット,東京都練馬区小竹町２丁目６１番８号,2017-04-21,株式会社
株式会社デンタルイノベーション,埼玉県行田市行田１９番９号,2017-04-21,株式会社
株式会社トゥモローアート,栃木県佐野市赤見町３９６９番地,2017-04-21,株式会社
株式会社ドラワッタエンタープライセス,栃木県宇都宮市下岡本町３７８１番地１４,2017-04-21,株式会社
株式会社ナカガワカセイ,奈良県橿原市小槻町１８９番地の１,2017-04-21,株式会社
株式会社ナゴヤホームズ,愛知県小牧市大字岩崎１２４２番地１５,2017-04-21,株式会社
株式会社ニナイテック,北海道恵庭市柏陽町３丁目２２番地３,2017-04-21,株式会社
株式会社ネクスト,大阪府大阪市中央区北浜東２番１９号,2017-04-21,株式会社
株式会社ノウト,東京都府中市小柳町２丁目４３番地の１７,2017-04-21,株式会社
株式会社ノースキャンプ,東京都千代田区三崎町２丁目１９番４号,2017-04-21,株式会社
株式会社ノース・テック,北海道札幌市北区屯田九条７丁目４番１０号,2017-04-21,株式会社
株式会社ハイクオリティ,栃木県宇都宮市宿郷３丁目５番２３号,2017-04-21,株式会社
株式会社ハウスプロダクト,愛知県高浜市稗田町１丁目２番地１０,2017-04-21,株式会社
株式会社ハニービーワークス,広島県広島市西区高須台４丁目１番２０号,2017-04-21,株式会社
株式会社バンクオブチキン,東京都港区南麻布３丁目１９番２８－７０３号,2017-04-21,株式会社
株式会社バンブーリング,東京都杉並区下高井戸３丁目３３番１号,2017-04-21,株式会社
株式会社パシフィックサーフテラス,東京都世田谷区喜多見９丁目４番７号,2017-04-21,株式会社
株式会社ヒューマンアレンジ,兵庫県姫路市城東町野田１番地１２,2017-04-21,株式会社
株式会社ファンダメンタル,奈良県奈良市二条町１丁目２番３１号,2017-04-21,株式会社
株式会社ファンディーナ,大阪府大阪市北区天満橋１丁目１番２４－２０９号,2017-04-21,株式会社
株式会社フロンティア,東京都練馬区関町南１丁目４番３号メルシー・ド・メール２０１,2017-04-21,株式会社
株式会社フーディア,山口県下関市観音崎町７番５号第一林ビル２Ｆ－Ｂ,2017-04-21,株式会社
株式会社ブライトファーム大久保,茨城県古河市東山田２５８４番地,2017-04-21,株式会社
株式会社ブルーファーマシー,東京都世田谷区砧２丁目２２番２号,2017-04-21,株式会社
株式会社ブレイクスルー,和歌山県岩出市西野１４８番地１ミムラビル３－Ａ号室,2017-04-21,株式会社
株式会社ベアグッド,東京都目黒区青葉台３丁目１８番３－４０８号,2017-04-21,株式会社
株式会社ベコ,福岡県福岡市早良区田隈３丁目４６番１４号,2017-04-21,株式会社
株式会社ベストテクノス,千葉県市原市辰巳台東４丁目１８番地５,2017-04-21,株式会社
株式会社ペンギン,東京都立川市錦町１丁目２番８号,2017-04-21,株式会社
株式会社ホソヤ企画,北海道札幌市清田区北野五条４丁目１番３－２０２号,2017-04-21,株式会社
株式会社ホットチョコレーツ,神奈川県横浜市栄区公田町４５０番地１３,2017-04-21,株式会社
株式会社ボニチャー,東京都荒川区南千住３丁目１８番１３号１Ｆ,2017-04-21,株式会社
株式会社マグノリアアート,東京都新宿区西新宿７丁目２２番９号,2017-04-21,株式会社
株式会社マッチラボ,大阪府大阪市西区江戸堀１丁目１９番２３号,2017-04-21,株式会社
株式会社マルイアセットマネジメント,岡山県津山市戸島８９３番地１５,2017-04-21,株式会社
株式会社マーブリングファインアーツホールディングス,東京都世田谷区南烏山１丁目１２番２８号,2017-04-21,株式会社
株式会社ムライ,埼玉県川口市大字道合３０７番地の５,2017-04-21,株式会社
株式会社ユアテック関東サービス,埼玉県川口市柳崎１丁目２０番３８号,2017-04-21,株式会社
株式会社ユニコーンファーム,東京都港区浜松町２丁目２番１５浜松町ダイヤビル２Ｆ,2017-04-21,株式会社
株式会社ユニティ,東京都渋谷区道玄坂１丁目１２番１号,2017-04-21,株式会社
株式会社ラグラス・インベスターズ,沖縄県那覇市天久２丁目１３番８号,2017-04-21,株式会社
株式会社ラベール,東京都新宿区大久保１丁目１７番地１６－２０５号,2017-04-21,株式会社
株式会社ラ・ソレール,大阪府寝屋川市宇谷町５番２－５３４号,2017-04-21,株式会社
株式会社リアリノ,大阪府大阪市淀川区西宮原１丁目８番２４号新大阪第３ドイビル６Ｆ,2017-04-21,株式会社
株式会社リッチウェィブ,愛知県名古屋市中区栄３丁目２番３号,2017-04-21,株式会社
株式会社リバティー,神奈川県秦野市本町１丁目２番３号戸田ビル２０１号,2017-04-21,株式会社
株式会社リンク,茨城県つくば市天久保１丁目６番地２六本木ビル１階,2017-04-21,株式会社
株式会社リーセンシー,東京都江戸川区松江５丁目１番１６号第２マゴメビル,2017-04-21,株式会社
株式会社リーディットシステム,福岡県福岡市中央区今泉１丁目２０番２号,2017-04-21,株式会社
株式会社リ．ファーム,熊本県宇城市豊野町糸石３７６８番地１,2017-04-21,株式会社
株式会社レオンライン,東京都港区麻布十番２丁目２１番６号－２１０２号室,2017-04-21,株式会社
株式会社ロイドウィル,東京都渋谷区道玄坂１丁目１２番１号,2017-04-21,株式会社
株式会社ロングイ,北海道帯広市西十五条南１１丁目１番地５７,2017-04-21,株式会社
株式会社ワングローバル,東京都世田谷区砧７丁目２番２１－１１０号,2017-04-21,株式会社
株式会社ヴィジョニーク,東京都目黒区東山１丁目２１番１４号鴻巣橋ハイツ３０２,2017-04-21,株式会社
株式会社丁志,広島県安芸郡府中町みくまり１丁目１番９号,2017-04-21,株式会社
株式会社万勢,東京都大田区大森東１丁目２８番５号,2017-04-21,株式会社
株式会社三匠エステート,東京都葛飾区新小岩３丁目１３番１６号,2017-04-21,株式会社
株式会社三屋工業,栃木県大田原市奥沢７１７番地,2017-04-21,株式会社
株式会社三悦,東京都東大和市新堀１丁目１４３２番地の５１,2017-04-21,株式会社
株式会社三立リトラス,東京都大田区仲六郷２丁目４３番５号,2017-04-21,株式会社
株式会社上杉商事,大阪府大阪市西成区岸里３丁目２番２１号地下１階,2017-04-21,株式会社
株式会社下坂商店,兵庫県宝塚市泉町７番１３号,2017-04-21,株式会社
株式会社丸和装業,大分県大分市三川上２丁目５番１４号,2017-04-21,株式会社
株式会社京瀬,岡山県倉敷市玉島１２３２番地１,2017-04-21,株式会社
株式会社伊藤左官工業,神奈川県小田原市中村原１３１番地の１サニーパープル１０６,2017-04-21,株式会社
株式会社伊藤建装,静岡県浜松市東区大島町１７８番地の１,2017-04-21,株式会社
株式会社八代松本林業,熊本県八代市泉町樅木１４７番地,2017-04-21,株式会社
株式会社創和建装,埼玉県川越市大字木野目１６５３番地５,2017-04-21,株式会社
株式会社勝建設,宮崎県宮崎市南花ケ島町３１０－７,2017-04-21,株式会社
株式会社北海道トラスト,北海道帯広市西二十一条南５丁目２５番地１４,2017-04-21,株式会社
株式会社北神商会,兵庫県加古川市志方町細工所１０５４番地の２,2017-04-21,株式会社
株式会社匠興,埼玉県川口市芝４丁目１０番２号,2017-04-21,株式会社
株式会社古内,埼玉県さいたま市大宮区桜木町４丁目５１６番地（１０１）,2017-04-21,株式会社
株式会社和技建,埼玉県川口市芝５丁目１６番３２号,2017-04-21,株式会社
株式会社回復屋,福岡県福岡市博多区綱場町６番９号,2017-04-21,株式会社
株式会社坂元工業,鹿児島県鹿児島市牟礼岡１丁目２３番１８号,2017-04-21,株式会社
