法人名,住所,設立日,法人種別
合同会社ＨＡＬ,長野県佐久市岩村田３７７３番地５,2026-05-12,合同会社
合同会社ＨＡＮＡＢＵＳＡ,神奈川県横浜市港北区高田西３丁目２番１４号,2026-05-12,合同会社
合同会社ＨＥＳ,三重県津市東丸之内１３‐１６,2026-05-12,合同会社
合同会社ＨＯＭＥＲＵＮＮＥＲ,神奈川県小田原市栢山２７９２番地の７,2026-05-12,合同会社
合同会社ＩｎＫ　Ａｕｒａ,京都府京都市中京区西ノ京職司町６７番地３２、１Ｆ,2026-05-12,合同会社
合同会社Ｊ‐Ｌｉｎｋ,静岡県菊川市吉沢２５９番地の２,2026-05-12,合同会社
合同会社ＪａＭＴｅｃ,神奈川県川崎市高津区新作５丁目７－２５,2026-05-12,合同会社
合同会社Ｊａｓｐｅｒ,東京都港区芝浦４丁目２２番１－９１６号,2026-05-12,合同会社
合同会社Ｋ＆Ｓパートナーズ,東京都豊島区高松１丁目１５－１５,2026-05-12,合同会社
合同会社Ｋｎｏｔ,三重県志摩市阿児町鵜方１４４２番地,2026-05-12,合同会社
合同会社ＬＣＬ,東京都千代田区岩本町３丁目３－１４ステラ岩本町１階,2026-05-12,合同会社
合同会社Ｌａｂｏ３８,長野県茅野市金沢５５６８番地２,2026-05-12,合同会社
合同会社ＬｉＬｉｕｍ,東京都世田谷区太子堂４丁目１８番１５号マガザン三軒茶屋２、３Ｆ－３,2026-05-12,合同会社
合同会社Ｌｕｘｌｙ,東京都中野区中野５丁目３７－１０－３０２,2026-05-12,合同会社
合同会社ＭＥＲＣＳＩＮＴ,広島県呉市音戸町南隠渡２丁目２０－１９,2026-05-12,合同会社
合同会社Ｍｉｄｏｒｉ　ｔｏ　Ｍｏｎｏｇａｔａｒｉ,静岡県静岡市駿河区東新田３丁目９番９号,2026-05-12,合同会社
合同会社Ｍｉｒｅｖｉａ,大阪府大阪市西区北堀江１丁目１７番２０号,2026-05-12,合同会社
合同会社Ｍｉｙｕ,東京都港区麻布十番２丁目３番１０号７０５,2026-05-12,合同会社
合同会社Ｎ,大分県大分市大字松岡２２６番地の１,2026-05-12,合同会社
合同会社ＮＥＥＤＬＥ　ＢＯＯＫ,岐阜県岐阜市下奈良１丁目５番１６号,2026-05-12,合同会社
合同会社ＮＥＳＥＣＯＲＥ,東京都府中市清水が丘３丁目９－７,2026-05-12,合同会社
合同会社Ｎｅｗ　ｔｙｐｅ,埼玉県川口市大字安行原２１０番地の３,2026-05-12,合同会社
合同会社ＯＫエンタープライズ,京都府京都市下京区仏光寺通大宮西入坊門町８０５－２,2026-05-12,合同会社
合同会社ＯＴＯ,静岡県裾野市佐野８４３番地の６エステートピア大庭２０５,2026-05-12,合同会社
合同会社Ｐ‐ｍｏｔｉｏｎ,北海道札幌市中央区南六条西６丁目７番地２ライオンビル太陽館５階,2026-05-12,合同会社
合同会社ＰＩＮＥ,三重県伊勢市吹上２丁目１３番３３号,2026-05-12,合同会社
合同会社ＰＯＬＡＲＩＳ,和歌山県和歌山市園部１５２番地１６,2026-05-12,合同会社
合同会社Ｐｉｒｏｔｔａ,埼玉県比企郡小川町大字勝呂４４番地１２６,2026-05-12,合同会社
合同会社ＲＡＹＶＩＡ,石川県金沢市北間町イ４７番地３,2026-05-12,合同会社
合同会社Ｒｅｌｌｉａ,神奈川県横浜市神奈川区金港町５－１４クアドリフォリオ８階,2026-05-12,合同会社
合同会社Ｒｅｖａｌｅｎ,東京都渋谷区笹塚３丁目７－１,2026-05-12,合同会社
合同会社ＳＡＲ,神奈川県川崎市宮前区鷺沼４丁目１５－１０、３１０,2026-05-12,合同会社
合同会社ＳＮＯＷ,大阪府和泉市三林町１２７番地の３,2026-05-12,合同会社
合同会社ＳＯＲＡ,東京都中央区日本橋室町１丁目１１番１２号,2026-05-12,合同会社
合同会社ＳＵＢＡＮ,兵庫県淡路市生穂１６２７番地３,2026-05-12,合同会社
合同会社Ｓｅｌｅｃｔ,新潟県柏崎市大字上原１０１番地,2026-05-12,合同会社
合同会社Ｓｎｏｗｂａｌｌ　Ｂａｓｅ,東京都葛飾区東水元５丁目３７－１２,2026-05-12,合同会社
合同会社Ｓｐｒｏｃｋｅｔ　Ｈｏｌｅｓ　Ｊａｐａｎ,東京都渋谷区西原１丁目２８－４興和ビル１Ｆ,2026-05-12,合同会社
合同会社Ｔ‐ＢＡＳプラス,東京都町田市玉川学園２丁目１１番２２号高橋ビル３０１,2026-05-12,合同会社
合同会社ＴＦＪ　Ｈｅｒｉｔａｇｅ,東京都小平市上水南町１丁目２４番１５号,2026-05-12,合同会社
合同会社ＴＫ,千葉県市川市塩焼３丁目６番１７号,2026-05-12,合同会社
合同会社Ｔｒａｊｅｃｔｏｒｙ　Ｐａｒｔｎｅｒｓ,東京都品川区上大崎３丁目１４番３４号－４０２,2026-05-12,合同会社
合同会社Ｔｒｉｎｉｔｙ　ｗｏｒｋｓ,京都府長岡京市城の里１６番地２０,2026-05-12,合同会社
合同会社Ｕ鉄,広島県広島市東区戸坂惣田１丁目４－１９－３０６,2026-05-12,合同会社
合同会社ＵＮＩＴ　Ａ,東京都中野区中野４丁目１０番２号中野セントラルパークサウス２階,2026-05-12,合同会社
合同会社Ｖｉｋｙｏｈ,滋賀県大津市本堅田６丁目２２番６号,2026-05-12,合同会社
合同会社Ｖｏｒｔｅｘ　Ｂｒｉｄｇｅ,京都府京都市右京区山ノ内苗町５番地１,2026-05-12,合同会社
合同会社ＷｅｌｌＢｌｏｏｍ,佐賀県佐賀市本庄町大字本庄５７７－１４,2026-05-12,合同会社
合同会社ｃｈｅｚ　Ｉ,熊本県熊本市東区御領２丁目７２２－１,2026-05-12,合同会社
合同会社ｎｏｄｏｋａ,山口県周南市銀座１丁目３１番ＴＯＫＵＹＡＭＡ　ＤＥＣＫ　Ｄ３,2026-05-12,合同会社
合同会社ｓｔｕｄｉｏ　ｎｕ,千葉県浦安市明海３丁目２番７―３０３号海園の街,2026-05-12,合同会社
吉羽工業株式会社,北海道旭川市永山八条５丁目１番１５号,2026-05-12,株式会社
土地家屋調査士法人原田設計,東京都清瀬市中清戸１丁目４４２番地,2026-05-12,その他の設立登記法人
土地家屋調査士法人長谷川パートナーズ,東京都練馬区錦２丁目１１－１０シティスター練馬３０２,2026-05-12,その他の設立登記法人
土地家屋調査士法人ＲＩＳＥ登記測量,東京都世田谷区用賀４丁目９番１２号Ａ－Ｓｔａｇｅ用賀６Ｆ,2026-05-12,その他の設立登記法人
大基興業合同会社,兵庫県川辺郡猪名川町つつじが丘１丁目４０－４,2026-05-12,合同会社
大日綜合株式会社,新潟県上越市板倉区猿供養寺３６９番地,2026-05-12,株式会社
大熊経営パートナーズ合同会社,埼玉県富士見市鶴瀬西３丁目７－８,2026-05-12,合同会社
太陽リアルエステート株式会社,岐阜県多治見市小田町６丁目１番地,2026-05-12,株式会社
奉行株式会社,兵庫県尼崎市杭瀬南新町２丁目６番４３号,2026-05-12,株式会社
宮城野会計合同会社,宮城県仙台市宮城野区宮城野１丁目２３番１９号,2026-05-12,合同会社
富士グレイスケア合同会社,三重県四日市市三滝台４丁目１４番地５,2026-05-12,合同会社
小川重機合同会社,栃木県さくら市喜連川２４１７―２,2026-05-12,合同会社
川﨑畜産株式会社,宮崎県東諸県郡国富町大字深年４６６３番地,2026-05-12,株式会社
弁護士法人アソシエーション・つやま,岡山県津山市南新座３４番地アリコベール・しんざ２０１,2026-05-12,その他の設立登記法人
徳治株式会社,東京都板橋区熊野町３７－６スタディプラザ５０１号,2026-05-12,株式会社
探究と奏株式会社,東京都杉並区浜田山１丁目１１番１‐３１１号東急ドエル・プレステージ浜田山ガーデンズ,2026-05-12,株式会社
新宮町下府新開土地区画整理組合,福岡県糟屋郡新宮町大字湊１８２番地,2026-05-12,その他
日本住宅建設株式会社,福岡県北九州市小倉北区片野新町北３８８番地の３ブルーハイツ片野,2026-05-12,株式会社
日本製麻分割準備株式会社,富山県砺波市下中３番地３,2026-05-12,株式会社
明電工株式会社,北海道札幌市白石区菊水元町五条２丁目２番４号,2026-05-12,株式会社
株式会社あすなろ不動産,愛知県名古屋市北区杉村１丁目１３番１９号,2026-05-12,株式会社
株式会社あぽろ,埼玉県入間市河原町１－２５山口ビル１Ｆ,2026-05-12,株式会社
株式会社いるいるプランニング,東京都大田区大森西３丁目２８－５コスモリード大森西２Ｆ,2026-05-12,株式会社
株式会社おおはた不動産,兵庫県加東市社８１番地５メモリアルハイツ１０１号,2026-05-12,株式会社
株式会社かじや,愛媛県松山市二番町２丁目４番地１０ＭＵＫＡＩＢＬＤＧ－６・６階,2026-05-12,株式会社
株式会社くすのき,東京都調布市西つつじケ丘３丁目２６番７号アーバンフラッツＭＡ２０３,2026-05-12,株式会社
株式会社そば結び本舗,埼玉県北葛飾郡杉戸町大字本島６１９番地,2026-05-12,株式会社
株式会社たままる,愛知県名古屋市守山区四軒家１丁目１５６７番地ラポール長谷川１０１,2026-05-12,株式会社
株式会社つばさ屋,大阪府貝塚市地藏堂１１１番地１,2026-05-12,株式会社
株式会社つむぎ,福岡県糟屋郡宇美町ひばりが丘３丁目２８番１１号,2026-05-12,株式会社
株式会社なかお工業,愛知県豊橋市飯村南４丁目２番地５,2026-05-12,株式会社
株式会社にわサイクリングツアーズ,埼玉県北葛飾郡杉戸町大字杉戸５８０番地１,2026-05-12,株式会社
株式会社ひびき,愛知県愛西市東保町東河原６００番地,2026-05-12,株式会社
株式会社ひろ,神奈川県川崎市多摩区中野島５丁目２番３７号,2026-05-12,株式会社
株式会社ふぉれすと,三重県伊賀市ゆめが丘６丁目２５番地１,2026-05-12,株式会社
株式会社もりのね,茨城県北茨城市関本町福田１４１,2026-05-12,株式会社
株式会社わかやまメンタルオフィス,和歌山県和歌山市西高松１丁目２番１４号,2026-05-12,株式会社
株式会社アイエスピー技研,神奈川県横浜市都筑区中川３丁目２番１２号,2026-05-12,株式会社
株式会社アクシスコア,東京都千代田区神田須田町１丁目７番８号ＶＯＲＴ秋葉原Ⅳ２Ｆ,2026-05-12,株式会社
株式会社アグリゲート,和歌山県紀の川市神通字稲尾２０７番地１,2026-05-12,株式会社
株式会社アグリネクサス,埼玉県狭山市中央３丁目６番Ｇ－４０７号,2026-05-12,株式会社
株式会社アスクドア,東京都台東区蔵前１丁目４番１号ＭＯＶＫＵＲＡＭＡＥ,2026-05-12,株式会社
株式会社アップ,北海道札幌市豊平区平岸三条８丁目６番１号,2026-05-12,株式会社
株式会社アディクト,滋賀県甲賀市甲南町希望ケ丘本町８丁目８５７番３４３,2026-05-12,株式会社
株式会社アトラックス,神奈川県横浜市港北区下田町３丁目１５番６－１号,2026-05-12,株式会社
株式会社アーバンストーリー,愛知県名古屋市中村区名駅４丁目２４番５号第２森ビル４０１,2026-05-12,株式会社
株式会社イレブンジズ,群馬県前橋市紅雲町２丁目２番１９号,2026-05-12,株式会社
株式会社ウェルステップ,東京都町田市原町田４丁目２－１０丸正ビル４階,2026-05-12,株式会社
株式会社ウェルミィ,大阪府吹田市片山町３丁目７番２３号,2026-05-12,株式会社
株式会社ウミック,福井県大飯郡高浜町音海第５１号３番地１,2026-05-12,株式会社
株式会社エキサイト,大分県大分市高城新町５番１３号－４０３,2026-05-12,株式会社
株式会社エクラジャポン,長野県北佐久郡軽井沢町大字追分１２５２番地１９,2026-05-12,株式会社
株式会社エコシェア,静岡県静岡市葵区栄町２番地５アークビルディング５０２,2026-05-12,株式会社
株式会社エスコネクト,山口県岩国市麻里布町４丁目１７番４号,2026-05-12,株式会社
株式会社エヌアド,熊本県熊本市中央区国府本町１番１号国府本町テナント事務所２階３号室,2026-05-12,株式会社
株式会社エレワークス,山梨県南都留郡富士河口湖町河口５９６番地２,2026-05-12,株式会社
株式会社エンフェルーム,東京都墨田区横網２丁目８番１３－５０２号レフィールオーブ両国,2026-05-12,株式会社
株式会社オカノホーム,千葉県柏市中原１丁目１５－１２－２号,2026-05-12,株式会社
株式会社オルヴィア,東京都杉並区桃井１丁目２１番７号,2026-05-12,株式会社
株式会社オーグメント,神奈川県川崎市中原区上小田中７丁目１４番２１－２号,2026-05-12,株式会社
株式会社オービットワークス,大阪府大阪市中央区本町２丁目３番６号本町ビジネスビル,2026-05-12,株式会社
株式会社オーロラアセット,東京都足立区千住大川町３６番４号,2026-05-12,株式会社
株式会社カチノワ,東京都江東区塩浜１丁目１番１３－８２５号,2026-05-12,株式会社
株式会社カドカド,大阪府摂津市千里丘１丁目１４番１５－３０６号,2026-05-12,株式会社
株式会社カミユ,東京都江戸川区西小岩４丁目１番２２号スピカ小岩ビル６階,2026-05-12,株式会社
株式会社カルファイン山宝,岡山県高梁市松原通２１１１番地３,2026-05-12,株式会社
株式会社カロネア,埼玉県三郷市戸ケ崎４丁目１７０番地プティヴィラージュ３－２０２,2026-05-12,株式会社
株式会社カーライズ,秋田県大館市清水５丁目８番４５号,2026-05-12,株式会社
株式会社カーリーマネジメント,埼玉県所沢市小手指町１丁目４４番地の１リリーベル小手指５０５,2026-05-12,株式会社
株式会社キャラクターライセンスビジネス研究所,神奈川県横浜市港北区高田東３丁目２２番１９号,2026-05-12,株式会社
株式会社クニノス,東京都品川区東品川１丁目１３番４号,2026-05-12,株式会社
株式会社クリアエステート,埼玉県川口市元郷６丁目１１番１３号,2026-05-12,株式会社
株式会社クロベエ,兵庫県川西市けやき坂３丁目４番地の３,2026-05-12,株式会社
株式会社グリス・コンサルティング,大阪府大阪市西淀川区柏里１丁目１１番１６号ヴィラ柏里４０５,2026-05-12,株式会社
株式会社グリーンフォース,熊本県合志市野々島４３９３番地３２４,2026-05-12,株式会社
株式会社グローバルケア,大阪府大阪市生野区新今里１丁目９番２号,2026-05-12,株式会社
株式会社グローバルテクノロジー,東京都渋谷区恵比寿１丁目８番１８号Ｋ－１ビル３Ｆ,2026-05-12,株式会社
株式会社グローバルホスピタリティラボ,鹿児島県鹿児島市易居町１番２号鹿児島市役所みなと大通り別館６Ｆ－１８号室,2026-05-12,株式会社
株式会社グローリーボックス,大阪府大阪市中央区内本町２丁目４番１６号－１１０７号室,2026-05-12,株式会社
株式会社コトづくり,福島県南相馬市小高区本町１丁目８７番地,2026-05-12,株式会社
株式会社コミットエックス,東京都町田市原町田６丁目９－８アエタ町田４階,2026-05-12,株式会社
株式会社コレクトグローブ,兵庫県神戸市北区山田町東下字野田北５２,2026-05-12,株式会社
株式会社コンフィード,大阪府大阪市福島区福島２丁目２番２４－７１１号,2026-05-12,株式会社
株式会社ゴールデンバット,神奈川県川崎市川崎区宮本町８番地１,2026-05-12,株式会社
株式会社サクライファーム,青森県青森市栄町２丁目１０番１６号,2026-05-12,株式会社
株式会社サブリー,愛知県名古屋市中村区竹橋町３７番３号,2026-05-12,株式会社
株式会社サンガレージ,愛知県豊明市沓掛町北畑４１番地１,2026-05-12,株式会社
株式会社サンクルー,静岡県伊東市吉田３７３番地の７,2026-05-12,株式会社
株式会社ザイマックスワークス,東京都港区虎ノ門２丁目１０番１号,2026-05-12,株式会社
株式会社シャイニーオーソ,東京都江戸川区東小松川４丁目２９番１８号,2026-05-12,株式会社
株式会社シーズ,東京都小笠原村父島字奥村,2026-05-12,株式会社
株式会社ジェイシーシーホールディングス,沖縄県糸満市西崎町４丁目１６番地１６,2026-05-12,株式会社
株式会社ジャングル・ブック,埼玉県所沢市大字山口１７８５番地の２,2026-05-12,株式会社
株式会社スギウラホールディングス,愛知県西尾市法光寺町屋敷３５番地,2026-05-12,株式会社
株式会社スケッチ,岐阜県大垣市南頬町２丁目８４番地１,2026-05-12,株式会社
株式会社スタジオヘロン,東京都世田谷区用賀４丁目１８番７号,2026-05-12,株式会社
株式会社スタンドアップホールディングス,大阪府藤井寺市藤ケ丘４丁目２２番１４号,2026-05-12,株式会社
株式会社ステラポラリス,東京都港区南青山２丁目２番１５号ＷｉｎＡｏｙａｍａビルＵＣＦ６階,2026-05-12,株式会社
株式会社ストラテクト,東京都千代田区神田和泉町１番地６－１６ヤマトビル４０５,2026-05-12,株式会社
株式会社セブン,東京都港区麻布台３丁目４番１２－６０２号,2026-05-12,株式会社
株式会社ゼンユウクリエイティブ,神奈川県横浜市都筑区東方町４１２番地１,2026-05-12,株式会社
株式会社ソコエ,大阪府大阪市淀川区新高３丁目７番１７－６０３号,2026-05-12,株式会社
株式会社ソルの輪,大阪府寝屋川市東神田町２１番６－１０１号プラシードセレノカーサⅢ,2026-05-12,株式会社
株式会社タカスギ,東京都豊島区要町３丁目１８番２号,2026-05-12,株式会社
株式会社ダブルフォー,東京都町田市原町田６丁目９番８号４Ｆ,2026-05-12,株式会社
株式会社ティーケイ,京都府京都市右京区太秦和泉式部町１２番地,2026-05-12,株式会社
株式会社テラ・パートナーズ,北海道旭川市神居三条１８丁目１番１８号,2026-05-12,株式会社
株式会社トイマン,東京都新宿区内藤町１番地８,2026-05-12,株式会社
株式会社トモエ保険事務所,愛知県名古屋市中区松原２丁目２２番１５号トーカンマンション第２松原２０３号,2026-05-12,株式会社
株式会社トモシア,大阪府堺市北区長曽根町３０８２番地５エンジェルズ・アイ５０１号,2026-05-12,株式会社
株式会社トラストリアルティ,兵庫県姫路市延末３１６番地４,2026-05-12,株式会社
株式会社トータルネットワーク,東京都新宿区西新宿３丁目３番１３号西新宿水間ビル６階,2026-05-12,株式会社
株式会社ナカジマ農産,福井県福井市東郷中島町第３号７番地１,2026-05-12,株式会社
株式会社ナカニシ塗装工業,北海道河東郡音更町南鈴蘭南３丁目７番地２,2026-05-12,株式会社
株式会社ナカミチ,大阪府大阪市鶴見区諸口２丁目１３番２２号,2026-05-12,株式会社
株式会社ナルココロエージェンシー,神奈川県横浜市緑区十日市場町１４８１－３－Ｇ６１２,2026-05-12,株式会社
株式会社ネクエレ,愛知県名古屋市緑区熊の前１丁目１１０４番地ラビアンローズ徳重Ｃ棟２０１号,2026-05-12,株式会社
株式会社ネクスト,兵庫県川西市大和西１丁目５９番６号,2026-05-12,株式会社
株式会社ネクストリンク,兵庫県姫路市別所町佐土２丁目６６番地プログレスビレッジ１Ｆ,2026-05-12,株式会社
株式会社ノヴァン,愛知県春日井市高森台３丁目１６番地８,2026-05-12,株式会社
株式会社ノースルック,東京都江戸川区南葛西６丁目１９番２－８０４号,2026-05-12,株式会社
株式会社ハタテック,三重県四日市市川島町７４６１番地１,2026-05-12,株式会社
株式会社ハヤト種苗,福島県大沼郡三島町大字早戸字湯ノ平９２４番地,2026-05-12,株式会社
株式会社パースビット,大阪府大阪市北区梅田１丁目２番２号大阪駅前第２ビル１２－１２,2026-05-12,株式会社
株式会社ヒズキ工業,北海道苫小牧市啓北町１丁目１番２０号,2026-05-12,株式会社
株式会社フォワード,大阪府大阪市淀川区西中島５丁目１番８号日研ビル１００３号室,2026-05-12,株式会社
株式会社フォーユー,神奈川県川崎市多摩区長尾６丁目２番１－２０８号,2026-05-12,株式会社
株式会社フジモト電気工事,京都府亀岡市下矢田町４丁目２３番１号,2026-05-12,株式会社
株式会社フジ商会,大阪府堺市美原区大保８３番地の９,2026-05-12,株式会社
株式会社フライハイト,兵庫県姫路市二階町１８番地,2026-05-12,株式会社
株式会社ブルースタープラス,愛知県名古屋市千種区春里町４丁目１９番地の５,2026-05-12,株式会社
株式会社プラス,大分県大分市畑中４丁目３番１号,2026-05-12,株式会社
株式会社プラス,大阪府吹田市青葉丘北１０番５号（Ｂ－１０５）,2026-05-12,株式会社
株式会社プラスパートナー,東京都町田市金森東１丁目１番４号,2026-05-12,株式会社
株式会社ペイントＭ,大阪府泉佐野市南中安松２９３番地の３,2026-05-12,株式会社
株式会社ペルビック,埼玉県羽生市東１丁目１番５６号,2026-05-12,株式会社
株式会社ホリョンＪＡＰＡＮ,千葉県船橋市夏見台１丁目２０番１９－２０８号,2026-05-12,株式会社
株式会社ホープライト,大阪府茨木市戸伏町１１番８号山崎第１０マンション３０２号室,2026-05-12,株式会社
株式会社マイソリューション,東京都港区六本木４丁目８番７号六本木三河台ビル２階,2026-05-12,株式会社
株式会社マキテン,東京都港区北青山１丁目３番３号三橋ビル３階,2026-05-12,株式会社
株式会社ミズキ精工,埼玉県さいたま市西区大字佐知川８０８番地８,2026-05-12,株式会社
株式会社ミタニテック,三重県鈴鹿市岸岡町３５２２番地の２,2026-05-12,株式会社
株式会社ミテラス,愛知県豊橋市牛川町字郷道１１番地２,2026-05-12,株式会社
株式会社ミライノキセキ,愛知県岡崎市岡町字西神馬崎北側１２番地１,2026-05-12,株式会社
株式会社モンステーション,大阪府大阪市中央区南本町２丁目１－１,2026-05-12,株式会社
株式会社ユキテック,愛知県名古屋市中川区東中島町８丁目６番地,2026-05-12,株式会社
株式会社ユニット,千葉県船橋市本町１丁目１２番２４号第２マンション海老原１階１０１号室,2026-05-12,株式会社
株式会社ヨウザン,群馬県前橋市平和町１丁目４番１０号,2026-05-12,株式会社
株式会社ライズ,沖縄県沖縄市宮里１丁目２番１号Ａ－２０２,2026-05-12,株式会社
株式会社ラフトアンドクルー,北海道帯広市西十八条南５丁目２０番地４,2026-05-12,株式会社
株式会社ラメプレイス,大阪府大阪市中央区南船場３丁目２番２２号おおきに南船場ビル２０５,2026-05-12,株式会社
株式会社ランドスカイ,神奈川県大和市下鶴間５９８－１,2026-05-12,株式会社
株式会社リアルフェイス,三重県四日市市西坂部町４１３７番地８２,2026-05-12,株式会社
株式会社リエステイト,埼玉県さいたま市大宮区吉敷町１丁目１３５番地Ａｒａｉビル８階,2026-05-12,株式会社
株式会社リサイクル日邦,和歌山県御坊市塩屋町北塩屋１４５１番地３,2026-05-12,株式会社
株式会社リノベアット,群馬県高崎市飯塚町４９０番地,2026-05-12,株式会社
株式会社リバウンドアセット,滋賀県大津市皇子が丘２丁目４番１０－２０１号,2026-05-12,株式会社
株式会社リビングプラザサンコスモ,京都府八幡市下奈良蜻蛉尻筋１１番地の８,2026-05-12,株式会社
株式会社リボンド,大阪府大阪市天王寺区夕陽丘町４－２ＭｅｔｒｏＰｏｒｔｅ四天王寺前夕陽ケ丘ⅢＢＩＺｃｏｍｆｏｒｔ四天王寺３号室,2026-05-12,株式会社
株式会社リーフスプリング,埼玉県狭山市新狭山３丁目４番１８号,2026-05-12,株式会社
株式会社ルミナス,東京都八王子市長房町９６－７,2026-05-12,株式会社
株式会社レヴィアス,東京都新宿区西新宿３丁目３番１３号西新宿水間ビル６階,2026-05-12,株式会社
