法人名,住所,設立日,法人種別
株式会社譱,兵庫県神戸市灘区天城通８丁目５番１５号１Ｆ,2017-01-23,株式会社
株式会社近藤企画,北海道釧路市緑ケ岡２丁目２５番１号,2017-01-23,株式会社
株式会社金子土建興業,東京都豊島区池袋１丁目１番２－５０３号サンハイツトキワ,2017-01-23,株式会社
株式会社長江,東京都千代田区東神田１丁目３番５－２０１号,2017-01-23,株式会社
株式会社関東はつり工業,栃木県那須塩原市鍋掛１５８９番地５,2017-01-23,株式会社
株式会社陸建,神奈川県海老名市国分南４丁目２１番１９号,2017-01-23,株式会社
株式会社高松設備,香川県高松市紙町４６９番地６,2017-01-23,株式会社
株式会社魚住艤装,神奈川県横浜市神奈川区羽沢町１２０２番地８２,2017-01-23,株式会社
株式会社鳳翔,神奈川県横浜市中区山下町１９１番地９白鳳方,2017-01-23,株式会社
株式会社黒滝農園,青森県つがる市稲垣町繁田母衣掛３３番地１０,2017-01-23,株式会社
株式会社１１６,兵庫県姫路市勝原区宮田２３番地１,2017-01-23,株式会社
株式会社３１０,東京都港区海岸３丁目１８番２号,2017-01-23,株式会社
株式会社Ａ・Ｒ・Ｐ・Ｓ,神奈川県横浜市青葉区鉄町５０９番地１,2017-01-23,株式会社
株式会社ＡＤ．Ｉ,兵庫県尼崎市西難波町３丁目３１番９号,2017-01-23,株式会社
株式会社ＡＵＴＥＸ,大阪府大阪市淀川区野中北１丁目１２番２５－２０３号,2017-01-23,株式会社
株式会社ＢＡＲ　ＬＹＴＴＯＮ　Ｎ,岡山県岡山市北区幸町３番９号,2017-01-23,株式会社
株式会社Ｃ．Ｕ．Ｉ,埼玉県さいたま市中央区桜丘１丁目６番２号,2017-01-23,株式会社
株式会社ＣＡＮＴＩＫ－ＭＡＮＩＳ,神奈川県横浜市中区山下町９８番地,2017-01-23,株式会社
株式会社Ｄｅｎｔａｌｕｘｅ,東京都港区六本木１丁目３番３９－４０１号,2017-01-23,株式会社
株式会社Ｅｉｇｈｔｙ　ＳＰＣ,東京都港区愛宕２丁目５番１号愛宕グリーンヒルズＭＯＲＩタワー３４階株式会社ＪＡＣＫＩｎｖｅｓｔｏｒｓ内,2017-01-23,株式会社
株式会社Ｆｕｋｕｓｕｋｅｙａ・ＳＡＩＫＩ,広島県廿日市市津田５１番地８,2017-01-23,株式会社
株式会社Ｇ３,東京都江戸川区篠崎町６丁目２３番２３号,2017-01-23,株式会社
株式会社ＧＯほけん事務所,大分県中津市三光西秣１０９３番地,2017-01-23,株式会社
株式会社Ｇａｌｅｘ　Ｊａｐａｎ,兵庫県神戸市中央区雲井通６丁目１番１５号,2017-01-23,株式会社
株式会社Ｇｒａｎｔ,愛知県津島市百島町字中割２番地１（３Ｆ）,2017-01-23,株式会社
株式会社ＨＯＵＳＥ　ＬＡＢＯ,東京都八王子市長沼町６５５番地１,2017-01-23,株式会社
株式会社Ｈａｒｕ不動産販売,埼玉県さいたま市北区奈良町７９番地３７,2017-01-23,株式会社
株式会社ＩＳＳＹ,大阪府大阪市北区樋之口町１番２０－２７１３号,2017-01-23,株式会社
株式会社ＪＴＳ,福岡県福岡市博多区博多駅前４丁目１３－２７,2017-01-23,株式会社
株式会社Ｋ’ｓエステート,東京都中央区日本橋人形町２丁目２１番１号,2017-01-23,株式会社
株式会社Ｋ′ｓホールディングス,愛知県春日井市松河戸町３丁目８番地７,2017-01-23,株式会社
株式会社ＬＡＸＭＩ,埼玉県川口市新井町２５番２７号－２０５号室,2017-01-23,株式会社
株式会社ＬｉＨ,東京都港区三田３丁目２番８号,2017-01-23,株式会社
株式会社ＭＢＳ　ＣＯＲＰＯＲＡＴＩＯＮ,埼玉県戸田市川岸３丁目２番５号ダイワパレスⅡ－２０２号室,2017-01-23,株式会社
株式会社ＭＯＴＴＡ,東京都東村山市栄町２丁目２番地１４,2017-01-23,株式会社
株式会社ＭｏｖｅｓＴｏｋｙｏ,東京都港区三田３丁目４番１８号,2017-01-23,株式会社
株式会社ＮＥＷ　ＳＰＲＩＮＧＳ,青森県南津軽郡藤崎町大字中島字岩崎４番５,2017-01-23,株式会社
株式会社ＮＫ企画,香川県善通寺市木徳町７５６番地６,2017-01-23,株式会社
株式会社ＮｅｗＦｉｅｌｄ,千葉県浦安市海楽１丁目８番７号グリーンエステートＢ棟１０１号室,2017-01-23,株式会社
株式会社ＮｅｘｔＨｏｍｅ,沖縄県浦添市屋富祖１丁目３番５号シンアイ産業ビル２０１号室,2017-01-23,株式会社
株式会社Ｑ’ｓ　Ｉ,東京都新宿区新宿１丁目３４番１３貝塚ビル２階,2017-01-23,株式会社
株式会社ＱＬＡＢＯ,神奈川県横浜市西区北幸１丁目１１番１号水信ビル７階,2017-01-23,株式会社
株式会社ＲＡＮＡ＆ＢＲＯＴＨＥＲＳ,埼玉県上尾市大字原市１１９０番地１パークタウンハイム第３－５号室,2017-01-23,株式会社
株式会社ＳｅｉＫｅｎ工業,愛知県常滑市大鳥町２丁目８６番地,2017-01-23,株式会社
株式会社Ｓｈｉｎｅ　Ｖｉｃｔｏｒｙ,神奈川県逗子市小坪６丁目７番２１－３号,2017-01-23,株式会社
株式会社Ｓｉｍｐｌｅ＆ｃｏｎｖｉｎｃｅｄ　Ｓｅｒｖｉｃｅ,東京都千代田区九段北４丁目３番２０号九段フラワーホーム６０７号,2017-01-23,株式会社
株式会社ＵＰＯＩＮＴ,千葉県船橋市海神町南１丁目１５０３番地１,2017-01-23,株式会社
株式会社ＵＲＯＢＯＲＯＳ,東京都練馬区関町南２丁目７番２２号,2017-01-23,株式会社
株式会社ＵＳＤＭ,石川県白山市みずほ４丁目４番地６,2017-01-23,株式会社
株式会社ＶＩＲＴＵＥＳＴ,東京都港区西新橋３丁目１７番７,2017-01-23,株式会社
株式会社ＷＩＴＨホールディングス,埼玉県川口市飯塚１丁目２番１６号,2017-01-23,株式会社
株式会社ＹＥＳアルファスマイル,埼玉県戸田市喜沢２丁目４番地の２７,2017-01-23,株式会社
株式会社ＹｏｕｒＴｏｐｉａ,京都府京都市伏見区毛利町１２６番地グレートキャッスル伏見３０７,2017-01-23,株式会社
株式会社ｈｏｌｌｙ,福岡県福岡市中央区渡辺通１丁目１番３号,2017-01-23,株式会社
株式会社ｍａｃｏ　ｉｎｃ．,大阪府大阪市北区豊崎３丁目１５番５号ＴＫビル３Ｆ,2017-01-23,株式会社
株式会社ｍｅ,大阪府高槻市塚原２丁目２０番１５号,2017-01-23,株式会社
株式会社ｎｅｗ　ｐｈａｓｅ,栃木県宇都宮市中今泉４丁目７番１２号,2017-01-23,株式会社
株式会社ｏｚＥｎＲＩ,東京都港区南麻布１丁目１１番５号パティオ南麻布４０１,2017-01-23,株式会社
株式会社ｓｏｍｍｅｌｉｅｒＴＶ,東京都渋谷区恵比寿南１丁目１番１号,2017-01-23,株式会社
株式会社ｕｍｊｉ,東京都世田谷区北沢１丁目４７番１９－２０５号,2017-01-23,株式会社
株式会社ｗｏｎｄｅｒｗａｌｌ,東京都渋谷区代々木４丁目２７番２８号,2017-01-23,株式会社
橋本デザイン株式会社,兵庫県神戸市北区日の峰３丁目１７番地の９,2017-01-23,株式会社
橋隆国際株式会社,愛知県名古屋市中区栄３丁目２番３号名古屋日興証券ビル４階,2017-01-23,株式会社
波の上株式会社,愛知県知多郡阿久比町大字草木字朝日２５番地,2017-01-23,株式会社
清健工業株式会社,神奈川県川崎市幸区塚越４丁目３４５－１－４１７,2017-01-23,株式会社
湘南社会福祉事業協同組合,神奈川県茅ヶ崎市赤羽根１５５番地,2017-01-23,その他の設立登記法人
特定非営利活動法人くらしサポートセンターふきのとう,京都府京都市左京区田中飛鳥井町５０番地,2017-01-23,その他の設立登記法人
特定非営利活動法人アルク,北海道札幌市北区北二十三条西７丁目１番３８号プラザ２３おおうら１０３号,2017-01-23,その他の設立登記法人
特定非営利活動法人イエローハーツ,埼玉県深谷市東方２０１３番地,2017-01-23,その他の設立登記法人
特定非営利活動法人ウエストスリー,埼玉県桶川市大字下日出谷８０５番地の２０,2017-01-23,その他の設立登記法人
特定非営利活動法人ズシップ連合会,神奈川県逗子市沼間５丁目１４番２３号,2017-01-23,その他の設立登記法人
特定非営利活動法人文京文化交流クラブ,東京都文京区西片２丁目１８番２３－２０５号,2017-01-23,その他の設立登記法人
特定非営利活動法人日本おいも振興協会,東京都立川市柴崎町３丁目５番２４号,2017-01-23,その他の設立登記法人
特定非営利活動法人日本トマト振興協会,東京都立川市柴崎町３丁目５番２４号,2017-01-23,その他の設立登記法人
特定非営利活動法人東京里山開拓団,東京都世田谷区代沢５丁目２３番６号,2017-01-23,その他の設立登記法人
特定非営利活動法人門真フィルムコミッション,大阪府門真市大字薭島６４７番地の１７,2017-01-23,その他の設立登記法人
特定非営利活動法人雲援隊,長野県塩尻市大門二番町７番３号,2017-01-23,その他の設立登記法人
特定非営利活動法人Ｎ－ＩＣＨＩＧＯ,東京都港区三田５丁目５番６－６０６号,2017-01-23,その他の設立登記法人
特定非営利活動法人Ｐｅａｃｅｆｕｌ　Ｂｅａｒ　ＫＵＭＡＭＯＴＯ,熊本県宇城市松橋町古保山２７１５番地１９,2017-01-23,その他の設立登記法人
田口工業株式会社,大阪府大阪市西成区南津守４丁目４番３２号,2017-01-23,株式会社
盛運合同会社,東京都荒川区東尾久２丁目２番９号三祥ビル２２８,2017-01-23,合同会社
石田工業株式会社,山梨県笛吹市境川町石橋２１８９番地５,2017-01-23,株式会社
社会福祉法人湘南日向会,神奈川県藤沢市石川６丁目１８番４６,2017-01-23,その他の設立登記法人
翔栄建設株式会社,兵庫県神戸市東灘区住吉宮町１丁目１５番９号,2017-01-23,株式会社
茨城ソーラー開発合同会社,東京都新宿区四谷４丁目８番大熊ビル２階,2017-01-23,合同会社
農事組合法人草江ファーム,石川県羽咋郡志賀町草江トの１２,2017-01-23,その他の設立登記法人
鄭大大株式会社,埼玉県さいたま市浦和区常盤３丁目１３番１０号,2017-01-23,株式会社
金屋子神株式会社,東京都世田谷区羽根木１丁目４－１８,2017-01-23,株式会社
麻那古土工保護森林組合,佐賀県佐賀市富士町大字中原３３８番地イ１,2017-01-23,その他の設立登記法人
Ａ．Ｊ　ＩＮＴＥＲＮＡＴＩＯＮＡＬ株式会社,東京都西東京市向台町１丁目１６番２４号新井ビル２０２号,2017-01-23,株式会社
ＡＤＳ株式会社,埼玉県蕨市南町２丁目７番３－４０３号,2017-01-23,株式会社
ＡＳＩＡＮ　ＭＯＴＯＲ　ＧＡＲＡＧＥ株式会社,三重県鈴鹿市高塚町１４５１番地の４６７,2017-01-23,株式会社
ＡｎｙＣａｒｅ　Ｊａｐａｎ株式会社,東京都港区港南２丁目１６番２号太陽生命品川ビル２８Ｆ,2017-01-23,株式会社
ＢＵ－ＴＡ合同会社,東京都荒川区荒川３丁目７４番１－４０２号,2017-01-23,合同会社
Ｃ，Ｋ，Ｒコーポレーション株式会社,千葉県野田市木間ケ瀬３９０４,2017-01-23,株式会社
ＣＡＰＩＴＡＬ　ＴＡＸ株式会社,東京都港区赤坂７丁目３番３７号,2017-01-23,株式会社
ＣＬＮＥＴ株式会社,東京都中央区日本橋箱崎町２７番９号,2017-01-23,株式会社
ＣＯＭＰＬＥＴＥ　ＩＮＶＥＳＴＭＥＮＴＳ合同会社,千葉県柏市逆井４丁目２６番３号サンヴィレッジＡ－１０１号,2017-01-23,合同会社
ＣＯＳＭＩＣ　ＣＡＦＥ株式会社,福岡県久留米市荘島町１４番地２１,2017-01-23,株式会社
ＤＭＳ株式会社,東京都荒川区南千住８丁目６番３－１４０４号,2017-01-23,株式会社
Ｄｉｓｔａｎｔ　Ｓｈｏｒｅｓ　Ｂｒｅｗｉｎｇ株式会社,東京都東村山市秋津町３丁目１４番地２,2017-01-23,株式会社
ＦＵＫＵＳＯＵ商事株式会社,東京都豊島区南長崎５丁目２５番１０号,2017-01-23,株式会社
ＨＲＶＣ合同会社,東京都港区芝浦４丁目１２番３２号,2017-01-23,合同会社
Ｈａｐｐｙ　Ｄｅｓｉｇｎ株式会社,千葉県船橋市八木が谷２丁目２６番１２号,2017-01-23,株式会社
ＩＳＪ株式会社,栃木県芳賀郡茂木町大字小貫２４４１番地,2017-01-23,株式会社
Ｊ‐ＧＯＬＤ株式会社,東京都北区田端１丁目１２番１４－５０８号匯金ビル,2017-01-23,株式会社
Ｊｅｔｈｒｏ１７合同会社,兵庫県西宮市松籟荘３番５号,2017-01-23,合同会社
ＫＡＭＩコンサルティング合同会社,東京都江戸川区北小岩６丁目２１番１６号,2017-01-23,合同会社
Ｍ＆Ｍ株式会社,神奈川県厚木市戸室３丁目２番９号,2017-01-23,株式会社
ＭＹ　Ｓｔｅｌｌａ株式会社,東京都豊島区南長崎６丁目２１番１５号,2017-01-23,株式会社
ＮＰＯ法人コアラ日高,埼玉県日高市横手２丁目２５番地８,2017-01-23,その他の設立登記法人
ＮＰＯ法人手作り石鹸普及の会,熊本県菊池市泗水町豊水４２０５番地,2017-01-23,その他の設立登記法人
ＮＰＯ法人Ｐｅｅｒ　Ｄｏ,大阪府豊中市服部南町４丁目４番１８号,2017-01-23,その他の設立登記法人
ＮＲ企画インターネット株式会社,神奈川県横浜市青葉区あざみ野２丁目３１番地９サンモールあざみ野１０３,2017-01-23,株式会社
ＮＺＴエンジニアリング株式会社,埼玉県川口市前川４丁目３８番８号,2017-01-23,株式会社
Ｏ．Ｓ．アーツプロダクション株式会社,埼玉県越谷市蒲生茜町２８番地８,2017-01-23,株式会社
ＰｉｅｃｅＨｏｍｅ株式会社,大阪府堺市南区庭代台３丁１４番４号,2017-01-23,株式会社
Ｒ＆Ａ　Ｃｏｎｓｕｌｔｉｎｇ株式会社,埼玉県坂戸市南町９番９号,2017-01-23,株式会社
ＲＡＩＮＢＯＷ合同会社,埼玉県さいたま市北区櫛引町２丁目１９９番地２０２号室,2017-01-23,合同会社
ＲｘＬｏｇｉｘ　Ｊａｐａｎ合同会社,東京都港区虎ノ門４丁目３番２０号神谷町ＭＴビル１４階,2017-01-23,合同会社
ＳＤＹエステート合同会社,東京都世田谷区砧６丁目３番１５号,2017-01-23,合同会社
ＳＨＩＲＹＵ合同会社,東京都世田谷区北烏山１丁目６１番１５号,2017-01-23,合同会社
ＳＨＯＮＡＮ　ＺＯＯＬＯＧＩＣＡＬ　ＧＡＲＤＥＮ株式会社,埼玉県さいたま市南区南浦和３丁目２０番３号,2017-01-23,株式会社
ＳＯＵＴＨ　ＡＳＩＡ　ＣＯＲＰＯＲＡＴＩＯＮ合同会社,東京都豊島区駒込３丁目１６番４号コートエム＆エーパートツー２０６号,2017-01-23,合同会社
ＳｔｒａｓＢｅｒｇ合同会社,神奈川県横浜市西区西戸部町１丁目９９番Ｄ号,2017-01-23,合同会社
ＹＡＴ１合同会社,東京都港区虎ノ門３丁目２２番１０－２０１号,2017-01-23,合同会社
ａｉｃｏｍ株式会社,兵庫県神戸市中央区三宮町２丁目５番地１３香月ビル４Ｆ,2017-01-23,株式会社
ａｒｃｈ株式会社,千葉県市川市八幡３丁目３番２－６１７号,2017-01-23,株式会社
ｅＱ’ｉｎｖｅｓｔ合同会社,東京都江戸川区松江４丁目６番１４,2017-01-23,合同会社
ｉテック合同会社,和歌山県海南市小野田１５３１番地２０２,2017-01-23,合同会社
ｖｉｖａ８１９株式会社,大阪府大阪市北区天満３丁目６,2017-01-23,株式会社
あくら合同会社,岡山県岡山市南区西高崎５番地４,2017-01-24,合同会社
さくら３９株式会社,愛媛県八幡浜市五反田２番耕地７２２番地１,2017-01-24,株式会社
アイアール不動産株式会社,岡山県総社市駅前１丁目８番２号,2017-01-24,株式会社
アテナ合同会社,埼玉県川口市元郷３丁目２３番２９号エムアイ２Ｆ,2017-01-24,合同会社
アネシス株式会社,大阪府豊中市桜の町１丁目３番１９号,2017-01-24,株式会社
アパレルものづくり協同組合,徳島県徳島市上八万町下中筋１０６番地,2017-01-24,その他の設立登記法人
アポロン合同会社,東京都豊島区南大塚２丁目１１番１０号ミモザビル３階,2017-01-24,合同会社
アリドミ工業株式会社,山口県防府市大字大崎５５番地,2017-01-24,株式会社
アルコンファーマ株式会社,東京都港区虎ノ門１丁目２３番１号,2017-01-24,株式会社
イーティー合同会社,千葉県千葉市中央区矢作町８１２番地１５,2017-01-24,合同会社
エイブル興産株式会社,福島県いわき市平字下の町８番地１ネオグランデいわき中央１１０２号,2017-01-24,株式会社
エヌズダイニング株式会社,東京都武蔵野市境南町２丁目１番２３号,2017-01-24,株式会社
エムエムウェイ合同会社,東京都三鷹市新川５丁目１２番１号,2017-01-24,合同会社
エレパース・ジャパン合同会社,千葉県市川市市川２丁目２６番１８号,2017-01-24,合同会社
エープラス株式会社,東京都中央区銀座２丁目１２番１２号,2017-01-24,株式会社
オフィス村元合同会社,兵庫県神戸市垂水区清玄町１８番地の８,2017-01-24,合同会社
キリストの光宣教会,山口県光市虹ケ丘３丁目２２番３８号,2017-01-24,その他の設立登記法人
キリヤマガレージ株式会社,愛知県岡崎市切山町字大ゾレ３２番地１８,2017-01-24,株式会社
クラウドナイン合同会社,東京都新宿区新宿７丁目３番４２号,2017-01-24,合同会社
クレアシオン・プリンシパル合同会社,東京都港区虎ノ門４丁目３番１号,2017-01-24,合同会社
クレハウス株式会社,群馬県太田市只上町９０３番地１,2017-01-24,株式会社
グローバル・マネジメント株式会社,長崎県長崎市元船町２番８号,2017-01-24,株式会社
コアクラ合同会社,北海道稚内市緑４丁目４番３０号,2017-01-24,合同会社
コネクト株式会社,東京都杉並区善福寺１丁目１番２２号,2017-01-24,株式会社
サンズドリーム株式会社,東京都千代田区紀尾井町１番５号,2017-01-24,株式会社
スマイルレディ株式会社,宮崎県日向市亀崎３丁目６番１３号,2017-01-24,株式会社
セスティック株式会社,埼玉県川口市大字西立野８１２番地の２,2017-01-24,株式会社
ソワイユマネージメント合同会社,東京都新宿区新宿２丁目１２番１３号新宿アントレサロンビル２階,2017-01-24,合同会社
タスクアライブ株式会社,山口県宇部市相生町８番１号宇部興産ビル,2017-01-24,株式会社
タートル・アセットマネジメント合同会社,神奈川県横浜市青葉区美しが丘１丁目１８番地たまプラーザ団地３－８棟２０２号,2017-01-24,合同会社
ダイヤモンド・コンサルティングオフィス合同会社,東京都港区南青山２丁目２番１５号ウィン青山９４２,2017-01-24,合同会社
チャイカ合同会社,北海道函館市元町７番７号,2017-01-24,合同会社
ディセアー株式会社,東京都豊島区西池袋１丁目３１－５白井ビル３Ｆ,2017-01-24,株式会社
ディールプロパティーズ株式会社,東京都渋谷区恵比寿４丁目５番２８号,2017-01-24,株式会社
ニトパック共栄会,大阪府茨木市下穂積１丁目１番２号,2017-01-24,その他
ネクスト・ステージ株式会社,東京都台東区上野２丁目１１番８号,2017-01-24,株式会社
ノーウェアサーフ合同会社,東京都江東区豊洲４丁目１１番２５－６０２号,2017-01-24,合同会社
ハイランド株式会社,愛知県名古屋市中村区名駅南５丁目１２番２７号,2017-01-24,株式会社
ビューティフルマナー株式会社,千葉県千葉市稲毛区稲毛東４丁目５番１－１３２１,2017-01-24,株式会社
ビラト・インターナショナル・ツアーアンド・トラベル・プライベート・リミテド,東京都八王子市子安町１丁目５３－３－１０５,2017-01-24,外国会社等
ファッシネーション合同会社,東京都渋谷区代々木１丁目３０番１５号６０９号室,2017-01-24,合同会社
ブリッジエステート株式会社,東京都杉並区上井草１丁目３０番１６号,2017-01-24,株式会社
プレステージ海外自立支援センター合同会社,兵庫県加古川市上荘町国包３２５番地の１,2017-01-24,合同会社
プロードス株式会社,大阪府豊中市岡上の町２丁目５番５号,2017-01-24,株式会社
ポーラスター・プロパティ合同会社,東京都品川区東五反田２丁目１０番１号,2017-01-24,合同会社
マッドハウス株式会社,東京都墨田区業平４丁目２番１２号,2017-01-24,株式会社
ミライジング株式会社,東京都文京区湯島３丁目６番１号全国家電会館３Ｆ,2017-01-24,株式会社
ムーン合同会社,埼玉県蕨市北町１丁目２３番２８号ルームワンＷ棟（サブリース）２階Ｂ－Ｈ,2017-01-24,合同会社
メイプルネスト株式会社,東京都渋谷区代官山町８番１６号,2017-01-24,株式会社
ライツ・ワールド株式会社,東京都港区麻布台３丁目５－５－８０２,2017-01-24,株式会社
ルケルス合同会社,大阪府大阪市北区池田町１０番地１１号,2017-01-24,合同会社
ワイズキー株式会社,東京都千代田区神田淡路町１丁目９番７号３階,2017-01-24,株式会社
ワイズプラスワン通商株式会社,埼玉県さいたま市岩槻区大字飯塚１１１２番地１,2017-01-24,株式会社
一般社団法人うみすばる,神奈川県三浦郡葉山町堀内９８９番地の１６,2017-01-24,その他の設立登記法人
一般社団法人とみおかプラス,福島県郡山市大槻町字西ノ宮４８番地の５,2017-01-24,その他の設立登記法人
一般社団法人サーマルリサイクルパワー技術研究所,沖縄県島尻郡与那原町字東浜８７番地の１７,2017-01-24,その他の設立登記法人
一般社団法人メゾンドール,東京都江戸川区北葛西４丁目１３番４号メゾンドール,2017-01-24,その他の設立登記法人
一般社団法人先生ビジネス共同協会,東京都新宿区西新宿７丁目４番７号,2017-01-24,その他の設立登記法人
一般社団法人先端技術機構,東京都港区南青山２丁目１８－２竹中ツインビルＡ館２階,2017-01-24,その他の設立登記法人
一般社団法人全国空き家対策機構,東京都千代田区隼町２番１２号藤和半蔵門コープ７０７号室,2017-01-24,その他の設立登記法人
一般社団法人啐啄の機,鹿児島県姶良市中津野４４４番地３,2017-01-24,その他の設立登記法人
一般社団法人山春,愛知県名古屋市中区葵１丁目２７番２９号,2017-01-24,その他の設立登記法人
一般社団法人日中協働発展促進協会,東京都港区赤坂２丁目１２番２１－３０２号,2017-01-24,その他の設立登記法人
一般社団法人日本の美しい花嫁をつくる会,東京都港区南青山２丁目２番１５号,2017-01-24,その他の設立登記法人
一般社団法人日本アジア経済教育スポーツ会議,大阪府松原市南新町３丁目９番１９号,2017-01-24,その他の設立登記法人
一般社団法人滋賀人,滋賀県長浜市八幡中山町１２０１番地,2017-01-24,その他の設立登記法人
一般社団法人生命素粒子健康センター,沖縄県那覇市泊２丁目１番地２１尚平ビル６０２,2017-01-24,その他の設立登記法人
一般社団法人自然災害総合支援協会,東京都町田市成瀬が丘２丁目２２番地８,2017-01-24,その他の設立登記法人
一般社団法人道徳経学用日本,茨城県稲敷郡阿見町うずら野２丁目３２番地３,2017-01-24,その他の設立登記法人
一般社団法人錬身会楽シィー,福岡県福岡市西区下山門３丁目２２番２０－１０２号,2017-01-24,その他の設立登記法人
一般社団法人阿休易庵,千葉県四街道市鷹の台４丁目１８番６号,2017-01-24,その他の設立登記法人
一般社団法人ＡＵＲＡ総研,北海道札幌市厚別区厚別中央二条２丁目３番６号,2017-01-24,その他の設立登記法人
一般社団法人Ｐｅａｃｅ　Ｌｉｆｅ,奈良県大和郡山市西町２０８番地１,2017-01-24,その他の設立登記法人
