法人名,住所,設立日,法人種別
グランディール合同会社,東京都中野区本町３丁目２９番４－２０２号,2017-02-07,合同会社
コミク商事株式会社,埼玉県東松山市小松原町８番地１６,2017-02-07,株式会社
コンプルメントコンサルティング株式会社,東京都江東区豊洲３丁目４番１－２８０３号,2017-02-07,株式会社
サファイアブーケ合同会社,兵庫県宝塚市社町６番６号,2017-02-07,合同会社
サンセリテ株式会社,滋賀県草津市野村８丁目６番８号Ｂ１０１,2017-02-07,株式会社
サントリーコミュニケーションズ株式会社,東京都港区台場２丁目３番３号,2017-02-07,株式会社
サントリービジネスシステム株式会社,東京都港区台場２丁目３番３号,2017-02-07,株式会社
サンブリッジコンサルティング株式会社,東京都千代田区丸の内２丁目２番１号岸本ビルヂング６階,2017-02-07,株式会社
サヴァナコンサルティング株式会社,東京都国分寺市西町２丁目２６番地１４,2017-02-07,株式会社
サーストン株式会社,静岡県静岡市清水区幸町１１番１３号,2017-02-07,株式会社
サービスカンパニー株式会社,富山県小矢部市上野本５２番地７,2017-02-07,株式会社
シノホープ合同会社,東京都墨田区両国３丁目１５番４－９０１号藤和シティホームズ両国,2017-02-07,合同会社
スマートスキャン株式会社,東京都千代田区丸の内２丁目７番２号,2017-02-07,株式会社
ソークエンジニアリング株式会社,東京都荒川区東日暮里４丁目１０番１０号,2017-02-07,株式会社
タチバナ江東白河株式会社,東京都江東区白河３丁目９番１５号,2017-02-07,株式会社
タビットツアーズ株式会社,茨城県水戸市酒門町５１２３番地,2017-02-07,株式会社
タンゴ・サポート株式会社,京都府京丹後市丹後町竹野５１０番地,2017-02-07,株式会社
ダイマックス合同会社,東京都江戸川区宇喜田町１４４９番地１１,2017-02-07,合同会社
テクノジャパン株式会社,群馬県北群馬郡榛東村大字長岡１０９６番地２,2017-02-07,株式会社
デザインエナジー合同会社,東京都新宿区西新宿７丁目５番９,2017-02-07,合同会社
トシロジスティクス株式会社,福岡県糟屋郡粕屋町大字江辻１番１号,2017-02-07,株式会社
トラストネットワーク株式会社,福岡県福岡市博多区博多駅南５丁目２１番８号,2017-02-07,株式会社
ドレープフィーチャリング株式会社,東京都世田谷区用賀２丁目２９番２４号,2017-02-07,株式会社
ナルド合同会社,東京都港区高輪３丁目１８番１１号高輪テラスＢ,2017-02-07,合同会社
ネイロエージェント株式会社,東京都新宿区高田馬場１丁目２９番９号,2017-02-07,株式会社
ハウスワークス株式会社,愛知県名古屋市港区名港１丁目１４番２５号,2017-02-07,株式会社
ハキムトレーディング株式会社,岡山県岡山市北区十日市中町二丁目３９番３号ハイツ松１０８号,2017-02-07,株式会社
ビセイパートナーズ株式会社,岡山県岡山市北区加茂２４６番地２,2017-02-07,株式会社
ビヨンドブロックチェーン株式会社,東京都渋谷区恵比寿南２丁目６番１１号山崎ビル１階,2017-02-07,株式会社
フォーハンズ株式会社,岐阜県大垣市綾野１丁目２６４８番地１,2017-02-07,株式会社
フカエ・テクノロジーズ合同会社,神奈川県川崎市高津区下作延６丁目７番２９号,2017-02-07,合同会社
フジケンミンフーズ株式会社,静岡県藤枝市城南２丁目１０番６号,2017-02-07,株式会社
フリンジウッド合同会社,東京都目黒区大橋１丁目８番１１号,2017-02-07,合同会社
フローラバッグ株式会社,東京都中央区東日本橋１丁目３番１５号,2017-02-07,株式会社
ブリッジエンド株式会社,神奈川県鎌倉市十二所８６１番地,2017-02-07,株式会社
プリミシカ株式会社,神奈川県横浜市都筑区南山田２丁目２４番６－９１２号,2017-02-07,株式会社
マシンクレイン株式会社,石川県金沢市諸江町１番１５号,2017-02-07,株式会社
ミヤマ東日本株式会社,宮城県栗原市若柳字大林寺浦３２番地４,2017-02-07,株式会社
ミラコロプラス株式会社,埼玉県さいたま市浦和区高砂３丁目１０番４号八千代ビル５階,2017-02-07,株式会社
ユーキックス株式会社,大阪府大阪市北区黒崎町１３番８号２０２号室,2017-02-07,株式会社
ライフクリエイトサービス株式会社,千葉県松戸市西馬橋幸町１１２番地,2017-02-07,株式会社
ライフファクトリー株式会社,埼玉県さいたま市西区大字佐知川１９９番地１３,2017-02-07,株式会社
レッドガウル株式会社,愛知県名古屋市南区堤起町１丁目２０番３号,2017-02-07,株式会社
ワースコネクション株式会社,東京都武蔵野市吉祥寺北町３丁目５番９号,2017-02-07,株式会社
一般社団法人かがやき,埼玉県さいたま市見沼区大字東宮下５３３番地２５,2017-02-07,その他の設立登記法人
一般社団法人かがわガイド協会,香川県高松市川島東町２９３番地５,2017-02-07,その他の設立登記法人
一般社団法人こどもみらい塾,東京都中野区東中野４丁目２７番２６号,2017-02-07,その他の設立登記法人
一般社団法人ふくろうの会,大阪府泉佐野市松原２丁目２番３１号,2017-02-07,その他の設立登記法人
一般社団法人ふるさと再生支援機構,東京都中央区築地７丁目７番５号,2017-02-07,その他の設立登記法人
一般社団法人まるにわ,鳥取県鳥取市湖山町北１丁目４２７－１,2017-02-07,その他の設立登記法人
一般社団法人もちもちびと,岐阜県高山市神明町４丁目５７番地２,2017-02-07,その他の設立登記法人
一般社団法人アルク,大阪府河内長野市栄町１番４号,2017-02-07,その他の設立登記法人
一般社団法人グローウィズ２１,兵庫県明石市二見町福里２８８番地の２二見ハイツ２棟２０７号,2017-02-07,その他の設立登記法人
一般社団法人ツーリズムとよた,愛知県豊田市小坂本町１丁目２５番地,2017-02-07,その他の設立登記法人
一般社団法人ブリッジフォース,東京都千代田区霞が関３丁目２番５号,2017-02-07,その他の設立登記法人
一般社団法人マチノエン,兵庫県高砂市高砂町次郎助町１５７６番地,2017-02-07,その他の設立登記法人
一般社団法人交通事故被害者等相談所,埼玉県入間市久保稲荷４丁目２番地９ターナビル１０１,2017-02-07,その他の設立登記法人
一般社団法人全国心理教育支援協会,大阪府大阪市中央区安堂寺町２丁目３番５号,2017-02-07,その他の設立登記法人
一般社団法人全日本菓子輸出促進協議会,東京都港区六本木２丁目２番２号,2017-02-07,その他の設立登記法人
一般社団法人労働福祉センターみやぎ,宮城県仙台市青葉区本町２丁目１２番７号,2017-02-07,その他の設立登記法人
一般社団法人医療アートメイク学会,東京都中央区銀座２丁目１１番８号ラウンドクロス銀座３Ｆ,2017-02-07,その他の設立登記法人
一般社団法人外国人技能実習生・労働者雇用支援協会,東京都港区赤坂９丁目６－３０ルイマーブル乃木坂１０７号室,2017-02-07,その他の設立登記法人
一般社団法人家相建築設計推進協会,東京都千代田区神田神保町１丁目７番地,2017-02-07,その他の設立登記法人
一般社団法人日伯スポーツ文化交流会,群馬県邑楽郡大泉町朝日１丁目７番４０号,2017-02-07,その他の設立登記法人
一般社団法人日本住宅産業協議会活性化推進支援機構,宮崎県宮崎市佐土原町下那珂３５６９番地７,2017-02-07,その他の設立登記法人
一般社団法人日本女性医療者連合,東京都中央区銀座２丁目６番５号銀座トレシャス７階,2017-02-07,その他の設立登記法人
一般社団法人日本ＬＧＢＴ機構,東京都千代田区平河町２丁目３番１０号,2017-02-07,その他の設立登記法人
一般社団法人発達障害支援アドバイザー協会,福岡県福岡市博多区上呉服町二丁目１５番地ＳＯＨＡＫＡＴＡビル３階,2017-02-07,その他の設立登記法人
一般社団法人神田をワインの街にしようの会,東京都千代田区鍛冶町１丁目３番９号,2017-02-07,その他の設立登記法人
一般社団法人福島ミッションセンター,福島県郡山市安積町日出山４丁目１４番地,2017-02-07,その他の設立登記法人
一般社団法人連和商会,東京都中央区日本橋蛎殻町１丁目３０番２号,2017-02-07,その他の設立登記法人
一般社団法人食の学問体系化研究所,兵庫県淡路市夢舞台１番地３８,2017-02-07,その他の設立登記法人
一般社団法人ＡＴＩ,兵庫県西宮市鷲林寺南町１０番８号,2017-02-07,その他の設立登記法人
一般社団法人ＨＯＫＫＡＩＤＯ　ＭＩＲＡＩ　ＬＡＢ．,北海道札幌市中央区北五条西１１丁目８Ｓａｃｒａビル４階,2017-02-07,その他の設立登記法人
一般社団法人Ｏ＆Ｎ,東京都台東区上野１丁目２０番１号,2017-02-07,その他の設立登記法人
一般社団法人Ｓｕｍｉｋａ,北海道小樽市花園１丁目１２番２号,2017-02-07,その他の設立登記法人
一般社団法人ＷＡＶＥＳ　ＪＡＰＡＮ,東京都港区南青山１丁目１５番１８号リーラ乃木坂,2017-02-07,その他の設立登記法人
一般社団法人ｂｅａｕｔｙ＆ｈｅａｌｔｈ志穂,北海道苫小牧市本幸町２丁目３番１７－８０２号,2017-02-07,その他の設立登記法人
一般財団法人中間ゼネラル,福岡県中間市上蓮花寺１丁目２番１号２階,2017-02-07,その他の設立登記法人
三結商事合同会社,東京都練馬区中村北１丁目１０番１７－１２０４号,2017-02-07,合同会社
下北ジオパーク推進協議会,青森県むつ市中央１丁目８番１号,2017-02-07,その他
中央葬研株式会社,東京都千代田区神田須田町２丁目２５番地ＧＹＢ秋葉原,2017-02-07,株式会社
久成株式会社,埼玉県越谷市大字大房９８９－３,2017-02-07,株式会社
伯耆生コン株式会社,鳥取県米子市旗ヶ崎２３１９番地,2017-02-07,株式会社
全病理ボランティアの会,大阪府吹田市泉町４丁目２５－５,2017-02-07,その他
共栄土木建築株式会社,岐阜県大垣市島里２丁目７８番地,2017-02-07,株式会社
凱施貿易株式会社,東京都大田区中央８丁目１６番１４号,2017-02-07,株式会社
出口建設合同会社,愛知県豊明市前後町五軒屋１５５１番地３仙人塚ハイツ３０６号,2017-02-07,合同会社
医療法人祥寿会,神奈川県相模原市南区相模大野３丁目３番１ｂｏｎｏ相模大野ＳｏｕｔｈＭａｌｌ４階Ｂ４０１－２,2017-02-07,その他の設立登記法人
協和商事株式会社,兵庫県神戸市兵庫区松原通４丁目４番７号,2017-02-07,株式会社
司法書士法人よしい事務所,東京都新宿区新宿４丁目３番１７号フォーキャスト新宿サウス４階,2017-02-07,その他の設立登記法人
司法書士法人ＣＳＰ,福岡県北九州市小倉南区富士見２丁目１５番２号,2017-02-07,その他の設立登記法人
合同会社ありが,千葉県柏市若柴１７８番地４柏の葉キャンパス１４８街区２ショップ＆オフィス棟６階,2017-02-07,合同会社
合同会社こもれび社会福祉士事務所,愛媛県八幡浜市大平１番耕地７９４番地７,2017-02-07,合同会社
合同会社アルファ電設,石川県加賀市美岬町よ１１番地１,2017-02-07,合同会社
合同会社アンシャンテ高輪,東京都港区高輪３丁目２５－２７,2017-02-07,合同会社
合同会社インフォード,神奈川県相模原市緑区下九沢１４７９番地１－２０２号,2017-02-07,合同会社
合同会社エザンス,東京都江戸川区春江町３丁目３０番２３号,2017-02-07,合同会社
合同会社オフィスシックス,神奈川県横浜市西区戸部本町４５番１号ながせビル２Ｆ,2017-02-07,合同会社
合同会社オフィスＭ５２４,兵庫県神崎郡福崎町高岡１２２９番地３,2017-02-07,合同会社
合同会社カーシャンバー,沖縄県糸満市字潮平７０７番地１オーブヴェルトゥス１０２号,2017-02-07,合同会社
合同会社キラカンパニー,東京都府中市朝日町１丁目６番地５号,2017-02-07,合同会社
合同会社クロスホーム,大阪府大阪市城東区天王田２番２２号,2017-02-07,合同会社
合同会社クローバー,千葉県柏市南増尾７丁目４番地２０号コーポ北稜Ａ１０２,2017-02-07,合同会社
合同会社グレーベン,神奈川県横浜市中区尾上町４丁目５７番地,2017-02-07,合同会社
合同会社ゴゴゴ,東京都中野区大和町１丁目６８番７号やまとマンション４０３号,2017-02-07,合同会社
合同会社シャインステート,東京都八王子市左入町３４１番地,2017-02-07,合同会社
合同会社ジアコーポレーション,埼玉県吉川市大字加藤１１５番地１,2017-02-07,合同会社
合同会社スタジオあ,神奈川県川崎市多摩区三田１丁目２６番地２６,2017-02-07,合同会社
合同会社セイトキ,千葉県鎌ケ谷市北中沢１丁目１０－２８－２０７,2017-02-07,合同会社
合同会社ゼロワン,東京都墨田区江東橋３丁目１番１０－１３０３号,2017-02-07,合同会社
合同会社ソラベル,青森県三戸郡新郷村大字戸来字沢出口２番地１,2017-02-07,合同会社
合同会社タカフーズ,北海道上川郡美瑛町字水上３６６番地９,2017-02-07,合同会社
合同会社チアーズ,福岡県北九州市八幡西区金剛３丁目１３番６号,2017-02-07,合同会社
合同会社ニコーセールスリミテッド,愛知県愛知郡東郷町大字春木字清水ケ根１３番地,2017-02-07,合同会社
合同会社ビルミルク,群馬県邑楽郡大泉町坂田３丁目１０番１１号,2017-02-07,合同会社
合同会社ブルースカイ,埼玉県加須市北下新井３３５番地,2017-02-07,合同会社
合同会社ブルースター,千葉県松戸市松戸１１３９番地の２ライオンズステーションタワー松戸１１０６号,2017-02-07,合同会社
合同会社ブルーベリー,茨城県土浦市荒川沖２３５番地１－２０３号,2017-02-07,合同会社
合同会社ヘイヤ,東京都台東区浅草橋１丁目２３番１１－３０１号,2017-02-07,合同会社
合同会社ワイズプランニング,神奈川県横浜市西区元久保町８番１６－４０２号,2017-02-07,合同会社
合同会社ヴォイド,岩手県奥州市江刺区藤里字後田４８番地,2017-02-07,合同会社
合同会社三上,東京都台東区台東１丁目１９番１２号秋山マンション３０１,2017-02-07,合同会社
合同会社三喜,沖縄県糸満市字大度２５５番地の２０,2017-02-07,合同会社
合同会社修,愛知県知多郡武豊町字後畑２０番地６,2017-02-07,合同会社
合同会社喜幸,京都府京都市下京区西木屋町通四条下る船頭町２０２番地,2017-02-07,合同会社
合同会社奄旨海房魚匠,鹿児島県奄美市笠利町大字外金久９８８番地２,2017-02-07,合同会社
合同会社小島太陽光発電所,栃木県那須烏山市大里８９１番地１,2017-02-07,合同会社
合同会社小林興業,宮崎県東臼杵郡門川町宮ケ原２丁目６１番地１日吉ハウス１号,2017-02-07,合同会社
合同会社居宅介護支援事業所鏡,熊本県八代市鏡町貝洲１１５０番地１,2017-02-07,合同会社
合同会社康平,東京都渋谷区桜丘町２３番１７－４０８号,2017-02-07,合同会社
合同会社斉藤農園,茨城県稲敷郡阿見町本郷１丁目４４番地８,2017-02-07,合同会社
合同会社松阪菜果,三重県松阪市広瀬町７６１番地,2017-02-07,合同会社
合同会社権現谷接骨院,静岡県浜松市中区和合町１９０番地の１０,2017-02-07,合同会社
合同会社永友,長崎県諫早市多良見町市布１３００番地２４,2017-02-07,合同会社
合同会社琉球賃貸ドットコム,沖縄県那覇市壺川１丁目１２－１２シャルマン２０１号室,2017-02-07,合同会社
合同会社盛凛社,宮城県仙台市青葉区荒巻本沢３丁目１番１－１０４号,2017-02-07,合同会社
合同会社護邦,愛知県津島市新開町１丁目４０番地１,2017-02-07,合同会社
合同会社金城土木,沖縄県国頭郡大宜味村字田嘉里４０９番地,2017-02-07,合同会社
合同会社鋼成工業,東京都葛飾区白鳥４丁目１３番５－８０２号,2017-02-07,合同会社
合同会社長沢工業,神奈川県川崎市川崎区出来野８番５号,2017-02-07,合同会社
合同会社関電所,群馬県沼田市奈良町６９０番地,2017-02-07,合同会社
合同会社青葉内装,埼玉県越谷市大成町１丁目５０番地７,2017-02-07,合同会社
合同会社２２条動物病院,北海道帯広市西二十二条南３丁目６番地４,2017-02-07,合同会社
合同会社ＡＫＡＣ,東京都目黒区中目黒１丁目１０番２２－５０６号,2017-02-07,合同会社
合同会社ＡＹソーラー鹿児島,鹿児島県鹿児島市西別府町２９９５番地１０,2017-02-07,合同会社
合同会社ＡｓｉｌＡ,福岡県福岡市博多区博多駅前３丁目７番３５号,2017-02-07,合同会社
合同会社ＢｅＰｌａｃｅ,愛知県名古屋市中区金山５丁目２番２６号ファミリアーレ金山ＣＩＴＹ２０７号,2017-02-07,合同会社
合同会社ＣＴＸ　ＪＡＰＡＮ,東京都江東区有明１丁目４番２０号,2017-02-07,合同会社
合同会社ＦＲＥＹ,東京都港区六本木２丁目４番１２－１４０５号,2017-02-07,合同会社
合同会社ＦＵＧＡ,東京都大田区蒲田４丁目１０番１４号,2017-02-07,合同会社
合同会社Ｉ　ＤＥ　ＳＩＧＮ,沖縄県中頭郡北谷町字宮城３番地２６２,2017-02-07,合同会社
合同会社ＪＣ不動産企画,群馬県桐生市川内町５丁目２５１番地の３,2017-02-07,合同会社
合同会社ＪＲＰＦ江坂,東京都千代田区丸の内３丁目１番１号東京共同会計事務所内,2017-02-07,合同会社
合同会社ＫｎＡ　ＪＥＷＥＬ　ＢＯＸ,沖縄県糸満市西崎２丁目１６番２号２Ｆ,2017-02-07,合同会社
合同会社ＬＡ’ＢＯエステート,北海道札幌市中央区南一条西５丁目１３番地１,2017-02-07,合同会社
合同会社ＬＥＸＩＭＣＯ　ＪＡＰＡＮ,埼玉県久喜市南２丁目３番２５号カーサ昌和２０３号,2017-02-07,合同会社
合同会社Ｍ・Ａ・ＰＲＯＪＥＣＴ,静岡県御殿場市中畑１３８４番地の３７,2017-02-07,合同会社
合同会社ＭＪ,東京都千代田区内神田３丁目２１番８号,2017-02-07,合同会社
合同会社Ｐｏｒｃｅｌｌｉｎｏ,東京都港区海岸１丁目１０番６５号ＦＵＴＩＶＡＬ汐留浜離宮パークサイドシティ２０１号,2017-02-07,合同会社
合同会社Ｒ＆Ｄ,北海道札幌市中央区南八条西１丁目１３番地１３９Ｓ－ＦＯＲＴ中島公園１４０５号,2017-02-07,合同会社
合同会社Ｒ＆Ｙ,福岡県久留米市中央町２１番地３０－７０３号,2017-02-07,合同会社
合同会社Ｓ・Ｇ,愛知県名古屋市中区錦２丁目１７番３０号河越ビル７０２,2017-02-07,合同会社
合同会社Ｓ＆Ｓ　ＪＡＰＡＮ,大阪府大阪市西成区聖天下１丁目１１番６号,2017-02-07,合同会社
合同会社ＳＥＮＳＵＩ,沖縄県那覇市古島２丁目６番地１,2017-02-07,合同会社
合同会社ＳＩＮＡ,千葉県四街道市大日７８７番地１,2017-02-07,合同会社
合同会社Ｓｏｗ－ｅｎ,東京都立川市錦町６丁目１２番２０号ヘリオス３７８立川１０６号,2017-02-07,合同会社
合同会社ＶＯＩＣＥ,東京都板橋区小茂根３丁目１２番５号Ｂ１Ｆ,2017-02-07,合同会社
合同会社ＷＥＢ　ＭＩＹＡＣＯ,山梨県山梨市小原東９１５番地,2017-02-07,合同会社
合同会社ＹＭコーポレーション,東京都渋谷区道玄坂１丁目１９－６津田ソシアルビル２階,2017-02-07,合同会社
合同会社ｉＮｅｘｔ,静岡県静岡市駿河区広野３丁目１２番７号Ｍ’ｓビル４Ａ,2017-02-07,合同会社
合同会社ｍｉｍａ商事,北海道札幌市北区新琴似九条９丁目１番１２号,2017-02-07,合同会社
合同会社ｎｅｗ　ｅｒａ,北海道札幌市中央区南十条西１０丁目１番２０号さくらビル５階,2017-02-07,合同会社
合名会社ゴールドプラス,山口県山口市朝田１６７７番地５,2017-02-07,合名会社
埼玉人材派遣株式会社,埼玉県川越市今成４丁目２４番地４８,2017-02-07,株式会社
増富パワー株式会社,東京都新宿区新宿２丁目４番２号カーサ御苑５０３,2017-02-07,株式会社
夢前ニツト株式会社,兵庫県姫路市夢前町前之庄１１２６番地の１,2017-02-07,株式会社
大広設備株式会社,宮城県東松島市小松字鷹の池９６番地４,2017-02-07,株式会社
大明電子株式会社,大阪府四條畷市南野２丁目５番３７号,2017-02-07,株式会社
大田区教育研究会,東京都大田区蒲田５丁目３７－１ニッセイアロマスクエア５階,2017-02-07,その他
安曇野食工房合同会社,長野県安曇野市穂高柏原１６３３番地５,2017-02-07,合同会社
宮内青果株式会社,茨城県行方市小高１１５５番地,2017-02-07,株式会社
山健工業株式会社,福岡県筑紫郡那珂川町今光６丁目８２番地２０１－３号,2017-02-07,株式会社
山王会津株式会社,神奈川県相模原市南区相模台４丁目６番２８号,2017-02-07,株式会社
岩永鉄筋株式会社,埼玉県狭山市大字青柳１２４番地の１１６,2017-02-07,株式会社
峠屋漕泳商店株式会社,神奈川県藤沢市辻堂４丁目５番１号,2017-02-07,株式会社
幸せＬＡＢ株式会社,愛知県名古屋市中村区名駅４丁目３番２５号キャッスルプラザ２階,2017-02-07,株式会社
幸峰商事株式会社,東京都足立区花畑５丁目１番４号フラワーハイツ１Ａ号室,2017-02-07,株式会社
康祥株式会社,埼玉県川口市栄町３丁目１０－１４－２Ｆ,2017-02-07,株式会社
弁護士法人尾道しまなみ法律事務所,広島県尾道市新浜１丁目１４番３１号金属ビル７０１号室,2017-02-07,その他の設立登記法人
日本ジオトラスト株式会社,大阪府大阪市北区天神橋３丁目２番１３号,2017-02-07,株式会社
日本索維貿易株式会社,東京都大田区東蒲田１丁目２１－１５ＡＳＯＮＥ東蒲田レジデンス１３０２号室,2017-02-07,株式会社
明和合同会社,東京都千代田区丸の内１丁目８番２号鉄鋼ビルディング４階,2017-02-07,合同会社
明和建材株式会社,愛知県瀬戸市田端町１丁目５５番地の３,2017-02-07,株式会社
朝日新聞目白大塚販売株式会社,東京都豊島区高田２丁目１８番２４号,2017-02-07,株式会社
東京華瀛株式会社,東京都足立区西綾瀬１丁目３番５号ペルレ五反野５０４号室,2017-02-07,株式会社
東成工業株式会社,福岡県遠賀郡岡垣町大字原８８７番地１２,2017-02-07,株式会社
林塗装工業株式会社,奈良県天理市西長柄町４４１番地,2017-02-07,株式会社
株式会社あらき,広島県広島市中区紙屋町１丁目５番１７号,2017-02-07,株式会社
株式会社いろは,大阪府松原市天美西１丁目１５番１５号,2017-02-07,株式会社
株式会社いろり商店,富山県富山市新富町２丁目４番２３号,2017-02-07,株式会社
株式会社いわき工業,東京都立川市西砂町４丁目１０番地の３,2017-02-07,株式会社
株式会社えびす不動産,埼玉県さいたま市北区東大成町１丁目４４５番地ファミーユ長岡３０５,2017-02-07,株式会社
株式会社おりがみ,千葉県松戸市栄町６丁目４５４番地の６,2017-02-07,株式会社
株式会社ごーるど,兵庫県西宮市高須町１丁目１番６－９１４,2017-02-07,株式会社
株式会社さくらサービス,千葉県佐倉市上別所１１７番地３,2017-02-07,株式会社
株式会社さとう新聞店,新潟県魚沼市田中３６０番地３,2017-02-07,株式会社
株式会社つくばアカウントラーズ,茨城県つくば市春日２丁目４５番地４,2017-02-07,株式会社
