法人名,住所,設立日,法人種別
合同会社クーペ,福岡県福岡市中央区鳥飼２丁目３番１７号,2019-05-16,合同会社
合同会社グローバルソーイング,愛知県日進市岩崎町梅ノ木２１１番地の１,2019-05-16,合同会社
合同会社コユソ,広島県広島市中区上幟町８－３４－６０３,2019-05-16,合同会社
合同会社ゴデーレ,東京都葛飾区奥戸２丁目６番１７号,2019-05-16,合同会社
合同会社サルコー,岐阜県加茂郡川辺町西栃井５９６,2019-05-16,合同会社
合同会社サンファームＴ,山梨県南都留郡忍野村忍草１３０８番地２,2019-05-16,合同会社
合同会社サンファームＹ,山梨県南都留郡忍野村忍草２５６番地４,2019-05-16,合同会社
合同会社シトリン,東京都江東区扇橋３丁目５番１２号,2019-05-16,合同会社
合同会社シャルム,徳島県板野郡北島町鯛浜字かや７４番地,2019-05-16,合同会社
合同会社シルバー,東京都大田区東糀谷１丁目１３番２号,2019-05-16,合同会社
合同会社スマイル労働衛生コンサルタント事務所,東京都渋谷区渋谷２丁目１０番１５号,2019-05-16,合同会社
合同会社ティーオーシー,千葉県佐倉市大崎台２丁目２２番地１０,2019-05-16,合同会社
合同会社デラシネ,東京都江東区東雲１丁目９番４２－３０４号,2019-05-16,合同会社
合同会社トステクノ,佐賀県鳥栖市古野町１５０番地２,2019-05-16,合同会社
合同会社ニュータウンネット,東京都荒川区荒川５丁目１１番地１５クォーレ東館２０５号,2019-05-16,合同会社
合同会社ヒラ工業,静岡県静岡市葵区上足洗４４番地の３、１階２号室,2019-05-16,合同会社
合同会社フィンウェル研究所,東京都新宿区西新宿３丁目９番７号,2019-05-16,合同会社
合同会社ブレントウッド・キャピタル・パートナーズ,神奈川県横浜市青葉区松風台３４番１４号,2019-05-16,合同会社
合同会社ベアベア,東京都渋谷区幡ヶ谷２丁目３８番地１号幡ヶ谷ハウス３１３,2019-05-16,合同会社
合同会社マエストロ,東京都港区浜松町２丁目２番１５号,2019-05-16,合同会社
合同会社ミカサ,埼玉県草加市新善町４７１番地２,2019-05-16,合同会社
合同会社メトロ・ワン,東京都千代田区丸の内３丁目１番１号東京共同会計事務所内,2019-05-16,合同会社
合同会社ヨーローカンパニー,宮崎県宮崎市大字田吉１８８１番地１シ－サイドエコ－４０２号,2019-05-16,合同会社
合同会社ライフクック,神奈川県川崎市高津区諏訪２丁目９番５号ドミール・ドゥ１０２,2019-05-16,合同会社
合同会社三幸会,熊本県合志市須屋６８０番地１,2019-05-16,合同会社
合同会社仔熊舎,千葉県夷隅郡大多喜町田代３１７番地,2019-05-16,合同会社
合同会社令和レンタカー,沖縄県那覇市銘苅３丁目１１番９号,2019-05-16,合同会社
合同会社信和設計,長崎県長崎市千歳町１番５号,2019-05-16,合同会社
合同会社優絆会,兵庫県神戸市須磨区潮見台町２丁目１番１３－４０３号,2019-05-16,合同会社
合同会社北村企画,大阪府大阪狭山市西山台１丁目２７番３号,2019-05-16,合同会社
合同会社小林敬一郎建築研究所,大阪府大阪市北区天満１丁目３番１２号フローレント高尾ビル１０１号,2019-05-16,合同会社
合同会社恒揚,東京都品川区二葉１丁目１６－１５上海亭ビル１Ｆ,2019-05-16,合同会社
合同会社感謝,鹿児島県鹿児島市下福元町７５０８番地４,2019-05-16,合同会社
合同会社戸村,千葉県香取市山之辺１２４４番地１,2019-05-16,合同会社
合同会社未来,東京都練馬区貫井２丁目３０番３号,2019-05-16,合同会社
合同会社水月,愛知県津島市永楽町３丁目２５番地５,2019-05-16,合同会社
合同会社玲音,北海道札幌市白石区菊水九条１丁目３番１０号アリエス３－３０１号,2019-05-16,合同会社
合同会社福事川本事務所,大分県別府市富士見町３番４号,2019-05-16,合同会社
合同会社福松建設,宮城県仙台市太白区東中田３丁目１番１号キャロットⅡ１階,2019-05-16,合同会社
合同会社９’ｓコーポレーション,千葉県千葉市花見川区幕張本郷１丁目９番２３号－１０１,2019-05-16,合同会社
合同会社Ａｎｉ　Ｍａｎａｇｅｍｅｎｔ,福岡県宗像市日の里５丁目５番地６－３Ｆ,2019-05-16,合同会社
合同会社Ｂｅｌｌａｒｉｓ,栃木県下野市駅東３丁目６番１８号コーポ英Ｄ１０２,2019-05-16,合同会社
合同会社ＣＡＢＵ,東京都台東区浅草橋５丁目１４番１号マノンフラット浅草橋１０１,2019-05-16,合同会社
合同会社Ｃｅｌａｌｉｎｋ,東京都練馬区早宮４丁目３４番２号,2019-05-16,合同会社
合同会社Ｄｃｅｎｔｅｒ,長崎県長崎市本石灰町４番２号１階,2019-05-16,合同会社
合同会社Ｆ＆Ｂコンサルティング,大阪府大阪市淀川区東三国１丁目２３－１２,2019-05-16,合同会社
合同会社ＧＥＮＥＴＯ　ＧＲＯＵＰ,京都府京都市左京区静市市原町１３７番地,2019-05-16,合同会社
合同会社Ｉ＆Ｕ,東京都品川区西五反田２丁目７－９クワハラビル５階,2019-05-16,合同会社
合同会社ＪＡＹＡＭＡＬＩ　ＥＮＴＥＲＰＲＩＳＥＳ,茨城県常総市国生字坊山１２３６番地２,2019-05-16,合同会社
合同会社ＬＡコンサルタント,熊本県熊本市東区平山町３１９８番地３,2019-05-16,合同会社
合同会社ＬＩＭ,東京都杉並区高円寺南２丁目１５－１９ウエストポート２０６,2019-05-16,合同会社
合同会社ＭＡＳ,福岡県福岡市西区今宿町１９２番地３,2019-05-16,合同会社
合同会社ＭＥＧＡＲＯＣＫＥＴ,千葉県船橋市宮本５丁目６番１８号,2019-05-16,合同会社
合同会社ＭＯＮＯ空間研究所,大分県別府市駅前本町５番２７号,2019-05-16,合同会社
合同会社ＮＯ　ＦＥＡＲ　ＮＯ　ＬＩＦＥ,石川県金沢市田上本町３丁目８０番地１ＴＡＧＡＭＩマンションＡ１Ｆ,2019-05-16,合同会社
合同会社ＰＤプラス,愛知県豊田市栄町４丁目５番地７,2019-05-16,合同会社
合同会社Ｒ１０Ｈｏｌｄｉｎｇｓ,東京都中央区京橋１丁目１番地５号セントラルビル２階,2019-05-16,合同会社
合同会社ＲＯＨＩＴコンサルティング,東京都荒川区町屋３丁目２番１号Ｂ１Ｆ,2019-05-16,合同会社
合同会社ＳＩ,福岡県福岡市中央区荒戸３丁目２－４５－４０１,2019-05-16,合同会社
合同会社ＳＮＴ,福岡県福岡市博多区博多駅前３丁目２３番２０－９０４号,2019-05-16,合同会社
合同会社ＳＳコンサルティング,宮城県仙台市青葉区二日町７番３２号勾当台ハイツ,2019-05-16,合同会社
合同会社ＳＴＭエンタープライズ,山梨県甲府市中央４丁目１番５号ウイング甲府中央７０７,2019-05-16,合同会社
合同会社ＴＡＮＯＳＨＩ．３,兵庫県西宮市荒木町９－３６－３０２,2019-05-16,合同会社
合同会社Ｔｏｋｙｏ　Ｄｅｂａｔｅ　Ａｃａｄｅｍｙ,東京都港区東麻布１丁目２８番３号ＳＱＵＡＲＥ・ＡＺＡＢＵ８０３,2019-05-16,合同会社
合同会社ｅａｓｔｗｅｓｔ,大阪府大阪市淀川区東三国５丁目２番２０号岸本ビル５（６階）,2019-05-16,合同会社
合同会社ｉｚｕｍｒｕｄ,千葉県千葉市美浜区高洲３丁目３番,2019-05-16,合同会社
合同会社ｐｉｃｎｉｃ,東京都杉並区方南１丁目９番１号,2019-05-16,合同会社
合同会社ｙｕｉ,東京都墨田区向島３丁目２４番１号,2019-05-16,合同会社
大阪ＣＢサービス株式会社,大阪府守口市南寺方中通３丁目１４番２４号,2019-05-16,株式会社
大黒農園株式会社,埼玉県北葛飾郡杉戸町大字椿４４９番地,2019-05-16,株式会社
天力商貿株式会社,東京都荒川区西日暮里６丁目１番地１１号２０１号室,2019-05-16,株式会社
天才デザイン株式会社,東京都品川区北品川１丁目９番７号トップルーム品川１０１５号,2019-05-16,株式会社
太地興産株式会社,福岡県福岡市東区青葉６丁目１９番３号,2019-05-16,株式会社
宮澤塗装株式会社,長野県岡谷市川岸東５丁目９番１１号,2019-05-16,株式会社
富永商事合同会社,大阪府阪南市舞４丁目３７番２３号,2019-05-16,合同会社
工務店メンチ株式会社,大阪府南河内郡河南町大宝１丁目１１番１号,2019-05-16,株式会社
得令実業株式会社,東京都台東区雷門２丁目６番２号マーナマリー浅草雷門ビル５階,2019-05-16,株式会社
志釜利一株式会社,北海道札幌市中央区北五条西１９丁目２６番地４,2019-05-16,株式会社
日光ベル合同会社１,東京都千代田区丸の内３丁目１番１号東京共同会計事務所内,2019-05-16,合同会社
日光ベル合同会社２,東京都千代田区丸の内３丁目１番１号東京共同会計事務所内,2019-05-16,合同会社
日光ベル合同会社３,東京都千代田区丸の内３丁目１番１号東京共同会計事務所内,2019-05-16,合同会社
日光ベル合同会社４,東京都千代田区丸の内３丁目１番１号東京共同会計事務所内,2019-05-16,合同会社
日光ベル合同会社５,東京都千代田区丸の内３丁目１番１号東京共同会計事務所内,2019-05-16,合同会社
日光ベル合同会社６,東京都千代田区丸の内３丁目１番１号東京共同会計事務所内,2019-05-16,合同会社
日光ベル合同会社７,東京都千代田区丸の内３丁目１番１号東京共同会計事務所内,2019-05-16,合同会社
日高ポートサービス株式会社,和歌山県和歌山市築港５丁目３番地,2019-05-16,株式会社
星耀貿易合同会社,神奈川県横浜市神奈川区子安通３丁目３４１番地１クリオ新子安ファースト６０６号,2019-05-16,合同会社
昭志株式会社,大阪府大阪市生野区巽北１丁目２１番２９号生野ハイツ１０１６号,2019-05-16,株式会社
松田貴志人材開発コンサルティング株式会社,東京都練馬区関町南２丁目２０番１０－３０６号,2019-05-16,株式会社
株式会社ころあい,東京都中央区銀座４丁目１１番９号,2019-05-16,株式会社
株式会社さくらビルド,茨城県水戸市見川町２４６５番地の４,2019-05-16,株式会社
株式会社にじいろファーマシー,東京都世田谷区三軒茶屋２丁目４１番１３号,2019-05-16,株式会社
株式会社はたま,東京都港区三田２丁目２番１６,2019-05-16,株式会社
株式会社ひらの工管,千葉県匝瑳市蕪里３６２９番地,2019-05-16,株式会社
株式会社ふくろう,宮崎県児湯郡川南町大字川南１３４４１番地６,2019-05-16,株式会社
株式会社まずみる,北海道札幌市中央区南一条西８丁目４番１号ＴＧ札幌ビル４階,2019-05-16,株式会社
株式会社らぽーる,大阪府大阪市福島区鷺洲３丁目１０－１３ハイツニチカン１０３号,2019-05-16,株式会社
株式会社アイケン工業,北海道釧路市芦野２丁目７番１７号,2019-05-16,株式会社
株式会社アイルスケープ,東京都世田谷区北沢３丁目２７番４号立木ビル２Ｆ,2019-05-16,株式会社
株式会社アクアノースビーチ,大阪府大阪市住吉区大領３丁目６番１３号,2019-05-16,株式会社
株式会社アデノプリベント,東京都港区新橋４丁目６番１５号,2019-05-16,株式会社
株式会社アバンセ,鹿児島県鹿児島市薬師２丁目６番１８号,2019-05-16,株式会社
株式会社アヤラ工業,栃木県鹿沼市文化橋町１９６５番地５,2019-05-16,株式会社
株式会社アートケアステーション,滋賀県大津市御殿浜１２番１４号,2019-05-16,株式会社
株式会社アームズ,神奈川県横須賀市走水２丁目１６番１１号,2019-05-16,株式会社
株式会社アールネクスト,大阪府河内長野市下里町９８３番地の１,2019-05-16,株式会社
株式会社イッパイアッテナ,東京都練馬区石神井台８丁目２０番２７号トリアード３０２,2019-05-16,株式会社
株式会社インフィニート,東京都渋谷区猿楽町１４番１６号プラウド代官山猿楽町３０１,2019-05-16,株式会社
株式会社ウイングレット,東京都中野区東中野５丁目１番１号,2019-05-16,株式会社
株式会社ウェルブレス,東京都渋谷区渋谷１丁目１５番１５－５０７号テラス渋谷美竹,2019-05-16,株式会社
株式会社ウチヤマ建物管理,埼玉県さいたま市大宮区桜木町２丁目２２０番地,2019-05-16,株式会社
株式会社エスティーエス,東京都八王子市打越町１１３７番地１柳入本館１階,2019-05-16,株式会社
株式会社エステックス,千葉県銚子市外川台町１０３８１番地の３,2019-05-16,株式会社
株式会社エスプライズ,東京都中野区上鷺宮４丁目１０番３号３階,2019-05-16,株式会社
株式会社エッジニティ,大阪府堺市北区百舌鳥梅町１丁２番地２ＴＫアンバーコート中百舌鳥９０２号,2019-05-16,株式会社
株式会社エムシーライン,兵庫県神戸市灘区福住通３丁目３番３号,2019-05-16,株式会社
株式会社オフィスナカムラ,岐阜県郡上市八幡町島谷１５２４番地２１,2019-05-16,株式会社
株式会社オフィス一ノ瀬,兵庫県姫路市別所町小林４９６番地,2019-05-16,株式会社
株式会社オリジナルモーション,東京都中央区日本橋本町３丁目３番６号ワカ末ビル７階,2019-05-16,株式会社
株式会社オートグラフティ,富山県高岡市野村１３４８番地１,2019-05-16,株式会社
株式会社オートコネクト,兵庫県明石市大久保町江井島８９９番地４,2019-05-16,株式会社
株式会社オール・トレーディング,長崎県松浦市志佐町栢木免１６４８,2019-05-16,株式会社
株式会社カケイハウジング,東京都新宿区高田馬場１丁目２７番３－４０４号,2019-05-16,株式会社
株式会社カワバタ企画,東京都板橋区前野町６丁目８番１７号,2019-05-16,株式会社
株式会社キンキ警備,兵庫県尼崎市上坂部２丁目２０番４３号メゾン茶屋Ⅰ２０１,2019-05-16,株式会社
株式会社ギャルソントラスト,福岡県久留米市国分町７０６番地４,2019-05-16,株式会社
株式会社クリアルテ,東京都港区東麻布２丁目２６番７号,2019-05-16,株式会社
株式会社クリエイティブソリューション,長野県松本市大字島立字屋敷添９００番地３穂上ビル３階,2019-05-16,株式会社
株式会社クリエイティブフィールド,東京都江東区有明１丁目４番２０号,2019-05-16,株式会社
株式会社クリーンピース,福岡県北九州市八幡西区三ケ森１丁目４－２４小林ビル２－１号室,2019-05-16,株式会社
株式会社クータ,東京都渋谷区恵比寿２丁目２８番１０号ＳｈｕＢＬＤＧ２８５６,2019-05-16,株式会社
株式会社グリムの森ペットクリニック,栃木県下野市下古山３丁目２番地１０,2019-05-16,株式会社
株式会社グリラス,徳島県徳島市八万町新貝５６番地７０,2019-05-16,株式会社
株式会社グロウ,東京都文京区本郷２丁目１５番８号,2019-05-16,株式会社
株式会社ケイズエステート,兵庫県神戸市東灘区本山北町６丁目２番４０号,2019-05-16,株式会社
株式会社ゲートメソッド,大阪府大阪市中央区久太郎町３丁目１番２７号,2019-05-16,株式会社
株式会社コイド総合経営研究所,埼玉県川口市幸町３丁目７番２１号,2019-05-16,株式会社
株式会社コムアシスト,愛知県日進市香久山５丁目２０１番地１センチュリースクエア香久山Ｗ－１０４,2019-05-16,株式会社
株式会社サンキョー,大阪府大阪市北区天神橋３丁目６番２６号扇町パークビル２階,2019-05-16,株式会社
株式会社サークルプリント,東京都港区麻布十番２丁目１８番４号,2019-05-16,株式会社
株式会社シエル空調,埼玉県さいたま市中央区八王子５丁目１１番１１－５号,2019-05-16,株式会社
株式会社シロブサ,東京都清瀬市松山２丁目１２番１８号,2019-05-16,株式会社
株式会社シーズコンサルティング,東京都目黒区上目黒４丁目２７番３号,2019-05-16,株式会社
株式会社シートメタル,神奈川県海老名市社家１５２番地,2019-05-16,株式会社
株式会社ジョイハウス,埼玉県新座市野火止８丁目１１番１６－５０１号,2019-05-16,株式会社
株式会社スノーオータム,岡山県岡山市中区海吉２０３３番地１２,2019-05-16,株式会社
株式会社スリーエス,滋賀県彦根市東沼波町７０５番地２２,2019-05-16,株式会社
株式会社セイテン建設,東京都新宿区新宿１丁目３６番２号新宿第七葉山ビル３階,2019-05-16,株式会社
株式会社センテシア,神奈川県横浜市西区浅間町１丁目５番地６ハーモニーレジデンス横浜１００２号,2019-05-16,株式会社
株式会社タウルス,徳島県板野郡板野町川端字鶴ケ須５１番地２,2019-05-16,株式会社
株式会社チノスコンサルティング,東京都新宿区高田馬場４丁目９番１４号ふみビル４階,2019-05-16,株式会社
株式会社ツギタス,東京都北区豊島８丁目１５番４号７０２,2019-05-16,株式会社
株式会社トラフィックセキュリティー,岡山県岡山市北区今６丁目１５番３５号,2019-05-16,株式会社
株式会社トランキムケーティーケー,兵庫県姫路市宮上町１丁目１６６番地１,2019-05-16,株式会社
株式会社トランスアクトホールディングス,東京都港区芝公園３丁目５番８号機械振興会館４０７,2019-05-16,株式会社
株式会社トリアドール,東京都目黒区目黒２丁目１４－１３－１４０１,2019-05-16,株式会社
株式会社トリカイ,広島県福山市引野町５丁目１２－１６フォレスト引野８０４,2019-05-16,株式会社
株式会社ナーリーフロント,大阪府大阪市浪速区木津川２丁目１番１８号,2019-05-16,株式会社
株式会社ニシザトフィロソフィー,沖縄県宮古島市平良字久貝８７０番地１,2019-05-16,株式会社
株式会社ネクストヒーローズ沖縄,沖縄県那覇市三原２丁目１６番１０号,2019-05-16,株式会社
株式会社ノリシロ,東京都東久留米市滝山６丁目２番１０,2019-05-16,株式会社
株式会社ノーザンハウス,千葉県千葉市稲毛区山王町３８０番地５クレストコート山王１０５号,2019-05-16,株式会社
株式会社ハンドルホールディングス,東京都港区北青山３丁目１４番４号,2019-05-16,株式会社
株式会社バーチャルリソース,千葉県松戸市岩瀬１８番地４パストラル松戸２０３号,2019-05-16,株式会社
株式会社パピーズ,大阪府大阪市生野区巽西２丁目７番１４号,2019-05-16,株式会社
株式会社ビクレストパートナーズ,東京都千代田区東神田２丁目４番１－６０１号,2019-05-16,株式会社
株式会社ビーエムテック,千葉県千葉市花見川区宮野木台１丁目２２番１９号,2019-05-16,株式会社
株式会社ファイバーロード,熊本県上益城郡益城町大字宮園１１６６番地,2019-05-16,株式会社
株式会社フィールズファーム,新潟県新潟市秋葉区川根甲１２４番６,2019-05-16,株式会社
株式会社フェリスタ,千葉県船橋市金杉３丁目１０番２６号,2019-05-16,株式会社
株式会社フォトサリュ,東京都江戸川区船堀４丁目３番９－５０２号,2019-05-16,株式会社
株式会社フォーシード,宮城県仙台市太白区中田町字前沖１１５番地３,2019-05-16,株式会社
株式会社フュチュール・インターナショナル,東京都東村山市青葉町２丁目９番地９８,2019-05-16,株式会社
株式会社フリー,東京都八王子市明神町１丁目７番１２－３０１号,2019-05-16,株式会社
株式会社フロンティアパートナーズ,東京都渋谷区恵比寿４丁目２０番３号,2019-05-16,株式会社
株式会社ブルースター,東京都港区赤坂４丁目１１番８号アルメリア３０１,2019-05-16,株式会社
株式会社プロスパー・インベストメント,神奈川県横浜市港北区日吉本町１丁目２４番１１－１００４号,2019-05-16,株式会社
株式会社ヘルストライアングル,東京都新宿区西新宿２丁目４番１号新宿ＮＳビル６階,2019-05-16,株式会社
株式会社ホープスター,埼玉県八潮市八潮５丁目１７番地８,2019-05-16,株式会社
株式会社マルコンハウス,愛知県名古屋市中区丸の内２丁目１７番１３号ＮＫ丸の内ビル２Ｆ,2019-05-16,株式会社
株式会社マルーノデザイン,東京都品川区東品川３丁目１９番,2019-05-16,株式会社
株式会社ミカサプラニング,埼玉県久喜市栗橋中央１丁目２番２０号,2019-05-16,株式会社
株式会社ミドテク,東京都渋谷区恵比寿１丁目１５番９号シルク恵比寿４０３,2019-05-16,株式会社
株式会社ミライディスプレイ,千葉県千葉市美浜区打瀬１丁目１１番地１グリーナＡ棟１０２５号,2019-05-16,株式会社
株式会社モグラ,東京都台東区秋葉原３番１１号,2019-05-16,株式会社
株式会社ユナイト,大阪府枚方市大峰東町３７６８番,2019-05-16,株式会社
株式会社ユニカルホールディングス,和歌山県橋本市小峰台２丁目９番地の９,2019-05-16,株式会社
株式会社ヨッピーファーム,宮崎県日向市美々津町１７４２番地１,2019-05-16,株式会社
株式会社ライズ,東京都練馬区氷川台３丁目３６番１７－１０２号,2019-05-16,株式会社
株式会社ラフィルム,東京都港区麻布十番３丁目６番２号ＮＳ麻布十番ビル１１階,2019-05-16,株式会社
株式会社リンドベル,兵庫県洲本市本町５丁目４番２８号,2019-05-16,株式会社
株式会社リーライ,埼玉県鶴ヶ島市大字上広谷４番地８,2019-05-16,株式会社
株式会社リーラコーエンキャリア,東京都新宿区西新宿１丁目２２番２号,2019-05-16,株式会社
株式会社レイワ・グローバル,山口県宇部市大字東岐波１２９番地３,2019-05-16,株式会社
株式会社レディフォー友乃家,千葉県市原市五所１３５２番地３,2019-05-16,株式会社
株式会社レノボ,東京都中央区日本橋室町４丁目４番３号喜助日本橋室町ビル５階,2019-05-16,株式会社
株式会社ワイズポート,大阪府大阪市西区北堀江４丁目１４番６－５０３号,2019-05-16,株式会社
株式会社ワンポイント,兵庫県姫路市相野９２７番地４３,2019-05-16,株式会社
株式会社ワールドボックス,東京都江東区木場３丁目１８番１６号グリーンハイツ木場２０３,2019-05-16,株式会社
株式会社ヴェルフ,東京都千代田区神田三崎町２丁目１７番８号,2019-05-16,株式会社
株式会社一成工業,新潟県上越市春日山町１丁目２６番１９号,2019-05-16,株式会社
株式会社丸秀ファーム,岡山県岡山市南区藤田８５８番地,2019-05-16,株式会社
株式会社九州ライフグリーン,大分県豊後大野市緒方町鮒川２０９５番地,2019-05-16,株式会社
株式会社予防医薬,大阪府大阪市中央区本町４丁目２番１２号８Ｆ,2019-05-16,株式会社
株式会社井上畜産,和歌山県橋本市高野口町伏原１３５４番地３,2019-05-16,株式会社
株式会社令和トラスト,北海道久遠郡せたな町大成区都２７７番地,2019-05-16,株式会社
株式会社令和建設,兵庫県姫路市夢前町前之庄１６３番地４,2019-05-16,株式会社
株式会社令美,大阪府大阪市東住吉区今川７丁目７番２４号,2019-05-16,株式会社
株式会社令翔,埼玉県加須市久下５丁目２９３番８号サンフラワーマンション３０３,2019-05-16,株式会社
株式会社伊香賀建設,福岡県大野城市栄町２丁目１番２号,2019-05-16,株式会社
株式会社光信,福岡県福岡市南区長丘１丁目１９番１７号,2019-05-16,株式会社
株式会社前田,青森県弘前市大字平岡町８１番地,2019-05-16,株式会社
株式会社創新,神奈川県横浜市中区本牧町２丁目３０４番地加藤ビル３Ｃ－５,2019-05-16,株式会社
株式会社北原設備,埼玉県富士見市大字勝瀬１５９９番地６,2019-05-16,株式会社
株式会社南寮階上,東京都西東京市東町４丁目１４番８号,2019-05-16,株式会社
