法人名,住所,設立日,法人種別
いなだ庭園株式会社,愛媛県松山市古三津５丁目４番１０号,2024-03-01,株式会社
おいしいパスタ株式会社,埼玉県戸田市大字新曽２２００－２－２Ｆ,2024-03-01,株式会社
だいまるっと合同会社,福岡県福岡市東区箱崎１丁目１１番２４－２０１号大丸コーポ,2024-03-01,合同会社
はせべ不動産株式会社,滋賀県長浜市朝日町２４番３２号,2024-03-01,株式会社
アッドライブ株式会社,愛知県名古屋市港区魁町２丁目１６番地１,2024-03-01,株式会社
エースジュニア合同会社,東京都豊島区南長崎３丁目８－１４,2024-03-01,合同会社
クマ・コンセプツ株式会社,東京都中野区東中野３丁目２番７号ＦＡＩＴＨ,2024-03-01,株式会社
クラウドマネジメント合同会社,東京都中央区日本橋室町１丁目１１番１２号日本橋水野ビル７階,2024-03-01,合同会社
クレスト合同会社,千葉県匝瑳市栢田８３２６番地,2024-03-01,合同会社
グランドデザインファーム株式会社,北海道札幌市西区発寒十三条４丁目１３番２９号,2024-03-01,株式会社
ケアサービス合同会社,栃木県宇都宮市御幸ケ原町１１６番地１５,2024-03-01,合同会社
ゴールドビレッジ合同会社,兵庫県西宮市五月ケ丘４番８号,2024-03-01,合同会社
サンテクノ株式会社,東京都板橋区板橋１丁目２５－１クレールＯ２．１０１,2024-03-01,株式会社
サンランド株式会社,神奈川県横浜市栄区笠間３丁目１２番１２号,2024-03-01,株式会社
シマグリ株式会社,愛知県小牧市光ケ丘１丁目１番地アクシス光ケ丘１号棟４０８号,2024-03-01,株式会社
シントウホールディングス株式会社,宮城県石巻市大街道北３丁目７番２７号,2024-03-01,株式会社
ジェーディーエムカーワールド合同会社,神奈川県横浜市瀬谷区瀬谷町５８１２番地細谷戸ハイツ２街区２棟３１０号,2024-03-01,合同会社
スターケータリング株式会社,愛知県名古屋市東区出来町３丁目９番１０号,2024-03-01,株式会社
ストルツメディカル・ジャパン株式会社,東京都北区上中里１丁目３７番１５号,2024-03-01,株式会社
スペキュリード株式会社,東京都渋谷区渋谷２丁目１９－１５宮益坂ビルディング６０９,2024-03-01,株式会社
セブン・スプリングス株式会社,東京都世田谷区成城５丁目１９番３号マウントロイヤル成城２０１,2024-03-01,株式会社
ダ・ヴィンチグループ株式会社,東京都港区浜松町１丁目３番２－３６０３号,2024-03-01,株式会社
テンポラリー株式会社,北海道札幌市中央区北一条西３丁目３番地,2024-03-01,株式会社
トリプルＫ株式会社,岩手県北上市相去町下成沢５４番地８,2024-03-01,株式会社
パンセ株式会社,神奈川県横浜市南区平楽９１番地２,2024-03-01,株式会社
フォレスト・ワン株式会社,神奈川県三浦市三崎町小網代４４番地６,2024-03-01,株式会社
フジタカ建設株式会社,大阪府摂津市正雀３丁目２番６号,2024-03-01,株式会社
ブレインストーム・コンサルティング合同会社,埼玉県志木市本町４丁目１３番１－１１１５号志木ガーデンヒルズ,2024-03-01,合同会社
プライムウェルス合同会社,大阪府大阪市北区梅田１丁目１番３号大阪駅前第３ビル２９階１－１－１号室,2024-03-01,合同会社
ホームメンテナンス合同会社,大阪府大阪市北区梅田１丁目２番２号大阪駅前第２ビル１２－１２,2024-03-01,合同会社
ボンフカヤ株式会社,福岡県福岡市中央区赤坂１丁目１０番２２号ベスト赤坂門ビル５Ｆ,2024-03-01,株式会社
ミーモＡＤＶＡＮＣＥ合同会社,大阪府東大阪市高井田３番２号,2024-03-01,合同会社
メゾン・ド・パルファン管理組合法人,東京都中央区京橋１丁目１番５号,2024-03-01,その他の設立登記法人
ランウェイ株式会社,東京都中央区月島１丁目８番１－１３０２号,2024-03-01,株式会社
ランタナ合同会社,東京都目黒区中目黒１丁目８番１号,2024-03-01,合同会社
ラ・レジダンス・ド・京橋管理組合法人,東京都中央区京橋１丁目１番５号,2024-03-01,その他の設立登記法人
ロビンス株式会社,岐阜県各務原市蘇原緑町４丁目２５番地２０,2024-03-01,株式会社
ワイズホースパートナー株式会社,北海道函館市山の手１丁目４番１１号,2024-03-01,株式会社
ヴィオリアス日本株式会社,沖縄県国頭郡恩納村字谷茶１９１９番地１ＯＩＳＴイノベーション・インキュベータ,2024-03-01,株式会社
一般社団法人にじ,岡山県岡山市北区駅前町２丁目３番１２号カーサ・スタチオーネ２０３,2024-03-01,その他の設立登記法人
一般社団法人はやぶさ,富山県射水市小島３７５８マンションオオシマ４０１号,2024-03-01,その他の設立登記法人
一般社団法人アイランドシップ６号,東京都中央区八丁堀４丁目２番１０号ＡＯＪ税理士法人内,2024-03-01,その他の設立登記法人
一般社団法人アルファメガソーラープロジェクト２号,東京都千代田区二番町３番地麹町スクエア株式会社シリウス・アドバイザリー内,2024-03-01,その他の設立登記法人
一般社団法人キープクリーンジャパン協会,栃木県小山市西城南４丁目３０番地３０,2024-03-01,その他の設立登記法人
一般社団法人ミュージアムＥＳＤコミュニティ,和歌山県岩出市西安上３１１番地の８,2024-03-01,その他の設立登記法人
一般社団法人ユニプラ,東京都町田市高ヶ坂３丁目１３番１３号,2024-03-01,その他の設立登記法人
一般社団法人ワクワクモバイル,滋賀県長浜市口分田町３８８番地５,2024-03-01,その他の設立登記法人
一般社団法人夢・希望ＪＡＰＡＮ,東京都港区麻布十番２丁目２０番７号ＢＩＲＴＨＡＺＡＢＵ－ＪＵＢＡＮ,2024-03-01,その他の設立登記法人
一般社団法人富山県こども食堂支援センター,富山県富山市婦中町速星１０３９番地８,2024-03-01,その他の設立登記法人
一般社団法人岡山物流,東京都中央区日本橋１丁目４番１号,2024-03-01,その他の設立登記法人
一般社団法人幸生,千葉県柏市花野井３２１番地４,2024-03-01,その他の設立登記法人
一般社団法人自立支援協会,新潟県新潟市江南区東船場３丁目４番８号,2024-03-01,その他の設立登記法人
一般社団法人芽衣心会,東京都中央区銀座７丁目８番６号９階,2024-03-01,その他の設立登記法人
一般社団法人行屋稲荷大明神を祀る会,埼玉県志木市柏町６丁目２９番４５号,2024-03-01,その他の設立登記法人
一般社団法人西響会,奈良県奈良市宝来１丁目８番１号,2024-03-01,その他の設立登記法人
一般社団法人６ｏｋｋｅｎ,山梨県南都留郡富士河口湖町大石１０７３,2024-03-01,その他の設立登記法人
一般社団法人Ｃｏｌｌｅｃｔｉｖｅ　Ｃｏｍｍｕｎｉｔｙ,新潟県十日町市蓬平３７１,2024-03-01,その他の設立登記法人
一般社団法人ＫアンドＹ,東京都豊島区目白２丁目１６番１０－３０５号,2024-03-01,その他の設立登記法人
一般社団法人ＫＩＮＯ,京都府京都市北区紫野下柏野町１４番地３２,2024-03-01,その他の設立登記法人
一般社団法人ＫＰＢＣ,京都府京都市北区等持院東町５１番地７,2024-03-01,その他の設立登記法人
一般社団法人ＭＡＢＡＤＩＬＩＫＯ,大阪府箕面市小野原東６丁目２２番３号,2024-03-01,その他の設立登記法人
一般社団法人ＮＨスポーツ振興連盟,北海道札幌市西区琴似四条４丁目１番１８号１階,2024-03-01,その他の設立登記法人
一般社団法人Ｐｒｅｍａ,三重県鈴鹿市江島台１丁目１１番２２号,2024-03-01,その他の設立登記法人
一般社団法人ＳＡＳＡＥＲＵ,愛媛県伊予市米湊３２３番地１,2024-03-01,その他の設立登記法人
一般社団法人Ｔｅｒｒａ,東京都目黒区目黒本町３丁目７番１７号,2024-03-01,その他の設立登記法人
一般社団法人ｈｏｐｅ　ｈａｐｐｙ　ｏｆ　ａｎｉｍａｌｓ,千葉県柏市加賀２丁目７番１１号,2024-03-01,その他の設立登記法人
一般財団法人Ｔｈｏｒｏｕｇｈｂｒｅｄ　Ａｆｔｅｒｃａｒｅ　ａｎｄ　Ｗｅｌｆａｒｅ,東京都港区西新橋１丁目１９番４号,2024-03-01,その他の設立登記法人
三六五日株式会社,大阪府大阪市北区天神橋２丁目２番１０号ハイマウントビル６０１号室,2024-03-01,株式会社
三和産業株式会社,東京都豊島区東池袋２丁目６３番１号３０３号室,2024-03-01,株式会社
中和株式会社,大阪府大阪市生野区巽北１丁目７番３号２０３号室,2024-03-01,株式会社
云崧日本合同会社,東京都江戸川区西小岩３丁目１２番３号フドウアーバニティー西小岩２０１,2024-03-01,合同会社
今外株式会社,大阪府大阪市北区天満橋１丁目４番１４号天満橋ビル３０５号室,2024-03-01,株式会社
億城株式会社,東京都新宿区大久保２丁目２０番１８号Ａ棟,2024-03-01,株式会社
凛株式会社,大阪府箕面市小野原西６丁目２０番３号,2024-03-01,株式会社
刀千舎合同会社,東京都新宿区西新宿４丁目３２－１１－２０７,2024-03-01,合同会社
労働保険事務組合　経営労務パートナーズ協会,埼玉県越谷市東越谷６丁目２６－８,2024-03-01,その他
北山社中株式会社,東京都目黒区柿の木坂２丁目９番８号,2024-03-01,株式会社
医療法人かみじょうリハビリ整形外科クリニック,長野県長野市徳間１丁目２７番４号,2024-03-01,その他の設立登記法人
医療法人小泉クリニック,長野県上田市小泉字古仁反田７７５番地７,2024-03-01,その他の設立登記法人
医療法人戸田眼科,広島県東広島市寺家駅前１３番３５号,2024-03-01,その他の設立登記法人
医療法人社団優幸会,東京都台東区上野３丁目２３番１１号松田ビル２階,2024-03-01,その他の設立登記法人
医療法人社団真正美会,東京都中央区新川２丁目２８－２メディカルプライム新川４階,2024-03-01,その他の設立登記法人
医療法人社団ＭＯＲＩ　ＤＥＮＴＡＬ　ＣＬＩＮＩＣ,東京都港区南青山６丁目２番９号ＮＹＫビル２階,2024-03-01,その他の設立登記法人
医療法人福郎会,長崎県西彼杵郡長与町高田郷８番地２,2024-03-01,その他の設立登記法人
古美術東郷堂株式会社,埼玉県さいたま市南区文蔵３丁目３８番１号,2024-03-01,株式会社
合同会社ここから,福島県福島市笹谷字上成出５番地,2024-03-01,合同会社
合同会社すいみー,新潟県見附市市野坪町２－５０－１,2024-03-01,合同会社
合同会社つむぎ,福岡県春日市星見ヶ丘３丁目１３２番地,2024-03-01,合同会社
合同会社つむぎ舎,東京都中央区銀座１丁目１２番４号,2024-03-01,合同会社
合同会社とんとん,香川県高松市栗林町１丁目２番８－７０１号,2024-03-01,合同会社
合同会社ぶんた,神奈川県川崎市中原区木月伊勢町９番３５号ＭＨ１０１,2024-03-01,合同会社
合同会社よりみち,滋賀県愛知郡愛荘町長野１０９８番地２０,2024-03-01,合同会社
合同会社わたしの,東京都立川市若葉町１丁目１２－４,2024-03-01,合同会社
合同会社アミア,神奈川県横浜市都筑区高山１２―６,2024-03-01,合同会社
合同会社エムケイメンテナンス,富山県中新川郡立山町前沢３５８７‐９,2024-03-01,合同会社
合同会社グランコンスト,東京都板橋区舟渡３丁目１７番５号,2024-03-01,合同会社
合同会社グリーンライフエイド,福島県福島市渡利字絵馬平８９番地の８,2024-03-01,合同会社
合同会社サポーティア,福岡県宗像市葉山２丁目１５７５番地２７フェリーチェ桜壱番館Ａ号,2024-03-01,合同会社
合同会社スタジオエム,静岡県静岡市駿河区西島１５７番地の１,2024-03-01,合同会社
合同会社ステイマスター,東京都杉並区成田東４丁目３２－３,2024-03-01,合同会社
合同会社スポーツキング,千葉県柏市高南台１丁目１５番地８８,2024-03-01,合同会社
合同会社スリーサポート,東京都江東区有明３丁目７番１１号有明パークビル２０階,2024-03-01,合同会社
合同会社スルー,東京都渋谷区渋谷２丁目１９－１５宮益坂ビルディング６０９,2024-03-01,合同会社
合同会社テイルズ,東京都板橋区舟渡１丁目１６番１８号ビルドール浮間舟渡１－４０３,2024-03-01,合同会社
合同会社トゥデイシップ,埼玉県越谷市大成町１丁目１５５－７,2024-03-01,合同会社
合同会社プルテウス,東京都江東区豊洲５丁目１番１３－２０２０号,2024-03-01,合同会社
合同会社ホームラン,京都府京都市下京区西八百屋町１３８,2024-03-01,合同会社
合同会社ホーリーウィン,京都府京都市西京区桂浅原町１１９番地パラーティ浅原３０２号,2024-03-01,合同会社
合同会社ミックス,東京都台東区上野３丁目１４番２号ＵｅｎｏＹｏｕｒ２ｎｄ３１６号,2024-03-01,合同会社
合同会社ヨシフジ,京都府亀岡市千代川町湯井中筋４５番地,2024-03-01,合同会社
合同会社ライトチャンバー,熊本県熊本市南区日吉１丁目９番３－１０１号,2024-03-01,合同会社
合同会社リッチベル,広島県広島市西区鈴が峰町３５番２４－１０３号,2024-03-01,合同会社
合同会社リトフル,山口県山口市小郡大正町１番１号,2024-03-01,合同会社
合同会社与一,宮崎県宮崎市月見ケ丘１丁目２７番地２４号,2024-03-01,合同会社
合同会社侑進,北海道札幌市西区西町北２０丁目５番１２号,2024-03-01,合同会社
合同会社土巳宏,富山県富山市本郷町１２３番地２アネシス・ルナＢ２０２号,2024-03-01,合同会社
合同会社土田塗装,埼玉県八潮市大字古新田１０８２－１,2024-03-01,合同会社
合同会社総合整備センターヒロポンズ,沖縄県中頭郡西原町字小那覇４８９－１,2024-03-01,合同会社
合同会社若林建設,大阪府岸和田市吉井町３丁目２８番１４－８０４号,2024-03-01,合同会社
合同会社西九州エナジー,佐賀県鳥栖市本通町２丁目１０３７番地１ＭＪＲ鳥栖弐番館２０９１,2024-03-01,合同会社
合同会社豊珠世,東京都町田市玉川学園７丁目１１番２号,2024-03-01,合同会社
合同会社進幸,徳島県名西郡石井町石井字石井６５４番地１,2024-03-01,合同会社
合同会社障害者就労援護会,大阪府大阪市東成区中道１丁目９番１０号,2024-03-01,合同会社
合同会社塚口獣医科医院分院,兵庫県尼崎市南塚口町１丁目１番１７号,2024-03-01,合同会社
合同会社１７８,東京都豊島区東池袋２丁目６２番８号ＢＩＧオフィスプラザ池袋１１０２,2024-03-01,合同会社
合同会社２８クリエイト,愛媛県松山市西長戸町１５１－１ブルージュＢ２０３号,2024-03-01,合同会社
合同会社ＡＹＣＳ,大阪府箕面市半町４丁目２０番１３号,2024-03-01,合同会社
合同会社Ｄ　Ｂｒａｎｄ　Ｊａｐａｎ　Ｔｒａｄｉｎｇ,神奈川県横浜市中区末吉町１丁目３番地１小此木第２ビル２１１号室,2024-03-01,合同会社
合同会社ＤＬｅｒ,東京都新宿区西新宿３丁目３番１３号西新宿水間ビル６階,2024-03-01,合同会社
合同会社Ｄｉａｍｏｎｄ,三重県四日市市西浦１丁目７番３号ＧＲＡＮＶＩＡニシウラ２階,2024-03-01,合同会社
合同会社ＦＡＬＦＴ,神奈川県横浜市神奈川区金港町５‐１４クアドリフォリオ８階,2024-03-01,合同会社
合同会社ＦｉｌｏｍｅｎａＡ．Ｃ．,東京都世田谷区梅丘２丁目２６番２号,2024-03-01,合同会社
合同会社Ｆｌｏｕｌｉｓｈ,愛知県春日井市鳥居松町７丁目２０番地１,2024-03-01,合同会社
合同会社ＧＲＡＮＤ　ＪＡＰＡＮ　ＬＥＩＳＵＲＥ,福島県須賀川市館取町８２番地２スズキビル１０３,2024-03-01,合同会社
合同会社ＧＲＩＭＭ,東京都三鷹市深大寺２丁目１５番１３号,2024-03-01,合同会社
合同会社ＨＫＴ９１０,福岡県福岡市南区柏原６丁目６２番１３号,2024-03-01,合同会社
合同会社Ｉ‐Ｓｔｙｌｅ,千葉県浦安市高洲１丁目１番２９－５０１号,2024-03-01,合同会社
合同会社ＩＲＥＮＫＡ,北海道札幌市厚別区厚別東四条７丁目２８番１５号,2024-03-01,合同会社
合同会社Ｊ＆Ｍクリエイト,東京都渋谷区恵比寿西２丁目４番８号ウィンド恵比寿ビル８Ｆ,2024-03-01,合同会社
合同会社ＫＪＦ,大阪府大阪市浪速区湊町１丁目２番１７号ローレルタワー難波３０３号,2024-03-01,合同会社
合同会社ＫＬＴ,神奈川県平塚市八重咲町１９番２５号ヴィラ平塚４０３,2024-03-01,合同会社
合同会社ＬＵＭＩＮＯＵＳ,沖縄県石垣市美崎町１０番地８号Ｋ１ビル２Ｆ,2024-03-01,合同会社
合同会社ＬｅａｒｎＫ,千葉県松戸市小金原５丁目１６番地の１３,2024-03-01,合同会社
合同会社Ｌｉｎｏ,東京都世田谷区赤堤２丁目９番１５号,2024-03-01,合同会社
合同会社Ｌｕｐｉｎａｌ,沖縄県那覇市泉崎１丁目２０番１号,2024-03-01,合同会社
合同会社Ｍｉｙａｂｉ,千葉県千葉市若葉区桜木６丁目１５番２１号桜木ビル２０１,2024-03-01,合同会社
合同会社ＮＩＢＩ,千葉県浦安市当代島３丁目３番１６号,2024-03-01,合同会社
合同会社Ｎｏｉｒ,東京都目黒区下目黒１丁目１－１４コトノラビル７Ｆ,2024-03-01,合同会社
合同会社ＯＧＡＫＥＮ,山口県山口市矢原９３９－２カサヌーボＡ２０２,2024-03-01,合同会社
合同会社ＰＦスピカ,東京都千代田区平河町１丁目６番１５号シルスフィア会計事務所内,2024-03-01,合同会社
合同会社ＰＬＵＣＫ,静岡県磐田市二之宮東１２－９ｍｉｅｌｅ１０２,2024-03-01,合同会社
合同会社ＰＯＮＴＥ,大阪府大阪市福島区野田５丁目１１番１７号,2024-03-01,合同会社
合同会社ＲｅｖｅｌＡｉ,岡山県倉敷市中帯江１７番地の１,2024-03-01,合同会社
合同会社ＳＴコンサルティング,神奈川県横浜市神奈川区松本町１丁目２番３号第２カヤギヤビル１Ｆ,2024-03-01,合同会社
合同会社Ｓａｎｄｉａ,東京都中央区八丁堀４丁目２番１０号ＡＯＪ税理士法人内,2024-03-01,合同会社
合同会社Ｓｈｉｍｏｋｅｎ,広島県廿日市市上平良１６２－１,2024-03-01,合同会社
合同会社ＳｍａｒｔＣｒｅａｔｅ,埼玉県さいたま市西区大字内野本郷４２７番地６,2024-03-01,合同会社
合同会社Ｓｔｒａｄａ,宮城県仙台市青葉区錦ケ丘４丁目２４番地の１０,2024-03-01,合同会社
合同会社ＴＩＧ,東京都豊島区東池袋２丁目３８番４号シティタワー池袋１９０５号室,2024-03-01,合同会社
合同会社ＴＵＲＮ,東京都渋谷区神宮前６丁目２３番４号桑野ビル２階,2024-03-01,合同会社
合同会社ＶＩＳＴＡ,秋田県秋田市仁井田本町１丁目６番３０号２階,2024-03-01,合同会社
合同会社Ｖｏｙａｇｅ　Ｖｉｌｌａｇｅ,群馬県利根郡昭和村大字川額３７１６番地５４７,2024-03-01,合同会社
合同会社ＺＯＮＥ．Ｃ,大阪府大阪市浪速区桜川４丁目１２番２６号８１２号室,2024-03-01,合同会社
合同会社ａ‐ｓｕｐｐｏｒｔ,千葉県千葉市中央区弁天１丁目３－６－１階,2024-03-01,合同会社
合同会社ａＦｒｏｎｔｉｅｒ,北海道札幌市西区平和三条４丁目１‐１９,2024-03-01,合同会社
合同会社ｄｅｎｆｏｒ,富山県富山市太田口通り２丁目２－１６,2024-03-01,合同会社
合同会社ｆｏｒｃｉｘ,東京都新宿区四谷３丁目１３番地ＳＥＡＢＩＲＤビル２階,2024-03-01,合同会社
合同会社ｍｅｗ,神奈川県鎌倉市大町２丁目８番１０－３０２号,2024-03-01,合同会社
合同会社ｎｕｌｌＶｉｓｔａ,神奈川県横浜市西区浅間町１丁目４番３号ウィザードビル４０２,2024-03-01,合同会社
合同会社ｖｉｌｌａ　ｖｉｒｉｄｉ,茨城県取手市戸頭７丁目３－４,2024-03-01,合同会社
國知不動合同会社,沖縄県島尻郡与那原町字板良敷３７０番地知念アパート１０３号,2024-03-01,合同会社
多々良村農業會,福岡県福岡市東区大字津屋１０３２番地の４,2024-03-01,その他の設立登記法人
大木バイオクリエーションズ株式会社,福岡県三潴郡大木町大字三八松４５６番地,2024-03-01,株式会社
大栄工業株式会社,神奈川県横浜市港南区日野３丁目１０番１－２０９号,2024-03-01,株式会社
大連紅島日本株式会社,千葉県柏市今谷南町５番１０号,2024-03-01,株式会社
宮原化成株式会社,埼玉県さいたま市北区宮原町３丁目５８４－３宮原ステーションプラザ３０９,2024-03-01,株式会社
富士芳見商事株式会社,滋賀県大津市坂本８丁目１５番１１号,2024-03-01,株式会社
広尾一般社団法人,東京都千代田区神田小川町３丁目２６番８号神田小川町三丁目ビル６階,2024-03-01,その他の設立登記法人
康年株式会社,東京都新宿区高田馬場４丁目４番１０号コーポラス徳光,2024-03-01,株式会社
慶株式会社,千葉県松戸市松戸１４３４－２リバーシティ松戸３０７号室,2024-03-01,株式会社
敬和株式会社,愛知県一宮市真清田１丁目１－１９,2024-03-01,株式会社
方園株式会社,東京都板橋区仲宿６０－１６林ビル２階,2024-03-01,株式会社
日本マンストテクノロジー株式会社,福島県郡山市八山田西３丁目１０２番地,2024-03-01,株式会社
日本盛庚株式会社,神奈川県横浜市中区相生町４丁目６９－１トーカン馬車道キャステール７０１号室,2024-03-01,株式会社
日本裕和株式会社,大阪府大阪市西成区南津守７丁目８番６号４Ｃ,2024-03-01,株式会社
日本ＩＢ合同会社,新潟県新潟市中央区網川原２丁目３１番１６号,2024-03-01,合同会社
日科株式会社,東京都台東区東上野３丁目１８番１号ＴＨＥＢＬＯＯＭＵＥＮＯ２０５室,2024-03-01,株式会社
日系國際株式会社,東京都足立区中央本町３丁目１２－１－１２０２,2024-03-01,株式会社
日高株式会社,愛知県名古屋市名東区梅森坂西１丁目８０１番地の１４６,2024-03-01,株式会社
春福合同会社,山口県岩国市南岩国町１丁目７番１０－３０６号,2024-03-01,合同会社
有限会社斉藤硝子店,静岡県島田市若松町２４９２番地の２０,2024-03-01,有限会社
望月電気株式会社,神奈川県厚木市山際１４６番地３,2024-03-01,株式会社
東海国際株式会社,東京都台東区台東２丁目３１－１０－１０１号室,2024-03-01,株式会社
栃木商会合同会社,栃木県足利市今福町２９８番１サンシティビルＧＲ１,2024-03-01,合同会社
株式会社あかるいチカラ,神奈川県横浜市金沢区大道１丁目４番１６号,2024-03-01,株式会社
株式会社あにもる,千葉県流山市美田２０６番地の２,2024-03-01,株式会社
株式会社いくのう,福岡県宗像市平等寺前田７１４番１,2024-03-01,株式会社
株式会社きずなグループ空,東京都町田市木曽西３丁目８－４らくりーぶ２１忠生１０４,2024-03-01,株式会社
株式会社さくらい教材,熊本県山鹿市菊鹿町松尾９６番地,2024-03-01,株式会社
株式会社さくらの里八幡平,岩手県八幡平市大更第３１地割４６番地３,2024-03-01,株式会社
株式会社さとるの畑,埼玉県さいたま市浦和区瀬ヶ崎１丁目３３番１９号,2024-03-01,株式会社
株式会社たまきホールディングス,神奈川県横浜市南区山王町３丁目２４番地８港横浜ビル７階,2024-03-01,株式会社
株式会社つくし,東京都新宿区早稲田町７６―１,2024-03-01,株式会社
株式会社はるたいき,石川県金沢市森山１丁目２番１号２２１,2024-03-01,株式会社
