法人名,住所,設立日,法人種別
株式会社ＴＳＫグループ,埼玉県久喜市久喜中央１丁目４番４３号,2017-06-13,株式会社
株式会社ＴＵＧフードアシスト,大阪府大阪市東住吉区今林１丁目２番６８号,2017-06-13,株式会社
株式会社ＵＬＵＣＵＳ,京都府京都市北区紫竹下緑町３１番地２,2017-06-13,株式会社
株式会社ＶＡＮ３４,神奈川県横浜市旭区中白根１丁目２７番１４号,2017-06-13,株式会社
株式会社ＷＩＣＨ,千葉県千葉市中央区新田町５番地１０,2017-06-13,株式会社
株式会社ＷＯＫＳ企画,神奈川県横浜市鶴見区鶴見中央３丁目５番１４号,2017-06-13,株式会社
株式会社ＷＴＤ,群馬県太田市東長岡町１６９１番地１もくすいビルＧＡ２３,2017-06-13,株式会社
株式会社Ｙ　Ｓｔｙｌｅ,神奈川県横浜市西区高島２丁目１１番２号,2017-06-13,株式会社
株式会社Ｙ．ｓセキュリティ,千葉県山武郡横芝光町栗山７３５番地２,2017-06-13,株式会社
株式会社ＹＤＫ,東京都港区六本木７丁目１４番１６号ＦＳビル１階,2017-06-13,株式会社
株式会社ＹＫライオン,大阪府箕面市半町３丁目１３番４号,2017-06-13,株式会社
株式会社ＹＫＫ,東京都世田谷区赤堤２丁目４１番５号,2017-06-13,株式会社
株式会社ＹＭＣ,岐阜県多治見市笠原町３１４６番地の１,2017-06-13,株式会社
株式会社ｃｏｕｎｔ　ｏｎ,東京都港区虎ノ門３丁目８番２５号,2017-06-13,株式会社
株式会社ｆｕｔｕｒｅ,千葉県柏市高田１２７３番地５アビタシオンフーサＤ棟,2017-06-13,株式会社
株式会社ｇｒａｎｄｉｒ,神奈川県横浜市金沢区富岡東５丁目８番５２号,2017-06-13,株式会社
株式会社ｉ－ｓｓ,京都府福知山市字半田７７２番地,2017-06-13,株式会社
株式会社ｉＴＯＮＹ　ＭＡＮＡＧＥＭＥＮＴ,東京都目黒区大橋１丁目３－９フェイスビル４Ｆ,2017-06-13,株式会社
株式会社ｒａｎｔｏｔｓｕｋｉ,栃木県足利市大門通２３８０番地,2017-06-13,株式会社
株式会社ｔｉｌｔｅｄ,長野県北佐久郡軽井沢町大字発地５２２番地１７７,2017-06-13,株式会社
株式会社ｔｒｙ　ｖａｌｕｅ,千葉県柏市高田１２７３番地５アビタシオンフーサＤ棟,2017-06-13,株式会社
株式会社ｕｎｄｅｒ　ｗｏｒｌｄ,愛媛県松山市二番町１丁目１－４,2017-06-13,株式会社
梵天株式会社,岐阜県羽島郡岐南町伏屋３丁目２４１番地,2017-06-13,株式会社
楽遊社エンタープライズ合同会社,千葉県千葉市花見川区幕張本郷２丁目９番１３号ファーストコーポ弐番館３０５号室,2017-06-13,合同会社
橋本工建株式会社,埼玉県入間市大字下藤沢５７９番地１４,2017-06-13,株式会社
永誠株式会社,東京都板橋区大山東町１７番７－６０７号ロイヤル大山,2017-06-13,株式会社
海星空株式会社,東京都杉並区松ノ木１丁目２番４７号,2017-06-13,株式会社
涼風訪問看護ステーション株式会社,沖縄県名護市大西１丁目１番１号１０１号室,2017-06-13,株式会社
瀬戸内・小豆島人財創成協同組合,香川県小豆郡土庄町甲１３１３番地１,2017-06-13,その他の設立登記法人
瀬戸山自治会,鹿児島県肝属郡南大隅町佐多伊座敷３３８３,2017-06-13,その他
熊成開発株式会社,熊本県熊本市西区松尾２丁目４番２４号,2017-06-13,株式会社
特定非営利活動法人いろはリズム,東京都練馬区豊玉南１丁目８番２１－１０５号,2017-06-13,その他の設立登記法人
特定非営利活動法人たんば教育支援機構,兵庫県丹波市山南町南中１１５番地４,2017-06-13,その他の設立登記法人
特定非営利活動法人アジア中小企業協力機構,東京都小平市花小金井南町２丁目８番４号嘉悦大学内黒瀬研究室,2017-06-13,その他の設立登記法人
特定非営利活動法人地域生活支援オレンジねっと,宮城県仙台市泉区南光台南１丁目１番２３号,2017-06-13,その他の設立登記法人
特定非営利活動法人ＡＣＥ　Ｓｐｏｒｔｓ　Ｃｌｕｂ,宮城県仙台市太白区金剛沢２丁目１４番３７号,2017-06-13,その他の設立登記法人
特定非営利活動法人ＮＰＯサポート東大阪,大阪府東大阪市吉田２丁目１番３８号,2017-06-13,その他の設立登記法人
玄通Ｊａｐａｎ　Ｓｕｐｐｌｙ　Ｃｈａｉｎ株式会社,東京都千代田区神田平河町１番地第３東ビル６Ｆ－１８号,2017-06-13,株式会社
玖島産業長崎株式会社,長崎県大村市森園町１５９２番地,2017-06-13,株式会社
田村住建株式会社,福島県田村市船引町船引字新沼９０番地２１,2017-06-13,株式会社
石巻自動車協会,宮城県石巻市双葉町３－２６,2017-06-13,その他
社会福祉法人まつかぜの会,千葉県松戸市緑ケ丘２丁目３４９番地,2017-06-13,その他の設立登記法人
社会福祉法人綾福祉会,沖縄県島尻郡八重瀬町字新城８５７番地,2017-06-13,その他の設立登記法人
神戸国際医療サポート株式会社,兵庫県神戸市垂水区塩屋北町２丁目１５－６,2017-06-13,株式会社
福田湾投資株式会社,東京都新宿区信濃町１２番地１,2017-06-13,株式会社
美健合同会社,鹿児島県鹿屋市川西町４４５２番地２,2017-06-13,合同会社
葛飾土木建築企業組合,東京都葛飾区西水元６丁目２１番１５号,2017-06-13,その他の設立登記法人
蓮實牧場株式会社,栃木県那須塩原市野間７４番地２,2017-06-13,株式会社
藤枝市男女共同参画推進センター運営協議会,静岡県藤枝市駅前２丁目１－５,2017-06-13,その他
蛍雪合同会社,北海道虻田郡倶知安町北七条西２丁目２番地３２,2017-06-13,合同会社
融興商事株式会社,東京都八王子市元横山町２丁目９番１０号,2017-06-13,株式会社
貢商事株式会社,熊本県熊本市北区貢町５３７番地１８,2017-06-13,株式会社
農事組合法人ほんごう農夢,滋賀県東近江市川合町１５７５番地３,2017-06-13,その他の設立登記法人
野向ワールド合同会社,東京都中央区日本橋箱崎町４１番６－５０７号,2017-06-13,合同会社
長野土地開発株式会社,長野県長野市大字鶴賀権堂町２３０９番地,2017-06-13,株式会社
陽翔合同会社,大分県大分市かたしま台１丁目１７番地の１４７,2017-06-13,合同会社
雅株式会社,東京都江戸川区南小岩３丁目２２番２１号,2017-06-13,株式会社
霧洋銀道株式会社,和歌山県橋本市三石台３丁目２６番地の１４,2017-06-13,株式会社
駒工株式会社,三重県員弁郡東員町笹尾西２丁目２９番６,2017-06-13,株式会社
高松市川島土地改良区,香川県高松市川島本町１９１－２,2017-06-13,その他
高田屋株式会社,大分県大分市大手町１丁目１番１５号（スカイコート大手町８０８）,2017-06-13,株式会社
ＡＧインターナショナル株式会社,鹿児島県鹿屋市串良町有里３１６１番地２,2017-06-13,株式会社
ＡＫＡ　Ｈｏｓｐｉｔａｌｉｔｙ合同会社,東京都中央区銀座２丁目１２－５銀座ＮＦビル４Ｆ,2017-06-13,合同会社
Ａｇｉｌｉａｄ　Ｔｅｃｈｎｏｌｏｇｉｅｓ　Ｐｒｉｖａｔｅ　Ｌｉｍｉｔｅｄ,東京都江東区有明３丁目７番２６号Ｂ棟９階,2017-06-13,外国会社等
Ａｉｒ　Ｌｉｆｅ株式会社,沖縄県中頭郡北中城村字熱田２１４番地,2017-06-13,株式会社
Ａｐｐｌｉｅｄ　Ｗｉｎｇ　Ｃｈｕｎ　Ｏｋｉｎａｗａ合同会社,沖縄県浦添市仲間１丁目２番１０－２０５号浦添マンション,2017-06-13,合同会社
ＢｒｉｇｈｔＭｙ株式会社,東京都文京区音羽１丁目８番３－１２０６号,2017-06-13,株式会社
Ｃ．Ｏ．Ｊ株式会社,静岡県浜松市中区幸２丁目４５番３号,2017-06-13,株式会社
ＣＬ　Ｉｎｔｅｒｍｅｄｉａｔｅ　Ｈｏｌｄｉｎｇｓ　Ⅰ　Ｂ．Ｖ．,東京都中央区日本橋本町３丁目３番６号ワカ末ビル７階,2017-06-13,外国会社等
ＣＹＫＴ株式会社,静岡県富士宮市西町２３番１号,2017-06-13,株式会社
Ｃｈａｒｍａｎｔ　Ｉｎｔｅｒｎａｔｉｏｎａｌ株式会社,東京都港区南麻布１丁目５番３１－５０４号,2017-06-13,株式会社
Ｃｌａｙ　Ｈａｎｄｓ株式会社,神奈川県逗子市久木３丁目１４番１３号ハイツウイングＣ号,2017-06-13,株式会社
Ｄｏｏｒ　ｔｏ　Ｄｏｏｒ株式会社,福岡県福岡市中央区荒戸３丁目４番地７８－５０４号,2017-06-13,株式会社
Ｅ－ｂｅ－Ａ株式会社,東京都中央区東日本橋３丁目９番２号サンクビル３Ｆ,2017-06-13,株式会社
Ｅ．ｎ．Ｅ株式会社,愛知県岡崎市稲熊町字５丁目１２１番地２,2017-06-13,株式会社
ＥＣＭＴ合同会社,東京都江東区東陽２丁目３番５－５０５号,2017-06-13,合同会社
ＦＡＲＩＤＡ　ＳＨＯＥＳ　ＰＲＩＶＡＴＥ　ＬＩＭＩＴＥＤ,東京都渋谷区渋谷１丁目１０番地７号,2017-06-13,外国会社等
Ｆｕｌｌ　Ｃｉｒｃｌｅ合同会社,神奈川県横浜市南区六ツ川１丁目６７７番地３９,2017-06-13,合同会社
Ｇ．Ｓ．Ｇ合同会社,東京都品川区西五反田２丁目１３番１プレジデントハイツ五反田５０６号室,2017-06-13,合同会社
ＧＨＩＢＬＩ合同会社,静岡県田方郡函南町丹那１３１６番地の２４７,2017-06-13,合同会社
ＨＡＯＳＵ合同会社,兵庫県神戸市中央区港島中町３丁目２番地の１ポートアイランド団地６６棟８１１号,2017-06-13,合同会社
ＨＡＰＰＹ　ＧＯＬＦ　ＣＯＭＰＡＮＹ　ＬＩＭＩＴＥＤ,,2017-06-13,外国会社等
ＨＴＴ　ＴＲＡＤＩＮＧ株式会社,千葉県野田市木間ケ瀬１４５３番地１,2017-06-13,株式会社
Ｈａｐｐｙ　Ｄｒｉｖｅ株式会社,東京都品川区八潮１丁目１－２八潮中一ビル３０２,2017-06-13,株式会社
ＩＫＳ合同会社,神奈川県横浜市泉区中田南２丁目２３－２７,2017-06-13,合同会社
ＩＮＦＩＮＩＴＹ合同会社,千葉県木更津市請西南２丁目１４番地５,2017-06-13,合同会社
ＪＩＡコンテナファンド株式会社,東京都港区虎ノ門２丁目９番１１号,2017-06-13,株式会社
ＪＬＳ　Ｔｒａｄｉｎｇ合同会社,東京都渋谷区神宮前５丁目３６番２号パンプアップ第二ビル３０１号,2017-06-13,合同会社
ＪＴＣ国際株式会社,大阪府堺市中区福田１４０２番地３,2017-06-13,株式会社
ＫＧ工業株式会社,奈良県橿原市雲梯町５７番地の６,2017-06-13,株式会社
ＫＮＴグループ労働組合連合会,東京都千代田区東神田１丁目７番８号,2017-06-13,その他の設立登記法人
ＫＯＳ株式会社,沖縄県那覇市松山１丁目３３番７号,2017-06-13,株式会社
ＫＵＩＫＥＬ　ＩＮＴＥＲＮＡＴＩＯＮＡＬ株式会社,群馬県館林市東美園町６番地の６,2017-06-13,株式会社
ＫＹＨ株式会社,静岡県静岡市清水区谷田６番１２号,2017-06-13,株式会社
Ｋｉｎｇｓｍａｎ　ｃａｐｉｔａｌ　ｐａｒｔｎｅｒ株式会社,神奈川県川崎市中原区市ノ坪４４９番地３シティタワー武蔵小杉７１２,2017-06-13,株式会社
ＬＡＵＲＥＬ　ＬＯＧＩＳＴＩＣＳ株式会社,福岡県太宰府市都府楼南４丁目１２番５号サンシティ伍番館４号,2017-06-13,株式会社
Ｌｉａｎｄｅ・Ｊ・Ｒ＆Ｄ株式会社,奈良県香芝市瓦口２０１４番地,2017-06-13,株式会社
Ｌｉｎｏ＆Ｍ株式会社,神奈川県川崎市高津区千年新町２０番地５,2017-06-13,株式会社
ＭＦＪ株式会社,群馬県高崎市緑町２丁目７番地２,2017-06-13,株式会社
Ｍａｉｓｏｎ　Ｍｉｓｔｒａｌ　Ｎａｒｒｏｗ　Ｄｅｓｉｇｎ株式会社,東京都中央区新富１丁目９番５号,2017-06-13,株式会社
Ｍａｔａｋｕｌ合同会社,埼玉県川口市上青木２丁目４番１１号レモンビル２Ｆ,2017-06-13,合同会社
Ｍｅｔａｆｉｎｄコンサルティング株式会社,東京都千代田区神田司町２丁目１３番地神田第４アメレックスビル,2017-06-13,株式会社
ＮＰＯ法人むぎの会,大分県大分市かたしま台１丁目１７番地の１４８,2017-06-13,その他の設立登記法人
ＮＰＯ法人認知症予防・生きかた支援センターＨＡＲＵＫＡＺＥ,熊本県熊本市北区貢町１３５番地,2017-06-13,その他の設立登記法人
ＯＭＡ株式会社,栃木県鹿沼市西茂呂２丁目２２番地７,2017-06-13,株式会社
Ｏｎｅ－Ｅ．Ｔ株式会社,岐阜県美濃加茂市加茂野町加茂野５０３番地６,2017-06-13,株式会社
ＯｎｅＳｔｒｅａｍ　Ｎｅｔｗｏｒｋｓ，ＬＬＣ,東京都港区南麻布３丁目１９番２３号オーク南麻布ビル２階,2017-06-13,外国会社等
Ｒ＆Ｖ合同会社,富山県射水市大江１３１３番地,2017-06-13,合同会社
ＳＭＴロジスティクス株式会社,埼玉県戸田市中町２丁目１２番１４号,2017-06-13,株式会社
ＳＵＧＡＲ株式会社,東京都港区北青山３丁目６番地７号,2017-06-13,株式会社
ＳＹＮＡＰＴＥＫ　Ｄｅｅｐ　Ｌｅａｒｎｉｎｇ　Ｓｏｌｕｔｉｏｎｓ合同会社,岐阜県可児市長坂６丁目１８０番地,2017-06-13,合同会社
Ｓｑｕａｒｅｐｏｉｎｔ　Ｏｐｅｒａｔｉｏｎｓ　Ｐｒｉｖａｔｅ　Ｌｉｍｉｔｅｄ,,2017-06-13,外国会社等
Ｓｔａｒｌｉｇｈｔ　Ｇｒｏｕｐ株式会社,東京都豊島区北大塚２丁目１２－８,2017-06-13,株式会社
ＴＡＫアシスタント株式会社,大阪府貝塚市澤５５番地８,2017-06-13,株式会社
ＴＣシステム株式会社,大阪府東大阪市小若江３丁目２番１７号,2017-06-13,株式会社
ＴＮＫ合同会社,千葉県千葉市若葉区貝塚２丁目４－４５－１０１,2017-06-13,合同会社
Ｔｅｃｈ　Ｌａｂｏ株式会社,福岡県福岡市博多区博多駅前２丁目１９番１７号トーカン博多第５ビル３１２号室,2017-06-13,株式会社
ＶＭＶ合同会社,千葉県館山市湊１３６番地の１,2017-06-13,合同会社
ＶＰＣｊａｐａｎ株式会社,東京都千代田区神田錦町２丁目７,2017-06-13,株式会社
Ｖｅｒｓ株式会社,東京都中野区南台４丁目５２番８号,2017-06-13,株式会社
Ｙ．Ｆ株式会社,東京都葛飾区新小岩３丁目４番１６号,2017-06-13,株式会社
ＹＭＤｃｏｎｎｅｃｔｉｏｎ合同会社,千葉県我孫子市湖北台６丁目１０番６号,2017-06-13,合同会社
ＹＯＵＮＧＥＲ７合同会社,東京都千代田区麹町６丁目２番６号,2017-06-13,合同会社
ＹｅｅＰａ株式会社,兵庫県西宮市東町１丁目１２番１号,2017-06-13,株式会社
ｅ－ｈｏｍｅ株式会社,東京都豊島区池袋２丁目１３番４号,2017-06-13,株式会社
ｉＡｇｅｎｃｙ合同会社,大阪府大阪市中央区淡路町３丁目５番１３号創建御堂筋ビル２階,2017-06-13,合同会社
ｍｙｕ株式会社,東京都世田谷区奥沢８丁目２８番１１号,2017-06-13,株式会社
ｚｅｎｍｏｔｏｒ株式会社,東京都港区南青山６丁目７番２号,2017-06-13,株式会社
おひさま進歩１１号株式会社,長野県飯田市馬場町３丁目４１１番地,2017-06-14,株式会社
こどもパソコン教室合同会社,東京都渋谷区神宮前５丁目１９番１号,2017-06-14,合同会社
はりま緑化株式会社,兵庫県姫路市家島町真浦２４５７番地,2017-06-14,株式会社
びわこ食糧検査合同会社,滋賀県近江八幡市浅小井町２１１０番地,2017-06-14,合同会社
アコード株式会社,京都府京都市南区久世上久世町５３０番地１００,2017-06-14,株式会社
アサウィル株式会社,兵庫県川西市久代６丁目２番２－２１６号,2017-06-14,株式会社
アジルジオデザイン株式会社,東京都葛飾区奥戸４丁目２４番１２－９０１号,2017-06-14,株式会社
アトリエプリマＭ＆Ｙ株式会社,神奈川県横浜市中区山下町６０番地１－５０９号室,2017-06-14,株式会社
アメリー株式会社,東京都千代田区神田須田町２丁目２番地５,2017-06-14,株式会社
イデアル株式会社,熊本県熊本市南区城南町舞原３０８番地７,2017-06-14,株式会社
ウェランド株式会社,東京都港区赤坂７丁目３番３７号プラース・カナダ３階,2017-06-14,株式会社
ウルトラハウス合同会社,高知県高知市石立町２１７番地１,2017-06-14,合同会社
エムリアルエステート合同会社,栃木県鹿沼市栄町１丁目１５番地３,2017-06-14,合同会社
エレンデール株式会社,東京都目黒区下目黒２丁目９番２－９０３号,2017-06-14,株式会社
オッチプランニング株式会社,愛知県豊橋市中岩田１丁目１５番地１９,2017-06-14,株式会社
オフィス・レイ合同会社,東京都渋谷区千駄ヶ谷３丁目２２番地１,2017-06-14,合同会社
カシマアセットマネジメント合同会社,東京都品川区北品川１丁目９番７号１０１５,2017-06-14,合同会社
カルモ工業株式会社,兵庫県神戸市長田区苅藻通４丁目５番３号,2017-06-14,株式会社
カワジマキョシ株式会社,千葉県柏市新富町１丁目３番１６シンセイ２号棟２０４,2017-06-14,株式会社
カーシエル株式会社,東京都中央区日本橋３丁目４－１５八重洲ビル５階,2017-06-14,株式会社
ガーデンプランニング合同会社,千葉県銚子市正明寺町１１７番地,2017-06-14,合同会社
グランツ・マシンテクノ株式会社,静岡県沼津市原４０１番地の１２Ａ,2017-06-14,株式会社
ケーエム株式会社,東京都台東区東上野２丁目２番７号渡邉ビル１階,2017-06-14,株式会社
コーヤル光学株式会社,神奈川県横浜市青葉区すすき野１丁目９番地６０,2017-06-14,株式会社
サカイ住研合同会社,滋賀県守山市赤野井町３７４番地,2017-06-14,合同会社
サツキ工業株式会社,広島県福山市春日町５丁目１－１３－６１１,2017-06-14,株式会社
システムクラフト株式会社,熊本県熊本市東区花立３丁目４０番８号,2017-06-14,株式会社
ジェイブック株式会社,東京都港区海岸１丁目１１番１号ニューピア竹芝ノースタワー１４Ｆ,2017-06-14,株式会社
ジェニュイン日本株式会社,東京都港区高輪４丁目８番６号,2017-06-14,株式会社
ジルミナ株式会社,東京都小金井市前原町４丁目１３番３０号,2017-06-14,株式会社
スカイサーチ東日本株式会社,秋田県秋田市寺内字イサノ１０１番地アルファコート３Ｈ,2017-06-14,株式会社
スターボード・ヘルム株式会社,東京都港区南青山２丁目２番１５号ＷｉｎＡｏｙａｍａビルＵＣＦ９階,2017-06-14,株式会社
スプランドゥール株式会社,大阪府大阪市中央区南船場３丁目７番２９号,2017-06-14,株式会社
スマイルエナジー合同会社,神奈川県横浜市青葉区柿の木台４０番地５セピアコート柿の木台２０１,2017-06-14,合同会社
スロウフロウ株式会社,秋田県秋田市八橋本町１丁目２番１４号,2017-06-14,株式会社
セッション株式会社,東京都港区西麻布１丁目２番１２号デュオスカーラ西麻布タワーイースト９０２,2017-06-14,株式会社
チームエス株式会社,宮城県仙台市泉区泉中央１丁目２３番地５号,2017-06-14,株式会社
ツカサ工業合同会社,埼玉県久喜市佐間１０６２番地４,2017-06-14,合同会社
トミートレーディング株式会社,兵庫県三田市ゆりのき台２丁目２６番地１,2017-06-14,株式会社
トリプルアール株式会社,神奈川県川崎市川崎区本町１丁目９番地７三嘉ビル４階,2017-06-14,株式会社
トーキングＪＰ株式会社,東京都港区六本木５丁目１０番３１号,2017-06-14,株式会社
ナチュラルラボラトリー合同会社,岐阜県岐阜市上竹屋町５番地,2017-06-14,合同会社
ハイブリッジ協同組合,埼玉県富士見市鶴瀬東２丁目９番１２号メイプルタウン２３１１号,2017-06-14,その他の設立登記法人
ヒオキトータルサービス合同会社,愛知県春日井市十三塚町３０１６番地３６,2017-06-14,合同会社
ブラザー株式会社,神奈川県横浜市鶴見区尻手１丁目１番１７－３０２号,2017-06-14,株式会社
マイラーメン株式会社,東京都港区南青山３丁目１番５号ら・クラースビル５階,2017-06-14,株式会社
メダティス株式会社,東京都渋谷区恵比寿南１丁目１－１ヒューマックス恵比寿ビル８階,2017-06-14,株式会社
ライフダインフィットネス株式会社,東京都渋谷区神宮前６丁目４番１５号,2017-06-14,株式会社
ライフチャンネル株式会社,兵庫県加古川市加古川町中津２５３番地の８,2017-06-14,株式会社
ローイット株式会社,東京都千代田区神田須田町１丁目２番地７,2017-06-14,株式会社
ワンズイマジネーション株式会社,静岡県浜松市中区富塚町４４０３番地の６,2017-06-14,株式会社
一般社団法人いきいきライフ協会大阪,兵庫県尼崎市南塚口町２丁目６番２７号,2017-06-14,その他の設立登記法人
一般社団法人わくわく人生応援協会,長野県飯田市大門町２６番地,2017-06-14,その他の設立登記法人
一般社団法人コ・クリエーション,神奈川県川崎市幸区北加瀬２丁目１番４３－７１６号,2017-06-14,その他の設立登記法人
一般社団法人ナショナル・ワークアウトアンドコーチング協会,福岡県福岡市南区井尻５丁目２２番１７－３０５号,2017-06-14,その他の設立登記法人
一般社団法人伊平屋島観光協会,沖縄県島尻郡伊平屋村字我喜屋２１７番地２７（伊平屋村産業連携拠点センター内）,2017-06-14,その他の設立登記法人
一般社団法人住宅修繕保険活用推進機構,東京都中央区銀座１丁目１５番７号ＭＡＣビル３Ｆ,2017-06-14,その他の設立登記法人
一般社団法人共同保育所ちろりん村,宮城県仙台市青葉区東勝山１丁目１９番７号,2017-06-14,その他の設立登記法人
一般社団法人副業推進協会,愛知県名古屋市中区丸の内３丁目１７番２８号第２リックスビル４階,2017-06-14,その他の設立登記法人
一般社団法人国際おもてなし芸術教育協会,東京都台東区上野公園１８番７－５０１号,2017-06-14,その他の設立登記法人
一般社団法人岡山ＡＣＬＳ協会,岡山県岡山市中区森下町４番８号,2017-06-14,その他の設立登記法人
一般社団法人日本スポーツケア協会,神奈川県大和市林間２丁目１９番２０号,2017-06-14,その他の設立登記法人
一般社団法人日本筋膜リリース協会,東京都中央区銀座６丁目１３番１６号,2017-06-14,その他の設立登記法人
一般社団法人東洋医学普及開発機構,福岡県福岡市城南区長尾１丁目１７番７号,2017-06-14,その他の設立登記法人
一般社団法人福岡おやじたい,福岡県福岡市中央区那の川２丁目６番４０－７０７号,2017-06-14,その他の設立登記法人
一般社団法人福岡ＳＵＮＳ,福岡県福岡市博多区博多駅南３丁目２番３号,2017-06-14,その他の設立登記法人
一般社団法人ＧＯ　ＯＮ,京都府京都市上京区毘沙門町７５２,2017-06-14,その他の設立登記法人
一般社団法人Ｍ＆Ｓ総合研究所,福岡県福岡市東区多の津４丁目６番１号,2017-06-14,その他の設立登記法人
上甲子園ファクトリー株式会社,兵庫県西宮市上甲子園５丁目８番７号１０３号,2017-06-14,株式会社
両コマース合同会社,東京都新宿区西新宿１丁目２６番２号新宿野村ビルＢ１Ｆ,2017-06-14,合同会社
中村エナジー合同会社,茨城県牛久市刈谷町５丁目４０番地,2017-06-14,合同会社
九思税理士法人,福岡県福岡市南区大橋１丁目１１番１８号小川ビル２階Ａ号室,2017-06-14,その他の設立登記法人
京都ケータリング株式会社,京都府舞鶴市字公文名５７０番地の１,2017-06-14,株式会社
倉岡建装合同会社,熊本県熊本市西区谷尾崎町８５６番地１,2017-06-14,合同会社
全日青森不動産事業協同組合,青森県青森市長島４丁目１番５号,2017-06-14,その他の設立登記法人
再生エネルギー株式会社,栃木県宇都宮市上田原町１１８７番地,2017-06-14,株式会社
