法人名,住所,設立日,法人種別
かなとみらい企画合同会社,香川県高松市寿町２丁目２－１０高松寿町プライムビル４Ｆ,2024-06-03,合同会社
ふじサンエネルギー合同会社,東京都千代田区富士見２丁目１０番２号,2024-06-03,合同会社
アイ・エヌ・シー合同会社,京都府京都市中京区壬生賀陽御所町４２－１２,2024-06-03,合同会社
アサヒ機装ホールディングス株式会社,東京都港区高輪３丁目２４番１６号,2024-06-03,株式会社
アジャイルパートナーズ株式会社,岡山県岡山市北区惣爪１８３番地,2024-06-03,株式会社
アニマライズ・ジャパン合同会社,東京都品川区東大井３丁目８番１２号ディームス大井町フォレスト４０２,2024-06-03,合同会社
イラスト・狩り合同会社,長野県上田市天神４丁目３番１２号,2024-06-03,合同会社
イント＆ピコ株式会社,千葉県印西市原３丁目２番７３５号,2024-06-03,株式会社
ウインググループホールディングス株式会社,愛知県東海市大田町畑間７１番地１,2024-06-03,株式会社
エヌ．エム．ティ株式会社,東京都八王子市上野町１０－２,2024-06-03,株式会社
エムエムｔｅｃ合同会社,兵庫県神戸市西区二ツ屋２丁目４番１５号,2024-06-03,合同会社
エムケーデータソリューション合同会社,神奈川県相模原市南区新磯野４丁目２番３号４０５号室,2024-06-03,合同会社
オクシリアイランドフェリー株式会社,北海道奥尻郡奥尻町字奥尻３０９番地先,2024-06-03,株式会社
コスモ商事株式会社,大阪府堺市堺区市之町東２丁２番２３号,2024-06-03,株式会社
コダイコーヒー株式会社,大阪府豊中市本町４丁目６－３９,2024-06-03,株式会社
コマドリ協同組合,栃木県小山市東城南４丁目９番地３,2024-06-03,その他の設立登記法人
シスルオント株式会社,神奈川県三浦郡葉山町堀内１１７３番地の１ファミール葉山シーガレリア５０５号,2024-06-03,株式会社
シンテック株式会社,茨城県筑西市甲７８６番地６,2024-06-03,株式会社
ジャストワールドズ合同会社,熊本県熊本市南区良町１丁目１番３７‐２号,2024-06-03,合同会社
タズシステム合同会社,東京都中央区銀座７丁目１３番３０号,2024-06-03,合同会社
ダット・コンサルティング株式会社,東京都港区北青山１丁目３番１号アールキューブ青山３階,2024-06-03,株式会社
トクテック株式会社,神奈川県川崎市川崎区池上新町２丁目１０番１７号ルシェル２０１,2024-06-03,株式会社
ニューパスコンサルティング株式会社,兵庫県神戸市中央区熊内町５丁目１２番１８号,2024-06-03,株式会社
プロスペリタス合同会社,東京都中央区湊３丁目１７番８―４１１号,2024-06-03,合同会社
ホログラム合同会社,岐阜県岐阜市三田洞東２丁目７番１０号,2024-06-03,合同会社
メリーテックス株式会社,東京都港区南青山１丁目１番１号,2024-06-03,株式会社
ユニオン住研株式会社,大阪府大阪市北区樋之口町３番１２号,2024-06-03,株式会社
ユニファースト株式会社,兵庫県姫路市飾磨区清水２丁目５岩崎ビル３Ｆ中,2024-06-03,株式会社
ライフケアホールディングス株式会社,東京都港区三田５丁目４番４号リッツ三田１Ｆ,2024-06-03,株式会社
ランドユーズ合同会社,鳥取県米子市葭津１５０８－７,2024-06-03,合同会社
リアライズ株式会社,滋賀県大津市大将軍３丁目６－６－１０１号,2024-06-03,株式会社
リアラブル株式会社,東京都台東区池之端３丁目３番９号,2024-06-03,株式会社
レミーホールディングス株式会社,新潟県新発田市富塚町３丁目２８８番地６,2024-06-03,株式会社
一般社団法人ぐんま未来企画,群馬県みどり市大間々町大間々１０１０番地３,2024-06-03,その他の設立登記法人
一般社団法人七星,大阪府大阪市鶴見区焼野２丁目南６番７号３階,2024-06-03,その他の設立登記法人
一般社団法人中華美食文化促進会,東京都新宿区百人町１丁目１８－１０第２林ビル４階,2024-06-03,その他の設立登記法人
一般社団法人事業創発研究会ＤｉｇｉＢｉｚみやぎ,宮城県仙台市青葉区大町１丁目３番２号,2024-06-03,その他の設立登記法人
一般社団法人大阪菓子会館,大阪府大阪市西区北堀江１丁目２３番７号,2024-06-03,その他の設立登記法人
一般社団法人慶留間島教育振興センター,沖縄県島尻郡座間味村字慶留間２６番地,2024-06-03,その他の設立登記法人
一般社団法人日本こどもの才能発見協会,兵庫県神戸市中央区磯辺通１丁目１番１８号カサベラ国際プラザビル７０７号室,2024-06-03,その他の設立登記法人
一般社団法人日本人口減対策機構,岐阜県岐阜市岩田西１丁目８０５,2024-06-03,その他の設立登記法人
一般社団法人東名防潮水門管理組合,宮城県東松島市牛網字上西５５番地３,2024-06-03,その他の設立登記法人
一般社団法人津軽パワー,東京都港区元赤坂１丁目１番８号赤坂コミュニティビル４階,2024-06-03,その他の設立登記法人
一般社団法人特殊車両推進協議会,東京都江戸川区南葛西３丁目１０番１５号マンションカネイ４０３号室,2024-06-03,その他の設立登記法人
一般社団法人英気の泉,愛知県名古屋市中村区菊水町１丁目２番１８号,2024-06-03,その他の設立登記法人
一般社団法人Ｍａｋａｎａ　ｐｒｏｄｕｃｅ,東京都町田市南成瀬６丁目８番地５東芳ハイツ３－１,2024-06-03,その他の設立登記法人
一般社団法人Ｎメディカル,大阪府大阪市西区西本町２丁目５番１１号５階,2024-06-03,その他の設立登記法人
一般社団法人ＮＮＫ,福岡県福岡市西区小戸１丁目１９番１－Ａ－２０１号,2024-06-03,その他の設立登記法人
一般社団法人Ｓｐｏｒｔｓ　Ｌｉｆｅ　Ａｌｌｉａｎｃｅ,栃木県宇都宮市二荒町５番７号,2024-06-03,その他の設立登記法人
七福株式会社,福岡県福岡市中央区大名２丁目１２番１５号赤坂セブンビル８Ｆ,2024-06-03,株式会社
三森不動産株式会社,山梨県甲府市朝日２丁目５番１３号,2024-06-03,株式会社
三田理化ホールディングス株式会社,大阪府大阪市北区大淀中２丁目８番２号,2024-06-03,株式会社
上大岡第一町内会,神奈川県横浜市港南区上大岡西１丁目１３－１２,2024-06-03,その他
九州アジアワーク協同組合,長崎県長崎市田中町７９番地５６,2024-06-03,その他の設立登記法人
信環境株式会社,東京都杉並区下井草２丁目１０番２２号,2024-06-03,株式会社
倍安来日本株式会社,東京都北区浮間１丁目１番１４号リムジンビル３２８,2024-06-03,株式会社
北沢技研株式会社,神奈川県横浜市青葉区青葉台１丁目１９番地２７,2024-06-03,株式会社
千爾株式会社,大阪府大阪市中央区本町橋６番２１－３０５号,2024-06-03,株式会社
合同会社いここい,北海道小樽市信香町４番６号,2024-06-03,合同会社
合同会社いその屋,東京都江戸川区東松本２丁目７番８号,2024-06-03,合同会社
合同会社みこえ,兵庫県神戸市北区幸陽町１丁目１８番地エスペランス幸陽台７１３号,2024-06-03,合同会社
合同会社よしみい,千葉県我孫子市青山台１丁目７番１３－１号,2024-06-03,合同会社
合同会社アンダンティーノ,東京都大田区下丸子４丁目２７番３－９０１号,2024-06-03,合同会社
合同会社ウェブミー,大阪府大阪市北区梅田１丁目２番２号大阪駅前第２ビル１２‐１２,2024-06-03,合同会社
合同会社エクセンド,福岡県福岡市博多区博多駅前１丁目２３番２号ＰａｒｋＦｒｏｎｔ博多駅前１丁目５Ｆ－Ｂ,2024-06-03,合同会社
合同会社エムワイエンジニアリング,山口県下関市垢田町２丁目１番１８号,2024-06-03,合同会社
合同会社クリューソス,神奈川県川崎市幸区小倉１番地１パークシティ新川崎Ｅ－３０７,2024-06-03,合同会社
合同会社クレア,東京都八王子市小宮町１１７０－１マンションさつき野４０３号,2024-06-03,合同会社
合同会社ケイドットエス,東京都杉並区久我山２丁目１７－３,2024-06-03,合同会社
合同会社ケンシン,大阪府枚方市片鉾東町２３番２３号,2024-06-03,合同会社
合同会社シュパーズ,北海道札幌市中央区南七条西４丁目４２４－１２すすきのプラザビル８０７,2024-06-03,合同会社
合同会社ターンアラウンド,宮城県仙台市青葉区荒巻本沢３丁目２‐１,2024-06-03,合同会社
合同会社パレット,広島県尾道市天満町７番３号,2024-06-03,合同会社
合同会社フィル,千葉県浦安市北栄１丁目１１－１１－２０１,2024-06-03,合同会社
合同会社フラットプレイス,神奈川県川崎市宮前区平４丁目１番５号,2024-06-03,合同会社
合同会社プログレス,東京都渋谷区渋谷２丁目１９‐１５宮益坂ビルディング６０９,2024-06-03,合同会社
合同会社ミルアセットマネジメント,神奈川県横浜市西区宮ケ谷２５番地１パークスクエア三ツ沢公園Ｂ３１３号,2024-06-03,合同会社
合同会社リベライズ,大阪府松原市立部１丁目１２１番地の３６,2024-06-03,合同会社
合同会社リーブルポン,神奈川県横浜市港北区新横浜３丁目２０－３,2024-06-03,合同会社
合同会社ワンフォオール,大分県宇佐市大字住江６３５番地の１５６,2024-06-03,合同会社
合同会社一五,福岡県遠賀郡岡垣町中央台４丁目７－１４,2024-06-03,合同会社
合同会社井上カンリ代行,愛知県岩倉市八剱町城屋敷３４０５番地６,2024-06-03,合同会社
合同会社優,福岡県福岡市西区愛宕浜２丁目３番３号,2024-06-03,合同会社
合同会社匠堂本舗,岡山県赤磐市桜が丘東４丁目４－４０,2024-06-03,合同会社
合同会社徳人,三重県津市白塚町４６０８‐１２,2024-06-03,合同会社
合同会社折笠,東京都江戸川区江戸川５丁目４０番地１３ＳＴＨＯＭＥＢ－１,2024-06-03,合同会社
合同会社新川崎ＤＣ,東京都千代田区丸の内３丁目１番１号東京共同会計事務所内,2024-06-03,合同会社
合同会社武藏建築,神奈川県相模原市南区相武台２丁目２３番１８－５号,2024-06-03,合同会社
合同会社沖縄ミライ,沖縄県那覇市辻２丁目４－１５ピュアインビル７０３,2024-06-03,合同会社
合同会社細美創,福岡県福岡市中央区薬院２丁目５－４２－９０１号,2024-06-03,合同会社
合同会社近畿総合リサイクル,大阪府大阪市生野区新今里２丁目１１番１２号カルム今里１階,2024-06-03,合同会社
合同会社隆法堂,福岡県糟屋郡篠栗町大字尾仲３４１番地２８,2024-06-03,合同会社
合同会社ＡＱｃｅｌｌ,大阪府茨木市庄２丁目１７,2024-06-03,合同会社
合同会社Ａｆｆｅｃｔ,長野県松本市中央１丁目４－２酒楽ビル１階,2024-06-03,合同会社
合同会社ＡｙＵＮｇ,北海道札幌市南区真駒内本町６丁目２番１号,2024-06-03,合同会社
合同会社ＣＳＲ,北海道室蘭市中島町１丁目２３－１０ＡＨＳビル１階,2024-06-03,合同会社
合同会社ＣＹＣＬＥＲ,愛知県名古屋市中川区八熊２丁目１６番１５号,2024-06-03,合同会社
合同会社ＤＡＴＥ,大阪府大阪市中央区上本町西２丁目１番４号,2024-06-03,合同会社
合同会社ＥＴＥＲＮＡＬ,沖縄県島尻郡与那原町字与那原１２８２番地の６,2024-06-03,合同会社
合同会社ＥＹＥＬＯＶＥ,茨城県鉾田市鉾田２５９５番地１１,2024-06-03,合同会社
合同会社ＪＯＹ　ＦＡＣＴＯＲＹ,三重県津市乙部２１‐２５‐１０５,2024-06-03,合同会社
合同会社ＫＤＢ,東京都調布市柴崎１丁目５０番地４,2024-06-03,合同会社
合同会社ＫＳＤ,千葉県千葉市花見川区瑞穂１丁目１０－１１ハイブリッジＢ２０４,2024-06-03,合同会社
合同会社ＫＹＵ,岐阜県羽島市正木町森１４丁目１５番地,2024-06-03,合同会社
合同会社Ｋａｉｍａｎａ,沖縄県宮古島市平良字久貝２４８番地９,2024-06-03,合同会社
合同会社ＬＧ　Ｃｏｒｐｏｒａｔｉｏｎ,愛知県丹羽郡大口町上小口１丁目６０番地２,2024-06-03,合同会社
合同会社Ｌａ　Ｆｉｎ,大阪府大阪市北区梅田１丁目２番２号大阪駅前第２ビル１２－１２,2024-06-03,合同会社
合同会社Ｌｕｃｉｄａ　Ｃｏｎｓｕｌｔｉｎｇ,東京都渋谷区恵比寿西２丁目８番４号ＥＸ恵比寿西ビル５階,2024-06-03,合同会社
合同会社ＭＴＢ,東京都町田市山崎町２９５番地１２,2024-06-03,合同会社
合同会社Ｍａｖｅｒｉｃｋ,大阪府大阪市北区梅田２丁目５番１３号桜橋第一ビル３０４号,2024-06-03,合同会社
合同会社Ｍｌｉｅｒ,埼玉県和光市丸山台２丁目１７番４号,2024-06-03,合同会社
合同会社Ｍｙコーポレーション,大阪府高槻市中川町４番１２号,2024-06-03,合同会社
合同会社ＮＡＩＮＳ,愛知県岩倉市南新町三反田９８４－３６,2024-06-03,合同会社
合同会社Ｎａｔｈｔｈａｎｄｉｇｅ　Ｉｎｔｅｒｎａｔｉｏｎａｌ,東京都墨田区立花４丁目１９番２号,2024-06-03,合同会社
合同会社Ｎｏｂｌｅ　Ｇｒｏｕｐ,千葉県我孫子市都１７番地１,2024-06-03,合同会社
合同会社Ｒ９,東京都江戸川区平井６丁目４－２,2024-06-03,合同会社
合同会社ＳＨＵＢＩ,大分県佐伯市直川大字横川２４８６番地,2024-06-03,合同会社
合同会社Ｓｔｅｌｌａ,北海道札幌市東区北三十条東１丁目２番１１号,2024-06-03,合同会社
合同会社ＴＮＣ,熊本県八代市鏡町貝洲３０６番地４,2024-06-03,合同会社
合同会社ＴＷＥＬＶＥ,埼玉県所沢市大字山口９９２番地の２,2024-06-03,合同会社
合同会社Ｔｚ,静岡県浜松市中央区幸１丁目１１番１１号,2024-06-03,合同会社
合同会社ＵＮＬＩＭＩＴＥＤ,北海道札幌市東区北二十二条東１０丁目３番１２号,2024-06-03,合同会社
合同会社ｅｓｐｏｉｒ,神奈川県横浜市西区みなとみらい５丁目３番２－２００５号,2024-06-03,合同会社
合同会社ｆｅｒｔｉｌｅ,東京都中央区銀座７丁目１５－８タウンハイツ銀座４０６,2024-06-03,合同会社
合同会社ｋａ‐ｓａ,福井県鯖江市柳町４丁目１１－１８メイプルＩ．２０４,2024-06-03,合同会社
合同会社ｌｉｎｅｎ,大阪府大阪市北区山崎町１－１３ＩＢビル２階,2024-06-03,合同会社
合同会社ｍｅｎ,東京都千代田区六番町７―１１,2024-06-03,合同会社
合同会社ｒａｒｅ．,静岡県静岡市駿河区大和１丁目１－１９ロイヤルマンション大和町３０８号,2024-06-03,合同会社
合同会社ｓｅｓａｍｅ,神奈川県横浜市鶴見区尻手１丁目７－９－１１２,2024-06-03,合同会社
合同会社ｓｕｄｄａｉｓ　ｅｎｔｅｒｐｒｉｓｅｓ,茨城県結城市大字結城字塔ノ下町７４８番６の１,2024-06-03,合同会社
合同会社ｔａｌｔｏ,東京都目黒区下目黒１丁目１番１４号コノトラビル７Ｆ,2024-06-03,合同会社
合資会社カネチョウ,東京都板橋区志村２丁目８番１号,2024-06-03,合資会社
吉幸林株式会社,東京都港区港南４丁目６番７号,2024-06-03,株式会社
君禾株式会社,大阪府大阪市港区市岡３丁目１３番９号藤原文化２０２Ａ,2024-06-03,株式会社
家族味株式会社,兵庫県神戸市中央区中山手通３丁目４番２－５０１号,2024-06-03,株式会社
富億株式会社,神奈川県横浜市中区山下町１６４番地,2024-06-03,株式会社
寧楽醗酵株式会社,奈良県天理市柳本町１４０６番地柳本マンション２０４号室,2024-06-03,株式会社
寺村商事株式会社,京都府木津川市山城町綺田渡戸２７番地,2024-06-03,株式会社
小山一花株式会社,愛知県名古屋市中区錦２丁目１６番４号,2024-06-03,株式会社
弁護士法人あきつゆ,愛知県名古屋市東区武平町５丁目１番名古屋栄ビルディング,2024-06-03,その他の設立登記法人
文太郎ソリューションズ株式会社,京都府京都市右京区西院日照町１１２サーパスシティ西院日照町５０７,2024-06-03,株式会社
文瑄合同会社,大阪府大阪市東淀川区西淡路１丁目１－９ビジネス新大阪５２１号室,2024-06-03,合同会社
新浜株式会社,愛媛県新居浜市繁本町１－８,2024-06-03,株式会社
日本卓越精機ベアリング製造株式会社,東京都台東区清川１丁目２１－５ＷＡＬＬａｐａｒｔｍｅｎｔ５階大区画号室,2024-06-03,株式会社
日本総合リサイクル合同会社,神奈川県横浜市西区北幸２丁目１０番４８号むつみビル３階,2024-06-03,合同会社
明心合同会社,千葉県松戸市新松戸１丁目８７番地セザール新松戸３０２号,2024-06-03,合同会社
星優蜜株式会社,東京都杉並区井草２丁目２番５‐１０９号,2024-06-03,株式会社
智控日本株式会社,東京都台東区台東１丁目２４番９号ブライト秋葉原Ｂ１Ｆ,2024-06-03,株式会社
月と風の森株式会社,福岡県福岡市博多区東月隈４丁目２番１０号,2024-06-03,株式会社
株式会社あい和商事,奈良県香芝市良福寺１４５番地１,2024-06-03,株式会社
株式会社いろはカンパニー,沖縄県うるま市字赤道６８６番地８,2024-06-03,株式会社
株式会社おのさかん,秋田県雄勝郡羽後町西馬音内字中野１９番地１３,2024-06-03,株式会社
株式会社こもれび,兵庫県神戸市須磨区高倉台５丁目１２番１９号,2024-06-03,株式会社
株式会社どんぐりふぁーむ,和歌山県伊都郡かつらぎ町大字星山２９２番地,2024-06-03,株式会社
株式会社はじめ商店,宮崎県串間市大字奈留５１７１番地,2024-06-03,株式会社
株式会社まのね,東京都稲城市平尾２丁目１００－１１,2024-06-03,株式会社
株式会社まるごーとナーシング,新潟県南魚沼市塩沢８６２－８,2024-06-03,株式会社
株式会社みつき,広島県広島市南区大州２丁目１０番１２号,2024-06-03,株式会社
株式会社みらいえ不動産,静岡県浜松市中央区和田町７５番地の２ビジネスパーク和田５号,2024-06-03,株式会社
株式会社わいわい,秋田県秋田市中通６丁目１２番１３号,2024-06-03,株式会社
株式会社アイナハレ沖縄,沖縄県中頭郡北中城村字島袋１４３３番地１,2024-06-03,株式会社
株式会社アスイロ,大阪府大阪市北区梅田１丁目１３番１号大阪梅田ツインタワーズ・サウス１５階,2024-06-03,株式会社
株式会社アルクスィエル,大分県大分市大字葛木３１９番地の８,2024-06-03,株式会社
株式会社アーク,東京都中央区湊３丁目５番１０号,2024-06-03,株式会社
株式会社エイチ・ワイ・エイ,栃木県宇都宮市上戸祭町７６番地１３,2024-06-03,株式会社
株式会社エスコネクト,鹿児島県鹿児島市加治屋町８－１６－７０１,2024-06-03,株式会社
株式会社エルイーツー,京都府京都市伏見区深草西浦町８丁目１１３西陣ビル４階,2024-06-03,株式会社
株式会社オフィスさんなっぷ,岡山県倉敷市児島駅前１丁目４６番地,2024-06-03,株式会社
株式会社カインドコラボ,京都府京都市上京区左馬松町７９２番地１,2024-06-03,株式会社
株式会社キッズネクスト,千葉県千葉市美浜区真砂４丁目３番５号,2024-06-03,株式会社
株式会社キャンバスペイント,和歌山県岩出市安上６６番地の１,2024-06-03,株式会社
株式会社クラップボルデ,東京都千代田区丸の内２丁目２番１号岸本ビルヂング６階,2024-06-03,株式会社
株式会社グラン,東京都台東区駒形１丁目７番１１号東武浅草駒形ビル６Ｆ,2024-06-03,株式会社
株式会社グローバルコミュニケーションデザイン,岡山県岡山市北区出石町１丁目７番７号,2024-06-03,株式会社
株式会社ココロザシ,熊本県八代市高島町４１６７番地１（Ⅱ１０３）,2024-06-03,株式会社
株式会社サニー,沖縄県中頭郡西原町字幸地９９５－７,2024-06-03,株式会社
株式会社サンネックス,佐賀県伊万里市新天町２８４番地３,2024-06-03,株式会社
株式会社シェフテリエ,東京都港区南青山１丁目１５－９,2024-06-03,株式会社
株式会社シビルサポート,福岡県福岡市東区香椎２丁目２３番１－１０５号ＪＧＭヴェルデガーデン香椎の杜,2024-06-03,株式会社
株式会社ジョイミール,大分県大分市大字上宗方１０６１－２－２ＦＮ,2024-06-03,株式会社
株式会社スリーエス,埼玉県ふじみ野市亀久保３丁目５番３７号,2024-06-03,株式会社
株式会社セティレ,東京都国分寺市東元町３丁目３４番１０号Ｐ・Ａ国分寺Ⅱ２１２,2024-06-03,株式会社
株式会社セブンズノース,大阪府大阪市阿倍野区西田辺町１丁目４番２１－５０３号,2024-06-03,株式会社
株式会社セーフプラス,山梨県甲府市下石田２丁目１０－４,2024-06-03,株式会社
株式会社ゼニス,大阪府高槻市真上町２丁目１番３１号,2024-06-03,株式会社
株式会社チーム・ジエイシイケイ,東京都小金井市梶野町１丁目２番３６号,2024-06-03,株式会社
株式会社テクノアロウ,愛知県小牧市若草町１９０番地,2024-06-03,株式会社
株式会社デリ・アートフルライフ,東京都千代田区神田錦町３番１５名鉄不動産竹橋ビル３Ｆ,2024-06-03,株式会社
株式会社トシオオタニ,東京都港区南青山３丁目１番３６号青山丸竹ビル６Ｆ,2024-06-03,株式会社
株式会社トップステップ,東京都港区南青山３丁目１－３６青山丸竹ビル６Ｆ,2024-06-03,株式会社
株式会社ネクストクリエイションズ,埼玉県志木市中宗岡３丁目４番１号,2024-06-03,株式会社
株式会社ノベルフーズ,神奈川県横浜市神奈川区山内町１番地,2024-06-03,株式会社
株式会社ハッピーブルー,大阪府吹田市江坂町１丁目１７番１２－８０４号,2024-06-03,株式会社
株式会社パラソル総研,東京都千代田区岩本町２丁目１番９－１４０１号,2024-06-03,株式会社
株式会社ヒライ,千葉県市川市曽谷６丁目２５－２６,2024-06-03,株式会社
株式会社ヒロオ,京都府宇治市明星町２丁目３番地の１８,2024-06-03,株式会社
株式会社ビッグラック,香川県高松市百間町９番地１５,2024-06-03,株式会社
株式会社ファイン住設,千葉県東金市求名１１７番地１,2024-06-03,株式会社
株式会社プロジェクトメンターコンサルティング,茨城県ひたちなか市大字市毛９３５番地１７,2024-06-03,株式会社
株式会社ベルズ,熊本県熊本市中央区下通１丁目９番１４号,2024-06-03,株式会社
株式会社ベレット,東京都江東区深川２丁目２６番３号－４０３,2024-06-03,株式会社
株式会社マウント富士運搬,山梨県富士吉田市上吉田７丁目１３番１５号,2024-06-03,株式会社
株式会社マーケティングハイランズ,大阪府大阪市中央区日本橋１丁目１８番１号,2024-06-03,株式会社
株式会社ムービーズ,石川県金沢市角間町ヌ７番地,2024-06-03,株式会社
株式会社メモリアル西伊豆,静岡県賀茂郡西伊豆町田子１７７０番地の１,2024-06-03,株式会社
株式会社モリデン,広島県広島市中区吉島新町１丁目１番１号,2024-06-03,株式会社
株式会社ヤマダワークス,愛知県名古屋市中区大須３丁目１４番地３６号,2024-06-03,株式会社
株式会社ユウダイ,沖縄県宜野湾市大山５丁目１番１２号１０１号石川貸店舗,2024-06-03,株式会社
株式会社ラブリエ,愛知県名古屋市中区丸の内３丁目２２番１１号,2024-06-03,株式会社
株式会社リナジー,東京都港区北青山１丁目３番１号アールキューブ青山３階,2024-06-03,株式会社
株式会社レイ,大阪府大阪市阿倍野区阿倍野筋１丁目１番４３号あべのハルカス３１Ｆ,2024-06-03,株式会社
