法人名,住所,設立日,法人種別
株式会社ＰＧＦ　ｌａｂ,東京都千代田区神田練塀町３富士ソフト秋葉原ビル１２Ｆ,2017-02-20,株式会社
株式会社ＲＥＧＯＬＩＴＨ,高知県高知市長浜５２５５番地３,2017-02-20,株式会社
株式会社ＲＩＦＥＮ,千葉県香取郡多古町十余三３４５番地６,2017-02-20,株式会社
株式会社ＲＫコーポレーション,東京都西東京市ひばりが丘北３丁目５番２２号野島第一ビルＢ１,2017-02-20,株式会社
株式会社ＳＣＮＥＴ,兵庫県神戸市中央区神若通６丁目２番６号,2017-02-20,株式会社
株式会社ＳＣＲＥＥＮ,兵庫県神戸市中央区三宮町３丁目５番２号,2017-02-20,株式会社
株式会社ＳＴＵＤＩＯ　ＣＡＲＩＮＧ,東京都渋谷区渋谷３丁目７番３号第一野口ビルＢ１Ｆ,2017-02-20,株式会社
株式会社ＳｔｙｌｅＬｉｆｅ,東京都豊島区駒込３丁目８番８号,2017-02-20,株式会社
株式会社Ｔ’ｓ,埼玉県さいたま市大宮区桜木町２丁目５４７番地１,2017-02-20,株式会社
株式会社Ｔ＆Ｙ,長野県千曲市大字新山７４８番地,2017-02-20,株式会社
株式会社ＴＭＴシステム,富山県高岡市横田２３６番地１０,2017-02-20,株式会社
株式会社ＴＲＩＨ　ＬＩＧＨＴ,福岡県福岡市東区香椎照葉３丁目２番７－１５０７号,2017-02-20,株式会社
株式会社ＴＳＩ,大阪府東大阪市出雲井町２番１７号,2017-02-20,株式会社
株式会社ＴｂＲ,愛媛県松山市桑原５丁目６番３４号,2017-02-20,株式会社
株式会社Ｔｈｒｅｅ　Ｐｅａｃｅ,鹿児島県鹿児島市荒田２丁目４２番１５号,2017-02-20,株式会社
株式会社Ｔｉａｒａ,広島県福山市新涯町２丁目３番１５号ディオポルテ２０８,2017-02-20,株式会社
株式会社ＵＮ,東京都中央区勝どき５丁目３番１号,2017-02-20,株式会社
株式会社ＶＥＲＤＥ,広島県広島市佐伯区千同２丁目６番５－９号,2017-02-20,株式会社
株式会社ＶＥＲＯ,兵庫県神戸市中央区元町通１丁目４番１２号ＭＩＳＸ４０２号,2017-02-20,株式会社
株式会社ＶＩＳＩＴＵＳ,東京都目黒区碑文谷３丁目１３番１４号,2017-02-20,株式会社
株式会社ＷＡＶＥ５,東京都港区六本木５丁目１６番１号,2017-02-20,株式会社
株式会社Ｙ’ｓ　Ｃｏｍｐａｎｙ,愛知県小牧市小牧４丁目３７０番地,2017-02-20,株式会社
株式会社ＹＡＳＵＢＥ,岐阜県揖斐郡揖斐川町上南方４０６番地,2017-02-20,株式会社
株式会社ａｉｒ,熊本県宇土市築籠町１０１番地８,2017-02-20,株式会社
株式会社ｅｃｌａｔ　ｖｉｆ,大阪府大阪市北区中津１丁目６番２９号ザ・セントラルマークタワー３３１５,2017-02-20,株式会社
株式会社ｍｏｎｏ,東京都港区虎ノ門１丁目１６番６号,2017-02-20,株式会社
株式会社ｖｅｒｔｅｘ,沖縄県南城市知念字知念４２８番地７,2017-02-20,株式会社
梅乃屋コーポレーション株式会社,大分県豊後大野市三重町市場１６０６番地１,2017-02-20,株式会社
梅九造園株式会社,神奈川県川崎市麻生区細山８丁目１７番１８号－１０２,2017-02-20,株式会社
楪園芸株式会社,福島県郡山市田村町川曲字牛骨５０番地,2017-02-20,株式会社
渡部石油株式会社,愛知県名古屋市天白区植田３丁目１８２４番地,2017-02-20,株式会社
温泉ぱん・リテール株式会社,栃木県さくら市早乙女９５番地６,2017-02-20,株式会社
滋賀移住・交流促進協議会,滋賀県大津市京町４丁目１番１号,2017-02-20,その他
特定非営利活動法人かわさき市民共同おひさまプロジェクト,神奈川県川崎市多摩区登戸新町１８２番地２シーズガーデン登戸新町４０１,2017-02-20,その他の設立登記法人
特定非営利活動法人まなびとくらし,神奈川県横浜市神奈川区三ツ沢下町２６番４号,2017-02-20,その他の設立登記法人
特定非営利活動法人仏教災害支援ネットワーク,大阪府大阪市天王寺区夕陽丘町１－１８梅旧院内,2017-02-20,その他の設立登記法人
特定非営利活動法人全国もったいない市場,大阪府大阪市北区大淀中２丁目２番１号,2017-02-20,その他の設立登記法人
特定非営利活動法人地域持続研究所,千葉県千葉市稲毛区弥生町１番３３号千葉大学人文社会科学系総合研究棟,2017-02-20,その他の設立登記法人
特定非営利活動法人府中フットボールアカデミー,東京都府中市新町１丁目３８番地の５,2017-02-20,その他の設立登記法人
特定非営利活動法人日本マーケットプロジェクト,東京都港区西麻布４丁目７番１０号麻布笄町Ａハウス１０１,2017-02-20,その他の設立登記法人
特定非営利活動法人日本似顔絵アーティスト協会,東京都台東区浅草１丁目１０番２号ＹＳ－１ビル３階,2017-02-20,その他の設立登記法人
特定非営利活動法人水力発電推進隊,長野県松本市寿北７丁目６番Ｑ－１０３号市営住宅,2017-02-20,その他の設立登記法人
特定非営利活動法人若年者の学びと就業を支援する会,北海道札幌市中央区南十三条西１０丁目２番１６－４０３号,2017-02-20,その他の設立登記法人
特許業務法人平木国際特許事務所,東京都港区愛宕２丁目５番１号愛宕グリーンヒルズＭＯＲＩタワー３２階,2017-02-20,その他の設立登記法人
環境サミット株式会社,東京都品川区東五反田１丁目７番１１号－５１０号,2017-02-20,株式会社
皓軒株式会社,大阪府大阪市此花区梅香３丁目３２番１号,2017-02-20,株式会社
矢掛高校実践研究実行委員会,岡山県小田郡矢掛町矢掛１７７６－２矢掛高校　内,2017-02-20,その他
碩品株式会社,京都府京都市中京区夷川通東洞院東入山中町５４０番地,2017-02-20,株式会社
福井・永平寺周遊滞在型観光推進計画策定委員会,福井県福井市大手３丁目１０－１おもてなし観光推進課内,2017-02-20,その他
福井県高等学校定時制通信制教育振興会連合会,福井県福井市若杉町３５－２１道守高校内,2017-02-20,その他
笑顔国際貿易合同会社,東京都豊島区千早３丁目３０番２号アーバンヒルズ千早町１０３,2017-02-20,合同会社
結城紬海外展開推進協議会,茨城県結城市大字結城１２－２,2017-02-20,その他
総検校塙保己一先生遺徳顕彰会,埼玉県本庄市児玉町金屋７２８－２,2017-02-20,その他
西武キャピタル合同会社,東京都渋谷区恵比寿西２丁目１９番９号,2017-02-20,合同会社
辰冉株式会社,東京都台東区上野６丁目７番１６号,2017-02-20,株式会社
農事組合法人高口,秋田県横手市平鹿町下吉田字高口東９番地,2017-02-20,その他の設立登記法人
金松左官株式会社,沖縄県うるま市字豊原３３０番地１,2017-02-20,株式会社
額縁のフレハン株式会社,栃木県足利市常見町１丁目２番地１１,2017-02-20,株式会社
１０２Ｃｏｎｄｕｃｔ＆Ｒｅｓｅａｒｃｈ　ＬＡＢ合同会社,東京都西東京市北町５丁目１２番３２号ソラージュＭ１０２号,2017-02-20,合同会社
ＡＫＪ合同会社,千葉県松戸市新作１３４番地５－１－１２０１,2017-02-20,合同会社
ＡＵＴＵＭＮ　ＥＮＴＥＲＰＲＩＳＥ株式会社,大阪府大阪市東成区中道２丁目２５番１５号,2017-02-20,株式会社
ＢＬＥＳＳ建築設計合同会社,栃木県小山市東城南４丁目６番２号シャトーグランチェスタ２０３号室,2017-02-20,合同会社
Ｂｅｅ　Ｍｅｄｉａ合同会社,千葉県市川市市川南３丁目１２番Ｃ－２２０５号,2017-02-20,合同会社
ＣＫＨコンサルティング　リミテッド,,2017-02-20,外国会社等
ＣＯＭＭＯＮ　ＳＥＮＳＥ　ＭＡＴＳＵＭＯＴＯ合同会社,長野県松本市本庄１丁目６番４－３０１号,2017-02-20,合同会社
Ｃｈｒｉｓｔｉｅ　Ｉｎｔｅｒｎａｔｉｏｎａｌ株式会社,大阪府大阪市中央区博労町４丁目２番８号,2017-02-20,株式会社
ＤｉＧｉＹａ合同会社,北海道札幌市手稲区富丘六条４丁目９番１６号,2017-02-20,合同会社
ＥＩＧＨＴＲＥＥ合同会社,東京都中央区八丁堀１丁目８番３号仁成堂ビル３０２号室,2017-02-20,合同会社
ＥＸＰＯＲＴ　ＪＡＰＡＮ　ＴＲＡＤＩＮＧ合同会社,栃木県足利市葉鹿南町３番地１ドーム２１葉鹿Ｂ２０２,2017-02-20,合同会社
ＦＯＲＴＵＮＥ・ＵＬＴＲＡ合同会社,東京都港区浜松町１丁目２７番９号,2017-02-20,合同会社
ＦＰプラティーノ合同会社,北海道札幌市北区新琴似十一条４丁目３番１７号,2017-02-20,合同会社
Ｇｏｄ　Ｃｈｏｓｅｎ合同会社,埼玉県春日部市大字備後町西４－５－２３－２０２,2017-02-20,合同会社
ＨＡＰＰＯ　ＯＮＥ　ＩＮＶＥＳＴＭＥＮＴＳ　ＰＴＹ　ＬＴＤ,長野県北安曇郡白馬村大字北城４９８０－１３,2017-02-20,外国会社等
Ｈｉ．Ｐｉｇｇｙ株式会社,東京都豊島区南大塚１丁目３１番１４号２０３室,2017-02-20,株式会社
ＪＡＰＡＮ　ＷＨＥＥＬＳ　ＥＮＴＥＲＰＲＩＳＥＳ　ＰＲＩＶＡＴＥ　ＬＩＭＩＴＥＤ,埼玉県羽生市大字今泉５４４,2017-02-20,外国会社等
Ｊｉｍｍｙ　Ｏｒａｎｇｅ株式会社,福岡県福岡市中央区天神３丁目６番２４号,2017-02-20,株式会社
ＫＣＥ　ＥＬＥＣＴＲＯＮＩＣＳ　ＰＵＢＬＩＣ　ＣＯＭＰＡＮＹ　ＬＩＭＩＴＥＤ,東京都文京区後楽１丁目２－９,2017-02-20,外国会社等
ＫＪＡＭ合同会社,茨城県稲敷郡美浦村大字信太５９０番地１０,2017-02-20,合同会社
ＫＫＢ株式会社,大阪府大阪市北区梅田２丁目２番２号ヒルトンプラザウエストオフィスタワー１８階,2017-02-20,株式会社
ＭＡＲＯＯ企画株式会社,東京都新宿区新宿５丁目４－１新宿Ｑフラットビル３０７号,2017-02-20,外国会社等
ＭＧＦ合同会社,神奈川県横浜市鶴見区尻手１丁目１番１６－４４５号,2017-02-20,合同会社
ＭＯＫ．Ａ合同会社,東京都目黒区上目黒３丁目３５番１２号レインボーヒルズ２０１,2017-02-20,合同会社
Ｍｅｒ　Ｍｅｃ　Ｊａｐａｎ合同会社,東京都港区南麻布３丁目１９番２３号オーク南麻布ビル２階,2017-02-20,合同会社
ＮＰＣ株式会社,兵庫県神戸市中央区栄町通４丁目４－３－６０４,2017-02-20,株式会社
ＯＦＦＩＣＥ　ＮＯＷ　ＦＩＥＬＤ合同会社,東京都新宿区市谷砂土原町３丁目８－４０ＴＯＰ市ヶ谷３０５号,2017-02-20,合同会社
ＰＥ　Ｓａｋｕｔｏ　Ｌａｎｄ，ＬＬＣ,,2017-02-20,外国会社等
ＰＰＦＡ　Ｊａｐａｎ　Ｐｒｅｆ　Ｉｎｖｅｓｔｏｒ　Ｐｔｅ．Ｌｔｄ．,,2017-02-20,外国会社等
ＰＳＹＧＩＧ株式会社,東京都品川区北品川１丁目２番１３号八ツ山ニューハイツ２０３,2017-02-20,株式会社
ＲＩＣＨ　ＦＯＣＵＳ　ＴＲＡＤＩＮＧ　ＬＩＭＩＴＥＤ,神奈川県横浜市中区花咲町１丁目４６番地,2017-02-20,外国会社等
ＲＩＸＥＲ株式会社,大阪府寝屋川市高柳５丁目１６番５号デュポール辻１Ｆ,2017-02-20,株式会社
ＲｉＯＳ株式会社,東京都豊島区西池袋５丁目２番１２号サンＳＴＫ２階,2017-02-20,株式会社
ＲｉｎＺ株式会社,大阪府河内長野市喜多町１１１番１号,2017-02-20,株式会社
Ｓｃｈｗａｃｋ　Ｐｔｙ　Ｌｔｄ,北海道虻田郡倶知安町字山田１７０番地２３８,2017-02-20,外国会社等
ＳｉｔｅＪｏｕｒｎａｌ合同会社,東京都中央区日本橋大伝馬町１３番７号日本橋大富ビル２階,2017-02-20,合同会社
Ｓｏｌａｃｅ　Ｃｏｒｐｏｒａｔｉｏｎ,,2017-02-20,外国会社等
Ｓｔｒｉｎｇ　Ｆｕｒｎｉｔｕｒｅ株式会社,東京都渋谷区東３丁目２０－１・ｂ－ｆｌａｔ・４ｆ,2017-02-20,株式会社
ＴＭＣ株式会社,大阪府大阪市阿倍野区阪南町６丁目８番２５号,2017-02-20,株式会社
ＴＲＡＮ　ＧＩＡ株式会社,東京都世田谷区祖師谷５丁目２２番３号,2017-02-20,株式会社
Ｕｐｌｏａｄ　Ｊａｐａｎ株式会社,東京都渋谷区宇田川町３６番６号,2017-02-20,株式会社
Ｗｈｉｔｅｒｏｏｍ　Ｉｎｖｅｓｔｍｅｎｔｓ　Ｐｔｙ　Ｌｔｄ,北海道虻田郡倶知安町字山田１７０番地２３８,2017-02-20,外国会社等
ｕｎｋｎｏｗｎ　ｗｏｒｌｄ合同会社,東京都中央区銀座７丁目１３番６号サガミビル２階,2017-02-20,合同会社
いわて家電事業協同組合,岩手県一関市山目字十二神１４５番地２,2017-02-21,その他の設立登記法人
よしこ三輝合同会社,群馬県高崎市上小鳥町３７６番地５,2017-02-21,合同会社
アイブリング株式会社,大阪府大阪市西区北堀江１丁目５番１３号,2017-02-21,株式会社
アサイラム株式会社,神奈川県小田原市蓮正寺３０８番地,2017-02-21,株式会社
アジア人財サービス株式会社,大阪府大阪市西淀川区大和田３丁目３番１号,2017-02-21,株式会社
アップルゴールド株式会社,東京都渋谷区恵比寿４丁目１０番１３－２０７号,2017-02-21,株式会社
アビームアーチ合同会社,静岡県浜松市北区三ヶ日町大崎１５５６番地,2017-02-21,合同会社
アフィン合同会社,熊本県熊本市南区出仲間４丁目３－２８,2017-02-21,合同会社
アンサーテック株式会社,大阪府豊中市三和町２丁目２番３６－６０５号,2017-02-21,株式会社
ウィルフラップ合同会社,千葉県市川市大和田５丁目１番１２－２０１号（プレールＫ）,2017-02-21,合同会社
エイチアイケーサービス合同会社,東京都文京区小石川５丁目３４番１０号,2017-02-21,合同会社
エイチエー株式会社,東京都豊島区東池袋１丁目３３番３号,2017-02-21,株式会社
エフイーエスエス株式会社,千葉県市川市妙典１丁目５番６号,2017-02-21,株式会社
エンブテック株式会社,島根県松江市八束町波入２４３４番地１,2017-02-21,株式会社
カインドケア株式会社,富山県富山市中島２丁目１番３５号,2017-02-21,株式会社
キャリアフィットエムエス株式会社,北海道札幌市中央区南一条東２丁目３番地２,2017-02-21,株式会社
グリーンインベストメンツ合同会社,東京都港区六本木１丁目６番１号泉ガーデンタワー,2017-02-21,合同会社
サンライトガーデン株式会社,愛知県名古屋市天白区島田黒石５０３番地,2017-02-21,株式会社
システム企画ＢＵ合同会社,東京都東久留米市中央町５丁目１番２号,2017-02-21,合同会社
シンクリッチ株式会社,東京都渋谷区千駄ヶ谷２丁目９番６号Ｂａｒｂｉｚｏｎ３－２０４,2017-02-21,株式会社
ジャックス東住吉合同会社,大阪府大阪市東住吉区住道矢田５丁目６番１号,2017-02-21,合同会社
ジャパングッズ株式会社,東京都新宿区富久町１－５富久町第５服部ビル９Ｆ,2017-02-21,株式会社
ジャムワークス株式会社,東京都日野市新町１丁目６番地の１９,2017-02-21,株式会社
ジョインペイント株式会社,埼玉県狭山市大字北入曽７００番地の３農住メゾンプレミールＡ－１０２,2017-02-21,株式会社
スカイドリーム合同会社,東京都荒川区東尾久１丁目２５番１３号,2017-02-21,合同会社
ステップフォワード合同会社,大阪府大阪市此花区朝日２丁目１８番８号３階３１２,2017-02-21,合同会社
セーフラン安全用品株式会社,大阪府大阪市住之江区南港北２丁目１－１０ＡＴＣビル,2017-02-21,株式会社
タケ・サイト株式会社,静岡県静岡市駿河区敷地１丁目３番３５号,2017-02-21,株式会社
ダイユウ建設株式会社,茨城県結城市大字田間１４５４番地２,2017-02-21,株式会社
チームビルディングス株式会社,千葉県船橋市習志野２丁目８番３３号,2017-02-21,株式会社
テイワイエス不動産株式会社,東京都板橋区小豆沢２丁目２４番９号,2017-02-21,株式会社
デンカ・キュー・ジェノミクス合同会社,東京都中央区日本橋室町２丁目１番１号,2017-02-21,合同会社
ニシネス合同会社,千葉県四街道市旭ケ丘１丁目１７番６号,2017-02-21,合同会社
ハクスイ株式会社,鳥取県西伯郡伯耆町白水２０４番地１,2017-02-21,株式会社
ハロースタイル株式会社,大阪府大阪市北区堂島浜２丁目２番２８号,2017-02-21,株式会社
バープロトーキョー株式会社,東京都新宿区天神町６４番地神楽坂アトリエ６４・４Ｆ,2017-02-21,株式会社
ヒノメル株式会社,東京都渋谷区円山町３－５道玄坂ＳＳＤビル３Ｆ,2017-02-21,株式会社
ビースレッド合同会社,神奈川県大和市下鶴間１６０３番地１６,2017-02-21,合同会社
フロンティア・プレイス合同会社,大阪府大阪市西区南堀江３丁目１６番４－２０３号,2017-02-21,合同会社
ブラックホールコーヒー合同会社,東京都荒川区町屋４丁目３１番１１号,2017-02-21,合同会社
プリンチペッサ合同会社,東京都台東区蔵前３丁目１７番３号ＳＩビル８０１,2017-02-21,合同会社
マリーン企画株式会社,熊本県八代市松崎町２７番地１５,2017-02-21,株式会社
ライドサービス株式会社,大阪府大阪市旭区中宮３丁目１番２３号,2017-02-21,株式会社
リアルワールドゲームス株式会社,東京都中央区日本橋箱崎町５番１５号５階,2017-02-21,株式会社
ロジソリューション株式会社,長崎県長崎市伊勢町２番３０－３０２号,2017-02-21,株式会社
一般社団法人つくし,福島県郡山市亀田１丁目１５番１３号,2017-02-21,その他の設立登記法人
一般社団法人ひとまちプロジェクト,大阪府堺市北区野遠町１９２番地３１,2017-02-21,その他の設立登記法人
一般社団法人アイコン,東京都港区新橋４丁目３０番６号京急中はらビル５階,2017-02-21,その他の設立登記法人
一般社団法人アセットファイナンス東神奈川,東京都千代田区神田神保町３丁目５番地,2017-02-21,その他の設立登記法人
一般社団法人ウィーアーワン北上,宮城県石巻市北上町十三浜字丸山３７番地１,2017-02-21,その他の設立登記法人
一般社団法人ハビットカウンセラー協会,東京都墨田区菊川１丁目１３番８号,2017-02-21,その他の設立登記法人
一般社団法人ビジネスマン結婚協会,兵庫県芦屋市大原町八丁目２番ラ・フォーネ芦屋２階,2017-02-21,その他の設立登記法人
一般社団法人ヘイゼル,東京都港区新橋４丁目３０番６号京急中はらビル５階,2017-02-21,その他の設立登記法人
一般社団法人中津燎子の英語未来塾,東京都杉並区荻窪５丁目１６番１２－２０２号,2017-02-21,その他の設立登記法人
一般社団法人人民日報海外網日本新聞ネット留学生支援会,東京都台東区東上野１丁目１７番２号第２江口ビル３階,2017-02-21,その他の設立登記法人
一般社団法人命の薬ＮＵＣＨＩＧＵＳＵＩ機構,東京都港区赤坂９丁目１番７号赤坂レジデンシャル５１３,2017-02-21,その他の設立登記法人
一般社団法人国際アクティブエイジング協会,東京都大田区西蒲田６丁目１４番１８号,2017-02-21,その他の設立登記法人
一般社団法人大阪府建物管理協力グループ,大阪府大阪市北区松ケ枝町１番３９号東天満エンビィビル,2017-02-21,その他の設立登記法人
一般社団法人子ども健康政策研究所,東京都中央区東日本橋２丁目２１番３号,2017-02-21,その他の設立登記法人
一般社団法人東日本原木しいたけ協会,茨城県古河市上大野５１３番地５,2017-02-21,その他の設立登記法人
一般社団法人極真武道空手連盟極真拳武曾,東京都大田区蒲田１丁目１８番１０号フォレストヒルズ１Ｆ,2017-02-21,その他の設立登記法人
一般社団法人米国アンチエイジング医学会,東京都港区虎ノ門２丁目７番１６号エグゼクティブタワー虎ノ門７０４,2017-02-21,その他の設立登記法人
一般社団法人背骨管理士協会,東京都中央区銀座３丁目１１番１７－２０１,2017-02-21,その他の設立登記法人
一般社団法人西岡ＨＣ１号,東京都港区元赤坂１丁目１番８号赤坂コミュニティビル４階,2017-02-21,その他の設立登記法人
一般社団法人鉄砲町ホテル開発,東京都港区元赤坂１丁目１番７号,2017-02-21,その他の設立登記法人
一般社団法人長崎環境まちづくり社中,長崎県長崎市竹の久保町２０番９号２Ｆ,2017-02-21,その他の設立登記法人
一般社団法人ＦＫＤ＆Ｓ,東京都千代田区紀尾井町４番３,2017-02-21,その他の設立登記法人
一般社団法人ＮＡＯＭＩ音楽家育成フォーラム,東京都港区南麻布４丁目１２番２５号南麻布セントレ,2017-02-21,その他の設立登記法人
一般社団法人Ｎｅｘｔ　Ｃｏｍｍｏｎｓ　Ｌａｂ,東京都港区赤坂１丁目９番１３号三会堂ビルディング,2017-02-21,その他の設立登記法人
七田総合研究所株式会社,東京都品川区大崎５丁目５番３－１００３号,2017-02-21,株式会社
三穂商事合資会社,福島県いわき市平字八幡小路６６番地,2017-02-21,合資会社
中屋合資会社,福島県いわき市仁井田町寺前５２番地,2017-02-21,合資会社
中根運送合資会社,福島県いわき市植田町金畑１２番地,2017-02-21,合資会社
丸一磐城運送合資会社,福島県いわき市平字南町６８番地,2017-02-21,合資会社
丸和商店合同会社,群馬県伊勢崎市宮子町３５７４番地４ラ・グラシューズＢ１０２,2017-02-21,合同会社
乾産業合資会社,福島県いわき市平字搔槌小路１番地,2017-02-21,合資会社
仮想通貨投資合同会社,東京都千代田区九段北１丁目１５番１４号,2017-02-21,合同会社
保証責任中通負債整理組合,佐賀県嬉野市塩田町大字久間丙２４３３番地,2017-02-21,その他の設立登記法人
保証責任堤之上負債整理組合,佐賀県嬉野市塩田町大字久間丙４３４４番地,2017-02-21,その他の設立登記法人
創誠建設合同会社,福岡県北九州市八幡西区町上津役西１丁目３番７号,2017-02-21,合同会社
勿来丸通自動車合資会社,福島県いわき市勿来町関田北作２７番地,2017-02-21,合資会社
医療法人社団中村歯科医院,島根県出雲市今市町北本町１丁目７番１５号,2017-02-21,その他の設立登記法人
医療法人翠珠会,大阪府池田市菅原町３番１－３０３号,2017-02-21,その他の設立登記法人
千葉組合資会社,福島県いわき市三沢町堂平１２番地,2017-02-21,合資会社
博展株式会社,栃木県鹿沼市楡木町５１８番地,2017-02-21,株式会社
双湖事業化計画合同会社,島根県松江市朝日町４６０番地１０,2017-02-21,合同会社
合同会社やまねこ不動産,福岡県糸島市高田１丁目１６番１２号,2017-02-21,合同会社
合同会社アクアテック,東京都墨田区墨田５丁目９番３号,2017-02-21,合同会社
合同会社アル・ハーディ,北海道札幌市東区北二十条東１４丁目４番８－２０６号,2017-02-21,合同会社
合同会社イゾラグランデＡ,東京都江東区豊洲５丁目６番２９－２１０号,2017-02-21,合同会社
合同会社ウキグモ,神奈川県茅ヶ崎市十間坂１丁目１番２３号,2017-02-21,合同会社
合同会社エイチアイシー,東京都世田谷区駒沢４丁目１１番２―３１１号,2017-02-21,合同会社
合同会社エーシーエース,福岡県大川市大字幡保７２番地２,2017-02-21,合同会社
合同会社カインドネス,東京都港区虎ノ門１丁目１６番６号ＵＣＦ７０３,2017-02-21,合同会社
合同会社カサノヴァ,愛知県北名古屋市鹿田花の木５０番地１,2017-02-21,合同会社
合同会社サニービレッジ,千葉県船橋市湊町２丁目１２番２４号湊町日本橋ビル６Ｆ,2017-02-21,合同会社
合同会社スクエア,東京都町田市原町田６丁目２７番１６号,2017-02-21,合同会社
