法人名,住所,設立日,法人種別
合同会社晟,岩手県盛岡市津志田南２丁目１１番４８号,2018-02-07,合同会社
合同会社暖家,福岡県大牟田市上官町４丁目１３６番地１,2018-02-07,合同会社
合同会社本所管理,東京都墨田区本所３丁目１９番９号,2018-02-07,合同会社
合同会社洋陽,埼玉県川口市中青木３丁目９番２－５０９号青木町ハイツ,2018-02-07,合同会社
合同会社珠玉,沖縄県名護市東江３丁目２０番２１号,2018-02-07,合同会社
合同会社琢琉,沖縄県石垣市字大浜２８６番地,2018-02-07,合同会社
合同会社福天,神奈川県厚木市下荻野３７２番地１仲居ハイツ２０２号室,2018-02-07,合同会社
合同会社結心,岩手県奥州市水沢区字川端１７４番地３,2018-02-07,合同会社
合同会社繊維革新技術研究所,大阪府大阪市北区茶屋町８番２１－７０３号,2018-02-07,合同会社
合同会社美咲グループ,千葉県香取市北２丁目１１番地５,2018-02-07,合同会社
合同会社至誠舎,群馬県邑楽郡大泉町大字古氷７１８番地の１０,2018-02-07,合同会社
合同会社輝,東京都千代田区九段南１丁目５番６号りそな九段ビル５Ｆ,2018-02-07,合同会社
合同会社道の郷,長野県中野市大字大俣１４９番地,2018-02-07,合同会社
合同会社野崎商店,徳島県阿波市阿波町善地８５番地１,2018-02-07,合同会社
合同会社鎌倉Ｓｅｃｒｅｔ　Ｂａｓｅ,神奈川県鎌倉市材木座５丁目８番１８号リディア２０３号,2018-02-07,合同会社
合同会社順天,静岡県湖西市古見１１９２番地,2018-02-07,合同会社
合同会社飛鳥,埼玉県さいたま市浦和区岸町４丁目１０番１６号,2018-02-07,合同会社
合同会社８ｗｏｒｋｓ,東京都板橋区成増２丁目１７番３６号コウワ成増ビル６０１,2018-02-07,合同会社
合同会社ＡＫラボ,千葉県千葉市稲毛区作草部町８１８番地３,2018-02-07,合同会社
合同会社ＢＴＳ,東京都世田谷区代田４丁目６－５ＴＳ代田１０６,2018-02-07,合同会社
合同会社Ｂｏｏ,千葉県船橋市本中山２丁目２２番７号中山コーポ１０３,2018-02-07,合同会社
合同会社Ｃ．Ｆ．Ｓ．,東京都中央区築地６丁目１９番２１号ニチレイ東銀座レジデンス１８０７号室,2018-02-07,合同会社
合同会社ＣＨＡＩＮ,熊本県熊本市南区近見２丁目１６番２８号,2018-02-07,合同会社
合同会社Ｃｏｎｎｅｃｔｌｅａｐ,徳島県阿南市内原町中分７４番地,2018-02-07,合同会社
合同会社ＤＡＩＭＯＮリサーチ,埼玉県さいたま市緑区大字大門１７３４番地１,2018-02-07,合同会社
合同会社ＦＳ,東京都千代田区丸の内３丁目１番１号東京共同会計事務所内,2018-02-07,合同会社
合同会社ＧＲＩＴ,大分県大分市都町１丁目１番２３号,2018-02-07,合同会社
合同会社Ｇｉｒｌａｎｄ,東京都中央区月島３丁目１３番１０号,2018-02-07,合同会社
合同会社ＨＮＨ,広島県広島市中区舟入本町１番１４－１５０６号,2018-02-07,合同会社
合同会社ＨａＭｏｎＤ,兵庫県姫路市飾磨区阿成渡場２６６番地,2018-02-07,合同会社
合同会社ＪＯＢマスター,沖縄県那覇市字識名１２５３番地９,2018-02-07,合同会社
合同会社ＬＡＦＡＥＲＯ１,埼玉県羽生市大字下岩瀬３６３－５,2018-02-07,合同会社
合同会社ＭＡＣＹ,東京都港区港南４丁目６番８－３１０５号,2018-02-07,合同会社
合同会社ＭＹＧＫ１号,東京都千代田区丸の内３丁目１番１号東京共同会計事務所内,2018-02-07,合同会社
合同会社ＭＹＧＫ２号,東京都千代田区丸の内３丁目１番１号東京共同会計事務所内,2018-02-07,合同会社
合同会社ＯＴＡ,熊本県菊池郡菊陽町沖野３丁目１番１２号,2018-02-07,合同会社
合同会社ＰＯエステート,東京都品川区北品川１丁目９番７号トップルーム品川１０１５号,2018-02-07,合同会社
合同会社Ｐｉｒａｎｈａ,沖縄県国頭郡恩納村字名嘉真２２８８番地５３２,2018-02-07,合同会社
合同会社Ｒｅｘｔ滝越,長野県木曽郡王滝村５００５番地５,2018-02-07,合同会社
合同会社ＲｏｙａｌＢｏｎｄ,栃木県宇都宮市御幸ケ原町６５番地１１,2018-02-07,合同会社
合同会社ＳＡＳＰＯＭ,鳥取県鳥取市中町３２番地,2018-02-07,合同会社
合同会社ＳＩＭＣ,東京都千代田区二番町１番地６ザ・サンメゾン二番町エルド２０２号室,2018-02-07,合同会社
合同会社ＳＰＣＡ１,東京都千代田区麹町３丁目４番地,2018-02-07,合同会社
合同会社ＳＰＮＹ１,東京都千代田区麹町３丁目４番地,2018-02-07,合同会社
合同会社ＳＳＲ,東京都墨田区墨田２丁目４１番１５号,2018-02-07,合同会社
合同会社Ｔ－Ａｐｐｌｉｃａｔｉｏｎ　ｗｏｒｋｓ,埼玉県和光市白子３丁目２６番３９号,2018-02-07,合同会社
合同会社ＴＣＮ,東京都新宿区歌舞伎町２丁目２０－１０Ｊビル２Ｆ,2018-02-07,合同会社
合同会社ＴＫ＆Ａｓｓｏｃｉａｔｅｏ,神奈川県鎌倉市扇ガ谷２丁目１７番１２号,2018-02-07,合同会社
合同会社ＴＮファミリー,東京都世田谷区等々力２丁目１８番１１号,2018-02-07,合同会社
合同会社Ｕ＆Ｋ,千葉県船橋市薬円台１丁目２７番２１号,2018-02-07,合同会社
合同会社ＹＧＣ　Ｊａｐａｎ,東京都世田谷区玉川田園調布２丁目４番１号レイズ田園調布メゾン２０２,2018-02-07,合同会社
合同会社ＹＴＰ,広島県三原市宮沖５丁目６番１５号,2018-02-07,合同会社
合同会社ｎｉｘ,埼玉県川口市幸町２丁目１５－２,2018-02-07,合同会社
合名会社百福,福岡県行橋市大字宮市５１番地７,2018-02-07,合名会社
大喜工業株式会社,沖縄県沖縄市泡瀬２丁目９番２０号,2018-02-07,株式会社
奥野株式会社,大阪府茨木市舟木町７番２５号,2018-02-07,株式会社
富船プロパティー１合同会社,東京都千代田区丸の内２丁目１番１号,2018-02-07,合同会社
富船プロパティー２合同会社,東京都千代田区丸の内２丁目１番１号,2018-02-07,合同会社
富船マネージメント合同会社,東京都千代田区丸の内２丁目１番１号,2018-02-07,合同会社
小林さく井株式会社,千葉県四街道市亀崎１４０９番地,2018-02-07,株式会社
岡山ホンダ販売株式会社,岡山県岡山市南区当新田８９番地５,2018-02-07,株式会社
弁護士法人みらい,東京都千代田区麹町２丁目３番地麹町プレイス２階,2018-02-07,その他の設立登記法人
弁護士法人ガーディアン法律事務所,東京都国分寺市南町３丁目２２番１２号マーベラス国分寺Ⅱ,2018-02-07,その他の設立登記法人
弁護士法人村上・久保法律事務所,北海道札幌市中央区北一条西１５丁目１番地３大通ハイム５０３,2018-02-07,その他の設立登記法人
愛知オートトレーディング株式会社,愛知県あま市七宝町川部折戸４７番地,2018-02-07,株式会社
新宅建設株式会社,福岡県福岡市早良区田隈１丁目２９番１号,2018-02-07,株式会社
日光Ｐｌｕｓ７ホールディング合同会社,東京都千代田区丸の内３丁目１番１号東京共同会計事務所内,2018-02-07,合同会社
日光Ｐｌｕｓ７合同会社１,東京都千代田区丸の内３丁目１番１号東京共同会計事務所内,2018-02-07,合同会社
日商トラスト株式会社,埼玉県川口市北原台３丁目３番２９号１階,2018-02-07,株式会社
日本橋コンサルティング株式会社,東京都中央区日本橋本町２丁目６番７－１４０１号,2018-02-07,株式会社
明成合同会社,埼玉県川越市霞ケ関東２丁目１４－７ベルピア霞が関第一２０４,2018-02-07,合同会社
晶順美国際貿易株式会社,東京都立川市錦町３丁目１番３号２０３室,2018-02-07,株式会社
東京亜当商務投資合同会社,東京都中野区中央３丁目２６番１号アーバンプレイスＶ坂上Ｂ号棟１０１,2018-02-07,合同会社
株式会社あかりえむ,長崎県長崎市本原町２５番３号,2018-02-07,株式会社
株式会社えにし,福岡県福岡市中央区白金１丁目１番３－６０６号,2018-02-07,株式会社
株式会社ここ,千葉県銚子市上野町２１７番地の７７,2018-02-07,株式会社
株式会社しゅうとう,東京都千代田区丸の内１丁目１１番１号パシフィックセンチュリープレイス丸の内８階,2018-02-07,株式会社
株式会社じぶんラボ,東京都千代田区神田神保町１丁目２番１０号第三日東ビル４Ｆ,2018-02-07,株式会社
株式会社すまいる,千葉県八千代市大和田新田１５番地高津団地１街区６棟５０５号,2018-02-07,株式会社
株式会社てとり,北海道札幌市東区伏古九条４丁目５番７号,2018-02-07,株式会社
株式会社ぱすてる,東京都町田市木曽東２丁目１１番４１－３０１号,2018-02-07,株式会社
株式会社ひらの測量,東京都国立市青柳２丁目１９番地の１１,2018-02-07,株式会社
株式会社ふくせんか,福岡県うきは市浮羽町古川１０９９番地８,2018-02-07,株式会社
株式会社ほけんプラス,岡山県瀬戸内市長船町福里９２番地,2018-02-07,株式会社
株式会社まちといえ,香川県高松市鶴市町２０３４番地１０５,2018-02-07,株式会社
株式会社みなとビルヂング,東京都世田谷区若林４丁目２１番１５号,2018-02-07,株式会社
株式会社みんなの会社,栃木県大田原市若草１丁目７６１番地４,2018-02-07,株式会社
株式会社めるかど,福岡県北九州市小倉北区魚町４丁目４番２１号,2018-02-07,株式会社
株式会社る・る・ル,福岡県田川市大字夏吉３３４９番地６,2018-02-07,株式会社
株式会社アイフィールド,岡山県津山市二宮１５９０番地８,2018-02-07,株式会社
株式会社アクラス,静岡県静岡市清水区高橋３丁目９番５号,2018-02-07,株式会社
株式会社アグロスラボラトリー,東京都新宿区中里町３１番地サガミヤビル７階,2018-02-07,株式会社
株式会社アステリア,青森県八戸市南類家３丁目１番２１号,2018-02-07,株式会社
株式会社アセットコア,埼玉県幸手市中３丁目１７番２４号,2018-02-07,株式会社
株式会社アダバット,兵庫県神戸市中央区港島中町６丁目８番１,2018-02-07,株式会社
株式会社アダマス,東京都渋谷区恵比寿２丁目３６番７号,2018-02-07,株式会社
株式会社アップワード,東京都江戸川区本一色１丁目１２番１－８１３号,2018-02-07,株式会社
株式会社アルド,埼玉県さいたま市大宮区高鼻町１丁目９６番地,2018-02-07,株式会社
株式会社アルマカン,東京都八王子市散田町３丁目２０番６号,2018-02-07,株式会社
株式会社アークライト,埼玉県八潮市八潮３丁目１１番地１１,2018-02-07,株式会社
株式会社アートラボ,香川県観音寺市茂西町１丁目６番１５号,2018-02-07,株式会社
株式会社アールエステート,岡山県岡山市北区十日市中町１番３１号２０７,2018-02-07,株式会社
株式会社インターグロー,愛知県一宮市牛野通４丁目１５番地,2018-02-07,株式会社
株式会社インテリジェンス,沖縄県宜野湾市真志喜３丁目１０番５－２０２号,2018-02-07,株式会社
株式会社インフォプラス,東京都新宿区西新宿７丁目４番７号,2018-02-07,株式会社
株式会社インプルーブドライフ,神奈川県横浜市戸塚区戸塚町２８２０番地２９,2018-02-07,株式会社
株式会社インペリアルハーツ,東京都新宿区新宿５丁目１１番２号,2018-02-07,株式会社
株式会社ウェイーラーズ,神奈川県川崎市多摩区長尾２丁目１１番１号リライアンス向ヶ丘遊園１０３,2018-02-07,株式会社
株式会社ウミウシ,埼玉県蕨市中央３丁目１９番２０号,2018-02-07,株式会社
株式会社エイトステップ,宮城県仙台市太白区三神峯２丁目２番１７号Ｆ棟１階,2018-02-07,株式会社
株式会社エイト技研,東京都板橋区双葉町３９番１１号バロンビル５Ｆ,2018-02-07,株式会社
株式会社エスエフ,埼玉県春日部市米島９６１番地２２,2018-02-07,株式会社
株式会社エスプロホーム,宮城県仙台市青葉区本町１丁目１４番１８号６０５,2018-02-07,株式会社
株式会社エテルナトランスポート,福岡県福岡市中央区赤坂１丁目１３番３８号丸喜ビル３０１,2018-02-07,株式会社
株式会社エデュケーションコア,東京都中央区日本橋小網町８番２号,2018-02-07,株式会社
株式会社エフアイロジ,愛知県丹羽郡扶桑町大字高雄字天道２１９番地１,2018-02-07,株式会社
株式会社エムツリー,静岡県静岡市葵区瀬名中央４丁目１番１８号ソーラーハイツ瀬名２０１号,2018-02-07,株式会社
株式会社エムニーニー,東京都渋谷区桜丘町２６番１号セルリアンタワー１５階,2018-02-07,株式会社
株式会社エルドラド,東京都練馬区関町南１丁目２番１４－３０７号,2018-02-07,株式会社
株式会社エレメント・トウキョウ,東京都千代田区神田神保町２丁目２６番地,2018-02-07,株式会社
株式会社オザワ建設,三重県津市久居東鷹跡町４０番地１,2018-02-07,株式会社
株式会社オールインモータース,静岡県浜松市中区高丘西１丁目６番１５号,2018-02-07,株式会社
株式会社カブト,千葉県千葉市花見川区こてはし台４丁目２２番２４号,2018-02-07,株式会社
株式会社カメハウス,東京都足立区六月３丁目１番３号,2018-02-07,株式会社
株式会社ガーデンクリエイト,高知県四万十市古津賀３丁目８４番地,2018-02-07,株式会社
株式会社ギャランティー・アンド・ファクタリング,熊本県熊本市中央区辛島町４番３５号,2018-02-07,株式会社
株式会社クリーン,長野県長野市大字津野２７８番地１,2018-02-07,株式会社
株式会社クロバー,東京都八王子市下柚木３丁目１番地Ａ－１０２,2018-02-07,株式会社
株式会社グッドルーティン,東京都大田区大森中２丁目１７番１７号,2018-02-07,株式会社
株式会社グラミー,東京都渋谷区恵比寿４丁目２０番３号恵比寿ガーデンプレイスタワー１８階,2018-02-07,株式会社
株式会社グランツキャピタル,北海道札幌市西区西野四条１０丁目１４番２１号,2018-02-07,株式会社
株式会社グランドエコシステム,三重県度会郡南伊勢町五ケ所浦１０９４番地,2018-02-07,株式会社
株式会社グリーンカフェ,群馬県伊勢崎市昭和町３８１９番地２Ｆ,2018-02-07,株式会社
株式会社グローバー,福岡県福岡市南区弥永団地２１番４０１号,2018-02-07,株式会社
株式会社ケインズ,大阪府大阪市西区北堀江１丁目９番４－４０２号,2018-02-07,株式会社
株式会社ケン・トレーデイング,大阪府大阪市住吉区上住吉１丁目１－３,2018-02-07,株式会社
株式会社コインゲート,千葉県佐倉市鍋山町５５番地４－９０１号,2018-02-07,株式会社
株式会社コンプラス,福岡県飯塚市相田１６８番地７,2018-02-07,株式会社
株式会社サクセスフル,東京都渋谷区恵比寿南１丁目７番８号,2018-02-07,株式会社
株式会社サムライスタビリティ,徳島県徳島市川内町榎瀬６８４番地の１,2018-02-07,株式会社
株式会社サンシャイン,東京都中央区八重洲２丁目６番２１号,2018-02-07,株式会社
株式会社シューズナース,兵庫県神戸市中央区磯辺通１丁目１番２０号ＫＯＷＡＢＬＤＧ．３階,2018-02-07,株式会社
株式会社シンクシンク,岡山県岡山市中区四御神１９０番地８,2018-02-07,株式会社
株式会社シンビクル,香川県仲多度郡まんのう町炭所西１５２３番地２,2018-02-07,株式会社
株式会社ジェニュイン,長崎県佐世保市名切町１番２号,2018-02-07,株式会社
株式会社ジーラウンド,埼玉県草加市北谷２丁目３番２３－２号,2018-02-07,株式会社
株式会社ジーラム,東京都港区南青山２丁目２番１５号ウィン青山９４２号,2018-02-07,株式会社
株式会社スギ重,東京都大田区大森南２丁目９番６号,2018-02-07,株式会社
株式会社スケダチ,大阪府和泉市太町４１番地の３８,2018-02-07,株式会社
株式会社スズラン,北海道札幌市中央区南四条西３丁目９番地北星ビル２階,2018-02-07,株式会社
株式会社ステラマネジメント,大阪府大阪市北区天満１丁目７番２０号,2018-02-07,株式会社
株式会社ステージアップ,埼玉県志木市中宗岡４丁目１６番２２号,2018-02-07,株式会社
株式会社セカンド,東京都世田谷区中町５丁目２１番９号,2018-02-07,株式会社
株式会社ゼロイチ,大阪府大阪市北区西天満２丁目６番８号堂島ビルヂング,2018-02-07,株式会社
株式会社タングラム,東京都台東区東上野６丁目１２番１号サリチェＴ－Ⅲビル３０２,2018-02-07,株式会社
株式会社ティ・エスコート,沖縄県浦添市字大平４９８番地３８,2018-02-07,株式会社
株式会社ティ・ピ・エス,東京都葛飾区奥戸６丁目３番２号,2018-02-07,株式会社
株式会社テクニカルＫ,神奈川県足柄下郡真鶴町岩４０５番地１,2018-02-07,株式会社
株式会社ディストリビューション,東京都大田区平和島６丁目１番１号,2018-02-07,株式会社
株式会社デリシュミート,神奈川県横浜市港南区大久保２丁目３３番１７号,2018-02-07,株式会社
株式会社トライク,東京都港区南青山２丁目２番１５号ウィン青山９４２,2018-02-07,株式会社
株式会社トリアポンス,北海道札幌市北区北二十四条西１２丁目１番７－８０１号,2018-02-07,株式会社
株式会社トータルメイクス,大阪府門真市北岸和田２丁目９番３３号,2018-02-07,株式会社
株式会社ナノ,福岡県筑紫野市上古賀３丁目９番１号,2018-02-07,株式会社
株式会社ナンセツ,大阪府門真市大倉町七丁目２５番,2018-02-07,株式会社
株式会社ハートリンクス,千葉県松戸市松戸１７４５番地セレーノ．ｍ５０３号,2018-02-07,株式会社
株式会社パスティーズ,埼玉県戸田市新曽南２丁目７番１２号,2018-02-07,株式会社
株式会社パーク,東京都町田市原町田１丁目７番２７号,2018-02-07,株式会社
株式会社ヒガニューリース運輸,沖縄県沖縄市与儀３丁目９番２３号シーサイドマンション４Ｆ,2018-02-07,株式会社
株式会社ヒロコハヤシ,兵庫県神戸市中央区港島中町６丁目８番１,2018-02-07,株式会社
株式会社ヒロテック,福岡県遠賀郡芦屋町船頭町１１番２２号,2018-02-07,株式会社
株式会社ビーエヌワン,神奈川県横浜市青葉区美しが丘５丁目２８番地７平野ビル３、５１４号,2018-02-07,株式会社
株式会社ピンクラテ,兵庫県神戸市中央区港島中町６丁目８番１,2018-02-07,株式会社
株式会社ピーネコーポレーション,埼玉県入間郡三芳町大字上富１０３１番地１,2018-02-07,株式会社
株式会社ファケレ,東京都港区南青山２丁目２番１５号,2018-02-07,株式会社
株式会社ファーモア,岡山県津山市高野本郷１２７４－１７,2018-02-07,株式会社
株式会社フィジオン,東京都千代田区三番町５番地１１パークハウス三番町１３０３号,2018-02-07,株式会社
株式会社フリーダムス,大阪府大阪市西区南堀江４丁目５番Ｂ－１０３,2018-02-07,株式会社
株式会社フルータス,熊本県熊本市東区戸島４丁目３番６７号,2018-02-07,株式会社
株式会社フレンドシステムズ,千葉県千葉市稲毛区稲毛東４丁目５番１－９３８号,2018-02-07,株式会社
株式会社ブルーマン,東京都豊島区南大塚２丁目１７番８号,2018-02-07,株式会社
株式会社プラスティ,愛知県一宮市観音寺１丁目１１番２４号,2018-02-07,株式会社
株式会社プレビス,京都府八幡市下奈良宮ノ道２５番地３,2018-02-07,株式会社
株式会社ペッターロッソ,愛知県名古屋市中区栄３丁目３１番８号モリダイヤハイツ栄３０２,2018-02-07,株式会社
株式会社ホワイトベアー,東京都港区芝３丁目１２番１２号サンテ・トゥルム芝公園１Ｆ,2018-02-07,株式会社
株式会社ホーネスト２３,三重県四日市市笹川７丁目５１番１６,2018-02-07,株式会社
株式会社マルイチ,東京都墨田区向島１丁目２５番１３号,2018-02-07,株式会社
株式会社マルジョウ山口園,静岡県周智郡森町三倉３０１１番地の１０,2018-02-07,株式会社
株式会社マロントラスト,東京都目黒区柿の木坂２丁目２８番２号,2018-02-07,株式会社
株式会社ミィロークコンサルティング,東京都千代田区九段南１丁目５番６号りそな九段ビル５階,2018-02-07,株式会社
株式会社ミッドポイント,東京都渋谷区松濤１丁目５番１号,2018-02-07,株式会社
株式会社ミヤマホームケア,東京都江戸川区中央１丁目３番２３号,2018-02-07,株式会社
株式会社ミライズ,東京都中央区銀座１丁目２２番１０号,2018-02-07,株式会社
株式会社ミートワン,東京都港区六本木３丁目１番１号,2018-02-07,株式会社
株式会社メモリー,東京都世田谷区松原２丁目３８番６号,2018-02-07,株式会社
株式会社モンテプロズ,福岡県福岡市西区生松台１丁目２４番２－１号,2018-02-07,株式会社
株式会社ヤマグチサービス,愛知県豊橋市堂坂町２９番地の２,2018-02-07,株式会社
株式会社ヤラスラブ,福岡県福岡市博多区中洲中島町四丁目２３番８０６号,2018-02-07,株式会社
株式会社ユニオン,埼玉県春日部市中央１丁目１番地１７,2018-02-07,株式会社
株式会社ライズ,長野県伊那市狐島４０５９番地,2018-02-07,株式会社
株式会社ライフステージ,静岡県浜松市西区古人見町１６４８番地の５３,2018-02-07,株式会社
株式会社ライフ末裕,奈良県葛城市東室１０６番地５,2018-02-07,株式会社
株式会社ラビットハウス,神奈川県相模原市中央区清新６丁目２番３号,2018-02-07,株式会社
株式会社ラルーチェ寿,埼玉県さいたま市岩槻区大字岩槻５０１０番地４,2018-02-07,株式会社
株式会社リグナス,神奈川県横浜市旭区左近山１５７－２－３－３１－２０２,2018-02-07,株式会社
株式会社リサイクル２４時,千葉県香取市野田５０９番地５,2018-02-07,株式会社
株式会社リセイル,埼玉県さいたま市北区盆栽町１６８番地,2018-02-07,株式会社
株式会社リトルツリーズ,東京都品川区戸越５丁目４番３号アズ品川ビル,2018-02-07,株式会社
株式会社リビング・プランナー,東京都千代田区九段南３丁目８番１０号１１階,2018-02-07,株式会社
株式会社リピートアップ,東京都中央区銀座７丁目１３番６号サガミビル２階,2018-02-07,株式会社
株式会社リベルタ,大阪府大阪市天王寺区上汐４丁目５番１１号,2018-02-07,株式会社
株式会社リヴクールワン,千葉県市川市大洲４丁目１５番１０号,2018-02-07,株式会社
株式会社リーフジャパン,愛知県名古屋市天白区植田山３丁目１３０８番地,2018-02-07,株式会社
株式会社リーランス,広島県広島市南区南蟹屋２丁目２番３２号,2018-02-07,株式会社
株式会社ルクール,和歌山県岩出市根来９３７番地の１,2018-02-07,株式会社
株式会社レオン,埼玉県狭山市柏原３６０４番地の１２狭山ニュータウン１３７－９,2018-02-07,株式会社
株式会社ロッソ＆ビアンコＩｎｃ,兵庫県姫路市南今宿２番３７,2018-02-07,株式会社
株式会社ワイ・ティー・エス・テクノ,福岡県北九州市小倉北区井堀２丁目１番１２－７０５号,2018-02-07,株式会社
株式会社ワールドニューブリッジ,大阪府大阪市西区靱本町３丁目１０番１０－９０２号,2018-02-07,株式会社
株式会社ヴァローレ,千葉県習志野市東習志野５丁目３４番４号,2018-02-07,株式会社
株式会社一,東京都中野区東中野１丁目４１番８号メゾンＫⅠ２０２,2018-02-07,株式会社
株式会社三栄,千葉県茂原市長清水１４０番地,2018-02-07,株式会社
