法人名,住所,設立日,法人種別
覚王山税理士法人,愛知県名古屋市中区丸の内３丁目１９番１４号,2025-01-16,その他の設立登記法人
豊洲アンティーク株式会社,大阪府大阪市淀川区東三国２丁目１８番２０－１０６号,2025-01-16,株式会社
貞光チキンファーム合同会社,徳島県美馬市脇町字東俣名１０８５番地１０,2025-01-16,合同会社
農事組合法人五十公野,新潟県新発田市上新保５９６番地,2025-01-16,その他の設立登記法人
農事組合法人八所,島根県雲南市大東町須賀６３１番地３,2025-01-16,その他の設立登記法人
農業生産法人株式会社カビラ農産,沖縄県石垣市字平得１５３５番地３５,2025-01-16,株式会社
運賢企業株式会社,東京都港区六本木４丁目３番２１－ブランズ六本木ザ・レジデンス６０４号,2025-01-16,株式会社
重建株式会社,愛知県名古屋市港区東茶屋２丁目４２３番地,2025-01-16,株式会社
青騰株式会社,埼玉県蕨市塚越７丁目３７番２号ブリーズコート蕨塚越テラス４０４号,2025-01-16,株式会社
音悦株式会社,兵庫県神戸市中央区熊内町１丁目１番１５－２０３号,2025-01-16,株式会社
風義株式会社,神奈川県川崎市中原区木月住吉町２１番１号,2025-01-16,株式会社
騰雲株式会社,大阪府大阪市東成区大今里西１丁目７番３号,2025-01-16,株式会社
１ｓｔ　ＷＩＮＴＯＰ　ＦＲＥＩＧＨＴ　ＪＡＰＡＮ株式会社,大阪府豊中市本町５丁目１１番２６－２０１号,2025-01-16,株式会社
Ａ＆Ｓエンジニアリング株式会社,京都府京都市伏見区深草泓ノ壺町２８－６,2025-01-16,株式会社
Ａ２メディテックス株式会社,静岡県富士宮市山宮８６０番地の６,2025-01-16,株式会社
ＡＡ合同会社,大阪府東大阪市日下町１丁目６番１５号,2025-01-16,合同会社
ＡＢＣ株式会社,東京都荒川区町屋３丁目２４番２号面川ビル２０５号室,2025-01-16,株式会社
ＡＧ株式会社,山口県萩市大字高佐下１０番地１０,2025-01-16,株式会社
ＡＮ　Ｃｏｒｐｏｒａｔｉｏｎ株式会社,東京都港区三田１丁目１１番４５号三田清風ガーデン６０７,2025-01-16,株式会社
Ａｄｖａｎｃｅ　Ｔｅｃｈｎｏｌｏｇｙ　Ｃｏｎｓｕｌｔｉｎｇ　Ｓｅｒｖｉｃｅｓ　Ｐｖｔ．Ｌｔｄ,東京都渋谷区道玄坂１丁目１２番１号　渋谷マークシティウエスト２２階,2025-01-16,外国会社等
Ａｌｕｒｅ合同会社,神奈川県横浜市港北区大倉山７丁目５番１号,2025-01-16,合同会社
Ｂｅｌｌｉｓｓｉｍａ合同会社,神奈川県厚木市鳶尾２丁目３番２３－１号,2025-01-16,合同会社
ＣＦ‐ＨＴＡＹ株式会社,大阪府大阪市西成区北津守４丁目５番３号,2025-01-16,株式会社
ＣＩＲＸ株式会社,東京都新宿区百人町１丁目１８番８号大久保カドビル２階ＬｉｎｋＳｐａｃｅ百人町Ｗ０８号室,2025-01-16,株式会社
ＣＴ＆ＢｉＺ合同会社,東京都中央区八重洲２丁目１－１ＹＡＮＭＡＲＴＯＫＹＯ１２階,2025-01-16,合同会社
ＣｌｅａｒＰａｔｈ合同会社,愛知県名古屋市西区名駅２丁目２７番８号名古屋プライムセントラルタワー３階,2025-01-16,合同会社
ＤＯＴＳ．合同会社,愛知県碧南市山神町８丁目１２番地,2025-01-16,合同会社
ＤＴＣ株式会社,北海道札幌市中央区北五条西５丁目１－５ＪＲ５５ＳＡＰＰＯＲＯビル８Ｆ,2025-01-16,株式会社
ＤＸｏｐｔｉｍｉｚａｔｉｏｎ株式会社,東京都千代田区神田和泉町１番地６の１６ヤマトビル４０５,2025-01-16,株式会社
ＥＤＦ合同会社,広島県広島市西区己斐中３丁目１１－２７,2025-01-16,合同会社
ＥＰファンド第０１号合同会社,愛知県名古屋市東区泉１丁目１８‐３泉ステイトリービル８０１,2025-01-16,合同会社
ＦＤＡ株式会社,神奈川県横浜市神奈川区反町４丁目２７番地１５ウィンディーポート２０１,2025-01-16,株式会社
ＦＵＬＬＨＯＵＳＥ　ＩＮＶＥＳＴＭＥＮＴ　ＰＴＥ．　ＬＴＤ,,2025-01-16,外国会社等
Ｆｉｒｓｔ　Ｓｔａｒ株式会社,兵庫県尼崎市浜田町４丁目２０－５,2025-01-16,株式会社
Ｇａｎｚｈｏｕｍｕｘｉｎｇｋｅｊｉｙｏｕｘｉａｎｇｏｎｇｓｉ,,2025-01-16,外国会社等
Ｇｒｏｗｔｈ　Ｐｌａｃｅ株式会社,千葉県市川市南八幡４丁目３番７－１０４号（グリーンターフ南八幡第Ⅲ）,2025-01-16,株式会社
Ｇｕｐｐｙ　Ｗｅｂ　Ｓｅｒｖｉｃｅ合同会社,東京都世田谷区北沢３丁目２７―４立木ビル２Ｆ,2025-01-16,合同会社
ＨＡＧＨＩＲＩＡＮ　ＣＯＲＰＯＲＡＴＩＯＮ合同会社,東京都新宿区原町１丁目６３番地８,2025-01-16,合同会社
ＨＥＬＬＡ　ＧＲＥＥＮ株式会社,岐阜県関市山田１０４５番地２１,2025-01-16,株式会社
ＨＩＲＯＬＩＮＸ株式会社,広島県福山市駅家町大字江良８０３番地３,2025-01-16,株式会社
ＨＲＩＴＳＴＵＤＩＯ株式会社,東京都渋谷区渋谷２丁目１９番１５号宮益坂ビルディング６０９,2025-01-16,株式会社
Ｈａｆｅｌｅ　Ｋｏｒｅａ　Ｉｎｃ．,神奈川県横浜市戸塚区上品濃１４－１７,2025-01-16,外国会社等
ＨｅＢｅｉＡｏＷｅｉＳｉＢａｎｇＭａｏＹｉＹｏｕＸｉａｎＧｏｎｇＳｉ,,2025-01-16,外国会社等
ＩＭ１号畜電所合同会社,熊本県球磨郡あさぎり町深田西２３２６番地１６８,2025-01-16,合同会社
ＩＮＤＯＧＯ株式会社,神奈川県横浜市西区浅間町１丁目４番３号ウィザードビル４０２,2025-01-16,株式会社
ＩＮＤＯＮＥＳＩＡ　ＳＰＩＣＥＳＨＩＰ株式会社,静岡県駿東郡小山町大胡田９６０番地１,2025-01-16,株式会社
ＪＷ株式会社,沖縄県宜野湾市伊佐３丁目１３番７号,2025-01-16,株式会社
Ｊａｐａｎ　Ｃｅｒａｍｉｃｓ合同会社,愛知県名古屋市守山区翠松園２丁目１４０１番地,2025-01-16,合同会社
Ｋ’ＬＵＸＥ　ＪＡＰＡＮ合同会社,神奈川県横浜市港北区篠原町１０７４番７０,2025-01-16,合同会社
ＫＡＣ株式会社,兵庫県西宮市神呪町７番３－１号,2025-01-16,株式会社
ＫＯＴＡ　ＢＡＳＥ株式会社,兵庫県神戸市長田区長田町４丁目２番２１号,2025-01-16,株式会社
ＫＳパートナーズ合同会社,山梨県南アルプス市鏡中條１４４番地１,2025-01-16,合同会社
Ｋｅｎ　Ｇｌｏｂａｌ　Ｓｔｕｄｉｏ株式会社,神奈川県川崎市麻生区向原２丁目１４番３３号,2025-01-16,株式会社
Ｋｉｒｅｈａｓｈｉ合同会社,東京都江東区北砂５丁目２０－４－８１２,2025-01-16,合同会社
ＬＢＢホールディングス株式会社,東京都港区虎ノ門１丁目１７番１号虎ノ門ヒルズビジネスタワー１５階,2025-01-16,株式会社
ＬＴ　Ｗｏｒｋｓ株式会社,大阪府大阪市淀川区西宮原１丁目５－３３新大阪飯田ビル１Ｆ,2025-01-16,株式会社
Ｌｅｅｇｉｎｚａ合同会社,東京都千代田区麹町２丁目２番２２号（Ｃ／ＯＪｏｏ－ｒｅａｌｅｓｔａｔｅ－ｏｆｆｉｃｅ）,2025-01-16,合同会社
Ｌｅｉクッキング株式会社,東京都港区新橋４丁目１４番１新橋ＡＵＮＢＬＤＧ４階,2025-01-16,株式会社
ＭアンドＭプラス１合同会社,大阪府摂津市東正雀２番１５－１号,2025-01-16,合同会社
ＭＯ企画合同会社,大阪府大阪市城東区鴫野西４丁目９番１７－５１１号,2025-01-16,合同会社
ＭＴ　Ｂｏｒｄｅｒｌｅｓｓ合同会社,福井県越前市府中１丁目６－１０岩端ビル２Ｆ,2025-01-16,合同会社
ＭＴＢアセット株式会社,神奈川県横浜市神奈川区栄町５番地１横浜クリエーションスクエア１４階,2025-01-16,株式会社
Ｍａｓｏｕｒｉ　Ｃａｐｉｔａｌ株式会社,東京都千代田区四番町４番地９新東京国際リーガル内,2025-01-16,株式会社
Ｍｅｒｃａｔｏｒ　Ｍｅｄｉａ　ＬＩＭＩＴＥＤ,,2025-01-16,外国会社等
Ｍｏｍｅｎｔｕｍ　Ｇｒｏｗｔｈ合同会社,東京都中央区新川１丁目３－１７新川三幸ビル５０１号室,2025-01-16,合同会社
ＮＥＥＮＡＮＹ株式会社,神奈川県横浜市青葉区松風台２２番地６０,2025-01-16,株式会社
ＮＥＰＡ　ＥＮＴＥＲＰＲＩＳＥ合同会社,千葉県富里市日吉台２丁目１９番地１５,2025-01-16,合同会社
ＮＥＲＶ合同会社,愛知県名古屋市中村区名駅南１丁目１４番９号エルザビル名古屋駅前１１０３号室,2025-01-16,合同会社
ＮＨＩ株式会社,岐阜県土岐市土岐津町土岐口１２３８番地の１グリーングラス土岐２０１号,2025-01-16,株式会社
ＮＮＴ株式会社,福岡県糸島市前原中央２丁目３番６０－３０２号,2025-01-16,株式会社
ＮＰＯ法人ちょこっと多縁よど,愛媛県松山市余戸南３丁目８番９号,2025-01-16,その他の設立登記法人
ＮＰＯ法人ＲＥＮＥＣＯ,神奈川県川崎市川崎区観音２丁目１８番１５号,2025-01-16,その他の設立登記法人
Ｎａｙｒａ　Ｍｏｔｏｒ　Ｔｒａｄｉｎｇ合同会社,神奈川県海老名市杉久保南１丁目６番１－２０６号,2025-01-16,合同会社
Ｎｉｎｅ株式会社,岡山県倉敷市真備町下二万１８１３番地３,2025-01-16,株式会社
ＰａｙＰａｙ　Ｉｎｄｉａ　Ｐｒｉｖａｔｅ　Ｌｉｍｉｔｅｄ,,2025-01-16,外国会社等
ＰｒｏｕＤＣｏｍｍＵｎｉｔｙ合同会社,千葉県千葉市緑区高津戸町４１３番地６,2025-01-16,合同会社
Ｓ‐ＪＭ合同会社,神奈川県藤沢市弥勒寺１丁目２１番１１～３１１号,2025-01-16,合同会社
Ｓ．Ｏ．Ｌ．Ｉ．Ｄ　Ｗｏｒｋｓ合同会社,宮城県仙台市太白区あすと長町１丁目５番４２‐１５０６号,2025-01-16,合同会社
ＳＡＮＮＯ株式会社,福岡県久留米市国分町８２８番地９,2025-01-16,株式会社
ＳＩＴＣ　Ｉｎｔｅｒｎａｔｉｏｎａｌ　Ｌｏｇｉｓｔｉｃｓ,,2025-01-16,外国会社等
ＳＴＡＲＴＥＣ株式会社,東京都新宿区四谷４丁目８番地,2025-01-16,株式会社
ＳＶ株式会社,大阪府大阪市東淀川区西淡路３丁目９－３４,2025-01-16,株式会社
Ｓｅｒｅｎｉｔｙ株式会社,埼玉県児玉郡美里町大字甘粕７５０－１,2025-01-16,株式会社
ＳｈａｎｇＨａｉＧｕｏＹｕｎＳｈｉＹｅＹｏｕＸｉａｎＧｏｎｇＳｉ,,2025-01-16,外国会社等
Ｓｈｅｎ　Ｚｈｅｎ　Ｇｅｅｍｏｏ　Ｔｅｃｈｎｏｌｏｇｙ　Ｃｏｍｐａｎｙ　Ｌｉｍｉｔｅｄ,,2025-01-16,外国会社等
Ｓｈｅｎ　Ｚｈｅｎ　Ｓｈｉ　Ｘｉｎ　Ｆｅｉ　Ｙｉ　Ｋｅ　Ｊｉ　Ｙｏｕ　Ｘｉａｎ　Ｇｏｎｇ　Ｓｉ,,2025-01-16,外国会社等
ＳｈｅｎＺｈｅｎＳｈｉＭｅｉＹａＤｉａｎＺｉＳｈａｎｇＷｕＹｏｕＸｉａｎＧｏｎｇＳｉ,,2025-01-16,外国会社等
ＳｈｅｎＺｈｅｎＳｈｉＸｉＥｒＷｏＫｅＪｉＹｏｕＸｉａｎＧｏｎｇＳｉ,,2025-01-16,外国会社等
Ｓｏｌｅｉｌ株式会社,東京都渋谷区広尾２丁目２番１５－３０５号,2025-01-16,株式会社
ＳｔｅｌｌａｒＴｅｃｈ　Ｒｏｂｏｔｉｃｓ株式会社,茨城県那珂市菅谷１５３３番地３トゥルスⅠ－１０１号室,2025-01-16,株式会社
Ｓｔｒｉｋｅ　ｗａｖｅ株式会社,東京都江東区大島７丁目１９番７号－２０５,2025-01-16,株式会社
Ｓｕｎ＆Ｃｏｍｐａｎｙ株式会社,東京都墨田区江東橋４丁目２７番１４号,2025-01-16,株式会社
Ｓｙｍｂｉａ株式会社,東京都中央区銀座６丁目１３番１６号銀座ＷａｌｌビルＵＣＦ５階,2025-01-16,株式会社
ＴＧ投資合同会社,神奈川県横浜市港北区高田東４丁目１４番６号,2025-01-16,合同会社
ＴＮ　Ｌｅｉｓｕｒｅ　Ｃｒｅａｔｅ合同会社,東京都墨田区押上２丁目１８番１２号,2025-01-16,合同会社
ＴＳＡＮコンサルティング株式会社,東京都港区南青山５丁目４番２４号南青山Ｍ＆Ｍビル地下１階,2025-01-16,株式会社
Ｔｅｉｍｅ株式会社,東京都墨田区太平４丁目２２番６,2025-01-16,株式会社
Ｔｅｎｏｖａ　Ｓ．ｐ．Ａ．,茨城県神栖市砂山１６－１,2025-01-16,外国会社等
ＴｏｋｉＬｉｆｅ合同会社,大阪府大阪市北区大淀北１丁目６番２１－２１３号,2025-01-16,合同会社
Ｔｒａｖｅｌｅｔｓ株式会社,兵庫県神戸市東灘区御影中町１丁目９－３カネヨシビル４Ｆ,2025-01-16,株式会社
Ｔｗｉｎｋｌｅ　Ｅｎｔｅｒｔａｉｎｍｅｎｔ　Ａｔｅｌｉｅｒ合同会社,東京都渋谷区道玄坂１丁目１０番８号渋谷道玄坂東急ビル２Ｆ－Ｃ,2025-01-16,合同会社
ＶＨＢＧ　メカニカルプレシジョンカンパニーリミテッド,兵庫県加古川市野口町坂井２０１番地の１３,2025-01-16,外国会社等
ＷＨＩＴＥコーポレーション株式会社,大阪府大阪市中央区城見２丁目１番６１号ツイン２１ＭＩＤタワー３８階ＲｅｑｒｅｅＯＢＰ,2025-01-16,株式会社
ＷＺＹ株式会社,大阪府大阪市中央区淡路町１丁目３番７号キタデビル２０１号,2025-01-16,株式会社
Ｙ．Ｎ．Ｉｎｃｏｒｐｏｒａｔｅｄ合同会社,東京都港区南青山３丁目１番３６号青山丸竹ビル６Ｆ,2025-01-16,合同会社
ＹＮＳ　ＴＲＡＤＥＲＳ　ＰＲＩＶＡＴＥ　ＬＩＭＩＴＥＤ,新潟県妙高市大字小濁７３１　レンタルスペース２Ｆ－４,2025-01-16,外国会社等
ＹＯＵ‐ＭＥ株式会社,東京都世田谷区代沢５丁目３２－３,2025-01-16,株式会社
ＺＥＣＨＥＮＧＤＩＡＮＺＩＺＨＯＮＧＳＨＡＮＹＯＵＸＩＡＮＧＯＮＧＳＩ,,2025-01-16,外国会社等
ｂｂ．ｇｒｉｎ株式会社,大阪府吹田市千里山竹園１丁目１８番２－５０１号,2025-01-16,株式会社
ｉＡｕｔｏ　ＴＯＫＹＯ株式会社,東京都港区港南３丁目６番２１号,2025-01-16,株式会社
ｔｅＲＩＣＥ株式会社,秋田県山本郡八峰町峰浜石川字石川４９８番地３,2025-01-16,株式会社
きみと合同会社,東京都杉並区高円寺南３丁目２３番１７号,2025-01-17,合同会社
つばさキャピタル合同会社,長野県佐久市小田井９０６番地,2025-01-17,合同会社
のぞみ白老ソーラー合同会社,東京都港区芝５丁目２９番１９号ＰＭＯ田町Ⅳ８階,2025-01-17,合同会社
ひまわり商事株式会社,徳島県板野郡板野町下庄字古杉１１５番地２－２Ｆ,2025-01-17,株式会社
めぬまファーム株式会社,埼玉県熊谷市西城９０６番地,2025-01-17,株式会社
わんにゃんるんるん株式会社,埼玉県さいたま市大宮区桜木町２丁目３番地大宮マルイ７階,2025-01-17,株式会社
アイオライト株式会社,東京都千代田区岩本町２丁目１３－６ミツボシ第３ビル５０３号室,2025-01-17,株式会社
アジヘル・アンド・カンパニー合同会社,東京都足立区綾瀬１丁目３２－８－２０２号室,2025-01-17,合同会社
アットクリッピング株式会社,東京都新宿区新宿２丁目３番１０号,2025-01-17,株式会社
アリクル合同会社,青森県八戸市東白山台３丁目６番２５―２号,2025-01-17,合同会社
アーバンデザイン株式会社,千葉県富里市七栄６５０番地３５ー２６０２号室,2025-01-17,株式会社
ウイルプラスリヒト株式会社,東京都港区芝５丁目１３番１５号,2025-01-17,株式会社
エグゼクティブコーチ株式会社,東京都港区西新橋１丁目７番１４号,2025-01-17,株式会社
エフユースタイル株式会社,東京都品川区東品川１丁目３番１５号ＴｈｅＰａｒｋＲｅｘＴＥＮＮＯＺｔｈｅＤＯＣＫ,2025-01-17,株式会社
オドーレラボ株式会社,大阪府豊中市寺内１丁目６番１－１０９号,2025-01-17,株式会社
オリベ株式会社,福井県あわら市高塚第７号１３番地,2025-01-17,株式会社
オーセントレンドテクノロジー株式会社,神奈川県横浜市西区みなとみらい４丁目４番２号横浜ブルーアベニュー１２階,2025-01-17,株式会社
キョーモ合同会社,京都府京都市伏見区深草正覚町７番地３グランドパレス京都伏見１１１,2025-01-17,合同会社
クイーンズチョイス株式会社,兵庫県尼崎市南武庫之荘１丁目２５番２１号ＡＴＴＥＳＡ１２－１０１号室,2025-01-17,株式会社
クリエイティブ合同会社,島根県松江市雑賀町１５１５番地メゾンサイカ５０１,2025-01-17,合同会社
クレストミュージック株式会社,東京都中央区日本橋堀留町１丁目３番６号－２０３,2025-01-17,株式会社
グラハム株式会社,東京都渋谷区恵比寿西１丁目１０番１１号フジワラビルディング２階,2025-01-17,株式会社
コンストラクションブレイン株式会社,和歌山県和歌山市栄谷９５９番地２５,2025-01-17,株式会社
コーポレートコーチ株式会社,東京都港区西新橋１丁目７番１４号,2025-01-17,株式会社
サムライクッキング合同会社,千葉県船橋市前原西１丁目２０番２２号,2025-01-17,合同会社
ザコード株式会社,東京都千代田区神田和泉町１番地６－１６ヤマトビル４０５,2025-01-17,株式会社
ザフュー株式会社,神奈川県横浜市磯子区磯子８丁目６番１号,2025-01-17,株式会社
シフトエッジ株式会社,東京都港区南青山２丁目２番１５号,2025-01-17,株式会社
ジョー株式会社,東京都江戸川区篠崎町４丁目７番１１号ＫＳキャトルセゾンⅡ１０５号室,2025-01-17,株式会社
ストウィル合同会社,兵庫県小野市王子町８０６番地１,2025-01-17,合同会社
スパークルファインダー合同会社,東京都渋谷区恵比寿西２丁目８番４号ＥＸ恵比寿西ビル５階,2025-01-17,合同会社
セルリアン・ストラテジー株式会社,千葉県流山市おおたかの森南２丁目２０番地の１４,2025-01-17,株式会社
チャンターラー合同会社,愛知県豊田市神明町１丁目３７水野ビル３Ｆ,2025-01-17,合同会社
デジトレックス株式会社,東京都千代田区麹町３丁目５番地４麹町インテリジェントビルＢ－１,2025-01-17,株式会社
デュ・モアナ合同会社,兵庫県川西市萩原台東１丁目１７５番地の１７,2025-01-17,合同会社
ドン報運送合同会社,埼玉県鴻巣市本町８丁目１０番１７－４０５号ライオンズマンション鴻巣,2025-01-17,合同会社
ハワイ好きやね株式会社,大阪府大阪市中央区博労町１丁目８－１２－１０２,2025-01-17,株式会社
パワーオンティーチング株式会社,福岡県北九州市門司区杜ノ木一丁目４番２７号,2025-01-17,株式会社
パーソルエスアンドアイ株式会社,東京都豊島区池袋２丁目６５番１８号,2025-01-17,株式会社
ヒューマンネクスト株式会社,東京都渋谷区渋谷２丁目１９－１５宮益坂ビルディング６０９,2025-01-17,株式会社
ヒロ・マリタイム・ソリューションズ合同会社,千葉県浦安市美浜４丁目２１番１９号,2025-01-17,合同会社
フジワラ殖産株式会社,兵庫県小野市本町３３番地の７,2025-01-17,株式会社
フューチャーサポート株式会社,東京都大田区大森北３丁目４番５号平安ビル４階１,2025-01-17,株式会社
ブルー株式会社,岐阜県養老郡養老町鷲巣字北新田１６５５番地１,2025-01-17,株式会社
ベリティメッド株式会社,大阪府交野市私市１丁目２９番１６号,2025-01-17,株式会社
ホヌ・エンタープライズ株式会社,兵庫県西宮市西平町１１番４１号,2025-01-17,株式会社
ポーヴス合同会社,岐阜県岐阜市切通６丁目１４番８号,2025-01-17,合同会社
ミートス株式会社,佐賀県鳥栖市山浦町字乗目１３８０番２,2025-01-17,株式会社
メッツラー・ジャパン・ホールディングス株式会社,東京都千代田区内幸町２丁目２番２号富国生命ビル２３階,2025-01-17,株式会社
モジャロ株式会社,兵庫県三田市中央町３番１２号マスダビル３階,2025-01-17,株式会社
ユニライフケア株式会社,北海道札幌市白石区中央三条１丁目５番２４号,2025-01-17,株式会社
ラムマスター２合同会社,東京都中央区日本橋１丁目４番１号日本橋一丁目ビルディング,2025-01-17,合同会社
リフラクタ株式会社,宮城県宮城郡利府町加瀬字男鹿島台１－１０,2025-01-17,株式会社
一般社団法人そだちば,埼玉県川口市戸塚５丁目１９番３４号,2025-01-17,その他の設立登記法人
一般社団法人つなぐみらい,東京都千代田区神田小川町２丁目４番１４号フィールドクレストビル８階,2025-01-17,その他の設立登記法人
一般社団法人コトサス,沖縄県那覇市曙２丁目２５番３９号ヤビク商事ビル２０１,2025-01-17,その他の設立登記法人
一般社団法人サポートホールディングス４８号,東京都千代田区丸の内１丁目４番１号東京共同会計事務所内,2025-01-17,その他の設立登記法人
一般社団法人サンクチュアリビレッジ,愛知県新城市日吉字原２２番地,2025-01-17,その他の設立登記法人
一般社団法人スマート農業共同体,北海道北広島市西の里３０８－１,2025-01-17,その他の設立登記法人
一般社団法人フォーライフ,福岡県北九州市小倉北区片野新町１丁目２番２０号,2025-01-17,その他の設立登記法人
一般社団法人駄可笑屋敷プロジェクト,東京都杉並区方南２丁目１２番２７号,2025-01-17,その他の設立登記法人
一般社団法人ＡＧＩＬＥ,大阪府大阪市住吉区山之内３丁目２番２４号ラ・シャンブル,2025-01-17,その他の設立登記法人
一般社団法人Ｅｎｅｒｇｙ　Ｒｅｖｏｌｕｔｉｏｎ　Ａｓｓｏｃｉａｔｉｏｎ,東京都中央区銀座３丁目４番１号大倉別館５階Ｒｅｇｕｓ内,2025-01-17,その他の設立登記法人
一般社団法人Ｉ．Ｆ．Ｃ　ＣＯＮＮＥＣＴ,大阪府池田市城山町３番１１号,2025-01-17,その他の設立登記法人
一般社団法人ＳＫＤ,東京都中央区勝どき６丁目３番２－４２０９号,2025-01-17,その他の設立登記法人
一般社団法人ＴＵ００７,東京都新宿区四谷２丁目９番地１５東京ユナイテッド綜合事務所内,2025-01-17,その他の設立登記法人
三千歳草株式会社,京都府京都市上京区禅昌院町６４８－８,2025-01-17,株式会社
三木株式会社,大阪府大阪市阿倍野区阿倍野筋４丁目２０番４－９０４号,2025-01-17,株式会社
來德福株式会社,東京都中央区銀座６丁目１３番１６号銀座ＷａｌｌビルＵＣＦ５階,2025-01-17,株式会社
元吉グループ株式会社,東京都中央区１－２１－５銀座ＪＫビル３Ｆ,2025-01-17,株式会社
医療法人みのりの会,福岡県筑紫野市原田８丁目１番地１０,2025-01-17,その他の設立登記法人
医療法人ソリスデンタルクリニック,青森県八戸市田向２丁目１５番１０号,2025-01-17,その他の設立登記法人
医療法人佑森会,大阪府大阪市中央区森ノ宮中央２丁目１番７０号もりのみやキューズモールＢＡＳＥ２階,2025-01-17,その他の設立登記法人
医療法人八環会,大阪府大阪市西淀川区大和田２丁目２番４３号メラード大和田店２階,2025-01-17,その他の設立登記法人
医療法人吉田歯科クリニック,愛知県豊田市丸山町３丁目５３番地１,2025-01-17,その他の設立登記法人
医療法人戸田歯科医院,京都府京丹後市峰山町杉谷８６２番地の５,2025-01-17,その他の設立登記法人
医療法人明峯会,群馬県太田市新道町３７番地３,2025-01-17,その他の設立登記法人
医療法人社団恵裕仁会,神奈川県横浜市泉区中田北２丁目７番３号ネストＢ＆Ｗ１Ｆ,2025-01-17,その他の設立登記法人
医療法人社団慶和会,千葉県いすみ市岬町和泉１８８０番地４,2025-01-17,その他の設立登記法人
医療法人社団Ｊ‐ｇｒｏｕｐ,千葉県我孫子市本町２丁目３番３号星野ビル４階,2025-01-17,その他の設立登記法人
医療法人蒼水会,大阪府大阪市鶴見区放出東３丁目２１番５０号ＪＲ放出駅ＮＫビル２０１,2025-01-17,その他の設立登記法人
