法人名,住所,設立日,法人種別
ありさげ合同会社,愛知県岡崎市大和町字鳥ケ城５４番地１クレールコート１０２,2019-07-01,合同会社
けやき合同会社,東京都練馬区石神井町３丁目２５番３号本橋ビル３階,2019-07-01,合同会社
つながるワイファイ合同会社,東京都豊島区東池袋１丁目３４番５号６階,2019-07-01,合同会社
アイシーエルジャパン株式会社,東京都中央区日本橋蛎殻町１丁目１番９号,2019-07-01,株式会社
アイビス株式会社,東京都文京区千石３丁目１５番６号,2019-07-01,株式会社
アジア経済発展事業協同組合,愛知県名古屋市中川区柳川町１５番４号,2019-07-01,その他の設立登記法人
アジュール株式会社,神奈川県横浜市緑区白山４丁目１５番１８号,2019-07-01,株式会社
アマテラス製薬株式会社,東京都渋谷区神宮前４丁目１９－６ウエストイーストビル２Ｆ,2019-07-01,株式会社
アース合同会社,東京都文京区本郷４丁目９番２２号,2019-07-01,合同会社
アール・ヴィラ合同会社,香川県高松市国分寺町国分２７１２番地２,2019-07-01,合同会社
インフィード合同会社,宮城県仙台市太白区郡山３丁目２７番地４３号ステラータＢ棟１０２,2019-07-01,合同会社
エグレン株式会社,神奈川県川崎市川崎区港町５番３－２５２７号,2019-07-01,株式会社
エッジーコイン合同会社,福岡県福岡市博多区中洲５丁目３番８号－アクア博多５階,2019-07-01,合同会社
エニシス合同会社,千葉県松戸市幸谷７３５番地の３,2019-07-01,合同会社
カロス・アイ株式会社,兵庫県芦屋市伊勢町４番１２号－２１３,2019-07-01,株式会社
キャリアホープ株式会社,山口県下関市阿弥陀寺町７番１９－４０１号,2019-07-01,株式会社
クオリティライフ合同会社,大阪府和泉市池田下町２７６番地の１クロスロード北池田２０２号,2019-07-01,合同会社
クラウドエージェント株式会社,愛知県名古屋市西区城西４丁目２７番２０号,2019-07-01,株式会社
グランヴェルジェ株式会社,広島県広島市安佐南区中須１丁目１番１４号,2019-07-01,株式会社
グレン合同会社,東京都品川区東五反田１丁目１８番３－６０７号,2019-07-01,合同会社
サトウ商会株式会社,山形県飽海郡遊佐町遊佐字川端２７番地１,2019-07-01,株式会社
サンライズ合同会社,福島県いわき市好間町大利字井田木１４番地,2019-07-01,合同会社
サン・ティトル株式会社,東京都目黒区上目黒２丁目６－１０－２０１,2019-07-01,株式会社
サン食品株式会社,北海道苫小牧市字糸井１５０番地２７,2019-07-01,株式会社
サードステージ株式会社,兵庫県神戸市中央区磯上通４丁目１番１４号７階,2019-07-01,株式会社
シーズシー・モア株式会社,兵庫県神戸市中央区磯上通４丁目３番１０－６０６号,2019-07-01,株式会社
シー・ファイブ・ファイブ・ホールディングス株式会社,東京都千代田区丸の内１丁目２番１号,2019-07-01,株式会社
ジュピターパートナーズ株式会社,東京都港区六本木１丁目４番５号アークヒルズサウスタワー３階,2019-07-01,株式会社
スタンダードフィルム合同会社,東京都世田谷区上馬１丁目４番２１号,2019-07-01,合同会社
スターシップ合同会社,大阪府豊中市新千里東町１丁目１番２－２４０８号,2019-07-01,合同会社
スマイルプラスワン企画合同会社,宮城県仙台市若林区卸町２丁目９番１号ＩＮＴＩＬＡＱ　Ｍ３４,2019-07-01,合同会社
スラプラ株式会社,愛知県名古屋市東区筒井町４丁目３９番地,2019-07-01,株式会社
スーパームーン株式会社,東京都港区六本木７丁目１５番１３号六本木ダイヤハイツ,2019-07-01,株式会社
ツクリテラ合同会社,奈良県生駒市辻町７３２番地２３,2019-07-01,合同会社
デザイン＆ランゲージ株式会社,兵庫県神戸市中央区中町通３丁目１番１６号サンビル５０２,2019-07-01,株式会社
トランスコスモス社会保険労務士法人,東京都渋谷区渋谷３丁目２５番１８号,2019-07-01,その他の設立登記法人
ビーマウス株式会社,東京都新宿区北新宿２丁目４番３号グランノールキヨカ２０３,2019-07-01,株式会社
フランマネジメント合同会社,東京都世田谷区上野毛２丁目２２番１０号上野毛シティハウス・ノーステラス２０６,2019-07-01,合同会社
フリーセイン株式会社,東京都江戸川区平井５丁目２３番５－７０１号,2019-07-01,株式会社
ブロッサム合同会社,大阪府大阪市鶴見区放出東３丁目２１番４０－２０２号,2019-07-01,合同会社
プラチナ看護株式会社,東京都港区高輪２丁目１２番１３号レジデンス高輪２０１号室,2019-07-01,株式会社
プラネットギア株式会社,群馬県高崎市双葉町１１番１１号,2019-07-01,株式会社
プロフィットコンサルティング株式会社,東京都渋谷区円山町５番５号Ｎａｖｉ渋谷Ｖ３階,2019-07-01,株式会社
ペンターテイナー株式会社,大阪府八尾市南太子堂４丁目３番８５号,2019-07-01,株式会社
ホシノ工業株式会社,栃木県足利市葉鹿町７１３番地１０,2019-07-01,株式会社
マネジメントコンシェルジュ合同会社,兵庫県神戸市東灘区住吉山手７丁目１１番４号,2019-07-01,合同会社
マルセグループ株式会社,奈良県五條市田殿町５２５番地,2019-07-01,株式会社
マルセ株式会社,大阪府大阪市中央区本町４丁目８番１号,2019-07-01,株式会社
マーコ・インターナショナル,茨城県牛久市ひたち野西４丁目２２－３,2019-07-01,外国会社等
ミレリテミルシャジャパン株式会社,神奈川県小田原市田島５６７番地の１,2019-07-01,株式会社
モクモクファーム株式会社,和歌山県橋本市柿の木坂１２番地の１２,2019-07-01,株式会社
ライフエンディングパートナーズ株式会社,宮城県本吉郡南三陸町志津川字廻館４４番地５ＥＳ－Ｒｏａｄ１０７号,2019-07-01,株式会社
リバンデフィールド株式会社,滋賀県甲賀市甲賀町櫟野１６５９番地１,2019-07-01,株式会社
ワイズワーズ合同会社,東京都江戸川区鹿骨２丁目３４番１５号エクセルブラウン２０３号,2019-07-01,合同会社
ワヨウトレーディング株式会社,東京都立川市曙町１丁目１２番１７号原島ビル４階,2019-07-01,株式会社
一般社団法人おこめ,愛知県尾張旭市西山町１丁目２番地３９,2019-07-01,その他の設立登記法人
一般社団法人ここ咲,静岡県袋井市袋井３１３番地の３,2019-07-01,その他の設立登記法人
一般社団法人このおと,和歌山県和歌山市布引５４３番地,2019-07-01,その他の設立登記法人
一般社団法人オースピシャス,東京都世田谷区船橋７丁目１３番５号朝日千歳船橋ホーム１０４,2019-07-01,その他の設立登記法人
一般社団法人キャットグルーマー協会,東京都渋谷区代々木２丁目１８番６,2019-07-01,その他の設立登記法人
一般社団法人グローバル行政書士ネットワーク,神奈川県横浜市中区かもめ町１３,2019-07-01,その他の設立登記法人
一般社団法人サステナブル経営推進機構,東京都千代田区鍛冶町２丁目２番１号三井住友銀行神田駅前ビル,2019-07-01,その他の設立登記法人
一般社団法人センリツ音楽協会,大阪府枚方市南中振１丁目４１番３３号,2019-07-01,その他の設立登記法人
一般社団法人ヒトイクラボ,東京都千代田区神田佐久間町３丁目３８第５東ビル５Ｆ,2019-07-01,その他の設立登記法人
一般社団法人ボディケアトレーナーアカデミー,東京都渋谷区本町３丁目１３－１２渋谷本町ビル８階,2019-07-01,その他の設立登記法人
一般社団法人モルディブ・ニッポントレードインフォメーションセンター,東京都中央区築地４丁目１２番２号シグネットビル５階,2019-07-01,その他の設立登記法人
一般社団法人ラフィオ,埼玉県深谷市東方町４丁目３５番地１,2019-07-01,その他の設立登記法人
一般社団法人全国技能実習監理団体連絡会,東京都港区元赤坂１丁目６番２号安全ビルレジデンス２００２号,2019-07-01,その他の設立登記法人
一般社団法人南三陸ＹＥＳ工房,宮城県本吉郡南三陸町入谷字中の町２２７番地,2019-07-01,その他の設立登記法人
一般社団法人和合館工学舎,宮城県仙台市青葉区柏木１丁目２番４５号フォレスト仙台５階,2019-07-01,その他の設立登記法人
一般社団法人地域ブランド推進協会,埼玉県川口市西川口６丁目１５番６－４０４号,2019-07-01,その他の設立登記法人
一般社団法人奥尻島観光協会,北海道奥尻郡奥尻町字奥尻３０９番地２,2019-07-01,その他の設立登記法人
一般社団法人建物改修診断士協会,大阪府泉大津市田中町３番１０－１０１号,2019-07-01,その他の設立登記法人
一般社団法人日本レタグラフィー協会,兵庫県西宮市上ケ原四番町４番５号,2019-07-01,その他の設立登記法人
一般社団法人横浜税務承継協会,神奈川県横浜市中区山下町１番地シルクセンターＭ２階,2019-07-01,その他の設立登記法人
一般社団法人浜松全力応援団,静岡県浜松市中区南浅田１丁目１９番２１号,2019-07-01,その他の設立登記法人
一般社団法人若き血,東京都品川区東五反田２丁目１０番２号,2019-07-01,その他の設立登記法人
一般社団法人静岡登録支援協会,静岡県三島市大場２５番地,2019-07-01,その他の設立登記法人
一般社団法人Ａ－ｗｉｎｇ,福岡県福岡市東区水谷２丁目５１番１９－４０７号,2019-07-01,その他の設立登記法人
一般社団法人ＩＴキャリア開発支援機構,東京都中央区銀座７丁目１３番６号サガミビル２階,2019-07-01,その他の設立登記法人
一般社団法人ＳＨ０２４,東京都港区虎ノ門３丁目２２番１０－２０１号,2019-07-01,その他の設立登記法人
一般財団法人大阪ラスキン・モリスセンター,大阪府豊能郡能勢町山辺１０５５番地,2019-07-01,その他の設立登記法人
一般財団法人持法院,愛知県岡崎市井田町字１丁目１０７番地１,2019-07-01,その他の設立登記法人
一般財団法人日本道義主義財団,東京都港区新橋２丁目２０番１５号新橋駅前ビル１号館４０５,2019-07-01,その他の設立登記法人
三本矢株式会社,広島県東広島市西条西本町２８番３０号,2019-07-01,株式会社
中瀬農産株式会社,福井県坂井市丸岡町末政第５号６３番地,2019-07-01,株式会社
伊藤株式会社,東京都中央区日本橋蛎殻町１丁目３番５号共同ビル２階２３号,2019-07-01,株式会社
共栄テクノエンジニアリング株式会社,東京都町田市成瀬６丁目１５番８号,2019-07-01,株式会社
創和産業株式会社,山形県山形市小白川町４丁目３２番７号山口ビル２０１号,2019-07-01,株式会社
南合同会社,大阪府堺市南区赤坂台１丁２番５号,2019-07-01,合同会社
合同会社いこい,新潟県上越市大字向橋１０９３番地の２,2019-07-01,合同会社
合同会社おっとりの部屋,青森県青森市小柳３丁目１番１２号,2019-07-01,合同会社
合同会社ごとふ動物病院,福岡県福岡市早良区藤崎１丁目１番３７号,2019-07-01,合同会社
合同会社さとう,福島県会津若松市慶山１丁目９番３８号なかよし荘２０５号,2019-07-01,合同会社
合同会社しくみコンサルティング,山口県防府市大字田島３４１番７４号,2019-07-01,合同会社
合同会社しろすみれ,千葉県市原市北国分寺台４丁目１０番地５,2019-07-01,合同会社
合同会社みの家,山口県周南市栄町２丁目３９番地早坂ビル３,2019-07-01,合同会社
合同会社アトリエ・キオ,大阪府茨木市駅前１丁目５番２９号,2019-07-01,合同会社
合同会社アリーズ,神奈川県逗子市久木８丁目８番２６号,2019-07-01,合同会社
合同会社アンダーザローズ,東京都港区三田１丁目７番１号,2019-07-01,合同会社
合同会社イーリス,長崎県北松浦郡佐々町市場免１６番地２,2019-07-01,合同会社
合同会社エス・ケー・スリー,静岡県田方郡函南町肥田２０６番地の１９,2019-07-01,合同会社
合同会社オクトパス,大阪府摂津市千里丘東５丁目１９番３０－３０３号,2019-07-01,合同会社
合同会社カズタケ,神奈川県相模原市南区東林間８丁目１番５号,2019-07-01,合同会社
合同会社カワムラ,山口県下関市大学町４丁目３番２号,2019-07-01,合同会社
合同会社ギャラリー大竹,長野県大町市大町４０７１番地１,2019-07-01,合同会社
合同会社クイーンズ,東京都江東区豊洲４丁目９番１３号１３１０号室,2019-07-01,合同会社
合同会社クララオムニメディア,東京都品川区北品川１丁目９番７－１０１５号,2019-07-01,合同会社
合同会社クレボンタン,愛知県名古屋市西区二方町３番地の１,2019-07-01,合同会社
合同会社クローマ,東京都町田市玉川学園８丁目１９番３８号,2019-07-01,合同会社
合同会社ケーエムエー,愛媛県松山市堀江町８６６番地３８,2019-07-01,合同会社
合同会社ストレート,東京都港区虎ノ門４丁目３番２０号,2019-07-01,合同会社
合同会社セカンドウィンズ,広島県広島市安佐南区高取北１丁目４番３０号,2019-07-01,合同会社
合同会社ダイヤグラム,北海道札幌市中央区南十七条西１３丁目２番４０号,2019-07-01,合同会社
合同会社ティーンズ,東京都府中市若松町１丁目１番地の８白井ハイム４０１,2019-07-01,合同会社
合同会社テクサラダ,兵庫県西宮市甲子園砂田町４番１４号,2019-07-01,合同会社
合同会社ハートクリーン,京都府京都市南区大宮通八条下る東寺東門前町４０番地,2019-07-01,合同会社
合同会社パイン,東京都港区三田２丁目４番１１号,2019-07-01,合同会社
合同会社パーム,東京都港区虎ノ門４丁目３番２０号,2019-07-01,合同会社
合同会社プランニングティー,熊本県天草市亀場町食場６３９番地５,2019-07-01,合同会社
合同会社プランビー,東京都板橋区板橋１丁目１１番４号,2019-07-01,合同会社
合同会社マグノリア,東京都中央区日本橋２丁目７番１号,2019-07-01,合同会社
合同会社マブチ看板,静岡県浜松市東区和田町８９９番地の１,2019-07-01,合同会社
合同会社ヨークン,大阪府大阪市生野区生野西３丁目１番５号,2019-07-01,合同会社
合同会社ランタナ,熊本県熊本市東区桜木５丁目９番１１１号,2019-07-01,合同会社
合同会社リッシュウエスト,兵庫県神戸市中央区三宮町３丁目１－９堀内ビル,2019-07-01,合同会社
合同会社レイワ無線,福岡県福岡市博多区博多駅東１丁目１２番１５号,2019-07-01,合同会社
合同会社井上工業,高知県高知市長浜４４５６番地８－１０号,2019-07-01,合同会社
合同会社奥哲維事務所,愛知県一宮市奥町字郷浦１９番地１,2019-07-01,合同会社
合同会社家クリニック,山口県下松市大字末武下３９３番地２,2019-07-01,合同会社
合同会社山王サポート２号,東京都千代田区丸の内３丁目１番１号東京共同会計事務所内,2019-07-01,合同会社
合同会社山王サポート３号,東京都千代田区丸の内３丁目１番１号東京共同会計事務所内,2019-07-01,合同会社
合同会社山王サポート４号,東京都千代田区丸の内３丁目１番１号東京共同会計事務所内,2019-07-01,合同会社
合同会社山王サポート５号,東京都千代田区丸の内３丁目１番１号東京共同会計事務所内,2019-07-01,合同会社
合同会社廃棄物整理処理機構,埼玉県川口市領家２丁目３０番８－２０１－３,2019-07-01,合同会社
合同会社敬神貿易,静岡県浜松市中区佐鳴台４丁目４０番８号,2019-07-01,合同会社
合同会社栄心工業,北海道川上郡標茶町字中チャンベツ原野南一線東１０番地,2019-07-01,合同会社
合同会社武究舎,千葉県浦安市猫実２丁目３２番３５号,2019-07-01,合同会社
合同会社測量サポート,東京都港区高輪４丁目２３－６－７０８,2019-07-01,合同会社
合同会社産業創造アドバイザリー,東京都江戸川区西葛西２丁目２２番４５号レジデントプレイス西葛西４３９,2019-07-01,合同会社
合同会社田倉自動車,山口県下関市大字田倉２９６番地２,2019-07-01,合同会社
合同会社秀勢,千葉県浦安市北栄１丁目１３番７号,2019-07-01,合同会社
合同会社網干興産,神奈川県横浜市神奈川区入江１丁目２６番１４号,2019-07-01,合同会社
合同会社自由経営,東京都北区岩淵町３８－１シティータワー赤羽１４０１,2019-07-01,合同会社
合同会社踊刀,千葉県松戸市秋山３丁目２番地の３,2019-07-01,合同会社
合同会社青龍,埼玉県所沢市三ケ島５丁目８３０番地の２,2019-07-01,合同会社
合同会社高浜スカイアンドシー,長崎県長崎市高浜町３４４３番地,2019-07-01,合同会社
合同会社４ｃｏｌｏｒｓ,宮城県仙台市太白区鹿野３丁目１４番６号,2019-07-01,合同会社
合同会社５３１,埼玉県八潮市中央３丁目３１番地５,2019-07-01,合同会社
合同会社Ａ　ｆｏｕｒ　ｌｅａｆ,静岡県牧之原市細江１４４５番地１,2019-07-01,合同会社
合同会社ＡＩＤＬＰＥＣＫ,千葉県市原市加茂１丁目５番地１１ルーセントハイツＡ２０１,2019-07-01,合同会社
合同会社ＡＳＶＩＣ　ＴＲＡＤＩＮＧ,福岡県福岡市中央区清川３丁目１４番１９号,2019-07-01,合同会社
合同会社Ａｎｔｒｅｐ,大阪府大阪狭山市半田３丁目３６１番地の１,2019-07-01,合同会社
合同会社ＡｔｏＺサービス,福岡県糟屋郡粕屋町仲原１丁目７番１４号,2019-07-01,合同会社
合同会社ＢＥＹＯＮＤ,千葉県市原市若宮６丁目１２番地４,2019-07-01,合同会社
合同会社ＢＵＬＬＴＡＧ,千葉県千葉市花見川区幕張本郷５丁目１１番１０－１０１号,2019-07-01,合同会社
合同会社Ｃａｔｓ,岐阜県養老郡養老町下笠６１５番地,2019-07-01,合同会社
合同会社Ｃｏｏ,福岡県糸島市波多江２２４番地６,2019-07-01,合同会社
合同会社Ｄ＆Ｆ,福岡県久留米市国分町１４６６番地６,2019-07-01,合同会社
合同会社ＤＣ　Ｌａｂｏｒａｔｏｒｙ,千葉県市川市南大野２丁目２番地３４号,2019-07-01,合同会社
合同会社ＤｅＱｉｔＡ,大阪府藤井寺市小山藤の里町１４－１,2019-07-01,合同会社
合同会社ＥＶＯＬＵＴＩＯＮ,大阪府大阪市東淀川区下新庄３丁目５番４号３１５号,2019-07-01,合同会社
合同会社Ｅｄｕｃａｔｉｏｎ　Ｌａｂ　Ｆｕ－Ｏｎ,千葉県市川市市川３丁目３８番１５号,2019-07-01,合同会社
合同会社Ｅｖｅｒ　Ｇｒｅｅｎ,愛知県名古屋市千種区池下１丁目４番１５号川辺３１８ビル５Ａ,2019-07-01,合同会社
合同会社ＦＵＮＧＯ,福岡県福岡市博多区博多駅東３丁目３番地１０号,2019-07-01,合同会社
合同会社Ｆｏｌｉｕｍ　Ｆｌｏｒｉｓ　ＴＡＫＡＲＡＺＵＫＡ,東京都武蔵野市吉祥寺北町３丁目９－２,2019-07-01,合同会社
合同会社ＧＡＮＥＺＡ,東京都豊島区池袋２丁目５５－１１,2019-07-01,合同会社
合同会社ＨＡＶＥＮ,茨城県つくば市学園の森２丁目１３番地１７５,2019-07-01,合同会社
合同会社Ｉ,北海道河東郡音更町東通１２丁目５番地１３,2019-07-01,合同会社
合同会社Ｋ＆Ｓ　Ａｓｓｏｃｉａｔｅｓ,東京都港区東麻布２丁目８番１１－３０１号,2019-07-01,合同会社
合同会社Ｋ－ＮＯ,群馬県吾妻郡嬬恋村大字袋倉７９５番地４号,2019-07-01,合同会社
合同会社ＮＡＮＫＡＩ,神奈川県相模原市中央区田名３１４８番地５,2019-07-01,合同会社
合同会社ＯＬＯ,京都府京都市東山区慈法院庵町５０６番地－１０４号,2019-07-01,合同会社
合同会社ＯＳＡＭＵ,宮城県仙台市青葉区宮町１丁目６番３８号,2019-07-01,合同会社
合同会社ＯｖｅｒＶｅｉｎ,新潟県長岡市神谷１６５５番地８,2019-07-01,合同会社
合同会社ＰＢＯ,和歌山県有田郡有田川町大字天満６３３番地３,2019-07-01,合同会社
合同会社ＲＡＶＥＮＮＡ,東京都渋谷区神宮前３丁目１４番１５号石崎ビル２０２号室,2019-07-01,合同会社
合同会社ＲＩＳＥ,東京都渋谷区代々木１丁目５３－１,2019-07-01,合同会社
合同会社Ｒａｄｉｃａｌ,福岡県福岡市中央区大宮２丁目６番１１号第１４泰平ビル３－１,2019-07-01,合同会社
合同会社Ｓｅａｍ,群馬県高崎市下滝町５１１番地５号,2019-07-01,合同会社
合同会社ＳｈａｒｉｎｇＴｉｍｅ,新潟県新潟市東区物見山３丁目２番８号,2019-07-01,合同会社
合同会社ＳｏＬ,東京都世田谷区下馬６丁目２番１１号,2019-07-01,合同会社
合同会社Ｓｐｅｃｉａｌ　ｔｈａｎｋｓ,長野県松本市県１丁目３番４７号,2019-07-01,合同会社
合同会社ＶＩＲＴＵＥ,東京都千代田区二番町９番３号ＴＨＥＢＡＳＥ麹町,2019-07-01,合同会社
土地家屋調査士法人清崎事務所,熊本県熊本市南区南高江７丁目６番１４号,2019-07-01,その他の設立登記法人
夢ファクトリー合同会社,東京都渋谷区桜丘町２３番１７号シティコート桜丘４０８,2019-07-01,合同会社
天龍インタートレード株式会社,静岡県三島市大場２５番地,2019-07-01,株式会社
安格不動産發展株式会社,大阪府大阪市淀川区西宮原２丁目６番１６号新大阪コーポビアネーズ５２７号室,2019-07-01,株式会社
寿栄運送株式会社,奈良県天理市中山町５１２番地２,2019-07-01,株式会社
小坂電気設備合同会社,鳥取県米子市河崎３３１５番地８７,2019-07-01,合同会社
岐阜長良川鵜飼保存会,岐阜県岐阜市司町４０番地１岐阜市役所文化財保護課内,2019-07-01,その他
平高ボーリング株式会社,長崎県諫早市高来町折山２９８番地１,2019-07-01,株式会社
日吉合同会社,千葉県鎌ケ谷市初富９６番地４０,2019-07-01,合同会社
日本プレミアム保証株式会社,大阪府大阪市北区天満橋１丁目６番１８号,2019-07-01,株式会社
日本小幸製薬株式会社,東京都中央区日本橋蛎殻町１丁目３番５号共同ビル２階２３号,2019-07-01,株式会社
東京投資管理リサーチ合同会社,東京都西東京市向台町５丁目５番３８号,2019-07-01,合同会社
株式会社うさぎ農園,熊本県合志市野々島１２９５,2019-07-01,株式会社
株式会社くさかんむり,兵庫県神戸市北区淡河町淡河１４４７番地,2019-07-01,株式会社
株式会社さかいＬｏｇｉ,愛知県一宮市天王２丁目３番１１号渡辺ビル１０４号,2019-07-01,株式会社
株式会社なみまち,福井県あわら市波松第２５号１番地,2019-07-01,株式会社
株式会社はせる,栃木県宇都宮市桜１丁目７番１４号ＨＡＲＢＯＲ３０３,2019-07-01,株式会社
株式会社やまのこしば,新潟県新潟市南区白根魚町１番１２号,2019-07-01,株式会社
株式会社わくわくＬａｂｏ,愛知県名古屋市昭和区川名山町１丁目１０番地の１,2019-07-01,株式会社
株式会社アイナコーポレーション,千葉県松戸市仲井町２丁目４４番地大橋ビル１階,2019-07-01,株式会社
株式会社アイリスマネジメント,東京都国立市東２丁目２１番地３号,2019-07-01,株式会社
株式会社アイワンド,東京都荒川区東尾久２丁目２番９号三祥ビル２１０号,2019-07-01,株式会社
株式会社アップデート不動産,新潟県長岡市古正寺３丁目１１６番地,2019-07-01,株式会社
株式会社アトリエロジウラ,静岡県焼津市相川１４６３番地の１,2019-07-01,株式会社
株式会社アネシス,岡山県倉敷市老松町４丁目１２番４３号,2019-07-01,株式会社
