法人名,住所,設立日,法人種別
株式会社Ｆｏｒｅｓｔｅｒ　Ｃｒｅａｔｅ,東京都世田谷区北烏山２丁目３－６,2017-02-13,株式会社
株式会社ＦｕＲｕＲｉ,東京都港区東麻布２丁目３３番５号,2017-02-13,株式会社
株式会社Ｇ．Ｔ．Ｍ,愛知県名古屋市中区松原３丁目７番１５号,2017-02-13,株式会社
株式会社ＧＡＴＥ,香川県丸亀市川西町北１３１０番地７,2017-02-13,株式会社
株式会社ＧＯＤ,神奈川県横浜市港南区港南台３丁目１２番１０号,2017-02-13,株式会社
株式会社Ｈ．Ｈ．Ｓ,埼玉県さいたま市浦和区針ヶ谷４丁目４番３号,2017-02-13,株式会社
株式会社ＨＡＴＡＫＥ,熊本県玉名市山田３５３番地,2017-02-13,株式会社
株式会社Ｉ,新潟県三条市直江町４丁目１１番１７－５号,2017-02-13,株式会社
株式会社Ｉ・Ｂ・Ｃ,群馬県高崎市江木町１４６０番地７,2017-02-13,株式会社
株式会社ＩＪパートナーズ,東京都新宿区下宮比町２番２８号,2017-02-13,株式会社
株式会社ＩＱＵＩＣＫ,東京都渋谷区初台１丁目３８番地１０号第二近江ビル４０５,2017-02-13,株式会社
株式会社Ｉｔｅｃ,愛知県名古屋市熱田区千年１丁目４番２２号,2017-02-13,株式会社
株式会社Ｊ．Ｓ．Ｂ．,沖縄県豊見城市字真玉橋１１６番地,2017-02-13,株式会社
株式会社ＪＢファーム,香川県仲多度郡まんのう町炭所西２７８２番地２,2017-02-13,株式会社
株式会社ＪＯＨプロジェクト,大阪府堺市南区美木多上７６番地,2017-02-13,株式会社
株式会社Ｋプランニング,愛媛県宇和島市堀端町１番４１号,2017-02-13,株式会社
株式会社Ｋ・Ｓ,東京都国分寺市泉町３丁目１６番２１号,2017-02-13,株式会社
株式会社Ｋ－ＴＯＰ,滋賀県草津市芦浦町７７７番地３２,2017-02-13,株式会社
株式会社ＫＳＣ,東京都江東区永代２丁目３４番７号,2017-02-13,株式会社
株式会社ＫＷＨ,東京都台東区千束１丁目６番１号,2017-02-13,株式会社
株式会社Ｌ＆Ｒヴィレッジ,神奈川県横浜市旭区今宿西町２００番地６,2017-02-13,株式会社
株式会社Ｌ．ＧＲＯＵＮＤ,埼玉県戸田市大字新曽１８６２番地の２（トゥジュール・ヴェール２０３号室）,2017-02-13,株式会社
株式会社ＬＡＵＬＥＡ,群馬県前橋市岩神町１丁目１４番１２号,2017-02-13,株式会社
株式会社Ｌａ　ｎａｔｉｏｎ,福岡県福岡市中央区草香江２丁目１０番２６号,2017-02-13,株式会社
株式会社Ｌｏｖｅ　Ｌａｂｏ,東京都杉並区梅里２丁目３５番１３号マーガレットハイツ３０２,2017-02-13,株式会社
株式会社ＭＫＹキッチン,茨城県筑西市玉戸１０４２番地６,2017-02-13,株式会社
株式会社ＭＵＤＯＲＡ　ｒｕｎ　ｐａｒｔｙ,広島県福山市山野町大字山野字下５８番８,2017-02-13,株式会社
株式会社Ｍａｌｉｋ　Ｍｏｔｏｒｓ,宮城県大崎市古川小野字東舘３３番,2017-02-13,株式会社
株式会社Ｍｉｎａｔａ,神奈川県川崎市中原区上小田中１丁目９番１２号,2017-02-13,株式会社
株式会社Ｎ．Ｋ．ＳＵＮ,東京都町田市原町田４丁目１１番１３号,2017-02-13,株式会社
株式会社ＮＪ－Ｓｏｆｔ,千葉県船橋市宮本９丁目２番１０－５０３号,2017-02-13,株式会社
株式会社ＮＵＭＢＥＲ,埼玉県熊谷市筑波２丁目６１番地大谷ビルヂィング４階Ｂ室,2017-02-13,株式会社
株式会社Ｎｕｒｓｉｎｇ　Ｃａｒｅ　Ｐｌｕｓ,佐賀県武雄市武雄町大字武雄５５９８番地３,2017-02-13,株式会社
株式会社ＯＭＳ,東京都台東区上野６丁目１６番１７号,2017-02-13,株式会社
株式会社ＯＭＹ,東京都渋谷区初台１丁目４４番１０号,2017-02-13,株式会社
株式会社ＰＥＡＣＨＥＳ,東京都府中市小柳町５丁目１９番地の２１,2017-02-13,株式会社
株式会社Ｐｅｌｅ,三重県伊賀市上野東町２９６４番地,2017-02-13,株式会社
株式会社ＲＥＮＴＯＮ,東京都港区虎ノ門２丁目７番５号,2017-02-13,株式会社
株式会社ＲＭＫ,熊本県合志市野々島２４６１番地,2017-02-13,株式会社
株式会社Ｒｅｍａｉｎｓ　Ｃｏｎｓｕｌｔｉｎｇ,愛知県名古屋市南区柵下町１丁目３２番地,2017-02-13,株式会社
株式会社Ｓ－ＳＴＹＬＥ,東京都北区田端１丁目１２番６号,2017-02-13,株式会社
株式会社ＳＥＩＴＯＫＵ,埼玉県幸手市栄五番１２－２０２号,2017-02-13,株式会社
株式会社ＳＨＯＪＩ,大阪府枚方市三矢町１番２１号,2017-02-13,株式会社
株式会社ＳＫ建装,奈良県香芝市鎌田２００番地４,2017-02-13,株式会社
株式会社Ｓａｉｇａ,沖縄県那覇市字上之屋３７４番地３ミオカステーロ泊５０２,2017-02-13,株式会社
株式会社Ｓｏｌｅｉｃ,東京都千代田区東神田１丁目７番２号,2017-02-13,株式会社
株式会社ＳｔｙｌｅＫ,愛知県一宮市多加木４丁目２番５号,2017-02-13,株式会社
株式会社Ｔ＆Ａ,神奈川県横浜市青葉区美しが丘３丁目１７番地２３,2017-02-13,株式会社
株式会社Ｔ＆Ｆ,東京都港区港南５丁目１番４号スカイクレストビュー東京６０５号,2017-02-13,株式会社
株式会社ＴＨＥＩＡ,東京都港区南青山５丁目１７番６号,2017-02-13,株式会社
株式会社ＴＬＡＴＯ,東京都千代田区神田錦町３丁目１６番地五十嵐ビル５階,2017-02-13,株式会社
株式会社ＴＳＵＢＯＭＡＴＳＵ,茨城県笠間市美原３丁目４番１５号,2017-02-13,株式会社
株式会社Ｔｏｎｅ　ｍａｎａｇｅｍｅｎｔ,東京都稲城市東長沼２４１６番地プラウドシティ南山６３４,2017-02-13,株式会社
株式会社Ｔｔｉｒｒａ,長野県諏訪郡富士見町富士見３１０１番地４９,2017-02-13,株式会社
株式会社ＷＤ,愛知県名古屋市熱田区三本松町２０番６号,2017-02-13,株式会社
株式会社Ｗｏｒｌｄ　Ｏｎｅ,北海道札幌市豊平区月寒東一条１１丁目７番９号,2017-02-13,株式会社
株式会社ＹＴ,京都府京都市伏見区羽束師志水町１９１番地１３,2017-02-13,株式会社
株式会社ａｚｚｕｒｒｏ,東京都目黒区碑文谷５丁目１５番６ー６０１号ダイナシティ碑文谷,2017-02-13,株式会社
株式会社ｅｎｃｏｕｎｔｅｒ,東京都品川区東五反田４丁目１０番２２－２０１号,2017-02-13,株式会社
株式会社ｉｎｆｉｎｉｔｙ,神奈川県横浜市旭区中希望が丘１７７番地の１,2017-02-13,株式会社
株式会社ｖａｌｏＴＥＣ,東京都羽村市神明台１丁目１１番地１０,2017-02-13,株式会社
椻下建設株式会社,富山県下新川郡入善町下飯野７３６番地１０,2017-02-13,株式会社
極東エンジニアリング合同会社,北海道札幌市西区発寒七条７丁目７番２０,2017-02-13,合同会社
楽樹合同会社,岡山県岡山市南区藤田４１３番地１０,2017-02-13,合同会社
民泊ファンド１号合同会社,東京都中央区築地１丁目３番４号築地ニイクラビル２Ｆ,2017-02-13,合同会社
涵社株式会社,埼玉県越谷市蒲生寿町１８番３２号－１Ｆ,2017-02-13,株式会社
清光土木株式会社,宮城県仙台市宮城野区小田原３丁目４番３５号,2017-02-13,株式会社
特定非営利活動法人アスト,京都府城陽市寺田垣内後８２番地の１,2017-02-13,その他の設立登記法人
特定非営利活動法人ネクストサポートステージ,東京都府中市住吉町４丁目１８番地の３山田ビル２０３,2017-02-13,その他の設立登記法人
特定非営利活動法人品川中小企業診断士会,東京都品川区南大井３丁目２６番３－２０１号,2017-02-13,その他の設立登記法人
特定非営利活動法人立山クラフト舎,富山県中新川郡立山町上中１９７番地,2017-02-13,その他の設立登記法人
特定非営利活動法人赤ちゃん抱っこ・こども食堂ふれあいコミュニティー千葉,千葉県木更津市中央１丁目１番６号木更津市市民活動支援センター隣,2017-02-13,その他の設立登記法人
特定非営利活動法人Ｈａｔｃｈ,神奈川県横浜市泉区岡津町３５３番地サニーウェルＤ－３号,2017-02-13,その他の設立登記法人
特定非営利活動法人ＰＵＬＣＩＮＩ　ＦＣ,神奈川県川崎市中原区上小田中６丁目４１番７号宮前ハイツ１０２,2017-02-13,その他の設立登記法人
白神テクノ合同会社,岡山県倉敷市児島小川９丁目８番５３号プラティーヌＫ－Ｂ－１０１,2017-02-13,合同会社
白鷹町ラジコン防除受託組合,山形県西置賜郡白鷹町大字荒砥乙７２６－１,2017-02-13,その他
石井イノベーションサービス株式会社,千葉県市原市姉崎３２３３の２,2017-02-13,株式会社
神戸メカニカル株式会社,兵庫県神戸市垂水区小束山１丁目２番地６号棟１０４号,2017-02-13,株式会社
篠山市エコツーリズム推進協議会,兵庫県丹波篠山市北新町４１番地篠山市役所農都環境課内,2017-02-13,その他
農事組合法人みらいの光,茨城県つくばみらい市南太田３７３番地,2017-02-13,その他の設立登記法人
金華媒体株式会社,東京都新宿区百人町２丁目１番２号,2017-02-13,株式会社
鎌倉トレーディング合同会社,神奈川県鎌倉市由比ガ浜４丁目４番３９号,2017-02-13,合同会社
電磁波シールド株式会社,東京都千代田区九段南４丁目７番１６号,2017-02-13,株式会社
風の子クラブ,岡山県岡山市北区芳賀５１１１－２２,2017-02-13,その他
高橋ＧＬ株式会社,東京都練馬区石神井台２丁目３番１６号コーポ青葉２０３,2017-02-13,株式会社
高部商事株式会社,埼玉県戸田市美女木４丁目２２番地の１２,2017-02-13,株式会社
鷹取キムチの里づくり実行委員会,高知県高岡郡檮原町下折渡２１０,2017-02-13,その他
ＡＬＴ株式会社,東京都千代田区外神田４丁目１４番１号,2017-02-13,株式会社
Ａｌｐｈａ　Ｍｏｄｅ合同会社,千葉県柏市柏９７１番地７,2017-02-13,合同会社
Ａｒｋ合同会社,鹿児島県薩摩郡さつま町旭町１６番地１,2017-02-13,合同会社
ＢＥＩＧＥ　ＣＲＥＡＴＩＶＥ＆ＣＯ．，ＩＮＣ．,神奈川県横浜市中区山下町１６２番地１横浜飛栄ビルディング４０８号室,2017-02-13,外国会社等
ＢＬＯＯＭＹ合同会社,愛知県名古屋市中村区名駅南３丁目１１番２０号名駅南ランドビル１Ｆ,2017-02-13,合同会社
Ｂｉｎｇ　Ｗｉｎ商事合同会社,東京都新宿区赤城下町４５ＫＢＣ－Ｂ－３号,2017-02-13,合同会社
ＤＯＮＧＷＯＮＪＡＰＡＮ株式会社,愛知県名古屋市北区萩野通１丁目４５番地,2017-02-13,株式会社
ＥＣモード合同会社,埼玉県さいたま市浦和区東仲町１５番８号,2017-02-13,合同会社
ＥＬＬＩＥ株式会社,東京都渋谷区神泉町２０番１６号エクセルシオール渋谷８０１,2017-02-13,株式会社
ＥＯＮ　ＡＳＩＡインベストメント合同会社,東京都台東区上野１丁目２０番１号,2017-02-13,合同会社
ＥＰＲメディシン・ジャパン株式会社,熊本県熊本市東区湖東３丁目２１番２４号,2017-02-13,株式会社
Ｆｏｒｔｕｎｅ　Ｌｉｆｅ合同会社,静岡県浜松市中区和地山１丁目８番２１号,2017-02-13,合同会社
ＧＯＬＤ　Ｖ株式会社,茨城県古河市茶屋新田１４２番地１,2017-02-13,株式会社
ＨＡＮＤＡ　ＴＯＫＹＯ株式会社,東京都新宿区新宿５丁目１５番６光陽ビル７０４号,2017-02-13,株式会社
ＩＫＥ　ＪＰ合同会社,東京都豊島区西池袋１丁目４番５号,2017-02-13,合同会社
ＪＭＴ合同会社,東京都港区芝１丁目２番１－２００７号,2017-02-13,合同会社
ＪＯＹＴＥＡ株式会社,東京都文京区本駒込５丁目７１－８駒込台ハイツＫ５０１,2017-02-13,株式会社
Ｊａｐａｎ　Ｃｏｎｓｕｌｔｉｎｇ　ａｎｄ　Ｅ‐ｃｏｍｍｅｒｃｅ　Ｓｅｒｖｉｃｅｓ合同会社,神奈川県藤沢市本鵠沼１丁目９番１８号,2017-02-13,合同会社
Ｊｏｉｎｆｏｒｃｅｓ株式会社,東京都港区南青山２丁目１０番６号外苑ビル３階,2017-02-13,株式会社
Ｋ－トラストプラン合同会社,東京都大田区池上７丁目９番８号ガーデンホーム池上３０６,2017-02-13,合同会社
ＫＡＴＡＳＥ株式会社,千葉県四街道市栗山１０７３番地１０１,2017-02-13,株式会社
ＫＤＳ　ＰＲＯＭＯＴＩＯＮ合同会社,沖縄県南城市知念字安座真１２３２番地１,2017-02-13,合同会社
ＫＨＡＤＫＡ合同会社,神奈川県川崎市幸区下平間２８７番地,2017-02-13,合同会社
Ｋｏｄａｍａ合同会社,東京都目黒区目黒２丁目１１番３号印刷工場１階,2017-02-13,合同会社
ＬＵＺ株式会社,神奈川県横浜市鶴見区元宮２丁目１番８２号,2017-02-13,株式会社
Ｌｅａｎ　Ｉｎ　Ｊａｐａｎ株式会社,東京都文京区小石川５丁目２番１４号村木ビル３０１室,2017-02-13,株式会社
Ｍ＆Ｓ不動産株式会社,兵庫県明石市西明石北町３丁目１２番９号,2017-02-13,株式会社
Ｍａｉｃａｔ合同会社,埼玉県さいたま市見沼区大字中川１４４番地４７,2017-02-13,合同会社
Ｍａｒｉｋｏ　Ｄｒｅａｍ株式会社,新潟県新潟市西区ときめき東１丁目１６番地２８,2017-02-13,株式会社
Ｍｉｅ　Ｔｒａｎｓｌａｔｉｏｎ　Ｓｅｒｖｉｃｅｓ合同会社,兵庫県神戸市長田区大日丘町１丁目５番１２号,2017-02-13,合同会社
Ｍｕｓｉｋ　Ｎａｔｕｒ合同会社,埼玉県三郷市半田１１４２番１,2017-02-13,合同会社
Ｍｙｔｓ合同会社,埼玉県草加市青柳７丁目５１番１４－３０５号,2017-02-13,合同会社
ＮＩＳ株式会社,埼玉県さいたま市中央区大字下落合１０７７ＦＳマンション１階,2017-02-13,株式会社
ＮＯＮＯＭＥ株式会社,東京都渋谷区道玄坂２丁目１０番１２号新大宗ビル３号館５３１号,2017-02-13,株式会社
ＮＰＯ法人ハックジャパン,大阪府豊中市桜の町３丁目７番７号,2017-02-13,その他の設立登記法人
ＮＰＯ法人日本ファミリィダンス協会,東京都新宿区三栄町１８番地３４岡戸ビル２Ｆ,2017-02-13,その他の設立登記法人
Ｎｅｔｅｘｂｏｏｍ　Ｊａｐａｎ株式会社,大阪府大阪市中央区南船場３丁目１２番２１号心斎橋プラザビル新館４階,2017-02-13,株式会社
ＱＴ佐世保不動産販売合同会社,東京都新宿区四谷２丁目９番地１５あると綜合事務所内,2017-02-13,合同会社
ＳＨＵホールディングス株式会社,東京都港区芝浦４丁目２０番２－３０７号,2017-02-13,株式会社
ＳＲＤ１株式会社,東京都新宿区西新宿２丁目４番１号,2017-02-13,株式会社
ＳＲＤ２株式会社,東京都新宿区西新宿２丁目４番１号,2017-02-13,株式会社
Ｓａｉｌｉｎｇ＆Ｃｏｍｐａｎｙ株式会社,東京都港区芝５丁目２９番２２－１００１号,2017-02-13,株式会社
Ｓａｎｏｊａ　Ｅｎｔｅｒｐｒｉｓｅｓ合同会社,群馬県前橋市上泉町２２１サニーホーム２０１,2017-02-13,合同会社
Ｓｅｃｕｒｅ　Ｓｅｒｖｉｃｅ株式会社,新潟県新潟市中央区女池３丁目３２番１号２０３,2017-02-13,株式会社
Ｓｏｕｔｈｅｒｎ　Ｃｒｏｓｓ合同会社,神奈川県茅ヶ崎市東海岸北３丁目１４－４３,2017-02-13,合同会社
Ｓｐｈｅｒｅ株式会社,東京都世田谷区下馬２丁目３番４号,2017-02-13,株式会社
Ｔ．Ｍカンパニー合同会社,千葉県浦安市北栄１丁目４番２６号,2017-02-13,合同会社
ＴＭハートナーズ株式会社,茨城県牛久市栄町２丁目１１２番地の２,2017-02-13,株式会社
Ｗ２Ｗ合同会社,沖縄県那覇市字上之屋３４０番地１,2017-02-13,合同会社
ＹＣＣ株式会社,埼玉県吉川市中野２０３番地８,2017-02-13,株式会社
ＺＥＴＡ　ＪＡＰＡＮ株式会社,東京都大田区大森北４丁目８番５号,2017-02-13,株式会社
ｂａｃｏｏｒ株式会社,大阪府吹田市円山町４番２３号（５０７）,2017-02-13,株式会社
ｉＭｏｂｉｌｅ　Ｍｉｎｄ合同会社,東京都小平市鈴木町１丁目４６６－１８新小金井赤レンガ倉庫２Ｆ－Ｂ,2017-02-13,合同会社
ｉｐｃ株式会社,東京都品川区南大井２丁目１２番１－１４１０号,2017-02-13,株式会社
ｔｗｉｃｅ　ｕｐ株式会社,広島県広島市中区土橋町４番２４－４０２号,2017-02-13,株式会社
おかげさまお互いさま合同会社,東京都文京区湯島３丁目２８番１８号ＡＤホームズ２Ｆ,2017-02-14,合同会社
ひかりレンタル株式会社,神奈川県川崎市幸区南幸町１丁目１３番地８,2017-02-14,株式会社
ひよこアセットマネジメント株式会社,東京都港区麻布永坂町１３番地永坂更科中央ビル９０１,2017-02-14,株式会社
ふどうさんの窓口株式会社,広島県東広島市西条町寺家４５０１番地１,2017-02-14,株式会社
まる不動産合同会社,福岡県福岡市西区野方２丁目２２番２４号,2017-02-14,合同会社
よるのしろ株式会社,東京都府中市分梅町５丁目３番地の２４,2017-02-14,株式会社
らいくじょぶかんぱにー株式会社,東京都葛飾区新小岩２丁目９番１号,2017-02-14,株式会社
アイクリート株式会社,大阪府大阪市北区松ケ枝町７番２２号高橋ビル東６号館５階,2017-02-14,株式会社
アペックス２１株式会社,神奈川県横浜市青葉区美しが丘西３丁目５１番地３,2017-02-14,株式会社
アームズ株式会社,神奈川県相模原市南区東大沼２丁目１９番５号,2017-02-14,株式会社
インテリプラス株式会社,愛知県江南市江森町上７８,2017-02-14,株式会社
インテルホーム株式会社,埼玉県草加市谷塚１丁目２番４３号－２０６,2017-02-14,株式会社
オーガニック・テックファーム株式会社,京都府京都市伏見区治部町１０５番地京都市成長産業創造センター内,2017-02-14,株式会社
カレー株式会社,東京都羽村市小作台１丁目２５番地２,2017-02-14,株式会社
キャリア・ステート株式会社,鹿児島県鹿児島市上之園町２４番１１号,2017-02-14,株式会社
クリエイトジョブ株式会社,富山県富山市水橋伊勢屋１０６番地,2017-02-14,株式会社
ケンテッククリエイト株式会社,北海道札幌市手稲区前田八条１９丁目１番１０号,2017-02-14,株式会社
ココカラ運営協議会,福岡県宗像市日の里１丁目３１－１,2017-02-14,その他
コモド・クリエイティブ・コンサルタンツ合同会社,山梨県南アルプス市榎原４３１番地２,2017-02-14,合同会社
コンピュータ・ターミナル株式会社,大阪府大阪市中央区南久宝寺町３丁目４番１４号,2017-02-14,株式会社
サイトウ自然環境株式会社,山形県山形市十日町２丁目２番３２－１１０５号ファミール十日町,2017-02-14,株式会社
サンクレイル株式会社,愛知県名古屋市千種区今池４丁目１６番２７号,2017-02-14,株式会社
サンライトケア株式会社,和歌山県和歌山市西庄１０５６番地２５７,2017-02-14,株式会社
サンライト合同会社,京都府京都市山科区勧修寺西北出町２２番,2017-02-14,合同会社
シティテラスコムズ株式会社,東京都練馬区中村南３丁目１８番８号,2017-02-14,株式会社
シンセリティサービス株式会社,和歌山県和歌山市吹屋町２丁目１０８番地７,2017-02-14,株式会社
ジャパンコンテンツクリエイション株式会社,神奈川県川崎市高津区梶ケ谷２丁目４番地１梶ヶ谷ドエリング５０６,2017-02-14,株式会社
スタートワン合同会社,東京都港区芝２丁目２７－８、１０階,2017-02-14,合同会社
スヤマ・インフィル株式会社,東京都武蔵野市境２丁目４番４号,2017-02-14,株式会社
セブン商事株式会社,東京都八王子市西寺方町１３０１番地,2017-02-14,株式会社
タクマ総合企画株式会社,大分県大分市大字上宗方１１７番地の２,2017-02-14,株式会社
チョコレートボックス合同会社,埼玉県大里郡寄居町大字末野９００番地２,2017-02-14,合同会社
テックフジワラ株式会社,三重県亀山市野村３丁目２番３１ー２０１号プリムローズ,2017-02-14,株式会社
デザインハウス宮崎株式会社,宮崎県西都市大字右松６９８番１,2017-02-14,株式会社
トコトコ合同会社,東京都港区東新橋２丁目１０番１０号東新橋ビル２階,2017-02-14,合同会社
トラストコネクション株式会社,福岡県福岡市南区玉川町５番１１－３０１号,2017-02-14,株式会社
トータルアドバイザー横浜合同会社,神奈川県横浜市港南区下永谷２丁目２７番４－４０４号,2017-02-14,合同会社
ニューモード株式会社,東京都渋谷区代々木３丁目４６番１６号,2017-02-14,株式会社
ネットトラスト合同会社,大阪府豊中市永楽荘４丁目８番１８号３０１号室,2017-02-14,合同会社
ヒューマンケアーガーデン株式会社,福岡県福岡市中央区笹丘２丁目１０番１７号,2017-02-14,株式会社
ビーコンサービス株式会社,東京都港区虎ノ門４丁目３番２０号神谷町ＭＴビル１４階,2017-02-14,株式会社
ファーストライジング合同会社,鹿児島県薩摩川内市宮崎町２９２１番地３サンロードＣ棟１０１号,2017-02-14,合同会社
フォーライフ合同会社,茨城県鹿嶋市大字平井１１８４番地３Ａｌｔａｉｒ１０２,2017-02-14,合同会社
フジワラキャピタルマネジメント合同会社,東京都港区白金台１丁目１番２１－５０５号,2017-02-14,合同会社
ブッダインターナショナル合同会社,東京都大田区久が原２丁目２０番９号,2017-02-14,合同会社
プログレス不動産販売株式会社,東京都新宿区西新宿６丁目５－１新宿アイランドタワー４１階,2017-02-14,株式会社
ホテルエージェントジャパン株式会社,千葉県流山市南流山３丁目９番地の７,2017-02-14,株式会社
マジックマップ合同会社,東京都新宿区西新宿４丁目３９番２０号,2017-02-14,合同会社
ミライズ株式会社,埼玉県川越市連雀町１４番地２,2017-02-14,株式会社
モシリトイ・ファーム合同会社,北海道虻田郡ニセコ町字富士見１１８番地,2017-02-14,合同会社
モデシェンド合同会社,東京都港区六本木５丁目１２番７－１０５号,2017-02-14,合同会社
ヨシオキカク株式会社,東京都新宿区白銀町６番１－７０３号,2017-02-14,株式会社
ライフナビ株式会社,京都府京都市西京区川島調子町１６番８,2017-02-14,株式会社
ラ・ステップ株式会社,神奈川県川崎市川崎区昭和２丁目１１番２３－２０１号,2017-02-14,株式会社
ワイズウッズ・ツー合同会社,東京都渋谷区代官山町２０番９号,2017-02-14,合同会社
ワールドシェアホーム合同会社,千葉県印旛郡酒々井町馬橋６７０番地１,2017-02-14,合同会社
ヴォシアナ株式会社,東京都港区麻布狸穴町６０－１,2017-02-14,株式会社
一般社団法人あきんどなまか,山形県鶴岡市美咲町１番５号,2017-02-14,その他の設立登記法人
一般社団法人しげんカフェシステムズ,愛知県津島市唐臼町代官田９１番地,2017-02-14,その他の設立登記法人
一般社団法人とこ,滋賀県野洲市西河原５８６番地１,2017-02-14,その他の設立登記法人
一般社団法人にじ,東京都葛飾区白鳥３丁目３２番４０号,2017-02-14,その他の設立登記法人
一般社団法人まどいせん,福岡県筑紫野市桜台２丁目１７番１号（コートビレッジ後藤Ａ２０３号）,2017-02-14,その他の設立登記法人
一般社団法人アイスクール,東京都文京区本郷５丁目２７番８号赤門樋口ビル２階,2017-02-14,その他の設立登記法人
一般社団法人アートカルチャーケア協会,大阪府大阪市天王寺区大道３丁目４番３号１０１,2017-02-14,その他の設立登記法人
一般社団法人オフィスＳＴＹ,長野県北安曇郡白馬村大字北城８７２１番地の１,2017-02-14,その他の設立登記法人
