法人名,住所,設立日,法人種別
あき産業合同会社,東京都台東区浅草橋５丁目２４番８－８０３号,2018-02-01,合同会社
くどう住設機器販売株式会社,北海道札幌市白石区栄通８丁目４番１５号,2018-02-01,株式会社
さくら合同会社,奈良県生駒市小明町１０６０番地５,2018-02-01,合同会社
まつやま農園株式会社,兵庫県姫路市林田町松山２２５番地３,2018-02-01,株式会社
みらい技研合同会社,神奈川県横浜市西区戸部本町２６番３号,2018-02-01,合同会社
アイデア株式会社,福岡県北九州市小倉北区片野４丁目２１番８－４０５号,2018-02-01,株式会社
アガリエ合同会社,沖縄県那覇市泉崎２丁目２２番地３,2018-02-01,合同会社
アグリ創研株式会社,東京都武蔵野市吉祥寺東町４丁目３番７号,2018-02-01,株式会社
アーキインネクスト合同会社,北海道札幌市中央区南七条西１丁目２番地１ディークラディアＳ７－４０５号,2018-02-01,合同会社
アースエナジー合同会社,東京都大田区鵜の木２丁目４１番１３号,2018-02-01,合同会社
イベンタス株式会社,東京都新宿区市谷山伏町２番１３号,2018-02-01,株式会社
ゲイトアシスト合同会社,埼玉県さいたま市南区南浦和２丁目３０番２号１０１,2018-02-01,合同会社
コロンビアホテル＆リゾーツ株式会社,東京都渋谷区渋谷２丁目１７番３号,2018-02-01,株式会社
コードクリードアセットマネージメント株式会社,東京都目黒区上目黒５丁目８番８号,2018-02-01,株式会社
サンアシストエナジー株式会社,栃木県真岡市熊倉２丁目２８番地４,2018-02-01,株式会社
サンマルコカンパニー合同会社,千葉県船橋市宮本８丁目１６番９号,2018-02-01,合同会社
ジュエルジャパン合同会社,埼玉県戸田市下戸田１丁目１０番１２号スカイパレス５０２,2018-02-01,合同会社
スタークリーン株式会社,東京都八王子市寺町２０番地１,2018-02-01,株式会社
ゼロオリジン株式会社,東京都品川区北品川１丁目９番７号トップルーム品川１０１５号,2018-02-01,株式会社
トレミーフィット株式会社,東京都港区虎ノ門１丁目１５－１１第二名和ビル１０階,2018-02-01,株式会社
バズルパ合同会社,沖縄県島尻郡南風原町字宮平３４２番地４,2018-02-01,合同会社
パーソナル・アクセス株式会社,北海道旭川市忠和五条４丁目１１番９号,2018-02-01,株式会社
フォレストガール株式会社,大阪府大阪市浪速区元町１丁目７番２２号,2018-02-01,株式会社
フォーチュン株式会社,東京都渋谷区代々木４丁目７番３号,2018-02-01,株式会社
プロマスト・セーフティ株式会社,愛知県刈谷市野田町陣戸池１０１番地３２,2018-02-01,株式会社
プロマスト・マネジメント株式会社,愛知県額田郡幸田町大字大草字三ツ石３１番地１,2018-02-01,株式会社
ホープボート株式会社,東京都港区港南２丁目１６番４号品川グランドセントラルタワー８階,2018-02-01,株式会社
ボンド株式会社,福岡県福岡市中央区薬院３丁目３番８号,2018-02-01,株式会社
ポーリー・プラスａ号合同会社,東京都千代田区丸の内３丁目１番１号東京共同会計事務所内,2018-02-01,合同会社
ポーリー・プラスｂ号合同会社,東京都千代田区丸の内３丁目１番１号東京共同会計事務所内,2018-02-01,合同会社
ポーリー・プラスｃ号合同会社,東京都千代田区丸の内３丁目１番１号東京共同会計事務所内,2018-02-01,合同会社
ポーリー・プラスｄ号合同会社,東京都千代田区丸の内３丁目１番１号東京共同会計事務所内,2018-02-01,合同会社
ポーリー・プラスｅ号合同会社,東京都千代田区丸の内３丁目１番１号東京共同会計事務所内,2018-02-01,合同会社
マッケンビジネスホールディングス株式会社,東京都千代田区九段南３丁目７番８号九段梅田ビル２階,2018-02-01,株式会社
ミライエルアセットマネジメント合同会社,大阪府吹田市垂水町１丁目２８番２８号,2018-02-01,合同会社
メディカルチアーズ株式会社,埼玉県戸田市大字新曽２０１番地オークリーフ３０２号室,2018-02-01,株式会社
モグナ株式会社,東京都港区赤坂１丁目１４番５号,2018-02-01,株式会社
ユートピア・クラブ合同会社,大阪府大阪市北区天神橋２丁目２－８日宝南森町ビル３０６,2018-02-01,合同会社
ライドクリエイト株式会社,大阪府枚方市茄子作１丁目１２番１８号,2018-02-01,株式会社
ラーンフォレスト合同会社,東京都板橋区泉町３番８－６０２号シティコープ本蓮沼,2018-02-01,合同会社
一般社団法人とかち地域活性化支援機構,北海道帯広市東二条南５丁目１番地６,2018-02-01,その他の設立登記法人
一般社団法人アグリカルチャー・オーガニック,神奈川県相模原市南区松が枝町１５番１１－４０３号,2018-02-01,その他の設立登記法人
一般社団法人アジア女性自立支援協会,東京都世田谷区池尻４丁目３３番１１号ダイセイビル２０１,2018-02-01,その他の設立登記法人
一般社団法人エンカレッジ,東京都中野区本町４丁目１９番１９号,2018-02-01,その他の設立登記法人
一般社団法人コミュニティーサポートセンターさいたま,埼玉県さいたま市桜区新開１丁目１０番１１号,2018-02-01,その他の設立登記法人
一般社団法人ストーン,東京都杉並区善福寺２丁目３８番３号,2018-02-01,その他の設立登記法人
一般社団法人ヘリコバクターピロリ未病対策協会,神奈川県横浜市金沢区福浦３丁目９番地,2018-02-01,その他の設立登記法人
一般社団法人ポーリー・プラス,東京都千代田区丸の内３丁目１番１号東京共同会計事務所内,2018-02-01,その他の設立登記法人
一般社団法人モナコイン普及促進協会,大阪府大阪市淀川区野中北１丁目１２番２５－３０３号,2018-02-01,その他の設立登記法人
一般社団法人ロック,東京都杉並区善福寺２丁目３８番３号,2018-02-01,その他の設立登記法人
一般社団法人仮想通貨税務協会,大阪府大阪市中央区久太郎町２丁目５番３１号,2018-02-01,その他の設立登記法人
一般社団法人富田管理法人,北海道札幌市手稲区手稲本町二条５丁目１２番５５号,2018-02-01,その他の設立登記法人
一般社団法人日本イケメン協会,東京都中央区月島３丁目１４番８号,2018-02-01,その他の設立登記法人
一般社団法人日本施設基準管理士協会,東京都文京区千石４丁目１７番１０号,2018-02-01,その他の設立登記法人
一般社団法人東京アジアン美容協会,東京都中央区銀座２丁目８番９号,2018-02-01,その他の設立登記法人
一般社団法人相続手続カウンセラー協会,兵庫県神戸市中央区八幡通４丁目２番１８号,2018-02-01,その他の設立登記法人
一般社団法人進路指導・キャリア教育支援機構,福岡県太宰府市都府楼南４丁目２６－８－４０１,2018-02-01,その他の設立登記法人
一般社団法人ＢＡＳＥ－ＯＮ,岡山県岡山市中区倉益１２４番地６,2018-02-01,その他の設立登記法人
一般財団法人鈴木道雄記念財団,静岡県浜松市南区高塚町３００番地,2018-02-01,その他の設立登記法人
中日福祉人財協同組合,愛知県名古屋市中川区応仁町２丁目４７番地１,2018-02-01,その他の設立登記法人
井見川株式会社,山口県下関市一の宮本町２丁目１２番３号,2018-02-01,株式会社
企業組合ワーカーズ・コレクティブつぶつぶ,京都府向日市物集女町クヅ子５番地ハイツグレースメイト１０２,2018-02-01,その他の設立登記法人
何者合同会社,静岡県富士市厚原３４３番地の２５,2018-02-01,合同会社
佳楊合同会社,埼玉県児玉郡上里町大字七本木５４４０番地ヴィータル上里２０２号室,2018-02-01,合同会社
剛路株式会社,和歌山県和歌山市園部１５０４－１,2018-02-01,株式会社
勝山畜産株式会社,静岡県静岡市葵区水見色１０１０番地,2018-02-01,株式会社
合同会社あじさい,千葉県浦安市猫実５丁目５番２２号,2018-02-01,合同会社
合同会社きよみず屋,北海道旭川市七条通２１丁目１９７２番地２,2018-02-01,合同会社
合同会社こいのぼり,北海道札幌市厚別区厚別南７丁目１４番１１号,2018-02-01,合同会社
合同会社こころ,沖縄県浦添市安波茶１丁目１２番１０号,2018-02-01,合同会社
合同会社さくら企画,愛知県名古屋市昭和区白金３丁目５番１１号,2018-02-01,合同会社
合同会社さっぽろ浜健,北海道札幌市東区北十二条東１５丁目５番２０号,2018-02-01,合同会社
合同会社たてじま,北海道札幌市豊平区水車町１丁目４番２４号,2018-02-01,合同会社
合同会社ふぁみしーず,埼玉県蓮田市東１丁目４番１８号,2018-02-01,合同会社
合同会社アナハイム・エレクトロニクス,東京都新宿区市谷八幡町１番,2018-02-01,合同会社
合同会社インペリアル,福岡県福岡市博多区博多駅東１丁目１０番３５号,2018-02-01,合同会社
合同会社エストレンド研究所,東京都渋谷区代々木１丁目３０番１５号天翔代々木ビルＳー４０６,2018-02-01,合同会社
合同会社オンザシップ,東京都杉並区阿佐谷南３丁目２７番１３号,2018-02-01,合同会社
合同会社キマイラ,東京都文京区千駄木３丁目４２番１４号２０１,2018-02-01,合同会社
合同会社クサダ建築製作所,愛知県一宮市浅井町江森字東之森１５番地,2018-02-01,合同会社
合同会社グランド,埼玉県上尾市大字上尾下７９３番地７,2018-02-01,合同会社
合同会社グルウ,東京都世田谷区玉川２丁目２４番６号シルク玉川６階,2018-02-01,合同会社
合同会社グローバルサプライ,大阪府大阪市北区西天満３丁目５番２号,2018-02-01,合同会社
合同会社コネクト,福岡県福岡市南区鶴田１丁目１番２１－３０２,2018-02-01,合同会社
合同会社シャンス,京都府京田辺市三山木南山３０番地１,2018-02-01,合同会社
合同会社ストリートビートトレーディング,神奈川県横浜市都筑区荏田東２丁目１番２７号,2018-02-01,合同会社
合同会社チームワーク,栃木県宇都宮市平松本町３２２番地７さくらハイツ２０２,2018-02-01,合同会社
合同会社ツバキ,千葉県市川市妙典３丁目１５番１６号,2018-02-01,合同会社
合同会社ナイツ,新潟県新潟市東区寺山２丁目９番３号,2018-02-01,合同会社
合同会社ハイキューホテル,兵庫県神戸市中央区北長狭通７丁目２番４号ＧＳハイム元町４０４,2018-02-01,合同会社
合同会社パティスリー・レ・ミゼラブル,埼玉県越谷市赤山町３丁目２４４番地８マキシマビル１Ｆ,2018-02-01,合同会社
合同会社ベルグランツ,神奈川県川崎市中原区上丸子天神町３３３番地,2018-02-01,合同会社
合同会社ミルキーウェイ,神奈川県逗子市沼間３丁目２３番１号,2018-02-01,合同会社
合同会社ライアン,千葉県市川市福栄１丁目１６番１号,2018-02-01,合同会社
合同会社リクラス,千葉県千葉市美浜区打瀬１丁目６番地４ファーストウイングＤ－１５０６号,2018-02-01,合同会社
合同会社レミタス,新潟県十日町市松代３７７３番地２５本山住宅２階,2018-02-01,合同会社
合同会社北国レンタカー,岩手県奥州市水沢区東中通り２丁目４番７号,2018-02-01,合同会社
合同会社吉田屋,山梨県大月市七保町葛野２６６２番地,2018-02-01,合同会社
合同会社岩﨑パートナーサービス,兵庫県赤穂市正保橋町３番地４４,2018-02-01,合同会社
合同会社忠誠,神奈川県愛甲郡愛川町中津７２８７角田貸事務所Ａ号棟,2018-02-01,合同会社
合同会社成龍,大阪府堺市東区引野町１丁７番地７４,2018-02-01,合同会社
合同会社梶本設計,滋賀県大津市平津２丁目４番１－４０３号,2018-02-01,合同会社
合同会社清友企画,静岡県静岡市清水区追分２丁目１４番地１２号,2018-02-01,合同会社
合同会社畠田事務所,兵庫県神戸市中央区御幸通６丁目１番１５号御幸ビル５０８号,2018-02-01,合同会社
合同会社発電道楽,京都府南丹市日吉町胡麻口野部谷１０番地２１,2018-02-01,合同会社
合同会社駱駝屋珈琲店,兵庫県西宮市与古道町２番３４号,2018-02-01,合同会社
合同会社龍メディカルサービス,北海道札幌市中央区南一条東７丁目１５番地８カサトレスリオ６０３号,2018-02-01,合同会社
合同会社ＡＰモバイル,千葉県市川市塩焼１丁目１０番２８号,2018-02-01,合同会社
合同会社ＡＶＡＮＺＡＲ,熊本県菊池市野間口７６０番地１,2018-02-01,合同会社
合同会社Ａｌｉｖｅ　Ｃｏｍｐａｎｙ,神奈川県横浜市西区浅間台２８番地２２,2018-02-01,合同会社
合同会社Ｂｕｙｓｈｏｐ,埼玉県草加市青柳７丁目３９番２２号,2018-02-01,合同会社
合同会社ＥＦＣ,兵庫県丹波市市島町勅使６７７番地１,2018-02-01,合同会社
合同会社Ｇｌｏｂａｌ　Ｅｎｔｅｒｔａｉｎｍｅｎｔ,神奈川県横浜市戸塚区上矢部町４７番地３ラムーナ横浜戸塚フォレストリッジ９２３号,2018-02-01,合同会社
合同会社ＨＡＬＹ,東京都国立市北３丁目３９番の３８,2018-02-01,合同会社
合同会社ＨＡＮＡＢＩ,福岡県福岡市東区舞松原１丁目５－４,2018-02-01,合同会社
合同会社ＨＩＭＫ,愛知県名古屋市北区鳩岡町１丁目７番地の１８ユニーブル黒川シティ７０７号,2018-02-01,合同会社
合同会社Ｋ＆Ｅ,愛知県名古屋市中区新栄３丁目１９番５号,2018-02-01,合同会社
合同会社Ｋ．Ａ．Ｙ,静岡県静岡市葵区安東３丁目６番３０号,2018-02-01,合同会社
合同会社ＬＷＬ,愛知県名古屋市中区栄１丁目１６番１６号,2018-02-01,合同会社
合同会社Ｌｅａｒｏ,愛知県名古屋市名東区上社３丁目５０６番地,2018-02-01,合同会社
合同会社Ｍ＆Ｍ,奈良県生駒市真弓２丁目９番２６号,2018-02-01,合同会社
合同会社Ｍｉｏ　Ｐｒｏｐｅｒｔｉｅｓ　ＯＭＹ,東京都江戸川区北葛西５丁目２６番９号,2018-02-01,合同会社
合同会社ＮＫエナジー,青森県八戸市大字大久保字鷹待場１５番地６,2018-02-01,合同会社
合同会社ＯｎｌｙＯｎｅ,埼玉県新座市道場２丁目９番１６号,2018-02-01,合同会社
合同会社Ｐ＆Ｔ,東京都台東区千束１丁目１６番１１－１３０５号クレストフォルム浅草グランステージ,2018-02-01,合同会社
合同会社ＲＯＸ,東京都町田市原町田６丁目１４番５号,2018-02-01,合同会社
合同会社Ｓ．Ｎ．Ｒ．Ｉ．,神奈川県横浜市磯子区杉田４丁目１８番９号,2018-02-01,合同会社
合同会社ＳＡＧ,北海道札幌市中央区南五条西２丁目１オークラビル,2018-02-01,合同会社
合同会社ＳＥＡ,東京都新宿区西新宿８丁目１０－２－３０１,2018-02-01,合同会社
合同会社Ｔ＆Ｋ,愛知県あま市西今宿郷内一１８番地１,2018-02-01,合同会社
合同会社ＴＡＳＲ,東京都豊島区池袋２丁目６５番６号,2018-02-01,合同会社
合同会社ＴＳフーズ,宮崎県延岡市大瀬町１丁目５番地７,2018-02-01,合同会社
合同会社Ｕｎｉｎｅｘ,熊本県熊本市中央区菅原町３番２０－３０３号,2018-02-01,合同会社
合同会社ｋｕｋｕｎａファクトリー,神奈川県横浜市戸塚区汲沢２丁目１番５号,2018-02-01,合同会社
合資会社小島商事,熊本県阿蘇市内牧３６５番地,2018-02-01,合資会社
和晃建設株式会社,徳島県美馬郡つるぎ町半田字中藪６６番地５,2018-02-01,株式会社
壱永商店合同会社,東京都大田区大森東４丁目２２番２号,2018-02-01,合同会社
大榮開発株式会社,北海道札幌市清田区清田二条１丁目４番１３号,2018-02-01,株式会社
宇都宮工業株式会社,島根県雲南市大東町飯田６２番地７,2018-02-01,株式会社
実富士インターナショナル投資合同会社,東京都足立区竹の塚３丁目１６番１４号,2018-02-01,合同会社
岐阜レンタリース株式会社,岐阜県可児市中恵土２３３７番地の１,2018-02-01,株式会社
徳賀和クリエイティブ株式会社,大阪府大阪市中央区南本町１丁目３番２３号,2018-02-01,株式会社
日本三和健康産業株式会社,福岡県福岡市西区豊浜１丁目１４番２０－１号,2018-02-01,株式会社
日本環境保全株式会社,茨城県行方市若海１７５番地,2018-02-01,株式会社
晃誠工業株式会社,岡山県倉敷市中畝７丁目１０番２７号,2018-02-01,株式会社
有限会社大谷地工業,千葉県市原市大厩１２００番地３２,2018-02-01,有限会社
東京国愛株式会社,東京都新宿区高田馬場１丁目３１番８号,2018-02-01,株式会社
東北アグリ合同会社,青森県上北郡六戸町大字犬落瀬字上淋代９３番地２,2018-02-01,合同会社
東北メンテナンスサービス合同会社,宮城県大崎市古川中里２丁目３番４３号,2018-02-01,合同会社
東水商事合同会社,埼玉県さいたま市桜区道場２丁目１番１－７３８,2018-02-01,合同会社
東芝メモリエトワール株式会社,三重県四日市市山之一色町８００番地,2018-02-01,株式会社
染谷意匠株式会社,千葉県松戸市小金３２３番地,2018-02-01,株式会社
株式会社えぽっく,茨城県日立市日高町４丁目１３番１４号高磯ハイツ４０１号室,2018-02-01,株式会社
株式会社ささのは,熊本県熊本市西区戸坂町２番５－２号,2018-02-01,株式会社
株式会社すむたす,東京都目黒区上目黒５丁目６番２５－２０１号目黒ＬＦＶ,2018-02-01,株式会社
株式会社そらちファーム,神奈川県横浜市都筑区川和町１９番地２,2018-02-01,株式会社
株式会社ほんごう農場,栃木県栃木市大平町西野田１０９６番地,2018-02-01,株式会社
株式会社まるや総合研究所,鹿児島県薩摩川内市神田町３番３１号,2018-02-01,株式会社
株式会社みらい教育ラボ,福岡県北九州市戸畑区中原新町２番１号,2018-02-01,株式会社
株式会社アシフ,栃木県小山市大字大行寺１０２０番地９,2018-02-01,株式会社
株式会社アルカディアバケーションズ,東京都千代田区丸の内１丁目１１番１号,2018-02-01,株式会社
株式会社アーサー工業,神奈川県横浜市青葉区桂台２丁目３１番地２０,2018-02-01,株式会社
株式会社アール,大阪府大阪市北区中之島４丁目３番２０－２６０９号,2018-02-01,株式会社
株式会社ウッドジョブ,東京都世田谷区喜多見１丁目３０番１３号,2018-02-01,株式会社
株式会社エスアルジャパン,北海道札幌市南区澄川四条２丁目１３番１６号,2018-02-01,株式会社
株式会社エニーリンク,東京都新宿区高田馬場１丁目２８番１０号三慶ビル４階,2018-02-01,株式会社
株式会社エムキュービックプラス,東京都渋谷区桜丘町１６－３,2018-02-01,株式会社
株式会社オフィスＫＡＪＩＹＡ,東京都千代田区四番町８番地６番町パークハウス１００２号,2018-02-01,株式会社
株式会社キュリカ,東京都豊島区東池袋３丁目１番１号,2018-02-01,株式会社
株式会社クリザンテム,栃木県宇都宮市ゆいの杜６丁目１７番１号,2018-02-01,株式会社
株式会社クレオム,東京都港区六本木７丁目３番８号,2018-02-01,株式会社
株式会社クレストＨＣ,東京都港区南青山２丁目２２番１４号,2018-02-01,株式会社
株式会社コウダ,千葉県千葉市若葉区桜木６丁目３番４１号,2018-02-01,株式会社
株式会社コクダイ,岡山県岡山市東区西大寺松崎１０２１番地,2018-02-01,株式会社
株式会社ココログループ,広島県広島市西区古江上２丁目５０２番地７　１２０７号,2018-02-01,株式会社
株式会社ゴッドスピード,東京都日野市三沢３丁目７番地３,2018-02-01,株式会社
株式会社サイクレーヴ,東京都千代田区富士見１丁目１番８号,2018-02-01,株式会社
株式会社サイジスタ,東京都千代田区富士見１丁目１番８号,2018-02-01,株式会社
株式会社サンパル,香川県丸亀市北平山町２丁目４番１号エクセレント１１号,2018-02-01,株式会社
株式会社サンユーコーポレーション,京都府京都市北区紫竹下長目町１３番地,2018-02-01,株式会社
株式会社シエンスジャパン,大阪府茨木市園田町８番１８号,2018-02-01,株式会社
株式会社シマトコ,大阪府堺市北区新堀町１丁３９番地５－８１３号,2018-02-01,株式会社
株式会社シンフォニー,大阪府大阪市港区夕凪２丁目１７番５号,2018-02-01,株式会社
株式会社シーエルビー,埼玉県所沢市中新井１丁目５番地の１,2018-02-01,株式会社
株式会社スタッフコンシェル,神奈川県横浜市西区平沼１丁目７番１８号篠崎ビル１Ｆ,2018-02-01,株式会社
株式会社スマイル・オール,岡山県岡山市北区北長瀬本町２０番５１号,2018-02-01,株式会社
株式会社スリーエイト,東京都杉並区阿佐谷南２丁目２２番６号フォーブルラン１０３,2018-02-01,株式会社
株式会社スリーロック,神奈川県横浜市緑区寺山町７６２番地７メゾン・ド・ラフィーネ２０２号,2018-02-01,株式会社
株式会社センターフィールド,静岡県静岡市葵区千代田６丁目２０番１１号,2018-02-01,株式会社
株式会社ソート,東京都中野区本町４丁目５番１０－１００５号,2018-02-01,株式会社
株式会社タグボートホールディングス,福岡県北九州市小倉北区浅野２丁目９番２２号,2018-02-01,株式会社
株式会社ツカサ電設,兵庫県神戸市西区玉津町今津１３５番地の４,2018-02-01,株式会社
株式会社ティムズ,神奈川県横浜市青葉区榎が丘２１番地６３,2018-02-01,株式会社
株式会社トゥエルブ,東京都中央区銀座７丁目１５番８号タウンハイツ銀座４０６,2018-02-01,株式会社
株式会社トキ,京都府京都市中京区西ノ京樋ノ口町５番地の２,2018-02-01,株式会社
株式会社トラステリア,東京都青梅市今寺３丁目３８５番地の１,2018-02-01,株式会社
株式会社トータルエコサポート,東京都中央区銀座１丁目１５番７号マック銀座ビル４０２号,2018-02-01,株式会社
株式会社ビーズニーズヴィンヤーズ,茨城県つくば市神郡２５６５番地,2018-02-01,株式会社
株式会社フェイスグループ,東京都大田区田園調布４丁目３４番１３号カーサフェリーチェ田園調布１０１,2018-02-01,株式会社
株式会社フォアフロント,埼玉県三郷市戸ケ崎１丁目３４番地１,2018-02-01,株式会社
株式会社フォレガ,広島県福山市東明王台４番３号,2018-02-01,株式会社
株式会社フルテック,東京都豊島区池袋本町２丁目３９番７号,2018-02-01,株式会社
株式会社ブルーフラッグ,東京都渋谷区渋谷１丁目１２番２号クロスオフィス渋谷７０７,2018-02-01,株式会社
株式会社プライスワン,愛知県名古屋市西区野南町６番地,2018-02-01,株式会社
株式会社プラスドソレイユ,宮崎県宮崎市橘通東３丁目４番９号落合ビル３階,2018-02-01,株式会社
株式会社プランナー鈴ヶ丘,三重県伊勢市鹿海町６２６番地２,2018-02-01,株式会社
株式会社ベストビジネスパートナー,東京都渋谷区神宮前１丁目５番８号,2018-02-01,株式会社
株式会社ポスティ,東京都港区新橋６丁目１６番８号,2018-02-01,株式会社
株式会社ミスタージャポン,埼玉県さいたま市中央区鈴谷１丁目５３４番地７,2018-02-01,株式会社
株式会社ミツマサ,神奈川県横浜市神奈川区白幡向町１２番１６号,2018-02-01,株式会社
株式会社ミユ,神奈川県横浜市中区桜木町１丁目１０１番地１クロスゲート７Ｆ,2018-02-01,株式会社
株式会社ムーン,東京都新宿区高田馬場２丁目１４番４号三愛ビル４階,2018-02-01,株式会社
