法人名,住所,設立日,法人種別
ＴＭＫグラフィック株式会社,大阪府大阪市東住吉区北田辺６丁目１６番２４号プレアール北田辺Ⅱ２Ａ,2016-12-13,株式会社
ＴＰコンサルティング合同会社,東京都港区港南４丁目６番４号,2016-12-13,合同会社
ＴＰＬ株式会社,東京都港区赤坂６丁目１２番１１号赤坂甲陽ビル７階,2016-12-13,株式会社
ＶＩＢ．コンサルタント合同会社,愛知県西尾市一色町赤羽後田９０番地５,2016-12-13,合同会社
ＶＴＯＭＯ株式会社,東京都目黒区上目黒４丁目２番１－３０６号,2016-12-13,株式会社
ＹＢＹＲＡ株式会社,千葉県浦安市富士見３丁目１番１８号,2016-12-13,株式会社
ｂｅａｒ　ｆｏｏｔ　ｃｏｒｐｏｒａｔｉｏｎ株式会社,東京都大田区鵜の木２丁目２４番１号,2016-12-13,株式会社
ｅｘｔｒｏｐｙＬＡＢ合同会社,福岡県福岡市博多区中洲５丁目３－８アクア博多５階,2016-12-13,合同会社
ｎａｎａｉｒｏ合同会社,大分県大分市大字佐賀関２０８３番地の１,2016-12-13,合同会社
ｎｉｎｅ合同会社,愛知県江南市宮後町砂場北１７４番地,2016-12-13,合同会社
きらら株式会社,宮城県仙台市青葉区中山６丁目２４番３６号,2016-12-14,株式会社
くまくま本舗株式会社,神奈川県横浜市保土ケ谷区西谷町８８１番地,2016-12-14,株式会社
しげよし工業株式会社,大阪府堺市西区菱木３丁２０１４番地２,2016-12-14,株式会社
つの水産加工品開発協議会,宮崎県児湯郡都農町大字川北４８７４番地２,2016-12-14,その他
とちぎ県代行運転協同組合,栃木県宇都宮市吉野２丁目８番２３号,2016-12-14,その他の設立登記法人
りぶりふデザインスタジオ合同会社,神奈川県横浜市港北区新横浜２丁目４番地６－７階,2016-12-14,合同会社
アイジュリン株式会社,大阪府大阪市浪速区湊町１丁目２番１７－２５０７号,2016-12-14,株式会社
アイ・アース合同会社,愛知県豊田市大清水町大清水１７９番地７ゼフィール大清水３０１号,2016-12-14,合同会社
アクティス株式会社,東京都千代田区内神田１丁目１１番１０号,2016-12-14,株式会社
アニマート・グループ沖縄株式会社,沖縄県名護市字宇茂佐３６１番地２ラ・ベル・メール１階,2016-12-14,株式会社
アヤナスデザイン株式会社,東京都文京区水道２丁目６番４号,2016-12-14,株式会社
アルマ株式会社,神奈川県横浜市鶴見区鶴見中央１丁目９番８－８０６号,2016-12-14,株式会社
イプシロン株式会社,東京都千代田区九段南１丁目５番６号りそな九段ビル５Ｆ,2016-12-14,株式会社
イリスエステート合同会社,東京都世田谷区松原１丁目２４番６号,2016-12-14,合同会社
インクルージョンデザイン株式会社,北海道札幌市中央区南三条西２４丁目３番１７号,2016-12-14,株式会社
ウィルソア株式会社,東京都渋谷区恵比寿４丁目２０番３号,2016-12-14,株式会社
エクスツー合同会社,宮城県仙台市泉区将監１丁目９番１号,2016-12-14,合同会社
エフェクト合同会社,福島県福島市八木田字並柳２０番地の５,2016-12-14,合同会社
オプテックエクスプレス株式会社,千葉県千葉市美浜区中瀬１丁目３番地幕張テクノガーデンＣＢ棟３階ＭＢＰ,2016-12-14,株式会社
カナデル株式会社,神奈川県横浜市中区長者町５丁目７５番地１スクエア長者町８１７号室,2016-12-14,株式会社
グットファインティング株式会社,沖縄県中頭郡北谷町字桑江５７９番地２,2016-12-14,株式会社
グー・チョキ・パートナーズ株式会社,東京都港区虎ノ門１丁目１６番６号,2016-12-14,株式会社
ケイカクラボ株式会社,岩手県盛岡市本宮７丁目７番１０号,2016-12-14,株式会社
ゴールデンミャンマー株式会社,福島県いわき市平字旧城跡４番地,2016-12-14,株式会社
サミットサービス合同会社,東京都港区芝大門１丁目４番１４号芝栄太楼ビル４階,2016-12-14,合同会社
サンキュー株式会社,大阪府大阪市東淀川区大道南１丁目２５番２３号,2016-12-14,株式会社
サンシャインホーム株式会社,長野県茅野市宮川１１３４７番地７,2016-12-14,株式会社
サンズジャパン株式会社,東京都三鷹市下連雀４丁目１９番２号,2016-12-14,株式会社
シシマネジメントコンサルティング合同会社,宮城県仙台市青葉区本町１丁目１２番１２号,2016-12-14,合同会社
シンエイテック株式会社,愛知県知多市朝倉町３７７番地,2016-12-14,株式会社
シーエルカーワークス合同会社,岡山県笠岡市大島中６３７６番地１,2016-12-14,合同会社
シーサーストーリー株式会社,沖縄県宮古島市平良字松原１１３５番地６,2016-12-14,株式会社
ジャコモ合同会社,東京都港区南麻布４丁目１１番４６号,2016-12-14,合同会社
ジャパンコールドチェーン株式会社,東京都渋谷区道玄坂１丁目１２番１号渋谷マークシティＷ２２階,2016-12-14,株式会社
ジョアドボーテ株式会社,東京都足立区梅田６丁目４番１４号,2016-12-14,株式会社
ジーエフジー合同会社,千葉県木更津市請西東２丁目２１番地３,2016-12-14,合同会社
ゼロ株式会社,大阪府大阪市生野区巽南１丁目３番１８号,2016-12-14,株式会社
ダイヤ物産合同会社,東京都渋谷区広尾４丁目１番１０－９０１号,2016-12-14,合同会社
トップセルジャパン合同会社,東京都中央区新川２丁目１９番６－１２０２号,2016-12-14,合同会社
トランクシステム工業株式会社,埼玉県草加市旭町３丁目２番１７号,2016-12-14,株式会社
ドールパタンハンディクラフトエックスポートプライベートリミテド,東京都西東京市下保谷２丁目５－２０コーポニートネス１０６,2016-12-14,外国会社等
ナカジマ株式会社,大阪府大阪市住之江区東加賀屋４丁目４番１３号,2016-12-14,株式会社
ナチュラルフリー株式会社,京都府京都市山科区大塚高岩１２番地１５１,2016-12-14,株式会社
ネオエナジー合同会社,岡山県総社市下原９５３番地１,2016-12-14,合同会社
ハイズメディカル株式会社,香川県高松市扇町２丁目４番２７－３０６号,2016-12-14,株式会社
ファミリーエナジー合同会社,東京都港区西新橋１丁目２０番３号虎ノ門法曹ビル,2016-12-14,合同会社
ファミリーワン合同会社,埼玉県さいたま市浦和区駒場１丁目５番１５－１０３号,2016-12-14,合同会社
フォーチューン株式会社,兵庫県芦屋市陽光町８番２０－２０１号,2016-12-14,株式会社
フォープラス合同会社,東京都新宿区歌舞伎町１丁目９番６号,2016-12-14,合同会社
フジタファーム株式会社,島根県隠岐郡隠岐の島町南方１１５５番地,2016-12-14,株式会社
フラワーズ・アンド・カンパニー合同会社,東京都世田谷区太子堂３丁目３６番１－３１９号,2016-12-14,合同会社
フードシヨツプむらかみ株式会社,愛知県名古屋市瑞穂区白砂町１丁目６番地,2016-12-14,株式会社
ブルー・ウォール・ホールディングス株式会社,熊本県熊本市中央区船場町下１丁目２３番地サムティ熊本慶徳校前１４０７,2016-12-14,株式会社
プラチナサービス合同会社,熊本県熊本市中央区白山２丁目１番１号白山堂ビル３０２,2016-12-14,合同会社
プラム合同会社,埼玉県川口市西青木４丁目５番２５号,2016-12-14,合同会社
プレステージホーム東京株式会社,東京都町田市常盤町３４９８番地,2016-12-14,株式会社
プログレッシブ・パートナーズ合同会社,埼玉県川口市差間２丁目１７番４３号,2016-12-14,合同会社
プロセスｅ株式会社,大阪府南河内郡太子町大字太子５６５－４,2016-12-14,株式会社
ペタンク株式会社,東京都港区台場１丁目３番４－９０２号,2016-12-14,株式会社
ホープ日光商事株式会社,神奈川県川崎市川崎区砂子１丁目５番地１４,2016-12-14,株式会社
マックスライン株式会社,神奈川県横浜市金沢区能見台６丁目４４番地５,2016-12-14,株式会社
マックス共栄会第一持株会,東京都中央区日本橋箱崎町６－６,2016-12-14,その他
マックス共栄会第二持株会,東京都中央区日本橋箱崎町６－６,2016-12-14,その他
ミューコネクト株式会社,岐阜県羽島市桑原町小薮２１５７番地２,2016-12-14,株式会社
ユニ・チャーム新規事業準備株式会社,東京都港区三田３丁目５番２７号,2016-12-14,株式会社
ラグナ株式会社,神奈川県横浜市青葉区美しが丘４丁目３２番５２号,2016-12-14,株式会社
ロイヤルフーズ合同会社,北海道札幌市白石区中央二条１丁目４番１８号,2016-12-14,合同会社
ワールドペガサスジャパン株式会社,東京都千代田区神田須田町２丁目１９番地,2016-12-14,株式会社
一般社団法人その辺のもので生きる,鹿児島県南さつま市金峰町大坂７０２０番地,2016-12-14,その他の設立登記法人
一般社団法人はりまのこ,兵庫県たつの市龍野町立町３８番地,2016-12-14,その他の設立登記法人
一般社団法人まつり研究会,東京都新宿区市谷本村町２番４号,2016-12-14,その他の設立登記法人
一般社団法人オーケーサポート,愛知県みよし市明知町砲録山７番地２５,2016-12-14,その他の設立登記法人
一般社団法人ケンの家,神奈川県横浜市青葉区奈良町８３４番地１,2016-12-14,その他の設立登記法人
一般社団法人ステラ・パーク,兵庫県西宮市南昭和町５番２２号,2016-12-14,その他の設立登記法人
一般社団法人チェントロソフィア１５４９,東京都足立区江北３丁目４０番１９号,2016-12-14,その他の設立登記法人
一般社団法人ドマーニ,滋賀県彦根市小泉町６２０－３０,2016-12-14,その他の設立登記法人
一般社団法人ネイビーブルー・プロパティーズ,東京都中央区日本橋２丁目７番１号,2016-12-14,その他の設立登記法人
一般社団法人プレジール,愛知県名古屋市中区錦３丁目１７番２６号,2016-12-14,その他の設立登記法人
一般社団法人マカバジャパン,東京都港区海岸３丁目１９番２－７１６号,2016-12-14,その他の設立登記法人
一般社団法人南九州サンテクノ,長崎県諫早市幸町６７番１８号,2016-12-14,その他の設立登記法人
一般社団法人日本ケアメイク協会,愛知県名古屋市中区千代田５丁目２２番３５号,2016-12-14,その他の設立登記法人
一般社団法人日本バヌアツ友好協会,東京都新宿区西新宿６丁目８番１号住友不動産新宿オークタワー２７階,2016-12-14,その他の設立登記法人
一般社団法人日本ラスアルハイマー経済協力推進機構,東京都千代田区丸の内２丁目３番２号,2016-12-14,その他の設立登記法人
一般社団法人日本認知症予防アロマ協会,福岡県久留米市荒木町白口１６３９番地,2016-12-14,その他の設立登記法人
一般社団法人未来共育学園,京都府京都市南区久世高田町２５７番地１３９桂川駅前ビル３階,2016-12-14,その他の設立登記法人
一般社団法人未来技術協会,東京都練馬区中村２丁目１番１号,2016-12-14,その他の設立登記法人
一般社団法人東京労働者福祉協議会,東京都港区芝５丁目２６番３０号,2016-12-14,その他の設立登記法人
一般社団法人次世代無人航空機技術革新機構,東京都中央区銀座６丁目１３番地１６号銀座ウォールビル５０５,2016-12-14,その他の設立登記法人
一般社団法人沖縄県認知症介護指導者会,沖縄県南城市字つきしろ１６７８番地２２５、２Ｆ,2016-12-14,その他の設立登記法人
一般社団法人環境未来フォーラム,東京都港区虎ノ門４丁目３番１号,2016-12-14,その他の設立登記法人
一般社団法人相続対策支援機構,東京都中央区日本橋茅場町１丁目１３番１３号,2016-12-14,その他の設立登記法人
一般社団法人茶方會,東京都目黒区八雲３丁目４番７号,2016-12-14,その他の設立登記法人
一般社団法人関東訪問理美容協会,神奈川県横浜市南区六ツ川１丁目６７９番地の１６,2016-12-14,その他の設立登記法人
一般社団法人ＡＳＧＪ２,東京都中央区銀座１丁目６番１１号土志田ビルディング３Ｆ,2016-12-14,その他の設立登記法人
一般社団法人Ａｍｕｓａｙファミリー,静岡県浜松市中区船越町３０番２１号ロイヤルクレスト船越１０１,2016-12-14,その他の設立登記法人
一般社団法人ＣＯＬＯＲ　ＡＩＤ,岐阜県多治見市宝町２丁目９番地,2016-12-14,その他の設立登記法人
一般社団法人ＮＲＮパートナーズ,福岡県福岡市博多区博多駅東１丁目１４番３号,2016-12-14,その他の設立登記法人
一般社団法人ＳＡＮＭＯＲＩ　ＩＭＡＧＥ,東京都港区南麻布３丁目２１番１４－７０４号,2016-12-14,その他の設立登記法人
一般社団法人ｒｅ　ｂｏｒｎアカデミー,愛知県名古屋市中区丸の内１丁目４番１２号,2016-12-14,その他の設立登記法人
一般財団法人日本漢方医学教育振興財団,東京都千代田区内神田３丁目２番９号,2016-12-14,その他の設立登記法人
一般財団法人田中德兵衞記念芸術財団,埼玉県川口市末広１丁目１１番２号,2016-12-14,その他の設立登記法人
一般財団法人近江商人歴史保存会,滋賀県東近江市五個荘山本町２７０番地,2016-12-14,その他の設立登記法人
七福株式会社,大分県玖珠郡九重町大字町田１８番地の１,2016-12-14,株式会社
三財川筋広域協定運営委員会,宮崎県西都市大字下三財３４１４の２,2016-12-14,その他
乙乃情報継続株式会社,東京都品川区大井３丁目２１番２４号,2016-12-14,株式会社
偉澤商事合同会社,東京都江東区木場５丁目１番５－Ｂ１１１号,2016-12-14,合同会社
光真工業株式会社,愛知県豊田市鴛鴨町中高根９４番地１,2016-12-14,株式会社
八代市坂本地区有害鳥獣利活用組合,熊本県八代市坂本町百済来下６９２－１,2016-12-14,その他
北海道高等学校世界史研究会,北海道苫小牧市青葉町１丁目１－１北海道苫小牧西高等学校内,2016-12-14,その他
医療法人さくら眼科,愛知県新城市上平井９５９番地１,2016-12-14,その他の設立登記法人
医療法人とくしげ会,愛知県名古屋市緑区徳重５丁目４１５番地,2016-12-14,その他の設立登記法人
医療法人好貴会,愛知県東海市加木屋町２丁目２２４番地１,2016-12-14,その他の設立登記法人
医療法人平針北クリニック,愛知県日進市赤池町屋下３０６番地２,2016-12-14,その他の設立登記法人
医療法人朝日が丘整形外科,愛知県長久手市下山４８番地１,2016-12-14,その他の設立登記法人
医療法人樹翔会,愛知県長久手市仲田７０８番地,2016-12-14,その他の設立登記法人
医療法人社団ゆみの内科クリニック,神奈川県厚木市中町２丁目８番７号グランデ本厚木中町１階,2016-12-14,その他の設立登記法人
医療法人社団エトワール会,神奈川県川崎市中原区新丸子東３丁目１３０２番地ららテラス武蔵小杉４階,2016-12-14,その他の設立登記法人
医療法人社団フジオカデンタルクリニック,兵庫県三木市緑が丘町中１丁目７番地２,2016-12-14,その他の設立登記法人
医療法人社団ユアーズオーラルクリニック,兵庫県たつの市龍野町小宅北４０－２２,2016-12-14,その他の設立登記法人
医療法人社団松島整形外科医院,兵庫県尼崎市上坂部３丁目２９番８号,2016-12-14,その他の設立登記法人
医療法人社団藤井整形外科,神奈川県横浜市金沢区瀬戸三丁目４５番金沢八景メディカルビル３階,2016-12-14,その他の設立登記法人
医療法人陽翔会,愛知県豊橋市平川本町２丁目４番地１６,2016-12-14,その他の設立登記法人
千駄ケ谷計算代行株式会社,東京都渋谷区千駄ヶ谷３丁目５５番６号,2016-12-14,株式会社
原不動産投信株式会社,愛知県愛西市小茂井町中４０番地,2016-12-14,株式会社
原相互産業株式会社,愛知県愛西市小茂井町中４０番地,2016-12-14,株式会社
合同会社いずみ設備,沖縄県名護市宮里５丁目３番２－１０１号ＧｒａｎｄＮｅｗ,2016-12-14,合同会社
合同会社くすのき保育園,東京都足立区六月２丁目１７番１９号,2016-12-14,合同会社
合同会社とまり木,東京都世田谷区経堂５丁目９番１号,2016-12-14,合同会社
合同会社にこにこ,大阪府和泉市王子町６６８番地の１８,2016-12-14,合同会社
合同会社ひまわり,埼玉県秩父市久那１５７４番地５,2016-12-14,合同会社
合同会社めがね,東京都多摩市永山１丁目１７番地の１５コスモ永山１２０３,2016-12-14,合同会社
合同会社アイ・プランニング,神奈川県横浜市西区戸部本町１６番２０号,2016-12-14,合同会社
合同会社アタッシュ産業,福岡県築上郡築上町大字湊４６９番地３,2016-12-14,合同会社
合同会社アークリンク,千葉県松戸市大金平４丁目２４８番地の２,2016-12-14,合同会社
合同会社イトウ,東京都葛飾区亀有５丁目４６番１－９０４号コスモ亀有５,2016-12-14,合同会社
合同会社イノベジット,埼玉県所沢市大字上安松２９０番地２１,2016-12-14,合同会社
合同会社エクサパレット,東京都千代田区内幸町１丁目３番１号幸ビルディング９階エキスパートオフィス新橋９０１号室,2016-12-14,合同会社
合同会社エピファニー,東京都豊島区巣鴨５丁目４５番８号,2016-12-14,合同会社
合同会社エムストーリー,東京都文京区本郷４丁目２番３号,2016-12-14,合同会社
合同会社オギノス,埼玉県入間市豊岡１丁目１番１４号１４０５,2016-12-14,合同会社
合同会社サティワークス,東京都千代田区丸の内２丁目２番１号,2016-12-14,合同会社
合同会社サポートフォーデイリー,長野県南佐久郡佐久穂町大字八郡６２０番地,2016-12-14,合同会社
合同会社サンキ,岡山県岡山市南区新保１３１９番地６,2016-12-14,合同会社
合同会社シェラタン,神奈川県川崎市宮前区平２丁目１０番３号,2016-12-14,合同会社
合同会社スカイパシフィック・ビデオワークス,東京都練馬区高野台４丁目１８番１５－４０１号,2016-12-14,合同会社
合同会社スターマックス,東京都江東区潮見２丁目７－１,2016-12-14,合同会社
合同会社スターライトブリッジ,東京都中央区日本橋２丁目７番１号,2016-12-14,合同会社
合同会社ナカダ・ファシリティーズ,富山県小矢部市名畑５２０５番地,2016-12-14,合同会社
合同会社ニジュウゴ,東京都稲城市東長沼７４９番地の２,2016-12-14,合同会社
合同会社ハッピーグリーン,北海道江別市新栄台６３番地の１１,2016-12-14,合同会社
合同会社ハナ建設,山口県岩国市海土路町２丁目４９番１０号,2016-12-14,合同会社
合同会社ハマプランニング,神奈川県横浜市磯子区丸山１丁目１９番３号,2016-12-14,合同会社
合同会社ビッグブリッジ,広島県広島市西区天満町１７番１９号,2016-12-14,合同会社
合同会社フェリークス,熊本県熊本市中央区島崎１丁目１１番４８号,2016-12-14,合同会社
合同会社フナケン,埼玉県さいたま市南区大字大谷口２５６５番地１６,2016-12-14,合同会社
合同会社フミティス,東京都中央区八重洲１丁目７番１０号中坪ビル７Ｆ,2016-12-14,合同会社
合同会社ブルーガール,山口県防府市泉町６番２３－１０２号,2016-12-14,合同会社
合同会社プラスエステート,長野県飯田市松尾久井２２２６番８,2016-12-14,合同会社
合同会社プリシア,東京都中野区本町２丁目１０番１４号メゾン小倉１０２,2016-12-14,合同会社
合同会社ベルフラワー,福島県いわき市四倉町字東一丁目６６番地の２３,2016-12-14,合同会社
合同会社マーケティングデザインラボ,東京都江戸川区大杉３丁目１８番２号,2016-12-14,合同会社
合同会社メリー企画,東京都新宿区西新宿５丁目５番１０号,2016-12-14,合同会社
合同会社リチルウォーム,岡山県浅口市鴨方町深田３２５番地５,2016-12-14,合同会社
合同会社リブウェル,熊本県熊本市中央区島崎１丁目１１番４８号,2016-12-14,合同会社
合同会社ヴィエルジュ,東京都北区豊島５丁目５番７－４２６号,2016-12-14,合同会社
合同会社吉田電機,埼玉県三郷市彦成３丁目８番１９－５０２号,2016-12-14,合同会社
合同会社園帝,愛媛県八幡浜市国木１６０番地１,2016-12-14,合同会社
合同会社小野澤地所,東京都国分寺市西町２丁目３０番地３５,2016-12-14,合同会社
合同会社日本観光サポート,大阪府大阪市西区新町１丁目２５番５号エスリード心斎橋西１１０３,2016-12-14,合同会社
合同会社普代工務店,東京都府中市紅葉丘２丁目１番地の５,2016-12-14,合同会社
合同会社沖縄物語,沖縄県那覇市牧志２丁目７－２４,2016-12-14,合同会社
合同会社琴音,新潟県新潟市中央区女池西１丁目６番５号,2016-12-14,合同会社
合同会社由,大阪府和泉市富秋町２丁目１６番１１号,2016-12-14,合同会社
合同会社神海夜パートナーズ,東京都新宿区西新宿５丁目３番１６－４０４号,2016-12-14,合同会社
合同会社福祉用具アシスト,茨城県取手市寺田４６７４番地５,2016-12-14,合同会社
合同会社蓮香堂,茨城県常陸大宮市下伊勢畑１３０７,2016-12-14,合同会社
合同会社豊岡工務店,千葉県船橋市夏見４丁目１６番２３号,2016-12-14,合同会社
合同会社遊山ゲストハウス,奈良県奈良市大宮町３丁目５番５－９０１号,2016-12-14,合同会社
合同会社銀塩機材,東京都中野区本町６丁目４番１－１１２号,2016-12-14,合同会社
合同会社飛花,神奈川県大和市福田１５５６番地６２,2016-12-14,合同会社
合同会社高はし,神奈川県川崎市高津区久地２丁目９番１０－１０４号,2016-12-14,合同会社
合同会社鷹巣発電所,沖縄県那覇市久米１丁目７番３号３階３０６号,2016-12-14,合同会社
合同会社２４度Ｃ,千葉県八街市四木１８３３番地４ｔｗｏ,2016-12-14,合同会社
合同会社ＡＱＤ,東京都世田谷区代田６丁目１８番１７号下北沢アパートメンツＦ,2016-12-14,合同会社
合同会社ＣｏｌｏＣｏｒｏ,埼玉県久喜市栗橋中央１丁目１７番１７号,2016-12-14,合同会社
合同会社Ｈ・Ｆ・Ｓ,福岡県福岡市西区姪の浜４丁目６番１－１０１号,2016-12-14,合同会社
合同会社ＩＮＮＯ,鹿児島県大島郡天城町大字瀬滝８０３番地６,2016-12-14,合同会社
合同会社ＬＯＣＡＬ,大阪府大阪市西淀川区野里１丁目２７番１号,2016-12-14,合同会社
合同会社Ｌｉｂｉｎｅｓｓ,新潟県上越市新光町２丁目３番６号,2016-12-14,合同会社
合同会社ＭＫ,東京都品川区南大井５丁目１０番１０号,2016-12-14,合同会社
合同会社ＭＫ企画,神奈川県横須賀市吉井２丁目６－２－９０６,2016-12-14,合同会社
合同会社ＮＡＬＵ,大阪府大阪市東住吉区田辺６丁目３－２０,2016-12-14,合同会社
合同会社ＯＴＤ,神奈川県藤沢市辻堂太平台１丁目１４番１号,2016-12-14,合同会社
合同会社Ｐ,沖縄県那覇市字国場６７０番地２,2016-12-14,合同会社
合同会社ＱＯＬＳ,沖縄県中頭郡西原町字我謝２４１番地の２（１Ｆ）,2016-12-14,合同会社
合同会社ＲＫ,神奈川県川崎市幸区柳町１１,2016-12-14,合同会社
合同会社ＳＯＵＳＨＵ,広島県広島市安佐南区西原８丁目４１－４－１５０１,2016-12-14,合同会社
合同会社Ｓｏｌｌｕｎａ,福井県坂井市丸岡町羽崎第１６号１番地１,2016-12-14,合同会社
合同会社Ｕ・ＴＡ,埼玉県富士見市東みずほ台１丁目５番１２号メリーライフみずほ台,2016-12-14,合同会社
