法人名,住所,設立日,法人種別
株式会社礎会計センター,熊本県熊本市西区春日４丁目２６番７号,2016-10-07,株式会社
株式会社福実エステート,福岡県福岡市南区大橋４丁目２７番５号,2016-10-07,株式会社
株式会社穂積保険事務所,福島県白河市東栃本字桝形３番地１５,2016-10-07,株式会社
株式会社立福工務店,福岡県田川郡川崎町大字安眞木３７７３番地,2016-10-07,株式会社
株式会社第一建築設計,神奈川県横浜市青葉区鴨志田町５６９番地１－１８－４０５,2016-10-07,株式会社
株式会社美ＧＩＮ,岩手県北上市村崎野２０地割１９８番地１２２,2016-10-07,株式会社
株式会社翔栄建装,静岡県静岡市清水区石川本町１５番１－２０９号,2016-10-07,株式会社
株式会社芳賀工務店,東京都足立区西保木間２丁目１８番２８号,2016-10-07,株式会社
株式会社若林工業,滋賀県東近江市蛇溝町１０７３番地１３,2016-10-07,株式会社
株式会社茜フードサービス,佐賀県多久市北多久町大字小侍６６６番地２７,2016-10-07,株式会社
株式会社菖蒲谷山林開発,福井県福井市菖蒲谷町第１６号１番地,2016-10-07,株式会社
株式会社虎桜,埼玉県朝霞市田島２丁目４番２６号,2016-10-07,株式会社
株式会社西尾興業,長崎県佐世保市吉井町吉元４０番地６,2016-10-07,株式会社
株式会社西方建匠,山形県米沢市万世町牛森４３０２番地,2016-10-07,株式会社
株式会社谷口商会,岡山県岡山市東区邑久郷２６４５番地,2016-10-07,株式会社
株式会社谷口畜産,鳥取県鳥取市河原町小畑３６番地１,2016-10-07,株式会社
株式会社輝進,広島県呉市本通４丁目９番１３－２０１号,2016-10-07,株式会社
株式会社近藤錠前製作所,東京都台東区今戸２丁目１１番１８号,2016-10-07,株式会社
株式会社那須平商店,宮城県岩沼市本町７番１５号,2016-10-07,株式会社
株式会社鈴心,岩手県北上市口内町舘沢２８番地,2016-10-07,株式会社
株式会社鈴木組,茨城県水戸市元吉田町２７８７番地の２,2016-10-07,株式会社
株式会社長輝,京都府舞鶴市字福来５９２番地,2016-10-07,株式会社
株式会社長﨑興産,福岡県福岡市博多区千代２丁目２１番１８号,2016-10-07,株式会社
株式会社門司笑,福岡県北九州市門司区鳴竹１丁目１３番８号,2016-10-07,株式会社
株式会社関就工業,大阪府寝屋川市香里西之町１０番１７号,2016-10-07,株式会社
株式会社関水,群馬県前橋市清野町６０番地５,2016-10-07,株式会社
株式会社隆昌水産,長崎県南松浦郡新上五島町宿ノ浦郷３９２番地,2016-10-07,株式会社
株式会社青木建装,福島県喜多方市塩川町御殿場六丁目１３０番地,2016-10-07,株式会社
株式会社颯真,福岡県福岡市城南区樋井川２丁目１０番１７号,2016-10-07,株式会社
株式会社飛梅ＤＩＮＩＮＧ,宮城県仙台市青葉区国分町３丁目９番９号,2016-10-07,株式会社
株式会社高島オート,滋賀県高島市安曇川町西万木７７６番地,2016-10-07,株式会社
株式会社高橋工業一級建築士事務所,秋田県横手市柳田字笹崎１４１番地１,2016-10-07,株式会社
株式会社鳶伊藤組,愛知県豊田市西中山町蔵屋敷５８番地３,2016-10-07,株式会社
株式会社齊藤重機,熊本県宇城市三角町波多９２４番地１０,2016-10-07,株式会社
株式会社齋藤建築,福島県喜多方市字大谷地８０２５番地６,2016-10-07,株式会社
株式会社３ＴＯＰ,東京都渋谷区幡ヶ谷３丁目３９番１２号渋谷ウェストビル１階,2016-10-07,株式会社
株式会社ＡＩＦソリューションズ,東京都千代田区外神田２丁目１８番５号光洋ビル２階,2016-10-07,株式会社
株式会社ＡＪＰ,三重県津市南中央４番１５号,2016-10-07,株式会社
株式会社ＡＳＫ,大阪府大阪市北区天神橋７丁目４番２－４０１号,2016-10-07,株式会社
株式会社ＡＳＴＲＯＢＯＸ,東京都渋谷区円山町１９番１号,2016-10-07,株式会社
株式会社Ａｄ　Ｓｏｃｉａｌ,東京都千代田区九段南４丁目２番１１号,2016-10-07,株式会社
株式会社Ａｇｅｎｔ　Ｓｙｓｔｅｍ,石川県金沢市八日市４丁目１４４番地１,2016-10-07,株式会社
株式会社ＢＡＳＵＤＥＶ　ＣＯＲＰＯＲＡＴＩＯＮ,東京都墨田区緑１丁目１８番３号,2016-10-07,株式会社
株式会社ＢＥＳＴ　ＨＯＭＥ,神奈川県横浜市磯子区上中里町１０２９番地１０５,2016-10-07,株式会社
株式会社ＢＮＥ,東京都豊島区駒込３丁目３番２１号小松第一ビル７０５号室,2016-10-07,株式会社
株式会社ＢＵＮ．ＩＴＧ,神奈川県横浜市中区海岸通４丁目２３番地,2016-10-07,株式会社
株式会社ＢＵＮ．ＬＯＧ,神奈川県横浜市中区海岸通４丁目２３番地,2016-10-07,株式会社
株式会社ＢＵＮ．ＭＥＧ,神奈川県横浜市中区海岸通４丁目２３番地,2016-10-07,株式会社
株式会社ＢＶ,東京都世田谷区玉川４丁目９番１３号,2016-10-07,株式会社
株式会社Ｂｅｌｌｅ　Ｐｏｔｅｒｉｅ,大阪府大阪市平野区平野東２丁目５番５号,2016-10-07,株式会社
株式会社ＣＡ　Ｙｏｕｎｇ　Ｌａｂ,東京都渋谷区道玄坂１丁目１２番１号,2016-10-07,株式会社
株式会社ＣＭＣ,大阪府大阪市中央区安土町１丁目５番８号－６０５,2016-10-07,株式会社
株式会社ＣｙＣＡＳＴ,東京都渋谷区道玄坂１丁目１２番１号,2016-10-07,株式会社
株式会社Ｄ．ＬＩＮＥ,神奈川県横浜市中区扇町１丁目１番地２５,2016-10-07,株式会社
株式会社ＤＡＩＭＡＺＩＮ,東京都板橋区大山町３６番９号,2016-10-07,株式会社
株式会社ＤＡＩＭＯＮ,東京都千代田区三崎町３丁目４番６号,2016-10-07,株式会社
株式会社ＤＥＣテクノ,三重県津市安濃町草生２３７番地２,2016-10-07,株式会社
株式会社ＤＵＬＴ,東京都渋谷区神南１丁目１２番１４号,2016-10-07,株式会社
株式会社ＤＷＬ,東京都府中市本宿町２丁目１２番地の１Ｄ′クラディアＴＩＭＥＳＡＶＥＮＵＥ６０４,2016-10-07,株式会社
株式会社Ｄｒｅａｍ　Ｌｕｎｃｈ　Ｌｏｇｉｓｔｉｃｓ,東京都豊島区東池袋５丁目４０番９号１Ｆ,2016-10-07,株式会社
株式会社ＥＤＵＣＡＴＩＯＮＡＬ　ＭＥＤＩＣＩＮＥ,東京都豊島区東池袋３丁目１番１号サンシャイン６０－４５Ｆ,2016-10-07,株式会社
株式会社ＥＥＬａｂ,滋賀県彦根市野良田町３４０番地８（４１１号）,2016-10-07,株式会社
株式会社ＥＭＯ,大阪府大阪市中央区森ノ宮中央１丁目１６番２２号,2016-10-07,株式会社
株式会社ＥＮＡＵＳＹＳ,長野県茅野市ちの３１４番地６,2016-10-07,株式会社
株式会社ＥＮＴＲＡＮＣＥ,青森県青森市桜川４丁目３番１０号,2016-10-07,株式会社
株式会社Ｆ．Ｃ．Ｃ．サービス,埼玉県東松山市松葉町３丁目１６番１７号,2016-10-07,株式会社
株式会社ＦＩＸＳ,京都府久世郡久御山町田井向野５３番地７,2016-10-07,株式会社
株式会社ＦＯＲＴ,岡山県岡山市北区問屋町９番地１０１,2016-10-07,株式会社
株式会社ＦＰＧ,東京都目黒区青葉台３丁目２番５号,2016-10-07,株式会社
株式会社ＦＵＣＨＡ,石川県金沢市元町１丁目１６番１９号,2016-10-07,株式会社
株式会社Ｆｉｎｓｉｇｈｔ,東京都千代田区丸の内２丁目２番１号,2016-10-07,株式会社
株式会社ＧＥＮＲＹＵ,鹿児島県鹿屋市西原１丁目２９番１８号,2016-10-07,株式会社
株式会社ＧＰＳジャパン,東京都豊島区東池袋３丁目１番１号サンシャイン６０－４５階,2016-10-07,株式会社
株式会社ＧＲ,静岡県静岡市駿河区下川原４丁目１６番３７号,2016-10-07,株式会社
株式会社ＧＲＡＮＤＩＲ,大阪府大阪市淀川区十八条２丁目１０番９号リル三国６１０号,2016-10-07,株式会社
株式会社Ｇｏｏｄｌｉｆｅ,大阪府東大阪市西堤本通西１丁目６番１２号,2016-10-07,株式会社
株式会社Ｇｓｐｅｃ,熊本県熊本市南区御幸笛田２丁目２１番１７号,2016-10-07,株式会社
株式会社Ｇｕｅｓｔ　Ｓｍｉｌｅ３６５,東京都杉並区南荻窪４丁目１１番１０号,2016-10-07,株式会社
株式会社Ｈ．Ａ．Ｌ．,東京都新宿区北新宿１丁目２０番１３－２０６号,2016-10-07,株式会社
株式会社ＨＡＬコーポレーション,神奈川県横浜市青葉区美しが丘５丁目２番地１４たまセンター第２ビル,2016-10-07,株式会社
株式会社ＨＡＲＵ電工,愛知県豊川市萩町中屋敷５３番地１,2016-10-07,株式会社
株式会社ＨＩＫＡＲＩ工房,徳島県徳島市国府町和田字竹添４７番地の４,2016-10-07,株式会社
株式会社ＨＮパートナーズ,大阪府大阪市北区芝田２丁目２番１３号日生ビル東館６０７Ｂ,2016-10-07,株式会社
株式会社Ｈａｃｋｓ,東京都港区南青山２丁目２番１５号,2016-10-07,株式会社
株式会社Ｉ＆Ｉ,千葉県佐倉市稲荷台２丁目５番地１４,2016-10-07,株式会社
株式会社ＩＣＴネクスト,東京都中央区日本橋小舟町２番９号,2016-10-07,株式会社
株式会社ＩＬ　Ｇａｔｔｏ,東京都品川区戸越１丁目１９番２４号,2016-10-07,株式会社
株式会社ＩＭ塗装,神奈川県川崎市川崎区鋼管通３丁目３番４号,2016-10-07,株式会社
株式会社ＩＭＡＹＡ,大阪府大阪市北区浪花町１３番３８号,2016-10-07,株式会社
株式会社ＩＮＦＩＮＩＴＵＲＥ,福岡県北九州市小倉南区富士見２丁目１５番２号,2016-10-07,株式会社
株式会社ＩＮＰＡＴ,北海道札幌市厚別区上野幌一条１丁目１２番５号,2016-10-07,株式会社
株式会社ＩＰ・ＴＡＫＩ,京都府京都市右京区太秦下刑部町１６２,2016-10-07,株式会社
株式会社Ｋ＆Ｓ,神奈川県横浜市南区吉野町２丁目４番地,2016-10-07,株式会社
株式会社Ｋ－ＨＯＭＥ,京都府京都市伏見区醍醐大畑町１１８番地,2016-10-07,株式会社
株式会社Ｋ．Ｊ．Ｒ,神奈川県横須賀市久里浜４丁目３番１２号Ｌビル,2016-10-07,株式会社
株式会社Ｋ３,京都府京都市南区西九条比永城町１１８番地,2016-10-07,株式会社
株式会社Ｋ５,大阪府大阪市平野区加美西１丁目１６番１４－４０５号,2016-10-07,株式会社
株式会社ＫＡＴＯ　Ｄｅｓｉｇｎ,東京都渋谷区富ヶ谷２丁目１２番１６号,2016-10-07,株式会社
株式会社ＫＢＳ,神奈川県横浜市中区松影町１丁目４番地９－１１０９号室,2016-10-07,株式会社
株式会社ＫＣＨ,広島県安芸郡海田町幸町９番１号,2016-10-07,株式会社
株式会社ＫＩＴ興業,神奈川県横浜市南区別所２丁目２８番４号,2016-10-07,株式会社
株式会社ＫＯＧＡ　ＨＯＬＤＩＮＧＳ,東京都港区麻布台２丁目１番２－５０９号,2016-10-07,株式会社
株式会社ＫＯＨＯプラスワン,岐阜県大垣市丸の内２丁目２０番地,2016-10-07,株式会社
株式会社ＫＳＢ,福島県会津若松市上町１番１６号,2016-10-07,株式会社
株式会社ＫＳＩ,福岡県福岡市中央区荒戸１丁目１１番１０号サンシティー西公園１０３号,2016-10-07,株式会社
株式会社ＬＡＭＹＭＡＬ,東京都渋谷区神宮前４丁目３番１５号東京セントラル表参道５０４,2016-10-07,株式会社
株式会社Ｌｅ’ａｎｄｅ,東京都千代田区神田駿河台２丁目１番７号,2016-10-07,株式会社
株式会社Ｌｅｇａｃｉｅｓ,神奈川県横浜市保土ケ谷区天王町２丁目４２番地２－２－１００５号,2016-10-07,株式会社
株式会社Ｌｉｐ,東京都渋谷区渋谷３丁目６番２号,2016-10-07,株式会社
株式会社Ｌｏｖｅｄｅｓｉｇｎ,東京都練馬区下石神井１丁目１３番５号ことみハイム２号室,2016-10-07,株式会社
株式会社Ｍ,千葉県印西市滝野１丁目４番１３号,2016-10-07,株式会社
株式会社Ｍ・プラニング,神奈川県南足柄市岩原４９４番地３,2016-10-07,株式会社
株式会社ＭＡＴＥＲＩＡＬ,東京都目黒区中目黒２丁目８番７－３０２号Ｊ－ＰＡＲＫ中目黒ＩＶ,2016-10-07,株式会社
株式会社ＭＣロード,大阪府大阪市都島区中野町４丁目１３番４号,2016-10-07,株式会社
株式会社ＭＯＺＺ　ＴＯＫＹＯ,東京都渋谷区道玄坂１丁目１２番１号,2016-10-07,株式会社
株式会社ＭＰＧそらち,北海道富良野市字西学田二区１４０番地１,2016-10-07,株式会社
株式会社ＭＲＣ,京都府宇治市木幡東中２１番地の３,2016-10-07,株式会社
株式会社ＭＳ　Ｒｏａｄ,広島県尾道市吉和町４５２８番地１５,2016-10-07,株式会社
株式会社Ｍｅｒｃｕｒｅ,東京都豊島区高松２丁目５番８号鳳ハイツ２０３号室,2016-10-07,株式会社
株式会社Ｍｏｄｅｒｎ　Ｌｅａｓｉｎｇ,愛知県豊田市昭和町４丁目１８番地,2016-10-07,株式会社
株式会社Ｎ．Ｋオートシステム,北海道札幌市北区篠路町拓北３１－３４３,2016-10-07,株式会社
株式会社ＮＡＮＤＡ　ＪＡＰＡＮ,茨城県稲敷市時崎４５番地１－Ｄ,2016-10-07,株式会社
株式会社ＮＴサプライ,沖縄県島尻郡与那原町字東浜２４番地の５プレミアムガーデンⅠ－６０４号,2016-10-07,株式会社
株式会社ＯＣＴＯＰＡＴＨ,大阪府大阪市西区京町堀１丁目１３－１７－２０５,2016-10-07,株式会社
株式会社ＯＦＦＩＣＥ　ＫＩＴＡＢＡ,奈良県橿原市大久保町１９９番地の１,2016-10-07,株式会社
株式会社ＯＧ,東京都豊島区池袋２丁目６１番１号,2016-10-07,株式会社
株式会社ＯＰＥＮＥＲＳ,石川県金沢市元町２丁目１５番５号（元町グリーンマンション・６０２号）,2016-10-07,株式会社
株式会社ＯＳＣ,愛知県岡崎市戸崎町字才苗２９番地２,2016-10-07,株式会社
株式会社ＯＴＯ,岡山県赤磐市桜が丘西６丁目１３番７号,2016-10-07,株式会社
株式会社ＯＴＯＺＵＲＥ,東京都目黒区平町１丁目１番１号ルーブル都立大学参番館４０２,2016-10-07,株式会社
株式会社ＰＥＡＣＥ,大阪府大阪市住之江区浜口東３丁目８番１０号,2016-10-07,株式会社
株式会社ＰＬＡＩＮ,大阪府大阪市平野区長吉長原西２丁目１０番２４号,2016-10-07,株式会社
株式会社Ｐｒｅｍｉｅｒ,福岡県福岡市中央区港１丁目６番６,2016-10-07,株式会社
株式会社ＱｕａｌｉＡｒｔｓ,東京都渋谷区円山町１９番１号,2016-10-07,株式会社
株式会社Ｒ,佐賀県佐賀市巨勢町大字牛島７１０番地,2016-10-07,株式会社
株式会社ＲＥＮコンサルティング,東京都千代田区西神田３丁目１番６号,2016-10-07,株式会社
株式会社ＲＨコーポレーション,京都府京都市上京区仁和寺街道千本東入西富仲町６８３番地８,2016-10-07,株式会社
株式会社ＲｅＢｉｒｔｈ,大阪府大阪市中央区上本町西５丁目３番１５号,2016-10-07,株式会社
株式会社Ｓ＆Ｍ　Ｔｒａｄｉｎｇ,東京都豊島区東池袋１丁目４３番１０－３１０号,2016-10-07,株式会社
株式会社ＳＡＧＡＥ．ＡｕｔｏＳｅｒｖｉｃｅ,山形県寒河江市大字寒河江字五反５３番地１,2016-10-07,株式会社
株式会社ＳＤ－ＬＡＢ,広島県広島市安芸区矢野西３丁目４６番２３号,2016-10-07,株式会社
株式会社ＳＯＡＲ　ＲＥＳＯＲＴ,長崎県対馬市美津島町洲藻４６番地１,2016-10-07,株式会社
株式会社ＳＯＬ・コーポレーション,東京都豊島区西巣鴨１丁目１０番１５号,2016-10-07,株式会社
株式会社ＳＴＤ,東京都千代田区麹町４丁目４番５号麹町シャインビル,2016-10-07,株式会社
株式会社ＳＴＥＰ・ＯＮＥ,宮崎県小林市真方５５２８番地１,2016-10-07,株式会社
株式会社ＳＹ技術設計,香川県三豊市豊中町本山甲１０７０番地１,2016-10-07,株式会社
株式会社Ｓｔａｉｒｓ,宮城県多賀城市城南１丁目１１番３８号,2016-10-07,株式会社
株式会社Ｔ＆Ｐ　Ｓｏｌｕｔｉｏｎｓ,東京都品川区南品川４丁目４番１７号,2016-10-07,株式会社
株式会社Ｔ－ＴＥＣ,愛知県豊田市大見町２丁目６３番地１,2016-10-07,株式会社
株式会社Ｔ．Ｆ　ｃｏｒｐｏｒａｔｉｏｎ,東京都新宿区北新宿１丁目６番１号,2016-10-07,株式会社
株式会社Ｔ．Ｓカンパニー,東京都江東区有明１丁目４番２０－２２１６号,2016-10-07,株式会社
株式会社ＴＨアグリサービス,栃木県那須郡那須町大字豊原丙１８６９番地３,2016-10-07,株式会社
株式会社ＴＮ・ＬＩＮＫ,栃木県真岡市下鷺谷１０３番地,2016-10-07,株式会社
株式会社ＴＯＫＵＩ　ＪＡＰＡＮ,神奈川県横浜市西区高島２丁目６番３２号,2016-10-07,株式会社
株式会社ＴＯＭＯＴＡＳ,京都府京都市右京区西京極南大入町４番地,2016-10-07,株式会社
株式会社ＴＳＫ　ＣＯＭＰＡＮＹ,栃木県鹿沼市西鹿沼町１７７番地３,2016-10-07,株式会社
株式会社Ｔａｎｄｅｍｓ,東京都世田谷区松原３丁目３０－１０－２Ｆ,2016-10-07,株式会社
株式会社Ｔｈｅ　Ｗｅｅｋｅｎｄ,東京都港区南麻布３丁目１９番７号,2016-10-07,株式会社
株式会社ＴｏｗａＳｔｅｌａ,東京都新宿区西新宿８丁目１７番１号,2016-10-07,株式会社
株式会社ＵＰ,沖縄県沖縄市古謝２丁目１７番２４号,2016-10-07,株式会社
株式会社Ｕｐｄａｔｅ,兵庫県尼崎市猪名寺１丁目２５番５２号,2016-10-07,株式会社
株式会社ＷＥＬＬＳ,東京都中央区東日本橋２丁目２８番４号日本橋ＣＥＴビル２階,2016-10-07,株式会社
株式会社ＹＤｃａｐｉｔａｌ,東京都江東区東雲１丁目９番４１－３１０１号,2016-10-07,株式会社
株式会社ＹＨＯＰＥ,福井県福井市下森田新町第１６号２２番地,2016-10-07,株式会社
株式会社ＹＮ企画,広島県福山市南蔵王町６丁目１４番３７号Ａ１０２,2016-10-07,株式会社
株式会社ＹＯＲＯＺＵ,福岡県北九州市門司区新門司１丁目６番３号,2016-10-07,株式会社
株式会社ＹＴＣ,東京都世田谷区松原３丁目２７番２３号マートルコート松原１０６号,2016-10-07,株式会社
株式会社ａｃｔ,東京都世田谷区松原６丁目２３番１４号,2016-10-07,株式会社
株式会社ａｍｏｒｅｔｔｏ,鹿児島県鹿児島市上之園町１０番地８,2016-10-07,株式会社
株式会社ｂｌｏｗｌｉｎｅ,大阪府大阪市中央区南船場３丁目６番２５号,2016-10-07,株式会社
株式会社ｂｏｔ　ｄｏｃｋ,東京都渋谷区宇田川町６－２０,2016-10-07,株式会社
株式会社ｃｒｅｅｒ,愛知県安城市福釜町蔵前４７番地３,2016-10-07,株式会社
株式会社ｅａｕ,東京都杉並区成田東２丁目３９番２０－３０８号,2016-10-07,株式会社
株式会社ｆｏｎｔｅ,東京都江戸川区鹿骨５丁目４０番５号,2016-10-07,株式会社
株式会社ｉＣｉＯＮ,東京都渋谷区代々木２丁目１０番９号本間ビル７階,2016-10-07,株式会社
株式会社ｎ．ｐ．ｃ,大阪府大阪市北区西天満２丁目８番１号大江ビルヂングＢ２,2016-10-07,株式会社
株式会社ｏｆｆｉｃｅ　ＬＥＰ,大阪府大阪市城東区今福西４丁目４番２３号,2016-10-07,株式会社
株式会社ｓｈｉｒｏ,香川県高松市丸亀町６番地２号１階,2016-10-07,株式会社
森方電工株式会社,京都府福知山市石原４丁目３７番地,2016-10-07,株式会社
横浜点検コンサルタンツ合同会社,神奈川県横浜市港北区綱島上町１番地１グリーンサラウンドシティ３番街６１１号,2016-10-07,合同会社
沖縄ＵＤＳ株式会社,沖縄県那覇市牧志２丁目１６番８号,2016-10-07,株式会社
河北うずら株式会社,大分県日田市天瀬町合田２２７５番地１,2016-10-07,株式会社
泓倍資産管理株式会社,東京都江東区木場５丁目１番４－３０１号,2016-10-07,株式会社
清水企画合同会社,佐賀県唐津市東唐津３丁目１番３号,2016-10-07,合同会社
濱の屋株式会社,神奈川県鎌倉市御成町６番１４号,2016-10-07,株式会社
特定非営利活動法人ふくつ子どもステーションすてっぷ,福岡県福津市中央１丁目１６番６－５０６号,2016-10-07,その他の設立登記法人
特定非営利活動法人みえ減災啓発支援ネット,三重県四日市市蔵町４番１７号四日市市なやプラザ,2016-10-07,その他の設立登記法人
特定非営利活動法人みつばちの小さな喫茶店,北海道札幌市西区山の手三条７丁目４番２０号まるいち店舗内,2016-10-07,その他の設立登記法人
特定非営利活動法人カシオペア,長野県長野市大字鶴賀七瀬南部５６６番地５東竹ビル３Ｆ,2016-10-07,その他の設立登記法人
特定非営利活動法人コールサービスあんしん,北海道旭川市永山四条４丁目１番５号,2016-10-07,その他の設立登記法人
特定非営利活動法人三多摩市民後見を考える会,東京都立川市西砂町２丁目２８番地の１７,2016-10-07,その他の設立登記法人
特定非営利活動法人丸瀬布昆虫同好会,北海道紋別郡遠軽町丸瀬布中町３番地,2016-10-07,その他の設立登記法人
特定非営利活動法人京都面会交流ひろば,京都府京都市中京区新町通御池上る中之町４６番地イーグルコート京都御池創苑１００５号,2016-10-07,その他の設立登記法人
特定非営利活動法人大阪脊椎脊髄グループ,大阪府河内長野市木戸東町２番１号,2016-10-07,その他の設立登記法人
特定非営利活動法人子どもと文化のＮＰＯＡｒｔ．３１,長野県諏訪郡原村１７２１７番地４１９,2016-10-07,その他の設立登記法人
特定非営利活動法人宮古地域医療情報連携ネットワーク協議会,岩手県宮古市西町１丁目６番２号,2016-10-07,その他の設立登記法人
特定非営利活動法人海のこえ,千葉県長生郡一宮町一宮３３４８番地３,2016-10-07,その他の設立登記法人
特定非営利活動法人ｇｒｅｅｎ,岡山県岡山市中区八幡４３番地４,2016-10-07,その他の設立登記法人
特許業務法人広和特許事務所,東京都新宿区西新宿３丁目１番３号西新宿小出ビル４階,2016-10-07,その他の設立登記法人
玉川鉄筋工業株式会社,大阪府大阪市此花区酉島１丁目９番１９号,2016-10-07,株式会社
畷工機株式会社,大阪府交野市星田北３丁目３３番１号,2016-10-07,株式会社
皮美輝合同会社,東京都渋谷区代々木３丁目３７番７号グランハイツ代々木５０９,2016-10-07,合同会社
社会保険労務士法人シプス,広島県廿日市市串戸４丁目１１番１５－１号,2016-10-07,その他の設立登記法人
社会保険労務士法人鈴木事務所,北海道釧路市宮本１丁目３番１１号,2016-10-07,その他の設立登記法人
神無月オフィス合同会社,福岡県福岡市中央区天神１丁目１５番６号中尾事務所内,2016-10-07,合同会社
福島送電準備合同会社,福島県福島市中町５番２１号,2016-10-07,合同会社
福渡来合同会社,広島県安芸郡坂町植田３丁目２０番５号,2016-10-07,合同会社
税理士法人ベストフレンド,愛知県一宮市森本２丁目２６番５号,2016-10-07,その他の設立登記法人
税理士法人操山会計,岡山県岡山市中区清水１丁目１０番９号カトービル２階,2016-10-07,その他の設立登記法人
税理士法人静岡南会計,静岡県静岡市駿河区南町２番２０号,2016-10-07,その他の設立登記法人
稲安工業株式会社,石川県羽咋市大川町北新３４７番地３,2016-10-07,株式会社
米澤商会株式会社,東京都江戸川区松江５丁目２５番１２号,2016-10-07,株式会社
結城ブリッジ株式会社,茨城県結城市大字結城１２０２２番地２２アイル・ビーチェⅠ２０３,2016-10-07,株式会社
臼井資産管理株式会社,東京都世田谷区上野毛１丁目３４番１５号,2016-10-07,株式会社
華聖商業株式会社,東京都品川区八潮５丁目１０番５３－４０５号,2016-10-07,株式会社
西日本ケアサービス株式会社,山口県光市島田２丁目２６番２５号,2016-10-07,株式会社
