法人名,住所,設立日,法人種別
うめさとＡＨ株式会社,千葉県野田市山崎新町２７番地の１５,2016-09-01,株式会社
みんなの安心株式会社,佐賀県三養基郡みやき町大字江口７５６１番地,2016-09-01,株式会社
やんばるの泉合同会社,沖縄県那覇市松尾２丁目２２番２０号,2016-09-01,合同会社
アグリエース株式会社,広島県東広島市八本松町原１０１３７番地,2016-09-01,株式会社
アッとプランニング合同会社,京都府京都市下京区三ノ宮町通上ノ口上る岩滝町２２２番地２号,2016-09-01,合同会社
アブレ株式会社,東京都渋谷区恵比寿南２丁目２８番１－１０１号,2016-09-01,株式会社
アポロ電子株式会社,東京都町田市南成瀬６丁目１６番地１８,2016-09-01,株式会社
アントレプレナー株式会社,東京都港区六本木４丁目２番４５号,2016-09-01,株式会社
エスコンジャパンリート投資法人,東京都千代田区神田駿河台４丁目２番５号,2016-09-01,その他の設立登記法人
エム・ティ・アロー株式会社,東京都武蔵野市吉祥寺北町１丁目１５番１９号,2016-09-01,株式会社
オーナーズ・オブ・ライフ合同会社,東京都江戸川区東葛西９丁目５番１５－５０１号コスモ葛西アステア,2016-09-01,合同会社
カメヤ株式会社,兵庫県南あわじ市阿那賀９８４番地,2016-09-01,株式会社
キムズカンパニー株式会社,大阪府堺市北区百舌鳥梅町１丁１番地６,2016-09-01,株式会社
グリーンフィールド株式会社,福岡県北九州市小倉北区浅野３丁目８番１号,2016-09-01,株式会社
グレイン株式会社,大阪府大阪市此花区西九条３丁目４番１５号,2016-09-01,株式会社
ザ・ペアシティ四谷管理組合法人,東京都新宿区三栄町２７番地４,2016-09-01,その他の設立登記法人
ドーンインターナショナル株式会社,東京都港区六本木５丁目１０番３３号麻布鳥居坂マンション４０５,2016-09-01,株式会社
バイオミライ株式会社,東京都目黒区下目黒４丁目２０番１３－１０４号,2016-09-01,株式会社
フジ・エヴァーグリーンホーム株式会社,滋賀県野洲市小篠原９１３番地,2016-09-01,株式会社
プラスアルファ株式会社,愛知県名古屋市港区河口町１番２,2016-09-01,株式会社
プロメタル株式会社,熊本県菊池郡大津町大字杉水３４０３番地１７,2016-09-01,株式会社
モロフジホールディングス株式会社,福岡県福岡市中央区白金１丁目６番１４号４階,2016-09-01,株式会社
ユナイテッドフードカルチャー株式会社,千葉県鎌ケ谷市右京塚１番１７－６０２号,2016-09-01,株式会社
ライフカーゴ株式会社,東京都大田区南千束１丁目８番１２号,2016-09-01,株式会社
ランドトラスト株式会社,山梨県富士吉田市上吉田６５９２番地,2016-09-01,株式会社
リトレード株式会社,東京都荒川区東尾久２丁目２番９号三洋ビル２２０号室,2016-09-01,株式会社
リバティテクノ株式会社,兵庫県川西市鴬台１丁目６番地の１,2016-09-01,株式会社
リーフネット株式会社,岡山県岡山市南区箕島３６６番地３,2016-09-01,株式会社
レインメーカー合同会社,東京都中央区日本橋３丁目２番１４号新槇町ビル別館第一２階,2016-09-01,合同会社
一般社団法人アミートラスト,福島県郡山市堤１丁目９４番地の６,2016-09-01,その他の設立登記法人
一般社団法人クリアディンプルデンチャー協会,千葉県千葉市中央区本町３丁目３番３号,2016-09-01,その他の設立登記法人
一般社団法人ジャパンウィメンズコレクション,東京都港区麻布十番２丁目７番５号,2016-09-01,その他の設立登記法人
一般社団法人ソノダ,熊本県熊本市南区出仲間７丁目４番４１－５０３号,2016-09-01,その他の設立登記法人
一般社団法人ナラティブケア協会,愛知県名古屋市守山区四軒家１丁目３３１番地,2016-09-01,その他の設立登記法人
一般社団法人マッシュ,鳥取県境港市昭和町７番地３,2016-09-01,その他の設立登記法人
一般社団法人介護職協会,静岡県焼津市田尻北１６２８番地の１９,2016-09-01,その他の設立登記法人
一般社団法人天現寺大使館,東京都港区南麻布４丁目２番４２号クオリア南麻布１階,2016-09-01,その他の設立登記法人
一般社団法人慶淳会,東京都港区赤坂４丁目１番１号ＳＨＩＭＡ赤坂ビル,2016-09-01,その他の設立登記法人
一般社団法人湘南ファミリーステーション,神奈川県藤沢市大庭５３１８番地２,2016-09-01,その他の設立登記法人
今井株式会社,千葉県君津市下湯江１８１番地,2016-09-01,株式会社
信太山興産株式会社,大阪府大阪市中央区北久宝寺町２丁目４番１号,2016-09-01,株式会社
光月合同会社,東京都荒川区東尾久２丁目２番９号三祥ビル２１１,2016-09-01,合同会社
全品株式会社,埼玉県川口市西川口１丁目３０番２０号泰合ビル創業館・西川口オフィス３Ｆ－１０号室,2016-09-01,株式会社
医療法人社団恵心会,東京都江東区大島５丁目３６番８号宍戸第３ビル３階,2016-09-01,その他の設立登記法人
古河アスコン株式会社,茨城県古河市尾崎３９５８番地,2016-09-01,株式会社
合同会社アドバンス,北海道名寄市西二条南１０丁目３６番地２,2016-09-01,合同会社
合同会社アラヤ,岩手県盛岡市厨川２丁目１番６２号,2016-09-01,合同会社
合同会社ジョイライフワールド,神奈川県川崎市麻生区万福寺４丁目１９番１－９３４号,2016-09-01,合同会社
合同会社ダマーリインターナショナル,埼玉県新座市片山３丁目１番１４号,2016-09-01,合同会社
合同会社フォレストリバー,千葉県市川市本塩１番１８号,2016-09-01,合同会社
合同会社フットマーク,神奈川県横浜市都筑区中川中央１丁目３８番５号中西ビル１Ｆ,2016-09-01,合同会社
合同会社ラフーズ,福島県田村市都路町岩井沢字楢梨子９６番地１０,2016-09-01,合同会社
合同会社リウム,東京都江東区海辺１７番１１号,2016-09-01,合同会社
合同会社ワイズファクトリー,熊本県熊本市西区花園７丁目２番２２号２０６,2016-09-01,合同会社
合同会社八戸是川,東京都港区虎ノ門１丁目２番８号リニューアブル・ジャパン株式会社内,2016-09-01,合同会社
合同会社向洋,埼玉県白岡市小久喜２２２番地１７,2016-09-01,合同会社
合同会社城東美装,埼玉県戸田市喜沢１丁目１２番地の６,2016-09-01,合同会社
合同会社心友,青森県つがる市森田町森田月見野４７５番地７,2016-09-01,合同会社
合同会社日愛,京都府京都市伏見区小栗栖森本町２０番地の５１,2016-09-01,合同会社
合同会社東勝,東京都北区神谷１丁目１番２７－８０７号レシアス王子神谷パークフロント,2016-09-01,合同会社
合同会社渥美,静岡県浜松市南区三新町２４５番地,2016-09-01,合同会社
合同会社絵晟,茨城県神栖市息栖２２０４番地,2016-09-01,合同会社
合同会社英祥,京都府京都市左京区岩倉三宅町３１０番地６,2016-09-01,合同会社
合同会社Ａ－ｓｔｙｌｅ,熊本県熊本市東区花立５丁目４番４３号,2016-09-01,合同会社
合同会社ＡＧクリエイト,兵庫県伊丹市御願塚４丁目５番３号,2016-09-01,合同会社
合同会社ＧＯＯＤＲＩＣＨ,静岡県浜松市中区中央２丁目９番７号,2016-09-01,合同会社
合同会社ＭＢインベストメント１,東京都千代田区丸の内３丁目１番１号東京共同会計事務所内,2016-09-01,合同会社
合同会社Ｒ＆Ｃｏ,東京都練馬区向山２丁目１７番２７号,2016-09-01,合同会社
合同会社ＲＯＳＫＹ,東京都中央区銀座６丁目６番１号,2016-09-01,合同会社
合同会社Ｗａ,神奈川県川崎市川崎区榎町１番１８号,2016-09-01,合同会社
合同会社Ｗｉｔｈ　ｙｏｕ,三重県亀山市栄町１４８７番地２５,2016-09-01,合同会社
合同会社ｄｉｇｏｏｎ,滋賀県栗東市小平井２丁目１５番８号,2016-09-01,合同会社
合同会社ｓｈｉｍｏｋｉｔａｍｂｏ,東京都世田谷区北沢１丁目１９番４－４０５号,2016-09-01,合同会社
吉乃川ホールディングス株式会社,新潟県長岡市摂田屋４丁目８番１２号,2016-09-01,株式会社
吉田板金株式会社,愛媛県松山市下伊台町乙５７７番地,2016-09-01,株式会社
名星テクノサービス株式会社,愛知県名古屋市名東区扇町２丁目１番地の２,2016-09-01,株式会社
和花菜農園株式会社,和歌山県和歌山市中筋日延７２番地１,2016-09-01,株式会社
四葉地所株式会社,東京都渋谷区幡ヶ谷２丁目９番２０号,2016-09-01,株式会社
土地家屋調査士法人ＬＡＮＤ　ＡＮＤ,大阪府大阪市旭区赤川２丁目１４番１号,2016-09-01,その他の設立登記法人
大月ウッドサプライ株式会社,山梨県大月市大月町花咲１６８７番地４,2016-09-01,株式会社
太陽油化管理株式会社,東京都板橋区三園２丁目１２－２,2016-09-01,株式会社
守警備保障株式会社,大阪府堺市中区八田西町２丁１６番４０号,2016-09-01,株式会社
帝盛株式会社,埼玉県川口市新井町３番地１０,2016-09-01,株式会社
新宅エンジニアリング株式会社,大阪府堺市西区浜寺船尾町東４丁２６０番地５,2016-09-01,株式会社
日本大全新エネルギー株式会社,愛知県名古屋市中区丸の内３丁目１７番２８号,2016-09-01,株式会社
日本戦略株式会社,東京都中央区日本橋茅場町１丁目９番２号,2016-09-01,株式会社
明聖産業株式会社,東京都渋谷区神宮前４丁目２５番６号神宮前ビル,2016-09-01,株式会社
月易国際株式会社,神奈川県横浜市中区山下町１３０番地１５華輝アパート１０２号室,2016-09-01,株式会社
木村技巧株式会社,千葉県柏市増尾台３丁目１２番５号,2016-09-01,株式会社
株式会社うまいもの劇団,宮城県仙台市太白区中田町字寺浦１０番地の３８,2016-09-01,株式会社
株式会社うり,東京都江戸川区西小岩１丁目２７番３０号第三関根ビル１階,2016-09-01,株式会社
株式会社かんすい苑覚楽,栃木県那須塩原市黒磯４０２番地５,2016-09-01,株式会社
株式会社くるみ,兵庫県姫路市継２６２番地１,2016-09-01,株式会社
株式会社さくら人事労務サポート,新潟県新潟市秋葉区新津本町２丁目６番３７号青野ビル３階,2016-09-01,株式会社
株式会社はるもけあ,大阪府泉佐野市南中安松７４９－１,2016-09-01,株式会社
株式会社ひとえ,京都府京都市下京区富小路通五条下る本塩竈町５５８番地８京都昭栄ビル９階,2016-09-01,株式会社
株式会社まごころホールディングス,大阪府堺市北区長曽根町１６０７番地１,2016-09-01,株式会社
株式会社まるまさラーメン,和歌山県西牟婁郡白浜町８９０番地の３７,2016-09-01,株式会社
株式会社みやび庵,愛知県名古屋市中区大須３丁目３７番１４号,2016-09-01,株式会社
株式会社ゆざライフプランニング,神奈川県平塚市公所４９３番地の８,2016-09-01,株式会社
株式会社アクロス,東京都中央区京橋１丁目６番１３号金葉ビルディング６Ｆ,2016-09-01,株式会社
株式会社アステックス福岡,福岡県福岡市博多区博多駅前２丁目１７－２５博多クリエイトビル５階,2016-09-01,株式会社
株式会社アズコーポレーション,東京都北区豊島３丁目２１番９号,2016-09-01,株式会社
株式会社アドヴァンクライン,山口県防府市清水町８番３０号,2016-09-01,株式会社
株式会社アルカナ,東京都港区南青山２丁目２番１５号ウィン青山ビルＵＣＦ－９１７,2016-09-01,株式会社
株式会社アルマ,広島県広島市安佐北区あさひが丘７丁目１４番２０号,2016-09-01,株式会社
株式会社イトハン,埼玉県朝霞市田島２丁目５番２５号,2016-09-01,株式会社
株式会社イレブン,兵庫県西宮市北六甲台５丁目４０番４号,2016-09-01,株式会社
株式会社エス,香川県高松市西ハゼ町２０１番地３,2016-09-01,株式会社
株式会社エヌケイ,沖縄県豊見城市字高安５９３番地１,2016-09-01,株式会社
株式会社エムスペース,千葉県柏市しいの木台２丁目１３番地１４,2016-09-01,株式会社
株式会社エンジョイ,愛知県名古屋市中区栄４丁目１７番２０号,2016-09-01,株式会社
株式会社エー・キャット,東京都板橋区蓮沼町１番１８号,2016-09-01,株式会社
株式会社オフィスアライズ,大阪府大阪市西区土佐堀１丁目６番２０号,2016-09-01,株式会社
株式会社オライ,京都府京都市東山区祇園町北側２８２－１６,2016-09-01,株式会社
株式会社オーバータイム,埼玉県戸田市笹目７丁目９番地の１２,2016-09-01,株式会社
株式会社キットアライブ,北海道札幌市中央区大通西４丁目６番地８,2016-09-01,株式会社
株式会社キュアラボ,埼玉県さいたま市見沼区大和田町１丁目１２３０番地５５,2016-09-01,株式会社
株式会社クレインホールディングス,大阪府大阪市鶴見区鶴見１丁目６番９５号,2016-09-01,株式会社
株式会社グリーンアート,群馬県みどり市笠懸町阿左美４８０番地１０,2016-09-01,株式会社
株式会社グリーンウィーク,栃木県那須郡那須町大字豊原丙４３１６番地,2016-09-01,株式会社
株式会社グロリアスライフ,愛知県名古屋市中川区八神町３丁目８番地,2016-09-01,株式会社
株式会社グロービズ,東京都新宿区百人町２丁目２４番１３号,2016-09-01,株式会社
株式会社コアトレード,東京都豊島区上池袋４丁目８番１０号,2016-09-01,株式会社
株式会社コラソン,大阪府和泉市内田町１丁目５番２１号,2016-09-01,株式会社
株式会社コラボス光,岡山県岡山市北区野田２丁目４番１号,2016-09-01,株式会社
株式会社サンライズ,東京都稲城市矢野口３５８番地の１,2016-09-01,株式会社
株式会社シズプレ,静岡県静岡市葵区飯間５番地の４,2016-09-01,株式会社
株式会社シンキ塗装,大阪府大阪市東成区神路２丁目８番３３号,2016-09-01,株式会社
株式会社ジオーアルズ,茨城県守谷市松ケ丘３丁目１番地３,2016-09-01,株式会社
株式会社ジャパンロードサービス,福島県いわき市平字作町三丁目１番１２号２階,2016-09-01,株式会社
株式会社セダップ,埼玉県鶴ヶ島市松ヶ丘４丁目１番,2016-09-01,株式会社
株式会社タカハリ,静岡県磐田市上本郷１００５番地５グレースフィール１０２,2016-09-01,株式会社
株式会社ディレボリューション,神奈川県鎌倉市七里ガ浜東４丁目３２番１１号,2016-09-01,株式会社
株式会社トリプルアール,東京都新宿区住吉町６番５号,2016-09-01,株式会社
株式会社ニコニコ足場,石川県かほく市上田名子３０番地１,2016-09-01,株式会社
株式会社ネスト,東京都目黒区中根１丁目２番１７号,2016-09-01,株式会社
株式会社ハウズメイト,東京都港区白金台５丁目１３番２８号,2016-09-01,株式会社
株式会社ハル美装,東京都葛飾区細田５丁目５番５号,2016-09-01,株式会社
株式会社ヒトコト,福岡県福岡市城南区別府２丁目３番７－１０２号,2016-09-01,株式会社
株式会社ファインプール,熊本県熊本市中央区上通町５番地４６,2016-09-01,株式会社
株式会社フィールドダイヤ,千葉県松戸市中根４１５番地,2016-09-01,株式会社
株式会社フューチャーインベスターズ,東京都足立区中央本町１丁目１８番１２,2016-09-01,株式会社
株式会社プレシア製薬,東京都世田谷区桜３丁目９番２１号,2016-09-01,株式会社
株式会社ベライト,群馬県高崎市日光町３番地,2016-09-01,株式会社
株式会社ベリテ,東京都渋谷区千駄ヶ谷５丁目２６番５－８０６号,2016-09-01,株式会社
株式会社ミライズ,熊本県熊本市中央区神水１丁目２５番７号,2016-09-01,株式会社
株式会社ムーンチャイルド,東京都北区西が丘３丁目８番３－１３２１号,2016-09-01,株式会社
株式会社メガホン,大阪府大阪市北区堂島浜２丁目２番２８号,2016-09-01,株式会社
株式会社メルシー,茨城県つくば市島名２３３５ウィンズヒル４Ｃ,2016-09-01,株式会社
株式会社ヤマニ,岐阜県岐阜市茜部菱野１丁目１０５番地の１,2016-09-01,株式会社
株式会社リヨメール,東京都中央区湊１丁目８番１１号,2016-09-01,株式会社
株式会社リーダーシステムズ,兵庫県神戸市長田区菅原通６丁目２番１号ＫＳビル,2016-09-01,株式会社
株式会社ルーシッドエステート,三重県四日市市小古曽東１丁目１番１３－５号,2016-09-01,株式会社
株式会社レイッティ,東京都文京区本郷３丁目２６番１３号,2016-09-01,株式会社
株式会社ロータスＨ・Ｂ,埼玉県ふじみ野市緑ケ丘１丁目４番１４号,2016-09-01,株式会社
株式会社ワイズブランチ,千葉県千葉市中央区弁天１丁目１５番１号,2016-09-01,株式会社
株式会社ヴァージニア,東京都港区西麻布２丁目２番２号,2016-09-01,株式会社
株式会社一兼,千葉県野田市柳沢３０９番地の３,2016-09-01,株式会社
株式会社一立建設,埼玉県久喜市吉羽６９３番地,2016-09-01,株式会社
株式会社三和の里リサイクルセンター,青森県弘前市大字大森字勝山７３０番地１,2016-09-01,株式会社
株式会社中の橋,東京都江東区大島７丁目１２番１号１Ｆ,2016-09-01,株式会社
株式会社中山畜産,熊本県阿蘇郡南阿蘇村大字一関２３０５番地１,2016-09-01,株式会社
株式会社丸和,神奈川県川崎市高津区二子３丁目３１番３号ＭＫ二子ビル４Ｆ,2016-09-01,株式会社
株式会社京ころも久住,京都府京都市下京区御供石町３５０－３,2016-09-01,株式会社
株式会社京都魚苑,京都府京都市南区久世上久世町７９１番地,2016-09-01,株式会社
株式会社住マイル工房,京都府京都市左京区上高野仲町１番地１,2016-09-01,株式会社
株式会社健美堂商事,茨城県稲敷市角崎１６７８番地１,2016-09-01,株式会社
株式会社優心,香川県三豊市三野町大見甲５８０８番地,2016-09-01,株式会社
株式会社先導社,石川県金沢市湊４丁目６３番地,2016-09-01,株式会社
株式会社北桜観光バス,北海道札幌市白石区菊水元町七条４丁目５番２８号,2016-09-01,株式会社
株式会社吉川建設,千葉県松戸市松戸１８７９番地の２－３０２号,2016-09-01,株式会社
株式会社堺りんかいアスコン,大阪府堺市西区築港新町１丁５番１７号,2016-09-01,株式会社
株式会社大空,群馬県伊勢崎市戸谷塚町４８番地１,2016-09-01,株式会社
株式会社姫路カメラ,兵庫県姫路市岡田６４０番地８,2016-09-01,株式会社
株式会社宙,東京都福生市大字福生６４１番地１メゾン・ド・カナール２０３号室,2016-09-01,株式会社
株式会社寿晴,鹿児島県鹿児島市田上７丁目９番２４号,2016-09-01,株式会社
株式会社山縣商店,千葉県市原市光風台５丁目３１６,2016-09-01,株式会社
株式会社山雄,愛知県名古屋市中区大須１丁目２３番地６３号,2016-09-01,株式会社
株式会社恵,長野県安曇野市豊科９４番地１,2016-09-01,株式会社
株式会社愛ウェルネス,愛媛県宇和島市丸穂町１丁目１番２７号,2016-09-01,株式会社
株式会社日本栄塗,福岡県古賀市青柳町１９８番地,2016-09-01,株式会社
株式会社望月写真院,愛知県豊橋市柱八番町４５番地,2016-09-01,株式会社
株式会社東商フードサービス,群馬県みどり市笠懸町阿左美１３３番地４,2016-09-01,株式会社
株式会社松井設備,大阪府富田林市錦織中１丁目３番１０号,2016-09-01,株式会社
株式会社松栄商事,東京都板橋区高島平１丁目３２番４号,2016-09-01,株式会社
株式会社森像,北海道上川郡美瑛町憩が丘６番１号,2016-09-01,株式会社
株式会社澪,東京都葛飾区鎌倉４丁目１８番２号,2016-09-01,株式会社
株式会社知秋,大阪府大阪市中央区内淡路町２丁目４番７号ＪＳ北浜ビル,2016-09-01,株式会社
株式会社神戸合材センター,兵庫県神戸市西区櫨谷町寺谷字徒弟谷７２３番地の１１,2016-09-01,株式会社
株式会社秋葉ビジネスコンサルタント,千葉県船橋市滝台町１０７番地４８－２０７,2016-09-01,株式会社
株式会社誓歯会,大阪府堺市西区浜寺石津町中２丁６番２８号,2016-09-01,株式会社
株式会社諏訪設備工業,愛知県名古屋市北区垣戸町１丁目２番地,2016-09-01,株式会社
株式会社追分産業,富山県射水市本開発４５２番地３,2016-09-01,株式会社
株式会社酒見農産,福岡県久留米市北野町八重亀８０６番地４,2016-09-01,株式会社
株式会社金原,愛知県豊橋市中浜町６９番地の１,2016-09-01,株式会社
株式会社風和璃,岩手県宮古市西ヶ丘３丁目１１番１－１０６号市営住宅,2016-09-01,株式会社
株式会社鳥トウ,愛知県あま市七宝町川部四反田８番地５,2016-09-01,株式会社
株式会社鶏光,茨城県行方市青沼７４１番地,2016-09-01,株式会社
株式会社黄石日本,東京都豊島区池袋２丁目４１番６号第一シャンボールビル４Ｆ,2016-09-01,株式会社
株式会社３Ｒ,広島県広島市西区西観音町１５番９号,2016-09-01,株式会社
株式会社ＢＣＪ－２６,東京都千代田区丸の内１丁目１番１号パレスビル５階,2016-09-01,株式会社
株式会社ＢＯＮＤＳ,静岡県静岡市駿河区池田５２８番地の２,2016-09-01,株式会社
株式会社Ｂｌａｉｒ,東京都中央区勝どき６丁目３番１号ＴＨＥ－ＴＯＫＹＯ－ＴＯＷＥＲＳ－ＳＥＡ－ＴＯＷＥＲ－１９２４号室,2016-09-01,株式会社
株式会社ＢｕｎｇｏＴｅｃｈ,大分県大分市末広町１丁目５番１６号ユナイテッド末広ビル３Ｆ,2016-09-01,株式会社
株式会社ＥＸＩＴＷＯＲＫＳ,千葉県船橋市三咲４丁目７番１８－２号,2016-09-01,株式会社
株式会社ＦＯＵＲ　ＳＩＤＥ,北海道札幌市中央区北一条東９丁目１３番２３号グランカーサ永山公園通ｅａｓｔ６０１号,2016-09-01,株式会社
株式会社Ｆｕｎ　Ｊａｐａｎ　Ｃｏｍｍｕｎｉｃａｔｉｏｎｓ,東京都品川区東品川２丁目３番１１号,2016-09-01,株式会社
株式会社Ｉ＆Ｍ,大阪府泉南郡熊取町大久保中４丁目１９番４号,2016-09-01,株式会社
株式会社Ｉ．Ｋ,埼玉県川口市西青木１丁目１１番２９－４０１号,2016-09-01,株式会社
株式会社ＩＫＥＧＡＩ＆Ｂｒｏｓ．,東京都渋谷区恵比寿１丁目１３番６号,2016-09-01,株式会社
株式会社ＫＴＫ　ＨＯＭＥ,広島県福山市芦田町大字福田９３９番地９,2016-09-01,株式会社
株式会社Ｌ,東京都港区芝３丁目１５番１３号ＹＯＤＡビル４Ｆ,2016-09-01,株式会社
株式会社ＬＩＦＥ　ｗｉｔｈ　ＣＨＡＬＫ,千葉県柏市若柴１７８番地４柏の葉キャンパス１４８街区２,2016-09-01,株式会社
株式会社ＭＡＲＵＮＡＫＡメタル,滋賀県愛知郡愛荘町長野２３８０番地１４,2016-09-01,株式会社
株式会社ＭＥＣ,香川県高松市上福岡町８５５番地,2016-09-01,株式会社
株式会社Ｍａｒｃｈ,大阪府大阪市北区天満４丁目１２番１５号,2016-09-01,株式会社
株式会社ＯＮＥ　ＳＩＤＥ,大阪府大阪市平野区加美西１丁目４番３６号,2016-09-01,株式会社
株式会社ＲＵＳＨ,東京都江東区亀戸５丁目３５番３号,2016-09-01,株式会社
株式会社Ｓケアデザイン研究所,兵庫県神戸市中央区磯辺通４丁目２番８号田嶋ビル８階,2016-09-01,株式会社
株式会社Ｓ・Ｉエムズ,東京都港区六本木６丁目８番２３号,2016-09-01,株式会社
株式会社Ｓｉｌｅｎｔ　Ｖｏｉｃｅ,大阪府大阪市西区南堀江４丁目２８番６号ル・グランデ南堀江ユニディアスコート６０１,2016-09-01,株式会社
