法人名,住所,設立日,法人種別
合同会社オーサムズ,茨城県つくば市池向１６７８番地５,2021-03-15,合同会社
合同会社ガラジュ,千葉県四街道市さちが丘２丁目１８番３号,2021-03-15,合同会社
合同会社キルシェ,岡山県岡山市南区箕島１２４３番地２,2021-03-15,合同会社
合同会社クラウドフードサービス,大阪府羽曳野市西浦１５３０－３,2021-03-15,合同会社
合同会社グッドラック,宮城県仙台市青葉区中山４丁目１７番２０－３０８号,2021-03-15,合同会社
合同会社ゴールドライン,神奈川県相模原市中央区千代田１丁目６番８号オアシス相模原５０１,2021-03-15,合同会社
合同会社シニアライフサービス,高知県高知市山ノ端町１６番地,2021-03-15,合同会社
合同会社タイズ,広島県広島市西区井口台３丁目３３番４１号,2021-03-15,合同会社
合同会社ティーファクトリー,東京都豊島区北大塚２丁目５－５アズーエスペランサ２０２号,2021-03-15,合同会社
合同会社トピカ農産,福島県南相馬市小高区耳谷字小泉２３,2021-03-15,合同会社
合同会社トリニティミシガン,東京都中央区日本橋１丁目４番１号,2021-03-15,合同会社
合同会社ニッサンカランカ,茨城県筑西市藤ケ谷１３５５番地マイシティライフ１０番館１０１号,2021-03-15,合同会社
合同会社ニュービレジ,東京都練馬区立野町１５番９号,2021-03-15,合同会社
合同会社ハピネス,福島県二本松市小浜字新町５０,2021-03-15,合同会社
合同会社ピースフル,東京都港区芝４丁目７番６号芝ビルディング７０４,2021-03-15,合同会社
合同会社フィオーレ,千葉県市川市市川１丁目３番８号東ビル５階,2021-03-15,合同会社
合同会社モノ・プラス一級建築士事務所,沖縄県那覇市牧志２丁目１６番４６号タカラマンションマキシー１・３０３,2021-03-15,合同会社
合同会社ランドブリッジ,東京都葛飾区四つ木３丁目４番３５号コンフォール四ツ木１０１号室,2021-03-15,合同会社
合同会社レオンズ,沖縄県沖縄市園田３丁目４番２０号２Ｆ,2021-03-15,合同会社
合同会社ワンダーフォーゲル,東京都新宿区西新宿７丁目５番５号Ｐｌａｚａ西新宿ＵＣＦ４階,2021-03-15,合同会社
合同会社ワーキングベアー,東京都中央区日本橋兜町１７番１号日本橋ロイヤルプラザ７０６,2021-03-15,合同会社
合同会社三裕ハウス,大阪府大阪市都島区友渕町１丁目５番３－１１０２号,2021-03-15,合同会社
合同会社二輝商事,千葉県船橋市上山町３丁目５１６番地４０,2021-03-15,合同会社
合同会社内造園土木,鹿児島県曽於市末吉町上町６丁目４番９号,2021-03-15,合同会社
合同会社愛,神奈川県横須賀市東浦賀１丁目１５番７号,2021-03-15,合同会社
合同会社東建美装,群馬県前橋市富士見町小暮５２８番地１ＦポラリスＢ,2021-03-15,合同会社
合同会社河田,静岡県浜松市東区植松町１６番地,2021-03-15,合同会社
合同会社泰山,千葉県松戸市下矢切１２５番地の１,2021-03-15,合同会社
合同会社瓦林総合研究室,兵庫県西宮市日野町３番６４号,2021-03-15,合同会社
合同会社社会政策課題研究所,岐阜県岐阜市宇佐３丁目１６番１１号,2021-03-15,合同会社
合同会社藤田,大阪府豊中市浜３丁目１９番１８号,2021-03-15,合同会社
合同会社野村昌史建築研究所,京都府京都市中京区壬生森町１６番地２,2021-03-15,合同会社
合同会社黒柄,兵庫県淡路市浦８６０番地２,2021-03-15,合同会社
合同会社ＡＭ３プロダクツ,愛知県名古屋市中区千代田３丁目１１番１４号プレサンスロジェ鶴舞駅前２０４号,2021-03-15,合同会社
合同会社ＡＭＩＧＯ,京都府京都市南区東九条宇賀辺町２－１－１１０１,2021-03-15,合同会社
合同会社Ｂｅａｔｓ,大阪府堺市北区百舌鳥陵南町２丁６８０番地,2021-03-15,合同会社
合同会社ＣＴＤ,茨城県龍ケ崎市長山７丁目１２番地１,2021-03-15,合同会社
合同会社ＥＸＩＴ,福岡県福岡市中央区薬院３丁目１２番４１－１１０３号ナビールコート薬院,2021-03-15,合同会社
合同会社Ｆｉｒｍｉｎｃ,鹿児島県指宿市東方１０９８３番地８,2021-03-15,合同会社
合同会社ＦｒｅｅＦｌｙ,神奈川県大和市中央３丁目３－２７レクシオ大和１０２,2021-03-15,合同会社
合同会社Ｇ・アルコー,大阪府大阪市東成区大今里南１丁目２２番１４－５０６号,2021-03-15,合同会社
合同会社ＧＯＪＯ　Ｌ＆Ｓ,東京都中央区京橋１丁目１－５セントラルビル２Ｆ,2021-03-15,合同会社
合同会社ＧＲＩＴ,広島県廿日市市宮内２０６０番地（３０２）,2021-03-15,合同会社
合同会社ＨＳＫ,北海道札幌市白石区菊水上町三条３丁目５２番地１１５,2021-03-15,合同会社
合同会社Ｈａｒｕｋａｚｅ　Ａｄｖｉｓｏｒｙ,千葉県千葉市中央区長洲１丁目１０番２４号,2021-03-15,合同会社
合同会社ＪＭ,埼玉県さいたま市大宮区三橋４丁目２７４番地アルファード２０３,2021-03-15,合同会社
合同会社ＪＯＹ,東京都江戸川区江戸川６丁目３番４号,2021-03-15,合同会社
合同会社ＬＩＮＫ,千葉県船橋市本中山４丁目３番３棟４０３号,2021-03-15,合同会社
合同会社Ｌｉｍ,千葉県柏市ひばりが丘１９番３－１０３号,2021-03-15,合同会社
合同会社Ｍ’ｓ,東京都台東区小島２丁目８番１５－４０２号小島町ハイツ４０２,2021-03-15,合同会社
合同会社Ｍ’ｓコーポレーション,静岡県沼津市下香貫矢丸１２００番地の２,2021-03-15,合同会社
合同会社ＭＡＳＨ,兵庫県神戸市西区月が丘２丁目６番地の４,2021-03-15,合同会社
合同会社ＭａｒｋｅＴｅｃｈ,東京都板橋区中丸町８番３号ＰＲＥＭＩＵＭＣＵＢＥ池袋要町１３０１,2021-03-15,合同会社
合同会社ＭｅＲＣｅｌａｔｉｏｎ,東京都港区白金３丁目１５－１５ライオンズマンショングリーン白金２０１,2021-03-15,合同会社
合同会社Ｍｉｚａ,沖縄県中頭郡北中城村字島袋１４７７番地コーポＭ１０２号室,2021-03-15,合同会社
合同会社Ｐ＆ＭＥ,東京都北区赤羽北１丁目１６番２－５０１号ハイネス赤羽,2021-03-15,合同会社
合同会社ＰＲＩ,東京都千代田区内神田２丁目２番６号５階あすな会計事務所内,2021-03-15,合同会社
合同会社Ｒｅｌｉｆｅ,東京都荒川区東尾久４丁目５１番１１号,2021-03-15,合同会社
合同会社ＳＫＳ,東京都大田区蒲田５丁目１６番５号,2021-03-15,合同会社
合同会社ＳＯＦＩ,埼玉県春日部市中央５丁目９番地３６,2021-03-15,合同会社
合同会社ＳＯＬ　ＦｒｅｅＳｔｙｌｅ,神奈川県座間市緑ケ丘５丁目１３番２３号,2021-03-15,合同会社
合同会社ＳＯＲＡ,大分県大分市大字八幡１０３５番地の１,2021-03-15,合同会社
合同会社Ｓｏｃｉａｌ　Ｉｎｎｏｖａｔｉｏｎ,三重県四日市市三栄町３番１７－８０２号プレサンスロジェ四日市中央通り,2021-03-15,合同会社
合同会社Ｓｕｎｆｌｏｗｅｒ,東京都新宿区四谷２丁目１１番龍文堂ビル３０２,2021-03-15,合同会社
合同会社Ｔ・Ｎ　ａｒｔｓ,岡山県岡山市中区国府市場５３２番地,2021-03-15,合同会社
合同会社ＴＡＫＥＹＡ,長崎県南松浦郡新上五島町三日ノ浦郷５５番地１５,2021-03-15,合同会社
合同会社Ｔａｄｐｏｌｅ,千葉県長生郡長南町佐坪１１３１ＫＩＺＵＮＡＨＯＭＥ２２０号,2021-03-15,合同会社
合同会社ＶＡＲＣＨＡＲ２,東京都港区新橋３丁目１６－１２第一横山ビル２階,2021-03-15,合同会社
合同会社Ｗｈｉｔｅ　Ｓｔａｒ　Ｌｉｎｅ,愛知県名古屋市守山区森孝１丁目８１９番地の３,2021-03-15,合同会社
合同会社ｉｎｂａａ,東京都中央区日本橋箱崎町１－２ＦｔＦビル２階,2021-03-15,合同会社
合同会社ｏｆｆｉｃｅ．ｈ,熊本県熊本市南区幸田２丁目９番１５号,2021-03-15,合同会社
合同会社ｓｔｒｕｇｇｌｅ　ａｎｄ　ｖａｌｕｅ,東京都港区港南２丁目１６番７－４１８号,2021-03-15,合同会社
合同会社ｖｉｓｉｏｎａｒｙ　ｍｅ,山口県柳井市南町３丁目６番１２号,2021-03-15,合同会社
合志サービス合同会社,熊本県合志市幾久富１８６６番地１６２５,2021-03-15,合同会社
大同建設株式会社,群馬県伊勢崎市東本町９６番地２１,2021-03-15,株式会社
大坪屋株式会社,大阪府大阪市中央区東心斎橋１丁目１４番２１号川村ビル２階ＡＣ号室,2021-03-15,株式会社
大東情報株式会社,東京都港区芝３丁目１５番１３号芝宮地ビル３階３０１号室,2021-03-15,株式会社
大輝工業株式会社,鳥取県鳥取市徳尾１０２番地９,2021-03-15,株式会社
太晴輝エネルギー合同会社,大分県大分市大字三芳９８６番地の１６,2021-03-15,合同会社
太田市鳥之郷小第２放課後児童クラブ,群馬県太田市鶴生田町８３番地２,2021-03-15,その他
学校法人星槎こども園ＫＩＤＳ　ｐｌａｎｅｔ,神奈川県横浜市青葉区榎が丘５番１,2021-03-15,その他の設立登記法人
宮地畜産株式会社,東京都豊島区千早２丁目３８番１６号,2021-03-15,株式会社
富士悠合同会社,東京都西東京市富士町２丁目１２番２１号,2021-03-15,合同会社
小林株式会社,大阪府大阪市北区紅梅町３－２４吉田マンション２０１号室,2021-03-15,株式会社
弁護士法人ＳＢＰＪ法律事務所,大阪府大阪市阿倍野区西田辺町１丁目１９番２０号,2021-03-15,その他の設立登記法人
心斎橋エステート株式会社,大阪府大阪市中央区西心斎橋２丁目１２番２２号,2021-03-15,株式会社
恒程合同会社,東京都中央区勝どき５丁目１２番４－１２０３号,2021-03-15,合同会社
悠ＳＨＯＰ株式会社,福岡県筑紫野市原田４丁目２番地１０,2021-03-15,株式会社
日中商事株式会社,静岡県浜松市中区寺島町８５３番地の１０一条レジデンス７０１,2021-03-15,株式会社
日和現代株式会社,神奈川県横浜市中区山下町７４－１大和地所ビル,2021-03-15,株式会社
日本イエス・キリスト教団防府新田教会,山口県防府市大字新田１１０８番地の３,2021-03-15,その他の設立登記法人
日本カード株買取目的株式会社,大阪府大阪市都島区片町２丁目２番４０号大発ビルディング８階,2021-03-15,株式会社
日本愛希麗合同会社,東京都渋谷区本町６丁目４１－３－２０１,2021-03-15,合同会社
日本電気工事株式会社,大阪府大阪市生野区中川西１丁目１６番４号,2021-03-15,株式会社
旭輝商事合同会社,東京都板橋区坂下１丁目３５－８－Ａ号,2021-03-15,合同会社
昌霖株式会社,大阪府大阪市中央区島之内２丁目４番１６号ケイアンドティ道頓堀５０７号,2021-03-15,株式会社
有限会社黒住商店,東京都葛飾区青戸５丁目３０番７号,2021-03-15,有限会社
木子国際株式会社,東京都豊島区千早２丁目１１番７号,2021-03-15,株式会社
杜工房株式会社,大分県国東市国東町鶴川４番地１,2021-03-15,株式会社
東宏ホールディングス株式会社,愛知県稲沢市高重町屋敷４３番地,2021-03-15,株式会社
東雲プロパティー特定目的会社,東京都千代田区丸の内１丁目１１番１号,2021-03-15,その他の設立登記法人
松佐製薬株式会社,東京都港区新橋６丁目１２番７号,2021-03-15,株式会社
株式会社あけび,茨城県つくばみらい市狸穴１３５７番地２,2021-03-15,株式会社
株式会社あすてる愛,静岡県磐田市福田中島１２３６番地,2021-03-15,株式会社
株式会社いとおさんち,新潟県西蒲原郡弥彦村美山６５０９番地１,2021-03-15,株式会社
株式会社おたから島,神奈川県横浜市南区通町１丁目６番地１田ビルⅡ１０１号室,2021-03-15,株式会社
株式会社がなしよサポート,鹿児島県鹿児島市西伊敷７丁目１６－１４,2021-03-15,株式会社
株式会社さく,秋田県秋田市千秋中島町５番２１号,2021-03-15,株式会社
株式会社はなぶさ,千葉県白井市名内５８１番地,2021-03-15,株式会社
株式会社ひろしま安芸相続手続支援センター,広島県安芸郡府中町茂陰２丁目５番３４－１０２号,2021-03-15,株式会社
株式会社ほんや,東京都武蔵野市西久保２丁目２７番１６号,2021-03-15,株式会社
株式会社やまだいふぁーむ,静岡県沼津市西浦木負２５７番地,2021-03-15,株式会社
株式会社ゆめかわ,大阪府東大阪市花園東町２丁目３－１６フォーレスト１－３０５号室,2021-03-15,株式会社
株式会社らしく,東京都千代田区外神田２丁目１９番１５号,2021-03-15,株式会社
株式会社わんさか,沖縄県名護市字大浦４６５番地７,2021-03-15,株式会社
株式会社アイオー,神奈川県横浜市泉区緑園３丁目２９番地１３,2021-03-15,株式会社
株式会社アイコミニケーション,東京都港区芝浦４丁目２２番１－２９０９号,2021-03-15,株式会社
株式会社アクシア,鹿児島県いちき串木野市長崎町１０１番地,2021-03-15,株式会社
株式会社アクシアプランニング,広島県広島市東区牛田旭１丁目９番６２号,2021-03-15,株式会社
株式会社アズソル,東京都渋谷区代々木２丁目２３番１号,2021-03-15,株式会社
株式会社アローズ,福岡県福岡市中央区地行浜２丁目２番４－２０１１号,2021-03-15,株式会社
株式会社イナサの風,宮城県仙台市青葉区中江１丁目１４番１号,2021-03-15,株式会社
株式会社インクアバル,大阪府大阪市西区江戸堀２丁目１番１号,2021-03-15,株式会社
株式会社インタープラン,東京都文京区湯島４丁目５番４号クラマタ産業ビル３０２,2021-03-15,株式会社
株式会社ウェイヴ,高知県高知市追手筋１丁目９番１５号山下ビル１Ｆ,2021-03-15,株式会社
株式会社エキスパートデザイン,沖縄県浦添市屋富祖２丁目１６番１７号,2021-03-15,株式会社
株式会社エムエスイー,東京都中央区銀座３丁目１４番１３号第一厚生館ビル５階,2021-03-15,株式会社
株式会社エムシー,埼玉県所沢市大字下安松６０９番地の７トコロハイム１０１,2021-03-15,株式会社
株式会社エルアンドエル,東京都港区東新橋２丁目１０番２号,2021-03-15,株式会社
株式会社エンタ,神奈川県川崎市麻生区多摩美１丁目１８番５号,2021-03-15,株式会社
株式会社オフィスタカハシ,岩手県紫波郡紫波町二日町字北七久保１９３番地１,2021-03-15,株式会社
株式会社オルベック,東京都板橋区蓮沼町３４番１１号,2021-03-15,株式会社
株式会社オーシャン総合企画,大阪府門真市四宮６丁目６番４８号,2021-03-15,株式会社
株式会社カプリス,東京都渋谷区恵比寿南２丁目３－１５－３Ｆ,2021-03-15,株式会社
株式会社カメレオン,東京都台東区上野２丁目５番３号ＳＮビル４階,2021-03-15,株式会社
株式会社キャロット,大阪府大阪市中央区松屋町３番１５－５０５号,2021-03-15,株式会社
株式会社キーププロフィット・コンサルテイングＧ,佐賀県三養基郡みやき町大字中津隈９７０番地２,2021-03-15,株式会社
株式会社クリーンナップ,栃木県宇都宮市陽東８丁目１６番２０号,2021-03-15,株式会社
株式会社クレア,北海道旭川市豊岡九条７丁目８番１１号,2021-03-15,株式会社
株式会社グローバルマーケッツ,東京都渋谷区円山町５番５号,2021-03-15,株式会社
株式会社コウサク,東京都港区浜松町２丁目２番１５号浜松町ダイヤビル２Ｆ,2021-03-15,株式会社
株式会社ゴールデイズ,神奈川県横浜市金沢区西柴３丁目３８番４号,2021-03-15,株式会社
株式会社サカエデザイン,神奈川県川崎市宮前区菅生４丁目１６番２７号,2021-03-15,株式会社
株式会社シーズン,大阪府阪南市尾崎町５０８番地３,2021-03-15,株式会社
株式会社シーブレス,長崎県佐世保市日宇町２８９３番地８,2021-03-15,株式会社
株式会社ジェネシス,岩手県盛岡市向中野４丁目９番２１号,2021-03-15,株式会社
株式会社ストライビング,大阪府岸和田市内畑町２１１５番地,2021-03-15,株式会社
株式会社ストル,東京都渋谷区神宮前６丁目２３－４桑野ビル２階,2021-03-15,株式会社
株式会社スロウ,北海道札幌市中央区大通西２丁目５番７号陶管ビル６階,2021-03-15,株式会社
株式会社セイコウホールディングス,茨城県那珂市向山１２６９番地の２,2021-03-15,株式会社
株式会社セルメディリア,愛知県春日井市勝川町５丁目１０５番地,2021-03-15,株式会社
株式会社セレソン,東京都江戸川区船堀３丁目１６－５プラウドシティ船堀６０９,2021-03-15,株式会社
株式会社ソアイルノーブル,東京都渋谷区神宮前６丁目２３番４号桑野ビル２階,2021-03-15,株式会社
株式会社ソアー,高知県高知市杉井流１６番５号－２階,2021-03-15,株式会社
株式会社タイシス,東京都千代田区東神田２丁目６番９号,2021-03-15,株式会社
株式会社タカ防災設備,大阪府守口市日光町３番６号－１０１,2021-03-15,株式会社
株式会社タツノコファースト,東京都港区西新橋３丁目２番１号Ｄａｉｗａ西新橋ビル２階,2021-03-15,株式会社
株式会社ダイデン群馬,群馬県佐波郡玉村町大字樋越２６０番地４,2021-03-15,株式会社
株式会社ツインカプセラ,茨城県つくば市千現２丁目１番６,2021-03-15,株式会社
株式会社ツナマーケット,群馬県高崎市飯玉町５０番地パナシア５０１,2021-03-15,株式会社
株式会社トミヨシ,奈良県橿原市西池尻町１６９番地の１,2021-03-15,株式会社
株式会社ニューウェル城南,東京都大田区中央１丁目１７番１号,2021-03-15,株式会社
株式会社ネオプレイヤーワン,東京都中野区中央５丁目２４番９号Ｅｓｔｕｄｉｏ６０２号室,2021-03-15,株式会社
株式会社ハアトエ,神奈川県鎌倉市由比ガ浜１丁目３番５－１号,2021-03-15,株式会社
株式会社ハートメディカル,神奈川県相模原市中央区淵野辺２丁目１５番地２５号,2021-03-15,株式会社
株式会社ハートｂｅａｔ,千葉県市原市五井５３７３番地１－４０９,2021-03-15,株式会社
株式会社ビギンプラス,京都府京都市中京区御池通東洞院東入笹屋町４３６永和御池ビル６０６号,2021-03-15,株式会社
株式会社ビジョナリーワークス,岐阜県岐阜市西川手９丁目１２６番地２,2021-03-15,株式会社
株式会社ビジョン,福井県あわら市二面３４－５９番地,2021-03-15,株式会社
株式会社ビルダーズラボ,佐賀県小城市小城町６０８番地５,2021-03-15,株式会社
株式会社プラネット,愛知県半田市旭町２丁目２１番地,2021-03-15,株式会社
株式会社プリエル,山口県山口市吉田２９８２－１４,2021-03-15,株式会社
株式会社プロフィット　マネジメント　インテグレーション,茨城県土浦市田中３丁目１番１４－７０３号,2021-03-15,株式会社
株式会社ヘアーエス,長野県佐久市中込３５６８番地４５,2021-03-15,株式会社
株式会社ヘルスアセスメントメディカルセンター,東京都中央区日本橋人形町１丁目１２番１１－１７０６号,2021-03-15,株式会社
株式会社ペガサス,東京都豊島区南大塚２丁目１１番１０号ミモザビル３階,2021-03-15,株式会社
株式会社ホンマニア,東京都荒川区西日暮里６丁目６４番１,2021-03-15,株式会社
株式会社ボトル・プラネット,大阪府大阪市北区豊崎６丁目１２番１８号,2021-03-15,株式会社
株式会社ボヌール,兵庫県神戸市中央区浜辺通４丁目１番２３号三宮ベンチャービル６０２号室,2021-03-15,株式会社
株式会社ポポ,東京都台東区上野４丁目７番５号,2021-03-15,株式会社
株式会社マサナカ,千葉県浦安市当代島２丁目１６番２０－２０５号ライオンズマンション浦安シティ,2021-03-15,株式会社
株式会社マンスフィールド,香川県三豊市高瀬町羽方１２６２番地１,2021-03-15,株式会社
株式会社マーブル,香川県高松市多肥下町１５５４番地４,2021-03-15,株式会社
株式会社モンテズ,大阪府東大阪市小阪１丁目１０番３５,2021-03-15,株式会社
株式会社ユーサポート,東京都中央区東日本橋２丁目１６番１１号,2021-03-15,株式会社
株式会社ライトテック,大阪府大阪市阿倍野区阿倍野筋３丁目１０番１号,2021-03-15,株式会社
株式会社ライトプラス,東京都足立区保塚町５番５号,2021-03-15,株式会社
株式会社ライフタイムズ,大阪府大阪市中央区西心斎橋２丁目８－１０,2021-03-15,株式会社
株式会社ラフレア,大阪府寝屋川市対馬江東町５番３号,2021-03-15,株式会社
株式会社リアン,大阪府大阪市中央区内本町１丁目２番１４号秀和ビル１０階,2021-03-15,株式会社
株式会社リキッドメタルジャパン,千葉県船橋市金杉７丁目１番９号,2021-03-15,株式会社
株式会社ルカウ,東京都中野区中野３丁目３６番４号,2021-03-15,株式会社
株式会社ループ,愛知県名古屋市緑区浦里１丁目１６７番地２,2021-03-15,株式会社
株式会社ロックオン,東京都港区芝５丁目１６－１４,2021-03-15,株式会社
株式会社ワイズ・マーケティング,東京都台東区浅草橋３丁目２０番１８号,2021-03-15,株式会社
株式会社ワンアップブレース,東京都三鷹市大沢６丁目７番１８号,2021-03-15,株式会社
株式会社ワンダーボーイ,東京都品川区大崎３丁目６－２１,2021-03-15,株式会社
株式会社一文字堂,群馬県渋川市半田７２５番地１Ｃ１０２,2021-03-15,株式会社
株式会社七星プランニング,大阪府八尾市沼１丁目６８番地の６５朝日プラザシティ八尾南２番館９０４号,2021-03-15,株式会社
株式会社三忠,大分県大分市上野丘１丁目４番３７号,2021-03-15,株式会社
株式会社丸三,東京都千代田区外神田１丁目８番１４号,2021-03-15,株式会社
株式会社但馬産地直送センター,兵庫県養父市十二所２６８番地３,2021-03-15,株式会社
株式会社佐々木牧場,北海道厚岸郡厚岸町片無去８６０番地１,2021-03-15,株式会社
株式会社佐藤重量,兵庫県神戸市灘区都通２丁目１番２６号摩耶コート壱番館９０８号,2021-03-15,株式会社
株式会社余川建設,福島県伊達市中道４９番地１１,2021-03-15,株式会社
株式会社前田板金,大阪府八尾市山本町南１丁目２番２９－１１０３号,2021-03-15,株式会社
株式会社双心,滋賀県甲賀市水口町城内８番１号,2021-03-15,株式会社
株式会社古賀志山麓会ホールディング,栃木県宇都宮市古賀志町３６４番地,2021-03-15,株式会社
株式会社和田産業,兵庫県姫路市花田町高木４３番地１,2021-03-15,株式会社
株式会社和集,京都府京都市右京区常盤北裏町７番地３８,2021-03-15,株式会社
株式会社喜久一,京都府京都市右京区西院東今田町３４,2021-03-15,株式会社
株式会社堀文,千葉県流山市おおたかの森東１丁目９－１－１５１３,2021-03-15,株式会社
株式会社大和,東京都中央区日本橋人形町１丁目１２番１１号,2021-03-15,株式会社
株式会社大手町フィナンシャル,東京都千代田区大手町２丁目２番１号,2021-03-15,株式会社
株式会社天知,山梨県甲府市北口１丁目２番１９号デュオヒルズ甲府北口１５０２室,2021-03-15,株式会社
株式会社奥野,東京都千代田区九段南１丁目５番６号りそな九段ビル５階ＫＳフロア,2021-03-15,株式会社
株式会社市川裕美事務所,神奈川県鎌倉市二階堂３８番地２ザ・パークハウス鎌倉二階堂４０７,2021-03-15,株式会社
株式会社徒然舎,岐阜県岐阜市美殿町４０番地矢澤ビル１階,2021-03-15,株式会社
