法人名,住所,設立日,法人種別
株式会社大原農園,沖縄県南城市佐敷字佐敷７６１番地１,2017-01-11,株式会社
株式会社大森建築,宮城県石巻市桃生町倉埣字人家１番地,2017-01-11,株式会社
株式会社大槻,福島県伊達市霊山町石田字彦平２３番地,2017-01-11,株式会社
株式会社大英興業,神奈川県海老名市東柏ケ谷４丁目６番７９号,2017-01-11,株式会社
株式会社天寿,千葉県柏市豊住３丁目１番３６号,2017-01-11,株式会社
株式会社天水工,福岡県福岡市博多区竹丘町２丁目４番７号,2017-01-11,株式会社
株式会社天空丸,神奈川県平塚市田村８丁目９番３３号,2017-01-11,株式会社
株式会社奈良興業,東京都足立区梅田１丁目３０番１６号,2017-01-11,株式会社
株式会社奥山設備,山形県天童市大字上荻野戸７８１番地,2017-01-11,株式会社
株式会社奥村機械,北海道紋別市渚滑町９丁目５番地の１,2017-01-11,株式会社
株式会社女神の森イベントリンクス,山梨県北杜市小淵沢町２９６１番地,2017-01-11,株式会社
株式会社孝新興業,神奈川県横浜市緑区鴨居３丁目２３番１１－２号,2017-01-11,株式会社
株式会社学びＵＰコミュニケーションズ,東京都千代田区一ツ橋１丁目１番１号,2017-01-11,株式会社
株式会社学映,佐賀県佐賀市鍋島町大字森田９０２番地,2017-01-11,株式会社
株式会社安藤工業,滋賀県守山市水保町１３９９番地２７,2017-01-11,株式会社
株式会社寺田,大阪府大阪市天王寺区玉造元町２番３５号玉造末広ビル２階,2017-01-11,株式会社
株式会社寿浅商,群馬県高崎市金古町１８７１番地２,2017-01-11,株式会社
株式会社小川建築,三重県四日市市西坂部町４５１番地２,2017-01-11,株式会社
株式会社山国建設,大阪府八尾市中田３丁目３８番地の８,2017-01-11,株式会社
株式会社山崎屋,神奈川県横浜市保土ケ谷区帷子町１丁目２２番地,2017-01-11,株式会社
株式会社山木屋電興社,東京都葛飾区東立石４丁目３３番２号,2017-01-11,株式会社
株式会社山本新聞店,山梨県上野原市八ツ沢４６３番地,2017-01-11,株式会社
株式会社島村,熊本県熊本市南区城南町塚原８８６番地,2017-01-11,株式会社
株式会社嵜本工務店,長崎県平戸市田平町岳崎免７２４番地５,2017-01-11,株式会社
株式会社川下工業,東京都中野区鷺宮３丁目１５番１２号４階,2017-01-11,株式会社
株式会社川口工業,愛知県海部郡大治町大字西條字高場１４番地の２,2017-01-11,株式会社
株式会社平和クリーニング商会,富山県富山市下野新３５３２番地６,2017-01-11,株式会社
株式会社庄原松栄ファーム,広島県庄原市西本町１丁目４番１５号２Ｆ,2017-01-11,株式会社
株式会社後藤武建築設計事務所,神奈川県横浜市中区吉田町１０番地都南ビル５Ｆ,2017-01-11,株式会社
株式会社心,静岡県富士市伝法２番地の２１,2017-01-11,株式会社
株式会社心身堂グループ,大阪府泉大津市東豊中町１丁目４番１０号,2017-01-11,株式会社
株式会社志賀サンプル,大阪府大阪市平野区瓜破東５丁目１番１８号,2017-01-11,株式会社
株式会社快成建設,東京都足立区栗原２丁目２２番８号,2017-01-11,株式会社
株式会社恒工務店,岐阜県各務原市川島河田町１丁目４３番地,2017-01-11,株式会社
株式会社成上,福島県いわき市鹿島町船戸字五反田１０番地の２,2017-01-11,株式会社
株式会社成清牧場,北海道河東郡鹿追町北鹿追北８線４番地５１,2017-01-11,株式会社
株式会社教育サポート,大阪府大東市西楠の里町１０番２２号,2017-01-11,株式会社
株式会社新誠工業,神奈川県藤沢市葛原５９９番地の１,2017-01-11,株式会社
株式会社日本ニューエアー,京都府京都市中京区西ノ京月輪町２４番地１エスリード西小路御池５０６,2017-01-11,株式会社
株式会社日本投資家育成機構,東京都千代田区神田神保町１丁目５番１号,2017-01-11,株式会社
株式会社日研製作所,大阪府東大阪市高井田西２丁目３番１３号,2017-01-11,株式会社
株式会社日諸ファーム,北海道樺戸郡浦臼町字ヲソキナイ２番地の２０,2017-01-11,株式会社
株式会社曻,鹿児島県霧島市隼人町真孝１０９８番地,2017-01-11,株式会社
株式会社服部建業,新潟県上越市高土町３丁目６番２７号,2017-01-11,株式会社
株式会社木曽商事,愛知県稲沢市祖父江町祖父江南方１３４番地,2017-01-11,株式会社
株式会社杉牧場,鹿児島県西之表市伊関２３６番地８,2017-01-11,株式会社
株式会社村木工業,北海道苫小牧市ときわ町３丁目５番２号,2017-01-11,株式会社
株式会社村田工作社,神奈川県横浜市港北区新吉田町５１１番地,2017-01-11,株式会社
株式会社来夢,北海道札幌市白石区本通１２丁目北１番１５号,2017-01-11,株式会社
株式会社東宝国際,大阪府大阪市中央区内本町２丁目１番１９号内本町松屋ビル１０,2017-01-11,株式会社
株式会社東浜,鳥取県岩美郡岩美町大字陸上３４番地,2017-01-11,株式会社
株式会社東海テクニカルサービス,愛知県一宮市小信中島字南平口７７番地５,2017-01-11,株式会社
株式会社松本工業,神奈川県横浜市港北区新吉田町３９番地,2017-01-11,株式会社
株式会社林翔,大阪府大阪市中央区常盤町１丁目１番８号,2017-01-11,株式会社
株式会社柴田組,三重県四日市市伊倉３丁目６番２４号センチュリーハイツ２１・Ｂ３,2017-01-11,株式会社
株式会社栄登,福岡県北九州市八幡西区割子川２丁目７番１号,2017-01-11,株式会社
株式会社桐生エネルギー,群馬県太田市高林東町２３０３番地２,2017-01-11,株式会社
株式会社桜井石材,愛知県一宮市高田字中坪８５番地１,2017-01-11,株式会社
株式会社植田,大阪府柏原市平野２丁目１１番２３号,2017-01-11,株式会社
株式会社楓,千葉県市原市能満１４０９番地１,2017-01-11,株式会社
株式会社横林自動車,鹿児島県西之表市西之表１５２２０番地,2017-01-11,株式会社
株式会社橙,滋賀県米原市下多良８３番地１４,2017-01-11,株式会社
株式会社永村バッテリー,熊本県菊池郡大津町美咲野３丁目３３番６,2017-01-11,株式会社
株式会社沖愛工業,愛知県岩倉市稲荷町羽根１６番地１,2017-01-11,株式会社
株式会社深川未来ファーム,北海道深川市一已町字一已７３５４番地,2017-01-11,株式会社
株式会社清水農場,北海道名寄市字曙８５８番地４,2017-01-11,株式会社
株式会社渡辺空調設備,愛知県一宮市起字西茜屋５２番地２,2017-01-11,株式会社
株式会社渡邊建設,広島県広島市中区舟入本町２番８－６０３号,2017-01-11,株式会社
株式会社渡部新聞店,福島県喜多方市関柴町上高額字宮越５３７番地３,2017-01-11,株式会社
株式会社瀧野設備,東京都小平市学園西町２丁目１９番１５号,2017-01-11,株式会社
株式会社片岡林業,高知県吾川郡仁淀川町上名野川２９０番地,2017-01-11,株式会社
株式会社猪股牧場,宮城県加美郡加美町米泉字中野１２３番地,2017-01-11,株式会社
株式会社王匠,京都府亀岡市塩屋町１４番地,2017-01-11,株式会社
株式会社琉通工テクニカルサポート,沖縄県名護市字屋部２９１番地２,2017-01-11,株式会社
株式会社瑞幸窯,長崎県東彼杵郡波佐見町村木郷１３０番地２,2017-01-11,株式会社
株式会社生活文化研究所,神奈川県横浜市保土ケ谷区東川島町９番地の１－６０２号,2017-01-11,株式会社
株式会社田中商事,山形県尾花沢市大字延沢３１７４番地,2017-01-11,株式会社
株式会社田中農園,北海道沙流郡日高町字正和２３７番地４,2017-01-11,株式会社
株式会社田中青果,神奈川県横浜市港北区大曽根２丁目２４番３１－１３号,2017-01-11,株式会社
株式会社田口建築設備設計,山梨県甲府市山宮町２７００番地２５,2017-01-11,株式会社
株式会社田浦牧場,熊本県葦北郡芦北町大字古石８５１番地２３,2017-01-11,株式会社
株式会社町原商会,神奈川県川崎市中原区中丸子６０７番地,2017-01-11,株式会社
株式会社目組,東京都板橋区幸町３５番１号,2017-01-11,株式会社
株式会社真輝建設,京都府亀岡市下矢田町２丁目５番１号,2017-01-11,株式会社
株式会社真鍋商店,愛媛県四国中央市上分町７４９番地１２,2017-01-11,株式会社
株式会社矢野材木店,大阪府富田林市若松町５丁目１番２号,2017-01-11,株式会社
株式会社石﨑タイル,大阪府河内長野市木戸西町３丁目１４番３３号,2017-01-11,株式会社
株式会社福井プレス,大阪府東大阪市東石切町５丁目６番２８号,2017-01-11,株式会社
株式会社秀虎,宮城県石巻市湊字立石１５３番地３,2017-01-11,株式会社
株式会社稲森工務店,宮崎県宮崎市祇園２丁目２２番地３,2017-01-11,株式会社
株式会社竹元工業,福岡県北九州市戸畑区千防１丁目１３番１０－２０１号,2017-01-11,株式会社
株式会社竹内養鶏場,北海道河東郡音更町字下音更北４線西１７番地,2017-01-11,株式会社
株式会社竹村写真事務所,大阪府大阪市北区東天満１丁目５番２号信保ビル３０２号,2017-01-11,株式会社
株式会社第一商産,東京都新宿区西早稲田３丁目１２番４－４０１号,2017-01-11,株式会社
株式会社細野塗装店,神奈川県相模原市南区下溝１７０１番地１,2017-01-11,株式会社
株式会社細野建工,東京都町田市金森東２丁目９番２１号,2017-01-11,株式会社
株式会社綜合ギフト・メッセ,福井県福井市長本町５１０番地,2017-01-11,株式会社
株式会社美美,神奈川県横浜市港南区日野南５丁目３番５号,2017-01-11,株式会社
株式会社美選,神奈川県相模原市南区相模大野７丁目３５番１－３０７号,2017-01-11,株式会社
株式会社肉肉ＴＡＩＺＯ,新潟県新潟市江南区早通２丁目７番２７号,2017-01-11,株式会社
株式会社能勢,茨城県筑西市岡芹８６４番地４,2017-01-11,株式会社
株式会社舜聖工業,福岡県北九州市若松区中川町１番２７号,2017-01-11,株式会社
株式会社菅原内装,宮城県仙台市青葉区南吉成３丁目１６番地２０,2017-01-11,株式会社
株式会社萩情報システムセンター,山口県萩市大字江向２番地３,2017-01-11,株式会社
株式会社藤和架設,福島県相馬市尾浜字細田３５４番地,2017-01-11,株式会社
株式会社西機工,大阪府大阪市北区池田町１番３６号,2017-01-11,株式会社
株式会社西田,神奈川県厚木市中町３丁目１３番７号,2017-01-11,株式会社
株式会社西田ホールディングス,神奈川県厚木市中町３丁目１３番７号,2017-01-11,株式会社
株式会社謙防,神奈川県海老名市東柏ケ谷２丁目１６番１２号,2017-01-11,株式会社
株式会社豊嶋電工,大阪府大阪市阿倍野区帝塚山１丁目１７番５号１０１号,2017-01-11,株式会社
株式会社豊田組,三重県亀山市野村３丁目１８番６号,2017-01-11,株式会社
株式会社赤義興業,宮城県仙台市宮城野区福室２丁目８番２５－４１２号,2017-01-11,株式会社
株式会社轍,東京都世田谷区砧７丁目１０番１０号ヴィラ・タカクラ１０３,2017-01-11,株式会社
株式会社辻橋箔押・仏壇店,滋賀県彦根市城町１丁目７番２１号,2017-01-11,株式会社
株式会社金田商事,東京都葛飾区東四つ木３丁目６番１号,2017-01-11,株式会社
株式会社鈴晃,福岡県田川郡糸田町７４９番地１,2017-01-11,株式会社
株式会社鈴木機工,愛知県あま市花正金岩越５５番地,2017-01-11,株式会社
株式会社関東エネルギー,群馬県太田市高林東町１７２２番地,2017-01-11,株式会社
株式会社隈部組,大阪府大阪市城東区鴫野三丁目１８番２２号,2017-01-11,株式会社
株式会社雄進,北海道札幌市豊平区月寒東一条１５丁目８番２５－８０３号,2017-01-11,株式会社
株式会社電気工事高電,愛媛県新居浜市宇高町１丁目１３番５４号,2017-01-11,株式会社
株式会社電通テック,東京都千代田区内幸町１丁目５番３号,2017-01-11,株式会社
株式会社青木工業,福岡県福岡市早良区南庄１丁目１０番１号,2017-01-11,株式会社
株式会社高岡塗装,熊本県上益城郡山都町入佐３０９６番地,2017-01-11,株式会社
株式会社高橋外装,群馬県富岡市七日市１２３３番地８,2017-01-11,株式会社
株式会社高畑経営コンサルティング,東京都葛飾区お花茶屋３丁目１番１７号,2017-01-11,株式会社
株式会社高石縫工所,大阪府東大阪市太平寺２丁目３番１８号,2017-01-11,株式会社
株式会社高砂屋リンク,東京都八王子市みつい台１丁目１９番９号,2017-01-11,株式会社
株式会社高野建設,北海道登別市富岸町９４番地３,2017-01-11,株式会社
株式会社３Ｆｉｌｍｓ琉球,沖縄県那覇市久茂地２丁目１５番８号,2017-01-11,株式会社
株式会社Ａ．Ｏ．Ｉ,大分県大分市花津留１丁目１番３号,2017-01-11,株式会社
株式会社ＡＡＬ研究所,神奈川県川崎市麻生区虹ケ丘１丁目２０番１０号,2017-01-11,株式会社
株式会社ＡＢＥ　Ｆｒｕｉｔ,福島県福島市荒井字上笊森３０番地,2017-01-11,株式会社
株式会社ＡＣＯＲＥ,兵庫県神戸市中央区二宮町４丁目２２番１１号,2017-01-11,株式会社
株式会社ＡＹＡ,東京都江戸川区船堀７丁目５番５号,2017-01-11,株式会社
株式会社Ａｆｆｅｔｔｏ,東京都武蔵野市中町１丁目２５番１０号,2017-01-11,株式会社
株式会社Ａｒｃ,北海道札幌市中央区大通西２丁目地下鉄東西線大通駅コンコース地下２階,2017-01-11,株式会社
株式会社Ａｓｐａｃｅ,北海道札幌市豊平区福住一条２丁目５番１－１０８号,2017-01-11,株式会社
株式会社Ａｖａｍ,東京都渋谷区桜丘町２３番１７号,2017-01-11,株式会社
株式会社ＢＥＥＧＬＥ,東京都港区港南２丁目１６番７－１８０５号,2017-01-11,株式会社
株式会社ＢＥＳＴ　ＧＲＩＬＬ,千葉県千葉市中央区東千葉１丁目９番１７号サン・グロリア１０２号,2017-01-11,株式会社
株式会社ＢＧパートナーズ,東京都世田谷区桜新町１丁目３４番２５号,2017-01-11,株式会社
株式会社ＢＯＯＢＯＯファクトリー,秋田県秋田市御所野元町４丁目４番３０号,2017-01-11,株式会社
株式会社Ｂｉｓ,東京都足立区東綾瀬１丁目１０番１－４０２号,2017-01-11,株式会社
株式会社Ｂｕｄｄｉｅｓ,神奈川県横浜市中区新港２丁目３－３Ａｕｄｉみなとみらい１Ｆ,2017-01-11,株式会社
株式会社ＣＨＯＴＥＴＳＵ,東京都港区麻布十番３丁目２番１２－５０２号,2017-01-11,株式会社
株式会社Ｃａｎｖａｓ,滋賀県高島市安曇川町西万木７８４番地２,2017-01-11,株式会社
株式会社Ｃｈｅｒｉ,大阪府大阪市西区新町１丁目２３番７号,2017-01-11,株式会社
株式会社Ｃｏｎｄｕｃｔｏｒ,大阪府大阪市福島区福島３丁目１番３９号メリヤス会館４１５号室,2017-01-11,株式会社
株式会社ＤＡＮ,東京都三鷹市上連雀１丁目１１番５１号,2017-01-11,株式会社
株式会社ＤＭＣ天童温泉,山形県天童市鎌田１丁目３番３８号,2017-01-11,株式会社
株式会社ＥＨ,大阪府大阪市淀川区東三国３丁目１番２１号１階,2017-01-11,株式会社
株式会社ＥＩＮＢＡＮＤ,滋賀県東近江市佐野町４４７番地３３,2017-01-11,株式会社
株式会社ＥＮＪＯＹ　ＤＥＳＩＧＮ　ＷＯＲＫＳ,福岡県久留米市通町１０５番地２６,2017-01-11,株式会社
株式会社ＥＳＣ,広島県尾道市瀬戸田町福田８２３番地３,2017-01-11,株式会社
株式会社ＥＶＥＲＥＳＴ,栃木県大田原市浅香２丁目３３６７番地２２,2017-01-11,株式会社
株式会社ＦＴＣ．ＦＵＣＯＮ,兵庫県姫路市神屋町５丁目３５番地１,2017-01-11,株式会社
株式会社ＦＵＫＵ,滋賀県守山市播磨田町３１０２番地,2017-01-11,株式会社
株式会社Ｆａｂｂｒｏ,宮城県仙台市太白区富沢字鍛冶屋敷前２９番地,2017-01-11,株式会社
株式会社Ｆｏｇｇｉａ,東京都新宿区赤城下町３３番地２４,2017-01-11,株式会社
株式会社Ｆｏｒｅｓｔｒｙ天塩,北海道天塩郡天塩町字ウブシ５５２４番地の１,2017-01-11,株式会社
株式会社Ｆｕ－Ｆｕ－ペット,神奈川県厚木市まつかげ台１０番４号,2017-01-11,株式会社
株式会社Ｆｕｔｗｏｒｋグループ,宮城県仙台市泉区上谷刈字羽黒山１７番地１,2017-01-11,株式会社
株式会社Ｇ－ＲＩＤＥ,北海道札幌市南区澄川六条１３丁目８番７号,2017-01-11,株式会社
株式会社ＧＢホスピタリティ,東京都新宿区西新宿３丁目２０番２号,2017-01-11,株式会社
株式会社ＧＲＡＮＤ　ＤＥＳＩＧＮ,秋田県秋田市泉北２丁目１０番７号,2017-01-11,株式会社
株式会社ＧｉＦＴ　ｐａｒｔｎｅｒｓ,東京都目黒区下目黒１丁目８番３１号目黒パークハイツ２０１,2017-01-11,株式会社
株式会社Ｇｒａｎ　Ｃｏｃｈｅ,愛知県名古屋市港区小碓２丁目８５番地,2017-01-11,株式会社
株式会社Ｈ・Ｍ・Ｃ,茨城県結城郡八千代町大字大間木４０５番地１６,2017-01-11,株式会社
株式会社Ｈ＆Ａ,東京都昭島市福島町２丁目２６番９号,2017-01-11,株式会社
株式会社Ｈ．Ｍ北陸ホールディングス,福井県福井市和田東２丁目１９０２番地,2017-01-11,株式会社
株式会社ＨＡＬＯプロジェクト,東京都小金井市本町５丁目１８番５ピーアンドリッチワン２Ｆ,2017-01-11,株式会社
株式会社ＨＩＮＯＭＡＲＵ－ＡＴＨＬＥＴＥ,東京都江東区深川１丁目６番２９号,2017-01-11,株式会社
株式会社ＨＶＥＴ,東京都稲城市押立９５８番地の９,2017-01-11,株式会社
株式会社Ｈａｇ　Ｗｅｌｌ,滋賀県東近江市今町２６１番地,2017-01-11,株式会社
株式会社Ｈｕｎ’ｓ　Ｃｏｒｐｏｒａｔｉｏｎ,東京都江戸川区南小岩７丁目４０番３１号ＴＦビル,2017-01-11,株式会社
株式会社ＩＳＬＥ,神奈川県相模原市中央区下九沢９６３番地１,2017-01-11,株式会社
株式会社ＩＳＭ,大阪府八尾市山本町南４丁目５番９号,2017-01-11,株式会社
株式会社Ｊファーム,鹿児島県霧島市隼人町松永５５０９番地１,2017-01-11,株式会社
株式会社Ｊ＆Ｋコーポレーション,東京都品川区上大崎２丁目２４番１１－１２０１号,2017-01-11,株式会社
株式会社Ｊ－ＳＹＳ,大阪府堺市西区浜寺諏訪森町中２丁１６０番地の３,2017-01-11,株式会社
株式会社ＪＡＭＰＳ,大阪府茨木市宇野辺２丁目５番３４－４０７号,2017-01-11,株式会社
株式会社Ｋプロジェクト,広島県広島市中区大手町３丁目５番３－３０１号,2017-01-11,株式会社
株式会社Ｋライン,宮城県気仙沼市港町２８６番地１,2017-01-11,株式会社
株式会社Ｋ＆Ｆ鉱業,石川県金沢市弥生１丁目３１番３６号,2017-01-11,株式会社
株式会社Ｋ＆Ｙ,愛知県名古屋市中村区則武本通１丁目３６番地,2017-01-11,株式会社
株式会社ＫＩＭＡＵＴＯ　ＪＡＰＡＮ,神奈川県横浜市西区北幸１丁目１１番１号,2017-01-11,株式会社
株式会社ＫＳ－Ａｃｔｉｏｎ,愛媛県松山市高岡町８２１番地１５,2017-01-11,株式会社
株式会社ＫＴ仮設,大阪府柏原市平野１丁目９番３号,2017-01-11,株式会社
株式会社ＫＵＤＯＨ,熊本県熊本市中央区九品寺１丁目１番２６号,2017-01-11,株式会社
株式会社Ｌ,大阪府大阪市住之江区中加賀屋４丁目１番２０号,2017-01-11,株式会社
株式会社Ｌｕｃｅ,埼玉県川口市大字伊刈１６７番地１,2017-01-11,株式会社
株式会社Ｍ．Ｉ．Ｗｏｒｋｓ,東京都江戸川区江戸川６丁目１番地５１,2017-01-11,株式会社
株式会社ＭＡＤＯＫＳ,東京都世田谷区瀬田２丁目２８番１０号池田ビル１階,2017-01-11,株式会社
株式会社ＭＡＪＥＬＡＮ,東京都中野区東中野４丁目４番５号,2017-01-11,株式会社
株式会社ＭＡＲＩＮＥ設計工房,神奈川県川崎市宮前区犬蔵２丁目１５番３１－３号,2017-01-11,株式会社
株式会社ＭＡＲＵＮＯ,滋賀県野洲市妙光寺２９６番地１,2017-01-11,株式会社
株式会社ＭＢＣ,大阪府豊中市新千里南町１丁目１番７０－４０５号,2017-01-11,株式会社
株式会社ＭＤＫ,東京都足立区梅田５丁目１３番２号,2017-01-11,株式会社
株式会社ＭＦジャパン,東京都港区芝大門２丁目７番６号,2017-01-11,株式会社
株式会社ＭＫ　ＰＬＡＮＮＩＮＧ,神奈川県川崎市中原区小杉町１丁目４０３番地,2017-01-11,株式会社
株式会社ＭＫ　Ｔｒｕｓｔ,神奈川県茅ヶ崎市東海岸南２丁目６番１２号ル・ファール東海岸１０３,2017-01-11,株式会社
株式会社ＭＴメディカルオフィス,栃木県佐野市高砂町７番地,2017-01-11,株式会社
株式会社Ｍａｄｅ　ｉｎ　ＪＡＰＡＮ,東京都江戸川区西瑞江４丁目１５番地１０フルーヴ２３・１０２,2017-01-11,株式会社
株式会社Ｍｐｌａｎｎｉｎｇ,愛知県名古屋市北区丸新町２６７番地２Ａ,2017-01-11,株式会社
株式会社Ｎ＆Ｋ,熊本県熊本市西区田崎町４８４番地１６,2017-01-11,株式会社
株式会社ＮＫＦ,東京都豊島区要町２丁目２９番７号,2017-01-11,株式会社
株式会社Ｎｅｗ　Ｓｕｐｐｏｒｔ,福岡県福岡市西区大字周船寺１７２番地３,2017-01-11,株式会社
株式会社Ｎｉｎｅ,大阪府大阪市中央区森ノ宮中央１丁目２番２１号,2017-01-11,株式会社
株式会社ＮｕＣｏｄｅ,神奈川県横浜市中区桜木町２丁目２番地港陽ビル４Ｆ,2017-01-11,株式会社
株式会社ＯＳＫキッズ,岡山県岡山市北区絵図町１番５０号,2017-01-11,株式会社
株式会社ＯＳＫフィットネス,岡山県岡山市北区絵図町１番５０号,2017-01-11,株式会社
株式会社ＯＳＫヘルスプロモーション,岡山県岡山市北区絵図町１番５０号,2017-01-11,株式会社
株式会社ＯｆｆｉｃｅＳｏｒｒｉｓｏ,大阪府茨木市西駅前町４番３１１号,2017-01-11,株式会社
株式会社Ｏｎｅ　Ｓｔｙｌｅ,東京都渋谷区千駄ヶ谷３丁目５５番３号,2017-01-11,株式会社
株式会社ＰＩＥＣＥ,福島県郡山市桑野１丁目１３番２５号,2017-01-11,株式会社
株式会社ＰＩＧＮＵＳ,東京都新宿区新宿７丁目２６番７号ビクセル新宿１Ｆ,2017-01-11,株式会社
株式会社ＰＬＡＮＥＴ,福岡県小郡市美鈴が丘２丁目５番地１６,2017-01-11,株式会社
株式会社ＰＯＧＬＩ,京都府京都市西京区大枝北沓掛町１丁目５番地２サンシティ桂坂ロイヤル弐番館４１０号,2017-01-11,株式会社
株式会社ＰＯＫＯＴＡＮ,神奈川県相模原市緑区二本松２丁目５番５－２号２０３,2017-01-11,株式会社
株式会社ＰＲＯＣ,東京都港区港南２丁目１６番７－１８０５号,2017-01-11,株式会社
株式会社ＰｅｒｓｏｎａｌＤｒｅａｍｓ,福井県福井市順化１丁目１７番５号,2017-01-11,株式会社
株式会社ＱｕｅｅｎＳｔｙｌｅ,大阪府堺市北区金岡町１４１５番地２サンヴァリエ中百舌鳥９号棟４０５号室,2017-01-11,株式会社
株式会社ＲＩＤＥ－ＯＮ,東京都港区西新橋１丁目１１番５号,2017-01-11,株式会社
株式会社ＲＪＰ,宮城県仙台市宮城野区蒲生字東城道田１９番地の２,2017-01-11,株式会社
株式会社Ｒａｕｈ,長野県飯田市北方２０４０番地６,2017-01-11,株式会社
株式会社Ｒｉｏ＆Ｃｏ,東京都台東区今戸２丁目６番１号,2017-01-11,株式会社
株式会社ＳＡＫＵＲＡＩＳＥ,山形県東根市中央南２丁目５番５号,2017-01-11,株式会社
株式会社ＳＣ,大阪府大阪市中央区玉造１丁目２１番２２号,2017-01-11,株式会社
株式会社ＳＧＯＶ,兵庫県神戸市中央区熊内橋通４丁目２番６号３０１,2017-01-11,株式会社
