法人名,住所,設立日,法人種別
あおみが丘コミュニティ株式会社,愛知県高浜市二池町５丁目５番地７,2017-02-01,株式会社
おもいで株式会社,東京都渋谷区恵比寿１丁目１５－９シルク恵比寿４０３,2017-02-01,株式会社
さくらえん合同会社,愛知県刈谷市中手町２丁目６０３番地,2017-02-01,合同会社
じょいらいふマネージメント株式会社,兵庫県神戸市西区押部谷町木幡３４５番地,2017-02-01,株式会社
みつわ会計株式会社,京都府京都市山科区竹鼻西ノ口町３５番地１６,2017-02-01,株式会社
らいふパートナー株式会社,埼玉県さいたま市岩槻区仲町１丁目１１番１２－１０５号,2017-02-01,株式会社
アウル・オン・サービス株式会社,東京都豊島区上池袋３丁目２５番５号２階,2017-02-01,株式会社
アクセル・エンタテインメント・インク,東京都渋谷区神宮前２丁目７番６－１０６号,2017-02-01,外国会社等
アクティブワン株式会社,東京都港区三田３丁目２番２２号,2017-02-01,株式会社
アステル不動産株式会社,神奈川県相模原市緑区西橋本２丁目２５番３号２Ｆ,2017-02-01,株式会社
イデアルプラン株式会社,神奈川県横浜市港南区上大岡西２丁目４番８号福真ビル３階,2017-02-01,株式会社
エイトオーシャンズホールディングス株式会社,千葉県船橋市藤原１丁目２６番１６－６０４号,2017-02-01,株式会社
エコロコンサルティング株式会社,鹿児島県曽於郡大崎町菱田１７２６番地１,2017-02-01,株式会社
エスアールシステムサービス株式会社,東京都中央区日本橋３丁目２番１４号新槇町ビル別館第一２階,2017-02-01,株式会社
エフ・ダイニング・プロジェクト株式会社,東京都渋谷区道玄坂２丁目８番８号コスモ渋谷館５０１,2017-02-01,株式会社
エリーゼジャパン合同会社,神奈川県横浜市保土ケ谷区天王町２丁目４２番地２,2017-02-01,合同会社
エレナ資産管理合同会社,香川県坂出市府中町５０８０番地２,2017-02-01,合同会社
エースリーアイ株式会社,東京都新宿区四谷３丁目１番地,2017-02-01,株式会社
オーエスラボ株式会社,東京都板橋区赤塚２丁目２４番１３号,2017-02-01,株式会社
カナル・トレーディング・ジャパン株式会社,東京都羽村市小作台１丁目２１番地８ホワイト８６－３０３,2017-02-01,株式会社
クッシュマン・アンド・ウェイクフィールド・コンストラクション合同会社,東京都千代田区永田町２丁目１１番１号,2017-02-01,合同会社
クリエイトファイブ合同会社,静岡県静岡市駿河区石田１丁目１８番１－２０１号,2017-02-01,合同会社
クレア・ジャパン株式会社,東京都千代田区九段南２丁目４番１１号,2017-02-01,株式会社
グライド・ファシリティマネジメント株式会社,東京都渋谷区渋谷２丁目１０番１３号,2017-02-01,株式会社
グローバル・パートナー株式会社,東京都中央区日本橋本石町２丁目１番１号,2017-02-01,株式会社
ケンコーポレーション株式会社,福岡県福岡市南区市崎１丁目１２番２３号,2017-02-01,株式会社
コニー株式会社,兵庫県尼崎市常松２丁目１３番８－４０５号,2017-02-01,株式会社
シンコースポーツ大阪株式会社,大阪府大阪市西区江戸堀１丁目２番１１号,2017-02-01,株式会社
ジャパンスカイワーク株式会社,宮城県富谷市鷹乃杜１丁目３１番８号,2017-02-01,株式会社
スタイルドライブ株式会社,新潟県新潟市中央区天神１丁目１番地,2017-02-01,株式会社
ソリューションリンク株式会社,東京都調布市富士見町３丁目９番地３７,2017-02-01,株式会社
タイムクラウド株式会社,東京都港区西麻布１丁目５－１８イバラキビル１階,2017-02-01,株式会社
タニダ創建株式会社,兵庫県姫路市豊富町御蔭３３５３番地２７,2017-02-01,株式会社
ダーモゾーンジャパン株式会社,東京都台東区蔵前４丁目３３番８号,2017-02-01,株式会社
ティ・アイ・エム株式会社,福岡県遠賀郡岡垣町旭台５丁目１１番４号,2017-02-01,株式会社
ティーメイト株式会社,鹿児島県薩摩郡さつま町宮之城屋地１０７７番地２,2017-02-01,株式会社
テイコクナナキ合同会社,静岡県浜松市西区篠原町２１２４７番２号,2017-02-01,合同会社
テイワイエス合同会社,東京都板橋区小豆沢２丁目２４番９号,2017-02-01,合同会社
テクノバイオ株式会社,兵庫県三田市すずかけ台３丁目５番地１、２棟３０６号,2017-02-01,株式会社
テラルホールディングス株式会社,広島県福山市御幸町大字森脇２３０番地,2017-02-01,株式会社
ディアネクスト株式会社,千葉県八千代市大和田８６３番地の２,2017-02-01,株式会社
トミーアセットマネジメント株式会社,兵庫県宝塚市武庫山２丁目１９番１－５０１号,2017-02-01,株式会社
トレードウェブ・ジャパン株式会社,東京都港区赤坂５丁目３番１号赤坂Ｂｉｚタワー３０階,2017-02-01,株式会社
トーラスエナジー株式会社,大阪府大阪市中央区徳井町２丁目４－１５,2017-02-01,株式会社
ニュースタイルジャパン株式会社,東京都江東区森下２丁目２０番１号,2017-02-01,株式会社
ニューワン株式会社,東京都世田谷区尾山台３丁目２２番１３号,2017-02-01,株式会社
ハーバルグリーン株式会社,東京都世田谷区船橋７丁目８番２－１４３３号,2017-02-01,株式会社
バギーズ合同会社,東京都目黒区青葉台４丁目６番１７－５１２号松見坂マンション,2017-02-01,合同会社
バードコア株式会社,千葉県流山市平和台４丁目２３番地の５,2017-02-01,株式会社
パイオニアケーブルネットワーク株式会社,東京都大田区大森本町１丁目６番１号,2017-02-01,株式会社
ファイン・ブレーン合同会社,山梨県甲府市徳行４丁目１６番２６号レクセル甲府４１６,2017-02-01,合同会社
フォーメーション株式会社,千葉県我孫子市新木野１丁目２－１１－１０１,2017-02-01,株式会社
ブルーダリア・マネジメント株式会社,東京都港区南青山２丁目２番１５号ウィン青山ビルＵＣＦ９階,2017-02-01,株式会社
ブロードフォード株式会社,愛知県名古屋市西区大金町１丁目２９番地,2017-02-01,株式会社
プーキーホールディングス株式会社,香川県木田郡三木町大字井戸２０４８番地１,2017-02-01,株式会社
ペリドット合同会社,千葉県船橋市芝山５丁目１３番９号,2017-02-01,合同会社
ホクトフード株式会社,北海道札幌市白石区北郷三条９丁目６番１６号,2017-02-01,株式会社
ホースラインジャパン株式会社,愛知県東海市東海町３丁目９番１６号,2017-02-01,株式会社
ポケットカンパニー株式会社,福岡県福岡市東区名島４丁目５－１－１０３,2017-02-01,株式会社
ミタカ株式会社,鹿児島県鹿児島市桜ヶ丘６丁目４３番地１２,2017-02-01,株式会社
ミライスト株式会社,神奈川県横浜市中区住吉町２丁目２１番地１,2017-02-01,株式会社
メタルデザイン株式会社,福岡県福津市津丸１２０２番地の４７,2017-02-01,株式会社
モリゴネット合同会社,東京都大田区中央５丁目８番１４号ステューディオ前田１０１号,2017-02-01,合同会社
ユワ産業合同会社,岡山県岡山市中区藤原西町１丁目２番５－４号,2017-02-01,合同会社
ライブラコア合同会社,東京都世田谷区奥沢５丁目３４番１号,2017-02-01,合同会社
リクノアカデミック株式会社,東京都中央区銀座７丁目１３番６号サガミビル２階,2017-02-01,株式会社
リニューアブルエナジーパートナーズ合同会社,東京都港区西新橋１丁目３番１号,2017-02-01,合同会社
一般社団法人ウサギ,沖縄県名護市字宇茂佐４５８番地８,2017-02-01,その他の設立登記法人
一般社団法人オフィスｋｉｙｏｈａｒｕ,山梨県北杜市長坂町長坂上条２５３３番地２４長坂ステーションビル４４１,2017-02-01,その他の設立登記法人
一般社団法人サンプロ・プロモーション,大阪府吹田市江の木町１番８号田中ビル４Ｆ,2017-02-01,その他の設立登記法人
一般社団法人ザ・グローバル・アライアンス・フォー・ビジネス・アンド・ヒューマン・ライツ,神奈川県川崎市高津区野川３８９８番地１,2017-02-01,その他の設立登記法人
一般社団法人シティコンサルティンググループ,北海道札幌市中央区南一条西１０丁目４番地第２タイムビル２階,2017-02-01,その他の設立登記法人
一般社団法人ジャパンフォワード推進機構,東京都千代田区大手町１丁目７番２号,2017-02-01,その他の設立登記法人
一般社団法人スポーツで三原を元気にする会,広島県三原市宗郷４丁目９番１２号,2017-02-01,その他の設立登記法人
一般社団法人医輪会,東京都三鷹市井の頭５丁目７番３６号,2017-02-01,その他の設立登記法人
一般社団法人吉日,東京都港区北青山１丁目２番３号青山ビル９階,2017-02-01,その他の設立登記法人
一般社団法人国際ブラシヨガ協会,東京都港区赤坂９丁目１番７号,2017-02-01,その他の設立登記法人
一般社団法人徳広エネルギー工房,長野県大町市平２１１２番地４０４,2017-02-01,その他の設立登記法人
一般社団法人日中友好病院連盟,東京都千代田区九段北１丁目３番１号九段下プラザビル８Ｆ,2017-02-01,その他の設立登記法人
一般社団法人日本輸入ブランド品鑑定調査機構,東京都港区西麻布２丁目１３番１５号大山ビル７Ｆ,2017-02-01,その他の設立登記法人
一般社団法人本の研究社,東京都港区南青山５丁目１２番２８号,2017-02-01,その他の設立登記法人
一般社団法人災害復旧職人派遣協会,山梨県大月市猿橋町殿上６３０番地１,2017-02-01,その他の設立登記法人
一般社団法人環境テック,東京都世田谷区宇奈根２丁目１２番２７号,2017-02-01,その他の設立登記法人
一般社団法人関西伝統芸能女流振興会,大阪府大阪市西区新町２丁目１５番１０－１１０７号,2017-02-01,その他の設立登記法人
一般社団法人高朗会,兵庫県尼崎市立花町４丁目１２番１号ベルトピア立花Ⅲ３０７,2017-02-01,その他の設立登記法人
一般社団法人Ｈａｕｓｋａａ,埼玉県川越市かすみ野１丁目１番地５,2017-02-01,その他の設立登記法人
一般社団法人Ｈｕｇ＆Ｙｏｇａ協会,東京都西東京市東町３丁目２番２号,2017-02-01,その他の設立登記法人
一般社団法人Ｏｃｅａｎ　Ｔｒｕｓｔ,京都府京都市下京区室町通綾小路上る鶏鉾町４８０番地オフィス－ワン四条烏丸１１０６,2017-02-01,その他の設立登記法人
一般財団法人ヨシックス記念財団,愛知県名古屋市東区徳川町５０２番地,2017-02-01,その他の設立登記法人
一般財団法人第１６回世界女子ソフトボール選手権大会組織委員会,千葉県千葉市稲毛区天台町２８５千葉県総合スポーツセンター宿泊研修所第２研修室,2017-02-01,その他の設立登記法人
上平窪合名会社,福島県いわき市平上平窪字酢釜５０番地,2017-02-01,合名会社
下関システムハウス株式会社,山口県下関市長府浜浦町２番５４号,2017-02-01,株式会社
二更日本株式会社,東京都中央区日本橋小網町１１番８号ザ・パークレックス小網町ビル３Ｆ,2017-02-01,株式会社
五福商事株式会社,長崎県五島市浜町５０６番地,2017-02-01,株式会社
伊藤電気株式会社,愛知県名古屋市南区南野１丁目２１番地の１０,2017-02-01,株式会社
全国柔道整復師会株式会社,山梨県富士吉田市下吉田１丁目１番２１号,2017-02-01,株式会社
八多凝集研究所株式会社,東京都港区赤坂２丁目１２番３１号,2017-02-01,株式会社
共同ＮＰＩパッケージ株式会社,茨城県守谷市立沢１９３２番地,2017-02-01,株式会社
医療法人愛紘会,神奈川県川崎市幸区小倉１丁目３番１４号テイスティーヒルズ１階,2017-02-01,その他の設立登記法人
医療法人社団順誠会,千葉県市川市妙典４丁目２番１２号,2017-02-01,その他の設立登記法人
医療法人秀和会,大阪府泉佐野市市場西３丁目４番１０号,2017-02-01,その他の設立登記法人
千福合同会社,埼玉県越谷市東越谷１０丁目１０７番地２６,2017-02-01,合同会社
合同会社えがおや,神奈川県相模原市中央区上溝２丁目４番２５号,2017-02-01,合同会社
合同会社ひだまりＡＴＡＬ,東京都大田区東六郷３丁目２６番６－２０２号,2017-02-01,合同会社
合同会社みなくるＪａｐａｎ,奈良県葛城市南道穗２３９番地４,2017-02-01,合同会社
合同会社みんなの職業訓練センター,大阪府大阪市淀川区東三国６丁目１５－８,2017-02-01,合同会社
合同会社アトリウム,東京都中央区日本橋茅場町３丁目９番６号,2017-02-01,合同会社
合同会社アルゴツール,京都府京都市中京区蛸薬師通烏丸西入橋弁慶町２２２番地京都いのべーしょんオフィス,2017-02-01,合同会社
合同会社アール・エム・ティー,東京都練馬区春日町５丁目３３番１２－２０２号,2017-02-01,合同会社
合同会社イースリーファンズ,大阪府河内長野市市町３１９番地の２０,2017-02-01,合同会社
合同会社ガルウィング,東京都北区王子２丁目１４番２０号大凰ビル１階,2017-02-01,合同会社
合同会社クラウドエージェント,東京都中央区銀座７丁目１３番５号ＮＲＥＧ銀座ビル１階,2017-02-01,合同会社
合同会社クラスター,神奈川県川崎市宮前区野川２６５２番地１９,2017-02-01,合同会社
合同会社クラリス,埼玉県さいたま市南区別所５丁目１５番２号,2017-02-01,合同会社
合同会社クロスオーバー,東京都港区新橋１丁目１７番１号新幸ビル４階,2017-02-01,合同会社
合同会社グローカル・パートナーズ,東京都杉並区宮前３丁目８番３－１０７号,2017-02-01,合同会社
合同会社グロースカンパニー,大分県別府市北浜１丁目４番２０号２Ｆ－１,2017-02-01,合同会社
合同会社スピードラボ,香川県高松市多肥下町１５２８番地１０エスポワールⅡ田井３０５,2017-02-01,合同会社
合同会社スマイルエステート,東京都中央区銀座１丁目１５番７号マック銀座ビル３階,2017-02-01,合同会社
合同会社セブン,東京都渋谷区千駄ヶ谷５丁目３０番９号,2017-02-01,合同会社
合同会社セルフステア,東京都品川区北品川１丁目９番７号トップルーム品川１０１５号,2017-02-01,合同会社
合同会社センス,東京都中央区東日本橋３丁目５番９号,2017-02-01,合同会社
合同会社ダイワ,東京都大田区西蒲田５丁目１０番８号,2017-02-01,合同会社
合同会社ツボイ,岡山県総社市門田３４２番地３１,2017-02-01,合同会社
合同会社ティーゴ,東京都豊島区目白４丁目２１番９号,2017-02-01,合同会社
合同会社デイリーファーム真野,北海道北見市留辺蘂町松山３１８番地２,2017-02-01,合同会社
合同会社ナイト,広島県広島市中区富士見町１５番５－８０１号,2017-02-01,合同会社
合同会社ブラウニー,東京都大田区北千束２丁目６番５号,2017-02-01,合同会社
合同会社ブランシェイム,東京都千代田区二番町５番地２麹町駅プラザ３階,2017-02-01,合同会社
合同会社ホーリーロッジ,東京都練馬区大泉町２丁目２４番２４号,2017-02-01,合同会社
合同会社マルコ,長崎県雲仙市愛野町乙５０３６番地４２,2017-02-01,合同会社
合同会社ラーイマーイ,東京都渋谷区神宮前４丁目９番５号,2017-02-01,合同会社
合同会社ワイメア,東京都中央区日本橋３丁目２番１４号新槇町ビル別館第一１階,2017-02-01,合同会社
合同会社ヴィント・エイジ,東京都板橋区小茂根１丁目２９番１０号２Ｆ,2017-02-01,合同会社
合同会社中央リサイクルセンター,長野県長野市川中島町四ツ屋１３２７番地３５,2017-02-01,合同会社
合同会社倫,東京都目黒区東山２丁目２番２号オリエンタル東山３０３号,2017-02-01,合同会社
合同会社安心健康社会研究所,広島県福山市神辺町大字川南１１０９番地の４,2017-02-01,合同会社
合同会社山本商店,大阪府泉大津市池浦町１丁目１４番１号,2017-02-01,合同会社
合同会社幕張総合研究所,千葉県千葉市稲毛区天台２丁目６番２１号,2017-02-01,合同会社
合同会社日本マーケティングシステム,愛知県あま市篠田３丁目２２番地,2017-02-01,合同会社
合同会社明星ＴＫ保温,宮崎県延岡市富美山町８３番地４８８,2017-02-01,合同会社
合同会社望建設,福岡県福岡市東区唐原１丁目３番２３号,2017-02-01,合同会社
合同会社来夢,長崎県南松浦郡新上五島町東神ノ浦郷１８６番地６,2017-02-01,合同会社
合同会社桜弁当,東京都板橋区蓮根１丁目２９番６号第３江口コーポ１０１,2017-02-01,合同会社
合同会社桜華,東京都新宿区上落合１丁目２３－１,2017-02-01,合同会社
合同会社楽家,東京都墨田区江東橋３丁目１番５－４０２号,2017-02-01,合同会社
合同会社武蔵坊,広島県広島市東区二葉の里２丁目４番１４号,2017-02-01,合同会社
合同会社真澄,愛知県清須市助七五反田７３番地５,2017-02-01,合同会社
合同会社鉄の斧,埼玉県さいたま市北区宮原町２丁目１０３番地６アムール宮原１０３,2017-02-01,合同会社
合同会社ＡＫＣ,東京都小金井市本町４丁目１番１－６０１号,2017-02-01,合同会社
合同会社ＡＲＫ,東京都港区白金１丁目２５番１１－３０７号,2017-02-01,合同会社
合同会社ＡＳＴＥＲＩＡ,東京都港区浜松町２丁目２番１５号,2017-02-01,合同会社
合同会社ＡＵＴＯ　ＡＳＡＤ,福岡県宗像市光岡９５２番地,2017-02-01,合同会社
合同会社Ｄ．Ｋ．Ｙ．Ｙ,東京都練馬区田柄５丁目１７番２１号,2017-02-01,合同会社
合同会社Ｄｏｔｓ,大阪府堺市東区草尾４２６番地１,2017-02-01,合同会社
合同会社ＨＴコーポレーション,大阪府枚方市岡東町１８番２３号,2017-02-01,合同会社
合同会社ＨＵＲＩＴＴ,静岡県浜松市浜北区中条７１８番地の１リーベディヒ１０１,2017-02-01,合同会社
合同会社Ｈａｒｍｏｎｙ,東京都世田谷区上用賀４丁目３７番１２－９０６号,2017-02-01,合同会社
合同会社ＫＲｍｓエネルギー,青森県五所川原市字柏原町６２番地１,2017-02-01,合同会社
合同会社ＬＬＯＹＥＤ　ＴＲＡＤＩＮＧ,千葉県船橋市習志野台４丁目８１番２３号ソワサント福田２０５号,2017-02-01,合同会社
合同会社ＬｉｆｅＳｔｅｅｒ,愛知県岡崎市鴨田町字山畔１番地３６,2017-02-01,合同会社
合同会社ＭＡＴＥＥＬＡ　ＭＯＴＯＲＳ,福岡県古賀市駅東２丁目１４番１５号ドミール古賀１０２号,2017-02-01,合同会社
合同会社ＲＩＳＥ,東京都豊島区東池袋１丁目１７番１１－１１０５号,2017-02-01,合同会社
合同会社ＴＭ　Ａｓｓｅｔ　Ｍａｎａｇｅｍｅｎｔ,千葉県松戸市常盤平柳町１１番地１４,2017-02-01,合同会社
合同会社ＵＳプロパティファイナンス３号,東京都中央区日本橋兜町３番１１号三田証券株式会社内,2017-02-01,合同会社
合同会社ｂｒｉｇｈｔｎｅｗ,東京都北区赤羽２丁目２３番２号,2017-02-01,合同会社
合同会社ｉＨＭ,東京都小平市学園東町３丁目１８番３号,2017-02-01,合同会社
合同会社ｓｔｙｌｉｓｔ,東京都品川区旗の台６丁目２４番１３号オークハイツ４０１,2017-02-01,合同会社
合同会社ｔｒｅｆｌｅ,神奈川県横浜市港南区港南台９丁目１６番５号,2017-02-01,合同会社
合名会社境屋商店,福島県いわき市平字一町目２４番地,2017-02-01,合名会社
合名会社小川屋本店,福島県いわき市平字一町目２５番地,2017-02-01,合名会社
合名会社平東電社,福島県いわき市平字田町７０番地,2017-02-01,合名会社
合名会社猪苅製パン工場,福島県いわき市内郷小島町川崎２番地,2017-02-01,合名会社
合名会社白川屋材木店,福島県いわき市平字三崎４８番地,2017-02-01,合名会社
合名会社草野屋商店,福島県いわき市平下平窪字八木内４６番地,2017-02-01,合名会社
合名会社草野屋搾油所,福島県いわき市平下平窪字八木内４６番地,2017-02-01,合名会社
合名会社鬼ヶ澤炭礦礦業所,福島県いわき市内郷宮町峯根５７番地,2017-02-01,合名会社
合資会社會津屋商店,福島県いわき市平字五町目１９番地,2017-02-01,合資会社
合資会社有田鑛務所,福島県いわき市内郷綴町榎下６４番地,2017-02-01,合資会社
合資会社阿部源商店,福島県いわき市平字三町目２１番地,2017-02-01,合資会社
合資会社青山商店,福島県いわき市平字二町目２７番地,2017-02-01,合資会社
向電気工事株式会社,大阪府寝屋川市池田新町１４番２号,2017-02-01,株式会社
坂本ファーム株式会社,大阪府堺市北区野遠町５４３番地１,2017-02-01,株式会社
大日商事株式会社,東京都世田谷区野沢３丁目２２番７号,2017-02-01,株式会社
大橋産業合同会社,神奈川県厚木市飯山３００４番地１６,2017-02-01,合同会社
婚礼紀株式会社,神奈川県相模原市南区旭町２４番６号,2017-02-01,株式会社
富瑞テクノロジー株式会社,千葉県船橋市坪井東１丁目１２番９－２０７号,2017-02-01,株式会社
富田商店株式会社,福島県南会津郡下郷町大字弥五島字中原７３６番地１６,2017-02-01,株式会社
小胞体ストレス研究所株式会社,徳島県徳島市蔵本町３丁目１８番地の１５,2017-02-01,株式会社
山本工業株式会社,広島県広島市安佐南区山本２丁目３番７－３０２号,2017-02-01,株式会社
山梨Ｍａｄｅ株式会社,山梨県南アルプス市和泉９８４番地１,2017-02-01,株式会社
岡山県建設業協会建部支部,岡山県岡山市北区建部町福渡４９１－１,2017-02-01,その他
崑崙貿易株式会社,大阪府大阪市浪速区恵美須西２丁目６番９号,2017-02-01,株式会社
川添工業株式会社,宮崎県宮崎市田野町乙９４５１番地２６,2017-02-01,株式会社
己照合同会社,岡山県倉敷市玉島爪崎９８１番地１,2017-02-01,合同会社
幕張プロパティ一般社団法人,東京都千代田区丸の内３丁目１番１号東京共同会計事務所内,2017-02-01,その他の設立登記法人
弁護士法人桜橋法律事務所,大阪府大阪市北区堂島２丁目２番２号近鉄堂島ビル１９階,2017-02-01,その他の設立登記法人
愛嬌酒場えにし株式会社,神奈川県横浜市中区吉田町６４番３号,2017-02-01,株式会社
慕求日本株式会社,千葉県柏市新富町２丁目１番４０－２号,2017-02-01,株式会社
戸田工業株式会社,埼玉県戸田市笹目北町１０番地１８,2017-02-01,株式会社
日本基督教会　静岡池田伝道教会,静岡県静岡市駿河区栗原３４－８,2017-02-01,その他
日本未来トラストホールディングス株式会社,東京都港区虎ノ門４丁目３番１号城山トラストタワー,2017-02-01,株式会社
旭屋合資会社,福島県いわき市平下平窪字曲田７５番地,2017-02-01,合資会社
旭鐵工業株式会社,千葉県旭市ニの６５１３番地１３,2017-02-01,株式会社
有限会社三井精工,山梨県都留市戸沢１１７５番地,2017-02-01,有限会社
有限会社拓昇,千葉県銚子市名洗町３０８０番地,2017-02-01,有限会社
朝日不動産管理株式会社,東京都品川区大井４丁目１３番１７号,2017-02-01,株式会社
東光開拓農業協同組合,山梨県北杜市明野町浅尾５２５９番地,2017-02-01,その他の設立登記法人
東商建築デザイン株式会社,宮城県仙台市青葉区栗生４丁目１２番地の１,2017-02-01,株式会社
