法人名,住所,設立日,法人種別
あいの手合同会社,長野県松本市大字神林３５４８番地１,2016-10-03,合同会社
かなこ企画合同会社,東京都千代田区神田錦町３丁目２１番ちよだプラットフォームスクウェア１０３０,2016-10-03,合同会社
すわスパイン株式会社,広島県福山市多治米町５丁目２３番２９－１０１号,2016-10-03,株式会社
ひろしま人事サポート合同会社,広島県広島市中区寺町５番２７号パークヒルズ城南２Ｆ,2016-10-03,合同会社
アイルズジャパン株式会社,三重県伊賀市甲野１０３３番地３２５,2016-10-03,株式会社
アジアパシフィックインベストメント青山株式会社,東京都目黒区青葉台１丁目４番７－１０６号,2016-10-03,株式会社
アセット・コミュニケーション株式会社,神奈川県横浜市保土ケ谷区桜ケ丘２丁目４３番１－４５０号,2016-10-03,株式会社
アドプラス合同会社,沖縄県那覇市天久１丁目６番６－３０２号,2016-10-03,合同会社
アメージングＳ．Ｔ株式会社,福井県福井市大宮１丁目２番３号,2016-10-03,株式会社
アークプラスト株式会社,岡山県倉敷市東塚３丁目２４番３４号,2016-10-03,株式会社
アールエムデザイン株式会社,東京都台東区三ノ輪１丁目１－１１モンロービル３階,2016-10-03,株式会社
インターナショナルジャパン株式会社,千葉県佐倉市大崎台３丁目１０番４－２号,2016-10-03,株式会社
インフィニティーインターナショナル株式会社,埼玉県さいたま市岩槻区大字慈恩寺８８６番地３－１階,2016-10-03,株式会社
エイブル引越サービス株式会社,大阪府大阪市中央区北浜４丁目１番２号,2016-10-03,株式会社
エスケイトランス株式会社,静岡県富士市大渕２４８３番地,2016-10-03,株式会社
エヌアンドエムドーナツ株式会社,京都府京都市中京区車屋町通押小路上る西押小路町１０９番地１,2016-10-03,株式会社
エヌ・テックサービス株式会社,京都府相楽郡精華町大字植田小字畑ノ前７０番地１,2016-10-03,株式会社
エム・ケイ電設株式会社,福岡県福岡市博多区諸岡４丁目５番２６号,2016-10-03,株式会社
エンデバー株式会社,埼玉県所沢市東所沢３丁目３８番地６,2016-10-03,株式会社
カラーズ合同会社,東京都港区赤坂９丁目６－２８アルベルゴ乃木坂７０６,2016-10-03,合同会社
クリエード株式会社,大阪府守口市京阪本通１丁目１番１４号シャトーピネール５０６号室,2016-10-03,株式会社
クロスアプリ株式会社,東京都中央区築地１丁目１２－１３,2016-10-03,株式会社
グリーンプロ信州株式会社,長野県下高井郡木島平村大字穂高２７５８番地１,2016-10-03,株式会社
ケイアイ・フロンティア株式会社,群馬県前橋市下新田町２２８番地牛込ハイツ１０５号,2016-10-03,株式会社
ケイズヴェルクシュタット株式会社,神奈川県横浜市都筑区大棚町６６５－１,2016-10-03,株式会社
ケイテック株式会社,岡山県岡山市北区楢津５９２－１,2016-10-03,株式会社
シャンティ株式会社,東京都千代田区鍛冶町１丁目７番４号,2016-10-03,株式会社
ジャパンマーベリックス株式会社,千葉県市原市君塚５丁目９番地４セザール五井５０５,2016-10-03,株式会社
ジュウィール合同会社,東京都台東区東上野１丁目１４番７号,2016-10-03,合同会社
スミエナジー・ベンチャーズ合同会社,東京都中央区晴海１丁目８番１１号,2016-10-03,合同会社
センター・バレー株式会社,東京都中央区日本橋２丁目１番１４号,2016-10-03,株式会社
チエノマ株式会社,大阪府大阪市都島区都島南通１丁目６番５号,2016-10-03,株式会社
ティー株式会社,福井県福井市蔵作町第９号５１番地,2016-10-03,株式会社
ハステック・ホールディングス株式会社,東京都渋谷区渋谷１丁目１１番３号第一小山ビル６階,2016-10-03,株式会社
パインフィールド合同会社,兵庫県明石市北王子町１２番３号,2016-10-03,合同会社
ピュアリフォーム株式会社,東京都渋谷区恵比寿西２丁目１番１０号,2016-10-03,株式会社
ファステラ合同会社,福岡県久留米市津福今町４５８番地５,2016-10-03,合同会社
フーセンウサギ株式会社,大阪府大阪市淀川区東三国１丁目３２番１２－１２０２号,2016-10-03,株式会社
ブライトＪＰ株式会社,広島県広島市中区竹屋町１番２６号,2016-10-03,株式会社
プロモコ建機株式会社,千葉県八千代市平戸２９３,2016-10-03,株式会社
マチヤケミカル株式会社,群馬県桐生市天神町２丁目１０番１６号,2016-10-03,株式会社
ミチマコンサルティング合同会社,三重県四日市市川島町４３６８番地,2016-10-03,合同会社
ルートストック合同会社,東京都千代田区西神田２丁目５番７号神田中央ビル６０３,2016-10-03,合同会社
ログトレ株式会社,東京都港区東麻布１丁目７－３,2016-10-03,株式会社
ヴィラ椿３号館管理組合法人,和歌山県西牟婁郡白浜町椿１０４９－３管理事務室,2016-10-03,その他の設立登記法人
一般社団法人しげまつ乳児保育園,京都府京都市右京区太秦桂ケ原町９番地２４,2016-10-03,その他の設立登記法人
一般社団法人しまね水産業構造改革サポート,島根県松江市御手船場町５７５番地,2016-10-03,その他の設立登記法人
一般社団法人すずらん会,東京都中央区八丁堀４丁目１１番７号,2016-10-03,その他の設立登記法人
一般社団法人アリラン,東京都豊島区南大塚２丁目１１番１０号ミモザビル,2016-10-03,その他の設立登記法人
一般社団法人ソーシャルプロジェクト,石川県金沢市額谷３丁目４９番地,2016-10-03,その他の設立登記法人
一般社団法人ヒューマンアンドエコロジー,熊本県合志市福原１番地３５,2016-10-03,その他の設立登記法人
一般社団法人ライブリーこども協会,香川県坂出市京町２丁目１－１０－１階,2016-10-03,その他の設立登記法人
一般社団法人ワイエスジー,山口県下関市岬之町１６－６下関ハイマート２Ｆ,2016-10-03,その他の設立登記法人
一般社団法人伊萬里,佐賀県伊万里市二里町大里甲１７７５番地１,2016-10-03,その他の設立登記法人
一般社団法人但馬ライフケア・整理業務会,兵庫県豊岡市九日市上町１１２１番地,2016-10-03,その他の設立登記法人
一般社団法人全国セーフティードライバー育成協会,東京都江戸川区宇喜田町１４０５番地,2016-10-03,その他の設立登記法人
一般社団法人公衆無線ＬＡＮ認証管理機構,東京都中央区銀座６丁目２番１号,2016-10-03,その他の設立登記法人
一般社団法人北海道日伯協会,北海道札幌市中央区南一条西４丁目１６番日本旅行札幌ビル六階,2016-10-03,その他の設立登記法人
一般社団法人四国物流サポート,徳島県徳島市幸町３丁目１０１番地リーガルアクシスビル２－Ｂ,2016-10-03,その他の設立登記法人
一般社団法人国際オルソケラトロジー学会アジア,福岡県福岡市中央区平尾５丁目６番１２号,2016-10-03,その他の設立登記法人
一般社団法人国際人財就労育成定着支援機構,東京都台東区池之端２丁目９番３号,2016-10-03,その他の設立登記法人
一般社団法人大阪府トライアスロン協会,大阪府富田林市梅の里３丁目３５番５号,2016-10-03,その他の設立登記法人
一般社団法人稲沢バナナ園,愛知県稲沢市祖父江町祖父江南方２３番地,2016-10-03,その他の設立登記法人
一般社団法人経営支援機構,東京都豊島区東池袋４丁目５番１号,2016-10-03,その他の設立登記法人
一般社団法人農援隊,広島県東広島市黒瀬町宗近柳国３１００番地,2016-10-03,その他の設立登記法人
一般社団法人金沢民泊協会,石川県金沢市西泉３丁目１０番地,2016-10-03,その他の設立登記法人
一般社団法人阿波市観光協会,徳島県阿波市阿波町東原１７３番地,2016-10-03,その他の設立登記法人
一般社団法人青い鳥,大阪府泉南市信達市場１５９２番地の１,2016-10-03,その他の設立登記法人
一般社団法人ＢＥＡＴ　ＬＯＮＧ　ＬＥＧＳ,埼玉県久喜市鷲宮５丁目３０番１８号グリーンハイム１０１号,2016-10-03,その他の設立登記法人
一般財団法人インドネシア・ロータリースクール,大分県佐伯市城南町２９番１５号,2016-10-03,その他の設立登記法人
一般財団法人欧州日本藝術財団,東京都港区南麻布４丁目１２番２５号南麻布セントレ２Ｆ,2016-10-03,その他の設立登記法人
丸喜産業ホールディングス株式会社,富山県高岡市葦附５８５８番地,2016-10-03,株式会社
五十河村農業會,京都府京丹後市大宮町延利２８番地１,2016-10-03,その他の設立登記法人
優ソフトウェア合同会社,山口県防府市岩畠１丁目７番２５号,2016-10-03,合同会社
光聖商事株式会社,埼玉県富士見市東みずほ台２丁目８番地１１－３０２号,2016-10-03,株式会社
前田ヘルスケアホールディングス株式会社,富山県富山市向新庄町１丁目１８番４７号,2016-10-03,株式会社
医療法人優栄会,京都府京都市下京区烏丸通仏光寺上る二帖半敷町６５５番地産経京都烏丸ビル５Ｆ,2016-10-03,その他の設立登記法人
医療法人創樹会,広島県広島市中区大手町２丁目１番４号広島本通マークビル５階,2016-10-03,その他の設立登記法人
医療法人山本整形外科,長崎県東彼杵郡川棚町下組郷３７５番地８,2016-10-03,その他の設立登記法人
医療法人社団たなしこどもクリニック,東京都西東京市芝久保町３丁目４番３０号ケルン田無１階Ｂ号室,2016-10-03,その他の設立登記法人
医療法人Ｏｐｅｎ　ＵＰ,広島県福山市東陽台１丁目１１番６号,2016-10-03,その他の設立登記法人
南砺森林資源利用協同組合,富山県南砺市上原字前島６００番地,2016-10-03,その他の設立登記法人
司株式会社,福島県いわき市鹿島町米田字塙２２番地の２７,2016-10-03,株式会社
合同会社ちよだ,東京都調布市布田１丁目２１番地７石井ビル１Ｆ,2016-10-03,合同会社
合同会社はやて企画,東京都立川市富士見町１丁目３５番１３号ライオンズスクエア立川レジデンス１４０２号,2016-10-03,合同会社
合同会社みやびソリューション,東京都調布市布田１丁目４５番地６,2016-10-03,合同会社
合同会社アイティーオー・プラス,東京都品川区大井１丁目４５番２号ジブラルタル大井ビル２階,2016-10-03,合同会社
合同会社アトリエｊｏｌｉ,福岡県福岡市西区愛宕１丁目１３－４,2016-10-03,合同会社
合同会社アパラティス,鳥取県米子市岡成１８６番地,2016-10-03,合同会社
合同会社アロハビズ,静岡県静岡市葵区古庄４丁目７番１７号,2016-10-03,合同会社
合同会社イルマーレ,兵庫県神戸市中央区中山手通７丁目５－８リビエール山手１Ｆ,2016-10-03,合同会社
合同会社エイチアイシー,東京都文京区湯島２丁目３１番２４－７０２号,2016-10-03,合同会社
合同会社エネヘリオス,福井県坂井市春江町中筋大手１番地２,2016-10-03,合同会社
合同会社オプス,東京都調布市緑ケ丘２丁目６４番地１３,2016-10-03,合同会社
合同会社オリエント１号,東京都中央区日本橋２丁目７番１号,2016-10-03,合同会社
合同会社カーサコネクト,福岡県福岡市南区長丘５丁目１番１５－３０４号,2016-10-03,合同会社
合同会社キヅナ・プロパティズ,東京都千代田区丸の内１丁目８番３号丸の内トラストタワー本館２０階,2016-10-03,合同会社
合同会社グットライフ,東京都町田市原町田４丁目２２番６号,2016-10-03,合同会社
合同会社グット企画殺陣軍団,東京都杉並区高円寺北１丁目１６番２号,2016-10-03,合同会社
合同会社グローバル動画,東京都江東区森下５丁目１４番１７号Ｒビル４０２号,2016-10-03,合同会社
合同会社ケイエイコーポレーション,神奈川県横浜市神奈川区羽沢南２丁目２５－２８大丸ハイツ１０７号室,2016-10-03,合同会社
合同会社スター・ウィンド,東京都昭島市玉川町４丁目１２番７号,2016-10-03,合同会社
合同会社パーチェサー,神奈川県平塚市横内４２７１番地の１０,2016-10-03,合同会社
合同会社ヒゲピカ,東京都渋谷区笹塚２丁目４番１－１１０５号,2016-10-03,合同会社
合同会社フューチャー・ウインド,東京都港区麻布永坂町１番地麻布パークサイドビル３階,2016-10-03,合同会社
合同会社ブラウズトレーディング,神奈川県横浜市青葉区あざみ野南１丁目９－６グリーンあざみ野１０１号,2016-10-03,合同会社
合同会社ルスカ,高知県高知市旭天神町９１番地,2016-10-03,合同会社
合同会社ヱル・ファーム,北海道石狩郡当別町西町５番地１,2016-10-03,合同会社
合同会社多賀時計サービス,千葉県市川市宮久保２丁目９番１０号,2016-10-03,合同会社
合同会社山内会計事務所,福岡県北九州市八幡西区千代ケ崎１丁目９番３１－２０５号,2016-10-03,合同会社
合同会社幸真興業,埼玉県川越市大字下赤坂６６９番地９,2016-10-03,合同会社
合同会社想い,福岡県北九州市八幡東区祇園２丁目９番５号,2016-10-03,合同会社
合同会社未来創造,東京都港区芝４丁目６番１６－１０１号,2016-10-03,合同会社
合同会社環境ケミカル研究所,東京都西東京市田無町１丁目２番２６－５０１号,2016-10-03,合同会社
合同会社穂刈工務店,千葉県四街道市栗山９５５番地１（バイオレットガーデンＡ１０１）,2016-10-03,合同会社
合同会社自転車クリニック,岐阜県安八郡神戸町大字丈六道２４番地１,2016-10-03,合同会社
合同会社荒磯,東京都中央区銀座４丁目１４番７－１３０２号,2016-10-03,合同会社
合同会社葵,福岡県大野城市栄町１丁目２番９－５０５アクセスシティ千歳Ⅱ,2016-10-03,合同会社
合同会社西崎陸運,沖縄県糸満市字潮平５９１番地の５,2016-10-03,合同会社
合同会社都市再生プロジェクト,東京都港区芝４丁目６番１６－１０１号,2016-10-03,合同会社
合同会社青空,神奈川県川崎市川崎区小川町１２番地１３,2016-10-03,合同会社
合同会社ＡＣ,東京都豊島区池袋３丁目４２番５号羅ホーム３０１号室,2016-10-03,合同会社
合同会社ＡＲＩＳ,岐阜県各務原市蘇原希望町２丁目２７番地ナビハイツ第４六軒北棟３０２,2016-10-03,合同会社
合同会社Ｂ＆Ｇ,東京都世田谷区北沢４丁目４番１３号,2016-10-03,合同会社
合同会社ＨＡＮＡプロジェクト,北海道富良野市字南扇山の１,2016-10-03,合同会社
合同会社Ｋ－３３企画,沖縄県中頭郡中城村字南上原５９６番地　１Ｆ,2016-10-03,合同会社
合同会社Ｋｅｙｃｈａｉｎ,東京都中央区日本橋茅場町１丁目６番１６号,2016-10-03,合同会社
合同会社ＬＩＦＥ,福岡県福岡市南区柏原１丁目１０番５号,2016-10-03,合同会社
合同会社ＬＵＣＩＡＮＯ,東京都港区南青山２丁目２番１５号ＷｉｎＡｏｙａｍａビルＵＣＦ９階,2016-10-03,合同会社
合同会社Ｌｅａ,東京都港区南青山２丁目２番１５号ＷｉｎＡｏｙａｍａビルＵＣＦ９階,2016-10-03,合同会社
合同会社Ｌｉｂｒａ,福岡県福岡市博多区住吉５丁目１４番１１,2016-10-03,合同会社
合同会社Ｌｏｔｕｓ,北海道札幌市南区川沿一条２丁目１番８号,2016-10-03,合同会社
合同会社ＭＩＨＩＲＯ,東京都港区赤坂６丁目１２番１１号赤坂甲陽ビル７階,2016-10-03,合同会社
合同会社ＭＲ,愛知県名古屋市中川区西伏屋３丁目４０１番地,2016-10-03,合同会社
合同会社ＮＩＣＯｔｔｏ,福島県福島市五月町３番３号,2016-10-03,合同会社
合同会社ＯＲＤＥＲ,東京都新宿区上落合２丁目２２番２３－７０８号,2016-10-03,合同会社
合同会社Ｑｕｒｔｏ,愛知県名古屋市中区栄２丁目１番１２号,2016-10-03,合同会社
四ッ葉合同会社,長崎県長崎市浜口町６番８号サーパス平和公園１０３,2016-10-03,合同会社
夢農家株式会社,岐阜県関市山田８７１番地３４,2016-10-03,株式会社
大原産和株式会社,東京都足立区関原２丁目１２番２０号,2016-10-03,株式会社
大和ハウスプロパティマネジメント株式会社,東京都千代田区飯田橋２丁目１８番２号,2016-10-03,株式会社
大新水道工業株式会社,大阪府守口市藤田町５丁目１５番,2016-10-03,株式会社
奥村板金株式会社,富山県下新川郡入善町青木８５５番地１,2016-10-03,株式会社
小林成建株式会社,千葉県茂原市本小轡１１１９番地６２,2016-10-03,株式会社
平田産業株式会社,大阪府茨木市宿久庄４丁目２番２３号,2016-10-03,株式会社
平興産株式会社,京都府京都市中京区御池通高倉西入高宮町２１９番地サニーフォレストビル４階,2016-10-03,株式会社
庚新合同会社,埼玉県入間郡毛呂山町大字長瀬２４９番地５,2016-10-03,合同会社
建満株式会社,静岡県静岡市葵区東千代田３丁目６番２１号,2016-10-03,株式会社
彦坂建設株式会社,愛知県名古屋市中川区山王１丁目６番１６号,2016-10-03,株式会社
成和電気工事株式会社,兵庫県神戸市兵庫区塚本通５丁目２番８号,2016-10-03,株式会社
新徳窓建株式会社,神奈川県横浜市瀬谷区二ツ橋町１０３番地,2016-10-03,株式会社
日本地熱資源開発株式会社,東京都江東区青海２丁目７番４号,2016-10-03,株式会社
日警サービス株式会社,京都府京都市右京区西京極北裏町１５番地１０進和ビル１階Ｂ,2016-10-03,株式会社
日豊合同会社,静岡県富士市中央町２丁目１０番７－１号,2016-10-03,合同会社
未来予報株式会社,東京都千代田区神田練塀町３番地富士ソフト秋葉原ビル１２階,2016-10-03,株式会社
東星株式会社,神奈川県横浜市中区山下町１１８番地１－２０３号,2016-10-03,株式会社
株式会社あおい,兵庫県たつの市誉田町広山５６１番地８,2016-10-03,株式会社
株式会社あかつきケア,神奈川県横浜市金沢区柴町３６７番地１－４－１０１,2016-10-03,株式会社
株式会社しんわ,福岡県築上郡吉富町大字今吉３３３番地２,2016-10-03,株式会社
株式会社せいこう,大阪府八尾市南木の本６丁目５７番地の１サンハイツ八尾南１－１０４号,2016-10-03,株式会社
株式会社そうじ,愛知県西春日井郡豊山町大字豊場字志水７０番地南西棟,2016-10-03,株式会社
株式会社だいだい,東京都千代田区麹町１丁目４番地,2016-10-03,株式会社
株式会社つくし,東京都台東区浅草２丁目４番１３号,2016-10-03,株式会社
株式会社ながさきサーチ,長崎県長崎市浜町２番１７号,2016-10-03,株式会社
株式会社ほほ笑み,福岡県北九州市小倉北区中津口１丁目１番３８号,2016-10-03,株式会社
株式会社まるいちカンパニー,兵庫県西宮市樋之池町１５番５－４０９号,2016-10-03,株式会社
株式会社みはら電器,愛媛県松山市下伊台町１３６９番地１８,2016-10-03,株式会社
株式会社みらいみらい,大阪府大阪市淀川区東三国３丁目５番７－１２０１号,2016-10-03,株式会社
株式会社やんちゃ,岐阜県飛騨市古川町是重２丁目２番８号,2016-10-03,株式会社
株式会社アイテラス,鹿児島県薩摩川内市樋脇町市比野８５６番地,2016-10-03,株式会社
株式会社アイディール,大阪府八尾市北本町２丁目１２番３０号,2016-10-03,株式会社
株式会社アイ・レボズ,北海道札幌市西区山の手七条７丁目１０－１,2016-10-03,株式会社
株式会社アクティブ,青森県青森市問屋町２丁目９番８号,2016-10-03,株式会社
株式会社アシストサービス,大阪府豊中市上新田１丁目２４番Ｆ－１３０３号,2016-10-03,株式会社
株式会社アップライトＴＶ,東京都中央区銀座７丁目１７番８号銀座松良ビル３階,2016-10-03,株式会社
株式会社アドバコーポレーション北関東,栃木県宇都宮市宝井町３３１番地３,2016-10-03,株式会社
株式会社アベイル,千葉県富里市七栄６４５番地１,2016-10-03,株式会社
株式会社アースエル,栃木県栃木市梓町２３６番地１,2016-10-03,株式会社
株式会社アール,千葉県旭市米込７３７番地,2016-10-03,株式会社
株式会社アールトレーディング,千葉県野田市古布内１４５０番地１６－１Ｆ,2016-10-03,株式会社
株式会社イデア・アソシエイツ,静岡県静岡市清水区草薙１丁目３番１５－１２０４号,2016-10-03,株式会社
株式会社イーアールデザイン,岐阜県各務原市川島小網町２１４６番地５６,2016-10-03,株式会社
株式会社ウィットセル,神奈川県横浜市青葉区桜台３８番地９,2016-10-03,株式会社
株式会社ウェイマーク,東京都世田谷区船橋５丁目３３番１９号,2016-10-03,株式会社
株式会社エアリアルラボ,東京都中央区銀座１丁目１６番７号,2016-10-03,株式会社
株式会社エスシーメンテ,静岡県静岡市駿河区新川２丁目１０番４６号,2016-10-03,株式会社
株式会社エバンス,群馬県前橋市粕川町月田６１３番地１,2016-10-03,株式会社
株式会社エンカウンター,福島県伊達市保原町高成田字高清山３０番地９,2016-10-03,株式会社
株式会社エーツーワークス,静岡県御殿場市中畑５２８番地の３９,2016-10-03,株式会社
株式会社オトボトケ,東京都港区六本木３丁目４番２号,2016-10-03,株式会社
株式会社オフィスＣ－１,東京都世田谷区上馬２丁目３４番１５－２０２号,2016-10-03,株式会社
株式会社オリエンス,大阪府大阪市中央区高津３丁目１６番２－４０３号,2016-10-03,株式会社
株式会社オーズ,埼玉県朝霞市根岸台１丁目５番２号,2016-10-03,株式会社
株式会社カイチ,和歌山県田辺市東山２丁目１３番１１号,2016-10-03,株式会社
株式会社キャッチャーライナー,東京都新宿区新宿５丁目７番１４号,2016-10-03,株式会社
株式会社キヨトクリテール,福岡県福岡市中央区清川１丁目７番１３号,2016-10-03,株式会社
株式会社クオーレ,神奈川県藤沢市藤沢９７６番地２秀明ビル４０５,2016-10-03,株式会社
株式会社クランクハイト,東京都渋谷区上原１丁目７番１９号千葉ビル＃１０１,2016-10-03,株式会社
株式会社クリアスカイ,東京都大田区南雪谷２丁目１４番６号柴崎ハウス２０１,2016-10-03,株式会社
株式会社グノシス,東京都千代田区九段南１丁目５番６号りそな九段ビルＫＳフロア,2016-10-03,株式会社
株式会社グラスアートエヌプラス,北海道小樽市色内２丁目１４番１０号,2016-10-03,株式会社
株式会社グランシード,東京都新宿区新宿３丁目１１番１２号永谷テイクエイト４０５号,2016-10-03,株式会社
株式会社グロウス,千葉県船橋市習志野台４丁目９－３ＮＫ習志野ビル２０３号室,2016-10-03,株式会社
株式会社ケアライフ新潟,新潟県新潟市西区松美台１６番２１号,2016-10-03,株式会社
株式会社ケイステック,神奈川県相模原市中央区田名３９９９番地１０,2016-10-03,株式会社
株式会社ケルク建装,大阪府枚方市招提元町２丁目３９番２０号,2016-10-03,株式会社
株式会社コノシュア,東京都台東区池之端２丁目３番２０－３０２号,2016-10-03,株式会社
株式会社コートラルジュ,千葉県千葉市花見川区花園２丁目１番３号,2016-10-03,株式会社
株式会社サイトウ,東京都練馬区富士見台１丁目１２番１１号,2016-10-03,株式会社
株式会社サジテール,大阪府大阪市西区京町堀１丁目１５番８号,2016-10-03,株式会社
