法人名,住所,設立日,法人種別
じてんしゃメリー株式会社,大阪府東大阪市岩田町５丁目１３番２３号,2025-03-03,株式会社
とす記帳代行サービス．ＴＫ合同会社,佐賀県鳥栖市田代外町６７８番地３,2025-03-03,合同会社
はちもく合同会社,神奈川県横浜市金沢区能見台東８番,2025-03-03,合同会社
まえみリンク株式会社,山口県萩市大字唐樋町６９番地１１,2025-03-03,株式会社
みつばちフェローシップ一般社団法人,東京都港区浜松町２丁目２番１５号浜松町ダイヤビル２Ｆ,2025-03-03,その他の設立登記法人
アクアトレーダーズ株式会社,千葉県市川市宝２丁目４番７号,2025-03-03,株式会社
イメージワン合同会社,東京都港区新橋２丁目２－５パイオニアビル３－４階,2025-03-03,合同会社
ウマミグローバルフーズ株式会社,熊本県熊本市中央区練兵町２８ハイムサンシャインＡ７０１,2025-03-03,株式会社
エスアイエスエス株式会社,埼玉県さいたま市浦和区本太３丁目１１番１６－１０号,2025-03-03,株式会社
エヴァーラスティング協同組合,福岡県糸島市神在西２丁目１２番１号,2025-03-03,その他の設立登記法人
オウルブリッジ株式会社,埼玉県川口市飯塚４丁目１５番２６－３０３号,2025-03-03,株式会社
オークツリー・キャピタル合同会社,東京都国立市西２丁目８番地の１２３,2025-03-03,合同会社
オーシャンリンクスジャパン株式会社,神奈川県横浜市港南区下永谷６丁目２４番４９－３０６号,2025-03-03,株式会社
ゴーイングウェル株式会社,広島県広島市佐伯区旭園２７番６号,2025-03-03,株式会社
サムライ・ハート合同会社,兵庫県姫路市安田４丁目４９－１１Ｈｉ２ビル３０４－１号室,2025-03-03,合同会社
シノラ合同会社,東京都港区東麻布２丁目１４－１１，ＨＯＹＯ東麻布３０１号室,2025-03-03,合同会社
シバロク合同会社,東京都町田市南成瀬１丁目３－２－２１８,2025-03-03,合同会社
ジェネシス株式会社,兵庫県神戸市中央区磯辺通１丁目１番１８号カサベラ国際プラザビル７０７号室,2025-03-03,株式会社
ジオネ・グローバル投資株式会社,東京都新宿区西新宿５丁目２番１号シティタワー新宿３００９号Ａ室,2025-03-03,株式会社
セロイ株式会社,三重県鈴鹿市東庄内町３９０５番地,2025-03-03,株式会社
タイムリープワンダーワークス株式会社,京都府京都市下京区中堂寺粟田町９１番地京都リサーチパーク,2025-03-03,株式会社
タマキケミカル株式会社,大阪府大阪市北区西天満２丁目６番８号堂島ビルデイング第４０２号ビー室,2025-03-03,株式会社
タレントラボ株式会社,埼玉県川口市芝富士２丁目４－１５ＰＬＥＮＤＹ蕨３０３,2025-03-03,株式会社
ディーテクノサービス株式会社,青森県八戸市根城１丁目２９番４号,2025-03-03,株式会社
トライアングル株式会社,千葉県船橋市日の出２丁目１４番８号,2025-03-03,株式会社
ナカテラス合同会社,兵庫県西宮市高座町５番３３号,2025-03-03,合同会社
バナナとフィッシュ株式会社,東京都中央区築地６丁目１７番１号,2025-03-03,株式会社
ビーハビット株式会社,東京都渋谷区渋谷２丁目１９番１５号宮益坂ビルディング６０９,2025-03-03,株式会社
ピーク・エナジー・ジャパン・インベストメント合同会社,東京都港区芝大門２丁目１２番３号共生ビル２号館７階,2025-03-03,合同会社
フィールド・ブリッジ合同会社,長野県諏訪郡原村１７２１７－１６２５,2025-03-03,合同会社
フォース株式会社,岐阜県可児市川合８４８番地１,2025-03-03,株式会社
フロンティア合同会社,東京都新宿区西新宿７丁目１０－１７ダイカンプラザＢ館３０４,2025-03-03,合同会社
マイデザイン株式会社,徳島県徳島市佐古一番町１３番６号,2025-03-03,株式会社
マグネティックフィールド株式会社,東京都港区六本木６丁目１２番３－１８０１号,2025-03-03,株式会社
メンテ株式会社,奈良県生駒市元町２丁目８番３９号,2025-03-03,株式会社
ユーデザイン合同会社,栃木県大田原市美原２丁目３３０５番地１１,2025-03-03,合同会社
ラィヒトゥーム株式会社,兵庫県尼崎市道意町６丁目２９番地の６,2025-03-03,株式会社
ライジング・サン合同会社,愛知県名古屋市北区成願寺１丁目６ザ・シーン城北Ａ１００９,2025-03-03,合同会社
リアクト合同会社,大阪府大阪市西区靱本町１丁目１０番４－７０１号,2025-03-03,合同会社
リベルテ社会保険労務士法人,東京都新宿区四谷３丁目１３番地ＳＥＡＢＩＲＤビル２階,2025-03-03,その他の設立登記法人
リーフ企画合同会社,東京都中野区弥生町４丁目２５番５－３０１号,2025-03-03,合同会社
ロンフレ合同会社,山口県下松市潮音町３丁目１２番５号パークハイツ２０６号,2025-03-03,合同会社
一般社団法人かがわ産アスパラガス普及協会,香川県仲多度郡多度津町大字葛原１５６２番地２,2025-03-03,その他の設立登記法人
一般社団法人こどもリビング,東京都渋谷区桜丘町１３－４アロマ桜丘３０１,2025-03-03,その他の設立登記法人
一般社団法人みなと００５,東京都港区虎ノ門３丁目２２番１０－２０１号,2025-03-03,その他の設立登記法人
一般社団法人みやまきりしま,鹿児島県霧島市国分中央３丁目７－１４－２,2025-03-03,その他の設立登記法人
一般社団法人エターナルフロー,神奈川県川崎市麻生区上麻生４丁目３１番７号,2025-03-03,その他の設立登記法人
一般社団法人コトづくり,福島県南相馬市小高区本町１丁目８７番地,2025-03-03,その他の設立登記法人
一般社団法人ゼウスＳＰＣホールディングス,東京都港区芝大門２丁目１２番３号共生ビル２号館７階,2025-03-03,その他の設立登記法人
一般社団法人ヘルスケアマネジメント協会,福井県福井市大宮３丁目２８番２５号,2025-03-03,その他の設立登記法人
一般社団法人下関医療圏医療連携推進機構,山口県下関市向洋町１丁目１３番１号,2025-03-03,その他の設立登記法人
一般社団法人個人事業主支援協会,東京都中央区日本橋室町１丁目１１番１２号日本橋水野ビル７階,2025-03-03,その他の設立登記法人
一般社団法人健康マネジメント協会,東京都荒川区西日暮里２丁目３６番１５号,2025-03-03,その他の設立登記法人
一般社団法人友輝,兵庫県姫路市夢前町菅生澗７４－３３,2025-03-03,その他の設立登記法人
一般社団法人岩手スポーツファンド,岩手県盛岡市流通センター北１丁目１２番５号,2025-03-03,その他の設立登記法人
一般社団法人日本ゆめイロ空間セラピー,福岡県福岡市南区老司３丁目３２－２０,2025-03-03,その他の設立登記法人
一般社団法人日本バーテックス協会,東京都渋谷区恵比寿南１丁目３番８号３階,2025-03-03,その他の設立登記法人
一般社団法人明日の政策研究会,東京都杉並区荻窪４丁目２番１６号,2025-03-03,その他の設立登記法人
一般社団法人東京中神教会,東京都昭島市中神町３丁目７番３４号,2025-03-03,その他の設立登記法人
一般社団法人Ｉ＆Ｏｔｈｅｒｓ,東京都千代田区二番町９番地３,2025-03-03,その他の設立登記法人
一般社団法人ＴＯＨＯ　ＬＦＣ,愛知県名古屋市名東区平和が丘３丁目１１番地愛知東邦大学内,2025-03-03,その他の設立登記法人
一般社団法人ＵｎｉｔＳａｐｐｏｒｏ７,北海道札幌市東区北八条東４丁目１番２０号２階,2025-03-03,その他の設立登記法人
三二一株式会社,東京都墨田区錦糸２丁目４番６号３１５,2025-03-03,株式会社
三光レーザー株式会社,岩手県一関市真柴字曽根田１０番地４,2025-03-03,株式会社
三岸株式会社,東京都板橋区仲宿６３番７号ＯＥＯｆｆｉｃｅＢｌｄｇ．３０６号,2025-03-03,株式会社
丸賀創業株式会社,千葉県船橋市湊町２丁目１１番１３号ライオンズ船橋シーズンフォート８０４,2025-03-03,株式会社
優勝株式会社,大阪府大阪市浪速区日本橋東２丁目４番２号ＭＯＯビル１階,2025-03-03,株式会社
元楽拓株式会社,大阪府大阪市西成区鶴見橋１丁目１０番１４号２０２室,2025-03-03,株式会社
再エネ塗装コンサルタント合同会社,愛知県名古屋市南区大同町３丁目４番地の６,2025-03-03,合同会社
出光アグリライフホールディングス株式会社,東京都千代田区大手町１丁目２番１号,2025-03-03,株式会社
加藤ケアプランハウス合同会社,愛知県知多郡阿久比町大字草木字上鶴若８番地,2025-03-03,合同会社
合同会社あゆみそう,茨城県古河市中田１３３６番地２,2025-03-03,合同会社
合同会社いつく,広島県廿日市市宮島町５８０,2025-03-03,合同会社
合同会社かがやき,大阪府大阪市西成区南津守７丁目１３番４６－１０１号,2025-03-03,合同会社
合同会社くろまめ,東京都渋谷区神山町１１番１５号神山フォレスト３０７,2025-03-03,合同会社
合同会社つくし,滋賀県彦根市芹橋２丁目１‐１７,2025-03-03,合同会社
合同会社はらっぱ,埼玉県比企郡吉見町大字地頭方６６７,2025-03-03,合同会社
合同会社ひつじ亭,北海道函館市松風町１０番６号,2025-03-03,合同会社
合同会社べべべ,東京都渋谷区神泉町１０番１５号アネックス神泉３０１,2025-03-03,合同会社
合同会社まる,東京都武蔵野市吉祥寺本町１丁目２０－１吉祥寺永谷シティプラザ内,2025-03-03,合同会社
合同会社みなと００５,東京都港区虎ノ門３丁目２２番１０－２０１号,2025-03-03,合同会社
合同会社むぎてん,北海道札幌市西区八軒八条西３丁目３番６号,2025-03-03,合同会社
合同会社アニマル,三重県津市白塚町５０３４番地１,2025-03-03,合同会社
合同会社イズクム,神奈川県横浜市南区白金町２丁目２８番地,2025-03-03,合同会社
合同会社ウィーン２５,東京都港区北青山２丁目１１番１０－４０３号,2025-03-03,合同会社
合同会社エム,東京都中央区勝どき４丁目６番１－３５２７号,2025-03-03,合同会社
合同会社エー・アール・エー,岡山県倉敷市宮前３８０番地５６,2025-03-03,合同会社
合同会社オールフローター,北海道登別市中央町２丁目１４－５,2025-03-03,合同会社
合同会社ガナウス,東京都渋谷区渋谷２丁目１９‐１５宮益坂ビルディング６０９,2025-03-03,合同会社
合同会社クオーレ,愛知県名古屋市中村区野田町字経田３３番地の１,2025-03-03,合同会社
合同会社サポート,山梨県甲府市飯田１丁目３－２８,2025-03-03,合同会社
合同会社サンセットオレンジ,愛知県小牧市大字本庄２５９７－３４９,2025-03-03,合同会社
合同会社スマイルＣ,広島県東広島市高屋高美が丘６丁目２番３号,2025-03-03,合同会社
合同会社タスカル,東京都江戸川区北小岩６丁目１０－４ハイブリッジ北小岩２０３,2025-03-03,合同会社
合同会社チェリッシュ,神奈川県横浜市港南区丸山台２丁目４０－２８－２,2025-03-03,合同会社
合同会社ティティ,大阪府大阪市生野区新今里４丁目１１－９－２Ｆ,2025-03-03,合同会社
合同会社ディーシック,福島県いわき市平赤井字田町１４,2025-03-03,合同会社
合同会社デントリペア関東,埼玉県さいたま市桜区田島１０丁目１８番１号５１５,2025-03-03,合同会社
合同会社トング,東京都港区虎ノ門４丁目１番３４－９０３号,2025-03-03,合同会社
合同会社ナンドデモ,東京都港区海岸２丁目３番７－２０１号,2025-03-03,合同会社
合同会社ニャンテック,茨城県稲敷郡阿見町南平台１丁目５－２１,2025-03-03,合同会社
合同会社ノース・ドーン,北海道札幌市西区発寒七条１１丁目３－１６－１０１,2025-03-03,合同会社
合同会社フォレスト・ベア・ライン,福岡県福岡市博多区博多駅前１丁目２３番２号ＰａｒｋＦｒｏｎｔ博多駅前１丁目５Ｆ－Ｂ,2025-03-03,合同会社
合同会社フューチャーライフ,東京都府中市東芝町１番地の６９プラウド府中東芝町３０６,2025-03-03,合同会社
合同会社ブル,愛知県安城市箕輪町唐生５５番地１,2025-03-03,合同会社
合同会社ブーストコーポレイト,愛知県名古屋市中村区名駅４丁目２４番５号第２森ビル４０１,2025-03-03,合同会社
合同会社プラムカンパニー,埼玉県さいたま市浦和区北浦和１丁目６番１５号,2025-03-03,合同会社
合同会社ベリーナイス,東京都三鷹市牟礼１丁目１４番２号,2025-03-03,合同会社
合同会社ムサシトレーディング,埼玉県坂戸市中富町４７番地６－１階,2025-03-03,合同会社
合同会社メイクイット,山口県山陽小野田市厚狭１丁目６番５号,2025-03-03,合同会社
合同会社メゾン・ヴィータＲＭ,東京都新宿区矢来町２１番地３アムール神楽坂３０１,2025-03-03,合同会社
合同会社ヤマト,京都府綾部市志賀郷町山崎１３番地の１,2025-03-03,合同会社
合同会社ユニコーンスター,東京都渋谷区道玄坂１丁目１０番８号渋谷道玄坂東急ビル２Ｆ－Ｃ,2025-03-03,合同会社
合同会社リアルエステートさくらの森,大分県大分市大字玉沢９６５－１,2025-03-03,合同会社
合同会社ロケガモン,東京都世田谷区桜上水４丁目１番,2025-03-03,合同会社
合同会社一商堂,千葉県柏市南逆井６丁目３４－３１,2025-03-03,合同会社
合同会社代行屋,大阪府大阪市北区長柄東２丁目８さざなみプラザ第８３６－１４０４,2025-03-03,合同会社
合同会社伏まち屋,京都府京都市伏見区京町２丁目２１５番地１,2025-03-03,合同会社
合同会社健将,埼玉県入間市宮寺３２１３－５コープ石川２０１号室,2025-03-03,合同会社
合同会社和,東京都新宿区新宿５丁目１１番３０号新宿第五葉山ビル４階,2025-03-03,合同会社
合同会社宮一ＦＰ事務所,群馬県高崎市寺尾町６４９番地２,2025-03-03,合同会社
合同会社山久電気サービス,茨城県つくば市小野崎１番地,2025-03-03,合同会社
合同会社川合設計,愛知県名古屋市天白区荒池１丁目１２０５番地,2025-03-03,合同会社
合同会社広英,大阪府東大阪市藤戸新田２丁目１０番２１号,2025-03-03,合同会社
合同会社愛和,福井県大野市吉野町１１７－２,2025-03-03,合同会社
合同会社拓実,東京都葛飾区四つ木１丁目１５番７号,2025-03-03,合同会社
合同会社新桜エステート,東京都練馬区桜台１丁目３０番６号,2025-03-03,合同会社
合同会社日ノ本,東京都港区麻布台３丁目１－４第二妹尾ビル４階,2025-03-03,合同会社
合同会社歩月映像,神奈川県横浜市神奈川区六角橋１丁目２６番６号,2025-03-03,合同会社
合同会社清水工芸,埼玉県さいたま市岩槻区大字釣上３３番地,2025-03-03,合同会社
合同会社萬代,広島県広島市西区高須３丁目４－１５,2025-03-03,合同会社
合同会社通,京都府京都市中京区壬生坊城町５５番地６,2025-03-03,合同会社
合同会社青空オフィス,神奈川県横浜市戸塚区舞岡町８１１,2025-03-03,合同会社
合同会社Ａ．Ｙ．Ａ,東京都港区北青山１丁目３－３三橋ビル３階,2025-03-03,合同会社
合同会社ＡＲＩＡカンパニー,大阪府大阪市北区梅田１丁目１－３大阪駅前第３ビル２９階１－１－１号室,2025-03-03,合同会社
合同会社ＡＳＩＴＡＢＡ,福岡県春日市昇町１丁目２６－１,2025-03-03,合同会社
合同会社Ａｉｌｕｘ,大阪府吹田市五月が丘東８番Ａ－８０７号,2025-03-03,合同会社
合同会社Ａｌｔａｉｒ＆Ｖｅｇａ,神奈川県横浜市旭区さちが丘５２番地１アークヒルズ山太４０５,2025-03-03,合同会社
合同会社ＢＥＡＭ,神奈川県大和市大和東１丁目４番１４号プラウド大和１３０７,2025-03-03,合同会社
合同会社ＢＥＡＳＴＩＥ,大阪府豊中市千里園３丁目６番２０号,2025-03-03,合同会社
合同会社Ｂｏｏｓｔｅｒ,福岡県糟屋郡篠栗町大字篠栗４１１５番地,2025-03-03,合同会社
合同会社Ｂｏｏｓｔｌａｂ,静岡県静岡市葵区両替町１丁目４番地の８佐乃春ビル２階,2025-03-03,合同会社
合同会社ＣＵＴＥ,東京都足立区綾瀬５丁目７番６－５０１号ベルシード綾瀬ｄｕｅ＃Ｒ,2025-03-03,合同会社
合同会社Ｃｌｅａｎｕｐ．,東京都港区新橋２丁目２－５新橋パイオニアビル３－４階,2025-03-03,合同会社
合同会社ＤＥＫ,東京都渋谷区渋谷２丁目１９番１５号宮益坂ビルディング６０９,2025-03-03,合同会社
合同会社Ｄａｗｎｉｓ,鹿児島県鹿児島市郡元２丁目１０番１７号,2025-03-03,合同会社
合同会社Ｅａｒｔｈ　Ｎｅｓｔ,東京都港区東麻布２丁目１２番２－４０３号,2025-03-03,合同会社
合同会社ＧＹＡＫＵＴＥＮ,東京都渋谷区神泉町１０‐１５,2025-03-03,合同会社
合同会社ＨＵＢ　ＩＳＬＡＮＤ,北海道札幌市南区澄川六条５丁目５番７号第１まるいマンション２０２号,2025-03-03,合同会社
合同会社ＩＳＩ,神奈川県相模原市南区上鶴間本町９丁目３４番１５号セザールつきみ野３０２号,2025-03-03,合同会社
合同会社Ｉｎｔｒｏ,東京都港区虎ノ門３丁目１９番１０,2025-03-03,合同会社
合同会社Ｋ１０,東京都世田谷区代田３丁目１６番７号,2025-03-03,合同会社
合同会社ＫＧ　Ｌｉｆｅ　Ｐａｒｔｎｅｒｓ,埼玉県さいたま市大宮区桜木町２丁目３番地大宮マルイ７Ｆ,2025-03-03,合同会社
合同会社Ｋｅｉ,千葉県八千代市萱田１６０９番地１－３１１,2025-03-03,合同会社
合同会社Ｌ．Ｎ．Ｄ,埼玉県さいたま市緑区大字中尾１３９８番地１７,2025-03-03,合同会社
合同会社Ｌｉｔｔｌｅ,岡山県倉敷市庄新町２番２－６号林原方,2025-03-03,合同会社
合同会社Ｍネクスト,秋田県秋田市泉南３丁目６‐２４,2025-03-03,合同会社
合同会社Ｍ．Ａ．Ｍ　ｎｏｍａｄ,京都府京都市伏見区日野野色町７番地９,2025-03-03,合同会社
合同会社Ｍ３,東京都杉並区上荻１丁目２１番３号,2025-03-03,合同会社
合同会社ＭＫ　ｃｒａｆｔ,神奈川県横浜市鶴見区本町通１丁目２番地ブックストーリー秋１００,2025-03-03,合同会社
合同会社ＭＳオレンジ,愛知県名古屋市昭和区檀溪通１丁目３６番地ハピネス川名１階,2025-03-03,合同会社
合同会社ＭＳＤ,東京都世田谷区下馬５丁目２９番１１号,2025-03-03,合同会社
合同会社ＭＳＤＡ,愛知県名古屋市千種区池上町１丁目５番地の９１,2025-03-03,合同会社
合同会社ＮＥＯ　ＣＡＲＲＹ,東京都渋谷区神泉町１０番１５号アネックス神泉３０１,2025-03-03,合同会社
合同会社ＮｅｘｕｓＬａｂ,神奈川県横浜市港北区大曽根１丁目５番１０－３１号,2025-03-03,合同会社
合同会社ＰｕｒＰＬｅＣＬａｓｓ,東京都渋谷区神泉町１４番１２号,2025-03-03,合同会社
合同会社ＲＩＤ,東京都中野区弥生町３丁目２４－６ホーエンビル３Ｆ,2025-03-03,合同会社
合同会社Ｒｉｎｇ,広島県安芸高田市美土里町横田４７６６‐１,2025-03-03,合同会社
合同会社Ｒｉｒｉ,岐阜県羽島郡岐南町上印食３丁目１５２番地の１,2025-03-03,合同会社
合同会社ＳＫ機工,宮城県遠田郡涌谷町小里字岸ケ森東２３０番地,2025-03-03,合同会社
合同会社ＳＵＮＲＩＳＥ,岩手県九戸郡洋野町種市第１地割１５番地６７,2025-03-03,合同会社
合同会社ＴＡＫＩＢＩ,大阪府大阪市福島区福島７丁目１－１０ＷｉＺｆｕｋｕｓｈｉｍａ２階,2025-03-03,合同会社
合同会社ＴＴ,東京都目黒区鷹番２丁目２０－１７ＴＳビル３０２,2025-03-03,合同会社
合同会社Ｕｌｕ,愛知県海部郡蟹江町城３丁目４０９,2025-03-03,合同会社
合同会社ＶＥＴＡＡＲ,東京都港区港南２丁目１１番１７号,2025-03-03,合同会社
合同会社Ｖｉｃｔｏｒ,東京都渋谷区本町３丁目３９‐１１Ｍ‐ｓｔａｔｉｏｎ西新宿１０１,2025-03-03,合同会社
合同会社ＹＯＵＲＳ,埼玉県川口市前川２丁目２６－１９－１０２,2025-03-03,合同会社
合同会社ＺｅｎＭａｓｈｉ,千葉県木更津市江川１５１７番地４３,2025-03-03,合同会社
合同会社ｅｓｓｅｎｔｉａｌｉｓ,東京都板橋区西台３丁目４０番１６号,2025-03-03,合同会社
合同会社ｎｕｅｖｅ,東京都杉並区高円寺南４丁目７番１３号仲野ビル２号室,2025-03-03,合同会社
合同会社ｏｏ,岐阜県可児市下恵土６０１３番地１,2025-03-03,合同会社
合同会社ｐｉｌｉｅｒ,神奈川県逗子市逗子７丁目３番５２号逗子向陽ビル３Ｆ,2025-03-03,合同会社
大利根マシナリー株式会社,栃木県足利市羽刈町５５６番地,2025-03-03,株式会社
大聖観光ＳＴＰ株式会社,愛知県名古屋市港区野跡２丁目３番６号,2025-03-03,株式会社
天海コーポレーション株式会社,神奈川県横浜市戸塚区矢部町１８１５－９,2025-03-03,株式会社
太平洋不動産開発株式会社,熊本県熊本市中央区新市街１番２８号ＴＨＥ・ＰＬＡＣＥ花畑ビル６Ｆ,2025-03-03,株式会社
姿勢美人株式会社,埼玉県春日部市備後東４丁目１０番３２号,2025-03-03,株式会社
宮城県仙台第三高等学校尚志会,宮城県仙台市宮城野区鶴ケ谷１丁目１９,2025-03-03,その他
富嶽カントリークラブ株式会社,静岡県静岡市清水区宍原１７８３番地の１,2025-03-03,株式会社
弁護士法人沖崎綜合法律事務所,東京都千代田区二番町８番地７二番町パークフォレスト１１階,2025-03-03,その他の設立登記法人
徳剛株式会社,大阪府大阪市城東区野江３丁目２５番６－５０３号室,2025-03-03,株式会社
徳天株式会社,大阪府大阪市城東区野江３丁目２５番６－５０１号室,2025-03-03,株式会社
徳山土地合同会社,東京都港区六本木３丁目２番１号六本木グランドタワー,2025-03-03,合同会社
日藥本舗株式会社,奈良県御所市大字茅原２２０番地の１,2025-03-03,株式会社
旭英株式会社,東京都港区芝浦４丁目２０番２－１２１５号芝浦アイランドブルームタワー,2025-03-03,株式会社
春暉株式会社,京都府京都市東山区弓矢町５０番地１・１０１室,2025-03-03,株式会社
曜紀株式会社,大阪府大阪市港区田中２丁目６番１－１４９－Ａ室,2025-03-03,株式会社
有限会社眞下建築,埼玉県秩父郡皆野町大字皆野２５３９番地の６,2025-03-03,有限会社
服部株式会社,大阪府大阪市中央区南新町１丁目３番６号,2025-03-03,株式会社
朗尤照明株式会社,大阪府大阪市東住吉区杭全１丁目１７番１７号Ｔｉｎａ天王寺東ビル４０２号室,2025-03-03,株式会社
東海サンダー株式会社,大阪府東大阪市若江西新町４丁目１０番３５号,2025-03-03,株式会社
東猯穴土地区画整理組合,茨城県牛久市ひたち野西１丁目１４番１号　プリマベーラ２０６号室,2025-03-03,その他
株式会社あいじアグリサービス,愛媛県北宇和郡鬼北町大字西野々３３１番地,2025-03-03,株式会社
株式会社おにぎり道嬉酔,埼玉県川口市西川口１丁目２６番１８号須田ビル１０３,2025-03-03,株式会社
株式会社さかい,東京都調布市上石原１丁目３番地５グランドールＧＴ１１０,2025-03-03,株式会社
株式会社さくらプランニング,東京都墨田区墨田５丁目５番２号Ｒビル墨田３階１２号室,2025-03-03,株式会社
株式会社つむぎ,千葉県柏市南柏１丁目５番１４号,2025-03-03,株式会社
株式会社よすが,東京都港区南青山２丁目２番１５号,2025-03-03,株式会社
