法人名,住所,設立日,法人種別
溝手社会保険労務士法人,岡山県岡山市北区大供２丁目１番１号ＨＡＳＰＡＬＩＢＬ４０１号,2021-08-05,その他の設立登記法人
瀬戸内自然生活株式会社,愛媛県松山市北条辻１３８８番地,2021-08-05,株式会社
特定非営利活動法人はーもにープロジェクト,新潟県新潟市西蒲区赤鏥９４２番地８,2021-08-05,その他の設立登記法人
特定非営利活動法人まんまる,茨城県水戸市東台２丁目８番２号,2021-08-05,その他の設立登記法人
特定非営利活動法人みらプロ,兵庫県加西市玉丘町２１７番地の２,2021-08-05,その他の設立登記法人
特定非営利活動法人弦楽アンサンブルすみれ,群馬県前橋市問屋町１丁目１０番地６ＨＳビル３Ｆ,2021-08-05,その他の設立登記法人
特定非営利活動法人ＦＬＥＸ,青森県三沢市大字三沢字下久保５７番地１４９号,2021-08-05,その他の設立登記法人
特定非営利活動法人ＨＴＬＶ‐１全国ねっと,兵庫県神崎郡福崎町東田原１０３８番地５６,2021-08-05,その他の設立登記法人
特定非営利活動法人ＪＥＦＡ国際社会貢献人材教育支援協会,大阪府大阪市中央区心斎橋筋１丁目２番２５号,2021-08-05,その他の設立登記法人
異業種事業協同組合リンク,群馬県伊勢崎市境栄１８３番地２,2021-08-05,その他の設立登記法人
神戸ハリマ防災株式会社,兵庫県神戸市西区長畑町２番地の５ハイツ長畑３０２号,2021-08-05,株式会社
税理士法人プロスタッフ和,群馬県甘楽郡甘楽町大字白倉６１番地１,2021-08-05,その他の設立登記法人
税理士法人ベストサポート,静岡県富士市中里４４３番地の７,2021-08-05,その他の設立登記法人
税理士法人ロジエンス,愛知県名古屋市守山区小幡南２丁目１４番地１７号グランコンフォール１０１号,2021-08-05,その他の設立登記法人
稲垣祭儀株式会社,東京都葛飾区堀切６丁目２７番１３号,2021-08-05,株式会社
窓ライフ株式会社,山口県防府市大字植松４８９番地の２,2021-08-05,株式会社
絆商会株式会社,茨城県石岡市旭台１丁目１２番５３号フェニックスビル２０１,2021-08-05,株式会社
華美株式会社,大阪府大阪市中央区北久宝寺町１丁目７番９号,2021-08-05,株式会社
蒼翠合同会社,徳島県徳島市名東町１丁目３９５番地の８,2021-08-05,合同会社
農事組合法人うえきた,秋田県大仙市太田町斉内字狐塚１４９番地,2021-08-05,その他の設立登記法人
鎌倉橋コンサルティング株式会社,東京都千代田区内神田２丁目７番７号新内神田ビル３階,2021-08-05,株式会社
雅寧商事株式会社,京都府京都市左京区一乗寺地蔵本町３４番地２ファミールメゾンたけはし４Ｃ,2021-08-05,株式会社
鴨池株式会社,東京都千代田区外神田４丁目９番２号千住ビル５,2021-08-05,株式会社
１８合同会社,兵庫県神戸市中央区相生町１丁目１番１６号,2021-08-05,合同会社
２７８４合同会社,長野県安曇野市三郷温３０３５番地１７,2021-08-05,合同会社
ＡＩＣＲＯ株式会社,東京都千代田区一番町６番地相模屋本社ビル７Ｆ,2021-08-05,株式会社
ＡＬ－ＫＨＡＩＲ　ＬＡＳＡＮＩ　ＴＲＡＤＩＮＧ株式会社,茨城県古河市諸川１１３４番地３０,2021-08-05,株式会社
ＡＳＯＫＡ　ＡＵＴＯ　ＴＲＡＤＩＮＧ,千葉県佐倉市大篠塚７７３番地Ｃ－１,2021-08-05,外国会社等
Ａｃｃｕｒａｔｉｏ合同会社,神奈川県秦野市渋沢２丁目４１番１５号,2021-08-05,合同会社
Ａｆｒｏ　ｓｐｉｃｅ株式会社,東京都新宿区新宿１丁目１４番２号,2021-08-05,株式会社
ＡｉＯ　ＪＡＰＡＮ株式会社,広島県府中市栗柄町３１０７番地５,2021-08-05,株式会社
Ａｌｔｉｓｓｉｍｏ株式会社,愛知県名古屋市中区錦１丁目５番１１号名古屋伊藤忠ビル４階,2021-08-05,株式会社
ＢＩＢＬＩＣＫ株式会社,東京都世田谷区桜新町２丁目５－２１桜新町さざんかハウス２０１,2021-08-05,株式会社
ＢＬＡＣＫ　ＳＨＥＥＰ合同会社,東京都墨田区京島１丁目２２番１３号アーデル曳舟パークビュータワー２０２,2021-08-05,合同会社
Ｂｅｙｏｎｄ　Ｂｏｒｄｅｒｓ株式会社,東京都港区南青山４丁目１７番３３号グランカーサ南青山２Ｆ,2021-08-05,株式会社
Ｂｙｆｕｌｌ株式会社,大阪府八尾市南木の本４丁目３９番地の１,2021-08-05,株式会社
ＣＩＥ東京国際投資株式会社,東京都江戸川区東小岩５丁目１２番１９－１１０３号,2021-08-05,株式会社
ＤＳ　Ｋｏｊｉｍａｃｈｉ一般社団法人,東京都港区虎ノ門５丁目１番４号,2021-08-05,その他の設立登記法人
ＤＳ　Ｋｏｊｉｍａｃｈｉ合同会社,東京都港区虎ノ門５丁目１番４号,2021-08-05,合同会社
Ｄｒｉｖｅｎｅｔｓ株式会社,東京都港区赤坂２丁目１１番７号ＡＴＴ新館１１階Ｍａｚａｒｓ・Ｊａｐａｎ株式会社内,2021-08-05,株式会社
Ｅａｒｔｈｔｒａｅ株式会社,長野県飯山市南町１２番地９,2021-08-05,株式会社
Ｅｎｇｉｎｅｅｒ　Ｃｏｍｍｕｎｉｔｙ株式会社,東京都千代田区二番町１１－９,2021-08-05,株式会社
Ｅｘパートナーズ株式会社,東京都豊島区西池袋２丁目２７番８号パールメゾンサカエ１０１号,2021-08-05,株式会社
Ｆｏｒｂｉｃ　ＨＤ株式会社,福島県郡山市大町１丁目１７番５号,2021-08-05,株式会社
Ｆｕｎ　Ｌｉｆｅ　Ｐｌａｎｎｉｎｇ株式会社,東京都渋谷区神宮前６丁目２３－４桑野ビル２Ｆ,2021-08-05,株式会社
Ｇ．Ｔ．ｃｕｒｌ株式会社,山口県山口市中央５丁目８番７号,2021-08-05,株式会社
ＧＩＡ　ＰＨＡＴ合同会社,東京都荒川区荒川３丁目６４番３メゾン・ド・レカン１０４号,2021-08-05,合同会社
ＧＭ株式会社,栃木県塩谷郡高根沢町宝石台３丁目１２番地４,2021-08-05,株式会社
ＧＲＥＥＮ　ＦＯＲＥＳＴＥＲＳ応援合同会社,東京都目黒区洗足２丁目１３番３号,2021-08-05,合同会社
ＧＵＲＵ　ＴＲＡＤＩＮＧ株式会社,東京都江戸川区大杉２丁目９－６,2021-08-05,株式会社
ＨＡＩ　ＡＵ株式会社,岐阜県中津川市太田町１丁目５番３４号,2021-08-05,株式会社
ＨｙＥｎｇ株式会社,兵庫県明石市二見町南二見１番地,2021-08-05,株式会社
ＩＮＰ合同会社,東京都目黒区上目黒３丁目１３番１１号,2021-08-05,合同会社
ＪＥＣＴ８１合同会社,東京都港区南青山２丁目２番１５号,2021-08-05,合同会社
Ｋ－プランニング合同会社,山形県東田川郡三川町大字横山字不動野６１番地３,2021-08-05,合同会社
ＫＡＴエンジニアリング株式会社,東京都板橋区板橋１丁目４３番１１号ＫＡＷＡＮＯビル２０２,2021-08-05,株式会社
ＫＨＡＮ　ＴＲＡＤＩＮＧ株式会社,栃木県小山市大字萱橋８１４番地,2021-08-05,株式会社
ＫＩＫＩＭＯＮＯ株式会社,沖縄県うるま市字具志川２９９５－２,2021-08-05,株式会社
ＬＣ国際株式会社,大阪府大阪市西成区梅南２丁目４番２７－４０１号,2021-08-05,株式会社
ＬＬＢ合同会社,神奈川県川崎市川崎区四谷上町１２番２号,2021-08-05,合同会社
ＬＹＳＯＮ株式会社,東京都葛飾区立石８丁目１７番１－５０４号,2021-08-05,株式会社
Ｌａｕｎｄｒｙ’ｓ本田洗機株式会社,京都府京都市山科区西野山百々町２３０番地１２,2021-08-05,株式会社
ＬｉｂｅｒｔｙＰａｒａｄｉｓｅ合同会社,滋賀県近江八幡市佐波江町２４２番地１,2021-08-05,合同会社
ＭＥＲＧＥ株式会社,神奈川県横浜市磯子区杉田６丁目１７番５号,2021-08-05,株式会社
ＭＩＹＡＢＩ．ｎｅｔ株式会社,岡山県岡山市南区妹尾５０１－３－２Ｆ,2021-08-05,株式会社
Ｍｉｎｉ－Ｌａｂ株式会社,神奈川県厚木市中町３丁目１８番５号ソーケン本厚木ビル４Ｆ,2021-08-05,株式会社
Ｎカンパニー株式会社,東京都世田谷区玉川１丁目１５番２号,2021-08-05,株式会社
ＮＩＲＭＡＬ株式会社,千葉県白井市折立５４８番地の１,2021-08-05,株式会社
ＯＮＧ　ＣＲＥＡＴＯＲＳ合同会社,東京都港区赤坂２丁目１２番２０号ディア・シティ赤坂東館１０４,2021-08-05,合同会社
ＰＲＩＮＣＩＰＬＥ株式会社,大阪府吹田市山田南３１番１２号,2021-08-05,株式会社
Ｒ－ＦＡＣＴＯＲＹ株式会社,茨城県牛久市牛久町８８１番地３,2021-08-05,株式会社
ＲＩＤＧＥ株式会社,大阪府箕面市船場東３丁目２番３５－２２０２号,2021-08-05,株式会社
ＲＪＫＰ合同会社,神奈川県横浜市栄区小菅ケ谷１丁目１４番１８号カメリア１０２,2021-08-05,合同会社
ＳＡＪＩ　ＭＯＴＯＲ,千葉県佐倉市大篠塚１３３２番地Ａ－１,2021-08-05,外国会社等
ＳＧＳ　ＣＡＲＥ　ＦＡＣＩＬＩＴＹ合同会社,大阪府大阪市中央区高津１丁目４番１２－４０１号,2021-08-05,合同会社
ＳＨＡＰＥ　ＷＯＲＫＳ合同会社,東京都港区麻布十番２丁目１３番７号プラシーボ麻布３０１,2021-08-05,合同会社
ＳＩＫＡ　ＡＵＴＯ株式会社,滋賀県大津市荒川５７０番２,2021-08-05,株式会社
ＳＱＵＡＲＥ株式会社,神奈川県横浜市都筑区茅ケ崎中央２４番４号第六セキビル７０２,2021-08-05,株式会社
ＳＴ・ＧＲＩＴ合同会社,東京都世田谷区等々力４丁目４番９号,2021-08-05,合同会社
ＳＵＥＴＳＵＧＵ合同会社,神奈川県横浜市栄区飯島町１０８４番地３,2021-08-05,合同会社
ＳＵＮＲＩＳＥ合同会社,千葉県八千代市八千代台東１丁目４１－８コーポ・サンライズ１０３,2021-08-05,合同会社
Ｓｅｃｏｎｄ　Ｃｈａｎｃｅ株式会社,茨城県水戸市梅香２丁目２－４５,2021-08-05,株式会社
Ｓｍａｒｔ　Ｆｉｔ株式会社,滋賀県近江八幡市安土町東老蘇１３５０番地１０,2021-08-05,株式会社
ＳｕｇａｒＭ株式会社,東京都文京区本郷５丁目１６番３号,2021-08-05,株式会社
Ｔ’ｓ－Ｆｉｎｅ株式会社,愛知県春日井市上条町１０丁目１７４番地１,2021-08-05,株式会社
Ｔアセット株式会社,兵庫県神戸市中央区江戸町１０４番地江戸町１０４ビル４階,2021-08-05,株式会社
ＴＡＭＩＫＡ株式会社,静岡県熱海市咲見町７番３２号ユニオンビル１階,2021-08-05,株式会社
ＴＡＲＯ’Ｚ株式会社,福井県福井市足羽２丁目１０番８号,2021-08-05,株式会社
ＴＫインベスト合同会社,兵庫県たつの市誉田町片吹１３６番地１,2021-08-05,合同会社
ＴＫクレアーレ株式会社,東京都渋谷区千駄ヶ谷３丁目３番８号第５スカイビル３０７号室,2021-08-05,株式会社
ＴＭエステート株式会社,岐阜県大垣市新開町９７番地６,2021-08-05,株式会社
ＴＭＲグループ株式会社,東京都江東区常盤２丁目４番３号,2021-08-05,株式会社
ＴＯＮＥ株式会社,福岡県福岡市中央区大名１丁目１３番１６号ＴＥＮＪＩＮアーク弐番館,2021-08-05,株式会社
ＴＲＵＳＴＯＣＫ合同会社,東京都文京区小石川５丁目３４－１２Ｓ－ＲＥＳＩＤＥＮＣＥ文京小石川９０１,2021-08-05,合同会社
Ｔｈｅ　Ｇｒｅｅｎ＆Ｃｏ．株式会社,兵庫県尼崎市東塚口町１丁目１１番１－１１７号,2021-08-05,株式会社
Ｕｐ　ｔｏ　ｙｏｕ株式会社,長崎県北松浦郡佐々町中川原免１３０番地４,2021-08-05,株式会社
ＷＪプラニング株式会社,東京都国分寺市泉町１丁目５番１６号,2021-08-05,株式会社
ＷＪ株式会社,山口県下関市伊倉新町２丁目２番５号ニュー・ベェルウェル１０８号,2021-08-05,株式会社
ＹＫエステート株式会社,滋賀県大津市下阪本５丁目８番１８号２０１,2021-08-05,株式会社
ＹＫ・サクセス株式会社,千葉県松戸市五香西２丁目３２番２号グランシャリオⅠ（１０４）,2021-08-05,株式会社
ｃ－パステル株式会社,高知県高知市北秦泉寺７４６番地１６,2021-08-05,株式会社
ｃｉａｏ　ｅｍ　ｃａｆｅ合同会社,東京都小平市花小金井南町１丁目２７番１１号,2021-08-05,合同会社
ｃｏｎｔｅ合同会社,東京都調布市布田２丁目３８番地１マートルコート調布第２、５０９,2021-08-05,合同会社
ｅｉｄ株式会社,京都府京都市右京区西院日照町１１２－１１３,2021-08-05,株式会社
ｅｌｅ　ｅｙｅ株式会社,神奈川県平塚市北金目２丁目２０番４号,2021-08-05,株式会社
ｋｉｋｕ　ＤＥＳＩＧＮ株式会社,三重県桑名市南魚町３５番地２,2021-08-05,株式会社
ｎｉｃｏ株式会社,福島県須賀川市森宿字坪ノ内１６１番地７７,2021-08-05,株式会社
ｐｏｒｔｅｅ株式会社,東京都世田谷区三宿２丁目１６番１０－４１６号,2021-08-05,株式会社
あいす合同会社,神奈川県横浜市都筑区北山田５丁目７番１－１２０１号,2021-08-06,合同会社
あだち紙器株式会社,愛知県名古屋市中村区城屋敷町２丁目４９－１,2021-08-06,株式会社
いもり企画株式会社,東京都新宿区西新宿１丁目２５番１号新宿センタービル４９階,2021-08-06,株式会社
お茶の水ヘルスケア合同会社,東京都千代田区外神田２丁目３－１－１１０６,2021-08-06,合同会社
しものせき海響ふく協同組合,山口県下関市彦島西山町５丁目６番４３号,2021-08-06,その他の設立登記法人
つたわる株式会社,埼玉県所沢市中新井５丁目１番５－５０１号,2021-08-06,株式会社
みらくる株式会社,長野県上田市秋和７２５番地２,2021-08-06,株式会社
めだか不動産合同会社,高知県高知市長浜１６７１番地６西側,2021-08-06,合同会社
もっとネット合同会社,大阪府大阪市平野区長吉長原２丁目３番１７号,2021-08-06,合同会社
るる合同会社,東京都港区白金台５丁目１４番１号白金台アパートメント３０６,2021-08-06,合同会社
アイアンクラフト株式会社,栃木県那須塩原市北和田５７３番地３,2021-08-06,株式会社
アイキ建設株式会社,東京都小平市小川町２丁目１８１４－１０４,2021-08-06,株式会社
アクセス行政書士法人,東京都小平市仲町３５０番地１サンワード宮北Ａ１０６号室,2021-08-06,その他の設立登記法人
アジアウェルトレーディング合同会社,東京都渋谷区神宮前３丁目１５番８号,2021-08-06,合同会社
アスベスト調査分析株式会社,東京都港区新橋４丁目２７番７号田村町Ｓｈｉｎｓｈｏｄｏｈビル４階,2021-08-06,株式会社
アップリンク株式会社,神奈川県横浜市青葉区鉄町２３１９番地４,2021-08-06,株式会社
アペックストラストパートナーズ株式会社,大阪府大阪市北区紅梅町１番１８号,2021-08-06,株式会社
アルバテック株式会社,埼玉県川口市大字榛松７６７番地の１,2021-08-06,株式会社
アーキビルドイーズ株式会社,北海道旭川市東四条９丁目２番１３号,2021-08-06,株式会社
インベスト通産株式会社,埼玉県上尾市小泉６丁目１９番１４,2021-08-06,株式会社
イーエム断熱合同会社,神奈川県相模原市南区南台１丁目６番２号ムネタケマンション３０８,2021-08-06,合同会社
イートラスト株式会社,長崎県佐世保市木場田町８番１６号,2021-08-06,株式会社
エスケーシステム株式会社,神奈川県藤沢市湘南台１丁目１４番地の１６イーグル湘南２０７号,2021-08-06,株式会社
エムズウェルネスパートナーズ合同会社,兵庫県神戸市兵庫区西上橘通２丁目８番１２号ＶＩＬＬＡＭＩＮＡＴＯＧＡＷＡ５０１,2021-08-06,合同会社
エーエルティープラス株式会社,東京都大田区山王２丁目１番８号,2021-08-06,株式会社
エー・ティー・エイチ株式会社,東京都江東区青海１丁目１番２０号,2021-08-06,株式会社
オンサ株式会社,東京都港区浜松町２丁目２番１５号浜松町ダイヤビル２Ｆ,2021-08-06,株式会社
ガトス合同会社,東京都杉並区永福３丁目３２番１８号カサ・ガトス永福Ａ,2021-08-06,合同会社
キートス合同会社,神奈川県横浜市金沢区並木２丁目６番６－３０５号,2021-08-06,合同会社
クオシア株式会社,東京都中央区銀座２丁目９番１６号１Ｆ,2021-08-06,株式会社
クラスタス合同会社,千葉県千葉市緑区鎌取町１２１番地６３,2021-08-06,合同会社
クレバー機械株式会社,大阪府大阪市西区北堀江３丁目１０番１７号,2021-08-06,株式会社
グッドライトホーム株式会社,福岡県福岡市東区三苫５丁目１番７７号,2021-08-06,株式会社
グローバル人材活用協同組合,山口県宇部市相生町４番１２号宇部ビル３階３－Ｃ,2021-08-06,その他の設立登記法人
ゴトウホーム株式会社,福岡県北九州市八幡東区祇園原町１３番２１号,2021-08-06,株式会社
サステナブルホールディングス株式会社,東京都港区六本木５丁目２番１号,2021-08-06,株式会社
サンクトアセット合同会社,愛知県名古屋市千種区城山町２丁目１９番地８,2021-08-06,合同会社
サングレイス株式会社,青森県三戸郡五戸町字追分５番地２４,2021-08-06,株式会社
シュエット株式会社,岐阜県岐阜市太郎丸北浦１番地２３,2021-08-06,株式会社
ジェイシナジー株式会社,埼玉県川口市大字源左衛門新田１１番地の１,2021-08-06,株式会社
スマイルライフサービス株式会社,兵庫県加古川市野口町長砂２２０番地の１８,2021-08-06,株式会社
セーフティネットクリエイト株式会社,大阪府泉大津市北豊中町２丁目９番１９号,2021-08-06,株式会社
ダヴィンチ株式会社,埼玉県さいたま市緑区東浦和１丁目２１番地３,2021-08-06,株式会社
チェーンブリッジ株式会社,東京都中央区銀座１丁目２２番１１号,2021-08-06,株式会社
チック株式会社,神奈川県川崎市麻生区百合丘１丁目１番２６－２０３号,2021-08-06,株式会社
トミポーツ合同会社,東京都葛飾区青戸４丁目１番１９－６０３号,2021-08-06,合同会社
ナニワビィクトリー株式会社,大阪府大阪市淀川区野中南２丁目２番１６－７０１号,2021-08-06,株式会社
ネオテクノシーク株式会社,大阪府東大阪市今米１丁目２番４８号松栄ビル５Ｆ,2021-08-06,株式会社
ハッシュキューインターナショナル合同会社,茨城県土浦市右籾２９５４番地２０２号,2021-08-06,合同会社
ハピネスサービス株式会社,兵庫県姫路市青山南２丁目２番２２号,2021-08-06,株式会社
ハヤヒ株式会社,東京都渋谷区神宮前６丁目２８番９号東武ビル６Ｆ,2021-08-06,株式会社
ハーバー税理士法人,兵庫県神戸市中央区東川崎町１丁目７番４号,2021-08-06,その他の設立登記法人
ビレッジアップドリーム株式会社,埼玉県川口市差間３丁目１０番１０号リーリエ２０３号,2021-08-06,株式会社
ピグレット株式会社,東京都港区南青山４丁目１７番１３号,2021-08-06,株式会社
ファミリータイズ合同会社,千葉県館山市八幡６６０－１レオネクストオリーブガーデン２０６,2021-08-06,合同会社
フォルテック株式会社,大阪府箕面市粟生間谷西５丁目３番１号,2021-08-06,株式会社
フタバ国際交流協同組合,福島県郡山市小原田１丁目３７３番地１メゾン黄２０１号室,2021-08-06,その他の設立登記法人
ベベ電気設備株式会社,兵庫県神戸市西区伊川谷町潤和３１１番地の４５,2021-08-06,株式会社
マサキ内装株式会社,神奈川県横浜市保土ケ谷区狩場町３３４番地７７,2021-08-06,株式会社
マタゴウリ合同会社,北海道虻田郡倶知安町北一条西１丁目１番地１山崎ビル３階,2021-08-06,合同会社
ミント株式会社,神奈川県横浜市中区元浜町４丁目３５番地９０６号,2021-08-06,株式会社
メイホウ工業株式会社,兵庫県明石市明南町１丁目３－７－Ｂ１０１,2021-08-06,株式会社
メディカルアイソトープ・プライムジャパン株式会社,東京都港区白金１丁目１５番２９号,2021-08-06,株式会社
メロディー株式会社,東京都練馬区石神井町８丁目２３番７号,2021-08-06,株式会社
モイトゥール株式会社,東京都港区赤坂２丁目１４番２７国際新赤坂ビル東館Ｂ１階１０９区外Ｔ－ＴＩＭＥ内,2021-08-06,株式会社
ライズコンサルティング合同会社,栃木県大田原市薄葉２１７９番地１９,2021-08-06,合同会社
リアライズホーム株式会社,東京都江戸川区西葛西１丁目２番４号,2021-08-06,株式会社
リジッドシステム株式会社,東京都千代田区岩本町１丁目２番１３号渡東ビルディング３階,2021-08-06,株式会社
リバイロ合同会社,埼玉県草加市北谷３丁目２８番１１号,2021-08-06,合同会社
リンクエッジ株式会社,東京都港区三田１丁目３番３７号板金会館２階,2021-08-06,株式会社
ルーツ・ホールディングス株式会社,愛知県名古屋市中区栄２丁目２番２３号,2021-08-06,株式会社
レアヴォルケデザインワークス株式会社,東京都港区浜松町２丁目２番１５号浜松町ダイヤビル２Ｆ,2021-08-06,株式会社
ロイヤル株式会社,兵庫県洲本市物部３丁目３番９号,2021-08-06,株式会社
ロサ・フェア株式会社,東京都中央区銀座１丁目２２番１１号銀座大竹ビジデンス２階,2021-08-06,株式会社
ロハスクリエイション合同会社,埼玉県坂戸市大字厚川５０－４,2021-08-06,合同会社
ワンネス株式会社,香川県高松市鬼無町是竹１１１番地３,2021-08-06,株式会社
一兆商事合同会社,埼玉県戸田市下前１丁目１１番２０号,2021-08-06,合同会社
一般社団法人あゆ実,大阪府寝屋川市成田東が丘３３番１５号,2021-08-06,その他の設立登記法人
一般社団法人おひとりさまリーガルサポート,兵庫県神戸市中央区多聞通３丁目２番９号甲南スカイビル４Ｆ,2021-08-06,その他の設立登記法人
一般社団法人つるかわ子どもこもんず,東京都町田市能ヶ谷１丁目８番８号パレス・リッツ６０９,2021-08-06,その他の設立登記法人
一般社団法人まさ企画,埼玉県戸田市上戸田５丁目２２番８－３０３号,2021-08-06,その他の設立登記法人
一般社団法人みらい創造あぐり,宮城県栗原市一迫真坂字清水田崎４番地,2021-08-06,その他の設立登記法人
一般社団法人アンカー,東京都中野区東中野２丁目６番２４号,2021-08-06,その他の設立登記法人
一般社団法人オーセンティックライフ協会,東京都中央区銀座１丁目２２番１１号銀座大竹ビジデンス２階,2021-08-06,その他の設立登記法人
一般社団法人サポートホールディングスＪＲＥアルバ,東京都千代田区丸の内３丁目１番１号東京共同会計事務所内,2021-08-06,その他の設立登記法人
一般社団法人ドコデモヒロバ,埼玉県大里郡寄居町大字鉢形９１９番地１,2021-08-06,その他の設立登記法人
一般社団法人ニート引きこもり自立支援協会,神奈川県横浜市青葉区美しが丘１丁目１３番地１０吉村ビル１０７号,2021-08-06,その他の設立登記法人
一般社団法人ネイルサロン経営協会,神奈川県横浜市中区野毛町２丁目１０１番地１,2021-08-06,その他の設立登記法人
一般社団法人ハウス４７,東京都千代田区丸の内３丁目１番１号東京共同会計事務所内,2021-08-06,その他の設立登記法人
一般社団法人ルックアット,奈良県天理市二階堂上ノ庄町３８８番地２,2021-08-06,その他の設立登記法人
一般社団法人京都バリアフリーツアーセンター,京都府京都市南区東九条南烏丸町３７番地３,2021-08-06,その他の設立登記法人
一般社団法人危機対策機構,沖縄県中頭郡中城村字南上原７１７番地１－１Ｆ,2021-08-06,その他の設立登記法人
