法人名,住所,設立日,法人種別
株式会社関戸無線電機,広島県福山市大門町３丁目２６番３５号,2021-11-05,株式会社
株式会社関野建設,静岡県熱海市下多賀４６４番地の１２,2021-11-05,株式会社
株式会社陽だまり,香川県高松市由良町５３７番地１５,2021-11-05,株式会社
株式会社高來想建,神奈川県小田原市早川１３７６番地の１,2021-11-05,株式会社
株式会社鳶矢崎架設,群馬県館林市下三林町８４６番地の５,2021-11-05,株式会社
株式会社鶴田池ゴルフセンター,大阪府堺市西区草部１６３０番地,2021-11-05,株式会社
株式会社鹿行Ａ．Ｒ．Ｑ．Ｃ．,茨城県鹿嶋市大字宮中２２９番地７エムエフビル,2021-11-05,株式会社
株式会社麦,兵庫県加古郡稲美町国岡１０４８番地の２,2021-11-05,株式会社
株式会社１Ｈ　ｂａｓｉｘ,東京都江東区新大橋２丁目１６番１１－３０２号,2021-11-05,株式会社
株式会社２４－７デザインｓ,茨城県結城市大字結城５８６０番地３８,2021-11-05,株式会社
株式会社２ｊｋ,東京都中央区銀座５丁目９番１７号銀座あづまビル２階,2021-11-05,株式会社
株式会社６ＲＯＫＵ,北海道帯広市西六条南３１丁目５番地２,2021-11-05,株式会社
株式会社８８Ｐｌｕｓ,大阪府大阪市西成区花園南１丁目３番１１号花園ビル４階,2021-11-05,株式会社
株式会社Ａ‐ＳＴＥＰ,愛知県名古屋市中区錦２丁目１１番２７号,2021-11-05,株式会社
株式会社Ａ　ＷＯＯＤ　ＷＯＲＫＳ,東京都八王子市東中野２００１番地３０,2021-11-05,株式会社
株式会社Ａ・セキュリティ,大阪府豊中市服部西町２丁目７番３０号,2021-11-05,株式会社
株式会社Ａ・Ｋ・Ｉ,兵庫県伊丹市北伊丹３丁目１６８番地,2021-11-05,株式会社
株式会社Ａ＆Ｇ　ＢＬＯＯＭ,神奈川県横浜市都筑区茅ケ崎東４丁目１２番１１号,2021-11-05,株式会社
株式会社Ａ－ＴＥＱ,神奈川県厚木市飯山３２９３番地８,2021-11-05,株式会社
株式会社ＡＣホーム,愛知県名古屋市名東区延珠町５０１番地大島ビル１０３号室,2021-11-05,株式会社
株式会社ＡＩＤ　ＰＲＥＣＩＯＵＳ,静岡県沼津市市道町８－５１,2021-11-05,株式会社
株式会社ＡＩＲＡＹ－ＡＰＡＲＴＭＥＮＴ,東京都葛飾区東金町１丁目３８番３号ＮＥＷ金町ビル２Ｆ,2021-11-05,株式会社
株式会社ＡＪ,岐阜県大垣市中川町２丁目１０５２番地３,2021-11-05,株式会社
株式会社ＡＫ　ＳＫＹ,千葉県松戸市牧の原４３５番地３６,2021-11-05,株式会社
株式会社ＡＬＩ　ＴＲＡＤＩＮＧ　ＣＯＭＰＡＮＹ,栃木県栃木市岩舟町新里１３０４番地,2021-11-05,株式会社
株式会社ＡＭＣリテール,東京都千代田区大手町１丁目４番２号,2021-11-05,株式会社
株式会社ＡＯＩ,岡山県岡山市北区中央町１‐２６‐２０３,2021-11-05,株式会社
株式会社ＡＳＡＬＩＮＫＳ,大阪府箕面市桜井１丁目２６番３７号,2021-11-05,株式会社
株式会社ＡＳＧ,沖縄県中頭郡嘉手納町字水釜５４８番地３,2021-11-05,株式会社
株式会社ＡＴ,東京都渋谷区代官山町１７番１号代官山アドレス３１０６,2021-11-05,株式会社
株式会社ＡｉｒＡｄｍｉｎ８,東京都品川区南大井３丁目２０番５号,2021-11-05,株式会社
株式会社Ａｎｓｗｅｒ,埼玉県所沢市金山町１７番１１号アーバンリゾート２号館２０３号室,2021-11-05,株式会社
株式会社Ａｒｒｏｗｓ,東京都港区高輪１丁目１７番１５－８０４号,2021-11-05,株式会社
株式会社Ａｒｒｏｗｓ,大阪府大阪市住吉区苅田１丁目１４－２４,2021-11-05,株式会社
株式会社ＢＡＣＫ　ＤＯＯＲ,大阪府大阪市此花区西九条１丁目２９番２号５０１,2021-11-05,株式会社
株式会社ＢＡＳＳＡ,東京都江東区富岡１丁目２５番４号ニックハイム八幡１０２,2021-11-05,株式会社
株式会社ＢＬＡＣＫ　ＡＰＲＯＮ,北海道新冠郡新冠町字北星町２番地の４４,2021-11-05,株式会社
株式会社ＢＬＵＥ　ＳＯＬ,東京都東久留米市新川町１丁目９番２３－１０１号,2021-11-05,株式会社
株式会社ＢＯＵＲＧＥＯＩＳ,東京都渋谷区宇田川町３番７号ヒューリック渋谷公園通りビル５Ｆ,2021-11-05,株式会社
株式会社ＢＲＩＤＧＥＡ,福岡県福岡市中央区舞鶴３丁目２番３５号,2021-11-05,株式会社
株式会社Ｂｅｉｎｇ　ｗｉｔｈ　ｙｏｕ,兵庫県神戸市中央区加納町６丁目３番１－２５０２号,2021-11-05,株式会社
株式会社ＢｅｎｉＷｅｌｌ,兵庫県神戸市中央区浪花町５６起業プラザひょうご内,2021-11-05,株式会社
株式会社ＢｇＡ,神奈川県海老名市中央１丁目１６番３１号Ａ＆ＮＩビル１Ｆ,2021-11-05,株式会社
株式会社Ｂｌｕｅ　ｐｅａｒ,奈良県奈良市芝辻町３丁目９－１５,2021-11-05,株式会社
株式会社ＣＢモンスター,愛知県名古屋市東区東桜２丁目２０番１０号ベストハイツ東桜２０１号,2021-11-05,株式会社
株式会社ＣＧＩ,埼玉県川口市大字里４００番地の１,2021-11-05,株式会社
株式会社ＣＯＵＲＡＭＯＮ,大阪府摂津市鳥飼西５丁目４番６号３Ｆ,2021-11-05,株式会社
株式会社ＣＯＶＥＲ,広島県広島市中区竹屋町１番２４号,2021-11-05,株式会社
株式会社ＣＲＥＡＳ,大阪府大阪市中央区瓦町４丁目６番８号ローレルタワー御堂筋本町９０５号,2021-11-05,株式会社
株式会社ＣＲＩ＆Ｃ,沖縄県那覇市久茂地１丁目１番地１－９階,2021-11-05,株式会社
株式会社ＣＳパートナーズ,大阪府岸和田市北町８番２２号,2021-11-05,株式会社
株式会社ＣＹＣＯＯ　ＪＡＰＡＮ,東京都台東区台東４丁目１４番１１号６Ｆ,2021-11-05,株式会社
株式会社Ｃｅｄａｒ＆Ｃｏ．,静岡県御前崎市池新田４１６０番地の６,2021-11-05,株式会社
株式会社Ｃｌａｉｒ　Ｐａｒｔｎｅｒｓ,東京都新宿区喜久井町５０番地更輝夏目坂マンション３０２,2021-11-05,株式会社
株式会社Ｄ‐ｐｌｕｓ,滋賀県草津市野路町６８３番地６－２０２,2021-11-05,株式会社
株式会社ＤＡＷＮ,大阪府池田市石橋１丁目２３番５号,2021-11-05,株式会社
株式会社ＤＬＤ,東京都千代田区九段北１丁目１３番５号,2021-11-05,株式会社
株式会社ＤｅｍｉＣｏ,大阪府大阪市平野区加美北８丁目１番４号,2021-11-05,株式会社
株式会社Ｅ－ＨＯＭＥ,埼玉県富士見市東みずほ台４丁目１２－７スカイピアみずほ台１０２号,2021-11-05,株式会社
株式会社ＥＸＰＥＲＩＥＮＣＥ,東京都多摩市聖ヶ丘２丁目４５番地の５,2021-11-05,株式会社
株式会社Ｅｍｔｒａｎｓｅ,東京都八王子市南町９番１０－４０６号,2021-11-05,株式会社
株式会社ＥｘｏｔｉｃＣａｒｓ．ｊｐ,神奈川県横浜市青葉区美しが丘３丁目５４番地３,2021-11-05,株式会社
株式会社Ｆ－ｓｔｙｌｅ,東京都世田谷区南烏山５丁目１８番１５号ＡＮＯＡＴＨ南烏山４Ｆ,2021-11-05,株式会社
株式会社ＦＫＬＩＮＥ,山口県下関市豊田町大字稲見４４２番地,2021-11-05,株式会社
株式会社ＦＯＣＵＳ,福岡県福岡市南区大橋２丁目１２番１２号,2021-11-05,株式会社
株式会社ＦＳＤＬ,大阪府吹田市南吹田５丁目２９番１８号第二田辺ビル,2021-11-05,株式会社
株式会社ＦＴＴパートナーズ,福岡県福岡市中央区薬院２丁目３番４１号,2021-11-05,株式会社
株式会社Ｆａｎ　ｆｏｏｄ,愛知県瀬戸市東寺山町１６８番地,2021-11-05,株式会社
株式会社Ｆｉｌａｍｅｎｔクリエイティブ,東京都港区北青山２丁目１２番３３号ＡＣＮ青山テラス１階,2021-11-05,株式会社
株式会社Ｆｉｎａｎｃｉａｌ　Ｐｌａｔｆｏｒｍ　Ｈｕｂ,東京都世田谷区北沢１丁目１５－５カスタリア北沢４０１,2021-11-05,株式会社
株式会社Ｆｉｖｅ－Ａｒｃ,愛知県名古屋市中区栄５丁目２１番２６号,2021-11-05,株式会社
株式会社Ｆｒｅｅｋ,神奈川県茅ヶ崎市堤２２０４番地５,2021-11-05,株式会社
株式会社Ｆｒｅｉｇｈｔ,埼玉県桶川市末広２丁目８番２１号,2021-11-05,株式会社
株式会社Ｆｒｕｏｒ,北海道旭川市永山二条４丁目２番３号,2021-11-05,株式会社
株式会社Ｆｕ‐ＳｅｎＳＥ,埼玉県春日部市中央１丁目５８番地１３,2021-11-05,株式会社
株式会社ＦｕｌｕｌＵ,愛知県名古屋市中川区中郷５丁目９２番地の１,2021-11-05,株式会社
株式会社Ｇ・Ｆ,香川県さぬき市長尾西２３５７番地１,2021-11-05,株式会社
株式会社ＧＣ,福岡県福岡市中央区地行浜２丁目２番５号,2021-11-05,株式会社
株式会社ＧＣｐｒｏｍｏｔｅ,大阪府大阪市中央区南本町４丁目５番７号東亜ビル５０２号室,2021-11-05,株式会社
株式会社ＧＲテック,福岡県福岡市西区拾六町５丁目４３１番地,2021-11-05,株式会社
株式会社Ｇａｉａｎｉｘｘ,東京都中央区日本橋蛎殻町１丁目８番５号,2021-11-05,株式会社
株式会社ＧｏｏＦｙぱんち,愛知県名古屋市守山区川東山３６０３番地,2021-11-05,株式会社
株式会社Ｇｏｏｄｗａｖｅ,神奈川県藤沢市片瀬海岸３丁目２３－１８－２１６,2021-11-05,株式会社
株式会社Ｈ－ＰＰＹ,大阪府大阪市中央区久太郎町４丁目１番３号大阪センタービル６Ｆ－１６３,2021-11-05,株式会社
株式会社Ｈ．Ｓ．Ｍ,大阪府大阪市淀川区宮原１丁目８番２７－１１０３号,2021-11-05,株式会社
株式会社Ｈ２,茨城県ひたちなか市大字稲田７４２番地２Ｆ,2021-11-05,株式会社
株式会社Ｈ２ｍ,東京都港区東麻布２丁目１５－５アルカディア東麻布Ｂ１,2021-11-05,株式会社
株式会社ＨＡＫＵＡＩ,神奈川県藤沢市大庭５４１６番地の２３,2021-11-05,株式会社
株式会社ＨＡＮＴＯ,茨城県つくば市飯田２６３番地１,2021-11-05,株式会社
株式会社ＨＥＲＯＳ,京都府京都市下京区小坂町１番地１,2021-11-05,株式会社
株式会社ＨＩＢＩＫＩ工務店,大阪府大阪市鶴見区中茶屋１丁目１２番４５号,2021-11-05,株式会社
株式会社Ｉ－Ｔｅｃｈ,東京都千代田区内幸町２丁目１番１号,2021-11-05,株式会社
株式会社Ｉ．Ｋ,千葉県市原市能満１１番地５,2021-11-05,株式会社
株式会社ＩＤＫ,東京都西多摩郡瑞穂町むさし野２丁目５９番地１１,2021-11-05,株式会社
株式会社ＩＭＧ,東京都立川市富士見町２丁目２２番１７号フラット２２３－１０１号,2021-11-05,株式会社
株式会社ＩＭＰＲＯＴＥＣ,大阪府大阪市北区梅田１丁目２番２号大阪駅前第２ビル２階５－６号室,2021-11-05,株式会社
株式会社ＩＴＥＴＯＲｉ,東京都台東区竜泉３丁目１２番７－２０３号ヴェレーナ東京入谷Ⅲ,2021-11-05,株式会社
株式会社ＩＸＩＴ,埼玉県新座市野寺４丁目１番９号,2021-11-05,株式会社
株式会社Ｉｎ　Ｓｔｙｌｅ　Ｔｒａｄｉｎｇ,東京都新宿区百人町２丁目２番１号カイダ第７ビル４Ｆ,2021-11-05,株式会社
株式会社Ｊ－ｓｔｙｌｅ,兵庫県神戸市中央区中山手通２丁目１３番１２号ランドマークビル神戸４Ｂ,2021-11-05,株式会社
株式会社ＪＯ建設,神奈川県小田原市南鴨宮１丁目１１番１号,2021-11-05,株式会社
株式会社ＪＳ工務店,埼玉県坂戸市千代田２丁目１４番１１号,2021-11-05,株式会社
株式会社ＪＴＯ,埼玉県三郷市中央１丁目２番地１ザ・ライオンズ三郷中央Ｂ棟７１０,2021-11-05,株式会社
株式会社ＪＵＮ,兵庫県姫路市飾磨区上野田３丁目１１９番地,2021-11-05,株式会社
株式会社Ｊｕｎｏ　ｉｎｔｅｒｎａｔｉｏｎａｌ,神奈川県横浜市金沢区柴町３６８番地,2021-11-05,株式会社
株式会社Ｋ‐ｌ’ａｖａｎｃｅ,東京都板橋区仲宿４９－７,2021-11-05,株式会社
株式会社Ｋ．Ｏ．ＬＯＧＩ,千葉県野田市柳沢６４番地の５６,2021-11-05,株式会社
株式会社Ｋ．ＳＴＯＮＥ,広島県山県郡安芸太田町大字津浪１１番地１,2021-11-05,株式会社
株式会社Ｋ．Ｔ．Ｍ,兵庫県姫路市砥堀１１３５番地１８,2021-11-05,株式会社
株式会社Ｋ３キャラクターズ,東京都新宿区余丁町８番１０号ライオンズマンション２０３,2021-11-05,株式会社
株式会社ＫＡＣ,大阪府堺市東区北野田８６９番地１６,2021-11-05,株式会社
株式会社ＫＡＩＺＥＮ,東京都目黒区中目黒２丁目１０番８号－１２０２,2021-11-05,株式会社
株式会社ＫＥネット,大阪府大阪市中央区内本町１丁目２番１４号,2021-11-05,株式会社
株式会社Ｋａｒｅｉｎａ,兵庫県姫路市久保町８０番地,2021-11-05,株式会社
株式会社ＬＥＧＡＲＥＡ,東京都中央区日本橋２丁目１番３号,2021-11-05,株式会社
株式会社ＬＩＡＮＡＨ,鹿児島県鹿児島市西谷山２丁目１９番１３号,2021-11-05,株式会社
株式会社ＬＩＭＩＴＬＥＳＳ,神奈川県横浜市青葉区しらとり台３０－６－Ｃ,2021-11-05,株式会社
株式会社ＬＯＧＩＥＸ,千葉県富津市二間塚１６６６番地１,2021-11-05,株式会社
株式会社ＭＡ２ｓｔｕｄｉｏ,沖縄県那覇市久茂地２丁目２番２号２Ｆ,2021-11-05,株式会社
株式会社ＭＫ　Ｌｉｎｋｓ,神奈川県相模原市緑区東橋本２丁目３５番５号,2021-11-05,株式会社
株式会社ＭＫＲ,福井県福井市東森田１丁目７０６番地,2021-11-05,株式会社
株式会社ＭＫＳ,熊本県山鹿市古閑１０３３番地２,2021-11-05,株式会社
株式会社ＭＯＣＡ－ｗｅｌｆａｒｅ,大阪府富田林市南旭ケ丘町１７番３号,2021-11-05,株式会社
株式会社ＭＹＡＲＴ,東京都港区北青山２丁目７－２０猪瀬ビル２Ｆ,2021-11-05,株式会社
株式会社Ｍａｄｏｎｎａ　Ｌｉｌｙ,東京都新宿区新宿１丁目３６－２新宿第七葉山ビル３階,2021-11-05,株式会社
株式会社Ｍｉｒｒｉｓｏライフ,北海道札幌市西区西野九条４丁目６番４３号,2021-11-05,株式会社
株式会社Ｎ－ｃｒａｆｔ,埼玉県さいたま市北区本郷町５３０番地６,2021-11-05,株式会社
株式会社ＮＥＷＳＡＧＩＮＧ,東京都文京区目白台１丁目９番４号,2021-11-05,株式会社
株式会社ＮＥＸ,埼玉県白岡市荒井新田６５番地,2021-11-05,株式会社
株式会社ＮＨＨＭ,東京都千代田区神田淡路町１丁目２番地１武蔵野ビル４階,2021-11-05,株式会社
株式会社ＮＯＢＵ’Ｓ　Ｃｏｍｐａｎｙ,神奈川県三浦郡葉山町一色９４３番地１ＡＴＥＬＩＥＲ９４３Ａ棟１階,2021-11-05,株式会社
株式会社ＮＳ,東京都港区赤坂４丁目１４番１４－３８０２号,2021-11-05,株式会社
株式会社ＮＴＨ,兵庫県姫路市飾磨区加茂２７５番地５－１Ｆ,2021-11-05,株式会社
株式会社Ｎｅｘｔ　ｅｎｃｏｕｎｔ,茨城県つくばみらい市板橋２６８４番地３,2021-11-05,株式会社
株式会社ＯＧ,北海道函館市昭和２丁目６番１３号,2021-11-05,株式会社
株式会社ＯＮＯＤＥＲＡユニバーサルキッチン,東京都千代田区大手町１丁目１番３号,2021-11-05,株式会社
株式会社ＯＲＣａ,大阪府大阪市北区天神橋７丁目１５番５号好きやねん大阪ビル５階,2021-11-05,株式会社
株式会社ＯＴＳ,東京都港区浜松町２丁目２番１５号,2021-11-05,株式会社
株式会社Ｏｎｅ‐Ｓｔｏｐ,佐賀県佐賀市鍋島町大字八戸溝２４８番地９－５０３,2021-11-05,株式会社
株式会社ＰＡＲＫ　ＳＴＵＤＩＯ,福岡県福岡市中央区警固１丁目３番７号,2021-11-05,株式会社
株式会社ＰＬＡＹ　ＣＲＡＦＴ,大阪府枚方市川原町１１－１０大京第一ビル１０１,2021-11-05,株式会社
株式会社ＰＯＬＡＲＩＳ,石川県金沢市小立野１丁目５－１小立野センチュリー４０６号室,2021-11-05,株式会社
株式会社ＰＰＬ,大阪府大阪市阿倍野区長池町５番２号,2021-11-05,株式会社
株式会社ＰＲＯ　ＨＯＬＤＩＮＧＳ,広島県福山市南蔵王町６丁目１８番４０号,2021-11-05,株式会社
株式会社ＰＵＲＯＧＵＲＥＳＵ,香川県高松市屋島西町２４９８番地１１,2021-11-05,株式会社
株式会社Ｐｅａｃｅ,埼玉県さいたま市見沼区春岡１丁目３０番地６―１０２号,2021-11-05,株式会社
株式会社ＰｉａＤＯＯＲ,東京都国立市富士見台３丁目１９－４,2021-11-05,株式会社
株式会社Ｐｏｒｕｌｅｔ,東京都港区南青山２丁目２９番９,2021-11-05,株式会社
株式会社Ｐｒｏｊｅｃｔ　Ｎｙｘ,東京都世田谷区経堂５丁目３番２６号,2021-11-05,株式会社
株式会社ＲラインＥＸＰＲＥＳＳ,山梨県甲斐市富竹新田７５７番地５２,2021-11-05,株式会社
株式会社Ｒ．Ｋ．Ｅ,埼玉県川越市大字砂新田３７８番地６５,2021-11-05,株式会社
株式会社ＲＥＣＯ,東京都中央区銀座１丁目１２番４号Ｎ＆ＥＢＬＤ．７階,2021-11-05,株式会社
株式会社ＲＥＩＺＩＮ　ＦＯＲＥＸ,東京都中央区銀座１丁目２２番１１号,2021-11-05,株式会社
株式会社ＲＵ,京都府京都市右京区西院坤町６１番地都興業ビル５階,2021-11-05,株式会社
株式会社Ｒａｉｎｅｌ,大阪府大阪市北区天神橋７丁目１５番５号好きやねん大阪ビル５階,2021-11-05,株式会社
株式会社Ｒａｔｉｏｎａｌｅ,千葉県松戸市八ケ崎７丁目３番地の１ハイランドテラス八ケ崎３１０号,2021-11-05,株式会社
株式会社ＲｅＬＩＦＥ,神奈川県相模原市南区当麻１１９２番地の２,2021-11-05,株式会社
株式会社Ｒｅａｌ,東京都港区西新橋２丁目３４番８－３０６号,2021-11-05,株式会社
株式会社Ｒｅｂｏｒｎ,大阪府大阪市阿倍野区昭和町２丁目１２番２６号プレミスト１３０３,2021-11-05,株式会社
株式会社Ｒｅｌｉｅｆ,京都府京都市下京区月鉾町５９エリッツ四条烏丸ビル９０２,2021-11-05,株式会社
株式会社Ｒｅｎ　Ｃｌａｉｒ,福岡県福岡市博多区比恵町１８番２３号,2021-11-05,株式会社
株式会社Ｒｉｃｅ　Ｖｉｌｌａｇｅ,東京都町田市中町１丁目２１番１１号中一ビル４Ｆ,2021-11-05,株式会社
株式会社Ｒｕｏｓ,大阪府大阪市中央区南船場４丁目１４番１号,2021-11-05,株式会社
株式会社Ｓ．Ｓマネジメント福井,福井県福井市和田東２丁目１７１１番地,2021-11-05,株式会社
株式会社Ｓ１８－８工房,東京都大田区東糀谷６丁目９番１－４１３号,2021-11-05,株式会社
株式会社ＳＡＫＵＭＯＢＡ,東京都千代田区神田松永町１０番地１,2021-11-05,株式会社
株式会社ＳＤ,山口県岩国市山手町１丁目２番６号,2021-11-05,株式会社
株式会社ＳＤＢＭ,大阪府吹田市長野西１０番１６号,2021-11-05,株式会社
株式会社ＳＦＳ,宮崎県延岡市桜ケ丘１丁目２６番地１２,2021-11-05,株式会社
株式会社ＳＨＩＮＮ,東京都港区赤坂６丁目１９－４１,2021-11-05,株式会社
株式会社ＳＨＯ‐ＧＲＯＵＰ,兵庫県加古郡播磨町南大中２丁目７番４３号,2021-11-05,株式会社
株式会社ＳＨＯＺＯ　ＴＯＫＹＯ,東京都港区北青山３丁目１０番１５号,2021-11-05,株式会社
株式会社ＳＫホールディングス,兵庫県西宮市南郷町３番２０号,2021-11-05,株式会社
株式会社ＳＭＣ,福島県いわき市渡辺町上釜戸字瀬峰７４,2021-11-05,株式会社
株式会社ＳＯＵＮＤ　ＰＯＲＴ,東京都港区白金６丁目５番２－１５０２号,2021-11-05,株式会社
株式会社ＳＳＫ,東京都港区新橋５丁目１２番１１号天翔オフィス新橋５丁目４０４号,2021-11-05,株式会社
株式会社ＳＴＡＲ　ＤＡＨＬＩＡ,埼玉県蕨市中央１丁目２番６号,2021-11-05,株式会社
株式会社ＳＴＡＹＬＥＳＳ,静岡県富士市水戸島本町１０番２５号ダイアパレスステーションサイド富士６０３号,2021-11-05,株式会社
株式会社ＳＴＩデザインオフィス,兵庫県神戸市中央区相生町５丁目１５番３－１００２号,2021-11-05,株式会社
株式会社ＳＴＵＤＩＯ　ＳＯＴＡ,東京都大田区大森西１丁目８番２２号,2021-11-05,株式会社
株式会社ＳＵＰＥＲＭＡＲＫＥＴ,東京都渋谷区千駄ヶ谷４丁目５番１１号,2021-11-05,株式会社
株式会社Ｓａｌｏｎ　ｄｅ　Ｙｕｋａ,埼玉県川越市大字鯨井新田３３番地１常松ビル１０１,2021-11-05,株式会社
株式会社ＳｉＲＯ,東京都武蔵野市吉祥寺本町１丁目１０番５号吉祥寺公園通りビル６Ｆ,2021-11-05,株式会社
株式会社Ｓｐｉｎ　Ｐｌｕｓ,千葉県千葉市緑区おゆみ野５丁目２４番地６,2021-11-05,株式会社
株式会社Ｓｕｎ’ｓ　Ｔｈｉｎｋ,東京都足立区梅島１丁目９番１３号中村ビル,2021-11-05,株式会社
株式会社Ｔスチール,埼玉県新座市馬場３丁目８番２３－８号,2021-11-05,株式会社
株式会社Ｔ＆Ｇ　Ｃｏｎｓｕｌｔｉｎｇ,東京都港区海岸３丁目１２番４－１１０７号,2021-11-05,株式会社
株式会社Ｔ．Ｏ．２９,東京都府中市四谷１丁目２番地の２１,2021-11-05,株式会社
株式会社ＴＡО,宮城県栗原市高清水大沢６番地４,2021-11-05,株式会社
株式会社ＴＦＳホールディングス,神奈川県横浜市西区浅間町１丁目１３番地３,2021-11-05,株式会社
株式会社ＴＧＣ,佐賀県鳥栖市酒井西町８０４番地１,2021-11-05,株式会社
株式会社ＴＫＤ,福岡県北九州市小倉北区高坊２丁目９番２５－２０４号,2021-11-05,株式会社
株式会社ＴＫＺ,東京都調布市布田１丁目４５番地６ライオンズマンション調布駅前６０５号室,2021-11-05,株式会社
株式会社ＴＭＤ,神奈川県藤沢市善行坂１丁目１番２２－２０９号,2021-11-05,株式会社
株式会社ＴＯＲＥＡ　ＮＡＴＵＲＡ,神奈川県川崎市多摩区生田２丁目３番４号,2021-11-05,株式会社
株式会社ＴＳＵＫＡＳＡホールディングス,埼玉県川越市大字藤間１５１番地７,2021-11-05,株式会社
株式会社Ｔｉｇｒｅ,東京都港区芝大門２丁目１３番１号滝沢ビル２階,2021-11-05,株式会社
株式会社Ｔｏｔａｌ　Ｓｕｐｐｏｒｔ　Ｍａｎａｇｅｍｅｎｔ,神奈川県横浜市保土ケ谷区星川１丁目４番１３号,2021-11-05,株式会社
株式会社Ｔｒａｎｓｐｏｒｔ　Ｗｕｎｄｅｒ,福岡県福岡市中央区那の津３丁目４６番６号,2021-11-05,株式会社
株式会社ＵＮＣ,大阪府大阪市中央区難波千日前４番１７号,2021-11-05,株式会社
株式会社ＵＮＩＳＯＮ,大阪府寝屋川市河北西町２番２０号,2021-11-05,株式会社
株式会社ＶＡＳＥ,愛知県清須市朝日愛宕１３８番地,2021-11-05,株式会社
株式会社ＶＩＡＳ,東京都立川市柴崎町３丁目１４番２１号,2021-11-05,株式会社
株式会社ＶＯＧＵＥ　ＥＮＴＥＲＴＡＩＮＭＥＮＴ,大阪府大阪市福島区福島６丁目１１番１３－３０５号,2021-11-05,株式会社
株式会社Ｖｉｓｕａｌｌｙ,栃木県宇都宮市桜４丁目１７番１４号,2021-11-05,株式会社
株式会社ＷＡＴＥＲＴＲＥＥ,東京都渋谷区千駄ヶ谷３丁目５番１２号ＥＳビル１Ｆ,2021-11-05,株式会社
株式会社ＷＩＮＤ’Ｓ,茨城県土浦市真鍋２丁目４番１３号,2021-11-05,株式会社
株式会社ＷＰＣ,大阪府豊中市曽根東町２丁目２番５－２０７号,2021-11-05,株式会社
株式会社ＷＸＹＺ,大阪府大阪市西区北堀江１丁目３番２０号,2021-11-05,株式会社
株式会社Ｗａｃｗｏｒｋｓ,東京都渋谷区神宮前６丁目２３番４号桑野ビル２階,2021-11-05,株式会社
株式会社Ｗｈｉｐｓ,愛知県知多市岡田字大曽１９番地３,2021-11-05,株式会社
株式会社Ｗｉｎｄｏｒａ　Ａｃｃｏｕｎｔｉｎｇ,東京都新宿区弁天町１０５番地日神デュオステージ新宿外苑東通り１１０１,2021-11-05,株式会社
株式会社Ｙ２プランニング,兵庫県西宮市甲陽園若江町５番２６－２０３号,2021-11-05,株式会社
