法人名,住所,設立日,法人種別
特定非営利活動法人いしかわ食わかちａｉ,石川県金沢市有松４丁目６番地２５号ファイン有松ＡＮＮＥＸ・Ｂ号室,2024-03-22,その他の設立登記法人
特定非営利活動法人やまとたかだ第九の会,奈良県大和高田市片塩町６－１６医療法人酒本医院内,2024-03-22,その他の設立登記法人
特定非営利活動法人ＡＬＥＴＴＡ,東京都目黒区下目黒２丁目２３番１６－１００２号パラスト目黒,2024-03-22,その他の設立登記法人
玲合同会社,東京都港区港南４丁目１番６－１５０４号,2024-03-22,合同会社
田熊建設合同会社,千葉県船橋市山手３丁目１１番１０号,2024-03-22,合同会社
矢谷合同会社,兵庫県神戸市北区唐櫃台２丁目２４番８－３０４号,2024-03-22,合同会社
知庭株式会社,大阪府泉大津市条南町３－２６松浜マンション２０５室,2024-03-22,株式会社
石神井福音教会,東京都練馬区下石神井４丁目２１番１６号,2024-03-22,その他の設立登記法人
社会福祉法人綺羅星,滋賀県栗東市川辺２２８番９,2024-03-22,その他の設立登記法人
美粧堂合同会社,福岡県福岡市博多区博多駅前４丁目７番５－３０３号ムーブル博多,2024-03-22,合同会社
苅宿俊文研究室合同会社,神奈川県相模原市中央区由野台１丁目１番５号ホワイトパレス万年青４０６,2024-03-22,合同会社
荒健設株式会社,埼玉県深谷市大谷２３８６番地１,2024-03-22,株式会社
菊家カンパニー株式会社,千葉県木更津市真里１０４９番地,2024-03-22,株式会社
藤成株式会社,千葉県柏市藤ケ谷１５１０番地,2024-03-22,株式会社
虹株式会社,東京都渋谷区代々木５丁目３４番６号代々木パークハウスＰＲＩＭＥＨＩＬＬＳ３０１,2024-03-22,株式会社
西崎レジデンス株式会社,沖縄県那覇市若狭１丁目６番１０号ビーチサイドビル,2024-03-22,株式会社
西日本信用株式会社,愛知県名古屋市中区栄２丁目２番１号,2024-03-22,株式会社
諾華数字科技株式会社,東京都足立区中川２丁目１３－２ジョイフル亀有３０１,2024-03-22,株式会社
豊美実業株式会社,群馬県邑楽郡邑楽町大字中野５７３９番地,2024-03-22,株式会社
軒昂株式会社,埼玉県川口市西川口２丁目６番１３号,2024-03-22,株式会社
農事組合法人堀田営農組合,富山県氷見市堀田３５５６番地１,2024-03-22,その他の設立登記法人
通信電測株式会社,山口県山口市陶４９００番地２,2024-03-22,株式会社
逸見エステート株式会社,東京都板橋区大山東町２７番２号,2024-03-22,株式会社
長寿薬膳堂カフェ合同会社,兵庫県神戸市東灘区田中町１丁目１２番３号,2024-03-22,合同会社
長寿薬膳堂グループ合同会社,兵庫県神戸市東灘区田中町３丁目４番２０号,2024-03-22,合同会社
雅稲惠舎株式会社,千葉県南房総市安馬谷３２７３番地５,2024-03-22,株式会社
鳳凰フェニックスエナジー株式会社,愛知県知多市大興寺字里９９番地の１,2024-03-22,株式会社
鴻運合同会社,東京都八王子市長沼町１３０７－１２,2024-03-22,合同会社
２Ａ．株式会社,東京都渋谷区神宮前４丁目２２番７号,2024-03-22,株式会社
３６９ｄｅｓｉｇｎ株式会社,群馬県高崎市並榎町１６４番地４２,2024-03-22,株式会社
５５株式会社,東京都新宿区西新宿５丁目５番１－１６０９号,2024-03-22,株式会社
Ａ‐Ｃｏｎｎｅｃｔメディアコンサルティング株式会社,東京都新宿区西新宿３丁目６番４号ＣＩＲＣＬＥＳ西新宿６Ｆ,2024-03-22,株式会社
ＡＣＨＩＬＬＥＳ　ＳＯＬＵＴＩＯＮＳ株式会社,大阪府大阪市中央区南本町２丁目３番１２号３Ｆ,2024-03-22,株式会社
ＡＫホールディングス株式会社,新潟県新潟市秋葉区程島１９６２番地３,2024-03-22,株式会社
ＡＮＩＭＡＬ株式会社,神奈川県横浜市南区中村町４丁目２７４－５－５０６,2024-03-22,株式会社
ＡＳＡカンパニー合同会社,東京都大田区大森北３丁目２９－２３但馬屋マンション１０６,2024-03-22,合同会社
ＡＳｍｉｌｅホールディングス株式会社,千葉県銚子市松岸町３丁目３８３番地,2024-03-22,株式会社
ＡＶＡＮＺＡＲＥ合同会社,大阪府大阪市住吉区苅田４丁目４番２１号,2024-03-22,合同会社
Ａｌｏｈｉ合同会社,千葉県千葉市中央区中央港１丁目２５番２０号エコロジー千葉みなとレジデンス,2024-03-22,合同会社
Ａｒｉｓｅ株式会社,静岡県浜松市中央区西山町２番地パリタⅡ１０２,2024-03-22,株式会社
ＢＯＢ株式会社,長崎県対馬市上県町伊奈１２６１番地,2024-03-22,株式会社
Ｂｅｙｏｎｄ　Ｇｒａｖｉｔｙ　ｏｆ　ＡＲＴ株式会社,東京都港区西麻布３丁目１３番１６－２０３号室,2024-03-22,株式会社
Ｂｉｊｉｎ　Ｃａｒｅ　Ｊｐ株式会社,大阪府大阪市平野区加美西１丁目６番１８号,2024-03-22,株式会社
Ｂｒａｂｂｉｔ合同会社,東京都江戸川区東瑞江１丁目３０番３号,2024-03-22,合同会社
Ｂｒａｎｄｉｎｇ　ａｔｅ株式会社,福岡県福岡市東区東浜１丁目１３番３２号１Ｆ,2024-03-22,株式会社
Ｂｒｅｚｅｌｉｃ株式会社,福島県いわき市常磐水野谷町亀ノ尾１００番地の３,2024-03-22,株式会社
Ｂｒｉｄｇｅ　Ｇｒｏｕｐ株式会社,東京都文京区根津１丁目１番地１９号シティハイツ根津１０２号室,2024-03-22,株式会社
Ｃａｎｖａｓ合同会社,愛媛県松山市竹原２丁目１番５３号エバーグリーン松山２号館１０４号,2024-03-22,合同会社
Ｃｈｏｉｓ　Ｃｈａｎｓ株式会社,大阪府大阪市生野区林寺２丁目１番１９－１０２号,2024-03-22,株式会社
Ｃｏｍｐａｓｓ　Ａｌｐｈａ合同会社,埼玉県さいたま市緑区大字大門１１６番地１浦和東パークホームズ５０５,2024-03-22,合同会社
ＣｒｅｗＺ株式会社,東京都渋谷区代々木１丁目３９番１１号ＭＦＰＲ代々木タワー５０８,2024-03-22,株式会社
ＣｕｏｒｅＲｉｃｃｏ合同会社,栃木県宇都宮市宝木本町１４６７－４,2024-03-22,合同会社
ＤＥＥＮ　ＧＲＯＵＰ合同会社,千葉県東金市上布田４１－４Ａ,2024-03-22,合同会社
ＤＥＩＬ株式会社,愛知県江南市般若町東山５６番地,2024-03-22,株式会社
ＤＩＡ株式会社,東京都練馬区関町南２丁目２７番７号,2024-03-22,株式会社
ＤＩＮＨ　ＳＡＮＧ合同会社,愛知県海部郡蟹江町本町９丁目１１４番地桃花林３０２号,2024-03-22,合同会社
ＤＲＯＰ　ＯＦ　ＲＡＩＮ株式会社,大阪府大阪市東淀川区上新庄２丁目１番３８号４階,2024-03-22,株式会社
ＤＶＣ久喜特定目的会社,東京都港区南青山４丁目２１番２６号リュエル青山Ｃ棟Ｂ１細谷総合会計事務所内,2024-03-22,その他の設立登記法人
Ｄｅａｒ　Ｄｅｓｉｇｎ株式会社,東京都台東区柳橋１丁目８番地５,2024-03-22,株式会社
ＤｒｅａｍＨｏｕｓｅ合同会社,埼玉県川口市西川口１丁目３０番２０号３Ｆ,2024-03-22,合同会社
ＥＧＧＨＥＡＲＴ株式会社,神奈川県横浜市神奈川区高島台６番地２高島台ハウス４０４号,2024-03-22,株式会社
ＥＭ企画株式会社,兵庫県明石市大久保町西島１１７５番地の１,2024-03-22,株式会社
Ｆｅａｒｌｅｓｓ１５株式会社,東京都港区南青山２丁目２番１５号,2024-03-22,株式会社
ＦｏｒｅｖｅｒＳａｔｕｒｄａｙ株式会社,東京都中央区晴海５丁目４－４－１６０８,2024-03-22,株式会社
ＧＥＮＥＲＡＴＥ株式会社,大阪府大阪市西区新町１丁目１４番２１－５１０２号,2024-03-22,株式会社
ＧＲＡＦ合同会社,東京都渋谷区代々木３丁目５２番７号,2024-03-22,合同会社
Ｇａｔｅ　Ｉｎｎｏｖａｔｉｏｎ株式会社,東京都足立区西新井２丁目４番６号ＡｎｄＰｌｕｓ西新井ビル,2024-03-22,株式会社
ＨＡＫプラスチック株式会社,愛知県名古屋市北区大曽根３丁目１０番７号,2024-03-22,株式会社
Ｈａｎｓｅｎ　Ｔｒａｎｓｍｉｓｓｉｏｎｓ株式会社,東京都渋谷区宇田川町２－１渋谷ホームズ３１３－Ｏ号室,2024-03-22,株式会社
ＩＣＶゼットメディア株式会社,東京都渋谷区代々木２丁目２３番地１号,2024-03-22,株式会社
ＩＫＨＬＡＳ　ＴＲＡＤＩＮＧ株式会社,埼玉県羽生市大字藤井上組６９４番地１,2024-03-22,株式会社
ＩＲＩＳ株式会社,愛知県豊橋市柱二番町２番地１,2024-03-22,株式会社
ＪＤＣグリーンエナジー合同会社,東京都港区虎ノ門４丁目３番１３号,2024-03-22,合同会社
ＪＵＳＰＥＲ合同会社,神奈川県横浜市戸塚区戸塚町４１６２,2024-03-22,合同会社
Ｋ・ＦＡＣＴＯＲＹ株式会社,青森県北津軽郡中泊町大字中里字紅葉坂２２２番地１もみじ団地９号,2024-03-22,株式会社
Ｋ＆Ｋ合同会社,東京都港区南麻布１丁目８番２１号ＴＨＥＣＬＡＳＳ南麻布１００１号室,2024-03-22,合同会社
ＫＡＫＵＤＡＩ株式会社,京都府京田辺市山手東２丁目５番地１ファインパークＡ棟５０３号,2024-03-22,株式会社
ＫＡＷＡＧＵＣＨＩホールディングス株式会社,愛知県春日井市篠木町１丁目４０番地,2024-03-22,株式会社
ＫＤＣ株式会社,大阪府大阪市北区西天満２丁目３番６号大阪法曹ビル２０２,2024-03-22,株式会社
ＫＩＬＡ株式会社,神奈川県横浜市中区桜木町１丁目１－７ヒューリックみなとみらい１０階,2024-03-22,株式会社
ＫＯＤＥＮ　ＵＫＩ合同会社,東京都中野区弥生町３丁目５番５号,2024-03-22,合同会社
ＫＳ　ａｓｓｅｔ株式会社,大阪府豊中市東豊中町６丁目２３－３７－１０３,2024-03-22,株式会社
ＫａＬａ株式会社,大阪府大阪市生野区生野東１丁目１３番８号,2024-03-22,株式会社
Ｌ’ＯＥＩＬ　ＤＥ　ＴＯＫＹＯ　Ｊａｐａｎ株式会社,東京都杉並区浜田山１丁目３３－３０メゾンアンドー１１０,2024-03-22,株式会社
ＬＥＶ株式会社,大阪府大阪市西淀川区田川二丁目８番３１号,2024-03-22,株式会社
ＬＩＦＥ　ＲｅＢＯＲＮ株式会社,千葉県船橋市藤原５丁目１２番８４号,2024-03-22,株式会社
ＬＩＦＥ　ＳＥＳＳＩＯＮ株式会社,大阪府吹田市千里山東１丁目２４番１８号,2024-03-22,株式会社
ＬＯＵＴＳ　ＲＩＳＥ　ＢＥＡＵＴＹ合同会社,東京都墨田区本所２丁目１６－２プライムメゾン浅草イースト３０６,2024-03-22,合同会社
Ｌａｎｋａ合同会社,東京都西東京市芝久保町４丁目１２番４８号,2024-03-22,合同会社
Ｌｉｆｅ　Ｃｏｎｓｔｅｌｌａｔｉｏｎ合同会社,東京都中央区日本橋２丁目２番３号ＲＩＳＨＥビルＵＣＦ４階,2024-03-22,合同会社
Ｌｕｘ株式会社,和歌山県和歌山市小雑賀２５７番地５,2024-03-22,株式会社
ＭＡＲＥ株式会社,神奈川県鎌倉市御成町４－１５－３０１,2024-03-22,株式会社
ＭＡＳＡ＆ＣＯＭＰＡＮＹ株式会社,東京都港区南麻布５丁目１４番４－５０２号,2024-03-22,株式会社
ＭＢオペレーションズ株式会社,東京都渋谷区恵比寿４丁目７番６号,2024-03-22,株式会社
ＭＫセントラルテクノ株式会社,愛知県刈谷市新富町４丁目６０１番地３０１号,2024-03-22,株式会社
ＭＳＫ株式会社,鹿児島県鹿屋市笠之原町２８番１‐３号,2024-03-22,株式会社
Ｍａｒｕ株式会社,神奈川県伊勢原市高森１丁目９番地の９,2024-03-22,株式会社
ＭｉｎｄＭａｔｒｉｘ合同会社,東京都港区南青山３丁目１番３６号青山丸竹ビル６Ｆ,2024-03-22,合同会社
Ｍｙｏｐｏ合同会社,新潟県妙高市大字田切２１８番地１８０,2024-03-22,合同会社
ＮＡＨＩＲＯ株式会社,東京都渋谷区松濤２丁目７番１２号,2024-03-22,株式会社
ＮＰＯ法人菊池大学,熊本県菊池市今７２５番地,2024-03-22,その他の設立登記法人
ＮＶＭ合同会社,京都府京都市下京区朱雀宝蔵町４４番地協栄ビル２階京都朱雀スタジオ,2024-03-22,合同会社
Ｎｅｏｔｅｃ　Ｓｏｌｕｔｉｏｎｓ合同会社,東京都渋谷区代々木１丁目３０番１５号,2024-03-22,合同会社
Ｎｅｘｔ　ｅｇｇ合同会社,東京都墨田区東向島４丁目３９番１６号,2024-03-22,合同会社
Ｎｏｒｔｈ　Ｇｒｅｅｎａｔｉｏｎ合同会社,北海道札幌市中央区南二条西７丁目１番５　２．７ビル２階,2024-03-22,合同会社
Ｎｓｅｎｓｅ株式会社,宮城県仙台市青葉区北根３丁目１８－１２,2024-03-22,株式会社
ＯＫｅｏ株式会社,埼玉県所沢市寿町１０番１３－４０２号キャトル・フィーユ,2024-03-22,株式会社
ＯＺＡＷＡ　ＭＡＮＡＧＥＭＥＮＴ合同会社,神奈川県高座郡寒川町一之宮１丁目２３番３７号,2024-03-22,合同会社
ＰＡＹｉＴＦＯＲＷＡＲＤ合同会社,埼玉県川口市本町３丁目２番地１２デュアルコート川口イーストビュー７０５,2024-03-22,合同会社
ＰＩＦ合同会社,東京都西東京市新町５丁目４番１号,2024-03-22,合同会社
ＰＲＭ株式会社,東京都千代田区神田佐久間町１丁目１４番地第２東ビル２０５号室,2024-03-22,株式会社
ＰＴＲ株式会社,愛知県豊川市豊川元町１０番地河合ビル１階,2024-03-22,株式会社
ＰＷＣパワーシステム株式会社,東京都江東区潮見２丁目３番９号２階,2024-03-22,株式会社
ＰｅａｃｅｆｕｌＶｉｓｉｏｎ株式会社,北海道札幌市中央区南一条西１６丁目１番地３２３春野ビル３Ｆ,2024-03-22,株式会社
Ｐｅｏｐｌｅ　Ｔｅｃｈ　Ｕｎｉｔｅ株式会社,北海道札幌市北区新琴似九条９丁目９番１号,2024-03-22,株式会社
Ｐｒｉｎｃｅｓｓ．Ｔｒｅｅ株式会社,福岡県朝倉市堤１１６４番地１,2024-03-22,株式会社
ＲＡＦ合同会社,沖縄県中頭郡北谷町字吉原９３６ＧＲＥＥＮＧＡＲＤＥＮ,2024-03-22,合同会社
ＲＥＧＲＵＳ　ＩＮＴＥＲＮＡＴＩＯＮＡＬ株式会社,神奈川県横浜市神奈川区三ツ沢下町２２－３－３,2024-03-22,株式会社
ＲＥＶＩＶＥ　ＨＯＰＥ株式会社,東京都中央区銀座１丁目１２番４号Ｎ＆ＥＢＬＤ．６Ｆ,2024-03-22,株式会社
ＲＭＫシステム株式会社,愛知県名古屋市東区車道町２丁目３２番地の３,2024-03-22,株式会社
ＲＰＤコンサルティング株式会社,東京都西東京市東伏見５丁目４番２３号,2024-03-22,株式会社
Ｒｅｃｏｄｅｃ株式会社,北海道帯広市西十五条南１４丁目１番地１,2024-03-22,株式会社
Ｒｏｏｉ　ＳｉｐＪｏｙ株式会社,東京都世田谷区北沢２丁目１０番１５号,2024-03-22,株式会社
Ｓ＆Ｌ株式会社,東京都新宿区百人町１丁目１３－２７オサタマンション２０１室,2024-03-22,株式会社
Ｓ．Ｖ．ＪＡＰＡＮ　ＴＲＡＤＩＮＧ合同会社,栃木県真岡市若旅６６９番地３,2024-03-22,合同会社
ＳＣメタルズ株式会社,愛知県小牧市新町１丁目１０９番地３,2024-03-22,株式会社
ＳＥＬＥＮＥ株式会社,東京都中央区銀座７丁目１３番２０号銀座ＴＨビル９階,2024-03-22,株式会社
ＳＥＮＴＥＲ株式会社,福岡県福岡市博多区冷泉町１０－２３博多冷泉町ビル２階,2024-03-22,株式会社
ＳＦＫＳ００４株式会社,滋賀県近江八幡市倉橋部町２４３番地,2024-03-22,株式会社
ＳＩＮＹＯ株式会社,愛知県瀬戸市新田町２２０番地の２,2024-03-22,株式会社
ＳＫＹ　Ｐｒｏｐｅｒｔｉｅｓ株式会社,東京都千代田区二番町１番地番町ハイム５１３号室,2024-03-22,株式会社
ＳＴＡＲＴＡＳ株式会社,福岡県福岡市博多区諸岡３丁目３３番４５－５０１号,2024-03-22,株式会社
ＳＵＰＥＲ　ＵＮＩＶＥＲＳＡＬ合同会社,東京都世田谷区三軒茶屋２丁目１３番２０－６０６号,2024-03-22,合同会社
Ｓｈｏｗ株式会社,東京都足立区東六月町６番２３号,2024-03-22,株式会社
ＳｋＹ　Ｐｒｏｐ株式会社,大阪府大阪市北区角田町八丁目４７阪急グランドビル２０Ｆ,2024-03-22,株式会社
Ｓｍｉｌｅ　Ｊｉｚｏ株式会社,北海道砂川市吉野一条南５丁目３６番地７０,2024-03-22,株式会社
ＳｔａＲと管理株式会社,福岡県福岡市南区清水３丁目１７番２号,2024-03-22,株式会社
Ｓｔａｎｄ　ｆｉｅｌｄ株式会社,埼玉県越谷市川柳町１丁目４１番地１０,2024-03-22,株式会社
Ｓｔｅｐ　Ｆｏｒｗａｒｄ株式会社,北海道札幌市中央区南五条西１５丁目２番３号リズム医大前５０３号室,2024-03-22,株式会社
Ｓｕｎ合同会社,東京都港区北青山１丁目３番１号アールキューブ青山３階,2024-03-22,合同会社
Ｓｕｎｎｙ　Ｐｉｅｃｅｓ合同会社,東京都世田谷区弦巻２丁目２８番３号,2024-03-22,合同会社
Ｔ＆Ｓ株式会社,東京都江東区東陽３丁目３番１－９０１号,2024-03-22,株式会社
Ｔ．Ｔ．Ｓ合同会社,神奈川県横浜市都筑区牛久保１丁目２番５号プレミールすみれ１０１号室,2024-03-22,合同会社
Ｔ．Ｖ．Ｂ税理士法人,東京都新宿区新宿２丁目９番２２号多摩川新宿ビル６階,2024-03-22,その他の設立登記法人
ＴＡＮ　ＡＮ合同会社,福岡県福岡市東区若宮２丁目４１番８号,2024-03-22,合同会社
ＴＤ　ｃｏｎｎｅｃｔ株式会社,大阪府大阪市中央区南船場３丁目９番６号３Ｆ,2024-03-22,株式会社
ＴＨＡＮＨ　ＢＩＥＮ合同会社,茨城県鉾田市鉾田１０９番地ＨＫ１０－２０７号室,2024-03-22,合同会社
ＴＨＲＥＥ株式会社,千葉県千葉市若葉区金親町１３３番地８,2024-03-22,株式会社
ＴＯＭＯ合同会社,熊本県人吉市下原田町字堀１２５－４,2024-03-22,合同会社
ＴＳ　ａｓｓｉｓｔ株式会社,茨城県土浦市中高津２丁目１１番５号,2024-03-22,株式会社
Ｔｅｒｉｚｏｎ合同会社,千葉県千葉市中央区中央３丁目１６番１号デュオヒルズ千葉中央９０３号,2024-03-22,合同会社
Ｔｈｉｎｋ８株式会社,東京都東村山市栄町２丁目１９番２３号１階,2024-03-22,株式会社
ＴｒｙＬｉｎｋ　Ｃｏｎｓｕｌｔｉｎｇ＆Ｅｎｔｅｒｔａｉｎｍｅｎｔ株式会社,東京都中央区日本橋室町１丁目１１番１２号日本橋水野ビル７階,2024-03-22,株式会社
ＵＮＦＯＬＬＯＷＩＮＧ合同会社,京都府京都市下京区中堂寺前田町６番地の１５,2024-03-22,合同会社
ＶＩｉＣＥＬＫ　ｃｏｓｍｅｔｉｃｓ株式会社,東京都渋谷区恵比寿４丁目２０番３号恵比寿ガーデンプレイスタワー１８階,2024-03-22,株式会社
ＶＫＳＭ株式会社,東京都台東区東上野５丁目１３番９号,2024-03-22,株式会社
ＶＮＪＰ　ＰＲＩＭＥ　ＴＲＡＤＥ株式会社,愛知県豊田市石楠町伊達屋敷２６番地,2024-03-22,株式会社
Ｗ＆ＡＳトレーディング株式会社,埼玉県比企郡川島町大字下狢６５１,2024-03-22,株式会社
ＷＩＮＣＡＲ　ＡＳＩＡ株式会社,東京都目黒区下目黒３丁目１０番３６号,2024-03-22,株式会社
ＷＯＲＬＤ　ＩＭＰＯＲＴ合同会社,東京都目黒区自由が丘２丁目１６番１２号ＲＪ３,2024-03-22,合同会社
ＷＹ．Ｈ株式会社,千葉県佐倉市宮前３丁目２２番地４ＧＡＲＤＥＮＥＬＥＧＡＮＴ２２０号室,2024-03-22,株式会社
Ｘ‐ｅｎｅｒｇｙ　Ｊａｐａｎ株式会社,愛知県名古屋市西区城西５丁目２７番２号,2024-03-22,株式会社
Ｙ．Ｓ．Ｋ株式会社,大阪府豊中市刀根山元町４番３４号,2024-03-22,株式会社
Ｙｕｂｉホールディングス株式会社,大阪府大阪市福島区福島６丁目１３番６号,2024-03-22,株式会社
ＺＡＨＩＤ　ＴＲＡＤＩＮＧ合同会社,福岡県遠賀郡岡垣町中央台４丁目８番２号,2024-03-22,合同会社
ＺＤＤ株式会社,兵庫県宝塚市すみれガ丘３丁目５番１－１１５号,2024-03-22,株式会社
ＺＥＮ経営共創株式会社,東京都千代田区外神田５丁目６－２菊池ビル１階,2024-03-22,株式会社
ＺＥＴＴＯＮ合同会社,東京都中央区銀座７丁目１５番８号,2024-03-22,合同会社
ｅｎｚｉｎｅ合同会社,千葉県千葉市花見川区幕張町１丁目７６７５番地２レクセルマンション幕張ブリーズ１０１０号,2024-03-22,合同会社
ｆｒｏｎｔｃｏａｃｈｉｎｇ株式会社,東京都渋谷区道玄坂１丁目１０番８号渋谷道玄坂東急ビル２Ｆ－Ｃ,2024-03-22,株式会社
ｊｏｙ　ｒｕｌｅｒ株式会社,千葉県千葉市中央区浜野町７５１番地,2024-03-22,株式会社
ｎｉｊｉ合同会社,福岡県福岡市城南区樋井川７丁目１６番２０－２０１号ＫＹコーポ,2024-03-22,合同会社
ｓｎｏｗ株式会社,神奈川県横浜市青葉区新石川２丁目２２番地１３,2024-03-22,株式会社
ｔｗｅｌｖｅ株式会社,愛知県名古屋市中区大須３丁目３８番４５号,2024-03-22,株式会社
ｗｉｉｉｌｌ株式会社,大阪府大阪市北区梅田２丁目２－２ヒルトンプラザウエストオフィスタワー１９Ｆ,2024-03-22,株式会社
ｙ’ｏｎｅ合同会社,東京都世田谷区尾山台３丁目１８－６,2024-03-22,合同会社
おおすみパワード株式会社,鹿児島県肝属郡肝付町前田３５４３番地３,2024-03-25,株式会社
こころ株式会社,京都府京都市右京区梅津北浦町２－８スカイハイツ和新１Ｆ東,2024-03-25,株式会社
はぴはぴはっぴー合同会社,沖縄県宜野湾市伊佐２丁目１９番１７－１２０２,2024-03-25,合同会社
みんなのマネサポ合同会社,愛知県刈谷市広小路７丁目１番地１,2024-03-25,合同会社
アストラル株式会社,愛知県岡崎市欠町字足延１番地１,2024-03-25,株式会社
アムス合同会社,茨城県守谷市けやき台３丁目２８番地７,2024-03-25,合同会社
アルケミストジャパン株式会社,東京都中央区日本橋３丁目９番１号日本橋三丁目スクエア１１階,2024-03-25,株式会社
アートフルマインド合同会社,東京都港区芝浦４丁目１５－１プラウドタワー芝浦７１２,2024-03-25,合同会社
イデアルラボ合同会社,東京都港区南青山２丁目２－１５ＷｉｎＡｏｙａｍａビルＵＣＦ６３５,2024-03-25,合同会社
エグザムキャリア合同会社,神奈川県横浜市保土ケ谷区西谷３丁目２０番１８号,2024-03-25,合同会社
エスリール株式会社,兵庫県西宮市高木西町８番１－３０３号,2024-03-25,株式会社
エンゼルゲーミングデバイス株式会社,滋賀県東近江市青野町４６００番地,2024-03-25,株式会社
オートオーエ合同会社,東京都江戸川区西小岩５丁目１５－１１,2024-03-25,合同会社
カルマインベストメント３合同会社,千葉県船橋市飯山満町１丁目７１９番地２,2024-03-25,合同会社
ギフトハウスオオサカ合同会社,大阪府大阪市淀川区三津屋南１丁目１１－５,2024-03-25,合同会社
グランドリアルエステート株式会社,東京都新宿区高田馬場４丁目３番７号,2024-03-25,株式会社
グローバルソリューション株式会社,熊本県阿蘇郡南小国町大字赤馬場１８９６－７,2024-03-25,株式会社
サクシア株式会社,神奈川県横浜市港北区新横浜２丁目４－１９富士火災横浜ビル４階,2024-03-25,株式会社
サロンｋｙｏｋｏ合同会社,千葉県八千代市高津４２８番地３,2024-03-25,合同会社
サンリスティール株式会社,大阪府大阪市西淀川区福町３丁目３番４９号,2024-03-25,株式会社
シェアエコ株式会社,愛知県名古屋市名東区小井堀町１００１番地,2024-03-25,株式会社
シャイニー株式会社,神奈川県三浦市南下浦町上宮田３３７４番地５,2024-03-25,株式会社
シンプリファイア合同会社,神奈川県三浦郡葉山町一色３７０,2024-03-25,合同会社
ジャントン合同会社,東京都杉並区上高井戸３丁目４番２４号三原荘,2024-03-25,合同会社
