法人名,住所,設立日,法人種別
淀屋橋税理士法人,大阪府大阪市中央区北浜１丁目１番９号,2019-05-10,その他の設立登記法人
湖東商会合同会社,滋賀県東近江市八日市緑町２１番８号,2019-05-10,合同会社
湘南インベスト株式会社,神奈川県茅ヶ崎市常盤町２番２６号,2019-05-10,株式会社
湘南コンサルティング株式会社,神奈川県中郡二宮町二宮１１０１番地,2019-05-10,株式会社
熊本国際空港株式会社,熊本県上益城郡益城町大字小谷１８０２番地の２,2019-05-10,株式会社
片品村ホールディングス一般社団法人,東京都港区赤坂１丁目１２番３２号アーク森ビル３０階Ｃｅｎｘｕｓ税理士法人内,2019-05-10,その他の設立登記法人
特定非営利活動法人あいち自立支援協会,愛知県名古屋市北区元志賀町２丁目１２番地,2019-05-10,その他の設立登記法人
特定非営利活動法人セルフケアプランニング,兵庫県赤穂市中広１１９番地５７,2019-05-10,その他の設立登記法人
特定非営利活動法人ソレイユリトミック,東京都日野市大坂上３丁目１７番地の１ローズガーデンＢ,2019-05-10,その他の設立登記法人
特定非営利活動法人誠信会,長崎県西彼杵郡長与町高田郷６２番地１,2019-05-10,その他の設立登記法人
特定非営利活動法人ＡＳＯＶＩＶＡ,大阪府南河内郡千早赤阪村大字小吹６８番地の４９４,2019-05-10,その他の設立登記法人
環球楽居株式会社,東京都墨田区向島２丁目１４番９－７０１号,2019-05-10,株式会社
田中電気株式会社,大阪府泉南市信達市場１６４９番地の１,2019-05-10,株式会社
石井工業株式会社,埼玉県上尾市大字原市３９３５番地１０,2019-05-10,株式会社
石井税務コンサルティング株式会社,新潟県新発田市中曽根町２丁目８番１３号,2019-05-10,株式会社
石原造船株式会社,熊本県天草市久玉町４９２６番地２,2019-05-10,株式会社
礒野エアテック株式会社,兵庫県加古川市東神吉町砂部２２８番地,2019-05-10,株式会社
社会福祉法人アミひめじ,兵庫県姫路市北平野南の町３番３４号,2019-05-10,その他の設立登記法人
社会福祉法人喜左ヱ門,兵庫県尼崎市若王寺２丁目１４－２０,2019-05-10,その他の設立登記法人
福栄商事株式会社,福島県白河市新白河１丁目２０１番地,2019-05-10,株式会社
秀ＳＨＯＷ株式会社,三重県桑名市多度町南之郷２番地,2019-05-10,株式会社
秋田家禽農業協同組合,秋田県秋田市上亀ノ丁２３番地,2019-05-10,その他の設立登記法人
秋田市園芸農業協同組合,秋田県秋田市土手長町上丁１番地,2019-05-10,その他の設立登記法人
秋田種鶏改良農業協同組合,秋田県秋田市土崎港将軍野１２番地,2019-05-10,その他の設立登記法人
秋田縣椎茸農業協同組合,秋田県秋田市川尻町字八十刈３６番地,2019-05-10,その他の設立登記法人
秋田酪農業協同組合,秋田県秋田市土手長町上丁１番地,2019-05-10,その他の設立登記法人
税理士法人つばさ経営,愛知県西尾市城崎町５丁目６番地,2019-05-10,その他の設立登記法人
税理士法人出雲・鳥山会計事務所,東京都江東区東陽５丁目３１番２９－４１０号,2019-05-10,その他の設立登記法人
税理士法人村井会計事務所,大阪府大阪市天王寺区四天王寺２丁目５番１１号５０３,2019-05-10,その他の設立登記法人
税理士法人ＤＡＹＳ,東京都板橋区大山町４番４号コンフォリア大山１４０１,2019-05-10,その他の設立登記法人
穂登建設合同会社,東京都江東区東砂３丁目２３番地１７号,2019-05-10,合同会社
竹田工業株式会社,北海道標津郡中標津町西町４丁目２番地１５,2019-05-10,株式会社
竹部電気株式会社,京都府京都市左京区高野泉町６番地１５８,2019-05-10,株式会社
糠沢牧野農業協同組合,秋田県北秋田市綴子字下谷地４０７番地,2019-05-10,その他の設立登記法人
綴子村岩谷牧野農業協同組合,秋田県北秋田市綴子字岩谷１３番地,2019-05-10,その他の設立登記法人
総合サポート新潟株式会社,新潟県新潟市北区太夫浜新町１丁目２５番１０号,2019-05-10,株式会社
英羽キャピタル株式会社,愛知県常滑市住吉町２丁目９４番地,2019-05-10,株式会社
藤井工業株式会社,新潟県新発田市住吉町２丁目８番９号８,2019-05-10,株式会社
西口電機工業株式会社,富山県富山市経堂４丁目７番１２号ＳＡＡＢビル２Ｆ,2019-05-10,株式会社
西和グループ株式会社,大阪府大阪市中央区島之内２丁目１５番２６号８０３,2019-05-10,株式会社
豊和商事株式会社,山形県寒河江市大字寒河江字洲崎丙１５４４番地の４,2019-05-10,株式会社
貴美丸水産株式会社,三重県尾鷲市三木浦町５０９番地３１,2019-05-10,株式会社
近畿商会株式会社,大阪府岸和田市尾生町３丁目１６番３号,2019-05-10,株式会社
迫田調査設計株式会社,大阪府八尾市春日町４丁目６番８号,2019-05-10,株式会社
郷原町を考える会,広島県呉市郷原町９０－１,2019-05-10,その他
野原工業株式会社,広島県府中市河南町２０２番地２,2019-05-10,株式会社
針生建設株式会社,宮城県仙台市宮城野区新田３丁目４番３３号ハイツＫＳ３０２,2019-05-10,株式会社
鈴木金属工業株式会社,茨城県日立市田尻町３丁目３３番７号,2019-05-10,株式会社
錦ストーン株式会社,東京都千代田区西神田２丁目７番６号,2019-05-10,株式会社
鎌倉マネジメントアーツ株式会社,神奈川県鎌倉市二階堂４３番地メゾン二階堂２０５,2019-05-10,株式会社
長崎共益合資会社,長崎県長崎市矢の平町７２３番地,2019-05-10,合資会社
長沢電気株式会社,静岡県静岡市駿河区西島１５８番地の５,2019-05-10,株式会社
長田土建工業株式会社,埼玉県坂戸市大字萱方３６番地９,2019-05-10,株式会社
閑馬町エナジー合同会社,山形県酒田市こがね町１丁目２２番地の１２,2019-05-10,合同会社
青山創建株式会社,愛知県岡崎市不吹町１４番地４８８,2019-05-10,株式会社
高水コーポレーション株式会社,愛知県名古屋市中村区深川町１丁目７番地１,2019-05-10,株式会社
魚子合同会社,神奈川県横浜市神奈川区神大寺２丁目６番４６－４０３号,2019-05-10,合同会社
鷹巣町酪農農業協同組合,秋田県北秋田市脇神字米ノ岱２７番地の１,2019-05-10,その他の設立登記法人
黒川部落牧野農業協同組合,秋田県秋田市金足黒川字黒川１７８番地,2019-05-10,その他の設立登記法人
龍興産業株式会社,広島県東広島市八本松飯田３丁目６番２６－３,2019-05-10,株式会社
１９８８合同会社,東京都中央区日本橋３丁目２番１４号日本橋ＫＮビル４Ｆ,2019-05-10,合同会社
２Ｒ　Ｉｎｆｉｎｉｔｙ株式会社,東京都目黒区東山１丁目１３番４号,2019-05-10,株式会社
３６５ソリューション株式会社,熊本県宇土市北段原町１８５番地１,2019-05-10,株式会社
４ｔｈクリエイト合同会社,東京都千代田区神田美倉町９番地神田美倉町ビル２階,2019-05-10,合同会社
ＡＮＤ１５０株式会社,神奈川県横浜市中区北仲通３丁目３３番地関内フューチャーセンター♯３０９,2019-05-10,株式会社
ＡＲＡＴＡＫＡ　ＳＴＡＲ　ＨＯＬＤＩＮＧＳ株式会社,兵庫県西宮市北口町１番１号,2019-05-10,株式会社
Ａｌｔａｉｒ　Ｃｏｎｎｅｃｔｉｏｎ合同会社,東京都港区西麻布１丁目１１番６,2019-05-10,合同会社
Ａｎｔｓ合同会社,茨城県ひたちなか市大字田彦３９１番地９８,2019-05-10,合同会社
Ａｔｌａｓ　Ｒｅｃｒｕｉｔｍｅｎｔ株式会社,東京都港区西麻布３丁目２番１３号コートアネックス六本木３０３号室,2019-05-10,株式会社
Ｂ＆ＭＷ合同会社,東京都日野市程久保８丁目４２番地の３２,2019-05-10,合同会社
ＢＥＳＴ　ＶＩＳＩＯＮ　ＣＡＲＥ　ＩＮＣ　ＰＴＥ　ＬＴＤ,大阪府大阪市西区京町堀２丁目４－１ー７０５,2019-05-10,外国会社等
Ｂｅ合同会社,東京都荒川区東日暮里３丁目３８番５号,2019-05-10,合同会社
Ｂｏｕｎｄ合同会社,東京都品川区戸越３丁目２番１号１Ｆ,2019-05-10,合同会社
ＣＯＶＯ株式会社,愛知県名古屋市中区栄４丁目１２番１号栄グリーンビル３階,2019-05-10,株式会社
ＣｏＭＲｅＤ株式会社,島根県江津市松川町八神２０番地,2019-05-10,株式会社
ＤＥＳＴＩＮＡＴＩＯＮ合同会社,神奈川県大和市下鶴間６番地１,2019-05-10,合同会社
ＤＲＥＡＭ　ＧＡＴＥ株式会社,広島県福山市新涯町１丁目３２番８号,2019-05-10,株式会社
ＥＤＧＥＭＡＴＲＩＸ株式会社,東京都渋谷区渋谷２丁目１１番６号,2019-05-10,株式会社
ＥＬＶＡ　ｊａｐａｎ合同会社,神奈川県川崎市高津区新作３丁目６番８号,2019-05-10,合同会社
Ｅｄｏ株式会社,東京都墨田区東墨田２丁目１１番９号,2019-05-10,株式会社
Ｅｎｎｅｏ株式会社,東京都千代田区神田神保町３丁目１０番４号,2019-05-10,株式会社
ＦＪトラスト合同会社,愛知県名古屋市東区泉１丁目１番３０号,2019-05-10,合同会社
ＦＹＫ合同会社,北海道札幌市西区山の手一条１２丁目１３番１号山本アパート１０２号,2019-05-10,合同会社
Ｈ＆Ｋ　Ｃｏｍｐａｎｙ株式会社,東京都目黒区原町１丁目３２番４号,2019-05-10,株式会社
ＨＢＲ合同会社,静岡県熱海市熱海１９９３番地の３５１,2019-05-10,合同会社
ＨＯＵＳＥ出版株式会社,神奈川県藤沢市鵠沼海岸７丁目５番２号,2019-05-10,株式会社
ＨＴパートナーズ合同会社,東京都港区赤坂１丁目１４番５号,2019-05-10,合同会社
Ｉホールディングス株式会社,茨城県つくば市梅園２丁目７番地３,2019-05-10,株式会社
ＪＫＣマリン株式会社,兵庫県神戸市中央区八幡通３丁目２－５,2019-05-10,株式会社
ＪＬＴコミュニケーションズ株式会社,大阪府大阪市西区江戸堀３丁目１番１４－２０４号,2019-05-10,株式会社
ＪＰ　ＨＩＬＡＬ　ＴＲＡＤＥ合同会社,東京都足立区栗原３丁目１４番３－２０２号芳泉ビル,2019-05-10,合同会社
Ｋ’ｓ　Ｗｏｒｋｓ合同会社,大阪府吹田市垂水町３丁目２０番１号,2019-05-10,合同会社
Ｋ　ＷＯＯＤ　ｂｅａｕｔｙ　ｉｎｔｅｒｎａｔｉｏｎａｌ合同会社,新潟県燕市南２丁目６番１０号,2019-05-10,合同会社
Ｋ２合同会社,神奈川県藤沢市鵠沼石上１丁目３番３号相模プラザＶビル５階,2019-05-10,合同会社
ＫＤＳエネルギー合同会社,山梨県甲斐市富竹新田１９８９－３－２階,2019-05-10,合同会社
ＫＵＷＡＨＡＴＡ　ＤＥＳＩＧＮ合同会社,神奈川県藤沢市藤が岡１丁目４番３－４１３号,2019-05-10,合同会社
Ｋａｚ株式会社,東京都中央区銀座６丁目１０番１号ＧｉｎｚａＳｉｘ１３階Ｗｅｗｏｒｋ,2019-05-10,株式会社
ＬＳ２株式会社,東京都板橋区板橋１丁目６番５号ヒルサイドレジデンス４０１号室,2019-05-10,株式会社
ＬｉＬｉ合同会社,北海道恵庭市黄金中央２丁目５番地１,2019-05-10,合同会社
Ｌｕｘ合同会社,東京都中央区銀座１丁目６番１１号土志田ビルディング３Ｆ,2019-05-10,合同会社
ＭＡＤＥ・ＩＮ・ＪＡＰＡＮ宝来物産合同会社,福岡県遠賀郡水巻町吉田東１丁目９番１６号,2019-05-10,合同会社
ＭＡＫＥＪＩＮ株式会社,神奈川県横浜市港北区篠原町１２４９番地１６,2019-05-10,株式会社
ＭＡＮＤＡ株式会社,和歌山県西牟婁郡白浜町１３８４番地の１８,2019-05-10,株式会社
ＭＡＲＣ　ＤＥＳＩＧＮ株式会社,愛知県名古屋市東区葵１丁目１５番１８号オフィスサンナゴヤ５階北室,2019-05-10,株式会社
ＭＡＲＬ株式会社,愛知県名古屋市中村区名駅３丁目２３番６号,2019-05-10,株式会社
ＭＫ－ｃｏｍｐａｎｙ合同会社,千葉県市川市原木１丁目６番２２－４０６号（アフィニス原木）,2019-05-10,合同会社
ＭＫＳ株式会社,香川県高松市鶴市町１７１番地７,2019-05-10,株式会社
Ｍａｎａｇｅｍｅｎｔ＆Ｔｅｃｈｎｉｃａｌ　ｓｏｌｕｔｉｏｎｓ，ＡＺｕ株式会社,大阪府守口市竜田通１丁目１番１－６０２号,2019-05-10,株式会社
Ｎ‐ＴＥＣ株式会社,広島県東広島市西条町下三永８５０番地７,2019-05-10,株式会社
Ｎ．Ｇ．Ｉ株式会社,愛知県みよし市福田町山畑１０６番地２,2019-05-10,株式会社
ＮＴ建物管理合同会社,東京都豊島区池袋本町１丁目１１番１２,2019-05-10,合同会社
ＮＹＳダイヤ工業株式会社,埼玉県川口市大字峯１６１６番地の１,2019-05-10,株式会社
Ｎｉｃｏｃｏ合同会社,東京都品川区北品川１丁目９番７号ドップルーム品川１０１５,2019-05-10,合同会社
ＯＫボーリング株式会社,広島県広島市佐伯区三宅５丁目３６７番地７,2019-05-10,株式会社
ＯＮＥ－ＢＹＥ合同会社,京都府城陽市久世里ノ西２２１番地の１９,2019-05-10,合同会社
Ｏｃｔａ会計サポート株式会社,福岡県北九州市若松区塩屋３丁目２０番２２号,2019-05-10,株式会社
Ｏｎｅ　Ａｓｉａ　Ｉｎｖｅｓｔｍｅｎｔ株式会社,東京都世田谷区駒沢２丁目２２番１５号,2019-05-10,株式会社
Ｐ．ＥＮ．Ｓ株式会社,神奈川県横須賀市公郷町４丁目３番地３,2019-05-10,株式会社
ＰＭＴＡ株式会社,愛知県名古屋市中区栄１丁目２３号２９番Ｓｕｎ・Ｈ２階,2019-05-10,株式会社
Ｐｉｖｏｔ　Ｓｅｒｖｉｃｅｓ　Ｊａｐａｎ合同会社,東京都千代田区平河町２丁目６番１号平河町ビル７階,2019-05-10,合同会社
ＰｏｗｅｒＮｏｗ株式会社,東京都渋谷区渋谷１丁目１１番１号３Ｆ,2019-05-10,株式会社
Ｑｕｅｅｎ　Ｂｅｅ株式会社,滋賀県大津市苗鹿３丁目８４番地３,2019-05-10,株式会社
ＲＢ　Ｃｒａｆｔ合同会社,宮崎県日向市大王町１丁目１５番地３,2019-05-10,合同会社
ＲＥＩＷＡ建設株式会社,大阪府箕面市稲６丁目７番２５号,2019-05-10,株式会社
ＲＥＩＷＡ株式会社,埼玉県さいたま市見沼区大字風渡野６４６番地２２,2019-05-10,株式会社
ＲＵＮ　ＬＡＮＫＡ　ＩＮＴＥＲＮＡＴＩＯＮＡＬ,千葉県長生郡白子町八斗１９９３番地白子ビジネスオフィス９号,2019-05-10,外国会社等
ＲＹＵＫＩ薬業株式会社,大阪府吹田市広芝町７番５－４０４号,2019-05-10,株式会社
ＳＡＮＤＳ株式会社,神奈川県横浜市保土ケ谷区権太坂２丁目１７番１２－２号,2019-05-10,株式会社
ＳＤＦ株式会社,兵庫県洲本市五色町広石下１２４４番地,2019-05-10,株式会社
ＳＯＬＩＤＬＩＦＥ株式会社,熊本県熊本市南区良町４丁目１０番９２号ヴェルドミール参番館１０１,2019-05-10,株式会社
ＳＲＣ株式会社,神奈川県藤沢市藤沢１丁目２番１９号,2019-05-10,株式会社
Ｓａｎｙｏ　Ｒｏａｄ　Ｓｙｓｔｅｍ株式会社,岡山県倉敷市白楽町１８番地１６,2019-05-10,株式会社
Ｓｓａｔｕｒｄａｙ合同会社,東京都中央区銀座５丁目９番１９号,2019-05-10,合同会社
ＴＹＰ合同会社,東京都世田谷区下馬６丁目２６番１０号,2019-05-10,合同会社
Ｔａｘ　Ｔｒｕｓｔｙ　Ｂｏａｒｄ合同会社,大阪府大阪市中央区島町１丁目１番１号島町ビル８階Ｂ号室,2019-05-10,合同会社
Ｔｏ－Ｌｉｎｋ合同会社,滋賀県守山市木浜町２０６０番地,2019-05-10,合同会社
Ｔｒａｃｋ＆Ｓｎｏｗ株式会社,長野県北佐久郡軽井沢町軽井沢東４６番地６,2019-05-10,株式会社
Ｔｒｉａｓ　Ｊａｐａｎ株式会社,東京都港区赤坂７丁目３番３７号,2019-05-10,株式会社
Ｔｒｕｓｔ＆Ｗｉｎ　ｅｎｅｒｇｙ合同会社,静岡県富士市元町３番１０号,2019-05-10,合同会社
Ｕ－ＫＥＮコーポレーション株式会社,長崎県平戸市鏡川町１３０８番地,2019-05-10,株式会社
ＵＴＨ　Ｊａｐａｎ株式会社,東京都港区東麻布３丁目７番３号,2019-05-10,株式会社
ＷＩＳＥ　ＣＲＡＦＴ株式会社,神奈川県伊勢原市岡崎４９５７番地,2019-05-10,株式会社
Ｗａｉネクスト株式会社,東京都町田市鶴川４丁目４１番地５４,2019-05-10,株式会社
Ｗｏｒｋｉｎｇ　Ｗｏｍａｎ　Ｐｌｕｓ合同会社,神奈川県横浜市神奈川区新浦島町１丁目１番地１ベイステージ横浜４３２－７４０号,2019-05-10,合同会社
ＹＭサービス株式会社,北海道札幌市北区篠路一条７丁目１５番１号,2019-05-10,株式会社
ｂｉｇ株式会社,東京都渋谷区渋谷２丁目２２番３号,2019-05-10,株式会社
ｃｏｚｙ株式会社,熊本県熊本市南区城南町隈庄８０４番地,2019-05-10,株式会社
ｉｎｓｉｇｈｔｗｏｒｋｓ株式会社,北海道札幌市清田区清田十条３丁目１１番４号,2019-05-10,株式会社
ｍｉｃｏ株式会社,東京都豊島区東池袋１丁目３４番５号いちご東池袋ビル６階,2019-05-10,株式会社
ｎｉｋｏｌｕｎａ株式会社,兵庫県神戸市中央区江戸町１０４番地,2019-05-10,株式会社
ｒａｉｎｂｏｗｈｏｌｉｃ株式会社,東京都豊島区西巣鴨１丁目２９番８号,2019-05-10,株式会社
ｓｕｎｓｅｔ　ｓｌｏｗ　ｆｅｅｌｉｎｇ合同会社,愛知県豊橋市松葉町３丁目９８番地,2019-05-10,合同会社
ｔａｇ－Ａ合同会社,東京都墨田区業平１丁目２０番１０号,2019-05-10,合同会社
ｔｈｅ　ｓｅｖｅｎ＆ｔｈｒｅｅ合同会社,愛知県名古屋市名東区社口１丁目１１０２番地１,2019-05-10,合同会社
ｕｅ株式会社,神奈川県小田原市前川３３番地の１５,2019-05-10,株式会社
あした精工株式会社,東京都足立区六木３丁目４４番１４号,2019-05-13,株式会社
あじさい税理士法人,兵庫県神戸市中央区元町通４丁目４番８号,2019-05-13,その他の設立登記法人
かずさまごころサービス株式会社,千葉県木更津市潮見３丁目１３番２号,2019-05-13,株式会社
さくらフードサービス株式会社,福岡県福岡市中央区警固１丁目１３番１５－２０１号,2019-05-13,株式会社
さくらホールディングス株式会社,千葉県佐倉市上志津１７９０番地１,2019-05-13,株式会社
さくら合同会社,大阪府大阪市中央区南久宝寺町１丁目５番４号,2019-05-13,合同会社
はいさち株式会社,埼玉県さいたま市桜区大字下大久保６７番地ミケリアフラッツＢ・２階,2019-05-13,株式会社
ひとつなぎ合同会社,埼玉県朝霞市栄町３丁目８番２３号３０３,2019-05-13,合同会社
みたらい観光株式会社,広島県呉市豊町御手洗１７０番地,2019-05-13,株式会社
むさし家ホールディングス株式会社,愛知県名古屋市中村区名駅４丁目１３番７号,2019-05-13,株式会社
わんぱくむすめ株式会社,東京都港区北青山２丁目７番１３号,2019-05-13,株式会社
アイディンシステム株式会社,大阪府大阪市北区梅田２丁目５番１３号桜橋第一ビル３０４号,2019-05-13,株式会社
アイプレゼンツ合同会社,大阪府大阪市都島区毛馬町２丁目１０番１８号,2019-05-13,合同会社
アクロトラディショナル合同会社,埼玉県さいたま市大宮区上小町２６上小町さくら１０２,2019-05-13,合同会社
アットプレジャー株式会社,千葉県船橋市丸山３丁目２２番４号,2019-05-13,株式会社
アフィリカ株式会社,東京都新宿区北新宿３丁目２－１６－１０４,2019-05-13,株式会社
アライブ航測合同会社,栃木県佐野市富岡町１５０４番地２,2019-05-13,合同会社
アルテック株式会社,京都府京都市南区吉祥院石原堂ノ後西町２４番６号,2019-05-13,株式会社
インテリジェントパワー＆エナジー・テクノロジーズ株式会社,神奈川県横浜市港北区新横浜２丁目５番１４号ＷｉｓｅＮｅｘｔ新横浜３階,2019-05-13,株式会社
ウェルビーリンク株式会社,東京都中央区銀座２丁目３番６号,2019-05-13,株式会社
エスケークリーン合同会社,栃木県宇都宮市花房２丁目９番２５号,2019-05-13,合同会社
エスピーディー会計合同会社,大阪府大阪市阿倍野区旭町１丁目１番１０号,2019-05-13,合同会社
エムコーポレーション株式会社,京都府京都市中京区雁金町３６２番地ローレルコート高倉７０１,2019-05-13,株式会社
エンジニアリング・クルー株式会社,福岡県北九州市戸畑区千防２丁目３番１－５１０号,2019-05-13,株式会社
オフィスＫＩＢＯＵ株式会社,京都府宇治市木幡南山畑１９番地の２サーパス宇治木幡第２・７１０号,2019-05-13,株式会社
オービット株式会社,埼玉県加須市道地１４５６番地６,2019-05-13,株式会社
カーファッション紀州株式会社,三重県南牟婁郡紀宝町井田１８４４番地２１,2019-05-13,株式会社
クラリネット・ファーイースト株式会社,東京都千代田区丸の内１丁目８番３号,2019-05-13,株式会社
クレイジーパピヨン株式会社,青森県上北郡おいらせ町上明堂６３番地２,2019-05-13,株式会社
コアイリ合同会社,東京都千代田区麹町１丁目６番１１号Ｇポイントビル４Ｆ,2019-05-13,合同会社
コンゴー冷熱工業株式会社,大阪府富田林市久野喜台２丁目７番１号,2019-05-13,株式会社
ザ・カセイ・イントロダクション株式会社,福岡県福岡市南区皿山１丁目２番１０号,2019-05-13,株式会社
シャイン株式会社,東京都港区東麻布１丁目２８番３号,2019-05-13,株式会社
ジェイ・リクルートメント株式会社,京都府京都市下京区新町通松原下る富永町１０７番地１,2019-05-13,株式会社
ジャストフィールド株式会社,埼玉県所沢市上新井４丁目２７番地の４,2019-05-13,株式会社
ジャパンスキンケア研究所株式会社,東京都杉並区上高井戸１丁目６番４号,2019-05-13,株式会社
ジークリエイト合同会社,東京都三鷹市井の頭５丁目４番３２号,2019-05-13,合同会社
スタートゥインクル合同会社,千葉県船橋市前原西２丁目１４番１ダイアパレス津田沼７１６号室,2019-05-13,合同会社
スターポート合同会社,東京都世田谷区玉川３丁目３５－１４レイディアント５０２,2019-05-13,合同会社
セルプロジャパン株式会社,神奈川県藤沢市村岡東２丁目２６番地の１,2019-05-13,株式会社
セレブレイトメッセージ株式会社,東京都港区赤坂３丁目７番１３号,2019-05-13,株式会社
センタージャパンドット株式会社,愛知県名古屋市中村区名駅１丁目１番１号ＪＰタワー名古屋２１階,2019-05-13,株式会社
センチュリオン株式会社,東京都大田区上池台１丁目４０番６号,2019-05-13,株式会社
ソリューションズモコ株式会社,埼玉県さいたま市桜区大字上大久保９０４番地１０（Ｂ－４１４）,2019-05-13,株式会社
テクノプラス株式会社,岡山県岡山市南区新保１１５５番地１,2019-05-13,株式会社
デジタル東京１特定目的会社,東京都千代田区霞が関３丁目２番６号東京倶楽部ビルディング１１階,2019-05-13,その他の設立登記法人
トキオ株式会社,長崎県長崎市大黒町７番２号第二藤田ビル３Ｆ,2019-05-13,株式会社
トラストワークス株式会社,大阪府大阪市平野区喜連５丁目５番２３号,2019-05-13,株式会社
ナイスグローバル株式会社,愛知県一宮市音羽３丁目１１番１号黒野住宅３１０号,2019-05-13,株式会社
ニューヤード株式会社,東京都新宿区新宿１丁目３６番２号新宿第七葉山ビル３階,2019-05-13,株式会社
ビーサイドゲームズ株式会社,東京都台東区浅草橋１丁目３２番３－７０１号,2019-05-13,株式会社
ビーバートレーディング株式会社,和歌山県日高郡みなべ町北道１５０番地２,2019-05-13,株式会社
