法人名,住所,設立日,法人種別
株式会社ｋｕｒａｌｉｎｋ,富山県富山市古沢３０５番地１,2026-05-07,株式会社
株式会社ｍａｋｅＭａｉｋｏ,京都府長岡京市今里更ノ町６番地２３,2026-05-07,株式会社
株式会社ｒｉｃｃａ,兵庫県姫路市神田町２丁目８番地グランエスレジデンス姫路２０２,2026-05-07,株式会社
株式会社ｓｏｃｉａｌ　ｉｓｓｕｅ　ｓｏｌｕｔｉｏｎｓ,奈良県生駒市西松ケ丘５番１７－２号,2026-05-07,株式会社
株式会社ｔａｓｕｔｅｃｈ,栃木県宇都宮市岩曽町１１９８番地４４,2026-05-07,株式会社
株式会社ｗａ‐ｓｙｕ,東京都港区南青山２丁目２６番１号,2026-05-07,株式会社
株式会社ｗｅｌｌｎａ,東京都台東区松が谷３丁目６番８号ｍａｉｓｏｎｍｏｍｏ２階,2026-05-07,株式会社
株式会社ｙｕ‐ｄａｉ,大分県大分市大字小池原２０７番地の１,2026-05-07,株式会社
泰吉利商事株式会社,福岡県古賀市谷山３２３番地３,2026-05-07,株式会社
津軽電設株式会社,青森県五所川原市字布屋町１６番地１,2026-05-07,株式会社
特定非営利活動法人そらみつキラキラ,奈良県奈良市西ノ京町１番地の１８,2026-05-07,その他の設立登記法人
特定非営利活動法人国際寺子屋,東京都小金井市貫井北町４丁目１番１号東京学芸大学,2026-05-07,その他の設立登記法人
特定非営利活動法人日本高齢者安心サポート,栃木県佐野市高萩町４０５番地４,2026-05-07,その他の設立登記法人
特定非営利活動法人Ｈａｒｍｏｎｙ,広島県福山市伊勢丘６丁目９番１１号,2026-05-07,その他の設立登記法人
特定非営利活動法人ＷＡＬＫ,新潟県新潟市北区下大谷内１７４番地,2026-05-07,その他の設立登記法人
特定非営利活動法人Ｗｏｍｅｎ　ｉｎ　Ａｖｉａｔｉｏｎ　Ｉｎｔｅｒｎａｔｉｏｎａｌ　Ｊａｐａｎ,東京都港区北青山１丁目３番１号アールキューブ青山３階,2026-05-07,その他の設立登記法人
田邊光志合同会社,鹿児島県西之表市西之表１５３００番地,2026-05-07,合同会社
磯部株式会社,奈良県磯城郡川西町大字唐院１３１番地,2026-05-07,株式会社
祥隆株式会社,鹿児島県鹿児島市下荒田３丁目１３番１号,2026-05-07,株式会社
菊永工業株式会社,鹿児島県南九州市川辺町高田１６３７番地２,2026-05-07,株式会社
行政書士法人北摂法務事務所,大阪府池田市石橋２丁目１４番１１号,2026-05-07,その他の設立登記法人
角度商事合同会社,東京都北区赤羽北１丁目２１－６,2026-05-07,合同会社
豊田サウンドラボ合同会社,東京都台東区浅草３丁目５番３号,2026-05-07,合同会社
超広精密株式会社,京都府八幡市上奈良宮ノ東２番地８,2026-05-07,株式会社
農事組合法人桂清水ファーム,秋田県大館市比内前田字本前田１５番地１,2026-05-07,その他の設立登記法人
農事組合法人ＨＡＣＨＩ,秋田県大館市大子内字羽立３６番地,2026-05-07,その他の設立登記法人
進化グローバル合同会社,東京都千代田区丸の内２丁目７番２号ＪＰタワー１４階,2026-05-07,合同会社
運農株式会社,東京都世田谷区赤堤４丁目３４番５号‐２,2026-05-07,株式会社
首都圏トレーディングインフィニティ合同会社,神奈川県相模原市緑区中野５１番地２,2026-05-07,合同会社
高合トレーディング株式会社,岐阜県安八郡安八町西結字瀬平西２２３４番地１,2026-05-07,株式会社
３Ｎ合同会社,福岡県福岡市中央区那の津２丁目１０番７号オフィスパレア天神北ＩＢ・Ｂ－３,2026-05-07,合同会社
Ａ＆Ｈコンサルタンツ合同会社,東京都江東区豊洲４丁目１１番２０－１４３１号,2026-05-07,合同会社
Ａ．Ｒ．Ｓｙｓｔｅｍｓ　Ａｕｔｏｍｏｔｉｖｅ　Ｊａｐａｎ株式会社,東京都中央区日本橋２丁目３番４号日本橋プラザビル６階,2026-05-07,株式会社
ＡＩＺ合同会社,大阪府豊中市庄内東町１丁目１番１５－２０４号,2026-05-07,合同会社
Ａｌｐｈａｌａｂ　Ｃａｐｉｔａｌ　Ｊａｐａｎ株式会社,東京都中央区日本橋室町４丁目３番９号,2026-05-07,株式会社
Ａｍｉｌｌａ　Ｐａｒｔｎｅｒｓ合同会社,東京都港区南青山３丁目１番３６号青山丸竹ビル６Ｆ,2026-05-07,合同会社
ＢＤ　Ｐｒｏｆｅｓｓｉｏｎａｌ株式会社,東京都港区六本木３丁目１番３０号Ａ・Ｂビル,2026-05-07,株式会社
ＢＴＡ株式会社,山口県周南市新堀６６３４－１,2026-05-07,株式会社
ＣＲＡＶＥ合同会社,兵庫県神戸市須磨区行幸町１丁目５－１５－８０３,2026-05-07,合同会社
Ｃｈｒｙｓａｌｉｓ　Ｓｔｕｄｉｏ株式会社,東京都文京区本郷５丁目１０―８,2026-05-07,株式会社
Ｃｏ‐Ｌａｎｔｅｒｎ合同会社,茨城県水戸市河和田２丁目３番地の５,2026-05-07,合同会社
ＤＴＣ　Ｐａｙ　Ｊａｐａｎ株式会社,東京都千代田区大手町１丁目６番１号大手町ビル４階ＦＩＮＯＬＡＢ内,2026-05-07,株式会社
ＥＣ１株式会社,愛媛県松山市鷹子町２９１－２コーポラス・ミニ１０１号,2026-05-07,株式会社
ＥＴＥＲＮＡＬ　ＳＴＯＮＥ合同会社,佐賀県西松浦郡有田町下内野丙２４０９番地１,2026-05-07,合同会社
ＦＡＡＺ合同会社,群馬県太田市岩瀬川町５８０番地３タウンハウス岩瀬川１０１号,2026-05-07,合同会社
ＦＤ　Ｆａｃｔｏｒｙ株式会社,愛知県豊川市豊川栄町１７番地,2026-05-07,株式会社
ＦＥＲＮＡ合同会社,熊本県熊本市中央区中央街７－２ＧＩＮＺＡＳＫＹＢＬＤ９Ｆ,2026-05-07,合同会社
ＦＯＭＴＩＳ＆ＵＦＦＡ　Ｇｒｏｕｐ合同会社,東京都三鷹市新川３丁目１７番１２号,2026-05-07,合同会社
ＦＹＤｅｓｉｇｎ合同会社,兵庫県尼崎市塚口本町５丁目３番５０－４１８号,2026-05-07,合同会社
Ｆｏｕｎｄｒｙ　Ｐａｒｔｎｅｒｓ合同会社,東京都中央区銀座１丁目１２番４号Ｎ＆ＥＢＬＤ．６Ｆ,2026-05-07,合同会社
ＧＥＮＫＩ．ｏ．ｐｒｏ株式会社,千葉県松戸市馬橋３２８９番地メゾンスワンレークＡ－３０１号,2026-05-07,株式会社
ＧＩＲＩ株式会社,石川県金沢市直江東２丁目６番地１,2026-05-07,株式会社
ＧＯＬＤＢＡＳＥ株式会社,大阪府大阪市北区長柄中２丁目１－１１,2026-05-07,株式会社
ＨＨＭＵ株式会社,兵庫県神戸市中央区磯辺通１丁目１番１８号カサベラ国際プラザビル７０７号室,2026-05-07,株式会社
ＨＬ　Ｃｏｎｓｔｒｕｃｔｉｏｎ株式会社,大阪府大阪市北区天神橋１丁目１８番３号,2026-05-07,株式会社
ＨｅｌｌｏＳｔａｒｔ合同会社,東京都千代田区神田須田町１丁目７番８号ＶＯＲＴ秋葉原ＩＶ２Ｆ,2026-05-07,合同会社
Ｈｙｐｅｒ　Ｅｎｅｒｇｙ１合同会社,東京都港区浜松町２丁目２番１５号浜松町ダイヤビル２Ｆ,2026-05-07,合同会社
Ｉｍｕｔａ　Ｐａｒｔｎｅｒｓ株式会社,東京都世田谷区用賀２丁目２９番１１号,2026-05-07,株式会社
ＪＡＰＡＮメンテナンス株式会社,大阪府門真市桑才新町３０－１９桑才倉庫１０・１１区画,2026-05-07,株式会社
ＪＩＮエステート株式会社,鹿児島県鹿児島市伊敷６丁目８番２１号,2026-05-07,株式会社
Ｋ‐ＲＩＺＥ株式会社,富山県富山市吉岡４５２番地２,2026-05-07,株式会社
Ｋ　ＳＴＲＵＣＴＵＲＥ　ＤＥＳＩＧＮ　ＳＴＵＤＩＯ合同会社,大阪府大阪市中央区南船場１丁目６番１５号ＬＩＢＥＲＡビル,2026-05-07,合同会社
ＫＯＫＡＺＡＩ合同会社,東京都港区六本木２丁目１番１９号Ｓ－Ｂｕｉｌｄｉｎｇ３階,2026-05-07,合同会社
Ｋｏｔｏｓｈｉｂｉ　Ｗｏｒｋｓ合同会社,東京都品川区上大崎３丁目１４番３４号プラスワン４０２,2026-05-07,合同会社
Ｌ＆Ｃ株式会社,栃木県日光市森友３３０番地コーポウイングＣ１０２,2026-05-07,株式会社
ＬＩＭＩＮＡＨ合同会社,神奈川県足柄上郡開成町吉田島３８１０－１レビールステーション開成１１１,2026-05-07,合同会社
Ｌｉｆｅ　Ｗｅｌｌｎｅｓｓ　Ｐａｒｔｎｅｒ合同会社,東京都北区東十条３丁目５番１０－３０３号アオキハイム,2026-05-07,合同会社
Ｌｉｌｉｙ株式会社,愛知県稲沢市平和町城西９７,2026-05-07,株式会社
Ｌｉｍ　ｆａｂ株式会社,岐阜県羽島市堀津町東山３０番地１,2026-05-07,株式会社
ＭＡＬＡＢＡＲ合同会社,群馬県太田市由良町１７０５番地６ツインパレス２－１０１号,2026-05-07,合同会社
ＭＷアセット合同会社,神奈川県藤沢市辻堂元町１丁目６番７号,2026-05-07,合同会社
Ｍｏａｎａ　Ｌｉｆｅ株式会社,大阪府東大阪市日下町４丁目３－５日下ビル３０１,2026-05-07,株式会社
Ｎｅｂｕｌａｂ合同会社,千葉県成田市花崎町８５６、２階Ａ室,2026-05-07,合同会社
Ｎｅｘｕｓ　Ｈｏｌｄｉｎｇｓ合同会社,東京都北区王子１丁目２８番８５０１号トーカン王子マンション,2026-05-07,合同会社
Ｎｐａｙ　Ｊａｐａｎ株式会社,東京都品川区上大崎２丁目１０番４４号,2026-05-07,株式会社
ＯＷＬサービス合同会社,愛知県北名古屋市高田寺一本橋４０番地１ハッピーハウス１０２号,2026-05-07,合同会社
Ｏｎ　Ｓｔｒａｔｅｇｙ合同会社,埼玉県さいたま市岩槻区大字釣上新田１５０８番地３,2026-05-07,合同会社
ＱＳエンジニアリング株式会社,茨城県つくば市竹園１丁目８番地２－３１５,2026-05-07,株式会社
ＲＡＹ　ＯＮＥ合同会社,石川県金沢市西泉２丁目１５５番地１フォレスト金沢西泉４０５号,2026-05-07,合同会社
ＲＫｎａｉｌ株式会社,東京都三鷹市上連雀９丁目２７－１０スノーベル２０２,2026-05-07,株式会社
ＲＯＮＧＴＵＡ　ＳＨＩＰＰＩＮＧ　ＪＡＰＡＮ株式会社,東京都港区台場２丁目３番１号,2026-05-07,株式会社
Ｓ‐Ｌｉｎｅ合同会社,宮城県栗原市築館薬師４丁目１番４５号,2026-05-07,合同会社
ＳＡＮ’ＩＮツーリズムマネージメント株式会社,島根県松江市殿町４３番地カラコロ工房２階,2026-05-07,株式会社
ＳＰＩＮＣＩＴＹ合同会社,東京都北区志茂３丁目１９番２号,2026-05-07,合同会社
Ｓｈｅｎｚｈｅｎ　Ｒｅｄ　Ｅｌｅｐｈａｎｔ　Ｐｉｘｅｌ　Ｔｅｃｈ　Ｃｏ．，Ｌｔｄ．,,2026-05-07,外国会社等
Ｓｉｎｇｄｏｍ合同会社,大阪府大阪市北区梅田１丁目１番３号大阪駅前第３ビル１１階２号室,2026-05-07,合同会社
ＴＨＥ　ＰＲＯＳ株式会社,福岡県福岡市中央区大手門１丁目２番２３号,2026-05-07,株式会社
ＴＲＡＣＥ合同会社,大阪府大阪市中央区谷町５丁目６番１５－６０１号,2026-05-07,合同会社
Ｔａｎａｂｅ　Ｔｒａｄｉｎｇ合同会社,愛知県名古屋市千種区西山元町１丁目１番地の６,2026-05-07,合同会社
ＴａｎｄＭ合同会社,東京都台東区西浅草２丁目２５－１－１２０６,2026-05-07,合同会社
Ｔｒａｎｓｆｏｒｍｉｘ合同会社,京都府京都市西京区上桂東ノ口町１７１－４,2026-05-07,合同会社
ＷＡＧＡ株式会社,宮城県遠田郡美里町青生字堀切７７番地２,2026-05-07,株式会社
Ｗａｌｌｅｙｅ　Ｃａｐｉｔａｌ　Ｊａｐａｎ　ＬＬＣ,東京都中央区日本橋３丁目９－１日本橋三丁目スクエア１１階,2026-05-07,外国会社等
ＷｈｅｅＬａｇｇ合同会社,東京都杉並区高井戸東２丁目２８‐３,2026-05-07,合同会社
ＺＩＮＯＶＡ株式会社,愛知県名古屋市北区金城町２丁目２１番地１,2026-05-07,株式会社
ＺＹＩＯＮ　ＴＲＡＤＩＮＧ合同会社,大阪府大阪市北区長柄西２丁目８番１８－８０３号,2026-05-07,合同会社
Ｚａｒｉｓｏｒａ合同会社,大阪府大阪市北区梅田１丁目２番２号,2026-05-07,合同会社
ｔｅｋａｒｏ株式会社,東京都千代田区麹町４丁目５―２０ＫＳビルディング８Ｆ,2026-05-07,株式会社
